title,score,id,url,num_comments,created,author,upvote_ratio,permalink,subreddit,subreddit_subscribers,author_name
Simu Liu celebrates Shang-Chi and the Legend of the Ten Ring's record breaking opening weekend box office gross,100476,pj9wf8,https://i.redd.it/7jp7cu8wjyl71.jpg,1790,1630966716.0,chanma50,0.89,/r/marvelstudios/comments/pj9wf8/simu_liu_celebrates_shangchi_and_the_legend_of/,marvelstudios,3075284,chanma50
Captain America's stunt double doing the signature backflip,95761,fijec5,https://v.redd.it/o3x7em14hnm41,1373,1584197052.0,samp987,0.95,/r/marvelstudios/comments/fijec5/captain_americas_stunt_double_doing_the_signature/,marvelstudios,3075284,samp987
James Gunn is NOT happy about this comment,80235,owboir,https://i.redd.it/r79iavht7xe71.jpg,3459,1627899640.0,MarvelNoob69,0.91,/r/marvelstudios/comments/owboir/james_gunn_is_not_happy_about_this_comment/,marvelstudios,3075284,MarvelNoob69
Stan Lee Dead at 95,80090,9wgpiz,http://m.tmz.com/#!2018/11/12/stan-lee-dead-dies-marvel-comics/,3902,1542048157.0,aaliyaahson,0.9,/r/marvelstudios/comments/9wgpiz/stan_lee_dead_at_95/,marvelstudios,3075284,aaliyaahson
"Sony, Marvel Make Up: Companies Will Produce Third ‘Spider-Man’ Film",79314,da1op4,https://variety.com/2019/film/news/sony-marvel-tom-holland-spider-man-1203351489/,4158,1569596645.0,thomasp003,0.89,/r/marvelstudios/comments/da1op4/sony_marvel_make_up_companies_will_produce_third/,marvelstudios,3075284,thomasp003
Simu Liu reacts to Shang-Chi's Rotten Tomatoes score,78642,pa3zrp,https://i.redd.it/bh0rlvqe25j71.jpg,1310,1629738040.0,chanma50,0.92,/r/marvelstudios/comments/pa3zrp/simu_liu_reacts_to_shangchis_rotten_tomatoes_score/,marvelstudios,3075284,chanma50
"Started with Stan Lee, never thought I’d make it here. 32 signatures",70255,dhk6hh,https://i.redd.it/ahjqyll02fs31.jpg,977,1571019493.0,Winter_soulja,0.93,/r/marvelstudios/comments/dhk6hh/started_with_stan_lee_never_thought_id_make_it/,marvelstudios,3075284,Winter_soulja
Behold... My Stuff!,70082,cwhpuj,https://gfycat.com/jitterysprydipper,634,1566979408.0,CheesyObserver,0.95,/r/marvelstudios/comments/cwhpuj/behold_my_stuff/,marvelstudios,3075284,CheesyObserver
Taika Waititi to Direct 'Thor 4',67751,ce0aqt,https://www.hollywoodreporter.com/heat-vision/taika-waititi-direct-thor-4-1224464,3345,1563298755.0,thomasp003,0.94,/r/marvelstudios/comments/ce0aqt/taika_waititi_to_direct_thor_4/,marvelstudios,3075284,thomasp003
"James Gunn - ""I just posted the big Guardians Easter egg on Facebook for everyone to see.""",66902,q1caie,https://i.redd.it/h676knjtdhr71.jpg,673,1633373944.0,chanma50,0.9,/r/marvelstudios/comments/q1caie/james_gunn_i_just_posted_the_big_guardians_easter/,marvelstudios,3075284,chanma50
I wore my self made Captain Marvel cosplay with BIG hair this time,65841,bso1el,https://i.redd.it/0cqbopldx8031.jpg,1519,1558741545.0,cutiepiesensei,0.87,/r/marvelstudios/comments/bso1el/i_wore_my_self_made_captain_marvel_cosplay_with/,marvelstudios,3075284,cutiepiesensei
Black Panther: Wakanda Forever - Official Title Treatment,65648,n3vhe4,https://i.redd.it/5g5eskp0mww61.jpg,3740,1620047016.0,chanma50,0.84,/r/marvelstudios/comments/n3vhe4/black_panther_wakanda_forever_official_title/,marvelstudios,3075284,chanma50
And now he's getting his own Disney+ Series! 👏,63120,nrad3j,https://i.redd.it/xpc9dw0l41371.jpg,956,1622716781.0,TheSuperheroAxis,0.94,/r/marvelstudios/comments/nrad3j/and_now_hes_getting_his_own_disney_series/,marvelstudios,3075284,TheSuperheroAxis
Spider-Man: No Way Home | Official Trailer,60403,qvnme3,https://www.youtube.com/watch?v=JfVOs4VSpmA&feature=youtube_video_deck,9949,1637112615.0,MarvelsGrantMan136,0.88,/r/marvelstudios/comments/qvnme3/spiderman_no_way_home_official_trailer/,marvelstudios,3075284,MarvelsGrantMan136
I am very Surprised nobody has uploaded this yet. Especially since everyone is stuck at home.,59841,fjw4fs,https://v.redd.it/msbwlkuds4n41,730,1584406609.0,ThanosFan99,0.94,/r/marvelstudios/comments/fjw4fs/i_am_very_surprised_nobody_has_uploaded_this_yet/,marvelstudios,3075284,ThanosFan99
This is the most visually stunning sequence in the MCU. Every frame is a painting.,59819,p11xjb,https://v.redd.it/j8g5dr4k8cg71,1114,1628517345.0,australiughhh,0.88,/r/marvelstudios/comments/p11xjb/this_is_the_most_visually_stunning_sequence_in/,marvelstudios,3075284,australiughhh
Marvel Studios' Thor: Love and Thunder | Official Teaser,59578,u6durw,https://youtu.be/tgB1wUcmbbw,5341,1650290419.0,chanma50,0.87,/r/marvelstudios/comments/u6durw/marvel_studios_thor_love_and_thunder_official/,marvelstudios,3075284,chanma50
"Robert Downey Jr. sends a message to Bridger Walker, the young boy who saved his sister from an attacking dog.",56557,hsxe6y,https://v.redd.it/v2tfuvwgofb51,1485,1594998754.0,chanma50,0.92,/r/marvelstudios/comments/hsxe6y/robert_downey_jr_sends_a_message_to_bridger/,marvelstudios,3075284,chanma50
Angelina Jolie is awesome,54555,pp0a7z,https://i.redd.it/zeex514arqn71.jpg,1178,1631744055.0,TooZeroLeft,0.88,/r/marvelstudios/comments/pp0a7z/angelina_jolie_is_awesome/,marvelstudios,3075284,TooZeroLeft
My Thor Love and Thunder Cosplay is almost as cool as the bottle opener I built into Stormbreaker.,53978,v562z0,https://v.redd.it/litq3u6ggq391,564,1654404507.0,CaptCash,0.86,/r/marvelstudios/comments/v562z0/my_thor_love_and_thunder_cosplay_is_almost_as/,marvelstudios,3075284,CaptCash
James Gunn reacts to Cleveland's MLB team being renamed the Cleveland Guardians,53013,oq639j,https://i.redd.it/gmnddnjbpzc71.jpg,579,1627058015.0,chanma50,0.9,/r/marvelstudios/comments/oq639j/james_gunn_reacts_to_clevelands_mlb_team_being/,marvelstudios,3075284,chanma50
Doctor Strange in the Multiverse of Madness | Official Trailer,52829,srvtoo,https://www.youtube.com/watch?v=aWzlQ2N6qqg,5910,1644793985.0,MarvelsGrantMan136,0.89,/r/marvelstudios/comments/srvtoo/doctor_strange_in_the_multiverse_of_madness/,marvelstudios,3075284,MarvelsGrantMan136
New Image of Chris Hemsworth and Natalie Portman in ‘Thor: Love and Thunder’,52564,ukaynh,https://i.redd.it/f9exs1lvc1y81.jpg,2210,1651921384.0,MarvelsGrantMan136,0.87,/r/marvelstudios/comments/ukaynh/new_image_of_chris_hemsworth_and_natalie_portman/,marvelstudios,3075284,MarvelsGrantMan136
How did the people working on this movie watch this scene and thought it looked passable?,52548,t0l2jp,https://v.redd.it/scjoepr8guj81,3131,1645735897.0,aaliyaahson,0.88,/r/marvelstudios/comments/t0l2jp/how_did_the_people_working_on_this_movie_watch/,marvelstudios,3075284,aaliyaahson
Simu-Liu recollects the most important part of Comic-Con 2019,52367,oo7tqm,https://i.redd.it/n1snlcwstec71.png,775,1626805279.0,l_l_l-illiam,0.92,/r/marvelstudios/comments/oo7tqm/simuliu_recollects_the_most_important_part_of/,marvelstudios,3075284,l_l_l-illiam
Thor's Wakanda Entrance Will Forever Be Legendary And Iconic. I Also Love How Easily He Wrecked Thanos's Ships,52355,bzqzmp,https://v.redd.it/zga6dz24bx331,2361,1560344743.0,Nashetania,0.9,/r/marvelstudios/comments/bzqzmp/thors_wakanda_entrance_will_forever_be_legendary/,marvelstudios,3075284,Nashetania
"Hugh Jackman Has Made Peace With MCU Rebooting Wolverine - “I knew it was the right time for me to leave the party—not just for me, but for the character. Somebody else will pick it up and run with it. It’s too good of a character not to.""",51615,g2g9j5,https://www.indiewire.com/2020/04/hugh-jackman-cats-wolverine-tom-hooper-1202225304/amp/?__twitter_impression=true,2102,1587048433.0,chanma50,0.94,/r/marvelstudios/comments/g2g9j5/hugh_jackman_has_made_peace_with_mcu_rebooting/,marvelstudios,3075284,chanma50
"Perfectly balanced: there are 32 Avengers: Endgame character posters; exactly half of them are characters who are alive, and half are characters who are dead.",51349,b5sfwp,https://i.redd.it/ufuxc2zeyho21.png,3225,1553620682.0,chanma50,0.9,/r/marvelstudios/comments/b5sfwp/perfectly_balanced_there_are_32_avengers_endgame/,marvelstudios,3075284,chanma50
"Before he was the master of kung fu, Simu Lui was a stock photo model",51212,pinxsf,https://www.reddit.com/gallery/pinxsf,747,1630885105.0,aaliyaahson,0.94,/r/marvelstudios/comments/pinxsf/before_he_was_the_master_of_kung_fu_simu_lui_was/,marvelstudios,3075284,aaliyaahson
"Simu Liu - ""Seeing all the little Asian kids dressed up as Shang-Chi is so precious. We should probably make more of these movies...""",51133,qjz39z,https://i.redd.it/cjfstt9bsuw71.jpg,1115,1635715448.0,chanma50,0.84,/r/marvelstudios/comments/qjz39z/simu_liu_seeing_all_the_little_asian_kids_dressed/,marvelstudios,3075284,chanma50
"James Gunn tweeted my work! I can’t believe it! Thanks for all the support, yours truly",50466,dddkyb,https://i.redd.it/twlo2n9palq31.jpg,591,1570223356.0,SpikeyTortoise,0.93,/r/marvelstudios/comments/dddkyb/james_gunn_tweeted_my_work_i_cant_believe_it/,marvelstudios,3075284,SpikeyTortoise
Hailee Steinfeld and Lucky The Dog on the set of ‘Hawkeye’,49138,r6ixoy,https://i.redd.it/ntzw2o1lly281.jpg,825,1638376701.0,MarvelsGrantMan136,0.91,/r/marvelstudios/comments/r6ixoy/hailee_steinfeld_and_lucky_the_dog_on_the_set_of/,marvelstudios,3075284,MarvelsGrantMan136
I would love to see this moment from the comics adapted for Falcon & the Winter Soldier,48890,l1bgr1,https://i.redd.it/tqyg7ahxaic61.jpg,997,1611156831.0,cbekel3618,0.89,/r/marvelstudios/comments/l1bgr1/i_would_love_to_see_this_moment_from_the_comics/,marvelstudios,3075284,cbekel3618
I'm sorry but not calling MIT back is the most relatable/realistic thing Peter has done.,48676,thtfjr,https://i.redd.it/t2yrnagwubo81.gif,1226,1647690037.0,Michael1691,0.9,/r/marvelstudios/comments/thtfjr/im_sorry_but_not_calling_mit_back_is_the_most/,marvelstudios,3075284,Michael1691
"James Gunn responds to Francis Ford Coppola's ""despicable"" comments",47615,dknzsc,https://i.redd.it/n6qlffnutqt31.jpg,2263,1571597875.0,chanma50,0.86,/r/marvelstudios/comments/dknzsc/james_gunn_responds_to_francis_ford_coppolas/,marvelstudios,3075284,chanma50
Kevin Feige Confirms Charlie Cox Daredevil Casting In The MCU,47575,r9xpts,https://www.cinemablend.com/interviews/kevin-feige-confirms-daredevil-casting-in-the-mcu-and-fans-will-be-pumped,2300,1638762313.0,chanma50,0.93,/r/marvelstudios/comments/r9xpts/kevin_feige_confirms_charlie_cox_daredevil/,marvelstudios,3075284,chanma50
Marvel Studios' Loki | Official Trailer | Disney+,47084,mkk4oj,https://www.youtube.com/watch?v=nW948Va-l10,3720,1617627630.0,harushiga,0.91,/r/marvelstudios/comments/mkk4oj/marvel_studios_loki_official_trailer_disney/,marvelstudios,3075284,harushiga
Fan Asks Stan Lee About possible Avengers film. 14 years before The Avengers.,46710,g0iut8,https://i.redd.it/ft7utonv5ls41.jpg,758,1586784186.0,ThanosFan99,0.93,/r/marvelstudios/comments/g0iut8/fan_asks_stan_lee_about_possible_avengers_film_14/,marvelstudios,3075284,ThanosFan99
Jake Gyllenhaal and Tom Holland visiting a children’s hospital in costume in London!,46240,c48p16,https://i.redd.it/h9x60qipb5631.jpg,770,1561313024.0,Ahsoka456,0.95,/r/marvelstudios/comments/c48p16/jake_gyllenhaal_and_tom_holland_visiting_a/,marvelstudios,3075284,Ahsoka456
Marvel Studios' Captain Marvel - Official Trailer,46148,9gug4c,https://youtube.com/watch?v=Z1BCujX3pw8,6693,1537274306.0,molenzwiebel,0.83,/r/marvelstudios/comments/9gug4c/marvel_studios_captain_marvel_official_trailer/,marvelstudios,3075284,molenzwiebel
"OFFICIAL: Hugh Jackman joins Deadpool 3, coming September 2024!",46128,xpshjs,https://twitter.com/VancityReynolds/status/1574865217141481477,2442,1664312323.0,The_Iceman2288,0.91,/r/marvelstudios/comments/xpshjs/official_hugh_jackman_joins_deadpool_3_coming/,marvelstudios,3075284,The_Iceman2288
Natalie Portman got pretty swole for her Thor role,45673,u70b90,https://i.redd.it/oo287hq46gu81.jpg,3392,1650357327.0,karateema,0.88,/r/marvelstudios/comments/u70b90/natalie_portman_got_pretty_swole_for_her_thor_role/,marvelstudios,3075284,karateema
Kathryn Hahn Says Her Kids Were 'Suspiciously Nicer' to Her After Watching WandaVision,45522,mhsgry,https://www.yahoo.com/entertainment/kathryn-hahn-says-her-kids-212821821.html,660,1617273233.0,JackFisherBooks,0.93,/r/marvelstudios/comments/mhsgry/kathryn_hahn_says_her_kids_were_suspiciously/,marvelstudios,3075284,JackFisherBooks
Simu throwing the first pitch for the Giants with a perfect strike and backflip,45337,pioh6f,https://v.redd.it/gvightjbzrl71,716,1630887161.0,MarvelNoob69,0.93,/r/marvelstudios/comments/pioh6f/simu_throwing_the_first_pitch_for_the_giants_with/,marvelstudios,3075284,MarvelNoob69
Marvel Studios' Moon Knight | Official Trailer | Disney+,45332,s6mswi,https://youtu.be/x7Krla_UxRg,4102,1642474817.0,chanma50,0.91,/r/marvelstudios/comments/s6mswi/marvel_studios_moon_knight_official_trailer_disney/,marvelstudios,3075284,chanma50
What the ultimate betrayal looks like..,45203,b7o9fk,https://i.redd.it/21a40ebmrgp21.jpg,926,1554042135.0,Naweezy,0.9,/r/marvelstudios/comments/b7o9fk/what_the_ultimate_betrayal_looks_like/,marvelstudios,3075284,Naweezy
Simu’s reaction of being welcomed home with a billboard,45147,pfw30g,https://i.redd.it/6vevf4ixswk71.jpg,601,1630509695.0,MarvelNoob69,0.89,/r/marvelstudios/comments/pfw30g/simus_reaction_of_being_welcomed_home_with_a/,marvelstudios,3075284,MarvelNoob69
Marvel Studios' Avengers: Infinity War - Official Trailer,45010,84v8ub,https://youtube.com/watch?v=QwievZ1Tx-8,7531,1521205363.0,molenzwiebel,0.85,/r/marvelstudios/comments/84v8ub/marvel_studios_avengers_infinity_war_official/,marvelstudios,3075284,molenzwiebel
Mackie and Seb always complaining about Tom Holland. 😂,44907,mvp9xl,https://v.redd.it/3zp2b86kblu61,919,1619038680.0,TheSuperheroAxis,0.94,/r/marvelstudios/comments/mvp9xl/mackie_and_seb_always_complaining_about_tom/,marvelstudios,3075284,TheSuperheroAxis
Chris Hemsworh and Chris Pratt on set of ‘Thor: Love and Thunder’.,44898,nyj49n,https://i.redd.it/jdxo398v1x471.jpg,1084,1623539130.0,EKRB7,0.9,/r/marvelstudios/comments/nyj49n/chris_hemsworh_and_chris_pratt_on_set_of_thor/,marvelstudios,3075284,EKRB7
Samuel L. Jackson: ‘I’d Rather Be Nick Fury’ Than Win Oscars or Chase Oscar-Baiting Roles,44870,vcw0pp,https://variety.com/2022/film/news/samuel-l-jackson-nick-fury-oscars-1235294988/,1271,1655303941.0,MarvelsGrantMan136,0.92,/r/marvelstudios/comments/vcw0pp/samuel_l_jackson_id_rather_be_nick_fury_than_win/,marvelstudios,3075284,MarvelsGrantMan136
And the sun shined on them again (Art by @keiidakamya on Twitter),44773,p4by2e,https://www.reddit.com/gallery/p4by2e,589,1628961021.0,ICumCoffee,0.92,/r/marvelstudios/comments/p4by2e/and_the_sun_shined_on_them_again_art_by/,marvelstudios,3075284,ICumCoffee
A man who knows a thing or two about Holiday Specials has concerns,44496,mwxpfz,https://imgur.com/7rZnP2K,763,1619191404.0,The_Iceman2288,0.94,/r/marvelstudios/comments/mwxpfz/a_man_who_knows_a_thing_or_two_about_holiday/,marvelstudios,3075284,The_Iceman2288
Box Office: ‘Spider-Man: No Way Home’ Debuts to Jaw-Dropping $253 Million,44345,rjzodx,https://variety.com/2021/film/news/spiderman-no-way-home-box-office-opening-weekend-pandemic-record-1235137725/,2666,1639929846.0,chanma50,0.92,/r/marvelstudios/comments/rjzodx/box_office_spiderman_no_way_home_debuts_to/,marvelstudios,3075284,chanma50
James Gunn Welcomes Will Poulter into the MCU as Adam Warlock,44192,q67ual,https://i.redd.it/1kwn9ilegws71.jpg,2362,1633992265.0,MarvelsGrantMan136,0.91,/r/marvelstudios/comments/q67ual/james_gunn_welcomes_will_poulter_into_the_mcu_as/,marvelstudios,3075284,MarvelsGrantMan136
Paul Rudd's reaction to his Ant-Man action figure,43961,dmetxf,https://v.redd.it/7pywyb5l1hu31,751,1571915276.0,Tajul92,0.95,/r/marvelstudios/comments/dmetxf/paul_rudds_reaction_to_his_antman_action_figure/,marvelstudios,3075284,Tajul92
Keep her name out of your mouth,43626,tqfleq,https://i.imgur.com/7C4JRjB.jpg,874,1648491342.0,The_Iceman2288,0.9,/r/marvelstudios/comments/tqfleq/keep_her_name_out_of_your_mouth/,marvelstudios,3075284,The_Iceman2288
Jeremy Renner is made aware of the most pro-Hawkeye post on this subreddit,43052,qyfoos,https://v.redd.it/k0hjmoe1nt081,692,1637445013.0,l_l_l-illiam,0.94,/r/marvelstudios/comments/qyfoos/jeremy_renner_is_made_aware_of_the_most/,marvelstudios,3075284,l_l_l-illiam
Ryan Reynolds Confirms Deadpool 3 at Marvel Studios,43024,egbcjj,https://comicbook.com/marvel/2019/12/27/ryan-reynolds-deadpool-3-marvel-studios/,1044,1577454462.0,Niyazali_Haneef,0.93,/r/marvelstudios/comments/egbcjj/ryan_reynolds_confirms_deadpool_3_at_marvel/,marvelstudios,3075284,Niyazali_Haneef
Went from cosplay Captain Marvel to meeting her in the flesh!!,42977,bifghv,https://i.redd.it/5rirctqfb2v21.jpg,1022,1556482285.0,cutiepiesensei,0.87,/r/marvelstudios/comments/bifghv/went_from_cosplay_captain_marvel_to_meeting_her/,marvelstudios,3075284,cutiepiesensei
No Way Home Twitter account responding to the leak,42956,padqhw,https://i.redd.it/32wet0m2o7j71.jpg,727,1629769541.0,MarvelNoob69,0.92,/r/marvelstudios/comments/padqhw/no_way_home_twitter_account_responding_to_the_leak/,marvelstudios,3075284,MarvelNoob69
Spider-Man: Far From Home - Official Trailer,42905,blbvp5,https://www.youtube.com/watch?v=Nt9L1jCKGnE,6392,1557147647.0,guz-,0.92,/r/marvelstudios/comments/blbvp5/spiderman_far_from_home_official_trailer/,marvelstudios,3075284,guz-
Official poster for 'Loki',42232,napd90,https://i.redd.it/zd1fwx9f4py61.jpg,1394,1620828046.0,chanma50,0.9,/r/marvelstudios/comments/napd90/official_poster_for_loki/,marvelstudios,3075285,chanma50
Chris Hemsworth in Global Climate strike,42156,d6tods,https://i.redd.it/cez2qvlukqn31.png,857,1568979762.0,superancica,0.88,/r/marvelstudios/comments/d6tods/chris_hemsworth_in_global_climate_strike/,marvelstudios,3075285,superancica
Official Poster for 'Spider-Man: No Way Home',41573,qp4iqb,https://i.redd.it/8mudir5meay71.jpg,1522,1636340401.0,MarvelsGrantMan136,0.91,/r/marvelstudios/comments/qp4iqb/official_poster_for_spiderman_no_way_home/,marvelstudios,3075285,MarvelsGrantMan136
That's a good point.,41266,d70ywm,https://i.redd.it/nebt4xuxatn31.jpg,228,1569012747.0,chanma50,0.92,/r/marvelstudios/comments/d70ywm/thats_a_good_point/,marvelstudios,3075285,chanma50
Kumail Nanjiani’s reaction to the review-bombing of Eternals on IMDB is perfect,41146,qi95oq,https://i.redd.it/xl1du3912dw71.jpg,1631,1635500794.0,cbekel3618,0.78,/r/marvelstudios/comments/qi95oq/kumail_nanjianis_reaction_to_the_reviewbombing_of/,marvelstudios,3075285,cbekel3618
Iman Vellani on meeting with Tom Hiddleston while shooting Ms. Marvel,41041,v3bxr6,https://i.redd.it/a7xpo4qxb8391.jpg,624,1654185058.0,ICumCoffee,0.89,/r/marvelstudios/comments/v3bxr6/iman_vellani_on_meeting_with_tom_hiddleston_while/,marvelstudios,3075285,ICumCoffee
Shuri Black Panther cosplay by Cutiepiesensei Cosplay,41006,ccwey6,https://i.redd.it/0u0d23qfu5a31.jpg,646,1563062714.0,cutiepiesensei,0.89,/r/marvelstudios/comments/ccwey6/shuri_black_panther_cosplay_by_cutiepiesensei/,marvelstudios,3075285,cutiepiesensei
Marvel Studios' Black Widow Official Trailer,40768,e5du1a,https://www.youtube.com/watch?v=RxAtuMu_ph4,3491,1575359785.0,guz-,0.85,/r/marvelstudios/comments/e5du1a/marvel_studios_black_widow_official_trailer/,marvelstudios,3075285,guz-
"You didn't know you needed this, but you do.",40629,lwsdpr,https://v.redd.it/s585h6kb0tk61,845,1614773280.0,TheSuperheroAxis,0.94,/r/marvelstudios/comments/lwsdpr/you_didnt_know_you_needed_this_but_you_do/,marvelstudios,3075285,TheSuperheroAxis
"Chris Hemsworth, Taika Waititi and Tom Hiddleston sleeping together on the way to SDCC 2017. Photo by Mark Ruffalo",40358,b2wf46,https://i.redd.it/6qdto5f3d2n21.jpg,643,1552996057.0,superancica,0.94,/r/marvelstudios/comments/b2wf46/chris_hemsworth_taika_waititi_and_tom_hiddleston/,marvelstudios,3075285,superancica
@SimuLiu: Been seeing this gem floating around the Asian internet and just want to say that I have been personally attacked,40321,r3baqr,https://i.redd.it/tttjoi3gd4281.png,638,1638010760.0,l_l_l-illiam,0.94,/r/marvelstudios/comments/r3baqr/simuliu_been_seeing_this_gem_floating_around_the/,marvelstudios,3075285,l_l_l-illiam
James Gunn: No More Resurrections,39883,ql8h9j,https://i.redd.it/zrdpohxqo7x71.png,1117,1635871639.0,l_l_l-illiam,0.95,/r/marvelstudios/comments/ql8h9j/james_gunn_no_more_resurrections/,marvelstudios,3075285,l_l_l-illiam
Marvel Studios' Doctor Strange in the Multiverse of Madness | Official Teaser,39878,rm893j,https://www.youtube.com/watch?v=Rt_UqUm38BI,3588,1640188955.0,harushiga,0.91,/r/marvelstudios/comments/rm893j/marvel_studios_doctor_strange_in_the_multiverse/,marvelstudios,3075285,harushiga
Benedict Wong Says We Have Entered 'Phase Wong' Of The Marvel Cinematic Universe,39857,tj9yfl,https://www.slashfilm.com/799490/benedict-wong-says-we-have-entered-phase-wong-of-the-marvel-cinematic-universe/,1261,1647863347.0,karateema,0.91,/r/marvelstudios/comments/tj9yfl/benedict_wong_says_we_have_entered_phase_wong_of/,marvelstudios,3075285,karateema
My boy and I are IronDad and Spider-Son,39811,d7kaxy,https://i.redd.it/8b011mgd02o31.jpg,298,1569118190.0,CaptCash,0.92,/r/marvelstudios/comments/d7kaxy/my_boy_and_i_are_irondad_and_spiderson/,marvelstudios,3075285,CaptCash
"This gives me goosebumps, literally every time I see it !",39782,cfjwxl,https://v.redd.it/4tcp5dgmefb31,1996,1563614495.0,samp987,0.87,/r/marvelstudios/comments/cfjwxl/this_gives_me_goosebumps_literally_every_time_i/,marvelstudios,3075285,samp987
James Cameron congratulates Avengers: Endgame on becoming the biggest movie of all time,39724,cgbskn,https://i.redd.it/nethlze87ub31.jpg,1148,1563793432.0,chanma50,0.9,/r/marvelstudios/comments/cgbskn/james_cameron_congratulates_avengers_endgame_on/,marvelstudios,3075285,chanma50
Taika Waititi confirms Korg's glorious return for Thor: Love and Thunder,39716,diouos,https://ew.com/movies/2019/10/16/thor-4-korg-taika-waititi/,706,1571230145.0,Niyazali_Haneef,0.94,/r/marvelstudios/comments/diouos/taika_waititi_confirms_korgs_glorious_return_for/,marvelstudios,3075285,Niyazali_Haneef
Marvel Studios' Hawkeye | Official Trailer | Disney+,39552,pnexan,https://www.youtube.com/watch?v=5VYb3B1ETlk,4105,1631538019.0,harushiga,0.85,/r/marvelstudios/comments/pnexan/marvel_studios_hawkeye_official_trailer_disney/,marvelstudios,3075285,harushiga
Spider Man didn’t know his own strength here. Any less reaction from Bucky and he is absolutely decapitated lol,39324,rtj9na,https://i.redd.it/2x9x50b4u2981.gif,1776,1641043118.0,Michael1691,0.9,/r/marvelstudios/comments/rtj9na/spider_man_didnt_know_his_own_strength_here_any/,marvelstudios,3075285,Michael1691
Stan Lee visits the set of Avengers: Infinity War,39124,b9foho,https://i.redd.it/34oq7un88aq21.jpg,497,1554398830.0,Naweezy,0.94,/r/marvelstudios/comments/b9foho/stan_lee_visits_the_set_of_avengers_infinity_war/,marvelstudios,3075285,Naweezy
"The defeat of the Kingpin by Daredevil, by yours truly",38898,dwg4de,https://i.redd.it/467qgys1zpy31.jpg,602,1573766756.0,SpikeyTortoise,0.93,/r/marvelstudios/comments/dwg4de/the_defeat_of_the_kingpin_by_daredevil_by_yours/,marvelstudios,3075285,SpikeyTortoise
People keep saying that Cap could have killed Spidey with the container since he didn’t know how strong Spider was. Nah. Cap knows exactly how strong Spidey is.,38578,r0pcoh,https://i.redd.it/eih4t68raf181.gif,1648,1637707236.0,Michael1691,0.9,/r/marvelstudios/comments/r0pcoh/people_keep_saying_that_cap_could_have_killed/,marvelstudios,3075285,Michael1691
Marvel Studios' What If...? | Official Trailer | Disney+,38540,oga730,https://www.youtube.com/watch?v=x9D0uUKJ5KI,3346,1625760040.0,harushiga,0.91,/r/marvelstudios/comments/oga730/marvel_studios_what_if_official_trailer_disney/,marvelstudios,3075285,harushiga
Mark Ruffalo and Taika Waititi at 2020 Academy Awards,38527,f2h004,https://i.redd.it/d8chvxwwmdg41.jpg,634,1581462657.0,superancica,0.9,/r/marvelstudios/comments/f2h004/mark_ruffalo_and_taika_waititi_at_2020_academy/,marvelstudios,3075285,superancica
Black Panther cosplay by Cutiepiesensei,37879,deb62f,https://i.redd.it/tzz59g0e80r31.jpg,512,1570404189.0,cutiepiesensei,0.89,/r/marvelstudios/comments/deb62f/black_panther_cosplay_by_cutiepiesensei/,marvelstudios,3075284,cutiepiesensei
Favorite newcomer to the MCU this year?,37510,rntiof,https://i.imgur.com/DOd0tUu.jpg,6618,1640375570.0,aaliyaahson,0.8,/r/marvelstudios/comments/rntiof/favorite_newcomer_to_the_mcu_this_year/,marvelstudios,3075284,aaliyaahson
"""Apparently I’m volatile, self-obsessed, and don’t play well with others""",36748,bqax5b,https://i.redd.it/5l6nhhr3c2z21.jpg,823,1558226068.0,theSaltySolo,0.94,/r/marvelstudios/comments/bqax5b/apparently_im_volatile_selfobsessed_and_dont_play/,marvelstudios,3075284,theSaltySolo
"James Gunn states he had to fight to get Dave Bautista as Drax as Marvel Studios did not want him, but after seeing the movie they agreed how right James was.",36447,lnp3u2,https://i.redd.it/7lyyzfxgqhi61.jpg,853,1613765037.0,Ahsoka456,0.95,/r/marvelstudios/comments/lnp3u2/james_gunn_states_he_had_to_fight_to_get_dave/,marvelstudios,3075284,Ahsoka456
Iron Man's free-fall suit up in the first Avengers compared to the one in Endgame,36449,j8og37,https://gfycat.com/splendidadorablegrayfox,899,1602350745.0,Naweezy,0.94,/r/marvelstudios/comments/j8og37/iron_mans_freefall_suit_up_in_the_first_avengers/,marvelstudios,3075284,Naweezy
Marvel has spoken.,36284,7ehn5f,https://i.redd.it/iw6abae8tbzz.png,707,1511269052.0,HalfBloodMockingjay,0.87,/r/marvelstudios/comments/7ehn5f/marvel_has_spoken/,marvelstudios,3075284,HalfBloodMockingjay
"In Spider-Man: Far from Home Peter can't bring a banana/his banana is taken away, so when Tom Holland met some young fans in china a kid actually gave him a banana",36269,f6hxna,https://i.redd.it/6u1gtp91ayh41.png,294,1582148615.0,El_Quetzal,0.94,/r/marvelstudios/comments/f6hxna/in_spiderman_far_from_home_peter_cant_bring_a/,marvelstudios,3075284,El_Quetzal
