title,score,id,url,num_comments,created,author,upvote_ratio,permalink,subreddit,subreddit_subscribers,author_name
“My wife has complained that OpenOffice will never print on Tuesdays” (2009),589,4jwbyr,https://bugs.launchpad.net/ubuntu/+source/cupsys/+bug/255161/comments/28,45,1463573298.0,iamkeyur,0.94,/r/coding/comments/4jwbyr/my_wife_has_complained_that_openoffice_will_never/,coding,489788,iamkeyur
"Alan Turing, World War Two codebreaker and mathematician, will be the face of new Bank of England £50 note",512,cdy42s,https://www.bbc.com/news/business-48962557,18,1563289012.0,javinpaul,0.96,/r/coding/comments/cdy42s/alan_turing_world_war_two_codebreaker_and/,coding,489788,javinpaul
Computer Science textbooks that are freely available online,417,kmph9q,https://csgordon.github.io/books.html,20,1609283838.0,iamkeyur,0.98,/r/coding/comments/kmph9q/computer_science_textbooks_that_are_freely/,coding,489788,iamkeyur
List of Coding Games to Practice & Improve Your Programming Skills,416,fxp0i0,https://blog.soshace.com/list-of-coding-games-to-practice-improve-your-programming-skills/,25,1586422455.0,branikita,0.97,/r/coding/comments/fxp0i0/list_of_coding_games_to_practice_improve_your/,coding,489788,branikita
Google will provide fundings for rewriting popular open source projects in Rust,385,lmmwj0,https://security.googleblog.com/2021/02/mitigating-memory-safety-issues-in-open.html,73,1613655315.0,iamkeyur,0.96,/r/coding/comments/lmmwj0/google_will_provide_fundings_for_rewriting/,coding,489788,iamkeyur
Challenging projects every programmer should try,384,euxxl6,http://web.eecs.utk.edu/~azh/blog/challengingprojects.html,26,1580173301.0,fagnerbrack,0.97,/r/coding/comments/euxxl6/challenging_projects_every_programmer_should_try/,coding,489788,fagnerbrack
Clean Code — A must-read Coding Book for Programmers,359,h9i1xc,https://medium.com/javarevisited/clean-code-a-must-read-coding-book-for-programmers-9dc80494d27c,49,1592233376.0,javinpaul,0.89,/r/coding/comments/h9i1xc/clean_code_a_mustread_coding_book_for_programmers/,coding,489788,javinpaul
"‎Scott Hanselmann: ""Don’t feel you need to work more than 8 hours a day. Or 6. Don’t make code your hobby UNLESS YOU WANT TO""",359,gc8s27,https://mobile.twitter.com/shanselman/status/1256500795719036928?s=19,72,1588435029.0,iamkeyur,0.95,/r/coding/comments/gc8s27/scott_hanselmann_dont_feel_you_need_to_work_more/,coding,489788,iamkeyur
A crash course on hacking satellites,334,i4yldv,https://nyan-sat.com/chapter0.html,21,1596742685.0,iamkeyur,0.99,/r/coding/comments/i4yldv/a_crash_course_on_hacking_satellites/,coding,489788,iamkeyur
I reverse engineered Google docs (2014),312,kkooin,http://features.jsomers.net/how-i-reverse-engineered-google-docs/,13,1609012405.0,iamkeyur,0.94,/r/coding/comments/kkooin/i_reverse_engineered_google_docs_2014/,coding,489788,iamkeyur
20 Things I've Learned in my 20 Years as a Software Engineer,314,q41vsz,https://www.simplethread.com/20-things-ive-learned-in-my-20-years-as-a-software-engineer/,11,1633712369.0,get-down-with-cpp,0.96,/r/coding/comments/q41vsz/20_things_ive_learned_in_my_20_years_as_a/,coding,489788,get-down-with-cpp
A complete daily plan for studying to become a Google software engineer.,313,565qmh,https://github.com/jwasham/google-interview-university,60,1475765406.0,nfrankel,0.89,/r/coding/comments/565qmh/a_complete_daily_plan_for_studying_to_become_a/,coding,489788,nfrankel
A Beginner's Roadmap to Becoming a Full-Stack Web Developer,303,bo0si9,https://utkuufuk.github.io/2019/05/12/fullstack-roadmap/,12,1557735820.0,lord-bazooka,0.95,/r/coding/comments/bo0si9/a_beginners_roadmap_to_becoming_a_fullstack_web/,coding,489788,lord-bazooka
The Code That Controls Your Money - COBOL is a coding language older than Weird Al Yankovic. The people who know how to use it are often just as old. It underpins the entire financial system. And it can’t be removed. How a computer language controls the financial life of the world.,296,qn9plu,https://www.wealthsimple.com/en-ca/magazine/cobol-controls-your-money,57,1636114116.0,speckz,0.94,/r/coding/comments/qn9plu/the_code_that_controls_your_money_cobol_is_a/,coding,489788,speckz
200 universities just launched 600 free online courses.,295,7bi4d3,https://qz.com/1120344/200-universities-just-launched-600-free-online-courses-heres-the-full-list/,3,1510106381.0,javinpaul,0.97,/r/coding/comments/7bi4d3/200_universities_just_launched_600_free_online/,coding,489788,javinpaul
GitHub is now free for teams,294,g19n3i,https://github.blog/2020-04-14-github-is-now-free-for-teams/,23,1586884653.0,nfrankel,0.97,/r/coding/comments/g19n3i/github_is_now_free_for_teams/,coding,489788,nfrankel
How we reduced our Google Maps API cost by 94%,288,iyj237,https://blog.cityflo.com/how-we-reduced-our-google-maps-api-cost/,21,1600894911.0,fagnerbrack,0.96,/r/coding/comments/iyj237/how_we_reduced_our_google_maps_api_cost_by_94/,coding,489788,fagnerbrack
"10 Best Books for Data Structure and Algorithms for Beginners in Java, C/C++, and Python",288,fhv0bd,https://medium.com/javarevisited/10-best-books-for-data-structure-and-algorithms-for-beginners-in-java-c-c-and-python-5e3d9b478eb1,11,1584079058.0,javinpaul,0.95,/r/coding/comments/fhv0bd/10_best_books_for_data_structure_and_algorithms/,coding,489788,javinpaul
"No, I have no side code projects to show you",288,5is8vh,https://www.linkedin.com/pulse/i-have-side-code-projects-show-you-ezekiel-buchheit,81,1481941292.0,javinpaul,0.9,/r/coding/comments/5is8vh/no_i_have_no_side_code_projects_to_show_you/,coding,489788,javinpaul
GitHub confirmed using all public code for training copilot regardless license,282,ogb8yn,https://twitter.com/NoraDotCodes/status/1412741339771461635,116,1625763058.0,iamkeyur,0.96,/r/coding/comments/ogb8yn/github_confirmed_using_all_public_code_for/,coding,489788,iamkeyur
500 Data Structures and Algorithms practice problems and their solutions,278,7dewx3,https://medium.com/@kingrayhan/500-data-structures-and-algorithms-practice-problems-and-their-solutions-b45a83d803f0,4,1510861459.0,geek_007,0.93,/r/coding/comments/7dewx3/500_data_structures_and_algorithms_practice/,coding,489788,geek_007
🎬Login & Registration Form Using HTML & CSS & JS✨,277,q40bxt,https://youtu.be/I5_T547tHf0,0,1633707715.0,robson_muniz,0.99,/r/coding/comments/q40bxt/login_registration_form_using_html_css_js/,coding,489788,robson_muniz
Margaret Hamilton Awarded Presidential Medal of Freedom,276,5ehlfv,https://www.nasa.gov/feature/margaret-hamilton-apollo-software-engineer-awarded-presidential-medal-of-freedom,4,1479911998.0,javinpaul,0.95,/r/coding/comments/5ehlfv/margaret_hamilton_awarded_presidential_medal_of/,coding,489788,javinpaul
Stack Overflow sold to Prosus for $1.8B,274,nqqio9,https://www.wsj.com/articles/software-developer-community-stack-overflow-sold-to-tech-giant-prosus-for-1-8-billion-11622648400,68,1622653067.0,iamkeyur,0.98,/r/coding/comments/nqqio9/stack_overflow_sold_to_prosus_for_18b/,coding,489788,iamkeyur
YouTube-dl has received a DMCA takedown from RIAA,268,jgvrlv,https://github.com/github/dmca/blob/master/2020/10/2020-10-23-RIAA.md,59,1603487068.0,iamkeyur,0.97,/r/coding/comments/jgvrlv/youtubedl_has_received_a_dmca_takedown_from_riaa/,coding,489788,iamkeyur
Things I Learnt The Hard Way (in 30 Years of Software Development),272,cprf13,https://blog.juliobiason.net/thoughts/things-i-learnt-the-hard-way/,36,1565693283.0,fagnerbrack,0.96,/r/coding/comments/cprf13/things_i_learnt_the_hard_way_in_30_years_of/,coding,489788,fagnerbrack
Why I Quit Google to Work for Myself,268,80wy3v,https://mtlynch.io/why-i-quit-google/,49,1519832486.0,javinpaul,0.89,/r/coding/comments/80wy3v/why_i_quit_google_to_work_for_myself/,coding,489788,javinpaul
SQLite is not a toy database,267,md9i7k,https://antonz.org/sqlite-is-not-a-toy-database/,44,1616709414.0,iamkeyur,0.96,/r/coding/comments/md9i7k/sqlite_is_not_a_toy_database/,coding,489788,iamkeyur
YouTube-dl is now part of GitHub/dmca.git,269,jhnp9e,https://github.com/github/dmca/tree/416da574ec0df3388f652e44f7fe71b1e3a4701f,19,1603601612.0,iamkeyur,0.97,/r/coding/comments/jhnp9e/youtubedl_is_now_part_of_githubdmcagit/,coding,489788,iamkeyur
npm is joining GitHub,266,fjpknn,https://github.blog/2020-03-16-npm-is-joining-github/,32,1584382704.0,nfrankel,0.96,/r/coding/comments/fjpknn/npm_is_joining_github/,coding,489788,nfrankel
List of software that has free tiers for developers,264,djt7u2,https://free-for.dev/,18,1571429932.0,iamkeyur,0.97,/r/coding/comments/djt7u2/list_of_software_that_has_free_tiers_for/,coding,489788,iamkeyur
I Created a Visualization of 20 Sorting Algorithms with Java. Which one do you like most?,266,k612qt,https://youtu.be/wGVIiUrESug,20,1607014701.0,compilerstuck,0.93,/r/coding/comments/k612qt/i_created_a_visualization_of_20_sorting/,coding,489788,compilerstuck
How Prince of Persia Defeated Apple II's Memory Limitations | War Stories | Ars Technica,265,fn6kdt,https://www.youtube.com/watch?v=sw0VfmXKq54,9,1584908854.0,pensker,0.96,/r/coding/comments/fn6kdt/how_prince_of_persia_defeated_apple_iis_memory/,coding,489788,pensker
Raytracing - in Excel!,263,cswruw,https://youtu.be/m28jJ7CMp8A,15,1566299026.0,s0lly,0.98,/r/coding/comments/cswruw/raytracing_in_excel/,coding,489788,s0lly
Bad managers are a huge problem in tech and developers can only compensate so much,265,ocmm01,https://iism.org/article/developers-can-t-fix-bad-management-57,28,1625269783.0,adroit-panda,0.97,/r/coding/comments/ocmm01/bad_managers_are_a_huge_problem_in_tech_and/,coding,489788,adroit-panda
Breaking GitHub Private Pages for $35k,258,mlan3c,https://robertchen.cc/blog/2021/04/03/github-pages-xss,18,1617712581.0,iamkeyur,0.98,/r/coding/comments/mlan3c/breaking_github_private_pages_for_35k/,coding,489788,iamkeyur
Most tech content is bullshit,260,gyjqm6,https://www.aleksandra.codes/tech-content-consumer,43,1591561514.0,iamkeyur,0.94,/r/coding/comments/gyjqm6/most_tech_content_is_bullshit/,coding,489788,iamkeyur
Write code. Not too much. Mostly functions.,255,khy8mi,https://www.brandonsmith.ninja/blog/write-code-not-too-much-mostly-functions,16,1608612026.0,iamkeyur,0.95,/r/coding/comments/khy8mi/write_code_not_too_much_mostly_functions/,coding,489788,iamkeyur
AWS forked my project and launched it as its own service,256,jc9t0e,https://twitter.com/tim_nolet/status/1317061818574082050,73,1602854907.0,iamkeyur,0.82,/r/coding/comments/jc9t0e/aws_forked_my_project_and_launched_it_as_its_own/,coding,489788,iamkeyur
"This page is a truly naked, brutalist HTML quine",251,je21pe,https://secretgeek.github.io/html_wysiwyg/html.html,11,1603115669.0,iamkeyur,0.96,/r/coding/comments/je21pe/this_page_is_a_truly_naked_brutalist_html_quine/,coding,489788,iamkeyur
Remote software developers earn more than non-remote developers,250,g5mnue,https://whoisnnamdi.com/remote-software-developers-earn-more/,34,1587499882.0,iamkeyur,0.95,/r/coding/comments/g5mnue/remote_software_developers_earn_more_than/,coding,489788,iamkeyur
I don't know how CPUs work so I simulated one in code,251,brap1d,https://djhworld.github.io/post/2019/05/21/i-dont-know-how-cpus-work-so-i-simulated-one-in-code/,18,1558446859.0,javinpaul,0.96,/r/coding/comments/brap1d/i_dont_know_how_cpus_work_so_i_simulated_one_in/,coding,489788,javinpaul
Tried to explain back-end development in a comic,249,5o2ea9,https://consolia-comic.com/comics/back-end,26,1484459728.0,javinpaul,0.9,/r/coding/comments/5o2ea9/tried_to_explain_backend_development_in_a_comic/,coding,489788,javinpaul
Someone is pretending to be me.,246,xpm92i,https://connortumbleson.com/2022/09/19/someone-is-pretending-to-be-me/,21,1664297965.0,speckz,0.97,/r/coding/comments/xpm92i/someone_is_pretending_to_be_me/,coding,489788,speckz
Learn to Code a Sudoku Solver,245,htoeww,https://youtu.be/jc1vm-aQ3eo,4,1595107165.0,GhOsT1679,0.96,/r/coding/comments/htoeww/learn_to_code_a_sudoku_solver/,coding,489788,GhOsT1679
Company Tried to Patent My Work After a Job Interview,247,a23d45,https://patentpandas.org/stories/company-patented-my-idea,19,1543673994.0,javinpaul,0.96,/r/coding/comments/a23d45/company_tried_to_patent_my_work_after_a_job/,coding,489788,javinpaul
I created a Visualization of 20 Sorting Algorithms as a Christmas Tree with Java. Merry Xmas :),241,kivjc2,https://youtu.be/p6rkVqgwVuI,13,1608738926.0,compilerstuck,0.95,/r/coding/comments/kivjc2/i_created_a_visualization_of_20_sorting/,coding,489788,compilerstuck
"Gorillas, the largest supermarket delivery service in Germany has leakes all its customers data through a GraphQL end-point",240,t03mfl,https://zerforschung.org/posts/gorillas-en/,12,1645682727.0,fagnerbrack,0.96,/r/coding/comments/t03mfl/gorillas_the_largest_supermarket_delivery_service/,coding,489788,fagnerbrack
Neural Networks from scratch in Python,238,kqh767,https://youtu.be/51EoNgwoaTo,16,1609792258.0,ki3,0.98,/r/coding/comments/kqh767/neural_networks_from_scratch_in_python/,coding,489788,ki3
The world in which IPv6 was a good design,235,6t0plf,http://apenwarr.ca/log/?m=201708#10,18,1502453378.0,iamkeyur,0.93,/r/coding/comments/6t0plf/the_world_in_which_ipv6_was_a_good_design/,coding,489788,iamkeyur
I had to build a web scraper to buy groceries,234,fqvkhx,https://utkuufuk.com/2020/03/28/grocery-scraping/,11,1585439513.0,lord-bazooka,0.95,/r/coding/comments/fqvkhx/i_had_to_build_a_web_scraper_to_buy_groceries/,coding,489788,lord-bazooka
Google's Engineering Practices documentation: How to do a code review,235,dd4hp3,https://google.github.io/eng-practices/review/reviewer/,9,1570177362.0,martinig,0.99,/r/coding/comments/dd4hp3/googles_engineering_practices_documentation_how/,coding,489788,martinig
Please ask stupid questions as a new software developer,234,qpe28b,https://www.nikitakazakov.com/ask-stupid-questions-as-software-developer,42,1636379523.0,speckz,0.96,/r/coding/comments/qpe28b/please_ask_stupid_questions_as_a_new_software/,coding,489788,speckz
Dijkstra's Shortest Path Algorithm,237,jdkzu3,https://youtu.be/-O-jQC6iHYE,9,1603044272.0,GhOsT1679,0.94,/r/coding/comments/jdkzu3/dijkstras_shortest_path_algorithm/,coding,489788,GhOsT1679
How to COMMIT BETTER with GIT,231,guqm4k,https://youtu.be/Hlp-9cdImSM,25,1591038070.0,ki3,0.89,/r/coding/comments/guqm4k/how_to_commit_better_with_git/,coding,489788,ki3
AI-generated answers temporarily banned on coding Q&A site Stack Overflow,229,zde5rz,https://www.theverge.com/2022/12/5/23493932/chatgpt-ai-generated-answers-temporarily-banned-stack-overflow-llms-dangers,29,1670263181.0,speckz,0.96,/r/coding/comments/zde5rz/aigenerated_answers_temporarily_banned_on_coding/,coding,489788,speckz
Microsoft demos language model that writes code based on signature and comment,231,gns7nm,https://www.youtube.com/watch?v=fZSFNUT6iY8&feature=youtu.be,44,1590045479.0,iamkeyur,0.96,/r/coding/comments/gns7nm/microsoft_demos_language_model_that_writes_code/,coding,489788,iamkeyur
Conversations with a six-year-old on functional programming,227,8i6h8t,https://byorgey.wordpress.com/2018/05/06/conversations-with-a-six-year-old-on-functional-programming/,8,1525876755.0,javinpaul,0.92,/r/coding/comments/8i6h8t/conversations_with_a_sixyearold_on_functional/,coding,489788,javinpaul
Long Names Are Long: Why Naming Is Important (with examples),228,dlf1lv,http://journal.stuffwithstuff.com/2016/06/16/long-names-are-long/,26,1571733667.0,fagnerbrack,0.96,/r/coding/comments/dlf1lv/long_names_are_long_why_naming_is_important_with/,coding,489788,fagnerbrack
7000+ Free Pluralsight Courses to Build in-demand tech skills without leaving your house,223,fvs0an,https://medium.com/javarevisited/7000-free-pluralsight-courses-to-build-in-demand-tech-skills-without-leaving-your-house-40edb50a8cf2?source=collection_home---4------0-----------------------,10,1586146694.0,javinpaul,0.93,/r/coding/comments/fvs0an/7000_free_pluralsight_courses_to_build_indemand/,coding,489788,javinpaul
"NSA urges orgs to use memory-safe programming languages - C/C++ on the bench, as NSA puts its trust in Rust, C#, Go, Java, Ruby and Swift",224,ysdtud,https://www.theregister.com/2022/11/11/nsa_urges_orgs_to_use/,21,1668180932.0,speckz,0.94,/r/coding/comments/ysdtud/nsa_urges_orgs_to_use_memorysafe_programming/,coding,489788,speckz
6 Coding Books Programmers and Software Developers should Read,220,hpbyu0,https://medium.com/javarevisited/6-coding-books-every-programmers-and-software-developers-should-read-620124886c8f,39,1594481733.0,javinpaul,0.84,/r/coding/comments/hpbyu0/6_coding_books_programmers_and_software/,coding,489788,javinpaul
Elevator.js – A “back to top” button that behaves like a real elevator,221,hevyd1,http://tholman.com/elevator.js/,33,1592980643.0,iamkeyur,0.91,/r/coding/comments/hevyd1/elevatorjs_a_back_to_top_button_that_behaves_like/,coding,489788,iamkeyur
Python is Now the Most Popular Introductory Teaching Language at Top U.S. Universities,218,3fn5s5,http://cacm.acm.org/blogs/blog-cacm/176450-python-is-now-the-most-popular-introductory-teaching-language-at-top-us-universities/fulltext,85,1438623559.0,alexcasalboni,0.95,/r/coding/comments/3fn5s5/python_is_now_the_most_popular_introductory/,coding,489788,alexcasalboni
190 universities just launched 600 free online courses. Here’s the full list.,220,9rkqmr,https://qz.com/1437623/600-free-online-courses-you-can-take-from-universities-worldwide/,14,1540560648.0,javinpaul,0.95,/r/coding/comments/9rkqmr/190_universities_just_launched_600_free_online/,coding,489788,javinpaul
Understanding how Facebook disappeared from the internet,214,q1j5n7,https://blog.cloudflare.com/october-2021-facebook-outage/,7,1633393337.0,iamkeyur,0.97,/r/coding/comments/q1j5n7/understanding_how_facebook_disappeared_from_the/,coding,489788,iamkeyur
Things you can do with a browser in 2020,218,flj4mh,https://github.com/luruke/browser-2020,12,1584656482.0,iamkeyur,0.97,/r/coding/comments/flj4mh/things_you_can_do_with_a_browser_in_2020/,coding,489788,iamkeyur
Generate Mazes - in Excel!,218,d6td6k,https://youtu.be/dCamjmvP4tw,16,1568977981.0,s0lly,0.96,/r/coding/comments/d6td6k/generate_mazes_in_excel/,coding,489788,s0lly
Flight rules for Git: a guide for programmers using Git about what to do when things go wrong,217,k1n9t3,https://github.com/k88hudson/git-flight-rules,6,1606424360.0,nfrankel,0.96,/r/coding/comments/k1n9t3/flight_rules_for_git_a_guide_for_programmers/,coding,489788,nfrankel
One Guy Ruined Hacktoberfest 2020,213,j3oe7y,https://joel.net/how-one-guy-ruined-hacktoberfest2020-drama,40,1601614432.0,iamkeyur,0.9,/r/coding/comments/j3oe7y/one_guy_ruined_hacktoberfest_2020/,coding,489788,iamkeyur
How to Choose Colours Procedurally (Algorithms) ,215,xe2ao,http://devmag.org.za/2012/07/29/how-to-choose-colours-procedurally-algorithms/,8,1343655877.0,rrenaud,0.96,/r/coding/comments/xe2ao/how_to_choose_colours_procedurally_algorithms/,coding,489788,rrenaud
Programming career: not everyone is a manager (and that's OK),214,k9te4x,https://engineering.wework.com/not-everyone-is-a-manager-4fe01a329ed1,46,1607526220.0,martinig,0.94,/r/coding/comments/k9te4x/programming_career_not_everyone_is_a_manager_and/,coding,489788,martinig
Password Rules Are Bullshit,215,5ym2fz,https://blog.codinghorror.com/password-rules-are-bullshit/,66,1489152835.0,fl4v1,0.93,/r/coding/comments/5ym2fz/password_rules_are_bullshit/,coding,489788,fl4v1
Dennis Ritchie's first C compiler on GitHub,213,m2hzep,https://github.com/mortdeus/legacy-cc,37,1615437745.0,iamkeyur,0.97,/r/coding/comments/m2hzep/dennis_ritchies_first_c_compiler_on_github/,coding,489788,iamkeyur
Google has started a video series on machine learning and I can understand it,215,4f1p35,https://www.youtube.com/watch?v=cKxRvEZd3Mw,13,1460809769.0,javinpaul,0.87,/r/coding/comments/4f1p35/google_has_started_a_video_series_on_machine/,coding,489788,javinpaul
Full-Stack JavaScript Tutorial for Beginners (2:22:12),213,czd8i5,https://youtu.be/ZaRRtwRT4TM,4,1567556163.0,Joseph_Delgadillo,0.94,/r/coding/comments/czd8i5/fullstack_javascript_tutorial_for_beginners_22212/,coding,489788,Joseph_Delgadillo
"Web based Windows XP desktop recreation, built with React",213,jlwle8,https://winxp.now.sh/,7,1604205022.0,iamkeyur,0.95,/r/coding/comments/jlwle8/web_based_windows_xp_desktop_recreation_built/,coding,489788,iamkeyur
Start all of your commands with a comma,212,xeerxw,https://rhodesmill.org/brandon/2009/commands-with-comma/,7,1663193118.0,fagnerbrack,0.95,/r/coding/comments/xeerxw/start_all_of_your_commands_with_a_comma/,coding,489788,fagnerbrack
"My guiding principles after 20 years of programming (an 22, 2020)",209,tkv5qv,https://alexewerlof.medium.com/my-guiding-principles-after-20-years-of-programming-a087dc55596c,20,1648045667.0,speckz,0.95,/r/coding/comments/tkv5qv/my_guiding_principles_after_20_years_of/,coding,489788,speckz
I’m learning to code at 56. Here’s an epic beat-down of my critical inner self.,207,5lzid6,https://medium.freecodecamp.com/yes-im-56-and-learning-to-code-f33abea6fd4c#.taav0dfn4,64,1483541559.0,javinpaul,0.88,/r/coding/comments/5lzid6/im_learning_to_code_at_56_heres_an_epic_beatdown/,coding,489788,javinpaul
Web Design in 4 minutes,210,4usyxg,http://jgthms.com/web-design-in-4-minutes/,16,1469595608.0,iamkeyur,0.94,/r/coding/comments/4usyxg/web_design_in_4_minutes/,coding,489788,iamkeyur
The Most Complete List of Legally Free Python Books (Updated 2021),202,kdlfii,https://www.pythonkitchen.com/legally-free-python-books-list/,11,1608037747.0,iamkeyur,0.94,/r/coding/comments/kdlfii/the_most_complete_list_of_legally_free_python/,coding,489788,iamkeyur
NoDesign.dev – Tools and resources for non artistic developers,201,gzajdx,https://nodesign.dev/,14,1591657492.0,iamkeyur,0.98,/r/coding/comments/gzajdx/nodesigndev_tools_and_resources_for_non_artistic/,coding,489788,iamkeyur
"Software Architecture is Overrated, Clear and Simple Design is Underrated",203,e5uvpw,https://blog.pragmaticengineer.com/software-architecture-is-overrated/,43,1575439575.0,fagnerbrack,0.85,/r/coding/comments/e5uvpw/software_architecture_is_overrated_clear_and/,coding,489788,fagnerbrack
Programming Books You Wish You Read Earlier,199,be7c8m,https://zeroequalsfalse.press/posts/programming-books-you-wish-you-read-earlier/,30,1555504998.0,woahdotcom,0.95,/r/coding/comments/be7c8m/programming_books_you_wish_you_read_earlier/,coding,489788,woahdotcom
Hosting SQLite databases on GitHub Pages or any static file hoster,198,n3guo8,https://phiresky.github.io/blog/2021/hosting-sqlite-databases-on-github-pages/,7,1619992168.0,iamkeyur,0.99,/r/coding/comments/n3guo8/hosting_sqlite_databases_on_github_pages_or_any/,coding,489788,iamkeyur
AWS services explained in one line each,196,gqzwdg,https://adayinthelifeof.nl/2020/05/20/aws.html,7,1590509306.0,iamkeyur,0.96,/r/coding/comments/gqzwdg/aws_services_explained_in_one_line_each/,coding,489788,iamkeyur
A Programmer Burnout Story; How to Recognize it And Avoid it,195,diow4o,https://www.coderhood.com/a-programmer-burnout-story-how-to-recognize-it-and-avoid-it/,22,1571230357.0,martinig,0.94,/r/coding/comments/diow4o/a_programmer_burnout_story_how_to_recognize_it/,coding,489788,martinig
"What is "":-!!"" in C code?",200,5e48cf,http://stackoverflow.com/questions/9229601/what-is-in-c-code,24,1479737919.0,javinpaul,0.96,/r/coding/comments/5e48cf/what_is_in_c_code/,coding,489788,javinpaul
Why nobody hires junior developers anymore,194,qan0wb,https://www.notonlycode.org/nobody-hires-juniors/,68,1634564830.0,speckz,0.89,/r/coding/comments/qan0wb/why_nobody_hires_junior_developers_anymore/,coding,489788,speckz
Why 0.1 + 0.2 === 0.30000000000000004: Implementing IEEE 754 in JS,195,e82m0d,https://www.youtube.com/watch?v=wPBjd-vb9eI,48,1575853778.0,fagnerbrack,0.94,/r/coding/comments/e82m0d/why_01_02_030000000000000004_implementing_ieee/,coding,489788,fagnerbrack
The Big List of Naughty Strings is a list of strings which have a high probability of causing issues when used as user-input data.,196,5ob6ns,https://github.com/minimaxir/big-list-of-naughty-strings,7,1484578050.0,javinpaul,0.93,/r/coding/comments/5ob6ns/the_big_list_of_naughty_strings_is_a_list_of/,coding,489788,javinpaul
An Intro to Compilers,197,hcsic1,https://nicoleorchard.com/blog/compilers,7,1592682405.0,iamkeyur,0.97,/r/coding/comments/hcsic1/an_intro_to_compilers/,coding,489788,iamkeyur
"20 Activation Functions in Python for Deep Neural Network | ELU, ReLU, Leaky-ReLU, Sigmoid, Cosine",197,gdcoas,https://www.youtube.com/watch?v=D1twox0mcrM&feature=share,3,1588602829.0,research_pie,0.96,/r/coding/comments/gdcoas/20_activation_functions_in_python_for_deep_neural/,coding,489788,research_pie
Regex cheatsheet - I Hate Regex,196,ewsple,https://ihateregex.io/,9,1580495611.0,tunei24531a,0.95,/r/coding/comments/ewsple/regex_cheatsheet_i_hate_regex/,coding,489788,tunei24531a
The latest trend for tech interviews: Days of unpaid homework,196,8nii17,https://work.qz.com/1254663/job-interviews-for-programmers-now-often-come-with-days-of-unpaid-homework/,68,1527774134.0,javinpaul,0.94,/r/coding/comments/8nii17/the_latest_trend_for_tech_interviews_days_of/,coding,489788,javinpaul
time.gif : endless GIF that always shows the current time in UTC:,193,6t7n80,https://hookrace.net/blog/time.gif/,8,1502531627.0,awsometak,0.96,/r/coding/comments/6t7n80/timegif_endless_gif_that_always_shows_the_current/,coding,489788,awsometak
Why Don’t Tech Companies Pay Their Engineers to Stay?,193,oxw2ks,https://www.goethena.com/post/why-don-t-tech-companies-pay-their-engineers-to-stay,65,1628093649.0,speckz,0.94,/r/coding/comments/oxw2ks/why_dont_tech_companies_pay_their_engineers_to/,coding,489788,speckz
How HTTPS Works,190,it8ir1,https://howhttps.works/,10,1600175683.0,iamkeyur,0.93,/r/coding/comments/it8ir1/how_https_works/,coding,489788,iamkeyur
