title,score,id,url,num_comments,created,author,upvote_ratio,permalink,subreddit,subreddit_subscribers,author_name
Tom Holland’s reaction when told Spider-Man: No Way Home is about to beat Avatar’s U.S. box office record.,36233,siezcb,https://v.redd.it/qerf6oyjgcf81,995,1643774692.0,ICumCoffee,0.88,/r/marvelstudios/comments/siezcb/tom_hollands_reaction_when_told_spiderman_no_way/,marvelstudios,3075284,ICumCoffee
The Falcon and the Winter Soldier Trailer,36233,lez1i3,https://youtu.be/IWBsDaFWyTE,2849,1612741983.0,chanma50,0.89,/r/marvelstudios/comments/lez1i3/the_falcon_and_the_winter_soldier_trailer/,marvelstudios,3075284,chanma50
Loki director Kate Herron announces that Loki is now wrapped and the finale has been turned in.,36128,o4bbt2,https://i.redd.it/rrn9pszhng671.jpg,823,1624212284.0,Ahsoka456,0.94,/r/marvelstudios/comments/o4bbt2/loki_director_kate_herron_announces_that_loki_is/,marvelstudios,3075284,Ahsoka456
State of Marvel after COVID-19 [GIF],36080,fl8cn6,https://gfycat.com/potablelastingafricanporcupine,510,1584616493.0,CheesyObserver,0.94,/r/marvelstudios/comments/fl8cn6/state_of_marvel_after_covid19_gif/,marvelstudios,3075284,CheesyObserver
Disney/Pixar/Marvel Studios' Loki by @lyle_style,36039,og1xx6,https://i.redd.it/5k8vkxl5sx971.jpg,374,1625727371.0,Tajul92,0.93,/r/marvelstudios/comments/og1xx6/disneypixarmarvel_studios_loki_by_lyle_style/,marvelstudios,3075284,Tajul92
"""Sentinel of Liberty"" (Captain America Trilogy posters) by Rico Jr",36020,7pvtjx,https://i.redd.it/7q7erei19m901.jpg,407,1515753907.0,aemon123,0.92,/r/marvelstudios/comments/7pvtjx/sentinel_of_liberty_captain_america_trilogy/,marvelstudios,3075284,aemon123
Poor David Harbour 😂,35811,eombls,https://i.redd.it/m6vq7rvadra41.png,596,1579013882.0,Tajul92,0.94,/r/marvelstudios/comments/eombls/poor_david_harbour/,marvelstudios,3075284,Tajul92
Russo Brothers give a message to the fans.,35662,89dv8i,https://i.redd.it/z0qk1avf6pp01.jpg,2106,1522762936.0,aemon123,0.89,/r/marvelstudios/comments/89dv8i/russo_brothers_give_a_message_to_the_fans/,marvelstudios,3075284,aemon123
Paul Rudd has an Ant-Man sized star in the Hollywood Walk of Fame,35641,q13prl,https://i.redd.it/y48mfd3i7fr71.jpg,317,1633347606.0,TooZeroLeft,0.92,/r/marvelstudios/comments/q13prl/paul_rudd_has_an_antman_sized_star_in_the/,marvelstudios,3075284,TooZeroLeft
Ragnarok Hulk = best version of Hulk. I wish we had more time with him. Thor/Hulk was a combo I didn't know I needed. Do you miss him?,35618,pope50,https://i.redd.it/abil2hm4xnn71.jpg,1220,1631709866.0,theSaltySolo,0.9,/r/marvelstudios/comments/pope50/ragnarok_hulk_best_version_of_hulk_i_wish_we_had/,marvelstudios,3075284,theSaltySolo
'Captain America 4' in the Works With 'Falcon and the Winter Soldier' Showrunner Malcolm Spellman,35218,mx4g6v,https://www.hollywoodreporter.com/heat-vision/captain-america-4-in-the-works-with-falcon-and-the-winter-soldier-showrunner-malcolm-spellman-exclusive,2360,1619210001.0,chanma50,0.91,/r/marvelstudios/comments/mx4g6v/captain_america_4_in_the_works_with_falcon_and/,marvelstudios,3075284,chanma50
That time Benedict Cumberbatch visited a comic book store dress as Doctor Strange,35188,nodzz8,https://v.redd.it/vmfvfh7f4a271,448,1622389904.0,El_Quetzal,0.95,/r/marvelstudios/comments/nodzz8/that_time_benedict_cumberbatch_visited_a_comic/,marvelstudios,3075284,El_Quetzal
Barack Obama on Chadwick Boseman,35162,iitmbx,https://i.redd.it/gpgi0leufyj51.jpg,434,1598712599.0,australiughhh,0.92,/r/marvelstudios/comments/iitmbx/barack_obama_on_chadwick_boseman/,marvelstudios,3075284,australiughhh
Chaos and Mischief,34947,oz53dl,https://i.redd.it/8fo6jd048qf71.jpg,549,1628250812.0,Nashetania,0.91,/r/marvelstudios/comments/oz53dl/chaos_and_mischief/,marvelstudios,3075285,Nashetania
Tom Holland’s dad on Twitter #SaveSpiderMan,34810,ctkdts,https://i.redd.it/7wp9a2djbuh31.jpg,679,1566409966.0,Winter_soulja,0.92,/r/marvelstudios/comments/ctkdts/tom_hollands_dad_on_twitter_savespiderman/,marvelstudios,3075285,Winter_soulja
"Natalie Portman on Instagram - ""And you thought you were the one and only...""",34559,u81uu3,https://i.redd.it/3j0vnpixypu81.jpg,1881,1650475999.0,MarvelsGrantMan136,0.87,/r/marvelstudios/comments/u81uu3/natalie_portman_on_instagram_and_you_thought_you/,marvelstudios,3075285,MarvelsGrantMan136
"Excerpt from Matt Jacobs' interview with Chadwick Boseman, 2017",34478,ij9ija,https://i.redd.it/waq9eo84p3k51.png,326,1598776287.0,australiughhh,0.96,/r/marvelstudios/comments/ij9ija/excerpt_from_matt_jacobs_interview_with_chadwick/,marvelstudios,3075285,australiughhh
There was an idea...,34120,cilruc,https://i.redd.it/ivi5bvrbdwc31.jpg,524,1564255582.0,ThanosFan99,0.86,/r/marvelstudios/comments/cilruc/there_was_an_idea/,marvelstudios,3075285,ThanosFan99
I’ve seen a bunch of complaints about how the actress playing Cassie in Endgame is way too old because she’s “like 20 something and Cassie was 10 in 2018”... Emma Fuhrmann was 15 when she filmed Endgame. Which would have made her one of the few actors who’s real age matches their character’s,34071,covk3x,https://i.redd.it/70ye4szozsf31.jpg,764,1565522183.0,EKRB7,0.95,/r/marvelstudios/comments/covk3x/ive_seen_a_bunch_of_complaints_about_how_the/,marvelstudios,3075285,EKRB7
"Simu Liu - ""Flopped so hard we got a sequel!!""",34028,rah61s,https://i.redd.it/r3pd92sjhz381.jpg,1193,1638823299.0,chanma50,0.9,/r/marvelstudios/comments/rah61s/simu_liu_flopped_so_hard_we_got_a_sequel/,marvelstudios,3075285,chanma50
60's styled Endgame Ironman by yours truly,33924,d3clhh,https://i.redd.it/5h0gpy5hn7m31.png,394,1568314806.0,SpikeyTortoise,0.93,/r/marvelstudios/comments/d3clhh/60s_styled_endgame_ironman_by_yours_truly/,marvelstudios,3075285,SpikeyTortoise
Paul Bettany being Meta,33846,m2nyb1,https://i.redd.it/ymcbi5vuudm61.jpg,190,1615461498.0,JackFisherBooks,0.95,/r/marvelstudios/comments/m2nyb1/paul_bettany_being_meta/,marvelstudios,3075285,JackFisherBooks
"Thor: Love and Thunder began shooting today, marked by a traditional Indigenous ceremony.",33821,l5ckii,https://i.redd.it/llwu5fr12od61.jpg,1126,1611662332.0,chanma50,0.92,/r/marvelstudios/comments/l5ckii/thor_love_and_thunder_began_shooting_today_marked/,marvelstudios,3075285,chanma50
Official Trailer | She-Hulk: Attorney at Law | Disney+,33680,urxgth,https://www.youtube.com/watch?v=gim2kprjL50,6319,1652824529.0,indig0sixalpha,0.73,/r/marvelstudios/comments/urxgth/official_trailer_shehulk_attorney_at_law_disney/,marvelstudios,3075285,indig0sixalpha
"""What, you wanted more?""",33617,e3d4zm,https://i.redd.it/avy372wcsl141.jpg,570,1575023668.0,LittleYellowFish1,0.95,/r/marvelstudios/comments/e3d4zm/what_you_wanted_more/,marvelstudios,3075285,LittleYellowFish1
Dave Bautista weighs in on Scarlett Johansson vs Disney,33600,oulmjx,https://i.redd.it/odc24qzx0de71.png,1905,1627655166.0,l_l_l-illiam,0.91,/r/marvelstudios/comments/oulmjx/dave_bautista_weighs_in_on_scarlett_johansson_vs/,marvelstudios,3075285,l_l_l-illiam
Sebastian Stan and Don Cheadle join Paul Bettany as actors who have appeared in all 4 Phases of the Marvel Cinematic Universe.,33350,mb3p69,https://i.redd.it/wshsr98dooo61.png,705,1616464170.0,chanma50,0.95,/r/marvelstudios/comments/mb3p69/sebastian_stan_and_don_cheadle_join_paul_bettany/,marvelstudios,3075285,chanma50
Chris Hemsworth's son Tristan plays Thor as a boy in THOR: LOVE AND THUNDER!,33038,u7pi0y,https://i.redd.it/gh8wjsdzgmu81.png,461,1650433715.0,Giff95,0.94,/r/marvelstudios/comments/u7pi0y/chris_hemsworths_son_tristan_plays_thor_as_a_boy/,marvelstudios,3075285,Giff95
That time Mark was starstruck at Paul.,32966,7oyy8y,https://i.redd.it/4ohka6fmwu801.jpg,374,1515422871.0,HalfBloodMockingjay,0.89,/r/marvelstudios/comments/7oyy8y/that_time_mark_was_starstruck_at_paul/,marvelstudios,3075285,HalfBloodMockingjay
Marvel Studios’ Eternals | Official Teaser,32922,njxf2j,https://www.youtube.com/watch?v=0WVDKZJkGlY,4142,1621861222.0,indig0sixalpha,0.87,/r/marvelstudios/comments/njxf2j/marvel_studios_eternals_official_teaser/,marvelstudios,3075285,indig0sixalpha
"Whether the Netflix shows remain canon or Feige decides to reboot Daredevil, I hope Vincent D'Onofrio is kept as Kingpin much like J.K. Simmons as J. Jonah Jameson.",32874,f73ynm,https://i.redd.it/o5jx2ye8p6i41.png,958,1582250511.0,Giff95,0.93,/r/marvelstudios/comments/f73ynm/whether_the_netflix_shows_remain_canon_or_feige/,marvelstudios,3075285,Giff95
"Chris Evans - ""Officially wrapped on Avengers 4. It was an emotional day to say the least. Playing this role over the last 8 years has been an honor. To everyone in front of the camera, behind the camera, and in the audience, thank you for the memories! Eternally grateful.""",32753,9lduli,https://twitter.com/ChrisEvans/status/1047896966410190849,1895,1538673179.0,The_Iceman2288,0.92,/r/marvelstudios/comments/9lduli/chris_evans_officially_wrapped_on_avengers_4_it/,marvelstudios,3075285,The_Iceman2288
Title for the next Spider-Man movie revealed:,32672,ct5onq,https://i.redd.it/hbjqbwacznh31.jpg,782,1566333240.0,LittleYellowFish1,0.96,/r/marvelstudios/comments/ct5onq/title_for_the_next_spiderman_movie_revealed/,marvelstudios,3075285,LittleYellowFish1
The Marvel banner on Disney+ has been changed,32630,qrlds2,https://www.reddit.com/gallery/qrlds2,2057,1636637509.0,aaliyaahson,0.84,/r/marvelstudios/comments/qrlds2/the_marvel_banner_on_disney_has_been_changed/,marvelstudios,3075285,aaliyaahson
