title,score,id,url,num_comments,created,author,upvote_ratio,permalink,subreddit,subreddit_subscribers,author_name
Steve Irwin explains why he likes money,60031,c2zzry,https://i.imgur.com/ALVqO8F.gifv,1350,1561057097.0,Scaulbylausis,0.96,/r/wholesomegifs/comments/c2zzry/steve_irwin_explains_why_he_likes_money/,wholesomegifs,1015626,Scaulbylausis
Man gifts fiancé with lost childhood teddy bear,55307,k3ba4y,https://i.imgur.com/CNUMJ5Z.gifv,991,1606664106.0,Scaulbylausis,0.92,/r/wholesomegifs/comments/k3ba4y/man_gifts_fiancé_with_lost_childhood_teddy_bear/,wholesomegifs,1015626,Scaulbylausis
Slinky Dog Cosplay,51456,qhrgm5,https://v.redd.it/k3ixkmg728w71,370,1635440419.0,Tunexux,0.94,/r/wholesomegifs/comments/qhrgm5/slinky_dog_cosplay/,wholesomegifs,1015626,Tunexux
Man Who Saved 669 Children During The Holocaust Has No Idea They’re Around Him On Live Television Show.,46757,6t1mby,http://i.imgur.com/6mqAlJt.gifv,893,1502462927.0,attheisstt,0.87,/r/wholesomegifs/comments/6t1mby/man_who_saved_669_children_during_the_holocaust/,wholesomegifs,1015626,attheisstt
When doggo chooses you,43893,f3it4b,https://gfycat.com/pooroldfashionedcatbird,375,1581635665.0,tobago_88,0.94,/r/wholesomegifs/comments/f3it4b/when_doggo_chooses_you/,wholesomegifs,1015626,tobago_88
"It's really uplifting to see small acts of kindness like this, especially during these times",42754,flh9p6,https://gfycat.com/fearlesszigzaggoldenmantledgroundsquirrel,615,1584650096.0,MyNameGifOreilly,0.89,/r/wholesomegifs/comments/flh9p6/its_really_uplifting_to_see_small_acts_of/,wholesomegifs,1015626,MyNameGifOreilly
Hugh Jackman gets recognised in Ethiopia.,40917,7dm1a0,https://i.imgur.com/qcEnKFE.gifv,411,1510935434.0,albo_underhill,0.92,/r/wholesomegifs/comments/7dm1a0/hugh_jackman_gets_recognised_in_ethiopia/,wholesomegifs,1015626,albo_underhill
Son surprises mom that he hasn’t seen in 7 months,40910,d0uy7t,https://gfycat.com/caringincompatiblehoatzin,411,1567856353.0,sezar4321,0.95,/r/wholesomegifs/comments/d0uy7t/son_surprises_mom_that_he_hasnt_seen_in_7_months/,wholesomegifs,1015626,sezar4321
Her beauty brought him to tears.,38893,eogjif,http://i.imgur.com/1mOGqy7.gifv,864,1578977593.0,deathakissaway,0.85,/r/wholesomegifs/comments/eogjif/her_beauty_brought_him_to_tears/,wholesomegifs,1015626,deathakissaway
This bird loving life after finding a new and better owner,37402,dff8eh,https://gfycat.com/sourfragrantdiamondbackrattlesnake,487,1570617711.0,tobago_88,0.93,/r/wholesomegifs/comments/dff8eh/this_bird_loving_life_after_finding_a_new_and/,wholesomegifs,1015626,tobago_88
Best friends forever,36504,rh4vds,https://i.imgur.com/DRa5JVx.gifv,325,1639590602.0,AmerBekic,0.97,/r/wholesomegifs/comments/rh4vds/best_friends_forever/,wholesomegifs,1015626,AmerBekic
Higgggggggggggh Five,36141,cuf8j9,https://i.imgur.com/P4vv1Tj.gifv,284,1566573270.0,MyNameGifOreilly,0.95,/r/wholesomegifs/comments/cuf8j9/higgggggggggggh_five/,wholesomegifs,1015626,MyNameGifOreilly
Beautiful first date.,35996,6ar8bq,http://i.imgur.com/FPiUQ8r.gifv,1906,1494595039.0,albo_underhill,0.84,/r/wholesomegifs/comments/6ar8bq/beautiful_first_date/,wholesomegifs,1015626,albo_underhill
Good guy Bill,35978,iy9iv5,https://i.imgur.com/0cktbBH.gifv,266,1600865681.0,AmerBekic,0.95,/r/wholesomegifs/comments/iy9iv5/good_guy_bill/,wholesomegifs,1015626,AmerBekic
First loving touch for a mistreated dog,35049,95mdx6,https://i.imgur.com/HmKJd15.gifv,732,1533737854.0,Sumit316,0.93,/r/wholesomegifs/comments/95mdx6/first_loving_touch_for_a_mistreated_dog/,wholesomegifs,1015626,Sumit316
Father cat just coming to check on mama and the babies.,34896,g6m04x,https://i.imgur.com/JDohzKV.gifv,341,1587646014.0,5_Frog_Margin,0.95,/r/wholesomegifs/comments/g6m04x/father_cat_just_coming_to_check_on_mama_and_the/,wholesomegifs,1015626,5_Frog_Margin
Two young best friends see each other for the first time in 3 months due to quarantine.,34493,h78eo6,https://i.imgur.com/IwiLwZo.gifv,782,1591915437.0,Two_Inches_Of_Fun,0.9,/r/wholesomegifs/comments/h78eo6/two_young_best_friends_see_each_other_for_the/,wholesomegifs,1015626,Two_Inches_Of_Fun
Pupper deciding their human's worked enough,33943,diooew,https://gfycat.com/forcefulcreepyivorybilledwoodpecker,146,1571229247.0,to_the_tenth_power,0.94,/r/wholesomegifs/comments/diooew/pupper_deciding_their_humans_worked_enough/,wholesomegifs,1015626,to_the_tenth_power
"I was afraid he Couldn't convince his friend to be free, But in the end, he sealed the deal!",33613,cm9qam,https://gfycat.com/warmheartedsimplealaskanmalamute,286,1565004169.0,sezar4321,0.94,/r/wholesomegifs/comments/cm9qam/i_was_afraid_he_couldnt_convince_his_friend_to_be/,wholesomegifs,1015626,sezar4321
Wholesome Grandpa,33508,fkru9d,https://gfycat.com/exhaustedgoldenalligator,476,1584547182.0,MyNameGifOreilly,0.96,/r/wholesomegifs/comments/fkru9d/wholesome_grandpa/,wholesomegifs,1015626,MyNameGifOreilly
She surprised her own prom date after not being able to walk for 10 months,32095,8fquvl,https://i.imgur.com/NirgLdK.gifv,725,1525002299.0,Tucko29,0.89,/r/wholesomegifs/comments/8fquvl/she_surprised_her_own_prom_date_after_not_being/,wholesomegifs,1015626,Tucko29
"And that, kids, is how I met your mother",31799,fqr6qd,https://gfycat.com/smallverifiablebluebottle,400,1585425248.0,MyNameGifOreilly,0.88,/r/wholesomegifs/comments/fqr6qd/and_that_kids_is_how_i_met_your_mother/,wholesomegifs,1015626,MyNameGifOreilly
The Queen seeing cows...,31750,82he13,https://gfycat.com/DimpledShrillCanadagoose,471,1520361407.0,albo_underhill,0.93,/r/wholesomegifs/comments/82he13/the_queen_seeing_cows/,wholesomegifs,1015626,albo_underhill
Grandma and Granddaughter dance,31690,pmvcxl,https://v.redd.it/6l0n08aag3n71,144,1631462417.0,Tunexux,0.95,/r/wholesomegifs/comments/pmvcxl/grandma_and_granddaughter_dance/,wholesomegifs,1015626,Tunexux
This girl has the sweetest reaction to her mother’s prank.,31444,7fuhmd,https://i.imgur.com/NMjYFTF.gifv,782,1511781262.0,attheisstt,0.86,/r/wholesomegifs/comments/7fuhmd/this_girl_has_the_sweetest_reaction_to_her/,wholesomegifs,1015626,attheisstt
Judge dismisses ticket,31340,6z282z,http://i.imgur.com/qVEALFv.gifv,641,1504970252.0,Sumit316,0.86,/r/wholesomegifs/comments/6z282z/judge_dismisses_ticket/,wholesomegifs,1015626,Sumit316
When dad is in charge of bath time!,30815,cp38qv,https://gfycat.com/adolescentpoliticalchafer,365,1565561611.0,sezar4321,0.95,/r/wholesomegifs/comments/cp38qv/when_dad_is_in_charge_of_bath_time/,wholesomegifs,1015626,sezar4321
K-5 principal going down the water slide in a suit in tie after the kids surpassed their reading goal last year.,30677,gybwk9,https://i.imgur.com/7W4dySm.gifv,199,1591534713.0,AmerBekic,0.96,/r/wholesomegifs/comments/gybwk9/k5_principal_going_down_the_water_slide_in_a_suit/,wholesomegifs,1015626,AmerBekic
To protect and get served.,30439,fpu2ls,http://i.imgur.com/6jg1rBP.gifv,566,1585301752.0,deathakissaway,0.92,/r/wholesomegifs/comments/fpu2ls/to_protect_and_get_served/,wholesomegifs,1015626,deathakissaway
All you got to do is dance,30363,e75chq,https://i.imgur.com/WmCvyKZ.gifv,381,1575669932.0,MyNameGifOreilly,0.96,/r/wholesomegifs/comments/e75chq/all_you_got_to_do_is_dance/,wholesomegifs,1015626,MyNameGifOreilly
"A son made a photo album of his dad and him over time. The last picture was a picture of a tuxedo saying ""Dad, will you be my best man?"" [x-post r/wholesomememes]",30288,8cesch,https://imgur.com/KaeqfdJ.gifv,393,1523794818.0,bobcobble,0.91,/r/wholesomegifs/comments/8cesch/a_son_made_a_photo_album_of_his_dad_and_him_over/,wholesomegifs,1015626,bobcobble
Afghan Boy dancing after receiving a prosthetic leg,30065,gavqkk,http://gfycat.com/smartfailingbull,489,1588253585.0,tw272727,0.95,/r/wholesomegifs/comments/gavqkk/afghan_boy_dancing_after_receiving_a_prosthetic/,wholesomegifs,1015626,tw272727
Friendliest goodest girl,29684,tpiuys,https://i.imgur.com/JiUowEq.gifv,132,1648383875.0,Aztery,0.96,/r/wholesomegifs/comments/tpiuys/friendliest_goodest_girl/,wholesomegifs,1015626,Aztery
The most wholesome good boy greet,29503,86th7d,https://imgur.com/8Ju3Yir.gifv,265,1521903031.0,GallowBoob,0.85,/r/wholesomegifs/comments/86th7d/the_most_wholesome_good_boy_greet/,wholesomegifs,1015626,GallowBoob
This is some next level cuteness...,29217,cwurg6,https://i.imgur.com/b5jVdEx.gifv,365,1567045710.0,Adit12T,0.88,/r/wholesomegifs/comments/cwurg6/this_is_some_next_level_cuteness/,wholesomegifs,1015626,Adit12T
"Doggo met gopher in Golden Gate Park, San Francisco",29089,jlemtn,https://v.redd.it/drnoy5je0ew51,264,1604131444.0,taperrain,0.96,/r/wholesomegifs/comments/jlemtn/doggo_met_gopher_in_golden_gate_park_san_francisco/,wholesomegifs,1015626,taperrain
"Ok cat, have it your way.",28863,qvbngw,https://v.redd.it/9rt38o72izz71,209,1637080138.0,Tunexux,0.96,/r/wholesomegifs/comments/qvbngw/ok_cat_have_it_your_way/,wholesomegifs,1015626,Tunexux
Look how happy she gets,28268,ra5wia,https://v.redd.it/aax4994kyw381,248,1638792800.0,Gastonbeast24,0.93,/r/wholesomegifs/comments/ra5wia/look_how_happy_she_gets/,wholesomegifs,1015626,Gastonbeast24
"How to pet a dog, Thanks wikihow",27738,c7f9k2,https://gfycat.com/bossyicyindianpalmsquirrel,174,1561906510.0,sezar4321,0.95,/r/wholesomegifs/comments/c7f9k2/how_to_pet_a_dog_thanks_wikihow/,wholesomegifs,1015626,sezar4321
"She was called to the animal clinic to see if a dog they found was hers, safe to say it was.",27638,zeluec,https://i.imgur.com/IvEOgfM.gifv,248,1670369611.0,St0pX,0.96,/r/wholesomegifs/comments/zeluec/she_was_called_to_the_animal_clinic_to_see_if_a/,wholesomegifs,1015626,St0pX
The look of amazement.,27307,6thugm,https://i.imgur.com/6DF4sHS.gifv,423,1502659158.0,deathakissaway,0.93,/r/wholesomegifs/comments/6thugm/the_look_of_amazement/,wholesomegifs,1015626,deathakissaway
Big sweetheart just wants to be cuddled,26995,gtcnem,https://i.imgur.com/bgCuMfZ.gifv,658,1590837324.0,lnfinity,0.96,/r/wholesomegifs/comments/gtcnem/big_sweetheart_just_wants_to_be_cuddled/,wholesomegifs,1015626,lnfinity
This runner makes happiness with simplest things...,26971,cq2hx2,https://i.imgur.com/n174RuD.gifv,261,1565744930.0,Adit12T,0.96,/r/wholesomegifs/comments/cq2hx2/this_runner_makes_happiness_with_simplest_things/,wholesomegifs,1015626,Adit12T
Rescue dog can thrive thanks to her four prosthetic limbs,26699,cyywhg,https://gfycat.com/terrificcoldbobcat,240,1567478187.0,commonvanilla,0.97,/r/wholesomegifs/comments/cyywhg/rescue_dog_can_thrive_thanks_to_her_four/,wholesomegifs,1015626,commonvanilla
99-year-old ex Marine walks 6 miles each day to visit wife in hospital,26532,9c5yha,https://i.imgur.com/g6NtSFY.gifv,551,1535831154.0,Journey_951,0.91,/r/wholesomegifs/comments/9c5yha/99yearold_ex_marine_walks_6_miles_each_day_to/,wholesomegifs,1015626,Journey_951
Members of the Harlem Globetrotters show a kid how easy it is to spin a basketball on your finger,26303,78v550,https://gfycat.com/SpeedyWavyDarklingbeetle,347,1509020098.0,SlimJones123,0.92,/r/wholesomegifs/comments/78v550/members_of_the_harlem_globetrotters_show_a_kid/,wholesomegifs,1015626,SlimJones123
Boy Is Surprised To See His Lost Dog Who Was Gone for 2 Weeks When His Parents Pick Him Up From School,26165,ebo2xc,https://gfycat.com/gloomyweeklyauklet,320,1576543294.0,Thund3rbolt,0.95,/r/wholesomegifs/comments/ebo2xc/boy_is_surprised_to_see_his_lost_dog_who_was_gone/,wholesomegifs,1015626,Thund3rbolt
"First place runner collapses just 50m shy of the finish line, helped across by second place runner",25800,8l29mr,http://i.imgur.com/vXzlqZq.gifv,631,1526921213.0,Sumit316,0.94,/r/wholesomegifs/comments/8l29mr/first_place_runner_collapses_just_50m_shy_of_the/,wholesomegifs,1015626,Sumit316
Local middle school principal gives a high five to every student at the start of the day.,25747,8de1rq,https://i.imgur.com/gLhfkLJ.gifv,536,1524138664.0,Tucko29,0.92,/r/wholesomegifs/comments/8de1rq/local_middle_school_principal_gives_a_high_five/,wholesomegifs,1015626,Tucko29
The best welcome home,25654,dtrhgu,https://i.imgur.com/9ojF3dD.gifv,160,1573275237.0,Whoshabooboo,0.95,/r/wholesomegifs/comments/dtrhgu/the_best_welcome_home/,wholesomegifs,1015626,Whoshabooboo
That's a kid that was raised right.,25543,mybjn9,https://i.imgur.com/skjWWW4.gifv,109,1619367414.0,Scaulbylausis,0.94,/r/wholesomegifs/comments/mybjn9/thats_a_kid_that_was_raised_right/,wholesomegifs,1015626,Scaulbylausis
Salma Hayek photobombed by Samuel L. Jackson,25538,bkxh9x,https://i.imgur.com/Ta4P8oU.gifv,242,1557061419.0,Sumit316,0.94,/r/wholesomegifs/comments/bkxh9x/salma_hayek_photobombed_by_samuel_l_jackson/,wholesomegifs,1015626,Sumit316
Man reunited with the officer that saved him from drowning as a child,24718,9kh93r,https://imgur.com/TIOE2YI.gifv,390,1538407264.0,GallowBoob,0.87,/r/wholesomegifs/comments/9kh93r/man_reunited_with_the_officer_that_saved_him_from/,wholesomegifs,1015626,GallowBoob
Father and daughter unarmed combat,24335,dd7e7y,http://i.redd.it/r324sndt4g911.gif,299,1570195831.0,tw272727,0.94,/r/wholesomegifs/comments/dd7e7y/father_and_daughter_unarmed_combat/,wholesomegifs,1015626,tw272727
Sunshine on a rainy day,24142,c5ekes,https://i.imgur.com/H1tAJHK.gifv,497,1561494045.0,aloofloofah,0.95,/r/wholesomegifs/comments/c5ekes/sunshine_on_a_rainy_day/,wholesomegifs,1015626,aloofloofah
Marine Vet Grandfather's first salute to Marine Granddaughter.,23631,cbg8zb,https://gfycat.com/realwaterloggedalligator,350,1562762617.0,Sumit316,0.93,/r/wholesomegifs/comments/cbg8zb/marine_vet_grandfathers_first_salute_to_marine/,wholesomegifs,1015626,Sumit316
Happy when you’re close to me,23577,irqi2m,https://i.imgur.com/pRep1Su.gifv,126,1599966061.0,memezzer,0.95,/r/wholesomegifs/comments/irqi2m/happy_when_youre_close_to_me/,wholesomegifs,1015626,memezzer
"You might call him crazy, I'd call him a hero x 2",23536,7shobv,https://i.imgur.com/uFWyKDh.gifv,537,1516741194.0,albo_underhill,0.94,/r/wholesomegifs/comments/7shobv/you_might_call_him_crazy_id_call_him_a_hero_x_2/,wholesomegifs,1015626,albo_underhill
A dream come true.,23472,d167po,https://v.redd.it/t770zceymal31,237,1567915089.0,yomamascub,0.95,/r/wholesomegifs/comments/d167po/a_dream_come_true/,wholesomegifs,1015626,yomamascub
"Father receives a gift from his adopted daughter for his birthday, when she surprises him by changing her last name to his.",23381,80bgfe,https://i.imgur.com/TyrCvLb.gifv,383,1519632610.0,Pirate_Redbeard,0.91,/r/wholesomegifs/comments/80bgfe/father_receives_a_gift_from_his_adopted_daughter/,wholesomegifs,1015626,Pirate_Redbeard
Makes work that much better,23334,ji9adh,https://v.redd.it/m2ew3etlpdv51,284,1603691841.0,Palifaith,0.95,/r/wholesomegifs/comments/ji9adh/makes_work_that_much_better/,wholesomegifs,1015626,Palifaith
Dog returns after being lost for eight months...,23311,7z7pyz,https://i.imgur.com/VOKR95X.gifv,372,1519237180.0,albo_underhill,0.94,/r/wholesomegifs/comments/7z7pyz/dog_returns_after_being_lost_for_eight_months/,wholesomegifs,1015626,albo_underhill
"8-year-old girl learned sign so she could tell their package delivery man ""Thank you""",23262,yrnux3,https://i.imgur.com/z5dWmnS.gifv,118,1668105597.0,St0pX,0.95,/r/wholesomegifs/comments/yrnux3/8yearold_girl_learned_sign_so_she_could_tell/,wholesomegifs,1015626,St0pX
Honoring a legend when you have nothing to lose,23076,dv4xck,https://i.imgur.com/ylUB7tN.gifv,291,1573533263.0,Whoshabooboo,0.96,/r/wholesomegifs/comments/dv4xck/honoring_a_legend_when_you_have_nothing_to_lose/,wholesomegifs,1015626,Whoshabooboo
Dad builds Ninja Warrior course for his daughter,22939,71jhxt,http://i.imgur.com/6QUPtzn.gifv,586,1506004296.0,Sumit316,0.87,/r/wholesomegifs/comments/71jhxt/dad_builds_ninja_warrior_course_for_his_daughter/,wholesomegifs,1015626,Sumit316
"UPS driver gets photos with the dogs where he makes his deliveries and he shares them, chronicling the dogs of New Orleans.",22921,de25en,https://gfycat.com/giantflamboyanthawk,180,1570362073.0,sezar4321,0.94,/r/wholesomegifs/comments/de25en/ups_driver_gets_photos_with_the_dogs_where_he/,wholesomegifs,1015626,sezar4321
Cassandra Bergeron transported 27 dogs from Alabama to Orlando on a flight that likely saved them from euthanization.,22835,q6tl6k,https://v.redd.it/lbfr2d7kk2t71,488,1634066527.0,Tunexux,0.91,/r/wholesomegifs/comments/q6tl6k/cassandra_bergeron_transported_27_dogs_from/,wholesomegifs,1015626,Tunexux
The best way to prep for final exams,22813,d9dh8y,https://gfycat.com/tepidoffbeatamazontreeboa,98,1569465156.0,to_the_tenth_power,0.97,/r/wholesomegifs/comments/d9dh8y/the_best_way_to_prep_for_final_exams/,wholesomegifs,1015626,to_the_tenth_power
"Just two guys, shooting some hoops",22594,c8zerx,https://i.imgur.com/p8UTqM8.gifv,234,1562223187.0,Pirate_Redbeard,0.96,/r/wholesomegifs/comments/c8zerx/just_two_guys_shooting_some_hoops/,wholesomegifs,1015626,Pirate_Redbeard
64 yr old mom breaking deadlift world record in her division.,22579,84ee4h,https://i.imgur.com/fBL8ADu.gifv,532,1521042493.0,GallowBoob,0.88,/r/wholesomegifs/comments/84ee4h/64_yr_old_mom_breaking_deadlift_world_record_in/,wholesomegifs,1015626,GallowBoob
Enjoy life,22537,hl3112,https://v.redd.it/qf5ubb38au851,116,1593868010.0,yomamascub,0.97,/r/wholesomegifs/comments/hl3112/enjoy_life/,wholesomegifs,1015626,yomamascub
This little girl using the force after meeting some Star Wars actors,22531,eeh0pg,https://i.imgur.com/Kj9vJ3C.gifv,233,1577083935.0,Thund3rbolt,0.95,/r/wholesomegifs/comments/eeh0pg/this_little_girl_using_the_force_after_meeting/,wholesomegifs,1015626,Thund3rbolt
Granddads show the best affection,22452,clvdru,https://gfycat.com/thunderoushandycony,269,1564918600.0,sezar4321,0.96,/r/wholesomegifs/comments/clvdru/granddads_show_the_best_affection/,wholesomegifs,1015626,sezar4321
I can play too,22282,7ajqib,http://i.imgur.com/LNhnrPX.gifv,189,1509719423.0,Sumit316,0.9,/r/wholesomegifs/comments/7ajqib/i_can_play_too/,wholesomegifs,1015626,Sumit316
A soldier's worry her beloved dog wouldn't remember her while she was deployed in Africa quickly dissolved by the pup's unbelievably excited reaction.,21998,a1gn6x,https://gfycat.com/BriefWarmBlackfly,356,1543491912.0,GallowBoob,0.86,/r/wholesomegifs/comments/a1gn6x/a_soldiers_worry_her_beloved_dog_wouldnt_remember/,wholesomegifs,1015626,GallowBoob
5 year-old Ari Schultz has had 3 open-heart surgeries. This is his reaction when he finds out he's going home from the hospital,21960,6hswzm,http://i.imgur.com/wGi0TrA.gifv,539,1497698649.0,GallowBoob,0.85,/r/wholesomegifs/comments/6hswzm/5_yearold_ari_schultz_has_had_3_openheart/,wholesomegifs,1015626,GallowBoob
Good boi needed a time out after barking in the store,21867,pkzqm9,https://v.redd.it/a7r5670guhm71,312,1631200402.0,Tunexux,0.94,/r/wholesomegifs/comments/pkzqm9/good_boi_needed_a_time_out_after_barking_in_the/,wholesomegifs,1015626,Tunexux
That's good. That's damn good.,21824,p0lvh4,https://v.redd.it/eq6yu3zgx6g71,93,1628453181.0,Tunexux,0.94,/r/wholesomegifs/comments/p0lvh4/thats_good_thats_damn_good/,wholesomegifs,1015626,Tunexux
Thor is such a goofy dad,21631,82re1d,https://i.imgur.com/CRVYJ0e.gifv,451,1520453673.0,GallowBoob,0.87,/r/wholesomegifs/comments/82re1d/thor_is_such_a_goofy_dad/,wholesomegifs,1015626,GallowBoob
Rescuing a stray pup,21566,84x7h7,https://i.imgur.com/XljBlKm.gifv,206,1521221511.0,Sumit316,0.94,/r/wholesomegifs/comments/84x7h7/rescuing_a_stray_pup/,wholesomegifs,1015626,Sumit316
"She strayed into his life, knowing he was the one. He took her home.",21486,h03b0i,https://i.imgur.com/KJyUgrP.gifv,231,1591761542.0,SFinTX,0.96,/r/wholesomegifs/comments/h03b0i/she_strayed_into_his_life_knowing_he_was_the_one/,wholesomegifs,1015626,SFinTX
US soldiers in Vietnam hear the radio report that they're going home,21427,6ew8lk,https://gfycat.com/SelfassuredBabyishAttwatersprairiechicken,664,1496428457.0,KevlarYarmulke,0.94,/r/wholesomegifs/comments/6ew8lk/us_soldiers_in_vietnam_hear_the_radio_report_that/,wholesomegifs,1015626,KevlarYarmulke
Girl With Muscular Dystrophy Makes Amazing Paintings,21379,qgcky5,https://v.redd.it/979nwebe6uv71,154,1635272255.0,Tunexux,0.93,/r/wholesomegifs/comments/qgcky5/girl_with_muscular_dystrophy_makes_amazing/,wholesomegifs,1015626,Tunexux
Sister Mary Jo has skills,21239,eqy0s9,https://v.redd.it/o7rrnxr6drb41,127,1579449679.0,yomamascub,0.96,/r/wholesomegifs/comments/eqy0s9/sister_mary_jo_has_skills/,wholesomegifs,1015626,yomamascub
Bob Ross Approved,21059,g3jk12,http://i.imgur.com/oQvGVqO.gifv,298,1587194756.0,deathakissaway,0.94,/r/wholesomegifs/comments/g3jk12/bob_ross_approved/,wholesomegifs,1015626,deathakissaway
I'm glad he found his forever home,21011,imaocz,https://i.imgur.com/eCa4n72.gifv,230,1599199608.0,AmerBekic,0.96,/r/wholesomegifs/comments/imaocz/im_glad_he_found_his_forever_home/,wholesomegifs,1015626,AmerBekic
Mohammed Ali the greatest!,20829,dw8nr8,https://gfycat.com/flawedwildguineapig,247,1573733369.0,sezar4321,0.95,/r/wholesomegifs/comments/dw8nr8/mohammed_ali_the_greatest/,wholesomegifs,1015626,sezar4321
Childhood excitement for snow,20593,mii8sf,https://i.imgur.com/0XEF9EH.gifv,172,1617362219.0,aloofloofah,0.97,/r/wholesomegifs/comments/mii8sf/childhood_excitement_for_snow/,wholesomegifs,1015626,aloofloofah
Class takes a wholesome field trip to witness a classmates adoption,20581,e7f2ta,https://i.imgur.com/V2f033Q.gifv,161,1575729866.0,St0pX,0.93,/r/wholesomegifs/comments/e7f2ta/class_takes_a_wholesome_field_trip_to_witness_a/,wholesomegifs,1015626,St0pX
Did we just become best friends?,20417,6xrac4,http://i.imgur.com/VWhstfC.gifv,183,1504413878.0,Whoshabooboo,0.93,/r/wholesomegifs/comments/6xrac4/did_we_just_become_best_friends/,wholesomegifs,1015626,Whoshabooboo
Must protect.,20308,cd57oe,https://gfycat.com/idealisticvapidhorsechestnutleafminer,235,1563123094.0,Master1718,0.96,/r/wholesomegifs/comments/cd57oe/must_protect/,wholesomegifs,1015626,Master1718
Officer helps save baby ducklings as their mother anxiously waits.,20057,7n0j0p,https://i.imgur.com/so5e2nu.gifv,384,1514622343.0,deathakissaway,0.91,/r/wholesomegifs/comments/7n0j0p/officer_helps_save_baby_ducklings_as_their_mother/,wholesomegifs,1015626,deathakissaway
"Clyde, a husky with cerebellar hypoplasia is super happy when he has his leg braces on",19913,e4ru05,https://gfycat.com/determinedexaltedcottontail,110,1575252138.0,commonvanilla,0.97,/r/wholesomegifs/comments/e4ru05/clyde_a_husky_with_cerebellar_hypoplasia_is_super/,wholesomegifs,1015626,commonvanilla
Right on target,19698,eijdhr,https://i.redd.it/qfp7s6ul06841.gif,88,1577892017.0,Sumit316,0.95,/r/wholesomegifs/comments/eijdhr/right_on_target/,wholesomegifs,1015626,Sumit316
Greeting a dog.,19679,cs8tvh,https://gfycat.com/impureexcitableconure,106,1566170826.0,Master1718,0.97,/r/wholesomegifs/comments/cs8tvh/greeting_a_dog/,wholesomegifs,1015626,Master1718
Where dreams come true,19503,prjcdm,https://v.redd.it/rntxwkb0sjo71,214,1632095454.0,Tunexux,0.94,/r/wholesomegifs/comments/prjcdm/where_dreams_come_true/,wholesomegifs,1015626,Tunexux
"""Where's that smile?""",19485,6dnnb4,http://i.imgur.com/ogMfiNi.gifv,101,1495891144.0,GallowBoob,0.88,/r/wholesomegifs/comments/6dnnb4/wheres_that_smile/,wholesomegifs,1015626,GallowBoob
What Did you Do When they Came For The Dads??,19464,dbrv7b,https://gfycat.com/delayedpoisedgalapagoshawk,105,1569928575.0,sezar4321,0.95,/r/wholesomegifs/comments/dbrv7b/what_did_you_do_when_they_came_for_the_dads/,wholesomegifs,1015626,sezar4321
A stranger is a friend you just haven't met yet...,19410,7e0jgn,https://v.redd.it/wg0lga5anxyz,246,1511097721.0,albo_underhill,0.92,/r/wholesomegifs/comments/7e0jgn/a_stranger_is_a_friend_you_just_havent_met_yet/,wholesomegifs,1015626,albo_underhill
This young man has cerebral palsy. He took his first steps today without his cane as classmates cheered him on.,19385,f5h64s,https://gfycat.com/variablehelpfuladouri,173,1581979242.0,Thund3rbolt,0.95,/r/wholesomegifs/comments/f5h64s/this_young_man_has_cerebral_palsy_he_took_his/,wholesomegifs,1015626,Thund3rbolt
What in the world are you,19314,fy2gdw,https://gfycat.com/generalbogusboubou,197,1586472494.0,tobago_88,0.97,/r/wholesomegifs/comments/fy2gdw/what_in_the_world_are_you/,wholesomegifs,1015626,tobago_88
Courage isn't the absence of fear; it's being afraid and still pushing through.,19243,9ckm76,https://i.imgur.com/RfkYeS3.gifv,344,1535973021.0,Journey_951,0.94,/r/wholesomegifs/comments/9ckm76/courage_isnt_the_absence_of_fear_its_being_afraid/,wholesomegifs,1015626,Journey_951
Sir Patrick Stewart enjoying a Cornetto.,19140,7jjfhl,https://i.imgur.com/MTVXmjG.gifv,422,1513173920.0,albo_underhill,0.89,/r/wholesomegifs/comments/7jjfhl/sir_patrick_stewart_enjoying_a_cornetto/,wholesomegifs,1015626,albo_underhill
Coach tells walk-on kicker that he’ll get a full ride if he nails a 53-yard field Goal,18780,7s62t7,http://i.imgur.com/dqnGm0f.gifv,797,1516631274.0,Sumit316,0.89,/r/wholesomegifs/comments/7s62t7/coach_tells_walkon_kicker_that_hell_get_a_full/,wholesomegifs,1015626,Sumit316
Heartwarming letter from Santa.,18706,799txt,https://i.imgur.com/tKQtNjX.gifv,301,1509193519.0,attheisstt,0.89,/r/wholesomegifs/comments/799txt/heartwarming_letter_from_santa/,wholesomegifs,1015626,attheisstt
The Weather Man,18670,6e1hpr,http://i.imgur.com/kWYuWj4.gifv,145,1496077912.0,GallowBoob,0.81,/r/wholesomegifs/comments/6e1hpr/the_weather_man/,wholesomegifs,1015626,GallowBoob
This little dude is my hero!,18528,dqaeo9,https://gfycat.com/dapperheavenlyanteater,179,1572642394.0,sezar4321,0.97,/r/wholesomegifs/comments/dqaeo9/this_little_dude_is_my_hero/,wholesomegifs,1015626,sezar4321
"This guy had trouble with the stairs, so his owner made a doggie elevator.",18343,7rpuxn,https://i.imgur.com/YK8Q09n.gifv,155,1516447128.0,deathakissaway,0.94,/r/wholesomegifs/comments/7rpuxn/this_guy_had_trouble_with_the_stairs_so_his_owner/,wholesomegifs,1015626,deathakissaway
The best ring bearer,18336,pvdwvr,https://v.redd.it/ebtg8thtbpp71,147,1632598566.0,Tunexux,0.95,/r/wholesomegifs/comments/pvdwvr/the_best_ring_bearer/,wholesomegifs,1015626,Tunexux
