title,score,id,url,num_comments,created,author,upvote_ratio,permalink,subreddit,subreddit_subscribers,depth
This man jogged 2 miles through his neighborhood carrying a TV in his hands to prove that “looking like a suspect” who committed a robbery isn’t a good enough excuse for the murder of Ahmaud Arbery. Neighbors waived hello to him as he jogged.,259575,gh5c5i,https://v.redd.it/hxxifx1a0zx41,10424,1589130820.0,GallowBoob,0.95,/r/nextfuckinglevel/comments/gh5c5i/this_man_jogged_2_miles_through_his_neighborhood/,nextfuckinglevel,7785629,2
"There are massive floods in southeast Mexico right now. These guys in a boat found a good boy who was cold, frightened, and clinging to a wall. Heroes...",222475,juqm4s,https://v.redd.it/fil7foka5gz51,1883,1605464746.0,m3antar,0.97,/r/nextfuckinglevel/comments/juqm4s/there_are_massive_floods_in_southeast_mexico/,nextfuckinglevel,7785629,2
Gotta love The Rock. Fathers will do anything to help each other out!,222330,lu42yh,https://v.redd.it/u849fwmwy4k61,2108,1614482218.0,NRGpop,0.97,/r/nextfuckinglevel/comments/lu42yh/gotta_love_the_rock_fathers_will_do_anything_to/,nextfuckinglevel,7785629,2
One minute standing applause in the European Parliament when President Zelensky joined over video link,204180,t46o18,https://v.redd.it/icqdpgxykrk81,4020,1646137115.0,-martinique-,0.87,/r/nextfuckinglevel/comments/t46o18/one_minute_standing_applause_in_the_european/,nextfuckinglevel,7785629,2
Big skate dude teaches little skate dude,199601,iqwar1,https://v.redd.it/bhcq7kwrakm51,2727,1599848971.0,1q8b,0.97,/r/nextfuckinglevel/comments/iqwar1/big_skate_dude_teaches_little_skate_dude/,nextfuckinglevel,7785629,2
Anonymous message to Vladimir Putin.,197706,t1mmnf,https://v.redd.it/cikqri35i3k81,6519,1645845515.0,lonely_fucker69,0.88,/r/nextfuckinglevel/comments/t1mmnf/anonymous_message_to_vladimir_putin/,nextfuckinglevel,7785629,2
"Anthony Borges who used his body to hold his class door shut from a gunman, protecting his 20 classmates whilst being shot through the door five times. Fortunately he survived and has made a complete recovery.",189466,j5hh6l,https://i.redd.it/qcxln28ce9r51.jpg,3964,1601896204.0,Currynrice9728,0.97,/r/nextfuckinglevel/comments/j5hh6l/anthony_borges_who_used_his_body_to_hold_his/,nextfuckinglevel,7785629,2
"25 yo pizza delivery man runs into burning house, saves four children who tell him another might be in the house. He goes back in, finds the girl, jumps out a window with her, and carries her to a cop who captures the moment on his bodycam",183915,w2jy4k,https://v.redd.it/4gwzapvofgc91,6863,1658205871.0,habichuelacondulce,0.95,/r/nextfuckinglevel/comments/w2jy4k/25_yo_pizza_delivery_man_runs_into_burning_house/,nextfuckinglevel,7785629,2
Gary Webb - A man who stood for truth and transparency,182067,jnzc16,https://i.redd.it/ins1prnhy8x51.jpg,2961,1604506025.0,NewCarthagea,0.94,/r/nextfuckinglevel/comments/jnzc16/gary_webb_a_man_who_stood_for_truth_and/,nextfuckinglevel,7785629,2
Russian protestors starting to protect each other from visibly nervous police.,180933,t2q39x,https://v.redd.it/0kxj3eqy4ek81,3952,1645974261.0,-martinique-,0.93,/r/nextfuckinglevel/comments/t2q39x/russian_protestors_starting_to_protect_each_other/,nextfuckinglevel,7785629,2
"This is the most complex origami I have ever done - 2,5 years of designing and 109 hours of folding a single square sheet of paper into dueling knights, without any cutting or tearing.",177374,s8eqv0,https://v.redd.it/g3tzqy3n4tc81,2435,1642669416.0,jkonkkola_art,0.95,/r/nextfuckinglevel/comments/s8eqv0/this_is_the_most_complex_origami_i_have_ever_done/,nextfuckinglevel,7785629,2
"I post my weight loss pics on reddit to motivate others. A few redditors are upset my posts keep hitting front page and send me mean messages/comments. So naturally, I got some of them printed on a shirt to use in my latest post. Don't upvote this, it'll upset them and I'll have to get more shirts.",173005,knz10q,https://i.redd.it/uot3bbgthl861.jpg,4354,1609452075.0,3995346,0.86,/r/nextfuckinglevel/comments/knz10q/i_post_my_weight_loss_pics_on_reddit_to_motivate/,nextfuckinglevel,7785629,2
Smart dog,171599,ixv5qj,https://v.redd.it/bjaq4lp5aro51,2185,1600805188.0,yvesroyce2,0.95,/r/nextfuckinglevel/comments/ixv5qj/smart_dog/,nextfuckinglevel,7785629,2
Not a self-made man,165930,his2li,https://i.imgur.com/U6LJc26.gifv,2296,1593538719.0,d3333p7,0.95,/r/nextfuckinglevel/comments/his2li/not_a_selfmade_man/,nextfuckinglevel,7785629,2
Comedian Josh Johnson,164967,l6w0l3,https://i.redd.it/snrufe8jm2e61.gif,797,1611838905.0,NRGpop,0.92,/r/nextfuckinglevel/comments/l6w0l3/comedian_josh_johnson/,nextfuckinglevel,7785629,2
"Amazon Tribe wins lawsuit, blocks Big Oil’s bid to destroy millions of acres of rainforest",162302,gjsq3s,https://i.redd.it/fyvf88kq3sy41.png,1399,1589483090.0,d3333p7,0.93,/r/nextfuckinglevel/comments/gjsq3s/amazon_tribe_wins_lawsuit_blocks_big_oils_bid_to/,nextfuckinglevel,7785629,2
Women Are Not Allowed To Attend Soccer Matches In Iran. 5 Girls Sneak In Azadi Stadium In Disguise To Celebrate Persepolis Championship In Iran's Persian Gulf Pro League,161283,lbp4my,https://i.redd.it/amsnkpltz9f61.png,4584,1612363793.0,NRGpop,0.92,/r/nextfuckinglevel/comments/lbp4my/women_are_not_allowed_to_attend_soccer_matches_in/,nextfuckinglevel,7785629,2
Her mom COMPLETED CANDY CRUSH???,159686,u5n7js,https://v.redd.it/srzana31e3u81,2655,1650202600.0,Swerwin,0.86,/r/nextfuckinglevel/comments/u5n7js/her_mom_completed_candy_crush/,nextfuckinglevel,7785629,2
Hidilyn Diaz becomes the first ever Olympian to win a gold medal for the Philippines,157116,os5f3h,https://gfycat.com/impossiblefixedharborseal,2192,1627325768.0,AristonD,0.95,/r/nextfuckinglevel/comments/os5f3h/hidilyn_diaz_becomes_the_first_ever_olympian_to/,nextfuckinglevel,7785629,2
Mr. Doodle spent 2 years doodling his entire house,156066,xt9tvf,https://v.redd.it/jbhiaau67ar91,3608,1664668034.0,1q8b,0.91,/r/nextfuckinglevel/comments/xt9tvf/mr_doodle_spent_2_years_doodling_his_entire_house/,nextfuckinglevel,7785628,2
this guy made a very interesting mask,155371,in0dzz,https://v.redd.it/9qe77zj5qbl51,3960,1599309358.0,mymexicanshrek,0.9,/r/nextfuckinglevel/comments/in0dzz/this_guy_made_a_very_interesting_mask/,nextfuckinglevel,7785628,2
Steve Irwin's son is exactly what the world needs right now. His patience is unlimited!,154379,v8hjcn,https://v.redd.it/lmy64y5yql491,1796,1654783364.0,SnooCupcakes8607,0.9,/r/nextfuckinglevel/comments/v8hjcn/steve_irwins_son_is_exactly_what_the_world_needs/,nextfuckinglevel,7785628,2
I spent 300 hours making this Monster Hunter costume!,153993,qtpafl,https://v.redd.it/hdo1wlgq5kz71,2924,1636894648.0,KamuiCosplay,0.87,/r/nextfuckinglevel/comments/qtpafl/i_spent_300_hours_making_this_monster_hunter/,nextfuckinglevel,7785628,2
Utah teen saves choking friend with Heimlich maneuver during school lunch.,152115,jpmv6e,https://v.redd.it/z0z89ndwvrx51,2027,1604735168.0,sarge-m,0.97,/r/nextfuckinglevel/comments/jpmv6e/utah_teen_saves_choking_friend_with_heimlich/,nextfuckinglevel,7785628,2
Fan hits half-court hook shot for $75k and gets tackled by Lebron,151068,v78m1c,https://v.redd.it/x0o2ipofr9491,1480,1654638275.0,SnooCupcakes8607,0.92,/r/nextfuckinglevel/comments/v78m1c/fan_hits_halfcourt_hook_shot_for_75k_and_gets/,nextfuckinglevel,7785628,2
Arnold Schwarznegger’s take on the concept of the self made man,150659,udw042,https://v.redd.it/mqxuqm3x2aw81,2976,1651155301.0,Swerwin,0.88,/r/nextfuckinglevel/comments/udw042/arnold_schwarzneggers_take_on_the_concept_of_the/,nextfuckinglevel,7785628,2
"Guy tried to shoot up a methadone clinic in Buffalo,NY last week, bystander stepped in to save the day",150484,yv6zu4,https://v.redd.it/58egvjzofyz91,6104,1668448257.0,SamMee514,0.94,/r/nextfuckinglevel/comments/yv6zu4/guy_tried_to_shoot_up_a_methadone_clinic_in/,nextfuckinglevel,7785628,2
"A woman battling breast cancer married the love of her life on December 22, just 18 hours before passing away. The couple wed at a hospital chapel in Connecticut.",149402,mc7ohi,https://i.redd.it/s8zl3n91lzo61.png,2605,1616597520.0,NRGpop,0.86,/r/nextfuckinglevel/comments/mc7ohi/a_woman_battling_breast_cancer_married_the_love/,nextfuckinglevel,7785628,2
"New statement of the President of Ukraine: ""When I ran for presidency, I said that each of us is the President. Because we are all responsible for our state. For our beautiful Ukraine. And now it turns out that each of us is a warrior""",149007,t3d2ey,https://v.redd.it/kt9ax4kl2kk81,2262,1646046123.0,berengor_666,0.89,/r/nextfuckinglevel/comments/t3d2ey/new_statement_of_the_president_of_ukraine_when_i/,nextfuckinglevel,7785628,2
"Russian tank runs out of Fuel, gets stuck on Highway. Driver offers to take the soldiers back to russia. Everyone laughs. Driver tells them that Ukraine is winning, russian forces are surrendering and implies they should surrender aswell.",148456,t1shj9,https://v.redd.it/zop7h45955k81,3939,1645865415.0,lonely_fucker69,0.93,/r/nextfuckinglevel/comments/t1shj9/russian_tank_runs_out_of_fuel_gets_stuck_on/,nextfuckinglevel,7785628,2
"The Perfect Soundalike of Donald Trump, Maybe even his lost Twin",147919,sn5x64,https://v.redd.it/otelqlnv7ig81,2780,1644280336.0,NiceCasualRedditGuy,0.87,/r/nextfuckinglevel/comments/sn5x64/the_perfect_soundalike_of_donald_trump_maybe_even/,nextfuckinglevel,7785628,2
Whoever touches the trash can first loses.,147836,ifba0y,https://v.redd.it/fbyt77k6hti51,1328,1598216726.0,Pedrica1,0.95,/r/nextfuckinglevel/comments/ifba0y/whoever_touches_the_trash_can_first_loses/,nextfuckinglevel,7785628,2
For all those people who have never seen a complete rainbow,147654,kxa9sb,https://v.redd.it/labx085z0cb61,2877,1610645379.0,THECUTEKITTYCAT,0.94,/r/nextfuckinglevel/comments/kxa9sb/for_all_those_people_who_have_never_seen_a/,nextfuckinglevel,7785628,2
Here are the women - Senate aides - who had the presence of mind and courage to transport and keep safe the electoral votes before fleeing the Senate. There will always be villains. There will always be heroes.,146763,ksksy4,https://i.redd.it/mqsnrh8aqy961.jpg,1735,1610048160.0,m3antar,0.79,/r/nextfuckinglevel/comments/ksksy4/here_are_the_women_senate_aides_who_had_the/,nextfuckinglevel,7785628,2
I spent 1.5 years working on my light up Demonic Brigitte Cosplay. It includes over 1000 LEDs. Hope you like it!,146014,mzl6nz,https://v.redd.it/ktjtob0uxov61,2222,1619518355.0,KamuiCosplay,0.92,/r/nextfuckinglevel/comments/mzl6nz/i_spent_15_years_working_on_my_light_up_demonic/,nextfuckinglevel,7785628,2
When you have 100% control over bike and no obstacle can stop you.,142955,k40yac,https://v.redd.it/sxwvp9lp0f261,1991,1606758661.0,mohiemen,0.96,/r/nextfuckinglevel/comments/k40yac/when_you_have_100_control_over_bike_and_no/,nextfuckinglevel,7785628,2
Drone captures perfect shot of it's own rescue,142437,p51oel,https://v.redd.it/00kpog245lh71,1431,1629061241.0,solateor,0.91,/r/nextfuckinglevel/comments/p51oel/drone_captures_perfect_shot_of_its_own_rescue/,nextfuckinglevel,7785628,2
NVIDIA just released a new Eye Contact feature that uses AI to make you look into the camera,142325,10im0mx,https://v.redd.it/cot6z1g04mda1,4779,1674400903.0,esberat,0.9,/r/nextfuckinglevel/comments/10im0mx/nvidia_just_released_a_new_eye_contact_feature/,nextfuckinglevel,7785628,2
Why do you lift so much?,142208,rk2ic2,https://v.redd.it/e4q415i7lj681,1731,1639938366.0,SamMee514,0.83,/r/nextfuckinglevel/comments/rk2ic2/why_do_you_lift_so_much/,nextfuckinglevel,7785628,2
This real stunt from 1926,141574,nz180c,https://v.redd.it/qk3bbjqgh2571,1562,1623604915.0,d3333p7,0.93,/r/nextfuckinglevel/comments/nz180c/this_real_stunt_from_1926/,nextfuckinglevel,7785628,2
He took time and effort to cook dinner for the whole town,140540,ikdzho,https://v.redd.it/2dra4urougk51,1864,1598935547.0,memezzer,0.94,/r/nextfuckinglevel/comments/ikdzho/he_took_time_and_effort_to_cook_dinner_for_the/,nextfuckinglevel,7785628,2
50 year old firefighter deadlifts 600 lbs of flaming steel to celebrate his retirement,140185,ibikdr,https://gfycat.com/carefreepreciousearwig,2052,1597685297.0,hriyspungur,0.95,/r/nextfuckinglevel/comments/ibikdr/50_year_old_firefighter_deadlifts_600_lbs_of/,nextfuckinglevel,7785628,2
"Over 2400 CG Artists were given a base animation and challenged to create design art with it around the theme ""Infinite Journeys"". These are just some of the top 100 submissions.",138533,uixr6t,https://v.redd.it/rpwj7nnlvnx81,1310,1651758197.0,Swerwin,0.94,/r/nextfuckinglevel/comments/uixr6t/over_2400_cg_artists_were_given_a_base_animation/,nextfuckinglevel,7785629,2
This guy talking about pushups. Fitness is a journey and we all start somewhere.,137409,na7qfy,https://v.redd.it/cyqtq3ff3ky61,2073,1620767182.0,d3333p7,0.89,/r/nextfuckinglevel/comments/na7qfy/this_guy_talking_about_pushups_fitness_is_a/,nextfuckinglevel,7785629,2
New Zealand Maori leader Rawiri Waititi ejected from parliament for not wearing a necktie said that enforcing a Western dress code was an attempt to suppress indigenous culture.,137362,lgz8sz,https://v.redd.it/hf7pq30cuog61,5841,1612979409.0,mohiemen,0.83,/r/nextfuckinglevel/comments/lgz8sz/new_zealand_maori_leader_rawiri_waititi_ejected/,nextfuckinglevel,7785629,2
"Two weeks ago I posted a video of myself with a walking frame that got a lot of attention,Here’s an update of myself taking unassisted steps for the first time. (OC)",137356,hmg0lg,https://v.redd.it/fuw5xljosa951,1517,1594067957.0,unlikely--hero,0.94,/r/nextfuckinglevel/comments/hmg0lg/two_weeks_ago_i_posted_a_video_of_myself_with_a/,nextfuckinglevel,7785629,2
He saved 22 of his 23 students,137153,i4uqch,https://i.redd.it/jmvy8c1hqef51.jpg,2091,1596730647.0,__Dawn__Amber__,0.95,/r/nextfuckinglevel/comments/i4uqch/he_saved_22_of_his_23_students/,nextfuckinglevel,7785629,2
"Silverback and his son, calmly observe a caterpillar.",136815,l9hcmp,https://v.redd.it/0q343gqqfpe61,1778,1612114907.0,NRGpop,0.91,/r/nextfuckinglevel/comments/l9hcmp/silverback_and_his_son_calmly_observe_a/,nextfuckinglevel,7785629,2
This professor debunks TikToks about ‘psychology’ and we are here for it.,136227,ozskie,https://v.redd.it/85fve1utlxf71,2891,1628340228.0,esberat,0.9,/r/nextfuckinglevel/comments/ozskie/this_professor_debunks_tiktoks_about_psychology/,nextfuckinglevel,7785629,2
These are the type of police that help the world,136003,hlpyd1,https://i.redd.it/hfdmla21l2951.jpg,3163,1593968441.0,lol62056,0.88,/r/nextfuckinglevel/comments/hlpyd1/these_are_the_type_of_police_that_help_the_world/,nextfuckinglevel,7785629,2
Big shoutout to this guy who’s everyone’s DAD,135240,jxc7q5,https://i.redd.it/70ldnkqiq9061.jpg,1077,1605822933.0,memezzer,0.92,/r/nextfuckinglevel/comments/jxc7q5/big_shoutout_to_this_guy_whos_everyones_dad/,nextfuckinglevel,7785629,2
Awesome and simple illusion.,134867,jqg33y,https://v.redd.it/rj7vz35j12y51,1094,1604858097.0,Pedrica1,0.92,/r/nextfuckinglevel/comments/jqg33y/awesome_and_simple_illusion/,nextfuckinglevel,7785629,2
Didn't hesitate for a moment,134569,tbsimf,https://v.redd.it/5sw3e61vvrm81,1785,1647012397.0,Chasith,0.88,/r/nextfuckinglevel/comments/tbsimf/didnt_hesitate_for_a_moment/,nextfuckinglevel,7785629,2
"Japanese Chef cooking Omurice, the world hardest omelette to prepare. (Wait till the end).",134304,si8ujv,https://v.redd.it/mtjzddub1bf81,4860,1643757709.0,UnreadyIce,0.78,/r/nextfuckinglevel/comments/si8ujv/japanese_chef_cooking_omurice_the_world_hardest/,nextfuckinglevel,7785629,2
This is Utah’s first wildlife overpass crossing avoiding danger with vehicles,134080,k0eo8e,https://v.redd.it/0zonwh4de9161,2711,1606254783.0,memezzer,0.95,/r/nextfuckinglevel/comments/k0eo8e/this_is_utahs_first_wildlife_overpass_crossing/,nextfuckinglevel,7785629,2
This guy teaching English and how it is largely spoken in the US to his Chinese student,133869,uls2rz,https://v.redd.it/rmtwcwpojgy81,3724,1652105281.0,Swerwin,0.82,/r/nextfuckinglevel/comments/uls2rz/this_guy_teaching_english_and_how_it_is_largely/,nextfuckinglevel,7785629,2
This woman got married in a hospital hours before she died of cancer,133541,hpyjwf,https://i.redd.it/92k3bmfsrga51.jpg,2077,1594576059.0,lol62056,0.89,/r/nextfuckinglevel/comments/hpyjwf/this_woman_got_married_in_a_hospital_hours_before/,nextfuckinglevel,7785629,2
Guy takes his parrots out to fly around while riding his bike,133068,nxf0ck,https://v.redd.it/09yk4mxxsm471,2639,1623415133.0,AristonD,0.94,/r/nextfuckinglevel/comments/nxf0ck/guy_takes_his_parrots_out_to_fly_around_while/,nextfuckinglevel,7785629,2
She had to make 4 shots to win a car.,132688,lluxtv,https://v.redd.it/jrr3zry9m1i61,2226,1613569932.0,AristonD,0.92,/r/nextfuckinglevel/comments/lluxtv/she_had_to_make_4_shots_to_win_a_car/,nextfuckinglevel,7785629,2
"It took me 50 hours to fold this origami model from a single square piece of paper, without any cutting.",132642,ii2q7g,https://i.redd.it/ot9mawsl2pj51.jpg,1439,1598599673.0,jkonkkola_art,0.95,/r/nextfuckinglevel/comments/ii2q7g/it_took_me_50_hours_to_fold_this_origami_model/,nextfuckinglevel,7785629,2
This dog is a different breed,131706,jkqqwl,https://v.redd.it/471ogxlxz5w51,3014,1604034375.0,yvesroyce2,0.92,/r/nextfuckinglevel/comments/jkqqwl/this_dog_is_a_different_breed/,nextfuckinglevel,7785629,2
"This kid put her helmet on, her puffiest clothes and never gave up trying until she finally managed to slide on the rail with her skateboard",131285,lkgi12,https://v.redd.it/vzptmxa2znh61,1227,1613404798.0,Thund3rbolt,0.91,/r/nextfuckinglevel/comments/lkgi12/this_kid_put_her_helmet_on_her_puffiest_clothes/,nextfuckinglevel,7785629,2
This guy called Guy Fieri officiated 101 gay weddings on a single day.,131046,ip0svj,https://i.redd.it/5t8twph7bzl51.jpg,2458,1599594864.0,NiceCasualRedditGuy,0.86,/r/nextfuckinglevel/comments/ip0svj/this_guy_called_guy_fieri_officiated_101_gay/,nextfuckinglevel,7785629,2
A Gallery Owner was arrested after leaving a 10-Foot Heroin Spoon Sculpture outside OxyContin maker purdue pharma,130200,mstaic,https://i.redd.it/08r1f5j7art61.png,2337,1618675014.0,NRGpop,0.91,/r/nextfuckinglevel/comments/mstaic/a_gallery_owner_was_arrested_after_leaving_a/,nextfuckinglevel,7785629,2
School custodian casually walking through the gym with no one watching but the security camera and making a cool shot look easy,130007,ldgq0m,https://v.redd.it/0boyz58xzpf61,983,1612557668.0,Thund3rbolt,0.95,/r/nextfuckinglevel/comments/ldgq0m/school_custodian_casually_walking_through_the_gym/,nextfuckinglevel,7785629,2
100 drones giving a light show,129324,dbjx48,https://v.redd.it/33ujsp11btp31,2627,1569884492.0,memezzer,0.97,/r/nextfuckinglevel/comments/dbjx48/100_drones_giving_a_light_show/,nextfuckinglevel,7785629,2
"Yoyo champion Hunter Feuerstein demonstrates his ""DNA"" trick",128380,nj8y8h,https://i.imgur.com/zBKYvMK.gifv,1327,1621780404.0,solateor,0.94,/r/nextfuckinglevel/comments/nj8y8h/yoyo_champion_hunter_feuerstein_demonstrates_his/,nextfuckinglevel,7785629,2
How an incident in one person's life can kickstart a worldwide movement,127793,jyv13v,https://i.redd.it/25w9v302es061.jpg,613,1606048795.0,NewCarthagea,0.94,/r/nextfuckinglevel/comments/jyv13v/how_an_incident_in_one_persons_life_can_kickstart/,nextfuckinglevel,7785630,2
sniping someone while using a Recorder as a remote.,127585,xd7joo,https://v.redd.it/utkc7bjsnmn91,1656,1663075581.0,habichuelacondulce,0.92,/r/nextfuckinglevel/comments/xd7joo/sniping_someone_while_using_a_recorder_as_a_remote/,nextfuckinglevel,7785630,2
This gives you an idea how many layers of protection doctors must protect themselves everyday from the corona virus.,127590,fqrvy9,https://v.redd.it/e2hv26qu3hp41,3530,1585427442.0,memezzer,0.93,/r/nextfuckinglevel/comments/fqrvy9/this_gives_you_an_idea_how_many_layers_of/,nextfuckinglevel,7785630,2
"Stuck in a wheel chair his whole life, Micheal was able to start walking again. This is him 1 month after trying.",127529,jjqojf,https://v.redd.it/pv1cngnhzuv51,1632,1603901484.0,NewCarthagea,0.91,/r/nextfuckinglevel/comments/jjqojf/stuck_in_a_wheel_chair_his_whole_life_micheal_was/,nextfuckinglevel,7785630,2
When you hire the one who really knows how to do the job..,127363,ywpudc,https://v.redd.it/176f5mifha0a1,1476,1668594129.0,EvaRaw666,0.95,/r/nextfuckinglevel/comments/ywpudc/when_you_hire_the_one_who_really_knows_how_to_do/,nextfuckinglevel,7785630,2
"""The true meaning of life is to plant trees, under whose shade you do not expect to sit."" - What a legend",126467,mnjknh,https://i.redd.it/8sxhmqrs06s61.png,1539,1617981811.0,NRGpop,0.92,/r/nextfuckinglevel/comments/mnjknh/the_true_meaning_of_life_is_to_plant_trees_under/,nextfuckinglevel,7785630,2
Movie being filmed right in front of this neighborhood,126323,r8s8py,https://v.redd.it/v5wvryl3qj381,3981,1638632532.0,NiceCasualRedditGuy,0.9,/r/nextfuckinglevel/comments/r8s8py/movie_being_filmed_right_in_front_of_this/,nextfuckinglevel,7785630,2
It’s amazing how focused this german shepherd is,126280,yac5cy,https://v.redd.it/qd8qb5z5u9v91,831,1666407051.0,Chasith,0.98,/r/nextfuckinglevel/comments/yac5cy/its_amazing_how_focused_this_german_shepherd_is/,nextfuckinglevel,7785630,2
delivery bike gets boxed in by car,125697,po2m63,https://v.redd.it/75zrt92vygn71,3399,1631625531.0,Sapulinjing,0.86,/r/nextfuckinglevel/comments/po2m63/delivery_bike_gets_boxed_in_by_car/,nextfuckinglevel,7785630,2
This toy soldier cosplay is amazing,125267,ilxeya,https://gfycat.com/gregariousdisastrouscanine,699,1599152444.0,hriyspungur,0.96,/r/nextfuckinglevel/comments/ilxeya/this_toy_soldier_cosplay_is_amazing/,nextfuckinglevel,7785630,2
Nepalese climbers removed 2.2 tons of trash from Everest while the tourists were away,124580,mh6xrd,https://i.redd.it/o68qb30ufdq61.jpg,1945,1617199817.0,d3333p7,0.96,/r/nextfuckinglevel/comments/mh6xrd/nepalese_climbers_removed_22_tons_of_trash_from/,nextfuckinglevel,7785630,2
This very accurate Donald trump copy,124016,jyi4d1,https://v.redd.it/6ebcupjomn061,1682,1605991160.0,NiceCasualRedditGuy,0.88,/r/nextfuckinglevel/comments/jyi4d1/this_very_accurate_donald_trump_copy/,nextfuckinglevel,7785630,2
"The great concept of ""guerilla gardening""",123776,ubvdxv,https://v.redd.it/t84ccgfioqv81,1998,1650920428.0,qasqaldag,0.85,/r/nextfuckinglevel/comments/ubvdxv/the_great_concept_of_guerilla_gardening/,nextfuckinglevel,7785630,2
How to cheer up someone who’s had a rough day,123666,hwl0hu,https://v.redd.it/frforooggnc51,3152,1595528715.0,lol62056,0.85,/r/nextfuckinglevel/comments/hwl0hu/how_to_cheer_up_someone_whos_had_a_rough_day/,nextfuckinglevel,7785630,2
A Minnesota Supporter who was kicked from the match in 2003 returned 12 years later to finish his job,123532,sjz9yp,https://v.redd.it/a5xqxoqbopf81,1226,1643934833.0,UnreadyIce,0.89,/r/nextfuckinglevel/comments/sjz9yp/a_minnesota_supporter_who_was_kicked_from_the/,nextfuckinglevel,7785630,2
Host calls out audience for laughing at male domestic violence victim,123033,nehy8o,https://v.redd.it/jh2jlc0izoz61,2195,1621262248.0,d3333p7,0.89,/r/nextfuckinglevel/comments/nehy8o/host_calls_out_audience_for_laughing_at_male/,nextfuckinglevel,7785630,2
"When Pope Francis visted Japan last year, he was gifted a custom anime robe, which he wore.",122534,jx27c3,https://i.redd.it/b4ez8apa27061.jpg,1420,1605790627.0,Palana,0.91,/r/nextfuckinglevel/comments/jx27c3/when_pope_francis_visted_japan_last_year_he_was/,nextfuckinglevel,7785630,2
This is me taking my first proper steps after being told I would never walk again (OC),122522,hbnlc3,https://v.redd.it/7d7pb7romq551,1531,1592516248.0,unlikely--hero,0.92,/r/nextfuckinglevel/comments/hbnlc3/this_is_me_taking_my_first_proper_steps_after/,nextfuckinglevel,7785630,2
This happened two days ago in the US: students at Kennedy Catholic High School have left their classrooms and are staging a sit-in in their hallways to protest the forced resignation of two LGBT teachers. Strength in numbers.,122016,f6qfs6,https://i.redd.it/p05r1fnfo1i41.jpg,4930,1582189583.0,GallowBoob,0.86,/r/nextfuckinglevel/comments/f6qfs6/this_happened_two_days_ago_in_the_us_students_at/,nextfuckinglevel,7785630,2
"A snapshot of the Russian economy: an investment expert goes live on air and says his current career trajectory is to work as ""Santa Claus"" and then drinks to the death of the stock market (With subtitles)",121727,t5vxi8,https://v.redd.it/93bsrzpo77l81,2521,1646326305.0,m3antar,0.92,/r/nextfuckinglevel/comments/t5vxi8/a_snapshot_of_the_russian_economy_an_investment/,nextfuckinglevel,7785630,2
Dudes trying to re-enact scenes from action film,121305,gyf7qr,https://v.redd.it/3cflsmejji351,1226,1591546607.0,Sapulinjing,0.96,/r/nextfuckinglevel/comments/gyf7qr/dudes_trying_to_reenact_scenes_from_action_film/,nextfuckinglevel,7785630,2
Traffic powered wind turbine,121269,krp1t7,https://v.redd.it/g67hnhn24q961,2200,1609943848.0,Palana,0.91,/r/nextfuckinglevel/comments/krp1t7/traffic_powered_wind_turbine/,nextfuckinglevel,7785630,2
This 70 years old man looks like 30s after 34 years everyday workout,121080,onb9ex,https://v.redd.it/7trzsrp4b5c71,5222,1626690078.0,d3333p7,0.85,/r/nextfuckinglevel/comments/onb9ex/this_70_years_old_man_looks_like_30s_after_34/,nextfuckinglevel,7785630,2
This man is a legend for going this far,121041,ky2103,https://i.redd.it/gxiaf0gstjb61.png,822,1610739486.0,THECUTEKITTYCAT,0.88,/r/nextfuckinglevel/comments/ky2103/this_man_is_a_legend_for_going_this_far/,nextfuckinglevel,7785630,2
books for babies that are on another fucking level..,121002,w4x3ds,https://v.redd.it/x76di4kgq0d91,3005,1658451617.0,EvaRaw666,0.84,/r/nextfuckinglevel/comments/w4x3ds/books_for_babies_that_are_on_another_fucking_level/,nextfuckinglevel,7785630,2
