title,score,id,url,num_comments,created,author,upvote_ratio,permalink,subreddit,subreddit_subscribers,depth
Long exposure streak of this morning's Falcon Heavy launch and twin booster landings at LZ-1 & 2. (Marcus Cote/ Space Coast Times),4787,c545lh,https://i.redd.it/bbt22h17ag631.jpg,131,1561445699.0,marcuscotephoto,0.97,/r/spacex/comments/c545lh/long_exposure_streak_of_this_mornings_falcon/,spacex,1828412,2
SpaceX on Twitter: Falcon 9 first stage has landed on Of Course I Still Love You,4733,4xmxar,https://twitter.com/SpaceX/status/764696864662822912,484,1471152966.0,Zucal,0.9,/r/spacex/comments/4xmxar/spacex_on_twitter_falcon_9_first_stage_has_landed/,spacex,1828412,2
Tonight’s the night. Falcon 9 B1051 ready for a tenth launch.,4726,n82395,https://i.redd.it/9bky5ok9mzx61.jpg,415,1620519268.0,johnpisaniphotos,0.97,/r/spacex/comments/n82395/tonights_the_night_falcon_9_b1051_ready_for_a/,spacex,1828412,2
Falcon 9’s nine Merlin 1D engines propel it and Hispasat 30W-6 from SLC-40 at Cape Canaveral. johnkrausphotos.com / AmericaSpace,4654,82dcu1,https://i.imgur.com/z5wcWf9.jpg,119,1520322456.0,johnkphotos,0.97,/r/spacex/comments/82dcu1/falcon_9s_nine_merlin_1d_engines_propel_it_and/,spacex,1828412,2
Liftoff of CRS-22 and B1067!,4656,ns54lq,https://i.redd.it/ppws2pyj39371.jpg,82,1622813288.0,mdcainjr,0.98,/r/spacex/comments/ns54lq/liftoff_of_crs22_and_b1067/,spacex,1828412,2
Here's a photo from my sound-activated camera that was placed within the launch pad fence at LC-39A. (Marcus Cote/Space Coast Times),4649,8iwbdn,https://i.imgur.com/Td3EYmJ.jpg,124,1526134863.0,marcuscotephoto,0.96,/r/spacex/comments/8iwbdn/heres_a_photo_from_my_soundactivated_camera_that/,spacex,1828412,2
"Super Heavy Booster 4 is hoisted to the pad, SpaceX team for scale.",4634,sm761i,https://i.redd.it/w6q28i4iz9g81.jpg,360,1644180631.0,learntimelapse,0.98,/r/spacex/comments/sm761i/super_heavy_booster_4_is_hoisted_to_the_pad/,spacex,1828412,2
Falcon 9 goes transonic on its way to orbit this morning during SpaceX’s fourth launch of 60 Starlink satellites.,4625,evoxju,https://i.redd.it/me2j6lyhsqd41.jpg,140,1580314392.0,johnkphotos,0.98,/r/spacex/comments/evoxju/falcon_9_goes_transonic_on_its_way_to_orbit_this/,spacex,1828412,2
"A Shortfall of Gravitas, SpaceX’s newest droneship, arrived at Port Canaveral in Florida today.",4579,okxuzd,https://i.redd.it/fvcnak38yeb71.jpg,200,1626370917.0,johnkphotos,0.97,/r/spacex/comments/okxuzd/a_shortfall_of_gravitas_spacexs_newest_droneship/,spacex,1828412,2
r/SpaceX Falcon Heavy Test Flight Official Launch Discussion & Updates Thread,4581,7vg63x,https://www.reddit.com/r/spacex/comments/7vg63x/rspacex_falcon_heavy_test_flight_official_launch/,22396,1517850380.0,ElongatedMuskrat,0.99,/r/spacex/comments/7vg63x/rspacex_falcon_heavy_test_flight_official_launch/,spacex,1828412,2
"""First picture of SpaceX spacesuit. More in days to follow. Worth noting that this actually works (not a mockup). Already tested to double vacuum pressure. Was incredibly hard to balance esthetics and function. Easy to do either separately.""",4555,6vhitq,https://www.instagram.com/p/BYIPmEFAIIn/,828,1503475351.0,jclishman,1.0,/r/spacex/comments/6vhitq/first_picture_of_spacex_spacesuit_more_in_days_to/,spacex,1828412,2
Elon Musk on Twitter: Raptor just achieved power level needed for Starship & Super Heavy,4510,ao1lz5,https://twitter.com/elonmusk/status/1093423297130156033,684,1549527445.0,OccupyMarsNow,0.97,/r/spacex/comments/ao1lz5/elon_musk_on_twitter_raptor_just_achieved_power/,spacex,1828412,2
Falcon 9 soars through the clouds with AMOS-17,4513,cmy5p2,https://i.redd.it/bt13xr8q0xe31.jpg,106,1565135136.0,johnkphotos,0.97,/r/spacex/comments/cmy5p2/falcon_9_soars_through_the_clouds_with_amos17/,spacex,1828412,2
SpaceX Falcon 9 SXM-7 Laser Beam,4505,kchrva,https://i.redd.it/nr0wbdg9i0561.jpg,97,1607890438.0,mdcainjr,0.98,/r/spacex/comments/kchrva/spacex_falcon_9_sxm7_laser_beam/,spacex,1828412,2
Stunning morning over Port Canaveral as Of Course I Still Love You returns with Falcon 9 B1059.1,4487,e7fs0u,https://i.redd.it/ny8y3bn5f8341.jpg,172,1575733538.0,johnkphotos,0.98,/r/spacex/comments/e7fs0u/stunning_morning_over_port_canaveral_as_of_course/,spacex,1828412,2
@SpaceX on Twitter: Docking confirmed – Crew Dragon has arrived at the @space_station!,4482,gu034i,https://twitter.com/SpaceX/status/1267098143805435904,312,1590935351.0,hitura-nobad,0.97,/r/spacex/comments/gu034i/spacex_on_twitter_docking_confirmed_crew_dragon/,spacex,1828412,2
"BREAKING: On May 27, NASA will once again launch American astronauts on American rockets from American soil! With our @SpaceX partners, @Astro_Doug and @AstroBehnken will launch to the @Space_Station on the Crew Dragon spacecraft atop a Falcon 9 rocket. Let's #LaunchAmerica!",4474,g34soh,https://twitter.com/JimBridenstine/status/1251178705633841167,370,1587139339.0,675longtail,0.96,/r/spacex/comments/g34soh/breaking_on_may_27_nasa_will_once_again_launch/,spacex,1828412,2
SpaceX on Twitter: Falcon 9 first stage has landed at LZ-1,4462,4tdhd2,https://twitter.com/SpaceX/status/754901995970973696,353,1468817684.0,Zucal,0.9,/r/spacex/comments/4tdhd2/spacex_on_twitter_falcon_9_first_stage_has_landed/,spacex,1828412,2
SpaceX Falcon 9 Starlink-19 [OC],4445,lkw4xb,https://i.redd.it/rivcq1qcsrh61.jpg,101,1613450895.0,mdcainjr,0.98,/r/spacex/comments/lkw4xb/spacex_falcon_9_starlink19_oc/,spacex,1828412,2
"Sit back, relax, and enjoy the Falcon 9 launch of the first Starlink mission! 🚀💫🛰☂",4441,bsbocc,https://i.redd.it/0hiiqob8o2031.jpg,75,1558665847.0,johnkphotos,0.97,/r/spacex/comments/bsbocc/sit_back_relax_and_enjoy_the_falcon_9_launch_of/,spacex,1828412,2
Stunner of a Falcon 9 launch this evening. Here’s my long exposure photograph of JCSAT-18/Kacific1.,4420,ebnxjp,https://i.redd.it/n1vagli393541.jpg,65,1576542616.0,johnkphotos,0.98,/r/spacex/comments/ebnxjp/stunner_of_a_falcon_9_launch_this_evening_heres/,spacex,1828412,2
Starlink Second Stage looks like an insane comet!,4390,lcg47t,https://i.redd.it/d7dv0t4xugf61.jpg,80,1612446882.0,stevenmadow,0.99,/r/spacex/comments/lcg47t/starlink_second_stage_looks_like_an_insane_comet/,spacex,1828412,2
Falcon 9 putting on a show as it leaves earth behind,4372,nlqfm6,https://i.redd.it/tmvjjkmdwi171.jpg,121,1622060243.0,stevenmadow,0.98,/r/spacex/comments/nlqfm6/falcon_9_putting_on_a_show_as_it_leaves_earth/,spacex,1828412,2
DM2 official SpaceX mission patch!,4364,gnihxt,https://i.redd.it/t3xhrnci5zz41.jpg,208,1590004268.0,launchpins,0.98,/r/spacex/comments/gnihxt/dm2_official_spacex_mission_patch/,spacex,1828412,2
Starship and Falcon 1 at Boca Chica - Mod-Team in Position,4346,daoia1,https://i.redd.it/xgcedsh8mfp31.jpg,211,1569718781.0,ElongatedMuskrat,0.97,/r/spacex/comments/daoia1/starship_and_falcon_1_at_boca_chica_modteam_in/,spacex,1828412,2
There they go! The 5th batch of Starlink satellites have been deployed! View from just south of the Cocoa Beach Pier.,4352,f5b9zh,https://i.redd.it/t9wdfnmvgih41.jpg,212,1581957120.0,Space_Coast_Steve,0.97,/r/spacex/comments/f5b9zh/there_they_go_the_5th_batch_of_starlink/,spacex,1828412,2
CRS-23 taking flight to the ISS,4319,pdryr9,https://i.redd.it/ve8zdj36j9k71.jpg,68,1630227954.0,mdcainjr,0.98,/r/spacex/comments/pdryr9/crs23_taking_flight_to_the_iss/,spacex,1828412,2
The current status of SpaceX's Starship & Superheavy prototypes. 5th March 2021,4308,lycsbr,https://i.redd.it/qhqzi3yrx7l61.jpg,477,1614953969.0,brendan290803,0.97,/r/spacex/comments/lycsbr/the_current_status_of_spacexs_starship_superheavy/,spacex,1828412,2
SpaceX Falcon 9 Starlink-21 long exposure from the press site [OC],4289,m4sqoo,https://i.redd.it/bgskcnlxzym61.jpg,60,1615717430.0,mdcainjr,0.98,/r/spacex/comments/m4sqoo/spacex_falcon_9_starlink21_long_exposure_from_the/,spacex,1828412,2
The Inspiration4 crew watches as Crew-2 launches to the ISS. The next human spaceflight from U.S. soil will be these four launching on Dragon.,4279,mxj6ao,https://i.redd.it/fevz09dl94v61.jpg,181,1619267996.0,johnkphotos,0.99,/r/spacex/comments/mxj6ao/the_inspiration4_crew_watches_as_crew2_launches/,spacex,1828412,2
SpaceX aims for late-December launch of Falcon Heavy,4252,7a4z3a,https://www.nasaspaceflight.com/2017/11/spacex-aims-december-launch-falcon-heavy/,645,1509556169.0,michaelza199,0.95,/r/spacex/comments/7a4z3a/spacex_aims_for_latedecember_launch_of_falcon/,spacex,1828412,2
Sunday Morning with Starlink-13,4240,je20kh,https://i.redd.it/wpptoby532u51.jpg,91,1603115558.0,RigelSirious,0.98,/r/spacex/comments/je20kh/sunday_morning_with_starlink13/,spacex,1828412,2
"Elon Musk on Twitter: Starship test flight rocket just finished assembly at the @SpaceX Texas launch site. This is an actual picture, not a rendering.",4226,aer74n,https://twitter.com/elonmusk/status/1083567087983964160,737,1547177545.0,OccupyMarsNow,0.95,/r/spacex/comments/aer74n/elon_musk_on_twitter_starship_test_flight_rocket/,spacex,1828412,2
Falcon 9 launches GPS III SV04,4207,jou5x3,https://i.redd.it/a38xcyjffix51.jpg,58,1604620632.0,johnkphotos,0.98,/r/spacex/comments/jou5x3/falcon_9_launches_gps_iii_sv04/,spacex,1828412,2
"The first time I've ever felt compelled to name one of my launch photos... Ladies and gents, I give you ""Eye of Elon"" - the nebula/aurora created by the interaction of the CRS-20 1st and 2nd stages during boostback.",4170,ffj5z5,https://i.redd.it/gi4ufobikil41.jpg,146,1583701629.0,spiel2001,0.95,/r/spacex/comments/ffj5z5/the_first_time_ive_ever_felt_compelled_to_name/,spacex,1828412,2
Falcon Flew Over the Moon | Starlink 18,4166,ld7b7w,https://i.redd.it/zkxw6u16xnf61.jpg,47,1612532386.0,johnpisaniphotos,0.99,/r/spacex/comments/ld7b7w/falcon_flew_over_the_moon_starlink_18/,spacex,1828412,2
"SpaceX on Twitter: ""Planning to send Dragon to Mars as soon as 2018. Red Dragons will inform overall Mars architecture, details to come https://t.co/u4nbVUNCpA""",4158,4gp3m0,https://twitter.com/SpaceX/status/725351354537906176,948,1461772256.0,TMahlman,0.93,/r/spacex/comments/4gp3m0/spacex_on_twitter_planning_to_send_dragon_to_mars/,spacex,1828412,2
Today's Starlink launch. That's 7 flights for B1058 in less than a year!,4131,mmbcki,https://i.redd.it/ren5nu0uatr61.jpg,282,1617827756.0,Space_Coast_Steve,0.99,/r/spacex/comments/mmbcki/todays_starlink_launch_thats_7_flights_for_b1058/,spacex,1828412,2
"Elon Musk on Twitter: Grid fin hydraulic pump stalled, so Falcon landed just out to sea. Appears to be undamaged & is transmitting data. Recovery ship dispatched.",4111,a3f4ua,https://twitter.com/elonmusk/status/1070386062164283392,900,1544035062.0,ElongatedMuskrat,0.94,/r/spacex/comments/a3f4ua/elon_musk_on_twitter_grid_fin_hydraulic_pump/,spacex,1828412,2
Beam me up to the Space Station [OC],4109,mxbyt6,https://i.redd.it/kyhz4vkql1v61.jpg,41,1619235760.0,mdcainjr,0.99,/r/spacex/comments/mxbyt6/beam_me_up_to_the_space_station_oc/,spacex,1828412,2
"Boeing Starliner suffers ""off-nominal insertion"", will not visit space station",4076,edavxw,https://starlinerupdates.com/boeing-statement-on-the-starliner-orbital-flight-test/,1300,1576852104.0,rustybeancake,0.96,/r/spacex/comments/edavxw/boeing_starliner_suffers_offnominal_insertion/,spacex,1828412,2
SpaceX launches B1069 and successfully lands for the 100th time!,4036,rlelux,https://i.redd.it/tej1k5u1dw681.jpg,199,1640093017.0,mdcainjr,0.97,/r/spacex/comments/rlelux/spacex_launches_b1069_and_successfully_lands_for/,spacex,1828412,2
Rise and Shine Falcon 9 (Block 5),4008,8ifey8,https://i.redd.it/3kiyu1wej1x01.jpg,189,1525963504.0,TomCross,0.95,/r/spacex/comments/8ifey8/rise_and_shine_falcon_9_block_5/,spacex,1828412,2
"NASA awards SpaceX $53.2 million for a ""large-scale flight demonstration to transfer 10 metric tons of cryogenic propellant between tanks on a Starship vehicle""",4001,jb3fkt,https://www.nasa.gov/directorates/spacetech/solicitations/tipping_points/2020_selections/,484,1602691180.0,675longtail,0.98,/r/spacex/comments/jb3fkt/nasa_awards_spacex_532_million_for_a_largescale/,spacex,1828412,2
Awesome composite photo of Falcon 9 taking off and landing - Spacex Flickr,4001,jys368,https://www.flickr.com/photos/spacex/50631544171/,66,1606032108.0,BeginningResearch,0.99,/r/spacex/comments/jys368/awesome_composite_photo_of_falcon_9_taking_off/,spacex,1828412,2
"Joshua Brost of SpaceX: We’re planning about 30 orbital launches this year, versus 18 last year.",3990,81013m,https://twitter.com/jeff_foust/status/968965070540693505,379,1519855191.0,Zucal,0.95,/r/spacex/comments/81013m/joshua_brost_of_spacex_were_planning_about_30/,spacex,1828412,2
I spotted the Tesla in deep space this morning!,3980,7w9uy2,https://youtu.be/OLLHsstAY44,231,1518138980.0,AstronomyLive,0.96,/r/spacex/comments/7w9uy2/i_spotted_the_tesla_in_deep_space_this_morning/,spacex,1828412,2
"After 25 years, military told to move from “expendable” to “reusable” rockets",3987,92d9dy,https://arstechnica.com/science/2018/07/congress-requires-military-to-consider-reusable-rockets-for-launch-contracts/,236,1532703749.0,TMahlman,0.95,/r/spacex/comments/92d9dy/after_25_years_military_told_to_move_from/,spacex,1828412,2
"Elon on Twitter: “Thrust was low despite being commanded high for reasons unknown at present, hence hard touchdown. We’ve never seen this before. Next time, min two engines all the way to the ground & restart engine 3 if engine 1 or 2 have issues.”",3950,lysun2,https://twitter.com/elonmusk/status/1368016384458858500?s=21,838,1615000692.0,Broccoli32,0.97,/r/spacex/comments/lysun2/elon_on_twitter_thrust_was_low_despite_being/,spacex,1828412,2
Falcon 9 sails into blue skies with 60 more Starlinks,3941,jdgirp,https://i.redd.it/hgysf101xut51.jpg,158,1603028452.0,Space_Coast_Steve,0.97,/r/spacex/comments/jdgirp/falcon_9_sails_into_blue_skies_with_60_more/,spacex,1828412,2
Starlink 4-18 vs. The Sun,3937,usam9i,https://i.redd.it/zik90riyy7091.jpg,103,1652873147.0,stevenmadow,0.96,/r/spacex/comments/usam9i/starlink_418_vs_the_sun/,spacex,1828412,2
New photo of the F9 interstage interior,3900,924sol,https://i.imgur.com/DSS4Pol.jpg,261,1532629477.0,brickmack,0.96,/r/spacex/comments/924sol/new_photo_of_the_f9_interstage_interior/,spacex,1828412,2
Commercial Crew Launches [CG],3871,81si32,https://i.imgur.com/W8NvQH0.jpg,255,1520106706.0,brickmack,0.95,/r/spacex/comments/81si32/commercial_crew_launches_cg/,spacex,1828412,2
Photo-bombing a Falcon's Flame (Feel free to identify the bird for me),3836,dvarjl,https://i.redd.it/ymt6evgql9y31.jpg,288,1573569245.0,Space_Coast_Steve,0.98,/r/spacex/comments/dvarjl/photobombing_a_falcons_flame_feel_free_to/,spacex,1828412,2
Blue Origin New Shepard vs SpaceX Falcon 9 trajectory and engine burns,3828,3xvu9p,http://i.imgur.com/ATkpdAX.png,426,1450820098.0,zlsa,0.94,/r/spacex/comments/3xvu9p/blue_origin_new_shepard_vs_spacex_falcon_9/,spacex,1828412,2
"@SpaceX on Twitter: Standing down from launch today due to unfavorable weather in the flight path. Our next launch opportunity is Saturday, May 30 at 3:22 p.m. EDT, or 19:22 UTC",3818,grrjpf,https://twitter.com/SpaceX/status/1265739654810091520,614,1590611035.0,hitura-nobad,0.96,/r/spacex/comments/grrjpf/spacex_on_twitter_standing_down_from_launch_today/,spacex,1828412,2
"Elon Musk on Twitter: ""SpaceX will prob build 30 to 40 rocket cores for ~300 missions over 5 years. Then BFR takes over & Falcon retires. Goal of BFR is to enable anyone to move to moon, Mars & eventually outer planets.""",3813,8j745j,https://twitter.com/elonmusk/status/995462943079723008,730,1526246731.0,Balance-,0.96,/r/spacex/comments/8j745j/elon_musk_on_twitter_spacex_will_prob_build_30_to/,spacex,1828412,2
Last night’s Falcon Heavy doing its thing.,3815,10dn41y,https://i.redd.it/qxx2o4zcohca1.jpg,83,1673893359.0,stevenmadow,0.97,/r/spacex/comments/10dn41y/last_nights_falcon_heavy_doing_its_thing/,spacex,1828412,2
The first 50 Falcon 9 launches,3779,82kxzt,https://i.redd.it/jmgsqlwn89k01.jpg,187,1520390740.0,ethan829,0.98,/r/spacex/comments/82kxzt/the_first_50_falcon_9_launches/,spacex,1828412,2
Falcon 9 streaks over the Atlantic with 60 more Starlink satellites at 4:28am this morning.,3778,mc99wr,https://i.redd.it/4o6gjfgh00p61.jpg,109,1616601417.0,johnkphotos,0.98,/r/spacex/comments/mc99wr/falcon_9_streaks_over_the_atlantic_with_60_more/,spacex,1828412,2
Falcon 9 Zuma launch composite photo shot by @bassfaceglenn,3758,7q2a44,https://i.redd.it/ye2n5jl7dr901.jpg,133,1515816559.0,bassfaceglenn,0.95,/r/spacex/comments/7q2a44/falcon_9_zuma_launch_composite_photo_shot_by/,spacex,1828412,2
SpaceX on Twitter: Successful deployment of 60 Starlink satellites confirmed!,3747,duumfj,https://twitter.com/SpaceX/status/1193921194707128320,576,1573489189.0,hitura-nobad,0.98,/r/spacex/comments/duumfj/spacex_on_twitter_successful_deployment_of_60/,spacex,1828412,2
Crowds watch from Playalinda Beach as Falcon 9 launches 54 Starlink satellites and two rideshare payloads this evening,3735,ndbk83,https://i.redd.it/w9qz499oedz61.jpg,86,1621122062.0,johnkphotos,0.99,/r/spacex/comments/ndbk83/crowds_watch_from_playalinda_beach_as_falcon_9/,spacex,1828412,2
SpaceX launch from 50 miles away (IG: @stevenmadow),3726,e6lk9j,https://i.redd.it/ony7zxgu1v241.jpg,91,1575571624.0,stevenmadow,0.99,/r/spacex/comments/e6lk9j/spacex_launch_from_50_miles_away_ig_stevenmadow/,spacex,1828412,2
"Long exposure photograph: Falcon 9 launches CRS-17, lands first stage on droneship 12 miles off the coast of Cape Canaveral.",3711,bkijne,https://i.redd.it/xmtvmhz185w21.jpg,122,1556953350.0,johnkphotos,0.97,/r/spacex/comments/bkijne/long_exposure_photograph_falcon_9_launches_crs17/,spacex,1828412,2
[OC] Falcon Heavy vs Saturn V,3709,7nv62d,https://gfycat.com/OffensiveDefenselessGrasshopper,280,1514991811.0,theblackshell,0.97,/r/spacex/comments/7nv62d/oc_falcon_heavy_vs_saturn_v/,spacex,1828412,2
Raptor engine just reached 330 bar chamber pressure without exploding!,3704,ibp3m2,https://twitter.com/elonmusk/status/1295495834998513664,677,1597705325.0,675longtail,0.97,/r/spacex/comments/ibp3m2/raptor_engine_just_reached_330_bar_chamber/,spacex,1828412,2
"Elon on Twitter - ""Starhopper flight successful. Water towers *can* fly haha!!""",3679,chxvy0,https://twitter.com/elonmusk/status/1154599520711266305,478,1564112987.0,jclishman,0.96,/r/spacex/comments/chxvy0/elon_on_twitter_starhopper_flight_successful/,spacex,1828412,2
"SpaceX is the most disruptive company in the world, ranking #1 on CNBC’s 2018 Disruptors Top 50",3660,8l95kr,https://www.cnbc.com/2018/05/22/spacex-leading-the-space-race-to-launch-humans-to-mars.html,397,1526987348.0,thesheetztweetz,0.96,/r/spacex/comments/8l95kr/spacex_is_the_most_disruptive_company_in_the/,spacex,1828412,2
Elon Musk Crashes Westworld Panel at SXSW 2018 (FH Center core crash footage),3660,83iwau,https://www.youtube.com/watch?v=9sc3T8yN4mA,339,1520724451.0,jclishman,0.91,/r/spacex/comments/83iwau/elon_musk_crashes_westworld_panel_at_sxsw_2018_fh/,spacex,1828412,2
"Elon Musk: “SpaceX could do it if need be,” in response to NASA IG report that EVA suits are delayed and will cost over $1 billion",3642,p1rl33,https://twitter.com/elonmusk/status/1425100482779942936?s=21,778,1628609595.0,thesheetztweetz,0.93,/r/spacex/comments/p1rl33/elon_musk_spacex_could_do_it_if_need_be_in/,spacex,1828412,2
SpaceX on Twitter: Falcon Heavy side cores have landed at SpaceX’s Landing Zones 1 and 2.,3639,7vqktb,https://twitter.com/SpaceX/status/960980119312453632,540,1517950956.0,Zucal,0.96,/r/spacex/comments/7vqktb/spacex_on_twitter_falcon_heavy_side_cores_have/,spacex,1828412,2
"10,9,8,7,7,6,5,4,3,2,1..... liftoff",3637,gu5lu5,https://i.redd.it/v051r108n5251.jpg,61,1590954563.0,stevenmadow,0.97,/r/spacex/comments/gu5lu5/109877654321_liftoff/,spacex,1828412,2
Stunning sunrise return of Falcon 9 B1047 and Of Course I Still Love You following the launch of Telstar 19V -- johnkrausphotos.com,3639,91r184,https://i.redd.it/bb9tug3ky2c11.jpg,72,1532518441.0,johnkphotos,0.94,/r/spacex/comments/91r184/stunning_sunrise_return_of_falcon_9_b1047_and_of/,spacex,1828412,2
Elon Musk says SpaceX could face 'genuine risk of bankruptcy' from Starship engine production,3628,r5ccpc,https://spaceexplored.com/2021/11/29/spacex-raptor-crisis/,1578,1638239283.0,HPA97,0.93,/r/spacex/comments/r5ccpc/elon_musk_says_spacex_could_face_genuine_risk_of/,spacex,1828412,2
Happy Earth Day from Launch Complex 39A!,3608,g6a1wo,https://i.redd.it/i3phxs8gvfu41.jpg,44,1587591618.0,johnkphotos,0.98,/r/spacex/comments/g6a1wo/happy_earth_day_from_launch_complex_39a/,spacex,1828412,2
BocaChicaGal: Ship 20 and Booster B4 have been stacked!!,3574,oz6693,https://twitter.com/BocaChicaGal/status/1423629854877028355,510,1628254869.0,CProphet,0.96,/r/spacex/comments/oz6693/bocachicagal_ship_20_and_booster_b4_have_been/,spacex,1828412,2
Falcon 9's second stage among a field of stars as 60 more Starlink satellites launches to space yesterday,3571,m5lekz,https://i.redd.it/osmm1h7687n61.jpg,37,1615817074.0,johnkphotos,0.98,/r/spacex/comments/m5lekz/falcon_9s_second_stage_among_a_field_of_stars_as/,spacex,1828412,2
"Elon Musk: Unlike its aircraft division, which is fine, the FAA space division has a fundamentally broken regulatory structure. Their rules are meant for a handful of expendable launches per year from a few government facilities. Under those rules, humanity will never get to Mars.",3577,l756xz,https://twitter.com/elonmusk/status/1354862567680847876,441,1611860110.0,RootDeliver,0.98,/r/spacex/comments/l756xz/elon_musk_unlike_its_aircraft_division_which_is/,spacex,1828412,2
First stage landing on JRTI is a success! First successful landing on JRTI and the west coast following Iridium mission 1.,3571,5nythj,https://twitter.com/SpaceX/status/820330549529047040,450,1484417806.0,ElongatedMuskrat,0.99,/r/spacex/comments/5nythj/first_stage_landing_on_jrti_is_a_success_first/,spacex,1828412,2
SpaceX finally gets that beautiful B1051 off the ground early Friday morning,3560,i5dumx,https://i.redd.it/2js0j1lt1lf51.jpg,80,1596807116.0,adambernnyc,0.99,/r/spacex/comments/i5dumx/spacex_finally_gets_that_beautiful_b1051_off_the/,spacex,1828412,2
Elon’s favorite things,3548,jv9ydk,https://i.redd.it/3cooaw6hrmz51.jpg,100,1605544800.0,stevenmadow,0.94,/r/spacex/comments/jv9ydk/elons_favorite_things/,spacex,1828412,2
Elon Musk on Instagram: Falcon 9 fairing opens its parafoil after reentering the atmosphere,3545,8gf5yw,https://www.instagram.com/p/BiQ5qXnA_OM/,325,1525240619.0,OccupyMarsNow,0.96,/r/spacex/comments/8gf5yw/elon_musk_on_instagram_falcon_9_fairing_opens_its/,spacex,1828412,2
"Updated rendering of Crew Dragon docking to the ISS, lots of details",3520,93fr4h,https://i.redd.it/cpcbl6jp3bd11.jpg,207,1533053049.0,soldato_fantasma,0.96,/r/spacex/comments/93fr4h/updated_rendering_of_crew_dragon_docking_to_the/,spacex,1828412,2
Falcon 9 and 60 Starlink satellites streak through the Milky Way at 3:13am this morning.,3523,m2lvxe,https://i.redd.it/74l5baxz4dm61.jpg,144,1615452780.0,johnkphotos,0.98,/r/spacex/comments/m2lvxe/falcon_9_and_60_starlink_satellites_streak/,spacex,1828412,2
Starlink 12 from 2.75 miles,3514,j6sbn9,https://i.redd.it/sg6makpesor51.jpg,71,1602082556.0,RigelSirious,0.98,/r/spacex/comments/j6sbn9/starlink_12_from_275_miles/,spacex,1828412,2
"Comet NEOWISE over Falcon 9 and ANASIS-II vertical on SLC-40. Today’s launch window opens at 5:00 p.m. EDT and closes at 8:55 p.m. EDT, and weather is looking 70% favorable",3508,hupg2d,https://i.redd.it/sf6leeo4r1c51.jpg,59,1595265934.0,ReKt1971,0.98,/r/spacex/comments/hupg2d/comet_neowise_over_falcon_9_and_anasisii_vertical/,spacex,1828412,2
SN4 Blew up [Chris B - NSF on Twitter ],3497,gsyu7o,https://twitter.com/NASASpaceflight/status/1266442087848960000,873,1590778394.0,HPA97,0.97,/r/spacex/comments/gsyu7o/sn4_blew_up_chris_b_nsf_on_twitter/,spacex,1828412,2
"Publix, where launching is a pleasure",3483,k0rcvu,https://i.redd.it/xhx0gplhrd161.jpg,84,1606307539.0,stevenmadow,0.97,/r/spacex/comments/k0rcvu/publix_where_launching_is_a_pleasure/,spacex,1828412,2
Elon on Instagram - Moon Base Alpha,3483,7352hj,https://www.instagram.com/p/BZm88uhg1yN/,570,1506653118.0,jclishman,0.92,/r/spacex/comments/7352hj/elon_on_instagram_moon_base_alpha/,spacex,1828412,2
"Elon Musk: SN15 rolls to launch pad in a few days. It has hundreds of design improvements across structures, avionics/software & engine. Hopefully, one of those improvements covers this problem. If not, then retrofit will add a few more days.",3455,mgimvu,https://twitter.com/elonmusk/status/1376894241792737280,433,1617118283.0,CProphet,0.96,/r/spacex/comments/mgimvu/elon_musk_sn15_rolls_to_launch_pad_in_a_few_days/,spacex,1828412,2
"FCC approves SpaceX change to its Starlink network, a win despite objections from Amazon and others",3444,mzrdah,https://www.cnbc.com/2021/04/27/fcc-approves-spacex-starlink-modification-despite-objections.html,646,1619538317.0,soldato_fantasma,0.97,/r/spacex/comments/mzrdah/fcc_approves_spacex_change_to_its_starlink/,spacex,1828412,2
“Shipyard to the stars” - SpaceX’s Mars prototype rocket’s first night under the stars.,3447,dadd2s,https://i.redd.it/0wg4pd5roap31.jpg,125,1569659058.0,everydayastronaut,0.99,/r/spacex/comments/dadd2s/shipyard_to_the_stars_spacexs_mars_prototype/,spacex,1828412,2
"[Elon Musk] Unfortunately, launch is called off for today, as an aircraft entered the “keep out zone”, which is unreasonably gigantic. There is simply no way that humanity can become a spacefaring civilization without major regulatory reform. The current regulatory system is broken.",3419,oaf9r1,https://twitter.com/elonmusk/status/1409951549988782087?s=21,591,1624994609.0,tonybinky20,0.88,/r/spacex/comments/oaf9r1/elon_musk_unfortunately_launch_is_called_off_for/,spacex,1828412,2
Falcon 9 B1049 returns to Port Canaveral after its 5th flight,3420,gypvcb,https://i.redd.it/y0vz278rgl351.jpg,100,1591582156.0,Space_Coast_Steve,0.99,/r/spacex/comments/gypvcb/falcon_9_b1049_returns_to_port_canaveral_after/,spacex,1828412,2
