title,score,id,url,num_comments,created,author,upvote_ratio,permalink,subreddit,subreddit_subscribers,author_name
Cassini's last full-body image of Saturn before impact,64033,73kq63,https://www.flickr.com/photos/10795027@N08/37124872560/in/photostream/lightbox/,1168,1506849624.0,Pluto_and_Charon,0.93,/r/space/comments/73kq63/cassinis_last_fullbody_image_of_saturn_before/,space,22943290,Pluto_and_Charon
I waded into the ocean to get a unique perspective of Tuesday's Atlas V launch of cargo for the International Space Station,64028,66qyq4,https://i.imgur.com/HtcChRy.jpg,816,1492798380.0,johnkphotos,0.9,/r/space/comments/66qyq4/i_waded_into_the_ocean_to_get_a_unique/,space,22943290,johnkphotos
One of my rocket launch images is now displayed two-stories tall at United Launch Alliance's headquarters in Colorado!!,63351,70kbr8,https://i.imgur.com/W2eZDmn.jpg,771,1505606413.0,johnkphotos,0.9,/r/space/comments/70kbr8/one_of_my_rocket_launch_images_is_now_displayed/,space,22943290,johnkphotos
Juno Passing Jupiter,63284,ddvm8d,https://gfycat.com/fairblandazurewingedmagpie,1445,1570320113.0,mossberg91,0.97,/r/space/comments/ddvm8d/juno_passing_jupiter/,space,22943290,mossberg91
One of the sharpest moon image i ever captured though a 8 inch telescope.,63242,xtobwp,https://i.redd.it/r8h6ikeg5er91.jpg,1040,1664715873.0,daryavaseum,0.95,/r/space/comments/xtobwp/one_of_the_sharpest_moon_image_i_ever_captured/,space,22943290,daryavaseum
The Whirlpool Galaxy: My image Compared to Hubble's,63205,or121k,https://i.imgur.com/jL4WG2c.jpg,1016,1627171236.0,azzkicker7283,0.94,/r/space/comments/or121k/the_whirlpool_galaxy_my_image_compared_to_hubbles/,space,22943290,azzkicker7283
"Using less than an hour of data, I was able to make my best photo of the Andromeda Galaxy to date! [OC]",62627,ek4tb4,https://i.redd.it/z98ttz61pu841.jpg,960,1578182403.0,DanielJStein,0.94,/r/space/comments/ek4tb4/using_less_than_an_hour_of_data_i_was_able_to/,space,22943290,DanielJStein
SpaceX has received permission from the U.S. government to launch Elon Musk’s car toward Mars.,62584,7vfy2z,http://www.businessinsider.com/falcon-heavy-launch-spacex-elon-musk-tesla-roadster-car-2018-2,2900,1517848608.0,AdamCannon,0.88,/r/space/comments/7vfy2z/spacex_has_received_permission_from_the_us/,space,22943290,AdamCannon
"Venus, Mars and Moon. Image credit: Peter Barvoets",61880,7osf9n,https://i.redd.it/d26mt0lmyo801.jpg,769,1515350878.0,gDisasters,0.92,/r/space/comments/7osf9n/venus_mars_and_moon_image_credit_peter_barvoets/,space,22943290,gDisasters
This is my 33 hour exposure of the Dolphin Nebula that ended up getting me shortlisted as the Astronomy Photographer of the Year! [OC],61750,hy19cz,https://i.redd.it/g8nvxz75x4d51.jpg,749,1595740565.0,Idontlikecock,0.97,/r/space/comments/hy19cz/this_is_my_33_hour_exposure_of_the_dolphin_nebula/,space,22943290,Idontlikecock
"Congress's new NASA budget reverses many of the president's proposed cuts- if passed, it would be the best NASA budget since 2009, boosting NASA's budget up to $20.7 billion dollars. All missions proposed to be cancelled have instead been fully funded.",61518,86ez4h,http://planetary.org/blogs/casey-dreier/2018/20180322-fy18-omnibus.html,1772,1521751948.0,Pluto_and_Charon,0.9,/r/space/comments/86ez4h/congresss_new_nasa_budget_reverses_many_of_the/,space,22943290,Pluto_and_Charon
Our moon with Jupiter and its moons.,61289,kpv0ua,https://i.redd.it/vqucjd6z47961.jpg,390,1609714107.0,jesschristina,0.96,/r/space/comments/kpv0ua/our_moon_with_jupiter_and_its_moons/,space,22943290,jesschristina
"The Pillars of Creation are almost always shown in false color, so I decided to take a rare image of them in true color to showcase their real beauty [OC]",60815,gpfjcq,https://i.redd.it/sg7ytvr9rl051.png,1388,1590278403.0,Idontlikecock,0.93,/r/space/comments/gpfjcq/the_pillars_of_creation_are_almost_always_shown/,space,22943291,Idontlikecock
I pointed my telescope at the Bubble Nebula and took pictures for 24 hours. Here is a look at what happens when a star is born in a crowded neighborhood [OC],60394,e460nh,https://i.redd.it/mq38u6knww141.jpg,896,1575158405.0,TheVastReaches,0.95,/r/space/comments/e460nh/i_pointed_my_telescope_at_the_bubble_nebula_and/,space,22943291,TheVastReaches
2022 was easily my most diverse year for photographing our night sky. This is an 8k compilation I made of my favorite images.,60329,10073vy,https://i.redd.it/icikfapinb9a1.jpg,282,1672531203.0,DanielJStein,0.94,/r/space/comments/10073vy/2022_was_easily_my_most_diverse_year_for/,space,22943291,DanielJStein
Mars casts a warm reflection on the surface of the ocean during an opposition in which the red planet was closest to Earth since 2003.,60224,96l2fb,https://i.imgur.com/7vcnMOg.jpg,669,1534032001.0,marcuscotephoto,0.93,/r/space/comments/96l2fb/mars_casts_a_warm_reflection_on_the_surface_of/,space,22943291,marcuscotephoto
I still have a ways to go but I wanted to share my progress after all the support I recieved over my first photo.,60202,cv7x4d,https://i.redd.it/rzrekzvt9li31.jpg,482,1566736278.0,Pjacob77,0.94,/r/space/comments/cv7x4d/i_still_have_a_ways_to_go_but_i_wanted_to_share/,space,22943291,Pjacob77
Too many to count.,60012,ynu3v2,https://i.redd.it/1mu80jm1bey91.jpg,1401,1667750692.0,Acuate187,0.95,/r/space/comments/ynu3v2/too_many_to_count/,space,22943291,Acuate187
"My most detailed image of the sun to date, captured using over 100,000 individual photos from my backyard in Arizona. Earth for scale. [OC]",59766,vq4opb,https://i.redd.it/u2m8o97pca991.jpg,1260,1656806625.0,ajamesmccarthy,0.94,/r/space/comments/vq4opb/my_most_detailed_image_of_the_sun_to_date/,space,22943291,ajamesmccarthy
wanted to share with you all my retro futuristic space art series; hope you enjoy them!,59408,arkmhn,https://i.redd.it/9u3h4glqt4h21.png,1002,1550410789.0,frankreddit5,0.91,/r/space/comments/arkmhn/wanted_to_share_with_you_all_my_retro_futuristic/,space,22943291,frankreddit5
"A View of My View, from the International Space Station. More details in comments!",59350,zun1yu,https://i.redd.it/2hud45qdzx7a1.png,921,1671929566.0,astro_pettit,0.96,/r/space/comments/zun1yu/a_view_of_my_view_from_the_international_space/,space,22943291,astro_pettit
These are all of the telescopes I've use to create and post pictures on Reddit with.,59274,fvbsc2,https://i.redd.it/8zmbzxyj8zq41.jpg,951,1586082733.0,chucksastro,0.94,/r/space/comments/fvbsc2/these_are_all_of_the_telescopes_ive_use_to_create/,space,22943291,chucksastro
I created an ultra-detailed color image of the moon by combining around 100k photos. Check out the details on the surface. [OC],59188,ekk6cw,https://i.redd.it/ot11kqkje1941.jpg,940,1578263634.0,ajamesmccarthy,0.95,/r/space/comments/ekk6cw/i_created_an_ultradetailed_color_image_of_the/,space,22943291,ajamesmccarthy
To promote NASA’s Artemis Program I regularly set up my telescope on busy street corners to show passerby the Moon.,59110,wtvx6s,https://i.imgur.com/xiYkf4T.jpg,746,1661076024.0,__Augustus_,0.93,/r/space/comments/wtvx6s/to_promote_nasas_artemis_program_i_regularly_set/,space,22943291,__Augustus_
Over the last 3 years I've captured nearly every full moon. This is what happens when you animate a year's worth in sequence.,59097,w73lij,https://gfycat.com/temptingtediousant,1180,1658690678.0,ajamesmccarthy,0.94,/r/space/comments/w73lij/over_the_last_3_years_ive_captured_nearly_every/,space,22943291,ajamesmccarthy
Closeup photograph I shot of yesterday’s Antares rocket launch delivering cargo to the International Space Station,59071,dr07f4,https://i.redd.it/irpgqmm41hw31.png,532,1572786800.0,johnkphotos,0.95,/r/space/comments/dr07f4/closeup_photograph_i_shot_of_yesterdays_antares/,space,22943291,johnkphotos
I spent 2 years and 18 hours of exposure time to capture the Crescent Nebula.,58589,fizkyl,https://i.redd.it/0s196q9cgtm41.png,586,1584269357.0,chucksastro,0.95,/r/space/comments/fizkyl/i_spent_2_years_and_18_hours_of_exposure_time_to/,space,22943291,chucksastro
I often get asked if people can use my images as wallpapers for their phones. So here's a collection of space themed wallpapers cropped from images I have taken over the last few years [OC],58249,h8t50n,https://i.redd.it/p0onpwbopt451.jpg,653,1592138504.0,inefekt,0.95,/r/space/comments/h8t50n/i_often_get_asked_if_people_can_use_my_images_as/,space,22943291,inefekt
My 13 hour exposure of the Tarantula Nebula from my backyard,58246,e0qhuj,https://i.redd.it/z1q19lndyi041.jpg,605,1574553605.0,OkeWoke,0.96,/r/space/comments/e0qhuj/my_13_hour_exposure_of_the_tarantula_nebula_from/,space,22943291,OkeWoke
"I combined my highest resolution moon shot with my highest resolution sun shot to make this composition. Zoom in, it's nearly 8k resolution! [OC]",58082,mjwyow,https://i.redd.it/k5gx9wpiz5r61.jpg,813,1617545511.0,ajamesmccarthy,0.92,/r/space/comments/mjwyow/i_combined_my_highest_resolution_moon_shot_with/,space,22943291,ajamesmccarthy
"Ten years ago, The Space Shuttle Discovery under a full moon.",57935,azj7d3,https://upload.wikimedia.org/wikipedia/commons/5/57/Space_Shuttle_Discovery_under_a_full_moon%2C_03-11-09.jpg,590,1552245511.0,Aeromarine_eng,0.94,/r/space/comments/azj7d3/ten_years_ago_the_space_shuttle_discovery_under_a/,space,22943291,Aeromarine_eng
"From Mount Tschirgant in the Alps, you can see not only nearby towns and distant Tyrolean peaks, but also, weather permitting, stars, nebulas, & the band of the Milky Way Galaxy. And if you climbed during the Perseids Meteor Shower, like photographer Nicholas Roemmelt did, also a marvel like this",57536,amoxg8,https://i.redd.it/urpnrqkudce21.jpg,573,1549194762.0,Mass1m01973,0.87,/r/space/comments/amoxg8/from_mount_tschirgant_in_the_alps_you_can_see_not/,space,22943291,Mass1m01973
"Dust, Stars and cosmic rays swirling around Comet 67P/Churyimov-Gerasimenko, captured by the Rosetta probe",57058,8x2tqe,https://v.redd.it/2covqjnq8r811,697,1531069028.0,modaladverb,0.93,/r/space/comments/8x2tqe/dust_stars_and_cosmic_rays_swirling_around_comet/,space,22943291,modaladverb
"Using two different telescopes, I was able to create this true color image of the Sunflower Galaxy with a combined exposure of nearly 40 hours",57037,bye9gm,https://i.redd.it/vvm1lc2gz7331.jpg,660,1560038403.0,Idontlikecock,0.96,/r/space/comments/bye9gm/using_two_different_telescopes_i_was_able_to/,space,22943291,Idontlikecock
Jupiter's Auroras captured by the Hubble Telescope,56842,cg5wcj,https://i.imgur.com/ePWdHOQ.gifv,849,1563753215.0,mossberg91,0.96,/r/space/comments/cg5wcj/jupiters_auroras_captured_by_the_hubble_telescope/,space,22943291,mossberg91
"I took an absurdly high resolution photo of the moon on Wednesday, zoom in and check out the details!",56777,11jburq,https://i.redd.it/rg21bnd1bzla1.jpg,1314,1678047462.0,ajamesmccarthy,0.93,/r/space/comments/11jburq/i_took_an_absurdly_high_resolution_photo_of_the/,space,22943291,ajamesmccarthy
"Using over 1.5TB of data from two telescopes, I created a 110 megapixel image of the first full moon of fall. [OC]",56759,dheqqi,https://i.redd.it/kal3dg6kucs31.jpg,729,1570992786.0,ajamesmccarthy,0.95,/r/space/comments/dheqqi/using_over_15tb_of_data_from_two_telescopes_i/,space,22943291,ajamesmccarthy
"After 3 years of waiting for the right conditions, I was able to get this shot of the ISS crossing the face of the sun. [OC]",56729,g88axp,https://i.redd.it/0m924jy3e3v41.jpg,626,1587876372.0,ajamesmccarthy,0.95,/r/space/comments/g88axp/after_3_years_of_waiting_for_the_right_conditions/,space,22943291,ajamesmccarthy
"Hey, check out this view",56576,6cgask,http://i.imgur.com/q95PckC.gifv,1609,1495370064.0,Fizrock,0.9,/r/space/comments/6cgask/hey_check_out_this_view/,space,22943291,Fizrock
The Carina Nebula : New full-colour Image from the James Webb Space Telescope revealed by NASA (in 4K).,56401,vxdrkn,https://i.redd.it/4gb4y0lp47b91.jpg,1700,1657639304.0,GroundbreakingSet187,0.97,/r/space/comments/vxdrkn/the_carina_nebula_new_fullcolour_image_from_the/,space,22943291,GroundbreakingSet187
My 17 hour exposure of the Flaming Star Nebula in natural color,56393,8717cq,https://i.redd.it/8kkgfj82s0m01.jpg,649,1521990176.0,Idontlikecock,0.93,/r/space/comments/8717cq/my_17_hour_exposure_of_the_flaming_star_nebula_in/,space,22943291,Idontlikecock
Flower grown inside the International Space Station orbiting Earth January 2016,56280,ap5hsu,https://i.redd.it/4dhzckx4qrf21.jpg,504,1549816410.0,Aeromarine_eng,0.93,/r/space/comments/ap5hsu/flower_grown_inside_the_international_space/,space,22943291,Aeromarine_eng
"My 24 hour long exposure of the Eastern Veil Nebula, taken from my apartment roof",56250,clpq54,https://live.staticflickr.com/65535/48435308061_594e611d5c_o.png,873,1564876801.0,azzkicker7283,0.96,/r/space/comments/clpq54/my_24_hour_long_exposure_of_the_eastern_veil/,space,22943291,azzkicker7283
Photo I took of a Delta IV Heavy launch,56247,g48alo,https://i.redd.it/3661vhep8st41.jpg,501,1587305507.0,johnkphotos,0.96,/r/space/comments/g48alo/photo_i_took_of_a_delta_iv_heavy_launch/,space,22943291,johnkphotos
"A FORK, A SPOON AND A MOON... A Royal Spoonbill sits atop of a branch basking in the glow of the nearly Full Moon in Hawke’s Bay, New Zealand... Photo by Andrew Caldwell",56210,6xq066,https://i.redd.it/9ujjtkcp9kjz.jpg,432,1504397881.0,Reporter_at_large,0.88,/r/space/comments/6xq066/a_fork_a_spoon_and_a_moon_a_royal_spoonbill_sits/,space,22943291,Reporter_at_large
"A professor of Space Law is arguing the Apollo lunar landing sites (such as Tranquility Base) should be placed on the international World Heritage List. Currently, there is no law against running over, erasing, or carving out and selling the first bootprints imprinted on the Moon.",56096,asrk3d,http://www.astronomy.com/news/2019/02/the-case-for-protecting-the-apollo-landing-areas-as-heritage-sites,1508,1550686243.0,clayt6,0.92,/r/space/comments/asrk3d/a_professor_of_space_law_is_arguing_the_apollo/,space,22943291,clayt6
"Saturn’s icy moon, Enceladus.",56084,mohvjj,https://i.redd.it/4lg1aj37ags61.jpg,1131,1618105939.0,jesschristina,0.96,/r/space/comments/mohvjj/saturns_icy_moon_enceladus/,space,22943291,jesschristina
Astronaut Scott Kelly: I thought Elon Musk was crazy and then he landed his first stage on a barge. I'm never again going to doubt what he says.,55966,7713e8,https://www.cnbc.com/2017/10/17/astronaut-scott-kelly-says-dont-doubt-elon-musk.html,1684,1508269589.0,thesheetztweetz,0.8,/r/space/comments/7713e8/astronaut_scott_kelly_i_thought_elon_musk_was/,space,22943291,thesheetztweetz
Proudly representing my most detailed moon image after 3 years of practicing.(OC),55923,zc7ynp,https://i.redd.it/h8c1ot0uvw3a1.jpg,831,1670154846.0,daryavaseum,0.94,/r/space/comments/zc7ynp/proudly_representing_my_most_detailed_moon_image/,space,22943291,daryavaseum
Curiosity took another picture of the Martian sunset a few days ago,55710,7fnlt9,http://www.db-prods.net/marsroversimages/Curiosity/2017/1880ML0098480180703571C00_DB_web.JPG,625,1511710959.0,Pluto_and_Charon,0.93,/r/space/comments/7fnlt9/curiosity_took_another_picture_of_the_martian/,space,22943291,Pluto_and_Charon
I used two different scopes and over 50 hours of exposure to reveal hundreds of galaxies in a small region of the sky in true color [OC],55679,ggrhda,https://i.redd.it/zyrjey6wndv41.jpg,1331,1589071481.0,Idontlikecock,0.96,/r/space/comments/ggrhda/i_used_two_different_scopes_and_over_50_hours_of/,space,22943291,Idontlikecock
"This gif, created by Google product developer Clay Bavor, puts the 747 and SR-71 aircraft speeds into perspective compared to New Horizons spacecraft. 36,000 mph ~ 58,000 km/h was the speed reached at launch (Atlas V third stage cut off)",55560,b24gvp,https://i.redd.it/or67ho375om21.gif,1320,1552823933.0,Mass1m01973,0.93,/r/space/comments/b24gvp/this_gif_created_by_google_product_developer_clay/,space,22943291,Mass1m01973
Bezos’ Blue Origin loses lawsuit against NASA over SpaceX lunar lander contract,55546,qmm3za,https://twitter.com/thesheetztweetz/status/1456269808811405317?s=20,2080,1636036993.0,Pluto_and_Charon,0.93,/r/space/comments/qmm3za/bezos_blue_origin_loses_lawsuit_against_nasa_over/,space,22943291,Pluto_and_Charon
Mars Perseverance Rover captured this image.,55387,noee1k,https://i.redd.it/qgjqfxp18a271.jpg,1560,1622391069.0,MistWeaver80,0.95,/r/space/comments/noee1k/mars_perseverance_rover_captured_this_image/,space,22943291,MistWeaver80
I captured the Horsehead and Flame nebula with my home telescope.,55351,qodko3,https://i.redd.it/y9uyyssbn2y71.jpg,635,1636246495.0,chucksastro,0.96,/r/space/comments/qodko3/i_captured_the_horsehead_and_flame_nebula_with_my/,space,22943291,chucksastro
"A dramatic, closeup look at Thursday’s Atlas V rocket launch — photo captured with a sound-triggered camera I placed 500 feet from the rocket.",55336,coppj8,https://i.redd.it/9lthnuugnpf31.jpg,680,1565481749.0,johnkphotos,0.96,/r/space/comments/coppj8/a_dramatic_closeup_look_at_thursdays_atlas_v/,space,22943291,johnkphotos
Do you think there is life somewhere in this photo?,55264,yues8h,https://i.redd.it/6lhe4dweutz91.jpg,4882,1668374664.0,Acuate187,0.9,/r/space/comments/yues8h/do_you_think_there_is_life_somewhere_in_this_photo/,space,22943291,Acuate187
NASA let me play guitar in their loud speaker room!!! (The Large Reverberant Acoustic Test Facility),55205,5cfjeo,http://i.imgur.com/nfQlecP.jpg,1231,1478883789.0,termderd,0.89,/r/space/comments/5cfjeo/nasa_let_me_play_guitar_in_their_loud_speaker/,space,22943291,termderd
I took a picture of Jupiter (with moons) rising over the mountain forest,55082,pe4v5z,https://i.imgur.com/HIKT8s2.jpg,500,1630274775.0,PageD0WN,0.96,/r/space/comments/pe4v5z/i_took_a_picture_of_jupiter_with_moons_rising/,space,22943291,PageD0WN
"I started using a telephoto lens for my Milky Way landscape shots to capture extreme detail of our galaxy, this is my favorite shot to date!",54963,d4d6bk,https://i.redd.it/8oqnxcgafnm31.jpg,644,1568505721.0,DanielJStein,0.95,/r/space/comments/d4d6bk/i_started_using_a_telephoto_lens_for_my_milky_way/,space,22943291,DanielJStein
"Virgin Galactic’s pilots reach the edge of space: ""Spaceship Unity, welcome to space."" ""Copy base. Million dollar view!""",54917,a5y66f,https://v.redd.it/tklwi6t4a4421,2042,1544738254.0,thesheetztweetz,0.93,/r/space/comments/a5y66f/virgin_galactics_pilots_reach_the_edge_of_space/,space,22943291,thesheetztweetz
The clearest image of Venus!,54890,cs3p4n,https://i.redd.it/9t38mjham8h31.jpg,1030,1566147233.0,kcgg123,0.95,/r/space/comments/cs3p4n/the_clearest_image_of_venus/,space,22943291,kcgg123
Venus and the Earth doing cosmic ballet!!!,54630,88t0eg,https://i.imgur.com/PqJy8lX.gifv,951,1522608292.0,mtimetraveller,0.87,/r/space/comments/88t0eg/venus_and_the_earth_doing_cosmic_ballet/,space,22943291,mtimetraveller
NASA let me vacuum the world's largest vacuum chamber!,54414,5bc1ua,http://i.imgur.com/T8GWEgq.jpg,1018,1478378737.0,termderd,0.9,/r/space/comments/5bc1ua/nasa_let_me_vacuum_the_worlds_largest_vacuum/,space,22943291,termderd
"NASA's Ingenuity helicopter is carrying a small piece of aviation history. Underneath the helicopter's solar panel is a stamp-sized piece of fabric. It was a part of the wing covering on the Wright brothers’ aircraft that took the first powered, controlled flight on Earth on Dec. 17, 1903.",54161,mbs4xn,https://www.houstonchronicle.com/news/houston-texas/space/article/Mars-helicopter-to-pay-homage-to-Wright-brothers-16047212.php,1319,1616542892.0,MaryADraper,0.94,/r/space/comments/mbs4xn/nasas_ingenuity_helicopter_is_carrying_a_small/,space,22943291,MaryADraper
My image of the Needle Galaxy from a gigantic 4.3 m telescope,53921,bvwj3e,https://i.redd.it/bojrf717ik131.jpg,1243,1559475849.0,Idontlikecock,0.96,/r/space/comments/bvwj3e/my_image_of_the_needle_galaxy_from_a_gigantic_43/,space,22943291,Idontlikecock
"I captured an 80 megapixel image of our moon Thursday night, and enhanced color to show more details. Zoom in to properly experience it! [OC]",53842,inr5xt,https://i.redd.it/peqs29gvlkl51.jpg,1040,1599416906.0,ajamesmccarthy,0.94,/r/space/comments/inr5xt/i_captured_an_80_megapixel_image_of_our_moon/,space,22943291,ajamesmccarthy
My latest shot of the moon in 81 megapixels. [OC],53678,dau0zu,https://i.redd.it/876de1owrip31.jpg,794,1569756980.0,ajamesmccarthy,0.95,/r/space/comments/dau0zu/my_latest_shot_of_the_moon_in_81_megapixels_oc/,space,22943291,ajamesmccarthy
"Scientists may have solved one of the biggest questions in modern physics, with a new paper unifying dark matter and dark energy into a single phenomenon: a fluid which possesses 'negative mass"". This astonishing new theory may also prove right a prediction that Einstein made 100 years ago.",53596,a3a33c,https://phys.org/news/2018-12-universe-theory-percent-cosmos.html,3621,1543994944.0,Mass1m01973,0.93,/r/space/comments/a3a33c/scientists_may_have_solved_one_of_the_biggest/,space,22943291,Mass1m01973
Curiosity captured some high altitude clouds in Martian atmosphere.,53447,mjlen6,https://i.redd.it/j82sfejm02r61.jpg,998,1617497380.0,MistWeaver80,0.96,/r/space/comments/mjlen6/curiosity_captured_some_high_altitude_clouds_in/,space,22943291,MistWeaver80
Galaxies I've captured with my home telescope.,53086,lovc1t,https://v.redd.it/in1qpjkzgti61,979,1613907261.0,chucksastro,0.94,/r/space/comments/lovc1t/galaxies_ive_captured_with_my_home_telescope/,space,22943291,chucksastro
The recently discovered Giant Squid Nebula in the constellation Cepheus,53027,8dzo07,https://i.redd.it/ep5w6o6be3q01.jpg,1148,1524355206.0,Idontlikecock,0.93,/r/space/comments/8dzo07/the_recently_discovered_giant_squid_nebula_in_the/,space,22943291,Idontlikecock
"I photographed the full moon rising over the ocean through some clouds and atmospheric distortion, which rendered the moon a beautiful yellow-gold hue.",52971,9c7u6c,https://i.redd.it/7vzokbsgupj11.jpg,465,1535846441.0,johnkphotos,0.92,/r/space/comments/9c7u6c/i_photographed_the_full_moon_rising_over_the/,space,22943291,johnkphotos
Earth as seen from the ISS.,52911,8fug7d,https://v.redd.it/34ar0yao0xu01,1814,1525037205.0,modaladverb,0.91,/r/space/comments/8fug7d/earth_as_seen_from_the_iss/,space,22943291,modaladverb
This past Friday was the last time a full moon will occur on Friday the 13th until 2049! Here's a spooky shot I got of it over a swamp.,52611,d4ok20,https://i.redd.it/6uc57yctysm31.jpg,448,1568572873.0,spiider_bro,0.96,/r/space/comments/d4ok20/this_past_friday_was_the_last_time_a_full_moon/,space,22943291,spiider_bro
The Pillars of Creation: My image compared to Hubble's,52413,gl58af,https://i.imgur.com/pmmQS10.jpg,833,1589673601.0,azzkicker7283,0.94,/r/space/comments/gl58af/the_pillars_of_creation_my_image_compared_to/,space,22943291,azzkicker7283
Long exposure photograph I shot of SpaceX’s recent launch of Falcon 9 and SES-12,52281,8rv0rr,https://i.redd.it/ig51phocdn411.jpg,348,1529278745.0,johnkphotos,0.9,/r/space/comments/8rv0rr/long_exposure_photograph_i_shot_of_spacexs_recent/,space,22943291,johnkphotos
Falcon 9 closeup,52213,gh5vpi,https://i.redd.it/hl35gd1u5zx41.jpg,745,1589132683.0,johnkphotos,0.95,/r/space/comments/gh5vpi/falcon_9_closeup/,space,22943291,johnkphotos
10 year time lapse of stars orbiting the black hole at the center of our galaxy,52087,6dunm6,http://i.imgur.com/liT2ZMz.gifv,1999,1495988845.0,Fizrock,0.93,/r/space/comments/6dunm6/10_year_time_lapse_of_stars_orbiting_the_black/,space,22943291,Fizrock
"The Moon was hospitable to life for about 500 million years after its formation. During this time, it had enough water vapor to maintain an atmosphere and form pools of water on the ground. Volcanic activity was also high, which replenished the atmosphere with water vapor from the lunar interior.",51972,91j7k5,http://www.astronomy.com/news/2018/07/life-on-the-moon,1961,1532451734.0,clayt6,0.92,/r/space/comments/91j7k5/the_moon_was_hospitable_to_life_for_about_500/,space,22943291,clayt6
I developed a unique method for processing images of the Sun for extreme detail and clarity. This photo was shot on my backyard solar telescope. [OC],51860,lzejo5,https://i.redd.it/l5cu9ggayhl61.jpg,1100,1615075211.0,TheVastReaches,0.92,/r/space/comments/lzejo5/i_developed_a_unique_method_for_processing_images/,space,22943291,TheVastReaches
Ex-SpaceX employees at Virgin Galactic are given this shirt,51749,7e2alj,http://i.imgur.com/ASfmjDq.png,2460,1511115280.0,Fizrock,0.82,/r/space/comments/7e2alj/exspacex_employees_at_virgin_galactic_are_given/,space,22943291,Fizrock
Detailed Space Shuttle launch made out of LEGO,51593,9i7d9d,https://i.redd.it/p4dnlg6ypyn11.jpg,398,1537697288.0,Mass1m01973,0.91,/r/space/comments/9i7d9d/detailed_space_shuttle_launch_made_out_of_lego/,space,22943291,Mass1m01973
"20 years ago Hubble's ""Pillars of Creation"" image gave me an obsession with space. Now after 2 years of learning this hobby I can properly capture them myself. Here's my latest shot taken from my backyard. [OC]",51327,e7tkxy,https://i.redd.it/gvj0mybete341.png,590,1575810920.0,ajamesmccarthy,0.95,/r/space/comments/e7tkxy/20_years_ago_hubbles_pillars_of_creation_image/,space,22943291,ajamesmccarthy
"I used over 24 hours of exposure of the night sky to reveal hundreds of galaxies, zoom in to see them all! [OC]",51305,kc00b5,https://i.redd.it/jk1xkq9tdu461.jpg,934,1607817603.0,Idontlikecock,0.95,/r/space/comments/kc00b5/i_used_over_24_hours_of_exposure_of_the_night_sky/,space,22943291,Idontlikecock
I set up a sound-triggered camera roughly 900 feet away from the launch pad during this week's Falcon 9 rocket launch. (Marcus Cote/Space Coast Times),51260,7v3636,https://i.imgur.com/eYXpOVJ.jpg,651,1517702410.0,marcuscotephoto,0.92,/r/space/comments/7v3636/i_set_up_a_soundtriggered_camera_roughly_900_feet/,space,22943291,marcuscotephoto
Stephan's Quintet: My image compared to JWST's,51032,w0tznh,https://i.imgur.com/Sl4MYCA.jpg,1031,1658016004.0,azzkicker7283,0.94,/r/space/comments/w0tznh/stephans_quintet_my_image_compared_to_jwsts/,space,22943291,azzkicker7283
