title,score,id,url,num_comments,created,author,upvote_ratio,permalink,subreddit,subreddit_subscribers,depth
"Elon Musk on Twitter: ""Putting together SpaceX rocket landing blooper reel. We messed up a lot before it finally worked, but there's some epic explosion footage …""",2619,6x8za9,https://twitter.com/elonmusk/status/903333005527093248,218,1504206380.0,ethan829,0.99,/r/spacex/comments/6x8za9/elon_musk_on_twitter_putting_together_spacex/,spacex,1828412,2
U.S. Army signs deal with SpaceX to assess Starlink broadband network,2598,gqxzjt,https://spacenews.com/u-s-army-signs-deal-with-spacex-to-assess-starlink-broadband/,334,1590503061.0,stratohornet,0.99,/r/spacex/comments/gqxzjt/us_army_signs_deal_with_spacex_to_assess_starlink/,spacex,1828412,2
Official SAOCOM 1A Mission pictures including of the landing.,2596,9mibkf,https://www.flickr.com/photos/spacex/30234800687/,54,1539028709.0,FoxhoundBat,0.98,/r/spacex/comments/9mibkf/official_saocom_1a_mission_pictures_including_of/,spacex,1828412,2
"Michael Baylor: “Following up on @thejackbeyer's find, I can confirm that Deimos and Phobos are the names of two oil rigs purchased by SpaceX – likely for conversion to support Starship operations. ENSCO 8500 and ENSCO 8501 were the previous names of the rigs. They are nearly identical twins.”",2591,l0fsnl,https://twitter.com/nextspaceflight/status/1351442201134264321?s=21,517,1611045407.0,Broccoli32,0.98,/r/spacex/comments/l0fsnl/michael_baylor_following_up_on_thejackbeyers_find/,spacex,1828412,2
Starship SN9 performs its first static fire test making way for A 12.5km flight attempt no earlier than Friday,2588,krygic,https://twitter.com/NASASpaceflight/status/1346941667878662148,261,1609970910.0,Humble_Giveaway,0.98,/r/spacex/comments/krygic/starship_sn9_performs_its_first_static_fire_test/,spacex,1828412,2
Elon Musk on Twitter: Stainless Steel Starship,2578,a930k5,https://twitter.com/elonmusk/status/1077106553189093376,648,1545637235.0,OccupyMarsNow,0.97,/r/spacex/comments/a930k5/elon_musk_on_twitter_stainless_steel_starship/,spacex,1828412,2
[Leaked] Amos-6 Mission Patch,2575,62scc7,http://i.imgur.com/R7Qp8PY.png,249,1491048635.0,stratohornet,0.95,/r/spacex/comments/62scc7/leaked_amos6_mission_patch/,spacex,1828412,2
"Raptor reached 268.9 bar today, exceeding prior record held by the awesome Russian RD-180. Great work by @SpaceX engine/test team!",2569,apbfog,https://twitter.com/elonmusk/status/1094782854007910400,474,1549851663.0,venku122,0.97,/r/spacex/comments/apbfog/raptor_reached_2689_bar_today_exceeding_prior/,spacex,1828412,2
The current status of SpaceX's Starship & Superheavy prototypes. 13th March 2021,2571,m3xm3k,https://i.redd.it/9lonykwcnpm61.jpg,310,1615604239.0,brendan290803,0.99,/r/spacex/comments/m3xm3k/the_current_status_of_spacexs_starship_superheavy/,spacex,1828412,2
Elon Musk: SN4 passed cryo proof! 😅,2564,g8tvmq,https://twitter.com/elonmusk/status/1254632509863866368?s=21,295,1587962806.0,Tommy099431,0.97,/r/spacex/comments/g8tvmq/elon_musk_sn4_passed_cryo_proof/,spacex,1828412,2
SpaceX’s Gwynne Shotwell says the company plans to start polar launches of Starlink satellites this summer. Hopes to have full global connectivity after 28 launches; after that additional satellites will add capacity.,2559,mlh56p,https://twitter.com/jeff_foust/status/1379448725282689027,426,1617730615.0,CProphet,0.97,/r/spacex/comments/mlh56p/spacexs_gwynne_shotwell_says_the_company_plans_to/,spacex,1828412,2
SpaceX Likely to Spin Off Starlink Business and Pursue an IPO,2541,ezvwwz,https://www.bloomberg.com/news/articles/2020-02-06/spacex-likely-to-spin-off-starlink-business-and-pursue-an-ipo,562,1581011168.0,ethan829,0.98,/r/spacex/comments/ezvwwz/spacex_likely_to_spin_off_starlink_business_and/,spacex,1828412,2
"Tom Mueller, SpaceX Employee #2 and former VP of Propulsion, has retired",2530,k46yii,https://twitter.com/lrocket/status/1333537793335693312,219,1606775315.0,jclishman,0.98,/r/spacex/comments/k46yii/tom_mueller_spacex_employee_2_and_former_vp_of/,spacex,1828412,2
Inside Elon Musk’s plan to build one Starship a week—and settle Mars,2520,fdub0s,https://arstechnica.com/science/2020/03/inside-elon-musks-plan-to-build-one-starship-a-week-and-settle-mars/,435,1583410076.0,CProphet,0.98,/r/spacex/comments/fdub0s/inside_elon_musks_plan_to_build_one_starship_a/,spacex,1828412,2
"The first Raptor Vacuum engine (RVac) for Starship has shipped from SpaceX’s rocket factory in Hawthorne, California to our development facility in McGregor, Texas",2513,imri84,https://twitter.com/SpaceX/status/1302038129990279168,342,1599265108.0,675longtail,0.98,/r/spacex/comments/imri84/the_first_raptor_vacuum_engine_rvac_for_starship/,spacex,1828412,2
Brost: as early as the first half of next year we’ll start doing vertical takeoff and landing tests of our first BFR upper stage. #HumansToMars,2518,8i6y5g,https://twitter.com/jeff_foust/status/994240069744676864,374,1525880377.0,venku122,0.96,/r/spacex/comments/8i6y5g/brost_as_early_as_the_first_half_of_next_year/,spacex,1828412,2
Continuous uncut footage of the Falcon Heavy launch and booster landing.,2496,7vtq2v,https://youtu.be/59pY74ZhQ50,166,1517979376.0,AstronomyLive,0.99,/r/spacex/comments/7vtq2v/continuous_uncut_footage_of_the_falcon_heavy/,spacex,1828412,2
Elon Musk says SpaceX will send missions to Mars every orbital opportunity (26 months) starting in 2018.,2494,4m5g4m,https://twitter.com/TheAlexKnapp/status/738223764459114497,471,1464841491.0,ethan829,0.93,/r/spacex/comments/4m5g4m/elon_musk_says_spacex_will_send_missions_to_mars/,spacex,1828412,2
SpaceX targets 2021 commercial Starship launch,2488,c6nyvn,https://spacenews.com/spacex-targets-2021-commercial-starship-launch/,526,1561747564.0,ketivab,0.98,/r/spacex/comments/c6nyvn/spacex_targets_2021_commercial_starship_launch/,spacex,1828412,2
Starlink 4-3 takes to the skies!,2489,r7kkf9,https://i.redd.it/z65lly7ft7381.jpg,53,1638488366.0,mdcainjr,0.98,/r/spacex/comments/r7kkf9/starlink_43_takes_to_the_skies/,spacex,1828412,2
"Long exposure photograph I took from Satellite Beach, Florida of this morning’s 2:00am launch of Falcon 9 and EchoStar XXIII. I caught the first and second stage burns!",2482,5zoxv7,http://i.imgur.com/IGlBYaC.jpg,121,1489644361.0,johnkphotos,0.99,/r/spacex/comments/5zoxv7/long_exposure_photograph_i_took_from_satellite/,spacex,1828412,2
SpaceX CRS-20 launch from Lake Nona,2480,fevtvy,https://i.redd.it/vynyof1ug9l41.jpg,40,1583591427.0,stevenmadow,0.99,/r/spacex/comments/fevtvy/spacex_crs20_launch_from_lake_nona/,spacex,1828412,2
Falcon Heavy USSF-67 delights spectators on Cape Canaveral Beach,2471,10d0ice,https://i.redd.it/rhd6as0tzaca1.jpg,89,1673830466.0,CCBRChris,0.97,/r/spacex/comments/10d0ice/falcon_heavy_ussf67_delights_spectators_on_cape/,spacex,1828412,2
SpaceX: More than 100 spacecraft have been signed up to fly on Falcon 9 since we launched the rideshare program. Small satellite operators can book their ride to orbit online → spacex.com/rideshare,2459,hb4tgt,https://twitter.com/spacex/status/1273426202188005377?s=21,308,1592443472.0,Tommy099431,0.98,/r/spacex/comments/hb4tgt/spacex_more_than_100_spacecraft_have_been_signed/,spacex,1828412,2
More Starlink satellites on their way to orbit,2456,wztbts,https://i.redd.it/7uqc3lklxfk91.jpg,54,1661686506.0,stevenmadow,0.97,/r/spacex/comments/wztbts/more_starlink_satellites_on_their_way_to_orbit/,spacex,1828412,2
SpaceX on Twitter: Falcon 9 first stage has landed at LZ-1,2445,68legz,https://twitter.com/SpaceX/status/859006000136769536,344,1493638068.0,TheVehicleDestroyer,0.99,/r/spacex/comments/68legz/spacex_on_twitter_falcon_9_first_stage_has_landed/,spacex,1828412,2
Falcon 9. Merah Putih. Fury. — johnkrausphotos.com,2443,95c8of,https://i.redd.it/mffpbl2jooe11.jpg,99,1533653093.0,johnkphotos,0.96,/r/spacex/comments/95c8of/falcon_9_merah_putih_fury_johnkrausphotoscom/,spacex,1828412,2
Elon Musk: Thanks for the longstanding faith in SpaceX. We very much look forward to doing this milestone flight with you.,2438,50bega,https://twitter.com/elonmusk/status/770629571972435969,188,1472567453.0,OccupyMarsNow,0.92,/r/spacex/comments/50bega/elon_musk_thanks_for_the_longstanding_faith_in/,spacex,1828412,2
AmericaSpace article: Air Force Strike Takes Out SpaceX’s Floating GovSat Booster,2438,7w4pag,http://www.americaspace.com/2018/02/08/air-force-strike-takes-out-spacexs-floating-govsat-booster/,636,1518095851.0,johnkphotos,0.95,/r/spacex/comments/7w4pag/americaspace_article_air_force_strike_takes_out/,spacex,1828412,2
Elon on twitter:”Falcon 9 on launch pad with Crew Dragon & new astronaut walkway”,2437,ad8g9c,https://twitter.com/elonmusk/status/1081986795452157955?s=21,157,1546800804.0,Blackrobot101,0.97,/r/spacex/comments/ad8g9c/elon_on_twitterfalcon_9_on_launch_pad_with_crew/,spacex,1828412,2
"Falcon 9 GovSat-1 Photo, Shot Through a Refractor Telescope 11 Miles Away - Photo By @bassfaceglenn",2430,7v01by,https://i.redd.it/i7asw4hsq0e01.jpg,77,1517672967.0,bassfaceglenn,0.97,/r/spacex/comments/7v01by/falcon_9_govsat1_photo_shot_through_a_refractor/,spacex,1828412,2
Starship SN9 launch and er... landing... in 4K!,2422,lbr5je,https://youtu.be/SARzFHLdgmM,259,1612369083.0,TMahlman,0.98,/r/spacex/comments/lbr5je/starship_sn9_launch_and_er_landing_in_4k/,spacex,1828412,2
"Elon on Twitter: ""Russia has excellent rocket engineering & best engine currently flying. Reusable version of their new Angara rocket would be great.""",2422,ayg5x3,https://twitter.com/elonmusk/status/1103729668987842560,342,1551984737.0,Blackrobot101,0.97,/r/spacex/comments/ayg5x3/elon_on_twitter_russia_has_excellent_rocket/,spacex,1828412,2
Crew Dragon for Crew-1 mission in Hawthorne,2425,i087im,https://i.redd.it/apts18dhxud51.png,85,1596055015.0,ReKt1971,0.99,/r/spacex/comments/i087im/crew_dragon_for_crew1_mission_in_hawthorne/,spacex,1828412,2
SpaceX team has completed 13 successful tests in a row of upgraded Mark 3 parachutes for Crew Dragon.,2417,dr4zga,https://twitter.com/SpaceX/status/1191067348914098176,173,1572807924.0,FoxhoundBat,0.98,/r/spacex/comments/dr4zga/spacex_team_has_completed_13_successful_tests_in/,spacex,1828412,2
"A rainbow briefly formed over the Falcon 9 / Crew-1 booster, B1061.1, after its return to Port Canaveral last week",2415,jzm80y,https://i.redd.it/tpv09nfqz0161.jpg,32,1606152958.0,johnkphotos,0.98,/r/spacex/comments/jzm80y/a_rainbow_briefly_formed_over_the_falcon_9_crew1/,spacex,1828412,2
"Thank you, SpaceX",2411,7w0mu7,https://www.reddit.com/r/spacex/comments/7w0mu7/thank_you_spacex/,357,1518047773.0,TheVehicleDestroyer,0.97,/r/spacex/comments/7w0mu7/thank_you_spacex/,spacex,1828412,2
"SpaceX's flightworthy boosters as of Mar 11, 2021",2397,m2yc36,https://i.redd.it/u8dk69zg8gm61.png,244,1615490288.0,rykllan,0.99,/r/spacex/comments/m2yc36/spacexs_flightworthy_boosters_as_of_mar_11_2021/,spacex,1828412,2
Elon Musk and Jim Bridenstine interview inside Firing Room #4!,2390,grlfkb,https://www.youtube.com/watch?v=p4ZLysa9Qqg&feature=youtu.be,189,1590592132.0,everydayastronaut,0.97,/r/spacex/comments/grlfkb/elon_musk_and_jim_bridenstine_interview_inside/,spacex,1828412,2
SpaceX on Twitter: SpaceX’s fifth high-altitude flight test of Starship from Starbase in Texas,2387,nbpcr7,https://twitter.com/SpaceX/status/1392926112540364807,278,1620934710.0,ModeHopper,0.98,/r/spacex/comments/nbpcr7/spacex_on_twitter_spacexs_fifth_highaltitude/,spacex,1828412,2
@BocaChicaGal: It’s happening......Booster BN1 stacking has begun in the high bay!!! 🔥🚀🔥,2383,m3i36t,https://twitter.com/bocachicagal/status/1370352617738633220,376,1615557554.0,CProphet,0.98,/r/spacex/comments/m3i36t/bocachicagal_its_happeningbooster_bn1_stacking/,spacex,1828412,2
Welcome back F9-024!,2386,4i3tcz,http://i.imgur.com/VnpJekb.jpg,248,1462512820.0,TMahlman,0.89,/r/spacex/comments/4i3tcz/welcome_back_f9024/,spacex,1828412,2
Detailed images of Falcon 9 B1050.1 being towed into Port Canaveral following splashdown off Florida coast,2359,a41s59,https://imgur.com/a/gcP3l5C,389,1544202166.0,johnkphotos,0.97,/r/spacex/comments/a41s59/detailed_images_of_falcon_9_b10501_being_towed/,spacex,1828412,2
Gwynne Shotwell: 18 months until Starship flies and <5 years until SpaceX puts cargo on Mars.,2357,buj667,https://twitter.com/RocketJoy/status/1133818584482947072?s=19,487,1559158950.0,shaldag_x,0.97,/r/spacex/comments/buj667/gwynne_shotwell_18_months_until_starship_flies/,spacex,1828412,2
"[Elon Musk] Yes, Booster 1 is a production pathfinder, figuring out how to build & transport 70 meter tall stage. Booster 2 will fly.",2351,m8eekc,https://twitter.com/elonmusk/status/1372695421487824903?s=21,313,1616150169.0,tonybinky20,0.98,/r/spacex/comments/m8eekc/elon_musk_yes_booster_1_is_a_production/,spacex,1828412,2
Elon on Twitter: First flight for Falcon Heavy Block 5 means there is some risk of failure between 5% to 10%,2349,bbng0e,https://twitter.com/elonmusk/status/1115998728878321672?s=21,336,1554910635.0,rustybeancake,0.98,/r/spacex/comments/bbng0e/elon_on_twitter_first_flight_for_falcon_heavy/,spacex,1828412,2
SpaceX launch from 50 miles away in Downtown Orlando (IG: @stevenmadow),2351,duv391,https://i.redd.it/gegdqlsh73y31.jpg,78,1573491138.0,stevenmadow,0.99,/r/spacex/comments/duv391/spacex_launch_from_50_miles_away_in_downtown/,spacex,1828412,2
NASA’s Launch Services Program (LSP) has certified Falcon 9 as a Category 3 launch vehicle. Category 3 launch vehicles are certified to support NASA’s highest cost and most complex scientific missions.,2348,9ve3bx,https://twitter.com/NASASpaceflight/status/1060643641277009920,164,1541712157.0,venku122,0.97,/r/spacex/comments/9ve3bx/nasas_launch_services_program_lsp_has_certified/,spacex,1828412,2
Congress may allow NASA to launch Europa Clipper on a Falcon Heavy,2344,hmwsk7,https://arstechnica.com/science/2020/07/house-budget-for-nasa-frees-europa-clipper-from-sls-rocket/,393,1594136146.0,CProphet,0.99,/r/spacex/comments/hmwsk7/congress_may_allow_nasa_to_launch_europa_clipper/,spacex,1828412,2
Falcon Heavy in foreground on Launch Complex 39A and Falcon 9 in background on 40,2343,7u5umk,https://www.instagram.com/p/BemBlnSAACd/,174,1517359417.0,jclishman,0.96,/r/spacex/comments/7u5umk/falcon_heavy_in_foreground_on_launch_complex_39a/,spacex,1828412,2
"Elon Musk on Twitter - ""Pics of SpaceX spacesuit developed for NASA commercial crew program coming out next week. Undergoing ocean landing mobility/safety tests.""",2344,6usw8h,https://twitter.com/elonmusk/status/899075756508065793,350,1503191368.0,jclishman,0.99,/r/spacex/comments/6usw8h/elon_musk_on_twitter_pics_of_spacex_spacesuit/,spacex,1828412,2
SpaceX wants to test its Starlink satellite internet network with the ships it uses to land rockets,2338,itxsne,https://www.cnbc.com/2020/09/16/spacex-asks-to-test-starlink-internet-with-its-fleet-of-boats.html,276,1600270253.0,thesheetztweetz,0.98,/r/spacex/comments/itxsne/spacex_wants_to_test_its_starlink_satellite/,spacex,1828412,2
"Elon Musk: Starship + Super Heavy propellant mass is 4800 tons (78% O2 & 22% CH4). I think we can get propellant cost down to ~$100/ton in volume, so ~$500k/flight. With high flight rate, probably below $1.5M fully burdened cost for 150 tons to orbit or ~$10/kg.",2336,gflpi2,https://twitter.com/elonmusk/status/1258580078218412033,811,1588909303.0,Tommy099431,0.96,/r/spacex/comments/gflpi2/elon_musk_starship_super_heavy_propellant_mass_is/,spacex,1828412,2
