title,score,id,url,num_comments,created,author,upvote_ratio,permalink,subreddit,subreddit_subscribers,author_name
"I'm 17 years old and just finished building this 14.7"" f/2.89 Newtonian reflector telescope. Despite its stubby size it collects roughly 2500 times more light than the human eye and is bigger than the scope at my local observatory.",219754,frdd1d,https://i.redd.it/luf6z5ghfop41.jpg,5008,1585516106.0,__Augustus_,0.92,/r/space/comments/frdd1d/im_17_years_old_and_just_finished_building_this/,space,22943291,__Augustus_
First full-colour Image of deep space from the James Webb Space Telescope revealed by NASA (in 4k),186352,vwv1et,https://i.redd.it/upud5pzg32b91.jpg,8263,1657578353.0,GroundbreakingSet187,0.95,/r/space/comments/vwv1et/first_fullcolour_image_of_deep_space_from_the/,space,22943291,GroundbreakingSet187
"I took nearly 50,000 images of the night sky to make an 81 Megapixel image of Tuesday's moon. Uncompressed image linked in the comments. [OC]",178823,arer0k,https://i.redd.it/d1aehdnbq0h21.jpg,3944,1550361606.0,ajamesmccarthy,0.97,/r/space/comments/arer0k/i_took_nearly_50000_images_of_the_night_sky_to/,space,22943291,ajamesmccarthy
"By complete accident I captured a plane crossing in front of our sun. I was able to figure out exactly which flight it was and got connected with the pilot, who was thrilled.",167306,l9ovhe,https://i.redd.it/7vh012zn3re61.jpg,1733,1612135253.0,ajamesmccarthy,0.94,/r/space/comments/l9ovhe/by_complete_accident_i_captured_a_plane_crossing/,space,22943291,ajamesmccarthy
"And just like that, a space race is born.",136438,7iqgbe,https://i.imgur.com/5qShsue.jpg,3575,1512864285.0,Fizrock,0.9,/r/space/comments/7iqgbe/and_just_like_that_a_space_race_is_born/,space,22943291,Fizrock
"Two years ago, I teamed up with a fellow redditor to try and take the most ridiculous moon shot we could come up with. Today, we proudly introduce our newest collaboration, a 174 megapixel look at our cosmic companion. Zoom in to check it out!",124964,wtl9fj,https://i.redd.it/zm4nfgq29yi91.jpg,2320,1661040016.0,ajamesmccarthy,0.95,/r/space/comments/wtl9fj/two_years_ago_i_teamed_up_with_a_fellow_redditor/,space,22943291,ajamesmccarthy
"I drove 1,400 miles (2,250 km) to put a camera 1,500 feet (466m) from SpaceX’s Falcon Heavy. It was worth it.",109064,7wpa6y,https://i.redd.it/ekarf1ee5hf01.jpg,908,1518307229.0,everydayastronaut,0.88,/r/space/comments/7wpa6y/i_drove_1400_miles_2250_km_to_put_a_camera_1500/,space,22943291,everydayastronaut
Saturn through a telescope,108159,10tvtrg,https://i.redd.it/c4oe6nsvj9ga1.jpg,1355,1675556405.0,danborja,0.95,/r/space/comments/10tvtrg/saturn_through_a_telescope/,space,22943291,danborja
"The surface of Mars, captured by the Curiosity rover.",107970,uva6hr,https://v.redd.it/mygn0nc1w0191,2756,1653223270.0,freudian_nipps,0.95,/r/space/comments/uva6hr/the_surface_of_mars_captured_by_the_curiosity/,space,22943291,freudian_nipps
I teamed up with a fellow redditor to try and make the best moon shot we could. Here is the result!,106034,fis797,https://i.redd.it/kmt13rkm7qm41.jpg,1232,1584230406.0,Idontlikecock,0.96,/r/space/comments/fis797/i_teamed_up_with_a_fellow_redditor_to_try_and/,space,22943291,Idontlikecock
Crew-2's four astronauts board the ISS!,105863,mxid7v,https://v.redd.it/tu3z15d204v61,3120,1619264827.0,CodingCoda,0.95,/r/space/comments/mxid7v/crew2s_four_astronauts_board_the_iss/,space,22943291,CodingCoda
The Needle Galaxy is nearly 50 million light-years away. I used 11 hours of exposure time to capture it from my backyard.,102121,eh7lgq,https://i.redd.it/eddbn0hcjl741.jpg,2343,1577635693.0,chucksastro,0.97,/r/space/comments/eh7lgq/the_needle_galaxy_is_nearly_50_million_lightyears/,space,22943291,chucksastro
The image on the left was my first picture of Jupiter I've ever taken. The right image is after 6 months of practice. Hope you guys like the progress!,101941,7hdcqv,https://i.redd.it/82c7am0jms101.png,1994,1512344414.0,Jfredolay,0.94,/r/space/comments/7hdcqv/the_image_on_the_left_was_my_first_picture_of/,space,22943291,Jfredolay
"One year ago I shared my highest resolution picture of our moon. Last night I created an improved version, combining 140,000 pictures. 400 megapixel full resolution linked in the comments. [OC]",101492,exf4yp,https://i.redd.it/h8imvrbshee41.jpg,1701,1580601604.0,ajamesmccarthy,0.95,/r/space/comments/exf4yp/one_year_ago_i_shared_my_highest_resolution/,space,22943291,ajamesmccarthy
The speed of light between Earth and Moon in real time,101069,ahww32,https://i.imgur.com/PS0vSkm.gif,2353,1547985817.0,berrysardar,0.95,/r/space/comments/ahww32/the_speed_of_light_between_earth_and_moon_in_real/,space,22943291,berrysardar
A picture of Saturn I took after sunrise,100923,tp8jr7,https://i.redd.it/2eu551sxmtp81.jpg,1178,1648341169.0,danborja,0.95,/r/space/comments/tp8jr7/a_picture_of_saturn_i_took_after_sunrise/,space,22943291,danborja
"Our solar system in 2018, a composition from pictures i was able to take from my backyard",99218,afn68d,https://i.redd.it/0r7wgjn7y8a21.png,2083,1547409780.0,ajamesmccarthy,0.93,/r/space/comments/afn68d/our_solar_system_in_2018_a_composition_from/,space,22943291,ajamesmccarthy
I photographed the International Space Station crossing the full moon Thursday evening during a transit window which lasted a mere 0.58 seconds,98158,enmuq0,https://i.redd.it/3zp57fd1cca41.jpg,1452,1578831805.0,johnkphotos,0.96,/r/space/comments/enmuq0/i_photographed_the_international_space_station/,space,22943291,johnkphotos
"This is my best picture of Saturn, taken from my backyard. Merry Christmas Everyone!",97103,7lwtjl,https://i.redd.it/m999hrkb3x501.png,1541,1514142079.0,Jfredolay,0.94,/r/space/comments/7lwtjl/this_is_my_best_picture_of_saturn_taken_from_my/,space,22943291,Jfredolay
"That's not camera noise- it's tens of thousands of stars. My image of the Snake Nebula, one of the most star dense regions in the sky, zoom in to see them all! [OC]",95386,hcwp7l,https://i.redd.it/lqd6kx22arx41.jpg,2251,1592697606.0,Idontlikecock,0.96,/r/space/comments/hcwp7l/thats_not_camera_noise_its_tens_of_thousands_of/,space,22943291,Idontlikecock
"I photographed the International Space Station crossing this morning's full moon! The ISS orbits Earth at 17,500mph, and this transit lasted only 0.90 seconds.",93676,7au9ye,https://i.imgur.com/ZRCR2zD.jpg,1411,1509840004.0,johnkphotos,0.92,/r/space/comments/7au9ye/i_photographed_the_international_space_station/,space,22943291,johnkphotos
"For the past three years, I've been writing software to process this image of the 2017 solar eclipse, here is the first result from my code!",93460,f4l2jv,https://i.redd.it/zl4y3zv0k7h41.jpg,1146,1581825005.0,SPACESHUTTLEINMYANUS,0.95,/r/space/comments/f4l2jv/for_the_past_three_years_ive_been_writing/,space,22943291,SPACESHUTTLEINMYANUS
NASA’s Perseverance Rover Successfully Lands on Mars,91047,lmwzwb,https://www.reddit.com/r/space/comments/lmwzwb/nasas_perseverance_rover_successfully_lands_on/,2816,1613681775.0,nebuladrifting,0.94,/r/space/comments/lmwzwb/nasas_perseverance_rover_successfully_lands_on/,space,22943291,nebuladrifting
"After staying up til 4am and taking thousands of pictures, I'm proud to present to you my composite image of the longest eclipse of the century. [OC]",89756,qyieoc,https://i.redd.it/bvsvwvkwbu081.jpg,897,1637453331.0,ajamesmccarthy,0.95,/r/space/comments/qyieoc/after_staying_up_til_4am_and_taking_thousands_of/,space,22943291,ajamesmccarthy
"The Sun photographed from the same spot, at the same hour, on different days throughout the year",89614,6je76h,https://i.imgur.com/WI9ePTE.jpg,1185,1498395557.0,gDisasters,0.91,/r/space/comments/6je76h/the_sun_photographed_from_the_same_spot_at_the/,space,22943291,gDisasters
"My best shot of Saturn so far, taken with an 8"" telescope from my backyard in Sacramento. [OC]",88900,d13qbj,https://i.redd.it/9sx79j4of9l31.png,1177,1567900803.0,ajamesmccarthy,0.95,/r/space/comments/d13qbj/my_best_shot_of_saturn_so_far_taken_with_an_8/,space,22943291,ajamesmccarthy
"On Tuesday night I captured my clearest image of the moon *ever* by blending over 100,000 images, captured with a telescope in pristine conditions. Make sure you zoom in to properly experience it. [OC]",88353,kksy80,https://i.redd.it/8fgs49trdm761.jpg,1787,1609027208.0,ajamesmccarthy,0.92,/r/space/comments/kksy80/on_tuesday_night_i_captured_my_clearest_image_of/,space,22943291,ajamesmccarthy
ISS crew watching Star Wars in space,87413,7luvgs,https://i.redd.it/bb487rnx3v501.jpg,2726,1514117754.0,RocketRundown,0.9,/r/space/comments/7luvgs/iss_crew_watching_star_wars_in_space/,space,22943291,RocketRundown
Hubble's shot of the Pillars of Creation versus one I took from my backyard in Sacramento last night [OC],87021,bvrdd8,https://i.redd.it/cxfwfn5h3u131.jpg,1497,1559433695.0,ajamesmccarthy,0.96,/r/space/comments/bvrdd8/hubbles_shot_of_the_pillars_of_creation_versus/,space,22943291,ajamesmccarthy
I rented a plane for a great view of the launch of NASA’s newest Mars rover last month,85549,if36p9,https://i.redd.it/3i8mrz2v7ri51.jpg,886,1598189318.0,johnkphotos,0.93,/r/space/comments/if36p9/i_rented_a_plane_for_a_great_view_of_the_launch/,space,22943291,johnkphotos
"Last night I captured a rare event, the ISS crossing the surface of the moon. This is a close crop of my shot, check out the full size linked in the comments. [OC]",85492,ffimgi,https://i.redd.it/7jyyt3s3eil41.jpg,867,1583699548.0,ajamesmccarthy,0.96,/r/space/comments/ffimgi/last_night_i_captured_a_rare_event_the_iss/,space,22943291,ajamesmccarthy
I took a photo of every planet in our solar system and adjusted their size to show how huge our Sun is. Zoom in to see how tiny Earth is in comparison. [OC],84949,dxez6h,https://i.redd.it/pa98pybbx4z31.jpg,2756,1573948808.0,ajamesmccarthy,0.95,/r/space/comments/dxez6h/i_took_a_photo_of_every_planet_in_our_solar/,space,22943291,ajamesmccarthy
Curiosity rover snaps spectacular Mars panorama,84226,cd2iwh,https://gfycat.com/genuinegorgeousanteater,1814,1563107716.0,mossberg91,0.97,/r/space/comments/cd2iwh/curiosity_rover_snaps_spectacular_mars_panorama/,space,22943291,mossberg91
"My newest and biggest homemade telescope, a 24” Dobsonian. I plan to try to observe the dwarf planet Makemake with it.",82066,k83ujw,https://i.redd.it/avbtbgihan361.jpg,1724,1607294582.0,__Augustus_,0.93,/r/space/comments/k83ujw/my_newest_and_biggest_homemade_telescope_a_24/,space,22943291,__Augustus_
"16,700 NASA employees, 96% of the NASA workforce, are out of work due to the partial federal government shutdown. About 200 employees at NASA's Johnson Space Center will continue working primarily to keep the three astronauts aboard the ISS alive.",81991,aab1gc,https://www.houstonchronicle.com/news/nation-world/space/article/NASA-other-federal-workers-not-as-supportive-of-13491632.php,2062,1546009544.0,MaryADraper,0.84,/r/space/comments/aab1gc/16700_nasa_employees_96_of_the_nasa_workforce_are/,space,22943291,MaryADraper
"Pluto’s Mountains, Frozen Plains and Foggy Hazes - from NASA’s New Horizons Space Probe",78707,ul6v1k,https://v.redd.it/q1jp9mk8gay81,1966,1652031477.0,freudian_nipps,0.97,/r/space/comments/ul6v1k/plutos_mountains_frozen_plains_and_foggy_hazes/,space,22943291,freudian_nipps
Earth behind a flower grown on the International Space Station,78347,8j49iq,https://upload.wikimedia.org/wikipedia/commons/c/c3/ISS-46_Zinnia_flower_in_front_of_the_Earth.jpg,640,1526222922.0,Aeromarine_eng,0.95,/r/space/comments/8j49iq/earth_behind_a_flower_grown_on_the_international/,space,22943291,Aeromarine_eng
This image of the space station transiting the crescent moon got me shortlisted as astrophotographer of the year [OC],78253,p4w5bm,https://i.redd.it/axfdkc3bojh71.jpg,818,1629043241.0,ajamesmccarthy,0.94,/r/space/comments/p4w5bm/this_image_of_the_space_station_transiting_the/,space,22943291,ajamesmccarthy
NASA InSight has landed on Mars,78190,a0mu37,https://www.reddit.com/r/space/comments/a0mu37/nasa_insight_has_landed_on_mars/,2354,1543262122.0,nebuladrifting,0.94,/r/space/comments/a0mu37/nasa_insight_has_landed_on_mars/,space,22943291,nebuladrifting
Triple-core thrust: Closeup photo I shot of Falcon Heavy’s fury,78030,7wv18g,https://www.imgur.com/nNhszKK.jpg,723,1518378395.0,johnkphotos,0.89,/r/space/comments/7wv18g/triplecore_thrust_closeup_photo_i_shot_of_falcon/,space,22943291,johnkphotos
I animated my picture of the Andromeda Galaxy,77603,81u5iu,https://gfycat.com/LinearEvenDrever,1247,1520122242.0,Idontlikecock,0.9,/r/space/comments/81u5iu/i_animated_my_picture_of_the_andromeda_galaxy/,space,22943291,Idontlikecock
Traveled to the darkest skies I could find in the U.S. to shoot the Milky Way. This photo is the result.,76817,va9xjl,https://i.redd.it/21upkdr503591.jpg,1307,1654992287.0,MrJackDog,0.94,/r/space/comments/va9xjl/traveled_to_the_darkest_skies_i_could_find_in_the/,space,22943291,MrJackDog
Volcanic eruption from Space,76656,8hhh6z,https://upload.wikimedia.org/wikipedia/commons/f/fe/Sarychev_Volcano_edit.jpg,802,1525633831.0,Aeromarine_eng,0.93,/r/space/comments/8hhh6z/volcanic_eruption_from_space/,space,22943291,Aeromarine_eng
"The Columbia Space Shuttle disintegrated upon re-entry into Earth’s atmosphere 15 years ago. Today, NASA will honor all those who have lost their lives while advancing human space exploration.",75474,7swtbo,http://www.astronomy.com/news/2018/01/remembering-the-columbia-disaster,2092,1516894175.0,clayt6,0.92,/r/space/comments/7swtbo/the_columbia_space_shuttle_disintegrated_upon/,space,22943291,clayt6
"I used an amateur telescope to collect light from deep space for over 13 hours, revealing this beautiful pair of galaxies [OC]",75148,earhl3,https://i.redd.it/xv5sm87wto441.jpg,1696,1576368004.0,TheVastReaches,0.96,/r/space/comments/earhl3/i_used_an_amateur_telescope_to_collect_light_from/,space,22943291,TheVastReaches
"The pulse of the gas thrusters on SpaceX's Falcon 9, as the rocket's boost stage guides it back to Earth",75034,cy3b9z,https://i.imgur.com/ffDsKZr.gifv,1004,1567297824.0,mossberg91,0.96,/r/space/comments/cy3b9z/the_pulse_of_the_gas_thrusters_on_spacexs_falcon/,space,22943291,mossberg91
"Two touching stars are expected to fully merge in 2022. The resulting explosion, called a Red Nova, will be visible to the naked eye.",74339,8rn0ys,http://www.astronomy.com/news/2017/01/2022-red-nova,2104,1529190412.0,clayt6,0.95,/r/space/comments/8rn0ys/two_touching_stars_are_expected_to_fully_merge_in/,space,22943291,clayt6
I photographed myself looking at the Milky Way just before sunrise over the Atlantic Ocean.,74320,800o0l,https://i.imgur.com/0wLCdUO.jpg,941,1519516804.0,marcuscotephoto,0.86,/r/space/comments/800o0l/i_photographed_myself_looking_at_the_milky_way/,space,22943291,marcuscotephoto
Home Telescope vs. The Hubble Space Telescope. This is the Pillars of Creation.,74082,f17grh,https://i.redd.it/3emmc67dvvf41.jpg,1308,1581247607.0,chucksastro,0.96,/r/space/comments/f17grh/home_telescope_vs_the_hubble_space_telescope_this/,space,22943290,chucksastro
"I set a camera 1,000 feet away from SpaceX's first reused rocket and it captured this beautiful shot",73780,62lt1h,http://i.imgur.com/InTf1LQ.jpg,859,1490973588.0,everydayastronaut,0.92,/r/space/comments/62lt1h/i_set_a_camera_1000_feet_away_from_spacexs_first/,space,22943290,everydayastronaut
My best astrophotography image since starting the hobby three years ago,73780,z5m2bf,https://i.redd.it/xgzj0efuef2a1.jpg,546,1669507479.0,MrJackDog,0.94,/r/space/comments/z5m2bf/my_best_astrophotography_image_since_starting_the/,space,22943290,MrJackDog
I spent a month shooting our moon to attempt to capture how it dances in our sky. This required capturing over 2 million individual photos and over 12 Terabytes of data to produce at this level of detail.,73720,ti92sz,https://gfycat.com/valuableacclaimedkissingbug,861,1647736481.0,ajamesmccarthy,0.93,/r/space/comments/ti92sz/i_spent_a_month_shooting_our_moon_to_attempt_to/,space,22943290,ajamesmccarthy
I created a long-exposure composite of last week's Atlas V launch and star trails above an abandoned sailboat.,73630,7tgo5x,https://i.imgur.com/AKHzSUQ.jpg,877,1517097615.0,marcuscotephoto,0.92,/r/space/comments/7tgo5x/i_created_a_longexposure_composite_of_last_weeks/,space,22943290,marcuscotephoto
"Tuesday morning Mars was temporarily hidden by the moon. Here is my shot, captured right as Mars emerged from the dark side. [OC]",71701,f819o8,https://i.redd.it/clr0xjl49ki41.jpg,743,1582416004.0,ajamesmccarthy,0.96,/r/space/comments/f819o8/tuesday_morning_mars_was_temporarily_hidden_by/,space,22943290,ajamesmccarthy
Blue Origin New Shepard booster landing after flying to space on today's test flight,71556,mr1ah1,https://v.redd.it/vpa5nw6xp7t61,2907,1618438203.0,675longtail,0.93,/r/space/comments/mr1ah1/blue_origin_new_shepard_booster_landing_after/,space,22943290,675longtail
I pointed my telescope at the Phoenix Nebula for almost 12 hours to capture this.,71420,fquq84,https://i.redd.it/aly8jwxevhp41.jpg,769,1585436597.0,chucksastro,0.94,/r/space/comments/fquq84/i_pointed_my_telescope_at_the_phoenix_nebula_for/,space,22943290,chucksastro
Long exposure photograph I captured of the recent SpaceX Starlink launch and its reflection along the shoreline of the Atlantic Ocean.,71015,enfogl,https://i.redd.it/gk1e3rnqn8a41.jpg,675,1578787313.0,johnkphotos,0.93,/r/space/comments/enfogl/long_exposure_photograph_i_captured_of_the_recent/,space,22943290,johnkphotos
"A recent picture I shot, using a backyard solar telescope, reveals the twisted detail of the Sun’s magnetic field. [OC]",70689,kyunx2,https://i.redd.it/zl8b3l1m9sb61.jpg,1420,1610841606.0,TheVastReaches,0.94,/r/space/comments/kyunx2/a_recent_picture_i_shot_using_a_backyard_solar/,space,22943290,TheVastReaches
I took my favorite picture of the moon ever by combining 200k photos [OC],70517,bt1fx8,https://i.redd.it/lwdazeoj5g031.jpg,1116,1558829050.0,ajamesmccarthy,0.94,/r/space/comments/bt1fx8/i_took_my_favorite_picture_of_the_moon_ever_by/,space,22943290,ajamesmccarthy
This pic I took looks like it could be a movie poster,69990,ug7gaw,https://i.redd.it/umxjzkg47kw81.jpg,1061,1651433586.0,EkantTakePhotos,0.86,/r/space/comments/ug7gaw/this_pic_i_took_looks_like_it_could_be_a_movie/,space,22943290,EkantTakePhotos
I captured something most astrophotographers can only dream about: I captured Star Trails from space. More details in comments.,69843,xbmhz4,https://i.redd.it/1cfd4oj779n91.jpg,929,1662912747.0,astro_pettit,0.92,/r/space/comments/xbmhz4/i_captured_something_most_astrophotographers_can/,space,22943290,astro_pettit
Meteor leaves a smoke ring,69830,9e8rts,https://i.imgur.com/YcIGSeD.gifv,899,1536451287.0,Fizrock,0.92,/r/space/comments/9e8rts/meteor_leaves_a_smoke_ring/,space,22943290,Fizrock
"I used over 24 hours of exposure of the night sky to reveal hundreds of galaxies, zoom in to see them!",69512,du3yub,https://i.redd.it/2ey863tfyqx31.jpg,1642,1573344003.0,Idontlikecock,0.95,/r/space/comments/du3yub/i_used_over_24_hours_of_exposure_of_the_night_sky/,space,22943290,Idontlikecock
The largest space telescope in history is about to blow our minds. The James Webb Space Telescope will be 100 times as powerful as the Hubble. It will change how we see the universe.,69210,px6zxk,https://www.vox.com/science-and-health/22664709/james-webb-space-telescope-launch-date-december-science-hubble,2503,1632837559.0,MaryADraper,0.94,/r/space/comments/px6zxk/the_largest_space_telescope_in_history_is_about/,space,22943290,MaryADraper
"After spending all night shooting around 600,000 photos of it, I’m thrilled to show you my sharpest Jupiter shot so far. This was captured using an 11” telescope and a camera I usually use for deep sky work.",69171,xh4duv,https://i.redd.it/lq9vyqin0jo91.jpg,909,1663467246.0,ajamesmccarthy,0.95,/r/space/comments/xh4duv/after_spending_all_night_shooting_around_600000/,space,22943290,ajamesmccarthy
"I took a picture of the railway, train and the solar eclipse",68399,10uel0n,https://i.imgur.com/c1xhaaJ.jpg,461,1675609527.0,PageD0WN,0.94,/r/space/comments/10uel0n/i_took_a_picture_of_the_railway_train_and_the/,space,22943290,PageD0WN
"For 134 years astronomers have been taking photos of the andromeda galaxy, but none have ever captured this newly discovered nebula hidden in plain sight right next to the galaxy!",68245,10c4u3x,https://i.redd.it/djk2l5g4l3ca1.jpg,879,1673740854.0,SPACESHUTTLEINMYANUS,0.96,/r/space/comments/10c4u3x/for_134_years_astronomers_have_been_taking_photos/,space,22943290,SPACESHUTTLEINMYANUS
"This is a 124 shot, 500MP image I took recently of the Milky Way over Lake Leschenaultia in Western Australia.",67989,6m74iz,http://imgur.com/PoeDHGD,874,1499602321.0,inefekt,0.92,/r/space/comments/6m74iz/this_is_a_124_shot_500mp_image_i_took_recently_of/,space,22943290,inefekt
Shockwave On the Sun Following a Solar Flare,67928,c76h7e,https://i.imgur.com/ZajaPxH.gifv,1998,1561852802.0,mossberg91,0.96,/r/space/comments/c76h7e/shockwave_on_the_sun_following_a_solar_flare/,space,22943290,mossberg91
"Probably my luckiest shot ever, I captured a shot of the ISS right on the terminator of a slim crescent moon. [OC]",67705,jd62c8,https://i.redd.it/mqnvv0wsuqt51.jpg,615,1602979313.0,ajamesmccarthy,0.94,/r/space/comments/jd62c8/probably_my_luckiest_shot_ever_i_captured_a_shot/,space,22943290,ajamesmccarthy
Proton-M launch goes horribly wrong,67569,9lmgi3,https://v.redd.it/fenph0hmgdq11,3205,1538747530.0,RocketRundown,0.91,/r/space/comments/9lmgi3/protonm_launch_goes_horribly_wrong/,space,22943290,RocketRundown
I photographed a surfer and parasailor watching Monday's Falcon 9 rocket landing.,66884,6utayd,http://i.imgur.com/ycVab1X.jpg,1079,1503196364.0,marcuscotephoto,0.91,/r/space/comments/6utayd/i_photographed_a_surfer_and_parasailor_watching/,space,22943290,marcuscotephoto
"After 780 days in space, the U.S. Air Force's secret spaceplane has returned to Earth",66770,dnskvt,https://i.redd.it/ugwb6r0su2v31.jpg,3148,1572179345.0,675longtail,0.95,/r/space/comments/dnskvt/after_780_days_in_space_the_us_air_forces_secret/,space,22943290,675longtail
Long exposure photo of a Falcon 9 rocket launch and its reflection; the symmetry makes this my favorite image I've shot to date!,66743,ad0809,https://i.redd.it/kfaa3fxd6p821.jpg,564,1546734553.0,johnkphotos,0.92,/r/space/comments/ad0809/long_exposure_photo_of_a_falcon_9_rocket_launch/,space,22943290,johnkphotos
I made a 4k wallpaper consisting of my favorite astronomy images through the years,66455,92z6oa,https://i.imgur.com/OAFbZbI.jpg,666,1532908039.0,Idontlikecock,0.9,/r/space/comments/92z6oa/i_made_a_4k_wallpaper_consisting_of_my_favorite/,space,22943290,Idontlikecock
My 18 Hour exposure photo of the Helix Nebula from my backyard,66289,dkc3u2,https://i.redd.it/yw09nlyl9lt31.jpg,695,1571530574.0,OkeWoke,0.96,/r/space/comments/dkc3u2/my_18_hour_exposure_photo_of_the_helix_nebula/,space,22943290,OkeWoke
All the planets aligned into one,66196,9m70ho,https://i.imgur.com/vgLIth5.jpg,1202,1538934519.0,Fizrock,0.84,/r/space/comments/9m70ho/all_the_planets_aligned_into_one/,space,22943290,Fizrock
Tripping on the moon,65864,6b3tos,http://i.imgur.com/C2H6SmE.gifv,2126,1494767573.0,Fizrock,0.93,/r/space/comments/6b3tos/tripping_on_the_moon/,space,22943290,Fizrock
"I took one tracked and one untracked exposure of the Milky Way and combined them to bring out an extreme amount of detail - Rocky Mountain National Park, CO",65728,90xi4p,https://i.redd.it/660wq44lwhb11.jpg,676,1532263511.0,DanielJStein,0.93,/r/space/comments/90xi4p/i_took_one_tracked_and_one_untracked_exposure_of/,space,22943290,DanielJStein
"In one of the most rewarding shots of my career, I captured the International Space Station in conjunction with the 53-mile-wide Tycho crater on the moon. More details in the comments.",65224,10657av,https://i.redd.it/3dy049jxpoaa1.jpg,567,1673139466.0,ajamesmccarthy,0.94,/r/space/comments/10657av/in_one_of_the_most_rewarding_shots_of_my_career_i/,space,22943290,ajamesmccarthy
"The family photo that Charlie Duke left on the Moon on April 23, 1972.... On the back side of the photo a message reads “this is the family of astronaut Duke from planet Earth. Landed on the moon, April 1972”.",64976,77wzun,https://i.redd.it/5spjcnkvv9tz.jpg,2115,1508630676.0,Reporter_at_large,0.91,/r/space/comments/77wzun/the_family_photo_that_charlie_duke_left_on_the/,space,22943290,Reporter_at_large
"I extracted the color data from 150k images of the moon so you can see where impacts ""paint"" the moon with different minerals. Wallpaper version and animation linked in the comments [OC]",64878,awo9ce,https://i.redd.it/encd91zeqsj21.jpg,622,1551571945.0,ajamesmccarthy,0.93,/r/space/comments/awo9ce/i_extracted_the_color_data_from_150k_images_of/,space,22943290,ajamesmccarthy
England and Ireland on a rare clear day,64727,10irlba,https://i.redd.it/cmvj6kueroda1.jpg,1470,1674414981.0,Stocky99,0.94,/r/space/comments/10irlba/england_and_ireland_on_a_rare_clear_day/,space,22943290,Stocky99
One of my favorite photos I’ve shot of a SpaceX launch,64674,dnm50n,https://i.redd.it/izhubczx8zu31.png,536,1572135656.0,johnkphotos,0.94,/r/space/comments/dnm50n/one_of_my_favorite_photos_ive_shot_of_a_spacex/,space,22943290,johnkphotos
The Northrop Grumman B-2 Spirit Stealth Bomber temporarily crosses paths with the moon during a rare appearance at the Melbourne Air and Space Show.,64444,86x3n1,https://i.imgur.com/bbGEUZH.jpg,1642,1521936001.0,marcuscotephoto,0.89,/r/space/comments/86x3n1/the_northrop_grumman_b2_spirit_stealth_bomber/,space,22943290,marcuscotephoto
"On Monday I captured my sharpest photo ever of the international space station, even though it only spent 1/25th of a second within the framing of my camera. I’ll share the raw video from the pass in the comments. [OC]",64360,r3qkug,https://i.redd.it/ebjim3kt88281.jpg,806,1638057633.0,ajamesmccarthy,0.95,/r/space/comments/r3qkug/on_monday_i_captured_my_sharpest_photo_ever_of/,space,22943290,ajamesmccarthy
