title,score,id,url,num_comments,created,author,upvote_ratio,permalink,subreddit,subreddit_subscribers,depth
Europe to Force Laptop Makers to Adopt USB-C for Charging | USB-C charging for everything and everyone.,25185,xw6q04,https://www.tomshardware.com/news/europe-to-force-laptop-makers-to-adopt-usb-c-for-charging,1650,1664965110.0,chrisdh79,0.94,/r/gadgets/comments/xw6q04/europe_to_force_laptop_makers_to_adopt_usbc_for/,gadgets,21140247,2
Samsung phones are spontaneously texting users' photos to random contacts without their permission,25134,8vmmxp,https://www.theverge.com/circuitbreaker/2018/7/2/17528076/samsung-phones-text-rcs-update-messages,1965,1530568421.0,drdessertlover,0.92,/r/gadgets/comments/8vmmxp/samsung_phones_are_spontaneously_texting_users/,gadgets,21140247,2
Apple Watch credited with helping cyclist call for help after being swept into flooded river,24902,l6a0zv,https://9to5mac.com/2021/01/27/apple-watch-call-emergency-cyclist/,665,1611769333.0,chrisdh79,0.88,/r/gadgets/comments/l6a0zv/apple_watch_credited_with_helping_cyclist_call/,gadgets,21140247,2
The mini SNES Classic launches in September for $80,24888,6jm6gh,https://www.theverge.com/2017/6/26/15874154/nintendo-snes-classic-edition-release-date-price-announced,3310,1498494624.0,SirVeza,0.84,/r/gadgets/comments/6jm6gh/the_mini_snes_classic_launches_in_september_for_80/,gadgets,21140247,2
AR contact lenses are the holy grail of sci-fi tech. Mojo is making them real,24837,ghaseg,https://www.digitaltrends.com/features/mojo-lens-future-of-augmented-reality/,1605,1589148768.0,MicroSofty88,0.91,/r/gadgets/comments/ghaseg/ar_contact_lenses_are_the_holy_grail_of_scifi/,gadgets,21140247,2
Elon Musk Claims His Mysterious Brain Chip Will Allow People To Hear Previously Impossible Sounds,24754,i24dra,https://www.independent.co.uk/life-style/gadgets-and-tech/news/elon-musk-neuralink-brain-chip-hearing-a9647306.html?amp,3182,1596334111.0,auscrisos,0.81,/r/gadgets/comments/i24dra/elon_musk_claims_his_mysterious_brain_chip_will/,gadgets,21140247,2
Nintendo is reportedly boosting production of Switch consoles,24693,6dvjij,https://www.theverge.com/2017/5/28/15706682/nintendo-switch-reportedly-boosting-production-gaming,3141,1495998513.0,ZoneRangerMC,0.84,/r/gadgets/comments/6dvjij/nintendo_is_reportedly_boosting_production_of/,gadgets,21140247,2
Canon has ended sales for its last film camera,24679,8njkl7,https://www.theverge.com/2018/5/31/17412708/canon-film-camera-ended-sales-eos-1v,1491,1527782394.0,Philo1927,0.92,/r/gadgets/comments/8njkl7/canon_has_ended_sales_for_its_last_film_camera/,gadgets,21140247,2
"Sorry, Apple — a portless iPhone is a terrible idea",24602,10c7dvd,https://www.digitaltrends.com/mobile/apple-iphone-portless-no-ports-terrible-idea-why/?utm_source=reddit&utm_medium=pe&utm_campaign=pd,3207,1673747792.0,ChickenTeriyakiBoy1,0.83,/r/gadgets/comments/10c7dvd/sorry_apple_a_portless_iphone_is_a_terrible_idea/,gadgets,21140247,2
Home Depot plans to foil shoplifters with power tools that won't work if they're stolen,24591,ox62h0,https://www.businessinsider.com/home-depot-fights-shoplifters-special-power-tools-2021-7,3054,1628005251.0,speckz,0.92,/r/gadgets/comments/ox62h0/home_depot_plans_to_foil_shoplifters_with_power/,gadgets,21140247,2
"After 15 Years, Apple Prepares to Break Up With Intel",24508,hda98l,https://www.nytimes.com/2020/06/19/technology/apple-intel-breakup.html,1927,1592758669.0,gulabjamunyaar,0.93,/r/gadgets/comments/hda98l/after_15_years_apple_prepares_to_break_up_with/,gadgets,21140247,2
"Police Destroy 1,069 Bitcoin Miners With Big Ass Steamroller In Malaysia - Malaysian authorities did not mess around when they broke up a cryptocurrency mining farm and charged the operators with stealing electricity.",24425,ongl1h,https://www.vice.com/en/article/7kv739/police-destroy-1069-bitcoin-miners-with-big-ass-steamroller-in-malaysia,1585,1626709269.0,speckz,0.93,/r/gadgets/comments/ongl1h/police_destroy_1069_bitcoin_miners_with_big_ass/,gadgets,21140247,2
Apple may not include EarPods headphones in iPhone 12 box to boost AirPods sales,24306,gn7otw,https://9to5mac.com/2020/05/20/kuo-no-free-earpods-iphone-12/,3411,1589963925.0,gulabjamunyaar,0.9,/r/gadgets/comments/gn7otw/apple_may_not_include_earpods_headphones_in/,gadgets,21140247,2
"A recycling robot named Clarke could be the key to reducing waste - it picks up recyclable waste with 90-percent accuracy, and is about 50 percent faster than a human would be at doing the same job.",24260,6p33iw,https://www.digitaltrends.com/cool-tech/clarke-recycling-robot/,779,1500836201.0,ZoneRangerMC,0.89,/r/gadgets/comments/6p33iw/a_recycling_robot_named_clarke_could_be_the_key/,gadgets,21140247,2
India Considering New Rules That Could Force Apple to Adopt USB-C on iPhone,24126,wrfy8d,https://www.macrumors.com/2022/08/18/india-rules-usb-c-forced-on-iphone/,1811,1660818404.0,chrisdh79,0.93,/r/gadgets/comments/wrfy8d/india_considering_new_rules_that_could_force/,gadgets,21140247,2
Apple has moved some AirPods Pro manufacturing from China to Vietnam,23930,go6eij,https://www.theverge.com/2020/5/21/21266574/apple-airpods-pro-vietnam-china-chinese-manufacturing,1067,1590098807.0,gulabjamunyaar,0.93,/r/gadgets/comments/go6eij/apple_has_moved_some_airpods_pro_manufacturing/,gadgets,21140247,2
Microsoft Has Committed to Right to Repair,23801,q3usgh,https://www.vice.com/en/article/7kvg59/microsoft-has-committed-to-right-to-repair,965,1633687931.0,chrisdh79,0.95,/r/gadgets/comments/q3usgh/microsoft_has_committed_to_right_to_repair/,gadgets,21140247,2
NASA engineer builds homemade gadget to prank porch pirates,23762,a7o4kv,https://www.digitaltrends.com/home/nasa-engineer-mark-rober-glitter-bomb-package-theft/,1425,1545238170.0,ChickenTeriyakiBoy1,0.84,/r/gadgets/comments/a7o4kv/nasa_engineer_builds_homemade_gadget_to_prank/,gadgets,21140247,2
Engineers have developed a synthetic skin for prosthetic limbs that can generate its own energy from solar power,23756,61802k,http://www.bbc.co.uk/news/uk-scotland-39353751,632,1490348744.0,ZoneRangerMC,0.9,/r/gadgets/comments/61802k/engineers_have_developed_a_synthetic_skin_for/,gadgets,21140247,2
Analyst says the iPhone 11 will struggle and be a yawner because of lack of innovation and novelty factor,23721,c0jg4l,"https://www.tomsguide.com/us/iphone-11-analyst-prediction,news-30358.html",4177,1560514817.0,nopantsdolphin,0.88,/r/gadgets/comments/c0jg4l/analyst_says_the_iphone_11_will_struggle_and_be_a/,gadgets,21140247,2
Canadian team discovers power-draining flaw in most laptop and phone batteries | Breakthrough explains major cause of self-discharging batteries and points to easy solution,23665,10q18jz,https://www.cbc.ca/news/canada/nova-scotia/battery-power-laptop-phone-research-dalhousie-university-1.6724175,857,1675177314.0,chrisdh79,0.95,/r/gadgets/comments/10q18jz/canadian_team_discovers_powerdraining_flaw_in/,gadgets,21140247,2
"The $2,000 Galaxy Fold is already breaking",23521,bebv4a,"https://www.tomsguide.com/us/galaxy-fold-screen-problems,news-29889.html",2670,1555528847.0,mspoonygp,0.93,/r/gadgets/comments/bebv4a/the_2000_galaxy_fold_is_already_breaking/,gadgets,21140247,2
The inventor of Roomba has created a weed-slashing robot for your garden,23294,6iuy43,http://www.businessinsider.com/inventor-roomba-behind-roomba-for-gardens-2017-6,1220,1498151774.0,ZoneRangerMC,0.87,/r/gadgets/comments/6iuy43/the_inventor_of_roomba_has_created_a_weedslashing/,gadgets,21140247,2
"Apple Watch Likely to Gain Blood Pressure, Blood Glucose, and Blood Alcohol Monitoring",23289,n3tdn5,https://www.macrumors.com/2021/05/03/apple-watch-blood-pressure-glucose-alcohol/,1846,1620040057.0,UnKindClock,0.93,/r/gadgets/comments/n3tdn5/apple_watch_likely_to_gain_blood_pressure_blood/,gadgets,21140247,2
A hyperrealistic robo-dolphin is paving the way for animatronic aquariums,23105,jnde4k,https://www.digitaltrends.com/features/robot-dolphin-animatronic-aquarium/,743,1604420916.0,MicroSofty88,0.92,/r/gadgets/comments/jnde4k/a_hyperrealistic_robodolphin_is_paving_the_way/,gadgets,21140247,2
"Raspberry Pi Introduces a New $4 Board, and Its Own Silicon",23076,l3e6vy,https://gizmodo.com/raspberry-pi-introduces-a-new-4-board-and-its-own-sil-1846100446,758,1611416157.0,MicroSofty88,0.96,/r/gadgets/comments/l3e6vy/raspberry_pi_introduces_a_new_4_board_and_its_own/,gadgets,21140247,2
Tim Cook's response to improving Android texting compatibility: 'buy your mom an iPhone' | The company appears to have no plans to fix 'green bubbles' anytime soon.,23036,x8xkun,https://www.engadget.com/tim-cook-response-green-bubbles-android-your-mom-095538175.html,5290,1662635230.0,chrisdh79,0.84,/r/gadgets/comments/x8xkun/tim_cooks_response_to_improving_android_texting/,gadgets,21140247,2
It Will Cost $699 to Repair a Broken 12.9-Inch M1 iPad Pro Without AppleCare+,22875,n2e7qa,https://www.macrumors.com/2021/04/30/12-9-inch-ipad-pro-out-of-warranty-fee/,2742,1619857521.0,UnKindClock,0.94,/r/gadgets/comments/n2e7qa/it_will_cost_699_to_repair_a_broken_129inch_m1/,gadgets,21140247,2
Valve is partnering with iFixit to sell Steam Deck replacement parts,22808,stcavx,https://www.pcgamer.com/valve-is-partnering-with-ifixit-to-sell-steam-deck-replacement-parts/,665,1644956398.0,thebelsnickle1991,0.97,/r/gadgets/comments/stcavx/valve_is_partnering_with_ifixit_to_sell_steam/,gadgets,21140247,2
Stadia controllers could become e-waste unless Google issues Bluetooth update - One firmware push could let Stadia fans keep their favorite wireless controller.,22728,xt0stw,https://arstechnica.com/gadgets/2022/09/stadia-controllers-could-become-e-waste-unless-google-issues-bluetooth-update/,1036,1664644484.0,speckz,0.94,/r/gadgets/comments/xt0stw/stadia_controllers_could_become_ewaste_unless/,gadgets,21140247,2
"Microsoft killed the Zune, but Zune-heads are still here",22704,l1yq3l,https://www.theverge.com/22238668/microsoft-zune-fans-mp3-music-player-subreddit,1535,1611236720.0,MicroSofty88,0.92,/r/gadgets/comments/l1yq3l/microsoft_killed_the_zune_but_zuneheads_are_still/,gadgets,21140247,2
50% rejection rate for iPhone casings produced in India shows scale of Apple’s challenge.,22630,11283q1,https://9to5mac.com/2023/02/14/iphone-casings-produced-in-india/,1631,1676388514.0,SUPRVLLAN,0.93,/r/gadgets/comments/11283q1/50_rejection_rate_for_iphone_casings_produced_in/,gadgets,21140247,2
Samsung kills headphone jack in the new Galaxy A8,22579,a4vvsb,"https://www.tomsguide.com/us/galaxy-a8-specs-price-headphone-jack,news-28801.html",4163,1544450380.0,thegeezuss,0.85,/r/gadgets/comments/a4vvsb/samsung_kills_headphone_jack_in_the_new_galaxy_a8/,gadgets,21140247,2
9-year-old unlocks unconscious father's iPhone with his face to call 911,22286,qmhgwl,https://appleinsider.com/articles/21/11/03/9-year-old-unlocks-fathers-iphone-with-his-face-calls-911-as-carbon-monoxide-fills-home,1079,1636020926.0,chrisdh79,0.87,/r/gadgets/comments/qmhgwl/9yearold_unlocks_unconscious_fathers_iphone_with/,gadgets,21140247,2
Passenger sees his lost wallet fly to different cities thanks to AirTag after airline says it couldn’t find it,22256,10qrefw,https://9to5mac.com/2023/01/31/passenger-lost-wallet-35-cities-airtag/,688,1675250797.0,chrisdh79,0.94,/r/gadgets/comments/10qrefw/passenger_sees_his_lost_wallet_fly_to_different/,gadgets,21140247,2
Artificial pancreas successfully treats type 1 diabetes,22225,10djph1,https://interestingengineering.com/innovation/artificial-pancreas-successfully-treat-diabetes,501,1673888196.0,diacewrb,0.95,/r/gadgets/comments/10djph1/artificial_pancreas_successfully_treats_type_1/,gadgets,21140247,2
"Japan's 'Flying Car' Gets Off Ground, With A Person Aboard",22122,ii8fic,https://www.providencejournal.com/news/20200828/japans-flying-car-gets-off-ground-with-person-aboard,842,1598626256.0,auscrisos,0.95,/r/gadgets/comments/ii8fic/japans_flying_car_gets_off_ground_with_a_person/,gadgets,21140247,2
GPU prices could fall dramatically in a matter of weeks,22055,sxxtr6,https://www.digitaltrends.com/computing/new-leak-says-gpu-prices-will-drop-in-march/,1783,1645461391.0,thebelsnickle1991,0.82,/r/gadgets/comments/sxxtr6/gpu_prices_could_fall_dramatically_in_a_matter_of/,gadgets,21140247,2
"Sony is selling a new wearable, pocket-sized air conditioner",22019,hnlpup,https://interestingengineering.com/sony-selling-wearable-air-conditioner-personal-heater-for-roughly-130,1440,1594230557.0,ChickenTeriyakiBoy1,0.93,/r/gadgets/comments/hnlpup/sony_is_selling_a_new_wearable_pocketsized_air/,gadgets,21140247,2
Europe's Biggest 3D Printer Prints an Entire Two-Story House,21946,hsxjf3,https://www.digitaltrends.com/news/kamp-c-3d-printed-building/,704,1594999263.0,MicroSofty88,0.95,/r/gadgets/comments/hsxjf3/europes_biggest_3d_printer_prints_an_entire/,gadgets,21140247,2
"Steam Deck Is Valve's Answer To The Switch, Out In December",21935,okxuy4,https://kotaku.com/steam-deck-is-valves-answer-to-the-switch-out-in-decem-1847299762?scrolla=5eb6d68b7fedc32c19ef33b4,2633,1626370914.0,speckz,0.93,/r/gadgets/comments/okxuy4/steam_deck_is_valves_answer_to_the_switch_out_in/,gadgets,21140247,2
European Union looks to block Apple’s hardware ‘gatekeeping’,21905,uxdwat,https://www.digitaltrends.com/mobile/european-union-digital-markets-act/?utm_source=reddit&utm_medium=pe&utm_campaign=pd,1667,1653472505.0,MicroSofty88,0.94,/r/gadgets/comments/uxdwat/european_union_looks_to_block_apples_hardware/,gadgets,21140247,2
Nintendo says the transition to its next console is ‘a major concern for us’,21862,un8pxw,https://www.videogameschronicle.com/news/nintendo-says-the-transition-to-its-next-console-is-a-major-concern-for-us/,3484,1652272164.0,PressTurn,0.94,/r/gadgets/comments/un8pxw/nintendo_says_the_transition_to_its_next_console/,gadgets,21140247,2
"R2-D2 is officially a Tamagotchi digital pet now, two decades too late.",21704,owfyuz,https://www.theverge.com/2021/8/2/22605668/r2-d2-tamagotchi-digital-pet-star-wars-release-date-preorder,360,1627915483.0,Sumit316,0.93,/r/gadgets/comments/owfyuz/r2d2_is_officially_a_tamagotchi_digital_pet_now/,gadgets,21140247,2
"UPS, Amazon delivery drones a step closer to reality with new US rules",21687,kof5d0,https://www.cnet.com/news/ups-amazon-delivery-drones-a-step-closer-to-reality-with-new-us-rules/,1520,1609522241.0,crosspostninja,0.93,/r/gadgets/comments/kof5d0/ups_amazon_delivery_drones_a_step_closer_to/,gadgets,21140247,2
"Nintendo Switch with new battery tested, nearly doubles battery life",21556,cqq5wl,https://www.tomsguide.com/news/new-nintendo-switch-battery-life-tested-how-much-better-is-it,1181,1565877388.0,krichbutler,0.91,/r/gadgets/comments/cqq5wl/nintendo_switch_with_new_battery_tested_nearly/,gadgets,21140247,2
"New EU Law Could Force Apple to Allow Other App Stores, Sideloading, and iMessage Interoperability",21467,yjbo1v,https://www.macrumors.com/2022/11/01/dma-eu-law-could-force-major-changes-apple/,2881,1667316629.0,chrisdh79,0.92,/r/gadgets/comments/yjbo1v/new_eu_law_could_force_apple_to_allow_other_app/,gadgets,21140247,2
Apple (finally) acknowledges faulty MacBook keyboards with new repair program,21399,8tejdr,https://www.theverge.com/circuitbreaker/2018/6/22/17495326/apple-macbook-pro-faulty-keyboard-repair-program-admits-issues,1626,1529804153.0,i_love_anachronisms,0.91,/r/gadgets/comments/8tejdr/apple_finally_acknowledges_faulty_macbook/,gadgets,21140247,2
The Nintendo Switch Turns Three And It's Not Slowing Down,21191,ffwc0q,https://www.digitaltrends.com/gaming/nintendo-switch-third-anniversary/,1321,1583767609.0,ChickenTeriyakiBoy1,0.91,/r/gadgets/comments/ffwc0q/the_nintendo_switch_turns_three_and_its_not/,gadgets,21140247,2
New $10 Raspberry Pi Zero comes with Wi-Fi and Bluetooth,21170,5wnbq1,https://arstechnica.com/information-technology/2017/02/new-10-raspberry-pi-zero-comes-with-wi-fi-and-bluetooth/,1491,1488278659.0,SirVeza,0.92,/r/gadgets/comments/5wnbq1/new_10_raspberry_pi_zero_comes_with_wifi_and/,gadgets,21140247,2
FBI: Pranksters are hijacking smart devices to live-stream swatting incidents,21074,kndhfk,https://www.zdnet.com/article/fbi-pranksters-are-hijacking-smart-devices-to-live-stream-swatting-incidents/,1319,1609370631.0,crosspostninja,0.93,/r/gadgets/comments/kndhfk/fbi_pranksters_are_hijacking_smart_devices_to/,gadgets,21140247,2
"In rural America, right-to-repair laws are the leading edge of a pushback against growing corporate power",21015,11a06t7,https://theconversation.com/in-rural-america-right-to-repair-laws-are-the-leading-edge-of-a-pushback-against-growing-corporate-power-199372,661,1677165592.0,speckz,0.96,/r/gadgets/comments/11a06t7/in_rural_america_righttorepair_laws_are_the/,gadgets,21140247,2
GPS-Implanted Fake Egg is Built Save Sea Turtles from Illegal Poaching,20987,j68iex,https://interestingengineering.com/gps-implanted-fake-eggs-might-save-sea-turtles-from-illegal-poaching,351,1602002680.0,ChickenTeriyakiBoy1,0.93,/r/gadgets/comments/j68iex/gpsimplanted_fake_egg_is_built_save_sea_turtles/,gadgets,21140247,2
Printers shifting away from disposable cartridges to refillable ink tanks,20974,mg9yy4,https://www.smh.com.au/technology/printers-have-become-an-untenable-grift-but-they-don-t-have-to-be-20210330-p57f5d.html,1190,1617087260.0,karatekid430,0.97,/r/gadgets/comments/mg9yy4/printers_shifting_away_from_disposable_cartridges/,gadgets,21140247,2
"Pixel 4 Face Unlock works if your eyes are closed, will open phone when you're asleep (or not alive)",20923,djnsgo,https://www.tomsguide.com/news/pixel-4-face-unlock-works-if-youre-asleep-or-not-alive,1442,1571406637.0,krichbutler,0.94,/r/gadgets/comments/djnsgo/pixel_4_face_unlock_works_if_your_eyes_are_closed/,gadgets,21140247,2
GM requests green light to ditch steering wheel in its self-driving cars,20909,efibol,https://www.digitaltrends.com/cars/gm-requests-green-light-to-ditch-steering-wheel-in-its-self-driving-cars/,2427,1577290903.0,mspoonygp,0.91,/r/gadgets/comments/efibol/gm_requests_green_light_to_ditch_steering_wheel/,gadgets,21140247,2
Gaming Controller Reads Muscle Signals to Click Before Your Fingers Move,20908,kx5agm,https://www.digitaltrends.com/gaming/impulse-neuro-controller/?utm_source=Reddit&utm_medium=Web&utm_campaign=pb,761,1610629627.0,MicroSofty88,0.94,/r/gadgets/comments/kx5agm/gaming_controller_reads_muscle_signals_to_click/,gadgets,21140247,2
Juul will pay $1.2 billion to settle multiple youth-vaping lawsuits,20899,zi0b34,https://www.engadget.com/juul-pay-1-2-billion-settle-multiple-youth-vaping-lawsuits-153915289.html,1164,1670698559.0,thebelsnickle1991,0.94,/r/gadgets/comments/zi0b34/juul_will_pay_12_billion_to_settle_multiple/,gadgets,21140247,2
"Raspberry Pi 400 announced, a keyboard with a built in PC featuring 4GB RAM and support for dual 4K displays",20840,jmm1q3,https://www.raspberrypi.org/products/raspberry-pi-400/,1044,1604317845.0,samtherat6,0.96,/r/gadgets/comments/jmm1q3/raspberry_pi_400_announced_a_keyboard_with_a/,gadgets,21140247,2
"Scalpers struggling to sell RTX 4080 cards, now ‘graciously’ offering them at MSRP",20803,1033751,https://videocardz.com/newz/scalpers-struggling-to-sell-rtx-4080-cards-now-graciously-offering-them-at-msrp,1152,1672837381.0,speckz,0.95,/r/gadgets/comments/1033751/scalpers_struggling_to_sell_rtx_4080_cards_now/,gadgets,21140247,2
"Boston Dynamics will now sell any business its own Spot robot for $74,500",20780,ha8v9y,https://www.theverge.com/21292684/boston-dynamics-spot-robot-on-sale-price,1229,1592329679.0,andyholla84,0.96,/r/gadgets/comments/ha8v9y/boston_dynamics_will_now_sell_any_business_its/,gadgets,21140247,2
A nano-thin layer of gold could prevent fogged-up glasses | The technology could also keep your windshield clear.,20727,zk3g1n,https://www.engadget.com/gold-nanocoating-glasses-that-dont-fog-up-160057012.html,802,1670861842.0,chrisdh79,0.95,/r/gadgets/comments/zk3g1n/a_nanothin_layer_of_gold_could_prevent_foggedup/,gadgets,21140247,2
eSight smart glasses are allowing legally blind people to see for the first time,20591,7xjz68,https://www.digitaltrends.com/wearables/esight-smart-glasses-blind-amazing/,707,1518631742.0,ChickenTeriyakiBoy1,0.91,/r/gadgets/comments/7xjz68/esight_smart_glasses_are_allowing_legally_blind/,gadgets,21140247,2
[Hands on] Intel are making Smart Glasses that look normal,20566,7vezh4,https://www.theverge.com/2018/2/5/16966530/intel-vaunt-smart-glasses-announced-ar-video,1308,1517839981.0,anonboxis,0.91,/r/gadgets/comments/7vezh4/hands_on_intel_are_making_smart_glasses_that_look/,gadgets,21140247,2
Price for entry-level 13-inch MacBook Pro RAM upgrade quietly doubles to $200,20417,gu8vx3,https://www.digitaltrends.com/computing/entry-level-13-inch-macbook-ro-ram-upgrade-price-doubles/,1860,1590965749.0,ChickenTeriyakiBoy1,0.91,/r/gadgets/comments/gu8vx3/price_for_entrylevel_13inch_macbook_pro_ram/,gadgets,21140247,2
"Oh wait, after all that USB 3.3 branding clusterfrack, it turns out USB 4 is coming out too with double the bandwidth of 3.3 and Thunderbolt compatibility",20371,ax8h2b,https://www.digitaltrends.com/computing/usb4-announced/,1055,1551714144.0,nopantsdolphin,0.94,/r/gadgets/comments/ax8h2b/oh_wait_after_all_that_usb_33_branding/,gadgets,21140247,2
Leaked GPU Specs Suggest Xbox Series X Substantially More Powerful Than PS5,20309,ejwurl,https://www.extremetech.com/extreme/303964-leaked-gpu-specs-suggest-xbox-series-x-substantially-more-powerful-than-ps5,3336,1578145882.0,holyhacker,0.83,/r/gadgets/comments/ejwurl/leaked_gpu_specs_suggest_xbox_series_x/,gadgets,21140247,2
Two women have filed a class-action lawsuit against Apple for AirTag stalking,20297,zh35hb,https://www.digitaltrends.com/mobile/apple-class-action-lawsuit-airtag-stalking-big-deal-why/?utm_source=reddit&utm_medium=pe&utm_campaign=pd,2076,1670606917.0,ChickenTeriyakiBoy1,0.88,/r/gadgets/comments/zh35hb/two_women_have_filed_a_classaction_lawsuit/,gadgets,21140247,2
"Apple confirms the iPhone is getting USB-C, but isn’t happy about the reason why | Greg Joswiak said “obviously we’ll have to comply” with the EU’s new USB-C rules while criticizing them for e-waste implications and inconveniencing customers",20240,ydtx42,https://www.theverge.com/2022/10/26/23423977/iphone-usb-c-eu-law-joswiak-confirms-compliance-lightning,2699,1666777585.0,chrisdh79,0.93,/r/gadgets/comments/ydtx42/apple_confirms_the_iphone_is_getting_usbc_but/,gadgets,21140247,2
How to hear (and delete) every conversation your Google Home has recorded,20196,90imam,https://www.theverge.com/2018/7/20/17594802/google-home-how-to-delete-conversations-recorded,1099,1532112314.0,Abscess2,0.92,/r/gadgets/comments/90imam/how_to_hear_and_delete_every_conversation_your/,gadgets,21140247,2
New 'Bionic Eye' Linked To Chip In Brain Could Cure Blindness,20154,itx6v6,https://www.tasnimnews.com/en/news/2020/09/16/2350252/new-bionic-eye-linked-to-chip-in-brain-could-cure-blindness,864,1600268446.0,auscrisos,0.95,/r/gadgets/comments/itx6v6/new_bionic_eye_linked_to_chip_in_brain_could_cure/,gadgets,21140247,2
Smartphone shipments plunge to a low not seen since 2013 — their largest ever decline,19840,10lotnq,https://www.cnbc.com/2023/01/26/apple-retains-top-smartphone-spot-as-global-shipments-fall-to-2013-low.html,3251,1674728950.0,thebelsnickle1991,0.95,/r/gadgets/comments/10lotnq/smartphone_shipments_plunge_to_a_low_not_seen/,gadgets,21140247,2
India makes USB Type-C charging mandatory for device makers from March 2025 | Laptop makers have up to 2026 to comply,19848,zxebgj,https://www.moneycontrol.com/news/technology/india-makes-usb-type-c-charging-mandatory-for-device-makers-from-march-2025-9770081.html,908,1672245924.0,chrisdh79,0.95,/r/gadgets/comments/zxebgj/india_makes_usb_typec_charging_mandatory_for/,gadgets,21140247,2
Samsung to recall all Galaxy Fold review units,19748,bgetsl,"https://www.tomsguide.com/us/galaxy-fold-recall,news-29918.html",1653,1556015705.0,nopantsdolphin,0.93,/r/gadgets/comments/bgetsl/samsung_to_recall_all_galaxy_fold_review_units/,gadgets,21140247,2
"Half of smart appliances remain disconnected from Internet, makers lament | Did users change their Wi-Fi password, or did they see the nature of IoT privacy?",19750,10kc6ff,https://arstechnica.com/gadgets/2023/01/half-of-smart-appliances-remain-disconnected-from-internet-makers-lament/,3087,1674584533.0,chrisdh79,0.95,/r/gadgets/comments/10kc6ff/half_of_smart_appliances_remain_disconnected_from/,gadgets,21140247,2
A 62-Year-Old Paralyzed Man Sent Out His First Tweet With Brain Chip | Without the need for keystrokes.,19555,rpomdr,https://interestingengineering.com/a-62-year-old-paralyzed-man-sent-out-his-first-tweet-with-brain-chip,665,1640615136.0,chrisdh79,0.96,/r/gadgets/comments/rpomdr/a_62yearold_paralyzed_man_sent_out_his_first/,gadgets,21140247,2
A wearable sleep-tracker designed by an MIT team could give people the power to shape their own dreams,19511,j37z9y,https://www.businessinsider.com/sleep-tracking-device-could-help-people-shape-dreams-2020-9,1029,1601556746.0,chrisdh79,0.94,/r/gadgets/comments/j37z9y/a_wearable_sleeptracker_designed_by_an_mit_team/,gadgets,21140247,2
"Apple announces $29 AirTag, a new Tile-like item tracker",19387,muvkll,https://www.theverge.com/2021/4/20/20844326/apple-airtags-bluetooth-tracker-keys-tile-features-price,2498,1618939663.0,kbgames360,0.89,/r/gadgets/comments/muvkll/apple_announces_29_airtag_a_new_tilelike_item/,gadgets,21140247,2
The Royal Navy is testing using jet suits to fight high-seas piracy,19381,n5im7f,https://www.theverge.com/2021/5/4/22419267/royal-navy-jet-suit-gravity-industries,1169,1620228561.0,Sumit316,0.93,/r/gadgets/comments/n5im7f/the_royal_navy_is_testing_using_jet_suits_to/,gadgets,21140247,2
"AirPods, AirPods Max and AirPods Pro Don't Support Apple Music Lossless Audio",19269,nf9ozt,https://www.macrumors.com/2021/05/17/airpods-apple-music-lossless-audio/,1845,1621341645.0,UnKindClock,0.91,/r/gadgets/comments/nf9ozt/airpods_airpods_max_and_airpods_pro_dont_support/,gadgets,21140247,2
