title,score,id,url,num_comments,created,author,upvote_ratio,permalink,subreddit,subreddit_subscribers,depth
People be like: iT's fAKe aNd a FaLsE fLaG,23053,nfq969,https://i.imgur.com/linUw0A.jpg,2079,1621382265.0,FearmyBeard21,0.92,/r/UFOs/comments/nfq969/people_be_like_its_fake_and_a_false_flag/,UFOs,894644,2
President Bill Clinton was just on @LiveKellyRyan and was asked about #UFOs and #UAPs. He confirmed there are things flying we haven't identified yet,12174,nv6nt2,https://v.redd.it/2mnts4ot82471,1390,1623166478.0,AlienDisclosureGroup,0.86,/r/UFOs/comments/nv6nt2/president_bill_clinton_was_just_on_livekellyryan/,UFOs,894644,2
Wow,11803,nf7h0x,https://v.redd.it/ua4elmh4xtz61,2192,1621334837.0,kinger90210,0.92,/r/UFOs/comments/nf7h0x/wow/,UFOs,894644,2
Pilot spots cube/sphere like UFO,10275,p3omlz,https://v.redd.it/wit2agwlj5h71,1327,1628872195.0,BuzzDownBaby,0.84,/r/UFOs/comments/p3omlz/pilot_spots_cubesphere_like_ufo/,UFOs,894644,2
"""off-world vehicles not made on Earth""",9758,nhy352,https://i.imgur.com/V3XKU80.jpg,1047,1621618220.0,FearmyBeard21,0.92,/r/UFOs/comments/nhy352/offworld_vehicles_not_made_on_earth/,UFOs,894644,2
NEW: UFO / UAP filmed with good quality in slow-Motion. At the Miami air and sea show. Looks like it came from the water. Source in comments,9481,v01jnc,https://v.redd.it/pfkmp0afqb291,2082,1653790410.0,kinger90210,0.82,/r/UFOs/comments/v01jnc/new_ufo_uap_filmed_with_good_quality_in/,UFOs,894644,2
Pentagon UAP Task Force Report Status: RELEASED,8458,o7w0za,https://www.reddit.com/r/UFOs/comments/o7w0za/pentagon_uap_task_force_report_status_released/,3415,1624653448.0,ZolotoGold,0.88,/r/UFOs/comments/o7w0za/pentagon_uap_task_force_report_status_released/,UFOs,894644,2
"Woah ! NASA Chief Bill Nelson talks UFOs / UAPs and possible ET life. October 19, 2021.",8096,qe2b8a,https://v.redd.it/gnh6yeqhf6v71,1255,1634984733.0,kinger90210,0.94,/r/UFOs/comments/qe2b8a/woah_nasa_chief_bill_nelson_talks_ufos_uaps_and/,UFOs,894644,2
"Lake Huron object was “shaped like an octagon” and was at an altitude of 20,000ft",7996,110qkm0,https://i.redd.it/tvks9v5c8vha1.jpg,1563,1676236707.0,batazer,0.92,/r/UFOs/comments/110qkm0/lake_huron_object_was_shaped_like_an_octagon_and/,UFOs,894644,2
New insignia for the Office of the Director of National Intelligence contains an image of a flying saucer,7452,xn9v4d,https://i.redd.it/417o8lxmqwp91.png,1382,1664069227.0,quantumcryogenics,0.93,/r/UFOs/comments/xn9v4d/new_insignia_for_the_office_of_the_director_of/,UFOs,894644,2
"If extraterrestrials are behind the UAPs, we’re no longer the dominant species that we thought we were. How will you handle something superior to us?",6826,nn8b5m,https://i.redd.it/gv5q8a88kx171.jpg,2806,1622237761.0,batazer,0.81,/r/UFOs/comments/nn8b5m/if_extraterrestrials_are_behind_the_uaps_were_no/,UFOs,894644,2
"sep 29, 2022 ; UFO Captured on Professional Camera in China",6407,xye91f,https://v.redd.it/034idbqx3hs91,1192,1665187538.0,littlespacemochi,0.8,/r/UFOs/comments/xye91f/sep_29_2022_ufo_captured_on_professional_camera/,UFOs,894644,2
Leaked Photo From U-2 Spy Plane Observing the Chinese Balloon at High Altitude.,6125,118lh0r,https://i.redd.it/fsxzyti9roja1.jpg,634,1677030019.0,Rev19rb,0.94,/r/UFOs/comments/118lh0r/leaked_photo_from_u2_spy_plane_observing_the/,UFOs,894644,2
"BREAKING: The US and Canada may not be able to recover the debris of the three objects recently shot down, a senior administration official says - CNN",6029,1128fe1,https://www.cnn.com/2023/02/14/politics/conspiracy-theories-objects-white-house/index.html,1566,1676389304.0,Rev19rb,0.88,/r/UFOs/comments/1128fe1/breaking_the_us_and_canada_may_not_be_able_to/,UFOs,894644,2
The best UFO footage ever or the best fake ever. (100 x zoom and stabilized). New analysis and this classic case is worth discussing.,5925,s3vsm8,https://v.redd.it/9nnb2xoafob81,1138,1642176163.0,kinger90210,0.92,/r/UFOs/comments/s3vsm8/the_best_ufo_footage_ever_or_the_best_fake_ever/,UFOs,894644,2
Deleted reddit video from a DoD facility,5885,x004tf,https://v.redd.it/karzon1eihk91,760,1661705613.0,ididnotsee1,0.93,/r/UFOs/comments/x004tf/deleted_reddit_video_from_a_dod_facility/,UFOs,894644,2
This video should of convinced people - UTAH UFO VIDEO (2016) - Filmed by Sam Chortek and Jimmy Chappie. Released in 2019 on Brian Hanley's YouTube channel.,5359,xh44xb,https://v.redd.it/orjm3nn6wio91,1075,1663466505.0,user678990655,0.85,/r/UFOs/comments/xh44xb/this_video_should_of_convinced_people_utah_ufo/,UFOs,894644,2
"UFO accidentally captured on vintage 8mm home movie footage of a Japanese family. Around 1960. I slowed it down, enhanced, rewinded etc.",5289,p0zlqb,https://v.redd.it/owq5p20jibg71,619,1628508579.0,kinger90210,0.85,/r/UFOs/comments/p0zlqb/ufo_accidentally_captured_on_vintage_8mm_home/,UFOs,894644,2
THIS is a must SEE. This was only shown once and has never been repeated. UFO SciFi Channel 1997. VHS digitized.,5274,pyj6ie,https://v.redd.it/88ggxs011nq71,495,1633006485.0,kinger90210,0.96,/r/UFOs/comments/pyj6ie/this_is_a_must_see_this_was_only_shown_once_and/,UFOs,894644,2
Why everyone needs a superzoom (Nikon Coolpix p950 in this case),5134,p9od2k,https://v.redd.it/i76k8xag30j71,321,1629677906.0,charliebrookersright,0.97,/r/UFOs/comments/p9od2k/why_everyone_needs_a_superzoom_nikon_coolpix_p950/,UFOs,894644,2
Compelling footage of a UAP captured from a cruise ship.,5018,ogb8ah,https://v.redd.it/kd2vs8nkq0a71,739,1625763003.0,swiggybaby,0.86,/r/UFOs/comments/ogb8ah/compelling_footage_of_a_uap_captured_from_a/,UFOs,894644,2
"STS-115-E-07201 - Nasa has officially classified this as an ""Unidentified Object""",4847,u795fe,https://i.redd.it/s3o7eng7iiu81.jpg,774,1650385617.0,Flimsy-Union1524,0.92,/r/UFOs/comments/u795fe/sts115e07201_nasa_has_officially_classified_this/,UFOs,894644,2
"Legit UFO Footage, Multiple Eye Witnesses and Multiple Videos of it. Mexico, May 2009. Also the same UFO appeared over Fukushima. More in comments",4662,p2arfy,https://v.redd.it/x3p0vhaxmpg71,1034,1628679545.0,kinger90210,0.88,/r/UFOs/comments/p2arfy/legit_ufo_footage_multiple_eye_witnesses_and/,UFOs,894644,2
The starmap drawn by abductee Betty Hill in 1961 versus reality. All informations in comments ⬇️,4654,p6fjg6,https://i.redd.it/3hwh4gad90i71.jpg,752,1629243999.0,kinger90210,0.85,/r/UFOs/comments/p6fjg6/the_starmap_drawn_by_abductee_betty_hill_in_1961/,UFOs,894644,2
"Just because we do not understand this technology now, does not mean we should not try to.",4566,nlm989,https://i.imgur.com/Rl34zhw.jpg,294,1622049419.0,FearmyBeard21,0.97,/r/UFOs/comments/nlm989/just_because_we_do_not_understand_this_technology/,UFOs,894644,2
Props to WIRED for actually taking the time and doing a proper reporting on UFOs. #Respect,4443,nx7ad1,https://v.redd.it/rpuy6gdkdk471,486,1623385744.0,Enigma_101,0.97,/r/UFOs/comments/nx7ad1/props_to_wired_for_actually_taking_the_time_and/,UFOs,894644,2
This should be a national threat,4441,nmiktu,https://i.imgur.com/DuX1rLW.jpg,548,1622152194.0,FearmyBeard21,0.93,/r/UFOs/comments/nmiktu/this_should_be_a_national_threat/,UFOs,894644,2
"Former NASA Employee: ""We have a lot of high resolution photos of UFOs or Alien Spaceships and I can testify before Congress.""",4350,umkoqc,https://v.redd.it/xz06a0xkxny81,600,1652194785.0,Flimsy-Union1524,0.9,/r/UFOs/comments/umkoqc/former_nasa_employee_we_have_a_lot_of_high/,UFOs,894644,2
"Kiev bridge ufo seems interesting so i upped the contrast ,lowered shadowing and upped saturation ,the object is indeed there",4352,oochav,https://v.redd.it/0tbqygbnzfc71,634,1626819370.0,Ffcd23,0.92,/r/UFOs/comments/oochav/kiev_bridge_ufo_seems_interesting_so_i_upped_the/,UFOs,894644,2
"This link goes directly to nasa.gov , Zoom in lower right hand corner in space. You’ll find a UFO",4298,wtmnm1,http://www.hq.nasa.gov/alsj/a17/AS17-147-22470HR.jpg,714,1661044077.0,MartianMaterial,0.87,/r/UFOs/comments/wtmnm1/this_link_goes_directly_to_nasagov_zoom_in_lower/,UFOs,894644,2
Imagine what other presidents saw or heard about Ufos,4131,nio5o8,https://i.imgur.com/VkcY276.jpg,443,1621706132.0,FearmyBeard21,0.95,/r/UFOs/comments/nio5o8/imagine_what_other_presidents_saw_or_heard_about/,UFOs,894644,2
Pilots seeing strange lights in the sky during flights,4100,yyy0gm,https://www.reddit.com/gallery/yyy0gm,835,1668814698.0,FearmyBeard21,0.9,/r/UFOs/comments/yyy0gm/pilots_seeing_strange_lights_in_the_sky_during/,UFOs,894644,2
Even Dr Pepper is roasting the Pentagon now,4030,nqm2pc,https://i.imgur.com/2nZ3avS.jpg,82,1622641331.0,FearmyBeard21,0.98,/r/UFOs/comments/nqm2pc/even_dr_pepper_is_roasting_the_pentagon_now/,UFOs,894644,2
"UAP over Chicago airport, 2006. Over a dozen employees (pilots + technicians) saw UAP hover over airport for 5 mins. This is one picture that exists",3998,njg3ph,https://i.redd.it/fopv4xj4hx071.jpg,514,1621800870.0,batazer,0.93,/r/UFOs/comments/njg3ph/uap_over_chicago_airport_2006_over_a_dozen/,UFOs,894644,2
One of the best UFO photos ever - made by National Geographic Institute of Costa Rica in 1971,3945,11f7296,https://i.redd.it/hor9sguie5la1.png,691,1677685527.0,SirGorti,0.89,/r/UFOs/comments/11f7296/one_of_the_best_ufo_photos_ever_made_by_national/,UFOs,894644,2
"Real photograph of a UFO sighting , Los Angeles 1942 - referred to as the “Battle of Los Angeles”",3786,zht37w,https://i.redd.it/dr7fiasda45a1.jpg,369,1670680331.0,MartianMaterial,0.92,/r/UFOs/comments/zht37w/real_photograph_of_a_ufo_sighting_los_angeles/,UFOs,894644,2
"UFOs spotted in 1609, Korea: UAPs that looked like ‘wash bowls’ or ‘halos’ floated in the air and divided into two - multiple witnesses",3780,nuccv7,https://i.redd.it/whxepyfqgu371.jpg,381,1623071962.0,batazer,0.96,/r/UFOs/comments/nuccv7/ufos_spotted_in_1609_korea_uaps_that_looked_like/,UFOs,894644,2
Fleet of UFOs Flying from the dark side of the moon,3769,oub84q,https://v.redd.it/oyjuwn7j99e71,725,1627609743.0,Mj648,0.86,/r/UFOs/comments/oub84q/fleet_of_ufos_flying_from_the_dark_side_of_the/,UFOs,894644,2
Anyone know the source of this clip? I just saw this on twitter and the OP was asking the same question. This footage is really eerie to me.,3774,utcmp7,https://v.redd.it/sbqm7euovh091,1070,1652993152.0,GrahamUhelski,0.9,/r/UFOs/comments/utcmp7/anyone_know_the_source_of_this_clip_i_just_saw/,UFOs,894644,2
These 5 Polaroid photos are authentic. Belonged to an Airforce Captain. MUFON Case. More in comments,3725,ovqi2m,https://www.reddit.com/gallery/ovqi2m,626,1627817424.0,kinger90210,0.9,/r/UFOs/comments/ovqi2m/these_5_polaroid_photos_are_authentic_belonged_to/,UFOs,894644,2
"Fox Glacier, New Zealand 2019. Unknown Object with incredible speed shoots over Helicopter. No plane in ~25km range. 240p Camera.",3694,pc4tvt,https://v.redd.it/80wirls8rqj71,715,1630000647.0,kinger90210,0.91,/r/UFOs/comments/pc4tvt/fox_glacier_new_zealand_2019_unknown_object_with/,UFOs,894644,2
"Rep. Tim Burchett: ""The government should not hide the truth from us for another second.""",3646,r6p1st,https://v.redd.it/a9pgftc7wz281,290,1638392398.0,quantumcryogenics,0.94,/r/UFOs/comments/r6p1st/rep_tim_burchett_the_government_should_not_hide/,UFOs,894644,2
"""alien ships may be among us"" says Avi Loeb",3589,11pfes4,https://i.redd.it/7pgv98bfxcna1.jpg,509,1678630201.0,littlespacemochi,0.9,/r/UFOs/comments/11pfes4/alien_ships_may_be_among_us_says_avi_loeb/,UFOs,894644,2
This is a real photograph from Phoenix Arizona in 1997. The mayor is making fun of his citizens who were rightfully asking what was flying over their homes.,3578,zy25na,https://i.redd.it/vy0udtaivu8a1.jpg,371,1672309759.0,MartianMaterial,0.92,/r/UFOs/comments/zy25na/this_is_a_real_photograph_from_phoenix_arizona_in/,UFOs,894644,2
"Bill Nelson, NASA administrator comments on UFOs.",3535,nrcha6,https://v.redd.it/t17norlxo1371,653,1622723870.0,Remseey2907,0.94,/r/UFOs/comments/nrcha6/bill_nelson_nasa_administrator_comments_on_ufos/,UFOs,894644,2
This is our planet. I’m sure there’s nowhere for them to hide,3456,yvcq5b,https://i.redd.it/hq5gkv79fzz91.jpg,439,1668460199.0,MartianMaterial,0.89,/r/UFOs/comments/yvcq5b/this_is_our_planet_im_sure_theres_nowhere_for/,UFOs,894644,2
What a difference 6 months can make! 👽👾🛸,3430,niy46k,https://v.redd.it/1ia5oi4o7s071,408,1621737160.0,Enigma_101,0.97,/r/UFOs/comments/niy46k/what_a_difference_6_months_can_make/,UFOs,894644,2
"ISS 2015. UAP Changes Velocity and Trajectory. Object seems to be far away. No known asteroid, ice or debris can do this.",3419,pz8a9n,https://v.redd.it/m0dk1uqleuq71,689,1633095766.0,kinger90210,0.9,/r/UFOs/comments/pz8a9n/iss_2015_uap_changes_velocity_and_trajectory/,UFOs,894644,2
"Senator Mike Lee: ""I came away from the classified briefing with more questions than answers.""",3300,112cxti,https://i.redd.it/iul88gty97ia1.png,942,1676400609.0,swank5000,0.89,/r/UFOs/comments/112cxti/senator_mike_lee_i_came_away_from_the_classified/,UFOs,894644,2
Chinese Aircraft Caught in 4K Surveying a US Navy Jet: No Excuse for Lack of UAP Videos in 2023,3209,11b4tov,https://v.redd.it/37jlw0eed9ka1,336,1677279617.0,TreeLover4twenty,0.94,/r/UFOs/comments/11b4tov/chinese_aircraft_caught_in_4k_surveying_a_us_navy/,UFOs,894644,2
Nov.9.2018 Truck Driver Captures UFO & Pulls Over,3172,xvdf7s,https://v.redd.it/yiwzxe8a5sr91,488,1664885338.0,littlespacemochi,0.92,/r/UFOs/comments/xvdf7s/nov92018_truck_driver_captures_ufo_pulls_over/,UFOs,894644,2
The Gimbal UFO in color,3011,mbtkf6,https://v.redd.it/d6dgaj1iivo61,395,1616547217.0,Roacchie,0.96,/r/UFOs/comments/mbtkf6/the_gimbal_ufo_in_color/,UFOs,894644,2
"Hi, i'm Gary Mckinnon. I was in the news for a decade after getting caught 'hacking' mil/gov systems looking for evidence of UFO/UAP. Ask Me Anything.",2958,t0imdw,https://www.reddit.com/r/UFOs/comments/t0imdw/hi_im_gary_mckinnon_i_was_in_the_news_for_a/,451,1645729378.0,GaryMckinnonOfficial,0.92,/r/UFOs/comments/t0imdw/hi_im_gary_mckinnon_i_was_in_the_news_for_a/,UFOs,894644,2
Australian astrophotographer captures UFO with Canon 400d 300 mm zoom lens - clear photo!,2944,mwe76e,https://i.redd.it/ppuoyfl4dsu61.jpg,522,1619123902.0,batazer,0.93,/r/UFOs/comments/mwe76e/australian_astrophotographer_captures_ufo_with/,UFOs,894644,2
Video of a Craft Disappearing Quickly Shared by Tom Delonge on IG,2943,wz4wv0,https://v.redd.it/qvieg7ucs9k91,521,1661612298.0,ufosww,0.95,/r/UFOs/comments/wz4wv0/video_of_a_craft_disappearing_quickly_shared_by/,UFOs,894644,2
""" THIS flew over my building! "" Further Analyzed Footage for Bird Deniers",2939,xunnxq,https://v.redd.it/4409u4l27mr91,609,1664813425.0,ufosww,0.92,/r/UFOs/comments/xunnxq/this_flew_over_my_building_further_analyzed/,UFOs,894644,2
"How to explane that post about ""Old smudge on camera, or.. more taken in the ~80s""",2943,s7pkhl,https://i.redd.it/vfaz5mqd6nc81.png,290,1642597020.0,ufoofinterest,0.95,/r/UFOs/comments/s7pkhl/how_to_explane_that_post_about_old_smudge_on/,UFOs,894644,2
Eric Weinstein is completely right here - there needs to be way more transparency as it’s now in the hands of the military–industrial complex,2932,nvaret,https://i.redd.it/ujksir2043471.jpg,292,1623176642.0,batazer,0.98,/r/UFOs/comments/nvaret/eric_weinstein_is_completely_right_here_there/,UFOs,894644,2
My Effort To Get The CLASSIFIED UAP Report Reviewed for Release,2917,obloq0,https://www.reddit.com/r/UFOs/comments/obloq0/my_effort_to_get_the_classified_uap_report/,240,1625145579.0,blackvault,0.96,/r/UFOs/comments/obloq0/my_effort_to_get_the_classified_uap_report/,UFOs,894644,2
"Why do people forget that 'Bob Lazar passed' a strict Lie-detector test from Terry Tavernetti, an Examiner who took 1000s during his career???",2919,xeyynb,https://v.redd.it/dmnqyauha1o91,765,1663253926.0,user678990655,0.79,/r/UFOs/comments/xeyynb/why_do_people_forget_that_bob_lazar_passed_a/,UFOs,894644,2
Artistic drawing of 1994 Zimbabwe Ariel School UFO case,2898,yec79p,https://i.redd.it/anbioq3th8w91.png,309,1666826682.0,SirGorti,0.96,/r/UFOs/comments/yec79p/artistic_drawing_of_1994_zimbabwe_ariel_school/,UFOs,894644,2
Effort to get CLASSIFIED UAP Report Released UPDATE,2879,ofj495,https://www.reddit.com/r/UFOs/comments/ofj495/effort_to_get_classified_uap_report_released/,214,1625665292.0,blackvault,0.96,/r/UFOs/comments/ofj495/effort_to_get_classified_uap_report_released/,UFOs,894644,2
Truth embargo: UFOs are suddenly all the talk in Washington. After 75 years of taboo serious people can finally discuss the mysterious flying objects,2886,nysgel,https://www.nbcnews.com/politics/politics-news/truth-embargo-ufos-are-suddenly-all-talk-washington-n1270560,380,1623575392.0,AlienDisclosureGroup,0.95,/r/UFOs/comments/nysgel/truth_embargo_ufos_are_suddenly_all_the_talk_in/,UFOs,894644,2
"Greenville, South Carolina, USA. March 16th 2010. Witness photographs Triangular Object, that made no sound",2877,pd9mym,https://www.reddit.com/gallery/pd9mym,656,1630156766.0,kinger90210,0.91,/r/UFOs/comments/pd9mym/greenville_south_carolina_usa_march_16th_2010/,UFOs,894644,2
David Bowie about his UFO sighting.,2820,tvn6am,https://i.redd.it/d1555p2peer81.jpg,224,1649028449.0,kinger90210,0.96,/r/UFOs/comments/tvn6am/david_bowie_about_his_ufo_sighting/,UFOs,894644,2
"Caught on doorbell cam at 8:42pm, Kansas City, Missouri 2022 - (Analysis)",2790,y3zhve,https://v.redd.it/4fuy7jujzst91,661,1665767260.0,user678990655,0.92,/r/UFOs/comments/y3zhve/caught_on_doorbell_cam_at_842pm_kansas_city/,UFOs,894644,2
"Incredibly fast UFO sighting in Korea similar to the Beaver,Utah drone footage.",2765,mun8k0,https://v.redd.it/i2rtvntl0bu61,442,1618913886.0,swiggybaby,0.96,/r/UFOs/comments/mun8k0/incredibly_fast_ufo_sighting_in_korea_similar_to/,UFOs,894644,2
One of the best UFO photos ever - made in 1981 on Vancouver Island in Canada. Analysis of the photo shows it is legit but the identity of the disc object remains unidentified,2746,11h41d4,https://i.redd.it/f2nkg1vvmjla1.jpg,455,1677858702.0,SirGorti,0.94,/r/UFOs/comments/11h41d4/one_of_the_best_ufo_photos_ever_made_in_1981_on/,UFOs,894644,2
3 Terabytes of New UFO data in 2022?,2729,rf0vdy,https://i.redd.it/lib680be17581.png,314,1639350576.0,RealVaultteam6,0.96,/r/UFOs/comments/rf0vdy/3_terabytes_of_new_ufo_data_in_2022/,UFOs,894644,2
Stabilized Triangle UAP,2718,ybqwo4,https://v.redd.it/slexuyq3zlv91,608,1666554004.0,DeepSpaceHorizon,0.93,/r/UFOs/comments/ybqwo4/stabilized_triangle_uap/,UFOs,894644,2
Not sure what’s going on but I will keep a tab on this story 👀,2712,ys9nfb,https://i.redd.it/al39cpk3kbz91.jpg,491,1668171259.0,LigmaBalls-420,0.94,/r/UFOs/comments/ys9nfb/not_sure_whats_going_on_but_i_will_keep_a_tab_on/,UFOs,894644,2
NASA now investigating Navy's UFO videos: 'There is something there' Administrator Bill Nelson said the space agency is giving the sightings serious,2692,nxyno2,https://v.redd.it/up19ejn5kr471,533,1623472697.0,AlienDisclosureGroup,0.95,/r/UFOs/comments/nxyno2/nasa_now_investigating_navys_ufo_videos_there_is/,UFOs,894644,2
UFO only visible in FLIR. National Police Air Service (NPAS). UK 2016. Set to: Black = Hot. Which means there is heat coming off the craft,2646,prt39g,https://v.redd.it/ognyvi2xano71,395,1632138078.0,kinger90210,0.96,/r/UFOs/comments/prt39g/ufo_only_visible_in_flir_national_police_air/,UFOs,894644,2
I went through 1338 NUFORC cases so you don't have to!,2630,xjaknt,https://www.reddit.com/gallery/xjaknt,338,1663684736.0,SandOk9259,0.96,/r/UFOs/comments/xjaknt/i_went_through_1338_nuforc_cases_so_you_dont_have/,UFOs,894644,2
"Chicago O‘Hare International Airport. On November 7, 2006. 12 United Airlines Employees spotted an odd metallic saucer-shaped craft.",2586,pfpgdd,https://www.reddit.com/gallery/pfpgdd,410,1630484083.0,kinger90210,0.93,/r/UFOs/comments/pfpgdd/chicago_ohare_international_airport_on_november_7/,UFOs,894644,2
"July 3, 2009 Lake Havasu City, Arizona. Witness is named Mark Preston. UFO footage. With Source. More in comments",2549,pliv58,https://v.redd.it/y1ofq6vernm71,419,1631271923.0,kinger90210,0.94,/r/UFOs/comments/pliv58/july_3_2009_lake_havasu_city_arizona_witness_is/,UFOs,894644,2
"The deciphered letter held in the hands of Gen. Ramey which provides smoking gun proof of a ""disk"" crash, and the recovery of ""the victims of the wreck"" (Photo: Roswell, 1947)",2520,11vip6d,https://i.redd.it/tc4tjq6ciooa1.jpg,399,1679224701.0,user678990655,0.87,/r/UFOs/comments/11vip6d/the_deciphered_letter_held_in_the_hands_of_gen/,UFOs,894644,2
Photos of A US Lockheed F-117 Nighthawk Stealth fighter trying to pursue a UFO.,2487,ussfap,https://v.redd.it/izglhsjw8c091,458,1652924934.0,Mj648,0.94,/r/UFOs/comments/ussfap/photos_of_a_us_lockheed_f117_nighthawk_stealth/,UFOs,894644,2
"UFO captured over Lima, peru april 20th 2020",2486,j0r8sv,https://v.redd.it/juuu3dq71pp51,279,1601213858.0,Roacchie,0.98,/r/UFOs/comments/j0r8sv/ufo_captured_over_lima_peru_april_20th_2020/,UFOs,894644,2
Helpful Advice from Mick West (finally?),2469,otf2jm,https://i.redd.it/6qb41u4arzd71.jpg,277,1627494523.0,JBeanoBeano,0.96,/r/UFOs/comments/otf2jm/helpful_advice_from_mick_west_finally/,UFOs,894644,2
UFO Flyby Past Plane + Reaction of passenger,2457,p4psi9,https://v.redd.it/op70qrvhfhh71,415,1629016289.0,BuzzDownBaby,0.92,/r/UFOs/comments/p4psi9/ufo_flyby_past_plane_reaction_of_passenger/,UFOs,894644,2
DOD employee sees metallic sphere above home...states on record he believes it's a genuine UFO. I interviewed him — audio and video in comments.,2414,inpknu,https://www.reddit.com/gallery/inpknu,437,1599411658.0,chicompj,0.98,/r/UFOs/comments/inpknu/dod_employee_sees_metallic_sphere_above/,UFOs,894644,2
“The American people should be given more information. They're ready for it. They can handle it. And they need and deserve to know it.” - The Hill on Twitter,2375,113tg6q,https://twitter.com/thehill/status/1626235199779667968?s=46&t=6Y5i6EOmNnD3mEVk1fS6Eg,636,1676561945.0,shogun2909,0.93,/r/UFOs/comments/113tg6q/the_american_people_should_be_given_more/,UFOs,894644,2
in 2013 an object collided with a fatal meteorite which was heading for Russia.,2367,z453gi,https://v.redd.it/3m2zko10a12a1,561,1669354409.0,user678990655,0.81,/r/UFOs/comments/z453gi/in_2013_an_object_collided_with_a_fatal_meteorite/,UFOs,894644,2
Real Photo taken during the Belgian UFO wave 1989-1990.,2350,10wh18n,https://i.redd.it/xk9t4cgtruga1.png,426,1675813366.0,user678990655,0.88,/r/UFOs/comments/10wh18n/real_photo_taken_during_the_belgian_ufo_wave/,UFOs,894644,2
I found this video titled *shot_down_crew escape* action begins 00:14 .,2351,uux4am,https://v.redd.it/nik8u1wphw091,208,1653170651.0,NAWFAL93,0.94,/r/UFOs/comments/uux4am/i_found_this_video_titled_shot_down_crew_escape/,UFOs,894644,2
Netherlands - 15 Oct. Arnhem - Park Sonsbeek (Analysis),2331,y530uw,https://v.redd.it/x4vm6iofb2u91,298,1665880173.0,manwhore25,0.86,/r/UFOs/comments/y530uw/netherlands_15_oct_arnhem_park_sonsbeek_analysis/,UFOs,894644,2
UFO + Reaction From Dad And Son,2314,qyeolz,https://v.redd.it/495ao983et081,391,1637442006.0,BuzzDownBaby,0.93,/r/UFOs/comments/qyeolz/ufo_reaction_from_dad_and_son/,UFOs,894644,2
"Navy Photographer Lee Hansen captured this footage on Catalina Island, California, April 15th 1966 at 9.45 am. More in comments",2311,owbzqe,https://v.redd.it/yuxbg2jgcxe71,338,1627901200.0,kinger90210,0.97,/r/UFOs/comments/owbzqe/navy_photographer_lee_hansen_captured_this/,UFOs,894644,2
"Alright people of Montana, we need you now. Go forth and take videos!",2296,10s4w4d,https://i.redd.it/80jit5304vfa1.png,857,1675381583.0,swank5000,0.93,/r/UFOs/comments/10s4w4d/alright_people_of_montana_we_need_you_now_go/,UFOs,894644,2
Clip from a video that was removed from YouTube. Found archives of it on google. This one seems VERY interesting.,2298,xr3w3r,https://v.redd.it/r7qvgbh7vrq91,452,1664446118.0,DeepSpaceHorizon,0.86,/r/UFOs/comments/xr3w3r/clip_from_a_video_that_was_removed_from_youtube/,UFOs,894644,2
"Cmdr. Graham Bethune: ""Monstrous Circle of White Light on Water"" ""a 300 foot UFO that traveled 10,000 feet straight up in a fraction of a second""",2282,uin5zy,https://v.redd.it/06ha98qljkx81,262,1651717894.0,Flimsy-Union1524,0.97,/r/UFOs/comments/uin5zy/cmdr_graham_bethune_monstrous_circle_of_white/,UFOs,894644,2
"Thousands of Redditors are upvoting misleading map about UFO Reports which shows that UFOs are mainly US and UK thing. This map presents data reported to NUFORC, USA based UFO organization - it is heavily biased towards english speaking countries",2251,115jin1,https://i.redd.it/ou17tiex6zia1.png,155,1676738872.0,SirGorti,0.91,/r/UFOs/comments/115jin1/thousands_of_redditors_are_upvoting_misleading/,UFOs,894644,2
I think I found evidence that a UFO may have visited Earth three times in 47 years,2255,tnx4vz,https://www.reddit.com/r/UFOs/comments/tnx4vz/i_think_i_found_evidence_that_a_ufo_may_have/,264,1648236792.0,UFOLOGY_SHORTS,0.93,/r/UFOs/comments/tnx4vz/i_think_i_found_evidence_that_a_ufo_may_have/,UFOs,894644,2
The Pentagon is asked about the overdue UFO/UAP report,2234,z2ew3d,https://v.redd.it/bao3c18i2o1a1,285,1669176559.0,LigmaBalls-420,0.98,/r/UFOs/comments/z2ew3d/the_pentagon_is_asked_about_the_overdue_ufouap/,UFOs,894644,2
Israel's Former Space Security Chief,2226,z0mtz4,https://v.redd.it/0h3xuik1t71a1,479,1668997540.0,littlespacemochi,0.93,/r/UFOs/comments/z0mtz4/israels_former_space_security_chief/,UFOs,894644,2
"UFO Sighting Over moon by Astronomer in Italy While Cleaning Telescope April 29, 2007",2219,11tsejv,https://v.redd.it/7jgstqe06boa1,240,1679062756.0,Flimsy-Union1524,0.95,/r/UFOs/comments/11tsejv/ufo_sighting_over_moon_by_astronomer_in_italy/,UFOs,894644,2
Object spotted in Medellin Colombia (Analysis),2214,y8ogn5,https://v.redd.it/py1yfjjg3wu91,295,1666240690.0,manwhore25,0.93,/r/UFOs/comments/y8ogn5/object_spotted_in_medellin_colombia_analysis/,UFOs,894644,2
UFO FlyBy (Passenger Reaction),2207,qlluxf,https://v.redd.it/18kujn9hwax71,536,1635910584.0,BuzzDownBaby,0.94,/r/UFOs/comments/qlluxf/ufo_flyby_passenger_reaction/,UFOs,894644,2
