title,score,id,url,num_comments,created,author,upvote_ratio,permalink,subreddit,subreddit_subscribers,depth
image-GPT from OpenAI can generate the pixels of half of a picture from nothing using a NLP model,633,i437om,https://www.youtube.com/watch?v=FwXQ568_io0,46,1596625082.0,OnlyProggingForFun,0.97,/r/learnmachinelearning/comments/i437om/imagegpt_from_openai_can_generate_the_pixels_of/,learnmachinelearning,287562,2
How to measure bias and variance in ML models,631,w3rwxm,https://i.redd.it/cyp9u9ad9rc91.png,13,1658337418.0,roycoding,0.98,/r/learnmachinelearning/comments/w3rwxm/how_to_measure_bias_and_variance_in_ml_models/,learnmachinelearning,287562,2
No need to use green screen for changing backgrounds. A Trimap-Free Solution for Portrait Matting in Real Time under Changing Scenes / Code Link in the Comment section,610,kg5eyr,https://v.redd.it/mypvjla8d4661,12,1608373158.0,TheInsaneApp,0.99,/r/learnmachinelearning/comments/kg5eyr/no_need_to_use_green_screen_for_changing/,learnmachinelearning,287562,2
Supervised Learning - A Workflow Chart,598,ib8d90,https://i.redd.it/7zfxkyey2ih51.png,20,1597642859.0,TheInsaneApp,0.98,/r/learnmachinelearning/comments/ib8d90/supervised_learning_a_workflow_chart/,learnmachinelearning,287562,2
PyGAD (Genetic Algorithm) Plays Flappy Bird,594,mxr8dx,https://v.redd.it/6vkqz45xb6v61,40,1619293068.0,ahmed26gad,0.96,/r/learnmachinelearning/comments/mxr8dx/pygad_genetic_algorithm_plays_flappy_bird/,learnmachinelearning,287562,2
Complete chart of all type of neural nets.,590,z0y68q,https://i.redd.it/t2k57spndc1a1.jpg,29,1669034901.0,st1275857,0.83,/r/learnmachinelearning/comments/z0y68q/complete_chart_of_all_type_of_neural_nets/,learnmachinelearning,287562,2
"List of Free Artificial Intelligence, Machine Learning, Data Science, Deep Learning, Mathematics, Python Programming Resources",590,el5okg,https://www.marktechpost.com/free-resources/,23,1578368396.0,ai-lover,0.99,/r/learnmachinelearning/comments/el5okg/list_of_free_artificial_intelligence_machine/,learnmachinelearning,287562,2
I made an infographic to help me remember the mathematics behind CycleGAN. Feedback is appreciated!,580,jblogq,https://i.redd.it/tdaqk5wms8t51.png,16,1602760901.0,spiyer991,0.98,/r/learnmachinelearning/comments/jblogq/i_made_an_infographic_to_help_me_remember_the/,learnmachinelearning,287562,2
Few-Shot Patch-Based Training (Siggraph 2020) - Dr. Ondřej Texler - Link to free zoom lecture by the author in comments,577,nsrn1j,https://i.redd.it/hcadfwvqxe371.gif,7,1622883978.0,pinter69,0.99,/r/learnmachinelearning/comments/nsrn1j/fewshot_patchbased_training_siggraph_2020_dr/,learnmachinelearning,287562,2
Remove your Tattoos Using Deep Learning / Code Link is given in the comment,573,mq78x7,https://www.reddit.com/gallery/mq78x7,24,1618335305.0,TheInsaneApp,0.98,/r/learnmachinelearning/comments/mq78x7/remove_your_tattoos_using_deep_learning_code_link/,learnmachinelearning,287562,2
What's your thought about this?,565,rvljii,https://v.redd.it/6rre2l32qh981,73,1641270439.0,vadhavaniyafaijan,0.95,/r/learnmachinelearning/comments/rvljii/whats_your_thought_about_this/,learnmachinelearning,287562,2
Real-time recognition of handwritten math functions and drawing their graphs,566,mpx9qm,https://www.youtube.com/watch?v=jcoB61viBnk,28,1618298374.0,Independent-Square32,0.99,/r/learnmachinelearning/comments/mpx9qm/realtime_recognition_of_handwritten_math/,learnmachinelearning,287562,2
Models are just a piece of the puzzle,567,qywjgn,https://i.redd.it/i2ts9clhpy081.png,49,1637506333.0,harsh5161,0.87,/r/learnmachinelearning/comments/qywjgn/models_are_just_a_piece_of_the_puzzle/,learnmachinelearning,287562,2
Wanna watch a guy solve a basic reinforcement learning problem from scratch in Python in excruciating detail?,557,eyjqhi,https://youtu.be/psDlXfbe6ok,32,1580787523.0,jack-of-some,0.98,/r/learnmachinelearning/comments/eyjqhi/wanna_watch_a_guy_solve_a_basic_reinforcement/,learnmachinelearning,287562,2
"When I was learning machine learning for the first time, the exact manner in which convolutional neural networks worked always evaded me, largely because they were only ever explained at an introductory level in tutorials. So, I made an animated video explaining exactly how CNNs work. Hope it helps!",554,eqw6gs,https://www.youtube.com/watch?v=eyKwPyOqMg4,34,1579440306.0,antaloaalonso,0.98,/r/learnmachinelearning/comments/eqw6gs/when_i_was_learning_machine_learning_for_the/,learnmachinelearning,287562,2
These plants do not exist,555,qjpdui,https://v.redd.it/jxy5m9bvcsw71,11,1635686488.0,vadhavaniyafaijan,0.99,/r/learnmachinelearning/comments/qjpdui/these_plants_do_not_exist/,learnmachinelearning,287562,2
"I'm a Senior DS and I put together a Youtube Channel with project tutorials, resume critiques, and career advice. Let me know what you think!",550,mjao5g,https://www.reddit.com/r/learnmachinelearning/comments/mjao5g/im_a_senior_ds_and_i_put_together_a_youtube/,21,1617463624.0,madzthakz,0.98,/r/learnmachinelearning/comments/mjao5g/im_a_senior_ds_and_i_put_together_a_youtube/,learnmachinelearning,287562,2
[PROJECT]Heart Rate Detection using Eulerian Magnification,551,rmzcuh,https://v.redd.it/uj50mlmhib781,18,1640276991.0,NickFortez06,0.98,/r/learnmachinelearning/comments/rmzcuh/projectheart_rate_detection_using_eulerian/,learnmachinelearning,287562,2
The hitchhikers guide to computer vision,548,n0btp6,https://www.reddit.com/r/learnmachinelearning/comments/n0btp6/the_hitchhikers_guide_to_computer_vision/,29,1619605765.0,AdelSexy,0.98,/r/learnmachinelearning/comments/n0btp6/the_hitchhikers_guide_to_computer_vision/,learnmachinelearning,287562,2
Types of Activation Functions,541,v1ni8z,https://i.redd.it/zkamlherks291.png,16,1653994315.0,Otherwise_Lab_4638,0.94,/r/learnmachinelearning/comments/v1ni8z/types_of_activation_functions/,learnmachinelearning,287562,2
Yingyang dataset classification with random Radial Basis Functions and Logistic Regression,541,kecoat,https://i.redd.it/mq33ppjjvk561.gif,26,1608137073.0,larsupilami73,0.98,/r/learnmachinelearning/comments/kecoat/yingyang_dataset_classification_with_random/,learnmachinelearning,287562,2
Introduction to Anomaly Detection with Auto-Encoder on time series,543,m7oquf,https://v.redd.it/682r3pwturn61,30,1616066881.0,AstroThese,0.99,/r/learnmachinelearning/comments/m7oquf/introduction_to_anomaly_detection_with/,learnmachinelearning,287562,2
Reducing Pandas Memory Usage: Reading In Chunks,539,kkjq3x,https://www.reddit.com/gallery/kkjq3x,14,1608994417.0,robofied,0.96,/r/learnmachinelearning/comments/kkjq3x/reducing_pandas_memory_usage_reading_in_chunks/,learnmachinelearning,287562,2
Infographic to remember how SVMs work. Let me know if I've made a mistake anywhere!,538,knmf0h,https://i.redd.it/50ja1lwlhh861.png,37,1609403894.0,spiyer991,0.99,/r/learnmachinelearning/comments/knmf0h/infographic_to_remember_how_svms_work_let_me_know/,learnmachinelearning,287562,2
Introduction to Anomaly Detection with Auto-Encoder on time series,538,do8cbl,https://i.redd.it/pjjh57js2av31.gif,47,1572266765.0,AstroThese,0.99,/r/learnmachinelearning/comments/do8cbl/introduction_to_anomaly_detection_with/,learnmachinelearning,287562,2
VToonify: Controllable High-Resolution Portrait Video Style Transfer,535,xvud71,https://v.redd.it/rx9ovsulkvr91,16,1664926810.0,Illustrious_Row_9971,0.99,/r/learnmachinelearning/comments/xvud71/vtoonify_controllable_highresolution_portrait/,learnmachinelearning,287562,2
I'm launching my YT channel on machine learning topics. Straight to the point. No BS,539,m96r5o,https://www.reddit.com/r/learnmachinelearning/comments/m96r5o/im_launching_my_yt_channel_on_machine_learning/,30,1616245859.0,ahmedbesbes,0.95,/r/learnmachinelearning/comments/m96r5o/im_launching_my_yt_channel_on_machine_learning/,learnmachinelearning,287562,2
"Netflix just open-sourced Polynote, a cool Machine Learning, and Data Science workflow tool (Github link included)",532,dms6qx,https://www.marktechpost.com/2019/10/24/netflix-just-open-sourced-polynote-a-cool-machine-learning-and-data-science-workflow-tool/,11,1571977309.0,ai-lover,0.99,/r/learnmachinelearning/comments/dms6qx/netflix_just_opensourced_polynote_a_cool_machine/,learnmachinelearning,287562,2
I made an infographic to help me remember how TF–IDF works. Hope this helps someone,525,gway54,https://i.redd.it/nchhwldrvt251.png,36,1591248094.0,spiyer991,0.97,/r/learnmachinelearning/comments/gway54/i_made_an_infographic_to_help_me_remember_how/,learnmachinelearning,287562,2
Why You Don’t Need to Learn Machine Learning,529,k1h6nl,https://www.reddit.com/r/learnmachinelearning/comments/k1h6nl/why_you_dont_need_to_learn_machine_learning/,69,1606404760.0,hiphop1987,0.94,/r/learnmachinelearning/comments/k1h6nl/why_you_dont_need_to_learn_machine_learning/,learnmachinelearning,287562,2
How to Read Math as a Software Engineer,524,n6yd2w,https://youtu.be/UZzVdfBhZOw,9,1620393690.0,research_pie,0.97,/r/learnmachinelearning/comments/n6yd2w/how_to_read_math_as_a_software_engineer/,learnmachinelearning,287562,2
"Huge List of Free Artificial Intelligence, Machine Learning, Data Science & Python E-Books",524,i2ezu0,https://www.theinsaneapp.com/2020/08/free-data-science-deep-learning-python-ebooks.html,17,1596386153.0,TheInsaneApp,0.98,/r/learnmachinelearning/comments/i2ezu0/huge_list_of_free_artificial_intelligence_machine/,learnmachinelearning,287562,2
Supervised Learning and Reinforcement Learning Explained,528,rjypy4,https://v.redd.it/g68taxirmi681,12,1639926963.0,TheInsaneApp,0.96,/r/learnmachinelearning/comments/rjypy4/supervised_learning_and_reinforcement_learning/,learnmachinelearning,287562,2
7 Free eBooks every Data Scientist should read in 2020,511,ix0mev,https://www.reddit.com/r/learnmachinelearning/comments/ix0mev/7_free_ebooks_every_data_scientist_should_read_in/,18,1600695650.0,hiphop1987,0.96,/r/learnmachinelearning/comments/ix0mev/7_free_ebooks_every_data_scientist_should_read_in/,learnmachinelearning,287562,2
"here are our 40 courses, 4 academic years Computer Science curriculum in 1079 YouTube videos. The best thing is that is FREE, easy to access by everyone, and opens many other resources in form of other recommended videos or references in the descriptions.",513,neuu3f,https://laconicml.com/computer-science-curriculum-youtube-videos/,21,1621293228.0,yung_quan,0.98,/r/learnmachinelearning/comments/neuu3f/here_are_our_40_courses_4_academic_years_computer/,learnmachinelearning,287562,2
"Maybe it's just me, but building individual data pipelines in Tensorflow/Keras can get quite involved.",510,r15609,https://i.redd.it/og3tczx5pj181.jpg,25,1637760455.0,Ottzel3,0.98,/r/learnmachinelearning/comments/r15609/maybe_its_just_me_but_building_individual_data/,learnmachinelearning,287562,2
I created a web visualizer to see how AI learns to play Snake using Q-learning.,505,j4xio8,https://i.redd.it/shn9zx8ad2r51.gif,21,1601811163.0,guyi567,0.99,/r/learnmachinelearning/comments/j4xio8/i_created_a_web_visualizer_to_see_how_ai_learns/,learnmachinelearning,287562,2
🧱 Using AI to detect what can be built from your pile of Legos,500,oc5er2,https://youtu.be/6Gigj7j9I3E,27,1625212200.0,Independent-Square32,0.98,/r/learnmachinelearning/comments/oc5er2/using_ai_to_detect_what_can_be_built_from_your/,learnmachinelearning,287562,2
Machine Learning Algorithms,496,ut2v6z,https://i.redd.it/yb2lv1zbkf091.png,27,1652965107.0,instituteprograms,0.91,/r/learnmachinelearning/comments/ut2v6z/machine_learning_algorithms/,learnmachinelearning,287562,2
Automatically Overlaying Baseball Pitch Motion and Trajectory with ML,490,kbr3in,https://v.redd.it/t69domlf0s461,11,1607787633.0,chonyyy,0.98,/r/learnmachinelearning/comments/kbr3in/automatically_overlaying_baseball_pitch_motion/,learnmachinelearning,287562,2
Real-time visualization of a neural network recognizing digits from user's input,480,ee405g,https://youtu.be/GtglKSYA6RY,15,1577014667.0,cmillionaire9,0.99,/r/learnmachinelearning/comments/ee405g/realtime_visualization_of_a_neural_network/,learnmachinelearning,287562,2
Deep Learning Tools,481,wt0vb3,https://i.redd.it/gxz6j7aziti91.png,31,1660979408.0,instituteprograms,0.94,/r/learnmachinelearning/comments/wt0vb3/deep_learning_tools/,learnmachinelearning,287562,2
I'm a Senior Data Scientist at Disney and I'm hosting another Data Science Q&A session this Thursday @ 5:30 PM PST. I'll be joined by an Applied Scientist at Amazon!,468,n3v9b7,https://www.reddit.com/r/learnmachinelearning/comments/n3v9b7/im_a_senior_data_scientist_at_disney_and_im/,12,1620046418.0,madzthakz,0.95,/r/learnmachinelearning/comments/n3v9b7/im_a_senior_data_scientist_at_disney_and_im/,learnmachinelearning,287562,2
Yoga pose classifier (code in comments),473,shjtxr,https://v.redd.it/qv5csg5uv4f81,22,1643683244.0,Pawan315,0.97,/r/learnmachinelearning/comments/shjtxr/yoga_pose_classifier_code_in_comments/,learnmachinelearning,287562,2
My 100 Days of ML (03/12/19 - 11/03/20) Summary,473,fhbn4u,https://i.redd.it/7rxemrkgk6m41.jpg,66,1583992173.0,hithesh111,0.98,/r/learnmachinelearning/comments/fhbn4u/my_100_days_of_ml_031219_110320_summary/,learnmachinelearning,287562,2
Creating a Virtual Pen And Eraser with OpenCV,468,gyyfjs,https://youtu.be/86TW0j8NdY0,22,1591619432.0,cmillionaire9,0.96,/r/learnmachinelearning/comments/gyyfjs/creating_a_virtual_pen_and_eraser_with_opencv/,learnmachinelearning,287562,2
I made a self-driving car in vanilla javascript [code and tutorial in the comments],462,t6gfrg,https://v.redd.it/2zucq202jcl81,25,1646391324.0,gniziemazity,0.97,/r/learnmachinelearning/comments/t6gfrg/i_made_a_selfdriving_car_in_vanilla_javascript/,learnmachinelearning,287562,2
AI learned to realistically change the time of day in the photo,462,fmf651,https://youtu.be/4etgOxaIxdI,19,1584798270.0,cmillionaire9,0.98,/r/learnmachinelearning/comments/fmf651/ai_learned_to_realistically_change_the_time_of/,learnmachinelearning,287562,2
AI has learned how to effectively separate audio recordings into music and vocals,467,dud1e4,https://youtu.be/7BtBA-ZC5XI,28,1573400843.0,cmillionaire9,0.98,/r/learnmachinelearning/comments/dud1e4/ai_has_learned_how_to_effectively_separate_audio/,learnmachinelearning,287562,2
"Pokémon text to image, fine tuned stable diffusion model with Gradio UI",462,xrpftq,https://www.reddit.com/gallery/xrpftq,21,1664503545.0,Illustrious_Row_9971,0.99,/r/learnmachinelearning/comments/xrpftq/pokémon_text_to_image_fine_tuned_stable_diffusion/,learnmachinelearning,287562,2
This AI Restores Old Photos with Damages Automatically,456,izftnz,https://youtu.be/FVo400nmZfc,6,1601022337.0,cloud_weather,0.99,/r/learnmachinelearning/comments/izftnz/this_ai_restores_old_photos_with_damages/,learnmachinelearning,287562,2
"For me, one of the main barriers to the world of deep learning was setting up all the tools. Here's a video that I hope will eliminate this barrier. Hope you guys found it helpful!",450,cf60nf,https://www.youtube.com/watch?v=Ksu5zZIdfH0,18,1563533106.0,antaloaalonso,0.98,/r/learnmachinelearning/comments/cf60nf/for_me_one_of_the_main_barriers_to_the_world_of/,learnmachinelearning,287562,2
End to End Machine Learning Tutorial — From Data Collection to Deployment 🚀,454,hv48tu,https://www.reddit.com/r/learnmachinelearning/comments/hv48tu/end_to_end_machine_learning_tutorial_from_data/,21,1595323044.0,ahmedbesbes,0.98,/r/learnmachinelearning/comments/hv48tu/end_to_end_machine_learning_tutorial_from_data/,learnmachinelearning,287562,2
"A handy scikit-learn cheat sheet to machine learning with Python, including code examples.",450,v6rzi0,https://i.redd.it/bj6ib59cf6491.jpg,2,1654597838.0,joanna58,0.98,/r/learnmachinelearning/comments/v6rzi0/a_handy_scikitlearn_cheat_sheet_to_machine/,learnmachinelearning,287562,2
Don't Learn from Siraj Raval,446,dhsnvc,https://twitter.com/FunMachineLearn/status/1183765658061983744?s=20,47,1571069062.0,GantMan,0.95,/r/learnmachinelearning/comments/dhsnvc/dont_learn_from_siraj_raval/,learnmachinelearning,287562,2
machine learning webapp 🐈 🐕 prediction using flask,443,ha0rbx,https://v.redd.it/okcokjzls8551,40,1592300279.0,Pawan315,0.96,/r/learnmachinelearning/comments/ha0rbx/machine_learning_webapp_prediction_using_flask/,learnmachinelearning,287562,2
Animated Explanation of Logistic Regression,446,xvqqia,https://i.redd.it/g6lktujbtur91.gif,14,1664917630.0,RacerRex9727,0.98,/r/learnmachinelearning/comments/xvqqia/animated_explanation_of_logistic_regression/,learnmachinelearning,287562,2
"I created a four-page Data Science Cheatsheet to assist with exam reviews, interview prep, and anything in-between [Cross-post r/DataScience]",439,ljrdxh,https://www.reddit.com/r/learnmachinelearning/comments/ljrdxh/i_created_a_fourpage_data_science_cheatsheet_to/,22,1613319620.0,WirelessSushi,0.98,/r/learnmachinelearning/comments/ljrdxh/i_created_a_fourpage_data_science_cheatsheet_to/,learnmachinelearning,287562,2
Understanding Dropout,438,jpl7wn,https://www.reddit.com/gallery/jpl7wn,23,1604726529.0,robofied,0.97,/r/learnmachinelearning/comments/jpl7wn/understanding_dropout/,learnmachinelearning,287562,2
90% of the truth about ML is inconvenient,438,o3ztwb,https://www.reddit.com/r/learnmachinelearning/comments/o3ztwb/90_of_the_truth_about_ml_is_inconvenient/,95,1624173135.0,AdelSexy,0.94,/r/learnmachinelearning/comments/o3ztwb/90_of_the_truth_about_ml_is_inconvenient/,learnmachinelearning,287562,2
"Artificial Intelligence and Machine Learning Infrastructure Platforms Used in Data Preparation, Model Building and Production",439,j9kv3u,https://i.redd.it/pcelswiwkls51.jpg,31,1602479544.0,TheInsaneApp,0.86,/r/learnmachinelearning/comments/j9kv3u/artificial_intelligence_and_machine_learning/,learnmachinelearning,287562,2
How NOT to learn Machine Learning,439,kb94wv,https://www.reddit.com/r/learnmachinelearning/comments/kb94wv/how_not_to_learn_machine_learning/,69,1607713933.0,hiphop1987,0.96,/r/learnmachinelearning/comments/kb94wv/how_not_to_learn_machine_learning/,learnmachinelearning,287562,2
Reinforcement Learning - Terminology: https://www.instagram.com/p/B_ECyFzAEkF/,439,g2sd0u,https://i.redd.it/u99n4qi07at41.png,9,1587087065.0,wstcpyt1988,0.91,/r/learnmachinelearning/comments/g2sd0u/reinforcement_learning_terminology/,learnmachinelearning,287562,2
How to Code a Math Formula,433,nc9ejh,https://youtu.be/ncRmzy6BWH0,7,1621001125.0,research_pie,0.98,/r/learnmachinelearning/comments/nc9ejh/how_to_code_a_math_formula/,learnmachinelearning,287562,2
Andrew Ng’s Machine Learning course confirmed to officially launching 15 June 2022,432,v95i0v,https://twitter.com/deeplearningai_/status/1534188432301465600?s=21&t=aILDkugxujhnPFcRDb-wTQ,65,1654859987.0,leej11,0.99,/r/learnmachinelearning/comments/v95i0v/andrew_ngs_machine_learning_course_confirmed_to/,learnmachinelearning,287562,2
Volleyball agents trained using competitive self-play [tutorial + project link],436,qdf2md,https://i.redd.it/awkct361ozu71.gif,7,1634902872.0,PugglesMcPuggle,0.99,/r/learnmachinelearning/comments/qdf2md/volleyball_agents_trained_using_competitive/,learnmachinelearning,287562,2
AI Generates a New Sharingan | Using GAN To Generate SharinGAN,436,gc670g,https://youtu.be/8fnynVsR53k,57,1588424954.0,oFlamingo,0.94,/r/learnmachinelearning/comments/gc670g/ai_generates_a_new_sharingan_using_gan_to/,learnmachinelearning,287562,2
Deep Learning Explained series on YouTube,433,txia06,https://i.redd.it/dh8l9h1oovr81.png,11,1649237710.0,python_engineer,0.95,/r/learnmachinelearning/comments/txia06/deep_learning_explained_series_on_youtube/,learnmachinelearning,287562,2
Real Life Contra | Code + Explanation in Comments,435,sakpim,https://v.redd.it/16jstahh2dd81,19,1642910838.0,Pawan315,0.96,/r/learnmachinelearning/comments/sakpim/real_life_contra_code_explanation_in_comments/,learnmachinelearning,287562,2
First ML experiment feeding my own art,433,hbz862,https://v.redd.it/ukvj45hrtu551,26,1592567051.0,OmrieBE,0.99,/r/learnmachinelearning/comments/hbz862/first_ml_experiment_feeding_my_own_art/,learnmachinelearning,287562,2
Anime to irl with PULSE - Photo Upsampling via Latent Space Exploration,429,ihpucf,https://youtu.be/CSoHaO3YqH8,14,1598550843.0,cloud_weather,0.98,/r/learnmachinelearning/comments/ihpucf/anime_to_irl_with_pulse_photo_upsampling_via/,learnmachinelearning,287562,2
An illustration of the core ideas of gradient descent,424,wdpwf8,https://i.redd.it/6wq36wfuj5f91.png,15,1659381580.0,roycoding,0.97,/r/learnmachinelearning/comments/wdpwf8/an_illustration_of_the_core_ideas_of_gradient/,learnmachinelearning,287562,2
PyGAD (Genetic Algorithm) Plays a Complex Level of the CoinTex Game,415,mk3xa3,https://v.redd.it/yb51yyoks7r61,15,1617567342.0,ahmed26gad,0.96,/r/learnmachinelearning/comments/mk3xa3/pygad_genetic_algorithm_plays_a_complex_level_of/,learnmachinelearning,287562,2
Understanding Markov Chains and Stationary Distribution,423,jhtbqk,https://youtu.be/i3AkTO9HLXo,22,1603632438.0,nerdy_wits,0.99,/r/learnmachinelearning/comments/jhtbqk/understanding_markov_chains_and_stationary/,learnmachinelearning,287562,2
Central Limit Theorem Explained...,416,iip5vb,https://youtu.be/8Z9XRrJU9ZM,26,1598690603.0,nerdy_wits,0.97,/r/learnmachinelearning/comments/iip5vb/central_limit_theorem_explained/,learnmachinelearning,287562,2
"Top 50 FREE Artificial Intelligence, Computer Science, Engineering and Programming Courses from the Ivy League Universities",421,j7i21f,https://laconicml.com/ivy-league-universities-courses/,17,1602180182.0,yung_quan,0.95,/r/learnmachinelearning/comments/j7i21f/top_50_free_artificial_intelligence_computer/,learnmachinelearning,287562,2
[Updated] Automatically Overlaying Baseball Pitch Motion and Trajectory in Realtime (Open Source),415,l3db4k,https://v.redd.it/x75l8rwvg3d61,16,1611413210.0,chonyyy,0.97,/r/learnmachinelearning/comments/l3db4k/updated_automatically_overlaying_baseball_pitch/,learnmachinelearning,287562,2
Real-Time Detection and Tracking of Basketball Players using Deep Neural Networks #dl #ml,406,f5ozmr,https://youtu.be/EJWD85amLW8,38,1582016543.0,cmillionaire9,0.97,/r/learnmachinelearning/comments/f5ozmr/realtime_detection_and_tracking_of_basketball/,learnmachinelearning,287562,2
Portal - Open Source App for Inspecting Model Inference,412,os581l,https://v.redd.it/54x7euenrld71,11,1627325189.0,xusty,0.99,/r/learnmachinelearning/comments/os581l/portal_open_source_app_for_inspecting_model/,learnmachinelearning,287562,2
This AI translates code from a programming language to another | Facebook TransCoder Explained,405,hgtte3,https://youtu.be/u6kM2lkrGQk,17,1593265746.0,OnlyProggingForFun,0.97,/r/learnmachinelearning/comments/hgtte3/this_ai_translates_code_from_a_programming/,learnmachinelearning,287562,2
gradient descent visualisation in linear regression.,407,emnrq7,https://i.redd.it/swwsc4l9mw941.gif,19,1578642135.0,zhangzhuyan,0.95,/r/learnmachinelearning/comments/emnrq7/gradient_descent_visualisation_in_linear/,learnmachinelearning,287562,2
🏐 Training RL agents to play 3D Volleyball with Self-Play + PPO + Unity ML-Agents (learnings & link in comments),404,p1nbxq,https://i.redd.it/bdkoaqvmnig71.gif,26,1628595080.0,PugglesMcPuggle,0.99,/r/learnmachinelearning/comments/p1nbxq/training_rl_agents_to_play_3d_volleyball_with/,learnmachinelearning,287562,2
Neural Network Visualizer - (Link in the comments),404,m6zz0o,https://v.redd.it/yvs5onng7ln61,12,1615986407.0,TheInsaneApp,0.94,/r/learnmachinelearning/comments/m6zz0o/neural_network_visualizer_link_in_the_comments/,learnmachinelearning,287562,2
"This video explains exactly how convolutional neural networks work, with a cool implementation. The code is written in Python and implemented with Keras.",402,dwpi63,https://www.youtube.com/watch?v=eyKwPyOqMg4,13,1573817404.0,antaloaalonso,0.96,/r/learnmachinelearning/comments/dwpi63/this_video_explains_exactly_how_convolutional/,learnmachinelearning,287562,2
"[Research 2020] The best AI papers of 2020 with a clear video demo, short read, paper, and code for each of them.",397,khuz5i,https://www.reddit.com/r/learnmachinelearning/comments/khuz5i/research_2020_the_best_ai_papers_of_2020_with_a/,2,1608600106.0,OnlyProggingForFun,0.99,/r/learnmachinelearning/comments/khuz5i/research_2020_the_best_ai_papers_of_2020_with_a/,learnmachinelearning,287562,2
The 50 Best Free Datasets for Machine Learning,400,mcud27,https://lionbridge.ai/datasets/the-50-best-free-datasets-for-machine-learning/,8,1616665057.0,datapablo,0.99,/r/learnmachinelearning/comments/mcud27/the_50_best_free_datasets_for_machine_learning/,learnmachinelearning,287562,2
How does k nearest neighbors work? | Machine Learning Basics,391,g8kovq,https://youtu.be/0p0o5cmgLdE,27,1587929267.0,wstcpyt1988,0.97,/r/learnmachinelearning/comments/g8kovq/how_does_k_nearest_neighbors_work_machine/,learnmachinelearning,287562,2
Don’t Repeat These Mistakes with SQL,395,js8e8e,https://www.reddit.com/r/learnmachinelearning/comments/js8e8e/dont_repeat_these_mistakes_with_sql/,29,1605102414.0,hiphop1987,0.97,/r/learnmachinelearning/comments/js8e8e/dont_repeat_these_mistakes_with_sql/,learnmachinelearning,287562,2
ML Infrastructure Platforms,396,v2byu9,https://i.redd.it/fidbqs0wxy291.jpg,30,1654071382.0,instituteprograms,0.96,/r/learnmachinelearning/comments/v2byu9/ml_infrastructure_platforms/,learnmachinelearning,287562,2
Run Stable Diffusion locally with a web UI + artist workflow video,393,x09eqy,https://v.redd.it/bmapk09ehjk91,5,1661729526.0,Illustrious_Row_9971,0.98,/r/learnmachinelearning/comments/x09eqy/run_stable_diffusion_locally_with_a_web_ui_artist/,learnmachinelearning,287562,2
"I wanted to try streamlit, so I trained a model to diagnose lung X-Rays (Pneumonia) and visualised it with streamlit [not hosted]",390,lsrypl,https://v.redd.it/pgnuqlmgqrj61,43,1614321984.0,wilhelmberghammer,0.99,/r/learnmachinelearning/comments/lsrypl/i_wanted_to_try_streamlit_so_i_trained_a_model_to/,learnmachinelearning,287562,2
