title,score,id,url,num_comments,created,author,upvote_ratio,permalink,subreddit,subreddit_subscribers,depth
"Hey guys, it's me again, with my latest Python GUI for uninstalling the default Windows 10 apps, PyDebloatX.",1206,kmvanp,https://www.reddit.com/r/Python/comments/kmvanp/hey_guys_its_me_again_with_my_latest_python_gui/,137,1609303735.0,Goldtom,0.98,/r/Python/comments/kmvanp/hey_guys_its_me_again_with_my_latest_python_gui/,Python,1112499,2
"I'm Al Sweigart, author of Automate the Boring Stuff with Python. I'm currently doing an AMA about my latest book on recursive algorithms.",1192,xcr4tt,https://www.reddit.com/r/Python/comments/xcr4tt/im_al_sweigart_author_of_automate_the_boring/,54,1663024098.0,AlSweigart,0.98,/r/Python/comments/xcr4tt/im_al_sweigart_author_of_automate_the_boring/,Python,1112499,2
73 Examples to Help You Master Python's f-strings,1196,jpojgg,https://miguendes.me/73-examples-to-help-you-master-pythons-f-strings,54,1604744459.0,cheerfulboy,0.97,/r/Python/comments/jpojgg/73_examples_to_help_you_master_pythons_fstrings/,Python,1112499,2
"My last post about Face recognition got amazing response from all of you guys on Python subreddit, I added few faces to the model and now it can recognise my mother too that too in low light, its amazing.I ll post link to script in the comment below.",1185,j3rg8c,https://i.redd.it/41sv9naognq51.jpg,91,1601630647.0,Hussain_Mujtaba,0.95,/r/Python/comments/j3rg8c/my_last_post_about_face_recognition_got_amazing/,Python,1112499,2
"I made an Ai discord bot for Coronavirus [Predictions , Statistics and over 100 visuals & features]",1179,hswvwc,https://v.redd.it/nktq0f7s0fb51,54,1594997018.0,AnonDoser,0.96,/r/Python/comments/hswvwc/i_made_an_ai_discord_bot_for_coronavirus/,Python,1112499,2
Free Python Programming Course on Udemy!,1174,jl5uxv,https://www.reddit.com/r/Python/comments/jl5uxv/free_python_programming_course_on_udemy/,124,1604094019.0,JO3POTATO,0.98,/r/Python/comments/jl5uxv/free_python_programming_course_on_udemy/,Python,1112499,2
Python 3.9: All You need to know 👊,1152,it4x8o,https://ayushi7rawat.hashnode.dev/python-39-all-you-need-to-know,215,1600159277.0,cheerfulboy,0.96,/r/Python/comments/it4x8o/python_39_all_you_need_to_know/,Python,1112499,2
From complete beginner to django website,1135,kcdfv0,https://www.reddit.com/r/Python/comments/kcdfv0/from_complete_beginner_to_django_website/,92,1607876740.0,roryjbd,0.98,/r/Python/comments/kcdfv0/from_complete_beginner_to_django_website/,Python,1112499,2
I took some suggestions and improved my solar system generator with better rings and colorful stars,1134,d8t3fu,https://i.redd.it/rei5amvbslo31.png,42,1569357619.0,thebuffed,0.98,/r/Python/comments/d8t3fu/i_took_some_suggestions_and_improved_my_solar/,Python,1112499,2
willmcgugan/rich Rich is a Python library for rich text and beautiful formatting in the terminal.,1122,kcyg3o,https://github.com/willmcgugan/rich#status,56,1607955507.0,pmz,0.99,/r/Python/comments/kcyg3o/willmcguganrich_rich_is_a_python_library_for_rich/,Python,1112499,2
I got a job!,1107,oo116s,https://www.reddit.com/r/Python/comments/oo116s/i_got_a_job/,116,1626783948.0,roryjbd,0.95,/r/Python/comments/oo116s/i_got_a_job/,Python,1112499,2
