title,score,id,url,num_comments,created,author,upvote_ratio,permalink,subreddit,subreddit_subscribers,depth
"Kevin Nash: ""The company is called World Wrestling Entertainment. I was entertained. @StephMcMahon said we're bringing this to you to take you away from where we are. I was immersed and not watching the news. Thank you @WWE for going beyond what every other product has. Delivered!""",7796,fvxqv8,https://twitter.com/RealKevinNash/status/1247087472703672321,558,1586175587.0,GetDown90,0.93,/r/SquaredCircle/comments/fvxqv8/kevin_nash_the_company_is_called_world_wrestling/,SquaredCircle,740816,2
"Jake Roberts: ""AEW was the first wrestling promotion that ever had a birthday party for me. That was pretty cool. They had cake and everything for everybody; it was really nice. The people at AEW are like that – Tony Khan is a wonderful man and a brilliant man.""",7770,hqfyb7,https://www.wrestlinginc.com/news/2020/07/jake-roberts-reveals-touching-thing-aew-did-for-him-that-no-672359/,481,1594649539.0,GetDown90,0.95,/r/SquaredCircle/comments/hqfyb7/jake_roberts_aew_was_the_first_wrestling/,SquaredCircle,740816,2
Kurt Angle and Eddie Guerrero’s comedic timing was all time great,7683,ntlrzb,https://gfycat.com/sardonicbackitaliangreyhound,193,1622986168.0,Naweezy,0.98,/r/SquaredCircle/comments/ntlrzb/kurt_angle_and_eddie_guerreros_comedic_timing_was/,SquaredCircle,740816,2
"WWE uncovers another $5 million in payments made by Vince McMahon, will delay filing of quarterly report",7654,wkfkuw,https://www.pwinsider.com/ViewArticle.php?id=161912,1178,1660081423.0,LexLozano,0.96,/r/SquaredCircle/comments/wkfkuw/wwe_uncovers_another_5_million_in_payments_made/,SquaredCircle,740816,2
Bray Wyatt has his own special face mask for when he goes out in public,7647,go2ha9,https://i.redd.it/22ezikjfx5051.jpg,317,1590086302.0,Strike_Gently,0.93,/r/SquaredCircle/comments/go2ha9/bray_wyatt_has_his_own_special_face_mask_for_when/,SquaredCircle,740816,2
"Transgender wrestler has ""unfair advantage,"" argues imbecile about rigged sport",7632,cz5lk8,https://www.kayfabenews.com/transgender-wrestler-has-unfair-advantage-argues-imbecile-about-rigged-sport/,1490,1567520891.0,dnytle,0.79,/r/SquaredCircle/comments/cz5lk8/transgender_wrestler_has_unfair_advantage_argues/,SquaredCircle,740816,2
"Jim Cornette on Twitter: On John Oliver's WWE report: Well, after a complete viewing, this is the absolute most truthful outside media piece I've seen on wrestling in over 40 years.",7588,b82jv3,https://twitter.com/TheJimCornette/status/1112700358101487617,1228,1554126191.0,Feintone,0.96,/r/SquaredCircle/comments/b82jv3/jim_cornette_on_twitter_on_john_olivers_wwe/,SquaredCircle,740816,2
John Cena drops his title and gets the smooth assist from John Cone,7538,f7wltt,https://i.imgur.com/59KS8g6.gifv,254,1582396437.0,Strike_Gently,0.97,/r/SquaredCircle/comments/f7wltt/john_cena_drops_his_title_and_gets_the_smooth/,SquaredCircle,740816,2
"Scott Steiner: ""I've never failed a drug test in my life. When WWE told me to take one, I told them to have Triple H pick me up in a limo, then we could go test together. (laughs) They never asked again...""",7534,e966js,https://prowrestlingstories.com/pro-wrestling-stories/steroid-use-wwe,564,1576065449.0,broken_beat,0.97,/r/SquaredCircle/comments/e966js/scott_steiner_ive_never_failed_a_drug_test_in_my/,SquaredCircle,740816,2
"Jim Johnston: ""The music now, in WWE and in AEW, I think it's.. sorry this is mean, it's all homogenous and it's mediocre and doesn't have anything to do with the characters, and I think that's why there are less big stars.""",7500,x36tx9,https://www.sescoops.com/news/jim-johnston-wrestling-music-mediocre/,1599,1662036544.0,TheSharpshooter,0.92,/r/SquaredCircle/comments/x36tx9/jim_johnston_the_music_now_in_wwe_and_in_aew_i/,SquaredCircle,740816,2
"Rob Van Dam bows to the crowd after hitting Jerry Lynn with a swift Gorilla Press, Standing Moonsault & Second Rope Moonsault combo",7484,ltpbb0,https://i.imgur.com/YLu31ZA.gifv,459,1614436361.0,FuzzyWuzzyMooMoo,0.97,/r/SquaredCircle/comments/ltpbb0/rob_van_dam_bows_to_the_crowd_after_hitting_jerry/,SquaredCircle,740816,2
"Ariya Daivari: ""Called Hollywood Fitness in Portland to see if we could use their gym. Was told they dont want wrestlers in their gym due to the standard they're trying to set as a non intimidating environment for the other members. Smart move. I was gonna powerbomb the first granny I saw.""",7493,9kspwd,https://twitter.com/AriyaDaivariWWE/status/1047157791805169664,483,1538501574.0,dnytle,0.94,/r/SquaredCircle/comments/9kspwd/ariya_daivari_called_hollywood_fitness_in/,SquaredCircle,740816,2
WWE remade the iconic 1991 Royal Rumble poster for 2019,7478,ajs2a9,https://www.wwe.com/f/styles/talent_champion_full/public/all/2019/01/20190125_Royal_Rumble_2019_Vintage_Poster_Article--25edc0cccdbebe89d258e1f69e7d069b.jpg,545,1548441325.0,TheSharpshooter,0.95,/r/SquaredCircle/comments/ajs2a9/wwe_remade_the_iconic_1991_royal_rumble_poster/,SquaredCircle,740816,2
Bobby 'The Brain' Heenan dead at 72: Megathread,7470,70qsb8,https://www.reddit.com/r/SquaredCircle/comments/70qsb8/bobby_the_brain_heenan_dead_at_72_megathread/,1290,1505687630.0,WredditMod,0.92,/r/SquaredCircle/comments/70qsb8/bobby_the_brain_heenan_dead_at_72_megathread/,SquaredCircle,740816,2
[RAW Spoilers] Becky's Announcement,7467,ghzw0r,https://www.reddit.com/r/SquaredCircle/comments/ghzw0r/raw_spoilers_beckys_announcement/,2394,1589242329.0,JustATributeCC,0.89,/r/SquaredCircle/comments/ghzw0r/raw_spoilers_beckys_announcement/,SquaredCircle,740816,2
"To be honest, this alone should get R-Truth inducted into the Hall of Fame",7400,ecqz3m,https://v.redd.it/zz3g3ex67k541,373,1576748036.0,Bigbenn0,0.96,/r/SquaredCircle/comments/ecqz3m/to_be_honest_this_alone_should_get_rtruth/,SquaredCircle,740816,2
KO in response to Jackson Ryker: “The freedom you speak of entitles you to speak your mind all you want. I’m not here to argue that. I just really need to tell you that I think you pushing your shitty wrestling catchphrase as all of this is happening is absolutely fucking pathetic. Good night.”,7384,guzhd6,https://twitter.com/fightowensfight/status/1267656906983833600?s=21,2399,1591067990.0,TurnaboutAdam,0.92,/r/SquaredCircle/comments/guzhd6/ko_in_response_to_jackson_ryker_the_freedom_you/,SquaredCircle,740816,2
Lita revealed on her Twitch livestream last night that WWE threatened to fire her if she didn't do the live sex celebration segment with Edge,7366,kwb576,https://www.reddit.com/r/SquaredCircle/comments/kwb576/lita_revealed_on_her_twitch_livestream_last_night/,1472,1610520738.0,gonnablamethemovies,0.95,/r/SquaredCircle/comments/kwb576/lita_revealed_on_her_twitch_livestream_last_night/,SquaredCircle,740816,2
If the brawl between the Inner Circle and the Elite from this week's Dynamite was aired on WWE.,7297,gommgl,https://v.redd.it/aj9vegyzfc051,597,1590165238.0,FriskeyVsWorld,0.92,/r/SquaredCircle/comments/gommgl/if_the_brawl_between_the_inner_circle_and_the/,SquaredCircle,740816,2
"Jericho on a possible HOF induction: ""If I continue to work for the Khan family for the rest of my life, I'll never go into the WWE Hall of Fame. I'm a hall of famer in the minds of the people who want me to be in the hall of fame. I'm a hall of famer in my mind. That's all that matters.""",7271,ftq9zs,https://www.wrestlinginc.com/news/2020/04/chris-jericho-believes-vince-mcmahon-probably-regrets-668691/,878,1585847757.0,Strike_Gently,0.95,/r/SquaredCircle/comments/ftq9zs/jericho_on_a_possible_hof_induction_if_i_continue/,SquaredCircle,740816,2
[Raw Spoilers] Damn Kurt...,7180,8b3y7z,https://streamable.com/96scy,824,1523324727.0,FuzzyWuzzyMooMoo,0.91,/r/SquaredCircle/comments/8b3y7z/raw_spoilers_damn_kurt/,SquaredCircle,740816,2
Renee Young joins the Raw announce team full time,7140,9enfdk,https://twitter.com/wwepr/status/1039152551462096898?s=21,792,1536588343.0,MXPelez,0.94,/r/SquaredCircle/comments/9enfdk/renee_young_joins_the_raw_announce_team_full_time/,SquaredCircle,740816,2
"Bret Hart: ""When you look back today, they don’t wrestle like Hulk Hogan anymore. They wrestle like Bret Hart. Wrestling’s all about action and speed and telling a story and I think that’s where I came in.""",7138,rkwboc,https://www.wrestlinginc.com/news/2021/12/bret-hart-they-dont-wrestle-like-hulk-hogan-anymore-they-wrestle-like-bret-hart/,847,1640032044.0,SuplexCity-Mayor,0.95,/r/SquaredCircle/comments/rkwboc/bret_hart_when_you_look_back_today_they_dont/,SquaredCircle,740816,2
WAR GAMES!!!!,7129,dv3q1n,https://v.redd.it/3bn1778866y31,187,1573527049.0,dr_teeth33,0.95,/r/SquaredCircle/comments/dv3q1n/war_games/,SquaredCircle,740816,2
"27 years ago to this day, WWF Champion Hulk Hogan faced IWGP Champion The Great Muta",7124,gcoo3x,https://v.redd.it/5wibrsp56jw41,832,1588503277.0,mcm123456,0.95,/r/SquaredCircle/comments/gcoo3x/27_years_ago_to_this_day_wwf_champion_hulk_hogan/,SquaredCircle,740816,2
"That time when WWE instructed Edge to come back and do whatever he could to get Becky Lynch booed by the crowd, but even after making fun of Edge's career-ending neck injury, Becky still gets cheered by the crowd - you can see the moment Edge gives up and knows that nothing he does will work.",7119,lj81sx,https://v.redd.it/b0v486ajwah61,707,1613246765.0,gonnablamethemovies,0.93,/r/SquaredCircle/comments/lj81sx/that_time_when_wwe_instructed_edge_to_come_back/,SquaredCircle,740816,2
The fans accidentally tip over the guardrail as they reach for Shawn Michaels,7104,fpvism,https://gfycat.com/elementarylankycondor,406,1585309466.0,ThurmanPlugg,0.98,/r/SquaredCircle/comments/fpvism/the_fans_accidentally_tip_over_the_guardrail_as/,SquaredCircle,740816,2
"Dave Meltzer: ""What horrible news, Rocky Johnson passed away, Dwayne's father. Our best to Dwayne, Ricky, Ata and the entire family.""",7095,ep9la2,https://twitter.com/davemeltzerWON/status/1217572990528835584,318,1579127150.0,Knoxlag,0.96,/r/SquaredCircle/comments/ep9la2/dave_meltzer_what_horrible_news_rocky_johnson/,SquaredCircle,740816,2
Paul Heyman speaks on the passing of New Jack [Talking Smack],7077,nd59zx,https://v.redd.it/3okj77x4ubz61,550,1621103342.0,KhabibTime,0.96,/r/SquaredCircle/comments/nd59zx/paul_heyman_speaks_on_the_passing_of_new_jack/,SquaredCircle,740816,2
“Motherfucker”. Stone Cold steals the Rock’s moment.,7071,bzcyeg,https://gfycat.com/costlymadarizonaalligatorlizard-squaredcircle,424,1560262159.0,Naweezy,0.97,/r/SquaredCircle/comments/bzcyeg/motherfucker_stone_cold_steals_the_rocks_moment/,SquaredCircle,740816,2
Triple H repeatedly tries to subtlety tell The Shield to do their signature pose,7038,fav942,https://i.imgur.com/fJjz1kT.gifv,331,1582899047.0,Strike_Gently,0.96,/r/SquaredCircle/comments/fav942/triple_h_repeatedly_tries_to_subtlety_tell_the/,SquaredCircle,740816,2
CM Punk: “New bio!” (Bio: Taiwan is a country”,6880,nl0767,https://twitter.com/cmpunk/status/1397299736600793093?s=21,756,1621977228.0,TurnaboutAdam,0.94,/r/SquaredCircle/comments/nl0767/cm_punk_new_bio_bio_taiwan_is_a_country/,SquaredCircle,740816,2
Sami Zayn finds out that Ska isn't cool anymore,6876,hsko07,https://i.redd.it/7rl2r98jxab51.jpg,594,1594941429.0,KneeHighMischief,0.98,/r/SquaredCircle/comments/hsko07/sami_zayn_finds_out_that_ska_isnt_cool_anymore/,SquaredCircle,740816,2
[Summerslam Spoilers] Superstar celebrates their victory by putting over the sponsor.,6859,ifi6ui,https://i.redd.it/qw1jodbjmvi51.jpg,199,1598242683.0,dpw2017,0.97,/r/SquaredCircle/comments/ifi6ui/summerslam_spoilers_superstar_celebrates_their/,SquaredCircle,740816,2
"Kevin Owens in response to someone finding fault with his daughter having a mask on : ""Yeah. I’m trying to teach her not to be a selfish piece of shit.""",6858,iu6pmb,https://twitter.com/FightOwensFight/status/1306363905413971970?s=20,487,1600296460.0,dpw2017,0.95,/r/SquaredCircle/comments/iu6pmb/kevin_owens_in_response_to_someone_finding_fault/,SquaredCircle,740816,2
What is known so far about the travel issues that have left many of the WWE Talent stuck in Saudi Arabia,6843,dq39zg,https://www.reddit.com/r/SquaredCircle/comments/dq39zg/what_is_known_so_far_about_the_travel_issues_that/,2720,1572609771.0,FuzzyWuzzyMooMoo,0.93,/r/SquaredCircle/comments/dq39zg/what_is_known_so_far_about_the_travel_issues_that/,SquaredCircle,740816,2
"Just when I think I couldn't be a bigger fan of Finn Balor, he wears THAT shirt to today's episode of WWE The Bump!",6800,qc35cx,https://i.redd.it/tk65kwtbgmu71.jpg,328,1634742867.0,starbearer92,0.83,/r/SquaredCircle/comments/qc35cx/just_when_i_think_i_couldnt_be_a_bigger_fan_of/,SquaredCircle,740816,2
Keith Lee and Mia Yim got married today. Congrats to the couple. (Source: Nixon Newell's IG story),6768,slgsym,https://i.redd.it/wb916yaby2g81.jpg,263,1644095434.0,FriskeyVsWorld,0.92,/r/SquaredCircle/comments/slgsym/keith_lee_and_mia_yim_got_married_today_congrats/,SquaredCircle,740816,2
"Even on a windy day, Stone Cold can't turn down a beer",6746,nwqe0l,https://i.imgur.com/tlZwDFF.gifv,237,1623338815.0,Strike_Gently,0.98,/r/SquaredCircle/comments/nwqe0l/even_on_a_windy_day_stone_cold_cant_turn_down_a/,SquaredCircle,740816,2
Triple H disguised as Goldust shooting Kane with a Flamethrower. You can't make this shit up...,6725,dk23xb,https://gfycat.com/darkcloudyindigobunting,409,1571481845.0,mcm123456,0.97,/r/SquaredCircle/comments/dk23xb/triple_h_disguised_as_goldust_shooting_kane_with/,SquaredCircle,740816,2
AEW just announced that Jon Moxley has signed a five-year contract extension that also includes an expanded role in coaching and mentorship.,6685,xyf1hq,https://twitter.com/marcraimondi/status/1578546816810815488,620,1665189904.0,KhabibTime,0.94,/r/SquaredCircle/comments/xyf1hq/aew_just_announced_that_jon_moxley_has_signed_a/,SquaredCircle,740816,2
Two legends with their signature rises,6620,d01ul8,https://gfycat.com/scarceselfishhippopotamus-squaredcircle-onepiece-popular,286,1567695208.0,Naweezy,0.97,/r/SquaredCircle/comments/d01ul8/two_legends_with_their_signature_rises/,SquaredCircle,740816,2
Trump appoints Vince Russo as chief of border wall to ensure nobody gets over.,6584,ae6jrb,https://www.kayfabenews.com/trump-appoints-vince-russo-chief-border-wall-ensure-nobody-gets/,441,1547038425.0,Feintone,0.9,/r/SquaredCircle/comments/ae6jrb/trump_appoints_vince_russo_as_chief_of_border/,SquaredCircle,740816,2
Smackdown Cameraman has a message for everyone,6568,ebw4li,https://i.imgur.com/OvcZ7v8.gifv,195,1576591164.0,Strike_Gently,0.98,/r/SquaredCircle/comments/ebw4li/smackdown_cameraman_has_a_message_for_everyone/,SquaredCircle,740816,2
PWInsider - WWE releases Velveteen Dream,6553,nhbah8,https://www.pwinsider.com/ViewArticle.php?id=147051,1952,1621544225.0,stonepa11,0.94,/r/SquaredCircle/comments/nhbah8/pwinsider_wwe_releases_velveteen_dream/,SquaredCircle,740816,2
CM Punk: “Doesn’t matter if your opinion of your coworker is positive or negative. Stand with them. Because they’ll do the same thing to you and you’ll wish someone helped. Trust me. You’re expendable. Together you’re unstoppable”,6546,uuva6d,https://twitter.com/cmpunk/status/1528110014853853184?s=21&t=5y62plYjqw2EFsyAIqQaKQ,901,1653164846.0,Strike_Gently,0.91,/r/SquaredCircle/comments/uuva6d/cm_punk_doesnt_matter_if_your_opinion_of_your/,SquaredCircle,740816,2
Batista: “They’re going to have to come up with another word thats used specifically for professional wrestlers who actually mean it when they say they’re retired. Currently the word “retired” has zero credibility by professional wrestling standards.”,6510,lxn3gg,https://twitter.com/davebautista/status/1367349588970123267?s=21,742,1614871830.0,Strike_Gently,0.97,/r/SquaredCircle/comments/lxn3gg/batista_theyre_going_to_have_to_come_up_with/,SquaredCircle,740816,2
Luke Harper requests release from WWE,6504,bdynfi,https://twitter.com/LukeHarperWWE/status/1118246927999676416,1784,1555445859.0,stonepa11,0.94,/r/SquaredCircle/comments/bdynfi/luke_harper_requests_release_from_wwe/,SquaredCircle,740816,2
Here’s my Roman Reigns drawing.,6498,j95kgg,https://i.redd.it/ec1qtnmgygs51.jpg,306,1602423569.0,Macaveli54,0.95,/r/SquaredCircle/comments/j95kgg/heres_my_roman_reigns_drawing/,SquaredCircle,740816,2
Undertakers comically large cowboy hat from when he returned as the deadman in 2004,6487,mvde6b,https://i.redd.it/pmlem2agfiu61.jpg,363,1619003615.0,MatthewMir,0.98,/r/SquaredCircle/comments/mvde6b/undertakers_comically_large_cowboy_hat_from_when/,SquaredCircle,740816,2
JR’s hatred for Triple H in the early 2000’s is unmatched,6477,nyy0bm,https://v.redd.it/i50qlyn1r1571,491,1623596053.0,KOSLawson,0.97,/r/SquaredCircle/comments/nyy0bm/jrs_hatred_for_triple_h_in_the_early_2000s_is/,SquaredCircle,740816,2
A reminder that Ricochet isn’t human.,6469,fkmphb,https://v.redd.it/3algfholeen41,512,1584522947.0,Bigbenn0,0.96,/r/SquaredCircle/comments/fkmphb/a_reminder_that_ricochet_isnt_human/,SquaredCircle,740816,2
Hangman Page: “if you work piss-in-a-bottle hard for long enough then you too can watch your boss’ boss’ boss’ tax cheat boss go on a ten minute almost space vacation. aew dynamite tomorrow at 8pm”,6448,oo4l4v,https://twitter.com/theadampage/status/1417510201784213513?s=21,609,1626795783.0,Weezy-NJPW_Fan,0.95,/r/SquaredCircle/comments/oo4l4v/hangman_page_if_you_work_pissinabottle_hard_for/,SquaredCircle,740816,2
"Cesaro: ""Reminds me of a few years back, I was in catering trying to go back to my table. Dwayne Johnson was in the way so I turned around but there was The Hitman. I was stuck between a rock and a hart place...""",6446,hyu19c,https://twitter.com/WWECesaro/status/1287766681851514880?s=20,190,1595862641.0,Strike_Gently,0.97,/r/SquaredCircle/comments/hyu19c/cesaro_reminds_me_of_a_few_years_back_i_was_in/,SquaredCircle,740816,2
"WWE employees were told by Triple H, Stephanie McMahon, and Nick Khan today that Juneteenth, Veteran's Day, Thanksgiving eve and a floating holiday have all been added to their paid holiday schedule for 2023.",6442,xjkgi0,https://twitter.com/seanrosssapp/status/1572329812949348352?s=46&t=2PNBVQR9k2QDIuB9TWx9Mg,566,1663707648.0,TurnaboutAdam,0.95,/r/SquaredCircle/comments/xjkgi0/wwe_employees_were_told_by_triple_h_stephanie/,SquaredCircle,740816,2
Adam Cole has a stare down with a hamster over Instagram Live,6439,gwvx2a,https://i.imgur.com/HYXNg6B.gifv,241,1591324176.0,Strike_Gently,0.97,/r/SquaredCircle/comments/gwvx2a/adam_cole_has_a_stare_down_with_a_hamster_over/,SquaredCircle,740816,2
"[Rumble Spoilers] This Is Brock Lesnar, Hear Him Scream - The Remix",6420,aku4ny,https://streamable.com/cylzo,180,1548721339.0,RealWWE,0.95,/r/SquaredCircle/comments/aku4ny/rumble_spoilers_this_is_brock_lesnar_hear_him/,SquaredCircle,740816,2
[Dynamite Spoiler] A BIG debut after the Tag match,6394,k5o1aa,https://streamable.com/4hu8q6,1237,1606961273.0,FuzzyWuzzyMooMoo,0.93,/r/SquaredCircle/comments/k5o1aa/dynamite_spoiler_a_big_debut_after_the_tag_match/,SquaredCircle,740816,2
"Bryan Danielson: ""if you're under a contract with WWE and you're not happy or your not happy with the company or whatever it is, if they can fire you and give you 90 days [then] you should be able to give them 90 days to be released from your contract.""",6388,qr233s,https://wrestlingnews.co/wwe-news/bryan-danielson-comments-on-wwe-talent-cuts-says-wrestlers-should-be-able-to-give-notice-if-they-are-not-happy/,525,1636572469.0,elegantSolomons62,0.96,/r/SquaredCircle/comments/qr233s/bryan_danielson_if_youre_under_a_contract_with/,SquaredCircle,740816,2
The Usos forfeiting the Gauntlet Match out of respect for Kofi and The New Day was perfection and one of the best part of Kofimania. WWE gets a lot of criticism for their storylines and bookings and whatnot but Kofimania shows that they can be great when they want to.,6391,f472vm,https://v.redd.it/b1eykahuy1h41,357,1581757821.0,Bigbenn0,0.95,/r/SquaredCircle/comments/f472vm/the_usos_forfeiting_the_gauntlet_match_out_of/,SquaredCircle,740816,2
Hacksaw Jim Duggan says he is cancer free. Hoooooo!!!!,6377,rbuees,https://twitter.com/OfficialHacksaw/status/1468605030219534338,138,1638979166.0,elegantSolomons62,0.98,/r/SquaredCircle/comments/rbuees/hacksaw_jim_duggan_says_he_is_cancer_free_hoooooo/,SquaredCircle,740816,2
"Vickie Guerrero: ""I met Eddie on a blind date. I didn't get home until 4 A.M because we danced till 3 A.M. I said, 'Dad, punish me how you want. I just met the greatest guy. I don't care what my punishment is.' And we started dating ever since and it was history after that.""",6376,cg3pof,https://www.wrestlinginc.com/news/2019/07/vickie-guerrero-opens-up-on-how-she-first-met-eddie-656604/,261,1563741196.0,GetDown90,0.96,/r/SquaredCircle/comments/cg3pof/vickie_guerrero_i_met_eddie_on_a_blind_date_i/,SquaredCircle,740816,2
Kevin Nash: “You're an employee if you have to show up at specific time and are restricted monetary gains in your personal time. Ask for your health insurance coverage and profit sharing.”,6357,in349o,https://twitter.com/realkevinnash/status/1302148803726700549?s=21,553,1599320064.0,Strike_Gently,0.97,/r/SquaredCircle/comments/in349o/kevin_nash_youre_an_employee_if_you_have_to_show/,SquaredCircle,740816,2
The Rock attempts the Rock Bottom on Eddie Guerrero,6326,fzx19g,https://gfycat.com/violethotdiplodocus,404,1586699227.0,Naweezy,0.98,/r/SquaredCircle/comments/fzx19g/the_rock_attempts_the_rock_bottom_on_eddie/,SquaredCircle,740816,2
Edge backstage immediately before his Royal Rumble return,6327,ewac8l,https://i.imgur.com/swywpL3.jpg,308,1580410704.0,Strike_Gently,0.97,/r/SquaredCircle/comments/ewac8l/edge_backstage_immediately_before_his_royal/,SquaredCircle,740816,2
Nia Jax's first appearance at a wrestling promotion since WWE release,6323,titqd4,https://v.redd.it/f0kdzu76jlo81,381,1647807167.0,xRainjosh,0.93,/r/SquaredCircle/comments/titqd4/nia_jaxs_first_appearance_at_a_wrestling/,SquaredCircle,740816,2
HANGMAN: “just came to the realization that simply escaping the calendar year won’t change the void of human empathy that has made this year so disheartening. have a great weekend.”,6319,ie1ie4,https://twitter.com/theadampage/status/1296866088987303936?s=21,553,1598031982.0,Strike_Gently,0.95,/r/SquaredCircle/comments/ie1ie4/hangman_just_came_to_the_realization_that_simply/,SquaredCircle,740816,2
"Kurt Angle putting his straps back on, just to take his straps off seconds later.",6314,nv19wi,https://v.redd.it/oh8dy8ezu0471,297,1623149406.0,MatthewMir,0.98,/r/SquaredCircle/comments/nv19wi/kurt_angle_putting_his_straps_back_on_just_to/,SquaredCircle,740816,2
Mark Henry’s controller has disconnected.,6287,gtv0eb,https://v.redd.it/tvv1wjtd42251,328,1590911929.0,MatthewMir,0.98,/r/SquaredCircle/comments/gtv0eb/mark_henrys_controller_has_disconnected/,SquaredCircle,740816,2
Renee Paquette announces that she has given birth to her and Jon Moxley's baby girl,6287,o0fqdi,https://twitter.com/ReneePaquette/status/1404808281655332874,318,1623767489.0,gonnablamethemovies,0.95,/r/SquaredCircle/comments/o0fqdi/renee_paquette_announces_that_she_has_given_birth/,SquaredCircle,740816,2
Dustin Rhodes: Today is a huge milestone for me. I have 14 yrs clean and sober from drugs and alcohol. Believe me when I say this for those who are struggling. YOU CANNOT DO IT ALONE. Seek help and #KeepSteppin 🤘🏼,6273,ut92rf,https://twitter.com/dustinrhodes/status/1527346749249327104?s=21&t=9TRLceVoJIR8fNe7zGSDow,154,1652982864.0,TurnaboutAdam,0.97,/r/SquaredCircle/comments/ut92rf/dustin_rhodes_today_is_a_huge_milestone_for_me_i/,SquaredCircle,740816,2
PWInsider: Lars Sullivan Released from WWE,6270,lb89go,https://www.pwinsider.com/ViewArticle.php?id=143628,1467,1612304326.0,stonepa11,0.94,/r/SquaredCircle/comments/lb89go/pwinsider_lars_sullivan_released_from_wwe/,SquaredCircle,740816,2
"Jim Ross wants Rusev in AEW: ""Rusev would be my priority. That's who I'd want to go after first because I can see him having major pay-per-view main event matches with a variety of top talents in our company AEW...I'd like to call his matches on that high level...He's got something to prove now""",6259,g4gmrb,https://wrestlingnews.co/wwe-news/jim-ross-says-wwe-missed-the-boat-on-rusev-and-he-would-like-to-see-him-in-aew/,899,1587334617.0,tentolive85,0.96,/r/SquaredCircle/comments/g4gmrb/jim_ross_wants_rusev_in_aew_rusev_would_be_my/,SquaredCircle,740816,2
"Being The Elite 236 - ""Brodie""",6260,klu6q2,https://youtu.be/L7O_79xnE1Y,563,1609174856.0,20minutes40years,0.96,/r/SquaredCircle/comments/klu6q2/being_the_elite_236_brodie/,SquaredCircle,740816,2
[AEW Double or Nothing Spoiler] Surprise appearance after the Main Event,6246,bt3ity,https://www.reddit.com/r/SquaredCircle/comments/bt3ity/aew_double_or_nothing_spoiler_surprise_appearance/,1335,1558842425.0,FuzzyWuzzyMooMoo,0.93,/r/SquaredCircle/comments/bt3ity/aew_double_or_nothing_spoiler_surprise_appearance/,SquaredCircle,740816,2
The Undertaker and Stone Cold lock up to start the match,6243,fdd3yu,https://i.imgur.com/DbuYvBd.gifv,220,1583329061.0,Strike_Gently,0.98,/r/SquaredCircle/comments/fdd3yu/the_undertaker_and_stone_cold_lock_up_to_start/,SquaredCircle,740816,2
Wrestling 101: Don’t drop a beer Stone Cold throws you,6236,bg25m4,https://i.redd.it/8v8mqh1yitt21.gif,204,1555940001.0,Naweezy,0.97,/r/SquaredCircle/comments/bg25m4/wrestling_101_dont_drop_a_beer_stone_cold_throws/,SquaredCircle,740816,2
"(Raw Spoilers) Ladies and gentlemen, Braun Strowman...",6214,7x6fux,https://streamable.com/fvown,878,1518491358.0,FuzzyWuzzyMooMoo,0.91,/r/SquaredCircle/comments/7x6fux/raw_spoilers_ladies_and_gentlemen_braun_strowman/,SquaredCircle,740816,2
