title,score,id,url,num_comments,created,author,upvote_ratio,permalink,subreddit,subreddit_subscribers,depth
Twitter blocks users from liking Trump video message as calls grow for his account to be removed,150,kry35q,https://www.independent.co.uk/news/world/americas/us-politics/twitter-donald-trump-blocks-comments-likes-b1783523.html,12,1609969868.0,Pessimist2020,0.97,/r/uspolitics/comments/kry35q/twitter_blocks_users_from_liking_trump_video/,uspolitics,28979,2
Donald Trump's private helicopter worth over $1 million up for sale after election Loss,152,jqxiw8,https://www.newsweek.com/donald-trumps-private-helicopter-worth-over-1-million-sale-after-election-loss-1545910,40,1604928259.0,truupe,0.98,/r/uspolitics/comments/jqxiw8/donald_trumps_private_helicopter_worth_over_1/,uspolitics,28979,2
Trump’s Voter Fraud Claims Are A Scam To Pay Off Campaign Debt,154,jqfz0h,https://www.politicususa.com/2020/11/08/trump-voter-fraud-campaign-debt.html,34,1604857726.0,3ustice3,0.95,/r/uspolitics/comments/jqfz0h/trumps_voter_fraud_claims_are_a_scam_to_pay_off/,uspolitics,28979,2
"AOC: ""It is stomach-churning that the first thoughts these Senators had to a dire & classified #COVID briefing was how to profit off this crisis. They didn’t mobilize to help families, or prep response. They dumped stock. Sen. Loeffler needs to resign, too.""",149,fn98wl,https://twitter.com/AOC/status/1240815356572205056,18,1584918407.0,shallah,0.96,/r/uspolitics/comments/fn98wl/aoc_it_is_stomachchurning_that_the_first_thoughts/,uspolitics,28979,2
"Mike Pence and his wife, Karen, voted by mail in April from a mansion they haven't lived in for 4 years",149,hefhp7,https://www.businessinsider.com/vice-president-pence-voted-by-mail-in-indiana-gop-primary-2020-6,39,1592922180.0,HenryCorp,0.97,/r/uspolitics/comments/hefhp7/mike_pence_and_his_wife_karen_voted_by_mail_in/,uspolitics,28979,2
John Oliver endorses Medicare for All; calls Pete’s “Medicare for All Who Want It” a “shit sandwich with a side of Guacamole”,153,f5gysd,https://twitter.com/dilanpcook/status/1229361734726623239,22,1581978442.0,bigohunter,0.94,/r/uspolitics/comments/f5gysd/john_oliver_endorses_medicare_for_all_calls_petes/,uspolitics,28979,2
"As Governor, Mike Pence Used a Personal Email Account for Official State Business. Seriously.",152,5x86yi,http://www.slate.com/blogs/the_slatest/2017/03/02/like_clinton_gov_pence_used_a_personal_email_for_state_business.html,42,1488513312.0,bobbelcher,0.78,/r/uspolitics/comments/5x86yi/as_governor_mike_pence_used_a_personal_email/,uspolitics,28979,2
Ex-Rand Paul aide pardoned by Trump convicted of illegally funneling Russian cash to Trump campaign,148,z06sck,https://www.salon.com/2022/11/18/ex-rand-paul-aide-pardoned-by-convicted-of-illegally-funneling-russian-cash-to-campaign/,10,1668957819.0,SimilarPlate,0.99,/r/uspolitics/comments/z06sck/exrand_paul_aide_pardoned_by_trump_convicted_of/,uspolitics,28979,2
"Almost All Press Were Initially Denied Access to Court Hearing on GOP’s Effort to Discard 126,000 Drive-Thru Votes in Texas",149,jmuxuq,https://lawandcrime.com/2020-election/almost-all-press-denied-access-to-hearing-on-gops-effort-to-discard-126000-drive-thru-votes-in-texas/,23,1604347322.0,bobbelcher,0.99,/r/uspolitics/comments/jmuxuq/almost_all_press_were_initially_denied_access_to/,uspolitics,28979,2
Pope Francis Suggests Donald Trump Is ‘Not Christian’,153,j1zxoa,https://www.nytimes.com/2016/02/19/world/americas/pope-francis-donald-trump-christian.html?smid=tw-share,31,1601388633.0,Bobinct,0.98,/r/uspolitics/comments/j1zxoa/pope_francis_suggests_donald_trump_is_not/,uspolitics,28979,2
Noted Republican Tulsi Gabbard Leaves Democratic Party,148,y1d7r2,https://www.buzzfeednews.com/article/davidmack/tulsi-gabbard-leaves-democrats,111,1665505124.0,BitterFuture,0.94,/r/uspolitics/comments/y1d7r2/noted_republican_tulsi_gabbard_leaves_democratic/,uspolitics,28979,2
West Virginia lawmaker records himself storming Capitol. Thousands call for his resignation.,146,kt1dds,https://www.nbcnews.com/news/us-news/west-virginia-lawmaker-records-himself-storming-capitol-thousands-call-his-n1253362,12,1610108293.0,realplayer16,0.99,/r/uspolitics/comments/kt1dds/west_virginia_lawmaker_records_himself_storming/,uspolitics,28979,2
Donald Trump nominates man whose firm tripled price of insulin to regulate drug companies,151,awopw9,https://www.independent.co.uk/news/world/americas/us-politics/donald-trump-nominates-alex-azar-eli-lilley-who-tripled-price-of-insulin-to-regulate-drug-companies-a8062886.html,10,1551574857.0,stankmanly,0.99,/r/uspolitics/comments/awopw9/donald_trump_nominates_man_whose_firm_tripled/,uspolitics,28979,2
"White House spokeswoman Sarah Huckabee Sanders: ""The president in no way, form or fashion has ever promoted or encouraged violence."" | FALSE",150,6leh7c,http://www.politifact.com/truth-o-meter/statements/2017/jul/05/sarah-huckabee-sanders/has-donald-trump-never-promoted-or-encouraged-viol/,43,1499266158.0,bobbelcher,0.67,/r/uspolitics/comments/6leh7c/white_house_spokeswoman_sarah_huckabee_sanders/,uspolitics,28979,2
Video of Lindsey Graham insisting Supreme Court vacancies should never be filled in election years goes viral,148,ivvd1v,https://www.independent.co.uk/news/world/americas/us-election/justice-ruth-bader-ginsburg-death-lindsey-graham-supreme-court-replacement-election-b498014.html,85,1600531792.0,SamDemosthenes,0.98,/r/uspolitics/comments/ivvd1v/video_of_lindsey_graham_insisting_supreme_court/,uspolitics,28979,2
Someone In The White House Leaked Trump's Calls Because They Are Trying To Warn America,145,6rej9i,http://www.politicususa.com/2017/08/03/white-house-leaked-trumps-calls-warn-america.html,9,1501786423.0,pheonix200,0.85,/r/uspolitics/comments/6rej9i/someone_in_the_white_house_leaked_trumps_calls/,uspolitics,28979,2
Prosecutors announce conspiracy charges against Proud Boys over Capitol riot,145,l8lgxc,https://thehill.com/regulation/court-battles/536603-prosecutors-announce-conspiracy-charges-against-proud-boys-over,8,1612012507.0,Pessimist2020,0.99,/r/uspolitics/comments/l8lgxc/prosecutors_announce_conspiracy_charges_against/,uspolitics,28979,2
"Senior Trump Official: We Were Wrong, He’s a ‘Fascist’",147,ktqnji,https://nymag.com/intelligencer/2021/01/capitol-riot-senior-trump-official-calls-him-a-fascist.html?utm_medium=s1&utm_campaign=nym&utm_source=tw,24,1610197759.0,DonaldWillKillUsAll,0.99,/r/uspolitics/comments/ktqnji/senior_trump_official_we_were_wrong_hes_a_fascist/,uspolitics,28979,2
Mattis tears into Trump: 'We are witnessing the consequences of three years without mature leadership',145,gw4kw3,https://www.cnn.com/2020/06/03/politics/mattis-statement-trump/index.html,14,1591224239.0,bobbelcher,0.97,/r/uspolitics/comments/gw4kw3/mattis_tears_into_trump_we_are_witnessing_the/,uspolitics,28979,2
Donald Trump has assembled the worst Cabinet in American history,147,5p5dx8,https://www.washingtonpost.com/blogs/plum-line/wp/2017/01/19/donald-trump-has-assembled-the-worst-cabinet-in-american-history/?hpid=hp_no-name_opinion-card-b%3Ahomepage%2Fstory&utm_term=.e23f9ecd60c6,16,1484934556.0,HenryCorp,0.66,/r/uspolitics/comments/5p5dx8/donald_trump_has_assembled_the_worst_cabinet_in/,uspolitics,28979,2
All 26 House Oversight Republicans refuse to sign statement denouncing white supremacy,147,11mqpj6,https://www.msn.com/en-us/news/politics/all-26-house-oversight-republicans-refuse-to-sign-statement-denouncing-white-supremacy/ar-AA18niP8?ocid=msedgntp&cvid=59523df41b0a418094afb5a2e6fb7101&ei=45,32,1678364209.0,northstardim,0.94,/r/uspolitics/comments/11mqpj6/all_26_house_oversight_republicans_refuse_to_sign/,uspolitics,28979,2
A former Georgia deputy boasted of charging Black people with felonies to make sure they lost their vote,143,n138mb,https://www.alternet.org/2021/04/felons-vote/,17,1619699278.0,stankmanly,0.99,/r/uspolitics/comments/n138mb/a_former_georgia_deputy_boasted_of_charging_black/,uspolitics,28979,2
"In Case You Missed It, Ronald Reagan was a Scumbag",144,jybqpg,https://kotaku.com/in-case-you-missed-it-reagan-was-a-scumbag-1845719331,27,1605969439.0,HenryCorp,0.97,/r/uspolitics/comments/jybqpg/in_case_you_missed_it_ronald_reagan_was_a_scumbag/,uspolitics,28979,2
More than 130 Secret Service officers are said to be infected with coronavirus or quarantining in wake of Trump’s campaign travel,146,jtijhr,https://www.washingtonpost.com/politics/secret-service-coronavirus-outbreak/2020/11/13/610eebcc-2539-11eb-8672-c281c7a2c96e_story.html,10,1605284048.0,bobbelcher,0.99,/r/uspolitics/comments/jtijhr/more_than_130_secret_service_officers_are_said_to/,uspolitics,28979,2
Ron DeSantis defended leaflets given to migrants he sent to Martha's Vineyard which promised them cash and jobs,141,xjawyo,https://www.msn.com/en-us/news/us/ron-desantis-defended-leaflets-given-to-migrants-he-sent-to-martha-s-vineyard-which-promised-them-cash-and-jobs/ar-AA122rs5?ocid=msedgdhp&pc=U531&cvid=fb0512d3a2304fc5a0a40ff5c556269c,62,1663685545.0,northstardim,0.96,/r/uspolitics/comments/xjawyo/ron_desantis_defended_leaflets_given_to_migrants/,uspolitics,28979,2
"""This is madness"": Mitt Romney blasts GOP lawmakers threatening to protest Electoral College vote",142,kaf1al,https://www.salon.com/2020/12/10/this-is-madness-mitt-romney-blasts-gop-lawmakers-threatening-to-protest-electoral-college-vote_partner/,33,1607605945.0,Pessimist2020,0.99,/r/uspolitics/comments/kaf1al/this_is_madness_mitt_romney_blasts_gop_lawmakers/,uspolitics,28979,2
Judge Rules Tucker Carlson Is Not a Credible Source of News,144,izpfj9,https://slate.com/news-and-politics/2020/09/judge-rules-fox-news-tucker-carlson-not-source-of-news-defamation-suit-mcdougal-trump.html,20,1601059859.0,bobbelcher,0.97,/r/uspolitics/comments/izpfj9/judge_rules_tucker_carlson_is_not_a_credible/,uspolitics,28979,2
Marjorie Taylor Greene's new 'endorsement of violence' could land her in front of a grand jury: CNN analysts,141,zk6p5d,https://www.rawstory.com/marjorie-taylor-greene-jan-6-2658951163/,51,1670868926.0,SimilarPlate,0.96,/r/uspolitics/comments/zk6p5d/marjorie_taylor_greenes_new_endorsement_of/,uspolitics,28979,2
"Conservatives, not liberals, are more inclined to value feelings over facts, psychology study finds",142,l06qzl,https://www.salon.com/2021/01/18/conservatives-not-liberals-are-more-inclined-to-value-feelings-over-facts-psychology-study-finds/,41,1611012694.0,CamelsandHippos,0.96,/r/uspolitics/comments/l06qzl/conservatives_not_liberals_are_more_inclined_to/,uspolitics,28979,2
"Donald Trump is wrong to claim that a winner has to be announced Election Night. In fact, federal law allows states until more than a month after the election to finalize their results.",145,jk25xl,https://www.politifact.com/factchecks/2020/oct/28/donald-trump/donald-trump-wrong-winner-has-be-announced-electio/,15,1603939564.0,cos,0.98,/r/uspolitics/comments/jk25xl/donald_trump_is_wrong_to_claim_that_a_winner_has/,uspolitics,28979,2
Trump demands “these votes must not count” after California opens poll site in heavily black area,140,gicoyw,https://www.salon.com/2020/05/11/trump-demands-these-votes-must-not-count-after-california-opens-poll-site-in-heavily-black-area/,35,1589295218.0,mulutavcocktail,0.96,/r/uspolitics/comments/gicoyw/trump_demands_these_votes_must_not_count_after/,uspolitics,28979,2
"President Donald Trump: ""Every single Democrat in the U.S. Senate has signed up for the open borders, and it's a bill, it's called the ‘open borders bill.’"" | FALSE",140,9mhdav,https://www.politifact.com/truth-o-meter/statements/2018/oct/08/donald-trump/donald-trump-falsely-claims-theres-open-borders-bi/,25,1539022379.0,bobbelcher,0.9,/r/uspolitics/comments/9mhdav/president_donald_trump_every_single_democrat_in/,uspolitics,28979,2
"Biden Says Top Executives of Failed Banks Should Face Harsher Penalties: ""We need to claw back every penny of their unjust pay and bonuses, impose real penalties, and ensure these executives never work in the banking industry again,""",144,11vqa3e,https://www.commondreams.org/news/biden-svb-executives,18,1679244524.0,shallah,0.99,/r/uspolitics/comments/11vqa3e/biden_says_top_executives_of_failed_banks_should/,uspolitics,28979,2
The FBI Just Put White Nationalists and Neo-Nazis on the Same Threat Level as ISIS,139,ezxhh6,https://www.vice.com/en_us/article/3a8awn/the-fbi-just-put-white-nationalists-and-neo-nazis-on-the-same-threat-level-as-isis,60,1581017281.0,bobbelcher,0.99,/r/uspolitics/comments/ezxhh6/the_fbi_just_put_white_nationalists_and_neonazis/,uspolitics,28979,2
Republicans Are Lying About Trumpcare,141,6a1fkx,http://www.slate.com/articles/news_and_politics/politics/2017/05/republicans_are_lying_about_trumpcare.html,30,1494282445.0,bobbelcher,0.82,/r/uspolitics/comments/6a1fkx/republicans_are_lying_about_trumpcare/,uspolitics,28979,2
Trump didn't bother to show up in Situation Room for botched Yemen raid,141,5rurhl,http://www.dailykos.com/story/2017/2/2/1629117/-Trump-didn-t-bother-to-show-up-in-Situation-Room-for-botched-Yemen-raid,29,1486138218.0,HenryCorp,0.78,/r/uspolitics/comments/5rurhl/trump_didnt_bother_to_show_up_in_situation_room/,uspolitics,28979,2
Rep. Lauren Boebert Ripped For Not Understanding Basics Of The Constitution,138,lo7nd1,https://www.huffpost.com/entry/lauren-boebert-constitutional-amendments-twitter_n_603008f4c5b66da5dba156cc,44,1613829503.0,Bobinct,0.97,/r/uspolitics/comments/lo7nd1/rep_lauren_boebert_ripped_for_not_understanding/,uspolitics,28979,2
Tearful Pelosi says Congress members may be prosecuted as she announces Capitol security review,140,ky0vzd,https://www.independent.co.uk/news/world/americas/us-election-2020/pelosi-tears-capitol-congress-prosecute-b1788043.html,42,1610736226.0,bobbelcher,0.97,/r/uspolitics/comments/ky0vzd/tearful_pelosi_says_congress_members_may_be/,uspolitics,28979,2
"Fox News investigation crushes Hunter Biden smear: Network ""found no role for Joe Biden""",136,jigydc,https://www.salon.com/2020/10/25/fox-news-investigation-crushes-hunter-biden-smear-network-found-no-role-for-joe-biden_partner/,17,1603727283.0,stankmanly,0.99,/r/uspolitics/comments/jigydc/fox_news_investigation_crushes_hunter_biden_smear/,uspolitics,28979,2
Man Who Called Ohio's Lockdown Order 'Bullshit' Has Succumbed To COVID-19,138,g4yke8,https://crooksandliars.com/2020/04/man-who-called-ohios-lockdown-order,32,1587407960.0,bobbelcher,0.97,/r/uspolitics/comments/g4yke8/man_who_called_ohios_lockdown_order_bullshit_has/,uspolitics,28979,2
"Trump tries to dodge responsibility for the terrible coronavirus response by blaming Obama, saying that he ""inherited a bad system."" If he did, he had three years to fix it and failed to do so.",142,fq5i04,https://www.cnbc.com/2020/03/13/coronavirus-trump-says-i-dont-take-responsibility-at-all-for-lack-of-tests.html,16,1585342426.0,Dems4Prez,0.95,/r/uspolitics/comments/fq5i04/trump_tries_to_dodge_responsibility_for_the/,uspolitics,28979,2
"Trump was ‘muttering, I won, I won, like ‘Mad King George’ after election defeat, report says",142,k3arlr,https://www.independent.co.uk/news/world/americas/us-election-2020/election-results-trump-king-george-b1763487.html,27,1606662227.0,Pessimist2020,0.93,/r/uspolitics/comments/k3arlr/trump_was_muttering_i_won_i_won_like_mad_king/,uspolitics,28979,2
"It’s amazing how many Republicans have apparently forgotten that this past election cycle they nominated a Holocaust denier in California, white supremacists in North Carolina & Iowa, a pro-Confederate candidate in Virginia, a pedophile in Alabama, and an actual Nazi in Illinois.",137,amp160,https://twitter.com/Weinsteinlaw/status/1091560610763034629,63,1549195759.0,shallah,0.92,/r/uspolitics/comments/amp160/its_amazing_how_many_republicans_have_apparently/,uspolitics,28979,2
"President Donald Trump: Ending the estate tax would ""protect millions of small businesses and the American farmer."" | PANTS ON FIRE!",139,731nxk,http://www.politifact.com/truth-o-meter/statements/2017/sep/28/donald-trump/donald-trumps-pants-fire-claim-about-estate-tax-sm/,18,1506619914.0,bobbelcher,0.81,/r/uspolitics/comments/731nxk/president_donald_trump_ending_the_estate_tax/,uspolitics,28979,2
More pregnant minors forced to leave Ohio to prevent giving birth to their rapists' babies: affidavits,134,xluwjn,https://www.rawstory.com/amp/forced-to-leave-ohio-2658323769,10,1663932389.0,shallah,0.99,/r/uspolitics/comments/xluwjn/more_pregnant_minors_forced_to_leave_ohio_to/,uspolitics,28979,2
Fox News in real trouble for spreading 'pure bunk' about Trump's loss -- and OAN could be 'wiped out' by lawsuits,137,vrxh8r,https://www.msn.com/en-us/news/us/fox-news-in-real-trouble-for-spreading-pure-bunk-about-trump-s-loss-and-oan-could-be-wiped-out-by-lawsuits/ar-AAZaRKn?ocid=msedgntp&cvid=d93d902de20f49d99e1994004e739fde,24,1657026500.0,northstardim,0.96,/r/uspolitics/comments/vrxh8r/fox_news_in_real_trouble_for_spreading_pure_bunk/,uspolitics,28979,2
Trump Wanted His Justice Department to Stop ‘SNL’ From Teasing Him,137,o5lnhg,https://news.yahoo.com/trump-wanted-justice-department-stop-074151566.html,29,1624363886.0,stankmanly,0.99,/r/uspolitics/comments/o5lnhg/trump_wanted_his_justice_department_to_stop_snl/,uspolitics,28979,2
Trump ally and postmaster general Louis DeJoy under FBI investigation for campaign fundraising,141,nrhyez,https://www.independent.co.uk/news/world/americas/us-politics/louis-dejoy-trump-postmaster-general-investigation-b1859188.html,97,1622738750.0,Pessimist2020,0.99,/r/uspolitics/comments/nrhyez/trump_ally_and_postmaster_general_louis_dejoy/,uspolitics,28979,2
Matt Gaetz's Alibi Goes Down In Flames,139,mikq7n,https://crooksandliars.com/2021/04/matt-gaetzs-alibi-goes-down-flames,17,1617371257.0,stankmanly,0.97,/r/uspolitics/comments/mikq7n/matt_gaetzs_alibi_goes_down_in_flames/,uspolitics,28979,2
"Trump supporters are planning to storm the Capitol again on 4 March, lawmaker warns",138,lmr41h,https://www.independent.co.uk/news/world/americas/us-politics/trump-4-march-qanon-capitol-b1804041.html,26,1613666905.0,Facerealityalready,0.99,/r/uspolitics/comments/lmr41h/trump_supporters_are_planning_to_storm_the/,uspolitics,28979,2
Two dozen congressmen and women call for Trump impeachment,138,ksbyz6,https://www.independent.co.uk/news/world/americas/us-politics/trump-capitol-impeachment-biden-b1783677.html,18,1610021128.0,Pessimist2020,0.99,/r/uspolitics/comments/ksbyz6/two_dozen_congressmen_and_women_call_for_trump/,uspolitics,28979,2
"Police brandishing firearms raided the home of Rebekah Jones, the former Florida employee who built the state's much-praised COVID-19 dashboard before being fired for refusing to ""manipulate data.""",135,k8rx1b,https://www.tallahassee.com/story/news/2020/12/07/agents-raid-home-fired-florida-data-scientist-who-built-covid-19-dashboard-rebekah-jones/6482817002/,18,1607382430.0,cos,0.99,/r/uspolitics/comments/k8rx1b/police_brandishing_firearms_raided_the_home_of/,uspolitics,28979,2
Georgia to re-certify Biden victory after two recounts,138,k8iouj,https://www.independent.co.uk/news/world/americas/us-election-2020/biden-georgia-recount-election-trump-b1767480.html,7,1607355082.0,Pessimist2020,0.99,/r/uspolitics/comments/k8iouj/georgia_to_recertify_biden_victory_after_two/,uspolitics,28979,2
"There’s a Giant Hole in the ""bipartisan"" Coronavirus Bill: Trump and Republicans Demanded an Exemption for the largest Corporations, which are not required to provide paid sick leave. They employ more than half of all Americans.",140,fimksa,https://www.nytimes.com/2020/03/14/opinion/coronavirus-pelosi-sick-leave.html,10,1584209095.0,Dems4Prez,0.99,/r/uspolitics/comments/fimksa/theres_a_giant_hole_in_the_bipartisan_coronavirus/,uspolitics,28979,2
Trump Just Blew Off a Deadline for Implementing Russian Sanctions He Approved,139,75sf87,http://www.motherjones.com/politics/2017/10/trump-just-blew-off-a-deadline-for-implementing-russian-sanctions-he-approved/,12,1507758532.0,bobbelcher,0.88,/r/uspolitics/comments/75sf87/trump_just_blew_off_a_deadline_for_implementing/,uspolitics,28979,2
"Watergate reporter: Military leaders ""have given up on this president"".",140,6uhfw5,http://shareblue.com/watergate-reporter-military-leaders-have-given-up-on-this-president/,67,1503058805.0,pheonix200,0.74,/r/uspolitics/comments/6uhfw5/watergate_reporter_military_leaders_have_given_up/,uspolitics,28979,2
"Sen. Lindsey Graham threatened to end a meeting with the mother of a late Capitol police officer if she didn't stop criticizing Trump, new book claims",136,xzvs8v,https://www.businessinsider.com/graham-threatened-to-end-meeting-with-sicknicks-mother-politico-2022-10,18,1665348180.0,BitterFuture,0.97,/r/uspolitics/comments/xzvs8v/sen_lindsey_graham_threatened_to_end_a_meeting/,uspolitics,28979,2
Texas museum forced to take down Trump statue because everyone keeps punching it,136,m8e7w4,https://www.independent.co.uk/news/world/americas/trump-statue-punching-texas-museum-b1819422.html,19,1616149359.0,Pessimist2020,1.0,/r/uspolitics/comments/m8e7w4/texas_museum_forced_to_take_down_trump_statue/,uspolitics,28979,2
Capitol riot: AOC reveals how she hid from mob looking to kill her as lawmaker loaned her shoes to ‘run for her life’,135,latm6n,https://www.independent.co.uk/news/world/americas/us-politics/capitol-riot-aoc-alexandria-ocasio-cortez-b1796197.html,20,1612265691.0,Pessimist2020,0.91,/r/uspolitics/comments/latm6n/capitol_riot_aoc_reveals_how_she_hid_from_mob/,uspolitics,28979,2
"Rudy Giuliani Is My Father. Please, Everyone, Vote for Joe Biden and Kamala Harris.",137,jbunf0,https://www.vanityfair.com/style/2020/10/rudy-giulianis-daughter-on-voting-for-biden,4,1602790740.0,bobbelcher,0.95,/r/uspolitics/comments/jbunf0/rudy_giuliani_is_my_father_please_everyone_vote/,uspolitics,28979,2
"Trump keeps saying Obama left him ‘no ventilators.’ The number is 16,660.",137,hfmfq5,https://www.washingtonpost.com/politics/2020/06/25/trump-keeps-saying-obama-left-him-no-ventilators-number-is-16660/,24,1593093045.0,bobbelcher,0.97,/r/uspolitics/comments/hfmfq5/trump_keeps_saying_obama_left_him_no_ventilators/,uspolitics,28979,2
"Trump tried to pressure Ukraine's president, Volodymyr Zelenskyy, into announcing an investigation into then-candidate Joe Biden and his son Hunter. Trump told Zelenskyy he would hand over much-needed security aid ... but first, “do us a favor.” That call would launch Trump's first impeachment",136,t48al6,https://www.msnbc.com/opinion/msnbc-opinion/alexander-vindman-s-trump-white-house-lawsuit-matters-n1289008,18,1646142479.0,HenryCorp,0.96,/r/uspolitics/comments/t48al6/trump_tried_to_pressure_ukraines_president/,uspolitics,28979,2
The DOJ is reportedly investigating Rep. Matt Gaetz over whether he had a sexual relationship with a 17-year-old,136,mgrbm2,https://www.businessinsider.com/justice-department-investigating-matt-gaetz-sexual-relationship-17-year-old-2021-3,21,1617142165.0,realplayer16,0.99,/r/uspolitics/comments/mgrbm2/the_doj_is_reportedly_investigating_rep_matt/,uspolitics,28979,2
'Hundreds' Likely To Face Federal Charges In U.S. Capitol Riot,133,kw1gn6,https://www.npr.org/2021/01/12/956083079/justice-department-warns-its-coming-for-those-involved-in-capitol-violence,13,1610487731.0,Pessimist2020,0.99,/r/uspolitics/comments/kw1gn6/hundreds_likely_to_face_federal_charges_in_us/,uspolitics,28979,2
The President of the United States Refused to Denounce White Supremacists. That's It.,135,j2k5cw,https://www.esquire.com/news-politics/a34214725/trump-proud-boys-stand-by-denounce-white-supremacists/,56,1601464243.0,Bobinct,0.94,/r/uspolitics/comments/j2k5cw/the_president_of_the_united_states_refused_to/,uspolitics,28979,2
Trump sold voters on the folly that he's a successful businessman. That's a con | US news,136,j1cu39,https://www.theguardian.com/commentisfree/2020/sep/28/trump-new-york-times-tax-returns-president,16,1601302715.0,Bobinct,0.96,/r/uspolitics/comments/j1cu39/trump_sold_voters_on_the_folly_that_hes_a/,uspolitics,28979,2
GOP strips insulin out-of-pocket cap from bill: ‘Republicans have just gone on the record in favor of expensive insulin’,135,wijonr,https://www.msn.com/en-us/news/politics/gop-strips-insulin-out-of-pocket-cap-from-bill-republicans-have-just-gone-on-the-record-in-favor-of-expensive-insulin/ar-AA10p9HS?ocid=msedgdhp&pc=U531&cvid=0028328853694b91842d914d84894ccd,23,1659889611.0,northstardim,0.98,/r/uspolitics/comments/wijonr/gop_strips_insulin_outofpocket_cap_from_bill/,uspolitics,28979,2
"Dr. Oz says he'll fight to end illegal immigration. A business owned by his family, in which he is a shareholder, faced the largest fine in ICE history for hiring undocumented workers.",136,vbbuxq,https://www.msn.com/en-us/money/companies/dr-oz-says-he-ll-fight-to-end-illegal-immigration-a-business-owned-by-his-family-in-which-he-is-a-shareholder-faced-the-largest-fine-in-ice-history-for-hiring-undocumented-workers/ar-AAYnRVM?ocid=msedgntp&cvid=95483cd55882476290314515bccc4d2e,14,1655125750.0,northstardim,1.0,/r/uspolitics/comments/vbbuxq/dr_oz_says_hell_fight_to_end_illegal_immigration/,uspolitics,28979,2
Fox News cancels Lou Dobbs after he backed Trump’s false election claims,139,ldmk7c,https://www.independent.co.uk/news/world/americas/us-politics/fox-news-cancels-lou-dobbs-trump-b1798521.html,13,1612574414.0,Pessimist2020,0.99,/r/uspolitics/comments/ldmk7c/fox_news_cancels_lou_dobbs_after_he_backed_trumps/,uspolitics,28979,2
George Floyd never resisted arrest please spread this video is it is being taken down,132,gsom8e,https://v.redd.it/41gtrdd3nn151,5,1590739064.0,CaptainSkull2030,0.94,/r/uspolitics/comments/gsom8e/george_floyd_never_resisted_arrest_please_spread/,uspolitics,28979,2
