title,score,id,url,num_comments,created,author,upvote_ratio,permalink,subreddit,subreddit_subscribers,depth
Cartoon for @LondonEconomic [oc],7553,xon03g,https://i.redd.it/sqcbyahv48q91.png,99,1664207208.0,ferji,0.98,/r/unitedkingdom/comments/xon03g/cartoon_for_londoneconomic_oc/,unitedkingdom,1404689,2
John Cleese has his microphone taken away at South by Southwest festival for saying that Britain should get 'reparations from Italy and France' for Romans and Normans enslaving Britons,7510,tdenhy,https://www.dailymail.co.uk/news/article-10606743/John-Cleese-stuns-South-Southwest-crowd-jokes-historic-slave-reparations-Britain.html,2285,1647200450.0,MoneyEqual,0.91,/r/unitedkingdom/comments/tdenhy/john_cleese_has_his_microphone_taken_away_at/,unitedkingdom,1404689,2
"UK and Ireland among five nations most likely to survive a collapse of global civilisation, study suggests",7447,ott0cq,https://news.sky.com/story/uk-and-ireland-among-five-nations-most-likely-to-survive-a-collapse-of-global-civilisation-study-suggests-12366136,1658,1627544980.0,esprit-de-lescalier,0.91,/r/unitedkingdom/comments/ott0cq/uk_and_ireland_among_five_nations_most_likely_to/,unitedkingdom,1404689,2
Liz Truss abandons plan to scrap 45p top rate of income tax amid Tory revolt,7398,xubp54,https://www.theguardian.com/politics/2022/oct/03/liz-truss-abandon-plan-scrap-45p-top-rate-income-tax-tory-revolt-kwasi-kwarteng-chancellor,824,1664778748.0,mathen,0.96,/r/unitedkingdom/comments/xubp54/liz_truss_abandons_plan_to_scrap_45p_top_rate_of/,unitedkingdom,1404689,2
Brits paying highest electricity bills on the planet,7326,10xwdq1,https://www.thelondoneconomic.com/news/brits-paying-highest-electricity-bills-on-the-planet-343294/,1269,1675953672.0,Disillusioned_Pleb01,0.99,/r/unitedkingdom/comments/10xwdq1/brits_paying_highest_electricity_bills_on_the/,unitedkingdom,1404689,2
Sunak gets fixed penalty for not wearing seatbelt,7308,10h496x,https://www.bbc.co.uk/news/uk-politics-64353054,869,1674239146.0,Mistermiyagi93,0.96,/r/unitedkingdom/comments/10h496x/sunak_gets_fixed_penalty_for_not_wearing_seatbelt/,unitedkingdom,1404689,2
"‘Eat Out to Help Out’ Scheme ‘Epidemiologically Illiterate’ As Sunak Failed to Consult Scientists, New Report Reveals",7257,ki23i1,https://bylinetimes.com/2020/12/21/eat-out-to-help-out-scheme-epidemiologically-illiterate-rishi-sunak-failed-to-consult-scientists/,710,1608629358.0,chrisjd,0.96,/r/unitedkingdom/comments/ki23i1/eat_out_to_help_out_scheme_epidemiologically/,unitedkingdom,1404689,2
Boris Johnson told by SNP he must resign over No 10 party: ‘Moment of moral reckoning’,7188,rbqmqu,https://www.independent.co.uk/news/uk/politics/boris-johnson-resign-snp-christmas-party-b1972001.html,1005,1638967739.0,HandOfThePing,0.94,/r/unitedkingdom/comments/rbqmqu/boris_johnson_told_by_snp_he_must_resign_over_no/,unitedkingdom,1404689,2
Tory MP says the best way to deal with rising energy bills is to ‘get a job’,7155,tgvwk2,https://metro.co.uk/2022/03/17/tory-mp-says-the-best-way-to-deal-with-rising-energy-bills-is-to-get-a-job-16295485/,1083,1647588872.0,lighthouse77,0.94,/r/unitedkingdom/comments/tgvwk2/tory_mp_says_the_best_way_to_deal_with_rising/,unitedkingdom,1404689,2
Couple who fled Ukraine went back because of ‘terrible’ UK rental options,7130,ys44y7,https://www.independent.co.uk/news/uk/homes-for-ukraine-rental-market-b2222194.html,613,1668151832.0,lighthouse77,0.91,/r/unitedkingdom/comments/ys44y7/couple_who_fled_ukraine_went_back_because_of/,unitedkingdom,1404689,2
Westminster Accounts: MPs earn £17.1m on top of their salaries since the last election - with Tories taking £15.4m,7092,106eaw7,https://news.sky.com/story/westminster-accounts-mps-earn-17-1m-on-top-of-their-salaries-since-the-last-election-with-tories-taking-15-4m-12758768,592,1673167357.0,Sir_Bantersaurus,0.96,/r/unitedkingdom/comments/106eaw7/westminster_accounts_mps_earn_171m_on_top_of/,unitedkingdom,1404689,2
Rishi Sunak also resigns,7077,vs2ytw,https://www.bbc.co.uk/news/live/uk-politics-62048657?ns_mchannel=social&ns_source=twitter&ns_campaign=bbc_live&ns_linkname=62c47123b893776ef33432a3%26Rishi%20Sunak%20also%20resigns%262022-07-05T17%3A13%3A49.353Z&ns_fee=0&pinned_post_locator=urn:asset:915d9039-e807-4b27-97fb-119d1d271e38&pinned_post_asset_id=62c47123b893776ef33432a3&pinned_post_type=share,1375,1657041311.0,SwimmerGlass4257,0.95,/r/unitedkingdom/comments/vs2ytw/rishi_sunak_also_resigns/,unitedkingdom,1404689,2
UK cost of living rises again by 5.4%,7076,s7k9cv,https://www.bbc.co.uk/news/business-60050699,1531,1642576099.0,topotaul,0.97,/r/unitedkingdom/comments/s7k9cv/uk_cost_of_living_rises_again_by_54/,unitedkingdom,1404689,2
Cost of living: Millions face energy bill hike as Ofgem lifts price cap | Business News,7059,sjgh7h,https://news.sky.com/story/cost-of-living-millions-face-energy-bill-hike-as-ofgem-lifts-price-cap-12531711,2057,1643886172.0,esprit-de-lescalier,0.96,/r/unitedkingdom/comments/sjgh7h/cost_of_living_millions_face_energy_bill_hike_as/,unitedkingdom,1404689,2
Police 'proactively' arrest Just Stop Oil protesters planning major disruption on motorways,7049,yof7wz,https://news.sky.com/story/police-proactively-arrest-just-stop-oil-protesters-planning-major-disruption-on-motorways-12740633,1107,1667803845.0,esprit-de-lescalier,0.95,/r/unitedkingdom/comments/yof7wz/police_proactively_arrest_just_stop_oil/,unitedkingdom,1404689,2
"It is illegal to hit our partners, friends and dogs – so why is it OK to smack children? - It is extraordinary that the debate is still being had in England – we should focus on alternatives to physical discipline",7047,ua1ho3,https://www.theguardian.com/commentisfree/2022/apr/23/illegal-hit-partners-friends-dogs-smack-children?CMP=fb_cif,1594,1650705462.0,Mobalise_Anarchise,0.88,/r/unitedkingdom/comments/ua1ho3/it_is_illegal_to_hit_our_partners_friends_and/,unitedkingdom,1404689,2
Petition to make lying in parliament a criminal offence passes threshold to be debated by MPs,7043,p633q8,https://www.nationalworld.com/news/politics/petition-to-make-lying-in-parliament-a-criminal-offence-passes-threshold-to-be-debated-by-mps-3349192,403,1629204522.0,qpl23,0.97,/r/unitedkingdom/comments/p633q8/petition_to_make_lying_in_parliament_a_criminal/,unitedkingdom,1404689,2
Twisted trolls slammed for tearing into crying Germany girl after England win,7040,obgx2e,https://www.mirror.co.uk/news/uk-news/twisted-trolls-slammed-tearing-crying-24431955,1533,1625126052.0,ainbheartach,0.91,/r/unitedkingdom/comments/obgx2e/twisted_trolls_slammed_for_tearing_into_crying/,unitedkingdom,1404689,2
Brexiteer mocked after figuring out deal gives Britain just 2.32% more fish after EU departure,6975,knkr61,https://www.theneweuropean.co.uk/brexit-news/martin-daubney-analysis-of-brexit-deal-6873128,698,1609396373.0,casualphilosopher1,0.94,/r/unitedkingdom/comments/knkr61/brexiteer_mocked_after_figuring_out_deal_gives/,unitedkingdom,1404690,2
"Devi Sridhar: The UK needs a zero-Covid strategy to prevent endless lockdowns - To avoid restrictions next winter, the UK must seek to eliminate the virus, not merely suppress it, argues the Edinburgh professor of global public health.",6886,ktoqdz,https://www.newstatesman.com/science-tech/coronavirus/2021/01/devi-sridhar-uk-needs-zero-covid-strategy-prevent-endless-lockdowns,1115,1610189059.0,TheSuspiciousKoala,0.95,/r/unitedkingdom/comments/ktoqdz/devi_sridhar_the_uk_needs_a_zerocovid_strategy_to/,unitedkingdom,1404690,2
Gordon Brown warns of Tories ‘testing the water’ for two-tier healthcare,6811,10j79kg,https://www.theguardian.com/politics/2023/jan/23/gordon-brown-warns-tories-two-tier-healthcare-system-charges-undermine-nhs?CMP=Share_AndroidApp_Other,864,1674460888.0,Duanedoberman,0.96,/r/unitedkingdom/comments/10j79kg/gordon_brown_warns_of_tories_testing_the_water/,unitedkingdom,1404690,2
What is the point of the Labour Party if it isn’t going to loudly support the rail strikes? - The Party was founded on workers rights. Fence-sitting could be its undoing,6805,vf1on5,https://inews.co.uk/opinion/labour-party-what-point-not-support-rail-strikes-1691975,1112,1655540572.0,Mobalise_Anarchise,0.94,/r/unitedkingdom/comments/vf1on5/what_is_the_point_of_the_labour_party_if_it_isnt/,unitedkingdom,1404690,2
Jacob Rees-Mogg has resigned,6798,yd2ve2,https://news.sky.com/story/rishi-sunak-prime-minister-latest-updates-penny-mordaunt-12593360?postid=4732778#liveblog-body,978,1666698557.0,shrigay,0.96,/r/unitedkingdom/comments/yd2ve2/jacob_reesmogg_has_resigned/,unitedkingdom,1404690,2
New video reveals Boris Johnson was hit with fresh boos as he left St Paul's service,6781,v4ir4y,https://www.mirror.co.uk/news/politics/new-video-reveals-boris-johnson-27144005,497,1654323431.0,ainbheartach,0.95,/r/unitedkingdom/comments/v4ir4y/new_video_reveals_boris_johnson_was_hit_with/,unitedkingdom,1404690,2
No confidence vote in Boris Johnson expected to be announced on Monday morning,6769,v5vxqk,https://www.itv.com/news/2022-06-06/no-confidence-vote-in-boris-johnson-expected-to-be-announced-on-monday-morning,757,1654494832.0,insomnimax_99,0.96,/r/unitedkingdom/comments/v5vxqk/no_confidence_vote_in_boris_johnson_expected_to/,unitedkingdom,1404690,2
Edward Colston statue: Black Lives Matter protesters found not guilty of criminal damage after toppling monument of slave trader,6744,rwqghk,http://news.sky.com/story/edward-colston-statue-four-protesters-found-not-guilty-of-criminal-damage-after-toppling-monument-of-slave-trader-12509488,2005,1641399271.0,topotaul,0.89,/r/unitedkingdom/comments/rwqghk/edward_colston_statue_black_lives_matter/,unitedkingdom,1404690,2
Rishi Sunak's wife 'has £490m stake in company still operating in Moscow' - Daily Record,6725,tngbwk,https://www.dailyrecord.co.uk/news/politics/rishi-sunaks-wife-has-490m-26552207,486,1648192086.0,Disillusioned_Pleb01,0.96,/r/unitedkingdom/comments/tngbwk/rishi_sunaks_wife_has_490m_stake_in_company_still/,unitedkingdom,1404690,2
"‘Brexit going really well actually’ insists government with no fuel, energy, food, workers, border control or trade deals",6718,pvzp2g,https://newsthump.com/2021/09/24/brexit-going-really-well-actually-insists-government-with-no-fuel-energy-food-workers-border-control-or-trade-deals/,506,1632681806.0,shish-mish,0.95,/r/unitedkingdom/comments/pvzp2g/brexit_going_really_well_actually_insists/,unitedkingdom,1404690,2
Tragedy as Daily Mail readers wank themselves to death after EU finally makes mistake,6715,l8md5y,https://newsthump.com/2021/01/30/tragedy-as-daily-mail-readers-wank-themselves-to-death-after-eu-finally-makes-mistake/,732,1612015505.0,bilefreebill,0.93,/r/unitedkingdom/comments/l8md5y/tragedy_as_daily_mail_readers_wank_themselves_to/,unitedkingdom,1404690,2
Liz Truss to punish Vladimir Putin by running Russia’s economy for a week,6652,xt2bs6,https://newsthump.com/2022/09/30/liz-truss-to-punish-vladimir-putin-by-running-russias-economy-for-a-week/,139,1664648337.0,Superbuddhapunk,0.97,/r/unitedkingdom/comments/xt2bs6/liz_truss_to_punish_vladimir_putin_by_running/,unitedkingdom,1404690,2
MP who said £82K salary was 'really grim' voted to slash welfare 49 times,6651,q3hf3k,https://www.joe.co.uk/news/mp-who-said-82k-salary-was-really-grim-voted-to-slash-welfare-49-times-292741,479,1633637146.0,shish-mish,0.97,/r/unitedkingdom/comments/q3hf3k/mp_who_said_82k_salary_was_really_grim_voted_to/,unitedkingdom,1404690,2
Liz Truss says war in Ukraine should bring end to debates about 'statues and pronouns',6539,tifert,https://inews.co.uk/news/liz-truss-russias-attack-democracy-ukraine-bring-end-debates-statues-pronouns-1527621,2283,1647759685.0,casualphilosopher1,0.87,/r/unitedkingdom/comments/tifert/liz_truss_says_war_in_ukraine_should_bring_end_to/,unitedkingdom,1404690,2
Three prime ministers have failed to make Brexit work. Why keep trying?,6530,yag8xb,https://www.theneweuropean.co.uk/paul-mason-three-prime-ministers-have-failed-to-make-brexit-work-why-keep-trying/,721,1666420525.0,casualphilosopher1,0.93,/r/unitedkingdom/comments/yag8xb/three_prime_ministers_have_failed_to_make_brexit/,unitedkingdom,1404690,2
Sir Keir Starmer cleared by Durham Police over 'beergate' after vowing to resign if he received fine,6540,vu8nfz,https://news.sky.com/story/sir-keir-starmer-cleared-by-durham-police-over-beergate-after-vowing-to-resign-if-he-received-fine-12609812,805,1657280070.0,topotaul,0.95,/r/unitedkingdom/comments/vu8nfz/sir_keir_starmer_cleared_by_durham_police_over/,unitedkingdom,1404690,2
"Average UK house price exceeds £260,000 for first time | House prices",6511,t4vzvc,https://www.theguardian.com/money/2022/mar/02/average-uk-house-price-exceeds-260000-pounds-first-time-nationwide,1079,1646211371.0,MoneyEqual,0.97,/r/unitedkingdom/comments/t4vzvc/average_uk_house_price_exceeds_260000_for_first/,unitedkingdom,1404690,2
Liz Truss among seven MPs who put Amazon Prime subscription on expenses,6443,w1603a,https://www.mirror.co.uk/news/politics/liz-truss-among-seven-mps-27499751,726,1658059726.0,casualphilosopher1,0.96,/r/unitedkingdom/comments/w1603a/liz_truss_among_seven_mps_who_put_amazon_prime/,unitedkingdom,1404690,2
Now we health workers know how empty Boris Johnson's 'clap for heroes' really was.,6439,lyz7bm,https://www.theguardian.com/commentisfree/2021/mar/05/boris-johnson-clap-patients-pay-offer?CMP=Share_AndroidApp_Other,739,1615027888.0,Duanedoberman,0.94,/r/unitedkingdom/comments/lyz7bm/now_we_health_workers_know_how_empty_boris/,unitedkingdom,1404690,2
Labour and the Lib Dems call for an immediate general election as the 'British public deserve a proper say on the country's future',6350,y8xxkm,https://londonlovesbusiness.com/labour-and-the-lib-dems-call-for-an-immediate-general-election-as-the-british-public-deserve-a-proper-say-on-the-countrys-future/,742,1666271542.0,shrigay,0.98,/r/unitedkingdom/comments/y8xxkm/labour_and_the_lib_dems_call_for_an_immediate/,unitedkingdom,1404690,2
"Sixty per cent of Brits earning £80,000-£100,000 say they’re “about average” | Highly paid people tend to see themselves as “normal” on the income scale – and “worse off” than their social circle.",6317,vrt3pg,https://www.newstatesman.com/society/2022/07/60-per-cent-brits-average-income,1598,1657009822.0,casualphilosopher1,0.95,/r/unitedkingdom/comments/vrt3pg/sixty_per_cent_of_brits_earning_80000100000_say/,unitedkingdom,1404690,2
Mick Lynch attacks BBC for 'parroting' Tory 'propaganda' in heated rail strike clash,6298,zkrxi0,https://www.mirror.co.uk/news/politics/mick-lynch-attacks-bbc-parroting-28718754,690,1670925059.0,ClassicFlavour,0.94,/r/unitedkingdom/comments/zkrxi0/mick_lynch_attacks_bbc_for_parroting_tory/,unitedkingdom,1404690,2
Boris Johnson’s claim that the Roman empire fell due to “uncontrolled immigration” is wrong – and dangerous,6291,ql0wwt,https://www.newstatesman.com/culture/history/2021/11/boris-johnsons-claim-that-the-roman-empire-fell-due-to-uncontrolled-immigration-is-wrong-and-dangerous,792,1635847405.0,tipodecinta,0.91,/r/unitedkingdom/comments/ql0wwt/boris_johnsons_claim_that_the_roman_empire_fell/,unitedkingdom,1404690,2
Top Labour MP John McDonnell calls for general strike and hits out at Sir Keir Starmer over strike position,6293,wa3ij3,https://news.sky.com/story/top-labour-mp-john-mcdonnell-calls-for-general-strike-and-hits-out-at-sir-keir-starmer-over-strike-position-12660413,1070,1658994392.0,esprit-de-lescalier,0.95,/r/unitedkingdom/comments/wa3ij3/top_labour_mp_john_mcdonnell_calls_for_general/,unitedkingdom,1404690,2
Stewart Lee leaves Spotify in Joe Rogan COVID misinformation boycott,6255,sizlac,https://www.nme.com/news/tv/stewart-lee-spotify-leaves-joe-rogan-boycott-covid-misinformation-3152186,2587,1643835239.0,ClassicFlavour,0.87,/r/unitedkingdom/comments/sizlac/stewart_lee_leaves_spotify_in_joe_rogan_covid/,unitedkingdom,1404690,2
Brexit: More Britons now say UK was wrong to quit the EU | Evening Standard,6211,vmhxah,https://www.standard.co.uk/news/politics/brexit-britons-uk-eu-wrong-leave-polls-analysis-b1008770.html,940,1656403782.0,Disillusioned_Pleb01,0.94,/r/unitedkingdom/comments/vmhxah/brexit_more_britons_now_say_uk_was_wrong_to_quit/,unitedkingdom,1404690,2
Boris Johnson and staff pictured with wine in Downing Street garden in May 2020 | Boris Johnson,6213,rk2sk3,https://www.theguardian.com/politics/2021/dec/19/boris-johnson-and-staff-pictured-with-wine-in-downing-street-garden-in-may-2020?CMP=Share_AndroidApp_Other,896,1639939193.0,CJBill,0.96,/r/unitedkingdom/comments/rk2sk3/boris_johnson_and_staff_pictured_with_wine_in/,unitedkingdom,1404690,2
Interest rate rises to 3% as Bank of England imposes biggest hike for three decades,6158,yl0uux,https://news.sky.com/story/interest-rate-rises-to-3-as-bank-of-england-imposes-biggest-hike-for-three-decades-12736964,1431,1667476904.0,topotaul,0.96,/r/unitedkingdom/comments/yl0uux/interest_rate_rises_to_3_as_bank_of_england/,unitedkingdom,1404690,2
Boris Johnson unveils £12bn- ayear tax rise to pay for NHS and social care,6133,pjldlm,https://www.theguardian.com/politics/2021/sep/07/boris-johnson-unveils-12bn-a-year-tax-rise-to-pay-for-nhs-and-social-care?CMP=Share_AndroidApp_Other,1921,1631014844.0,Alex09464367,0.95,/r/unitedkingdom/comments/pjldlm/boris_johnson_unveils_12bn_ayear_tax_rise_to_pay/,unitedkingdom,1404690,2
Larry the Cat outlasts fourth U.K. prime minister,6029,ybaqbn,https://www.npr.org/2022/10/21/1130251187/larry-the-cat-prime-minister,133,1666508421.0,marketrent,0.97,/r/unitedkingdom/comments/ybaqbn/larry_the_cat_outlasts_fourth_uk_prime_minister/,unitedkingdom,1404690,2
Liz Truss told 'it's over' by Tory MPs as she faces mounting threat of a coup,6020,y593ul,https://inews.co.uk/news/politics/liz-truss-told-its-over-by-tory-mps-as-she-faces-mounting-threat-of-a-coup-1913774?ico=most_popular,883,1665899940.0,casualphilosopher1,0.98,/r/unitedkingdom/comments/y593ul/liz_truss_told_its_over_by_tory_mps_as_she_faces/,unitedkingdom,1404690,2
Election results: Conservatives win Hartlepool by-election to claim seat from Labour for first time ever,5982,n6rsep,http://news.sky.com/story/election-results-conservatives-win-hartlepool-by-election-to-claim-seat-from-labour-for-first-time-ever-12298989,3049,1620367646.0,topotaul,0.91,/r/unitedkingdom/comments/n6rsep/election_results_conservatives_win_hartlepool/,unitedkingdom,1404690,2
Cost of living: ‘I remember going to bed hungry as a child – I thought I’d have a better life in my seventies’,5910,v04w13,https://inews.co.uk/news/cost-living-crisis-hungry-rishi-sunak-1654829,899,1653804008.0,casualphilosopher1,0.96,/r/unitedkingdom/comments/v04w13/cost_of_living_i_remember_going_to_bed_hungry_as/,unitedkingdom,1404690,2
"This time, Britain must stand behind Salman Rushdie",5909,wn79l0,https://www.telegraph.co.uk/books/what-to-read/time-britain-must-stand-behind-salman-rushdie/,1327,1660371338.0,casualphilosopher1,0.91,/r/unitedkingdom/comments/wn79l0/this_time_britain_must_stand_behind_salman_rushdie/,unitedkingdom,1404690,2
Mhairi Black widely praised for speech about UK government 'sleepwalking to fascism',5901,ut6270,https://www.indy100.com/politics/mhairi-black-fascism-speech-government,702,1652974447.0,ClassicFlavour,0.94,/r/unitedkingdom/comments/ut6270/mhairi_black_widely_praised_for_speech_about_uk/,unitedkingdom,1404690,2
COVID-19: Govt 'reserves right' to make vaccine passports mandatory in some settings,5840,oqkio1,https://news.sky.com/video/covid-19-govt-reserves-right-to-make-vaccine-passports-mandatory-in-some-settings-12361258,1758,1627107782.0,Mighty_L_LORT,0.91,/r/unitedkingdom/comments/oqkio1/covid19_govt_reserves_right_to_make_vaccine/,unitedkingdom,1404690,2
"Britain and the US are poor societies with some very rich people - When it comes to average household incomes, the UK may soon need to ask migrant labourers to take a pay cut",5836,xfkmx0,https://www.ft.com/content/ef265420-45e8-497b-b308-c951baa68945?sharetype=blocked,686,1663313134.0,Overthrow_Capitalism,0.92,/r/unitedkingdom/comments/xfkmx0/britain_and_the_us_are_poor_societies_with_some/,unitedkingdom,1404690,2
"Human remains found in Kent wood are Sarah Everard's, police confirm",5809,m3hypw,http://news.sky.com/story/human-remains-found-in-kent-wood-are-sarah-everard8217s-police-confirm-12242538,1347,1615557145.0,Mistermiyagi93,0.96,/r/unitedkingdom/comments/m3hypw/human_remains_found_in_kent_wood_are_sarah/,unitedkingdom,1404690,2
The decade that broke Britain: the disastrous decisions that left millions in a cost of living crisis,5767,v2b4he,https://www.theguardian.com/politics/2022/jun/01/the-decade-that-broke-britain-the-disastrous-decisions-that-left-millions-in-a-cost-of-living-crisis,951,1654067716.0,ainbheartach,0.95,/r/unitedkingdom/comments/v2b4he/the_decade_that_broke_britain_the_disastrous/,unitedkingdom,1404690,2
'Prince Andrew Is A Sweaty N***e' hits UK top 20 during Jubilee celebrations,5750,v4pal4,https://www.joe.co.uk/news/prince-andrew-is-a-sweaty-ne-hits-uk-top-20-during-jubilee-celebrations-340006,400,1654350638.0,ainbheartach,0.95,/r/unitedkingdom/comments/v4pal4/prince_andrew_is_a_sweaty_ne_hits_uk_top_20/,unitedkingdom,1404690,2
"Who should be applauded for the vaccine programme? Certainly not the Tories. While Boris Johnson attributes the success of the rollout to greed and capitalism, the credit should actually go to scientists, experts, NHS staff and volunteers",5726,me9q41,https://www.theguardian.com/commentisfree/2021/mar/26/who-should-be-applauded-for-the-vaccine-programme-certainly-not-the-tories?CMP=Share_AndroidApp_Other,543,1616833455.0,Duanedoberman,0.88,/r/unitedkingdom/comments/me9q41/who_should_be_applauded_for_the_vaccine_programme/,unitedkingdom,1404690,2
How the U.K. Became One of the Poorest Countries in Western Europe,5701,ydqk9m,https://www.msn.com/en-us/money/markets/how-the-uk-became-one-of-the-poorest-countries-in-western-europe/ar-AA13luEL,956,1666764415.0,Mighty_L_LORT,0.92,/r/unitedkingdom/comments/ydqk9m/how_the_uk_became_one_of_the_poorest_countries_in/,unitedkingdom,1404690,2
NHS yet to see ‘a single penny’ of promised £500m emergency fund | NHS | The Guardian,5695,yi3quc,https://www.theguardian.com/society/2022/oct/31/nhs-yet-to-see-a-single-penny-of-promised-500m-emergency-fund,265,1667200857.0,Disillusioned_Pleb01,0.97,/r/unitedkingdom/comments/yi3quc/nhs_yet_to_see_a_single_penny_of_promised_500m/,unitedkingdom,1404690,2
"Shamima Begum ‘knew what she was doing’ with Syria move, MI5 officer tells court",5693,z1se8u,https://www.itv.com/news/london/2022-11-21/shamima-begum-influenced-by-isis-should-be-treated-as-trafficking-victim,2592,1669120259.0,insomnimax_99,0.94,/r/unitedkingdom/comments/z1se8u/shamima_begum_knew_what_she_was_doing_with_syria/,unitedkingdom,1404690,2
"King Charles vows to serve with 'loyalty, respect and love' in first address to nation",5690,xa0xmk,https://news.sky.com/story/king-charles-vows-to-serve-with-loyalty-respect-and-love-in-first-address-to-nation-12693741,1169,1662743374.0,topotaul,0.84,/r/unitedkingdom/comments/xa0xmk/king_charles_vows_to_serve_with_loyalty_respect/,unitedkingdom,1404690,2
RNLI hits out at ‘migrant taxi service’ accusations. Lifeboat charity says it is its moral and legal duty to rescue people at risk of dying as they cross Channel,5670,ot4xly,https://www.theguardian.com/uk-news/2021/jul/28/rnli-hits-out-migrant-taxi-service-accusations?CMP=Share_AndroidApp_Other,1394,1627456656.0,Duanedoberman,0.94,/r/unitedkingdom/comments/ot4xly/rnli_hits_out_at_migrant_taxi_service_accusations/,unitedkingdom,1404690,2
Crying MP hits out at No 10 parties: ‘My mother-in-law died alone’,5637,s1iuef,https://metro.co.uk/2022/01/11/crying-mp-hits-out-at-no-10-parties-my-mother-in-law-died-alone-15899949/,904,1641923335.0,BestButtons,0.97,/r/unitedkingdom/comments/s1iuef/crying_mp_hits_out_at_no_10_parties_my/,unitedkingdom,1404690,2
France’s EU minister names her cat 'Brexit' because ‘he meows loudly to be let out but just stands there when I open the door’,5587,b2i9vb,https://www.independent.co.uk/news/world/europe/brexit-france-theresa-may-deal-nathalie-loiseau-cat-a8828026.html,263,1552912996.0,twistedLucidity,0.98,/r/unitedkingdom/comments/b2i9vb/frances_eu_minister_names_her_cat_brexit_because/,unitedkingdom,1404690,2
One in five who voted for Brexit now think it was the wrong decision,5588,yxmwcr,https://yougov.co.uk/topics/politics/articles-reports/2022/11/17/one-five-who-voted-brexit-now-think-it-was-wrong-d,963,1668681261.0,esprit-de-lescalier,0.94,/r/unitedkingdom/comments/yxmwcr/one_in_five_who_voted_for_brexit_now_think_it_was/,unitedkingdom,1404690,2
Rishi Sunak Tells Tory Members He Took Money Away From 'Deprived' Areas,5559,wgs18e,https://www.huffingtonpost.co.uk/entry/rishi-sunak-tells-tory-members-he-took-money-away-from-deprived-areas_uk_62ecddb1e4b00f4cf2396cfa,740,1659695651.0,echoesreach,0.96,/r/unitedkingdom/comments/wgs18e/rishi_sunak_tells_tory_members_he_took_money_away/,unitedkingdom,1404691,2
"Boris Johnson set to lose seat as Labour sweep scores of key battleground constituencies | Latest YouGov MRP model suggests that if an election were held tomorrow, the Conservatives would hold on to just three of 88 battleground seats",5551,uzhhcx,https://yougov.co.uk/topics/politics/articles-reports/2022/05/28/yougov-mrp-boris-johnson-set-lose-seat-labour-swee,607,1653719562.0,qpl23,0.96,/r/unitedkingdom/comments/uzhhcx/boris_johnson_set_to_lose_seat_as_labour_sweep/,unitedkingdom,1404691,2
"Cannabis, ket and speed to be 'decriminalised in London' by Sadiq Khan",5532,rvr4xo,https://metro.co.uk/2022/01/04/london-sadiq-khan-to-decriminalise-class-b-drugs-including-cannabis-15859699/,850,1641291471.0,ClassicFlavour,0.96,/r/unitedkingdom/comments/rvr4xo/cannabis_ket_and_speed_to_be_decriminalised_in/,unitedkingdom,1404691,2
