title,score,id,url,num_comments,created,author,upvote_ratio,permalink,subreddit,subreddit_subscribers,depth
"Becky Lynch and Seth Rollins stopped for a young fan outside the arena at a live event last night, and called her over to take a picture",6172,tphbr1,https://i.redd.it/who82sfzmwp81.jpg,220,1648377464.0,gonnablamethemovies,0.97,/r/SquaredCircle/comments/tphbr1/becky_lynch_and_seth_rollins_stopped_for_a_young/,SquaredCircle,740816,2
"Sami Zayn: “People think @WWE is this international media giant whose goal is to not only turn massive profits, but to bring joy to millions of fans worldwide. And while that is all true, it’s actually secondary to it’s main objective, which is to disrespect Sami Zayn every chance they get.”",6170,jdhto9,https://twitter.com/samizayn/status/1317834083909668866?s=21,227,1603033560.0,Weezy-NJPW_Fan,0.96,/r/SquaredCircle/comments/jdhto9/sami_zayn_people_think_wwe_is_this_international/,SquaredCircle,740816,2
[GRR SPOILERS] Greatest moment in Royal Rumble history?,6167,8fesmb,https://twitter.com/BulletClubItal/status/989964943729577984,497,1524861050.0,suzukigun4life,0.92,/r/SquaredCircle/comments/8fesmb/grr_spoilers_greatest_moment_in_royal_rumble/,SquaredCircle,740816,2
"Seth Rollins: “Look, Hulk Hogan’s always been really nice to me, but that doesn’t make him a great human being.”",6151,mlhifs,https://www.wrestlinginc.com/news/2021/04/seth-rollins-on-hulk-hogan-hes-nice-to-me-that-doesnt-make-him-a-great-human-being/,1020,1617731626.0,Strike_Gently,0.95,/r/SquaredCircle/comments/mlhifs/seth_rollins_look_hulk_hogans_always_been_really/,SquaredCircle,740816,2
I often forget how crazy Bobby Lashley was back in the day.,6147,frolc5,https://v.redd.it/l3ihn23tisp41,384,1585565532.0,Bigbenn0,0.97,/r/SquaredCircle/comments/frolc5/i_often_forget_how_crazy_bobby_lashley_was_back/,SquaredCircle,740816,2
"Kane: ""Bryan and I are on such opposite ends of the political spectrum. But we respect each other as human beings and value each other's opinions, so we had conversations and learned from each other. I learned a lot from Bryan, even if we didn't always agree.""",6138,ekw3gv,https://www.wrestlinginc.com/news/2020/01/kane-on-having-opposing-political-beliefs-with-daniel-bryan-664426/,1368,1578326886.0,GetDown90,0.94,/r/SquaredCircle/comments/ekw3gv/kane_bryan_and_i_are_on_such_opposite_ends_of_the/,SquaredCircle,740816,2
"Brad Nessler at the ric flair roast: ""If this group was any whiter, Jericho's wife would storm the Capitol with it.""",6101,wc7tq3,https://twitter.com/arashmarkazi/status/1553189929936617474?s=21&t=QyuJ33pgRv-noD2ds7LGPA,477,1659216323.0,thebobbyshaw33,0.93,/r/SquaredCircle/comments/wc7tq3/brad_nessler_at_the_ric_flair_roast_if_this_group/,SquaredCircle,740816,2
"Maria Kanellis: ""WWE doesnt want to build new stars, they want to spike the ratings for a couple weeks to keep the investors/networks happy. What WWE doesn’t seem to get, is ratings improve when people care about the story/stars. Invest in talent, spend the time building stars, stop the laziness.""",6081,i38bbp,https://twitter.com/MariaLKanellis/status/1290428612454354946,835,1596497837.0,GetDown90,0.92,/r/SquaredCircle/comments/i38bbp/maria_kanellis_wwe_doesnt_want_to_build_new_stars/,SquaredCircle,740816,2
Sean Ross Sapp: Fightful has learned WWE has released Jeff Hardy,6073,rck8gt,https://twitter.com/SeanRossSapp/status/1468968491982090248,1410,1639064388.0,juzashannon,0.94,/r/SquaredCircle/comments/rck8gt/sean_ross_sapp_fightful_has_learned_wwe_has/,SquaredCircle,740816,2
Shawn Michaels explains how he got his lazy eye to Bret Hart,6051,mf3kqb,https://v.redd.it/cm0izhq0ksp61,570,1616947070.0,ThurmanPlugg,0.97,/r/SquaredCircle/comments/mf3kqb/shawn_michaels_explains_how_he_got_his_lazy_eye/,SquaredCircle,740816,2
Bully Ray doesn’t get the fan reaction he was expecting,6044,niipum,https://i.imgur.com/Tppn3iA.gif,178,1621690345.0,Naweezy,0.98,/r/SquaredCircle/comments/niipum/bully_ray_doesnt_get_the_fan_reaction_he_was/,SquaredCircle,740816,2
"Kurt Angle: ""WWE are losing the young adults. The 18 to 40 years olds that WWE had during the Attitude Era, that’s more the way AEW’s direction is right now. They’re swearing on the air, they’re putting up the middle fingers. It’s more of an Attitude Era attitude.""",6028,pidy07,https://www.wrestlinginc.com/news/2021/09/kurt-angle-comments-on-reports-that-daniel-bryan-is-aew-bound/,934,1630851661.0,SuplexCity-Mayor,0.95,/r/SquaredCircle/comments/pidy07/kurt_angle_wwe_are_losing_the_young_adults_the_18/,SquaredCircle,740816,2
"Bret Hart: ""Goldberg to me was one of the most unprofessional wrestlers there ever was in the business. For Bill Goldberg to be in the Hall of Fame... he hurt everybody he worked with.""",6020,flbanm,https://www.wrestlinginc.com/news/2020/03/bret-hart-on-how-dangerous-bill-goldberg-was-668011/,1012,1584629612.0,GetDown90,0.96,/r/SquaredCircle/comments/flbanm/bret_hart_goldberg_to_me_was_one_of_the_most/,SquaredCircle,740816,2
Roman Reigns gets distracted after seeing Dana Brooke rub oil on Sonya Deville,6022,g1rk5y,https://i.imgur.com/IQK9cGe.gifv,438,1586956034.0,FuzzyWuzzyMooMoo,0.97,/r/SquaredCircle/comments/g1rk5y/roman_reigns_gets_distracted_after_seeing_dana/,SquaredCircle,740816,2
"Sting: ""At WrestleMania against Triple H, a lady working in the merchandising and market department said, ‘Your t-shirt is the number one seller for kids.’ A new generation of kids who had no idea who I was until they saw me. It was the painted face; I’m convinced it was the painted face.""",6008,kx64ym,https://prowrestlingstories.com/pro-wrestling-stories/face-paint-wrestling/,588,1610632798.0,broken_beat,0.97,/r/SquaredCircle/comments/kx64ym/sting_at_wrestlemania_against_triple_h_a_lady/,SquaredCircle,740816,2
"[Tony Khan] An independent study has confirmed that much of the staunch anti-AEW online community aren’t real individuals, it’s a staff running thousands of accounts + an army of bots to signal boost them. Look closely, these aren’t real people. Who’d pay for such a *wildly* expensive thing?",6005,tz8ikk,https://twitter.com/TonyKhan/status/1512479987672432640,2860,1649438341.0,AimarEraFutebol,0.88,/r/SquaredCircle/comments/tz8ikk/tony_khan_an_independent_study_has_confirmed_that/,SquaredCircle,740816,2
JTG with the greatest sell in the history of professional wrestling.,5986,j6os0r,https://v.redd.it/jqsd8i9vlnr51,300,1602068283.0,Bigbenn0,0.97,/r/SquaredCircle/comments/j6os0r/jtg_with_the_greatest_sell_in_the_history_of/,SquaredCircle,740816,2
(HIAC SPOILERS) Xpac is all of us,5973,dedhkm,https://streamable.com/c8cys,833,1570416238.0,thebobbyshaw33,0.96,/r/SquaredCircle/comments/dedhkm/hiac_spoilers_xpac_is_all_of_us/,SquaredCircle,740816,2
"Jim Ross: ""Tony Khan saved my life, I believe that. Because I like getting up now and going somewhere ... I'm going to the city to have our production meeting on Tuesday night and then our show on Wednesday. So I got a direction now and a destination.""",5961,dt2huh,https://wrestlingnews.co/aew-news/jim-ross-tony-khan-saved-my-life-i-believe-that/,380,1573153691.0,tentolive85,0.96,/r/SquaredCircle/comments/dt2huh/jim_ross_tony_khan_saved_my_life_i_believe_that/,SquaredCircle,740816,2
"Becky Lynch to Nia Jax: ""You gave me your best sucker punch, but I got back up to destroy your whole roster. They won’t let me fight, but I’ll get back up from that too. It’s what I do. So enjoy your one free shot, because as bad as my memory is now, I haven’t forgotten you, bitch.""",5956,9x1xrg,https://twitter.com/BeckyLynchWWE/status/1062753374443978752?s=19,831,1542215181.0,FuzzyWuzzyMooMoo,0.93,/r/SquaredCircle/comments/9x1xrg/becky_lynch_to_nia_jax_you_gave_me_your_best/,SquaredCircle,740816,2
This has to be one of the greatest photos ever captured in wrestling.,5945,e2ahrv,https://i.redd.it/ads1yc57n5141.jpg,239,1574828177.0,thebobbyshaw33,0.96,/r/SquaredCircle/comments/e2ahrv/this_has_to_be_one_of_the_greatest_photos_ever/,SquaredCircle,740816,2
