title,score,id,url,num_comments,created,author,upvote_ratio,permalink,subreddit,subreddit_subscribers,depth
Nintendo delayed Animal Crossing because it didn't want to put its employees through excessive crunch.,76598,bzr9hp,https://www.ign.com/articles/2019/06/11/nintendo-comments-on-crunch-and-game-delays-a-e3-2019,2321,1560346263.0,Frocharocha,0.95,/r/NintendoSwitch/comments/bzr9hp/nintendo_delayed_animal_crossing_because_it_didnt/,NintendoSwitch,4498700,2
Super Smash Bros. Ultimate brings back every character from every Smash Bros. game ever,60866,8qkays,https://dotesports.com/fgc/news/smash-switch-e3-2018-reveal-24468,4205,1528820607.0,DestroyingAwesome,0.9,/r/NintendoSwitch/comments/8qkays/super_smash_bros_ultimate_brings_back_every/,NintendoSwitch,4498700,2
Super Mario 3D All-Stars is coming September 18th! (Nintendo Switch),59425,ilt1o2,https://www.youtube.com/watch?v=5QfFyDwf6iY,7286,1599138466.0,Turbostrider27,0.93,/r/NintendoSwitch/comments/ilt1o2/super_mario_3d_allstars_is_coming_september_18th/,NintendoSwitch,4498700,2
"During this last month, I was either playing Animal Crossing or working on this animation about Animal Crossing...",57613,gxpgt2,https://v.redd.it/1unppjnr0a351,408,1591443672.0,a3headedcat,0.93,/r/NintendoSwitch/comments/gxpgt2/during_this_last_month_i_was_either_playing/,NintendoSwitch,4498700,2
Paper Mario: The Origami King - Arriving July 17th! (Nintendo Switch),51992,gjlvq0,https://www.youtube.com/watch?v=7sQ89mg_eTQ,3635,1589461232.0,Turbostrider27,0.94,/r/NintendoSwitch/comments/gjlvq0/paper_mario_the_origami_king_arriving_july_17th/,NintendoSwitch,4498700,2
Nintendo won't allow loot boxes on Nintendo Switch Games unless publishers disclose drop rates,51434,cp265i,https://www.eurogamer.net/articles/2019-08-07-microsoft-sony-nintendo-wont-allow-loot-boxes-on-consoles-unless-publishers-disclose-drop-rates,1445,1565556593.0,Frocharocha,0.95,/r/NintendoSwitch/comments/cp265i/nintendo_wont_allow_loot_boxes_on_nintendo_switch/,NintendoSwitch,4498700,2
Shigeru Miyamoto Becomes the First Video Game Creator to Be Recognised as a Person of Cultural Merit in Japan,51287,dopwap,https://www.crunchyroll.com/pt-br/anime-news/2019/10/29/shigeru-miyamoto-becomes-the-first-video-game-creator-to-be-recognised-as-a-person-of-cultural-merit-in-japan,891,1572356129.0,Frocharocha,0.96,/r/NintendoSwitch/comments/dopwap/shigeru_miyamoto_becomes_the_first_video_game/,NintendoSwitch,4498700,2
"The Legend of Zelda: Tears of the Kingdom – Coming May 12th, 2023 – Nintendo Switch",49787,xd9han,https://www.youtube.com/watch?v=2SNF4M_v7wc,3337,1663080359.0,dorkmax_executives,0.91,/r/NintendoSwitch/comments/xd9han/the_legend_of_zelda_tears_of_the_kingdom_coming/,NintendoSwitch,4498700,2
SNES games available September 5th for no additonal cost to NSO subscribers,49652,czrtvk,https://i.redd.it/s6xi0pwvknk31.jpg,5599,1567635907.0,squashpickle8,0.94,/r/NintendoSwitch/comments/czrtvk/snes_games_available_september_5th_for_no/,NintendoSwitch,4498700,2
First Look at Nintendo Labo,45870,7r4owq,https://www.youtube.com/watch?v=P3Bd3HUMkyU,7624,1516226418.0,thecornballer1,0.85,/r/NintendoSwitch/comments/7r4owq/first_look_at_nintendo_labo/,NintendoSwitch,4498700,2
[Official] Animal Crossing Coming to Switch in 2019!,45778,9fmlja,https://twitter.com/AC_Isabelle/status/1040369251478134784,1767,1536878344.0,callmeahri,0.9,/r/NintendoSwitch/comments/9fmlja/official_animal_crossing_coming_to_switch_in_2019/,NintendoSwitch,4498700,2
Nintendo Switch Home Redesign - Dark Theme,45648,eh2h7m,https://i.redd.it/tqh8pjisji741.png,1190,1577599565.0,Frieznburg,0.9,/r/NintendoSwitch/comments/eh2h7m/nintendo_switch_home_redesign_dark_theme/,NintendoSwitch,4498700,2
Among Us is coming to Nintendo Switch later today,45084,kdpuoq,https://twitter.com/NintendoEurope/status/1338895914631647233,2035,1608052650.0,harushiga,0.86,/r/NintendoSwitch/comments/kdpuoq/among_us_is_coming_to_nintendo_switch_later_today/,NintendoSwitch,4498700,2
Our Switch community is going to grow over these next 24 hours! Welcome newcomers both long time fans and new!,43971,7lwbka,https://i.redd.it/z6695ym2ow501.jpg,1595,1514136632.0,TingleMaps,0.84,/r/NintendoSwitch/comments/7lwbka/our_switch_community_is_going_to_grow_over_these/,NintendoSwitch,4498700,2
"Announcing a new title set 100 years before The Legend of #Zelda: Breath of the Wild, presented by the developers from Nintendo and KOEI Tecmo Games.",43781,iou2ci,https://twitter.com/NintendoAmerica/status/1303332277779341313,3162,1599573624.0,AntonioS3,0.92,/r/NintendoSwitch/comments/iou2ci/announcing_a_new_title_set_100_years_before_the/,NintendoSwitch,4498700,2
The sequel to The Legend of #Zelda: Breath of the Wild is now in development for NintendoSwitch!,43567,bzetnu,https://twitter.com/NintendoAmerica/status/1138486867328790528,2591,1560271448.0,Frocharocha,0.94,/r/NintendoSwitch/comments/bzetnu/the_sequel_to_the_legend_of_zelda_breath_of_the/,NintendoSwitch,4498700,2
Metroid Dread announced for Nintendo Switch,41586,o0i2ck,https://twitter.com/NintendoEurope/status/1404834820283326465,2830,1623773707.0,Turbostrider27,0.91,/r/NintendoSwitch/comments/o0i2ck/metroid_dread_announced_for_nintendo_switch/,NintendoSwitch,4498700,2
"Animal Crossing New Horizons March 20, 2020",39906,bzeppc,https://i.redd.it/l0vdj2529r331.jpg,1582,1560270940.0,squashpickle8,0.93,/r/NintendoSwitch/comments/bzeppc/animal_crossing_new_horizons_march_20_2020/,NintendoSwitch,4498700,2
Kirby after eating Steve in Smash Bros has been revealed,39597,j4ggom,https://i.redd.it/fqn64tsw9wq51.jpg,527,1601737326.0,maanwel,0.93,/r/NintendoSwitch/comments/j4ggom/kirby_after_eating_steve_in_smash_bros_has_been/,NintendoSwitch,4498700,2
"A class-action lawsuit has been filed against Nintendo of America, following the survey posted yesterday in relation to the Joy-Con Drifting issues",37584,cfbzi0,http://chimicles.com/cskd-files-class-action-lawsuit-against-nintendo-of-america-inc-relating-to-joy-con-drifting-issues/,2555,1563564510.0,AntonioS3,0.93,/r/NintendoSwitch/comments/cfbzi0/a_classaction_lawsuit_has_been_filed_against/,NintendoSwitch,4498700,2
Untitled Goose Game Melbourne-based creators stunned after topping Nintendo charts,37121,dd7kl5,https://www.abc.net.au/news/2019-10-02/untitled-goose-game-goes-from-gag-to-cultural-fad/11567216,1176,1570196735.0,Frocharocha,0.95,/r/NintendoSwitch/comments/dd7kl5/untitled_goose_game_melbournebased_creators/,NintendoSwitch,4498700,2
"The latest #NintendoSwitch update is now available, including the ability to pair Bluetooth devices for audio output.",36376,poeuqy,https://twitter.com/NintendoAmerica/status/1437930124490457088,2705,1631664304.0,Turbostrider27,0.95,/r/NintendoSwitch/comments/poeuqy/the_latest_nintendoswitch_update_is_now_available/,NintendoSwitch,4498700,2
"""Please be aware that the previously announced Overwatch launch event scheduled for Wednesday, 10/16 at NintendoNYC has been cancelled by Blizzard. We apologize for any inconvenience this may cause."" - @NintendoNYC",35144,di1sc2,https://twitter.com/NintendoNYC/status/1183940424467173378?s=19,312,1571109190.0,schuey_08,0.94,/r/NintendoSwitch/comments/di1sc2/please_be_aware_that_the_previously_announced/,NintendoSwitch,4498700,2
Zelda: Breath Of The Wild is one of TIME's Best Games Of The Decade,34411,edpmyv,https://time.com/5752663/best-video-games-2010s-decade/,2177,1576933070.0,Frocharocha,0.89,/r/NintendoSwitch/comments/edpmyv/zelda_breath_of_the_wild_is_one_of_times_best/,NintendoSwitch,4498700,2
Nintendo considering extending Switch Online library beyond NES,34254,c66uwf,https://www.videogameschronicle.com/news/nintendo-considering-extending-switch-online-library-beyond-nes/,2287,1561649106.0,Frocharocha,0.94,/r/NintendoSwitch/comments/c66uwf/nintendo_considering_extending_switch_online/,NintendoSwitch,4498700,2
Switch Home Redesign (Fan-Made),33614,mxmjho,https://v.redd.it/hzal24ks65v61,907,1619279197.0,Frieznburg,0.89,/r/NintendoSwitch/comments/mxmjho/switch_home_redesign_fanmade/,NintendoSwitch,4498700,2
Japanese CEO gives staff the day off to play Monster Hunster Rise,33448,mbh1qv,https://www.videogameschronicle.com/news/japanese-ceo-gives-staff-the-day-off-to-play-monster-hunster-rise/,795,1616512807.0,Turbostrider27,0.94,/r/NintendoSwitch/comments/mbh1qv/japanese_ceo_gives_staff_the_day_off_to_play/,NintendoSwitch,4498700,2
Animal Crossing: New Horizons sold more digital units in a single month (5.0M) than any console game in history.,33367,g656os,https://www.superdataresearch.com/blog/worldwide-digital-games-market,1435,1587575884.0,Turbostrider27,0.95,/r/NintendoSwitch/comments/g656os/animal_crossing_new_horizons_sold_more_digital/,NintendoSwitch,4498700,2
"Nintendo censors the terms ""human rights"" and ""freedom"" in the Chinese localization of Paper Mario: The Origami King",33048,hx1xyr,https://twitter.com/ShawTim/status/1286576932235091968?ref_src=twsrc%5Etfw%7Ctwcamp%5Etweetembed%7Ctwterm%5E1286576932235091968%7Ctwgr%5E&ref_url=https%3A%2F%2Fs9e.github.io%2Fiframe%2F2%2Ftwitter.min.html1286576932235091968,1223,1595597917.0,TheFearlessWarrior,0.73,/r/NintendoSwitch/comments/hx1xyr/nintendo_censors_the_terms_human_rights_and/,NintendoSwitch,4498700,2
"Less 'rip and tear', more 'post and snark'...",32967,7z2blw,https://imgur.com/oDqZJua,874,1519183023.0,Warlach,0.9,/r/NintendoSwitch/comments/7z2blw/less_rip_and_tear_more_post_and_snark/,NintendoSwitch,4498700,2
Super Smash Bros. Ultimate earns title of best-selling fighting game in history.,32371,dr67iy,https://www.digitaltrends.com/gaming/super-smash-bros-ultimate-best-selling-fighting-game/,1088,1572812941.0,AdamCannon,0.93,/r/NintendoSwitch/comments/dr67iy/super_smash_bros_ultimate_earns_title_of/,NintendoSwitch,4498700,2
Rocket League will no longer require Nintendo Switch Online to play online when it goes free-to-play,32199,ilb826,https://www.rocketleague.com/news/rocket-league-free-to-play--seasons--new-ranks--and-more/,732,1599067615.0,Ganrokh,0.96,/r/NintendoSwitch/comments/ilb826/rocket_league_will_no_longer_require_nintendo/,NintendoSwitch,4498700,2
'#GameFreakLied' - Pokémon devs under serious fire on social media by fans after reused models and other controversies.,31614,dvraem,https://egamingdesk.com/nintendo-switch/gamefreaklied-pokemon-dev-under-serious-fire/,3420,1573649352.0,Frocharocha,0.87,/r/NintendoSwitch/comments/dvraem/gamefreaklied_pokémon_devs_under_serious_fire_on/,NintendoSwitch,4498700,2
Nintendo Switch's Second Half of 2021 and Beyond Infographic (Made by me),31295,o18lmn,https://i.redd.it/7tjds33hkn571.png,2845,1623860177.0,ieatdragonz,0.93,/r/NintendoSwitch/comments/o18lmn/nintendo_switchs_second_half_of_2021_and_beyond/,NintendoSwitch,4498700,2
Breath of the Wild sequel delayed to spring 2023,31147,tr0fsi,https://twitter.com/NintendoAmerica/status/1508806409797963784,2890,1648562498.0,dorkmax_executives,0.93,/r/NintendoSwitch/comments/tr0fsi/breath_of_the_wild_sequel_delayed_to_spring_2023/,NintendoSwitch,4498700,2
I've been fighting cancer since May of 2017. My daughter and I were still able to keep our regular Mario Kart sessions going even when I had a 2 week stay in the hospital after major surgery.,30702,bbo7ui,https://i.redd.it/aj7xxpgptgr21.jpg,499,1554914577.0,tjbassoon,0.9,/r/NintendoSwitch/comments/bbo7ui/ive_been_fighting_cancer_since_may_of_2017_my/,NintendoSwitch,4498700,2
Nintendo Switch's First Half of 2021 Infographic (Made by me),30675,lmpi13,https://i.redd.it/c3ok16waa9i61.png,3932,1613662785.0,ieatdragonz,0.92,/r/NintendoSwitch/comments/lmpi13/nintendo_switchs_first_half_of_2021_infographic/,NintendoSwitch,4498700,2
Pikmin 3 Deluxe – Announcement Trailer - Nintendo Switch,30319,i45vbp,https://www.youtube.com/watch?v=aSSQ0Z6eDhU,2931,1596636086.0,harushiga,0.92,/r/NintendoSwitch/comments/i45vbp/pikmin_3_deluxe_announcement_trailer_nintendo/,NintendoSwitch,4498700,2
The fact that games are not removed from your wishlist after purchasing them really shows how little Nintendo cares about the user experience of the eShop.,29907,os39fl,https://www.reddit.com/r/NintendoSwitch/comments/os39fl/the_fact_that_games_are_not_removed_from_your/,1284,1627319528.0,Dacvak,0.89,/r/NintendoSwitch/comments/os39fl/the_fact_that_games_are_not_removed_from_your/,NintendoSwitch,4498700,2
Designed a storage for games in game boy look,29833,kovsc0,https://v.redd.it/nq3djy7piw861,361,1609585586.0,nilsk89,0.94,/r/NintendoSwitch/comments/kovsc0/designed_a_storage_for_games_in_game_boy_look/,NintendoSwitch,4498700,2
Nintendo Switch and 'Animal Crossing' are quarantine best sellers as both attracted new waves of fans who were once disinterested in gaming.,29734,gbhfxj,https://edition.cnn.com/2020/04/30/tech/nintendo-switch-animal-crossing-quarantine/index.html,1375,1588337140.0,Frocharocha,0.94,/r/NintendoSwitch/comments/gbhfxj/nintendo_switch_and_animal_crossing_are/,NintendoSwitch,4498700,2
Made an animation for my favorite Nintendo game,29622,8jolvc,https://v.redd.it/gn7oghcyq2y01,439,1526414093.0,a3headedcat,0.9,/r/NintendoSwitch/comments/8jolvc/made_an_animation_for_my_favorite_nintendo_game/,NintendoSwitch,4498700,2
"The sequel to ""The Legend of Zelda: Breath of the Wild"" will be released in 2022.",29498,o0ilgz,https://twitter.com/Nintendo/status/1404840673870630913,2610,1623775106.0,DestroyingAwesome,0.94,/r/NintendoSwitch/comments/o0ilgz/the_sequel_to_the_legend_of_zelda_breath_of_the/,NintendoSwitch,4498700,2
The Legend of Zelda: Breath of the Wild is voted the best video game of all time by IGN (from IGN’s Top 100),29354,rszz5i,https://www.ign.com/articles/the-best-100-video-games-of-all-time,4403,1640974930.0,Turbostrider27,0.78,/r/NintendoSwitch/comments/rszz5i/the_legend_of_zelda_breath_of_the_wild_is_voted/,NintendoSwitch,4498700,2
"Nintendo says ""more systems on the way"" as Switch sells out worldwide",29184,fx500x,https://www.gamesindustry.biz/articles/2020-04-08-nintendo-says-more-systems-on-the-way-as-switch-sells-out-worldwide,1665,1586346125.0,Frocharocha,0.95,/r/NintendoSwitch/comments/fx500x/nintendo_says_more_systems_on_the_way_as_switch/,NintendoSwitch,4498700,2
The Nintendo Switch has been the US’s bestselling console for 23 straight months,29158,jt87ak,https://www.theverge.com/2020/11/12/21562530/nintendo-switch-lite-sales-october-2020?utm_campaign=theverge&utm_content=chorus&utm_medium=social&utm_source=twitter,1261,1605232243.0,Amiibofan101,0.93,/r/NintendoSwitch/comments/jt87ak/the_nintendo_switch_has_been_the_uss_bestselling/,NintendoSwitch,4498700,2
I crocheted a Scorbunny,29042,avxmeo,https://i.redd.it/14mb724s0ej21.jpg,445,1551396517.0,mariehei,0.89,/r/NintendoSwitch/comments/avxmeo/i_crocheted_a_scorbunny/,NintendoSwitch,4498700,2
China to ban online gaming and chatting with foreigners outside Great Firewall,29002,g1qijz,https://www.taiwannews.com.tw/en/news/3916690,1920,1586951749.0,Frocharocha,0.95,/r/NintendoSwitch/comments/g1qijz/china_to_ban_online_gaming_and_chatting_with/,NintendoSwitch,4498700,2
"Nintendo, Sony, Microsoft to require loot box odds disclosure",28528,cn7oav,https://www.gamesindustry.biz/articles/2019-08-07-nintendo-sony-microsoft-to-require-loot-box-odds-disclosure,1333,1565193752.0,Frocharocha,0.97,/r/NintendoSwitch/comments/cn7oav/nintendo_sony_microsoft_to_require_loot_box_odds/,NintendoSwitch,4498700,2
Tune in 2/17 at 2 p.m. PT for a #NintendoDirect livestream featuring roughly 50 minutes of information focused on available games like Super #SmashBrosUltimate and games coming to #NintendoSwitch in the first half of 2021.,27829,ll4d8o,https://twitter.com/NintendoAmerica/status/1361676737730519042,3331,1613484024.0,harushiga,0.92,/r/NintendoSwitch/comments/ll4d8o/tune_in_217_at_2_pm_pt_for_a_nintendodirect/,NintendoSwitch,4498700,2
Tony Hawk's Pro Skater 1 + 2 coming to Nintendo Switch this year,27816,lqlrlw,https://twitter.com/TonyHawkTheGame/status/1364243630358220800,1364,1614096088.0,harushiga,0.93,/r/NintendoSwitch/comments/lqlrlw/tony_hawks_pro_skater_1_2_coming_to_nintendo/,NintendoSwitch,4498700,2
We're proud to have Super Mario Odyssey and The Legend of Zelda: Breath of the Wild as two of @thegameawards' Game of the Year nominees!,27511,7cwh3h,https://twitter.com/NintendoAmerica/status/930462859183583232,1359,1510674719.0,Porkpants81,0.9,/r/NintendoSwitch/comments/7cwh3h/were_proud_to_have_super_mario_odyssey_and_the/,NintendoSwitch,4498700,2
Nintendo Switch named Most fragile product of 2019 by French consumers' association,27302,egpl3v,http://www.jeuxvideo.com/news/1165759/nintendo-cite-comme-l-une-des-pires-entreprises-de-l-annee-par-60-millions-de-consommateurs.htm,2223,1577531117.0,TheFearlessWarrior,0.94,/r/NintendoSwitch/comments/egpl3v/nintendo_switch_named_most_fragile_product_of/,NintendoSwitch,4498700,2
Splatoon coming to Smash for Switch!,26992,831o2x,https://www.reddit.com/r/NintendoSwitch/comments/831o2x/splatoon_coming_to_smash_for_switch/,2852,1520548421.0,thecornballer1,0.83,/r/NintendoSwitch/comments/831o2x/splatoon_coming_to_smash_for_switch/,NintendoSwitch,4498700,2
Untitled Goose Game has sold 1 million copies!,26753,eht5cu,https://twitter.com/cabel/status/1211754892605308928,695,1577744297.0,schuey_08,0.93,/r/NintendoSwitch/comments/eht5cu/untitled_goose_game_has_sold_1_million_copies/,NintendoSwitch,4498700,2
Super Mario 3D World + Bowser’s Fury new trailer,26305,kvs6ah,https://www.youtube.com/watch?v=eDuQGng-ar8,2349,1610460037.0,Turbostrider27,0.93,/r/NintendoSwitch/comments/kvs6ah/super_mario_3d_world_bowsers_fury_new_trailer/,NintendoSwitch,4498700,2
7-year-old girl wins Pokémon Sword and Shield international tournament,26057,f903ge,https://www.oneesports.gg/headline/7-year-old-girl-wins-pokemon-sword-and-shield-international-tournament/,688,1582585672.0,Hex_of_Void,0.92,/r/NintendoSwitch/comments/f903ge/7yearold_girl_wins_pokémon_sword_and_shield/,NintendoSwitch,4498700,2
Super Mario Maker 2 – World Maker Update – Nintendo Switch,25793,g56ea8,https://youtube.com/watch?feature=youtu.be&v=NABeP5oGygM,1591,1587434569.0,Amiibofan101,0.95,/r/NintendoSwitch/comments/g56ea8/super_mario_maker_2_world_maker_update_nintendo/,NintendoSwitch,4498700,2
Overwatch director says Nintendo can have any character for Smash.,25224,dcd6k1,https://www.ign.com/articles/2019/10/02/overwatch-director-says-nintendo-can-have-any-character-for-smash,1722,1570036225.0,AdamCannon,0.9,/r/NintendoSwitch/comments/dcd6k1/overwatch_director_says_nintendo_can_have_any/,NintendoSwitch,4498700,2
"Nintendo Wants To Sell Switch ""For As Long As Possible"", Has ""No Plans"" To Cut Pricing",25141,duu4iz,https://www.videogameschronicle.com/news/nintendo-says-it-has-no-plans-for-a-switch-price-cut/,2251,1573487092.0,Frocharocha,0.92,/r/NintendoSwitch/comments/duu4iz/nintendo_wants_to_sell_switch_for_as_long_as/,NintendoSwitch,4498700,2
The Legend of Zelda: Breath of the Wild is the game of the decade on DenofGeek 100 game's listing.,24621,ei66aj,https://www.denofgeek.com/us/games/285132/best-video-games-2010s-decade,2544,1577814522.0,Frocharocha,0.85,/r/NintendoSwitch/comments/ei66aj/the_legend_of_zelda_breath_of_the_wild_is_the/,NintendoSwitch,4498700,2
Pokémon Legends: Arceus - Gameplay Trailer,24569,p6r5t3,https://www.youtube.com/watch?v=QRsbFmM37T4,3235,1629293334.0,harushiga,0.9,/r/NintendoSwitch/comments/p6r5t3/pokémon_legends_arceus_gameplay_trailer/,NintendoSwitch,4498700,2
Zelda: Link's Awakening Side-By-Side Comparison (Nintendo Switch vs Game Boy Color),24409,ar6fjv,https://gfycat.com/granularimmaculateamericanavocet-link-s-awakening-zelda,914,1550300777.0,K-LAWN,0.94,/r/NintendoSwitch/comments/ar6fjv/zelda_links_awakening_sidebyside_comparison/,NintendoSwitch,4498700,2
Sony's PS4 Cross-Play Program Now Supports Crossplay with Nintendo Switch,24163,dcugh1,http://www.pushsquare.com/news/2019/10/sonys_ps4_cross-play_program_has_reportedly_moved_out_of_beta,892,1570125203.0,Frocharocha,0.96,/r/NintendoSwitch/comments/dcugh1/sonys_ps4_crossplay_program_now_supports/,NintendoSwitch,4498700,2
A little Switch Stardew Valley fanart (OC),23970,97hzo8,https://i.redd.it/sd3b7p0589g11.jpg,326,1534337720.0,Throwy_away_1,0.92,/r/NintendoSwitch/comments/97hzo8/a_little_switch_stardew_valley_fanart_oc/,NintendoSwitch,4498700,2
"Against All Odds, the Animal Crossing and DOOM Communities Have United",23752,f897yn,https://www.ign.com/articles/against-all-odds-the-animal-crossing-and-doom-communities-have-united?sf117802209=1,591,1582463243.0,Hex_of_Void,0.93,/r/NintendoSwitch/comments/f897yn/against_all_odds_the_animal_crossing_and_doom/,NintendoSwitch,4498700,2
Zelda Breath Of The Wild 2 Is Currently Planned For A 2020 Release,23605,dvakr4,https://www.nintendoenthusiast.com/rumor-nintendo-targeting-2020-release-for-breath-of-the-wild-sequel/,1091,1573568349.0,Frocharocha,0.93,/r/NintendoSwitch/comments/dvakr4/zelda_breath_of_the_wild_2_is_currently_planned/,NintendoSwitch,4498700,2
Game Informal's 2018 April Issue includes this Super Mario Odyssey parody with Luigi.,23527,8bi69u,https://i.redd.it/s3l79cljxar01.jpg,397,1523462279.0,SahilGagrai,0.92,/r/NintendoSwitch/comments/8bi69u/game_informals_2018_april_issue_includes_this/,NintendoSwitch,4498700,2
Calculator releases for Nintendo Switch tomorrow.,23077,n9sobm,https://www.nintendo.com/games/detail/calculator-switch/,1895,1620723735.0,SahilGagrai,0.94,/r/NintendoSwitch/comments/n9sobm/calculator_releases_for_nintendo_switch_tomorrow/,NintendoSwitch,4498700,2
Nintendo says their female audience likes seeing Luigi as the lead character.,22861,c0ghdh,https://www.eurogamer.net/articles/2019-06-11-hands-on-with-luigis-mansion-3-and-its-multiplayer-dungeon-crawling-scarescraper-mode,1320,1560491142.0,TheFearlessWarrior,0.95,/r/NintendoSwitch/comments/c0ghdh/nintendo_says_their_female_audience_likes_seeing/,NintendoSwitch,4498700,2
Nintendo is refunding people who mistakenly purchased the wrong Pokémon DLC,22662,hcrdbc,https://twitter.com/nintendoamerica/status/1274397037182640129?s=21,1245,1592678298.0,TheFearlessWarrior,0.96,/r/NintendoSwitch/comments/hcrdbc/nintendo_is_refunding_people_who_mistakenly/,NintendoSwitch,4498700,2
Here's my take on the Doom Eternal: Nintendo Switch Edition,22656,ficm32,https://i.redd.it/us78dcdt9km41.jpg,362,1584158126.0,Frocharocha,0.91,/r/NintendoSwitch/comments/ficm32/heres_my_take_on_the_doom_eternal_nintendo_switch/,NintendoSwitch,4498700,2
Kotaku has tried to reach Nintendo on the Joy-Con issues after massive complaints and seems to be waiting on an update.,22619,ce0rhg,https://kotaku.com/joy-con-drift-is-becoming-a-real-problem-on-the-switch-1836417809,1823,1563300799.0,Frocharocha,0.89,/r/NintendoSwitch/comments/ce0rhg/kotaku_has_tried_to_reach_nintendo_on_the_joycon/,NintendoSwitch,4498700,2
Free Giveaway! Nintendo Switch OLED and Xenoblade Chronicles 3 - International,22244,wc2itp,https://www.reddit.com/r/NintendoSwitch/comments/wc2itp/free_giveaway_nintendo_switch_oled_and_xenoblade/,71112,1659201560.0,WolfLemon36,0.85,/r/NintendoSwitch/comments/wc2itp/free_giveaway_nintendo_switch_oled_and_xenoblade/,NintendoSwitch,4498700,2
"The Nintendo Switch sold 4 times more units than PS5, Series S & X Combined this week in japan.",22198,k1f5gb,https://www.resetera.com/threads/media-create-sales-week-47-2020-nov-16-nov-22.333380/,1498,1606396997.0,TheFearlessWarrior,0.8,/r/NintendoSwitch/comments/k1f5gb/the_nintendo_switch_sold_4_times_more_units_than/,NintendoSwitch,4498700,2
Free Giveaway! Nintendo Switch OLED - International,22150,vkfzs2,https://www.reddit.com/r/NintendoSwitch/comments/vkfzs2/free_giveaway_nintendo_switch_oled_international/,68808,1656166623.0,WolfLemon36,0.85,/r/NintendoSwitch/comments/vkfzs2/free_giveaway_nintendo_switch_oled_international/,NintendoSwitch,4498700,2
Raf Grassetti( God of War Art Director) shared another piece of his artwork of CupHead,22080,cgeq76,https://pasteboard.co/IpaPwPB.jpg,155,1563809735.0,Frocharocha,0.94,/r/NintendoSwitch/comments/cgeq76/raf_grassetti_god_of_war_art_director_shared/,NintendoSwitch,4498700,2
Mario Strikers: Battle League – Announcement Trailer – Nintendo Switch,21924,sopehq,https://www.youtube.com/watch?v=cLAzzYz92r4&feature=youtube_video_deck,1329,1644444515.0,MarvelsGrantMan136,0.94,/r/NintendoSwitch/comments/sopehq/mario_strikers_battle_league_announcement_trailer/,NintendoSwitch,4498700,2
"FYI, a game boy cartridge case will hold 15 Switch games!",21498,8ece8p,https://i.redd.it/zztoe4wphot01.jpg,706,1524497994.0,TingleMaps,0.93,/r/NintendoSwitch/comments/8ece8p/fyi_a_game_boy_cartridge_case_will_hold_15_switch/,NintendoSwitch,4498701,2
The gang is complete!,21433,ay4e26,https://i.redd.it/9uri9j64jkk21.jpg,210,1551908571.0,mariehei,0.91,/r/NintendoSwitch/comments/ay4e26/the_gang_is_complete/,NintendoSwitch,4498701,2
Animal Crossing: New Horizons sold 11.77 million units in it’s first 11 days,21168,gf1por,https://www.nintendo.co.jp/ir/en/finance/software/index.html,1197,1588835008.0,Amiibofan101,0.93,/r/NintendoSwitch/comments/gf1por/animal_crossing_new_horizons_sold_1177_million/,NintendoSwitch,4498701,2
"CD Projekt Red: ""I don’t know if Cyberpunk 2077 would work on the Nintendo Switch. It might be too heavy for it. But then, we did put Witcher 3 on it and we thought that would be too heavy too but somehow we pulled it off.""",21142,ey7itw,https://www.onmsft.com/feature/interview-cd-projekt-reds-john-mamais-talks-cyberpunk-2077s-creation-vr-dlc-nintendo-switch-and-more,994,1580738297.0,Frocharocha,0.94,/r/NintendoSwitch/comments/ey7itw/cd_projekt_red_i_dont_know_if_cyberpunk_2077/,NintendoSwitch,4498701,2
Elijah Wood visited this person's Animal Crossing :AC Island. The pics are pretty wholesome.,21065,g6rrjd,https://twitter.com/directedbyrian/status/1253365992849276934,481,1587665778.0,Frocharocha,0.93,/r/NintendoSwitch/comments/g6rrjd/elijah_wood_visited_this_persons_animal_crossing/,NintendoSwitch,4498701,2
