title,score,id,url,num_comments,created,author,upvote_ratio,permalink,subreddit,subreddit_subscribers,depth
"A mother once called into PBS, asking if Mr. Rogers could send an autograph to her daughter. She was suffering from seizures and set to have brain surgery. When Mr Rogers heard about it, he flew to see her in the hospital. He even brought his puppets along.",120927,jd0q0h,https://i.redd.it/uj2swhtrapt51.jpg,1450,1602960419.0,FacelessOnes,0.96,/r/nextfuckinglevel/comments/jd0q0h/a_mother_once_called_into_pbs_asking_if_mr_rogers/,nextfuckinglevel,7785630,2
This paramedic in the UK has found an innovative way to communicate with hard of hearing patients while wearing a face mask,120770,htj8g8,https://v.redd.it/ni4islj45nb51,1282,1595089072.0,Thund3rbolt,0.95,/r/nextfuckinglevel/comments/htj8g8/this_paramedic_in_the_uk_has_found_an_innovative/,nextfuckinglevel,7785630,2
Eliud Kipchoge breaks the world record (his own) with 2:01:09,120724,xnkltw,https://v.redd.it/r3w3qmvznzp91,2371,1664104662.0,qasqaldag,0.93,/r/nextfuckinglevel/comments/xnkltw/eliud_kipchoge_breaks_the_world_record_his_own/,nextfuckinglevel,7785630,2
"Mike Tyson in his prime, was not a human",120586,jrjglu,https://v.redd.it/n40hgy3lfey51,2412,1605008125.0,NiceCasualRedditGuy,0.93,/r/nextfuckinglevel/comments/jrjglu/mike_tyson_in_his_prime_was_not_a_human/,nextfuckinglevel,7785630,2
Never give up on your goals.,120428,jg7ha0,https://v.redd.it/2c9yhg32epu51,992,1603397376.0,sarge-m,0.92,/r/nextfuckinglevel/comments/jg7ha0/never_give_up_on_your_goals/,nextfuckinglevel,7785630,2
South Carolina teachers create “The Gentlemen Club” to teach young boys with no fathers life Lessons,120153,mrjpcp,https://i.redd.it/j8u80yluhdt61.png,2777,1618508051.0,NRGpop,0.87,/r/nextfuckinglevel/comments/mrjpcp/south_carolina_teachers_create_the_gentlemen_club/,nextfuckinglevel,7785630,2
Thank you to all the medical care workers across the world for your hard work and dedication,119531,k9a7l6,https://i.redd.it/tuubknahe0461.jpg,2532,1607453314.0,memezzer,0.83,/r/nextfuckinglevel/comments/k9a7l6/thank_you_to_all_the_medical_care_workers_across/,nextfuckinglevel,7785630,2
the bee lady scooping more bees (but explains how she does it),119498,jsgzcz,https://v.redd.it/ii3h54mhjoy51,2057,1605130494.0,mymexicanshrek,0.9,/r/nextfuckinglevel/comments/jsgzcz/the_bee_lady_scooping_more_bees_but_explains_how/,nextfuckinglevel,7785630,2
Name recognition demonstration.,118905,l1y0vr,https://v.redd.it/8tc2qywtooc61,1586,1611234152.0,Pedrica1,0.89,/r/nextfuckinglevel/comments/l1y0vr/name_recognition_demonstration/,nextfuckinglevel,7785630,2
"This is Tiernan McCready. This is what a hero looks like. In Bogside he saw three males grab an 18 year old girl and try to get her in their van. He reacted instantly, shouting at the males, led the girl to safety and told his mother to ring the police.",118570,mpe2yp,https://i.redd.it/uljj5uglxqs61.jpg,1803,1618234881.0,Currynrice9728,0.93,/r/nextfuckinglevel/comments/mpe2yp/this_is_tiernan_mccready_this_is_what_a_hero/,nextfuckinglevel,7785630,2
The way she makes her dress beautifully flow,118236,ufd96t,https://v.redd.it/ectsj8sloow81,1513,1651332092.0,Swerwin,0.88,/r/nextfuckinglevel/comments/ufd96t/the_way_she_makes_her_dress_beautifully_flow/,nextfuckinglevel,7785630,2
Wifey and I dropped almost 300 lbs in the last year and a half. I was told to post this here and that you guys might get a kick out of this picture.,118233,eoccoz,https://i.redd.it/ipgsfd5zqma41.jpg,1597,1578957898.0,3995346,0.91,/r/nextfuckinglevel/comments/eoccoz/wifey_and_i_dropped_almost_300_lbs_in_the_last/,nextfuckinglevel,7785630,2
Now this is the proper way to protest,117990,gwlmfn,https://i.redd.it/9swk9l1xex251.jpg,1977,1591290763.0,lol62056,0.83,/r/nextfuckinglevel/comments/gwlmfn/now_this_is_the_proper_way_to_protest/,nextfuckinglevel,7785630,2
"This looks like plastic, feels like plastic, but it isn't. This biodegradable bioplastic (Sonali Bag) is made from a plant named jute. And invented by a Bangladeshi scientist Mubarak Ahmed Khan. This invention can solve the Global Plastic Pollution problem.",117971,kg5yxj,https://v.redd.it/9oq4dntgl4661,2390,1608376092.0,mohiemen,0.91,/r/nextfuckinglevel/comments/kg5yxj/this_looks_like_plastic_feels_like_plastic_but_it/,nextfuckinglevel,7785630,2
He asked a blind classmate to prom with chocolates layed out in braille,117859,ffd6ds,https://v.redd.it/b597fqwkkgl41,2208,1583677457.0,GallowBoob,0.9,/r/nextfuckinglevel/comments/ffd6ds/he_asked_a_blind_classmate_to_prom_with/,nextfuckinglevel,7785630,2
The best way to avoid an argument. Tongue fu.,117848,oqny2h,https://v.redd.it/1g9im68q75d71,2089,1627124829.0,esberat,0.93,/r/nextfuckinglevel/comments/oqny2h/the_best_way_to_avoid_an_argument_tongue_fu/,nextfuckinglevel,7785630,2
"Nice!, you can paint in real life, but can you paint in VR?",117300,i6tzmq,https://v.redd.it/onwo7u60e2g51,908,1597017081.0,FacelessOnes,0.94,/r/nextfuckinglevel/comments/i6tzmq/nice_you_can_paint_in_real_life_but_can_you_paint/,nextfuckinglevel,7785630,2
Someone made a goose that you download and it destroys your computer (by SamNChiet),117055,ew8t5f,https://v.redd.it/q6ebcsg29yd41,1614,1580404770.0,GallowBoob,0.91,/r/nextfuckinglevel/comments/ew8t5f/someone_made_a_goose_that_you_download_and_it/,nextfuckinglevel,7785630,2
Smart streamer recognizes a girls attempt at getting rid of a stalker,116729,jxs5sb,https://v.redd.it/rndhp3ee5f061,2866,1605889624.0,NewCarthagea,0.87,/r/nextfuckinglevel/comments/jxs5sb/smart_streamer_recognizes_a_girls_attempt_at/,nextfuckinglevel,7785630,2
Krystyna Paszko launched a fake online shop on Facebook during the pandemic,116529,m0eezl,https://i.redd.it/nh6buxirpsl61.jpg,1447,1615205527.0,__Dawn__Amber__,0.9,/r/nextfuckinglevel/comments/m0eezl/krystyna_paszko_launched_a_fake_online_shop_on/,nextfuckinglevel,7785630,2
flipped off the swing like a boss..,116491,wdu755,https://v.redd.it/r6ntkpe9f6f91,737,1659392170.0,EvaRaw666,0.97,/r/nextfuckinglevel/comments/wdu755/flipped_off_the_swing_like_a_boss/,nextfuckinglevel,7785630,2
"Europe must wake up now. Europe's largest nuclear power plant is on fire. Right now, Russian tanks are firing upon nuclear units. These are tanks equipped with thermal imagers. That is, they know where they are shooting, they have been preparing for this!",116436,t6d8oh,https://v.redd.it/bgbnfjnmgbl81,5268,1646377733.0,berengor_666,0.82,/r/nextfuckinglevel/comments/t6d8oh/europe_must_wake_up_now_europes_largest_nuclear/,nextfuckinglevel,7785630,2
