title,score,id,url,num_comments,created,author,upvote_ratio,permalink,subreddit,subreddit_subscribers,depth
Oligarch of the Month: Kelly Loeffler--The Republican senator profited from a pandemic while millions of Americans lost their jobs.,121,kn8rdg,https://newrepublic.com/article/160258/oligarch-month-kelly-loeffler,4,1609356114.0,HenryCorp,0.99,/r/uspolitics/comments/kn8rdg/oligarch_of_the_month_kelly_loefflerthe/,uspolitics,28979,2
Lindsey Graham sparks unflattering speculation after refusing to take COVID test ahead of debate,117,j8iud6,https://www.rawstory.com/2020/10/lindsey-graham-sparks-unflattering-speculation-after-refusing-to-take-test-ahead-of-debate/,21,1602329037.0,shallah,0.98,/r/uspolitics/comments/j8iud6/lindsey_graham_sparks_unflattering_speculation/,uspolitics,28979,2
Most Americans say Trump acted irresponsibly and distrust White House on his health,116,j5tfjr,https://www.cnn.com/2020/10/05/politics/cnn-poll-coronavirus-trump/index.html,17,1601937113.0,bobbelcher,0.97,/r/uspolitics/comments/j5tfjr/most_americans_say_trump_acted_irresponsibly_and/,uspolitics,28979,2
"Postal Police Sue USPS, DeJoy Over Restrictions They Claim Put Postal Workers In ‘Danger’",119,itwg9n,https://www.postal-reporter.com/blog/postal-police-sue-usps-dejoy-over-restrictions-they-claim-put-postal-workers-in-danger/,4,1600266062.0,shallah,1.0,/r/uspolitics/comments/itwg9n/postal_police_sue_usps_dejoy_over_restrictions/,uspolitics,28979,2
Dr. Fauci Shuts Down ‘Fox & Friends’ on Coronavirus Cure: ‘We Don’t Operate on How You Feel’,120,ful1rj,https://www.thedailybeast.com/dr-fauci-shuts-down-fox-and-friends-on-coronavirus-cure-says-we-dont-operate-on-how-you-feel,28,1585964487.0,FnordFinder,0.98,/r/uspolitics/comments/ful1rj/dr_fauci_shuts_down_fox_friends_on_coronavirus/,uspolitics,28979,2
"Fauci: 'You don't make the timeline, the virus makes the timeline' on relaxing public health measures",118,fp8lhh,https://www.cnn.com/2020/03/25/politics/anthony-fauci-coronavirus-timeline-cnntv/index.html?utm_source=feedburner&utm_medium=feed&utm_campaign=Feed%3A+rss%2Fcnn_topstories+%28RSS%3A+CNN+-+Top+Stories%29,5,1585215000.0,FnordFinder,0.99,/r/uspolitics/comments/fp8lhh/fauci_you_dont_make_the_timeline_the_virus_makes/,uspolitics,28979,2
"While Biden Says 'Happy to Talk About That Later,' Sanders Holds Coronavirus Roundtable With Medical Experts",118,fg4gjp,http://www.commondreams.org/news/2020/03/09/while-biden-says-happy-talk-about-later-sanders-holds-coronavirus-roundtable-medical,13,1583797845.0,futuredude,0.92,/r/uspolitics/comments/fg4gjp/while_biden_says_happy_to_talk_about_that_later/,uspolitics,28979,2
"Trump Brags About Concealing Impeachment Evidence: 'We Have All the Material, They Don't'",117,eseypm,https://www.rollingstone.com/politics/politics-news/trump-impeachment-evidence-we-have-all-the-material-they-dont-941140/,14,1579713198.0,FnordFinder,0.94,/r/uspolitics/comments/eseypm/trump_brags_about_concealing_impeachment_evidence/,uspolitics,28979,2
"Nuclear secrets reportedly found at Mar-a-Lago are ‘gamechanger’, experts say",119,x8akxy,https://www.theguardian.com/us-news/live/2022/sep/07/trump-nuclear-document-special-master-biden-obama-bannon-latest,47,1662570519.0,BitterFuture,0.98,/r/uspolitics/comments/x8akxy/nuclear_secrets_reportedly_found_at_maralago_are/,uspolitics,28979,2
RNC cuts off Trump and makes him pay for his own lawyers in Mar-a-Lago documents mess: report,118,x1xlab,https://www.salon.com/2022/08/30/rnc-cuts-off-and-makes-him-pay-for-his-own-lawyers-in-mar-a-lago-documents-mess-report_partner/,27,1661901231.0,Pessimist2020,0.98,/r/uspolitics/comments/x1xlab/rnc_cuts_off_trump_and_makes_him_pay_for_his_own/,uspolitics,28979,2
"Ousted Florida data scientist Rebekah Jones wins House primary, will face Rep. Matt Gaetz",121,wy63fw,https://www.usatoday.com/story/news/politics/2022/08/24/rebekah-jones-primary-matt-gaetz/7885075001/,14,1661511368.0,BitterFuture,0.98,/r/uspolitics/comments/wy63fw/ousted_florida_data_scientist_rebekah_jones_wins/,uspolitics,28979,2
"Ginni Thomas, wife of Supreme Court justice, pressed Ariz. lawmakers to help reverse Trump’s loss, emails show",116,uu0v8l,https://wapo.st/3wxuhwE,14,1653063394.0,bobbelcher,0.98,/r/uspolitics/comments/uu0v8l/ginni_thomas_wife_of_supreme_court_justice/,uspolitics,28979,2
"Elizabeth Warren calls for investigation into ""dark money"" used to fund the U.S. Capitol riot",114,le3avk,https://www.salon.com/2021/02/06/sen-warren-calls-for-investigation-into-dark-money-used-to-fund-the-us-capitol-riot_partner/,2,1612635574.0,Pessimist2020,0.98,/r/uspolitics/comments/le3avk/elizabeth_warren_calls_for_investigation_into/,uspolitics,28979,2
Trump walks out of news conference after reporter asks him about Veterans Choice lie he's told more than 150 times,119,i6j8fs,https://www.cnn.com/2020/08/08/politics/trump-veterans-choice-paula-reid/index.html,12,1596979296.0,bobbelcher,0.96,/r/uspolitics/comments/i6j8fs/trump_walks_out_of_news_conference_after_reporter/,uspolitics,28979,2
Three tubs of unsent absentee ballots discovered in mail processing center after polls closed in Wisconsin,114,fyuh7o,https://www.msn.com/en-us/news/politics/three-tubs-of-ballots-discovered-in-mail-processing-center-after-polls-closed-in-wisconsin/ar-BB12laJO,7,1586571629.0,cos,0.98,/r/uspolitics/comments/fyuh7o/three_tubs_of_unsent_absentee_ballots_discovered/,uspolitics,28979,2
"Bernie Sanders becomes first candidate, Republican or Democrat, to win popular vote in all three early voting states",119,f8dg4z,https://www.newsweek.com/bernie-sanders-becomes-first-candidate-democrat-republican-win-popular-vote-all-3-three-early-1488638,30,1582482437.0,FnordFinder,0.93,/r/uspolitics/comments/f8dg4z/bernie_sanders_becomes_first_candidate_republican/,uspolitics,28979,2
Did Trump trade classified intel about Iran and China to the Saudis for raising gas prices?,116,yb09al,https://www.reuters.com/legal/classified-papers-seized-trump-home-held-us-secrets-about-iran-china-washington-2022-10-21/,27,1666476902.0,jmaximus,0.97,/r/uspolitics/comments/yb09al/did_trump_trade_classified_intel_about_iran_and/,uspolitics,28979,2
"Critics accuse Ted Cruz of ""fake compassion"" as he hands out water after Mexico trip",116,lowzuo,https://www.newsweek.com/critics-accuse-ted-cruz-fake-compassion-he-hands-out-water-after-mexico-trip-1570807,19,1613913847.0,Bobinct,0.99,/r/uspolitics/comments/lowzuo/critics_accuse_ted_cruz_of_fake_compassion_as_he/,uspolitics,28979,2
VP Pence Hasn’t Attended Virus Task Force Meeting In More Than A Month,116,jldv3a,https://www.newsandguts.com/vp-pence-hasnt-attended-virus-task-force-meeting-in-more-than-a-month/,13,1604126804.0,bobbelcher,0.98,/r/uspolitics/comments/jldv3a/vp_pence_hasnt_attended_virus_task_force_meeting/,uspolitics,28979,2
Hillary Clinton wants Donald Trump to pay legal fees after conspiracy lawsuit dismissed,112,yjkw5n,https://www.independent.co.uk/news/world/americas/us-politics/hillary-clinton-donald-trump-lawsuit-b2215381.html,5,1667335725.0,Pessimist2020,0.98,/r/uspolitics/comments/yjkw5n/hillary_clinton_wants_donald_trump_to_pay_legal/,uspolitics,28979,2
"Man ‘Down Q Rabbit Hole’ Killed Wife, Shot Daughter",115,xccr8b,https://www.thedailybeast.com/igor-lanis-murdered-wife-shot-daughter-after-being-sucked-down-qanon-rabbit-hole-family-says,25,1662988998.0,Pessimist2020,0.99,/r/uspolitics/comments/xccr8b/man_down_q_rabbit_hole_killed_wife_shot_daughter/,uspolitics,28979,2
Colonel fired by Trump offers to prosecute Michael Flynn after he called for violent military coup against US,117,npdtui,https://www.independent.co.uk/news/world/americas/us-politics/yevgeny-vindman-prosecute-flynn-coup-b1857174.html,10,1622496450.0,Pessimist2020,0.99,/r/uspolitics/comments/npdtui/colonel_fired_by_trump_offers_to_prosecute/,uspolitics,28979,2
Joe Biden Wants to Put the World’s Corporate Tax Havens Out of Business,119,mo5jfl,https://slate.com/business/2021/04/joe-biden-tax-havens-corporate-global-minimum.html,32,1618064246.0,stankmanly,0.99,/r/uspolitics/comments/mo5jfl/joe_biden_wants_to_put_the_worlds_corporate_tax/,uspolitics,28979,2
Calls mount for Cruz and Hawley to step down: ‘Broken their oath of office’ | Top Democrats demand GOP senators step down after objecting to election results that compelled Capitol violence,114,ktr2sg,https://www.independent.co.uk/news/world/americas/us-politics/patty-murray-resign-cruz-hawley-b1784714.html,12,1610199617.0,DonaldWillKillUsAll,0.98,/r/uspolitics/comments/ktr2sg/calls_mount_for_cruz_and_hawley_to_step_down/,uspolitics,28979,2
The Trump-Raffensperger call was big news — unless you were following conservative media,118,kql6yp,https://www.washingtonpost.com/lifestyle/media/conservative-media-raffensperger-georgia-trump/2021/01/04/d4bdb64e-4ea0-11eb-83e3-322644d82356_story.html?utm_source=reddit.com,9,1609803712.0,Bobinct,0.97,/r/uspolitics/comments/kql6yp/the_trumpraffensperger_call_was_big_news_unless/,uspolitics,28979,2
"McConnell's list of Republican Senators blocking COVID-19 relief for all Americans, and for states and cities, which have been paying for all our emergency workers.",116,k64bs5,https://www.republicanleader.senate.gov/senate-resources/republican-senators,13,1607023948.0,3ustice3,0.98,/r/uspolitics/comments/k64bs5/mcconnells_list_of_republican_senators_blocking/,uspolitics,28979,2
Former security officials warn Donald Trump won't keep state secrets,119,k2njrq,https://www.independent.co.uk/news/world/americas/us-election-2020/donald-trump-security-intelligence-briefings-b1763195.html,23,1606569708.0,Pessimist2020,0.99,/r/uspolitics/comments/k2njrq/former_security_officials_warn_donald_trump_wont/,uspolitics,28979,2
The Trump Campaign Accepted Russian Help to Win in 2016. Case Closed.,113,jo1kob,https://www.nytimes.com/2020/08/19/opinion/trump-russia-2016-report.html,25,1604513112.0,stankmanly,0.96,/r/uspolitics/comments/jo1kob/the_trump_campaign_accepted_russian_help_to_win/,uspolitics,28979,2
Mitch McConnell tried to gut a CDC program aimed at detecting and responding to infectious disease outbreaks,116,g0shkp,https://www.businessinsider.com/mitch-mcconnell-tried-to-defund-cdc-infectious-disease-program-2020-4,7,1586814719.0,shallah,0.94,/r/uspolitics/comments/g0shkp/mitch_mcconnell_tried_to_gut_a_cdc_program_aimed/,uspolitics,28979,2
Pence's office blocks public health officials from appearing on CNN,116,fxv9ym,https://www.cnn.com/2020/04/09/media/pence-office-tv-bookings-coronavirus/index.html,30,1586448938.0,bobbelcher,0.97,/r/uspolitics/comments/fxv9ym/pences_office_blocks_public_health_officials_from/,uspolitics,28979,2
"Donald Trump Is Firing Michael Atkinson, The Intelligence Community Inspector General Who Brought Forward The Whistleblower Complaint",116,furrq9,https://www.buzzfeednews.com/article/emmaloop/trump-fires-michael-atkinson-intelligence-impeachment,9,1585997903.0,FnordFinder,0.98,/r/uspolitics/comments/furrq9/donald_trump_is_firing_michael_atkinson_the/,uspolitics,28979,2
Yang: 'We should not have lifetime appointments for Supreme Court justices',113,f1gohd,https://www.nbcnews.com/video/yang-advocates-for-term-limits-for-supreme-court-justices-78381637979,14,1581288760.0,FnordFinder,0.96,/r/uspolitics/comments/f1gohd/yang_we_should_not_have_lifetime_appointments_for/,uspolitics,28979,2
Biden to pardon all prior federal offenses of simple marijuana possession,114,xxdiie,https://www.nbcnews.com/politics/biden-pardon-prior-federal-offenses-simple-marijuana-possession-rcna51088,13,1665083484.0,realplayer16,1.0,/r/uspolitics/comments/xxdiie/biden_to_pardon_all_prior_federal_offenses_of/,uspolitics,28979,2
Rush Limbaugh sold listeners a false reality — and we’re all still paying for it,115,lm5f9r,https://www.mediamatters.org/rush-limbaugh/rush-limbaugh-sold-listeners-false-reality-and-were-all-still-paying-it,10,1613597898.0,bobbelcher,0.93,/r/uspolitics/comments/lm5f9r/rush_limbaugh_sold_listeners_a_false_reality_and/,uspolitics,28979,2
Hedgefunds pressing Biden admin to attack small traders with trading halts.,114,l70489,https://www.reddit.com/r/uspolitics/comments/l70489/hedgefunds_pressing_biden_admin_to_attack_small/,31,1611848593.0,jmaximus,0.96,/r/uspolitics/comments/l70489/hedgefunds_pressing_biden_admin_to_attack_small/,uspolitics,28979,2
Man sues for refund of $2.5m he donated to Trump election challenge group,114,k21jsw,https://www.independent.co.uk/news/world/americas/us-election/fred-eshelman-donald-trump-lawsuit-voter-fraud-b1762554.html?utm_source=reddit.com,9,1606485489.0,Bobinct,0.98,/r/uspolitics/comments/k21jsw/man_sues_for_refund_of_25m_he_donated_to_trump/,uspolitics,28979,2
Trump admits for first time that Biden won election,116,juovqr,https://www.independent.co.uk/news/world/americas/us-politics/trump-biden-election-result-voter-fraud-b1723217.html,18,1605458884.0,CamelsandHippos,0.95,/r/uspolitics/comments/juovqr/trump_admits_for_first_time_that_biden_won/,uspolitics,28979,2
"Former U.S. attorneys — all Republicans — back Biden, saying Trump threatens ‘the rule of law’",114,jj6y0l,https://www.washingtonpost.com/politics/republican-us-attorneys-back-biden/2020/10/27/c1b55702-17fd-11eb-befb-8864259bd2d8_story.html,5,1603823836.0,bobbelcher,0.95,/r/uspolitics/comments/jj6y0l/former_us_attorneys_all_republicans_back_biden/,uspolitics,28979,2
Twitter bans posts wishing for Trump death. The Squad wonders where that policy was for them,110,j4tsu6,https://www.cnn.com/2020/10/03/politics/twitter-trump-policy-ban-the-squad-politics-trnd/index.html,28,1601789571.0,mulutavcocktail,0.95,/r/uspolitics/comments/j4tsu6/twitter_bans_posts_wishing_for_trump_death_the/,uspolitics,28979,2
What Fox News Doesn't Want You To Know: The Nazis weren't left-wing socialists. They were hardcore right-wing capitalists. Hitler was a tax-evading billionaire who used his office to enrich himself. Sound familiar?,115,i2u14x,http://foxhidesthetruth.com,17,1596447143.0,OliverMarkusMalloy,0.89,/r/uspolitics/comments/i2u14x/what_fox_news_doesnt_want_you_to_know_the_nazis/,uspolitics,28979,2
Trump owes tens of millions to the Bank of China — and the loan is due soon,113,g7bba5,https://www.politico.com/news/2020/04/24/trump-biden-china-debt-205475,9,1587745236.0,bobbelcher,0.96,/r/uspolitics/comments/g7bba5/trump_owes_tens_of_millions_to_the_bank_of_china/,uspolitics,28979,2
"As coronavirus crisis worsens, Trump continues his lawsuit to have the entire Affordable Care Act declared unconstitutional, including the protection for Pre-existing conditions",115,fntco0,https://www.cbpp.org/research/health/suit-challenging-aca-legally-suspect-but-threatens-loss-of-coverage-for-millions,16,1585002240.0,Dems4Prez,0.95,/r/uspolitics/comments/fntco0/as_coronavirus_crisis_worsens_trump_continues_his/,uspolitics,28979,2
Republicans blocking coronavirus bill that limits how much drugmakers can charge for vaccine,117,fdfs68,https://www.salon.com/2020/03/03/republicans-blocking-coronavirus-bill-that-limits-how-much-drugmakers-can-charge-for-vaccine-report_partner/,24,1583340492.0,spaceghoti,0.97,/r/uspolitics/comments/fdfs68/republicans_blocking_coronavirus_bill_that_limits/,uspolitics,28979,2
FedEx Won’t Stop Giving NRA Members Discounts,114,80h9i7,https://www.motherjones.com/politics/2018/02/fedex-just-responded-to-gun-control-activists-calling-for-it-to-end-its-partnership-with-the-nra/,29,1519684885.0,bobbelcher,0.87,/r/uspolitics/comments/80h9i7/fedex_wont_stop_giving_nra_members_discounts/,uspolitics,28979,2
Hundreds chant 'Coward!' amid Paul Ryan's Rhode Island visit,110,5xbfzg,http://bigstory.ap.org/article/9c0ffe1a1785469a84fc4fede5cb4a4b/paul-ryan-set-visit-democratic-leaning-rhode-island,4,1488559942.0,HenryCorp,0.82,/r/uspolitics/comments/5xbfzg/hundreds_chant_coward_amid_paul_ryans_rhode/,uspolitics,28979,2
Trump Says He’s ‘Not Going to Partake’ in Being Charged by Special Counsel. That is not how the legal system works.,113,z15arg,https://nymag.com/intelligencer/2022/11/trump-special-counsel-jack-smith-not-going-to-partake-double-jeopardy.html,33,1669053310.0,spaceghoti,0.97,/r/uspolitics/comments/z15arg/trump_says_hes_not_going_to_partake_in_being/,uspolitics,28979,2
"Longtime Trump aide Hope Hicks, who told the embattled former president he lost the 2020 election, is testifying to the Jan. 6 select committee today: report",110,ye8xzs,https://www.businessinsider.com/trump-confidant-hope-hicks-talking-to-jan-6-investigators-tuesday-2022-10,22,1666818330.0,wewewawa,0.96,/r/uspolitics/comments/ye8xzs/longtime_trump_aide_hope_hicks_who_told_the/,uspolitics,28979,2
GOP Rep. Jim Jordan deletes tweet calling the story of a 10-year-old girl being raped 'another lie' after Ohio authorities charged a man in the case,112,vygh7d,https://www.businessinsider.com/jim-jordan-deletes-tweet-10-year-old-abortion-another-lie-2022-7,32,1657753045.0,Bobinct,0.96,/r/uspolitics/comments/vygh7d/gop_rep_jim_jordan_deletes_tweet_calling_the/,uspolitics,28979,2
Fox News viewers have no clue: Network blocks nearly all critical coverage of Donald Trump. Fox News viewers are almost completely in the dark about Trump's Jan. 6 insurrection or the revelations since then.,116,v7teq0,https://www.salon.com/2022/06/08/fox-news-viewers-have-no-clue-network-blocks-nearly-all-critical-coverage-of-donald/,26,1654705092.0,alt_spaceghoti,0.95,/r/uspolitics/comments/v7teq0/fox_news_viewers_have_no_clue_network_blocks/,uspolitics,28979,2
DeSantis refuses to divest Florida of $300 million in Russian investments — but criticizes Biden over Russia and Ukraine,114,t5aq7v,https://www.alternet.org/2022/03/desantis-florida-russia/,13,1646256712.0,BitterFuture,0.98,/r/uspolitics/comments/t5aq7v/desantis_refuses_to_divest_florida_of_300_million/,uspolitics,28979,2
Matt Gaetz gets trolled about his allegations of pedophilia,115,on2saf,https://v.redd.it/onbfz0uw51c71,3,1626653621.0,leeguy01,0.97,/r/uspolitics/comments/on2saf/matt_gaetz_gets_trolled_about_his_allegations_of/,uspolitics,28979,2
"'Not Going to Happen': Progressives Slam McConnell Effort to Sabotage Reconciliation Bill | ""The last person who should have a say on our agenda is Senate MINORITY Leader Mitch McConnell,"" said Rep. Pramila Jayapal.",114,oa99wd,https://www.commondreams.org/news/2021/06/29/not-going-happen-progressives-slam-mcconnell-effort-sabotage-reconciliation-bill,7,1624976548.0,theladynora,0.97,/r/uspolitics/comments/oa99wd/not_going_to_happen_progressives_slam_mcconnell/,uspolitics,28979,2
"California is banning companies from using 'dark patterns,' a sneaky website design that makes things like canceling a subscription frustratingly difficult",112,maai7f,https://www.businessinsider.com/what-are-dark-patterns-2021-3,4,1616373437.0,spaceghoti,1.0,/r/uspolitics/comments/maai7f/california_is_banning_companies_from_using_dark/,uspolitics,28979,2
"Jared Kushner helped create a Trump campaign shell company that secretly paid the president's family members and spent $617 million in reelection cash, a source tells Insider",111,kfrq8l,https://www.businessinsider.com/jared-kushner-trump-campaign-shell-company-family-ammc-lara-2020-12,8,1608319366.0,DonaldWillKillUsAll,0.98,/r/uspolitics/comments/kfrq8l/jared_kushner_helped_create_a_trump_campaign/,uspolitics,28979,2
"Pro-Trump rally chants ""destroy the GOP,"" boos Georgia ""RINOs"" Loeffler and Perdue",113,kbzwe6,https://www.newsweek.com/pro-trump-rally-chants-destroy-gop-boos-georgia-rinos-loeffler-perdue-1554354,31,1607817205.0,Bobinct,0.96,/r/uspolitics/comments/kbzwe6/protrump_rally_chants_destroy_the_gop_boos/,uspolitics,28979,2
Trump's biggest donor wages war against the IRS: Billionaire Robert Mercer's fighting nearly $7 billion in back taxes,114,jz7kk0,https://www.salon.com/2017/05/01/trumps-biggest-donor-wages-war-against-the-irs-billionaire-robert-mercers-fighting-nearly-7-billion-in-back-taxes/,10,1606093101.0,OverByTheEdge,0.98,/r/uspolitics/comments/jz7kk0/trumps_biggest_donor_wages_war_against_the_irs/,uspolitics,28979,2
Ron Perlman Says Lindsey Graham Is ‘Ripe For An Ass Fucking’,112,jww37l,https://www.inquisitr.com/6388143/ron-perlman-lindsey-graham-ripe/,24,1605760294.0,stankmanly,0.93,/r/uspolitics/comments/jww37l/ron_perlman_says_lindsey_graham_is_ripe_for_an/,uspolitics,28979,2
Ex-deputy FBI chief McCabe: Officials had reason to think Trump posed 'danger to national security',112,jrpeo2,https://www.usatoday.com/story/news/politics/2020/11/10/we-did-our-job-ex-fbi-deputy-andrew-mccabe-defend-russia-inquiry/6231684002/,10,1605029813.0,3ustice3,0.98,/r/uspolitics/comments/jrpeo2/exdeputy_fbi_chief_mccabe_officials_had_reason_to/,uspolitics,28979,2
'Friday Night Massacre' at US Postal Service as Postmaster General - a Major Trump Donor - Ousts Top Officials,114,i67aj1,https://www.commondreams.org/news/2020/08/07/friday-night-massacre-us-postal-service-postmaster-general-major-trump-donor-ousts,25,1596922422.0,cos,0.99,/r/uspolitics/comments/i67aj1/friday_night_massacre_at_us_postal_service_as/,uspolitics,28979,2
"'I've run out of tears': Arizona man has lost 5 family members to COVID-19: “How many more people got to die before he does something about it? ...He’s not wearing a face mask. When you’re a great leader, you lead by example,”",113,h8p6fz,https://www.12news.com/article/news/health/coronavirus/valley-man-says-family-has-been-impacted-by-covid-19-calls-for-ducey-to-take-action/75-a107d3a3-2071-4a0d-ab12-98eade8e295a,11,1592118877.0,shallah,0.96,/r/uspolitics/comments/h8p6fz/ive_run_out_of_tears_arizona_man_has_lost_5/,uspolitics,28979,2
Poll: Majority of Americans Now Disapprove of Trump's Coronavirus Response,111,fu957p,https://www.politico.com/news/2020/04/03/poll-majority-of-americans-now-disapprove-of-trumps-coronavirus-response-162854,24,1585923282.0,Dems4Prez,0.92,/r/uspolitics/comments/fu957p/poll_majority_of_americans_now_disapprove_of/,uspolitics,28979,2
"Beto O'Rourke, candidate for US Senate (D-TX) Says ""only one other senator from either party over the last 25 years"" has ""a worse record on bipartisanship"" than Ted Cruz. | TRUE",109,9pcz8g,https://www.politifact.com/texas/statements/2018/oct/18/beto-orourke/beto-orourke-says-ted-cruz-has-second-worst-bipart/,7,1539894719.0,bobbelcher,0.94,/r/uspolitics/comments/9pcz8g/beto_orourke_candidate_for_us_senate_dtx_says/,uspolitics,28979,2
"President Donald Trump: ""We’re making (Medicare) stronger. We’re making Social Security stronger."" | FALSE",114,9dns9t,https://www.politifact.com/truth-o-meter/statements/2018/sep/06/donald-trump/donald-trump-wrongly-says-social-security-and-medi/,10,1536272336.0,bobbelcher,0.88,/r/uspolitics/comments/9dns9t/president_donald_trump_were_making_medicare/,uspolitics,28979,2
Scott Brown says opponents delayed his swearing-in to pass health care law | FALSE,114,7jlioh,http://www.politifact.com/punditfact/statements/2013/nov/12/scott-brown/scott-brown-says-opponents-delayed-his-swearing-pa/,6,1513192170.0,bobbelcher,0.93,/r/uspolitics/comments/7jlioh/scott_brown_says_opponents_delayed_his_swearingin/,uspolitics,28979,2
"Movement to Strip Congress of Their Healthcare Launched, Nearly 1,000,000 Join.",112,66xcql,http://www.bluedotdaily.com/movement-to-strip-congress-of-their-healthcare-launched-nearly-1000000-join/,8,1492884051.0,pheonix200,0.98,/r/uspolitics/comments/66xcql/movement_to_strip_congress_of_their_healthcare/,uspolitics,28979,2
"One-third of Americans unaware ObamaCare, ACA are the same.",112,5sn8ti,http://thehill.com/blogs/blog-briefing-room/news/318297-one-third-of-americans-didnt-know-obamacare-aca-were-same-law,14,1486493298.0,pheonix200,0.85,/r/uspolitics/comments/5sn8ti/onethird_of_americans_unaware_obamacare_aca_are/,uspolitics,28979,2
"A new subreddit dedicated to the Elon Musk jet tracker is one of the fastest-growing pages on the website, with almost 40,000 members in 2 days",115,zo86lk,https://www.insider.com/elonjet-jack-sweeney-twitter-bot-banned-elon-musk-reddit-2022-12,3,1671289564.0,1000000students,0.99,/r/uspolitics/comments/zo86lk/a_new_subreddit_dedicated_to_the_elon_musk_jet/,uspolitics,28979,2
Special master asks Trump team to back up claim FBI planted evidence,113,xlecfv,https://thehill.com/policy/national-security/3656739-special-master-asks-trump-team-to-back-up-claim-fbi-planted-evidence/?,13,1663883076.0,burtzev,0.98,/r/uspolitics/comments/xlecfv/special_master_asks_trump_team_to_back_up_claim/,uspolitics,28979,2
Judge greenlights lawsuit against Colorado Pro-Trump group accused of sending armed vigilantes door-to-door,115,uo03fp,https://www.msn.com/en-us/news/politics/judge-greenlights-lawsuit-against-colorado-pro-trump-group-accused-of-sending-armed-vigilantes-door-to-door/ar-AAXaWCa?ocid=msedgdhp&pc=U531&cvid=7425817bb191472690f74af4ead422a4,1,1652359065.0,northstardim,0.97,/r/uspolitics/comments/uo03fp/judge_greenlights_lawsuit_against_colorado/,uspolitics,28979,2
"Yes, the Trump justices said Roe v. Wade was a precedent in confirmation hearings",112,uj4fup,https://www.politifact.com/factchecks/2022/may/05/don-beyer/yes-trump-justices-said-roe-v-wade-was-precedent-c/,30,1651776894.0,bobbelcher,0.99,/r/uspolitics/comments/uj4fup/yes_the_trump_justices_said_roe_v_wade_was_a/,uspolitics,28979,2
Trump Aide Who Bought the Burner Phones Testifies That Mark Meadows Basically Planned Jan 6,111,tkrw66,https://www.politicalflare.com/2022/03/trump-aide-who-bought-the-burner-phones-testifies-that-mark-meadows-basically-planned-jan-6/,12,1648035336.0,KB_Sez,0.97,/r/uspolitics/comments/tkrw66/trump_aide_who_bought_the_burner_phones_testifies/,uspolitics,28979,2
GOP Removes Page Praising Donald Trump's 'Historic' Peace Deal With Taliban,111,p5f43u,https://www.newsweek.com/gop-removes-webpage-praising-trumps-historic-peace-deal-taliban-1619605,23,1629117068.0,leeguy01,0.98,/r/uspolitics/comments/p5f43u/gop_removes_page_praising_donald_trumps_historic/,uspolitics,28979,2
