title,score,id,url,num_comments,created,author,upvote_ratio,permalink,subreddit,subreddit_subscribers,depth
Elon Burn Ouch 🤕,28370,l7fw2f,https://i.redd.it/qq8q6tcjh6e61.jpg,875,1611885465.0,carpy987654,0.9,/r/teslamotors/comments/l7fw2f/elon_burn_ouch/,teslamotors,2173596,2
Doggo mode. Moose approved.,24534,aunr1m,https://i.imgur.com/lSyEjBy.jpg,455,1551115632.0,mahkus11,0.92,/r/teslamotors/comments/aunr1m/doggo_mode_moose_approved/,teslamotors,2173596,2
Tesla Model X bossing through that flooded area.,23874,d3e42b,https://v.redd.it/cs2zezb368m31,1054,1568321028.0,leonx81,0.92,/r/teslamotors/comments/d3e42b/tesla_model_x_bossing_through_that_flooded_area/,teslamotors,2173596,2
"Elon being sassy to Jalopnik, when they deserved it after trying to call out Elon Musk on Autopilot.",23653,d0ioua,https://i.redd.it/l9h6yj4ezzk31.png,1019,1567786102.0,backstreetatnight,0.85,/r/teslamotors/comments/d0ioua/elon_being_sassy_to_jalopnik_when_they_deserved/,teslamotors,2173596,2
The Race is on!,21994,7luapl,https://i.redd.it/refw1hz96u501.jpg,293,1514106432.0,Geek4lyf,0.92,/r/teslamotors/comments/7luapl/the_race_is_on/,teslamotors,2173596,2
Using Tesla app to melt snow & ice off before leaving the house,21287,lvg29g,https://v.redd.it/rr1rc21fjgk61,952,1614622337.0,skpl,0.88,/r/teslamotors/comments/lvg29g/using_tesla_app_to_melt_snow_ice_off_before/,teslamotors,2173596,2
The Brand New Tesla Model S,20524,l6egn1,https://www.reddit.com/gallery/l6egn1,1912,1611781753.0,rajkhaitan,0.86,/r/teslamotors/comments/l6egn1/the_brand_new_tesla_model_s/,teslamotors,2173596,2
PepsiCo makes biggest public pre-order of Tesla Semis: 100 trucks,17805,7jabhr,https://www.reuters.com/article/pepsico-tesla-orders/pepsico-makes-biggest-public-pre-order-of-tesla-semis-100-trucks-idUSL1N1OB1YR,906,1513080483.0,2050project,0.93,/r/teslamotors/comments/7jabhr/pepsico_makes_biggest_public_preorder_of_tesla/,teslamotors,2173596,2
Happy Thanksgiving r/TeslaMotors!,17558,e37iky,https://i.imgur.com/OHixWyw.jpg,154,1574990674.0,WhiskeySauer,0.91,/r/teslamotors/comments/e37iky/happy_thanksgiving_rteslamotors/,teslamotors,2173596,2
Saw this on a Tesla!,17280,5j29yf,https://i.reddituploads.com/0241b9dd85364f67abd01500aae0833c?fit=max&h=1536&w=1536&s=95ade62a8f3645258fefc6f3bfb8e457,789,1482094069.0,youyouxue,0.89,/r/teslamotors/comments/5j29yf/saw_this_on_a_tesla/,teslamotors,2173596,2
We just drove from San Francisco to New York City in a Tesla Model X without using a single drop of gas!,16991,61yrt5,https://i.redd.it/ht0w7m10x4oy.jpg,1343,1490700696.0,youyouxue,0.83,/r/teslamotors/comments/61yrt5/we_just_drove_from_san_francisco_to_new_york_city/,teslamotors,2173596,2
"Are you ready, world? We're coming for you.",13641,6qo4kl,https://i.redd.it/8fe4j0ieaxcz.jpg,816,1501504552.0,WhiskeySauer,0.84,/r/teslamotors/comments/6qo4kl/are_you_ready_world_were_coming_for_you/,teslamotors,2173596,2
Tesla Semi truck unveil set for September. Team has done an amazing job. Seriously next level.,13221,65738r,https://twitter.com/elonmusk/status/852580027178696704,1270,1492105922.0,ethan829,0.89,/r/teslamotors/comments/65738r/tesla_semi_truck_unveil_set_for_september_team/,teslamotors,2173596,2
Buys a Tesla ONCE.,11819,i0s0s1,https://v.redd.it/hh9bu4ovl1e51,494,1596135939.0,Serpenio_,0.92,/r/teslamotors/comments/i0s0s1/buys_a_tesla_once/,teslamotors,2173596,2
Tesla is no longer allowing remote work [@samnissim],11182,v25ee0,https://i.imgur.com/UPTcDej.jpg,332,1654046853.0,SupaZT,0.91,/r/teslamotors/comments/v25ee0/tesla_is_no_longer_allowing_remote_work_samnissim/,teslamotors,2173596,2
"Elon Musk on Twitter: ""Tesla Semi truck unveil & test ride tentatively scheduled for Oct 26th in Hawthorne. Worth seeing this beast in person. It's unreal.""",11066,6zyelf,https://twitter.com/elonmusk/status/908108029777686528,790,1505344833.0,ethan829,0.92,/r/teslamotors/comments/6zyelf/elon_musk_on_twitter_tesla_semi_truck_unveil_test/,teslamotors,2173596,2
"On this day in 2008: Tesla secures $40 million loan to avoid bankruptcy. Today, its $59 billion market cap makes Tesla the most valuable US automaker. Via @JonErlichman",10758,9tudw8,https://i.redd.it/094waueti4w11.jpg,329,1541254298.0,Geek4lyf,0.92,/r/teslamotors/comments/9tudw8/on_this_day_in_2008_tesla_secures_40_million_loan/,teslamotors,2173596,2
"Elon Musk on Twitter: ""Congrats to the Tesla owner who sacrificed damage to his own car to bring a car with an unconscious driver safely to a stop!""",10205,5ua6vf,https://twitter.com/elonmusk/status/831969536584806400,442,1487192034.0,scottg96,0.92,/r/teslamotors/comments/5ua6vf/elon_musk_on_twitter_congrats_to_the_tesla_owner/,teslamotors,2173596,2
I really like the new Tesla Twitter Account,9991,casm05,https://i.redd.it/4whhwei0y5931.jpg,94,1562628069.0,InquisitorCOC,0.94,/r/teslamotors/comments/casm05/i_really_like_the_new_tesla_twitter_account/,teslamotors,2173596,2
"Neil deGrasse Tyson: Elon Musk is more important than Jeff Bezos, Mark Zuckerberg and Steve Jobs",9625,9yskmd,https://www.cnbc.com/2018/11/19/neil-degrasse-tyson-elon-musk-is-the-most-important-person-in-tech.html?__source=yahoo%7Cfinance%7Cheadline%7Cstory%7C&par=yahoo&yptr=yahoo,610,1542723689.0,jjlew080,0.81,/r/teslamotors/comments/9yskmd/neil_degrasse_tyson_elon_musk_is_more_important/,teslamotors,2173596,2
We just drove from San Francisco to New York City in a Tesla Model 3 without using a single drop of gas!,9528,7nk60k,https://i.redd.it/nxngyefz1l701.jpg,659,1514867725.0,youyouxue,0.88,/r/teslamotors/comments/7nk60k/we_just_drove_from_san_francisco_to_new_york_city/,teslamotors,2173596,2
Bernie Sanders posted about Tesla's Powerpack project in Australia,9422,7fgglh,https://i.imgur.com/cCTKEY3.jpg,926,1511629731.0,scottg96,0.87,/r/teslamotors/comments/7fgglh/bernie_sanders_posted_about_teslas_powerpack/,teslamotors,2173596,2
Tesla Ventilator,9399,fvnnjb,https://youtu.be/zZbDg24dfN0,601,1586128829.0,UsernameINotRegret,0.94,/r/teslamotors/comments/fvnnjb/tesla_ventilator/,teslamotors,2173596,2
Elon: Production unit 1 of Model 3 is now built and going through final checkout. Pics soon.,9348,6m4fg2,https://twitter.com/elonmusk/status/883840893253451780,458,1499559094.0,I_Has_A_Bucket,0.9,/r/teslamotors/comments/6m4fg2/elon_production_unit_1_of_model_3_is_now_built/,teslamotors,2173596,2
"Elon - “Congratulations Tesla team on making our 1,000,000th car!!”",9194,fg6smp,https://twitter.com/elonmusk/status/1237204618850992129?s=21,242,1583807606.0,geniuzdesign,0.95,/r/teslamotors/comments/fg6smp/elon_congratulations_tesla_team_on_making_our/,teslamotors,2173596,2
Spotify secured - Elon Musk on Twitter,9169,cbc4k2,https://i.redd.it/s6xxqz53oe931.png,495,1562733740.0,Sramyaguchi,0.95,/r/teslamotors/comments/cbc4k2/spotify_secured_elon_musk_on_twitter/,teslamotors,2173596,2
Cool Picture of a Model 3 in front of SpaceX,9166,ett734,https://i.redd.it/4hrkxf3hgyc41.jpg,287,1579971372.0,WhiskeySauer,0.95,/r/teslamotors/comments/ett734/cool_picture_of_a_model_3_in_front_of_spacex/,teslamotors,2173596,2
Ford drives a Tesla,9083,motlrr,https://i.redd.it/u0attnksjks61.jpg,257,1618157592.0,InquisitorCOC,0.93,/r/teslamotors/comments/motlrr/ford_drives_a_tesla/,teslamotors,2173596,2
Model 3 orders have opened to the public!,8882,7ei6k5,https://i.redd.it/utmapyf09czz.png,1014,1511274356.0,youyouxue,0.89,/r/teslamotors/comments/7ei6k5/model_3_orders_have_opened_to_the_public/,teslamotors,2173596,2
"Model 3 was top-selling car in US by revenue despite no advertising, no paid endorsements & no discounts. Competitors spent billions on marketing. Model 3 was product alone.",8607,9rc3hc,https://twitter.com/elonmusk/status/1055500063785463808,574,1540486558.0,Geek4lyf,0.91,/r/teslamotors/comments/9rc3hc/model_3_was_topselling_car_in_us_by_revenue/,teslamotors,2173596,2
Model 3 achieves the lowest probability of injury of any vehicle ever tested by NHTSA,8540,9mb1iy,https://www.tesla.com/blog/model-3-lowest-probability-injury-any-vehicle-ever-tested-nhtsa?redirect=no,539,1538965906.0,geniuzdesign,0.93,/r/teslamotors/comments/9mb1iy/model_3_achieves_the_lowest_probability_of_injury/,teslamotors,2173596,2
New Tesla Model S Now the Quickest Production Car in the World -new 100 kWh battery pack: 0-60 in 2.5 secs and 315 miles of range,8290,4z8ahq,https://www.reddit.com/r/teslamotors/comments/4z8ahq/new_tesla_model_s_now_the_quickest_production_car/,1169,1471980638.0,FredTesla,0.91,/r/teslamotors/comments/4z8ahq/new_tesla_model_s_now_the_quickest_production_car/,teslamotors,2173596,2
Here's what happens when a Porsche tries to keep up with a Tesla,8287,6js870,https://www.youtube.com/watch?v=6n4_EMGdRZg,860,1498565292.0,2050project,0.87,/r/teslamotors/comments/6js870/heres_what_happens_when_a_porsche_tries_to_keep/,teslamotors,2173596,2
Tesla introduces $0.40/minute idle fee for Superchargers to incentivise owners to move when charging is over,8280,5irtz5,https://electrek.co/2016/12/16/tesla-supercharger-idle-fees/,827,1481935594.0,annerajb,0.94,/r/teslamotors/comments/5irtz5/tesla_introduces_040minute_idle_fee_for/,teslamotors,2173596,2
"Elon Musk on Twitter: ""Officially verified as the first production electric car to exceed 1000km on a single charge! Congratulations Tesla Owners Italia!!""",8239,6rud8h,https://twitter.com/elonmusk/status/893920554821931008,261,1501968130.0,scottg96,0.93,/r/teslamotors/comments/6rud8h/elon_musk_on_twitter_officially_verified_as_the/,teslamotors,2173596,2
2020 cannot come soon enough. Tesla Roadster out in the wild.,8142,9srpzj,https://i.redd.it/smrrjjy5udv11.jpg,290,1540931236.0,LordZeekos,0.92,/r/teslamotors/comments/9srpzj/2020_cannot_come_soon_enough_tesla_roadster_out/,teslamotors,2173596,2
Tesla overtakes GM as US' most valuable carmaker as TSLA shorts feel $1.4B burn,7900,dmyb3m,https://www.teslarati.com/tesla-tsla-overtakes-gm-1-billion-short-burn/,660,1572014086.0,Sramyaguchi,0.96,/r/teslamotors/comments/dmyb3m/tesla_overtakes_gm_as_us_most_valuable_carmaker/,teslamotors,2173596,2
Happy T-Giving r/Teslamotors!,7820,k1mmft,https://i.imgur.com/WaqpLJz.jpg,73,1606422145.0,WhiskeySauer,0.87,/r/teslamotors/comments/k1mmft/happy_tgiving_rteslamotors/,teslamotors,2173596,2
I will wait patiently...,7775,b0dk8c,https://i.redd.it/eo8i37igdrl21.jpg,136,1552427170.0,SparkyBangBang432,0.96,/r/teslamotors/comments/b0dk8c/i_will_wait_patiently/,teslamotors,2173596,2
"I held ""the ball"" and talked to Senior Reliability Engineer for 30 minutes about the broken glass incident.",7697,e07ln9,https://www.reddit.com/r/teslamotors/comments/e07ln9/i_held_the_ball_and_talked_to_senior_reliability/,740,1574457762.0,WhiskeySauer,0.95,/r/teslamotors/comments/e07ln9/i_held_the_ball_and_talked_to_senior_reliability/,teslamotors,2173596,2
"Ford Mustang towed away with a ticket for ICE-ing the Supercharger in Walnut Creek, CA",7671,ee4xyl,https://www.xautoworld.com/news/mustang-focus-towed-ice-ing/,791,1577021759.0,CarCooler,0.95,/r/teslamotors/comments/ee4xyl/ford_mustang_towed_away_with_a_ticket_for_iceing/,teslamotors,2173596,2
Tesla announces full autonomy hardware (AP 2.0) on all production vehicles starting now [Official Thread - Please keep all posts in here],7673,58dprx,https://www.reddit.com/r/teslamotors/comments/58dprx/tesla_announces_full_autonomy_hardware_ap_20_on/,2244,1476921684.0,FredTesla,0.91,/r/teslamotors/comments/58dprx/tesla_announces_full_autonomy_hardware_ap_20_on/,teslamotors,2173596,2
Tesla power pack? In San Juan Puerto Rico FedEx ramp.,7495,76inbf,https://i.imgur.com/yhLsJgY.jpg,279,1508069933.0,annerajb,0.94,/r/teslamotors/comments/76inbf/tesla_power_pack_in_san_juan_puerto_rico_fedex/,teslamotors,2173596,2
"Tesla CEO Elon Musk meets with President Trump to talk American manufacturing, Ford CEO and other execs are present",7355,5pp089,https://electrek.co/2017/01/23/tesla-ceo-elon-musk-president-donald-trump-american-manufacturing/,659,1485181566.0,annerajb,0.92,/r/teslamotors/comments/5pp089/tesla_ceo_elon_musk_meets_with_president_trump_to/,teslamotors,2173596,2
Another Tesla Solar Roof appears,7317,8839qp,https://i.imgur.com/zG74c3F.jpg,314,1522345200.0,SupaZT,0.96,/r/teslamotors/comments/8839qp/another_tesla_solar_roof_appears/,teslamotors,2173596,2
Someone spotted a Cybertruck on the street.,6873,e2pcbg,https://v.redd.it/ki776lzvib141,608,1574899370.0,leonx81,0.98,/r/teslamotors/comments/e2pcbg/someone_spotted_a_cybertruck_on_the_street/,teslamotors,2173596,2
The Blue Roadster,6850,abajto,https://i.redd.it/vb3sk5au3o721.jpg,106,1546285788.0,LordZeekos,0.94,/r/teslamotors/comments/abajto/the_blue_roadster/,teslamotors,2173596,2
Another amazing story that Tesla makes the one of the safest family cars.,6832,a5zuxt,https://i.redd.it/no0bqoe885421.jpg,611,1544749629.0,leonx81,0.89,/r/teslamotors/comments/a5zuxt/another_amazing_story_that_tesla_makes_the_one_of/,teslamotors,2173596,2
Smart Summon avoids curbs and obstacles,6737,dai8az,https://v.redd.it/v4oewqqy2dp31,351,1569688212.0,SparkyBangBang432,0.96,/r/teslamotors/comments/dai8az/smart_summon_avoids_curbs_and_obstacles/,teslamotors,2173596,2
Tesla Replaced Boeing as America’s Biggest Industrial Company,6651,fhfbb5,https://robbreport.com/motors/cars/tesla-tops-boeing-as-americas-biggest-industrial-company-2904620/,298,1584014889.0,CarCooler,0.96,/r/teslamotors/comments/fhfbb5/tesla_replaced_boeing_as_americas_biggest/,teslamotors,2173596,2
Tesla Tequila : Hidden in plain sight all along in Tesla Showrooms,6455,jqztr8,https://www.reddit.com/gallery/jqztr8,122,1604936398.0,skpl,0.95,/r/teslamotors/comments/jqztr8/tesla_tequila_hidden_in_plain_sight_all_along_in/,teslamotors,2173596,2
Elon: Tesla batteries are currently live & delivering power at 662 locations in Puerto Rico. Team is working 24/7 to activate several hundred more.,6443,8da60b,https://www.reddit.com/r/teslamotors/comments/8da60b/elon_tesla_batteries_are_currently_live/,254,1524093830.0,SupaZT,0.95,/r/teslamotors/comments/8da60b/elon_tesla_batteries_are_currently_live/,teslamotors,2173596,2
"Showing mom and grandma Autopark, now Mom wants a Tesla.",6437,b2zxfa,https://v.redd.it/g75ghcl3x3n21,244,1553014994.0,leonx81,0.97,/r/teslamotors/comments/b2zxfa/showing_mom_and_grandma_autopark_now_mom_wants_a/,teslamotors,2173596,2
White Roadster 2020 spotted,6414,9okrsl,https://i.redd.it/fh0igovzjhs11.png,333,1539668740.0,LordZeekos,0.96,/r/teslamotors/comments/9okrsl/white_roadster_2020_spotted/,teslamotors,2173596,2
"First production cargo trip of the Tesla Semi heavy duty truck, carrying battery packs from the Gigafactory in the Nevada mountains to the car factory in California",6354,82qz5k,https://www.instagram.com/p/BgCJlKbFckb/,459,1520450627.0,jclishman,0.95,/r/teslamotors/comments/82qz5k/first_production_cargo_trip_of_the_tesla_semi/,teslamotors,2173596,2
CYBERTRUCK,6301,nfyevl,https://v.redd.it/4ekhdbtpw0071,115,1621406603.0,hemng,0.92,/r/teslamotors/comments/nfyevl/cybertruck/,teslamotors,2173596,2
Elon on Tesla Battery Day,6290,j3wjgx,https://i.redd.it/xrhl8lry8pq51.png,157,1601652334.0,rajkhaitan,0.94,/r/teslamotors/comments/j3wjgx/elon_on_tesla_battery_day/,teslamotors,2173596,2
No gear shifting needed !!,6233,l6vuiq,https://i.redd.it/ovl5zfyil2e61.jpg,951,1611838378.0,carpy987654,0.9,/r/teslamotors/comments/l6vuiq/no_gear_shifting_needed/,teslamotors,2173596,2
420. Funding secured.,6123,eemba5,https://imgur.com/gallery/seYRele,312,1577116490.0,geniuzdesign,0.93,/r/teslamotors/comments/eemba5/420_funding_secured/,teslamotors,2173596,2
That's cool,6127,nhphhj,https://i.redd.it/3xp5o2vedg071.jpg,995,1621593806.0,hemng,0.78,/r/teslamotors/comments/nhphhj/thats_cool/,teslamotors,2173596,2
Tesla wins U.S. antitrust approval to buy SolarCity,6033,4zir6d,http://www.cnbc.com/2016/08/25/reuters-america-tesla-wins-us-antitrust-approval-to-buy-solarcity.html,257,1472135329.0,ethan829,0.93,/r/teslamotors/comments/4zir6d/tesla_wins_us_antitrust_approval_to_buy_solarcity/,teslamotors,2173596,2
Elon confirms Tesla was not invited to today’s White House event about EVs,5994,oygnzx,https://twitter.com/elonmusk/status/1423156475799683075?s=21,874,1628167120.0,geniuzdesign,0.9,/r/teslamotors/comments/oygnzx/elon_confirms_tesla_was_not_invited_to_todays/,teslamotors,2173596,2
The long Journey,5969,afkw6o,https://i.redd.it/rpu8ib4gw7a21.jpg,84,1547397089.0,Potatochak,0.95,/r/teslamotors/comments/afkw6o/the_long_journey/,teslamotors,2173596,2
Elon - 4000 Tesla cars loading in SF for Europe,5928,ashaxv,https://i.redd.it/5at3xiiw6mh21.jpg,394,1550621024.0,geniuzdesign,0.97,/r/teslamotors/comments/ashaxv/elon_4000_tesla_cars_loading_in_sf_for_europe/,teslamotors,2173596,2
Got my Model 3 a couple of weeks ago. Unbelievable car. Far ahead from any type of competition. 🔥🔥🔥,5917,bamz33,https://i.redd.it/r8eqxah6mxq21.jpg,214,1554681974.0,axlpicanha,0.92,/r/teslamotors/comments/bamz33/got_my_model_3_a_couple_of_weeks_ago_unbelievable/,teslamotors,2173596,2
Took a while for the confirmation but Tesla sent it today!,5826,7gzizj,https://i.redd.it/tvvrfya5qe101.jpg,400,1512176012.0,SEILogistics,0.92,/r/teslamotors/comments/7gzizj/took_a_while_for_the_confirmation_but_tesla_sent/,teslamotors,2173596,2
Roadster 2020.,5793,9kda6c,https://i.redd.it/uaxt5ug75ip11.jpg,234,1538368282.0,Geek4lyf,0.95,/r/teslamotors/comments/9kda6c/roadster_2020/,teslamotors,2173596,2
Here is another Model Y in the wild. She’s a beauty!,5762,fbi1gg,https://i.redd.it/ztu4ohn94xj41.jpg,179,1583006070.0,geniuzdesign,0.95,/r/teslamotors/comments/fbi1gg/here_is_another_model_y_in_the_wild_shes_a_beauty/,teslamotors,2173596,2
Autopilot cheat device...just kidding,5717,nchgqh,https://i.imgur.com/R2e2v7X.jpg,223,1621022248.0,mahkus11,0.92,/r/teslamotors/comments/nchgqh/autopilot_cheat_devicejust_kidding/,teslamotors,2173596,2
This....gonna be interesting.,5627,a54dby,https://i.redd.it/qjigq0befl321.jpg,281,1544509901.0,Potatochak,0.96,/r/teslamotors/comments/a54dby/thisgonna_be_interesting/,teslamotors,2173596,2
Tesla teardown finds electronics 6 years ahead of Toyota and VW,5549,f56ajz,https://asia.nikkei.com/Business/Automobiles/Tesla-teardown-finds-electronics-6-years-ahead-of-Toyota-and-VW2,680,1581931547.0,UsernameINotRegret,0.94,/r/teslamotors/comments/f56ajz/tesla_teardown_finds_electronics_6_years_ahead_of/,teslamotors,2173596,2
"Elon Musk on Twitter - ""Am considering taking Tesla private at $420. Funding secured. """,5431,95dbh4,https://twitter.com/elonmusk/status/1026872652290379776,1667,1533660535.0,jclishman,0.92,/r/teslamotors/comments/95dbh4/elon_musk_on_twitter_am_considering_taking_tesla/,teslamotors,2173596,2
Tesla victorious in Rhode Island after state approves license to sell direct,5418,7pnjbm,https://www.teslarati.com/tesla-approved-sell-direct-warwick-rhode-island/,176,1515670882.0,2050project,0.96,/r/teslamotors/comments/7pnjbm/tesla_victorious_in_rhode_island_after_state/,teslamotors,2173596,2
"Just had a $12,000 breakdown with my diesel truck. I can’t wait for my Tesla Semi.",5399,827dwk,https://i.imgur.com/WhYEixw.jpg,381,1520269111.0,SEILogistics,0.94,/r/teslamotors/comments/827dwk/just_had_a_12000_breakdown_with_my_diesel_truck_i/,teslamotors,2173596,2
Model 3 interface while Supercharging,5317,6iqtps,https://i.redd.it/cr473i6u445z.jpg,572,1498100639.0,youyouxue,0.92,/r/teslamotors/comments/6iqtps/model_3_interface_while_supercharging/,teslamotors,2173596,2
What do ya think? Electric rain,5255,buqpp4,https://i.redd.it/e2q6559h8b131.jpg,94,1559205339.0,backstreetatnight,0.96,/r/teslamotors/comments/buqpp4/what_do_ya_think_electric_rain/,teslamotors,2173596,2
A wild Elon appeared in a Tesla showroom https://mobile.twitter.com/brawong/status/1043680776989040640,5175,9i61e5,https://i.redd.it/tlbmdi9l7xn11.jpg,180,1537679001.0,Potatochak,0.92,/r/teslamotors/comments/9i61e5/a_wild_elon_appeared_in_a_tesla_showroom/,teslamotors,2173596,2
Charging your @Tesla while being awed by the Milky Way… Priceless,5176,cje7eg,https://i.redd.it/8a345oykz9d31.jpg,152,1564420417.0,axlpicanha,0.96,/r/teslamotors/comments/cje7eg/charging_your_tesla_while_being_awed_by_the_milky/,teslamotors,2173596,2
RIP Vern Troyer,5043,8dycg1,https://imgur.com/gallery/vpUOl,73,1524342235.0,jjlew080,0.9,/r/teslamotors/comments/8dycg1/rip_vern_troyer/,teslamotors,2173596,2
Model Y going through body shop,4979,lcu4h0,https://v.redd.it/4tkvod1yujf61,176,1612483247.0,rajkhaitan,0.97,/r/teslamotors/comments/lcu4h0/model_y_going_through_body_shop/,teslamotors,2173596,2
Elon Musk says Tesla Pickup Truck Looks more 'Blade Runner-esque' than Fan Rendering,4975,dfz9pg,https://electrek.co/2019/10/10/tesla-pickup-truck-blade-runneresque-than-elon-musk/,694,1570719705.0,UGot2Handit2Leprecns,0.96,/r/teslamotors/comments/dfz9pg/elon_musk_says_tesla_pickup_truck_looks_more/,teslamotors,2173596,2
"Cracked Windshield, Missing Hood....Blood on the Bumper",4967,hurnox,https://i.redd.it/pqt038d2b2c51.jpg,381,1595272641.0,Serpenio_,0.98,/r/teslamotors/comments/hurnox/cracked_windshield_missing_hoodblood_on_the_bumper/,teslamotors,2173596,2
"Elon: 7000 cars, 7 days ♥️ Tesla Team ♥️",4963,8vcszr,https://twitter.com/elonmusk/status/1013519243030253570,453,1530476815.0,I_Has_A_Bucket,0.87,/r/teslamotors/comments/8vcszr/elon_7000_cars_7_days_tesla_team/,teslamotors,2173596,2
Hawkeye from the Avengers drives a Tesla Model S,4947,bv82so,https://v.redd.it/7pqxz42a2k131,431,1559312278.0,UGot2Handit2Leprecns,0.86,/r/teslamotors/comments/bv82so/hawkeye_from_the_avengers_drives_a_tesla_model_s/,teslamotors,2173596,2
Model 3 is going Pac-Man on the mid size luxury market!,4924,9l22fu,https://i.redd.it/1g926511mzp11.png,415,1538579777.0,LordZeekos,0.92,/r/teslamotors/comments/9l22fu/model_3_is_going_pacman_on_the_mid_size_luxury/,teslamotors,2173596,2
Elon - Giga Berlin,4906,hrhytf,https://i.redd.it/vxnqafxvkya51.jpg,196,1594791663.0,geniuzdesign,0.97,/r/teslamotors/comments/hrhytf/elon_giga_berlin/,teslamotors,2173596,2
