title,score,id,url,num_comments,created,author,upvote_ratio,permalink,subreddit,subreddit_subscribers,depth
"Australia to introduce a travel ban on ALL NON-CITIZENS AND PERMANENT RESIDENTS entering Australia. Ban in place from 9pm Friday. From then, if you're not a citizen, a permanent resident, or a direct family member thereof, you can't come in to Australia.",9674,fl4aa9,https://twitter.com/callapilla/status/1240502646743511040,1063,1584593983.0,psylenced,0.97,/r/australia/comments/fl4aa9/australia_to_introduce_a_travel_ban_on_all/,australia,1148866,2
Proud of my 200th donation with Australian Red Cross Lifeblood!,9566,e5odne,https://i.redd.it/dis37w56ph241.jpg,473,1575409999.0,stumcm,0.96,/r/australia/comments/e5odne/proud_of_my_200th_donation_with_australian_red/,australia,1148866,2
$400 worth of popcorn accidentally dumped at our local cinema,9452,9tgelp,https://i.imgur.com/2omaKb2.jpg,200,1541127882.0,outdatedopinion,0.91,/r/australia/comments/9tgelp/400_worth_of_popcorn_accidentally_dumped_at_our/,australia,1148866,2
I don't hold a job [Matt Golding cartoon 22/5/2022],9438,uvo9vx,https://i.redd.it/y0eht5s5g4191.jpg,233,1653266421.0,stumcm,0.96,/r/australia/comments/uvo9vx/i_dont_hold_a_job_matt_golding_cartoon_2252022/,australia,1148866,2
"""I've just learned not to care""",9412,ej3z9c,https://v.redd.it/gqjuguiagf841,807,1577997897.0,SydneyTom,0.96,/r/australia/comments/ej3z9c/ive_just_learned_not_to_care/,australia,1148866,2
George Pell has reportedly died,9335,108n9n3,https://imgur.com/a/TIfL408,2569,1673390034.0,eye_snot,0.91,/r/australia/comments/108n9n3/george_pell_has_reportedly_died/,australia,1148866,2
"Today I learned that Australia has 0.3% of the world's population, and 18% of its poker machines (also known as slot or fruit machines). We have 76% of the world's poker machines situated in non-gaming venues (e.g. clubs and pubs).",9276,ai5lcw,http://www.tai.org.au/sites/defualt/files/Pokies%20pub%20test%20FINAL.pdf,823,1548039119.0,lapapinton,0.96,/r/australia/comments/ai5lcw/today_i_learned_that_australia_has_03_of_the/,australia,1148866,2
Lake Conjola NSW - NYE and Today,9273,f1gygf,https://i.redd.it/8uz4zq90dzf41.jpg,183,1581289925.0,tvr190,0.98,/r/australia/comments/f1gygf/lake_conjola_nsw_nye_and_today/,australia,1148866,2
The AEC reports that a record percentage of 18-24s have enrolled the vote for the 2019 federal election,9195,bgazfr,https://i.imgur.com/YVdMQYa.jpg,1068,1555987201.0,thedigisup,0.96,/r/australia/comments/bgazfr/the_aec_reports_that_a_record_percentage_of_1824s/,australia,1148866,2
"Monkey see, monkey do",9134,lqv5ft,https://i.redd.it/0mlxdcoy1bj61.jpg,117,1614120003.0,nath1234,0.96,/r/australia/comments/lqv5ft/monkey_see_monkey_do/,australia,1148866,2
"Central West NSW in Dec, May, and August.",9105,iefhvz,https://i.redd.it/04u6pfrfvii51.jpg,177,1598088285.0,LadderOne,0.98,/r/australia/comments/iefhvz/central_west_nsw_in_dec_may_and_august/,australia,1148866,2
"Was watching the new Netflix doco on weird sports (Home game), spotted this guy from the democratic republic of Congo",9085,hgog93,https://i.imgur.com/YVNnALX.jpg,155,1593238957.0,eye_snot,0.97,/r/australia/comments/hgog93/was_watching_the_new_netflix_doco_on_weird_sports/,australia,1148866,2
"Non-consensually removing a condom during sex — an act known as ""stealthing"" — is set to be criminalised in South Australia, with those found guilty facing penalties of up to life imprisonment.",9056,ykj0sd,https://www.abc.net.au/news/2022-11-03/stealthing-non-consensual-removal-of-condom-outlawed-in-sa/101607588,1125,1667426422.0,diabolical_cunt,0.95,/r/australia/comments/ykj0sd/nonconsensually_removing_a_condom_during_sex_an/,australia,1148866,2
"Adam Bandt on Twitter: Tomorrow, the Greens-initiated Media Diversity Inquiry will investigate the excessive power of Murdoch's media empire - thanks to 500k+ of you who signed Australia's largest petition. Murdoch and the Liberals are far too cosy - it's time to fight back against the billionaires.",9028,lmca2l,https://twitter.com/adambandt/status/1362233278212661252?s=21,438,1613617896.0,thedigisup,0.96,/r/australia/comments/lmca2l/adam_bandt_on_twitter_tomorrow_the/,australia,1148866,2
"Yesterday, Michaelia Cash told the ABC that she could live on the $40 a day the unemployed do, because she did the same thing backpacking. Her nonsense highlights an obvious fact: they don’t get it.",8977,8hj19s,http://thebigsmoke.com.au/2018/05/07/cash-moves-everything-around-her-welfare-point-including-reality/,884,1525647721.0,2littleducks,0.94,/r/australia/comments/8hj19s/yesterday_michaelia_cash_told_the_abc_that_she/,australia,1148866,2
PRESS F FOR FREE SPEECH - Michael West,8986,o09pxm,https://youtu.be/7SW3f7ysWK4,684,1623747048.0,Grantusmcgrant,0.96,/r/australia/comments/o09pxm/press_f_for_free_speech_michael_west/,australia,1148866,2
