title,score,id,url,num_comments,created,author,upvote_ratio,permalink,subreddit,subreddit_subscribers,depth
"After multiple redesigns, I finally finished the ultrasonic sensor adapter for my spider robot. I now have a robot that walks like a spider and sees like a bat !",524,lve67q,https://i.redd.it/pdsk19c96gk61.jpg,35,1614617829.0,SpacecadetShep,0.99,/r/robotics/comments/lve67q/after_multiple_redesigns_i_finally_finished_the/,robotics,199170,3
Nearly done,522,l3ikss,https://v.redd.it/6s9wugw4u4d61,26,1611430130.0,SMD_Human,0.99,/r/robotics/comments/l3ikss/nearly_done/,robotics,199170,3
[N] Chinese Calligraphy with a robotic arm,526,efcxuq,https://v.redd.it/3zwfk5h6zp641,21,1577254193.0,aNormalChinese,0.98,/r/robotics/comments/efcxuq/n_chinese_calligraphy_with_a_robotic_arm/,robotics,199170,3
[M] Mechanical jellyfish in Action,522,d1r1jd,https://i.imgur.com/Xw90ue2.gifv,18,1568036406.0,panosip,0.99,/r/robotics/comments/d1r1jd/m_mechanical_jellyfish_in_action/,robotics,199170,3
keeping the cat buisy,512,xa1jrg,https://v.redd.it/8byaywhmavm91,20,1662744926.0,liiamarl,0.99,/r/robotics/comments/xa1jrg/keeping_the_cat_buisy/,robotics,199170,3
Neat implementation,517,meuqed,https://i.imgur.com/ds6cRTF.gifv,16,1616906877.0,SmittyMcSmitherson,0.99,/r/robotics/comments/meuqed/neat_implementation/,robotics,199170,3
Roger v3 is almost complete!!,515,fpruxe,https://i.redd.it/hwt6q7lhp5p41.jpg,32,1585289311.0,gjs31,1.0,/r/robotics/comments/fpruxe/roger_v3_is_almost_complete/,robotics,199170,3
Hexapod Robot Inverse Kinematics Visualizer version 2 (It's so much faster now),510,hhlana,https://v.redd.it/hsj3khugip751,36,1593374523.0,mikasarei,1.0,/r/robotics/comments/hhlana/hexapod_robot_inverse_kinematics_visualizer/,robotics,199170,3
"My hexapod evolved! A single handmade PCB, radio control via an NRF24L01 and upgraded servos to CS-929MGs.",505,z28lsd,https://v.redd.it/945hh86u4l1a1,27,1669159320.0,KdogGboii,0.99,/r/robotics/comments/z28lsd/my_hexapod_evolved_a_single_handmade_pcb_radio/,robotics,199170,3
[D] The coolest robot at Maker Faire Tokyo 2019?,508,d1thko,https://v.redd.it/jbxlvlg7lll31,19,1568047764.0,moverstreet007,1.0,/r/robotics/comments/d1thko/d_the_coolest_robot_at_maker_faire_tokyo_2019/,robotics,199170,3
Johan Link (@joohanlink),502,hwzy89,https://v.redd.it/yfwr5ig2hsc51,21,1595589467.0,wikidot,0.98,/r/robotics/comments/hwzy89/johan_link_joohanlink/,robotics,199170,3
Robotic 3D Spatial Printing/Sculpting. More info + a link to the full video / project in the comments.,501,uv6l1a,https://v.redd.it/f5s7pv41o6091,14,1653207525.0,rieskriek,0.99,/r/robotics/comments/uv6l1a/robotic_3d_spatial_printingsculpting_more_info_a/,robotics,199170,3
"3D printed mounts for a basket, digital long-range FPV and 360º cameras and ran some lockdown errands with my Diablo robot platform.",501,w6inz8,https://v.redd.it/r3k6yo31wed91,84,1658623029.0,SexyCyborg,0.89,/r/robotics/comments/w6inz8/3d_printed_mounts_for_a_basket_digital_longrange/,robotics,199170,3
[M] This is how my Robot Vacuum finds its way around,501,d0m7kh,https://gfycat.com/lividjampackedakitainu,32,1567802151.0,panosip,0.99,/r/robotics/comments/d0m7kh/m_this_is_how_my_robot_vacuum_finds_its_way_around/,robotics,199170,3
"[M] Made a Video with my 3D printed robot, like KIRA. That’s the footage right from the robotarm, no postprocessing at all!",498,dg3is1,https://v.redd.it/nm4zdxvdqrr31,47,1570737171.0,Centauri24,0.99,/r/robotics/comments/dg3is1/m_made_a_video_with_my_3d_printed_robot_like_kira/,robotics,199170,3
"My dynamixel robot arm is moving ! Still a lot of tuning and programming left, but it looks promising !",492,seaiau,https://v.redd.it/c6xav4o61be81,24,1643322332.0,liiamarl,1.0,/r/robotics/comments/seaiau/my_dynamixel_robot_arm_is_moving_still_a_lot_of/,robotics,199170,3
"Calculating belt lengths in CAD is tedious, so I created a simple calculator for myself and all you robot makers out there! Link in comments.",488,s0sjwp,https://i.imgur.com/BOCHyPE.png,21,1641843698.0,MGRS-Design,0.99,/r/robotics/comments/s0sjwp/calculating_belt_lengths_in_cad_is_tedious_so_i/,robotics,199170,3
First test on my 3D printed 6dof robotic arm,485,zu7hxi,https://v.redd.it/tbv4iyfxst7a1,25,1671878978.0,ganacbicnio,0.99,/r/robotics/comments/zu7hxi/first_test_on_my_3d_printed_6dof_robotic_arm/,robotics,199170,3
[N]Skygauge Robotics,481,ebzcu2,https://v.redd.it/e7n7ew69h8541,54,1576605940.0,wikidot,0.99,/r/robotics/comments/ebzcu2/nskygauge_robotics/,robotics,199170,3
New update for my Robodog project,480,kogaqm,https://v.redd.it/69jhjp4hjr861,43,1609526087.0,SMD_Human,0.99,/r/robotics/comments/kogaqm/new_update_for_my_robodog_project/,robotics,199170,3
[WIP] Rover damping and motors first tests,479,x4un9v,https://v.redd.it/4tigc9vrcnl91,48,1662212264.0,p_tobias,0.99,/r/robotics/comments/x4un9v/wip_rover_damping_and_motors_first_tests/,robotics,199170,3
"Modular snake robot by Biorobotics Lab, CMU.",475,rdmhew,https://v.redd.it/3tzxcyzxjs481,23,1639181055.0,Sid_03,0.99,/r/robotics/comments/rdmhew/modular_snake_robot_by_biorobotics_lab_cmu/,robotics,199170,3
still awful but hopefully wont stay so,478,kp6phv,https://v.redd.it/lp4b1d2mpz861,38,1609624660.0,mikasarei,0.99,/r/robotics/comments/kp6phv/still_awful_but_hopefully_wont_stay_so/,robotics,199170,3
The Dronut X1 is a bi-rotor ducted drone powered by Cleo Robotics' patented thrust vectoring technology. More info + a link to the full video in the comments.,474,v1k2rt,https://v.redd.it/vj1vve7jbi291,28,1653979198.0,rieskriek,0.99,/r/robotics/comments/v1k2rt/the_dronut_x1_is_a_birotor_ducted_drone_powered/,robotics,199170,3
Upgraded Knee Gears > Reattached legs to torso,477,yqb9ep,https://v.redd.it/zb719z7pivy91,38,1667977084.0,Lavish_Gupta,1.0,/r/robotics/comments/yqb9ep/upgraded_knee_gears_reattached_legs_to_torso/,robotics,199170,3
"Update to the 14yo project, it moves!",470,r9p9nz,https://v.redd.it/zothrbepfs381,35,1638738013.0,Deep_Fry_Daddy,0.99,/r/robotics/comments/r9p9nz/update_to_the_14yo_project_it_moves/,robotics,199170,3
"Meet SLink1. I designed this 3D printed, 6DoF robot arm for my bachelor’s thesis in mechatronics.",474,o1s2bu,https://v.redd.it/hqdc2pf5cs571,48,1623917904.0,MGRS-Design,0.99,/r/robotics/comments/o1s2bu/meet_slink1_i_designed_this_3d_printed_6dof_robot/,robotics,199170,3
A prototype of my latest project : a robot that responds to American Sign Language commands. I use a Circuit Playground for hand tracking and I added flex sensors for finger tracking!,473,jnj0tn,https://v.redd.it/58z8tfjec3x51,24,1604438128.0,SpacecadetShep,0.98,/r/robotics/comments/jnj0tn/a_prototype_of_my_latest_project_a_robot_that/,robotics,199170,3
"Update on my spider robot: using an ultrasonic sensor, I can now make the robot stop whenever it gets too close to an object.",466,lxodtl,https://v.redd.it/9l2uobusd1l61,44,1614874821.0,SpacecadetShep,0.99,/r/robotics/comments/lxodtl/update_on_my_spider_robot_using_an_ultrasonic/,robotics,199170,3
Creating Fake Timelapse with A 4K light on a Staubli Robot sync’d to 4-Axis Camera Moco for NF ‘Time’,460,s8qi1p,https://v.redd.it/s7u7jexf6wc81,13,1642705877.0,RiteMediaGroup,1.0,/r/robotics/comments/s8qi1p/creating_fake_timelapse_with_a_4k_light_on_a/,robotics,199170,3
"Will Jackson, Founder of Engineered Arts- Soft Robotics Podcast",461,11cw3eg,https://v.redd.it/y2lg6ma49mka1,54,1677453603.0,meldiwin,0.98,/r/robotics/comments/11cw3eg/will_jackson_founder_of_engineered_arts_soft/,robotics,199170,3
It’s so much fun when it starts to look like a robot. Legs in process for Grayhound v7. I’m close!,452,nux6kn,https://i.redd.it/t2qq9t5s8z371.jpg,25,1623129833.0,graybotics,1.0,/r/robotics/comments/nux6kn/its_so_much_fun_when_it_starts_to_look_like_a/,robotics,199170,3
hows my robot lawn mower looking ? specs in the comments massive solo project,455,n3p97m,https://v.redd.it/42ryxzp0juw61,51,1620021916.0,extradrys,1.0,/r/robotics/comments/n3p97m/hows_my_robot_lawn_mower_looking_specs_in_the/,robotics,199170,3
Here's my spider-man robot (sort of) swinging more like it's supposed to this time!,443,p9e5uo,https://v.redd.it/kp8tzro3cxi71,17,1629645127.0,adam_beedle,0.99,/r/robotics/comments/p9e5uo/heres_my_spiderman_robot_sort_of_swinging_more/,robotics,199170,3
Internal eccentrically cycloidal gearing,447,tuorde,https://v.redd.it/miecixx5l5r81,48,1648921749.0,roTechnica,0.99,/r/robotics/comments/tuorde/internal_eccentrically_cycloidal_gearing/,robotics,199170,3
It likes to stare at balls (pink ones in particular),451,t15sao,https://v.redd.it/06osqnaaszj81,19,1645800633.0,HydrogenCyanideHCN,0.99,/r/robotics/comments/t15sao/it_likes_to_stare_at_balls_pink_ones_in_particular/,robotics,199170,3
Hexapod Robot Inverse Kinematics Solver for the Web,448,g2nczo,https://v.redd.it/ql4mv8wss8t41,28,1587070260.0,mikasarei,0.99,/r/robotics/comments/g2nczo/hexapod_robot_inverse_kinematics_solver_for_the/,robotics,199170,3
That last move nailed it.,450,h01u0g,https://i.redd.it/z6xxstyosz351.gif,8,1591755521.0,aNormalChinese,0.98,/r/robotics/comments/h01u0g/that_last_move_nailed_it/,robotics,199170,3
Brain-controlled human-like robot arm created at Hiroshi Ishiguro Laboratory,438,lhon0h,https://v.redd.it/u2cels4fbdg61,29,1613061710.0,Parth_varma,1.0,/r/robotics/comments/lhon0h/braincontrolled_humanlike_robot_arm_created_at/,robotics,199170,3
[M] I use brain controlled robots to excite students about science and engineering. Here's footage from an outreach session I did last year !,440,ep9n9s,https://v.redd.it/rhzyitaxq0b41,27,1579127381.0,SpacecadetShep,0.99,/r/robotics/comments/ep9n9s/m_i_use_brain_controlled_robots_to_excite/,robotics,199170,3
Free CAD of this little guy from Stanford,441,hmu1iq,https://v.redd.it/3fa31bk4md951,26,1594126617.0,dmalawey,1.0,/r/robotics/comments/hmu1iq/free_cad_of_this_little_guy_from_stanford/,robotics,199170,3
[D] Method-3 walking demo!,430,cznvbb,https://v.redd.it/juacy8kh2mk31,74,1567617658.0,moverstreet007,0.98,/r/robotics/comments/cznvbb/d_method3_walking_demo/,robotics,199170,3
Collaborative Robotic Machine Tending installation I did a while back - complete with dance music.,436,k1ndwn,https://v.redd.it/2xw5wikmfn161,63,1606424726.0,SmashAndCAD,1.0,/r/robotics/comments/k1ndwn/collaborative_robotic_machine_tending/,robotics,199170,3
"Finally wrote enough code to get it moving, now time for ROS",434,krcb39,https://v.redd.it/5xpu8lb10m961,51,1609894115.0,Brilliant_Intention,1.0,/r/robotics/comments/krcb39/finally_wrote_enough_code_to_get_it_moving_now/,robotics,199170,3
Low frequency servo/imu position control loop,427,ywegj6,https://v.redd.it/g6chxsq6j70a1,31,1668558393.0,Lavish_Gupta,1.0,/r/robotics/comments/ywegj6/low_frequency_servoimu_position_control_loop/,robotics,199170,3
First 2 joints working on my new robot arm for camera movements!,430,u7vrrn,https://v.redd.it/s6883rd8kou81,41,1650459025.0,roTechnica,1.0,/r/robotics/comments/u7vrrn/first_2_joints_working_on_my_new_robot_arm_for/,robotics,199170,3
I made an automatic water alarm clock to wake my brother :),433,rj80wo,https://v.redd.it/brf38m6v3b681,7,1639835867.0,TrashRobotics,0.99,/r/robotics/comments/rj80wo/i_made_an_automatic_water_alarm_clock_to_wake_my/,robotics,199170,3
Where can I get the Festo dream penguin?,432,pq0r9i,https://v.redd.it/5sumh7zhlyn71,7,1631887386.0,dmalawey,1.0,/r/robotics/comments/pq0r9i/where_can_i_get_the_festo_dream_penguin/,robotics,199170,3
Two stage planetary gear for my robotarm,428,w1gu66,https://v.redd.it/w3e9ff76w6c91,17,1658090296.0,The_Scienceman,0.99,/r/robotics/comments/w1gu66/two_stage_planetary_gear_for_my_robotarm/,robotics,199170,3
teaching a robot to balance,430,uhz6um,https://v.redd.it/q4e4p2xt6ex81,17,1651640995.0,departedmessenger,0.99,/r/robotics/comments/uhz6um/teaching_a_robot_to_balance/,robotics,199170,3
This is Corporación Robot. Robotic mask for halloween. Self desing.,430,tw81ya,https://v.redd.it/73xulxqttjr81,15,1649094076.0,corporacionRobot,0.99,/r/robotics/comments/tw81ya/this_is_corporación_robot_robotic_mask_for/,robotics,199170,3
"So, I got a new toy.",429,geha5p,https://i.redd.it/wd0laknxc4x41.jpg,47,1588759931.0,thetoillmainn,0.99,/r/robotics/comments/geha5p/so_i_got_a_new_toy/,robotics,199170,3
"Found the video of a robot I made when I was 14 which was also my first ever ""successful"" robot. Thought I'd share it here.",424,fsdbut,https://v.redd.it/mlqa48ggk0q41,18,1585662971.0,HydrogenCyanideHCN,0.99,/r/robotics/comments/fsdbut/found_the_video_of_a_robot_i_made_when_i_was_14/,robotics,199170,3
"Octopus-inspired robot can grip, move, and manipulate a wide range of objects",426,hyuxaa,https://v.redd.it/zm4dgwhn9fd51,23,1595865455.0,Parth_varma,0.99,/r/robotics/comments/hyuxaa/octopusinspired_robot_can_grip_move_and/,robotics,199170,3
"Humanoid robot (Ameca) with hyper realistic facial expressions, by Engineered Arts UK",420,r89o9w,https://v.redd.it/dubexl5t3c381,38,1638567062.0,Sid_03,0.98,/r/robotics/comments/r89o9w/humanoid_robot_ameca_with_hyper_realistic_facial/,robotics,199170,3
Build robots. Serve humans. Solve puzzles. We're making a robotics sandbox game called RoboCo – here's the latest look!,424,lpnh0d,https://v.redd.it/53f9bivvx0j61,27,1613998909.0,RoboCoGame,0.96,/r/robotics/comments/lpnh0d/build_robots_serve_humans_solve_puzzles_were/,robotics,199170,3
"Got rotation around it’s axis working on my robot. The mechanism is a printed set of worm gears, so it is quite noisy, but i am still happy. I was testing this by just hooking the motor up to a 3d printers driver board, i now have to order some proper driver circuits for Nema17. any recomendations?",424,10q9sw6,https://v.redd.it/t4m2sp9iehfa1,22,1675197610.0,Personalitysphere,1.0,/r/robotics/comments/10q9sw6/got_rotation_around_its_axis_working_on_my_robot/,robotics,199170,3
Surgical gantry built by (possibly underaged) crackhead,422,g9qgr1,https://www.youtube.com/watch?v=A_BlNA7bBxo,45,1588091539.0,hwillis,0.96,/r/robotics/comments/g9qgr1/surgical_gantry_built_by_possibly_underaged/,robotics,199170,3
"OBI, A Robot that provides independent dining experience for the ones with severe disabilities / Via: Interesting Engineering",424,inp4ty,https://v.redd.it/yh6c5nmz1kl51,14,1599410224.0,TheInsaneApp,0.98,/r/robotics/comments/inp4ty/obi_a_robot_that_provides_independent_dining/,robotics,199170,3
"8 cable, 6 axis ball balancing PID demo (seen on /r/all)",425,7708h6,https://gfycat.com/EnragedFickleCommongonolek,42,1508262321.0,i-make-robots,0.97,/r/robotics/comments/7708h6/8_cable_6_axis_ball_balancing_pid_demo_seen_on/,robotics,199170,3
NASA's Valkyrie Robot testing,416,idxww3,https://v.redd.it/vksgm98ko9i51,27,1598020672.0,Parth_varma,1.0,/r/robotics/comments/idxww3/nasas_valkyrie_robot_testing/,robotics,199170,3
looks payload-ready and super smooth! A unique chassis.,426,hfgw3p,https://v.redd.it/m4l65j3s6x651,16,1593065336.0,dmalawey,0.99,/r/robotics/comments/hfgw3p/looks_payloadready_and_super_smooth_a_unique/,robotics,199170,3
"[D] The Gundam robot in Yokohama , Japan is moving!",417,hgalvk,https://v.redd.it/colb7mq25a751,56,1593188310.0,moverstreet007,0.98,/r/robotics/comments/hgalvk/d_the_gundam_robot_in_yokohama_japan_is_moving/,robotics,199170,3
I finally taught my robot dog to walk after a lot of tinkering around with the code! 🤖🐶,422,t5jnep,https://v.redd.it/7087qummn3l81,30,1646283482.0,bewildered_astronaut,1.0,/r/robotics/comments/t5jnep/i_finally_taught_my_robot_dog_to_walk_after_a_lot/,robotics,199170,3
I made a robot leg and animated it with basic IK,420,yxpyvb,https://v.redd.it/ux6r9b09hi0a1,33,1668690921.0,KdogGboii,1.0,/r/robotics/comments/yxpyvb/i_made_a_robot_leg_and_animated_it_with_basic_ik/,robotics,199170,3
"One last look at Grayhound before “final” wiring begins. Currently writing up my belt tensioner mechanism’ endeavor in more detail, let’s just say we are mechanically mostly dialed finally (for now!)",416,o08xe3,https://www.reddit.com/gallery/o08xe3,53,1623743609.0,graybotics,0.99,/r/robotics/comments/o08xe3/one_last_look_at_grayhound_before_final_wiring/,robotics,199170,3
The queen of shitty robots has a (benign) brain tumor :(,418,8g0u8r,https://www.youtube.com/watch?v=tpa4kp4lK60,27,1525106485.0,hwillis,0.95,/r/robotics/comments/8g0u8r/the_queen_of_shitty_robots_has_a_benign_brain/,robotics,199170,3
"Yes, I am a mad scientist. Grayhound is so close to pupper level walking. Wire management/engineering is the goal this month.",415,osj4dx,https://i.redd.it/wd2dpz97zpd71.jpg,34,1627376125.0,graybotics,0.98,/r/robotics/comments/osj4dx/yes_i_am_a_mad_scientist_grayhound_is_so_close_to/,robotics,199170,3
And now we play in the Cartesian garden ䷪䷢,419,lixx65,https://v.redd.it/td2zglh0y7h61,25,1613211000.0,Lavish_Gupta,0.99,/r/robotics/comments/lixx65/and_now_we_play_in_the_cartesian_garden/,robotics,199170,3
Prototype of my new self balancing robot project using Lego,408,ungvcl,https://v.redd.it/md0hurzz6wy81,16,1652294733.0,bewildered_astronaut,1.0,/r/robotics/comments/ungvcl/prototype_of_my_new_self_balancing_robot_project/,robotics,199170,3
Head and eye FR + 1 button boot &calibrate + NLP,408,o5emfk,https://v.redd.it/e14xt1royq671,20,1624337200.0,Lavish_Gupta,1.0,/r/robotics/comments/o5emfk/head_and_eye_fr_1_button_boot_calibrate_nlp/,robotics,199170,3
A new study published in the journal 'Nature' shows a promising future for an untethered exoskeleton boot that could improve the lives of people suffering from mobility issues,409,y2bt3a,https://v.redd.it/wvrr32n45ft91,38,1665600054.0,helloworld_141,1.0,/r/robotics/comments/y2bt3a/a_new_study_published_in_the_journal_nature_shows/,robotics,199170,3
Walking the robot,407,pxxqta,https://v.redd.it/3svgi3z2ngq71,19,1632929236.0,ur5z,0.99,/r/robotics/comments/pxxqta/walking_the_robot/,robotics,199170,3
"Researchers at the Harvard John A. Paulson School of Engineering and Applied Sciences (SEAS) and Beihang University have developed an octopus-inspired soft robotic arm that can grip, move, and manipulate a wide range of objects.",411,h7pfpi,https://i.redd.it/mlm4ohbyni451.gif,18,1591983940.0,rieskriek,0.99,/r/robotics/comments/h7pfpi/researchers_at_the_harvard_john_a_paulson_school/,robotics,199170,3
Another giant robot doing something small,409,bomwlm,https://v.redd.it/8ujpcccby0y21,40,1557859915.0,ROBOT_8,0.99,/r/robotics/comments/bomwlm/another_giant_robot_doing_something_small/,robotics,199170,3
What's the best way to tune a Kalman filter?,408,xm4g3i,https://i.redd.it/c6lda3u0dnp91.png,23,1663955704.0,TobyWasBestSpiderMan,0.98,/r/robotics/comments/xm4g3i/whats_the_best_way_to_tune_a_kalman_filter/,robotics,199170,3
WIP portal robot: Planning out the internal mechanism to both support and rotate the inner stewart platform.,404,wxcmqw,https://www.reddit.com/gallery/wxcmqw,13,1661429665.0,Personalitysphere,1.0,/r/robotics/comments/wxcmqw/wip_portal_robot_planning_out_the_internal/,robotics,199170,3
The Octo-Bouncer,411,fcb5t1,https://www.youtube.com/watch?v=lYyAMDYzJQM,25,1583151159.0,wikidot,0.99,/r/robotics/comments/fcb5t1/the_octobouncer/,robotics,199170,3
How I Built a DIY Package Delivery Robot | Controlled Remotely (with text-to-speech),400,puk142,https://v.redd.it/8njo99z0fgp71,25,1632490913.0,MrxAnomynous,1.0,/r/robotics/comments/puk142/how_i_built_a_diy_package_delivery_robot/,robotics,199170,3
PiPBOT ALPHA - First steps / My first 3D printed robot. Only 3 parts ;),407,10i5kjx,https://v.redd.it/vnhaxbuvghda1,21,1674345504.0,jankrejcir,0.99,/r/robotics/comments/10i5kjx/pipbot_alpha_first_steps_my_first_3d_printed/,robotics,199170,3
First time lifting legs off the ground and not immediately falling over 🤩 All those awesome dog robots makes this look so easy...,401,q8dcyo,https://v.redd.it/rtcalyg7mit71,14,1634260673.0,bewildered_astronaut,1.0,/r/robotics/comments/q8dcyo/first_time_lifting_legs_off_the_ground_and_not/,robotics,199170,3
My 6dof almost fully 3D printable Robot with ~3kg payload :),395,9o625r,https://i.redd.it/12uy0kdvn7s11.jpg,88,1539548926.0,Centauri24,1.0,/r/robotics/comments/9o625r/my_6dof_almost_fully_3d_printable_robot_with_3kg/,robotics,199170,3
Always start the day with a cup of coffee. ☕,392,tbrdy8,https://v.redd.it/x7as9f16mrm81,21,1647009119.0,r_frojd,0.98,/r/robotics/comments/tbrdy8/always_start_the_day_with_a_cup_of_coffee/,robotics,199170,3
Finally got all 6 joints running with kinematics,397,spjlk5,https://v.redd.it/q5mjzlfi93h81,44,1644535074.0,ROBOT_8,1.0,/r/robotics/comments/spjlk5/finally_got_all_6_joints_running_with_kinematics/,robotics,199170,3
The start of a project 14 years in the making...,398,r4ekyn,https://i.redd.it/2tojple8ke281.jpg,68,1638134117.0,Deep_Fry_Daddy,1.0,/r/robotics/comments/r4ekyn/the_start_of_a_project_14_years_in_the_making/,robotics,199170,3
Visualizing foot path planning sometimes makes procedural art.,401,ovchpa,https://i.redd.it/psm90ihsele71.png,20,1627756729.0,i-make-robots,0.97,/r/robotics/comments/ovchpa/visualizing_foot_path_planning_sometimes_makes/,robotics,199170,3
Testing a screw-propelled chassis for using in different future robotics projects. It's a bit of a failure for now :),393,s647nv,https://v.redd.it/66h55hxk19c81,25,1642426617.0,TrashRobotics,0.99,/r/robotics/comments/s647nv/testing_a_screwpropelled_chassis_for_using_in/,robotics,199170,3
Sketch of Amber B1 robotic arm mounted on [k3lso],395,n9ynvy,https://i.redd.it/so4gkcgh7iy61.jpg,9,1620744377.0,r_frojd,0.97,/r/robotics/comments/n9ynvy/sketch_of_amber_b1_robotic_arm_mounted_on_k3lso/,robotics,199170,3
ASI Facility Robotics' Smart Yard Shifting edit,397,fknsul,https://gfycat.com/impishbeneficialanole,26,1584529555.0,wikidot,0.99,/r/robotics/comments/fknsul/asi_facility_robotics_smart_yard_shifting_edit/,robotics,199170,3
Use-Case testing synchronized robots for table top shots.,388,s7ya9f,https://v.redd.it/ltypnmv25pc81,16,1642620671.0,RiteMediaGroup,0.98,/r/robotics/comments/s7ya9f/usecase_testing_synchronized_robots_for_table_top/,robotics,199170,3
Navigation system enables robots to adapt to specific real-world environments and use cases with only small amounts of human preference data.,392,gvv8bz,https://v.redd.it/jlramgcgjp251,12,1591195500.0,rieskriek,0.99,/r/robotics/comments/gvv8bz/navigation_system_enables_robots_to_adapt_to/,robotics,199170,3
Spot Calibration,390,10ram44,https://v.redd.it/db4xjthtipfa1,24,1675296051.0,Naive_While_6177,0.99,/r/robotics/comments/10ram44/spot_calibration/,robotics,199170,3
"I learned how to make animations in fusion360, and made this video in the process.",387,vo4abd,https://v.redd.it/6hbo65fd9q891,14,1656581506.0,liiamarl,1.0,/r/robotics/comments/vo4abd/i_learned_how_to_make_animations_in_fusion360_and/,robotics,199170,3
The Most Adorable Robot Lamp in the World?! by Mario the Maker Magician,389,qfgg8j,https://v.redd.it/yoivpfy2jlv71,3,1635167572.0,thegigiandthebear,0.99,/r/robotics/comments/qfgg8j/the_most_adorable_robot_lamp_in_the_world_by/,robotics,199170,3
this is Corporación Robot. Mini Rover with head tracking using vr googless,387,tty19b,https://v.redd.it/7nlseohvoyq81,14,1648838163.0,corporacionRobot,0.99,/r/robotics/comments/tty19b/this_is_corporación_robot_mini_rover_with_head/,robotics,199170,3
