title,score,id,url,num_comments,created,author,upvote_ratio,permalink,subreddit,subreddit_subscribers,depth
"EU proposes mandatory USB-C on all devices, including iPhones",84285,ptt967,https://www.theverge.com/2021/9/23/22626723/eu-commission-universal-charger-usb-c-micro-lightning-connector-smartphones,5599,1632396940.0,Snoop8ball,0.91,/r/gadgets/comments/ptt967/eu_proposes_mandatory_usbc_on_all_devices/,gadgets,21140247,2
US lawmakers announce bill to prohibit bot scalping of high demand goods,78738,r78raj,https://www.eurogamer.net/articles/2021-12-01-us-lawmakers-announce-bill-to-prohibit-bot-scalping-of-high-demand-goods,3284,1638455651.0,Darren-B80,0.92,/r/gadgets/comments/r78raj/us_lawmakers_announce_bill_to_prohibit_bot/,gadgets,21140247,2
300 Drones Formed a QR Code That Rick Rolled Dallas on April Fools' Day,62570,tx37kt,https://www.dallasobserver.com/music/dallas-got-rick-rolled-with-a-giant-qr-code-on-april-fools-day-13716928,751,1649187699.0,geoxol,0.9,/r/gadgets/comments/tx37kt/300_drones_formed_a_qr_code_that_rick_rolled/,gadgets,21140247,2
"Logitech finally finds a good use for wireless charging: A mouse pad. With a Powerplay mouse pad, never again will your wireless mouse run out of power.",60283,6gtdjt,https://arstechnica.com/gadgets/2017/06/logitech-powerplay-mouse-pad-wireless-charging/,2505,1497285583.0,Philo1927,0.89,/r/gadgets/comments/6gtdjt/logitech_finally_finds_a_good_use_for_wireless/,gadgets,21140247,2
Apple Warns Looters With Stolen iPhones: You Are Being Tracked,59433,gvakh7,https://www.forbes.com/sites/zakdoffman/2020/06/01/apple-warns-looters-with-stolen-iphones-you-are-being-tracked/#1ddfee175098,2756,1591115567.0,wewewawa,0.9,/r/gadgets/comments/gvakh7/apple_warns_looters_with_stolen_iphones_you_are/,gadgets,21140247,2
EU lawmakers impose single charger for all smartphones,59273,xvctao,https://techxplore.com/news/2022-10-eu-lawmakers-impose-charger-smartphones.html,3516,1664883552.0,chrisdh79,0.93,/r/gadgets/comments/xvctao/eu_lawmakers_impose_single_charger_for_all/,gadgets,21140247,2
"94-year-old inventor of lithium-ion batteries develops safer, more efficient glass battery",53441,5y1a1x,http://www.digitaltrends.com/cool-tech/glass-battery-technology/,1538,1488902641.0,ZoneRangerMC,0.88,/r/gadgets/comments/5y1a1x/94yearold_inventor_of_lithiumion_batteries/,gadgets,21140247,2
Brazilian regulator seizes iPhones from retail stores as Apple fails to comply with charger requirement,52940,z3kwd3,https://9to5mac.com/2022/11/24/brazil-seizes-iphones-retail-stores-charger-requirement/,2779,1669298914.0,chrisdh79,0.94,/r/gadgets/comments/z3kwd3/brazilian_regulator_seizes_iphones_from_retail/,gadgets,21140247,2
"Couple used Apple AirTag to track luggage, found it was donated to charity",51136,10upla2,https://www.pcmag.com/news/couple-used-apple-airtag-to-track-luggage-that-was-donated-to-charity,1895,1675636187.0,thebelsnickle1991,0.95,/r/gadgets/comments/10upla2/couple_used_apple_airtag_to_track_luggage_found/,gadgets,21140247,2
Some Epson Printers Are Programmed to Stop Working After a Certain Amount of Use | Users are receiving error messages that their fully functional printers are suddenly in need of repairs.,50363,wjaqrt,https://gizmodo.com/epson-printer-end-of-service-life-error-not-working-dea-1849384045,3361,1659970152.0,chrisdh79,0.94,/r/gadgets/comments/wjaqrt/some_epson_printers_are_programmed_to_stop/,gadgets,21140247,2
We need your voice as we continue the fight for net neutrality • r/blog,49352,6mu7aa,https://www.reddit.com/r/blog/comments/6mtgtp/we_need_your_voice_as_we_continue_the_fight_for/,556,1499869018.0,kbgames360,0.85,/r/gadgets/comments/6mu7aa/we_need_your_voice_as_we_continue_the_fight_for/,gadgets,21140247,2
Medical student surgically implants Bluetooth device into own ear to cheat in final exam - It was the student’s final attempt to clear the exam after repeatedly failing it since getting admission into the college 11 years ago,48583,tep60z,https://www.independent.co.uk/asia/india/mbbs-student-bluetooth-cheating-bhopal-b2021217.html,2122,1647351371.0,speckz,0.92,/r/gadgets/comments/tep60z/medical_student_surgically_implants_bluetooth/,gadgets,21140247,2
Battery replacement must be ‘easily’ achieved by consumers in proposed European law,47696,zsgir2,https://9to5mac.com/2022/12/21/battery-replacement/,3539,1671696493.0,Avieshek,0.94,/r/gadgets/comments/zsgir2/battery_replacement_must_be_easily_achieved_by/,gadgets,21140247,2
The first ever 1-terabyte microSD card is now for sale,45366,bowqh9,"https://www.tomsguide.com/us/sandisk-1-tb-microsd-card,news-30079.html",2675,1557919567.0,nopantsdolphin,0.96,/r/gadgets/comments/bowqh9/the_first_ever_1terabyte_microsd_card_is_now_for/,gadgets,21140247,2
US farmers win right to repair John Deere equipment,43977,107fl34,https://www.bbc.co.uk/news/business-64206913,895,1673274111.0,diacewrb,0.95,/r/gadgets/comments/107fl34/us_farmers_win_right_to_repair_john_deere/,gadgets,21140247,2
Good news: scalpers are struggling to profit from Nvidia's RTX 4080,43064,z4qa3u,https://www.digitaltrends.com/computing/scalpers-struggle-to-sell-nvidia-rtx-4080/?utm_source=reddit&utm_medium=pe&utm_campaign=pd,1853,1669415447.0,ChickenTeriyakiBoy1,0.93,/r/gadgets/comments/z4qa3u/good_news_scalpers_are_struggling_to_profit_from/,gadgets,21140247,2
"After roasting Apple about headphone jacks, Google quietly dumps it from Pixel 6A",42348,unw3ps,https://www.theverge.com/2022/5/11/23067702/google-pixel-6a-headphone-jack,3623,1652343064.0,chrisdh79,0.92,/r/gadgets/comments/unw3ps/after_roasting_apple_about_headphone_jacks_google/,gadgets,21140247,2
Google is shutting down its Stadia game studios,41969,laemjz,https://www.engadget.com/google-stadia-game-studios-shut-down-montreal-los-angeles-201811811.html,4121,1612214761.0,MCA2142,0.93,/r/gadgets/comments/laemjz/google_is_shutting_down_its_stadia_game_studios/,gadgets,21140247,2
GPU prices are falling below MSRP due to the crypto crash,41727,vf87f5,https://www.digitaltrends.com/computing/gpu-prices-are-falling-below-msrp-due-to-the-crypto-crash/?utm_source=reddit&utm_medium=pe&utm_campaign=pd,1929,1655564998.0,ChickenTeriyakiBoy1,0.93,/r/gadgets/comments/vf87f5/gpu_prices_are_falling_below_msrp_due_to_the/,gadgets,21140247,2
"San Francisco Decides Killer Police Robots Are Not a Great Idea, Actually | “We should be working on ways to decrease the use of force by local law enforcement, not giving them new tools to kill people.”",41685,zf2pyg,https://www.vice.com/en/article/wxnanz/san-francisco-decides-killer-police-robots-are-not-a-great-idea-actually,1334,1670423997.0,chrisdh79,0.9,/r/gadgets/comments/zf2pyg/san_francisco_decides_killer_police_robots_are/,gadgets,21140247,2
Robots authorized to kill in SFPD draft policy - “This is not normal. No legal professional or ordinary resident should carry on as if it is normal.”,40390,z2pbgh,https://missionlocal.org/2022/11/killer-robots-to-be-permitted-under-sfpd-draft-policy/,2963,1669210593.0,speckz,0.91,/r/gadgets/comments/z2pbgh/robots_authorized_to_kill_in_sfpd_draft_policy/,gadgets,21140247,2
EU Gives Final Approval to Law That Will Force iPhone to Switch to USB-C,40382,yc9exm,https://www.macrumors.com/2022/10/24/eu-gives-final-approval-to-usb-c-law/,2026,1666612936.0,chrisdh79,0.94,/r/gadgets/comments/yc9exm/eu_gives_final_approval_to_law_that_will_force/,gadgets,21140247,2
Apple to Invest $3.6 Billion in Kia Motors for Apple Car Production,40101,lbnjid,https://www.macrumors.com/2021/02/03/apple-car-kia-investment/,3259,1612359046.0,geoxol,0.89,/r/gadgets/comments/lbnjid/apple_to_invest_36_billion_in_kia_motors_for/,gadgets,21140247,2
$350 USB Stick That Claims to Block 5G Is Actually a $6 Generic Thumb Drive,39616,gsdyrh,https://www.pcmag.com/news/350-usb-stick-that-claims-to-block-5g-is-actually-a-6-generic-thumb-drive,1605,1590697222.0,andyholla84,0.96,/r/gadgets/comments/gsdyrh/350_usb_stick_that_claims_to_block_5g_is_actually/,gadgets,21140247,2
Apple's pricey new monitor comes with a free 1-meter cable. A 1.8-meter cable will cost you $129.,39455,ta6m6y,https://www.businessinsider.com/the-thunderbolt-4-pro-versions-pricer-at-129-or-159-2022-3?utm_source=feedly&utm_medium=webfeeds,4015,1646828445.0,chrisdh79,0.82,/r/gadgets/comments/ta6m6y/apples_pricey_new_monitor_comes_with_a_free/,gadgets,21140247,2
"Masayuki Uemura, Creator Of The NES And SNES, Dies At Age 78",39376,rck2cy,https://kotaku.com/masayuki-uemura-creator-of-the-nes-and-snes-dies-at-7-1848184264,770,1639063867.0,chrisdh79,0.95,/r/gadgets/comments/rck2cy/masayuki_uemura_creator_of_the_nes_and_snes_dies/,gadgets,21140247,2
"Boston Dynamics' quadruped robots are now roaming the world free. Good luck, everyone.",39188,d923pv,https://www.tomsguide.com/news/boston-dynamics-spot-robot,2432,1569411902.0,nopantsdolphin,0.93,/r/gadgets/comments/d923pv/boston_dynamics_quadruped_robots_are_now_roaming/,gadgets,21140247,2
Nvidia Shield TV Owners Are Pissed About the Banner Ads in Android TV - The continued expansion of ads in smart devices is really starting to get on people's nerves.,39082,oo01ch,https://gizmodo.com/nvidia-shield-tv-owners-are-pissed-about-the-banner-ads-1847185249,3316,1626779778.0,speckz,0.95,/r/gadgets/comments/oo01ch/nvidia_shield_tv_owners_are_pissed_about_the/,gadgets,21140247,2
Hyundai and Kia confirm they are no longer in talks with Apple regarding Apple Car production,38292,lf9sqh,https://9to5mac.com/2021/02/07/apple-car-hyundai-kia-production/,2277,1612783303.0,UnKindClock,0.94,/r/gadgets/comments/lf9sqh/hyundai_and_kia_confirm_they_are_no_longer_in/,gadgets,21140247,2
YouTuber Builds His Own X-Ray Machine After Getting Hit With a $69K Hospital Bill - That's one way to save on medical costs.,38121,tnktby,https://www.popularmechanics.com/technology/a37543273/homemade-xray-machine/,1517,1648211233.0,speckz,0.84,/r/gadgets/comments/tnktby/youtuber_builds_his_own_xray_machine_after/,gadgets,21140247,2
"Facebook employees were caught writing 5-star Amazon reviews for its Portal device, and now they must take them down",37726,ahb4ue,https://www.businessinsider.com/facebook-employees-caught-leaving-5-star-amazon-reviews-for-portal-2019-1,1283,1547822865.0,caliphornian,0.94,/r/gadgets/comments/ahb4ue/facebook_employees_were_caught_writing_5star/,gadgets,21140247,2
EU: We May Need a Law to Force iPhones to Adopt USB-C,36758,ets977,https://www.pcmag.com/news/eu-we-may-need-a-law-to-force-iphones-to-adopt-usb-c,4466,1579967000.0,holyhacker,0.84,/r/gadgets/comments/ets977/eu_we_may_need_a_law_to_force_iphones_to_adopt/,gadgets,21140247,2
Apple now sells a ($35) iPhone dongle with a headphone jack & charging port,36583,73pcqh,https://www.theverge.com/circuitbreaker/2017/10/1/16393078/apple-belkin-rockstar-iphone-adapter-headphone-lightning,2130,1506902796.0,i_love_anachronisms,0.76,/r/gadgets/comments/73pcqh/apple_now_sells_a_35_iphone_dongle_with_a/,gadgets,21140247,2
"Old iPhones become faster if you change the region to France - Recent benchmark tests found that old iPhones, for example, the iPhone 7, run slightly faster after switching regions to France.",36223,paolld,https://www.gizchina.com/2021/08/23/old-iphones-become-faster-if-you-change-the-region-to-france/,2361,1629815798.0,speckz,0.93,/r/gadgets/comments/paolld/old_iphones_become_faster_if_you_change_the/,gadgets,21140247,2
RIP Headphone Jack: how the industry created and killed the world's most popular port,36001,cl31og,https://www.tomsguide.com/news/rip-headphone-jack-how-the-industry-created-and-killed-the-worlds-most-popular-port,6507,1564746466.0,nopantsdolphin,0.88,/r/gadgets/comments/cl31og/rip_headphone_jack_how_the_industry_created_and/,gadgets,21140247,2
Apple says cheap battery replacements hurt iPhone sales,35189,ac5av8,https://www.theverge.com/2019/1/2/18165866/apple-iphone-sales-cheap-battery-replacement,5188,1546518782.0,carrick1363,0.89,/r/gadgets/comments/ac5av8/apple_says_cheap_battery_replacements_hurt_iphone/,gadgets,21140247,2
iPhone 12 does not come with power charger or earbuds in the box,35031,jaid3b,https://9to5mac.com/2020/10/13/iphone-12-does-not-come-with-power-charger-or-earbuds-in-the-box/,4248,1602610914.0,UnKindClock,0.88,/r/gadgets/comments/jaid3b/iphone_12_does_not_come_with_power_charger_or/,gadgets,21140247,2
This sun-chasing robot looks after the plant on its head,34939,8y96uz,https://www.theverge.com/platform/amp/2018/7/12/17563688/robot-plant-hybrid-hexa-vincross-succulent,973,1531397263.0,Abscess2,0.92,/r/gadgets/comments/8y96uz/this_sunchasing_robot_looks_after_the_plant_on/,gadgets,21140247,2
Snap lost nearly $40 million on unsold Spectacles,34614,7bgq9c,https://www.theverge.com/2017/11/7/16620718/snapchat-spectacles-40-million-lost-failure-unsold-inventory?utm_campaign=theverge&utm_content=chorus&utm_medium=social&utm_source=twitter,3456,1510092885.0,carrick1363,0.89,/r/gadgets/comments/7bgq9c/snap_lost_nearly_40_million_on_unsold_spectacles/,gadgets,21140247,2
Full-body Teslasuit allows you to feel VR games using haptic feedback,33018,7pxwxe,https://www.digitaltrends.com/virtual-reality/teslasuit-full-body-haptic-feedback/,2199,1515776401.0,ChickenTeriyakiBoy1,0.88,/r/gadgets/comments/7pxwxe/fullbody_teslasuit_allows_you_to_feel_vr_games/,gadgets,21140247,2
The Switch has now outsold the PS4 and Game Boy | It's now only behind the DS and PlayStation 2.,31353,10w0qp4,https://www.engadget.com/the-switch-has-outsold-the-playstation-4-but-nintendo-sees-tougher-times-ahead-100631336.html,1852,1675773367.0,chrisdh79,0.92,/r/gadgets/comments/10w0qp4/the_switch_has_now_outsold_the_ps4_and_game_boy/,gadgets,21140247,2
There are now traffic cameras that can spot you using your phone while driving,31193,e5hi1b,https://www.cnet.com/news/there-are-now-traffic-cameras-that-can-spot-you-using-your-phone-while-driving/,3072,1575381651.0,mtimetraveller,0.92,/r/gadgets/comments/e5hi1b/there_are_now_traffic_cameras_that_can_spot_you/,gadgets,21140247,2
Sony Expects PS5 Shortages Will Last Into 2022,30544,n96y7a,https://www.digitaltrends.com/gaming/ps5-shortages-into-2022/?utm_source=reddit&utm_medium=pe&utm_campaign=pd,3596,1620658894.0,MicroSofty88,0.92,/r/gadgets/comments/n96y7a/sony_expects_ps5_shortages_will_last_into_2022/,gadgets,21140247,2
Apple’s AirTags are being abused by car thieves and stalkers,30268,roadym,https://www.digitaltrends.com/mobile/apple-airtags-stalker-car-thieves/?utm_source=reddit&utm_medium=pe&utm_campaign=pd,2604,1640441136.0,MicroSofty88,0.89,/r/gadgets/comments/roadym/apples_airtags_are_being_abused_by_car_thieves/,gadgets,21140247,2
No GPUs for you: US blocks sales of AI chips to China and Russia,30076,x4ub65,https://arstechnica.com/information-technology/2022/09/us-restricts-sales-of-high-end-nvidia-ai-chips-to-china-and-russia/,2717,1662211271.0,Avieshek,0.92,/r/gadgets/comments/x4ub65/no_gpus_for_you_us_blocks_sales_of_ai_chips_to/,gadgets,21140247,2
You can no longer buy Apple products in Russia,29887,t4xr67,https://www.digitaltrends.com/mobile/apple-halts-sales-russia/?utm_source=reddit&utm_medium=pe&utm_campaign=pd,971,1646218923.0,MicroSofty88,0.93,/r/gadgets/comments/t4xr67/you_can_no_longer_buy_apple_products_in_russia/,gadgets,21140247,2
NES Mini sells as many units in 30 days as Wii U in six months,29737,5iprdy,http://arstechnica.com/gaming/2016/12/nintendo-nes-mini-sales-figures/,2857,1481912139.0,Philo1927,0.87,/r/gadgets/comments/5iprdy/nes_mini_sells_as_many_units_in_30_days_as_wii_u/,gadgets,21140247,2
Nokia is supporting a user's right-to-repair by releasing an easy to fix smartphone,29491,11c8ojr,https://www.digitaltrends.com/mobile/hmd-global-nokia-g22-quickfix-nokia-c32-nokia-c22-mwc-2023-news/,1055,1677398113.0,MicroSofty88,0.95,/r/gadgets/comments/11c8ojr/nokia_is_supporting_a_users_righttorepair_by/,gadgets,21140247,2
The James Webb Space Telescope is capturing the universe on a 68GB SSD,29261,w1wmi3,https://www.engadget.com/the-james-webb-space-telescope-has-a-68-gb-ssd-095528169.html,2191,1658142468.0,Avieshek,0.95,/r/gadgets/comments/w1wmi3/the_james_webb_space_telescope_is_capturing_the/,gadgets,21140247,2
Japanese scientists invent floating 'firefly' light that could eventually be used in applications ranging from moving displays to projection mapping.,29142,7zpsv4,https://www.reuters.com/article/us-japan-lights-floating/japanese-scientists-invent-floating-firefly-light-idUSKCN1G7132,734,1519407236.0,Khaleeasi24,0.92,/r/gadgets/comments/7zpsv4/japanese_scientists_invent_floating_firefly_light/,gadgets,21140247,2
"US, Netherlands and Japan reportedly agree to limit China's access to chipmaking equipment",29001,10ok43b,https://www.engadget.com/us-netherlands-and-japan-reportedly-agree-to-limit-chinas-access-to-chipmaking-equipment-174204303.html,1673,1675029916.0,thebelsnickle1991,0.94,/r/gadgets/comments/10ok43b/us_netherlands_and_japan_reportedly_agree_to/,gadgets,21140247,2
Microsoft announces Xbox Adaptive Controller for players with disabilities,28980,8k3w8l,https://www.theverge.com/2018/5/17/17363964/microsoft-xbox-adaptive-controller-announced-price-release-date,968,1526560445.0,instantreporter,0.92,/r/gadgets/comments/8k3w8l/microsoft_announces_xbox_adaptive_controller_for/,gadgets,21140247,2
Only 4 percent of US iPhone users have agreed to app tracking after iOS 14.5 | Engadget,28967,n7xwgq,https://www.engadget.com/ios-14-5-users-reject-app-tracking-165309407.html,1481,1620506140.0,MCA2142,0.95,/r/gadgets/comments/n7xwgq/only_4_percent_of_us_iphone_users_have_agreed_to/,gadgets,21140247,2
New York City has released its proposal to outfit police officers with body cameras,28856,64dkqf,http://www.theverge.com/2017/4/8/15230524/new-york-city-police-department-nypd-body-camera-policy,837,1491751436.0,ZoneRangerMC,0.9,/r/gadgets/comments/64dkqf/new_york_city_has_released_its_proposal_to_outfit/,gadgets,21140247,2
Not in China but Chennai. Apple starts manufacturing of iPhone 11 in India,28644,hx0ywy,https://www.livemint.com/companies/news/not-in-china-but-chennai-apple-starts-manufacturing-of-iphone-11-in-india-11595574997264.html,1578,1595594059.0,gulabjamunyaar,0.92,/r/gadgets/comments/hx0ywy/not_in_china_but_chennai_apple_starts/,gadgets,21140247,2
No one should buy the Facebook Portal TV,28452,drzkya,https://www.cnet.com/news/no-one-should-buy-the-facebook-portal-tv/,2321,1572962758.0,mtimetraveller,0.92,/r/gadgets/comments/drzkya/no_one_should_buy_the_facebook_portal_tv/,gadgets,21140247,2
AMD cuts GPU prices at the right time to pull ahead of Nvidia,28366,xlz8rc,https://www.digitaltrends.com/computing/amd-lowers-radeon-rx-6000-msrp/?utm_source=reddit&utm_medium=pe&utm_campaign=pc,1832,1663943624.0,ChickenTeriyakiBoy1,0.94,/r/gadgets/comments/xlz8rc/amd_cuts_gpu_prices_at_the_right_time_to_pull/,gadgets,21140247,2
Army of seed-firing drones will plant 100 million trees by 2024,28326,uiy8iq,https://www.euronews.com/green/2022/05/04/this-australian-start-up-wants-to-fight-deforestation-with-an-army-of-drones,871,1651759598.0,MicroSofty88,0.93,/r/gadgets/comments/uiy8iq/army_of_seedfiring_drones_will_plant_100_million/,gadgets,21140247,2
UK to ban sale of carrier-locked phones from December 2021,28240,jj1zu4,https://www.theverge.com/2020/10/27/21535957/uk-ofcom-locked-carrier-phone-ban-ee-vodafone-tesco-mobile,841,1603808436.0,Philo1927,0.96,/r/gadgets/comments/jj1zu4/uk_to_ban_sale_of_carrierlocked_phones_from/,gadgets,21140247,2
Right to Repair Groups and Farmers Unions File FTC Complaint Against John Deere - The complaint alleges the tractor manufacturer makes its products deliberately difficult or impossible to repair without paying exorbitant costs to a dwindling dealer network.,27910,t7yr5o,https://www.vice.com/en/article/qjbnp3/right-to-repair-groups-and-farmers-unions-file-ftc-complaint-against-john-deere,681,1646573360.0,speckz,0.96,/r/gadgets/comments/t7yr5o/right_to_repair_groups_and_farmers_unions_file/,gadgets,21140247,2
Sony to bring over-the-counter hearing aids to the masses,27909,xe07np,https://www.digitaltrends.com/home-theater/sony-ws-audiology-announce-partnership-ota-hearing-aids/?utm_source=reddit&utm_medium=pe&utm_campaign=pc,1656,1663157109.0,ChickenTeriyakiBoy1,0.95,/r/gadgets/comments/xe07np/sony_to_bring_overthecounter_hearing_aids_to_the/,gadgets,21140247,2
Surprise. Nvidia RTX 3080 Ti Went on Sale ... and Sold Out Immediately,27753,ns2pv4,https://www.digitaltrends.com/computing/nvidia-rtx-3080-ti-sold-out/?utm_source=reddit&utm_medium=pe&utm_campaign=pd,3146,1622805578.0,MicroSofty88,0.93,/r/gadgets/comments/ns2pv4/surprise_nvidia_rtx_3080_ti_went_on_sale_and_sold/,gadgets,21140247,2
Nintendo Just Filed A New N64 Trademark | Is A New Classic Console On The Horizon?,27677,8lfwxb,https://www.digitaltrends.com/gaming/japanese-trademark-filing-hints-nintendo-64-classic/,2321,1527043175.0,i_love_anachronisms,0.89,/r/gadgets/comments/8lfwxb/nintendo_just_filed_a_new_n64_trademark_is_a_new/,gadgets,21140247,2
Valve publishes files to allow players to 3D print their own Steam Deck shells,27438,srnyn1,https://www.videogameschronicle.com/news/valve-publishes-files-to-allow-players-to-3d-print-their-own-steam-deck-shells/,832,1644773453.0,thebelsnickle1991,0.96,/r/gadgets/comments/srnyn1/valve_publishes_files_to_allow_players_to_3d/,gadgets,21140247,2
"iPhone 14 Plus Pre-Orders Worse Than iPhone 13 Mini, Product Strategy 'Fails'",27390,xcbn7z,https://www.macrumors.com/2022/09/12/kuo-iphone-14-plus-worse-than-iphone-13-mini/,5075,1662986065.0,chrisdh79,0.88,/r/gadgets/comments/xcbn7z/iphone_14_plus_preorders_worse_than_iphone_13/,gadgets,21140247,2
Flight sticks are selling out after the release of Microsoft Flight Simulator,27348,ifpfgx,https://www.theverge.com/2020/8/24/21398774/flight-stick-controllers-sold-out-microsoft-simulator,1498,1598277295.0,Philo1927,0.95,/r/gadgets/comments/ifpfgx/flight_sticks_are_selling_out_after_the_release/,gadgets,21140247,2
Ford Lightning owner powers home essentials for 2 days and still had battery left in the tank,27266,zy7z7v,https://electrek.co/2022/12/28/ford-lightning-owner-powers-home-essentials-for-2-days/,1921,1672327536.0,speckz,0.9,/r/gadgets/comments/zy7z7v/ford_lightning_owner_powers_home_essentials_for_2/,gadgets,21140247,2
"Facebook Logs Text, Call Histories for Some Android Users",27214,87a8ji,https://www.wsj.com/amp/articles/facebook-logs-text-call-histories-for-some-android-users-1522072657,1195,1522080133.0,Abscess2,0.91,/r/gadgets/comments/87a8ji/facebook_logs_text_call_histories_for_some/,gadgets,21140247,2
"Apple fans are returning their new MacBook Pros that cost a minimum of $2,800 because they can't reach the advertised speeds",27199,913yo0,https://finance.yahoo.com/news/apple-fans-returning-macbook-pros-154205304.html,3065,1532319254.0,GriffonsChainsaw,0.91,/r/gadgets/comments/913yo0/apple_fans_are_returning_their_new_macbook_pros/,gadgets,21140247,2
Nintendo sold more copies of Zelda for Switch than actual Switch consoles,27004,65e1hq,http://www.theverge.com/2017/4/13/15296874/nintendo-switch-zelda-sales-numbers-us,1962,1492192234.0,ZoneRangerMC,0.91,/r/gadgets/comments/65e1hq/nintendo_sold_more_copies_of_zelda_for_switch/,gadgets,21140247,2
Apple finally admits iPad Pro won't replace your PC,26343,dxn47e,https://www.zdnet.com/article/apple-finally-admits-ipad-pro-wont-replace-your-pc/,1993,1574000641.0,mtimetraveller,0.82,/r/gadgets/comments/dxn47e/apple_finally_admits_ipad_pro_wont_replace_your_pc/,gadgets,21140247,2
Apple may have to abandon Lightning connector cable,26051,eq23vh,https://www.bbc.com/news/technology-51137069,3629,1579276255.0,wewewawa,0.89,/r/gadgets/comments/eq23vh/apple_may_have_to_abandon_lightning_connector/,gadgets,21140247,2
Valve's Steam Deck wows reviewers: 'The most innovative gaming PC in 20 years',25915,snoarv,https://www.pcworld.com/article/612746/the-steam-deck-wows-players-in-its-first-hands-on-sessions.html,3347,1644337811.0,thebelsnickle1991,0.92,/r/gadgets/comments/snoarv/valves_steam_deck_wows_reviewers_the_most/,gadgets,21140247,2
New Tree-Loving Robots Could Plant Entire Forest of Seeds Daily,25685,l8boxz,https://interestingengineering.com/new-tree-loving-robots-could-plant-entire-forest-of-seeds-daily,589,1611974176.0,MicroSofty88,0.96,/r/gadgets/comments/l8boxz/new_treeloving_robots_could_plant_entire_forest/,gadgets,21140247,2
Airbus Just Debuted 'Zero-Emission' Aircraft Concepts Using Hydrogen Fuel,25636,iyepwx,https://interestingengineering.com/airbus-debuts-new-zero-emission-aircraft-concepts-using-hydrogen-fuel,1642,1600882221.0,ChickenTeriyakiBoy1,0.95,/r/gadgets/comments/iyepwx/airbus_just_debuted_zeroemission_aircraft/,gadgets,21140247,2
U.S. Army Awards Pocket-Sized Drones $20.6 Million Contract,25385,hej1eu,https://interestingengineering.com/us-army-awards-pocket-sized-drones-206-million-contract,1262,1592933705.0,ChickenTeriyakiBoy1,0.93,/r/gadgets/comments/hej1eu/us_army_awards_pocketsized_drones_206_million/,gadgets,21140247,2
Nvidia's RTX 3090 GPU Can Play Games in 8K at 60 FPS,25310,il90b5,https://www.digitaltrends.com/computing/nvidia-rtx-3090-3080-3070-announced/,2511,1599060791.0,MicroSofty88,0.92,/r/gadgets/comments/il90b5/nvidias_rtx_3090_gpu_can_play_games_in_8k_at_60/,gadgets,21140247,2
Nike self-lacing sneakers brick after bad firmware upgrade,25259,at793k,https://arstechnica.com/gadgets/2019/02/my-left-shoe-wont-even-reboot-faulty-app-bricks-nike-smart-sneakers/,1261,1550777144.0,nopantsdolphin,0.93,/r/gadgets/comments/at793k/nike_selflacing_sneakers_brick_after_bad_firmware/,gadgets,21140247,2
"AI-equipped drones taught themselves how to fly by crashing 11,500 times",25198,6asktu,https://www.digitaltrends.com/cool-tech/crashing-drones-teach-fly-better/,1131,1494608757.0,ZoneRangerMC,0.91,/r/gadgets/comments/6asktu/aiequipped_drones_taught_themselves_how_to_fly_by/,gadgets,21140247,2
