title,score,id,url,num_comments,created,author,upvote_ratio,permalink,subreddit,subreddit_subscribers,depth
"Energy prices to soar again as Jeremy Hunt rejects pleas to halt rise — Millions will see costs mount by another 40% in April as rebate scheme ends and chancellor lets cap go up to £3,000",4514,10u8rfk,https://www.theguardian.com/money/2023/feb/05/energy-prices-to-soar-again-as-jeremy-hunt-rejects-pleas-to-halt-rise,900,1675589822.0,marketrent,0.96,/r/unitedkingdom/comments/10u8rfk/energy_prices_to_soar_again_as_jeremy_hunt/,unitedkingdom,1404690,2
Edinburgh becomes first European city to commit to vegetarian menu in schools to reduce footprint,4485,10g7mh5,https://www.dailymail.co.uk/news/article-11651493/Edinburgh-European-capital-meat-menu-schools-reduce-footprint.html,1837,1674149397.0,ClassicFlavour,0.87,/r/unitedkingdom/comments/10g7mh5/edinburgh_becomes_first_european_city_to_commit/,unitedkingdom,1404690,2
ENOUGH IS ENOUGH! - Rishi Sunak has got to go!,4484,u0on19,https://www.reddit.com/r/unitedkingdom/comments/u0on19/enough_is_enough_rishi_sunak_has_got_to_go/,679,1649617904.0,Richyro0,0.93,/r/unitedkingdom/comments/u0on19/enough_is_enough_rishi_sunak_has_got_to_go/,unitedkingdom,1404690,2
Tory MP Lee Anderson Says People Use Food Banks Because They 'Can't Cook Or Budget',4467,unc5qm,https://www.huffingtonpost.co.uk/entry/tory-mp-lee-anderson-food-banks_uk_627bc3e7e4b03ca8364a02eb,785,1652282148.0,masterblaster0,0.96,/r/unitedkingdom/comments/unc5qm/tory_mp_lee_anderson_says_people_use_food_banks/,unitedkingdom,1404690,2
"Brexit worse for the UK economy than Covid pandemic, OBR says",4461,qhhkow,https://www.theguardian.com/politics/2021/oct/28/brexit-worse-for-the-uk-economy-than-covid-pandemic-obr-says,634,1635406250.0,printial,0.95,/r/unitedkingdom/comments/qhhkow/brexit_worse_for_the_uk_economy_than_covid/,unitedkingdom,1404690,2
"MPs need pay rise as living on £81k can be 'really grim', says Tory MP",4416,q2n1rx,https://www.mirror.co.uk/news/politics/mps-need-pay-rise-living-25151733,696,1633534868.0,chrisjd,0.97,/r/unitedkingdom/comments/q2n1rx/mps_need_pay_rise_as_living_on_81k_can_be_really/,unitedkingdom,1404690,2
'It's a mystery how bare-faced Boris Johnson keeps getting away with everything',4404,mkfkxw,https://www.mirror.co.uk/news/politics/its-mystery-how-bare-faced-23848078,663,1617610115.0,sensiblecentrist20,0.94,/r/unitedkingdom/comments/mkfkxw/its_a_mystery_how_barefaced_boris_johnson_keeps/,unitedkingdom,1404690,2
EXCLUSIVE: Nick Clegg sends son to £22k school after branding private education 'corrosive',4388,z63bz9,https://www.mirror.co.uk/news/politics/nick-clegg-sends-son-22k-28591182,871,1669561375.0,lighthouse77,0.95,/r/unitedkingdom/comments/z63bz9/exclusive_nick_clegg_sends_son_to_22k_school/,unitedkingdom,1404690,2
'We'll work from home forever': Civil servants vow to fight returning to offices despite Boris Johnson declaring war on the 'Whitehall blob' - as some officials even relocate out to the Cotswolds and Cornwall to WFH,4369,saqb00,https://www.dailymail.co.uk/news/article-10431021/Well-work-home-forever-Civil-servants-vow-fight-returning-offices.html,932,1642931871.0,MoneyEqual,0.95,/r/unitedkingdom/comments/saqb00/well_work_from_home_forever_civil_servants_vow_to/,unitedkingdom,1404690,2
"Can we start a Kickstarter to raise, say, £30,000 to hire a paparazzi for a year to ONLY stalk/take photos of Daily Mail editor Paul Dacre?",4348,2a8isy,https://www.reddit.com/r/unitedkingdom/comments/2a8isy/can_we_start_a_kickstarter_to_raise_say_30000_to/,404,1404912087.0,TopTrumpWANKER,0.94,/r/unitedkingdom/comments/2a8isy/can_we_start_a_kickstarter_to_raise_say_30000_to/,unitedkingdom,1404690,2
Johnson travels to Kyiv for Zelensky talks,4347,tzu0nw,https://www.bbc.co.uk/news/uk-61052643,1061,1649513567.0,topotaul,0.93,/r/unitedkingdom/comments/tzu0nw/johnson_travels_to_kyiv_for_zelensky_talks/,unitedkingdom,1404690,2
"'It's a Sin' writer Russell T. Davies tells Tory voters 'you're voting for murderers, b**tards, abusers and liars' in scathing acceptance speech",4321,vytdii,https://www.walesonline.co.uk/whats-on/whats-on-news/russell-davies-sin-tories-speech-24485937,469,1657797306.0,qpl23,0.95,/r/unitedkingdom/comments/vytdii/its_a_sin_writer_russell_t_davies_tells_tory/,unitedkingdom,1404690,2
First step towards a general strike? Enough is Enough campaign launches,4315,wjagpz,https://www.thelondoneconomic.com/politics/first-step-towards-a-general-strike-enough-is-enough-campaign-launches-331884/?fbclid=IwAR2VTtErS4A_vjSy6JOKM6pe2pGuQHppAwQLt_HNJg0PPcMh8V6-tq1GqGE,575,1659969443.0,tubaintothewildfern,0.96,/r/unitedkingdom/comments/wjagpz/first_step_towards_a_general_strike_enough_is/,unitedkingdom,1404690,2
Kwasi Kwarteng faces calls for inquiry after attending champagne party with hedge fund managers hours after delivering mini-budget,4317,xtl3w3,https://news.sky.com/story/kwasi-kwarteng-faces-calls-for-inquiry-after-attending-champagne-do-with-hedge-fund-managers-hours-after-delivering-mini-budget-12710039,187,1664705364.0,topotaul,0.99,/r/unitedkingdom/comments/xtl3w3/kwasi_kwarteng_faces_calls_for_inquiry_after/,unitedkingdom,1404690,2
City drivers 'should think twice' before buying SUVs,4325,mlw0kq,https://www.bbc.co.uk/news/business-56647128,1228,1617777066.0,topotaul,0.94,/r/unitedkingdom/comments/mlw0kq/city_drivers_should_think_twice_before_buying_suvs/,unitedkingdom,1404690,2
"Education On the Brink - Teachers and support staff are leaving education in droves. There's one way for the government to stem the flow: reverse twelve years of cuts, abandon austerity 2.0, and pay education workers properly.",4308,ygax4n,https://tribunemag.co.uk/2022/10/educations-staffing-crisis-is-reaching-breaking-point,458,1667020913.0,Overthrow_Capitalism,0.98,/r/unitedkingdom/comments/ygax4n/education_on_the_brink_teachers_and_support_staff/,unitedkingdom,1404690,2
Dewsbury pensioner too terrified to turn the heating on as she is left to freeze in her own home,4298,tue1lz,https://www.examinerlive.co.uk/news/cost-of-living/dewsbury-pensioner-terrified-turn-heating-23567855,880,1648887954.0,tipodecinta,0.95,/r/unitedkingdom/comments/tue1lz/dewsbury_pensioner_too_terrified_to_turn_the/,unitedkingdom,1404690,2
Interest rates rise to 1.75% in biggest hike for 27 years,4286,wfyau0,https://news.sky.com/story/interest-rates-rise-to-175-in-biggest-hike-for-27-years-12665163,1248,1659610884.0,topotaul,0.96,/r/unitedkingdom/comments/wfyau0/interest_rates_rise_to_175_in_biggest_hike_for_27/,unitedkingdom,1404690,2
Stephen Fry in plea for walk-in mental health hubs for youths hit by pandemic,4287,pf01bz,https://www.theguardian.com/society/2021/aug/31/stephen-fry-in-plea-for-walk-in-mental-health-hubs-for-youths-hit-by-pandemic?CMP=Share_AndroidApp_Other,387,1630390041.0,bintasaurus,0.97,/r/unitedkingdom/comments/pf01bz/stephen_fry_in_plea_for_walkin_mental_health_hubs/,unitedkingdom,1404690,2
Brexit impact ‘will get worse’ with supermarket shop to cost more and some EU products vanishing from shelves,4281,pse2fm,https://inews.co.uk/news/brexit-european-union-supermarket-shelves-1209128,857,1632210166.0,Disillusioned_Pleb01,0.94,/r/unitedkingdom/comments/pse2fm/brexit_impact_will_get_worse_with_supermarket/,unitedkingdom,1404690,2
COVID-19: Poll suggests most teachers have no confidence in the government after 'bewildering' U-turns,4252,kua7ee,http://news.sky.com/story/covid-19-poll-suggests-most-teachers-have-no-confidence-in-the-government-after-education-u-turns-12183844,330,1610264603.0,topotaul,0.97,/r/unitedkingdom/comments/kua7ee/covid19_poll_suggests_most_teachers_have_no/,unitedkingdom,1404690,2
Glasgow brewery vows to stop supplying Wetherspoons over treatment of staff,4230,fsy953,https://www.glasgowlive.co.uk/whats-on/food-drink-news/glasgow-brewery-vows-stop-supplying-18019986,315,1585741612.0,twistedLucidity,0.99,/r/unitedkingdom/comments/fsy953/glasgow_brewery_vows_to_stop_supplying/,unitedkingdom,1404690,2
Russia pulls back from Ukraine to avoid further visits from Liz Truss,4233,stsy9z,https://newsthump.com/2022/02/15/russia-pulls-back-from-ukraine-to-avoid-further-visits-from-liz-truss/,151,1645008231.0,chrisjd,0.97,/r/unitedkingdom/comments/stsy9z/russia_pulls_back_from_ukraine_to_avoid_further/,unitedkingdom,1404690,2
Michael Gove has been sacked,4216,vszi0d,https://news.sky.com/story/boris-johnson-live-updates-pm-fighting-for-political-life-after-sunak-and-javid-quit-12593360?postid=4127431#liveblog-body,822,1657138802.0,BestButtons,0.96,/r/unitedkingdom/comments/vszi0d/michael_gove_has_been_sacked/,unitedkingdom,1404690,2
Channel 4 News end credits on Jon Snow's last ever broadcast,4204,rn7uqt,https://i.redd.it/o2mhdfz9id781.jpg,192,1640300630.0,KamikazeChief,0.97,/r/unitedkingdom/comments/rn7uqt/channel_4_news_end_credits_on_jon_snows_last_ever/,unitedkingdom,1404690,2
"COVID-19: Cases surge to fresh high as another 53,135 infections recorded",4188,kmhwv3,http://news.sky.com/story/covid-19-cases-surge-to-fresh-high-as-another-53135-infections-recorded-12174911,1075,1609260512.0,topotaul,0.96,/r/unitedkingdom/comments/kmhwv3/covid19_cases_surge_to_fresh_high_as_another/,unitedkingdom,1404690,2
Rees-Mogg caught flouting Covid rules after crossing tiers to attend mass,4174,kr5uy0,https://www.thelondoneconomic.com/politics/rees-mogg-caught-flouting-covid-rules-after-crossing-tiers-to-attend-latin-mass/05/01/?utm_medium=cpc&utm_source=facebook&utm_campaign=tlb,524,1609875411.0,GreyFoxNinjaFan,0.96,/r/unitedkingdom/comments/kr5uy0/reesmogg_caught_flouting_covid_rules_after/,unitedkingdom,1404690,2
"Public now support rail strikes after Mick Lynch TV studio tour, poll finds",4171,vo30w1,https://www.independent.co.uk/news/uk/politics/mick-lynch-rmt-rail-strike-poll-b2112260.html?fs=e&s=cl,538,1656576423.0,lighthouse77,0.97,/r/unitedkingdom/comments/vo30w1/public_now_support_rail_strikes_after_mick_lynch/,unitedkingdom,1404690,2
Met Police officer sacked for dodging £4.30 train fare ‘said he did it all the time’,4152,w5z2zu,https://metro.co.uk/2022/07/22/met-police-officer-izaack-gnadou-sacked-for-dodging-4-30-train-fare-17050886/?fs=e&s=cl,698,1658565401.0,lighthouse77,0.96,/r/unitedkingdom/comments/w5z2zu/met_police_officer_sacked_for_dodging_430_train/,unitedkingdom,1404690,2
COVID-19: Mayor of London Sadiq Khan declares major incident over 'huge surge' of Omicron cases,4148,rj99ix,http://news.sky.com/story/covid-19-mayor-of-london-sadiq-khan-declares-major-incident-over-huge-surge-of-omicron-cases-12499021,1295,1639839802.0,topotaul,0.93,/r/unitedkingdom/comments/rj99ix/covid19_mayor_of_london_sadiq_khan_declares_major/,unitedkingdom,1404690,2
Parliament enters 316th consecutive year of insisting it’s going to tackle wealthy tax avoiders,4125,10mirll,https://newsthump.com/2023/01/26/parliament-enters-316th-consecutive-year-of-insisting-its-going-to-tackle-wealthy-tax-avoiders/,72,1674819446.0,marketrent,0.98,/r/unitedkingdom/comments/10mirll/parliament_enters_316th_consecutive_year_of/,unitedkingdom,1404690,2
"""Dutch bike part dealer shipping to every country in the world except UK because of Brexit VAT change",4125,kpgps0,https://road.cc/content/news/dutch-bike-part-dealer-shipping-every-country-except-uk-279779,625,1609661024.0,bilefreebill,0.94,/r/unitedkingdom/comments/kpgps0/dutch_bike_part_dealer_shipping_to_every_country/,unitedkingdom,1404690,2
"Growing majority of Britons think Brexit was a mistake, new poll shows",4126,ykcbmz,https://www.euronews.com/my-europe/2022/11/02/growing-majority-of-britons-think-brexit-was-a-mistake-new-poll-shows,810,1667412335.0,bottish,0.94,/r/unitedkingdom/comments/ykcbmz/growing_majority_of_britons_think_brexit_was_a/,unitedkingdom,1404690,2
Boris Johnson will NOT stand for Tory leader,4123,4ql1pn,https://twitter.com/janemerrick23/status/748469366761623552,2275,1467284007.0,TopTrumpWANKER,0.97,/r/unitedkingdom/comments/4ql1pn/boris_johnson_will_not_stand_for_tory_leader/,unitedkingdom,1404690,2
Up to 99 million animals ‘needlessly slaughtered without stunning’ every year,4117,rqctv4,https://www.independent.co.uk/news/uk/home-news/halal-no-stun-meat-animal-muslim-kosher-b1981575.html,1473,1640687010.0,GarlicCornflakes,0.9,/r/unitedkingdom/comments/rqctv4/up_to_99_million_animals_needlessly_slaughtered/,unitedkingdom,1404690,2
The Kunts have announced that they will be campaigning for the UK Christmas #1 single this year with ‘Fuck the Tories’,4115,yy0jwa,https://www.comedy.co.uk/people/news/7089/kunt-aims-for-christmas-music-chart-with-tories-song/,315,1668716655.0,sincerityisscxry,0.94,/r/unitedkingdom/comments/yy0jwa/the_kunts_have_announced_that_they_will_be/,unitedkingdom,1404690,2
