title,score,id,url,num_comments,created,author,upvote_ratio,permalink,subreddit,subreddit_subscribers,depth
"LPT: When you sign up for anything online, put the website’s name as your middle name. That way when you receive spam/advert emails, you will know who sold your info.",144025,j2mm1b,https://www.reddit.com/r/LifeProTips/comments/j2mm1b/lpt_when_you_sign_up_for_anything_online_put_the/,2024,1601474318.0,raviji22,0.96,/r/LifeProTips/comments/j2mm1b/lpt_when_you_sign_up_for_anything_online_put_the/,LifeProTips,21894053,1
"LPT: When you don't have all the facts, try to give people the most generous reason you can for their behaviour. Annoyingly slow driver? Maybe it's a mom with a birthday cake in the back. This mindset will gradually make you less reactive, more compassionate and more forgiving of your own bad days.",121062,nvfnp4,https://www.reddit.com/r/LifeProTips/comments/nvfnp4/lpt_when_you_dont_have_all_the_facts_try_to_give/,2643,1623189282.0,ContributionNarrow88,0.92,/r/LifeProTips/comments/nvfnp4/lpt_when_you_dont_have_all_the_facts_try_to_give/,LifeProTips,21894053,1
"LPT: If someone slights/insults you publicly during a meeting, pretend like you didn't hear them the first time and politely ask them to repeat themself. They'll either double-down & repeat the insult again, making them look rude & unprofessional. Or they'll realize their mistake & apologize to you.",104954,lxt9ld,https://www.reddit.com/r/LifeProTips/comments/lxt9ld/lpt_if_someone_slightsinsults_you_publicly_during/,2523,1614886880.0,brandonmcgritle,0.91,/r/LifeProTips/comments/lxt9ld/lpt_if_someone_slightsinsults_you_publicly_during/,LifeProTips,21894053,1
"LPT: When someone gets interrupted while telling a story, invite them to continue after the interruption is over with an, “as you were saying about (x)” or something similar. It can be uncomfortable for the person to start back up and this makes them feel like you valued their words.",97019,jyxteb,https://www.reddit.com/r/LifeProTips/comments/jyxteb/lpt_when_someone_gets_interrupted_while_telling_a/,1402,1606060405.0,Po1sonator,0.9,/r/LifeProTips/comments/jyxteb/lpt_when_someone_gets_interrupted_while_telling_a/,LifeProTips,21894053,1
"LPT: ""Off-brand"" was a term created by branded companies to make their cheaper competitors look bad. Don't see cheaper alternatives as lower quality or knock-offs, see them as a competitor. Some often are better than the branded version but the marketing psychology stops you from seeing that.",90431,o6cc19,https://www.reddit.com/r/LifeProTips/comments/o6cc19/lpt_offbrand_was_a_term_created_by_branded/,4355,1624453225.0,seanmashitoshi,0.84,/r/LifeProTips/comments/o6cc19/lpt_offbrand_was_a_term_created_by_branded/,LifeProTips,21894053,1
"LPT: It is important to know when to stop arguing with people, and simply let them be wrong.",90226,g519pk,https://www.reddit.com/r/LifeProTips/comments/g519pk/lpt_it_is_important_to_know_when_to_stop_arguing/,2333,1587416706.0,ritzz2_0,0.93,/r/LifeProTips/comments/g519pk/lpt_it_is_important_to_know_when_to_stop_arguing/,LifeProTips,21894053,1
LPT: Know you're about to get fired? Then for heaven's sake don't throw your resignation in first in one last show of defiance. The meeting where they let you go is your chance to extract a great severance package and positive references. Employers want a clean departure—don't make their life easy.,89025,jk9d7n,https://www.reddit.com/r/LifeProTips/comments/jk9d7n/lpt_know_youre_about_to_get_fired_then_for/,2590,1603975624.0,m77w,0.9,/r/LifeProTips/comments/jk9d7n/lpt_know_youre_about_to_get_fired_then_for/,LifeProTips,21894053,1
"LPT: Roast yo’ broccoli. Broccoli is a cheap, ubiquitous vegetable that too often is steamed or boiled to death, sapping nutrients and flavor. Toss with olive oil and salt and roast at 400.",86825,i5ko7x,https://www.reddit.com/r/LifeProTips/comments/i5ko7x/lpt_roast_yo_broccoli_broccoli_is_a_cheap/,3889,1596829646.0,RockleyBob,0.9,/r/LifeProTips/comments/i5ko7x/lpt_roast_yo_broccoli_broccoli_is_a_cheap/,LifeProTips,21894053,1
LPT: Billionaires like to rewrite their origin story to amplify their achievements against a backdrop of adversity that didn't really exist. Take their life advice with a pinch of salt: it probably won't work for you.,78818,jfx4ud,https://www.reddit.com/r/LifeProTips/comments/jfx4ud/lpt_billionaires_like_to_rewrite_their_origin/,4043,1603362624.0,m77w,0.85,/r/LifeProTips/comments/jfx4ud/lpt_billionaires_like_to_rewrite_their_origin/,LifeProTips,21894053,1
"LPT: Loyalty to your company only rewards the company. Hopping companies is the best way to increase your salary, don't sit there hoping for a raise. Apply to other jobs, get a better offer and use it to leverage a raise or take the offer.",77233,o7jyzc,https://www.reddit.com/r/LifeProTips/comments/o7jyzc/lpt_loyalty_to_your_company_only_rewards_the/,3410,1624611840.0,seanmashitoshi,0.89,/r/LifeProTips/comments/o7jyzc/lpt_loyalty_to_your_company_only_rewards_the/,LifeProTips,21894053,1
LPT: It only takes about 2-3 weeks of clicking unsubscribe on every single marketing email you receive to change your inbox (and your life) forever,73587,jgpzpr,https://www.reddit.com/r/LifeProTips/comments/jgpzpr/lpt_it_only_takes_about_23_weeks_of_clicking/,1849,1603469120.0,m77w,0.89,/r/LifeProTips/comments/jgpzpr/lpt_it_only_takes_about_23_weeks_of_clicking/,LifeProTips,21894053,1
"LPT: Don't answer those social media posts like, ""Your first car, first street you lived on and first dog is your rock star name"" Countless people are sharing these and answering them without realizing it is security questions 101 for all of your online banking and many other security measures.",73459,nm9egi,https://www.reddit.com/r/LifeProTips/comments/nm9egi/lpt_dont_answer_those_social_media_posts_like/,2000,1622127731.0,Po1sonator,0.88,/r/LifeProTips/comments/nm9egi/lpt_dont_answer_those_social_media_posts_like/,LifeProTips,21894053,1
"LPT: Dreading something? Avoidance makes it 100x harder because it completely disempowers you. When the only way out is through, turn and face the discomfort, take a deep breath and walk towards it. This is neuroscience-backed, see full post.",68240,k3j7g7,https://www.reddit.com/r/LifeProTips/comments/k3j7g7/lpt_dreading_something_avoidance_makes_it_100x/,1244,1606690119.0,ContributionNarrow88,0.9,/r/LifeProTips/comments/k3j7g7/lpt_dreading_something_avoidance_makes_it_100x/,LifeProTips,21894053,1
LPT: Those viral posts asking things like “Your stripper name is your first pet and your mother’s maiden name” are amazingly effective ways to reveal answers to common security questions you may be using elsewhere.,66499,dsemsi,https://www.reddit.com/r/LifeProTips/comments/dsemsi/lpt_those_viral_posts_asking_things_like_your/,1351,1573037229.0,squonch,0.92,/r/LifeProTips/comments/dsemsi/lpt_those_viral_posts_asking_things_like_your/,LifeProTips,21894053,1
LPT: wear earplugs to loud concert venues. Tinnitus is real and not fun.,65196,u8mx0y,https://www.reddit.com/r/LifeProTips/comments/u8mx0y/lpt_wear_earplugs_to_loud_concert_venues_tinnitus/,2757,1650545440.0,flux_capacitor3,0.91,/r/LifeProTips/comments/u8mx0y/lpt_wear_earplugs_to_loud_concert_venues_tinnitus/,LifeProTips,21894053,1
"LPT: When you have a 3 day weekend, do all of your chores (laundry, cleaning, homework, projects, etc) the night BEFORE your 3 day weekend begins. You may have to stay up late that night but you'll thank yourself later when you have 3 full days to relax.",65021,jm5y15,https://www.reddit.com/r/LifeProTips/comments/jm5y15/lpt_when_you_have_a_3_day_weekend_do_all_of_your/,875,1604251096.0,karacold,0.86,/r/LifeProTips/comments/jm5y15/lpt_when_you_have_a_3_day_weekend_do_all_of_your/,LifeProTips,21894053,1
"LPT: Want to be more charismatic? Don't try to be more impressive or entertaining, focus on being a very good engaged listener. Engaged listeners make eye-contact, ask questions to bring the speaker out, and don't interject with their own stories or change the conversation to be about them.",63655,leophm,https://www.reddit.com/r/LifeProTips/comments/leophm/lpt_want_to_be_more_charismatic_dont_try_to_be/,812,1612712261.0,zazzlekdazzle,0.87,/r/LifeProTips/comments/leophm/lpt_want_to_be_more_charismatic_dont_try_to_be/,LifeProTips,21894053,1
LPT: Some people aren't good at asking for help because they're so used to being 'the helper'.,62924,gbf20y,https://www.reddit.com/r/LifeProTips/comments/gbf20y/lpt_some_people_arent_good_at_asking_for_help/,1663,1588325700.0,ritzz2_0,0.92,/r/LifeProTips/comments/gbf20y/lpt_some_people_arent_good_at_asking_for_help/,LifeProTips,21894053,1
"LPT: If you are in your 20s, study Personal Finance like your life depended on it (Investing, 401 (k), Roth IRA (RRSP and TFSA in Canada), credit score, credit and debit cards, debts, loans, bankruptcy, etc.) It's a travesty that it's not mandatory learning in school.",62316,jlqdk6,https://www.reddit.com/r/LifeProTips/comments/jlqdk6/lpt_if_you_are_in_your_20s_study_personal_finance/,1965,1604179243.0,CircleBox2,0.86,/r/LifeProTips/comments/jlqdk6/lpt_if_you_are_in_your_20s_study_personal_finance/,LifeProTips,21894053,1
"LPT: Either they like you or they don't. Never try to convince somebody of your worth. If a person doesn't appreciate you, they don't deserve you. Respect yourself and be with people who truly value ""you""",60605,glfchx,https://www.reddit.com/r/LifeProTips/comments/glfchx/lpt_either_they_like_you_or_they_dont_never_try/,1090,1589721834.0,ritzz2_0,0.81,/r/LifeProTips/comments/glfchx/lpt_either_they_like_you_or_they_dont_never_try/,LifeProTips,21894053,1
"LPT: If someone doesn't appreciate something you do for them, it probably means that it isn't that important to them. Rather than stew about it or demand recognition, just add it to the list of things you don't need to do anymore.",58807,78i41s,https://www.reddit.com/r/LifeProTips/comments/78i41s/lpt_if_someone_doesnt_appreciate_something_you_do/,1521,1508872905.0,zazzlekdazzle,0.84,/r/LifeProTips/comments/78i41s/lpt_if_someone_doesnt_appreciate_something_you_do/,LifeProTips,21894053,1
"LPT: The news will NEVER be positive. Even if there was a news network in heaven, it would find something negative to talk about. It can only make money by injecting you with negative emotions and riling you up. Avoiding the news is the cheapest and fastest way to improving your mental health.",58597,sj2gsi,https://www.reddit.com/r/LifeProTips/comments/sj2gsi/lpt_the_news_will_never_be_positive_even_if_there/,2271,1643842180.0,CircleBox2,0.72,/r/LifeProTips/comments/sj2gsi/lpt_the_news_will_never_be_positive_even_if_there/,LifeProTips,21894053,1
"LPT: when your ISP raises your bill, call in and say “cancel service” to the automated operator. You’ll be sent to their retention team with no waiting on hold. They will usually take $10-20 off your monthly bill for a year. I do this once a year.",56915,8mpx3g,https://www.reddit.com/r/LifeProTips/comments/8mpx3g/lpt_when_your_isp_raises_your_bill_call_in_and/,2460,1527512817.0,flux_capacitor3,0.88,/r/LifeProTips/comments/8mpx3g/lpt_when_your_isp_raises_your_bill_call_in_and/,LifeProTips,21894053,1
LPT: This is a friendly reminder that employees currently have more power to negotiate for improved benefits and pay raises than at any point in the last 20+ years. Take advantage of it!!,56072,sdysgb,https://www.reddit.com/r/LifeProTips/comments/sdysgb/lpt_this_is_a_friendly_reminder_that_employees/,1319,1643291285.0,hoesindifareacodes,0.89,/r/LifeProTips/comments/sdysgb/lpt_this_is_a_friendly_reminder_that_employees/,LifeProTips,21894053,1
LPT: Confirmation bias is real for everyone. Be aware of your own bias and seek your news from more neutral sources. Your daily stress and anxiety levels will drop a lot.,55402,io7gc3,https://www.reddit.com/r/LifeProTips/comments/io7gc3/lpt_confirmation_bias_is_real_for_everyone_be/,2600,1599485403.0,hoesindifareacodes,0.85,/r/LifeProTips/comments/io7gc3/lpt_confirmation_bias_is_real_for_everyone_be/,LifeProTips,21894053,1
"LPT: Friends and family will hold on to grudges long after you’ve forgiven your SO. It’s easy to get into the habit of venting to them about your relationship, but unless it’s toxic or abusive, remember they don’t get to see the good along with the bad.",53024,iymo34,https://www.reddit.com/r/LifeProTips/comments/iymo34/lpt_friends_and_family_will_hold_on_to_grudges/,601,1600908281.0,RockleyBob,0.94,/r/LifeProTips/comments/iymo34/lpt_friends_and_family_will_hold_on_to_grudges/,LifeProTips,21894053,1
"LPT: Create a separate ""Future Me"" identity, and go out of your way to do nice things for them. Easiest form of self-care I've found.",52760,j4onsg,https://www.reddit.com/r/LifeProTips/comments/j4onsg/lpt_create_a_separate_future_me_identity_and_go/,1078,1601766318.0,ContributionNarrow88,0.93,/r/LifeProTips/comments/j4onsg/lpt_create_a_separate_future_me_identity_and_go/,LifeProTips,21894053,1
"LPT: When wearing a tie on a windy day, slip a coin down the inside of the hem to keep the tie from blowing around.",52440,j2xnwq,https://www.reddit.com/r/LifeProTips/comments/j2xnwq/lpt_when_wearing_a_tie_on_a_windy_day_slip_a_coin/,1174,1601510091.0,raviji22,0.9,/r/LifeProTips/comments/j2xnwq/lpt_when_wearing_a_tie_on_a_windy_day_slip_a_coin/,LifeProTips,21894053,1
"LPT: If you are signing a new rental agreement or lease, copy plain text from the old one and the new one into different Word documents. Then use the Review->Compare feature to see every detail of what your landlord changed.",52331,uijzyt,https://www.reddit.com/r/LifeProTips/comments/uijzyt/lpt_if_you_are_signing_a_new_rental_agreement_or/,796,1651708122.0,9oreos,0.95,/r/LifeProTips/comments/uijzyt/lpt_if_you_are_signing_a_new_rental_agreement_or/,LifeProTips,21894053,1
"LPT: Don't ""Hi"" your coworkers on Slack or Teams in an attempt to rope them into a synchronous conversation they may not have time for. If you have a work-related question, simply ask it up front. If you need to schedule a chat, provide context so they can prioritize their time.",52005,t48pfa,https://www.reddit.com/r/LifeProTips/comments/t48pfa/lpt_dont_hi_your_coworkers_on_slack_or_teams_in/,2580,1646143672.0,RockleyBob,0.78,/r/LifeProTips/comments/t48pfa/lpt_dont_hi_your_coworkers_on_slack_or_teams_in/,LifeProTips,21894053,1
"LPT: If you’re working in a technical role (IT, Engineering, etc), write everything you do down as if it was a user manual. Ignore those who say it will be used to replace you. It is far more likely to be used to show management “you can give me that promotion, as the next guy is all set”.",51163,drmk5z,https://www.reddit.com/r/LifeProTips/comments/drmk5z/lpt_if_youre_working_in_a_technical_role_it/,1773,1572895223.0,squonch,0.84,/r/LifeProTips/comments/drmk5z/lpt_if_youre_working_in_a_technical_role_it/,LifeProTips,21894053,1
"LPT: There will come a time in your life when it feels like you have no friends. The sooner you can learn to be alone without feeling lonely, the more survivable that time will be.",51163,m7g4mh,https://www.reddit.com/r/LifeProTips/comments/m7g4mh/lpt_there_will_come_a_time_in_your_life_when_it/,1408,1616031551.0,9oreos,0.87,/r/LifeProTips/comments/m7g4mh/lpt_there_will_come_a_time_in_your_life_when_it/,LifeProTips,21894053,1
"LPT: If you want to learn a new language, figure out the 100 most frequently used words and start with them. Those words make up about 50% of everyday speech, and should be a very solid basis.",50973,dzf42o,https://www.reddit.com/r/LifeProTips/comments/dzf42o/lpt_if_you_want_to_learn_a_new_language_figure/,1168,1574317094.0,Myst1kSkorpioN,0.83,/r/LifeProTips/comments/dzf42o/lpt_if_you_want_to_learn_a_new_language_figure/,LifeProTips,21894053,1
"LPT: When making a visible mistake in front of your peers, always admit fault immediately. Admitting you are a human who isn't perfect will diffuse alot of backlash and flack you would receive otherwise. It will reflect maturity and will take attention off the mistake you made.",50564,mdtpip,https://www.reddit.com/r/LifeProTips/comments/mdtpip/lpt_when_making_a_visible_mistake_in_front_of/,944,1616779526.0,brandonmcgritle,0.9,/r/LifeProTips/comments/mdtpip/lpt_when_making_a_visible_mistake_in_front_of/,LifeProTips,21894053,1
"LPT: When giving advice, use the phrase “perhaps” in replacement of “I think” so it comes off more as a suggestion and not an opinion. It will be more likely to be heard and taken into consideration.",50289,j39u54,https://www.reddit.com/r/LifeProTips/comments/j39u54/lpt_when_giving_advice_use_the_phrase_perhaps_in/,917,1601563244.0,raviji22,0.87,/r/LifeProTips/comments/j39u54/lpt_when_giving_advice_use_the_phrase_perhaps_in/,LifeProTips,21894053,1
"LPT: Try to be understanding of people with chronic pain. Some people have pain disabilities you can't see in their joints, back or bones. It is easy to think they should be able to do more, but unless you have experienced sever back pain or similar items it is really hard to understand.",50160,ip33dk,https://www.reddit.com/r/LifeProTips/comments/ip33dk/lpt_try_to_be_understanding_of_people_with/,1776,1599602132.0,Po1sonator,0.87,/r/LifeProTips/comments/ip33dk/lpt_try_to_be_understanding_of_people_with/,LifeProTips,21894053,1
"LPT: If you accidentally press the spacebar and scroll down the page, you can press Shift+Space and go back to where you were",49866,dy257y,https://www.reddit.com/r/LifeProTips/comments/dy257y/lpt_if_you_accidentally_press_the_spacebar_and/,563,1574077581.0,Myst1kSkorpioN,0.94,/r/LifeProTips/comments/dy257y/lpt_if_you_accidentally_press_the_spacebar_and/,LifeProTips,21894053,1
"LPT: When your mental health isn't in the best state, give yourself a break. Don't feel guilty for things you can't do. Normal things like eating, sleeping or socialising may be difficult, it's okay to struggle. Rest, recover, be kind to yourself and know the bad times are temporary.",49778,gfyx8e,https://www.reddit.com/r/LifeProTips/comments/gfyx8e/lpt_when_your_mental_health_isnt_in_the_best/,1021,1588963445.0,ritzz2_0,0.89,/r/LifeProTips/comments/gfyx8e/lpt_when_your_mental_health_isnt_in_the_best/,LifeProTips,21894053,1
"LPT: When deciding on a new job, don't underestimate the importance of its distance from your house. Sometimes a bad job can be made worse by a long commute home and vice versa.",49580,ph2v1v,https://www.reddit.com/r/LifeProTips/comments/ph2v1v/lpt_when_deciding_on_a_new_job_dont_underestimate/,1710,1630666625.0,karacold,0.92,/r/LifeProTips/comments/ph2v1v/lpt_when_deciding_on_a_new_job_dont_underestimate/,LifeProTips,21894053,1
"LPT: No one will remember your GPA, your salary, your fancy job title. People WILL remember your time spent with them, your experiences with them, your character & how you treated them. In the end, some things matter, others don’t.",48238,t7isie,https://www.reddit.com/r/LifeProTips/comments/t7isie/lpt_no_one_will_remember_your_gpa_your_salary/,961,1646514156.0,raviji22,0.83,/r/LifeProTips/comments/t7isie/lpt_no_one_will_remember_your_gpa_your_salary/,LifeProTips,21894053,1
