title,score,id,url,num_comments,created,author,upvote_ratio,permalink,subreddit,subreddit_subscribers,depth
"Poll finds a third of Americans think they handled COVID-19 better than Canada, and are also delusional",39287,ijxmwb,https://www.thestar.com/opinion/star-columnists/2020/08/31/poll-finds-a-third-of-americans-think-they-handled-covid-19-better-than-canada-and-are-also-delusional.html,2327,1598879247.0,viva_la_vinyl,0.81,/r/canada/comments/ijxmwb/poll_finds_a_third_of_americans_think_they/,canada,1630670,2
Sophie Gregoire Trudeau tests positive for COVID-19,38488,fhs081,https://beta.ctvnews.ca/national/2020/3/12/1_4850159.html,2839,1584064414.0,Austin63867,0.94,/r/canada/comments/fhs081/sophie_gregoire_trudeau_tests_positive_for_covid19/,canada,1630670,2
I am posting this here to give it a larger coverage.,38068,7le26m,https://i.redd.it/dlx9qshold501.jpg,1206,1513905800.0,anislitim,0.84,/r/canada/comments/7le26m/i_am_posting_this_here_to_give_it_a_larger/,canada,1630670,2
3M says White House asked it stop exporting U.S.-made respirators to Canada,35668,fu8mw0,http://www.bnnbloomberg.ca/3m-says-white-house-asked-it-stop-exporting-u-s-made-respirators-to-canada-1.1416965,4207,1585921345.0,fractx,0.89,/r/canada/comments/fu8mw0/3m_says_white_house_asked_it_stop_exporting/,canada,1630670,2
"COVID-19: Kijiji bans listings for toilet paper, hand sanitizer, face masks and other items",34405,fiicnq,https://montreal.ctvnews.ca/covid-19-kijiji-bans-listings-for-toilet-paper-hand-sanitizer-face-masks-and-other-items-1.4853107,1047,1584192490.0,fractx,0.96,/r/canada/comments/fiicnq/covid19_kijiji_bans_listings_for_toilet_paper/,canada,1630670,2
"‘Everybody will love it’: A four-day work week could help rebuild Canada’s economy post-COVID-19, experts say",34092,gqahpw,https://nationalpost.com/news/canada/floating-the-idea-of-a-four-day-work-week-as-a-way-to-rebuild-canada,2102,1590411338.0,feb914,0.92,/r/canada/comments/gqahpw/everybody_will_love_it_a_fourday_work_week_could/,canada,1630670,2
Foreign home buyers officially banned from purchasing real estate in Canada,32087,100oh0u,https://www.blogto.com/real-estate-toronto/2023/01/foreign-home-buyers-canada-ban/,1849,1672594225.0,Defiant_Race_7544,0.96,/r/canada/comments/100oh0u/foreign_home_buyers_officially_banned_from/,canada,1630670,2
PM Trudeau announces federal ban on assault-style firearms in Canada,28988,gbkbns,https://www.ctvnews.ca/mobile/politics/pm-trudeau-announces-federal-ban-on-assault-style-firearms-in-canada-1.4920528,12499,1588347323.0,NeptuneAgency,0.78,/r/canada/comments/gbkbns/pm_trudeau_announces_federal_ban_on_assaultstyle/,canada,1630670,2
"Young Canadians go to school longer for jobs that pay less, and then face soaring home prices",27962,xtpmhb,https://www.theglobeandmail.com/investing/personal-finance/young-money/article-young-canadians-personal-finance-housing-crisis/,2348,1664719428.0,FancyNewMe,0.94,/r/canada/comments/xtpmhb/young_canadians_go_to_school_longer_for_jobs_that/,canada,1630670,2
Quebec to impose 'significant' financial penalty against people who refuse to get vaccinated,27294,s1jpqt,https://montreal.ctvnews.ca/quebec-to-impose-significant-financial-penalty-against-people-who-refuse-to-get-vaccinated-1.5735536,9490,1641925470.0,seakucumber,0.78,/r/canada/comments/s1jpqt/quebec_to_impose_significant_financial_penalty/,canada,1630670,2
"If restrictions and mandates are being lifted, thank the silent majority that got vaccinated",27268,swknwp,https://www.theglobeandmail.com/opinion/editorials/article-if-restrictions-and-mandates-are-being-lifted-thank-the-silent/,3513,1645306887.0,Mighty_L_LORT,0.7,/r/canada/comments/swknwp/if_restrictions_and_mandates_are_being_lifted/,canada,1630670,2
That time of year.,27060,7gemrl,https://i.redd.it/h9bupiyb1y001.jpg,465,1511973981.0,KanataCitizen,0.94,/r/canada/comments/7gemrl/that_time_of_year/,canada,1630670,2
There Are Growing Calls to Finally Tax the Catholic Church,25551,og7z9v,https://www.vice.com/en/article/m7ep4x/there-are-growing-calls-to-finally-tax-the-catholic-church,1975,1625753427.0,KanataCitizen,0.88,/r/canada/comments/og7z9v/there_are_growing_calls_to_finally_tax_the/,canada,1630670,2
Billboard spotted in Los Angeles,25272,6u6bxn,https://i.redd.it/trk3q6yqy6gz.png,1249,1502929271.0,anislitim,0.83,/r/canada/comments/6u6bxn/billboard_spotted_in_los_angeles/,canada,1630670,2
FYI for those who didn’t get the alert.,24989,8iqzes,https://i.redd.it/4n5b9335eax01.jpg,313,1526070684.0,devdevo1919,0.92,/r/canada/comments/8iqzes/fyi_for_those_who_didnt_get_the_alert/,canada,1630670,2
Posthaste: Majority of Canadians say they can no longer keep up with inflation | 53 per cent of respondents in an Angus Reid poll say their finances are being overtaken by the rising costs of everything from gas to groceries,24932,t5s639,https://financialpost.com/executive/executive-summary/posthaste-majority-of-canadians-say-they-can-no-longer-keep-up-with-inflation,3180,1646315929.0,viva_la_vinyl,0.95,/r/canada/comments/t5s639/posthaste_majority_of_canadians_say_they_can_no/,canada,1630670,2
Ukraine invasion shows why Canada needs to become an energy superpower,24360,t1xkmu,https://nationalpost.com/opinion/adam-pankratz-ukraine-invasion-shows-why-canada-needs-to-become-an-energy-superpower,1603,1645883554.0,uselesspoliticalhack,0.87,/r/canada/comments/t1xkmu/ukraine_invasion_shows_why_canada_needs_to_become/,canada,1630670,2
"Biden to cancel Keystone XL pipeline permit on first day in office, sources confirm | CBC News",24211,kzi0fr,https://www.cbc.ca/news/canada/calgary/biden-keystone-xl-1.5877038,1597,1610926876.0,Seebeeeseh,0.92,/r/canada/comments/kzi0fr/biden_to_cancel_keystone_xl_pipeline_permit_on/,canada,1630670,2
Jeopardy! Host Alex Trebek Dead at 80,23900,jqfnvo,https://news.yahoo.com/jeopardy-host-alex-trebek-dead-172521141.html,493,1604856746.0,cyclinginvancouver,0.93,/r/canada/comments/jqfnvo/jeopardy_host_alex_trebek_dead_at_80/,canada,1630670,2
Tip-flation has some restaurants asking for up to 30% in tips - The suggested gratuity on some point-of-sale terminals keeps trending upward,23389,wuokwa,https://www.cbc.ca/radio/costofliving/tipflation-gratuities-1.6555135,4808,1661159309.0,sirharryflashman,0.94,/r/canada/comments/wuokwa/tipflation_has_some_restaurants_asking_for_up_to/,canada,1630670,2
U.S. Rep. Ocasio-Cortez raises $200K after battling Jagmeet Singh in hit video game Among Us,23284,k39fjq,https://www.cbc.ca/news/politics/among-us-singh-ocasio-cortez-200k-donations-1.5820831,1353,1606656779.0,viva_la_vinyl,0.83,/r/canada/comments/k39fjq/us_rep_ocasiocortez_raises_200k_after_battling/,canada,1630670,2
Trump gives FEMA power to restrict trade of essential goods into Canada despite warning from Trudeau,22964,futo8j,https://www.theglobeandmail.com/canada/article-trudeau-warns-us-over-restricting-the-trade-of-essential-goods-into/,4588,1586006709.0,fractx,0.9,/r/canada/comments/futo8j/trump_gives_fema_power_to_restrict_trade_of/,canada,1630670,2
"Ontario's new math curriculum to introduce coding, personal finance starting in Grade 1",22555,heilv6,https://www.cp24.com/news/ontario-s-new-math-curriculum-to-introduce-coding-personal-finance-starting-in-grade-1-1.4995865,1253,1592932343.0,feb914,0.96,/r/canada/comments/heilv6/ontarios_new_math_curriculum_to_introduce_coding/,canada,1630670,2
"Trudeau unveils $82B COVID-19 emergency response package for Canadians, businesses",22409,fkqwtn,https://www.cbc.ca/news/politics/economic-aid-package-coronavirus-1.5501037,2135,1584543823.0,NeptuneAgency,0.95,/r/canada/comments/fkqwtn/trudeau_unveils_82b_covid19_emergency_response/,canada,1630670,2
"Are the Proud Boys terrorists? Ottawa considers listing white supremacist groups alongside al-Qaida, Islamic State",21910,kv2z8f,https://www.thestar.com/politics/federal/2021/01/10/are-the-proud-boys-terrorists-ottawa-considers-listing-white-supremacist-groups-alongside-al-qaida-islamic-state.html,1421,1610372932.0,viva_la_vinyl,0.9,/r/canada/comments/kv2z8f/are_the_proud_boys_terrorists_ottawa_considers/,canada,1630670,2
"Trudeau makes history, invokes Emergencies Act to deal with trucker protests",21281,ssm73r,https://www.ctvnews.ca/politics/trudeau-makes-history-invokes-emergencies-act-to-deal-with-trucker-protests-1.5780283,9883,1644874861.0,cyclinginvancouver,0.79,/r/canada/comments/ssm73r/trudeau_makes_history_invokes_emergencies_act_to/,canada,1630670,2
Canadians push back as U.S. Congress pressures Canada to reopen shared border,20536,hp2c12,https://www.ctvnews.ca/politics/canadians-push-back-as-u-s-congress-pressures-canada-to-reopen-shared-border-1.5019295,2345,1594434710.0,Mighty_L_LORT,0.95,/r/canada/comments/hp2c12/canadians_push_back_as_us_congress_pressures/,canada,1630670,2
It’s not fair to judge all police officers based on the few bad apples we violently defend at all costs,20200,gunbdm,https://www.thebeaverton.com/2020/06/its-not-fair-to-judge-all-police-officers-based-on-the-few-bad-apples-we-violently-defend-at-all-costs/,1536,1591027692.0,L0ngp1nk,0.82,/r/canada/comments/gunbdm/its_not_fair_to_judge_all_police_officers_based/,canada,1630670,2
Halloween is a big deal in Nunavut! Happy Halloween! 🎃,19960,jlw43k,https://www.reddit.com/gallery/jlw43k,456,1604202745.0,BananaH8ter,0.95,/r/canada/comments/jlw43k/halloween_is_a_big_deal_in_nunavut_happy_halloween/,canada,1630670,2
Most of the crime guns seized in Toronto are smuggled into Canada from U.S.: Police,19532,x40rac,https://nationalpost.com/news/canada/most-of-the-crime-guns-in-toronto-this-summer-were-smuggled-into-canada-from-u-s,2232,1662123073.0,uselesspoliticalhack,0.91,/r/canada/comments/x40rac/most_of_the_crime_guns_seized_in_toronto_are/,canada,1630670,2
Facebook named most toxic social media platform by 40 per cent of Canadians,19448,hs97vu,https://www.cira.ca/newsroom/corporate/facebook-named-most-toxic-social-media-platform-40-cent-canadians,707,1594904534.0,jdtabish,0.95,/r/canada/comments/hs97vu/facebook_named_most_toxic_social_media_platform/,canada,1630670,2
"By 9:43 a.m., Canada's richest CEOs have already earned the average worker's annual salary",19344,1029fuq,https://www.cbc.ca/news/business/canada-richest-ceo-average-salary-1.6701407,1329,1672755759.0,morenewsat11,0.94,/r/canada/comments/1029fuq/by_943_am_canadas_richest_ceos_have_already/,canada,1630670,2
Almost 9 out of 10 Canadians feel food prices are rising faster than income: survey,19081,ebxb33,https://globalnews.ca/news/6303603/canadians-food-prices-rising-income-survey/,1865,1576596944.0,KanataCitizen,0.95,/r/canada/comments/ebxb33/almost_9_out_of_10_canadians_feel_food_prices_are/,canada,1630670,2
Over half of Ontarians plan to cancel Netflix over password sharing crackdown: poll,18810,116ci53,https://mobilesyrup.com/2023/02/17/over-half-of-ontarians-plan-to-cancel-netflix-over-password-sharing-crackdown-poll/,1780,1676817663.0,Defiant_Race_7544,0.94,/r/canada/comments/116ci53/over_half_of_ontarians_plan_to_cancel_netflix/,canada,1630670,2
Vaccinated Canadians feel entitled to ‘greater freedoms’ than non-vaccinated: poll,18748,oukss3,https://nationalpost.com/news/canada/vaccinated-canadians-feel-entitled-to-greater-freedoms-than-non-vaccinated-as-tensions-rise-poll,5540,1627652425.0,FancyNewMe,0.87,/r/canada/comments/oukss3/vaccinated_canadians_feel_entitled_to_greater/,canada,1630670,2
Billboard opposing Bell's SOPA-style website blocking proposal goes live over Yonge & Dundas,18651,80rljo,https://i.redd.it/g9qesmeqjui01.jpg,388,1519777105.0,jdtabish,0.94,/r/canada/comments/80rljo/billboard_opposing_bells_sopastyle_website/,canada,1630670,2
"Justin Trudeau was warranted in using Emergencies Act to shut down ‘Freedom Convoy,’ inquiry report finds",18623,114se0r,https://www.thestar.com/politics/federal/2023/02/17/report-on-justin-trudeau-governments-decision-to-invoke-emergencies-act-in-freedom-convoy-protests-slated-for-release-today.html?utm_source=Twitter&utm_medium=SocialMedia&utm_campaign=Federalpolitics&utm_content=emergenciesactreport,3525,1676654783.0,Austin63867,0.79,/r/canada/comments/114se0r/justin_trudeau_was_warranted_in_using_emergencies/,canada,1630670,2
Report: Self-entitled Generation Z wants to live past the age of 40,18559,da24tw,https://www.thebeaverton.com/2019/09/report-self-entitled-generation-z-wants-to-live-past-the-age-of-40/,1067,1569598593.0,pubwash,0.84,/r/canada/comments/da24tw/report_selfentitled_generation_z_wants_to_live/,canada,1630670,2
NDP calling for probe of grocery store profits as food prices continue to rise,18367,xpebp6,https://www.cbc.ca/news/politics/ndp-committee-study-grocer-store-profits-inflation-1.6596742,1906,1664278720.0,viva_la_vinyl,0.95,/r/canada/comments/xpebp6/ndp_calling_for_probe_of_grocery_store_profits_as/,canada,1630670,2
Nearly 70 per cent of Canadians say next vehicle purchase will be electric,17783,ls4q5v,https://techbomb.ca/sustainability/nearly-70-per-cent-of-canadians-say-next-vehicle-purchase-will-be-electric/,2395,1614253361.0,NeptuneAgency,0.91,/r/canada/comments/ls4q5v/nearly_70_per_cent_of_canadians_say_next_vehicle/,canada,1630670,2
"Canadians think tipping is ‘getting out of control,’ new poll suggest",17319,1175eaz,https://globalnews.ca/news/9498238/tipping-canada-angus-reid-poll/,2188,1676896033.0,viva_la_vinyl,0.95,/r/canada/comments/1175eaz/canadians_think_tipping_is_getting_out_of_control/,canada,1630670,2
"Millennials are working and working hard. In fact, they’re actually participating in the labour force more and, by some measures, working harder than previous generations did",17046,amd8yl,https://ottawacitizen.com/news/national/the-millennial-dilemna-and-what-it-means-for-the-rest-of-us,1532,1549106571.0,NeptuneAgency,0.9,/r/canada/comments/amd8yl/millennials_are_working_and_working_hard_in_fact/,canada,1630670,2
Happy New Year from our town in Nunavut! The annual fireworks display over the Arctic Ocean is always a hit! Here’s to a great 2021 Canada!,16890,ko97la,https://i.redd.it/p03p300o7p861.jpg,308,1609497092.0,BananaH8ter,0.98,/r/canada/comments/ko97la/happy_new_year_from_our_town_in_nunavut_the/,canada,1630670,2
"Ontario closes schools until Jan. 17, bans indoor dining and cuts capacity limits",16767,rv5jvw,https://toronto.ctvnews.ca/ontario-closes-schools-until-jan-17-bans-indoor-dining-and-cuts-capacity-limits-1.5726162,4244,1641227203.0,cyclinginvancouver,0.9,/r/canada/comments/rv5jvw/ontario_closes_schools_until_jan_17_bans_indoor/,canada,1630670,2
"Unvaccinated workers who lose jobs ineligible for EI benefits, minister says",16356,rt5hq3,https://nationalpost.com/news/canada/unvaccinated-workers-who-lose-jobs-ineligible-for-ei-benefits-barring-exemption-minister-says,4545,1640991502.0,FancyNewMe,0.84,/r/canada/comments/rt5hq3/unvaccinated_workers_who_lose_jobs_ineligible_for/,canada,1630670,2
"Tensions high between vaccinated and unvaccinated in Canada, poll suggests",16318,pwgmn9,https://www.ctvnews.ca/health/coronavirus/tensions-high-between-vaccinated-and-unvaccinated-in-canada-poll-suggests-1.5601636,4539,1632747865.0,FancyNewMe,0.92,/r/canada/comments/pwgmn9/tensions_high_between_vaccinated_and_unvaccinated/,canada,1630670,2
Poll shows majority of Canadians support barring unvaccinated from public gatherings,16134,oy5sm7,https://www.theglobeandmail.com/politics/article-poll-shows-majority-of-canadians-support-barring-unvaccinated-from/,3894,1628121956.0,90skid91,0.86,/r/canada/comments/oy5sm7/poll_shows_majority_of_canadians_support_barring/,canada,1630670,2
'I regret going': Protester says he spent life savings to support 'Freedom Convoy',15951,tm3elo,https://www.cbc.ca/news/canada/ottawa/ottawa-convoy-protest-regrets-1.6394502,2586,1648119969.0,CMikeHunt,0.84,/r/canada/comments/tm3elo/i_regret_going_protester_says_he_spent_life/,canada,1630670,2
Singh says taxing the rich will be among top NDP policy goals for the federal election | CBC News,15954,p2zoo9,https://www.cbc.ca/news/politics/singh-ndp-commitments-announcement-1.6138156,1949,1628774403.0,CoupleClothing,0.89,/r/canada/comments/p2zoo9/singh_says_taxing_the_rich_will_be_among_top_ndp/,canada,1630670,2
"2 out of 3 Canadians stressed about inflationary rise of food, fuel, and housing costs.",15852,ql1qp3,https://techbomb.ca/uncategorized/2-out-of-3-canadians-stressed-about-inflationary-rise-of-food-fuel-and-housing-costs/,2109,1635850974.0,NeptuneAgency,0.96,/r/canada/comments/ql1qp3/2_out_of_3_canadians_stressed_about_inflationary/,canada,1630670,2
Growing list of Canadian politicians caught travelling abroad despite pandemic,15809,kp0n0z,https://www.ctvnews.ca/mobile/politics/growing-list-of-canadian-politicians-caught-travelling-abroad-despite-pandemic-1.5251039,1105,1609605795.0,trackofalljades,0.96,/r/canada/comments/kp0n0z/growing_list_of_canadian_politicians_caught/,canada,1630670,2
'Everyone is outraged and sad': Canada shocked by killing of rare white moose. Flying Post First Nation in northern Ontario offer reward after ‘spirit’ moose – considered sacred – killed by suspected poachers,15739,jukhzt,https://www.theguardian.com/world/2020/nov/15/canada-killing-rare-white-moose-ontario,918,1605439644.0,Facerealityalready,0.96,/r/canada/comments/jukhzt/everyone_is_outraged_and_sad_canada_shocked_by/,canada,1630670,2
Elon Musk Tweets Meme Comparing Justin Trudeau to Adolf Hitler,15715,sunoy4,https://gizmodo.com/elon-musk-tweets-meme-comparing-justin-trudeau-to-adolf-1848553110,4684,1645101004.0,Defiant_Race_7544,0.85,/r/canada/comments/sunoy4/elon_musk_tweets_meme_comparing_justin_trudeau_to/,canada,1630670,2
Cannabis use among teens down by half after legalization in Canada,15629,jlhdpr,https://growcola.com/cannabis-use-among-teens-down-by-half-after-legalization-in-canada/,871,1604146570.0,viva_la_vinyl,0.95,/r/canada/comments/jlhdpr/cannabis_use_among_teens_down_by_half_after/,canada,1630670,2
Before and After of Old Growth Forrest in British Columbia.,15622,lzsi2i,https://i.redd.it/np9jp5w1hml61.png,830,1615129949.0,LarryJr-K,0.95,/r/canada/comments/lzsi2i/before_and_after_of_old_growth_forrest_in_british/,canada,1630670,2
Nearly three-quarters of Canadians say NATO should prepare to intervene in Ukraine: poll,15533,teni8i,https://www.cp24.com/news/nearly-three-quarters-of-canadians-say-nato-should-prepare-to-intervene-in-ukraine-poll-1.5819481,2245,1647346167.0,morenewsat11,0.79,/r/canada/comments/teni8i/nearly_threequarters_of_canadians_say_nato_should/,canada,1630670,2
"Conservatives must reject Trumpism and address voter anger rather than stoking it, says strategist",15395,kx48ny,https://www.cbc.ca/radio/thecurrent/the-current-for-jan-13-2021-1.5871185/conservatives-must-reject-trumpism-and-address-voter-anger-rather-than-stoking-it-says-strategist-1.5871704,1359,1610625238.0,viva_la_vinyl,0.88,/r/canada/comments/kx48ny/conservatives_must_reject_trumpism_and_address/,canada,1630671,2
"Found while metal detecting just outside Oshawa, Ontario, 🇨🇦. Wow🤯",15369,m4jsht,https://i.redd.it/qcsiius64wm61.jpg,427,1615682540.0,LarryJr-K,0.97,/r/canada/comments/m4jsht/found_while_metal_detecting_just_outside_oshawa/,canada,1630671,2
Canadian Senator Illegally Donated to Trump's Reelection Effort,15372,jj7fax,https://www.vice.com/en/article/pkdy9y/this-controversial-canadian-senator-lynn-beyak-donated-to-donald-trumps-re-election-effort-violating-campaign-finance-laws,1174,1603825258.0,seakucumber,0.93,/r/canada/comments/jj7fax/canadian_senator_illegally_donated_to_trumps/,canada,1630671,2
"Federal government to require vaccinations for all federal public servants, air and train passengers | CBC News",15353,p3oods,https://www.cbc.ca/news/politics/federal-government-mandatory-vaccinations-1.6140131,3300,1628872326.0,Seebeeeseh,0.9,/r/canada/comments/p3oods/federal_government_to_require_vaccinations_for/,canada,1630671,2
Trudeau pledges to vaccinate at least eight more people by end of September,15278,lvdn5m,https://www.thebeaverton.com/2021/03/trudeau-pledges-to-vaccinate-at-least-eight-more-people-by-end-of-september/,947,1614616533.0,PM_Your_Green_Buds,0.93,/r/canada/comments/lvdn5m/trudeau_pledges_to_vaccinate_at_least_eight_more/,canada,1630671,2
Outrage as 'anti-lockdown conspiracy theorists ignore coronavirus fears to stage public protest in Vancouver',15149,g0h04v,https://www.thesun.co.uk/news/11385702/outrage-as-anti-lockdown-conspiracy-theorists-protest-vancouver/,1885,1586776510.0,90skid91,0.83,/r/canada/comments/g0h04v/outrage_as_antilockdown_conspiracy_theorists/,canada,1630671,2
"11:17 a.m., January 4 is the time on the first workday of the year at which the average top-100 CEO has made as much money as the average Canadian worker will make all year",15005,kqb6jl,https://www.policyalternatives.ca/sites/default/files/uploads/publications/National%20Office/2021/01/Golden%20cushion.pdf,1270,1609775007.0,yogthos,0.94,/r/canada/comments/kqb6jl/1117_am_january_4_is_the_time_on_the_first/,canada,1630671,2
Study finds 42% of Canadians support socialism in Canada,14941,119wj5x,https://torontosun.com/news/national/study-finds-42-of-canadians-support-socialism-in-canada,2735,1677155347.0,uselesspoliticalhack,0.81,/r/canada/comments/119wj5x/study_finds_42_of_canadians_support_socialism_in/,canada,1630671,2
NDP wants to redistribute 'excess' corporate profits to Canadians to ease inflation,14886,v77ebg,https://nationalpost.com/news/politics/ndp-wants-to-redistribute-excess-corporate-profits-to-canadians-to-ease-inflation,2676,1654635317.0,FancyNewMe,0.9,/r/canada/comments/v77ebg/ndp_wants_to_redistribute_excess_corporate/,canada,1630671,2
Trudeau affirms women's right to choose after leak of draft U.S. ruling overturning abortion rights,14864,uhoyms,https://nationalpost.com/news/politics/trudeau-affirms-womens-right-to-choose-after-leak-of-draft-u-s-ruling-overturning-abortion-rights,1587,1651609152.0,LaconicStrike,0.89,/r/canada/comments/uhoyms/trudeau_affirms_womens_right_to_choose_after_leak/,canada,1630671,2
Ontario transgender teacher sparks controversy by wearing giant prosthetic breasts in class,14831,xk3p08,https://nationalpost.com/news/canada/ontario-transgender-teacher-sparks-controversy-by-wearing-giant-prosthetic-breasts-in-class,5774,1663763709.0,uselesspoliticalhack,0.8,/r/canada/comments/xk3p08/ontario_transgender_teacher_sparks_controversy_by/,canada,1630671,2
Saw this posted in a group on Facebook. Figured it could go here. Not promoting speeding.,14733,8g2ei0,https://i.redd.it/gtugu1ajq3v01.jpg,692,1525118409.0,devdevo1919,0.92,/r/canada/comments/8g2ei0/saw_this_posted_in_a_group_on_facebook_figured_it/,canada,1630671,2
Travellers to Canada will require a negative COVID-19 test before arriving to the country,14706,kn72zy,https://ca.news.yahoo.com/travellers-to-canada-will-require-negaitve-covid19-coronavirus-test-before-arriving-175343672.html,1262,1609351048.0,cyclinginvancouver,0.96,/r/canada/comments/kn72zy/travellers_to_canada_will_require_a_negative/,canada,1630671,2
Canada’s 1% Is Incredibly Rich. Their Wealth Needs to Be Taxed.,14697,hnvjsw,https://jacobinmag.com/2020/07/one-percent-canada-wealth-tax,1939,1594264199.0,90skid91,0.84,/r/canada/comments/hnvjsw/canadas_1_is_incredibly_rich_their_wealth_needs/,canada,1630671,2
"Trudeau promises severe consequences for Russia, Harper says Putin must be punished",14645,t0fto3,https://nationalpost.com/news/politics/trudeau-condemns-russias-attack-on-ukraine-says-russia-will-suffer-consequences,1594,1645722151.0,morenewsat11,0.93,/r/canada/comments/t0fto3/trudeau_promises_severe_consequences_for_russia/,canada,1630671,2
Let’s end publicly funded Catholic schools,14588,drn92o,https://www.theglobeandmail.com/canada/toronto/article-lets-end-publicly-funded-catholic-schools/,1905,1572897939.0,KanataCitizen,0.84,/r/canada/comments/drn92o/lets_end_publicly_funded_catholic_schools/,canada,1630671,2
Jagmeet Singh wants to tax companies making big profits during COVID,14513,j816wy,https://ipolitics.ca/2020/10/08/jagmeet-singh-wants-to-tax-companies-making-big-profits-during-covid/,1775,1602257796.0,yogthos,0.92,/r/canada/comments/j816wy/jagmeet_singh_wants_to_tax_companies_making_big/,canada,1630671,2
"Watchdog warns hiking minimum wage could lead to 50,000 conversations with your uncle about how the Liberals are ruining the economy",14471,7s2d2x,https://www.thebeaverton.com/2017/09/watchdog-warns-hiking-minimum-wage-lead-50000-conversations-uncle-liberals-ruining-economy/,1374,1516585727.0,CMikeHunt,0.84,/r/canada/comments/7s2d2x/watchdog_warns_hiking_minimum_wage_could_lead_to/,canada,1630671,2
Younger Canadians moving away from big cities at record levels,14469,kxsji5,https://www.bnnbloomberg.ca/younger-canadians-moving-away-from-big-cities-at-record-levels-1.1548707,2055,1610709173.0,viva_la_vinyl,0.96,/r/canada/comments/kxsji5/younger_canadians_moving_away_from_big_cities_at/,canada,1630671,2
It’s time to abolish tipping once and for all | TVO.org,14217,n0qnri,https://www.tvo.org/article/its-time-to-abolish-tipping-once-and-for-all,2866,1619649292.0,feb914,0.91,/r/canada/comments/n0qnri/its_time_to_abolish_tipping_once_and_for_all/,canada,1630671,2
"The U.S. would like to loosen border restrictions. ‘We’re not there yet,’ Justin Trudeau says",14214,mlztp8,https://www.thestar.com/politics/federal/2021/04/06/the-us-would-like-to-loosen-border-restrictions-were-not-there-yet-justin-trudeau-says.html,2180,1617794340.0,viva_la_vinyl,0.91,/r/canada/comments/mlztp8/the_us_would_like_to_loosen_border_restrictions/,canada,1630671,2
"Bell selects Ericsson, not Huawei, to build 5G cellular network",14181,gv7lpd,https://www.cbc.ca/news/business/bce-5g-ericsson-1.5594601?__vfz=medium%3Dsharebar,742,1591105499.0,feb914,0.97,/r/canada/comments/gv7lpd/bell_selects_ericsson_not_huawei_to_build_5g/,canada,1630671,2
