title,score,id,url,num_comments,created,author,upvote_ratio,permalink,subreddit,subreddit_subscribers,depth
"Here are my removed & genetically modified white blood cells, about to be put back in to hopefully cure my cancer! This is t-cell immunotherapy!",192797,i2bo3t,https://i.redd.it/g1gln8xo7le51.jpg,3209,1596373228.0,sarahjewel,0.97,/r/interestingasfuck/comments/i2bo3t/here_are_my_removed_genetically_modified_white/,interestingasfuck,11275009,2
The astronauts of Crew-2 enjoying their last day on Earth before they travel to space tomorrow to spend the next six months on the ISS,190761,mwefnu,https://i.redd.it/qe7gs07yesu61.jpg,3495,1619124515.0,BlueTycho,0.97,/r/interestingasfuck/comments/mwefnu/the_astronauts_of_crew2_enjoying_their_last_day/,interestingasfuck,11275009,2
A special effects artist made himself a mask for the pandemic and i can’t get over it,185578,fy0ah5,https://i.redd.it/119bprqmtur41.jpg,2025,1586465062.0,GallowBoob,0.95,/r/interestingasfuck/comments/fy0ah5/a_special_effects_artist_made_himself_a_mask_for/,interestingasfuck,11275009,2
Protestors in Hong Kong are cutting down facial recognition towers.,180948,cv31p6,https://gfycat.com/edibleunrulyargentineruddyduck,4344,1566700999.0,GallowBoob,0.97,/r/interestingasfuck/comments/cv31p6/protestors_in_hong_kong_are_cutting_down_facial/,interestingasfuck,11275009,2
"High winds at the perfect time of day created a previously undocumented 2,400 foot rainbow waterfall in Yosemite National Park",173188,v4akft,https://gfycat.com/feminineharmoniousisabellinewheatear,2635,1654294802.0,solateor,0.92,/r/interestingasfuck/comments/v4akft/high_winds_at_the_perfect_time_of_day_created_a/,interestingasfuck,11275009,2
An interesting example of reinforcement learning,169549,is6s8a,https://i.redd.it/pw04mrqwbzm51.gif,2077,1600031213.0,Thereaper29,0.98,/r/interestingasfuck/comments/is6s8a/an_interesting_example_of_reinforcement_learning/,interestingasfuck,11275009,2
Still growing strong: 700lbs and gaining 49lbs a day,167236,wd6kgf,https://v.redd.it/dsou7ltep0f91,4033,1659322958.0,solateor,0.96,/r/interestingasfuck/comments/wd6kgf/still_growing_strong_700lbs_and_gaining_49lbs_a/,interestingasfuck,11275009,2
"(Part 2) Never before seen 9/11 photo, discovered in a photo book I received from a late relative. The photos have never been digitized nor seen by anyone other than her — until now.",166808,myb64i,https://i.redd.it/24ytvi00ecv61.jpg,5049,1619366340.0,hanfanson,0.93,/r/interestingasfuck/comments/myb64i/part_2_never_before_seen_911_photo_discovered_in/,interestingasfuck,11275009,2
"Women of Iran removing their hijabs while screaming ""death to dictator"" in protest against the assasination of a woman called Mahsa Amini because of not putting her hijab correctly",164914,xkbxe8,https://v.redd.it/mluw5yzc29p91,3500,1663782833.0,Acrobatic-Net994,0.92,/r/interestingasfuck/comments/xkbxe8/women_of_iran_removing_their_hijabs_while/,interestingasfuck,11275009,2
"102-year-old Beatrice Lumpkin put on a face shield and gloves and took her ballot to the mailbox today. When she was born, women couldn't vote.",164658,j5t483,https://i.redd.it/50fu6bhnocr51.jpg,2072,1601935999.0,dickfromaccounting,0.93,/r/interestingasfuck/comments/j5t483/102yearold_beatrice_lumpkin_put_on_a_face_shield/,interestingasfuck,11275009,2
"Russian tennis player Andrey Rublev writes ""No war please"" on the camera following his advancement to the final in Dubai.",162430,t18ie0,https://gfycat.com/velvetygaseouskomododragon,1489,1645807762.0,KaamDeveloper,0.94,/r/interestingasfuck/comments/t18ie0/russian_tennis_player_andrey_rublev_writes_no_war/,interestingasfuck,11275009,2
Rain Storm in Alabama outside this factory door,161397,ov3j8i,https://gfycat.com/helplessinferiorhummingbird,4048,1627720021.0,HellsJuggernaut,0.97,/r/interestingasfuck/comments/ov3j8i/rain_storm_in_alabama_outside_this_factory_door/,interestingasfuck,11275009,2
Still the most impressive way to light the Olympic flame.,159984,orz0ak,https://i.imgur.com/GaTVVZw.gifv,1621,1627307091.0,ameen__shaikh,0.95,/r/interestingasfuck/comments/orz0ak/still_the_most_impressive_way_to_light_the/,interestingasfuck,11275009,2
"20 years ago, someone impaled a 60 pound pumpkin on the top of a spire at Cornell University in the middle of the night. It was over 170 feet off the ground. To this day, no one is really sure how this was accomplished without anyone noticing.",159008,td7adx,https://i.redd.it/q9a91nu8o5n81.jpg,4472,1647179307.0,neroina,0.96,/r/interestingasfuck/comments/td7adx/20_years_ago_someone_impaled_a_60_pound_pumpkin/,interestingasfuck,11275009,2
Hanging bats filmed upside-down look like a Goth nightclub.,156891,id78l6,https://gfycat.com/flusteredwangecko,1530,1597916376.0,5_Frog_Margin,0.96,/r/interestingasfuck/comments/id78l6/hanging_bats_filmed_upsidedown_look_like_a_goth/,interestingasfuck,11275009,2
33 days of wound healing,154393,go5c6f,https://i.imgur.com/BDnV9SN.gifv,2392,1590095289.0,aloofloofah,0.97,/r/interestingasfuck/comments/go5c6f/33_days_of_wound_healing/,interestingasfuck,11275009,2
You are Looking the first Image of another solar system,153338,q81u9l,https://i.redd.it/2saycm8knft71.jpg,4204,1634224704.0,thunde-r,0.95,/r/interestingasfuck/comments/q81u9l/you_are_looking_the_first_image_of_another_solar/,interestingasfuck,11275009,2
It's never too late to acknowledge the reality that urban highways are a fixable mistake,152741,qnfer6,https://i.redd.it/m61dwhwu4tx71.jpg,3539,1636131304.0,Thereaper29,0.88,/r/interestingasfuck/comments/qnfer6/its_never_too_late_to_acknowledge_the_reality/,interestingasfuck,11275009,2
"She was 11 when WWI started, 36 when WWII started, 74 when Star Wars released and 116 when Covid-19 started. And her name is Kane Tanaka as the world’s oldest living person at age 118 years. She was born on January 2, 1903.",150979,m5h3fg,https://i.redd.it/v2a444nlx5n61.jpg,2889,1615801393.0,prolelol,0.95,/r/interestingasfuck/comments/m5h3fg/she_was_11_when_wwi_started_36_when_wwii_started/,interestingasfuck,11275009,2
"Haoko the Gorilla loves spending time with his kids, but his missus doesn't allow it when they're too young, so he ""abducts"" them, forcing the mom into a harmless, playful chase. It's sort of a family tradition, as he did it with all 3 of his kids",150706,kk6ez6,https://gfycat.com/limpimpishiberianmole,1787,1608931965.0,Ainsley-Sorsby,0.97,/r/interestingasfuck/comments/kk6ez6/haoko_the_gorilla_loves_spending_time_with_his/,interestingasfuck,11275009,2
"Conjoined twins had a 1/30 million chance of survival at birth, they are now adults and have become teachers!",149345,pip0m7,https://i.redd.it/nwoirqrl5sl71.jpg,8753,1630889269.0,tandyman234,0.88,/r/interestingasfuck/comments/pip0m7/conjoined_twins_had_a_130_million_chance_of/,interestingasfuck,11275009,2
Huge oceanic Manta Ray spotted near Trinidad ( sharks for scale ),146017,hsbh4x,https://gfycat.com/denseenviouscoypu,2982,1594912753.0,Unicornglitteryblood,0.97,/r/interestingasfuck/comments/hsbh4x/huge_oceanic_manta_ray_spotted_near_trinidad/,interestingasfuck,11275009,2
"In France, police rush out to the people, expecting them to rush and create a stampede. No one moves and the police are forced to back down",145902,ygkf3p,https://v.redd.it/wtd4w1tw3rw91,6076,1667052049.0,Acrobatic-Net994,0.92,/r/interestingasfuck/comments/ygkf3p/in_france_police_rush_out_to_the_people_expecting/,interestingasfuck,11275009,2
Dog corrects pup's behaviour towards the owner,143800,s688ma,https://gfycat.com/spanishthinindianjackal,2339,1642437500.0,aloofloofah,0.96,/r/interestingasfuck/comments/s688ma/dog_corrects_pups_behaviour_towards_the_owner/,interestingasfuck,11275009,2
Experience of nukes in real life by atomic veterans,142933,tv9kk6,https://v.redd.it/3dcm5bufibr81,3465,1648993400.0,Unique_District_9381,0.95,/r/interestingasfuck/comments/tv9kk6/experience_of_nukes_in_real_life_by_atomic/,interestingasfuck,11275009,2
A modified US 1 Dollar Coin with a Hidden Button for Clasping and Unclasping a Sword,142495,hxshvw,https://gfycat.com/welcomeinfantileenglishpointer,1175,1595704897.0,Thund3rbolt,0.95,/r/interestingasfuck/comments/hxshvw/a_modified_us_1_dollar_coin_with_a_hidden_button/,interestingasfuck,11275009,2
Some drugstores in the Czech Republic introduced shampoo and shower gel filling machines. Customers can refill their empty bottles with various products so they don't have to buy a new one everytime,140498,duy2z5,https://i.redd.it/toesy16p54y31.jpg,1550,1573502867.0,Lord-AG,0.97,/r/interestingasfuck/comments/duy2z5/some_drugstores_in_the_czech_republic_introduced/,interestingasfuck,11275009,2
This restaurant in Vietnam,140355,h7m1w1,https://gfycat.com/happygoluckyagitatedantbear,2269,1591973377.0,Lord-AG,0.96,/r/interestingasfuck/comments/h7m1w1/this_restaurant_in_vietnam/,interestingasfuck,11275008,2
Man Does A Full Frontal Flip From An Incline Plank Position,140280,m2tqa8,https://gfycat.com/spicycharmingbellfrog,2442,1615478952.0,Unicornglitteryblood,0.93,/r/interestingasfuck/comments/m2tqa8/man_does_a_full_frontal_flip_from_an_incline/,interestingasfuck,11275008,2
Footage of a 3 year old chimney sweep from the 1930's,139518,u5q3a8,https://v.redd.it/3qw4kpl744u81,5004,1650211426.0,sewn_of_a_gun,0.91,/r/interestingasfuck/comments/u5q3a8/footage_of_a_3_year_old_chimney_sweep_from_the/,interestingasfuck,11275008,2
"WWII veteran, survivor of Leningrad Blockade, Yelena Osipova, arrested for peaceful protest against war in Saint Petersburg",139117,t5be9l,https://v.redd.it/dyle69yam1l81,2444,1646258539.0,NiceCasualRedditGuy,0.94,/r/interestingasfuck/comments/t5be9l/wwii_veteran_survivor_of_leningrad_blockade/,interestingasfuck,11275008,2
This dude made a custom Zoom background for his next meeting where he brings himself a cup of tea (by Jaws19show),137613,gg05q0,https://gfycat.com/inferiorglamorousjellyfish,808,1588967242.0,GallowBoob,0.94,/r/interestingasfuck/comments/gg05q0/this_dude_made_a_custom_zoom_background_for_his/,interestingasfuck,11275008,2
African painted dogs at the Oregon Zoo notice a visitor's service animal,136210,ynfb47,https://v.redd.it/84kzeqe419y91,4537,1667704888.0,solateor,0.95,/r/interestingasfuck/comments/ynfb47/african_painted_dogs_at_the_oregon_zoo_notice_a/,interestingasfuck,11275008,2
Seeing How Ducklings Take Their First Ever Jump.,135711,mqs314,https://i.imgur.com/hwDquKi.gifv,2190,1618411582.0,gunslayerjj,0.95,/r/interestingasfuck/comments/mqs314/seeing_how_ducklings_take_their_first_ever_jump/,interestingasfuck,11275008,2
Helicopter footage of a loose cow being wrangled by Emergency Services and cowboys in OKC,131630,v66vw1,https://v.redd.it/g3l3exopx0491,4556,1654531383.0,KaamDeveloper,0.9,/r/interestingasfuck/comments/v66vw1/helicopter_footage_of_a_loose_cow_being_wrangled/,interestingasfuck,11275008,2
"John Thompson was home alone when he had both his arms ripped off in a farming accident. However, he still managed to get up and dial for help via holding a pencil in his mouth. He survived and both his arms were reattached.",131442,i3k9ph,https://i.redd.it/buur3xwswze51.jpg,1983,1596551234.0,Unicornglitteryblood,0.96,/r/interestingasfuck/comments/i3k9ph/john_thompson_was_home_alone_when_he_had_both_his/,interestingasfuck,11275008,2
"""First the man takes the drink, then the drink takes the man."" Sculpture created based off an old Irish saying.",131374,l0tc0h,https://i.redd.it/4706cuh1ucc61.jpg,1379,1611090615.0,PC_Cuuhhrriiss,0.94,/r/interestingasfuck/comments/l0tc0h/first_the_man_takes_the_drink_then_the_drink/,interestingasfuck,11275008,2
This is the grave of Technical Sergeant Leonard Matlovich. It does not bear his name because he intended to be a monument to all gay veterans. Today marks 46 years since he appeared of the cover of Time magazine,131078,pkdc1w,https://i.redd.it/02zacl4wxam71.jpg,2320,1631116707.0,sewn_of_a_gun,0.85,/r/interestingasfuck/comments/pkdc1w/this_is_the_grave_of_technical_sergeant_leonard/,interestingasfuck,11275008,2
A nanobot picks up a lazy sperm by the tail and inseminates an egg with it,131055,pt99m1,https://i.redd.it/va00cpjhj2p71.gif,8346,1632322593.0,ICumCoffee,0.89,/r/interestingasfuck/comments/pt99m1/a_nanobot_picks_up_a_lazy_sperm_by_the_tail_and/,interestingasfuck,11275008,2
This tiny lizard perfectly shedding looks like he's wearing a tiny lizard space suit,130786,ftl8q8,https://i.redd.it/ttk87yklbeq41.jpg,1103,1585829441.0,GallowBoob,0.95,/r/interestingasfuck/comments/ftl8q8/this_tiny_lizard_perfectly_shedding_looks_like/,interestingasfuck,11275008,2
Electric scooter with swappable batteries in Taiwan,129296,pufh2l,https://i.redd.it/480wzyszuep71.gif,3488,1632472015.0,ICumCoffee,0.95,/r/interestingasfuck/comments/pufh2l/electric_scooter_with_swappable_batteries_in/,interestingasfuck,11275008,2
It's not unusual for Silverbacks to be affectionate father figures. Shabani just takes that up to 11,129097,k0dlpn,https://i.imgur.com/T83QInF.gifv,1513,1606251411.0,Ainsley-Sorsby,0.97,/r/interestingasfuck/comments/k0dlpn/its_not_unusual_for_silverbacks_to_be/,interestingasfuck,11275008,2
Children in Hokkaido are taught from a young age: NEVER STEP IN PUDDLES,128275,gmstd8,https://gfycat.com/scalyimpressiveirishdraughthorse,2422,1589908577.0,9999monkeys,0.97,/r/interestingasfuck/comments/gmstd8/children_in_hokkaido_are_taught_from_a_young_age/,interestingasfuck,11275008,2
"Jackson, Cash, and X staying still on command, before getting the signal they're free to go. Bred to herd, they've been taught to freeze while controlling sheep movements",128253,nlvgmf,https://i.imgur.com/ERYG5oP.gifv,2693,1622075035.0,solateor,0.94,/r/interestingasfuck/comments/nlvgmf/jackson_cash_and_x_staying_still_on_command/,interestingasfuck,11275008,2
Jim Carrey deepfake of The Shining,128116,cb0yot,https://i.imgur.com/XlYuTuc.gifv,3214,1562679340.0,dickfromaccounting,0.95,/r/interestingasfuck/comments/cb0yot/jim_carrey_deepfake_of_the_shining/,interestingasfuck,11275008,2
WHAT ITS LIKE - To Experience a Nuke in Virtual Reality,127822,tumhgv,https://v.redd.it/87cuzqkj45r81,5765,1648916077.0,Unique_District_9381,0.9,/r/interestingasfuck/comments/tumhgv/what_its_like_to_experience_a_nuke_in_virtual/,interestingasfuck,11275008,2
"People rescuing a Great White Shark that beached itself chasing a seagull. Filmed on Cape Cod, Massachusetts.",127311,ogkt1f,https://gfycat.com/wellmadeadorableconch,3883,1625792679.0,5_Frog_Margin,0.94,/r/interestingasfuck/comments/ogkt1f/people_rescuing_a_great_white_shark_that_beached/,interestingasfuck,11275008,2
1000 pound bluefin tuna landed solo by Michelle Bancewicz Cicale,127135,smzksq,https://v.redd.it/yxpfe9tgxgg81,8120,1644264647.0,Atrampoline,0.75,/r/interestingasfuck/comments/smzksq/1000_pound_bluefin_tuna_landed_solo_by_michelle/,interestingasfuck,11275008,2
Thailand supermarket ditches plastic packaging for Banana leaves.,126909,ny90m4,https://i.redd.it/n76bwbn8qu471.jpg,2652,1623511007.0,Fluid-Daydreamer,0.93,/r/interestingasfuck/comments/ny90m4/thailand_supermarket_ditches_plastic_packaging/,interestingasfuck,11275008,2
A termite road (above) and an ants road (below) both protected by a row of their soldiers in a confrontation without fighting,126690,fsksoe,https://i.imgur.com/1uZWelJ.gifv,2124,1585687095.0,dickfromaccounting,0.97,/r/interestingasfuck/comments/fsksoe/a_termite_road_above_and_an_ants_road_below_both/,interestingasfuck,11275008,2
Jumping on a ship that's going over large waves,126185,jzvll9,https://gfycat.com/agonizingreflectingenglishsetter,1550,1606182476.0,j4ck132,0.91,/r/interestingasfuck/comments/jzvll9/jumping_on_a_ship_thats_going_over_large_waves/,interestingasfuck,11275008,2
Owl warning a cat to keep away,125657,o12rs2,https://i.imgur.com/GMH3lGq.gifv,3313,1623843310.0,__Dawn__Amber__,0.95,/r/interestingasfuck/comments/o12rs2/owl_warning_a_cat_to_keep_away/,interestingasfuck,11275008,2
This enormous wolf,125633,9n4xc8,https://i.imgur.com/R2Cps9X.gifv,4887,1539216156.0,dickfromaccounting,0.95,/r/interestingasfuck/comments/9n4xc8/this_enormous_wolf/,interestingasfuck,11275008,2
Hurricane Ian - what 15 fr storm surge looks like (credit to Max Olson Chasing),125594,xrmtvw,https://v.redd.it/l0w7syf7zvq91,5358,1664495854.0,Atrampoline,0.95,/r/interestingasfuck/comments/xrmtvw/hurricane_ian_what_15_fr_storm_surge_looks_like/,interestingasfuck,11275008,2
Cannabis growing naturally in the Himalayas,125498,yxp2wn,https://i.redd.it/bmjpg4pglf0a1.jpg,3593,1668688338.0,haddock420,0.91,/r/interestingasfuck/comments/yxp2wn/cannabis_growing_naturally_in_the_himalayas/,interestingasfuck,11275008,2
This Baboon is helping his dog Friend to get rid of bugs.,125307,i2v9tg,https://i.imgur.com/xGmWcLs.gifv,1420,1596453733.0,sarveshak99,0.96,/r/interestingasfuck/comments/i2v9tg/this_baboon_is_helping_his_dog_friend_to_get_rid/,interestingasfuck,11275008,2
"Gee’s golden langur. Researchers have said that this monkey works hard to avoid human interactions, making them extremely difficult to observe in the wild",124843,wu5ypd,https://v.redd.it/hg073ccgw3j91,5552,1661105027.0,solateor,0.94,/r/interestingasfuck/comments/wu5ypd/gees_golden_langur_researchers_have_said_that/,interestingasfuck,11275008,2
How nails are orientated correctly prior to boxing,123960,jxtcrf,https://gfycat.com/glassfavorablegrebe,1535,1605893282.0,Thund3rbolt,0.95,/r/interestingasfuck/comments/jxtcrf/how_nails_are_orientated_correctly_prior_to_boxing/,interestingasfuck,11275008,2
NASA once brought cats on a plane to test their skills in zero gravity,123533,i0jcfj,https://i.imgur.com/NGiqrZk.gifv,2004,1596102969.0,__Dawn__Amber__,0.94,/r/interestingasfuck/comments/i0jcfj/nasa_once_brought_cats_on_a_plane_to_test_their/,interestingasfuck,11275008,2
News station switches from black/white to color TV for the first time,123421,tx7pcp,https://v.redd.it/76mfvw96ksr81,1656,1649199792.0,Slick0strich,0.95,/r/interestingasfuck/comments/tx7pcp/news_station_switches_from_blackwhite_to_color_tv/,interestingasfuck,11275008,2
"It’s been 100 years since “The Kid” was released out, and this baby is still alive. He just turns 102 year old today as one of the last 4 living silent film actors.",123422,m1arv6,https://gfycat.com/heartytidybernesemountaindog,1222,1615309079.0,prolelol,0.95,/r/interestingasfuck/comments/m1arv6/its_been_100_years_since_the_kid_was_released_out/,interestingasfuck,11275008,2
"Ukrainian President Zelensky confirms that Ukrainian forces managed to extract the mayor of Melitopol, Ivan Fedorov, from Russian captivity.",123101,tfrmca,https://v.redd.it/ivwb5zynwsn81,1903,1647460601.0,lonely_fucker69,0.87,/r/interestingasfuck/comments/tfrmca/ukrainian_president_zelensky_confirms_that/,interestingasfuck,11275008,2
The colors of these Macaws in Costa Rica,122426,k8gbzn,https://gfycat.com/disfiguredunknownkagu,1213,1607346555.0,HellsJuggernaut,0.96,/r/interestingasfuck/comments/k8gbzn/the_colors_of_these_macaws_in_costa_rica/,interestingasfuck,11275008,2
Coyote accidentally gives itself a brain freeze while drinking from a frozen water trough,122113,jgrek7,https://gfycat.com/neatearnestibex,1074,1603473401.0,HyperKing69,0.89,/r/interestingasfuck/comments/jgrek7/coyote_accidentally_gives_itself_a_brain_freeze/,interestingasfuck,11275008,2
"Engineering Student Designs a ""Mobile Airbag"" that Deploys When your Device is Dropped",121857,8ub0el,https://i.imgur.com/NbzslmI.gifv,3315,1530116779.0,Thund3rbolt,0.96,/r/interestingasfuck/comments/8ub0el/engineering_student_designs_a_mobile_airbag_that/,interestingasfuck,11275008,2
Walking on Lake Baikal,121733,l20gyf,https://gfycat.com/briskneighboringindianskimmer,1711,1611242516.0,hate_mail,0.95,/r/interestingasfuck/comments/l20gyf/walking_on_lake_baikal/,interestingasfuck,11275008,2
Erosion,121677,uvap5o,https://v.redd.it/bs3u36mc11191,1028,1653225108.0,ashu71029,0.91,/r/interestingasfuck/comments/uvap5o/erosion/,interestingasfuck,11275008,2
"Guy dressed as Yama, god of death, gives free helmets to bikers who aren't wearing one",121491,irebhp,https://gfycat.com/leafylimpbluet,1350,1599923569.0,Unicornglitteryblood,0.94,/r/interestingasfuck/comments/irebhp/guy_dressed_as_yama_god_of_death_gives_free/,interestingasfuck,11275008,2
Inventions that never really caught on,120503,okpwd6,https://i.imgur.com/yBVLCYN.gifv,3014,1626343978.0,ameen__shaikh,0.93,/r/interestingasfuck/comments/okpwd6/inventions_that_never_really_caught_on/,interestingasfuck,11275008,2
Antique safe made in France around ~1780 / 1810. With three keys and a combination of ordered switches.,120280,fpr22f,https://gfycat.com/disastroussophisticatedfrenchbulldog,1510,1585285333.0,Thund3rbolt,0.97,/r/interestingasfuck/comments/fpr22f/antique_safe_made_in_france_around_1780_1810_with/,interestingasfuck,11275008,2
"UPDATE POST (so many asked for one)! It's working - tumor shrinkage of 42% already, only 4 weeks post treatment!",120121,ij25bs,https://i.redd.it/4oc2qgqsv0k51.jpg,1609,1598742178.0,sarahjewel,0.94,/r/interestingasfuck/comments/ij25bs/update_post_so_many_asked_for_one_its_working/,interestingasfuck,11275008,2
Guy buys Quail eggs from a supermarket and manages to get one to hatch,119815,89knwm,https://i.imgur.com/7RjO7DH.gifv,3508,1522803176.0,dickfromaccounting,0.92,/r/interestingasfuck/comments/89knwm/guy_buys_quail_eggs_from_a_supermarket_and/,interestingasfuck,11275008,2
Turkish garbage collectors open a library with all of the books citizens discard in their trash,119684,hjey9s,https://i.redd.it/f4qr8xt08a851.jpg,1053,1593625074.0,asdfpartyy,0.95,/r/interestingasfuck/comments/hjey9s/turkish_garbage_collectors_open_a_library_with/,interestingasfuck,11275008,2
"Sled dogs have been in use in Alaska for about 9,000 years. Here's 13-strong team of them mushing in Alaska.",119639,jy38ta,https://gfycat.com/flimsyshockingbluebottle,2689,1605927203.0,5_Frog_Margin,0.94,/r/interestingasfuck/comments/jy38ta/sled_dogs_have_been_in_use_in_alaska_for_about/,interestingasfuck,11275008,2
Switzerland's largest supermarket chain is testing these refill stations for cleaning products for reducing waste,119340,idgrrc,https://i.imgur.com/ILwAQZP.gifv,2277,1597950888.0,sarveshak99,0.94,/r/interestingasfuck/comments/idgrrc/switzerlands_largest_supermarket_chain_is_testing/,interestingasfuck,11275008,2
Frogs taxidermy found inside French mansion that had been sealed for 100 years,119021,l690iw,https://i.redd.it/q974v3hyowd61.png,1030,1611766907.0,THECUTEKITTYCAT,0.92,/r/interestingasfuck/comments/l690iw/frogs_taxidermy_found_inside_french_mansion_that/,interestingasfuck,11275008,2
"There is a Mall in China that offers ""husband storage"" where wives can leave their husband while they shop.",118521,tffo5g,https://i.redd.it/avfjbqo6gqn81.jpg,2405,1647430841.0,neroina,0.87,/r/interestingasfuck/comments/tffo5g/there_is_a_mall_in_china_that_offers_husband/,interestingasfuck,11275008,2
Active ball joint mechanism based on spherical gear meshings,117559,o3kjnm,https://i.imgur.com/382WZ0z.gifv,1690,1624122019.0,aloofloofah,0.96,/r/interestingasfuck/comments/o3kjnm/active_ball_joint_mechanism_based_on_spherical/,interestingasfuck,11275008,2
Married couple in China discover they appeared in same photograph as teenagers,117055,83vc8i,https://i.imgur.com/VeqwCCD.jpg,1333,1520864887.0,dickfromaccounting,0.93,/r/interestingasfuck/comments/83vc8i/married_couple_in_china_discover_they_appeared_in/,interestingasfuck,11275008,2
"Video footage of Swastika blown up by U.S. Army in Nuremberg, 1945",116767,nx2hye,https://i.imgur.com/svvUcgO.gifv,4037,1623370148.0,NiceCasualRedditGuy,0.89,/r/interestingasfuck/comments/nx2hye/video_footage_of_swastika_blown_up_by_us_army_in/,interestingasfuck,11275008,2
"After the breakup of the USSR, the Lithuanian basketball team couldn't afford to participate in the 1992 Olympics, so the Grateful Dead funded the team's expenses and sent a box of tie-dyed outfits in Lithuania's national colours. They went on to win bronze.",116729,od3na5,https://i.imgur.com/CUJNq2i.jpg,1386,1625337232.0,Thryloz,0.95,/r/interestingasfuck/comments/od3na5/after_the_breakup_of_the_ussr_the_lithuanian/,interestingasfuck,11275008,2
Victorian England (1901),116331,kl14au,https://gfycat.com/naiveimpracticalhart,4706,1609062701.0,WhenMachinesCry,0.95,/r/interestingasfuck/comments/kl14au/victorian_england_1901/,interestingasfuck,11275008,2
Night bus in Japan,116332,ozyh8i,https://i.redd.it/alrtzkbbazf71.jpg,2238,1628360530.0,9999monkeys,0.95,/r/interestingasfuck/comments/ozyh8i/night_bus_in_japan/,interestingasfuck,11275008,2
"A Swedish engineer has invented a suit that will change the lives of people with Parkinson's and stroke. With the help of electrical stimulation, it helps to get rid of tremors.",116128,ovwfof,https://i.imgur.com/LflsmWp.gifv,1422,1627839127.0,Thryloz,0.94,/r/interestingasfuck/comments/ovwfof/a_swedish_engineer_has_invented_a_suit_that_will/,interestingasfuck,11275008,2
The smallest active-duty vessel (mini tug) of the United States Navy.,115477,ifa0ns,https://i.redd.it/vss11s2a5ti51.jpg,2264,1598212663.0,gangbangkang,0.96,/r/interestingasfuck/comments/ifa0ns/the_smallest_activeduty_vessel_mini_tug_of_the/,interestingasfuck,11275008,2
"Shabani the Gorilla trying to approach Ai, one of his females. She's been largely uninterested in him in years, but he's been patient and keeps trying his best",115404,y41z91,https://i.imgur.com/OOPTFvr.gifv,4467,1665773371.0,Ainsley-Sorsby,0.92,/r/interestingasfuck/comments/y41z91/shabani_the_gorilla_trying_to_approach_ai_one_of/,interestingasfuck,11275008,2
Smashing hemp fibres and braiding a traditional hemp rope,114516,q2odi7,https://i.imgur.com/73IqiK8.gifv,2304,1633538849.0,aloofloofah,0.95,/r/interestingasfuck/comments/q2odi7/smashing_hemp_fibres_and_braiding_a_traditional/,interestingasfuck,11275008,2
