title,score,id,url,num_comments,created,author,upvote_ratio,permalink,subreddit,subreddit_subscribers,depth
Samsung AI lab develops tech that can animate highly realistic heads using only a few -or in some cases - only one starter image.,13439,bs1tmx,https://gfycat.com/CommonDistortedCormorant,719,1558611239.0,SirT6,0.97,/r/sciences/comments/bs1tmx/samsung_ai_lab_develops_tech_that_can_animate/,sciences,166187,2
"This heart would have been rejected at most transplant centers (donor: 75 min down time, CPR, LVH). Using warm perfusion technology, however, Duke researchers were able to successfully transplant the heart to a new recipient.",7118,cm9yiz,https://gfycat.com/marvelousadoredbuck,407,1565005661.0,SirT6,0.98,/r/sciences/comments/cm9yiz/this_heart_would_have_been_rejected_at_most/,sciences,166187,2
The medical staff at Wuhan Union Hospital have been risking their lives fighting the coronavirus. True medical heroes. Great news that 11 medical staff at the hospital who were infected have turned negative for the virus and symptoms were controlled after treatment!,5667,eucyx2,https://i.redd.it/uu49qelvt6d41.jpg,263,1580072942.0,SirT6,0.95,/r/sciences/comments/eucyx2/the_medical_staff_at_wuhan_union_hospital_have/,sciences,166187,2
Cancer Cells Being Brutally Destroyed By Genetically Engineered T-cells,5437,d9z8b1,https://gfycat.com/gorgeousdefensivekid,246,1569584814.0,SirT6,0.99,/r/sciences/comments/d9z8b1/cancer_cells_being_brutally_destroyed_by/,sciences,166187,2
Teasing mosquitoes in the lab before they were provided with blood meal,4989,aottzb,https://gfycat.com/SpitefulClearBlackfly,321,1549729894.0,SirT6,0.98,/r/sciences/comments/aottzb/teasing_mosquitoes_in_the_lab_before_they_were/,sciences,166187,2
"An AI algorithm can now predict faces with just 16x16 resolution. Top is low resolution images, middle is the computer's output, bottom is the original photos.",4905,cyc6c6,https://i.redd.it/czkz1vu0g0k31.png,408,1567355897.0,IJesusChrist,0.97,/r/sciences/comments/cyc6c6/an_ai_algorithm_can_now_predict_faces_with_just/,sciences,166187,2
"Baby born inside of amniotic sac. Also called an en caul birth, it occurs approximately 1 in every 80,000 births. Various famous figures in history are alleged to have been born this wa.",4545,cohy1n,https://gfycat.com/bestcoolanophelesmosquito,282,1565443203.0,SirT6,0.97,/r/sciences/comments/cohy1n/baby_born_inside_of_amniotic_sac_also_called_an/,sciences,166187,2
"On this day 98 years ago, a 14 yr. old boy, Leonard Thompson, dying of diabetes (he weighed 65 lb), was given the first injection of insulin. It saved his life; he lived 13 more years. The before & after pics of his insulin treatment are below. A great achievement of our species.",4130,enevkp,https://i.redd.it/8f3kwrxuc8a41.jpg,146,1578783704.0,SirT6,0.98,/r/sciences/comments/enevkp/on_this_day_98_years_ago_a_14_yr_old_boy_leonard/,sciences,166187,2
"Over 11-inches of thrombic material removed from patient’s pulmonary artery - the thrombus originated in the lower extremities before migrating to the heart, where it formed a perfect cast of the artery.",3940,e7dy8q,https://gfycat.com/littleelatedgrunion,195,1575723034.0,SirT6,0.98,/r/sciences/comments/e7dy8q/over_11inches_of_thrombic_material_removed_from/,sciences,166187,2
People's beautiful expressions on hearing sounds for the first time,3732,e3fo40,https://gfycat.com/unpleasantevilacornbarnacle,103,1575039070.0,SirT6,0.98,/r/sciences/comments/e3fo40/peoples_beautiful_expressions_on_hearing_sounds/,sciences,166187,2
Saturn rising from behind the Moon,3609,aizn5a,https://i.imgur.com/6zsNGcc.gifv,315,1548249746.0,SirT6,0.99,/r/sciences/comments/aizn5a/saturn_rising_from_behind_the_moon/,sciences,166187,2
The distribution of annual average temperature anomalies due to global warming from 1850 until today.,3597,d7bc55,https://gfycat.com/silkycorruptconch,363,1569076906.0,SirT6,0.97,/r/sciences/comments/d7bc55/the_distribution_of_annual_average_temperature/,sciences,166187,2
"Triple Point Of Water - Watch as water boils, freezes, and melts simultaneously",3416,e1xjah,https://gfycat.com/colorlesssardonicamazonparrot,132,1574772703.0,IJesusChrist,0.99,/r/sciences/comments/e1xjah/triple_point_of_water_watch_as_water_boils/,sciences,166187,2
New experimental road marking system in Russia,3420,e30laq,https://gfycat.com/madacclaimedamericanbittern,258,1574959904.0,SirT6,0.97,/r/sciences/comments/e30laq/new_experimental_road_marking_system_in_russia/,sciences,166187,2
"The smallest movie ever made, ""A Boy and His Atom"", was created using individual atoms and a scanning tunneling microscope.",3366,cs12gq,http://i.imgur.com/LjDu3D5.gifv,79,1566134258.0,SirT6,0.98,/r/sciences/comments/cs12gq/the_smallest_movie_ever_made_a_boy_and_his_atom/,sciences,166187,2
"Image taken from the surface of the asteroid, Ryugu, by the Japanese Hayabusa2 spacecraft.",3285,cvngw3,https://i.redd.it/kgikywcoesi31.jpg,83,1566822825.0,SirT6,0.99,/r/sciences/comments/cvngw3/image_taken_from_the_surface_of_the_asteroid/,sciences,166187,2
How an eel's double jaw mechanism works,3287,dd6znd,https://gfycat.com/amusingdistortedgrayfox,134,1570193738.0,SirT6,0.98,/r/sciences/comments/dd6znd/how_an_eels_double_jaw_mechanism_works/,sciences,166187,2
Waves of garbage crash off of the coast of the Dominican Republic.,3150,bb6oyk,https://gfycat.com/MistyAcrobaticBonobo,452,1554808758.0,SirT6,0.98,/r/sciences/comments/bb6oyk/waves_of_garbage_crash_off_of_the_coast_of_the/,sciences,166187,2
"What people actually die from, what they Google and what the media covers.",3077,buyrks,https://i.redd.it/0kvz7p5l1f131.png,220,1559251498.0,SirT6,0.98,/r/sciences/comments/buyrks/what_people_actually_die_from_what_they_google/,sciences,166187,2
"A roaring glacial melt, under the bridge to Kangerlussiauq, Greenland where it's 22C today and Danish officials say 12 billions tons of ice melted in 24 hours.",3010,cli1f3,https://gfycat.com/shabbyclearacornbarnacle,473,1564834025.0,SirT6,0.98,/r/sciences/comments/cli1f3/a_roaring_glacial_melt_under_the_bridge_to/,sciences,166187,2
Lenticular lenses can be used to blur images along a single direction,2942,di6g4l,https://gfycat.com/warpedsmartbellfrog,52,1571138348.0,SirT6,0.98,/r/sciences/comments/di6g4l/lenticular_lenses_can_be_used_to_blur_images/,sciences,166187,2
"Ants use pheromones to follow trails. If a trail loops, they get locked running in a circle and die from exhaustion. This is called an ant mill.",2860,deyidt,https://gfycat.com/lankygenerousegret,133,1570533319.0,SirT6,0.99,/r/sciences/comments/deyidt/ants_use_pheromones_to_follow_trails_if_a_trail/,sciences,166187,2
"A panoramic view of Mars, captured by NASA’s Curiosity.",2795,bmx8hk,https://gfycat.com/DistinctHonestIaerismetalmark,108,1557488590.0,SirT6,0.99,/r/sciences/comments/bmx8hk/a_panoramic_view_of_mars_captured_by_nasas/,sciences,166187,2
"Amazing: a trail of termites (up) and a trail of ants (down), both protected by a row of their soldiers in a stand-off, without fighting.",2743,ey7l4g,https://gfycat.com/heftyhelpfulkid,99,1580738598.0,SirT6,0.97,/r/sciences/comments/ey7l4g/amazing_a_trail_of_termites_up_and_a_trail_of/,sciences,166187,2
An ordinary day on Mars. Seen by Curiosity Rover.,2735,eh5ycw,https://gfycat.com/realisticmintycats,64,1577626389.0,cosmicdatabase,0.99,/r/sciences/comments/eh5ycw/an_ordinary_day_on_mars_seen_by_curiosity_rover/,sciences,166187,2
Cuttlefish disguising itself as coral,2598,dop0fe,https://gfycat.com/thankfulevilelephantseal,64,1572351731.0,SirT6,0.99,/r/sciences/comments/dop0fe/cuttlefish_disguising_itself_as_coral/,sciences,166187,2
Melting metal with magnetic induction.,2556,cv81g7,https://gfycat.com/faroffblaringfreshwatereel,99,1566736998.0,SirT6,0.97,/r/sciences/comments/cv81g7/melting_metal_with_magnetic_induction/,sciences,166187,2
"A parasitic worm has taken over the motor functions and eye stalks of this snail, making them into caterpillar mimetics so that birds will eat them. The worm can then reproduce in the bird's GI tract, eventually transmitting via its feces.",2548,cprujv,https://gfycat.com/webbedamusinglemming,116,1565696007.0,SirT6,0.98,/r/sciences/comments/cprujv/a_parasitic_worm_has_taken_over_the_motor/,sciences,166187,2
"A crab using an upside down jellyfish to defend itself against predators. This is not an uncommon occurrence for the photosynthetic jellyfish, which spend much of their time upside down to allow light to penetrate their energy source. Sometimes a crab will snatch one, using it as a shield.",2544,csg153,https://gfycat.com/piercingcommoneasternglasslizard,71,1566215580.0,SirT6,0.99,/r/sciences/comments/csg153/a_crab_using_an_upside_down_jellyfish_to_defend/,sciences,166187,2
Huge explosion on Jupiter captured by amateur astrophotographer,2527,b639r1,https://gfycat.com/CleverCapitalCommongonolek,205,1553685824.0,SirT6,0.99,/r/sciences/comments/b639r1/huge_explosion_on_jupiter_captured_by_amateur/,sciences,166187,2
"Visualisation of a human embryo in the fifth week of life. Note the tail and fishlike appearance. All vertebrate embryos look roughly like this; we start from the same place, then diverge as we develop. Humans are modified fish.",2527,ebhto5,https://gfycat.com/evergreenpolishedcougar,132,1576515875.0,SirT6,0.96,/r/sciences/comments/ebhto5/visualisation_of_a_human_embryo_in_the_fifth_week/,sciences,166187,2
"For the first time, researchers using Hubble have detected water vapor signatures in the atmosphere of a planet beyond our solar system that resides in the ""habitable zone.",2515,d37a1o,https://gfycat.com/scholarlyformalhawaiianmonkseal,262,1568291845.0,SirT6,0.99,/r/sciences/comments/d37a1o/for_the_first_time_researchers_using_hubble_have/,sciences,166187,2
Putting faces to the toll COVID-19 is taking on Italy: obituary sections from Bergamo daily paper in February vs. this weekend.,2470,fj50jw,https://gfycat.com/neatignorantjunco,126,1584293672.0,SirT6,0.99,/r/sciences/comments/fj50jw/putting_faces_to_the_toll_covid19_is_taking_on/,sciences,166187,2
These floats turn ocean wave power into electricity.,2467,crlyou,https://gfycat.com/untimelyenlightenedgeese,133,1566047537.0,SirT6,0.97,/r/sciences/comments/crlyou/these_floats_turn_ocean_wave_power_into/,sciences,166187,2
Genetically modified T-cells hunting down and killing cancer cells,2429,aogzvt,https://gfycat.com/ScalyHospitableAsianporcupine,211,1549635957.0,SirT6,0.99,/r/sciences/comments/aogzvt/genetically_modified_tcells_hunting_down_and/,sciences,166187,2
"How airports deal with thunderstorms: They will “stack” planes at different altitudes over various waypoints/fixes, giving them the opportunity to sit in those holding patterns until the storm passes.",2424,cburna,https://gfycat.com/forthrightimpracticaladder,91,1562845508.0,SirT6,0.98,/r/sciences/comments/cburna/how_airports_deal_with_thunderstorms_they_will/,sciences,166187,2
"Slime Mold Or Le Blob Doesn't Have Brain, Eyes, Ears, Mouth Or Limbs But Solves The Maze in One Pass",2426,eevsh7,https://gfycat.com/filthyblushinggemsbok,55,1577159792.0,mtimetraveller,0.97,/r/sciences/comments/eevsh7/slime_mold_or_le_blob_doesnt_have_brain_eyes_ears/,sciences,166187,2
"These weed-killing robots could give big agrochemical companies a run for their money: this AI-driven robot uses 20% less herbicide, giving it a shot to disrupt a $26 billion market.",2392,bafvop,https://gfycat.com/HoarseWiltedAlleycat,310,1554641137.0,SirT6,0.98,/r/sciences/comments/bafvop/these_weedkilling_robots_could_give_big/,sciences,166187,2
A cell undergoing mitosis,2366,dne8n7,https://gfycat.com/entireesteemedcapybara,74,1572098509.0,SirT6,0.99,/r/sciences/comments/dne8n7/a_cell_undergoing_mitosis/,sciences,166187,2
The US has performed its first double lung transplant for lung damage caused by COVID-19. The recipient is a 20 yr old woman. She remains on a ventilator at this time. The damage inflicted by SARSCoV2 is stunning.,2325,h0yuzh,https://i.redd.it/djzrlo974a451.jpg,229,1591880428.0,SirT6,0.97,/r/sciences/comments/h0yuzh/the_us_has_performed_its_first_double_lung/,sciences,166187,2
"Another huge study of over 650,000 kids shows absolutely no link between vaccines and autism. Doctors say it's proof we're living in a 'fact-resistant' world.",2326,esvcme,https://www.businessinsider.com/study-shows-no-link-between-vaccines-and-autism-2019-3,72,1579796437.0,SirT6,0.98,/r/sciences/comments/esvcme/another_huge_study_of_over_650000_kids_shows/,sciences,166187,2
"The nearest galaxy, Andromeda, is headed toward our Milky Way galaxy at 110 km per second (68 miles/sec). It'll look bigger & bigger in our skies before colliding with us in a few billion years, and when that happens, the two galaxies will be ripped across space by tidal forces.",2321,dgvrz8,https://gfycat.com/competentidlegalapagosmockingbird,164,1570890195.0,SirT6,0.98,/r/sciences/comments/dgvrz8/the_nearest_galaxy_andromeda_is_headed_toward_our/,sciences,166187,2
Cell division,2281,csx7ko,https://gfycat.com/agitatedwangrunion,96,1566301018.0,SirT6,0.99,/r/sciences/comments/csx7ko/cell_division/,sciences,166187,2
A lethal dose of heroin vs. a lethal dose of fentanyl.,2281,cd3nta,https://i.redd.it/w8uydbhb5aa31.jpg,119,1563114844.0,SirT6,0.98,/r/sciences/comments/cd3nta/a_lethal_dose_of_heroin_vs_a_lethal_dose_of/,sciences,166187,2
"""A healthy society should not have only one voice”: Chinese doctor Li Wenliang, one of the eight whistleblowers who tried to warn other medics of the coronavirus outbreak but were reprimanded by local police, dies of coronavirus on Thursday in Wuhan. RIP.",2251,f0aq9y,https://i.redd.it/zwpajzguaif41.jpg,25,1581083391.0,SirT6,0.99,/r/sciences/comments/f0aq9y/a_healthy_society_should_not_have_only_one_voice/,sciences,166187,2
Visualizing magnetic fields,2249,d00gq2,https://gfycat.com/dependablereddotterel,47,1567688222.0,SirT6,0.99,/r/sciences/comments/d00gq2/visualizing_magnetic_fields/,sciences,166187,2
X-ray of a patient who attempted suicide by injecting themselves with mercury. The patient recovered with oral chelation therapy.,2206,ctfdjt,https://i.redd.it/1gaoagbjcsh31.jpg,102,1566386150.0,SirT6,0.99,/r/sciences/comments/ctfdjt/xray_of_a_patient_who_attempted_suicide_by/,sciences,166187,2
Gigantic pulsating parasite extracted from 8-week old kitten,2198,edaziw,https://gfycat.com/chillymerrykudu,182,1576852621.0,SirT6,0.96,/r/sciences/comments/edaziw/gigantic_pulsating_parasite_extracted_from_8week/,sciences,166187,2
How flatworms can regenerate a whole body from a fragment after being chopped into pieces.,2200,do7lhg,https://gfycat.com/fairoblongafricanmolesnake,80,1572262497.0,SirT6,0.98,/r/sciences/comments/do7lhg/how_flatworms_can_regenerate_a_whole_body_from_a/,sciences,166187,2
A dying neuron,2183,drgvwq,https://gfycat.com/delightfulreliableamericanpainthorse,84,1572870243.0,SirT6,0.99,/r/sciences/comments/drgvwq/a_dying_neuron/,sciences,166187,2
Gene therapy in action: early look at a gene therapy for Duchenne Muscular Dystrophy shows promise.,2175,c7sfqr,https://gfycat.com/greatyawningfoxterrier,55,1561986945.0,SirT6,0.99,/r/sciences/comments/c7sfqr/gene_therapy_in_action_early_look_at_a_gene/,sciences,166187,2
"A timelapse showing the movement of vines. A morning glory vine exhibiting both nastic movement to find, and then a thigmotropic response to grasp and hold.",2103,e2g3j4,https://gfycat.com/illweepyflies,33,1574861788.0,SirT6,0.98,/r/sciences/comments/e2g3j4/a_timelapse_showing_the_movement_of_vines_a/,sciences,166187,2
Drone technology enables rapid planting of trees - up to 150x faster than traditional methods. Researchers hope to use swarms of drones to plant a target of 500 billion trees.,2085,ekt47x,https://gfycat.com/welloffdesertedindianglassfish,86,1578311386.0,SirT6,0.98,/r/sciences/comments/ekt47x/drone_technology_enables_rapid_planting_of_trees/,sciences,166187,2
Uranium In A Cloud Chamber,2083,d6tn7s,https://gfycat.com/phonydeadlyeastrussiancoursinghounds,47,1568979574.0,SirT6,0.99,/r/sciences/comments/d6tn7s/uranium_in_a_cloud_chamber/,sciences,166187,2
"The duck-rabbit illusion works on Google Cloud Vision. The system interprets it one way or the other, depending on the orientation of the image.",2074,dmwk78,https://gfycat.com/famousgleefulchimpanzee,28,1572005475.0,SirT6,0.99,/r/sciences/comments/dmwk78/the_duckrabbit_illusion_works_on_google_cloud/,sciences,166187,2
"Golden apple snails emerge from the water to lay their egg masses on vegetation above the water line. The egg masses are bright pink and contain ~300 eggs. After hatching, the baby snails fall into the water.",2069,e0jnqf,https://gfycat.com/diligentequaljapanesebeetle,48,1574524732.0,SirT6,0.98,/r/sciences/comments/e0jnqf/golden_apple_snails_emerge_from_the_water_to_lay/,sciences,166187,2
"The first open heart operation ever filmed was recorded in 1945 by the US War Department. The surgeon was Dwight Harken, and the surgery was to remove a bullet fragment from a soldier's heart; the soldier survived.",2063,cr54bn,https://gfycat.com/obviousdisgustingblackfish,75,1565955302.0,SirT6,0.99,/r/sciences/comments/cr54bn/the_first_open_heart_operation_ever_filmed_was/,sciences,166187,2
The various types of spider eye arrangements,2059,d2c52d,https://i.redd.it/qlycchp7atl31.jpg,71,1568140821.0,IJesusChrist,0.99,/r/sciences/comments/d2c52d/the_various_types_of_spider_eye_arrangements/,sciences,166187,2
When a frog swallows a firefly,2038,f0sy6o,https://gfycat.com/ornatenervousfrogmouth,36,1581175433.0,SirT6,0.97,/r/sciences/comments/f0sy6o/when_a_frog_swallows_a_firefly/,sciences,166187,2
"The phenomenon of ""shimmering"" in honeybees, in which hundreds of individual honeybees flip their abdomens upwards within a split-second to produce a Mexican Wave-like pattern is a defensive mechanism to repel predatory hornets and wasps.",2021,d1pttj,https://gfycat.com/leadingpopularfrilledlizard,72,1568029760.0,SirT6,0.98,/r/sciences/comments/d1pttj/the_phenomenon_of_shimmering_in_honeybees_in/,sciences,166187,2
Time-lapse footage of a day in the life of a pair of pot plants.,2003,awv32b,https://gfycat.com/GloriousWellmadeArmyworm,73,1551627655.0,SirT6,0.99,/r/sciences/comments/awv32b/timelapse_footage_of_a_day_in_the_life_of_a_pair/,sciences,166187,2
Miniature ecosystem found in a drop of water taken from the birdbath,2004,cgrgiq,https://gfycat.com/browninfamousbarebirdbat,80,1563881730.0,SirT6,0.99,/r/sciences/comments/cgrgiq/miniature_ecosystem_found_in_a_drop_of_water/,sciences,166187,2
Our world has a disposable plastics problem. Exhibit: plastics storm raging in Croatia.,2009,bra0zo,https://gfycat.com/ElaborateHeartfeltChrysomelid,190,1558443046.0,SirT6,0.94,/r/sciences/comments/bra0zo/our_world_has_a_disposable_plastics_problem/,sciences,166187,2
"A boy was dying from a rare disease, lymphatic anomaly. His doctors had pinpointed the genetic mutation driving the disease, but had no idea how to treat it. So they made zebrafish with the mutation and screened hundreds of FDA approved drugs. They found one that worked, and the boy has recovered.",1987,c9fdzo,https://www.statnews.com/2019/07/01/precision-medicine-zebrafish-helped-save-boys-life/,71,1562329682.0,SirT6,0.99,/r/sciences/comments/c9fdzo/a_boy_was_dying_from_a_rare_disease_lymphatic/,sciences,166187,2
"The relationship between childhood mortality and fertility: 150 years ago we lived in a world where many children did not make it past the age of five. As a result woman frequently had more children. As infant mortality improved, fertility rates declined.",1982,bwncya,https://gfycat.com/ThoughtfulDampIvorygull,149,1559645847.0,SirT6,0.99,/r/sciences/comments/bwncya/the_relationship_between_childhood_mortality_and/,sciences,166187,2
"The surface of the sun in motion. Each of the ""cells"" on the surface of the sun are roughly the size of Texas.",1957,ew3be3,https://gfycat.com/oldeveryearwig,49,1580379774.0,cosmicdatabase,0.99,/r/sciences/comments/ew3be3/the_surface_of_the_sun_in_motion_each_of_the/,sciences,166187,2
"This mini snake-shaped robot can navigate winding spaces in models of the inner brain, demonstrating the promise of soft continuum robots as future medical tools.",1933,cx0qj1,https://gfycat.com/smartreasonablehousefly,81,1567084318.0,SirT6,0.99,/r/sciences/comments/cx0qj1/this_mini_snakeshaped_robot_can_navigate_winding/,sciences,166187,2
The distribution of space debris orbiting Earth,1936,dx8cd8,https://gfycat.com/welldocumentedappropriatecrane,65,1573918632.0,SirT6,0.99,/r/sciences/comments/dx8cd8/the_distribution_of_space_debris_orbiting_earth/,sciences,166187,2
"Four adult bison were released into a newly expanded habitat in Badlands National Park. It is the first time bison have set foot on this land since 1877, according to the World Wildlife Fund.",1928,diubpp,https://gfycat.com/uncomfortablefavoritearawana,47,1571253934.0,SirT6,0.98,/r/sciences/comments/diubpp/four_adult_bison_were_released_into_a_newly/,sciences,166187,2
Local vet singlehandedly performs bovine C-section,1920,gbhmqu,https://gfycat.com/enlightenedlikableibizanhound,90,1588337892.0,SirT6,0.98,/r/sciences/comments/gbhmqu/local_vet_singlehandedly_performs_bovine_csection/,sciences,166187,2
The Solar System's trajectory referencing our movement through the galaxy,1879,cud9u2,https://media1.giphy.com/media/KvukGjDlASaf6/source.gif,79,1566563748.0,IJesusChrist,0.94,/r/sciences/comments/cud9u2/the_solar_systems_trajectory_referencing_our/,sciences,166187,2
"The GOES weather satellite took an image per day of the Earth over the last year from at 1200 UTC, and looped them together. You can visualize how the seasons change from equinox to solstice due to the Earth's 23.5° tilt.",1874,edrbym,https://gfycat.com/knobbyboilingfallowdeer,69,1576943058.0,SirT6,0.99,/r/sciences/comments/edrbym/the_goes_weather_satellite_took_an_image_per_day/,sciences,166187,2
This arrow by mathematician and sculptor Kokichi Sugihara can't point left. It's 3D-printed with a series of curves designed prevent the brain from registering it.,1871,cmqdsk,https://gfycat.com/famousshockingdikkops,42,1565096996.0,SirT6,0.97,/r/sciences/comments/cmqdsk/this_arrow_by_mathematician_and_sculptor_kokichi/,sciences,166187,2
"The power of CAR-T, a therapy where patient T-cells are genetically engineered to destroy tumor cells. 65yo woman, disease refractory to multiple lines of chemo. Then CAR-T: (a) baseline before CAR-T (b) 10 days post CAR-T (c) 60 days post CAR-T. She is in remission more than one year later.",1862,dr0oxa,https://i.redd.it/9m4am0q58hw31.jpg,76,1572789410.0,SirT6,0.98,/r/sciences/comments/dr0oxa/the_power_of_cart_a_therapy_where_patient_tcells/,sciences,166187,2
Want to see a stem cell turn into a neuron?,1848,e8q61g,https://v.redd.it/21tlkgqsxs341,70,1575981973.0,pollisa_85,0.99,/r/sciences/comments/e8q61g/want_to_see_a_stem_cell_turn_into_a_neuron/,sciences,166187,2
"On International Women's Day, let us thank Katalin Karikó, inventor of the mRNA Vaccine tech that is saving billions of lives around the globe",1850,m0fckp,https://i.imgur.com/4NQyzhw.jpg,48,1615209008.0,avitechwriter,0.97,/r/sciences/comments/m0fckp/on_international_womens_day_let_us_thank_katalin/,sciences,166187,2
"The magnetosphere shields Earth: Each second, 1.5 million tons of solar material shoot off the Sun into space. But solar wind can get in near the poles and disrupt satellite, radio & GPS signals.",1834,e3xlec,https://gfycat.com/greedyscrawnyflyingsquirrel,82,1575125952.0,SirT6,0.98,/r/sciences/comments/e3xlec/the_magnetosphere_shields_earth_each_second_15/,sciences,166187,2
"This fish transport system moves fish through a flexible, pressurized tube, safely transporting them from one area to another. This solves a major problem for migratory fish like salmon.",1837,cpb5rd,https://gfycat.com/phonythriftyiridescentshark,155,1565609719.0,SirT6,0.98,/r/sciences/comments/cpb5rd/this_fish_transport_system_moves_fish_through_a/,sciences,166187,2
A stomata from the underside of a leaf opening and closing in response to water availability,1827,davoia,https://i.redd.it/hmm4pwllkjp31.gif,55,1569766652.0,IJesusChrist,0.99,/r/sciences/comments/davoia/a_stomata_from_the_underside_of_a_leaf_opening/,sciences,166187,2
Then and now,1814,hbdncq,https://i.redd.it/af5sqv5own551.jpg,53,1592483226.0,SirT6,0.98,/r/sciences/comments/hbdncq/then_and_now/,sciences,166187,2
"When a star strays too close to a black hole, intense tides break it apart into a stream of gas. The tail of the stream escapes the system, while the rest of it swings back around, surrounding the black hole with a disk of debris. This is called a tidal disruption event.",1801,dk3a0a,https://gfycat.com/simpleforkedcanine,37,1571489036.0,SirT6,0.99,/r/sciences/comments/dk3a0a/when_a_star_strays_too_close_to_a_black_hole/,sciences,166187,2
"Jupiter rising from behind the Moon, 600 million km away.",1806,azschw,https://gfycat.com/TightAromaticFlounder,48,1552303784.0,SirT6,1.0,/r/sciences/comments/azschw/jupiter_rising_from_behind_the_moon_600_million/,sciences,166187,2
Nerve transfer surgery enables tetraplegic patient to regain movement and function in his elbow and hand.,1798,cbfk4d,https://gfycat.com/identicaltemptingachillestang,65,1562758278.0,SirT6,0.99,/r/sciences/comments/cbfk4d/nerve_transfer_surgery_enables_tetraplegic/,sciences,166187,2
"Scientists exploring the ocean floor find the decomposing carcass of a whale. Scavenging fish and octopus strip the blubber from the corpse, while bone-eating Osedax worms dissolve its bones.",1778,djm4bv,https://gfycat.com/elegantorneryballpython,42,1571398036.0,SirT6,0.99,/r/sciences/comments/djm4bv/scientists_exploring_the_ocean_floor_find_the/,sciences,166187,2
