title,score,id,url,num_comments,created,author,upvote_ratio,permalink,subreddit,subreddit_subscribers,depth
ORIGIN- THE BURNER (on a 2 piece kit) my current practise idea is to strip almost everything off my kit and improvise fills and grooves on a minimal setup,131,ompqnl,https://v.redd.it/3q1gqpfaryb71,17,1626611863.0,Robin_stone_drums,0.99,/r/MetalDrums/comments/ompqnl/origin_the_burner_on_a_2_piece_kit_my_current/,MetalDrums,5552,2
Today’s cardio 🥵,128,tkcpuc,https://v.redd.it/x6tt23j3zzo81,24,1647982041.0,Djerrick,0.97,/r/MetalDrums/comments/tkcpuc/todays_cardio/,MetalDrums,5552,2
"When you wanna do blastbonks, but you don't wanna listen to angry guitars! (bonus points if you know where the music is from!)",127,p7xix1,https://v.redd.it/y0oxj0gsqgi71,19,1629445489.0,Robin_stone_drums,0.99,/r/MetalDrums/comments/p7xix1/when_you_wanna_do_blastbonks_but_you_dont_wanna/,MetalDrums,5552,2
Feet @ 220 trying not to suck ft. messy cables,122,u37vij,https://v.redd.it/p2t2zrnwwet81,19,1649906362.0,MikeCaputoDrums,0.97,/r/MetalDrums/comments/u37vij/feet_220_trying_not_to_suck_ft_messy_cables/,MetalDrums,5552,2
Some 7/8 blasting for you! 🤘🏻,105,o1b37q,https://v.redd.it/4efe3sw03o571,6,1623866428.0,Drummer1324,0.99,/r/MetalDrums/comments/o1b37q/some_78_blasting_for_you/,MetalDrums,5552,2
Check out !!,103,vud69t,https://www.youtube.com/watch?v=RGwrevD3SOM&ab_channel=MarkoCelesty%26FabioBule,2,1657293563.0,BojanicX,1.0,/r/MetalDrums/comments/vud69t/check_out/,MetalDrums,5552,2
Some POV Metal Drumming For You,97,pxf3f1,https://v.redd.it/v8ttoz910bq71,12,1632861067.0,jgogz,1.0,/r/MetalDrums/comments/pxf3f1/some_pov_metal_drumming_for_you/,MetalDrums,5552,2
"New Video, if you like fast drumming :)",91,vhlkbl,https://www.youtube.com/watch?v=kXSxloTt25U&ab_channel=MarkoCelesty%26FabioBule,1,1655840191.0,BojanicX,1.0,/r/MetalDrums/comments/vhlkbl/new_video_if_you_like_fast_drumming/,MetalDrums,5552,2
Played a sold out show at Anaheim House Of Blues on Wednesday with Brand of Sacrifice supporting Dayseeker and Spiritbox,91,wz8ogr,https://v.redd.it/oiydcyn2lak91,9,1661621835.0,MikeCaputoDrums,1.0,/r/MetalDrums/comments/wz8ogr/played_a_sold_out_show_at_anaheim_house_of_blues/,MetalDrums,5552,2
Been on the road playing with Brand of Sacrifice the last couple weeks. Here's a clip of Millennium from a sold out show in Anaheim,93,10zvyd2,https://v.redd.it/3hnwpqhe3mha1,10,1676144350.0,MikeCaputoDrums,1.0,/r/MetalDrums/comments/10zvyd2/been_on_the_road_playing_with_brand_of_sacrifice/,MetalDrums,5552,2
Kick drum go BRRRRRRRRRRRRR,89,x2ty6m,https://v.redd.it/xsghvy8fb5l91,16,1661993928.0,MikeCaputoDrums,0.98,/r/MetalDrums/comments/x2ty6m/kick_drum_go_brrrrrrrrrrrrr/,MetalDrums,5552,2
What I hear vs what they hear. This is why I use an electric kit in my house lol,88,10bdjxy,https://v.redd.it/muwaaq8kbxba1,14,1673664987.0,MikeCaputoDrums,1.0,/r/MetalDrums/comments/10bdjxy/what_i_hear_vs_what_they_hear_this_is_why_i_use/,MetalDrums,5552,2
metal drums,81,ufot8f,https://v.redd.it/ufuebfncmrw81,0,1651367835.0,milopkl,0.97,/r/MetalDrums/comments/ufot8f/metal_drums/,MetalDrums,5552,2
Some overhead blasting at 260bpm 🥵,80,yqsqxi,https://v.redd.it/m5vph3ik7zy91,16,1668021795.0,jgogz,1.0,/r/MetalDrums/comments/yqsqxi/some_overhead_blasting_at_260bpm/,MetalDrums,5552,2
Keeping chops up over some Chemical Brothers tracks :),79,ssza6q,https://v.redd.it/3b0wof78uyh81,9,1644918017.0,Robin_stone_drums,1.0,/r/MetalDrums/comments/ssza6q/keeping_chops_up_over_some_chemical_brothers/,MetalDrums,5552,2
Ah yes..,78,r8dm0l,https://i.redd.it/5dftt1c0cf381.jpg,10,1638579320.0,Robin_stone_drums,0.97,/r/MetalDrums/comments/r8dm0l/ah_yes/,MetalDrums,5552,2
"Former Slipknot Drummer Joey Jordison Dead At 46 — Sorry, not a drumming video. He was an inspiration to many, and the reason why I bought my first pair of drumsticks. RIP.",76,osvg64,https://www.blabbermouth.net/news/former-slipknot-drummer-joey-jordison-dead-at-46/?fbclid=IwAR3616ZYNjaPDwmwabyEM46Z8-eE6504MuvwflMM05X67i6mMmUYDEf93Ig,6,1627420676.0,mchiabotto,0.99,/r/MetalDrums/comments/osvg64/former_slipknot_drummer_joey_jordison_dead_at_46/,MetalDrums,5552,2
"Hit the studio today, the drums sounded unreal!",72,rxejh0,https://v.redd.it/zq8c4gktj2a81,6,1641475484.0,jgogz,0.99,/r/MetalDrums/comments/rxejh0/hit_the_studio_today_the_drums_sounded_unreal/,MetalDrums,5552,2
Some POV metal drumming! Trying to keep that snare drum haunted 👻👻👻,72,q43fvq,https://v.redd.it/dl5ssg6dp9s71,6,1633716857.0,jgogz,1.0,/r/MetalDrums/comments/q43fvq/some_pov_metal_drumming_trying_to_keep_that_snare/,MetalDrums,5552,2
New to Reddit! Here’s some fast #blasting! Cheers!,71,f4133i,https://v.redd.it/ykb80q068zg41,18,1581724137.0,Metalskylord666,0.93,/r/MetalDrums/comments/f4133i/new_to_reddit_heres_some_fast_blasting_cheers/,MetalDrums,5552,2
Trying to keep up with hellhammer on this killer NIDINGR track.,68,o0885f,https://v.redd.it/u7db5zfjld571,14,1623740778.0,Robin_stone_drums,1.0,/r/MetalDrums/comments/o0885f/trying_to_keep_up_with_hellhammer_on_this_killer/,MetalDrums,5552,2
Been a minute since I posted any videos here. Currently working with Fleshbound's first ep. Pretty cool stuff. Check it out if you have a minute!,70,mzwi10,https://v.redd.it/ribn63b8prv61,14,1619551798.0,KC_ToC,1.0,/r/MetalDrums/comments/mzwi10/been_a_minute_since_i_posted_any_videos_here/,MetalDrums,5552,2
"Watch ""Light Of Transparency (feat. Michael LePond) - Marko Celesty & Fabio Bule"" on YouTube",64,u8868r,https://youtu.be/ntrIt8NjTE0,2,1650493331.0,HorrorSoundsWorld,0.98,/r/MetalDrums/comments/u8868r/watch_light_of_transparency_feat_michael_lepond/,MetalDrums,5552,2
thrash metal,67,w6qgwy,https://v.redd.it/0wm0ireu3hd91,10,1658649884.0,milopkl,0.99,/r/MetalDrums/comments/w6qgwy/thrash_metal/,MetalDrums,5552,2
My SJC Pathfinder kit,65,n25pqz,https://i.redd.it/jwdnejif6ew61.jpg,9,1619823855.0,Towi_g,0.99,/r/MetalDrums/comments/n25pqz/my_sjc_pathfinder_kit/,MetalDrums,5552,2
"Drum Playthrough ,our single Tilted Gravity",62,v0dald,https://www.youtube.com/watch?v=GCFhGGMhj1c&ab_channel=MarkoCelesty%26FabioBule,4,1653837372.0,BojanicX,0.98,/r/MetalDrums/comments/v0dald/drum_playthrough_our_single_tilted_gravity/,MetalDrums,5552,2
Noodling around between takes awhile ago while filming a cover,62,t3tc7x,https://v.redd.it/6cotdj1zsnk81,13,1646091341.0,MikeCaputoDrums,0.95,/r/MetalDrums/comments/t3tc7x/noodling_around_between_takes_awhile_ago_while/,MetalDrums,5552,2
"My setup for festival gig last night. I was filling in for drummer who was in lockdown, so had to run all the backing tracks, click tracks etc, and remember how the songs went while wearing a death mask 😅",65,o3s5gz,https://i.redd.it/dpns993m0b671.jpg,5,1624144054.0,Robin_stone_drums,1.0,/r/MetalDrums/comments/o3s5gz/my_setup_for_festival_gig_last_night_i_was/,MetalDrums,5552,2
Sometimes you just gotta play super hard like an ignorant caveman. Here's a clip from when I filled in for Traitors in Europe right before COVID,62,t61yk8,https://v.redd.it/so9co6vxi8l81,4,1646342207.0,MikeCaputoDrums,0.98,/r/MetalDrums/comments/t61yk8/sometimes_you_just_gotta_play_super_hard_like_an/,MetalDrums,5552,2
For my fellow drummers,61,saqtl5,https://i.redd.it/36i0mpr80ed81.jpg,6,1642933948.0,Daxelol,0.95,/r/MetalDrums/comments/saqtl5/for_my_fellow_drummers/,MetalDrums,5552,2
Here we go,61,kjq7lp,https://i.redd.it/eyphb1tvd8761.jpg,4,1608857513.0,AC1D666,1.0,/r/MetalDrums/comments/kjq7lp/here_we_go/,MetalDrums,5552,2
Finally have my own drum studio! Planning on investing in some decent mics here soon but I’m happy to have a place to play loud!,57,q4fisn,https://v.redd.it/kcac8q19ads71,5,1633760175.0,Djerrick,0.95,/r/MetalDrums/comments/q4fisn/finally_have_my_own_drum_studio_planning_on/,MetalDrums,5552,2
"I'm so happy to have my kit back, anyone else love adding to their kits?",61,jvcddl,https://www.reddit.com/gallery/jvcddl,19,1605552263.0,ashalacotaco,1.0,/r/MetalDrums/comments/jvcddl/im_so_happy_to_have_my_kit_back_anyone_else_love/,MetalDrums,5552,2
OPPRESSOR GOD drum tracking this week :),57,v00u8m,https://v.redd.it/boh1knnaib291,7,1653787729.0,Robin_stone_drums,1.0,/r/MetalDrums/comments/v00u8m/oppressor_god_drum_tracking_this_week/,MetalDrums,5552,2
IMMORTAL!!! one by one ( sped up version with stick drops included haha),56,o6wxzc,https://v.redd.it/mcwlzb8xb6771,11,1624524554.0,Robin_stone_drums,1.0,/r/MetalDrums/comments/o6wxzc/immortal_one_by_one_sped_up_version_with_stick/,MetalDrums,5552,2
Little exercise I do sometimes to make sure both hands in my traditional blasts are locked in where they're supposed to be,54,11bue2z,https://v.redd.it/qamfs32e6eka1,10,1677355833.0,MikeCaputoDrums,0.98,/r/MetalDrums/comments/11bue2z/little_exercise_i_do_sometimes_to_make_sure_both/,MetalDrums,5552,2
When the drummer gets to write the song 😉,49,yvaqt9,https://v.redd.it/037mzupl2zz91,6,1668455944.0,jgogz,0.91,/r/MetalDrums/comments/yvaqt9/when_the_drummer_gets_to_write_the_song/,MetalDrums,5552,2
Getting a bit wild on this sarcophagum track!,53,syh8mp,https://v.redd.it/zfhf5mta3cj81,17,1645513791.0,Robin_stone_drums,1.0,/r/MetalDrums/comments/syh8mp/getting_a_bit_wild_on_this_sarcophagum_track/,MetalDrums,5552,2
Trying out the Alex Rudinger Linear Singles thing. Almost got it!,53,lm4hb5,https://v.redd.it/ytwmflhkp3i61,8,1613595430.0,GrooveJourney,0.95,/r/MetalDrums/comments/lm4hb5/trying_out_the_alex_rudinger_linear_singles_thing/,MetalDrums,5552,2
Little impromptu jam,55,vhwmq9,https://v.redd.it/2ndhxxsdp3791,10,1655872717.0,GeneralSpongeBob,1.0,/r/MetalDrums/comments/vhwmq9/little_impromptu_jam/,MetalDrums,5552,2
Brainstorming parts for The Odious Construct full length! Very proud of this one cuz i wrote an the music lol. Thanks for watching!,54,js9981,https://v.redd.it/qppcvlx5hmy51,12,1605105576.0,KC_ToC,0.98,/r/MetalDrums/comments/js9981/brainstorming_parts_for_the_odious_construct_full/,MetalDrums,5552,2
Endurance runs got me SWEATING 🥵,53,wq5gut,https://v.redd.it/w4txwgdzk6i91,3,1660683610.0,jgogz,1.0,/r/MetalDrums/comments/wq5gut/endurance_runs_got_me_sweating/,MetalDrums,5552,2
"Throwback to the Rings days. Ian would do this part with me every day. This was my favorite part of the set. Fun fact, my stick company saw him doing this the year before and made him a pair of signature sticks specifically for this lol",49,t7hfvz,https://v.redd.it/so58w5oheml81,2,1646510200.0,MikeCaputoDrums,0.97,/r/MetalDrums/comments/t7hfvz/throwback_to_the_rings_days_ian_would_do_this/,MetalDrums,5552,2
Cant wait to release this blaster,49,v4jc4b,https://v.redd.it/n6bb5qxsyj391,7,1654325952.0,GeneralSpongeBob,0.98,/r/MetalDrums/comments/v4jc4b/cant_wait_to_release_this_blaster/,MetalDrums,5552,2
You Suffer,50,fuiyge,https://v.redd.it/hooyjl97toq41,10,1585956468.0,g2g4m10,0.93,/r/MetalDrums/comments/fuiyge/you_suffer/,MetalDrums,5552,2
Slamming on this short Drums/Bass/Synth prog metal tune for a yet-to-be-released EP. Outro section in 31/16?,48,l4org2,https://v.redd.it/z0fm4oidbgd61,3,1611584480.0,notmaxkelly,0.98,/r/MetalDrums/comments/l4org2/slamming_on_this_short_drumsbasssynth_prog_metal/,MetalDrums,5552,2
Tryin to connect the hands and feet 🥶,50,hg1qfc,https://v.redd.it/y0x0jokxw6751,13,1593149211.0,KamberM,1.0,/r/MetalDrums/comments/hg1qfc/tryin_to_connect_the_hands_and_feet/,MetalDrums,5552,2
Little bit of Gojira,46,yxy3b4,https://v.redd.it/9dxzrqpw3k0a1,5,1668710930.0,MrSaucyNips,0.98,/r/MetalDrums/comments/yxy3b4/little_bit_of_gojira/,MetalDrums,5552,2
Tried to make an aggressive synth-metal solo tune in 9/16. Let me know what you guys think!,47,lawqxb,https://v.redd.it/wggk2ak2r2f61,10,1612276278.0,notmaxkelly,0.97,/r/MetalDrums/comments/lawqxb/tried_to_make_an_aggressive_synthmetal_solo_tune/,MetalDrums,5552,2
"I just triggered my kick drum, I'm liking it so far, and my hands are a bit sloppy on the toms cause I'm used to 3 rack toms and I'm missing one",46,l6cy4q,https://v.redd.it/ddnhmjvgkxd61,18,1611777591.0,ashalacotaco,0.98,/r/MetalDrums/comments/l6cy4q/i_just_triggered_my_kick_drum_im_liking_it_so_far/,MetalDrums,5552,2
Little preview of a live drum cam of Exodus with Brand of Sacrifice from the last day of our tour supporting We Came As Romans and Erra,43,11aac3b,https://v.redd.it/l02f09kaf0ka1,6,1677190267.0,MikeCaputoDrums,0.99,/r/MetalDrums/comments/11aac3b/little_preview_of_a_live_drum_cam_of_exodus_with/,MetalDrums,5552,2
"Just posted a drum cover of ""Broken Vision Rhythm"" by Loathe! Full vid in the comments.",42,tcumiu,https://v.redd.it/y71xypddn1n81,2,1647130635.0,brodytaylorsmith,0.92,/r/MetalDrums/comments/tcumiu/just_posted_a_drum_cover_of_broken_vision_rhythm/,MetalDrums,5552,2
Sneak peak of a tune I'm working on. Practice your paradiddles!,44,l265bu,https://v.redd.it/clgyl923pqc61,2,1611258567.0,GrooveJourney,0.96,/r/MetalDrums/comments/l265bu/sneak_peak_of_a_tune_im_working_on_practice_your/,MetalDrums,5552,2
Do these count?,42,8v8ing,https://imgur.com/ggzxNJ3.jpg,2,1530432282.0,InsideOutOstrich,0.94,/r/MetalDrums/comments/8v8ing/do_these_count/,MetalDrums,5552,2
Posted a drum playthrough for “Thy Underling” by Alluvial the other day! Full vid in the comments,43,10lkmwr,https://v.redd.it/k7t053xbrbea1,9,1674711442.0,brodytaylorsmith,1.0,/r/MetalDrums/comments/10lkmwr/posted_a_drum_playthrough_for_thy_underling_by/,MetalDrums,5552,2
Some new metal drumless tracks on my channel,43,t1ej1l,https://youtu.be/c_F9yiMmlsY,1,1645823147.0,HorrorSoundsWorld,0.99,/r/MetalDrums/comments/t1ej1l/some_new_metal_drumless_tracks_on_my_channel/,MetalDrums,5552,2
Upcoming Album practice - Floortom/hh bleed reduction tips welcomed :),42,j56jvi,https://v.redd.it/q08kcl1475r51,10,1601845416.0,KC_ToC,0.99,/r/MetalDrums/comments/j56jvi/upcoming_album_practice_floortomhh_bleed/,MetalDrums,5552,2
Me and brother getting some progress on the new material. Hope you can enjoy!,46,inx6z7,https://v.redd.it/7w8ll469bml51,19,1599437667.0,mikewindham55,1.0,/r/MetalDrums/comments/inx6z7/me_and_brother_getting_some_progress_on_the_new/,MetalDrums,5552,2
kit pic,43,111c3re,https://i.redd.it/wd64i1oqo0ia1.jpg,9,1676302786.0,Sensitive-Hair-8821,0.98,/r/MetalDrums/comments/111c3re/kit_pic/,MetalDrums,5552,2
New material is pushing your boi 🥵 having a blast with it though!,42,ya06av,https://v.redd.it/kwlyslfe77v91,2,1666375170.0,jgogz,0.98,/r/MetalDrums/comments/ya06av/new_material_is_pushing_your_boi_having_a_blast/,MetalDrums,5552,2
What orientation are your triggers?,41,og0irf,https://i.redd.it/4kyixsms9x971.jpg,12,1625721037.0,Robin_stone_drums,0.98,/r/MetalDrums/comments/og0irf/what_orientation_are_your_triggers/,MetalDrums,5552,2
"I'm learning dirk blasts, they aren't as fast as other drummers but it's getting better",39,jzxcq8,https://v.redd.it/tuvhhkw1x3161,16,1606189035.0,ashalacotaco,0.95,/r/MetalDrums/comments/jzxcq8/im_learning_dirk_blasts_they_arent_as_fast_as/,MetalDrums,5552,2
How do we feel about Matt Greiner?,42,zk726m,https://v.redd.it/qws7ccitei5a1,13,1670869716.0,MrSaucyNips,0.98,/r/MetalDrums/comments/zk726m/how_do_we_feel_about_matt_greiner/,MetalDrums,5552,2
bestial blasting,38,uhek36,https://v.redd.it/92l06t7l48x81,0,1651579482.0,milopkl,0.94,/r/MetalDrums/comments/uhek36/bestial_blasting/,MetalDrums,5552,2
Here’s a challenging blast beat exercise I came up with! Try it out and let me know what you think 🤘🏻,39,od6wwj,https://v.redd.it/lo3m37b6h2971,3,1625348219.0,Drummer1324,0.98,/r/MetalDrums/comments/od6wwj/heres_a_challenging_blast_beat_exercise_i_came_up/,MetalDrums,5552,2
taking steps forward in my doublekicks,36,xnasyx,https://v.redd.it/xnwgt20pywp91,7,1664071989.0,milopkl,0.96,/r/MetalDrums/comments/xnasyx/taking_steps_forward_in_my_doublekicks/,MetalDrums,5552,2
"Had a lot of fun with this one lol! Gerudo Valley, blast beat edition! 😁",37,k7eipa,https://v.redd.it/sz665tj4cf361,8,1607198308.0,KC_ToC,0.97,/r/MetalDrums/comments/k7eipa/had_a_lot_of_fun_with_this_one_lol_gerudo_valley/,MetalDrums,5552,2
"Practice from the other day. Right foot speed starting to come back (had surgery in July, Achilles rupture). Feels good to play some heavier stuff! 🤘🏻",35,10jxp0h,https://v.redd.it/r6c3ai4qsyda1,4,1674536524.0,JPonDrums14,0.94,/r/MetalDrums/comments/10jxp0h/practice_from_the_other_day_right_foot_speed/,MetalDrums,5552,2
Practicing New Throne of Exile Material 🥵,37,xy37tf,https://v.redd.it/umljmn2zres91,3,1665159294.0,jgogz,1.0,/r/MetalDrums/comments/xy37tf/practicing_new_throne_of_exile_material/,MetalDrums,5552,2
Pearl Eliminator Demon Drive upgrade,36,n6eomk,https://www.reddit.com/gallery/n6eomk,6,1620327390.0,Towi_g,1.0,/r/MetalDrums/comments/n6eomk/pearl_eliminator_demon_drive_upgrade/,MetalDrums,5552,2
"Eat of the Dead - Nile (drum cover) or I should say ""attempt"" lol Kollias is a monster",37,l13hc0,https://v.redd.it/qs8lb9i1jfc61,9,1611123963.0,mikewindham55,0.94,/r/MetalDrums/comments/l13hc0/eat_of_the_dead_nile_drum_cover_or_i_should_say/,MetalDrums,5552,2
FUNERAL THIRST!!!,36,kovoly,https://v.redd.it/gehdjqiygw861,8,1609585090.0,mikewindham55,0.98,/r/MetalDrums/comments/kovoly/funeral_thirst/,MetalDrums,5552,2
War Ensemble (not perfect),36,gi1lic,https://v.redd.it/pomtzq9fp8y41,3,1589248342.0,g2g4m10,1.0,/r/MetalDrums/comments/gi1lic/war_ensemble_not_perfect/,MetalDrums,5552,2
Sleep Token - Granite (Drum Cover),35,116hi00,https://v.redd.it/3k1ahk06t7ja1,2,1676825088.0,Getsometp,0.95,/r/MetalDrums/comments/116hi00/sleep_token_granite_drum_cover/,MetalDrums,5552,2
foREVer. some of the parts I love..,36,zxqh7a,https://v.redd.it/saut8dorgq8a1,8,1672274457.0,djkdrums,0.97,/r/MetalDrums/comments/zxqh7a/forever_some_of_the_parts_i_love/,MetalDrums,5552,2
"Clip of when I was learning Mental Prolapse for the Rings of Saturn Gidim US tour in 2019. This song was a very cool, super fun song to play. Also if you see live videos of this song up until early 2020 you can see how I played the parts evolved slightly over time to have more small details",33,t57n5s,https://v.redd.it/obui1rdlr0l81,1,1646248258.0,MikeCaputoDrums,0.94,/r/MetalDrums/comments/t57n5s/clip_of_when_i_was_learning_mental_prolapse_for/,MetalDrums,5552,2
Finished up some session work for The Crystalline Entity. Pretty fun stuff.,36,lp7a78,https://v.redd.it/h7moptevgwi61,2,1613943454.0,KC_ToC,0.98,/r/MetalDrums/comments/lp7a78/finished_up_some_session_work_for_the_crystalline/,MetalDrums,5552,2
Brinstar Depths and blast beats! And my gravity blast debut lol,35,k5c2a1,https://v.redd.it/j2c1mdp7ss261,12,1606925270.0,KC_ToC,0.96,/r/MetalDrums/comments/k5c2a1/brinstar_depths_and_blast_beats_and_my_gravity/,MetalDrums,5552,2
"Intro and ""Exploitation of the Gallows"" 🤘🤘🍻",36,jqpwx9,https://v.redd.it/uhyvjbu6q4y51,8,1604892062.0,mikewindham55,1.0,/r/MetalDrums/comments/jqpwx9/intro_and_exploitation_of_the_gallows/,MetalDrums,5552,2
Within Demons! Hope ya dig 🤘🤘🍻🥃,36,i4iee1,https://v.redd.it/p0uesfzmaaf51,4,1596677237.0,mikewindham55,0.97,/r/MetalDrums/comments/i4iee1/within_demons_hope_ya_dig/,MetalDrums,5552,2
Practicing on direct drive pedals,34,y33osk,https://v.redd.it/8it8iqraslt91,0,1665680031.0,MrSaucyNips,0.97,/r/MetalDrums/comments/y33osk/practicing_on_direct_drive_pedals/,MetalDrums,5552,2
"It was way too nice out to warm up for the show inside. Experimenting with different pedal settings, too.",34,v0bd7i,https://v.redd.it/oe00e4qf4f291,5,1653831451.0,GrooveJourney,1.0,/r/MetalDrums/comments/v0bd7i/it_was_way_too_nice_out_to_warm_up_for_the_show/,MetalDrums,5552,2
Blastbonks!,36,nvsjcs,https://v.redd.it/tp9h0xf2uk271,2,1623234528.0,Robin_stone_drums,1.0,/r/MetalDrums/comments/nvsjcs/blastbonks/,MetalDrums,5552,2
"""Summoning forth the swarm of Lord Belial"" - Drum cam - Entrenched Defilement",33,jkbi2b,https://v.redd.it/xkhli5syr1w51,2,1603983305.0,mikewindham55,0.96,/r/MetalDrums/comments/jkbi2b/summoning_forth_the_swarm_of_lord_belial_drum_cam/,MetalDrums,5552,2
I guess this qualifies as metal (finger) drumming. 🤘,32,10a56wu,https://v.redd.it/ojoqz42ybnba1,8,1673544321.0,Nular-Music,0.84,/r/MetalDrums/comments/10a56wu/i_guess_this_qualifies_as_metal_finger_drumming/,MetalDrums,5552,2
More practice,33,yoxz4c,https://v.redd.it/xkyqd31f1ly91,1,1667850202.0,Charlesthedreadful,0.95,/r/MetalDrums/comments/yoxz4c/more_practice/,MetalDrums,5552,2
DRAGONCORPSE Power Metal/Deathcore 🐲,35,xosy08,https://v.redd.it/jij1r5jb79q91,7,1664220119.0,jgogz,1.0,/r/MetalDrums/comments/xosy08/dragoncorpse_power_metaldeathcore/,MetalDrums,5552,2
blastbeats for the weekend!,33,s58mxl,https://v.redd.it/y5xormfbayb81,0,1642327033.0,milopkl,0.95,/r/MetalDrums/comments/s58mxl/blastbeats_for_the_weekend/,MetalDrums,5552,2
"Drum cam of ""Immersing""",33,ji2t1d,https://v.redd.it/eq8nhhb8gbv51,11,1603665485.0,mikewindham55,1.0,/r/MetalDrums/comments/ji2t1d/drum_cam_of_immersing/,MetalDrums,5552,2
(Short video) Gene Hoglan sits in with Behemoth!,32,8t5z6l,https://www.youtube.com/watch?v=QEK33PghWDM,2,1529711841.0,mchiabotto,0.95,/r/MetalDrums/comments/8t5z6l/short_video_gene_hoglan_sits_in_with_behemoth/,MetalDrums,5552,2
The meinl classics custom bell comes in so clutch for breakdowns 😩,34,101el23,https://v.redd.it/ytdlwiy8ro9a1,3,1672671543.0,jgogz,0.92,/r/MetalDrums/comments/101el23/the_meinl_classics_custom_bell_comes_in_so_clutch/,MetalDrums,5552,2
i like slow blastbeats better than fast ones,30,wumw4s,https://v.redd.it/bebnez7zz0j91,6,1661153064.0,milopkl,0.93,/r/MetalDrums/comments/wumw4s/i_like_slow_blastbeats_better_than_fast_ones/,MetalDrums,5552,2
Chek out this drummer,32,uwo5ba,https://www.youtube.com/watch?v=RtMyUQ1lCOc&ab_channel=MarkoCelesty%26FabioBule,2,1653390006.0,BojanicX,0.96,/r/MetalDrums/comments/uwo5ba/chek_out_this_drummer/,MetalDrums,5552,2
Drumless metal.track.Enjoy,31,s76xdg,https://youtu.be/k2bAapPg0P8,2,1642537503.0,HorrorSoundsWorld,0.94,/r/MetalDrums/comments/s76xdg/drumless_metaltrackenjoy/,MetalDrums,5552,2
Hi everyone! New here! Here's my attempt at Origin track 'Saligia'.. Absolute PUNISHER!! :'(,32,nnhylz,https://youtu.be/rr0GAXhY4v0,7,1622272628.0,Robin_stone_drums,1.0,/r/MetalDrums/comments/nnhylz/hi_everyone_new_here_heres_my_attempt_at_origin/,MetalDrums,5552,2
"This nearly cost me my sanity, highly recommend learning it🥁🤘",31,msqqhu,https://youtu.be/rrRTF8U22fc,9,1618666085.0,SamDrummer94,0.96,/r/MetalDrums/comments/msqqhu/this_nearly_cost_me_my_sanity_highly_recommend/,MetalDrums,5552,2
"Hello all! Paiste cymbals, Yamaha stage custom birch, OCDP Maple snare, ACD Pedals, and Remo heads are being used for this recording session! Cheers and happy drumming!",32,lj80jh,https://i.redd.it/7qnai1t2xah61.jpg,0,1613246662.0,Metalskylord666,0.97,/r/MetalDrums/comments/lj80jh/hello_all_paiste_cymbals_yamaha_stage_custom/,MetalDrums,5552,2
When you can feel the stick breaking,33,jlm4h8,https://v.redd.it/sfpje7soqgw51,7,1604164429.0,codygriffin11,0.98,/r/MetalDrums/comments/jlm4h8/when_you_can_feel_the_stick_breaking/,MetalDrums,5552,2
"Me and my brother working on one of our new tracks ""The Worming"" Cheers! 🍻🤘🤘 and excuse the unintended rim jobs 😅🤣😛 #rolanddrums #behringer #vaterdrumsticks #gibraltar #entrencheddefilement #deathmetal #metal #ironcobra #johnmichaelwindham #blackmetal",34,hui86r,https://v.redd.it/p84xmlzabzb51,8,1595236740.0,mikewindham55,0.92,/r/MetalDrums/comments/hui86r/me_and_my_brother_working_on_one_of_our_new/,MetalDrums,5552,2
"My band just released our debut music video. I'm super proud of my drumming in this. No quantization on anything, just a trigger/sample feed straight into the box through a DI. Hope y'all like it",30,f6zgwq,https://youtu.be/ijJfMA7ajsA,6,1582231715.0,Sub_Par_Drumming,0.94,/r/MetalDrums/comments/f6zgwq/my_band_just_released_our_debut_music_video_im/,MetalDrums,5552,2
Yo check out this drum play through I did for my black metal band!,34,45tyuu,http://youtu.be/0YLJR3tP0xE,11,1455497407.0,Drummer1324,1.0,/r/MetalDrums/comments/45tyuu/yo_check_out_this_drum_play_through_i_did_for_my/,MetalDrums,5552,2
"""How do you practice when you're not home?""",31,11t5xdn,https://i.redd.it/lyf3i8gwg7oa1.jpg,0,1678999958.0,MikeCaputoDrums,1.0,/r/MetalDrums/comments/11t5xdn/how_do_you_practice_when_youre_not_home/,MetalDrums,5552,2
Zelda Windwaker with blast beats? I think so 😎,31,u0vonz,https://v.redd.it/re98zrgjsss81,5,1649638918.0,KC_ToC,0.93,/r/MetalDrums/comments/u0vonz/zelda_windwaker_with_blast_beats_i_think_so/,MetalDrums,5552,2
MESHUGGAH - Nostrum (DRUM PLAYTHROUGH w/ TOMAS HAAKE),33,53j49i,https://youtu.be/EPW0AWDmfJQ,7,1474310934.0,LucasJLeCompte,0.98,/r/MetalDrums/comments/53j49i/meshuggah_nostrum_drum_playthrough_w_tomas_haake/,MetalDrums,5552,2
blastbeat with snare rolls,29,sfeayj,https://v.redd.it/bb94k6kezie81,0,1643447369.0,milopkl,0.95,/r/MetalDrums/comments/sfeayj/blastbeat_with_snare_rolls/,MetalDrums,5552,2
Me and my brother working new material,30,qow4t0,https://v.redd.it/xu9r932i78y71,8,1636314205.0,mikewindham55,0.95,/r/MetalDrums/comments/qow4t0/me_and_my_brother_working_new_material/,MetalDrums,5552,2
Revisiting old songs is always fun!,29,taglrp,https://v.redd.it/criwzvme4bm81,5,1646857210.0,Robin_stone_drums,0.97,/r/MetalDrums/comments/taglrp/revisiting_old_songs_is_always_fun/,MetalDrums,5552,2
Progress continues...,27,o286kc,https://v.redd.it/vmr9j1rnav571,0,1623964803.0,mikewindham55,0.93,/r/MetalDrums/comments/o286kc/progress_continues/,MetalDrums,5552,2
Getting down with some DRAGONCORPSE 🐲☠️,28,zqryl2,https://v.redd.it/jooqxefj947a1,3,1671551752.0,jgogz,0.95,/r/MetalDrums/comments/zqryl2/getting_down_with_some_dragoncorpse/,MetalDrums,5552,2
"a7x - Blinded in Chains, the rev was one of the greats! drum cover by @borgesmarc",27,xz4tz2,https://v.redd.it/uavs1dh14ps91,10,1665266418.0,Situation_Fearless,0.92,/r/MetalDrums/comments/xz4tz2/a7x_blinded_in_chains_the_rev_was_one_of_the/,MetalDrums,5552,2
