title,score,id,url,num_comments,created,author,upvote_ratio,permalink,subreddit,subreddit_subscribers,author_name
"Always sell benefits, not features. Remember this: In 2001, when Steve Jobs introduced the first iPod to the World, he didn't pull it out of his jeans pocket and say, ""The iPod. A 5GB MP3 player"". He said, ""The iPod. 1,000 songs in your pocket.""",1654,g34ai4,https://www.reddit.com/r/marketing/comments/g34ai4/always_sell_benefits_not_features_remember_this/,106,1587137740.0,kervokian,0.99,/r/marketing/comments/g34ai4/always_sell_benefits_not_features_remember_this/,marketing,474670,kervokian
SEO is easy. The EXACT process we use to scale our clients' SEO from 0 to 200k monthly traffic and beyond,947,hqg6im,https://www.reddit.com/r/marketing/comments/hqg6im/seo_is_easy_the_exact_process_we_use_to_scale_our/,100,1594650360.0,malchik23,0.97,/r/marketing/comments/hqg6im/seo_is_easy_the_exact_process_we_use_to_scale_our/,marketing,474670,malchik23
We just compiled a huge list of learning resources for digital marketing. We thought this sub would appreciate it!,885,flzd3z,https://www.reddit.com/r/marketing/comments/flzd3z/we_just_compiled_a_huge_list_of_learning/,52,1584726697.0,DrJigsaw,0.99,/r/marketing/comments/flzd3z/we_just_compiled_a_huge_list_of_learning/,marketing,474670,DrJigsaw
"I've written copy for tech companies like Zoom, Slack, and Drift. Here's my framework for writing captivating hero sections.",859,yloawd,https://www.reddit.com/r/marketing/comments/yloawd/ive_written_copy_for_tech_companies_like_zoom/,65,1667534586.0,itsjustdifferent_,0.99,/r/marketing/comments/yloawd/ive_written_copy_for_tech_companies_like_zoom/,marketing,474670,itsjustdifferent_
Something to lighten up the mood,779,fmsfem,https://i.redd.it/gn1scha5nxn41.jpg,6,1584844938.0,AptSeagull,0.98,/r/marketing/comments/fmsfem/something_to_lighten_up_the_mood/,marketing,474670,AptSeagull
2021 Marketing Worksheet,576,issqrx,https://www.reddit.com/r/marketing/comments/issqrx/2021_marketing_worksheet/,131,1600113627.0,JonODonovan,0.99,/r/marketing/comments/issqrx/2021_marketing_worksheet/,marketing,474670,JonODonovan
"Dear young marketer,",493,plnn9d,https://www.reddit.com/r/marketing/comments/plnn9d/dear_young_marketer/,60,1631288830.0,stewofkc,0.99,/r/marketing/comments/plnn9d/dear_young_marketer/,marketing,474670,stewofkc
"If you are wondering how to get started in SEO with no experience, this is what I did.",490,tk25tm,https://www.reddit.com/r/marketing/comments/tk25tm/if_you_are_wondering_how_to_get_started_in_seo/,104,1647953042.0,SEO403,0.99,/r/marketing/comments/tk25tm/if_you_are_wondering_how_to_get_started_in_seo/,marketing,474670,SEO403
Brand positioning increased our monthly sales from $10k to $100k in 45 days,477,jum3ru,https://www.reddit.com/r/marketing/comments/jum3ru/brand_positioning_increased_our_monthly_sales/,81,1605448014.0,otaota,0.97,/r/marketing/comments/jum3ru/brand_positioning_increased_our_monthly_sales/,marketing,474670,otaota
I’ve been marketing my tshirt company for 20 minutes and no sales,468,vqv5k3,https://www.reddit.com/r/marketing/comments/vqv5k3/ive_been_marketing_my_tshirt_company_for_20/,134,1656895136.0,illbzo1,0.88,/r/marketing/comments/vqv5k3/ive_been_marketing_my_tshirt_company_for_20/,marketing,474670,illbzo1
Google Sheets skills for digital marketers,466,blavfc,https://www.reddit.com/r/marketing/comments/blavfc/google_sheets_skills_for_digital_marketers/,78,1557141616.0,the_mmw,0.99,/r/marketing/comments/blavfc/google_sheets_skills_for_digital_marketers/,marketing,474670,the_mmw
Hard Truth: No one wants entry level “strategic” marketers,418,ly389h,https://www.reddit.com/r/marketing/comments/ly389h/hard_truth_no_one_wants_entry_level_strategic/,166,1614915948.0,Rusty_James,0.97,/r/marketing/comments/ly389h/hard_truth_no_one_wants_entry_level_strategic/,marketing,474670,Rusty_James
"To demonstrate the power of ChatGPT for the future of marketing, here's a sample of how you can generate entire campaigns for a dog grooming business -- in under five minutes",403,107j958,https://www.reddit.com/r/marketing/comments/107j958/to_demonstrate_the_power_of_chatgpt_for_the/,109,1673283056.0,SAT0725,0.96,/r/marketing/comments/107j958/to_demonstrate_the_power_of_chatgpt_for_the/,marketing,474670,SAT0725
500K Instagram Followers in 24 hours. The Sunny Co Clothing Scam!,399,7f78bz,https://www.reddit.com/r/marketing/comments/7f78bz/500k_instagram_followers_in_24_hours_the_sunny_co/,52,1511527139.0,natespf,0.95,/r/marketing/comments/7f78bz/500k_instagram_followers_in_24_hours_the_sunny_co/,marketing,474670,natespf
Anyone interested in Excel/Google Sheets tutorials for marketers?,372,an27zs,https://www.reddit.com/r/marketing/comments/an27zs/anyone_interested_in_excelgoogle_sheets_tutorials/,122,1549290937.0,regpaq,0.99,/r/marketing/comments/an27zs/anyone_interested_in_excelgoogle_sheets_tutorials/,marketing,474670,regpaq
TikTok is overrated and useless for the vast majority of businesses. Change my mind.,359,g0ief2,https://www.reddit.com/r/marketing/comments/g0ief2/tiktok_is_overrated_and_useless_for_the_vast/,226,1586782486.0,SAT0725,0.94,/r/marketing/comments/g0ief2/tiktok_is_overrated_and_useless_for_the_vast/,marketing,474670,SAT0725
Can't get my agency off the ground,338,wwiuea,https://www.reddit.com/r/marketing/comments/wwiuea/cant_get_my_agency_off_the_ground/,93,1661345744.0,illbzo1,0.89,/r/marketing/comments/wwiuea/cant_get_my_agency_off_the_ground/,marketing,474670,illbzo1
Want to write powerful ad copy? Learn from this 42 year old whisky ad,328,l0k9vq,https://www.reddit.com/r/marketing/comments/l0k9vq/want_to_write_powerful_ad_copy_learn_from_this_42/,66,1611064566.0,otaota,0.97,/r/marketing/comments/l0k9vq/want_to_write_powerful_ad_copy_learn_from_this_42/,marketing,474670,otaota
For Gods Sake Just Hire An Agency.,323,11h4c0f,https://www.reddit.com/r/marketing/comments/11h4c0f/for_gods_sake_just_hire_an_agency/,186,1677859425.0,Chaomayhem,0.97,/r/marketing/comments/11h4c0f/for_gods_sake_just_hire_an_agency/,marketing,474670,Chaomayhem
2019 Marketing Worksheet,326,a6q0pv,https://www.reddit.com/r/marketing/comments/a6q0pv/2019_marketing_worksheet/,54,1544975513.0,JonODonovan,0.99,/r/marketing/comments/a6q0pv/2019_marketing_worksheet/,marketing,474670,JonODonovan
Marketing Tips from the Master of Advertising David Ogilvy,309,ic903m,https://www.reddit.com/r/marketing/comments/ic903m/marketing_tips_from_the_master_of_advertising/,35,1597782435.0,Brendan_BBB,0.99,/r/marketing/comments/ic903m/marketing_tips_from_the_master_of_advertising/,marketing,474670,Brendan_BBB
Marketing Certifications We Value When Hiring New Marketers,301,5aruw8,https://www.reddit.com/r/marketing/comments/5aruw8/marketing_certifications_we_value_when_hiring_new/,44,1478113701.0,theyseemeroland,0.98,/r/marketing/comments/5aruw8/marketing_certifications_we_value_when_hiring_new/,marketing,474670,theyseemeroland
My favorite free marketing courses at the moment,304,ftlq63,https://www.reddit.com/r/marketing/comments/ftlq63/my_favorite_free_marketing_courses_at_the_moment/,78,1585831619.0,DomainDigital,0.99,/r/marketing/comments/ftlq63/my_favorite_free_marketing_courses_at_the_moment/,marketing,474670,DomainDigital
What I learned from roasting 200-300 websites' SEO/marketing/landing copy/etc.,295,qvbiu0,https://www.reddit.com/r/marketing/comments/qvbiu0/what_i_learned_from_roasting_200300_websites/,56,1637079801.0,malchik23,0.95,/r/marketing/comments/qvbiu0/what_i_learned_from_roasting_200300_websites/,marketing,474670,malchik23
How To Get a Marketing Job with No Experience,294,ktjcyo,https://www.reddit.com/r/marketing/comments/ktjcyo/how_to_get_a_marketing_job_with_no_experience/,52,1610164635.0,stewofkc,0.96,/r/marketing/comments/ktjcyo/how_to_get_a_marketing_job_with_no_experience/,marketing,474670,stewofkc
Does Anybody Else Feel That Clients Who Pay The Least Ask For The Most?,296,vsgth4,https://www.reddit.com/r/marketing/comments/vsgth4/does_anybody_else_feel_that_clients_who_pay_the/,72,1657079998.0,Jusgil24,0.98,/r/marketing/comments/vsgth4/does_anybody_else_feel_that_clients_who_pay_the/,marketing,474670,Jusgil24
7 books to transform your marketing,290,kzuc2z,https://www.reddit.com/r/marketing/comments/kzuc2z/7_books_to_transform_your_marketing/,78,1610975268.0,otaota,0.98,/r/marketing/comments/kzuc2z/7_books_to_transform_your_marketing/,marketing,474670,otaota
(I’m Unbanned) Here’s What Happened Last Week On Social Media (Marketer’s Edition),278,zrrge8,https://www.reddit.com/r/marketing/comments/zrrge8/im_unbanned_heres_what_happened_last_week_on/,35,1671637640.0,lazymentors,0.97,/r/marketing/comments/zrrge8/im_unbanned_heres_what_happened_last_week_on/,marketing,474670,lazymentors
Please remember to make your audience the hero in your storytelling,280,wmz2ep,https://www.reddit.com/r/marketing/comments/wmz2ep/please_remember_to_make_your_audience_the_hero_in/,63,1660346388.0,itsjustdifferent_,0.98,/r/marketing/comments/wmz2ep/please_remember_to_make_your_audience_the_hero_in/,marketing,474670,itsjustdifferent_
A handy list of resources to help you improve your copywriting and persuasion skills,277,ig9nna,https://www.reddit.com/r/marketing/comments/ig9nna/a_handy_list_of_resources_to_help_you_improve/,41,1598351941.0,kervokian,0.99,/r/marketing/comments/ig9nna/a_handy_list_of_resources_to_help_you_improve/,marketing,474670,kervokian
This...,270,gxhjhy,/r/LifeProTips/comments/gwvfay/lpt_imposter_syndrome_is_normal_you_will_likely/,14,1591406639.0,AptSeagull,0.95,/r/marketing/comments/gxhjhy/this/,marketing,474670,AptSeagull
101 best SEO tips to help you drive traffic in 2021,266,ojdnef,https://www.reddit.com/r/marketing/comments/ojdnef/101_best_seo_tips_to_help_you_drive_traffic_in/,52,1626175797.0,DrJigsaw,0.97,/r/marketing/comments/ojdnef/101_best_seo_tips_to_help_you_drive_traffic_in/,marketing,474670,DrJigsaw
I Spent 3 Days Reading 31+ Marketing Reports & Here’s What I learned in 2022 (Last Edition),263,zsq82t,https://www.reddit.com/r/marketing/comments/zsq82t/i_spent_3_days_reading_31_marketing_reports_heres/,30,1671726622.0,lazymentors,0.97,/r/marketing/comments/zsq82t/i_spent_3_days_reading_31_marketing_reports_heres/,marketing,474670,lazymentors
Our content promotion strategy that nets us 1k - 10k traffic per post (and 5-100 leads),261,gs6iik,https://www.reddit.com/r/marketing/comments/gs6iik/our_content_promotion_strategy_that_nets_us_1k/,60,1590673412.0,DrJigsaw,0.96,/r/marketing/comments/gs6iik/our_content_promotion_strategy_that_nets_us_1k/,marketing,474670,DrJigsaw
My favorite sites to find remote marketing jobs,258,hulihh,https://www.reddit.com/r/marketing/comments/hulihh/my_favorite_sites_to_find_remote_marketing_jobs/,37,1595252773.0,DomainDigital,0.99,/r/marketing/comments/hulihh/my_favorite_sites_to_find_remote_marketing_jobs/,marketing,474670,DomainDigital
The marketing genius of Liquid Death,256,ybim2l,https://www.reddit.com/r/marketing/comments/ybim2l/the_marketing_genius_of_liquid_death/,83,1666534016.0,itsjustdifferent_,0.97,/r/marketing/comments/ybim2l/the_marketing_genius_of_liquid_death/,marketing,474670,itsjustdifferent_
Pleeeeeeeeease stop with the scattergun Linkedin approaches.,257,li9it8,https://www.reddit.com/r/marketing/comments/li9it8/pleeeeeeeeease_stop_with_the_scattergun_linkedin/,97,1613130635.0,gloves1992,0.98,/r/marketing/comments/li9it8/pleeeeeeeeease_stop_with_the_scattergun_linkedin/,marketing,474670,gloves1992
"Stop with the job title inflation, already",252,bdj8zz,https://www.reddit.com/r/marketing/comments/bdj8zz/stop_with_the_job_title_inflation_already/,96,1555351566.0,the_lamou,0.94,/r/marketing/comments/bdj8zz/stop_with_the_job_title_inflation_already/,marketing,474670,the_lamou
Google Sheets for digital marketers: Pivot tables,243,bm40h7,https://www.reddit.com/r/marketing/comments/bm40h7/google_sheets_for_digital_marketers_pivot_tables/,26,1557314437.0,the_mmw,0.97,/r/marketing/comments/bm40h7/google_sheets_for_digital_marketers_pivot_tables/,marketing,474670,the_mmw
"Interview with a marketer on how she repositioned a product that went on to make $1 billion in revenue: the process of customer discovery, understanding your true competitors, and finding the unique value that your customers love. (Transcript/ Podcast)",238,g5fhpx,https://www.reddit.com/r/marketing/comments/g5fhpx/interview_with_a_marketer_on_how_she_repositioned/,34,1587476758.0,BGArt00,0.97,/r/marketing/comments/g5fhpx/interview_with_a_marketer_on_how_she_repositioned/,marketing,474670,BGArt00
Don't be that marketer,238,ln4cjm,https://i.redd.it/z8a81gcfnai61.png,30,1613701865.0,AptSeagull,0.96,/r/marketing/comments/ln4cjm/dont_be_that_marketer/,marketing,474670,AptSeagull
"Marketers, let’s talk salaries!",235,vaq1ey,https://www.reddit.com/r/marketing/comments/vaq1ey/marketers_lets_talk_salaries/,516,1655052633.0,soulfulidentity,0.96,/r/marketing/comments/vaq1ey/marketers_lets_talk_salaries/,marketing,474670,soulfulidentity
7 Social Media Marketing Tactics You Need!,238,xlpsl8,https://www.reddit.com/r/marketing/comments/xlpsl8/7_social_media_marketing_tactics_you_need/,27,1663914982.0,lazymentors,0.96,/r/marketing/comments/xlpsl8/7_social_media_marketing_tactics_you_need/,marketing,474670,lazymentors
Considering a Masters in Marketing? Here’s an FAQ to help you decide if it’s the right choice for you.,233,sxjjse,https://www.reddit.com/r/marketing/comments/sxjjse/considering_a_masters_in_marketing_heres_an_faq/,68,1645414523.0,illbzo1,0.92,/r/marketing/comments/sxjjse/considering_a_masters_in_marketing_heres_an_faq/,marketing,474670,illbzo1
Linkedin is developing a feature named Marketplace to compete Upwork and Fiverr with a Digital Wallet.,233,lqpmcc,https://www.reddit.com/r/marketing/comments/lqpmcc/linkedin_is_developing_a_feature_named/,50,1614105677.0,ivikasifications,1.0,/r/marketing/comments/lqpmcc/linkedin_is_developing_a_feature_named/,marketing,474670,ivikasifications
"Full list of best and most knowledgable YouTube marketing influencers, and best online courses to buy",230,xd7y69,https://www.reddit.com/r/marketing/comments/xd7y69/full_list_of_best_and_most_knowledgable_youtube/,37,1663076600.0,illbzo1,0.94,/r/marketing/comments/xd7y69/full_list_of_best_and_most_knowledgable_youtube/,marketing,474670,illbzo1
The Big Marketing FAQ You Didn't Know You Needed,231,bmmkxg,https://www.reddit.com/r/marketing/comments/bmmkxg/the_big_marketing_faq_you_didnt_know_you_needed/,46,1557422791.0,kirillionaire,0.98,/r/marketing/comments/bmmkxg/the_big_marketing_faq_you_didnt_know_you_needed/,marketing,474670,kirillionaire
Is all marketing forced marketing?,231,7eru5t,https://www.reddit.com/r/marketing/comments/7eru5t/is_all_marketing_forced_marketing/,27,1511365512.0,natespf,0.96,/r/marketing/comments/7eru5t/is_all_marketing_forced_marketing/,marketing,474670,natespf
The Excel Tutorial We Made For Our New Marketing Hires,222,5h2b58,https://blog.ladder.io/excel-tutorial/,21,1481142592.0,theyseemeroland,0.96,/r/marketing/comments/5h2b58/the_excel_tutorial_we_made_for_our_new_marketing/,marketing,474670,theyseemeroland
"A marketing lesson from one of America’s most influential winemakers (Hint: Use your audience’s language, not yours)",221,mqnf8e,https://www.reddit.com/r/marketing/comments/mqnf8e/a_marketing_lesson_from_one_of_americas_most/,51,1618394586.0,kervokian,0.96,/r/marketing/comments/mqnf8e/a_marketing_lesson_from_one_of_americas_most/,marketing,474670,kervokian
What College Students Aren't Being Taught About Marketing,223,118zqc9,https://www.reddit.com/r/marketing/comments/118zqc9/what_college_students_arent_being_taught_about/,53,1677074279.0,Rusty_James,0.99,/r/marketing/comments/118zqc9/what_college_students_arent_being_taught_about/,marketing,474670,Rusty_James
Google will soon start punishing mobile sites that show hard-to-dismiss popups,216,5etwyn,https://webmasters.googleblog.com/2016/08/helping-users-easily-access-content-on.html,20,1480085707.0,JonODonovan,0.96,/r/marketing/comments/5etwyn/google_will_soon_start_punishing_mobile_sites/,marketing,474670,JonODonovan
"Marketers, let’s talk salaries - 2023 edition!",215,10oe7vo,https://www.reddit.com/r/marketing/comments/10oe7vo/marketers_lets_talk_salaries_2023_edition/,598,1675015938.0,soulfulidentity,0.96,/r/marketing/comments/10oe7vo/marketers_lets_talk_salaries_2023_edition/,marketing,474670,soulfulidentity
"Interview with Chris Walker, a marketer with a no-bullshit approach to inbound demand generation: why marketers are doing it wrong, how marketers should be assessed, how to ensure content ACTUALLY brings in qualified leads, and the best metrics to measure content performance.",212,gd7pd4,https://www.reddit.com/r/marketing/comments/gd7pd4/interview_with_chris_walker_a_marketer_with_a/,25,1588580829.0,BGArt00,0.96,/r/marketing/comments/gd7pd4/interview_with_chris_walker_a_marketer_with_a/,marketing,474670,BGArt00
Google Sheets for digital marketers: Basic formulas and functions,218,boxnjv,https://www.reddit.com/r/marketing/comments/boxnjv/google_sheets_for_digital_marketers_basic/,40,1557925270.0,the_mmw,0.97,/r/marketing/comments/boxnjv/google_sheets_for_digital_marketers_basic/,marketing,474670,the_mmw
"Interview with a marketer who ran a £100k advertising campaign across London: the details behind their process of copywriting, channels to use, and costs, and finally, the results it bought in for the company.",214,g16938,https://www.reddit.com/r/marketing/comments/g16938/interview_with_a_marketer_who_ran_a_100k/,57,1586873636.0,BGArt00,0.96,/r/marketing/comments/g16938/interview_with_a_marketer_who_ran_a_100k/,marketing,474670,BGArt00
Signed my first monthly client today,211,jp40py,https://www.reddit.com/r/marketing/comments/jp40py/signed_my_first_monthly_client_today/,67,1604664672.0,RPSully,0.99,/r/marketing/comments/jp40py/signed_my_first_monthly_client_today/,marketing,474670,RPSully
"The ""2023 How-To-Get-Clients Playbook"" From an 8-Figure Marketer",210,1034wqa,https://www.reddit.com/r/marketing/comments/1034wqa/the_2023_howtogetclients_playbook_from_an_8figure/,47,1672842327.0,whitespadex,0.95,/r/marketing/comments/1034wqa/the_2023_howtogetclients_playbook_from_an_8figure/,marketing,474670,whitespadex
"I spent 3 days reading 30+ Marketing Reports, Case-Studies and Here’s What I learned About TikTok, UGC and Social Media! -2",205,y4p37q,https://www.reddit.com/r/marketing/comments/y4p37q/i_spent_3_days_reading_30_marketing_reports/,23,1665843389.0,lazymentors,0.95,/r/marketing/comments/y4p37q/i_spent_3_days_reading_30_marketing_reports/,marketing,474670,lazymentors
The importance of not burning any bridges,203,k6d4wx,https://www.reddit.com/r/marketing/comments/k6d4wx/the_importance_of_not_burning_any_bridges/,40,1607053498.0,RPSully,0.99,/r/marketing/comments/k6d4wx/the_importance_of_not_burning_any_bridges/,marketing,474670,RPSully
Why do pushy marketing / sales people still exist? It’s not 1980’s anymore…,208,w3s4n0,https://www.reddit.com/r/marketing/comments/w3s4n0/why_do_pushy_marketing_sales_people_still_exist/,279,1658337945.0,breakmyheart01,0.9,/r/marketing/comments/w3s4n0/why_do_pushy_marketing_sales_people_still_exist/,marketing,474670,breakmyheart01
"I recently interviewed a bunch of LinkedIn influencers on how they consistently go viral on LinkedIn, generating them millions of views and hundreds of leads automatically. Here's what I learnt, and the 10 best tips you can apply right away to your LinkedIn marketing.",203,71amar,https://www.reddit.com/r/marketing/comments/71amar/i_recently_interviewed_a_bunch_of_linkedin/,40,1505909372.0,airawear,0.9,/r/marketing/comments/71amar/i_recently_interviewed_a_bunch_of_linkedin/,marketing,474670,airawear
FY18 Content and Marketing Plan Worksheet,200,7mgiqc,https://www.reddit.com/r/marketing/comments/7mgiqc/fy18_content_and_marketing_plan_worksheet/,55,1514396967.0,JonODonovan,1.0,/r/marketing/comments/7mgiqc/fy18_content_and_marketing_plan_worksheet/,marketing,474670,JonODonovan
Anybody interested in an IAmA with a marketing consultant turned data specialist at a FAANG company? (xpost r/dataanalysis),195,jvtwmb,https://www.reddit.com/r/marketing/comments/jvtwmb/anybody_interested_in_an_iama_with_a_marketing/,37,1605623397.0,the_mmw,0.92,/r/marketing/comments/jvtwmb/anybody_interested_in_an_iama_with_a_marketing/,marketing,474670,the_mmw
'are you even a marketer unless...' bingo,195,j3f2b4,https://www.reddit.com/r/marketing/comments/j3f2b4/are_you_even_a_marketer_unless_bingo/,90,1601579373.0,gloves1992,0.96,/r/marketing/comments/j3f2b4/are_you_even_a_marketer_unless_bingo/,marketing,474670,gloves1992
Here’s What Happened Last Week on Social Media (Marketer’s Edition),193,wazhtt,https://www.reddit.com/r/marketing/comments/wazhtt/heres_what_happened_last_week_on_social_media/,35,1659084057.0,lazymentors,0.98,/r/marketing/comments/wazhtt/heres_what_happened_last_week_on_social_media/,marketing,474670,lazymentors
Coinbase CEO partakes in time-honored tradition of taking credit for agency work,190,syadvp,https://www.reddit.com/r/marketing/comments/syadvp/coinbase_ceo_partakes_in_timehonored_tradition_of/,76,1645492790.0,AptSeagull,0.94,/r/marketing/comments/syadvp/coinbase_ceo_partakes_in_timehonored_tradition_of/,marketing,474670,AptSeagull
Three ways to improve your SEO right now.,193,h92nil,https://www.reddit.com/r/marketing/comments/h92nil/three_ways_to_improve_your_seo_right_now/,60,1592171786.0,BGArt00,0.89,/r/marketing/comments/h92nil/three_ways_to_improve_your_seo_right_now/,marketing,474670,BGArt00
Is Search Engine Optimization the most lied about marketing skill?,190,lyt2hy,https://www.reddit.com/r/marketing/comments/lyt2hy/is_search_engine_optimization_the_most_lied_about/,77,1615001471.0,Tessenreacts,0.93,/r/marketing/comments/lyt2hy/is_search_engine_optimization_the_most_lied_about/,marketing,474670,Tessenreacts
"PSA: to anyone asking ""How should I market my (product or service)?""",190,dshmtf,https://www.reddit.com/r/marketing/comments/dshmtf/psa_to_anyone_asking_how_should_i_market_my/,48,1573053194.0,illbzo1,0.97,/r/marketing/comments/dshmtf/psa_to_anyone_asking_how_should_i_market_my/,marketing,474670,illbzo1
Here's what I learned spending 1m/month on FB and Linkedin ads for tech companies,188,vejp2h,https://www.reddit.com/r/marketing/comments/vejp2h/heres_what_i_learned_spending_1mmonth_on_fb_and/,42,1655482736.0,itsjustdifferent_,0.97,/r/marketing/comments/vejp2h/heres_what_i_learned_spending_1mmonth_on_fb_and/,marketing,474670,itsjustdifferent_
Here's the marketing plan I use... Also AMAA,187,1bzygs,https://www.reddit.com/r/marketing/comments/1bzygs/heres_the_marketing_plan_i_use_also_amaa/,88,1365525939.0,PablanoPato,0.99,/r/marketing/comments/1bzygs/heres_the_marketing_plan_i_use_also_amaa/,marketing,474670,PablanoPato
"They all laughed when MTV founders said, ""We're launching a 24-hour rock ’n’roll channel""",187,nmifr5,https://www.reddit.com/r/marketing/comments/nmifr5/they_all_laughed_when_mtv_founders_said_were/,29,1622151801.0,kervokian,0.95,/r/marketing/comments/nmifr5/they_all_laughed_when_mtv_founders_said_were/,marketing,474670,kervokian
I asked companies what marketing skills will be in-demand at the end of 2020,183,g6luri,https://www.reddit.com/r/marketing/comments/g6luri/i_asked_companies_what_marketing_skills_will_be/,68,1587645387.0,DomainDigital,0.95,/r/marketing/comments/g6luri/i_asked_companies_what_marketing_skills_will_be/,marketing,474670,DomainDigital
Here’s What Happened On Social Media Last Week ( Marketer’s Edition),180,uwnsk6,https://www.reddit.com/r/marketing/comments/uwnsk6/heres_what_happened_on_social_media_last_week/,68,1653388629.0,lazymentors,0.97,/r/marketing/comments/uwnsk6/heres_what_happened_on_social_media_last_week/,marketing,474670,lazymentors
Google Sheets for digital marketers: Forecasting,177,c2gm3m,https://www.reddit.com/r/marketing/comments/c2gm3m/google_sheets_for_digital_marketers_forecasting/,20,1560948232.0,the_mmw,0.98,/r/marketing/comments/c2gm3m/google_sheets_for_digital_marketers_forecasting/,marketing,474670,the_mmw
After more no's than I can count I finally landed my first marketing job,179,pfubga,https://www.reddit.com/r/marketing/comments/pfubga/after_more_nos_than_i_can_count_i_finally_landed/,45,1630504288.0,OppH2040,0.97,/r/marketing/comments/pfubga/after_more_nos_than_i_can_count_i_finally_landed/,marketing,474670,OppH2040
Google Sheets for Marketers Part I – Let’s Build a URL Builder!,174,ar0ilg,https://www.reddit.com/r/marketing/comments/ar0ilg/google_sheets_for_marketers_part_i_lets_build_a/,31,1550260470.0,regpaq,0.98,/r/marketing/comments/ar0ilg/google_sheets_for_marketers_part_i_lets_build_a/,marketing,474670,regpaq
LinkedIn Just Announced 5 Major Updates & Google + Snapchat have Introduced AI Features (Hot Changes in Marketing),173,11l36nh,https://www.reddit.com/r/marketing/comments/11l36nh/linkedin_just_announced_5_major_updates_google/,17,1678204933.0,lazymentors,0.96,/r/marketing/comments/11l36nh/linkedin_just_announced_5_major_updates_google/,marketing,474670,lazymentors
2022 Marketing Worksheet,171,rsybtd,https://www.reddit.com/r/marketing/comments/rsybtd/2022_marketing_worksheet/,22,1640970284.0,JonODonovan,0.99,/r/marketing/comments/rsybtd/2022_marketing_worksheet/,marketing,474670,JonODonovan
Company laid off 95% of their marketing department,173,ur5w4u,https://www.reddit.com/r/marketing/comments/ur5w4u/company_laid_off_95_of_their_marketing_department/,143,1652734685.0,Tessenreacts,0.97,/r/marketing/comments/ur5w4u/company_laid_off_95_of_their_marketing_department/,marketing,474670,Tessenreacts
Best Marketing strategy ever used.,165,oinjfp,https://www.reddit.com/r/marketing/comments/oinjfp/best_marketing_strategy_ever_used/,37,1626080601.0,propelguru01,0.91,/r/marketing/comments/oinjfp/best_marketing_strategy_ever_used/,marketing,474670,propelguru01
