title,score,id,url,num_comments,created,author,upvote_ratio,permalink,subreddit,subreddit_subscribers,depth
This image of Zelensky’s face while visiting Bucha today says it all.,109384,tw3mvi,https://i.redd.it/6xcdi7adxir81.jpg,4291,1649083155.0,nOMnOMShanti,0.9,/r/ukraine/comments/tw3mvi/this_image_of_zelenskys_face_while_visiting_bucha/,ukraine,860311,2
The Entire staff of the Russian TV channel “the rain” resigned during a live stream with last words: “no war” and then played “swan lake” ballet video (just like they did on all USSR tv channels when it suddenly collapsed),90135,t5ug4p,https://v.redd.it/cjg9ka7ov6l81,1483,1646322303.0,RussianPersian,0.95,/r/ukraine/comments/t5ug4p/the_entire_staff_of_the_russian_tv_channel_the/,ukraine,860311,2
My colleague was killed during a rocket attack on the Kyiv TV Tower. TV cameraman. Eugene Sakun. You are forever in our memory!,86411,t5058i,https://i.redd.it/3d5qcfwj2zk81.jpg,656,1646227712.0,Did-ko,0.95,/r/ukraine/comments/t5058i/my_colleague_was_killed_during_a_rocket_attack_on/,ukraine,860311,2
GET TO SHELTER,68385,t29etn,https://i.redd.it/nndumre2c9k81.jpg,2800,1645916096.0,X2Gaming,0.96,/r/ukraine/comments/t29etn/get_to_shelter/,ukraine,860311,2
🇺🇦Ukrainian troops are now deploying Panzerfaust-3IT anti-tank weapons received from Germany. These systems can reputedly kill any Russian tank in service.,68081,tjdbnq,https://i.redd.it/dqd23zgr0ro81.jpg,3596,1647873612.0,surajvj,0.92,/r/ukraine/comments/tjdbnq/ukrainian_troops_are_now_deploying_panzerfaust3it/,ukraine,860311,2
"USA’s NewsMax tries to bait Zelensky to say Putin's invasion would never happen if Trump were president. He responds: “Sorry if I am saying something you don’t like but for us as the country in war, it doesn’t matter if it is democrats or republicans, it is the people of the US that support us.”",62636,v26suz,https://v.redd.it/9xh4sa8gax291,1819,1654051382.0,nOMnOMShanti,0.9,/r/ukraine/comments/v26suz/usas_newsmax_tries_to_bait_zelensky_to_say_putins/,ukraine,860311,2
Ukrainian Soldier talks about the irony of life during times of war,60233,tjyzsq,https://v.redd.it/e7m0cau6lwo81,1080,1647941013.0,Dredd005,0.94,/r/ukraine/comments/tjyzsq/ukrainian_soldier_talks_about_the_irony_of_life/,ukraine,860311,2
"Ukrainian soldier who made TikTok’s to show his daughter that he was fine, disappeared for 2 days and speculated that he was dead, and for everyone's happiness he posted again and is still fighting.",58261,t6sa5g,https://v.redd.it/rlc18fnngfl81,882,1646426128.0,GroundbreakingSet187,0.92,/r/ukraine/comments/t6sa5g/ukrainian_soldier_who_made_tiktoks_to_show_his/,ukraine,860311,2
"This was uploaded online with the caption: ""We are closer than you think"".",58157,xpi78b,https://i.redd.it/s3lke7z4veq91.jpg,1745,1664288668.0,RallyToTheColors,0.87,/r/ukraine/comments/xpi78b/this_was_uploaded_online_with_the_caption_we_are/,ukraine,860311,2
«Hello! Today my uncle laid down his life defending Bakhmut. I would be grateful for the repost. I want him to be known»,57500,100l57k,https://i.redd.it/zxx8ehwlkh9a1.jpg,758,1672584552.0,HarakenQQ,0.9,/r/ukraine/comments/100l57k/hello_today_my_uncle_laid_down_his_life_defending/,ukraine,860311,2
This is a photo of men who have travelled from Ireland to fight for Ukraine’s freedom. 🇺🇦💛💙,55912,t46scj,https://i.redd.it/t954m66gmrk81.jpg,1331,1646137517.0,abdulkxrim,0.94,/r/ukraine/comments/t46scj/this_is_a_photo_of_men_who_have_travelled_from/,ukraine,860311,2
Élysée Palace released an image of Macron after calling Putin over Ukraine war today.,52703,t8zfe3,https://i.redd.it/5qy3312e01m81.jpg,3462,1646687007.0,TheRealMykola,0.9,/r/ukraine/comments/t8zfe3/élysée_palace_released_an_image_of_macron_after/,ukraine,860311,2
The night of March 8 in capital Kyiv was the first night since the war began when the Ukrainian air defense intercepted and destroyed all Russian cruise missiles. No impacts registered in Kyiv this night.,51526,t99yul,https://twitter.com/mrkovalenko/status/1501071619439087617?s=21,1309,1646718844.0,TheRealMykola,0.96,/r/ukraine/comments/t99yul/the_night_of_march_8_in_capital_kyiv_was_the/,ukraine,860311,2
President Zelensky has stated that Russia can forget about him accepting Russian ultimatums and that Ukraine is ready to fight the Russian Army for another 10 years. No surrender. 🇺🇦,50963,u5zm61,https://mobile.twitter.com/visegrad24/status/1515800689171128333,1871,1650239672.0,Espressodimare,0.92,/r/ukraine/comments/u5zm61/president_zelensky_has_stated_that_russia_can/,ukraine,860311,2
"Confirmed: Colonel Sergey Sukharev, Russia’s 331st Airborne Regiment commander, has been eliminated in Ukraine. He was directly responsible for the Ilovaisk massacre of 2014.",50309,tgx6dl,https://i.redd.it/bwowg8b3z3o81.jpg,1625,1647594589.0,a1b0r,0.94,/r/ukraine/comments/tgx6dl/confirmed_colonel_sergey_sukharev_russias_331st/,ukraine,860311,2
"This beautiful couple, Dmytro and Iryna died yesterday defending Kyiv from Putin forces.",49716,t2dvxc,https://i.redd.it/2w5l2591gak81.jpg,699,1645929535.0,Eienkei,0.96,/r/ukraine/comments/t2dvxc/this_beautiful_couple_dmytro_and_iryna_died/,ukraine,860311,2
"Russian invaders killed civilian family and dogs, they will pay for these crimes.",49311,t2ihg8,https://v.redd.it/3hefkebvrbk81,2811,1645945633.0,X2Gaming,0.96,/r/ukraine/comments/t2ihg8/russian_invaders_killed_civilian_family_and_dogs/,ukraine,860311,2
Zelenskyy and Johnson walked the streets of Kyiv,49218,tzywq3,https://v.redd.it/xl52kgr8ojs81,2758,1649528055.0,OwensKaren,0.9,/r/ukraine/comments/tzywq3/zelenskyy_and_johnson_walked_the_streets_of_kyiv/,ukraine,860311,2
HISTORY HAS BEEN MADE. Joe Biden has signed the Lend-Lease Act. Ukraine is immensely grateful to the U.S.,48875,ulywey,https://i.redd.it/hklu77133iy81.jpg,3439,1652123909.0,CapitalString,0.81,/r/ukraine/comments/ulywey/history_has_been_made_joe_biden_has_signed_the/,ukraine,860311,2
Russian protestors starting to protect each other from visibly nervous police.,48797,t2pwhd,https://v.redd.it/jd2ay6i13ek81,1079,1645973708.0,-martinique-,0.95,/r/ukraine/comments/t2pwhd/russian_protestors_starting_to_protect_each_other/,ukraine,860311,2
A #Ukrainian man with Down Syndrome bakes bread to feed 🇺🇦 soldiers fighting the war. ❤,47883,tfis09,https://i.redd.it/8aodmcdv8rn81.jpg,879,1647440490.0,surajvj,0.87,/r/ukraine/comments/tfis09/a_ukrainian_man_with_down_syndrome_bakes_bread_to/,ukraine,860311,2
No one left behind in Ukraine: These pups were found protecting newborn kittens 😍❤😭,47236,u6reas,https://v.redd.it/mknw5bq6mdu81,843,1650326523.0,thefathermucker,0.92,/r/ukraine/comments/u6reas/no_one_left_behind_in_ukraine_these_pups_were/,ukraine,860311,2
Biden in Kyiv,46573,1172sie,https://i.redd.it/gxuazilwwcja1.jpg,2117,1676886634.0,Sv1a,0.88,/r/ukraine/comments/1172sie/biden_in_kyiv/,ukraine,860311,2
"New York Times: ""Volunteer fighters armed with assault rifles patrolled central Kyiv on Friday, ready to defend their country.""",45803,t1lbx5,https://v.redd.it/lltinwj473k81,1127,1645841818.0,Regrup,0.97,/r/ukraine/comments/t1lbx5/new_york_times_volunteer_fighters_armed_with/,ukraine,860311,2
"Command of the Special Operations Forces of the Armed Forces of Ukraine: ""Another successful operation, another ""special"" trophy: the Russian self-propelled anti-aircraft missile and artillery complex Pantsir-S1""",45544,tb3lnk,https://i.redd.it/4vxmnialalm81.jpg,1639,1646932590.0,Regrup,0.95,/r/ukraine/comments/tb3lnk/command_of_the_special_operations_forces_of_the/,ukraine,860311,2
"Remarkable BBCNews report: farmers in Vosnesensk ambushed 🇷🇺 forces as they approached the small community, halting their advance by blowing up the bridge, destroying all 🇷🇺 tanks vehicles w/ help from 🇬🇧 NLAW anti-tank weapons, inflicting heavy 🇷🇺 losses & full retreat.",44968,tkfpph,https://v.redd.it/lzfkq5xcn0p81,1537,1647990203.0,AllHailTheBEAR,0.93,/r/ukraine/comments/tkfpph/remarkable_bbcnews_report_farmers_in_vosnesensk/,ukraine,860311,2
"The message President Zelensky wanted to share during the World Cup final. FIFA refused to broadcast it, so here it is for all to hear.",44451,zovehk,https://v.redd.it/qdtp0hiqsm6a1,767,1671358416.0,TinyStrawberry23,0.85,/r/ukraine/comments/zovehk/the_message_president_zelensky_wanted_to_share/,ukraine,860311,2
Day 2. Day 100.,44237,v43r29,https://i.redd.it/cts0kv3csf391.jpg,755,1654275320.0,ThaIgk,0.94,/r/ukraine/comments/v43r29/day_2_day_100/,ukraine,860311,2
"The Russian woman who filmed herself harassing Ukrainian refugee women on the streets of Austria is now recording videos in which she complains about Booking .com having cancelled her reservations in Vienna. “They have ruined my vacation,” she says. Now ship her back to Russia!",43132,wjx1c4,https://mobile.twitter.com/visegrad24/status/1556883242862649345,1567,1660030433.0,Espressodimare,0.91,/r/ukraine/comments/wjx1c4/the_russian_woman_who_filmed_herself_harassing/,ukraine,860311,2
"23-year-old Nazar Nebozhenskyi, who saved 20 fellow soldiers by drawing fire from 3 Russian BTRs to himself and destroying 2 of them, being mortally wounded in the process. Remember his name.",43051,twx369,https://i.redd.it/109db3iz6qr81.jpg,702,1649171203.0,rishcast,0.93,/r/ukraine/comments/twx369/23yearold_nazar_nebozhenskyi_who_saved_20_fellow/,ukraine,860311,2
Puppy helps plant potatoes in Ukraine 🇺🇦 🐶,42995,uh2e6k,https://v.redd.it/tyagt6iga5x81,567,1651533151.0,Local_Fox_2000,0.94,/r/ukraine/comments/uh2e6k/puppy_helps_plant_potatoes_in_ukraine/,ukraine,860311,2
"Today, Turkish President Erdogan announced that Crimea belongs to Ukraine: ""Turkey does not recognize the annexation of Crimea and considers this step illegal. According to international law, Crimea should be returned to Ukraine,"" Erdogan stressed.",42852,wvsxib,https://v.redd.it/1f105ea5nhj91,1610,1661271366.0,RunTheBull13,0.94,/r/ukraine/comments/wvsxib/today_turkish_president_erdogan_announced_that/,ukraine,860311,2
"According to reports, Russian forces killed all males aged 18-60 in the city of Bucha, northwest of Kyiv. “All men who were and young and healthy were shot.” This is genocide.",42651,tun2je,https://twitter.com/GicAriana/status/1510257553393041410,2884,1648917554.0,rishcast,0.94,/r/ukraine/comments/tun2je/according_to_reports_russian_forces_killed_all/,ukraine,860311,2
"20-yrs old Dmytro Zhukov from Kharkiv did not leave the city. In the basement, even under the shelling, he bakes 300 rolls a day and prepares 200 hot lunches for the military, people with disabilities, and lonely retirees. Volunteers then deliver food to those who need it.",41259,un7v7s,https://www.reddit.com/gallery/un7v7s,477,1652269283.0,ThaIgk,0.94,/r/ukraine/comments/un7v7s/20yrs_old_dmytro_zhukov_from_kharkiv_did_not/,ukraine,860311,2
Japanese TV anchor Yumiko Matsuo breaks down when reading the news of Putin bestowing honours on the brigade that committed atrocities in Bucha. She had just shown clips of children hiding in the bunker of the Mariupol steel mill and was overcome with emotion.,41215,u8bcah,https://v.redd.it/vhei66sx4su81,1521,1650502802.0,thefathermucker,0.93,/r/ukraine/comments/u8bcah/japanese_tv_anchor_yumiko_matsuo_breaks_down_when/,ukraine,860311,2
Russian Embassy in London today,41150,119uz1b,https://i.redd.it/d318g2kznyja1.jpg,957,1677149989.0,ThewizardBlundermore,0.91,/r/ukraine/comments/119uz1b/russian_embassy_in_london_today/,ukraine,860311,2
A “historic decision” .. Finland departs from its neutrality and decides to supply Ukraine with weapons,40937,t3u7s6,https://i.redd.it/g8eu9lci0ok81.jpg,924,1646093820.0,abdulkxrim,0.97,/r/ukraine/comments/t3u7s6/a_historic_decision_finland_departs_from_its/,ukraine,860311,2
Remington supports Ukraine with one million rounds of ammunition,40763,t7g6wo,https://i.redd.it/x3xtxkhw3ml81.jpg,1839,1646506586.0,Sondioc2152,0.95,/r/ukraine/comments/t7g6wo/remington_supports_ukraine_with_one_million/,ukraine,860311,2
A Finnish general's kind proposal for Putin in the light in the light of ongoing Russian aggression in Ukraine,40633,uqs5h2,https://i.redd.it/sov4w3rk7tz81.jpg,943,1652694442.0,ThaIgk,0.92,/r/ukraine/comments/uqs5h2/a_finnish_generals_kind_proposal_for_putin_in_the/,ukraine,860311,2
Ukraine footage of actual combat use of the FGM-148 Javelin anti-tank missile system by the Ukrainian army.,40469,ti1vz6,https://v.redd.it/ik3pvf4uydo81,2105,1647715593.0,AllHailTheBEAR,0.92,/r/ukraine/comments/ti1vz6/ukraine_footage_of_actual_combat_use_of_the/,ukraine,860311,2
The city of Bucha is completely liberated from the Russians!,39762,t5ouhw,https://v.redd.it/zq8gdu9ee5l81,796,1646304304.0,Sondioc2152,0.97,/r/ukraine/comments/t5ouhw/the_city_of_bucha_is_completely_liberated_from/,ukraine,860311,2
Soldier on the frontline made a little friend,39288,t6hb49,https://v.redd.it/6hrq7i0mvcl81,809,1646394868.0,Over9000Holland,0.95,/r/ukraine/comments/t6hb49/soldier_on_the_frontline_made_a_little_friend/,ukraine,860311,2
"German-supplied helmet stopped a ricochet 7.62x54mm bullet used by various Russian weapons - Not all donated equipment is junk, even if it's old to modern NATO standards",39045,v5cl96,https://i.redd.it/vexfwdkbss391.jpg,1038,1654432996.0,RallyToTheColors,0.94,/r/ukraine/comments/v5cl96/germansupplied_helmet_stopped_a_ricochet_762x54mm/,ukraine,860311,2
Ukrainian flag is back on the Snake Island,38686,vr4ut3,https://i.redd.it/i3rniwle9j991.jpg,394,1656932470.0,ThaIgk,0.92,/r/ukraine/comments/vr4ut3/ukrainian_flag_is_back_on_the_snake_island/,ukraine,860311,2
Ukrainian Military's Message to Russian Troops,38463,t2ygnr,https://v.redd.it/pq14n64o2gk81,888,1645997693.0,X2Gaming,0.97,/r/ukraine/comments/t2ygnr/ukrainian_militarys_message_to_russian_troops/,ukraine,860311,2
Russians vandalizing this Ukrainian refugee center in Spain (Barcelona) with fascist markings is an excellent reminder why no Russian citizen should be having a privilege of EU visas or residence permits. Apply for asylum or go home to fix your fascist mess of a country.,38395,xe9xxh,https://i.redd.it/47cnouytevn91.jpg,1687,1663181449.0,mossadnik,0.77,/r/ukraine/comments/xe9xxh/russians_vandalizing_this_ukrainian_refugee/,ukraine,860311,2
The Stolpakov family R.I.P.,38261,xhi3r8,https://i.redd.it/n78d1bvjnmo91.jpg,885,1663511268.0,vipassana-newbie,0.94,/r/ukraine/comments/xhi3r8/the_stolpakov_family_rip/,ukraine,860311,2
"In Russia, a military enlistment office was burned to avoid drafts to war in Ukraine",37902,ta3lhi,https://v.redd.it/hfr6vb92nbm81,785,1646815735.0,irishrugby2015,0.96,/r/ukraine/comments/ta3lhi/in_russia_a_military_enlistment_office_was_burned/,ukraine,860311,2
"Today, Russian soldiers who decided to resist the Putin regime received Ukrainian field uniforms and paraphernalia on behalf of the Freedom of Russia Legion.",37660,txrqvi,https://www.reddit.com/gallery/txrqvi,1401,1649266934.0,Overall_Memory6689,0.94,/r/ukraine/comments/txrqvi/today_russian_soldiers_who_decided_to_resist_the/,ukraine,860311,2
Ramzan Kadyrov (president of Chechnya) on main russian tv channel: “They imposed sanctions on us… if they keep acting that way we will take the whole Europe and will rule the Europe in the future”,37282,t4vrle,https://v.redd.it/yhuwz6r5nxk81,4064,1646210403.0,RussianPersian,0.93,/r/ukraine/comments/t4vrle/ramzan_kadyrov_president_of_chechnya_on_main/,ukraine,860311,2
Russian mall,36451,ta8zw3,https://v.redd.it/6zsihkxnbdm81,1913,1646836113.0,WalkerBuldog,0.95,/r/ukraine/comments/ta8zw3/russian_mall/,ukraine,860311,2
Ukraine's Chief of Intelligence: Putin has cancer,36180,uox0yp,https://v.redd.it/rsj2jcrp4az81,2681,1652463465.0,lokmardion,0.91,/r/ukraine/comments/uox0yp/ukraines_chief_of_intelligence_putin_has_cancer/,ukraine,860311,2
"The Russian pope directly says that after Ukraine, Russian aggression will be directed against Georgia, Moldova, Kazakhstan and the Baltic states, which are members of NATO.",35844,t8k7ya,https://v.redd.it/h2zfan9h4xl81,2618,1646639958.0,a1b0r,0.85,/r/ukraine/comments/t8k7ya/the_russian_pope_directly_says_that_after_ukraine/,ukraine,860311,2
A small Russian unit that fully surrendered to the Ukrainian Armed Forces (they aren't even soldiers).,35539,t4xnn9,https://v.redd.it/dgyypmj5byk81,1366,1646218546.0,Sunnyflbunny,0.97,/r/ukraine/comments/t4xnn9/a_small_russian_unit_that_fully_surrendered_to/,ukraine,860311,2
Russians killing Ukrainian civilians just because they want to,35391,t9exxk,https://v.redd.it/hczimn2fc5m81,1776,1646739497.0,Size14Shoes,0.95,/r/ukraine/comments/t9exxk/russians_killing_ukrainian_civilians_just_because/,ukraine,860311,2
TIME’s Person of The Year: President Zelensky and The Spirit of Ukraine,35188,zf0i3w,https://i.redd.it/iikua1qtli4a1.jpg,769,1670417832.0,TinyStrawberry23,0.85,/r/ukraine/comments/zf0i3w/times_person_of_the_year_president_zelensky_and/,ukraine,860311,2
He is reading this during russian speech,34902,tt34ew,https://i.redd.it/w4z9z988tqq81.jpg,671,1648742771.0,De-nis,0.95,/r/ukraine/comments/tt34ew/he_is_reading_this_during_russian_speech/,ukraine,860311,2
"President Zelensky and First Lady Zelenska: “Wish for miracles today? So today it is only one wish. And it will come true not by a miracle, but by our work. By struggle. By mutual aid. By humanity. Happy New Year! The year of our victory.”",34768,1001ehs,https://i.redd.it/rcl1z5xdrb9a1.jpg,587,1672514193.0,TinyStrawberry23,0.89,/r/ukraine/comments/1001ehs/president_zelensky_and_first_lady_zelenska_wish/,ukraine,860311,2
"I’ll remain President until victory is won, and after that I don’t know. I want to go to the beach and have a beer – Zelenskyy",34271,zkvi3n,https://www.pravda.com.ua/eng/news/2022/12/12/7380419/,947,1670937336.0,D-R-AZ,0.93,/r/ukraine/comments/zkvi3n/ill_remain_president_until_victory_is_won_and/,ukraine,860311,2
"Rest in Power 🕯 27-year-old Alice died defending her native Mariupol, the coastal city besieged by Russia for 82 days.",34005,v6e08o,https://www.reddit.com/gallery/v6e08o,245,1654550462.0,FarmSuch5021,0.91,/r/ukraine/comments/v6e08o/rest_in_power_27yearold_alice_died_defending_her/,ukraine,860311,2
"The Ukrainian army released a tapped phone call between a Russian soldier and his mother. The soldier describes how exciting it was to torture, maim and kill Ukrainians. His mother shares his excitement",33804,ui216j,https://www.reddit.com/r/ukraine/comments/ui216j/the_ukrainian_army_released_a_tapped_phone_call/,2172,1651653538.0,CapitalString,0.88,/r/ukraine/comments/ui216j/the_ukrainian_army_released_a_tapped_phone_call/,ukraine,860311,2
Female defender of Azovstal. Photo made during heavy fighting as russians are storming plant bunkers,33593,uj59tl,https://i.redd.it/s2dp3vgzlpx81.jpg,1064,1651779169.0,lokmardion,0.86,/r/ukraine/comments/uj59tl/female_defender_of_azovstal_photo_made_during/,ukraine,860311,2
"You may not have known, but there are skate troops in Ukraine",33350,uboygz,https://v.redd.it/ojuj63cfapv81,750,1650903621.0,TotalSpaceNut,0.93,/r/ukraine/comments/uboygz/you_may_not_have_known_but_there_are_skate_troops/,ukraine,860311,2
"It snowed in Kyiv. ""What a war, such a spring."" We will win 🙏🇺🇦 #ukraine #StandWithUkraine",32528,t9e5xn,https://v.redd.it/1zmcaw1235m81,885,1646736374.0,Sunnyflbunny,0.95,/r/ukraine/comments/t9e5xn/it_snowed_in_kyiv_what_a_war_such_a_spring_we/,ukraine,860311,2
Scholz said Germany is able to abandon Russian gas faster than expected and the process of EU’s independence of Russian gas is now irreversible,32410,toixff,https://twitter.com/nexta_tv/status/1507605707713044480?s=21&t=51AL-7vAwUslc4ua3aeaSg,1733,1648277718.0,TheRealMykola,0.96,/r/ukraine/comments/toixff/scholz_said_germany_is_able_to_abandon_russian/,ukraine,860311,2
Incredible footage of a Ukrainian drone chasing a Russian soldier back to his unit. Who begin shooting at the drone.,32366,tyjbjg,https://v.redd.it/xria5xb9g5s81,1610,1649355882.0,AllHailTheBEAR,0.93,/r/ukraine/comments/tyjbjg/incredible_footage_of_a_ukrainian_drone_chasing_a/,ukraine,860311,2
Peter Brookes’s Times cartoon,31939,uom9oo,https://i.redd.it/bjlfw8tj37z81.jpg,393,1652426741.0,boskee,0.94,/r/ukraine/comments/uom9oo/peter_brookess_times_cartoon/,ukraine,860311,2
Finland has filed a declaration of intervention against Russia for genocide in the International Court of Justice.,31703,xl4up8,https://i.redd.it/7tcq0go0kfp91.png,664,1663861285.0,SpaceEngineering,0.96,/r/ukraine/comments/xl4up8/finland_has_filed_a_declaration_of_intervention/,ukraine,860311,2
Biden labels the invasion genocide for the first time,30776,u290ef,https://v.redd.it/vzuntj40u5t81,1114,1649796348.0,rishcast,0.91,/r/ukraine/comments/u290ef/biden_labels_the_invasion_genocide_for_the_first/,ukraine,860311,2
More photos from Kramatorsk,30356,tz4sfe,https://www.reddit.com/gallery/tz4sfe,3068,1649428091.0,JD017,0.92,/r/ukraine/comments/tz4sfe/more_photos_from_kramatorsk/,ukraine,860311,2
"Russian ambassador to the UN accidentally blurts out the truth before correcting himself: ""The corpses in Bucha that didn't exist before the Russian troops arrived ... er, er, left, sorry - before they left ...""",30182,twr276,https://v.redd.it/91nhst6yjor81,910,1649151341.0,thefathermucker,0.94,/r/ukraine/comments/twr276/russian_ambassador_to_the_un_accidentally_blurts/,ukraine,860311,2
HUGE NEWS!!! Russian Troops No Longer Have Full Control Over Kherson - senior Pentagon official.,30021,tnvlql,https://i.redd.it/9zs1ww9epkp81.jpg,858,1648233006.0,Overall_Memory6689,0.95,/r/ukraine/comments/tnvlql/huge_news_russian_troops_no_longer_have_full/,ukraine,860311,2
DESTROYED ruZZian Commander of the 29th Army of the Eastern Military District Major General Andrey Kolesnikov. Glory to Ukraine!,30010,tbr7jj,https://i.redd.it/gnlst2lfkrm81.jpg,1239,1647008572.0,Regrup,0.91,/r/ukraine/comments/tbr7jj/destroyed_ruzzian_commander_of_the_29th_army_of/,ukraine,860311,2
President Zelensky came to the liberated Izyum in Kharkiv Oblast,29931,xdxorg,https://i.redd.it/ewodimp9qsn91.jpg,617,1663148980.0,Sv1a,0.94,/r/ukraine/comments/xdxorg/president_zelensky_came_to_the_liberated_izyum_in/,ukraine,860311,2
"Two Russian BMP's drive headlong into a minefield, Ukrainian drone watches the results unfold",29149,uqzjw4,https://v.redd.it/lp5ep7y64vz81,1629,1652717623.0,RallyToTheColors,0.93,/r/ukraine/comments/uqzjw4/two_russian_bmps_drive_headlong_into_a_minefield/,ukraine,860311,2
"Finnish prime minister is asked what is the way out of the conflict. Her reply: ""Russia leaves Ukraine, that's the way out of the conflict"" and leaves.",28640,xxvq3q,https://twitter.com/RikhardHusu/status/1578308226709590017,1171,1665139278.0,SpaceEngineering,0.96,/r/ukraine/comments/xxvq3q/finnish_prime_minister_is_asked_what_is_the_way/,ukraine,860311,2
Zelensky called the conditions for negotiations,28646,ypijb8,https://i.redd.it/nl7n5r7gjpy91.jpg,1276,1667904690.0,vipassana-newbie,0.95,/r/ukraine/comments/ypijb8/zelensky_called_the_conditions_for_negotiations/,ukraine,860311,2
"In the temporarily occupied Alchevsk, Russian air defense worked on its own",28610,vjdu0n,https://v.redd.it/8sp5fkogeh791,1622,1656038262.0,RunTheBull13,0.95,/r/ukraine/comments/vjdu0n/in_the_temporarily_occupied_alchevsk_russian_air/,ukraine,860311,2
"Katya, 23 yo. A bodybuilder & competitive basketball player, a champion of Ukraine. She loves to make pizza & sushi. On Mar 13, she took the oath. Now she serves in the 112 Separate Brigade of the Territorial Defense of Kyiv. Katya advances Ukrainian Victory. Credit: M.Tymchenko",28033,tdv9w1,https://i.redd.it/yr1snixh3cn81.jpg,478,1647257090.0,PjeterPannos,0.92,/r/ukraine/comments/tdv9w1/katya_23_yo_a_bodybuilder_competitive_basketball/,ukraine,860311,2
Destroying a ruSSian helicopter on the Snake Island,28021,ukw1fb,https://v.redd.it/upbplwhe87y81,1504,1651992544.0,ThaIgk,0.88,/r/ukraine/comments/ukw1fb/destroying_a_russian_helicopter_on_the_snake/,ukraine,860311,2
"Near the Georgia border crossing into Russia, protesters are playing the Ukrainian national anthem and trolling the Russians who are leaving. ‘In surveys, most of you support the war. So why now are you leaving?’ reads the sign carried by the man draped in the Ukraine flag.",27899,xqbv5a,https://i.redd.it/8lmo43dzilq91.jpg,1471,1664369351.0,Zhana-Aul,0.91,/r/ukraine/comments/xqbv5a/near_the_georgia_border_crossing_into_russia/,ukraine,860311,2
"Putin publicly lashing out at spy chief for suggesting negotiating before ""worst case scenario"" of invading 2 days before the invasion. This is what a dictator in an information bubble looks like.",27733,tcln3m,https://v.redd.it/kjq4yf6slzm81,1575,1647105886.0,Artane_33,0.94,/r/ukraine/comments/tcln3m/putin_publicly_lashing_out_at_spy_chief_for/,ukraine,860311,2
Dog is refusing to leave the debris where its owners are after this night’s missile strike,27701,xraii0,https://v.redd.it/02iv6kuoetq91,914,1664464733.0,migoodenuf,0.95,/r/ukraine/comments/xraii0/dog_is_refusing_to_leave_the_debris_where_its/,ukraine,860311,2
Due to russia's endless human wave attacks Ukrainians have to dig deeper trenches... as the current ones are filling up with machine gun bullet casings,27686,10zgefz,https://v.redd.it/cfjfh9wjviha1,1400,1676105143.0,gkanor,0.91,/r/ukraine/comments/10zgefz/due_to_russias_endless_human_wave_attacks/,ukraine,860311,2
[Illia Ponomarenko] Ukraine’s government has officially registered the Moskva cruiser wreck on the Black Sea bottom as a national underwater cultural heritage site,27632,u98lg7,https://twitter.com/IAPonomarenko/status/1517398931306594306,472,1650611238.0,rishcast,0.97,/r/ukraine/comments/u98lg7/illia_ponomarenko_ukraines_government_has/,ukraine,860311,2
"Mykhailo Dianov has been released from captivity. Marine and defender of ""Azovstal"".",27394,xlyi9k,https://www.reddit.com/gallery/xlyi9k,1202,1663941856.0,valeron_b,0.94,/r/ukraine/comments/xlyi9k/mykhailo_dianov_has_been_released_from_captivity/,ukraine,860311,2
