title,score,id,url,num_comments,created,author,upvote_ratio,permalink,subreddit,subreddit_subscribers,depth
"Nearly 50 hours of work, here’s my drawing of The Rock",49556,hfp11j,https://i.redd.it/t6u6wwm313751.jpg,1444,1593102152.0,Macaveli54,0.91,/r/SquaredCircle/comments/hfp11j/nearly_50_hours_of_work_heres_my_drawing_of_the/,SquaredCircle,740816,2
[Rampage Spoilers] Wrestler makes his AEW debut,28173,p8ivfv,https://streamable.com/vmlh0v,4933,1629511394.0,twistedlogicx,0.91,/r/SquaredCircle/comments/p8ivfv/rampage_spoilers_wrestler_makes_his_aew_debut/,SquaredCircle,740816,2
Daniel Bryan medically cleared to return to in-ring action,27136,85vdq9,https://www.wwe.com/shows/smackdown/article/daniel-bryan-makes-huge-announcement,6483,1521572614.0,RealWWE,0.87,/r/SquaredCircle/comments/85vdq9/daniel_bryan_medically_cleared_to_return_to/,SquaredCircle,740816,2
WWE has confirmed WrestleMania will not be taking place in Tampa Bay. It will instead air live on PPV/WWE Network and emanate from the WWE Performance Center.,22496,fjubzf,https://twitter.com/ryansatin/status/1239687980496740352,4531,1584399701.0,suzukigun4life,0.93,/r/SquaredCircle/comments/fjubzf/wwe_has_confirmed_wrestlemania_will_not_be_taking/,SquaredCircle,740816,2
Amanda Huber on Twitter: I’ve had 2 medically necessary abortions. I almost died because of a ruptured ectopic pregnancy. I also had a failed pregnancy my body didn’t pass which started to become septic. Please fuck all the way off.,21646,vjs9dl,https://twitter.com/MandaLHuber/status/1540360488378404864?t=_1nqhFzVoYNZxdVR-gWmpA&s=19,475,1656087799.0,Fan387,0.88,/r/SquaredCircle/comments/vjs9dl/amanda_huber_on_twitter_ive_had_2_medically/,SquaredCircle,740816,2
I just found my new favorite indie wrestler: pizza chef Luigi Primo,19099,wylmeb,https://i.redd.it/2uktq748r4k91.gif,707,1661551482.0,KneeHighMischief,0.96,/r/SquaredCircle/comments/wylmeb/i_just_found_my_new_favorite_indie_wrestler_pizza/,SquaredCircle,740816,2
Earthquake (my dad) playing Tetris while my brother and sister look on.,18472,bl4wky,https://i.redd.it/mw2zjhlgehw21.jpg,539,1557100753.0,LazyCanasian,0.95,/r/SquaredCircle/comments/bl4wky/earthquake_my_dad_playing_tetris_while_my_brother/,SquaredCircle,740816,2
Nia Jax's Instagram story regarding Covid Vaccine. Yikes,18474,jvc8ga,https://i.redd.it/nl9me3wfcnz51.png,2719,1605551849.0,pwgmanan,0.88,/r/SquaredCircle/comments/jvc8ga/nia_jaxs_instagram_story_regarding_covid_vaccine/,SquaredCircle,740816,2
"Vince McMahon: At 77, time for me to retire. Thank you, WWE Universe. Then. Now. Forever. Together.",17320,w5jzg8,https://twitter.com/vincemcmahon/status/1550572700959121408?s=21&t=DGaoQfr5gXXuZT4dINb80g,2142,1658520354.0,KhabibTime,0.92,/r/SquaredCircle/comments/w5jzg8/vince_mcmahon_at_77_time_for_me_to_retire_thank/,SquaredCircle,740816,2
"In memory of my dad today, here he is on his birthday excited for some hot disco hits!",17297,bxw6fa,https://i.redd.it/tbkw4nm5hy231.jpg,427,1559922567.0,LazyCanasian,0.95,/r/SquaredCircle/comments/bxw6fa/in_memory_of_my_dad_today_here_he_is_on_his/,SquaredCircle,740816,2
Kurt Angle is to be inducted into the 2017 WWE Hall of Fame!,16525,5odu7a,http://corporate.wwe.com/news/company-news/2017/01-16-2017,2237,1484604212.0,MXPelez,0.85,/r/SquaredCircle/comments/5odu7a/kurt_angle_is_to_be_inducted_into_the_2017_wwe/,SquaredCircle,740816,2
"BREAKING: Triple H announces WWE ""changing back to WWF, effective immediately""",16196,wi495o,https://www.kayfabenews.com/breaking-triple-h-announces-wwe-changing-back-to-wwf-effective-immediately/,1040,1659837708.0,Fan387,0.88,/r/SquaredCircle/comments/wi495o/breaking_triple_h_announces_wwe_changing_back_to/,SquaredCircle,740816,2
"TRAGIC UPDATE: LA County lifeguards confirm body found in Venice Beach is former WWE star Shad Gaspard, via @tina_patel.",15834,gnb6pa,https://twitter.com/austinkellerman/status/1263096635955044352?s=21,1526,1589980733.0,Bradleyharheez,0.95,/r/SquaredCircle/comments/gnb6pa/tragic_update_la_county_lifeguards_confirm_body/,SquaredCircle,740816,2
"[Sean Ross Sapp] Triple H will assume all responsibilities related to WWE creative, in addition to his regular duties, per WWE",15286,w7o685,https://twitter.com/SeanRossSapp/status/1551550437073080329,2640,1658753467.0,Shaunyowns,0.94,/r/SquaredCircle/comments/w7o685/sean_ross_sapp_triple_h_will_assume_all/,SquaredCircle,740816,2
WWE Hall of Famer “Mean” Gene Okerlund Passes Away,14998,abugmt,https://www.wwe.com/article/mean-gene-okerlund-passes-away?sf205241548=1,1452,1546443671.0,Shaunyowns,0.94,/r/SquaredCircle/comments/abugmt/wwe_hall_of_famer_mean_gene_okerlund_passes_away/,SquaredCircle,740816,2
"In honor of Father’s Day, here’s Earthquake and me around 1996-1997. Happy Father’s Day to all of the dads that are still with us and those that aren’t. Much love!",14024,hd8b7d,https://i.redd.it/ztg35lrr2a651.jpg,361,1592751615.0,LazyCanasian,0.96,/r/SquaredCircle/comments/hd8b7d/in_honor_of_fathers_day_heres_earthquake_and_me/,SquaredCircle,740816,2
[Royal Rumble Spoilers] Entrant #21 in the Men's Royal Rumble,13234,euianq,https://streamable.com/fw8sg,1595,1580096749.0,FuzzyWuzzyMooMoo,0.93,/r/SquaredCircle/comments/euianq/royal_rumble_spoilers_entrant_21_in_the_mens/,SquaredCircle,740816,2
[Survivor Series Spoilers] Information on the jobber.,13047,5e1xrg,https://www.reddit.com/r/SquaredCircle/comments/5e1xrg/survivor_series_spoilers_information_on_the_jobber/,980,1479698887.0,theonlycarrot,0.82,/r/SquaredCircle/comments/5e1xrg/survivor_series_spoilers_information_on_the_jobber/,SquaredCircle,740816,2
"Kofi on being called the first African American champion: “I think it’s silly that people try to not count The Rock in that category. Regardless of what you look like, you are what you are. He’s black. Whether he’s half black, he’s black.”",12629,i4s5tz,https://wrestlingnews.co/wwe-news/kofi-kingston-on-what-it-was-like-to-be-the-first-afrian-american-to-hold-the-wwe-championship/,1425,1596721857.0,Strike_Gently,0.94,/r/SquaredCircle/comments/i4s5tz/kofi_on_being_called_the_first_african_american/,SquaredCircle,740816,2
[WWE Backstage Spoilers] It finally happened...,12597,dvmq40,https://www.clippituser.tv/c/mndled,3145,1573621210.0,FuzzyWuzzyMooMoo,0.9,/r/SquaredCircle/comments/dvmq40/wwe_backstage_spoilers_it_finally_happened/,SquaredCircle,740816,2
"""Texas introduced a bill that would criminally charge venues that have drag shows with a Class A misdemeanor if they permit minors to enter at any time. The bill defines drag as essentially any trans person performing at all."" This would essentially ban trans wrestlers from performing in Texas.",12520,yw6qm4,https://twitter.com/esqueer_/status/1592568073021972481,1234,1668539743.0,DKBetiza,0.9,/r/SquaredCircle/comments/yw6qm4/texas_introduced_a_bill_that_would_criminally/,SquaredCircle,740816,2
Kevin Nash: “America is so full of hate. The senseless violence against our Asian American community once again showing how broken we are. Let's be diligent and protect our Asian Brothers and Sisters.”,12467,m84sly,https://twitter.com/realkevinnash/status/1372703829079293954?s=21,1081,1616113209.0,Strike_Gently,0.92,/r/SquaredCircle/comments/m84sly/kevin_nash_america_is_so_full_of_hate_the/,SquaredCircle,740816,2
MEGATHREAD: Multiple Outlets Report WWE has been sold to Saudi Arabia's Public Investment Fund.,12285,108u85d,https://www.reddit.com/r/SquaredCircle/comments/108u85d/megathread_multiple_outlets_report_wwe_has_been/,11816,1673407782.0,WredditMod,0.93,/r/SquaredCircle/comments/108u85d/megathread_multiple_outlets_report_wwe_has_been/,SquaredCircle,740816,2
"Orton: “It took me a little time, but what I had to do was realize, Kaepernick, he wasn't shiting on the flag. He wasn't disrespecting the people that have given their lives for our freedom. He was taking a stand against police brutality.”",12025,h9i95l,https://www.cbssports.com/wwe/news/randy-orton-on-recent-black-lives-matter-support-im-embarrassed-to-say-it-but-it-took-me-a-little/,1016,1592234031.0,Strike_Gently,0.91,/r/SquaredCircle/comments/h9i95l/orton_it_took_me_a_little_time_but_what_i_had_to/,SquaredCircle,740816,2
"Kevin Owens with a video on his thoughts on COVID-19: “If you’re belittling people for wearing a mask, you’re making fun of people who are trying to do what’s best for their community.”",11888,hhpkan,https://twitter.com/fightowensfight/status/1277393924852678656?s=21,458,1593389590.0,Strike_Gently,0.95,/r/SquaredCircle/comments/hhpkan/kevin_owens_with_a_video_on_his_thoughts_on/,SquaredCircle,740816,2
That time John Cena just decided to go off script and drag Roman Reigns to the deep end and ether him for no reason.,11264,ivozra,https://v.redd.it/6ag4flryh2o51,1066,1600505478.0,Bigbenn0,0.95,/r/SquaredCircle/comments/ivozra/that_time_john_cena_just_decided_to_go_off_script/,SquaredCircle,740816,2
Ric Flair: I Ain't Dead Yet Mother Fuckers! WOOOOO!,11233,6xnta2,https://twitter.com/RicFlairNatrBoy/status/904045165584818176,575,1504376191.0,KhabibTime,0.93,/r/SquaredCircle/comments/6xnta2/ric_flair_i_aint_dead_yet_mother_fuckers_wooooo/,SquaredCircle,740816,2
"AEW Star and Former WWE Legend, Jeff Hardy, Arrested last night",11121,vbikmu,https://volusiamug.vcgov.org/Details.aspx?InmateRID=543747,3720,1655144150.0,xRainjosh,0.94,/r/SquaredCircle/comments/vbikmu/aew_star_and_former_wwe_legend_jeff_hardy/,SquaredCircle,740816,2
WWE Pandemic Release Megathread,11110,g1wssv,https://www.reddit.com/r/SquaredCircle/comments/g1wssv/wwe_pandemic_release_megathread/,22491,1586972659.0,WredditMod,0.87,/r/SquaredCircle/comments/g1wssv/wwe_pandemic_release_megathread/,SquaredCircle,740816,2
WWE debuts 7’3” MONSTER!,10683,cf5suk,https://v.redd.it/hvzhwjx4k8b31,1165,1563531464.0,dr_teeth33,0.95,/r/SquaredCircle/comments/cf5suk/wwe_debuts_73_monster/,SquaredCircle,740816,2
"Sami Zayn: I mainly agree with this, but Obama gets too much of a pass. His ‘mistakes’ were not careless errors, he took calculated steps to maintain & expand policies, systems & wars put in place by GWB & evil scumbags before him. I don’t expect much better from Biden, but here’s hoping.",10646,kuqrtf,https://twitter.com/SamiZayn/status/1348421381202075650?s=19,1993,1610324120.0,niclaswwe,0.8,/r/SquaredCircle/comments/kuqrtf/sami_zayn_i_mainly_agree_with_this_but_obama_gets/,SquaredCircle,740816,2
WWE Official Press Release on the investigation into Vince McMahon and John Laurinaitis - Vince McMahan has stepped away from CEO responsibility,10642,vealqb,https://corporate.wwe.com/investors/news/press-releases/2022/06-17-2022-120023255,2377,1655463862.0,theonlycarrot,0.95,/r/SquaredCircle/comments/vealqb/wwe_official_press_release_on_the_investigation/,SquaredCircle,740816,2
"Lance Storm: Let me get this straight. Wearing a mask at school is too traumatizing to kids. We need to protect our kid’s freedom. But singling out Trans kids and arresting their parents etc. that’s okay. We can just fuck over those kids, they don’t need any freedom. WTF?",10594,szw309,https://twitter.com/LanceStorm/status/1496635258413801472,763,1645660850.0,niclaswwe,0.9,/r/SquaredCircle/comments/szw309/lance_storm_let_me_get_this_straight_wearing_a/,SquaredCircle,740816,2
"Dax Harwood - I choose to wear a mask because it POSSIBLY will make my 6 y/o daughter’s life a little safer. Am I right? Who knows, but if wearing a dumb mask over my face will help my daughter or anyone else in the world, I’ll take the chance. & if it’s wrong, I wore a fucking mask. Oh well.",10341,hh02i2,https://twitter.com/DaxHarwood/status/1276953592918945792?s=19,484,1593287070.0,pwgmanan,0.95,/r/SquaredCircle/comments/hh02i2/dax_harwood_i_choose_to_wear_a_mask_because_it/,SquaredCircle,740816,2
"Official statement from WWE: ""Paul Levesque, a.k.a. Triple H, underwent a successful procedure last week at Yale New Haven Hospital following a cardiac event. The episode was caused by a genetic heart issue and Paul is expected to make a full recovery.""",10292,pkimzu,https://twitter.com/wwe/status/1435702276962852869?s=21,1053,1631133105.0,Weezy-NJPW_Fan,0.95,/r/SquaredCircle/comments/pkimzu/official_statement_from_wwe_paul_levesque_aka/,SquaredCircle,740816,2
Renee Paquette just shared this new unseen backstage photo of Jon Huber with the TNT Title,10231,kn66rf,https://i.redd.it/u1rr74jbxc861.jpg,156,1609348325.0,niclaswwe,0.97,/r/SquaredCircle/comments/kn66rf/renee_paquette_just_shared_this_new_unseen/,SquaredCircle,740816,2
"Big Show won't wake up after a match, so the referees try to put themselves over",10016,d383h5,https://i.imgur.com/l40RlhX.gifv,218,1568295782.0,Strike_Gently,0.97,/r/SquaredCircle/comments/d383h5/big_show_wont_wake_up_after_a_match_so_the/,SquaredCircle,740816,2
"Sami Zayn: “I hear that as United States Champion, Bobby Lashley is working on a new finishing move called “The American Way”, where he sets up a base on my property, destroys my home, has his friends take whatever is left, then says he did it for freedom & makes me out to be the bad guy.”",9885,jx94sb,https://twitter.com/samizayn/status/1329503093294239747?s=21,873,1605813252.0,Weezy-NJPW_Fan,0.92,/r/SquaredCircle/comments/jx94sb/sami_zayn_i_hear_that_as_united_states_champion/,SquaredCircle,740816,2
CM Punk with a fantastic display of sportsmanship after Chris Hamrick suffers a gruesome knee injury,9829,f0tcmx,https://i.redd.it/ctfi2nhq1qf41.gif,415,1581177248.0,KneeHighMischief,0.97,/r/SquaredCircle/comments/f0tcmx/cm_punk_with_a_fantastic_display_of_sportsmanship/,SquaredCircle,740816,2
Sign catches Rock’s attention and he’s gotta set the record straight,9773,dia304,https://gfycat.com/sentimentalvigorousgemsbuck,384,1571155828.0,thebobbyshaw33,0.97,/r/SquaredCircle/comments/dia304/sign_catches_rocks_attention_and_hes_gotta_set/,SquaredCircle,740816,2
TNT's Closed Captioning person is not a fan of Maki Itoh.,9541,m3lzzl,https://i.imgur.com/dCl362D.jpg,532,1615568761.0,20minutes40years,0.97,/r/SquaredCircle/comments/m3lzzl/tnts_closed_captioning_person_is_not_a_fan_of/,SquaredCircle,740816,2
"""Rusev literally gave $25,000 of his own money to pay WWE production workers cause they weren’t getting paid.""",9447,g207gp,https://twitter.com/kctharington/status/1250516500827365376,1072,1586983001.0,Knoxlag,0.96,/r/SquaredCircle/comments/g207gp/rusev_literally_gave_25000_of_his_own_money_to/,SquaredCircle,740816,2
HANGMAN PAGE: i just hope that when im old and retired i don’t lower myself to some shit ass podcast where i trash the younger generation that’s just chasing the same fortune wrestling has afforded me,9364,vhc7i6,https://twitter.com/theAdamPage/status/1539223449993977858,1281,1655814537.0,DKBetiza,0.91,/r/SquaredCircle/comments/vhc7i6/hangman_page_i_just_hope_that_when_im_old_and/,SquaredCircle,740816,2
"Bret Hart shared this great photo today: ""I already received my first COVID-19 vaccine shot, and I’m waiting for my second. Getting the vaccine not only helps stop the spread and protect me and my loved ones, but it also means I’m one step closer to seeing all my fans in person again.""",9358,n7vd2g,https://i.redd.it/d9qs6yiswxx61.jpg,392,1620498593.0,starbearer92,0.94,/r/SquaredCircle/comments/n7vd2g/bret_hart_shared_this_great_photo_today_i_already/,SquaredCircle,740816,2
CM Punk answers why he won't do a Reddit AMA,9170,66bcd6,https://twitter.com/CMPunk/status/854735061748502528,716,1492619752.0,juzashannon,0.9,/r/SquaredCircle/comments/66bcd6/cm_punk_answers_why_he_wont_do_a_reddit_ama/,SquaredCircle,740816,2
Chuck Taylor uses a live grenade on Ciampa and feels the effect,9098,dsgtgi,https://i.imgur.com/SoB9h2I.gifv,580,1573049451.0,Strike_Gently,0.93,/r/SquaredCircle/comments/dsgtgi/chuck_taylor_uses_a_live_grenade_on_ciampa_and/,SquaredCircle,740816,2
AEW & The Owen Hart Foundation Enter Into A Relationship to Honor World Renowned Wrestler Owen Hart,9001,prwnj2,https://www.allelitewrestling.com/post/aew-the-owen-hart-foundation-enter-into-a-relationship-to-honor-world-renowned-wrestler-owen-hart,1527,1632150072.0,Weezy-NJPW_Fan,0.94,/r/SquaredCircle/comments/prwnj2/aew_the_owen_hart_foundation_enter_into_a/,SquaredCircle,740816,2
"Macaulay Culkin on WWE: ""They’ve cut I think 86 wrestlers from their roster this past calendar year. So yeah, you don’t have this rich variety that you might have had before, but even then, man, it’s like how many times can we watch the same match over again?”",8929,ryc2uh,https://www.wrestlinginc.com/news/2022/01/macaulay-culkin-blasts-the-current-state-of-wwe-product/?utm_source=dlvr.it&utm_medium=twitter,877,1641574811.0,Strike_Gently,0.95,/r/SquaredCircle/comments/ryc2uh/macaulay_culkin_on_wwe_theyve_cut_i_think_86/,SquaredCircle,740816,2
R.I.P. Chyna.,8777,4frd7i,https://i.reddituploads.com/75bc0afed3e842d0b419773a9ddce594?fit=max&h=1536&w=1536&s=d0dbac25035d22de89e3124255d5e857,2283,1461212442.0,PhillipJFry32,0.9,/r/SquaredCircle/comments/4frd7i/rip_chyna/,SquaredCircle,740816,2
Rey Mysterio’s reaction to seeing AJ Styles backstage at Royal Rumble,8649,7uf1uq,https://i.imgur.com/CWoTU99.jpg,490,1517448018.0,RealWWE,0.93,/r/SquaredCircle/comments/7uf1uq/rey_mysterios_reaction_to_seeing_aj_styles/,SquaredCircle,740816,2
WWE has come to terms on the release of Andrade. We wish him all the best in all of his future endeavors.,8562,madewk,https://twitter.com/wwe/status/1373833238121226240?s=21,1503,1616382375.0,Weezy-NJPW_Fan,0.94,/r/SquaredCircle/comments/madewk/wwe_has_come_to_terms_on_the_release_of_andrade/,SquaredCircle,740816,2
"Sammy Guevara: “I’ve made stupid, inappropriate and extremely offensive comments in my past. In my idiotic mind, I thought I was being funny in using words and terms that represent nothing but horror and pain. I am truly sorry for my hurtful words and actions, and I will never forgive myself.”",8552,hdxn2e,https://twitter.com/sammyguevara/status/1275130818353135617?s=21,1469,1592849967.0,Strike_Gently,0.91,/r/SquaredCircle/comments/hdxn2e/sammy_guevara_ive_made_stupid_inappropriate_and/,SquaredCircle,740816,2
"Tony Khan: “Jon Moxley has allowed me to share with you that he is entering an inpatient alcohol treatment program. Jon is a beloved member of the AEW family. We all stand with him and Renee, and all of his family and friends, as he shifts his focus to recovery.”",8545,qllt5i,https://twitter.com/tonykhan/status/1455739778087931913?s=21,1713,1635910422.0,Strike_Gently,0.95,/r/SquaredCircle/comments/qllt5i/tony_khan_jon_moxley_has_allowed_me_to_share_with/,SquaredCircle,740816,2
JOHN LAURINAITIS TERMINATED BY WWE,8541,wjfoco,https://www.pwinsider.com/ViewArticle.php?id=161872,1212,1659981893.0,LexLozano,0.94,/r/SquaredCircle/comments/wjfoco/john_laurinaitis_terminated_by_wwe/,SquaredCircle,740816,2
MEGATHREAD: Vince McMahon Retires,8537,w5k9pv,https://www.reddit.com/r/SquaredCircle/comments/w5k9pv/megathread_vince_mcmahon_retires/,6007,1658521086.0,WredditMod,0.91,/r/SquaredCircle/comments/w5k9pv/megathread_vince_mcmahon_retires/,SquaredCircle,740816,2
That time Triple H KILLED Shawn Michaels. I'm glad he retired this dangerous move.,8476,fgctxu,https://v.redd.it/yjja5kwl6ul41,647,1583842273.0,mcm123456,0.95,/r/SquaredCircle/comments/fgctxu/that_time_triple_h_killed_shawn_michaels_im_glad/,SquaredCircle,740816,2
"Darren Young on Randy Orton's reaction after he came out as homosexual: ""He said, 'Hey man, if you have any issue, you let me know, and I'll take care of anyone in the locker room.' Him and CM Punk were top guys that said those exact words and Randy, from then on, was my heart.""",8406,kpp87i,https://www.wrestlinginc.com/news/2021/01/darren-young-talks-randy-orton-supporting-him-after-he-came-678640/,645,1609696752.0,SuplexCity-Mayor,0.96,/r/SquaredCircle/comments/kpp87i/darren_young_on_randy_ortons_reaction_after_he/,SquaredCircle,740816,2
Step 1: Zack Ryder signs with AEW. Step 2: Cody Rhodes teams with him. Step 3: They call their tag team “The Suite Life of Zack & Cody” Step 4: They rename the Jericho Cruise “AEW: Suite Life On Deck” Step 5: Ratings 📈📈📈,8389,g2p0tf,https://twitter.com/deonteddj/status/1250882376428904448?s=19,435,1587075442.0,pwgmanan,0.93,/r/SquaredCircle/comments/g2p0tf/step_1_zack_ryder_signs_with_aew_step_2_cody/,SquaredCircle,740816,2
Mick foley: Today seems like a good day to remove Donald Trump from the #WWEHOF,8310,vdwuv9,https://twitter.com/realmickfoley/status/1537551539442696200?s=21&t=o1oACYQeRcpnaP4qkUaf2w,934,1655415953.0,Bradleyharheez,0.86,/r/SquaredCircle/comments/vdwuv9/mick_foley_today_seems_like_a_good_day_to_remove/,SquaredCircle,740816,2
[CM Punk] Feels pointless waking up today and just going about business as usual. Feels empty. I just feel so nihilistic. Let’s go do a pro wrestling show? When babies are murdered in schools everyday? I don’t even have kids and I feel lost. Everyone in government is complicit.,8258,uxmzbx,https://twitter.com/CMPunk/status/1529520840215146496,1174,1653501188.0,twistedlogicx,0.89,/r/SquaredCircle/comments/uxmzbx/cm_punk_feels_pointless_waking_up_today_and_just/,SquaredCircle,740816,2
"Renee Paquette: How do you drop the ball on SAMOA JOE?!?!? How?! Injuries aside, what a mistake.",8146,mrlyiu,https://twitter.com/ReneePaquette/status/1382775554068258818?s=19,850,1618514438.0,niclaswwe,0.93,/r/SquaredCircle/comments/mrlyiu/renee_paquette_how_do_you_drop_the_ball_on_samoa/,SquaredCircle,740816,2
"HBK gets hugged by a fan in the crowd mid-match, Michaels hugs back",8153,e6z1kt,https://i.imgur.com/ZCWMkKY.gifv,378,1575640452.0,Strike_Gently,0.98,/r/SquaredCircle/comments/e6z1kt/hbk_gets_hugged_by_a_fan_in_the_crowd_midmatch/,SquaredCircle,740816,2
The greatest running gag in wrestling. Sting in a Sting mask,8087,u92xkw,https://v.redd.it/et13ayh3hzu81,265,1650591083.0,KOSLawson,0.98,/r/SquaredCircle/comments/u92xkw/the_greatest_running_gag_in_wrestling_sting_in_a/,SquaredCircle,740816,2
Road Dogg's reaction to seemingly hitting someone with one of the DX glow sticks at the Hall of Fame ceremony,8067,bbznpx,https://i.imgur.com/UtPBbli.gifv,344,1554988039.0,FuzzyWuzzyMooMoo,0.97,/r/SquaredCircle/comments/bbznpx/road_doggs_reaction_to_seemingly_hitting_someone/,SquaredCircle,740816,2
I present to you the first and only time John Cena did a suicide dive.,8056,fmchum,https://v.redd.it/9nfzpb5ewzn41,378,1584783276.0,Bigbenn0,0.97,/r/SquaredCircle/comments/fmchum/i_present_to_you_the_first_and_only_time_john/,SquaredCircle,740816,2
The Last Time The WWF and WcW Champion's Were In The Ring Together On Free TV,8047,ffuem8,https://gfycat.com/vigorousjovialamericanrobin,360,1583759417.0,PogbaIsGood,0.97,/r/SquaredCircle/comments/ffuem8/the_last_time_the_wwf_and_wcw_champions_were_in/,SquaredCircle,740816,2
Jim Ross signs a 2 year deal with WWE.,8029,637tc0,http://wrestlingnews.co/wwe-news/jim-ross-provides-update-on-his-future-with-wwe/,665,1491236437.0,PhillipJFry32,0.91,/r/SquaredCircle/comments/637tc0/jim_ross_signs_a_2_year_deal_with_wwe/,SquaredCircle,740816,2
When Rey Mysterio CM Punk talked about their match with Eddie Guerrero on Social Media,8027,j83c9g,https://i.redd.it/k0ugy8nwx9t21.png,322,1602264573.0,PogbaIsGood,0.97,/r/SquaredCircle/comments/j83c9g/when_rey_mysterio_cm_punk_talked_about_their/,SquaredCircle,740816,2
"Roman Reigns: ""Thank you to everyone who’s reached out...I can’t put into words what it means to me. Your energy and positivity motivate me to get better quickly to get back in the ring, but for now I’m going to spend time with my family and focus on health. Thank you - Joe/Roman""",7994,9qrdwq,https://twitter.com/WWERomanReigns/status/1054792254462799878?s=19,432,1540317144.0,FuzzyWuzzyMooMoo,0.94,/r/SquaredCircle/comments/9qrdwq/roman_reigns_thank_you_to_everyone_whos_reached/,SquaredCircle,740816,2
[Zarian] Starting July 18th WWE Raw will have a TV-14 rating moving forward on USA Network. The PG Era is over.,7962,vz1tbt,https://twitter.com/AndrewZarian/status/1547638048615043073,1943,1657820765.0,AimarEraFutebol,0.93,/r/SquaredCircle/comments/vz1tbt/zarian_starting_july_18th_wwe_raw_will_have_a/,SquaredCircle,740816,2
"Jake Roberts: ""I don’t think marijuana is a gateway drug. I think alcohol is. I’ll tell all the folks out there, I’m pro-pot, you know? I never got in a fight when I was smoking pot. I never got in trouble when I was smoking pot. I never wanted to do cocaine when I was smoking pot.""",7951,ul651b,https://www.wrestlinginc.com/news/2022/05/jake-roberts-names-vince-mcmahons-worst-edict-regarding-drug-testing/,501,1652029404.0,SuplexCity-Mayor,0.95,/r/SquaredCircle/comments/ul651b/jake_roberts_i_dont_think_marijuana_is_a_gateway/,SquaredCircle,740816,2
"On this day 2 years ago, the greatest moment in WWE history happened.",7948,g8vkif,https://v.redd.it/kiv0flab6bv41,362,1587970604.0,Bigbenn0,0.96,/r/SquaredCircle/comments/g8vkif/on_this_day_2_years_ago_the_greatest_moment_in/,SquaredCircle,740816,2
Cora Jade responds to Darby Allin - “Being a good person with no abuse allegations against me is a huge part of my life and not just a character I play on TV.”,7951,riq61i,https://i.redd.it/tz648ykox5681.jpg,1996,1639773062.0,gonnablamethemovies,0.89,/r/SquaredCircle/comments/riq61i/cora_jade_responds_to_darby_allin_being_a_good/,SquaredCircle,740816,2
Jon Huber's In Memoriam graphic.,7910,km3hi3,https://i.redd.it/rbd0764ez0861.jpg,441,1609203766.0,JustATributeCC,0.97,/r/SquaredCircle/comments/km3hi3/jon_hubers_in_memoriam_graphic/,SquaredCircle,740816,2
2 Generations apart,7899,fudh4a,https://i.redd.it/udwndqy1anq41.jpg,325,1585937906.0,Knoxlag,0.94,/r/SquaredCircle/comments/fudh4a/2_generations_apart/,SquaredCircle,740816,2
