title,score,id,url,num_comments,created,author,upvote_ratio,permalink,subreddit,subreddit_subscribers,depth
"Swedish Rally, before four wheel drive",2363,aqj23u,https://i.redd.it/c88qcxl9yig21.gif,45,1550145951.0,duncadelic,0.99,/r/rally/comments/aqj23u/swedish_rally_before_four_wheel_drive/,rally,268448,2
Scandi flicks don’t get better than this,2232,l930er,https://v.redd.it/0vreumzcwke61,46,1612062446.0,PlenitudeOpulence,0.99,/r/rally/comments/l930er/scandi_flicks_dont_get_better_than_this/,rally,268448,2
"Hello I'm a rally enthusiast, and a diorama creator, let me share a bit of my work. Hope you like it.",2124,lkntcp,https://www.reddit.com/gallery/lkntcp,73,1613424973.0,Pedjogon,1.0,/r/rally/comments/lkntcp/hello_im_a_rally_enthusiast_and_a_diorama_creator/,rally,268448,2
Should be classified NSFW?,1999,exazqb,https://i.redd.it/5bdva1m63de41.jpg,36,1580584326.0,Zugrum,0.98,/r/rally/comments/exazqb/should_be_classified_nsfw/,rally,268448,2
Lancia Stratos HF in the scenery,1944,kq5fnp,https://i.redd.it/l81kzms0ca961.jpg,14,1609752798.0,VitorAntonio10,0.99,/r/rally/comments/kq5fnp/lancia_stratos_hf_in_the_scenery/,rally,268448,2
"Another example on the dangers rally drivers have to face sometimes. They can't have time to enjoy the beautiful scenery, but we do.",1916,kfkskp,https://v.redd.it/gn49hryy1y561,33,1608296794.0,VitorAntonio10,1.0,/r/rally/comments/kfkskp/another_example_on_the_dangers_rally_drivers_have/,rally,268448,2
if it works why not?,1850,m12amd,https://i.redd.it/hs5bca6kryl61.jpg,40,1615278806.0,nopunterino,0.99,/r/rally/comments/m12amd/if_it_works_why_not/,rally,268448,2
Three minutes of superb shots taken from the 2018 Spanish WRC round in Catalunya!,1809,kjcurb,https://v.redd.it/urf3hmrox3761,38,1608803941.0,VitorAntonio10,1.0,/r/rally/comments/kjcurb/three_minutes_of_superb_shots_taken_from_the_2018/,rally,268448,2
My first option is the second one.,1784,mmte8i,https://i.redd.it/kl0yhn7npyr61.jpg,54,1617893209.0,CiprianDerradeiros,0.99,/r/rally/comments/mmte8i/my_first_option_is_the_second_one/,rally,268448,2
We had a pretty big off on SS2 at LSPR this weekend. Here’s the roof camera with Comms. We are both OK,1780,y5prpb,https://v.redd.it/9bxeqhbb08u91,80,1665949151.0,Rally_kj,0.99,/r/rally/comments/y5prpb/we_had_a_pretty_big_off_on_ss2_at_lspr_this/,rally,268448,2
Full send in a Fiat 126,1778,113vbhk,https://v.redd.it/e00u3d3shmia1,85,1676566769.0,dannybluey,0.99,/r/rally/comments/113vbhk/full_send_in_a_fiat_126/,rally,268448,2
Like a Rally train 😍,1756,g4gu4t,https://v.redd.it/1opn3ev9put41,21,1587335361.0,Zugrum,1.0,/r/rally/comments/g4gu4t/like_a_rally_train/,rally,268448,2
Homologation,1672,mtyjm4,https://i.redd.it/j1vw73i184u61.jpg,29,1618831633.0,Testiercactus94,1.0,/r/rally/comments/mtyjm4/homologation/,rally,268448,2
Anyone else struggle with this?,1657,bz6qhv,https://i.redd.it/6ddy4mhb0n331.jpg,89,1560219573.0,garagehirohata,0.98,/r/rally/comments/bz6qhv/anyone_else_struggle_with_this/,rally,268448,2
Us hitting 125 MPH on stage at STPR last weekend!,1639,xkrqqr,https://v.redd.it/db0pf2qmbcp91,47,1663822063.0,Rally_kj,1.0,/r/rally/comments/xkrqqr/us_hitting_125_mph_on_stage_at_stpr_last_weekend/,rally,268448,2
"fingers, what fingers?",1623,mqlx3u,https://i.redd.it/hnsrhf46i3t61.png,15,1618387097.0,nopunterino,0.99,/r/rally/comments/mqlx3u/fingers_what_fingers/,rally,268448,2
Very different driving styles in Monte. Love it,1603,s7cgr1,https://v.redd.it/883b0tgdgjc81,84,1642551893.0,andy18cruz,0.99,/r/rally/comments/s7cgr1/very_different_driving_styles_in_monte_love_it/,rally,268448,2
Hello!! Here are a few more rally dioramas that I developed scene my last post. Hope you like theme.,1568,mkrmek,https://www.reddit.com/gallery/mkrmek,68,1617647965.0,Pedjogon,0.99,/r/rally/comments/mkrmek/hello_here_are_a_few_more_rally_dioramas_that_i/,rally,268448,2
<3,1574,f3qq1k,https://i.redd.it/fl6o88cwgvg41.jpg,25,1581678559.0,SpadoKln,0.99,/r/rally/comments/f3qq1k/3/,rally,268448,2
Four victories in World Rally Championship. She also won Pikes Peak Hillclimb.,1572,ly53y0,https://i.redd.it/wwhidluuc5l61.jpg,131,1614922720.0,CiprianDerradeiros,0.98,/r/rally/comments/ly53y0/four_victories_in_world_rally_championship_she/,rally,268448,2
"Found this on Instagram, and just look at it!",1555,rs8p66,https://v.redd.it/ybs329gt4q881,84,1640889366.0,VitorAntonio10,0.99,/r/rally/comments/rs8p66/found_this_on_instagram_and_just_look_at_it/,rally,268448,2
Allow me to post one of the best KKK's quotes,1552,fsvuxa,https://i.redd.it/72ykz1e446q41.jpg,29,1585730071.0,SpadoKln,0.99,/r/rally/comments/fsvuxa/allow_me_to_post_one_of_the_best_kkks_quotes/,rally,268448,2
"First World Stratos Meeting, June 2016, Biella, Italy",1518,g44o5x,https://i.redd.it/xgmivyozqqt41.jpg,31,1587287446.0,SpadoKln,1.0,/r/rally/comments/g44o5x/first_world_stratos_meeting_june_2016_biella_italy/,rally,268448,2
Left or right! 🤣🤣,1499,jajhr9,https://v.redd.it/mfl8qz5dpws51,32,1602614252.0,Zugrum,0.99,/r/rally/comments/jajhr9/left_or_right/,rally,268448,2
Until the accidents came,1445,glzyrd,https://i.redd.it/k162xcuihiz41.jpg,44,1589802492.0,littlemorven,0.99,/r/rally/comments/glzyrd/until_the_accidents_came/,rally,268448,2
In car video of my Olympus crash. Crash started at around 50mph,1423,ugw4fd,https://v.redd.it/6c1rincwu3x81,77,1651515821.0,mattdingo,0.99,/r/rally/comments/ugw4fd/in_car_video_of_my_olympus_crash_crash_started_at/,rally,268448,2
We accidentally jumped a Honda Fit 80 feet at Rally Colorado last weekend and I couldn’t stop laughing afterwards 😆,1412,wai62g,https://v.redd.it/ula15afceee91,62,1659034848.0,Rally_kj,0.99,/r/rally/comments/wai62g/we_accidentally_jumped_a_honda_fit_80_feet_at/,rally,268448,2
"My first rally car, who knew it'd be so thirsty 😅",1406,qq3nv7,https://i.redd.it/vxk0bqzinky71.jpg,51,1636464470.0,Zealousideal-Fun9663,0.99,/r/rally/comments/qq3nv7/my_first_rally_car_who_knew_itd_be_so_thirsty/,rally,268448,2
Solid giggle,1393,eufeia,https://i.redd.it/0a4wt1i8o7d41.jpg,22,1580082917.0,FedoraSmoker,0.99,/r/rally/comments/eufeia/solid_giggle/,rally,268448,2
Ford Fiesta WRC chased by helicopter.,1388,fn5kf1,https://i.redd.it/tx4eopab0ao41.jpg,15,1584905523.0,Zugrum,0.99,/r/rally/comments/fn5kf1/ford_fiesta_wrc_chased_by_helicopter/,rally,268448,2
2006 Subaru Impreza S12 WRC,1382,ldvfex,https://i.redd.it/rbw6lpja7uf61.jpg,24,1612608433.0,VitorAntonio10,0.99,/r/rally/comments/ldvfex/2006_subaru_impreza_s12_wrc/,rally,268448,2
We had a bit of a close call at the end of SS5 at SOFR today! Pulled through tho and we are leading class by 3 mins!!,1367,v9lyuq,https://v.redd.it/vs3zi2qh2w491,47,1654908410.0,Rally_kj,1.0,/r/rally/comments/v9lyuq/we_had_a_bit_of_a_close_call_at_the_end_of_ss5_at/,rally,268448,2
Evolution,1353,gp3nq8,https://i.redd.it/2q4xlwla7i051.jpg,95,1590234906.0,CiprianDerradeiros,0.96,/r/rally/comments/gp3nq8/evolution/,rally,268448,2
When in doubt....flat out! Colin McRae doing his thing,1348,118cpak,https://v.redd.it/p0godhzgpmja1,44,1677005203.0,dannybluey,0.99,/r/rally/comments/118cpak/when_in_doubtflat_out_colin_mcrae_doing_his_thing/,rally,268448,2
"My latest project. WRC Citroën DS3 S. Loeb 1/32 Confurco/Fafe, Rally Portugal. Hope you enjoy it. 😊",1323,n45znf,https://www.reddit.com/gallery/n45znf,53,1620072624.0,Pedjogon,0.99,/r/rally/comments/n45znf/my_latest_project_wrc_citroën_ds3_s_loeb_132/,rally,268448,2
Mads Østberg about the Pirelli gravel tyres,1328,ntga9t,https://v.redd.it/b1wy84ukll371,80,1622964663.0,RallyerSkates,1.0,/r/rally/comments/ntga9t/mads_østberg_about_the_pirelli_gravel_tyres/,rally,268448,2
Hey Group! Love to share my latest Diorama Projects! Hope you enjoy...,1315,10awlao,https://www.instagram.com/dioramas_goncalves/,87,1673622000.0,Pedjogon,0.99,/r/rally/comments/10awlao/hey_group_love_to_share_my_latest_diorama/,rally,268448,2
Patrick Snijers in 1988 around Manx.,1290,k7rsfw,https://v.redd.it/x6paapbasj361,50,1607252245.0,VitorAntonio10,1.0,/r/rally/comments/k7rsfw/patrick_snijers_in_1988_around_manx/,rally,268448,2
"One of the fastest sections from the Olympus Rally this past weekend. Car is a 2005 Subaru STI on Reiger suspension. Awesome weekend, as we won the Limited 4WD class!",1287,udhr7l,https://v.redd.it/4vqc1niov5w81,48,1651104451.0,DylanMurcottRacing,1.0,/r/rally/comments/udhr7l/one_of_the_fastest_sections_from_the_olympus/,rally,268448,2
Damn tht garage 😍😍,1240,g54spf,https://i.redd.it/ivo7dbdve2u41.jpg,37,1587428650.0,Zugrum,0.99,/r/rally/comments/g54spf/damn_tht_garage/,rally,268448,2
We jumped 140 feet in our Datsun 1200 at Rallye Baie Des Chaleurs this weekend as well as taking the overall 2WD win!!,1226,vs7ukj,https://www.reddit.com/gallery/vs7ukj,34,1657054197.0,Rally_kj,1.0,/r/rally/comments/vs7ukj/we_jumped_140_feet_in_our_datsun_1200_at_rallye/,rally,268448,2
2023 Season starts with a bang,1229,10gjadk,https://i.redd.it/pty1547yi4da1.jpg,38,1674177494.0,andy18cruz,1.0,/r/rally/comments/10gjadk/2023_season_starts_with_a_bang/,rally,268448,2
Love using it as my daily lately 😅,1205,r3e341,https://i.redd.it/1ngcy2ce95281.jpg,46,1638021508.0,Zealousideal-Fun9663,0.99,/r/rally/comments/r3e341/love_using_it_as_my_daily_lately/,rally,268448,2
Never give up!,1196,h04ug1,https://i.redd.it/yupy8m3dv0451.jpg,31,1591768476.0,Racing_Spirit,1.0,/r/rally/comments/h04ug1/never_give_up/,rally,268448,2
Sold the house to pay for the gas. Smart choices 🤓,1193,rcddi2,https://i.redd.it/nqwbhn7w9h481.jpg,24,1639038652.0,Zealousideal-Fun9663,0.99,/r/rally/comments/rcddi2/sold_the_house_to_pay_for_the_gas_smart_choices/,rally,268448,2
"if in doubt, flat out",1188,q1bnpe,https://v.redd.it/7wkfc0f5var71,35,1633372238.0,Lieutenant_Bacon,1.0,/r/rally/comments/q1bnpe/if_in_doubt_flat_out/,rally,268448,2
Just Saying... :(,1186,oat85i,https://i.redd.it/zmof4f08ad871.png,58,1625043225.0,Testiercactus94,0.92,/r/rally/comments/oat85i/just_saying/,rally,268448,2
"I present to you, my LEGO replica of the legendary S1 Quattro!",1188,yv46jo,https://reb.li/m/45938,34,1668442710.0,Pinguuuuuuuuuuu,0.98,/r/rally/comments/yv46jo/i_present_to_you_my_lego_replica_of_the_legendary/,rally,268448,2
"I made a fan art tribute to Michèle Mouton, the Black Volcano of Group B and the Queen of rallying.",1174,sxuwex,https://i.redd.it/4clbh82j57j81.png,54,1645453952.0,ShorePlain,0.99,/r/rally/comments/sxuwex/i_made_a_fan_art_tribute_to_michèle_mouton_the/,rally,268448,2
True story,1171,iuocmp,https://i.redd.it/qu83t018vqn51.jpg,15,1600364316.0,littlemorven,0.98,/r/rally/comments/iuocmp/true_story/,rally,268448,2
*while intoxicated,1171,fscpea,https://i.redd.it/9qryn909d0q41.jpg,52,1585660498.0,garagehirohata,0.99,/r/rally/comments/fscpea/while_intoxicated/,rally,268448,2
Petter Solberg and his Subaru Impreza,1155,fw972k,https://i.redd.it/a9r040z85ar41.jpg,27,1586214724.0,Zugrum,0.99,/r/rally/comments/fw972k/petter_solberg_and_his_subaru_impreza/,rally,268448,2
"""Testing"" the SVXs ability to launch on gravel. It's no missile but the flat 6 sounds good.",1148,fm99b2,https://v.redd.it/fl0mnrclcyn41,58,1584764433.0,Nabell531,1.0,/r/rally/comments/fm99b2/testing_the_svxs_ability_to_launch_on_gravel_its/,rally,268448,2
Spotted this today,1116,ig8ikn,https://i.redd.it/lmfyf1jz54j51.jpg,21,1598346078.0,littlemorven,0.99,/r/rally/comments/ig8ikn/spotted_this_today/,rally,268448,2
Education,1105,ajnldu,https://i.redd.it/4pl0ep9xljc21.jpg,15,1548410514.0,RaeGun7,0.97,/r/rally/comments/ajnldu/education/,rally,268448,2
Getting some practice in for the 2021 season.,1099,jrwug6,https://v.redd.it/kawhub604iy51,37,1605052699.0,DylanMurcottRacing,1.0,/r/rally/comments/jrwug6/getting_some_practice_in_for_the_2021_season/,rally,268448,2
The backs of Lancia Stratos,1097,pzvz64,https://i.redd.it/3h1yzyn4p1r71.jpg,14,1633184173.0,AnonymousWaterBucket,1.0,/r/rally/comments/pzvz64/the_backs_of_lancia_stratos/,rally,268448,2
Subaru WRX at the 2022 Goodwood Festival of Speed,1094,vtbz0x,https://i.redd.it/zwslzzozt4a91.jpg,56,1657175636.0,volfan1983xxx,0.98,/r/rally/comments/vtbz0x/subaru_wrx_at_the_2022_goodwood_festival_of_speed/,rally,268448,2
Reverse entry,1085,cd230w,https://v.redd.it/floku73ja9a31,21,1563104470.0,duncadelic,1.0,/r/rally/comments/cd230w/reverse_entry/,rally,268448,2
"Gigi Galli vs Ken Block - Same junction, different styles - Rallylegend 2019",1084,dj44dm,https://v.redd.it/b920gwbcp2t31,101,1571305958.0,SpadoKln,0.99,/r/rally/comments/dj44dm/gigi_galli_vs_ken_block_same_junction_different/,rally,268448,2
Are you sure brakes are at the correct temperature?,1079,g0r5p0,https://i.redd.it/e2x70yqjcns41.jpg,35,1586810424.0,Zugrum,0.99,/r/rally/comments/g0r5p0/are_you_sure_brakes_are_at_the_correct_temperature/,rally,268448,2
Been searching for a new permanent codriver. This new guy seems promising,1073,ht30zi,https://i.redd.it/p4b5wdlw6hb51.jpg,26,1595016992.0,mattdingo,0.99,/r/rally/comments/ht30zi/been_searching_for_a_new_permanent_codriver_this/,rally,268448,2
Rally was crazy in 1981,1066,yvxlbr,https://i.redd.it/5qkqwll9c40a1.jpg,21,1668519742.0,wigovsky,0.99,/r/rally/comments/yvxlbr/rally_was_crazy_in_1981/,rally,268448,2
I wonder how many people sent letters to lancia to make a new delta...,1072,ei26dx,https://i.redd.it/waw06f19oy741.jpg,39,1577794722.0,littlemorven,0.99,/r/rally/comments/ei26dx/i_wonder_how_many_people_sent_letters_to_lancia/,rally,268448,2
Why they were different,1056,fqonkz,https://i.redd.it/bkv03tsp9gp41.jpg,23,1585417172.0,Zugrum,0.95,/r/rally/comments/fqonkz/why_they_were_different/,rally,268448,2
SOME CARS WERE BORN TO BE FAST. STRATOS WAS BORN TO WIN.,1052,gsfu6j,https://i.redd.it/xmqeaqtwvk151.jpg,30,1590703240.0,CashRollFresh,0.99,/r/rally/comments/gsfu6j/some_cars_were_born_to_be_fast_stratos_was_born/,rally,268448,2
A S11 WRC Subaru Impreza. Doing actual Subaru things.,1038,bcneg1,https://i.redd.it/5ct2d8zjxyr21.jpg,20,1555133750.0,Davecoupe,0.99,/r/rally/comments/bcneg1/a_s11_wrc_subaru_impreza_doing_actual_subaru/,rally,268448,2
New to this sport but hope you like this,1039,ecualv,https://i.redd.it/tc3uzigttl541.jpg,12,1576767506.0,littlemorven,0.98,/r/rally/comments/ecualv/new_to_this_sport_but_hope_you_like_this/,rally,268448,2
Rally Diorama 1994 Seixoso 1/43 Toyota Celica Portugal.,1031,zfwabm,https://v.redd.it/vepaepf9tn4a1,16,1670498871.0,Pedjogon,0.99,/r/rally/comments/zfwabm/rally_diorama_1994_seixoso_143_toyota_celica/,rally,268448,2
Aaron Windus (Australia) showing how to scando on Tarmac.,1028,dkrai3,https://v.redd.it/vl5uad8izrt31,33,1571611960.0,BengalDamian,1.0,/r/rally/comments/dkrai3/aaron_windus_australia_showing_how_to_scando_on/,rally,268448,2
To finish the year in the best way! My last project of the year! Hyundai i20 1/43. Happy New Year.,1029,zz03fc,https://www.reddit.com/gallery/zz03fc,54,1672405585.0,Pedjogon,0.99,/r/rally/comments/zz03fc/to_finish_the_year_in_the_best_way_my_last/,rally,268448,2
Who doesn’t love a flying rallycar. Here are a few that I’ve captured this year.,1016,x6gpdv,https://www.reddit.com/gallery/x6gpdv,36,1662385828.0,Davecoupe,1.0,/r/rally/comments/x6gpdv/who_doesnt_love_a_flying_rallycar_here_are_a_few/,rally,268448,2
Today marks 15 years since Burnsie passed. RIP.,1021,k0rakc,https://i.redd.it/o82axp4oqd161.jpg,20,1606307260.0,Davecoupe,1.0,/r/rally/comments/k0rakc/today_marks_15_years_since_burnsie_passed_rip/,rally,268448,2
Anyone seen this Red Bull rally advert?,1018,jfxjh5,https://v.redd.it/qbcpzsksomu51,21,1603364669.0,Mudflap4,0.99,/r/rally/comments/jfxjh5/anyone_seen_this_red_bull_rally_advert/,rally,268448,2
The new R5 Fiesta breaks cover for testing.,1011,bron4v,https://i.redd.it/syo4wyhpirz21.jpg,43,1558530794.0,Davecoupe,0.99,/r/rally/comments/bron4v/the_new_r5_fiesta_breaks_cover_for_testing/,rally,268448,2
Hoonigan's tribute video of Ken Block is the #1 most trending video on YouTube!,1005,10fr6qm,https://i.redd.it/zei9uxnenyca1.png,11,1674098856.0,OnlyTheCrumbliest---,0.97,/r/rally/comments/10fr6qm/hoonigans_tribute_video_of_ken_block_is_the_1/,rally,268448,2
Well the office decor has changed again. This time we have Colin McRae's 1997 Rally GB winning Impreza with us for a few months - going to enjoy lunch with a view today.,1001,qfcj9s,https://www.reddit.com/gallery/qfcj9s,23,1635152409.0,MilesMyles,1.0,/r/rally/comments/qfcj9s/well_the_office_decor_has_changed_again_this_time/,rally,268448,2
Spotted this beautiful Subaru earlier today,994,xb2yen,https://www.reddit.com/gallery/xb2yen,18,1662851738.0,Ner02k,0.98,/r/rally/comments/xb2yen/spotted_this_beautiful_subaru_earlier_today/,rally,268448,2
a Toyota Corolla WRC drifting,987,o1wv5b,https://i.redd.it/rah8pihnrt571.jpg,15,1623935391.0,AnonymousWaterBucket,0.99,/r/rally/comments/o1wv5b/a_toyota_corolla_wrc_drifting/,rally,268448,2
Rallying in the F1 Monaco circuit? It happened in a Super Special Stage in 2008.,984,kjzzmm,https://v.redd.it/eyuhrzdbhc761,33,1608907167.0,VitorAntonio10,1.0,/r/rally/comments/kjzzmm/rallying_in_the_f1_monaco_circuit_it_happened_in/,rally,268448,2
Who says rally cars aren’t practical,980,b4y7co,https://i.redd.it/7b7dl5hbf3o21.jpg,32,1553444761.0,RaeGun7,0.99,/r/rally/comments/b4y7co/who_says_rally_cars_arent_practical/,rally,268448,2
1984 24h Ypres Rally,982,rqdk99,https://v.redd.it/ja3biap4o9881,35,1640690010.0,VitorAntonio10,1.0,/r/rally/comments/rqdk99/1984_24h_ypres_rally/,rally,268448,2
Pulled this out of the garage after 13 years. Some tlc needed but it’s up and running again. Hope to have it ready for a rally mid April,973,f86r6q,https://i.redd.it/qexfazacumi41.jpg,25,1582445821.0,johno-19,0.99,/r/rally/comments/f86r6q/pulled_this_out_of_the_garage_after_13_years_some/,rally,268448,2
"A manga concept I'm working on ❤️ Set in 1983, we follow two young rally enthusiast with dreams of being the fastest drivers in the world, practicing and competing in local rallies in their father's new Audi Quattro.",973,ybta5n,https://i.redd.it/8v66qb3iynv91.png,64,1666559994.0,ShorePlain,0.98,/r/rally/comments/ybta5n/a_manga_concept_im_working_on_set_in_1983_we/,rally,268448,2
We nearly killed a spectator at Charlevoix Group B style😂,966,ynedro,https://v.redd.it/dyk6e0gts8y91,43,1667702137.0,Rally_kj,0.99,/r/rally/comments/ynedro/we_nearly_killed_a_spectator_at_charlevoix_group/,rally,268448,2
Livery of Ford Puma Rally1 for 2022,970,s4oxc4,https://www.reddit.com/gallery/s4oxc4,27,1642266591.0,pzkenny,0.99,/r/rally/comments/s4oxc4/livery_of_ford_puma_rally1_for_2022/,rally,268448,2
Röhrl and Audi on Montecarlo 1985,962,f1ez1w,https://i.redd.it/tl0rw0w8pyf41.jpg,16,1581281840.0,Zugrum,1.0,/r/rally/comments/f1ez1w/röhrl_and_audi_on_montecarlo_1985/,rally,268448,2
Roaring monster coming right towards me,962,u699lp,https://v.redd.it/bh9v1brjd9u81,38,1650275095.0,tct99xx,1.0,/r/rally/comments/u699lp/roaring_monster_coming_right_towards_me/,rally,268448,2
Group S MR2 at the Toyota museum Tokyo,955,b5wbe6,https://i.redd.it/vznhzknbijo21.jpg,20,1553639481.0,stonesfromthesky,1.0,/r/rally/comments/b5wbe6/group_s_mr2_at_the_toyota_museum_tokyo/,rally,268448,2
Singer Porsche 911 safari,954,o5nlw7,https://i.redd.it/lvywtuprnt671.png,16,1624369788.0,AnonymousWaterBucket,0.99,/r/rally/comments/o5nlw7/singer_porsche_911_safari/,rally,268448,2
Richard Burns and his Impreza competing in the Welsh rally back in 2001.,953,knmpp3,https://v.redd.it/i18ze71tmh861,27,1609405381.0,VitorAntonio10,1.0,/r/rally/comments/knmpp3/richard_burns_and_his_impreza_competing_in_the/,rally,268448,2
RIP Ken Block 😞,955,101vu7i,https://www.reddit.com/gallery/101vu7i,17,1672713760.0,OnlyTheCrumbliest---,0.99,/r/rally/comments/101vu7i/rip_ken_block/,rally,268448,2
What a control 🤤🤤,947,j8oztf,https://v.redd.it/5o0tn83f3bs51,31,1602352618.0,Zugrum,0.99,/r/rally/comments/j8oztf/what_a_control/,rally,268448,2
Im about to bust a nut,953,r2sbug,https://i.redd.it/qqisj06s5z181.jpg,24,1637947650.0,ill_have_2_number_9s,0.99,/r/rally/comments/r2sbug/im_about_to_bust_a_nut/,rally,268448,2
1986 Audi Sport quattro S1,947,ekdp2c,https://i.redd.it/ecdwmg2n0z841.jpg,13,1578234735.0,Apple_Slipper,1.0,/r/rally/comments/ekdp2c/1986_audi_sport_quattro_s1/,rally,268448,2
Group B Ford RS200 marker drawing I did,941,u79vr5,https://i.redd.it/9x5ibpi1oiu81.jpg,18,1650387565.0,PloopHead,0.99,/r/rally/comments/u79vr5/group_b_ford_rs200_marker_drawing_i_did/,rally,268448,2
After 2 months of work my Lego Stratos is finished!,943,nlilej,https://www.reddit.com/gallery/nlilej,45,1622039909.0,Pinguuuuuuuuuuu,1.0,/r/rally/comments/nlilej/after_2_months_of_work_my_lego_stratos_is_finished/,rally,268448,2
Some images I took at Lombard Rally Chepstow,934,wzqv1g,https://www.reddit.com/gallery/wzqv1g,42,1661677180.0,woodyfuckinpecker,1.0,/r/rally/comments/wzqv1g/some_images_i_took_at_lombard_rally_chepstow/,rally,268448,2
A neat Ford Escort RS Cosworth.,934,kt7ee5,https://i.redd.it/v64n45kea5a61.jpg,10,1610127567.0,VitorAntonio10,0.99,/r/rally/comments/kt7ee5/a_neat_ford_escort_rs_cosworth/,rally,268448,2
"This is are some of best the footages of pure rally from Colin McRae. I bet you never saw this clips,so enjoy as I did!",926,lyp7sl,https://v.redd.it/gp1pbxs5qal61,36,1614988459.0,VitorAntonio10,0.99,/r/rally/comments/lyp7sl/this_is_are_some_of_best_the_footages_of_pure/,rally,268448,2
My Lego model of the Delta HF Integrale 16V,929,occ8mm,https://www.reddit.com/gallery/occ8mm,16,1625239077.0,Pinguuuuuuuuuuu,1.0,/r/rally/comments/occ8mm/my_lego_model_of_the_delta_hf_integrale_16v/,rally,268448,2
Tommi Mäkinen - Wales Rally GB 2003,928,hwfxss,https://i.redd.it/bjv26cps2mc51.jpg,15,1595512021.0,Mudflap4,1.0,/r/rally/comments/hwfxss/tommi_mäkinen_wales_rally_gb_2003/,rally,268448,2
David Higgins with the scandanavian flick,927,9nvipq,https://v.redd.it/88z2a9qamzr11,27,1539451843.0,Nabell531,0.99,/r/rally/comments/9nvipq/david_higgins_with_the_scandanavian_flick/,rally,268448,2
Can't get enough of all of this beauty,920,gvv3xn,https://v.redd.it/s733spydip251,23,1591195088.0,SpadoKln,1.0,/r/rally/comments/gvv3xn/cant_get_enough_of_all_of_this_beauty/,rally,268448,2
It may only be rally photography but hopefully the 3rd generation of rally photographer in our family has started.,921,xcf59s,https://www.reddit.com/gallery/xcf59s,23,1662995009.0,Davecoupe,0.99,/r/rally/comments/xcf59s/it_may_only_be_rally_photography_but_hopefully/,rally,268448,2
Saw this awesome Subaru today,921,z3u7w0,https://www.reddit.com/gallery/z3u7w0,21,1669322887.0,Ner02k,0.98,/r/rally/comments/z3u7w0/saw_this_awesome_subaru_today/,rally,268448,2
"I believe this was a repost, but I had it saved from nearly a year ago, so it's fresh.",919,o4hpeg,https://i.redd.it/oxvwue3x7i671.jpg,15,1624231259.0,OnlyTheCrumbliest---,0.99,/r/rally/comments/o4hpeg/i_believe_this_was_a_repost_but_i_had_it_saved/,rally,268448,2
"Well, my time at olympus rally could have gone better. 1st in class/5th overall until an off on the final stage.",922,ubqi28,https://v.redd.it/6r0nzlgimpv81,39,1650907671.0,mattdingo,1.0,/r/rally/comments/ubqi28/well_my_time_at_olympus_rally_could_have_gone/,rally,268448,2
Queen Stratos roaring on Tuscan gravel,917,iivcpt,https://v.redd.it/3jjz7hjdxyj51,11,1598718543.0,SpadoKln,1.0,/r/rally/comments/iivcpt/queen_stratos_roaring_on_tuscan_gravel/,rally,268448,2
"One of my favourite photos, Juha Kankkunen at Safari Rally 1993",914,h0vr6k,https://i.redd.it/850sxe7dy8451.jpg,18,1591866751.0,Racing_Spirit,1.0,/r/rally/comments/h0vr6k/one_of_my_favourite_photos_juha_kankkunen_at/,rally,268448,2
"Naked, liveryless, testing spec rallycars are the best rallycars.",911,r55q9f,https://www.reddit.com/gallery/r55q9f,23,1638220129.0,Davecoupe,1.0,/r/rally/comments/r55q9f/naked_liveryless_testing_spec_rallycars_are_the/,rally,268448,2
little problem,918,z5f2tm,https://v.redd.it/tgizabo8fc2a1,32,1669489279.0,chachinunhez,1.0,/r/rally/comments/z5f2tm/little_problem/,rally,268448,2
A legendary photo of Kimi from his rally days (2010),908,ro96fi,https://i.redd.it/qc9vlzgujm781.jpg,19,1640436268.0,CashRollFresh,0.99,/r/rally/comments/ro96fi/a_legendary_photo_of_kimi_from_his_rally_days_2010/,rally,268448,2
1976 Alfa Romeo Alfetta GTV Rally Car,905,f7r08z,https://i.redd.it/xdn7kfp7fgi41.jpg,14,1582368086.0,Apple_Slipper,0.99,/r/rally/comments/f7r08z/1976_alfa_romeo_alfetta_gtv_rally_car/,rally,268448,2
Lancia Delta HF Integrale Team Grifone,901,md5sxt,https://i.redd.it/cx1uafqe38p61.jpg,19,1616699256.0,VitorAntonio10,1.0,/r/rally/comments/md5sxt/lancia_delta_hf_integrale_team_grifone/,rally,268448,2
"Took my S13 Silvia put for the first time in over a year last weekend. Did some skids, won a trophy, had a ball. 5 pics",900,yghpsn,https://www.reddit.com/gallery/yghpsn,44,1667044501.0,BengalDamian,1.0,/r/rally/comments/yghpsn/took_my_s13_silvia_put_for_the_first_time_in_over/,rally,268448,2
saw these today,902,vungzw,https://www.reddit.com/gallery/vungzw,19,1657321624.0,rallyboi768,1.0,/r/rally/comments/vungzw/saw_these_today/,rally,268448,2
"Dani Sordo warming his Hyundai's tyres up just before a stage of Rally di Monza, back in 2016.",905,l39an9,https://v.redd.it/xo0mecd1z1d61,25,1611395053.0,VitorAntonio10,1.0,/r/rally/comments/l39an9/dani_sordo_warming_his_hyundais_tyres_up_just/,rally,268448,2
my latest rally mini Dioramas enjoy.,897,10zmxoh,https://instagram.com/dioramas_goncalves?igshid=YmMyMTA2M2Y=,20,1676119939.0,Pedjogon,0.99,/r/rally/comments/10zmxoh/my_latest_rally_mini_dioramas_enjoy/,rally,268448,2
This (one of 220 models totally built) 1984 Audi Sport Quattro recently sold for 425.000 euros to a Portuguese collector,900,e62waq,https://i.redd.it/2oonnakxmn241.jpg,28,1575481860.0,SpadoKln,1.0,/r/rally/comments/e62waq/this_one_of_220_models_totally_built_1984_audi/,rally,268448,2
Transchaco rally Paraguay 🇵🇾,892,wpaax6,https://v.redd.it/6ody7ts2vxh91,36,1660596057.0,chachinunhez,0.99,/r/rally/comments/wpaax6/transchaco_rally_paraguay/,rally,268448,2
