title,score,id,url,num_comments,created,author,upvote_ratio,permalink,subreddit,subreddit_subscribers,depth
Upvote K9 for 54 years of good luck.,13337,8tqfe9,https://i.redd.it/sf3l0cuvc5611.jpg,55,1529932586.0,MajorCviklje,0.93,/r/doctorwho/comments/8tqfe9/upvote_k9_for_54_years_of_good_luck/,doctorwho,504481,2
this blew my 15 year old mind back in the day,9984,wvml5x,https://v.redd.it/4ogrh06z9gj91,519,1661254933.0,bewarethechameleon,0.96,/r/doctorwho/comments/wvml5x/this_blew_my_15_year_old_mind_back_in_the_day/,doctorwho,504481,2
First look at the 13th Doctor and their TARDIS,7641,7bt5en,https://i.redd.it/gj7li8d37ywz.jpg,1662,1510232504.0,JakeM917,0.84,/r/doctorwho/comments/7bt5en/first_look_at_the_13th_doctor_and_their_tardis/,doctorwho,504481,2
The Doctors,7425,fil0fc,https://i.redd.it/9l9rnfaa0om41.jpg,171,1584203312.0,ucurucumuhammed,0.98,/r/doctorwho/comments/fil0fc/the_doctors/,doctorwho,504481,2
I've regenerated 3 years in a row for the same convention. What do you think?,7426,89yy3d,https://i.redd.it/jkujl3wyt2q01.jpg,274,1522928335.0,TheYoungGriffin,0.9,/r/doctorwho/comments/89yy3d/ive_regenerated_3_years_in_a_row_for_the_same/,doctorwho,504481,2
On this day 13 years ago 9 regenerated into 10!,7224,8s249m,https://i.redd.it/12gyzgbm5t411.png,210,1529348792.0,BigTimeSuperhero96,0.94,/r/doctorwho/comments/8s249m/on_this_day_13_years_ago_9_regenerated_into_10/,doctorwho,504481,2
Team TARDIS 2010,6657,88ksb2,https://i.redd.it/wp3gvxqma5p01.jpg,133,1522522417.0,MajorCviklje,0.93,/r/doctorwho/comments/88ksb2/team_tardis_2010/,doctorwho,504481,2
The Doctor's just chilling,6477,jhr0p7,https://i.redd.it/gsmktynvs7v51.jpg,187,1603620273.0,Incarcerator__,0.97,/r/doctorwho/comments/jhr0p7/the_doctors_just_chilling/,doctorwho,504481,2
This Shed is Incredible,6332,l1huij,https://i.redd.it/ofzjwvt5sjc61.jpg,88,1611174797.0,bartarton,0.99,/r/doctorwho/comments/l1huij/this_shed_is_incredible/,doctorwho,504481,2
Never skip 9!,6294,8nspzj,https://i.redd.it/l5nnjgvule111.jpg,218,1527866719.0,BigTimeSuperhero96,0.96,/r/doctorwho/comments/8nspzj/never_skip_9/,doctorwho,504481,2
[SPOILERS] MEGATHREAD: The 13th Doctor is....,6237,6nmir1,https://www.reddit.com/r/doctorwho/comments/6nmir1/spoilers_megathread_the_13th_doctor_is/,19407,1500216450.0,pcjonathan,0.85,/r/doctorwho/comments/6nmir1/spoilers_megathread_the_13th_doctor_is/,doctorwho,504481,2
A quote that'll stay with me forever.,6002,aqwoub,https://i.redd.it/lb4dzi2ukqg21.jpg,115,1550238304.0,Lowcrbnaman,0.97,/r/doctorwho/comments/aqwoub/a_quote_thatll_stay_with_me_forever/,doctorwho,504481,2
"Turn Left is criminally underrated. ""Labour camps. That's what they called them last time. It's happening again."" The world without the doctor is terrifying.",5992,fcxlw6,https://v.redd.it/4z7ozw5tlhk41,485,1583254880.0,Rubixsco,0.97,/r/doctorwho/comments/fcxlw6/turn_left_is_criminally_underrated_labour_camps/,doctorwho,504481,2
Tried my best to cosplay my favourite companion😩,5988,v12efn,https://www.reddit.com/gallery/v12efn,368,1653923664.0,Ok_Public_2094,0.95,/r/doctorwho/comments/v12efn/tried_my_best_to_cosplay_my_favourite_companion/,doctorwho,504481,2
This would've been amazing!,5789,6liaho,https://i.redd.it/yqztnuiwdv7z.jpg,386,1499302270.0,Jackmac32,0.9,/r/doctorwho/comments/6liaho/this_wouldve_been_amazing/,doctorwho,504481,2
"For our senior project we have to sculpt, mould and paint our own rubber latex mask. It was an easy decision for me.",5756,443jdz,https://imgur.com/jW52CfZ,187,1454556520.0,Skissored,0.91,/r/doctorwho/comments/443jdz/for_our_senior_project_we_have_to_sculpt_mould/,doctorwho,504481,2
Ah Wilf. If only his time in the Tardis wasn't so short lived.,5672,atgop6,https://i.redd.it/6tcmb2viz3i21.jpg,142,1550836468.0,TheMasterMelon-,0.98,/r/doctorwho/comments/atgop6/ah_wilf_if_only_his_time_in_the_tardis_wasnt_so/,doctorwho,504481,2
Rewatching Doctor Who. This hit me hard!,5629,dfj1a9,https://i.redd.it/pyoaureifjr31.jpg,117,1570636610.0,Taliendris,0.98,/r/doctorwho/comments/dfj1a9/rewatching_doctor_who_this_hit_me_hard/,doctorwho,504481,2
The reunion,5627,9sy2pg,http://i.imgur.com/RLCQf6U.jpg,193,1540987505.0,bowsmountainer,0.97,/r/doctorwho/comments/9sy2pg/the_reunion/,doctorwho,504481,2
Billy Shipton was amazing side character,5466,m49g3o,https://i.redd.it/ittb2rysltm61.png,131,1615652242.0,Conqutih,0.98,/r/doctorwho/comments/m49g3o/billy_shipton_was_amazing_side_character/,doctorwho,504481,2
I think she is the best Master. What do you think?,5368,fka9nr,https://i.redd.it/g4g1b60yz9n41.jpg,381,1584469548.0,ucurucumuhammed,0.93,/r/doctorwho/comments/fka9nr/i_think_she_is_the_best_master_what_do_you_think/,doctorwho,504481,2
Welcome Jodie Whittaker!,5358,7mm2eb,https://i.redd.it/2is6xag9en601.jpg,370,1514460217.0,MajorCviklje,0.93,/r/doctorwho/comments/7mm2eb/welcome_jodie_whittaker/,doctorwho,504481,2
If Doctor Who was an American show,5350,erev4x,https://i.redd.it/efb9vjzhfyb41.jpg,680,1579535176.0,DGH1993,0.94,/r/doctorwho/comments/erev4x/if_doctor_who_was_an_american_show/,doctorwho,504481,2
Really loved this trio. Anyone else wish they got another series together?,5340,kqbnfb,https://i.redd.it/ajsevroaac961.jpg,290,1609776433.0,Beniebabom,0.96,/r/doctorwho/comments/kqbnfb/really_loved_this_trio_anyone_else_wish_they_got/,doctorwho,504481,2
Matt on his first day with David on his last,5307,l5ogw3,https://www.reddit.com/gallery/l5ogw3,162,1611697329.0,Jackmac32,0.99,/r/doctorwho/comments/l5ogw3/matt_on_his_first_day_with_david_on_his_last/,doctorwho,504481,2
Happy 52nd birthday to John Barrowman aka Captain Jack Harkness! Keep being fabulous!,5309,azqwad,https://i.redd.it/95to4shd9gl21.jpg,93,1552292618.0,R4wly1997,0.95,/r/doctorwho/comments/azqwad/happy_52nd_birthday_to_john_barrowman_aka_captain/,doctorwho,504481,2
Get a room you two!,5168,b7owe4,https://i.redd.it/um9d7ezw2hp21.jpg,78,1554045933.0,R4wly1997,0.97,/r/doctorwho/comments/b7owe4/get_a_room_you_two/,doctorwho,504481,2
Saved the Doctors life the first time she met him. Made him save a family he was going to abandon. Helped him understand and accept his daughter. Stopped the universe from being destroyed. Donna was one of the most important companions the Doctor ever had.,5094,kvhuxy,https://i.redd.it/3rb3fyrl7ta61.jpg,241,1610417190.0,Jackmac32,0.97,/r/doctorwho/comments/kvhuxy/saved_the_doctors_life_the_first_time_she_met_him/,doctorwho,504481,2
HYPE IS REAL,5080,70hx67,https://i.redd.it/nhs9z3o8y9mz.png,250,1505580484.0,MajorCviklje,0.92,/r/doctorwho/comments/70hx67/hype_is_real/,doctorwho,504481,2
"Posted on Russell T Davies’ Instagram yesterday, this photo was taken in 2009...",5026,e6w005,https://i.redd.it/2ujwf1q84z241.jpg,113,1575620857.0,R4wly1997,0.99,/r/doctorwho/comments/e6w005/posted_on_russell_t_davies_instagram_yesterday/,doctorwho,504481,2
"With the news that Matt Smith is going to be in Star Wars: Episode IX, this image feels appropriate.",5014,9b1mp8,https://img00.deviantart.net/c91e/i/2012/103/c/a/star_wars___doctor_who_crossover_by_drombyb-d4pr7xd.jpg,258,1535482323.0,LegoK9,0.94,/r/doctorwho/comments/9b1mp8/with_the_news_that_matt_smith_is_going_to_be_in/,doctorwho,504481,2
"Don’t get a lot of appreciation for my tattoo where i live since noone knows Doctor Who, what do you think of it?",4955,9o2g37,https://i.redd.it/sc0tmu0dd5s11.jpg,163,1539521185.0,LastofTimelords,0.9,/r/doctorwho/comments/9o2g37/dont_get_a_lot_of_appreciation_for_my_tattoo/,doctorwho,504481,2
"On this day, 10 years ago, Jenna Coleman was announced as the new Doctor Who companion, Clara Oswald!",4945,tjarex,https://i.redd.it/jwgunaf4dqo81.jpg,264,1647865946.0,bowsmountainer,0.97,/r/doctorwho/comments/tjarex/on_this_day_10_years_ago_jenna_coleman_was/,doctorwho,504481,2
I spent the first few days of the new year sculpting and painting this little guy!,4938,5lui7p,https://i.redd.it/8mr8bwhrak7y.jpg,195,1483477591.0,Skissored,0.9,/r/doctorwho/comments/5lui7p/i_spent_the_first_few_days_of_the_new_year/,doctorwho,504481,2
Look what’s in Assassin’s Creed Origins,4904,7ak05h,https://i.redd.it/mpzpvjo11svz.jpg,124,1509721985.0,Mr_Mortus,0.94,/r/doctorwho/comments/7ak05h/look_whats_in_assassins_creed_origins/,doctorwho,504481,2
The Doctor and Ricky!,4887,fgm1o3,https://i.redd.it/9ltnlpnn4xl41.jpg,196,1583877918.0,JakeM917,0.98,/r/doctorwho/comments/fgm1o3/the_doctor_and_ricky/,doctorwho,504481,2
Ya know it just dawned on me that Madame De Pompadour was the original girl who waited,4859,me2k2a,https://i.redd.it/ogbk84hcugp61.jpg,204,1616805170.0,Jackmac32,0.98,/r/doctorwho/comments/me2k2a/ya_know_it_just_dawned_on_me_that_madame_de/,doctorwho,504481,2
Happy 50th Birthday to the legend David Tennant🎉🎉,4842,mt8dg2,https://i.redd.it/43tsex18yvt61.jpg,108,1618731470.0,Incarcerator__,0.99,/r/doctorwho/comments/mt8dg2/happy_50th_birthday_to_the_legend_david_tennant/,doctorwho,504481,2
Happy Birthday to Peter Capaldi!,4835,bd0wkg,https://i.redd.it/0eybrkaq17s21.jpg,87,1555232009.0,Simmonsdude,0.97,/r/doctorwho/comments/bd0wkg/happy_birthday_to_peter_capaldi/,doctorwho,504481,2
Something I've always liked about the Weeping Angels is their ability to break the 4th wall. There are many scenes when they don't move even though nothing seems to be looking at them... except for the audience.,4800,l0gvy4,https://i.redd.it/8wy7f8cqh9c61.jpg,180,1611050491.0,Jackmac32,0.99,/r/doctorwho/comments/l0gvy4/something_ive_always_liked_about_the_weeping/,doctorwho,504481,2
Stained glass dalek...,4794,ezbbmz,https://i.redd.it/t293w55tk4f41.jpg,76,1580917144.0,noir1717,0.99,/r/doctorwho/comments/ezbbmz/stained_glass_dalek/,doctorwho,504481,2
Finally got to meet my favorite person.....in two different forms,4783,9m1lm6,https://i.redd.it/1eh9hlvy6oq11.jpg,99,1538877362.0,elsehamy,0.95,/r/doctorwho/comments/9m1lm6/finally_got_to_meet_my_favorite_personin_two/,doctorwho,504481,2
This is such a great comparison.,4729,6xlotb,https://i.redd.it/f91ctehttgjz.jpg,87,1504356196.0,Jackmac32,0.93,/r/doctorwho/comments/6xlotb/this_is_such_a_great_comparison/,doctorwho,504481,2
"Like he's talking to child Amy, he's so sweet.",4726,fouwqq,https://i.redd.it/wtwjxqltyuo41.png,100,1585159287.0,francisl0007,0.99,/r/doctorwho/comments/fouwqq/like_hes_talking_to_child_amy_hes_so_sweet/,doctorwho,504481,2
I miss Jackie,4688,kr5tzf,https://i.redd.it/2mwbvqxagk961.jpg,129,1609875337.0,bartarton,0.99,/r/doctorwho/comments/kr5tzf/i_miss_jackie/,doctorwho,504481,2
David Tennant says he'd return for DOCTOR WHO's 60th anniversary!,4635,82i5ih,http://wegotthiscovered.com/tv/david-tennant-doctor-who-60th-anniversary/,257,1520367117.0,TheHip141991,0.96,/r/doctorwho/comments/82i5ih/david_tennant_says_hed_return_for_doctor_whos/,doctorwho,504481,2
Doctor Who notice on The London Underground [500 x 667],4561,2cwczt,http://i.imgur.com/2AnqTbV.png,124,1407430955.0,VerGuy,0.91,/r/doctorwho/comments/2cwczt/doctor_who_notice_on_the_london_underground_500_x/,doctorwho,504481,2
this scene always gives me the goosebumps!,4550,vi7n4v,https://v.redd.it/vuyugxmfv6791,219,1655911095.0,bewarethechameleon,0.98,/r/doctorwho/comments/vi7n4v/this_scene_always_gives_me_the_goosebumps/,doctorwho,504481,2
'' Are you my mummy ? '' never gets old,4547,l8u6pz,https://i.redd.it/wawa6vt0zie61.png,94,1612036698.0,Conqutih,0.98,/r/doctorwho/comments/l8u6pz/are_you_my_mummy_never_gets_old/,doctorwho,504481,2
Happy 35th Birthday Jenna Coleman!,4547,mznb84,https://i.redd.it/klhzi97rlpv61.jpg,120,1619526397.0,bowsmountainer,0.99,/r/doctorwho/comments/mznb84/happy_35th_birthday_jenna_coleman/,doctorwho,504481,2
I started to like 12th doctor at this moment,4538,g5o232,https://i.redd.it/gfge7udtn8u41.jpg,237,1587504301.0,Conqutih,0.99,/r/doctorwho/comments/g5o232/i_started_to_like_12th_doctor_at_this_moment/,doctorwho,504481,2
Here's a picture that'll make your day better.,4520,7sv2ji,https://i.redd.it/lxd2ilcnp6c01.jpg,78,1516873933.0,MajorCviklje,0.95,/r/doctorwho/comments/7sv2ji/heres_a_picture_thatll_make_your_day_better/,doctorwho,504481,2
Happy Birthday to Christopher Eccleston!,4519,ar6tix,https://i.redd.it/wyoq71yt1wg21.jpg,82,1550304539.0,Simmonsdude,0.98,/r/doctorwho/comments/ar6tix/happy_birthday_to_christopher_eccleston/,doctorwho,504481,2
Gotta love John Hurt for this...,4429,lbioiy,https://i.redd.it/ggri224xx7f61.jpg,86,1612338930.0,Satrajit0208,0.99,/r/doctorwho/comments/lbioiy/gotta_love_john_hurt_for_this/,doctorwho,504481,2
John Barrowman 'exterminated' outside The Tardis,4411,2ki1ko,http://i.imgur.com/Q8WXRGw.jpg,147,1414443708.0,VerGuy,0.92,/r/doctorwho/comments/2ki1ko/john_barrowman_exterminated_outside_the_tardis/,doctorwho,504481,2
Probably one of my most favorite Christmas episode moments,4402,hcoaia,https://i.redd.it/b7lgmcjp43651.jpg,82,1592667515.0,TheEdgeOfDawn,0.99,/r/doctorwho/comments/hcoaia/probably_one_of_my_most_favorite_christmas/,doctorwho,504481,2
Photo posted by Steven Moffat on his Instagram page the other day...,4400,co1shy,https://i.redd.it/wkdr2h8d4ff31.jpg,179,1565354259.0,R4wly1997,0.98,/r/doctorwho/comments/co1shy/photo_posted_by_steven_moffat_on_his_instagram/,doctorwho,504481,2
Happy 32nd Birthday Jenna Coleman,4393,8fapi8,https://imgur.com/fBzMcpE,180,1524826084.0,bowsmountainer,0.95,/r/doctorwho/comments/8fapi8/happy_32nd_birthday_jenna_coleman/,doctorwho,504481,2
The Doctor & Clara rock out at The Beatles' Abbey Road Crossing,4358,3ljo4y,http://i.imgur.com/dng2YSM.jpg,231,1442661446.0,pcjonathan,0.87,/r/doctorwho/comments/3ljo4y/the_doctor_clara_rock_out_at_the_beatles_abbey/,doctorwho,504481,2
The Doctor with a job.,4348,c0vlav,https://i.redd.it/aqe0wh8wph431.png,69,1560591381.0,IkBenJarrin,0.98,/r/doctorwho/comments/c0vlav/the_doctor_with_a_job/,doctorwho,504481,2
David Bradley with Peter Capaldi on set.,4305,7luoj4,https://i.redd.it/9uddem0isu501.jpg,98,1514113961.0,MajorCviklje,0.93,/r/doctorwho/comments/7luoj4/david_bradley_with_peter_capaldi_on_set/,doctorwho,504481,2
I met 10 and I couldn't contain my excitement.,4284,699cb2,https://i.redd.it/suogviz41jvy.png,109,1493922526.0,bethfox1,0.9,/r/doctorwho/comments/699cb2/i_met_10_and_i_couldnt_contain_my_excitement/,doctorwho,504481,2
"Actors in Doctor Who, Star Trek, and Star Wars",4163,8n9xxv,https://i.imgur.com/2J0oBvw.png,195,1527697486.0,LegoK9,0.97,/r/doctorwho/comments/8n9xxv/actors_in_doctor_who_star_trek_and_star_wars/,doctorwho,504481,2
"“The day is coming when I'll look into that man's eyes, my Doctor, and he won't have the faintest idea who I am. And I think it's going to kill me”...",4111,b4v9e3,https://i.redd.it/iiyjj0vkv1o21.jpg,120,1553426014.0,R4wly1997,0.98,/r/doctorwho/comments/b4v9e3/the_day_is_coming_when_ill_look_into_that_mans/,doctorwho,504481,2
In honour of World Mental Health Day,4094,dfy2k0,https://i.redd.it/wtr5l5qtupr31.jpg,92,1570714402.0,Taliendris,0.99,/r/doctorwho/comments/dfy2k0/in_honour_of_world_mental_health_day/,doctorwho,504481,2
Happy Birthday Jenna Coleman!,4090,g91usq,https://i.redd.it/5azht3wdgdv41.jpg,117,1587998216.0,bowsmountainer,0.98,/r/doctorwho/comments/g91usq/happy_birthday_jenna_coleman/,doctorwho,504481,2
I like how The Doctor reverts back to The First Doctor at The end Of his original regeneration cycle,4086,fatxwp,https://i.redd.it/wt1c71tarnj41.jpg,163,1582892746.0,DGH1993,0.97,/r/doctorwho/comments/fatxwp/i_like_how_the_doctor_reverts_back_to_the_first/,doctorwho,504481,2
this scene will always have a special spot in my heart!,4073,vf48n7,https://v.redd.it/3wx4lnq97d691,121,1655551618.0,bewarethechameleon,0.98,/r/doctorwho/comments/vf48n7/this_scene_will_always_have_a_special_spot_in_my/,doctorwho,504481,2
The Doctor and River...,4048,9vnpi4,https://i.redd.it/9bje0qr02dx11.jpg,172,1541793463.0,R4wly1997,0.97,/r/doctorwho/comments/9vnpi4/the_doctor_and_river/,doctorwho,504481,2
You cannot deny the coolness of the 12th Doctor,4041,kw2mvs,https://i.redd.it/73v1bipgbza61.jpg,151,1610491154.0,Jackmac32,0.97,/r/doctorwho/comments/kw2mvs/you_cannot_deny_the_coolness_of_the_12th_doctor/,doctorwho,504481,2
"Happy 48th Birthday to the Tenth Doctor himself, David Tennant!",4036,bem390,https://i.redd.it/wwb5oeab71t21.jpg,73,1555597099.0,R4wly1997,0.99,/r/doctorwho/comments/bem390/happy_48th_birthday_to_the_tenth_doctor_himself/,doctorwho,504481,2
Never realised this before,4018,bedm0h,https://i.redd.it/xmjbdb59cws21.jpg,109,1555538220.0,Jackmac32,0.98,/r/doctorwho/comments/bedm0h/never_realised_this_before/,doctorwho,504481,2
Snow Dalek for all of you without snow,4008,kt6pr2,https://i.redd.it/qnu7sa0r45a61.jpg,49,1610125666.0,LastofTimelords,0.99,/r/doctorwho/comments/kt6pr2/snow_dalek_for_all_of_you_without_snow/,doctorwho,504481,2
This part of the Shakespeare episode,3998,hbp6rr,https://i.redd.it/8su0p1ff3r551.jpg,133,1592521802.0,TheEdgeOfDawn,0.99,/r/doctorwho/comments/hbp6rr/this_part_of_the_shakespeare_episode/,doctorwho,504481,2
First attempt at cosplay - 13th Doctor!,3982,9ufa9r,https://i.redd.it/8nzxpgr7njw11.jpg,106,1541437380.0,bethfox1,0.97,/r/doctorwho/comments/9ufa9r/first_attempt_at_cosplay_13th_doctor/,doctorwho,504481,2
"Happy birthday, Peter Capaldi!",3981,mqm20r,https://i.redd.it/bmf90wm6k3t61.jpg,91,1618387755.0,Krokodrillo,0.99,/r/doctorwho/comments/mqm20r/happy_birthday_peter_capaldi/,doctorwho,504481,2
Can we all take a minute to appreciate this image?,3864,ln1f1f,https://i.redd.it/ncwep3p2tbi61.jpg,74,1613693296.0,Beniebabom,0.99,/r/doctorwho/comments/ln1f1f/can_we_all_take_a_minute_to_appreciate_this_image/,doctorwho,504481,2
"No frills, no romance, just two best friends looking out for each other...",3858,bbxazh,https://i.redd.it/rtcna4rqflr21.jpg,110,1554970377.0,R4wly1997,0.99,/r/doctorwho/comments/bbxazh/no_frills_no_romance_just_two_best_friends/,doctorwho,504481,2
"David Tennant (Scottish) playing the Doctor (who usually has an English accent), pretending to have a Scottish accent, and then forgetting and slipping back to his English accent makes my head hurt.",3847,yicqnx,https://i.imgur.com/i3cRCQH.jpg,156,1667224142.0,schlitt88,0.98,/r/doctorwho/comments/yicqnx/david_tennant_scottish_playing_the_doctor_who/,doctorwho,504481,2
New Who Catchphrases,3811,5jscxw,https://i.redd.it/y2gzp97q265y.png,113,1482433636.0,JakeM917,0.92,/r/doctorwho/comments/5jscxw/new_who_catchphrases/,doctorwho,504481,2
Ran into a familiar Martha at work 🎉,3807,a6eztc,https://i.redd.it/txkp1xikvf421.jpg,151,1544878546.0,elsehamy,0.97,/r/doctorwho/comments/a6eztc/ran_into_a_familiar_martha_at_work/,doctorwho,504481,2
"Go Home Doctor, You're Drunk.",3794,lb3w7v,https://i.redd.it/1zp090mg64f61.jpg,62,1612293565.0,bartarton,0.99,/r/doctorwho/comments/lb3w7v/go_home_doctor_youre_drunk/,doctorwho,504481,2
"When Doctor said these lines, I genuinely felt scared. Reminds me of the quote - fear the man who has nothing to lose.",3791,arkkqi,https://i.redd.it/w47tf4vhs4h21.png,169,1550410372.0,Lowcrbnaman,0.97,/r/doctorwho/comments/arkkqi/when_doctor_said_these_lines_i_genuinely_felt/,doctorwho,504481,2
"Don't cry,cry and Moffat wins",3758,gdfjjr,https://i.redd.it/qjs2mzjz5sw41.jpg,200,1588612140.0,Conqutih,0.98,/r/doctorwho/comments/gdfjjr/dont_crycry_and_moffat_wins/,doctorwho,504481,2
Karen Gillan and a stunt double from Amy's Choice,3759,d3euwd,https://i.redd.it/nf6penbaf8m31.jpg,91,1568324116.0,Josh_JF,0.98,/r/doctorwho/comments/d3euwd/karen_gillan_and_a_stunt_double_from_amys_choice/,doctorwho,504481,2
Just wanted to show some appreciation for our favorite doctor.,3744,glnfal,https://i.redd.it/eem7m7kg4ez41.png,447,1589749683.0,hinoxolegend,0.93,/r/doctorwho/comments/glnfal/just_wanted_to_show_some_appreciation_for_our/,doctorwho,504481,2
It never ceases to amaze me how much Mickey changed from season 1 - season 4.,3684,6x9dbp,https://i.redd.it/ebuniuegq4jz.jpg,222,1504209782.0,Jackmac32,0.92,/r/doctorwho/comments/6x9dbp/it_never_ceases_to_amaze_me_how_much_mickey/,doctorwho,504481,2
The Waters of Mars was a masterpiece. No single-episode character's death is quite as haunting as this imo.,3637,f7d1t9,https://v.redd.it/9jsjkapopai41,226,1582300488.0,Rubixsco,0.98,/r/doctorwho/comments/f7d1t9/the_waters_of_mars_was_a_masterpiece_no/,doctorwho,504481,2
Great advice by The Great Doctor,3642,awu3op,https://i.redd.it/4tkogz9srwj21.jpg,71,1551620822.0,Lowcrbnaman,0.97,/r/doctorwho/comments/awu3op/great_advice_by_the_great_doctor/,doctorwho,504481,2
"Happy birthday, Matt Smith, the eleventh Doctor. Bow ties are cool!",3629,yf4ry3,https://i.redd.it/g0jthb1y7fw91.jpg,125,1666908055.0,Krokodrillo,0.98,/r/doctorwho/comments/yf4ry3/happy_birthday_matt_smith_the_eleventh_doctor_bow/,doctorwho,504481,2
Couldn’t agree more...,3608,auxu80,https://i.redd.it/93oszggq0wi21.jpg,74,1551175865.0,R4wly1997,0.99,/r/doctorwho/comments/auxu80/couldnt_agree_more/,doctorwho,504481,2
Good Old Captain Jack Harkness,3598,ldwgs5,https://i.redd.it/lr0rkdn3luf61.png,135,1612613189.0,Conqutih,0.98,/r/doctorwho/comments/ldwgs5/good_old_captain_jack_harkness/,doctorwho,504481,2
Because he loved her........😢❤️❣️💕💞💟💝💖💗,3586,b45ygi,https://i.redd.it/mglmvz6boon21.jpg,160,1553266186.0,Lowcrbnaman,0.95,/r/doctorwho/comments/b45ygi/because_he_loved_her/,doctorwho,504481,2
"Apologies for putting myself on here again, my replica coat came and it turned out not to be a scam. So here is Martha Jones cosplay pt 2. 😂",3584,v1song,https://www.reddit.com/gallery/v1song,170,1654010397.0,Ok_Public_2094,0.96,/r/doctorwho/comments/v1song/apologies_for_putting_myself_on_here_again_my/,doctorwho,504481,2
Part of me still wishes that the Olympic committee had recreated this moment back in 2012.,3567,6m3qoz,https://i.redd.it/vpxzebfkxf8z.jpg,120,1499551021.0,Mr_Mortus,0.91,/r/doctorwho/comments/6m3qoz/part_of_me_still_wishes_that_the_olympic/,doctorwho,504481,2
Absolute masterpiece of an episode in my opinion.,3545,lk8um4,https://i.redd.it/im32t2jmklh61.jpg,252,1613375651.0,Satrajit0208,0.98,/r/doctorwho/comments/lk8um4/absolute_masterpiece_of_an_episode_in_my_opinion/,doctorwho,504481,2
Today marks the 5 year anniversary of the masterpiece that is Hell Bent,3516,k769ea,https://i.redd.it/avnbzdf2yc361.jpg,319,1607169452.0,bowsmountainer,0.95,/r/doctorwho/comments/k769ea/today_marks_the_5_year_anniversary_of_the/,doctorwho,504481,2
The Hybrid,3511,fq0qap,https://i.redd.it/b006irj1y8p41.jpg,80,1585328499.0,Josh_JF,1.0,/r/doctorwho/comments/fq0qap/the_hybrid/,doctorwho,504481,2
I always loved this scene after the 1st doctor sees his future. The way he is terrifyingly looking at 12 and the way 12 looks back is chilling. Imagine dedicating your life to being a force of good then being confronted with your future of war.,3478,eryfu2,https://i.redd.it/be8i3xui86c41.jpg,173,1579629882.0,Jackmac32,0.98,/r/doctorwho/comments/eryfu2/i_always_loved_this_scene_after_the_1st_doctor/,doctorwho,504481,2
Thoughts on my Peter Capaldi drawing?,3473,8l3mvw,https://i.redd.it/1ce8vcxyh9z01.jpg,136,1526931605.0,NMate777,0.93,/r/doctorwho/comments/8l3mvw/thoughts_on_my_peter_capaldi_drawing/,doctorwho,504481,2
"I made this after the march (and subsequent violence) in Charlottesville, Virginia last week and thought someone here may enjoy it.",3471,6v3vjh,https://i.redd.it/xxtet8z564hz.jpg,349,1503331262.0,TheYoungGriffin,0.88,/r/doctorwho/comments/6v3vjh/i_made_this_after_the_march_and_subsequent/,doctorwho,504481,2
Happy Birthday to the amazing 12th Doctor (April 14th)!!!,3460,g0ubf4,https://i.redd.it/ray8drag7os41.jpg,91,1586820871.0,francisl0007,0.98,/r/doctorwho/comments/g0ubf4/happy_birthday_to_the_amazing_12th_doctor_april/,doctorwho,504481,2
She is indeed,3448,grhkjc,https://i.redd.it/w2v4hjraga151.jpg,135,1590576923.0,Conqutih,0.99,/r/doctorwho/comments/grhkjc/she_is_indeed/,doctorwho,504481,2
Just a cute picture of the amazing Peter Capaldi,3432,gm2rah,https://i.redd.it/h2n8s1f8djz41.jpg,81,1589813157.0,hinoxolegend,0.99,/r/doctorwho/comments/gm2rah/just_a_cute_picture_of_the_amazing_peter_capaldi/,doctorwho,504481,2
You will never be as cool as The Doctor playing guitar on a tank,3435,ijrd8a,https://i.redd.it/bpni1hcpk9k51.jpg,146,1598847410.0,ananizapta,0.97,/r/doctorwho/comments/ijrd8a/you_will_never_be_as_cool_as_the_doctor_playing/,doctorwho,504481,2
Doctors wearing their predecessors clothes,3417,mfe97u,https://i.redd.it/p6b25w3g8vp61.jpg,156,1616979409.0,Jackmac32,0.99,/r/doctorwho/comments/mfe97u/doctors_wearing_their_predecessors_clothes/,doctorwho,504481,2
Finally got a second monitor and really had no choice in the matter,3399,jr918c,https://i.redd.it/ulu3wtdxsay51.jpg,82,1604964209.0,pogomonkeytutu,0.99,/r/doctorwho/comments/jr918c/finally_got_a_second_monitor_and_really_had_no/,doctorwho,504481,2
I'm crying!,3373,c0idbp,https://i.redd.it/azsssk4vqa431.png,74,1560506960.0,IkBenJarrin,0.96,/r/doctorwho/comments/c0idbp/im_crying/,doctorwho,504481,2
I hate it when they leave exhibits empty.,3371,5lfcvi,http://i.imgur.com/WUrSbFq.jpg,75,1483281490.0,pogomonkeytutu,0.89,/r/doctorwho/comments/5lfcvi/i_hate_it_when_they_leave_exhibits_empty/,doctorwho,504481,2
Are you my mummy! Art!,3357,fge1pp,https://i.redd.it/kodr2o9pnul41.png,58,1583847983.0,noir1717,0.99,/r/doctorwho/comments/fge1pp/are_you_my_mummy_art/,doctorwho,504481,2
With all the division in this subreddit in the past few weeks here is something to brighten up your day,3340,9ucvgh,https://i.redd.it/0b1qeeir3iw11.jpg,216,1541418731.0,BigTimeSuperhero96,0.95,/r/doctorwho/comments/9ucvgh/with_all_the_division_in_this_subreddit_in_the/,doctorwho,504481,2
Just finished my Doctor Who inspired painting. Hope you like it!,3322,9q8b6h,https://i.redd.it/qhpbct77jmt11.jpg,72,1540164809.0,NMate777,0.97,/r/doctorwho/comments/9q8b6h/just_finished_my_doctor_who_inspired_painting/,doctorwho,504481,2
