title,score,id,url,num_comments,created,author,upvote_ratio,permalink,subreddit,subreddit_subscribers,depth
Looking for a way to spend the off-season? Learn how to analyze Formula 1 data using Python!,683,rifsx8,https://www.reddit.com/r/F1Technical/comments/rifsx8/looking_for_a_way_to_spend_the_offseason_learn/,41,1639741964.0,Nothing0,0.98,/r/F1Technical/comments/rifsx8/looking_for_a_way_to_spend_the_offseason_learn/,F1Technical,221689,1
F1 Hybrid Era Seamless Gearbox,684,sfwbs4,https://youtu.be/O1-W6wVDOsI,25,1643503253.0,indeterminatedesign,0.99,/r/F1Technical/comments/sfwbs4/f1_hybrid_era_seamless_gearbox/,F1Technical,221689,1
Pirelli Preview - Japan 2022 @ Suzuka,679,xwn185,https://i.redd.it/xju5hrdr22s91.jpg,20,1665005562.0,autobanh_me,0.99,/r/F1Technical/comments/xwn185/pirelli_preview_japan_2022_suzuka/,F1Technical,221689,1
HungarianGP Drivers results across sessions,682,wf7wzt,https://i.redd.it/y3uxsq9v4if91.png,31,1659536555.0,TracingInsights,0.98,/r/F1Technical/comments/wf7wzt/hungariangp_drivers_results_across_sessions/,F1Technical,221689,1
Alpine F1 steering wheel in the making,672,109kxuh,https://www.reddit.com/gallery/109kxuh,35,1673483253.0,vick5516,1.0,/r/F1Technical/comments/109kxuh/alpine_f1_steering_wheel_in_the_making/,F1Technical,221689,1
RB6 2010 Pedal Box,665,kud061,https://i.imgur.com/90t1JV0.jpg,42,1610278651.0,Randomusername_101,0.99,/r/F1Technical/comments/kud061/rb6_2010_pedal_box/,F1Technical,221689,1
So is this a show car?,669,sgl76x,https://i.redd.it/txghvj3ulwe81.png,45,1643582765.0,Sm0g3R,0.96,/r/F1Technical/comments/sgl76x/so_is_this_a_show_car/,F1Technical,221689,1
What is the purpose of those dots on the rear wing? And do teams have to keep them on throughout the weekend? I don’t remember them being in F1 a couple years ago.,637,wxj576,https://www.reddit.com/gallery/wxj576,55,1661446036.0,beerusuuuuh,0.96,/r/F1Technical/comments/wxj576/what_is_the_purpose_of_those_dots_on_the_rear/,F1Technical,221689,1
F1 Steering Wheel Explained - Sauber 2013,633,nig3pq,https://i.redd.it/lm9iwz6qkn071.jpg,19,1621681039.0,T_Blown_Diffuser,0.97,/r/F1Technical/comments/nig3pq/f1_steering_wheel_explained_sauber_2013/,F1Technical,221689,1
#F1 Tech Explained - Tyre Camber,627,v4r68h,https://www.reddit.com/r/F1Technical/comments/v4r68h/f1_tech_explained_tyre_camber/,45,1654356394.0,F1DataAnalysis,0.99,/r/F1Technical/comments/v4r68h/f1_tech_explained_tyre_camber/,F1Technical,221689,1
Williams' floor from underneath,622,tbppm3,https://www.reddit.com/gallery/tbppm3,36,1647003900.0,eigengrau-licht,1.0,/r/F1Technical/comments/tbppm3/williams_floor_from_underneath/,F1Technical,221689,1
Honda F1 V10 Engine,627,kg6nun,https://i.redd.it/qvhrlq5tg3661.jpg,19,1608379644.0,Randomusername_101,0.99,/r/F1Technical/comments/kg6nun/honda_f1_v10_engine/,F1Technical,221689,1
"To those who missed the 'Intro to Formula 1 Data Analysis with Python' webinar, here are all the resources!",618,xqgu33,https://twitter.com/f1dataanalytics/status/1575154850580553729,26,1664381538.0,Nothing0,0.99,/r/F1Technical/comments/xqgu33/to_those_who_missed_the_intro_to_formula_1_data/,F1Technical,221689,1
A front shot of the Aston Martin. It has some very large tunnels in the sidepods,617,111hnby,https://i.redd.it/2gm0xv54c0ia1.png,20,1676316548.0,vick5516,0.99,/r/F1Technical/comments/111hnby/a_front_shot_of_the_aston_martin_it_has_some_very/,F1Technical,221689,1
RedBull RB9 Front Wing Vortices,610,s62p1t,https://gfycat.com/physicalimpishfieldmouse,10,1642421738.0,phil-swift4,0.98,/r/F1Technical/comments/s62p1t/redbull_rb9_front_wing_vortices/,F1Technical,221689,1
"DutchGP Race Pace Analysis - Mercedes was on top again, with VER practically matching them. PER and SAI underperformed (the latter due to floor damage)",614,x6gn9f,https://i.redd.it/ftypakkio1m91.png,77,1662385661.0,F1DataAnalysis,0.95,/r/F1Technical/comments/x6gn9f/dutchgp_race_pace_analysis_mercedes_was_on_top/,F1Technical,221689,1
Could someone explain the ‘rocket technology’ Mercedes has with their sidepod cooling design?,604,x3j95t,https://i.redd.it/7slrsaowfbl91.jpg,58,1662067977.0,beerusuuuuh,0.98,/r/F1Technical/comments/x3j95t/could_someone_explain_the_rocket_technology/,F1Technical,221689,1
MiamiGP Driver Classification and positions changes over the entire weekend.,608,uos9ui,https://i.redd.it/4o021ylo09z81.png,31,1652450027.0,TracingInsights,0.97,/r/F1Technical/comments/uos9ui/miamigp_driver_classification_and_positions/,F1Technical,221689,1
Distribution of speeds by teams ranked by max speed(Green dots) at long straight Speed Trap during the SpanishGP Race.,601,v3tzb7,https://i.redd.it/fazrlotnyc391.png,60,1654241233.0,TracingInsights,0.97,/r/F1Technical/comments/v3tzb7/distribution_of_speeds_by_teams_ranked_by_max/,F1Technical,221689,1
Racing Point RP20 with the front nose and suspension completely uncovered.,596,ld5fpe,https://i.redd.it/yf9tv3qxbnf61.jpg,30,1612525246.0,SollarAce,0.99,/r/F1Technical/comments/ld5fpe/racing_point_rp20_with_the_front_nose_and/,F1Technical,221689,1
"Details on the back of the new Alfa Romeo wheel, showing off a rear-mounted overtake button",591,10zpxvu,https://i.redd.it/cw5qr93grkha1.png,16,1676129638.0,vick5516,0.99,/r/F1Technical/comments/10zpxvu/details_on_the_back_of_the_new_alfa_romeo_wheel/,F1Technical,221689,1
"Can anyone ID this F1 car? I'm going to France next year and it's advertised for a museum, but I'm not sure if it's an authentic F1 car.",589,zhzui7,https://i.redd.it/mfkwpiag745a1.jpg,35,1670697408.0,DaevChoons,0.98,/r/F1Technical/comments/zhzui7/can_anyone_id_this_f1_car_im_going_to_france_next/,F1Technical,221689,1
Can someone explain what this means in layman’s terms?,580,sny38z,https://i.redd.it/9d97uiyv0pg81.jpg,82,1644362651.0,Kamasutra08,0.96,/r/F1Technical/comments/sny38z/can_someone_explain_what_this_means_in_laymans/,F1Technical,221689,1
What is the thing at the back? Why did other teams not use it?,584,sexxpv,https://i.redd.it/d15b3emj7he81.jpg,44,1643396340.0,DaManTheOne,0.91,/r/F1Technical/comments/sexxpv/what_is_the_thing_at_the_back_why_did_other_teams/,F1Technical,221689,1
Austria Race Gear shifts of drivers fastest lap,580,w0b5m1,https://i.redd.it/6zuhyx0nwvb91.jpg,37,1657957332.0,TracingInsights,0.97,/r/F1Technical/comments/w0b5m1/austria_race_gear_shifts_of_drivers_fastest_lap/,F1Technical,221689,1
"Tyre Degradation of different compounds at Hungary. Mediums were the best performing tyre with relatively low degradation. As Charles suggested in his radio calls, Ferrari should've opted for extending his medium stints instead of hards which is almost a second slower.",575,wdbajs,https://i.redd.it/21aos9jg12f91.png,38,1659339173.0,TracingInsights,0.97,/r/F1Technical/comments/wdbajs/tyre_degradation_of_different_compounds_at/,F1Technical,221689,1
DRS Activation Statistics for Drivers and Teams in the 2021 Formula 1 World Championship [Details below],576,s34fri,https://www.reddit.com/gallery/s34fri,38,1642094253.0,DrivenByData_,0.98,/r/F1Technical/comments/s34fri/drs_activation_statistics_for_drivers_and_teams/,F1Technical,221689,1
"Looking at tire strategies, we can see that Soft-Med-Med was the most successful, with the 4 drivers who used it averaging ~5 places gained. The grid was perfectly split 50/50 on starting tires, with softs having the clear advantage. Sorry I cant make the fancy graphics like others :(",565,wcr6si,https://i.redd.it/se136e118xe91.png,33,1659280884.0,PopLockNDropSigSauer,0.99,/r/F1Technical/comments/wcr6si/looking_at_tire_strategies_we_can_see_that/,F1Technical,221689,1
"From this comparison between the W11 and the MCL35M you can see how much Mercedes worked on the Power Unit; it has been made much tighter, and this will help aerodynamic efficiency. (Twitter: hotlapmode)",563,lmci43,https://i.redd.it/0pvyvt83n5i61.jpg,40,1613618618.0,bhargvagiri,0.98,/r/F1Technical/comments/lmci43/from_this_comparison_between_the_w11_and_the/,F1Technical,221689,1
How are Mercedes able to get away with no radiator on the airbox?,563,11u4yot,https://www.reddit.com/gallery/11u4yot,16,1679089781.0,beerusuuuuh,0.99,/r/F1Technical/comments/11u4yot/how_are_mercedes_able_to_get_away_with_no/,F1Technical,221689,1
New AT02 front nose at imola today,559,lrblek,https://i.redd.it/xd2x1d6t4fj61.png,25,1614169406.0,MiddleKerb,1.0,/r/F1Technical/comments/lrblek/new_at02_front_nose_at_imola_today/,F1Technical,221689,1
Multiple Motorsports Car widths this time!,558,ix3ffr,https://i.redd.it/ayoex412zio51.png,14,1600704765.0,16CLeclerc,0.96,/r/F1Technical/comments/ix3ffr/multiple_motorsports_car_widths_this_time/,F1Technical,221689,1
Heat from the Mercedes exhaust and wheels,557,o88iun,https://v.redd.it/gk0jnl8dbl771,15,1624704608.0,Animesh_Mishra,0.98,/r/F1Technical/comments/o88iun/heat_from_the_mercedes_exhaust_and_wheels/,F1Technical,221689,1
Ferrari have changed their air intake shape back to the triangular shape. What difference does the shape of air intake make in the car performance?,554,sidos5,https://i.redd.it/7dfspg8g5cf81.jpg,26,1643771031.0,Madhav_Taneja,0.98,/r/F1Technical/comments/sidos5/ferrari_have_changed_their_air_intake_shape_back/,F1Technical,221689,1
"AlphaTauri AT03 leaked , any toughts?",554,srgpcj,https://i.redd.it/euqgptfz5lh81.jpg,41,1644751811.0,FederalEngineer,0.96,/r/F1Technical/comments/srgpcj/alphatauri_at03_leaked_any_toughts/,F1Technical,221689,1
What’s this stuff that teams put on during practice and/or testing?,550,s8310u,https://i.redd.it/s84xjdmr4qc81.jpg,42,1642632671.0,Chasedi9_9923,0.95,/r/F1Technical/comments/s8310u/whats_this_stuff_that_teams_put_on_during/,F1Technical,221689,1
Alfa Romeo - Steering Wheel,542,n30rfo,https://i.redd.it/n00gdp89knw61.jpg,12,1619937464.0,T_Blown_Diffuser,0.99,/r/F1Technical/comments/n30rfo/alfa_romeo_steering_wheel/,F1Technical,221689,1
"Comparision between Mercedes' noses, 2014-2020.",535,kocem3,https://i.redd.it/vfvy7t4zop861.jpg,7,1609512535.0,Randomusername_101,0.98,/r/F1Technical/comments/kocem3/comparision_between_mercedes_noses_20142020/,F1Technical,221689,1
Bahrain GP 2020 | Alex Albon's car after crashing in FP2,538,k24btm,https://i.redd.it/pjqfppjq7t161.jpg,38,1606494606.0,Randomusername_101,0.99,/r/F1Technical/comments/k24btm/bahrain_gp_2020_alex_albons_car_after_crashing_in/,F1Technical,221689,1
Scarborough's Ferrari hypothesis,536,112esih,https://www.reddit.com/gallery/112esih,20,1676405282.0,vick5516,0.98,/r/F1Technical/comments/112esih/scarboroughs_ferrari_hypothesis/,F1Technical,221689,1
"[TracingInsights] Every drivers fastest lap of the race compared for Monaco GP. Front tyre area has tyre life, lap number is next to driver's name in brackets",534,v5zyvu,https://i.redd.it/iuk0grkvaz391.png,19,1654511607.0,TracingInsights,0.97,/r/F1Technical/comments/v5zyvu/tracinginsights_every_drivers_fastest_lap_of_the/,F1Technical,221689,1
Modern F1 Engines Eras Compared - Specs and Characteristics,533,xgljgf,https://www.reddit.com/r/F1Technical/comments/xgljgf/modern_f1_engines_eras_compared_specs_and/,36,1663418640.0,F1DataAnalysis,0.99,/r/F1Technical/comments/xgljgf/modern_f1_engines_eras_compared_specs_and/,F1Technical,221689,1
Comparison of Red Bull sidepod upgrade,537,tccgzk,https://www.reddit.com/gallery/tccgzk,18,1647075794.0,eigengrau-licht,0.99,/r/F1Technical/comments/tccgzk/comparison_of_red_bull_sidepod_upgrade/,F1Technical,221689,1
Complete Comparison of the Strenghts and Weaknesses of each 2022 Car,526,vjtjlj,https://www.reddit.com/r/F1Technical/comments/vjtjlj/complete_comparison_of_the_strenghts_and/,34,1656091262.0,F1DataAnalysis,0.96,/r/F1Technical/comments/vjtjlj/complete_comparison_of_the_strenghts_and/,F1Technical,221689,1
"Monaco, Spain, Full season overtakes and overtaken. Out of 12 overtakes at Monaco only 2 were shown live",523,v6pu1d,https://tracinginsights.substack.com/p/who-overtook-most-cars-at-monaco?r=1hpbkq&s=w&utm_campaign=post&utm_medium=web,23,1654588876.0,TracingInsights,0.99,/r/F1Technical/comments/v6pu1d/monaco_spain_full_season_overtakes_and_overtaken/,F1Technical,221689,1
So it does exist! RB18 (low quality but genuine),518,suycdg,https://i.redd.it/7bo2lw7vcgi81.jpg,29,1645129414.0,Voice_Calm,0.98,/r/F1Technical/comments/suycdg/so_it_does_exist_rb18_low_quality_but_genuine/,F1Technical,221689,1
Penalty points per driver and days to expiry after Miami Grand Prix.,521,un9mu2,https://i.redd.it/ume6bop9kuy81.png,44,1652275033.0,TracingInsights,0.98,/r/F1Technical/comments/un9mu2/penalty_points_per_driver_and_days_to_expiry/,F1Technical,221689,1
Penalty points as of Today. Total of 10 penalty points were awarded during the Austrian GP weekend,517,vys5ze,https://i.redd.it/5nk0yaix9ib91.png,85,1657792780.0,TracingInsights,0.97,/r/F1Technical/comments/vys5ze/penalty_points_as_of_today_total_of_10_penalty/,F1Technical,221689,1
"Could F1 cars realistically be made shorter, or are they destined to be so long forever?",521,u5k01x,https://www.reddit.com/r/F1Technical/comments/u5k01x/could_f1_cars_realistically_be_made_shorter_or/,84,1650189758.0,Bortron86,0.97,/r/F1Technical/comments/u5k01x/could_f1_cars_realistically_be_made_shorter_or/,F1Technical,221689,1
2022 vs. 2021 Red Bull: Telemetry Analysis,510,tdbow0,https://i.redd.it/n963wkamq6n81.jpg,31,1647192216.0,DrivenByData_,0.98,/r/F1Technical/comments/tdbow0/2022_vs_2021_red_bull_telemetry_analysis/,F1Technical,221689,1
"If you want to learn some Python and Formula 1 data analysis during the holidays, I just posted a new tutorial: ""Visualizing Formula 1 Qualifying Battles Using Python, Seaborn and Pandas""",507,rovtj8,https://medium.com/towards-formula-1-analysis/visualizing-formula-1-qualifying-battles-using-python-seaborn-and-pandas-7e5fa5cc3db4,16,1640520810.0,Nothing0,0.97,/r/F1Technical/comments/rovtj8/if_you_want_to_learn_some_python_and_formula_1/,F1Technical,221689,1
"2021 São Paulo Grand Prix Pole Lap Telemetry (Speed, Brake, Throttle, Elevation changes). More details in the comments",497,yr8h1r,https://www.reddit.com/gallery/yr8h1r,10,1668065880.0,TracingInsights,0.98,/r/F1Technical/comments/yr8h1r/2021_são_paulo_grand_prix_pole_lap_telemetry/,F1Technical,221689,1
Aerodynamic Studies of a 2022 F1 Car,494,s6x1bf,https://maxtayloraero.wordpress.com/2022/01/17/aerodynamic-studies-of-a-2022-f1-car/,36,1642510901.0,Spacehead3,0.99,/r/F1Technical/comments/s6x1bf/aerodynamic_studies_of_a_2022_f1_car/,F1Technical,221689,1
"I noticed this on the Wikipedia article for the 1976 German GP. Does anyone know why the rollover bars are different heights? I presume it's driver preference, but if so, why choose a shorter one?",494,temop4,https://i.redd.it/0a42p6aj7jn81.jpg,45,1647343182.0,Bortron86,0.98,/r/F1Technical/comments/temop4/i_noticed_this_on_the_wikipedia_article_for_the/,F1Technical,221689,1
What is this part called and what does it do? I don't know the name so couldn't search it up,494,sgqn8n,https://i.redd.it/z4b0nrtbwxe81.jpg,68,1643598427.0,Madhav_Taneja,0.94,/r/F1Technical/comments/sgqn8n/what_is_this_part_called_and_what_does_it_do_i/,F1Technical,221689,1
Interesting W12 floor area (taken before testing start),485,m3bege,https://i.redd.it/4uf6qi5fgjm61.jpg,41,1615529263.0,EdgeOfExceptional,1.0,/r/F1Technical/comments/m3bege/interesting_w12_floor_area_taken_before_testing/,F1Technical,221689,1
"How F1 wheel rim covers work, why they were banned and why they’re back",489,rwvboh,https://www.motorsport.com/f1/news/f1-tech-wheel-rim-covers-2022/7078251/,35,1641412139.0,BiblaTomas,1.0,/r/F1Technical/comments/rwvboh/how_f1_wheel_rim_covers_work_why_they_were_banned/,F1Technical,221689,1
British Grand Prix circuit map with corner speeds,486,hzxliz,https://i.redd.it/5w7zb6xwkrd51.jpg,43,1596014478.0,JarrodIdeaGuru,0.99,/r/F1Technical/comments/hzxliz/british_grand_prix_circuit_map_with_corner_speeds/,F1Technical,221689,1
Telemetry Analysis of Russell vs. Hamilton in FP2 ahead of the 2022 Bahrain Grand Prix,483,thshti,https://i.redd.it/13rcv0dzibo81.jpg,16,1647686060.0,DrivenByData_,0.98,/r/F1Technical/comments/thshti/telemetry_analysis_of_russell_vs_hamilton_in_fp2/,F1Technical,221689,1
"For those who are interested in learning Formula 1 data analysis in Python, I just created a new tutorial: ""Visualizing Formula 1 Race Strategies in Python using Fastf1, Pandas and Matplotlib""",478,sfgtff,https://medium.com/towards-formula-1-analysis/visualizing-formula-1-race-strategies-in-python-using-fastf1-pandas-and-matplotlib-95fe6b3298fa,3,1643457887.0,Nothing0,0.98,/r/F1Technical/comments/sfgtff/for_those_who_are_interested_in_learning_formula/,F1Technical,221689,1
McLaren Mcl35M official pictures from mclaren.com,477,lkllu2,https://www.reddit.com/gallery/lkllu2,44,1613418923.0,Danielp33r,0.99,/r/F1Technical/comments/lkllu2/mclaren_mcl35m_official_pictures_from_mclarencom/,F1Technical,221689,1
Distribution of Speed Trap measurements (with DRS) for each team in Friday Practices ahead of the 2022 Bahrain Grand Prix,479,th73lq,https://i.redd.it/vladevupd6o81.png,44,1647623765.0,DrivenByData_,1.0,/r/F1Technical/comments/th73lq/distribution_of_speed_trap_measurements_with_drs/,F1Technical,221689,1
Ferrari is currently on track to have the highest rate of pole positions in a season they did not win the WCC since 1999,473,wl0ijb,https://www.reddit.com/r/F1Technical/comments/wl0ijb/ferrari_is_currently_on_track_to_have_the_highest/,15,1660145724.0,PopLockNDropSigSauer,0.97,/r/F1Technical/comments/wl0ijb/ferrari_is_currently_on_track_to_have_the_highest/,F1Technical,221689,1
"Penalty points per driver and days to expiry(as of today) If a driver reach 12 points they are automatically banned from participating in the next race. After the race ban, points resets to 0. Gasly is really close to a race ban with 10 points",476,ynq3r2,https://i.redd.it/n0254v5k2cy91.png,62,1667741775.0,TracingInsights,0.98,/r/F1Technical/comments/ynq3r2/penalty_points_per_driver_and_days_to_expiryas_of/,F1Technical,221689,1
"Havent seen it mentioned anywhere, but is there any reason why mercedes changed their wheel design slightly last season, it used to be smooth across the top?",470,sdywun,https://i.redd.it/05gy61b2k8e81.png,46,1643291650.0,S1eet,0.97,/r/F1Technical/comments/sdywun/havent_seen_it_mentioned_anywhere_but_is_there/,F1Technical,221689,1
2021 Austrian GP: Race pace,466,oe1u1h,https://www.reddit.com/gallery/oe1u1h,24,1625468827.0,f1bythenumbers,0.99,/r/F1Technical/comments/oe1u1h/2021_austrian_gp_race_pace/,F1Technical,221689,1
"Tyre Blistering and Graining - Explanation, Causes and Solutions",470,vsw6s1,https://www.reddit.com/r/F1Technical/comments/vsw6s1/tyre_blistering_and_graining_explanation_causes/,19,1657130343.0,F1DataAnalysis,0.98,/r/F1Technical/comments/vsw6s1/tyre_blistering_and_graining_explanation_causes/,F1Technical,221689,1
70th Anniversary Grand Prix: Silverstone Now and Then,464,i4ou7f,https://i.redd.it/nr1h776qscf51.jpg,31,1596707191.0,JarrodIdeaGuru,0.99,/r/F1Technical/comments/i4ou7f/70th_anniversary_grand_prix_silverstone_now_and/,F1Technical,221689,1
French GP FP2 - Fastest driver in each of 25 mini sectors,464,w5wimx,https://i.redd.it/kkmapevzc9d91.png,27,1658556076.0,TracingInsights,0.98,/r/F1Technical/comments/w5wimx/french_gp_fp2_fastest_driver_in_each_of_25_mini/,F1Technical,221689,1
Mercedes Upgrades Miami,459,uitgt1,https://www.reddit.com/r/F1Technical/comments/uitgt1/mercedes_upgrades_miami/,110,1651742205.0,Danielp33r,0.97,/r/F1Technical/comments/uitgt1/mercedes_upgrades_miami/,F1Technical,221689,1
The solution to porpoising by Ferrari and McLaren,459,t8usgw,https://www.reddit.com/r/F1Technical/comments/t8usgw/the_solution_to_porpoising_by_ferrari_and_mclaren/,41,1646675014.0,mmd_aaron,0.98,/r/F1Technical/comments/t8usgw/the_solution_to_porpoising_by_ferrari_and_mclaren/,F1Technical,221689,1
"I made an icon for this Subreddit. Feel free to use it. If you have any suggestion, let me know.",458,iqr5i9,https://i.redd.it/a0q3uaoszim51.png,22,1599833277.0,aaron2812_,0.95,/r/F1Technical/comments/iqr5i9/i_made_an_icon_for_this_subreddit_feel_free_to/,F1Technical,221689,1
FIA Super License,459,j1x65v,https://i.imgur.com/71h1AcH.jpg,39,1601377771.0,aaron2812_,0.97,/r/F1Technical/comments/j1x65v/fia_super_license/,F1Technical,221689,1
What Ferrari is doing its sidepods seems quiet interesting,453,stygjl,https://i.redd.it/4wugg1e8q7i81.jpg,101,1645024959.0,Rouxs05,0.98,/r/F1Technical/comments/stygjl/what_ferrari_is_doing_its_sidepods_seems_quiet/,F1Technical,221689,1
Italian Grand Prix circuit map with corner speeds,453,im60fi,https://i.redd.it/zidwlqqt21l51.jpg,31,1599180395.0,JarrodIdeaGuru,0.99,/r/F1Technical/comments/im60fi/italian_grand_prix_circuit_map_with_corner_speeds/,F1Technical,221689,1
A new front wing for Alpha Tauri at Mugello with the team appearing to find a loophole that allows them to divert airflow from above the footplate inboard. @Matthew Somerfield Twitter,455,iq93pc,https://i.redd.it/hgs14u475dm51.png,13,1599762373.0,MiddleKerb,0.99,/r/F1Technical/comments/iq93pc/a_new_front_wing_for_alpha_tauri_at_mugello_with/,F1Technical,221689,1
Belgian Grand Prix circuit map with corner speeds,449,igvqgs,https://i.redd.it/lnwdttqjfbj51.jpg,26,1598434076.0,JarrodIdeaGuru,0.99,/r/F1Technical/comments/igvqgs/belgian_grand_prix_circuit_map_with_corner_speeds/,F1Technical,221689,1
Hungarian GP FP1 - Fastest driver in each of 25 mini sectors,450,wb5mae,https://i.redd.it/ogut467akie91.png,23,1659103293.0,TracingInsights,0.99,/r/F1Technical/comments/wb5mae/hungarian_gp_fp1_fastest_driver_in_each_of_25/,F1Technical,221689,1
Ferrari Power unit analysis by Scrabtech,435,tm9uby,https://www.reddit.com/gallery/tm9uby,31,1648128286.0,FederalEngineer,0.98,/r/F1Technical/comments/tm9uby/ferrari_power_unit_analysis_by_scrabtech/,F1Technical,221689,1
Redbull's Brakes uncovered,440,t15hqy,https://i.redd.it/xbwsmzvskzj81.jpg,16,1645799810.0,phil-swift4,0.99,/r/F1Technical/comments/t15hqy/redbulls_brakes_uncovered/,F1Technical,221689,1
Power and Drag Estimation – Ferrari vs RedBull vs Mercedes,437,ujloy5,https://www.reddit.com/r/F1Technical/comments/ujloy5/power_and_drag_estimation_ferrari_vs_redbull_vs/,24,1651837825.0,F1DataAnalysis,0.98,/r/F1Technical/comments/ujloy5/power_and_drag_estimation_ferrari_vs_redbull_vs/,F1Technical,221689,1
What is this?,434,ztos3i,https://i.redd.it/wux5u12bdq7a1.jpg,31,1671819363.0,bamiel,0.98,/r/F1Technical/comments/ztos3i/what_is_this/,F1Technical,221689,1
Hungarian GP FP3 - Fastest driver in each of 25 mini sectors,431,wbx3rz,https://i.redd.it/4u3e75nxdpe91.png,16,1659186299.0,TracingInsights,0.99,/r/F1Technical/comments/wbx3rz/hungarian_gp_fp3_fastest_driver_in_each_of_25/,F1Technical,221689,1
MCL35M complex bargeboard area from filming day [Twitter: @f1talks],424,lllmm9,https://i.redd.it/osee8qdgpyh61.jpg,22,1613534664.0,EdgeOfExceptional,0.99,/r/F1Technical/comments/lllmm9/mcl35m_complex_bargeboard_area_from_filming_day/,F1Technical,221689,1
Swirls generated by the Floor,424,t28ykn,https://i.redd.it/vyoemvxp97k81.jpg,8,1645914867.0,phil-swift4,0.98,/r/F1Technical/comments/t28ykn/swirls_generated_by_the_floor/,F1Technical,221689,1
Pirelli Preview - 2022 United States Grand Prix,429,y8sss0,https://i.redd.it/jw0tgei7bxu91.jpg,24,1666255652.0,TracingInsights,0.98,/r/F1Technical/comments/y8sss0/pirelli_preview_2022_united_states_grand_prix/,F1Technical,221689,1
"Mercedes say they won’t pursue appeal of Abu Dhabi stewards decision, as FIA announce investigation",422,rhnx05,https://www.formula1.com/en/latest/article.breaking-mercedes-wont-pursue-appeal-of-abu-dhabi-stewards-decision-as-fia.53UcGzDl9H2Ae3zMnsTX4w.html,150,1639650174.0,karolis_7,0.91,/r/F1Technical/comments/rhnx05/mercedes_say_they_wont_pursue_appeal_of_abu_dhabi/,F1Technical,221689,1
F1 agrees to ditch MGU-H as part of new engine rules,423,rhch6i,https://www.autosport.com/f1/news/f1-agrees-to-ditch-mgu-h-as-part-of-new-engine-rules/6885625/,98,1639610697.0,BiblaTomas,1.0,/r/F1Technical/comments/rhch6i/f1_agrees_to_ditch_mguh_as_part_of_new_engine/,F1Technical,221689,1
Honda RA620H,424,jadw3o,https://i.redd.it/yjhjdjgvlns51.png,33,1602597394.0,Randomusername_101,0.99,/r/F1Technical/comments/jadw3o/honda_ra620h/,F1Technical,221689,1
Japanese Grand Prix FP2 Mini-sector comparison,414,xxtly3,https://i.redd.it/myqev08mgcs91.png,19,1665131328.0,TracingInsights,0.99,/r/F1Technical/comments/xxtly3/japanese_grand_prix_fp2_minisector_comparison/,F1Technical,221689,1
To what extent is stalling the diffuser responsible for the spray in wet conditions? When the Mercedes rear end goes down the spray increases massively.,415,qeohgf,https://v.redd.it/3r1moksz4dv71,32,1635066171.0,Voice_Calm,0.89,/r/F1Technical/comments/qeohgf/to_what_extent_is_stalling_the_diffuser/,F1Technical,221689,1
Sidepod comparision between a Mercedes and Stroll's Racing Point(new parts) from Mugello.,402,iugyuh,https://i.redd.it/0jdocz4eson51.jpg,26,1600339144.0,Randomusername_101,1.0,/r/F1Technical/comments/iugyuh/sidepod_comparision_between_a_mercedes_and/,F1Technical,221689,1
Spanish Grand Prix circuit map with corner speeds,406,i8xk98,https://i.redd.it/73nayxyuzqg51.jpg,13,1597314943.0,JarrodIdeaGuru,0.99,/r/F1Technical/comments/i8xk98/spanish_grand_prix_circuit_map_with_corner_speeds/,F1Technical,221689,1
"Brazil Grand Prix (SPRINT WEEKEND) Pirelli preview - The track runs anti-clockwise with 15 corners, which place medium lateral demands on the tyres - It is well-known for plenty of overtaking and frequent safety cars - The weather is always another question mark",403,ypip9r,https://i.redd.it/r13opzy9kpy91.jpg,8,1667905165.0,TracingInsights,0.99,/r/F1Technical/comments/ypip9r/brazil_grand_prix_sprint_weekend_pirelli_preview/,F1Technical,221689,1
"Why F1 cars ""don't like"" reverse gear?",405,ua4e45,https://www.reddit.com/r/F1Technical/comments/ua4e45/why_f1_cars_dont_like_reverse_gear/,61,1650716981.0,Fatamos,0.97,/r/F1Technical/comments/ua4e45/why_f1_cars_dont_like_reverse_gear/,F1Technical,221689,1
