title,score,id,url,num_comments,created,author,upvote_ratio,permalink,subreddit,subreddit_subscribers,depth
Housing is so expensive in California that a school district is asking students' families to let teachers move in with them,3450,x2zziw,https://www.businessinsider.com/california-housing-unaffordable-for-teachers-moving-in-students-families-2022-8,536,1662012686.0,return2ozma,0.99,/r/collapse/comments/x2zziw/housing_is_so_expensive_in_california_that_a/,collapse,476177,2
Still Expected To Go To Work On Time,3444,xm8rrn,https://i.redd.it/fbz7u68o7op91.jpg,261,1663966016.0,Monsur_Ausuhnom,0.96,/r/collapse/comments/xm8rrn/still_expected_to_go_to_work_on_time/,collapse,476177,2
Reposted.,3452,plybfk,https://i.redd.it/oewvpp065sm71.png,207,1631325015.0,QuartzPuffyStar,0.97,/r/collapse/comments/plybfk/reposted/,collapse,476177,2
Funny how that happens,3406,hxblau,https://i.redd.it/end6qyes2uc51.jpg,207,1595630389.0,saul2015,0.98,/r/collapse/comments/hxblau/funny_how_that_happens/,collapse,476177,2
Scientists warn that some parts of the planet are already approaching the limits of their ability to adapt to climate change. This grim assessment comes about two weeks before the IPCC releases a report focusing on the limits of Earth’s ability to respond to damaging temperature increases.,3412,srpcbn,https://www.scientificamerican.com/article/earth-could-surpass-ability-of-ecosystems-to-recover-from-warming/,366,1644776945.0,xrm67,0.98,/r/collapse/comments/srpcbn/scientists_warn_that_some_parts_of_the_planet_are/,collapse,476177,2
"Redditors of all subs, Unite!",3400,oh2m1l,https://i.redd.it/vpw9sht3m8a71.jpg,328,1625858381.0,Aquatic_Ceremony,0.96,/r/collapse/comments/oh2m1l/redditors_of_all_subs_unite/,collapse,476177,2
Long COVID Experts and Advocates Say the Government Is Ignoring 'the Greatest Mass-Disabling Event in Human History',3371,xiq2os,https://time.com/6213103/us-government-long-covid-response/,589,1663624637.0,Mighty_L_LORT,0.97,/r/collapse/comments/xiq2os/long_covid_experts_and_advocates_say_the/,collapse,476177,2
I can’t be the only one..,3355,puki2t,https://i.redd.it/yba5sxggkgp71.jpg,115,1632492374.0,hourglass_curves,0.97,/r/collapse/comments/puki2t/i_cant_be_the_only_one/,collapse,476177,2
"Texas Power Plants Are Skipping Maintenance to Run Nonstop - ""Something is going to break."" - Bloomberg",3348,w0p3bt,https://archive.ph/hv2WQ,451,1658001696.0,BabyLlama-Drama,0.99,/r/collapse/comments/w0p3bt/texas_power_plants_are_skipping_maintenance_to/,collapse,476177,2
Footage from a ferry carrying passengers escaping the shores of Lake Evia in Greece,3352,ozuuqe,https://v.redd.it/puy69h673xf71,376,1628348547.0,QuartzPuffyStar,0.99,/r/collapse/comments/ozuuqe/footage_from_a_ferry_carrying_passengers_escaping/,collapse,476177,2
The Most Destructive Fire in Colorado History meets 'The American Chernobyl': the Developing Nuclear Disaster No One is Telling You About,3336,rtus8j,https://www.reddit.com/r/collapse/comments/rtus8j/the_most_destructive_fire_in_colorado_history/,532,1641077424.0,FishDisciple,0.98,/r/collapse/comments/rtus8j/the_most_destructive_fire_in_colorado_history/,collapse,476177,2
"Oh God, the Economy!",3338,p84itu,https://i.imgur.com/Pa3xPt1.jpg,149,1629463722.0,-_x,0.98,/r/collapse/comments/p84itu/oh_god_the_economy/,collapse,476177,2
I'm doing my part?,3327,qxj8ov,https://i.redd.it/2khlu7rw3iy71.jpg,202,1637337628.0,karabeckian,0.97,/r/collapse/comments/qxj8ov/im_doing_my_part/,collapse,476177,2
SCOTUS protesters plan to march on justices' homes after public doxing,3327,ujfaop,https://nypost.com/2022/05/05/supreme-court-surrounded-by-fence-after-roe-v-wade-protests/,793,1651810772.0,Did_I_Die,0.98,/r/collapse/comments/ujfaop/scotus_protesters_plan_to_march_on_justices_homes/,collapse,476177,2
Coronavirus has led to the largest ever drop in CO2 emissions! Which is....4%. Then you remember we need a 100% drop by 2050.,3327,fzcn41,https://www.carbonbrief.org/analysis-coronavirus-set-to-cause-largest-ever-annual-fall-in-co2-emissions,431,1586629019.0,veraknow,0.98,/r/collapse/comments/fzcn41/coronavirus_has_led_to_the_largest_ever_drop_in/,collapse,476177,2
"East Palestine train derailment killed more than 43,000 fish and animals, officials say",3313,11elood,https://www.usatoday.com/story/news/nation/2023/02/24/east-palestine-train-derailment-fish-animal-deaths/11337404002,145,1677622432.0,Mighty_L_LORT,0.99,/r/collapse/comments/11elood/east_palestine_train_derailment_killed_more_than/,collapse,476177,2
Coming To An America Near You,3303,zyysjm,https://i.redd.it/gbx1eky8y09a1.jpg,286,1672401371.0,Monsur_Ausuhnom,0.97,/r/collapse/comments/zyysjm/coming_to_an_america_near_you/,collapse,476177,2
Is America experiencing an unofficial general strike? | Robert Reich,3302,q9r2d1,https://www.theguardian.com/commentisfree/2021/oct/13/american-workers-general-strike-robert-reich,733,1634442225.0,Myth_of_Progress,0.98,/r/collapse/comments/q9r2d1/is_america_experiencing_an_unofficial_general/,collapse,476177,2
It's The Most Wonderful Time Of The Year,3277,zgpw20,https://i.redd.it/clxtj9l4ot4a1.jpg,348,1670569830.0,Monsur_Ausuhnom,0.89,/r/collapse/comments/zgpw20/its_the_most_wonderful_time_of_the_year/,collapse,476177,2
We are here to save you!,3265,qs7gyw,https://i.redd.it/cymtgz6e1a771.jpg,289,1636708650.0,Logiman43,0.99,/r/collapse/comments/qs7gyw/we_are_here_to_save_you/,collapse,476177,2
Where do you see yourself in 5 years?,3243,cxlomq,https://live.staticflickr.com/65535/48064948077_725c60066e_b.jpg,189,1567193377.0,Did_I_Die,0.99,/r/collapse/comments/cxlomq/where_do_you_see_yourself_in_5_years/,collapse,476177,2
tOuGh gUy is capable to survive in a collapsed society but can't make a little change,3243,r8gc4i,https://i.redd.it/3s5lk6t82g381.jpg,781,1638588131.0,bountyhunterfromhell,0.9,/r/collapse/comments/r8gc4i/tough_guy_is_capable_to_survive_in_a_collapsed/,collapse,476177,2
"57% of Americans can’t afford a $1,000 emergency expense, says new report",3224,10pkk62,https://fortune.com/recommends/article/57-percent-of-americans-cant-afford-a-1000-emergency-expense/,490,1675129086.0,Mighty_L_LORT,0.99,/r/collapse/comments/10pkk62/57_of_americans_cant_afford_a_1000_emergency/,collapse,476177,2
the real enemy illustrated,3217,izm4y2,https://funsubstance.com/uploads/original/28/28133.jpg,389,1601049654.0,Did_I_Die,0.96,/r/collapse/comments/izm4y2/the_real_enemy_illustrated/,collapse,476177,2
We are Gollum,3193,oui8jc,https://i.redd.it/bhqcgohwwbe71.png,114,1627641898.0,ontrack,0.98,/r/collapse/comments/oui8jc/we_are_gollum/,collapse,476177,2
I Feel Bad For Those Wiith Parents Who Dont Take Scientific Evidence Seriously,3189,m8spnj,https://i.redd.it/h4opc5yrp6n61.png,211,1616192371.0,worriedaboutyou55,0.95,/r/collapse/comments/m8spnj/i_feel_bad_for_those_wiith_parents_who_dont_take/,collapse,476177,2
"Twenty years, probably a bit optimistic.",3193,u47mka,https://i.redd.it/nmfjxu8jyot81.jpg,292,1650027886.0,doooompatrol,0.97,/r/collapse/comments/u47mka/twenty_years_probably_a_bit_optimistic/,collapse,476177,2
Elon Musk is One of the Biggest Charlatans of Our Techno-Hopium Age,3175,ma1t9j,https://www.reddit.com/r/collapse/comments/ma1t9j/elon_musk_is_one_of_the_biggest_charlatans_of_our/,752,1616348592.0,xrm67,0.92,/r/collapse/comments/ma1t9j/elon_musk_is_one_of_the_biggest_charlatans_of_our/,collapse,476177,2
Around 7.5 million people are poised to lose *all federal unemployment benefits* in a week. They’re going to $0 in jobless aid as delta cases + hospitalizations surge.,3178,pf8cfw,https://www.cnbc.com/2021/08/31/federal-unemployment-benefits-end-in-a-week-states-wont-extend-them.html,826,1630424276.0,If_I_Was_Vespasian,0.98,/r/collapse/comments/pf8cfw/around_75_million_people_are_poised_to_lose_all/,collapse,476177,2
"Millennials have 4 times less wealth than Baby Boomers did by age 34, control just 4.2% of all U.S. wealth",3178,jdqspw,https://www.newsweek.com/millennials-control-just-42-percent-us-wealth-4-times-poorer-baby-boomers-were-age-34-1537638,467,1603063857.0,metalreflectslime,0.99,/r/collapse/comments/jdqspw/millennials_have_4_times_less_wealth_than_baby/,collapse,476177,2
Take collapse with you wherever you go!,3170,dgna91,https://i.redd.it/ftoju0g20hr31.jpg,68,1570837476.0,saul2015,0.99,/r/collapse/comments/dgna91/take_collapse_with_you_wherever_you_go/,collapse,476177,2
Siberian Arctic Ice STILL hasn’t started refreezing... and it’s October,3169,j6nl18,https://i.redd.it/4qar4vas1nr51.jpg,361,1602061480.0,oxpea54,0.99,/r/collapse/comments/j6nl18/siberian_arctic_ice_still_hasnt_started/,collapse,476177,2
UN Warns of ‘Total Societal Collapse’ Due to Breaching of Planetary Boundaries,3168,uzztr1,https://bylinetimes.com/2022/05/26/un-warns-of-total-societal-collapse-due-to-breaching-of-planetary-boundaries,509,1653784013.0,Lilyo,0.98,/r/collapse/comments/uzztr1/un_warns_of_total_societal_collapse_due_to/,collapse,476177,2
"Capitalism Will Ruin the Earth By 2050, Scientists Say",3142,jnzd30,https://www.vice.com/en/article/v7m48d/capitalism-will-ruin-the-earth-by-2050-scientists-say,483,1604506123.0,conscsness,0.94,/r/collapse/comments/jnzd30/capitalism_will_ruin_the_earth_by_2050_scientists/,collapse,476177,2
Greta Thunberg: “Our politicians will not come to the rescue of planet Earth”,3132,y8rq1m,https://www.newstatesman.com/environment/2022/10/greta-thunberg-guest-edit-politicians-rescue-planet,434,1666251595.0,Goatmannequin,0.95,/r/collapse/comments/y8rq1m/greta_thunberg_our_politicians_will_not_come_to/,collapse,476177,2
Report: 61% of Americans overall were living paycheck to paycheck in April 2022,3114,v51la2,https://www.marketwatch.com/story/1-in-3-americans-earning-250-000-or-more-say-they-live-paycheck-to-paycheck-are-they-really-11654271836,288,1654387938.0,return2ozma,0.99,/r/collapse/comments/v51la2/report_61_of_americans_overall_were_living/,collapse,476177,2
When A Charity Website Is Peoples Safety Net From Bankruptcy,3103,lthnkc,https://i.redd.it/2y4uvufasni61.jpg,93,1614405513.0,worriedaboutyou55,0.99,/r/collapse/comments/lthnkc/when_a_charity_website_is_peoples_safety_net_from/,collapse,476177,2
An email urging lower wages for new employees due to higher gas prices sparks walkout at Lawrence Applebee’s,3104,tp21cg,https://www2.ljworld.com/news/general-news/2022/mar/23/an-email-urging-lower-wages-for-new-employees-due-to-higher-gas-prices-sparks-walkout-at-lawrence-applebees/,202,1648324400.0,Mighty_L_LORT,0.99,/r/collapse/comments/tp21cg/an_email_urging_lower_wages_for_new_employees_due/,collapse,476177,2
Playing video games as a kid vs as an adult,3092,u44297,https://i.redd.it/q7n4jeffpmt81.png,163,1650014216.0,dumnezero,0.98,/r/collapse/comments/u44297/playing_video_games_as_a_kid_vs_as_an_adult/,collapse,476177,2
"Humans Are Doomed to Go Extinct: Habitat degradation, low genetic variation and declining fertility are setting Homo sapiens up for collapse",3073,r5toux,https://www.scientificamerican.com/article/humans-are-doomed-to-go-extinct/,532,1638296502.0,xrm67,0.96,/r/collapse/comments/r5toux/humans_are_doomed_to_go_extinct_habitat/,collapse,476177,2
"U.S. sets somber record as Covid deaths surpass 800,000, more than any other country",3068,rfkvf9,https://www.nbcnews.com/news/us-news/least-800000-americans-died-covid-rcna8380,827,1639416143.0,Mighty_L_LORT,0.95,/r/collapse/comments/rfkvf9/us_sets_somber_record_as_covid_deaths_surpass/,collapse,476177,2
"1-in-1,000 year flood hits Dallas as entire Summer's worth of rain falls in one night.",3078,wv6uog,https://www.texastribune.org/2022/08/22/dallas-flooding-fort-worth/,461,1661206338.0,FlowerDance2557,0.99,/r/collapse/comments/wv6uog/1in1000_year_flood_hits_dallas_as_entire_summers/,collapse,476177,2
"58% of Americans are living paycheck to paycheck after inflation spike — including 30% of those earning $250,000 or more",3064,vm2yzc,https://www.cnbc.com/2022/06/27/more-than-half-of-americans-live-paycheck-to-paycheck-amid-inflation.html,429,1656356233.0,metalreflectslime,0.98,/r/collapse/comments/vm2yzc/58_of_americans_are_living_paycheck_to_paycheck/,collapse,476177,2
"I was in the grocery store around midnight. I saw a 20 year old guy teaching an old man how to stock shelves. The old man looked to be around 70 years or so, and seemed so tired. It made me feel sad.",3060,oikdxu,https://www.reddit.com/r/collapse/comments/oikdxu/i_was_in_the_grocery_store_around_midnight_i_saw/,731,1626065750.0,If_I_Was_Vespasian,0.97,/r/collapse/comments/oikdxu/i_was_in_the_grocery_store_around_midnight_i_saw/,collapse,476177,2
"Mexico City had a crazy hail storm today, looks as if it snowed for hours.",3049,vcbc32,https://v.redd.it/sh723s4pmm591,269,1655234659.0,return2ozma,0.99,/r/collapse/comments/vcbc32/mexico_city_had_a_crazy_hail_storm_today_looks_as/,collapse,476177,2
"‘At 75, I still have to work’: millions of Americans can’t afford to retire",3034,rgvfxm,https://www.theguardian.com/money/2021/dec/13/americans-retire-work-social-security,836,1639561262.0,krink1487,0.99,/r/collapse/comments/rgvfxm/at_75_i_still_have_to_work_millions_of_americans/,collapse,476177,2
The end is here. And it was manufactured by the failure of the american capitalism.,3039,h0an6p,https://i.redd.it/37ma4bdn03451.png,323,1591794703.0,TheTanzanite,0.96,/r/collapse/comments/h0an6p/the_end_is_here_and_it_was_manufactured_by_the/,collapse,476177,2
The meat industry is borrowing tactics from Big Oil to obfuscate the truth about climate change,3034,yu2htw,https://www.salon.com/2022/11/11/the-meat-industry-is-borrowing-tactics-from-big-oil-to-obfuscate-the-truth-about-climate-change/,471,1668348082.0,Monsur_Ausuhnom,0.96,/r/collapse/comments/yu2htw/the_meat_industry_is_borrowing_tactics_from_big/,collapse,476177,2
This is why we have doomed ourselves. No one listened when there was still a chance. And they still aren't listening.,3014,10mihfk,https://i.redd.it/parvxwc4lkea1.png,515,1674818349.0,temporvicis,0.96,/r/collapse/comments/10mihfk/this_is_why_we_have_doomed_ourselves_no_one/,collapse,476177,2
Are you ready for 2021?,2998,kob20q,https://i.redd.it/lpb307pxzp861.png,255,1609506609.0,haaany,0.98,/r/collapse/comments/kob20q/are_you_ready_for_2021/,collapse,476177,2
Solving the Climate Crisis Requires the End of Capitalism,2995,q841vu,https://www.resilience.org/stories/2021-10-13/solving-the-climate-crisis-requires-the-end-of-capitalism/,539,1634231255.0,-_x,0.92,/r/collapse/comments/q841vu/solving_the_climate_crisis_requires_the_end_of/,collapse,476177,2
The easy answer,2991,jl383s,https://i.redd.it/x86nalmr7aw51.png,313,1604085413.0,quadautomaticwervice,0.98,/r/collapse/comments/jl383s/the_easy_answer/,collapse,476177,2
Florida is set to experience a heat dome next week with potential for record-setting temperatures,2977,vesro2,https://i.redd.it/06rl2adpk9691.jpg,749,1655507655.0,vegandread,0.99,/r/collapse/comments/vesro2/florida_is_set_to_experience_a_heat_dome_next/,collapse,476177,2
"Ketchum considering tent city for workers amid 'crushing inequality,' scarce affordable housing ""These are the people who work at your school. These are the people that work at your local business. These are the people who serve you.""",2978,s16i0t,https://www.ktvb.com/article/news/local/growing-idaho/affordable-housing-ketchum-rent-blaine-county-crisis-park-tents/277-6dcd3da9-7ce7-4722-81de-b1e379e0300a,579,1641883182.0,Bluest_waters,0.99,/r/collapse/comments/s16i0t/ketchum_considering_tent_city_for_workers_amid/,collapse,476177,2
"Killing people for the ""economy"" is human sacrifice and fascist as fuck.",2970,rnieax,https://i.redd.it/0ffvy5f0tp681.jpg,216,1640336589.0,Goatmannequin,0.96,/r/collapse/comments/rnieax/killing_people_for_the_economy_is_human_sacrifice/,collapse,476177,2
Study: More than half of young people think 'humanity is doomed',2959,poe11w,https://grist.org/article/climate-anxiety-study-young-people-think-humanity-is-doomed/,465,1631661352.0,Vailhem,0.99,/r/collapse/comments/poe11w/study_more_than_half_of_young_people_think/,collapse,476177,2
"As inflation heats up, 64% of Americans are now living paycheck to paycheck",2949,t9kft5,https://www.cnbc.com/2022/03/08/as-prices-rise-64-percent-of-americans-live-paycheck-to-paycheck.html,467,1646756394.0,metalreflectslime,0.99,/r/collapse/comments/t9kft5/as_inflation_heats_up_64_of_americans_are_now/,collapse,476177,2
BuT tHe EcOnOmY,2949,nhsirq,https://i.redd.it/6c9dbedr6h071.jpg,145,1621603673.0,bountyhunterfromhell,0.99,/r/collapse/comments/nhsirq/but_the_economy/,collapse,476177,2
"Mass sabotage of French cement plant: 500 activists in new French eco-sabotage movement damage electrical devices, cables, vehicles & construction equipment at one of the country's biggest co2 emitters premises.",2946,zkfanl,https://twitter.com/illwilleditions/status/1601937473499799552,341,1670887481.0,-druesukker,0.99,/r/collapse/comments/zkfanl/mass_sabotage_of_french_cement_plant_500/,collapse,476177,2
Saudi Arabia Reveals Oil Output Is Near Its Ceiling - The world’s biggest crude producer has less capacity than previously anticipated.,2945,w4hkxz,https://www.bloomberg.com/opinion/articles/2022-07-20/saudi-arabia-reveals-oil-output-is-near-its-ceiling,467,1658412395.0,Myth_of_Progress,0.99,/r/collapse/comments/w4hkxz/saudi_arabia_reveals_oil_output_is_near_its/,collapse,476177,2
"Children born today will see literally thousands of animals disappear in their lifetime, as global food webs collapse",2931,zrg6lc,https://theconversation.com/children-born-today-will-see-literally-thousands-of-animals-disappear-in-their-lifetime-as-global-food-webs-collapse-196286,205,1671617200.0,dumnezero,0.98,/r/collapse/comments/zrg6lc/children_born_today_will_see_literally_thousands/,collapse,476177,2
40 percent of America's baby formula supplies are out of stock,2930,umogyn,https://www.nbcnews.com/business/consumer/baby-formula-shortage-recall-low-inventory-rcna27937,498,1652205001.0,Mighty_L_LORT,0.98,/r/collapse/comments/umogyn/40_percent_of_americas_baby_formula_supplies_are/,collapse,476177,2
These Type Of Ads Should Be Everywhere,2927,jxy1ch,https://i.imgur.com/h92loRK.jpg,71,1605908091.0,worriedaboutyou55,0.99,/r/collapse/comments/jxy1ch/these_type_of_ads_should_be_everywhere/,collapse,476177,2
How are y’all?,2907,v9kxs3,https://i.redd.it/7gsxiiowsv491.jpg,187,1654905070.0,hourglass_curves,0.99,/r/collapse/comments/v9kxs3/how_are_yall/,collapse,476177,2
Eat the rich! Why millennials and generation Z have turned their backs on capitalism,2897,ps479a,https://www.theguardian.com/politics/2021/sep/20/eat-the-rich-why-millennials-and-generation-z-have-turned-their-backs-on-capitalism,724,1632173080.0,-_x,0.96,/r/collapse/comments/ps479a/eat_the_rich_why_millennials_and_generation_z/,collapse,476177,2
i'M a BaDaSs,2879,10h2c71,https://i.redd.it/viss99m9v9da1.jpg,601,1674234674.0,bountyhunterfromhell,0.91,/r/collapse/comments/10h2c71/im_a_badass/,collapse,476177,2
Some farmers in the USA are predicting a shortage of food in 2022.,2882,tyr6kz,https://i.redd.it/61nq48ydq5q81.png,433,1649378352.0,metalreflectslime,0.95,/r/collapse/comments/tyr6kz/some_farmers_in_the_usa_are_predicting_a_shortage/,collapse,476177,2
But The Economy,2873,zhcdj1,https://i.redd.it/zn6sic3ziy4a1.jpg,78,1670628603.0,Monsur_Ausuhnom,0.98,/r/collapse/comments/zhcdj1/but_the_economy/,collapse,476177,2
"'We don’t have enough' lithium globally to meet EV targets, mining CEO says",2871,x6vbjr,https://news.yahoo.com/lithium-supply-ev-targets-miner-181513161.html,667,1662422265.0,IndicationOver,0.98,/r/collapse/comments/x6vbjr/we_dont_have_enough_lithium_globally_to_meet_ev/,collapse,476177,2
This 100% solar community endured Hurricane Ian with no loss of power and minimal damage | CNN,2861,xtscqg,https://www.cnn.com/2022/10/02/us/solar-babcock-ranch-florida-hurricane-ian-climate/index.html,149,1664726477.0,Monsur_Ausuhnom,0.97,/r/collapse/comments/xtscqg/this_100_solar_community_endured_hurricane_ian/,collapse,476177,2
Europan gas prices triple in a flash and reach 600% increase over the same time last year,2859,t8ldph,https://i.redd.it/17msp6kpixl81.png,519,1646644944.0,NORATHEDESTROYER,0.98,/r/collapse/comments/t8ldph/europan_gas_prices_triple_in_a_flash_and_reach/,collapse,476177,2
Amtrak cancels all long-distance trains ahead of potential freight rail shutdown,2844,xec4vp,https://www.usatoday.com/story/news/politics/2022/09/14/amtrak-cancels-train-freight-rail-strike-looming/10380518002/,349,1663186741.0,IndicationOver,0.98,/r/collapse/comments/xec4vp/amtrak_cancels_all_longdistance_trains_ahead_of/,collapse,476177,2
Some people start to engage in small acts of sabotage because of the climate crisis.,2841,ug6tuh,https://i.redd.it/lcgycgh8ftw81.jpg,442,1651431773.0,-druesukker,0.9,/r/collapse/comments/ug6tuh/some_people_start_to_engage_in_small_acts_of/,collapse,476177,2
