title,score,id,url,num_comments,created,author,upvote_ratio,permalink,subreddit,subreddit_subscribers,depth
"In the Little Mermaid (1991), Ariel meets an African mermaid from the Ivory Coast. This is because mermaids are fictional and can be black.",115355,xdzgw0,https://i.redd.it/n50mclrp7tn91.png,80,1663154887.0,PeterPorky,0.77,/r/shittymoviedetails/comments/xdzgw0/in_the_little_mermaid_1991_ariel_meets_an_african/,shittymoviedetails,954480,3
"In Watchmen (2009), the patterns on Rorschach's mask constantly shift around and show various images of my parents fighting",93886,n74h8n,https://i.redd.it/zj0x494kkqx61.jpg,525,1620409861.0,AdvocateSaint,0.97,/r/shittymoviedetails/comments/n74h8n/in_watchmen_2009_the_patterns_on_rorschachs_mask/,shittymoviedetails,954480,3
"In The Incredibles (2005), Mr. Incredible was captured with Load-Increasing Gravity Molecular-Apprehender (LIGMA) Balls",86626,u9xgbt,https://i.redd.it/4l86ta65j7v81.gif,354,1650688686.0,AdvocateSaint,0.96,/r/shittymoviedetails/comments/u9xgbt/in_the_incredibles_2005_mr_incredible_was/,shittymoviedetails,954480,3
"In Pixar’s Elemental (2023), two opposites have to go a journey together and annoy one another but then develop a bond. Then there’s a misunderstanding before the third act and they get mad and separate. Then realize they love one another and rescue each other at the end. Just a guess",84889,yykv7l,https://i.redd.it/74zb5psgcr0a1.jpg,1909,1668780250.0,fuzzy_dice_99,0.92,/r/shittymoviedetails/comments/yykv7l/in_pixars_elemental_2023_two_opposites_have_to_go/,shittymoviedetails,954480,3
"Despite his name, actor Adam Driver was not consider for a role in Baby Driver (2017). This is because he was 33 when the film came out, meaning he was an Adult Driver.",80755,elbq8u,https://i.imgur.com/v6IFYmX.jpg,283,1578404655.0,WorkThatFunction,0.95,/r/shittymoviedetails/comments/elbq8u/despite_his_name_actor_adam_driver_was_not/,shittymoviedetails,954480,3
"In Jumanji: Welcome to the Jungle (2017), Dwayne Johnson's avatar did not have the power to read the map. This is because paper beats Rock.",76456,emphkh,https://i.redd.it/yf46y4zxnx941.png,268,1578654251.0,skyfall91404,0.96,/r/shittymoviedetails/comments/emphkh/in_jumanji_welcome_to_the_jungle_2017_dwayne/,shittymoviedetails,954480,3
The dump truck from Cars 2 previously made an appearance in The Incredibles (2004).,76046,o7l9c1,https://i.redd.it/9v5diuz76e771.jpg,562,1624618111.0,pale_guy_,0.95,/r/shittymoviedetails/comments/o7l9c1/the_dump_truck_from_cars_2_previously_made_an/,shittymoviedetails,954480,3
PLEASE BELIEVE ME! THEY ACTUALLY MADE A MEN IN BLACK SPIN-OFF WITH CHRIS HEMSWORTH AND IT BOMBED AND NO ONE CAN REMEMB-,72383,w72v9v,https://v.redd.it/hag67r5bbkd91,1133,1658688732.0,NotSureHowThingsWork,0.94,/r/shittymoviedetails/comments/w72v9v/please_believe_me_they_actually_made_a_men_in/,shittymoviedetails,954480,3
"In Wonder Woman 1984, Steve is amazed by an escalator despite them being commonly used in stores by the time he died in 1918. This is a reference to how bad the script is.",71805,qppxtj,https://i.redd.it/2eq68zk0egy71.jpg,1091,1636413293.0,ccznen,0.97,/r/shittymoviedetails/comments/qppxtj/in_wonder_woman_1984_steve_is_amazed_by_an/,shittymoviedetails,954480,3
Action 🎬,65305,bx3yqh,https://i.redd.it/igmfdj175k231.jpg,178,1559749047.0,SleepyGary5,0.98,/r/shittymoviedetails/comments/bx3yqh/action/,shittymoviedetails,954480,3
"In Iron Man (2008), Iron Man is green because I am colorblind.",61880,dtvl5m,https://i.redd.it/dh3srf7jrnx31.jpg,435,1573304190.0,skyfall91404,0.96,/r/shittymoviedetails/comments/dtvl5m/in_iron_man_2008_iron_man_is_green_because_i_am/,shittymoviedetails,954480,3
"In Star Wars: The Last Jedi (2017), Praetorian Guards' helmets have no eyeholes, making them look inhuman and menacing. This also means they can't see shit and frequently run in random directions and attack absolutely nothing.",61589,uvxo2i,https://i.redd.it/9yfjsg5bj7191.gif,2343,1653303844.0,AdvocateSaint,0.92,/r/shittymoviedetails/comments/uvxo2i/in_star_wars_the_last_jedi_2017_praetorian_guards/,shittymoviedetails,954480,3
"Star Wars actor Jake Lloyd tried his best in 1999’s “The Phantom Menace”, and thats all that matters",60877,j0kgma,https://i.redd.it/spexeoae7mp51.jpg,925,1601179563.0,SleepyGary5,0.94,/r/shittymoviedetails/comments/j0kgma/star_wars_actor_jake_lloyd_tried_his_best_in/,shittymoviedetails,954480,3
"In episode 3 of The Last of Us (2023), the characters Bill and Frank kiss multiple times throughout the episode, which shows that they are very good friends",60429,10rown3,https://i.redd.it/82sknuszsrfa1.png,993,1675341645.0,kamaano,0.8,/r/shittymoviedetails/comments/10rown3/in_episode_3_of_the_last_of_us_2023_the/,shittymoviedetails,954480,3
"In the Force Awakens, Adam 'Driver' kills Harrison 'Ford'. This is a reference to the fact i crashed my dads Focus.",59439,dp3xdw,https://i.redd.it/fug8ec5v3nv31.jpg,183,1572424511.0,Awlatif10,0.94,/r/shittymoviedetails/comments/dp3xdw/in_the_force_awakens_adam_driver_kills_harrison/,shittymoviedetails,954480,3
"In ""Transformers"" (2007), Sam screams in fear when he first encounters a transformer. This implies that Sam has transphobia.",59425,v1eu3f,https://v.redd.it/rqtpnw1crp291,438,1653960210.0,Penguin-Monk,0.92,/r/shittymoviedetails/comments/v1eu3f/in_transformers_2007_sam_screams_in_fear_when_he/,shittymoviedetails,954480,3
"In Harry Potter and the Sorcerer's Stone (2001), Nearly Headless Nick was a poorly executed character.",57901,isku5u,https://gfycat.com/nicepettyfoal,335,1600090084.0,RayInRed,0.94,/r/shittymoviedetails/comments/isku5u/in_harry_potter_and_the_sorcerers_stone_2001/,shittymoviedetails,954480,3
"In Avengers: Endgame (2019), Thanos says ""I am inevitable"". This is a mistake from the filmmakers because he is actually Thanos.",55784,dcs5c8,https://i.redd.it/sk9nb6lgccq31.gif,194,1570115123.0,RayInRed,0.95,/r/shittymoviedetails/comments/dcs5c8/in_avengers_endgame_2019_thanos_says_i_am/,shittymoviedetails,954480,3
"Despite being a walker, Paul Walker was cast in the Fast & Furious movies because the director couldn't get Adam Driver for the lead role.",55220,ke74fo,https://i.redd.it/7a21e7h05j561.jpg,277,1608116011.0,pale_guy_,0.94,/r/shittymoviedetails/comments/ke74fo/despite_being_a_walker_paul_walker_was_cast_in/,shittymoviedetails,954480,3
In The Shawshank Redemption (1994) Brooks hangs himself. This is a reference to what I’m going to do if I see another fucking Morbius post,53757,v6tokw,https://i.redd.it/r0pg7rz3w6491.jpg,513,1654603475.0,KermitTheFraud92,0.94,/r/shittymoviedetails/comments/v6tokw/in_the_shawshank_redemption_1994_brooks_hangs/,shittymoviedetails,954480,3
Actor Finn Wolfhard was not considered for a role in the 1990 screen adaptation of Stephen Kings “It” due this his being born in 2002 and the constraints imposed by a linear understanding of time.,53409,d3rv7j,https://i.redd.it/jjqxftgv2em31.jpg,190,1568392584.0,SleepyGary5,0.96,/r/shittymoviedetails/comments/d3rv7j/actor_finn_wolfhard_was_not_considered_for_a_role/,shittymoviedetails,954480,3
"In ""The Godfather"" (1972), much of the movie is very low quality and stutters frequently. This is because I'm watching it on Reddit's video player.",53016,vkeaj6,https://i.redd.it/loedq2rmjr791.gif,211,1656161068.0,Penguin-Monk,0.94,/r/shittymoviedetails/comments/vkeaj6/in_the_godfather_1972_much_of_the_movie_is_very/,shittymoviedetails,954480,3
"Before the final battle in Morbius (2022), Dr. Morbius prepares a weaponized anticoagulant, explaining that ""to bats... it's lethal. To humans, it's deadly."" Who the fuck wrote this shit?",52620,txdbjo,https://i.redd.it/d5tmvdb30ur81.jpg,1983,1649217401.0,AdvocateSaint,0.96,/r/shittymoviedetails/comments/txdbjo/before_the_final_battle_in_morbius_2022_dr/,shittymoviedetails,954480,3
"In Pirates of the Caribbean: The Curse of the Black Pearl (2003), an air-filled boat of this volume would require a literal ton of weight to submerge it. This was possible because of Captain Jack Sparrow's massive balls",50266,usks8z,https://i.redd.it/zb2hxzxeda091.gif,787,1652902310.0,AdvocateSaint,0.85,/r/shittymoviedetails/comments/usks8z/in_pirates_of_the_caribbean_the_curse_of_the/,shittymoviedetails,954480,3
The same woman who appears as a background extra in this George Clooney scene in Ocean's Thirteen (2007) also appears in the background of a George Clooney scene in Gravity (2013),49847,neju4w,https://i.redd.it/j7qwmumncpz61.jpg,204,1621266755.0,KscILLBILL,0.94,/r/shittymoviedetails/comments/neju4w/the_same_woman_who_appears_as_a_background_extra/,shittymoviedetails,954480,3
"In Dark Phoenix (2019) Charles Xavier made his students wear an ""X"" on their chests so that the enemy would aim at them instead of him.",49775,lw064r,https://i.redd.it/vs6uh0snrlk61.jpg,562,1614685562.0,pale_guy_,0.96,/r/shittymoviedetails/comments/lw064r/in_dark_phoenix_2019_charles_xavier_made_his/,shittymoviedetails,954480,3
A plothole in The Godfather Part 2 (1974) is that the Statue of Liberty can be seen in the 1910’s even though it didn’t come to america till..... nevermind I was wrong. Just googled it and it arrived in 1885. My bad guys,49518,icn1zc,https://i.redd.it/9qs1t16shyh51.jpg,316,1597841555.0,KermitTheFraud92,0.92,/r/shittymoviedetails/comments/icn1zc/a_plothole_in_the_godfather_part_2_1974_is_that/,shittymoviedetails,954480,3
Zoe Saldana is one red alien away from a complete RGB,48792,xotxtr,https://i.redd.it/fkdus98md9q91.jpg,387,1664222263.0,AdvocateSaint,0.95,/r/shittymoviedetails/comments/xotxtr/zoe_saldana_is_one_red_alien_away_from_a_complete/,shittymoviedetails,954480,3
In Home Alone 6 (2021) jesus fucking christ there's six of them just fucking stop it stopped being good after the second one stop milking it it's a 40 year old franchise jesus fucking christ disney why,48393,xnqycm,https://i.redd.it/o10x8zln01q91.png,816,1664121058.0,ArcticFox19,0.92,/r/shittymoviedetails/comments/xnqycm/in_home_alone_6_2021_jesus_fucking_christ_theres/,shittymoviedetails,954480,3
"In Doctor Strange (2016), Doctor Strange can be seen defeating his enemy, an apple. This is because an apple a day keeps the doctor away.",48091,epzhg9,https://i.redd.it/uoa7m1vqwbb41.png,167,1579262547.0,skyfall91404,0.97,/r/shittymoviedetails/comments/epzhg9/in_doctor_strange_2016_doctor_strange_can_be_seen/,shittymoviedetails,954480,3
"In Return of the Jedi, Luke Skywalker does not turn to the dark side. This is because Palpatine forgot to tell him the tragedy of Darth Plagueis the Wise",47405,efqg53,https://i.redd.it/uk3oa2ediw641.png,423,1577332681.0,Likestuff12,0.95,/r/shittymoviedetails/comments/efqg53/in_return_of_the_jedi_luke_skywalker_does_not/,shittymoviedetails,954480,3
"In ""Road to El Dorado"" (2000), if you look closely, you'll notice she was no where near his face. My man was getting mouth hug.",45921,ur8gvt,https://i.redd.it/fotisudr4xz81.gif,737,1652741924.0,Penguin-Monk,0.92,/r/shittymoviedetails/comments/ur8gvt/in_road_to_el_dorado_2000_if_you_look_closely/,shittymoviedetails,954480,3
"In cars (2006) Lightning McQueen shows his dishonesty early in the film when he states ""I am speed"" when actually he is in fact, a car.",43814,c18g0y,https://i.redd.it/xmms2okp1p431.jpg,154,1560680103.0,Jonhinchliffe10,0.96,/r/shittymoviedetails/comments/c18g0y/in_cars_2006_lightning_mcqueen_shows_his/,shittymoviedetails,954480,3
"For Justice League (2017), Ezra Miller rigorously trained for six months in the art of ""running."" The results look impressive, and you can barely notice that he moves like he's never seen a human being running before.",43412,u4sne4,https://i.redd.it/i80qii0lgut81.gif,580,1650094494.0,AdvocateSaint,0.94,/r/shittymoviedetails/comments/u4sne4/for_justice_league_2017_ezra_miller_rigorously/,shittymoviedetails,954480,3
"In Doctor Strange in the Multiverse of Madness (2022) Peggy was originally going to say the line ""It's pegging time!"" but the studio removed it due to undisclosed reasons.",42813,x2bbjq,https://i.redd.it/rx3nfj1nb1l91.png,285,1661945837.0,pale_guy_,0.93,/r/shittymoviedetails/comments/x2bbjq/in_doctor_strange_in_the_multiverse_of_madness/,shittymoviedetails,954480,3
"In Spiderman Far From Home, Peter likes MJ. Possibly suggesting that he is heterosexual.",42660,civ3s6,https://i.redd.it/rp5ptqfjc1d31.jpg,630,1564315814.0,Awlatif10,0.95,/r/shittymoviedetails/comments/civ3s6/in_spiderman_far_from_home_peter_likes_mj/,shittymoviedetails,954480,3
"In Cast Away (2000), Tom Hanks is stuck on an island and befriended a volleyball rather than the cameraman.",42542,wut02q,https://i.redd.it/8zrt4oxei9j91.jpg,147,1661173195.0,pale_guy_,0.93,/r/shittymoviedetails/comments/wut02q/in_cast_away_2000_tom_hanks_is_stuck_on_an_island/,shittymoviedetails,954480,3
"In Joker (2019), there is a scene where the titular character is sitting in a bus and staring out the window. This is a reference to the movie's biggest influence, the critically acclaimed Fred: The Movie (2010)",42406,wmjo18,https://i.redd.it/8mwzt931w9h91.png,220,1660306066.0,kamaano,0.93,/r/shittymoviedetails/comments/wmjo18/in_joker_2019_there_is_a_scene_where_the_titular/,shittymoviedetails,954480,3
"In Tangled (2010), the red circle is not reflected in the mirror. Shitty job from the animators part.",42252,o0bpr3,https://i.redd.it/pfk9g5lipqp31.jpg,228,1623755050.0,RayInRed,0.91,/r/shittymoviedetails/comments/o0bpr3/in_tangled_2010_the_red_circle_is_not_reflected/,shittymoviedetails,954480,3
"Encanto (2021) is a classic magical realism movie. It blends realism, like a traditional Colombian village, with things that are impossible, such as an abuela admitting she was wrong about something.",42014,rta6z0,https://i.imgur.com/1YyP4Ks.jpg,731,1641006777.0,Gniphe,0.96,/r/shittymoviedetails/comments/rta6z0/encanto_2021_is_a_classic_magical_realism_movie/,shittymoviedetails,954480,3
In the beginning of Joker (2019) there’s a familiar face in the mirror.,41392,fvixks,https://i.redd.it/jijt3vi8p1r41.jpg,288,1586112489.0,123batman456,0.94,/r/shittymoviedetails/comments/fvixks/in_the_beginning_of_joker_2019_theres_a_familiar/,shittymoviedetails,954480,3
"In the newest Wakanda Forever trailer [2022], Black Panther is revealed to be female. This is a reference to the failures of public education, which did not prepare me for the reality that panthers can not only be female, but also transphobic, racist, antivax, and climate skeptic.",41093,xusmd3,https://i.redd.it/tzq0n8dt4nr91.jpg,146,1664824637.0,Absalom98,0.76,/r/shittymoviedetails/comments/xusmd3/in_the_newest_wakanda_forever_trailer_2022_black/,shittymoviedetails,954480,3
In Captain America: The First Avenger (2011) Marvel acknowledges the existence of Hitler in their universe. This would also mean that Hitler is eligible to be added to the list of top 10 MCU villains.,40857,waaozi,https://i.redd.it/1nlfkufxebe91.jpg,590,1659016713.0,pale_guy_,0.95,/r/shittymoviedetails/comments/waaozi/in_captain_america_the_first_avenger_2011_marvel/,shittymoviedetails,954480,3
"In Morbius (2022), there's a scene where Detective Rodriguez tries to lure a cat by shaking its litter box and saying, ""here kitty kitty."" The idea that you can attract something by shaking a box of shit in front of it is a reference to Sony promoting this film to us for 2 years.",40562,txjmmb,https://i.redd.it/d6ll1nb94wr81.jpg,443,1649243163.0,AdvocateSaint,0.97,/r/shittymoviedetails/comments/txjmmb/in_morbius_2022_theres_a_scene_where_detective/,shittymoviedetails,954480,3
"Fast Times at Ridgemont High (1982) makes a bold decision to open, without context, in the middle of this swimming pool scene. At least, that's what a lot of people in my town think, because this is where the VHS was parked every time I returned it to the video store.",40259,la96pz,https://i.imgur.com/KIzjzb4.jpg,478,1612201667.0,KscILLBILL,0.94,/r/shittymoviedetails/comments/la96pz/fast_times_at_ridgemont_high_1982_makes_a_bold/,shittymoviedetails,954480,3
Nick Fury's name has only one eye in it.,38854,ekc3kv,https://i.redd.it/y6biqmx38y841.jpg,164,1578225163.0,skyfall91404,0.95,/r/shittymoviedetails/comments/ekc3kv/nick_furys_name_has_only_one_eye_in_it/,shittymoviedetails,954480,3
In Superbad (2007) McLovin and the cops become close friends. This is a reference to the fact that cops are usually friendly with white dudes.,38844,kx3xnc,https://i.redd.it/zcitg580aab61.jpg,446,1610623816.0,pale_guy_,0.82,/r/shittymoviedetails/comments/kx3xnc/in_superbad_2007_mclovin_and_the_cops_become/,shittymoviedetails,954480,3
"In Wonder Woman (2017) Connie Nielsen plays Jeff Bezos, the leader of the Amazons.",38627,nsu9dy,https://i.redd.it/0sq4twz9tf371.jpg,182,1622894578.0,pale_guy_,0.93,/r/shittymoviedetails/comments/nsu9dy/in_wonder_woman_2017_connie_nielsen_plays_jeff/,shittymoviedetails,954480,3
"The only two white actors in Black Panther are Martin Freeman, who played Bilbo Baggins, and Andy Serkis who played Gollum. They're the Tolkien white guys.",37860,f3noy9,https://i.redd.it/kcwuruakd5j21.jpg,252,1581658896.0,RayInRed,0.8,/r/shittymoviedetails/comments/f3noy9/the_only_two_white_actors_in_black_panther_are/,shittymoviedetails,954480,3
"Thanks to tireless research by a team of scientists, we now know Avengers: Infinity War (2018) was a work of fiction.",37025,smxk2e,https://i.redd.it/icepjozvhgg81.jpg,562,1644259600.0,ccznen,0.95,/r/shittymoviedetails/comments/smxk2e/thanks_to_tireless_research_by_a_team_of/,shittymoviedetails,954480,3
She-Hulk: Attorney at Law (2022) made many Marvel fans angry which gives it an immersive experience because that is what the Hulk is all about.,36952,x86u6m,https://i.redd.it/q8uim2yr6gm91.jpg,396,1662561539.0,pale_guy_,0.84,/r/shittymoviedetails/comments/x86u6m/shehulk_attorney_at_law_2022_made_many_marvel/,shittymoviedetails,954480,3
"If you plan to go as Jeffrey Dahmer for Halloween because of the show Dahmer - Monster : The Jeffrey Dahmer Story (2022), I think that's totally awesome. But i would suggest you don't cheap out on the costume, so make sure you also get murdered in prison for being a cannibal rapist like he was.",36365,ygwl9a,https://i.redd.it/r7kxj8sx1vw91.jpg,612,1667081745.0,theDart,0.88,/r/shittymoviedetails/comments/ygwl9a/if_you_plan_to_go_as_jeffrey_dahmer_for_halloween/,shittymoviedetails,954480,3
"In Shrek, Shrek is green. In Encanto, Bruno is green. I don't think these facts are related. I just wanted you guys to read all of this text for no reason. Wasting precious seconds of your life away, getting closer and closer to death.",36222,xzm7kv,https://i.redd.it/vsou7m5dcss91.png,298,1665323574.0,Tokyono,0.85,/r/shittymoviedetails/comments/xzm7kv/in_shrek_shrek_is_green_in_encanto_bruno_is_green/,shittymoviedetails,954480,3
"In this scene from The Shining (1980), Dick Hallorann says ""...they turned out to be completely unreliable assholes."" This is a reference to my ""friend"" Brad and his sister who forgot to pick me up from the airport today. I'm posting this from a $150 Uber.",36192,oryw3y,https://i.redd.it/cxf5sk188kd71.png,249,1627306700.0,KscILLBILL,0.95,/r/shittymoviedetails/comments/oryw3y/in_this_scene_from_the_shining_1980_dick/,shittymoviedetails,954480,3
"In The Matrix (1999), Neo's passport expires on 09/11/2001. This is because his passport was issued on 09/12/1991 and valid only for 10 years.",36159,nwkrv0,https://i.imgur.com/O44u0UB.jpg,378,1623322846.0,RayInRed,0.94,/r/shittymoviedetails/comments/nwkrv0/in_the_matrix_1999_neos_passport_expires_on/,shittymoviedetails,954480,3
"In Zootopia (2016), in the laboratory of blue chemicals, two characters are referenced as ‘Woolter’ and ‘Jesse’. I have a grandson named Jesse",35630,fkv7gg,https://i.redd.it/st8ex3z3dhn41.jpg,169,1584558724.0,StuartRomano114,0.94,/r/shittymoviedetails/comments/fkv7gg/in_zootopia_2016_in_the_laboratory_of_blue/,shittymoviedetails,954480,3
"In Star Wars the phantom menace (1999), Darth Maul doesn’t, in fact, say “it’s Maulin time” as he mauls Qui-Gon. This is a reference that the movie came out 23 years before Morbius (2022) and cinema hadn’t been invented yet",35566,vayq75,https://i.redd.it/kf71pdvu1a591.jpg,141,1655077577.0,Sidiousfancasting,0.9,/r/shittymoviedetails/comments/vayq75/in_star_wars_the_phantom_menace_1999_darth_maul/,shittymoviedetails,954480,3
"In Willy Wonka and the Chocolate Factory (1971), the children get punished for their sins: Augustus gets boiled for his gluttony, Violet gets exploded for her pride, Verruca gets dirty for her greed, Mike gets shrunk for his arrogance, and Charlie gets burdened by taxes and OSHA fines for being poor",35571,zsk972,https://i.redd.it/ucynlbk2bh7a1.jpg,164,1671709648.0,ArcticFox19,0.97,/r/shittymoviedetails/comments/zsk972/in_willy_wonka_and_the_chocolate_factory_1971_the/,shittymoviedetails,954480,3
Avengers: Endgame (2019) features a funeral scene to memorialize the last time you’ll enjoy an MCU movie,35132,ykot3s,https://i.redd.it/x7q1b7lt4nx91.jpg,912,1667439709.0,fuzzy_dice_99,0.81,/r/shittymoviedetails/comments/ykot3s/avengers_endgame_2019_features_a_funeral_scene_to/,shittymoviedetails,954480,3
"The dark knight (2008): despite being a murderous maniac with no regard for human life, the Joker still takes special precautions to wear a mask around the vulnerable. This is because he is not a fucking idiot",34999,hp0ods,https://i.redd.it/1rk889txi4a51.jpg,245,1594427803.0,Rickmundo,0.94,/r/shittymoviedetails/comments/hp0ods/the_dark_knight_2008_despite_being_a_murderous/,shittymoviedetails,954480,3
"Despite it being set in 1938, Indiana Jones is somehow able to attend a Trump rally in Indiana Jones and the Last Crusade",34850,y4d7gp,https://i.redd.it/w3aao6b11wt91.jpg,194,1665804006.0,fuzzy_dice_99,0.74,/r/shittymoviedetails/comments/y4d7gp/despite_it_being_set_in_1938_indiana_jones_is/,shittymoviedetails,954480,3
In The Lion King (1994) they used Wildebeests instead of Bisons for the stampede because the name bison (bye son) was going to spoil what happens next.,34756,m4txee,https://i.redd.it/w4qrueg1gzm61.jpg,160,1615722846.0,pale_guy_,0.93,/r/shittymoviedetails/comments/m4txee/in_the_lion_king_1994_they_used_wildebeests/,shittymoviedetails,954480,3
"When Terrence Howard left, Marvel wanted Robert Downey Jr. to take over the James Rhodes role based on his performance in Tropic Thunder (2008). However, he was already playing as Iron Man.",34656,et9xv7,https://i.redd.it/o3n50vzo2qc41.png,304,1579869914.0,skyfall91404,0.94,/r/shittymoviedetails/comments/et9xv7/when_terrence_howard_left_marvel_wanted_robert/,shittymoviedetails,954480,3
"I was watching Lilo and Stitch (2002), when a reddit moderator suddenly appeared on screen. This surprised me, because the movie was released in 2002, while reddit was founded in 2005.",34648,10f5anu,https://i.redd.it/qikkmjcagsca1.jpg,233,1674041964.0,Tokyono,0.91,/r/shittymoviedetails/comments/10f5anu/i_was_watching_lilo_and_stitch_2002_when_a_reddit/,shittymoviedetails,954480,3
"In order for X-Men Origins: Wolverine (2009) to receive a PG-13 rating, 20th Century Fox sewed Deadpool's mouth shut.",33809,f38ngu,https://i.redd.it/7bhg4o10gog41.jpg,266,1581593573.0,skyfall91404,0.94,/r/shittymoviedetails/comments/f38ngu/in_order_for_xmen_origins_wolverine_2009_to/,shittymoviedetails,954480,3
"In an obvious homage to Who Framed Roger Rabbit, Paul Walker is animated in some scenes of Furious 7 (2015)",33740,i9p8wn,https://i.redd.it/k7di8upgwzg51.png,407,1597422844.0,NotSureHowThingsWork,0.94,/r/shittymoviedetails/comments/i9p8wn/in_an_obvious_homage_to_who_framed_roger_rabbit/,shittymoviedetails,954480,3
"The upcoming movie ""Oppenheimer"" (2023) is projected to do well in the U.S., but bomb in Japan.",33624,zoz1ct,https://i.redd.it/awguj223dp6a1.jpg,283,1671371335.0,Penguin-Monk,0.9,/r/shittymoviedetails/comments/zoz1ct/the_upcoming_movie_oppenheimer_2023_is_projected/,shittymoviedetails,954480,3
"In The Emoji Movie (2017), a boy manages to score a date with a girl by sending her a ""super cool emoji"". Yes, this really happened. I'm not joking. It's the emotional climax of the story.",33426,z6733v,https://i.redd.it/676htgdw3j2a1.jpg,388,1669570220.0,Tokyono,0.95,/r/shittymoviedetails/comments/z6733v/in_the_emoji_movie_2017_a_boy_manages_to_score_a/,shittymoviedetails,954480,3
In Spider-Man (2002) Peter Parker's first name is really Jesus.,32918,q8ocw9,https://i.redd.it/ecdgsq6v7mt71.jpg,171,1634304174.0,pale_guy_,0.96,/r/shittymoviedetails/comments/q8ocw9/in_spiderman_2002_peter_parkers_first_name_is/,shittymoviedetails,954480,3
"In Avengers: Endgame (2019), Sam Wilson is able to talk through his radio to Cap even though he’s a whole galaxy away. This is because he’s using Mint Mobile, where you can get premium wireless for just $15/month. No stores, no nonsense, just direct to you savings. Join Mint Mobile today",32908,xdaq4x,https://i.redd.it/rksdva7uann91.jpg,367,1663083251.0,fuzzy_dice_99,0.88,/r/shittymoviedetails/comments/xdaq4x/in_avengers_endgame_2019_sam_wilson_is_able_to/,shittymoviedetails,954480,3
"Like WandaVision, The Falcon and The Winter Soldier was originally going to be called Fucky (Falcon & Bucky) but was changed due to undisclosed reasons.",32804,mywud6,https://i.redd.it/8ll0q1skkiv61.jpg,233,1619441188.0,pale_guy_,0.95,/r/shittymoviedetails/comments/mywud6/like_wandavision_the_falcon_and_the_winter/,shittymoviedetails,954480,3
"in Justice League (2017), Henry Cavill's moustache had to be digitally removed as the actor was already filming MI:Fallout. This is a reference to Hollywood's obsession with CGI, as they could've just hired Liam Hemsworth to replace him instead of editing out his moustache.",32623,yiaer7,https://i.redd.it/ddn0loevd6x91.jpg,256,1667218939.0,Absalom98,0.95,/r/shittymoviedetails/comments/yiaer7/in_justice_league_2017_henry_cavills_moustache/,shittymoviedetails,954480,3
