title,score,id,url,num_comments,created,author,upvote_ratio,permalink,subreddit,subreddit_subscribers,depth
I just love the way the Lancia Stratos look when Racing,888,rfbjf4,https://i.redd.it/gufh0i09z9581.jpg,15,1639386169.0,volfan1983xxx,0.99,/r/rally/comments/rfbjf4/i_just_love_the_way_the_lancia_stratos_look_when/,rally,268448,2
rally photographers built different,887,sroqol,https://i.redd.it/jwkab4fsvlh81.gif,28,1644775391.0,Lieutenant_Bacon,0.99,/r/rally/comments/sroqol/rally_photographers_built_different/,rally,268448,2
"Group A rallying perfection. Turbofans, lamp pod and a lancia Delta Integralle Evo in tarmac spec with a dash of Martini warpaint.",882,ckaj3c,https://i.redd.it/eacd9xymynd31.jpg,24,1564589595.0,Davecoupe,1.0,/r/rally/comments/ckaj3c/group_a_rallying_perfection_turbofans_lamp_pod/,rally,268448,2
Audi Sport Quattro S1,886,flshfc,https://i.redd.it/gpauv7djwsn41.jpg,12,1584698449.0,-SwedishRally-,0.99,/r/rally/comments/flshfc/audi_sport_quattro_s1/,rally,268448,2
Hyundai i20 at Rally of Mexico,874,fwwh60,https://i.redd.it/ldrrnqryqhr41.jpg,9,1586306776.0,Zugrum,0.99,/r/rally/comments/fwwh60/hyundai_i20_at_rally_of_mexico/,rally,268448,2
"Another Diorama, this time the VW Polo R Wrc. Imgur album in comments",868,gqmx23,https://i.redd.it/odlo7cvx90151.jpg,15,1590453720.0,slientmagician9,1.0,/r/rally/comments/gqmx23/another_diorama_this_time_the_vw_polo_r_wrc_imgur/,rally,268448,2
Needing a little help clearing the corner,868,o35ntt,https://v.redd.it/sfx46kbso4671,33,1624067912.0,PlenitudeOpulence,0.99,/r/rally/comments/o35ntt/needing_a_little_help_clearing_the_corner/,rally,268448,2
💥NEW Audi A1 R4 Kit (Rally2 Kit),866,hfuood,https://i.redd.it/uh69wq2rk4751.jpg,19,1593120866.0,Chopito-Rally,0.99,/r/rally/comments/hfuood/new_audi_a1_r4_kit_rally2_kit/,rally,268448,2
"Testing for next weeks ARA National rally in PA, in my 2005 Subaru STI rallycar on Reiger suspension. The roads are private built stage roads on my property in NY.",861,xbssrx,https://v.redd.it/o6u2tnvjhan91,50,1662928124.0,DylanMurcottRacing,1.0,/r/rally/comments/xbssrx/testing_for_next_weeks_ara_national_rally_in_pa/,rally,268448,2
"This Lancia Delta Integrale will be competing at Wales Rally. If you have the opportunity, I highly recommend getting along to see this Lancia competing at Wales Rally GB, 3-5 October 2019.",863,db5spf,https://i.redd.it/gruzi2u7inp31.jpg,18,1569814250.0,BengalDamian,0.99,/r/rally/comments/db5spf/this_lancia_delta_integrale_will_be_competing_at/,rally,268448,2
Some proper merry Christmas wishes from Kristof Klausner,855,efg6fs,https://v.redd.it/c92qmex21s641,15,1577278447.0,SpadoKln,1.0,/r/rally/comments/efg6fs/some_proper_merry_christmas_wishes_from_kristof/,rally,268448,2
"Ken Block and Alex Gelsomino launch, Oregon Trail Rally 2023",849,1028hoh,https://v.redd.it/xpwaflzwhv9a1,34,1672753153.0,chovanak,0.99,/r/rally/comments/1028hoh/ken_block_and_alex_gelsomino_launch_oregon_trail/,rally,268448,2
OMG!,851,j0d5o8,https://v.redd.it/bwpk5mw2xjp51,68,1601151914.0,Zugrum,0.99,/r/rally/comments/j0d5o8/omg/,rally,268448,2
"Day 1 at Targa High Country, Victoria, Australia. The unseasonable snow caused chaos with some cars unable to reach the start line, and 1 car crashing on the way to the start line!",852,dtdkjd,https://i.redd.it/mx411s2iwfx31.jpg,26,1573208984.0,BengalDamian,1.0,/r/rally/comments/dtdkjd/day_1_at_targa_high_country_victoria_australia/,rally,268448,2
"Safari Rally Kenya, 1976, Lancia Stratos © Tamotsu Futamura",850,kp3ggx,https://i.redd.it/f5dn91opwy861.jpg,11,1609614473.0,VitorAntonio10,1.0,/r/rally/comments/kp3ggx/safari_rally_kenya_1976_lancia_stratos_tamotsu/,rally,268448,2
Winners!! Classic Adelaide Rally 2019!!,849,e7ci0q,https://i.redd.it/xq5img00n6341.jpg,50,1575711914.0,BengalDamian,1.0,/r/rally/comments/e7ci0q/winners_classic_adelaide_rally_2019/,rally,268448,2
Real Stratos on service,848,f8eibw,https://i.redd.it/yj879bio7qi41.jpg,17,1582486623.0,Zugrum,0.99,/r/rally/comments/f8eibw/real_stratos_on_service/,rally,268448,2
Some new 911 decor in the office today!,848,sh3te7,https://i.redd.it/pxmidk3mk1f81.jpg,10,1643642873.0,MilesMyles,0.99,/r/rally/comments/sh3te7/some_new_911_decor_in_the_office_today/,rally,268448,2
2005 Subaru Impreza WRC,840,elhrkw,https://i.redd.it/wx1w90ny8f941.jpg,24,1578431243.0,Apple_Slipper,0.99,/r/rally/comments/elhrkw/2005_subaru_impreza_wrc/,rally,268448,2
Spotted at the Nurburgring yesterday.,838,cphdbu,https://i.redd.it/3vadwe9pl2g31.jpg,24,1565638563.0,stonesfromthesky,0.99,/r/rally/comments/cphdbu/spotted_at_the_nurburgring_yesterday/,rally,268448,2
Bernard Béguin and the BMW M1 at the Rallye d'Antibes in 1984. 🔊🔊🔊 by Duke Video,836,nar3bg,https://v.redd.it/zwaa8ze8hpy61,26,1620832491.0,VitorAntonio10,1.0,/r/rally/comments/nar3bg/bernard_béguin_and_the_bmw_m1_at_the_rallye/,rally,268448,2
RAC Rally of Britain 1977,830,l2mqoe,https://v.redd.it/hjqvcoqlnvc61,26,1611318537.0,VitorAntonio10,1.0,/r/rally/comments/l2mqoe/rac_rally_of_britain_1977/,rally,268448,2
The Audi at Acropolis,831,ewn0lc,https://i.redd.it/ia8drv1ql3e41.jpg,8,1580469494.0,volfan1983xxx,1.0,/r/rally/comments/ewn0lc/the_audi_at_acropolis/,rally,268448,2
Subaru Impreza WRX – 1994 Rally New Zealand found in kanagawa,834,n32kev,https://www.reddit.com/gallery/n32kev,15,1619946171.0,newchoppa5555,0.99,/r/rally/comments/n32kev/subaru_impreza_wrx_1994_rally_new_zealand_found/,rally,268448,2
Craig Breen Hyundai WRT jumpy and twisty in SS14 Estonia,827,ksh37q,https://v.redd.it/47rlyso7vx961,22,1610037877.0,RallyerSkates,1.0,/r/rally/comments/ksh37q/craig_breen_hyundai_wrt_jumpy_and_twisty_in_ss14/,rally,268448,2
1986 Audi Quattro S1 Rally,824,pv75m5,https://i.redd.it/c21c7qvtmnp71.jpg,16,1632577926.0,AnonymousWaterBucket,0.99,/r/rally/comments/pv75m5/1986_audi_quattro_s1_rally/,rally,268448,2
"This must be the best photo of the 2022 WRC season so far. Pic by Jaanus Ree, Red Bull, at WRC Rally New Zealand.",829,xuf6gl,https://i.redd.it/qd0vz56udkr91.gif,28,1664791413.0,eDgE_031,0.98,/r/rally/comments/xuf6gl/this_must_be_the_best_photo_of_the_2022_wrc/,rally,268448,2
A few clips of me falling when trying to help rallycars.,824,cpqck5,https://v.redd.it/6ihin2u8i6g31,33,1565685865.0,-SwedishRally-,0.99,/r/rally/comments/cpqck5/a_few_clips_of_me_falling_when_trying_to_help/,rally,268448,2
Juha Kankkunen in action during a snowy day at the 1993 British RAC Rally,818,t7xgpk,https://i.redd.it/7ik4ywu08rl81.jpg,19,1646568507.0,VitorAntonio10,1.0,/r/rally/comments/t7xgpk/juha_kankkunen_in_action_during_a_snowy_day_at/,rally,268448,2
I am hilarious.,822,et4z6a,https://i.redd.it/h1r6bsskhnc41.jpg,25,1579838540.0,FedoraSmoker,0.99,/r/rally/comments/et4z6a/i_am_hilarious/,rally,268448,2
Damn tht butt 😍😍,817,fenaym,https://i.redd.it/xe3hdd1vc5l41.jpg,15,1583541662.0,Zugrum,0.99,/r/rally/comments/fenaym/damn_tht_butt/,rally,268448,2
Evo VI and some subarus + surprise at the end,817,110wliw,https://www.reddit.com/gallery/110wliw,21,1676253846.0,newchoppa5555,1.0,/r/rally/comments/110wliw/evo_vi_and_some_subarus_surprise_at_the_end/,rally,268448,2
Blind faith.,812,mek7zt,https://i.redd.it/tnsu1iyacmp61.jpg,29,1616871744.0,CiprianDerradeiros,1.0,/r/rally/comments/mek7zt/blind_faith/,rally,268448,2
Lancia Rally Team (Test 1985),812,ooc52g,https://i.redd.it/fry6q1wjwfc71.jpg,10,1626818328.0,JuanilloMera,1.0,/r/rally/comments/ooc52g/lancia_rally_team_test_1985/,rally,268448,2
"Just spent the last few days leveling the old rallycross layout, working on some new layouts for next season. Enjoy! Details in comments",809,jz100f,https://v.redd.it/ik8g82dn7u061,39,1606070966.0,DylanMurcottRacing,1.0,/r/rally/comments/jz100f/just_spent_the_last_few_days_leveling_the_old/,rally,268448,2
Pour one out for this MK2 that gave it's life to protect us from our own screwup.,810,yo2bzy,https://i.imgur.com/9XDoQB0.jpg,45,1667767863.0,Valafar_Actual,1.0,/r/rally/comments/yo2bzy/pour_one_out_for_this_mk2_that_gave_its_life_to/,rally,268448,2
Audi Sport Quattro RS 002 - Prototype Group S car that was scrapped after the FIA banned Group B cars. 700bhp.,803,fdasmb,https://i.redd.it/tlhdav0homk41.jpg,52,1583315553.0,CashRollFresh,0.99,/r/rally/comments/fdasmb/audi_sport_quattro_rs_002_prototype_group_s_car/,rally,268448,2
Any fans of the Galant VR4 rally car?,811,m7m5ax,https://i.redd.it/onihoo9dwqn61.jpg,33,1616055224.0,VitorAntonio10,0.99,/r/rally/comments/m7m5ax/any_fans_of_the_galant_vr4_rally_car/,rally,268448,2
Another Lancia 037 in action 😘😘,808,ff8mes,https://i.redd.it/8qtl9p0q5el41.jpg,9,1583648223.0,Zugrum,0.99,/r/rally/comments/ff8mes/another_lancia_037_in_action/,rally,268448,2
"No idea of who's driving it, but it sure it looks like they're flying over the 1000 Lakes.",806,n63day,https://i.redd.it/09b719soygx61.jpg,11,1620293415.0,VitorAntonio10,1.0,/r/rally/comments/n63day/no_idea_of_whos_driving_it_but_it_sure_it_looks/,rally,268448,2
"Sweden, 1978. Two Ford Escorts are majestically sliding sideways, and the Fiesta is doing what it can. Great footage!",808,kpilqa,https://v.redd.it/xfi8oqipj3961,17,1609670961.0,VitorAntonio10,1.0,/r/rally/comments/kpilqa/sweden_1978_two_ford_escorts_are_majestically/,rally,268448,2
M-Sport with their Fiesta is now the only manufacturer to have a car on all the 5 levels of the new FIA Rally piramid,802,jzlot4,https://i.redd.it/zb5pp4xav0161.jpg,31,1606151428.0,SpadoKln,1.0,/r/rally/comments/jzlot4/msport_with_their_fiesta_is_now_the_only/,rally,268448,2
Some images I took at Lombard Rally Taunton yesterday.,799,ynodqz,https://www.reddit.com/gallery/ynodqz,20,1667736826.0,woodyfuckinpecker,0.99,/r/rally/comments/ynodqz/some_images_i_took_at_lombard_rally_taunton/,rally,268448,2
Audi Sport Quattro S1 rally,792,qt2gy2,https://i.redd.it/xstf7n4qidz71.jpg,11,1636814001.0,AnonymousWaterBucket,0.99,/r/rally/comments/qt2gy2/audi_sport_quattro_s1_rally/,rally,268448,2
Ford Escort mk2 - rebuilt my AP Racing Monte Carlo calipers today and fitted a new handbrake kit so took it a quick test :-),796,hh1ii3,https://v.redd.it/c4b9zzn3pi751,26,1593291982.0,johno-19,0.99,/r/rally/comments/hh1ii3/ford_escort_mk2_rebuilt_my_ap_racing_monte_carlo/,rally,268448,2
Rally in Kenya,791,z75d3a,https://i.redd.it/yckolojf8s2a1.jpg,9,1669662716.0,wigovsky,1.0,/r/rally/comments/z75d3a/rally_in_kenya/,rally,268448,2
"Only photos ever made of secret mid-engine group B Audi Quattro. They were taken in 1985 at secret test track near Zlín, Czech Republic by local citizen.",790,xsr9lf,https://www.reddit.com/gallery/xsr9lf,11,1664617653.0,pzkenny,1.0,/r/rally/comments/xsr9lf/only_photos_ever_made_of_secret_midengine_group_b/,rally,268448,2
Testing the suspension one last time. She's going under for the rest of the stage rally preparation. Hope to be out next season!,788,ivwd25,https://v.redd.it/tpp9m3hjy4o51,28,1600535013.0,Nabell531,1.0,/r/rally/comments/ivwd25/testing_the_suspension_one_last_time_shes_going/,rally,268448,2
Audi boys come at me,790,nhcj5k,https://i.redd.it/rficmbgajc071.jpg,23,1621547379.0,nopunterino,0.97,/r/rally/comments/nhcj5k/audi_boys_come_at_me/,rally,268448,2
"PORSCHE 911 SC ""ROTHMANS"" (Beny Fernandez - 6º Rally Corte Ingles)",793,jqe93v,https://i.redd.it/a5z1r2tej1y51.jpg,10,1604852033.0,JuanilloMera,1.0,/r/rally/comments/jqe93v/porsche_911_sc_rothmans_beny_fernandez_6º_rally/,rally,268448,2
My 2022 Rallywise - looking forward to 2023 with even more,790,zzxeai,https://www.reddit.com/gallery/zzxeai,28,1672503066.0,woodyfuckinpecker,1.0,/r/rally/comments/zzxeai/my_2022_rallywise_looking_forward_to_2023_with/,rally,268448,2
One of my mates cars that we won a tarmac rally in last year. She also goes alright on the gravel ;) This is him peddling earlier last year with his lovely wife codriving.,788,gkva6w,https://i.redd.it/azg0ra5fx4z41.jpg,36,1589638343.0,BengalDamian,1.0,/r/rally/comments/gkva6w/one_of_my_mates_cars_that_we_won_a_tarmac_rally/,rally,268448,2
"Travis Pastrana’s all-new livery, made just for Gymkhana 🤩",789,jez17u,https://www.reddit.com/gallery/jez17u,49,1603229172.0,Chopito-Rally,0.98,/r/rally/comments/jez17u/travis_pastranas_allnew_livery_made_just_for/,rally,268448,2
600 HP Rallycross machinery look funny when wearing snow-surface tyres,780,kz9uh2,https://i.redd.it/58jqinri9xb61.jpg,24,1610902120.0,VitorAntonio10,1.0,/r/rally/comments/kz9uh2/600_hp_rallycross_machinery_look_funny_when/,rally,268448,2
Audi Sport Quattro S1 E2 Rally marker drawing I did,786,k9sqzv,https://i.redd.it/sll164wp86461.jpg,18,1607524020.0,PloopHead,0.99,/r/rally/comments/k9sqzv/audi_sport_quattro_s1_e2_rally_marker_drawing_i/,rally,268448,2
There has been lots of flying rallycars passing my lens already this season.,783,usgp45,https://www.reddit.com/gallery/usgp45,23,1652890937.0,Davecoupe,0.99,/r/rally/comments/usgp45/there_has_been_lots_of_flying_rallycars_passing/,rally,268448,2
That's some pretty photograph!,778,ykb8nv,https://i.redd.it/xjj79vyi5mx91.png,0,1667409841.0,VitorAntonio10,1.0,/r/rally/comments/ykb8nv/thats_some_pretty_photograph/,rally,268448,2
BMW 325i,777,ezmsfj,https://i.redd.it/qjn4wh1zd8f41.jpg,12,1580963268.0,Zugrum,1.0,/r/rally/comments/ezmsfj/bmw_325i/,rally,268448,2
Open hearted 🏁,779,evv1f6,https://i.redd.it/2poks8x7tsd41.jpg,16,1580338837.0,Zugrum,1.0,/r/rally/comments/evv1f6/open_hearted/,rally,268448,2
It’s that time of year to roll this one out again.,773,ljmz7b,https://i.redd.it/ch0p9svykfh61.jpg,13,1613303127.0,Davecoupe,1.0,/r/rally/comments/ljmz7b/its_that_time_of_year_to_roll_this_one_out_again/,rally,268448,2
Not something you see everyday. Group A Mitsubishi Galant VR-4 with Marlboro livery.,769,r75ur6,https://i.redd.it/6j1u7930c4381.jpg,23,1638446121.0,VitorAntonio10,0.99,/r/rally/comments/r75ur6/not_something_you_see_everyday_group_a_mitsubishi/,rally,268448,2
"Alfa Romeo donuts at rally legends in Madeira, Portugal",770,yhcc8v,https://v.redd.it/biji94c8lxw91,18,1667130449.0,tct99xx,1.0,/r/rally/comments/yhcc8v/alfa_romeo_donuts_at_rally_legends_in_madeira/,rally,268448,2
Prodrive (Subaru) P25 on display at the 2022 Goodwood Festival of Speed,767,w6pfbw,https://i.redd.it/7bpcwmvmrgd91.jpg,9,1658645671.0,volfan1983xxx,1.0,/r/rally/comments/w6pfbw/prodrive_subaru_p25_on_display_at_the_2022/,rally,268448,2
"I was playing with Midjourney - AI art tool - and 'created' this image. It is titled ""rally car in 2055.""",766,yi80lz,https://i.redd.it/wq2xvhikf4x91.png,37,1667213310.0,eDgE_031,0.95,/r/rally/comments/yi80lz/i_was_playing_with_midjourney_ai_art_tool_and/,rally,268448,2
"Hey guys, I have started doing some private rally training on my property in Upstate, NY. Here’s a video of the track layout and the cars. *More info in comments*",768,vja5s6,https://v.redd.it/8n6zpmyhgg791,40,1656026837.0,DylanMurcottRacing,0.99,/r/rally/comments/vja5s6/hey_guys_i_have_started_doing_some_private_rally/,rally,268448,2
"Ken Block and Alex Gelsomino launch on a tarmac stage, Oregon Trail Rally.",764,uwqstl,https://v.redd.it/nsp9jt0rdf191,24,1653398768.0,chovanak,0.99,/r/rally/comments/uwqstl/ken_block_and_alex_gelsomino_launch_on_a_tarmac/,rally,268448,2
Ladies and gentlemen please bow to her majesty the mighty Dacia Sandero R4,765,dq2h4m,https://i.redd.it/b87gnyksz1w31.jpg,32,1572604749.0,SpadoKln,0.99,/r/rally/comments/dq2h4m/ladies_and_gentlemen_please_bow_to_her_majesty/,rally,268448,2
The perfect cheat,768,g0achp,https://i.redd.it/nc0japxi1is41.jpg,33,1586746177.0,littlemorven,0.97,/r/rally/comments/g0achp/the_perfect_cheat/,rally,268448,2
"Yeah, the Hyundai doesn't look half bad from decent angles",760,s0ttsz,https://www.reddit.com/gallery/s0ttsz,40,1641846939.0,ill_have_2_number_9s,0.99,/r/rally/comments/s0ttsz/yeah_the_hyundai_doesnt_look_half_bad_from_decent/,rally,268448,2
A quick Rally Diorama I made. Imgur gallery in comments,761,gal3qb,https://i.redd.it/k3aoh3spduv41.jpg,6,1588205590.0,slientmagician9,1.0,/r/rally/comments/gal3qb/a_quick_rally_diorama_i_made_imgur_gallery_in/,rally,268448,2
Some images I took at ERC Portugal yesterday.,757,11qdjj6,https://www.instagram.com/alexstefanphoto,26,1678723182.0,woodyfuckinpecker,0.99,/r/rally/comments/11qdjj6/some_images_i_took_at_erc_portugal_yesterday/,rally,268448,2
Who doesn’t love the big Czech tank.,760,muo71q,https://www.reddit.com/gallery/muo71q,24,1618917899.0,Davecoupe,1.0,/r/rally/comments/muo71q/who_doesnt_love_the_big_czech_tank/,rally,268448,2
1984 Toyota Celica Twin Cam Turbo Group B Rally Car,757,f5qlg7,https://i.redd.it/ozbg8yyg7oh41.jpg,14,1582026489.0,Apple_Slipper,1.0,/r/rally/comments/f5qlg7/1984_toyota_celica_twin_cam_turbo_group_b_rally/,rally,268448,2
Audi Quattro S1,757,cv8dkj,https://i.redd.it/gg49koa0ili31.jpg,13,1566739032.0,-SwedishRally-,1.0,/r/rally/comments/cv8dkj/audi_quattro_s1/,rally,268448,2
here it is! the dominant delta,753,wg6vay,https://i.redd.it/gdy1rs8ddqf91.jpg,13,1659633639.0,rallyboi768,1.0,/r/rally/comments/wg6vay/here_it_is_the_dominant_delta/,rally,268448,2
Just a helicopter chasing a WRC Car,746,dzazti,https://i.redd.it/2u1pp9stoxz31.jpg,13,1574296028.0,-SwedishRally-,1.0,/r/rally/comments/dzazti/just_a_helicopter_chasing_a_wrc_car/,rally,268448,2
Juha Kankkunen in 1993,752,r9ghck,https://i.redd.it/wq6zsw1oeq381.jpg,4,1638713369.0,VitorAntonio10,1.0,/r/rally/comments/r9ghck/juha_kankkunen_in_1993/,rally,268448,2
I think we know the answer,746,r4g9t5,https://i.redd.it/0xvs229vxe281.png,13,1638138707.0,nopunterino,0.99,/r/rally/comments/r4g9t5/i_think_we_know_the_answer/,rally,268448,2
One cool shot of the Citroën DS,744,lnampp,https://i.redd.it/656stxde7ei61.jpg,9,1613722303.0,VitorAntonio10,0.99,/r/rally/comments/lnampp/one_cool_shot_of_the_citroën_ds/,rally,268448,2
Just choose your car.,739,pbch8v,https://i.redd.it/g1dsyf81mij71.jpg,145,1629902030.0,CiprianDerradeiros,0.99,/r/rally/comments/pbch8v/just_choose_your_car/,rally,268448,2
During these difficult times remember to stay at home and maybe play your favourite rally videogame with your mates,740,fo2v09,https://i.redd.it/6hkw65onklo41.jpg,15,1585045540.0,SpadoKln,0.99,/r/rally/comments/fo2v09/during_these_difficult_times_remember_to_stay_at/,rally,268448,2
The new Toyota Yaris GR-4 which will be the base for the 2021 WRC and R5 Yaris,743,eyngvm,https://i.redd.it/yw844jskjve41.jpg,63,1580807763.0,SpadoKln,1.0,/r/rally/comments/eyngvm/the_new_toyota_yaris_gr4_which_will_be_the_base/,rally,268448,2
"Volvo 240, sideways in Sweden today",736,bg2rd9,https://i.redd.it/rtgoyh20ttt21.jpg,24,1555943407.0,-SwedishRally-,1.0,/r/rally/comments/bg2rd9/volvo_240_sideways_in_sweden_today/,rally,268448,2
Sam Albert and Krista Skucas launch at Olympus Rally 2020,734,k1gwfj,https://v.redd.it/kxjj9lukpl161,21,1606403783.0,chovanak,0.99,/r/rally/comments/k1gwfj/sam_albert_and_krista_skucas_launch_at_olympus/,rally,268448,2
"Commissioned piece, Makinen’s Evo V",733,kaycqp,https://i.redd.it/z7js3xxuhi461.jpg,10,1607672376.0,PloopHead,0.99,/r/rally/comments/kaycqp/commissioned_piece_makinens_evo_v/,rally,268448,2
Jean-Luc Thérier's Porsche 911 SC for the 1980 Tour de Corse rally.,729,m693rq,https://i.redd.it/esk3i1h57en61.jpg,6,1615901460.0,VitorAntonio10,1.0,/r/rally/comments/m693rq/jeanluc_thériers_porsche_911_sc_for_the_1980_tour/,rally,268448,2
1999 Toyota Corolla WRC,733,f0qk76,https://i.redd.it/8hzr728itof41.jpg,10,1581162203.0,Apple_Slipper,1.0,/r/rally/comments/f0qk76/1999_toyota_corolla_wrc/,rally,268448,2
"My wife and I competed in our first rally this weekend, and even though we didn't finish, I think we still had the most fun.",729,tj1mw9,https://imgur.com/qJTGrzR,46,1647830728.0,Valafar_Actual,1.0,/r/rally/comments/tj1mw9/my_wife_and_i_competed_in_our_first_rally_this/,rally,268448,2
Skoda Fabia R5 in the Air,733,hmcc1m,https://i.redd.it/0peakyrxx9951.jpg,9,1594057539.0,volfan1983xxx,0.99,/r/rally/comments/hmcc1m/skoda_fabia_r5_in_the_air/,rally,268448,2
"my nan saw this, think it belongs here",729,vmjhl8,https://i.redd.it/3odxkpzd4c891.jpg,18,1656410185.0,rallyboi768,0.99,/r/rally/comments/vmjhl8/my_nan_saw_this_think_it_belongs_here/,rally,268448,2
This is one of my favorite pictures involving the Delta,729,lg8lek,https://i.redd.it/blncbynxmhg61.jpg,6,1612892151.0,VitorAntonio10,1.0,/r/rally/comments/lg8lek/this_is_one_of_my_favorite_pictures_involving_the/,rally,268448,2
First humpday of 2020.....,729,eltgcb,https://i.redd.it/61xvimzkfk941.jpg,16,1578494007.0,Davecoupe,1.0,/r/rally/comments/eltgcb/first_humpday_of_2020/,rally,268448,2
The Rally of 1000 Lakes + Juha Kankunnen + 1998 Ford Escort WRC,720,kew4gp,https://v.redd.it/qej8tr12lq561,23,1608206168.0,VitorAntonio10,1.0,/r/rally/comments/kew4gp/the_rally_of_1000_lakes_juha_kankunnen_1998_ford/,rally,268448,2
Is the MK2 Escort the best dance partner? ;),723,zx8g9v,https://v.redd.it/rltk1xdxum8a1,15,1672230738.0,VitorAntonio10,0.99,/r/rally/comments/zx8g9v/is_the_mk2_escort_the_best_dance_partner/,rally,268448,2
"Forget about the Puma, the Yaris is my favourite now",727,oxote9,https://www.reddit.com/gallery/oxote9,35,1628068486.0,ill_have_2_number_9s,0.99,/r/rally/comments/oxote9/forget_about_the_puma_the_yaris_is_my_favourite/,rally,268448,2
"Time passes, cars upgrade but brute force is always the best solution when service is only at the end of the day",720,dege6z,https://i.redd.it/stmecchrs2r31.jpg,14,1570435248.0,SpadoKln,1.0,/r/rally/comments/dege6z/time_passes_cars_upgrade_but_brute_force_is/,rally,268448,2
Elfyn Evans M-SPORT FORD WRT on snow in SS10 Rally Sweden 2018,721,kv4dur,https://v.redd.it/daca8996xpa61,24,1610377562.0,RallyerSkates,1.0,/r/rally/comments/kv4dur/elfyn_evans_msport_ford_wrt_on_snow_in_ss10_rally/,rally,268448,2
