title,score,id,url,num_comments,created,author,upvote_ratio,permalink,subreddit,subreddit_subscribers,author_name
"Hubspot recently acquired Hustle, which is a digital media platform. The same day Dharmesh Shah, Founder of Hubspot said that - Every business in future will have in house media companies. I think before having media houses, Every business will be surely having a content powerhouse within their team",168,livqpp,https://www.reddit.com/r/marketing/comments/livqpp/hubspot_recently_acquired_hustle_which_is_a/,86,1613200692.0,ivikasifications,0.96,/r/marketing/comments/livqpp/hubspot_recently_acquired_hustle_which_is_a/,marketing,474670,ivikasifications
"[Ultimate List] A list of Marketing Tools That I’ve tested over the years and found helpful to do better marketing with less work. More than 50 Tools To Help you with Marketing, Copywriting & Sales!",168,vjs7aw,https://www.reddit.com/r/marketing/comments/vjs7aw/ultimate_list_a_list_of_marketing_tools_that_ive/,20,1656087645.0,lazymentors,0.99,/r/marketing/comments/vjs7aw/ultimate_list_a_list_of_marketing_tools_that_ive/,marketing,474670,lazymentors
How 1 CBO on Facebook brings 200+ Leads per month & 80+ QUALIFIED booked calls…,163,w9fz5r,https://www.reddit.com/r/marketing/comments/w9fz5r/how_1_cbo_on_facebook_brings_200_leads_per_month/,26,1658931482.0,whitespadex,0.94,/r/marketing/comments/w9fz5r/how_1_cbo_on_facebook_brings_200_leads_per_month/,marketing,474670,whitespadex
Interview with VP of Marketing at +$50m revenue manufacturing firm: how to break into new customer segments. MJ Peters tells us her strategy from customer discovery through to running marketing experiments for generating inbound demand.,167,gw0n2n,https://www.reddit.com/r/marketing/comments/gw0n2n/interview_with_vp_of_marketing_at_50m_revenue/,14,1591212186.0,BGArt00,0.97,/r/marketing/comments/gw0n2n/interview_with_vp_of_marketing_at_50m_revenue/,marketing,474670,BGArt00
TikTok’s New Button To Go Viral + Instagram’s New Quiet Features (Marketing Updates of the Wek),164,10k8fvi,https://www.reddit.com/r/marketing/comments/10k8fvi/tiktoks_new_button_to_go_viral_instagrams_new/,36,1674575215.0,lazymentors,0.97,/r/marketing/comments/10k8fvi/tiktoks_new_button_to_go_viral_instagrams_new/,marketing,474670,lazymentors
Google results are becoming less trusted. How will this affect SEO?,162,yn03mz,https://www.reddit.com/r/marketing/comments/yn03mz/google_results_are_becoming_less_trusted_how_will/,66,1667668540.0,Chaomayhem,0.99,/r/marketing/comments/yn03mz/google_results_are_becoming_less_trusted_how_will/,marketing,474670,Chaomayhem
A List of 80+ Marketing Tools I found this year!,159,y9w6v9,https://www.reddit.com/r/marketing/comments/y9w6v9/a_list_of_80_marketing_tools_i_found_this_year/,14,1666365033.0,lazymentors,0.95,/r/marketing/comments/y9w6v9/a_list_of_80_marketing_tools_i_found_this_year/,marketing,474670,lazymentors
Chip & Dan Heath says telling great stories is one of the best ways to make your message stick. But the question is - how do you tell a great story? I've compiled 10 popular storytelling formulas in this post to help guide you tell a memorable and sticky brand message.,159,6v0hvr,https://www.reddit.com/r/marketing/comments/6v0hvr/chip_dan_heath_says_telling_great_stories_is_one/,16,1503287584.0,airawear,0.97,/r/marketing/comments/6v0hvr/chip_dan_heath_says_telling_great_stories_is_one/,marketing,474670,airawear
I think we've all been there as marketers...,156,i8loc6,https://www.reddit.com/r/marketing/comments/i8loc6/i_think_weve_all_been_there_as_marketers/,36,1597264600.0,itsjustdifferent_,0.98,/r/marketing/comments/i8loc6/i_think_weve_all_been_there_as_marketers/,marketing,474670,itsjustdifferent_
What mistakes would your list include?,153,hruwi3,https://www.reddit.com/r/marketing/comments/hruwi3/what_mistakes_would_your_list_include/,47,1594843385.0,Brendan_BBB,0.94,/r/marketing/comments/hruwi3/what_mistakes_would_your_list_include/,marketing,474670,Brendan_BBB
"Can we create a stickied post to to help summarize the ""what marketing books/videos/podcasts should I listen to?"" posts?",154,aupvmg,https://www.reddit.com/r/marketing/comments/aupvmg/can_we_create_a_stickied_post_to_to_help/,33,1551126363.0,PablanoPato,0.99,/r/marketing/comments/aupvmg/can_we_create_a_stickied_post_to_to_help/,marketing,474670,PablanoPato
Got fired from my first marketing job,151,r8obsf,https://www.reddit.com/r/marketing/comments/r8obsf/got_fired_from_my_first_marketing_job/,54,1638619498.0,OppH2040,0.97,/r/marketing/comments/r8obsf/got_fired_from_my_first_marketing_job/,marketing,474670,OppH2040
Here’s What Happened Last Week On Social Media (Marketer’s Edition),151,vdkbjw,https://www.reddit.com/r/marketing/comments/vdkbjw/heres_what_happened_last_week_on_social_media/,35,1655380723.0,lazymentors,0.99,/r/marketing/comments/vdkbjw/heres_what_happened_last_week_on_social_media/,marketing,474670,lazymentors
"""Client wants guaranteed 2x traffic increase in 60 days."" Recruiter says 🙄",148,t0m9rm,https://www.reddit.com/r/marketing/comments/t0m9rm/client_wants_guaranteed_2x_traffic_increase_in_60/,105,1645739031.0,ayhme,0.99,/r/marketing/comments/t0m9rm/client_wants_guaranteed_2x_traffic_increase_in_60/,marketing,474670,ayhme
Here’s what happened in First Week of April on Social Media ( Entrepreneur Edition),149,u10a0v,https://www.reddit.com/r/marketing/comments/u10a0v/heres_what_happened_in_first_week_of_april_on/,27,1649654738.0,lazymentors,0.97,/r/marketing/comments/u10a0v/heres_what_happened_in_first_week_of_april_on/,marketing,474670,lazymentors
"I Got Torn To Pieces On The Phone By A Potential Client Today, Was I Wrong?",147,t6oi1b,https://www.reddit.com/r/marketing/comments/t6oi1b/i_got_torn_to_pieces_on_the_phone_by_a_potential/,115,1646415844.0,Juicetin1998,0.97,/r/marketing/comments/t6oi1b/i_got_torn_to_pieces_on_the_phone_by_a_potential/,marketing,474670,Juicetin1998
My local SEO checklist for 2021 - step-by-step guide to help you rank consistently,148,oos2d0,https://www.reddit.com/r/marketing/comments/oos2d0/my_local_seo_checklist_for_2021_stepbystep_guide/,31,1626880872.0,malchik23,0.95,/r/marketing/comments/oos2d0/my_local_seo_checklist_for_2021_stepbystep_guide/,marketing,474670,malchik23
How our 60k per month consultancy handles outbound marketing & outreach,150,kic4xh,https://www.reddit.com/r/marketing/comments/kic4xh/how_our_60k_per_month_consultancy_handles/,37,1608665173.0,ly93,0.93,/r/marketing/comments/kic4xh/how_our_60k_per_month_consultancy_handles/,marketing,474670,ly93
Any interesting things you've learned through A/B testing?,147,twiuhx,https://www.reddit.com/r/marketing/comments/twiuhx/any_interesting_things_youve_learned_through_ab/,134,1649121037.0,stjduke,0.99,/r/marketing/comments/twiuhx/any_interesting_things_youve_learned_through_ab/,marketing,474670,stjduke
Entry Level Marketing Career Pro-tips.,147,dwfaqa,https://www.reddit.com/r/marketing/comments/dwfaqa/entry_level_marketing_career_protips/,34,1573763251.0,kirillionaire,0.98,/r/marketing/comments/dwfaqa/entry_level_marketing_career_protips/,marketing,474670,kirillionaire
"Free Social Media Resources, Reports and Case-Studies You need to get better At Marketing & Social Media Growth -2",146,x83tds,https://www.reddit.com/r/marketing/comments/x83tds/free_social_media_resources_reports_and/,335,1662553601.0,lazymentors,0.99,/r/marketing/comments/x83tds/free_social_media_resources_reports_and/,marketing,474670,lazymentors
Here’s What Happened On Social Media In July 2022 (Marketer’s Edition),142,wfv8hj,https://www.reddit.com/r/marketing/comments/wfv8hj/heres_what_happened_on_social_media_in_july_2022/,28,1659599629.0,lazymentors,0.98,/r/marketing/comments/wfv8hj/heres_what_happened_on_social_media_in_july_2022/,marketing,474670,lazymentors
Here’s What Happened last week on Social Media (Marketer’s Edition),143,xew2j4,https://www.reddit.com/r/marketing/comments/xew2j4/heres_what_happened_last_week_on_social_media/,22,1663246336.0,lazymentors,0.97,/r/marketing/comments/xew2j4/heres_what_happened_last_week_on_social_media/,marketing,474670,lazymentors
"Got Yelled At For 10 Straight Minutes And Lost A Client, Hows Your Sunday Going?",143,sb4qzl,https://www.reddit.com/r/marketing/comments/sb4qzl/got_yelled_at_for_10_straight_minutes_and_lost_a/,55,1642974174.0,Juicetin1998,0.95,/r/marketing/comments/sb4qzl/got_yelled_at_for_10_straight_minutes_and_lost_a/,marketing,474670,Juicetin1998
I'd like to propose a little game...,141,7l4z2f,https://www.reddit.com/r/marketing/comments/7l4z2f/id_like_to_propose_a_little_game/,33,1513808883.0,the_lamou,0.99,/r/marketing/comments/7l4z2f/id_like_to_propose_a_little_game/,marketing,474670,the_lamou
How treating our sales & marketing like dating helped us scale to 50k per month in profit,141,jx8q7l,https://www.reddit.com/r/marketing/comments/jx8q7l/how_treating_our_sales_marketing_like_dating/,45,1605812040.0,ly93,0.85,/r/marketing/comments/jx8q7l/how_treating_our_sales_marketing_like_dating/,marketing,474670,ly93
Here’s What Happened Last Week On Social Media (Marketer’s Edition),141,yqk1tb,https://www.reddit.com/r/marketing/comments/yqk1tb/heres_what_happened_last_week_on_social_media/,23,1668003012.0,lazymentors,0.97,/r/marketing/comments/yqk1tb/heres_what_happened_last_week_on_social_media/,marketing,474670,lazymentors
They Never Appreciate You Until They Need You!,136,xyai5b,https://www.reddit.com/r/marketing/comments/xyai5b/they_never_appreciate_you_until_they_need_you/,24,1665177409.0,Jusgil24,0.97,/r/marketing/comments/xyai5b/they_never_appreciate_you_until_they_need_you/,marketing,474670,Jusgil24
Marketing Book Club - March,139,ltz8lu,https://www.reddit.com/r/marketing/comments/ltz8lu/marketing_book_club_march/,48,1614465948.0,JonODonovan,0.99,/r/marketing/comments/ltz8lu/marketing_book_club_march/,marketing,474670,JonODonovan
Marketing is All About Psychology. Here are 9 Psychology Hacks You Need To Get Better At Marketing Your Business!,137,uvfhr2,https://www.reddit.com/r/marketing/comments/uvfhr2/marketing_is_all_about_psychology_here_are_9/,34,1653239952.0,lazymentors,0.83,/r/marketing/comments/uvfhr2/marketing_is_all_about_psychology_here_are_9/,marketing,474670,lazymentors
I’ve worked with Brands like Apple & Adobe For Instagram Strategies. Here’s My Insights on Instagram Growth In 2023,139,104wvp9,https://www.reddit.com/r/marketing/comments/104wvp9/ive_worked_with_brands_like_apple_adobe_for/,21,1673018710.0,lazymentors,0.93,/r/marketing/comments/104wvp9/ive_worked_with_brands_like_apple_adobe_for/,marketing,474670,lazymentors
"My boss thinks that ""Capitalizing The First Letter In Every Word"" is the best approach for Facebook/Google Ads, including descriptions. I think it looks amateur. Any real data on this?",136,wws3lh,https://www.reddit.com/r/marketing/comments/wws3lh/my_boss_thinks_that_capitalizing_the_first_letter/,115,1661368575.0,stjduke,0.99,/r/marketing/comments/wws3lh/my_boss_thinks_that_capitalizing_the_first_letter/,marketing,474670,stjduke
Google Sheets for digital marketers: Charts and Data Visualization,135,bubrel,https://www.reddit.com/r/marketing/comments/bubrel/google_sheets_for_digital_marketers_charts_and/,9,1559115837.0,the_mmw,0.98,/r/marketing/comments/bubrel/google_sheets_for_digital_marketers_charts_and/,marketing,474670,the_mmw
A heartfelt thank you to this sub Reddit,135,usgmrq,https://www.reddit.com/r/marketing/comments/usgmrq/a_heartfelt_thank_you_to_this_sub_reddit/,14,1652890767.0,Tessenreacts,0.99,/r/marketing/comments/usgmrq/a_heartfelt_thank_you_to_this_sub_reddit/,marketing,474670,Tessenreacts
"I Lost A Client To Honesty, Did I Do The Right Thing?",133,solt34,https://www.reddit.com/r/marketing/comments/solt34/i_lost_a_client_to_honesty_did_i_do_the_right/,83,1644435194.0,Jusgil24,0.95,/r/marketing/comments/solt34/i_lost_a_client_to_honesty_did_i_do_the_right/,marketing,474670,Jusgil24
"Should I tell my employer I own the domain they want, or keep it private?",135,mniau9,https://www.reddit.com/r/marketing/comments/mniau9/should_i_tell_my_employer_i_own_the_domain_they/,163,1617978201.0,ayhme,0.96,/r/marketing/comments/mniau9/should_i_tell_my_employer_i_own_the_domain_they/,marketing,474670,ayhme
"Biggest Illusion created by Digital Marketing Gurus: Learn a skill, Become a Coach. It's that simple.",137,m40whx,https://www.reddit.com/r/marketing/comments/m40whx/biggest_illusion_created_by_digital_marketing/,46,1615617527.0,ivikasifications,0.95,/r/marketing/comments/m40whx/biggest_illusion_created_by_digital_marketing/,marketing,474670,ivikasifications
IAmA a marketing consultant turned data specialist at a FAANG company,133,jxpibu,https://www.reddit.com/r/marketing/comments/jxpibu/iama_a_marketing_consultant_turned_data/,61,1605880865.0,the_mmw,0.91,/r/marketing/comments/jxpibu/iama_a_marketing_consultant_turned_data/,marketing,474670,the_mmw
You did learn SEO but can't get a job? This is what I did and would do to get started,128,tmn833,https://www.reddit.com/r/marketing/comments/tmn833/you_did_learn_seo_but_cant_get_a_job_this_is_what/,25,1648140762.0,SEO403,0.95,/r/marketing/comments/tmn833/you_did_learn_seo_but_cant_get_a_job_this_is_what/,marketing,474670,SEO403
21+ Effective Marketing Resources You Need!,130,ut082b,https://www.reddit.com/r/marketing/comments/ut082b/21_effective_marketing_resources_you_need/,31,1652955448.0,lazymentors,0.93,/r/marketing/comments/ut082b/21_effective_marketing_resources_you_need/,marketing,474670,lazymentors
Does it Ever get Better?,128,zl2jek,https://www.reddit.com/r/marketing/comments/zl2jek/does_it_ever_get_better/,77,1670955154.0,breakmyheart01,0.99,/r/marketing/comments/zl2jek/does_it_ever_get_better/,marketing,474670,breakmyheart01
Last year I was getting scolded by my director in company meetings. This year my agency is booked up and it's all thanks to Reddit,130,zesck1,https://www.reddit.com/r/marketing/comments/zesck1/last_year_i_was_getting_scolded_by_my_director_in/,43,1670388549.0,itsjustdifferent_,0.84,/r/marketing/comments/zesck1/last_year_i_was_getting_scolded_by_my_director_in/,marketing,474670,itsjustdifferent_
"I read 30+ Marketing Reports & Case-Studies and Here’s What I learned about Facebook, IG & LinkedIn + More Platforms.",127,xc5bwq,https://www.reddit.com/r/marketing/comments/xc5bwq/i_read_30_marketing_reports_casestudies_and_heres/,29,1662964076.0,lazymentors,0.93,/r/marketing/comments/xc5bwq/i_read_30_marketing_reports_casestudies_and_heres/,marketing,474670,lazymentors
tiktok search is eating away at google,124,w6yzl7,https://www.reddit.com/r/marketing/comments/w6yzl7/tiktok_search_is_eating_away_at_google/,71,1658678611.0,itsjustdifferent_,0.86,/r/marketing/comments/w6yzl7/tiktok_search_is_eating_away_at_google/,marketing,474670,itsjustdifferent_
Good job on CX,129,e0b2bu,https://i.redd.it/gv4hcy0cra041.jpg,4,1574473221.0,AptSeagull,0.95,/r/marketing/comments/e0b2bu/good_job_on_cx/,marketing,474670,AptSeagull
What are the best Digital Marketing Blogs on the internet to learn from?,126,o0htwc,https://www.reddit.com/r/marketing/comments/o0htwc/what_are_the_best_digital_marketing_blogs_on_the/,66,1623773070.0,propelguru01,0.97,/r/marketing/comments/o0htwc/what_are_the_best_digital_marketing_blogs_on_the/,marketing,474670,propelguru01
I started a 90-day LinkedIn Growth Challenge. Here’s what I learned In first 30 days!,124,u7dr14,https://www.reddit.com/r/marketing/comments/u7dr14/i_started_a_90day_linkedin_growth_challenge_heres/,97,1650397650.0,lazymentors,0.89,/r/marketing/comments/u7dr14/i_started_a_90day_linkedin_growth_challenge_heres/,marketing,474670,lazymentors
"I've written copy for tech companies like Zoom, Slack, and Drift. Here's my in-depth guide to writing copy that helps your brand escape competition and convert more visitors.",127,za7bj8,https://www.reddit.com/r/marketing/comments/za7bj8/ive_written_copy_for_tech_companies_like_zoom/,14,1669945440.0,itsjustdifferent_,0.94,/r/marketing/comments/za7bj8/ive_written_copy_for_tech_companies_like_zoom/,marketing,474670,itsjustdifferent_
Just sat in the dumbest marketing seminar about why companies should be in the metaverse,123,wm8v5e,https://www.reddit.com/r/marketing/comments/wm8v5e/just_sat_in_the_dumbest_marketing_seminar_about/,101,1660269556.0,Tessenreacts,0.94,/r/marketing/comments/wm8v5e/just_sat_in_the_dumbest_marketing_seminar_about/,marketing,474670,Tessenreacts
Noticed a big influx of students and entry-level marketers trying to outsource their work here,124,8cnisc,https://www.reddit.com/r/marketing/comments/8cnisc/noticed_a_big_influx_of_students_and_entrylevel/,45,1523885437.0,illbzo1,0.92,/r/marketing/comments/8cnisc/noticed_a_big_influx_of_students_and_entrylevel/,marketing,474670,illbzo1
"Why you should never use Upwork, ever.",126,594d01,https://www.reddit.com/r/marketing/comments/594d01/why_you_should_never_use_upwork_ever/,36,1477313984.0,JonODonovan,0.94,/r/marketing/comments/594d01/why_you_should_never_use_upwork_ever/,marketing,474670,JonODonovan
"I’ve been Tracking Social Media Platforms from Past 36 Weeks: Lessons Learned, Content Trends & Updates You need to Know!",123,wyvw7f,https://www.reddit.com/r/marketing/comments/wyvw7f/ive_been_tracking_social_media_platforms_from/,19,1661582817.0,lazymentors,0.97,/r/marketing/comments/wyvw7f/ive_been_tracking_social_media_platforms_from/,marketing,474670,lazymentors
"2016 Salary Guide for interactive, design, marketing, advertising and public relations positions",124,3yirj7,https://www.reddit.com/r/marketing/comments/3yirj7/2016_salary_guide_for_interactive_design/,32,1451309243.0,JonODonovan,0.97,/r/marketing/comments/3yirj7/2016_salary_guide_for_interactive_design/,marketing,474670,JonODonovan
A Client Who Left Me For Another Marketing Company Recently Messaged Me,126,qzxul0,https://www.reddit.com/r/marketing/comments/qzxul0/a_client_who_left_me_for_another_marketing/,57,1637620381.0,Jusgil24,0.95,/r/marketing/comments/qzxul0/a_client_who_left_me_for_another_marketing/,marketing,474670,Jusgil24
I am very active on Linkedin and many people there want to become Personal Brand by posting regularly on social media but they never talk about Reddit. I don't understand why they don't' talk about Reddit.,124,hyvysc,https://www.reddit.com/r/marketing/comments/hyvysc/i_am_very_active_on_linkedin_and_many_people/,51,1595868710.0,ivikasifications,0.9,/r/marketing/comments/hyvysc/i_am_very_active_on_linkedin_and_many_people/,marketing,474670,ivikasifications
Spotify Crunches User Data in Fun Ways for This New Global Outdoor Ad Campaign,124,5fjdxg,http://www.adweek.com/adfreak/spotify-crunches-user-data-fun-ways-new-global-outdoor-ad-campaign-174826,4,1480435120.0,theyseemeroland,0.98,/r/marketing/comments/5fjdxg/spotify_crunches_user_data_in_fun_ways_for_this/,marketing,474670,theyseemeroland
My Client Just Offered To Pay Me More Money!,121,t1ft26,https://www.reddit.com/r/marketing/comments/t1ft26/my_client_just_offered_to_pay_me_more_money/,13,1645826517.0,Juicetin1998,0.99,/r/marketing/comments/t1ft26/my_client_just_offered_to_pay_me_more_money/,marketing,474670,Juicetin1998
Google Sheets for Marketers: Dynamic GA Performance Reporting Dashboard,121,c7rvn6,https://www.reddit.com/r/marketing/comments/c7rvn6/google_sheets_for_marketers_dynamic_ga/,15,1561983563.0,the_mmw,0.98,/r/marketing/comments/c7rvn6/google_sheets_for_marketers_dynamic_ga/,marketing,474670,the_mmw
