title,score,id,url,num_comments,created,author,upvote_ratio,permalink,subreddit,subreddit_subscribers,depth
"My newest artpiece, based on the IPCC report... I call this one ""SUMMER 2030""",12818,p1lhvh,https://i.redd.it/1cpy085fxhg71.jpg,535,1628586216.0,The_Goop2526,0.99,/r/collapse/comments/p1lhvh/my_newest_artpiece_based_on_the_ipcc_report_i/,collapse,476177,2
"Work hard, they said. Get a degree, they said.",9648,tu7yb8,https://i.redd.it/biz9pmloy0r81.jpg,559,1648865673.0,vegandread,0.99,/r/collapse/comments/tu7yb8/work_hard_they_said_get_a_degree_they_said/,collapse,476177,2
Most of the population don't realise its going to get worse,9575,oz702y,https://i.redd.it/zxfdwkfpsqf71.jpg,547,1628257738.0,shakeil123,0.99,/r/collapse/comments/oz702y/most_of_the_population_dont_realise_its_going_to/,collapse,476177,2
"""We really had it all""",9132,t1lbxl,https://i.redd.it/hr0upo0uz1k81.jpg,285,1645841819.0,karabeckian,0.99,/r/collapse/comments/t1lbxl/we_really_had_it_all/,collapse,476177,2
"Archived Screenshot of ""The USA is on the verge of collapse""",8662,sdgue9,https://i.redd.it/c3wodsoul3e81.png,1189,1643232238.0,Goatmannequin,0.98,/r/collapse/comments/sdgue9/archived_screenshot_of_the_usa_is_on_the_verge_of/,collapse,476177,2
Everything Old is New Again,8521,10smz34,https://i.imgur.com/1IFYTKY.jpg,355,1675438001.0,karabeckian,0.98,/r/collapse/comments/10smz34/everything_old_is_new_again/,collapse,476177,2
"I feel like we're in an endless cycle of work, then eat, then sleep, then back to work, and I feel like we're expected to maintain this cycle until we die. Here's my latest art piece that I call ""CORPORATE ZOO"". (OC)",7764,qdcoy9,https://i.redd.it/aatbe6tktyu71.jpg,476,1634892621.0,The_Goop2526,0.99,/r/collapse/comments/qdcoy9/i_feel_like_were_in_an_endless_cycle_of_work_then/,collapse,476177,2
Interesting Times,7715,fhzx2q,https://i.redd.it/98fyhfza47841.jpg,286,1584107356.0,karabeckian,0.99,/r/collapse/comments/fhzx2q/interesting_times/,collapse,476177,2
Just stupid people doing what they do best,7637,t6qvgi,https://i.redd.it/79qn5ga15fl81.jpg,401,1646422218.0,bountyhunterfromhell,0.97,/r/collapse/comments/t6qvgi/just_stupid_people_doing_what_they_do_best/,collapse,476177,2
Moral Hazard,7526,11tqa7r,https://i.redd.it/w3xpqsud49oa1.jpg,196,1679057638.0,karabeckian,0.99,/r/collapse/comments/11tqa7r/moral_hazard/,collapse,476177,2
It was unsustainable from the beginning,7497,11nn69v,https://i.redd.it/223rx65zzxma1.jpg,172,1678449455.0,Biosphere_Collapse,0.98,/r/collapse/comments/11nn69v/it_was_unsustainable_from_the_beginning/,collapse,476177,2
"""Really bizarre that *mainstream* world famous scientists are essentially saying we won’t survive the next 80 years on the course we are on, and most people - including journalists and politicians - aren’t interested and refuse to pay attention.""",7426,sr29ba,https://v.redd.it/p8hbstye4hh81,637,1644702878.0,xrm67,0.99,/r/collapse/comments/sr29ba/really_bizarre_that_mainstream_world_famous/,collapse,476177,2
Tell me more about the coming Civil War...,7262,i1ab8u,https://i.redd.it/5yppxpdkemd51.jpg,659,1596212146.0,karabeckian,0.97,/r/collapse/comments/i1ab8u/tell_me_more_about_the_coming_civil_war/,collapse,476177,2
We’re approaching November and there’s still no refreeze in the Siberian Arctic,7148,jhqk0a,https://i.redd.it/am5djw8rk7v51.jpg,567,1603617542.0,oxpea54,0.99,/r/collapse/comments/jhqk0a/were_approaching_november_and_theres_still_no/,collapse,476177,2
"Nearly half of Americans believe America ""likely"" to enter ""civil war"" and ""cease to be a democracy"" in near future, quarter said ""political violence sometimes justified""",6902,vl8a54,https://www.salon.com/2022/06/23/is-american-democracy-already-lost-half-of-us-think-so--but-the-future-remains-unwritten/,1127,1656260345.0,lomorth,0.99,/r/collapse/comments/vl8a54/nearly_half_of_americans_believe_america_likely/,collapse,476177,2
"""Markets Breed Efficiency""",6884,q419l9,https://i.imgur.com/mkLh5gW.jpg,471,1633710525.0,karabeckian,0.97,/r/collapse/comments/q419l9/markets_breed_efficiency/,collapse,476177,2
Robbin' Who?,6863,l7vsi6,https://i.redd.it/t5ln20jkq8e61.jpg,137,1611935225.0,karabeckian,0.99,/r/collapse/comments/l7vsi6/robbin_who/,collapse,476177,2
Collapse acceptance has made me a happier person.,6841,skypwn,https://i.redd.it/or6l1e3n5yf81.jpg,253,1644037365.0,doooompatrol,0.99,/r/collapse/comments/skypwn/collapse_acceptance_has_made_me_a_happier_person/,collapse,476177,2
Stockholm Syndrome,6719,g2y89i,https://preview.redd.it/pmdknot1c8t41.jpg?width=1024&auto=webp&s=5f05f43c211a452101ad1eba80b9f77c02e6c670,374,1587113413.0,karabeckian,0.97,/r/collapse/comments/g2y89i/stockholm_syndrome/,collapse,476177,2
Libyans burn down Parliament over living conditions,6637,vpvyu8,https://v.redd.it/60ki5kx1q6991,433,1656780685.0,YonkersLilBrat,0.99,/r/collapse/comments/vpvyu8/libyans_burn_down_parliament_over_living/,collapse,476177,2
Put into perspective,6447,fq1rqd,https://i.redd.it/24nnkbjs69p41.png,327,1585331523.0,haaany,0.98,/r/collapse/comments/fq1rqd/put_into_perspective/,collapse,476177,2
me_irl,5487,mwwxxj,https://i.redd.it/i5dt1pcfrxu61.jpg,468,1619189319.0,Myth_of_Progress,0.98,/r/collapse/comments/mwwxxj/me_irl/,collapse,476177,2
3450 pounds of garbage left at Lake Tahoe over 4th of July weekend,5471,vurdom,https://i.redd.it/3azmlnpeega91.jpg,347,1657333679.0,vegandread,0.99,/r/collapse/comments/vurdom/3450_pounds_of_garbage_left_at_lake_tahoe_over/,collapse,476177,2
The Pandemic Pool,5441,i5fozv,https://i.redd.it/jwvg2u2sr6f51.png,110,1596813546.0,karabeckian,0.99,/r/collapse/comments/i5fozv/the_pandemic_pool/,collapse,476177,2
Would love to know as well!! “Add me to the list Winona”,5401,nx6t0h,https://i.redd.it/qwtdhw7t8k471.jpg,116,1623384079.0,conscsness,0.99,/r/collapse/comments/nx6t0h/would_love_to_know_as_well_add_me_to_the_list/,collapse,476177,2
"The World’s 2,000 Billionaires Have More Wealth Than Almost 5 Billion People Combined...Fact: Overconsumption by the elite and extreme wealth inequality have occurred in the collapse of every civilization over the last 5,000 years.",5343,j0wxu5,https://finance.yahoo.com/news/world-2-000-billionaires-more-090047225.html,443,1601234048.0,xrm67,0.99,/r/collapse/comments/j0wxu5/the_worlds_2000_billionaires_have_more_wealth/,collapse,476177,2
PNW Heat Wave Meme,5320,o7i5c1,https://i.imgur.com/w6HrC7N.jpg,284,1624602937.0,OldEstimate,0.99,/r/collapse/comments/o7i5c1/pnw_heat_wave_meme/,collapse,476177,2
How Reddit reacts to climate change reports,5306,tyv59c,https://i.redd.it/nm3swhnwz6s81.png,330,1649391395.0,Aquatic_Ceremony,0.98,/r/collapse/comments/tyv59c/how_reddit_reacts_to_climate_change_reports/,collapse,476177,2
Let's use paper straws!,5303,p7wi4c,https://i.redd.it/ukhn8rdvggi71.jpg,279,1629440353.0,Logiman43,0.98,/r/collapse/comments/p7wi4c/lets_use_paper_straws/,collapse,476177,2
Millennials and Gen Z Already Have It Tough and Its Only Going to get Worse,5275,imfbdg,https://i.redd.it/1ie48czmn4l51.jpg,612,1599223717.0,worriedaboutyou55,0.98,/r/collapse/comments/imfbdg/millennials_and_gen_z_already_have_it_tough_and/,collapse,476177,2
Stonks!,5222,i9meep,https://preview.redd.it/qzt1mydo9lg51.jpg?width=797&auto=webp&s=110754d9c687ee6a9db3f401ce194c09c20ecaab,178,1597413356.0,karabeckian,0.99,/r/collapse/comments/i9meep/stonks/,collapse,476177,2
Evergreen American Shit Post,5150,iv6ahk,https://i.imgur.com/0cHspjp.jpg,154,1600436520.0,karabeckian,0.96,/r/collapse/comments/iv6ahk/evergreen_american_shit_post/,collapse,476177,2
"It's been above 70°F all week here in Colorado, and we're on track to have the warmest December on record; I feel like it's only going to get worse. Here's my latest art piece, ""WINTER 2030"" (OC).",5125,r7uz02,https://i.redd.it/l39o3bfgma381.jpg,426,1638522298.0,The_Goop2526,0.98,/r/collapse/comments/r7uz02/its_been_above_70f_all_week_here_in_colorado_and/,collapse,476177,2
None of us are as secure in the future as we think.,5073,xsgdji,https://i.redd.it/veanknvr23r91.jpg,287,1664581799.0,vegandread,0.97,/r/collapse/comments/xsgdji/none_of_us_are_as_secure_in_the_future_as_we_think/,collapse,476177,2
"American People: ""We desperately need testing and contact tracing!""",5065,gk971p,https://i.imgur.com/8jPnfr2.jpg,238,1589549619.0,karabeckian,0.98,/r/collapse/comments/gk971p/american_people_we_desperately_need_testing_and/,collapse,476177,2
Americans celebrate Dow 30k at their local Food Bank... 🇺🇸,4993,k234fy,https://preview.redd.it/h56a93wx3m161.jpg?width=1024&auto=webp&s=5ff3187103fc890010bc44265aa58e944171731d,358,1606490822.0,karabeckian,0.99,/r/collapse/comments/k234fy/americans_celebrate_dow_30k_at_their_local_food/,collapse,476177,2
Worst Year Ever?,4989,lszlu2,https://i.redd.it/861x4qbrqkj61.jpg,204,1614352177.0,karabeckian,0.99,/r/collapse/comments/lszlu2/worst_year_ever/,collapse,476177,2
"Corporate Media: ""INFLATION!"". Corporations:",4973,skeo7h,https://i.imgur.com/V3xYjjp.png,137,1643985159.0,karabeckian,0.99,/r/collapse/comments/skeo7h/corporate_media_inflation_corporations/,collapse,476177,2
Coca-Cola is named world’s worst plastic polluter for a fifth year,4935,z05m19,https://www.euronews.com/green/2022/11/18/coca-cola-revealed-as-worlds-worst-plastic-polluter-for-fifth-year-in-a-row,188,1668954861.0,Monsur_Ausuhnom,0.99,/r/collapse/comments/z05m19/cocacola_is_named_worlds_worst_plastic_polluter/,collapse,476177,2
Degrowth: Free Love Edition,4908,z4kgf0,https://i.imgur.com/W2WwAPw.png,146,1669401002.0,OldEstimate,0.99,/r/collapse/comments/z4kgf0/degrowth_free_love_edition/,collapse,476177,2
Boomers with no notion of societal or ecological collapse...,4905,ymehd3,https://v.redd.it/2ab2bfdrv0y91,366,1667606220.0,return2ozma,0.97,/r/collapse/comments/ymehd3/boomers_with_no_notion_of_societal_or_ecological/,collapse,476177,2
At some point we're all just going to start laughing uncontrollably while everything burns.,4886,vjvz92,https://i.redd.it/myaswsymbm791.jpg,510,1656097868.0,a-horse-has-no-name,0.98,/r/collapse/comments/vjvz92/at_some_point_were_all_just_going_to_start/,collapse,476177,2
"North Pole will be ""ice free"" by 2040, potentially sparking ""world war"" - tensions over access to ""$1 trillion+"" of untapped Arctic metals, oil, gas expected to ""generate potential conflict"" between U.S., Russia, China",4861,vluwxz,https://nypost.com/2022/06/25/how-the-melting-arctic-could-lead-to-huge-richesand-world-war/amp/,664,1656334682.0,lomorth,0.98,/r/collapse/comments/vluwxz/north_pole_will_be_ice_free_by_2040_potentially/,collapse,476177,2
"Strip away the techno-hopium, and reality shines through.",4866,k6pb0e,https://i.redd.it/tdvmexfpf7361.png,214,1607102778.0,xrm67,0.99,/r/collapse/comments/k6pb0e/strip_away_the_technohopium_and_reality_shines/,collapse,476177,2
"‘We were shocked’: RAND study uncovers massive income shift to the top 1%. The median worker should be making as much as $102,000 annually—if some $2.5 trillion wasn’t being “reverse distributed” every year away from the working class.",4841,ki80hn,https://www.fastcompany.com/90550015/we-were-shocked-rand-study-uncovers-massive-income-shift-to-the-top-1,522,1608652772.0,Bluest_waters,0.99,/r/collapse/comments/ki80hn/we_were_shocked_rand_study_uncovers_massive/,collapse,476177,2
The Plan For Climate Change,4815,zto3ux,https://i.redd.it/nix7018tqo7a1.jpg,387,1671817714.0,Monsur_Ausuhnom,0.98,/r/collapse/comments/zto3ux/the_plan_for_climate_change/,collapse,476177,2
The modern environmental movement (comic),4779,iiaufz,https://i.redd.it/r5eaih52xrj51.png,406,1598633947.0,quadautomaticwervice,0.96,/r/collapse/comments/iiaufz/the_modern_environmental_movement_comic/,collapse,476177,2
Is this the society we live in?,4678,flrc06,https://i.redd.it/nui9fx619nn41.jpg,253,1584691773.0,temporvicis,0.99,/r/collapse/comments/flrc06/is_this_the_society_we_live_in/,collapse,476177,2
South Korea is on fire this weekend. Global warming doesn't stop for petty human conflicts.,4656,t7z89h,https://v.redd.it/1klpayavqrl81,246,1646574926.0,QuartzPuffyStar,0.97,/r/collapse/comments/t7z89h/south_korea_is_on_fire_this_weekend_global/,collapse,476177,2
Faster than expected,4569,sq1p8t,https://i.redd.it/dpns2tja08h81.jpg,117,1644592483.0,hourglass_curves,0.98,/r/collapse/comments/sq1p8t/faster_than_expected/,collapse,476177,2
"""bUt ThAt WoUlD cOlLaPsE tHe EcOnOmY!1!""",4549,kb4jsp,https://i.redd.it/p373tfseva361.png,172,1607699489.0,karabeckian,0.97,/r/collapse/comments/kb4jsp/but_that_would_collapse_the_economy1/,collapse,476177,2
"Hey, I've Seen This One!",4551,vp22jl,https://i.redd.it/pfwtqw3l50891.jpg,248,1656685506.0,karabeckian,0.96,/r/collapse/comments/vp22jl/hey_ive_seen_this_one/,collapse,476177,2
I hope my children can forgive me...,4501,wbn2ck,https://i.redd.it/bvyzjys7fme91.jpg,317,1659149984.0,doooompatrol,0.98,/r/collapse/comments/wbn2ck/i_hope_my_children_can_forgive_me/,collapse,476177,2
This is oversimplified but the crux of the matter,4498,ylwicp,https://i.redd.it/faldn1m9oyx91.jpg,648,1667561423.0,Bellybutton_fluffjar,0.91,/r/collapse/comments/ylwicp/this_is_oversimplified_but_the_crux_of_the_matter/,collapse,476177,2
"Food crisis in Sri Lanka, people burning politician's homes and clashing with the police",4461,unqear,https://v.redd.it/ei1pcstjgyy81,521,1652322186.0,YonkersLilBrat,0.99,/r/collapse/comments/unqear/food_crisis_in_sri_lanka_people_burning/,collapse,476177,2
The failings of civilization repackaged as heart-warming fluff news stories.,4456,tbrv5q,https://i.redd.it/5jsv38gcqrm81.jpg,74,1647010571.0,a-horse-has-no-name,0.98,/r/collapse/comments/tbrv5q/the_failings_of_civilization_repackaged_as/,collapse,476177,2
75% of middle-class households say their income is falling behind the cost of living,4367,w2hdz7,https://www.cnbc.com/2022/07/18/most-middle-class-households-say-income-falling-behind-cost-of-living.html,543,1658197978.0,metalreflectslime,0.99,/r/collapse/comments/w2hdz7/75_of_middleclass_households_say_their_income_is/,collapse,476177,2
Gotta love ignoring systemic problems in favour of simplistic answers,4351,11b1dxu,https://i.redd.it/f46itmpyn8ka1.jpg,598,1677271047.0,Biosphere_Collapse,0.89,/r/collapse/comments/11b1dxu/gotta_love_ignoring_systemic_problems_in_favour/,collapse,476177,2
Doomers,4337,rsxz08,https://i.imgur.com/KauEYdI.jpg,254,1640969330.0,FishDisciple,0.98,/r/collapse/comments/rsxz08/doomers/,collapse,476177,2
"""Perhaps the deadliest pandemic ever to strike humanity is the plague of deliberate misinformation, mass delusion and unfounded beliefs which is engulfing 21st Century society.""",4298,t3k4mg,https://johnmenadue.com/the-medias-role-in-the-age-of-deceit/,353,1646067444.0,xrm67,0.97,/r/collapse/comments/t3k4mg/perhaps_the_deadliest_pandemic_ever_to_strike/,collapse,476177,2
Water Scarcity Will Be A Major Investment,4297,zagu3t,https://i.redd.it/00aan39ybg3a1.jpg,274,1669972488.0,Monsur_Ausuhnom,0.99,/r/collapse/comments/zagu3t/water_scarcity_will_be_a_major_investment/,collapse,476177,2
"the UK daytine average temperature for November is 7.8°c, it's currently 19°c",4251,ys70vr,https://i.redd.it/lxl90eaqecz91.jpg,493,1668163560.0,Bellybutton_fluffjar,0.97,/r/collapse/comments/ys70vr/the_uk_daytine_average_temperature_for_november/,collapse,476177,2
Laying out the GDP strata,4227,v96x00,https://i.redd.it/otzhrcvchs491.png,110,1654864933.0,dumnezero,0.99,/r/collapse/comments/v96x00/laying_out_the_gdp_strata/,collapse,476177,2
"Full-time minimum wage workers can’t afford rent anywhere in the US, according to a new report",4174,oki45u,https://www.cnbc.com/2021/07/14/full-time-minimum-wage-workers-cant-afford-rent-anywhere-in-the-us.html,735,1626311233.0,metalreflectslime,0.99,/r/collapse/comments/oki45u/fulltime_minimum_wage_workers_cant_afford_rent/,collapse,476177,2
Just doing my part,4172,ewpiwv,https://i.redd.it/xhty3c0un4e41.jpg,119,1580482331.0,Disaster_Capitalist,0.99,/r/collapse/comments/ewpiwv/just_doing_my_part/,collapse,476177,2
BlackRock President Says ‘Entitled Generation’ Now Learning About Shortages (While BlackRock creates an artificial housing shortage nationwide),4071,tsbbh4,https://finance.yahoo.com/news/blackrock-kapito-says-scarcity-inflation-230000585.html,478,1648660378.0,survive_los_angeles,0.99,/r/collapse/comments/tsbbh4/blackrock_president_says_entitled_generation_now/,collapse,476177,2
UK natural gas prices up 40% in a single day,4040,q2ivmf,https://i.redd.it/tyzzva15ktr71.jpg,765,1633521352.0,NORATHEDESTROYER,0.99,/r/collapse/comments/q2ivmf/uk_natural_gas_prices_up_40_in_a_single_day/,collapse,476177,2
Oblivious!...,4025,edav79,https://i.redd.it/j6gn1722ts541.jpg,68,1576851998.0,xrm67,0.99,/r/collapse/comments/edav79/oblivious/,collapse,476177,2
USA wealthiest billionaires net worth increase.,4017,ia2ewm,https://i.redd.it/o9eshiiar1h51.jpg,460,1597471982.0,metalreflectslime,0.99,/r/collapse/comments/ia2ewm/usa_wealthiest_billionaires_net_worth_increase/,collapse,476177,2
"Scientists yesterday said seals washed up dead in the Caspian sea had bird flu, the first transmission of avian flu to wild mammals. Today bird flu was confirmed in foxes and otters in the UK",3994,10rq4vl,https://www.bbc.com/news/science-environment-64474594.amp,822,1675345406.0,veraknow,0.99,/r/collapse/comments/10rq4vl/scientists_yesterday_said_seals_washed_up_dead_in/,collapse,476177,2
"Happy to be with you all, here at the end.",3975,risrtr,https://i.redd.it/058lovlok6681.jpg,258,1639780798.0,doooompatrol,0.98,/r/collapse/comments/risrtr/happy_to_be_with_you_all_here_at_the_end/,collapse,476177,2
Sri Lanka is out of petrol - PM tells crisis-hit nation,3941,ur011p,https://v.redd.it/nelv0et68vz81,573,1652718869.0,YonkersLilBrat,0.99,/r/collapse/comments/ur011p/sri_lanka_is_out_of_petrol_pm_tells_crisishit/,collapse,476177,2
Just Enjoy,3886,yfn3gl,https://i.redd.it/da5wr5fqkjw91.jpg,211,1666960783.0,hourglass_curves,0.98,/r/collapse/comments/yfn3gl/just_enjoy/,collapse,476177,2
"U.S. counts approximately 543,000 new COVID cases in a day - Highest since the pandemic started",3867,rqj09y,https://www.marketwatch.com/story/coronavirus-tally-us-counts-more-than-500000-new-covid-cases-in-a-day-lifting-the-daily-average-to-a-near-1-year-high-2021-12-28,1036,1640707234.0,BabyLlama-Drama,0.96,/r/collapse/comments/rqj09y/us_counts_approximately_543000_new_covid_cases_in/,collapse,476177,2
Collapse related posts becoming more prevalent on Reddit.,3818,jkfudp,https://i.redd.it/e60hpo44w2w51.jpg,460,1603996675.0,shakeil123,0.98,/r/collapse/comments/jkfudp/collapse_related_posts_becoming_more_prevalent_on/,collapse,476177,2
25K and climbing already without power in Texas,3799,sj9psx,https://poweroutage.us/,690,1643862099.0,FlowerDance2557,0.98,/r/collapse/comments/sj9psx/25k_and_climbing_already_without_power_in_texas/,collapse,476177,2
"90% of US adults say the United States is experiencing a mental health crisis, CNN/KFF poll finds",3777,xwhwld,https://www.cnn.com/2022/10/05/health/cnn-kff-mental-health-poll-wellness/index.html,498,1664993505.0,ontrack,0.99,/r/collapse/comments/xwhwld/90_of_us_adults_say_the_united_states_is/,collapse,476177,2
Around half of older Americans can’t afford essential expenses: report,3762,w7t8kt,https://thehill.com/changing-america/respect/poverty/3572806-around-half-of-older-americans-cant-afford-essential-expenses-report/amp/,520,1658766246.0,return2ozma,0.99,/r/collapse/comments/w7t8kt/around_half_of_older_americans_cant_afford/,collapse,476177,2
"aww, poor little crabs",3756,y9uof3,https://i.redd.it/fas40ee526v91.jpg,261,1666361296.0,bountyhunterfromhell,0.96,/r/collapse/comments/y9uof3/aww_poor_little_crabs/,collapse,476177,2
Supermarkets put security tags on cheese blocks and other goods as stores tackle shoplifting amid soaring costs,3766,vsrdtg,https://www.independent.co.uk/news/uk/home-news/aldi-secruity-tag-cheese-inflation-b2116115.html,543,1657117886.0,survive_los_angeles,0.99,/r/collapse/comments/vsrdtg/supermarkets_put_security_tags_on_cheese_blocks/,collapse,476177,2
"Joaquin Phoenix calling out the hypocrisy of asking for votes, thoughts and prayers while flying private jets to a room full of millionaires (Golden Globes)",3741,ekoqzt,https://v.redd.it/z34tgzas43941,278,1578284636.0,TheTanzanite,0.99,/r/collapse/comments/ekoqzt/joaquin_phoenix_calling_out_the_hypocrisy_of/,collapse,476177,2
America Is Too Broken to Fight the Coronavirus. No other developed country is doing so badly.,3704,hf1m53,https://www.nytimes.com/2020/06/22/opinion/us-coronavirus-trump.html?smid=re-share,862,1593007630.0,jms1225,0.96,/r/collapse/comments/hf1m53/america_is_too_broken_to_fight_the_coronavirus_no/,collapse,476177,2
'It’s everyone. It’s all of us': More than half of Americans are living paycheck to paycheck — even the wealthy are feeling the heat of continued inflation,3701,xd8on7,https://finance.yahoo.com/news/everyone-us-more-half-americans-120000821.html,726,1663078424.0,Vailhem,0.99,/r/collapse/comments/xd8on7/its_everyone_its_all_of_us_more_than_half_of/,collapse,476177,2
It's That Easy! - A Decade-by-Decade Guide to Saving Civilization (Shitpost Friday),3694,imsjk4,https://i.redd.it/tyv5g483f8l51.jpg,157,1599269408.0,Myth_of_Progress,0.99,/r/collapse/comments/imsjk4/its_that_easy_a_decadebydecade_guide_to_saving/,collapse,476177,2
"A record 4.3 million workers quit their jobs in August, led by food and retail industries.",3690,q6u6r4,https://www.cnbc.com/2021/10/12/a-record-4point3-million-workers-quit-their-jobs-in-august-led-by-food-and-retail-industries.html,559,1634068259.0,metalreflectslime,0.99,/r/collapse/comments/q6u6r4/a_record_43_million_workers_quit_their_jobs_in/,collapse,476177,2
Rents reach 'insane' levels across US with no end in sight,3634,szpk9g,https://apnews.com/article/business-lifestyle-us-news-miami-florida-a4717c05df3cb0530b73a4fe998ec5d1,756,1645644178.0,jms1225,0.99,/r/collapse/comments/szpk9g/rents_reach_insane_levels_across_us_with_no_end/,collapse,476177,2
"Gen Zers are taking on more debt, roommates, and jobs as their economy gets worse and worse",3607,zdaad1,https://www.businessinsider.com/recession-outlook-gen-z-finances-debt-sidehustles-jobs-rent-2022-12,643,1670255040.0,IndicationOver,0.98,/r/collapse/comments/zdaad1/gen_zers_are_taking_on_more_debt_roommates_and/,collapse,476177,2
I’m all out of hopium for the year,3604,ksqdlq,https://i.imgur.com/oPawupl.jpg,362,1610064068.0,FishDisciple,0.99,/r/collapse/comments/ksqdlq/im_all_out_of_hopium_for_the_year/,collapse,476177,2
Technology Will Save Us,3585,n1ucuy,https://i.redd.it/5g32n9eggbw61.png,290,1619790935.0,Myth_of_Progress,0.98,/r/collapse/comments/n1ucuy/technology_will_save_us/,collapse,476177,2
Taiwan rejects US CDC guidance on 5-day quarantine: Some Omicron cases still infectious up to 12 days after testing positive,3586,rtm8pt,https://www.taiwannews.com.tw/en/news/4393548,392,1641053123.0,doooompatrol,0.98,/r/collapse/comments/rtm8pt/taiwan_rejects_us_cdc_guidance_on_5day_quarantine/,collapse,476177,2
"The world's biggest carbon-removal plant just opened. In a year, it'll negate just 3 seconds' worth of global emissions.",3576,pv8n1y,https://www.yahoo.com/news/worlds-biggest-carbon-removal-plant-110600071.html,533,1632582762.0,krink1487,0.99,/r/collapse/comments/pv8n1y/the_worlds_biggest_carbonremoval_plant_just/,collapse,476177,2
Hard times for everybody,3576,g7jur6,https://i.redd.it/3nbk3rmbxuu41.png,326,1587773850.0,bountyhunterfromhell,0.91,/r/collapse/comments/g7jur6/hard_times_for_everybody/,collapse,476177,2
"Drives me nuts no one in the MSM will acknowledge our cities are desperate for funding for schools, roads infrastructure, etc and yet police depts. were apparently stocked floor to ceiling with riot gear, guns, vests, tear gas, plastic bullets, cars, mini tanks, helmets, face guards, bullets etc",3564,gvwhqr,https://www.reddit.com/r/collapse/comments/gvwhqr/drives_me_nuts_no_one_in_the_msm_will_acknowledge/,290,1591199661.0,Bluest_waters,0.98,/r/collapse/comments/gvwhqr/drives_me_nuts_no_one_in_the_msm_will_acknowledge/,collapse,476177,2
Going to be some disappointment,3554,katzld,https://i.redd.it/f7ye11yf1h461.png,587,1607654790.0,Disaster_Capitalist,0.97,/r/collapse/comments/katzld/going_to_be_some_disappointment/,collapse,476177,2
Collapse Disillusionment Meme,3546,outpnh,https://i.imgur.com/1JcMD2M.png,128,1627678457.0,OldEstimate,0.99,/r/collapse/comments/outpnh/collapse_disillusionment_meme/,collapse,476177,2
"Following the bounties being placed on women and clinics in Texas right now, I created this digital art piece which I call ""LIFE IS PRECIOUS""",3522,ph1v3x,https://i.redd.it/3v7b7k0bd9l71.jpg,646,1630661843.0,The_Goop2526,0.92,/r/collapse/comments/ph1v3x/following_the_bounties_being_placed_on_women_and/,collapse,476177,2
House of Cards…,3513,uk24d7,https://i.redd.it/ws1exqd8fyx81.jpg,89,1651885856.0,xrm67,0.99,/r/collapse/comments/uk24d7/house_of_cards/,collapse,476177,2
Collapse in 30 minutes or it's free!,3519,114ocra,https://i.redd.it/hbzppwtsbnfa1.jpg,189,1676647544.0,karabeckian,0.99,/r/collapse/comments/114ocra/collapse_in_30_minutes_or_its_free/,collapse,476177,2
30 year old me was living the good life. He could eat ramen AND use the air conditioner in the summer.,3498,v98ajt,https://i.redd.it/pxn1hm9eus491.jpg,173,1654869285.0,a-horse-has-no-name,0.99,/r/collapse/comments/v98ajt/30_year_old_me_was_living_the_good_life_he_could/,collapse,476177,2
"Supreme Court has voted to overturn abortion rights, draft opinion shows",3479,uh4jnv,https://www.politico.com/news/2022/05/02/supreme-court-abortion-draft-opinion-00029473,1726,1651539974.0,Lilyo,0.96,/r/collapse/comments/uh4jnv/supreme_court_has_voted_to_overturn_abortion/,collapse,476177,2
