title,score,id,url,num_comments,created,author,upvote_ratio,permalink,subreddit,subreddit_subscribers,depth
Drawing Mona Lisa with 256 circles using evolution [Github repo in comments],5724,gn9add,https://v.redd.it/nyzyx7uyfwz41,122,1589972294.0,Itwist101,0.98,/r/Python/comments/gn9add/drawing_mona_lisa_with_256_circles_using/,Python,1112499,2
I've designed brand new cheatsheets (x2) and handouts (x3) for matplotlib,5033,hmoabi,https://raw.githubusercontent.com/matplotlib/cheatsheets/master/cheatsheets-1.png,109,1594098627.0,Nicolas-Rougier,0.98,/r/Python/comments/hmoabi/ive_designed_brand_new_cheatsheets_x2_and/,Python,1112499,2
A Python GUI for uninstalling the default Windows 10 apps.,4154,gs7xdb,https://i.redd.it/r51f4jvzti151.png,201,1590678403.0,Goldtom,0.99,/r/Python/comments/gs7xdb/a_python_gui_for_uninstalling_the_default_windows/,Python,1112499,2
"PrettyErrors, a module to format exception reports",3937,jui7zw,https://raw.githubusercontent.com/onelivesleft/PrettyErrors/master/example.png,171,1605425789.0,-sideshow-,0.99,/r/Python/comments/jui7zw/prettyerrors_a_module_to_format_exception_reports/,Python,1112499,2
"I am excited to share my 8th published book, Python 101, geared for beginners and intermediate level readers",3742,isbjm4,https://i.redd.it/jsla1w1pq0n51.jpg,134,1600048121.0,driscollis,0.96,/r/Python/comments/isbjm4/i_am_excited_to_share_my_8th_published_book/,Python,1112499,2
I'm developing a game with Python and Pygame!,3460,ggt5ld,https://i.redd.it/jogf31rlmux41.gif,217,1589077883.0,DaFluffyPotato,0.97,/r/Python/comments/ggt5ld/im_developing_a_game_with_python_and_pygame/,Python,1112499,2
I made an Instagram Bot to make DeepFakes for everyone! @deepfake.maker,3402,izspe0,https://v.redd.it/0g28dzoh5dp51,141,1601070131.0,dome271,0.96,/r/Python/comments/izspe0/i_made_an_instagram_bot_to_make_deepfakes_for/,Python,1112499,2
Made a Screen Dimmer based on Facial Recognition with OpenCV and AppleScript!,3330,h9bfe4,https://v.redd.it/ns6wu0ho11551,132,1592206495.0,LAcuber,0.98,/r/Python/comments/h9bfe4/made_a_screen_dimmer_based_on_facial_recognition/,Python,1112499,2
An update on Python 4,3277,itzn13,https://i.redd.it/ayxwpuasjjn51.png,392,1600275728.0,anyfactor,0.98,/r/Python/comments/itzn13/an_update_on_python_4/,Python,1112499,2
I released the Code for the Instagram DeepFake Bot!,3204,j2ai2r,https://v.redd.it/8yof81xg56q51,88,1601421174.0,dome271,0.96,/r/Python/comments/j2ai2r/i_released_the_code_for_the_instagram_deepfake_bot/,Python,1112499,2
I made a ray tracer that simulates curved spacetime by using Einstein's field equations from general relativity. Here's a black hole!,3127,hb108j,https://i.redd.it/yrcat3ndkj551.jpg,129,1592430700.0,jrmiranda,0.99,/r/Python/comments/hb108j/i_made_a_ray_tracer_that_simulates_curved/,Python,1112499,2
Randomly Generate 69420 - Generate random 5-digit numbers until 69420 is generated,2811,hvq628,https://v.redd.it/8lxqrb6tedc51,265,1595407124.0,baranonen,0.91,/r/Python/comments/hvq628/randomly_generate_69420_generate_random_5digit/,Python,1112499,2
I made a project that generates the graph,2762,hxnyge,https://i.redd.it/x8ueald2o0d51.png,98,1595688726.0,jeel2331,0.94,/r/Python/comments/hxnyge/i_made_a_project_that_generates_the_graph/,Python,1112499,2
"PrettyErrors, a module to format exception reports",2648,qxeyrn,https://raw.githubusercontent.com/onelivesleft/PrettyErrors/master/example.png,84,1637324046.0,-sideshow-,0.98,/r/Python/comments/qxeyrn/prettyerrors_a_module_to_format_exception_reports/,Python,1112499,2
Embedded Python: Build a Game on the BBC micro:bit – Real Python,2558,nf4jh0,https://realpython.com/embedded-python/,13,1621324065.0,pmz,0.97,/r/Python/comments/nf4jh0/embedded_python_build_a_game_on_the_bbc_microbit/,Python,1112499,2
White Cuts Across Black Background - an effect achieved through good use of the Python Image Library,2545,i4x5bw,https://v.redd.it/nn4a1e4jcff51,56,1596738232.0,Swipecat,0.98,/r/Python/comments/i4x5bw/white_cuts_across_black_background_an_effect/,Python,1112499,2
"I made a course on NumPy. It got good reviews, but sales were weak so I'm releasing the entire thing for free.",2516,l1jdcj,https://www.reddit.com/r/Python/comments/l1jdcj/i_made_a_course_on_numpy_it_got_good_reviews_but/,135,1611179127.0,Neb519,0.99,/r/Python/comments/l1jdcj/i_made_a_course_on_numpy_it_got_good_reviews_but/,Python,1112499,2
"Hello, world! I'm Al Sweigart, author of ""Automate the Boring Stuff with Python"" and several other programming books. AMA!",2496,otbvoj,https://www.reddit.com/r/Python/comments/otbvoj/hello_world_im_al_sweigart_author_of_automate_the/,539,1627485107.0,AlSweigart,0.98,/r/Python/comments/otbvoj/hello_world_im_al_sweigart_author_of_automate_the/,Python,1112499,2
"Spotlightify - a overlay controller for spotify, allowing you to quickly control your music without distraction. Please let me know if you are interested in this application as I am thinking of making it public on my github in the near future (once more features have been developed), thanks!",2493,go6no5,https://v.redd.it/qy9hkp9307051,211,1590099640.0,Murpho19,0.98,/r/Python/comments/go6no5/spotlightify_a_overlay_controller_for_spotify/,Python,1112499,2
I wrote a python script that I'm running on my phone to play a word game called Ruzzle.,2490,ejnnbc,https://v.redd.it/q8yf2bhacn841,231,1578093694.0,lambda5x5,0.98,/r/Python/comments/ejnnbc/i_wrote_a_python_script_that_im_running_on_my/,Python,1112499,2
Wrote a script that downloads r/wallpaper's hottest 100 images and cycles through them as a wallpaper!,2392,hei6kg,https://v.redd.it/pxn50vuyvo651,142,1592930990.0,LAcuber,0.99,/r/Python/comments/hei6kg/wrote_a_script_that_downloads_rwallpapers_hottest/,Python,1112499,2
I made a Sudoku.com solver using Selenium,2375,fgdbxb,https://v.redd.it/xxgz2t9ldul41,65,1583844704.0,Itwist101,0.98,/r/Python/comments/fgdbxb/i_made_a_sudokucom_solver_using_selenium/,Python,1112499,2
"After having this idea a while back and seeing yesterday's post with arduino controlled auto ambient lighting, I creating my own version with python!",2333,gmgezg,https://v.redd.it/m0nqwy6q0nz41,117,1589857423.0,lambda5x5,0.99,/r/Python/comments/gmgezg/after_having_this_idea_a_while_back_and_seeing/,Python,1112499,2
I made a python script to download subtitles for your movies...,2249,g10v5z,https://i.redd.it/kj5vvd1weqs41.gif,222,1586848123.0,sameera__madushan_,0.97,/r/Python/comments/g10v5z/i_made_a_python_script_to_download_subtitles_for/,Python,1112499,2
I made my handwriting a font on Inkscape and used custom made python script to add random movment (in y axis) for each character. Looks fine or too suspicious?,2235,fofxnx,https://i.redd.it/qm83ej0yipo41.jpg,205,1585093391.0,sanidhya69,0.98,/r/Python/comments/fofxnx/i_made_my_handwriting_a_font_on_inkscape_and_used/,Python,1112499,2
Rolling Shutter Effect demonstrated with Python,2204,dbg4nm,https://v.redd.it/fu4wiipo0sp31,60,1569868974.0,Swipecat,0.99,/r/Python/comments/dbg4nm/rolling_shutter_effect_demonstrated_with_python/,Python,1112499,2
My gravity simulation almost an entire day of work later! Featuring inelastic collisions,2179,bsy603,https://i.redd.it/2u3z0tlnne031.gif,149,1558810961.0,mittwochmensch,0.97,/r/Python/comments/bsy603/my_gravity_simulation_almost_an_entire_day_of/,Python,1112499,2
Boids - organic motion from 3 simple rules,2164,fpvay3,https://v.redd.it/n38kfl4q97p41,147,1585308386.0,chrismit3s,0.99,/r/Python/comments/fpvay3/boids_organic_motion_from_3_simple_rules/,Python,1112499,2
Ever heard of Black? This is the opposite. A tool to turn your clean python code into a hideous (working) mess.,2142,rra22x,https://www.reddit.com/r/Python/comments/rra22x/ever_heard_of_black_this_is_the_opposite_a_tool/,182,1640789999.0,Gedanke,0.96,/r/Python/comments/rra22x/ever_heard_of_black_this_is_the_opposite_a_tool/,Python,1112499,2
[OC] Updated version of my recent maze finding algorithm with source code,2108,empp5x,https://v.redd.it/585jcli1qx941,111,1578655617.0,Enguzelharf,0.98,/r/Python/comments/empp5x/oc_updated_version_of_my_recent_maze_finding/,Python,1112499,2
I found what happens when you change the Mandelbrot Set's power value and animated it with Python,2101,g1xlte,https://i.redd.it/u2r68zcwx0t41.gif,69,1586975031.0,Swipecat,0.99,/r/Python/comments/g1xlte/i_found_what_happens_when_you_change_the/,Python,1112499,2
Made a small Reddit client that runs on a 0.96 inch OLED display with a Raspberry Pi as my first project written in Python,2094,haq3vc,https://v.redd.it/k4mnainoqg551,69,1592396643.0,baranonen,0.98,/r/Python/comments/haq3vc/made_a_small_reddit_client_that_runs_on_a_096/,Python,1112499,2
Visualizing Bubble Sort,2074,eluz97,https://i.redd.it/r1rr66rzzk941.png,75,1578500895.0,thebuffed,0.98,/r/Python/comments/eluz97/visualizing_bubble_sort/,Python,1112499,2
This is one of the most interesting outputs of the particle simulation :),2034,dxq4ea,https://v.redd.it/ib5nkw7ifaz31,124,1574014560.0,chrismit3s,0.98,/r/Python/comments/dxq4ea/this_is_one_of_the_most_interesting_outputs_of/,Python,1112499,2
Circle Evolution v0.1 is now available on PyPI. My first big project as a 16 year old. [Github repo & desc in comments],1955,grglgp,https://i.redd.it/o0dlyr4r1a151.png,79,1590572156.0,Itwist101,0.95,/r/Python/comments/grglgp/circle_evolution_v01_is_now_available_on_pypi_my/,Python,1112499,2
Dijkstra's algorithm now running in linear time on a 90x90 grid,1955,fxpf9l,https://v.redd.it/t7zvu5grgrr41,109,1586424587.0,mutatedllama,0.95,/r/Python/comments/fxpf9l/dijkstras_algorithm_now_running_in_linear_time_on/,Python,1112499,2
Tuesday Daily Thread: Advanced questions,1945,nevt2r,https://www.reddit.com/r/Python/comments/nevt2r/tuesday_daily_thread_advanced_questions/,14,1621296014.0,Im__Joseph,1.0,/r/Python/comments/nevt2r/tuesday_daily_thread_advanced_questions/,Python,1112499,2
Maze Solver Visualizer - Dijkstra's algorithm (asynchronous neighbours),1910,fsuibu,https://v.redd.it/xb71rqy5l5q41,73,1585723755.0,mutatedllama,0.98,/r/Python/comments/fsuibu/maze_solver_visualizer_dijkstras_algorithm/,Python,1112499,2
Monday Daily Thread: Project ideas!,1903,ne1kkx,https://www.reddit.com/r/Python/comments/ne1kkx/monday_daily_thread_project_ideas/,18,1621209618.0,Im__Joseph,1.0,/r/Python/comments/ne1kkx/monday_daily_thread_project_ideas/,Python,1112499,2
"I know Python basics, what next?",1889,i0m2sy,https://www.reddit.com/r/Python/comments/i0m2sy/i_know_python_basics_what_next/,81,1596115867.0,ASIC_SP,0.97,/r/Python/comments/i0m2sy/i_know_python_basics_what_next/,Python,1112499,2
"Hey Reddit, here's my comprehensive course on Python Pandas, for free.",1883,lain0r,https://www.reddit.com/r/Python/comments/lain0r/hey_reddit_heres_my_comprehensive_course_on/,90,1612225298.0,Neb519,0.99,/r/Python/comments/lain0r/hey_reddit_heres_my_comprehensive_course_on/,Python,1112499,2
Using python to map the traffic that came to my server after my post hit the front page.,1851,b9xcit,https://i.redd.it/11a6sisopiq21.png,77,1554502026.0,Gedanke,0.98,/r/Python/comments/b9xcit/using_python_to_map_the_traffic_that_came_to_my/,Python,1112499,2
Here is an absolute Beginners Tutorial that can help you guys to get started with Machine learning. All you need is some basic knowledge of Python. You will have created two ML models at the end of this tutorial and also know the working of some ML algorithms.,1836,i73sy4,https://www.mygreatlearning.com/blog/machine-learning-tutorial-for-complete-beginners/?utm_source=myreddit-ML121,76,1597062087.0,Hussain_Mujtaba,0.96,/r/Python/comments/i73sy4/here_is_an_absolute_beginners_tutorial_that_can/,Python,1112499,2
Generating Geometric Birds,1829,eqir9x,https://i.redd.it/knqxkwn4hkb41.png,67,1579366246.0,thebuffed,0.98,/r/Python/comments/eqir9x/generating_geometric_birds/,Python,1112499,2
Learn Python in 2021 with these FREE Udemy Courses!,1815,kouixi,https://www.reddit.com/r/Python/comments/kouixi/learn_python_in_2021_with_these_free_udemy_courses/,238,1609578995.0,JO3POTATO,0.97,/r/Python/comments/kouixi/learn_python_in_2021_with_these_free_udemy_courses/,Python,1112499,2
MIT offers free online course in Computer Programming using Python,1800,nefzy6,https://www.edx.org/course/introduction-to-computer-science-and-programming-7,102,1621257408.0,ivaylos,0.98,/r/Python/comments/nefzy6/mit_offers_free_online_course_in_computer/,Python,1112499,2
I made an Instagram Bot that downloads any video post you send to him and sends it back to you as mp4. Source Code will follow later https://instagram.com/instaadownload,1791,ep8h1m,https://v.redd.it/s6ftz0u7c0b41,103,1579122490.0,dome271,0.97,/r/Python/comments/ep8h1m/i_made_an_instagram_bot_that_downloads_any_video/,Python,1112499,2
Guido van Rossum joins Microsoft,1792,jsyf3c,https://twitter.com/gvanrossum/status/1326932991566700549?s=21,476,1605200770.0,azhenley,0.97,/r/Python/comments/jsyf3c/guido_van_rossum_joins_microsoft/,Python,1112499,2
Matplotlib 3D bar plots,1760,fvcvfw,https://raw.githubusercontent.com/rougier/matplotlib-3d/master/doc/bar.png,53,1586088781.0,Nicolas-Rougier,0.99,/r/Python/comments/fvcvfw/matplotlib_3d_bar_plots/,Python,1112499,2
My simulation of gravity with 1000 particles. PC took a couple of hours to process!,1766,bu4shw,https://i.redd.it/py01ytbdd0131.gif,241,1559073895.0,mittwochmensch,0.97,/r/Python/comments/bu4shw/my_simulation_of_gravity_with_1000_particles_pc/,Python,1112499,2
"I made this clock using python and as GUI html, css, JS",1751,g6tiih,https://v.redd.it/r6ubz2wxfmu41,82,1587671373.0,Ro0t-set,0.96,/r/Python/comments/g6tiih/i_made_this_clock_using_python_and_as_gui_html/,Python,1112499,2
"Today I’m releasing PyBoy v1.0.0! A Game Boy emulator written in Python, focused on scripting, AI and learning",1740,g484d4,https://www.reddit.com/r/Python/comments/g484d4/today_im_releasing_pyboy_v100_a_game_boy_emulator/,49,1587304865.0,baekalfen,0.98,/r/Python/comments/g484d4/today_im_releasing_pyboy_v100_a_game_boy_emulator/,Python,1112499,2
"Update! As promised, I made a website for the writing synthesis algorithm I wrote, It's fairly easy to use (Massively better than using the scripts itself). I hope it helps some of you to get your assignments done. Do try it out! Currently hosted on https://3c160834.ngrok.io (Link expires in 8 hrs)",1742,g6apwp,https://v.redd.it/3ynw9d402gu41,125,1587593856.0,sanidhya69,0.98,/r/Python/comments/g6apwp/update_as_promised_i_made_a_website_for_the/,Python,1112499,2
I was able to install and use Jupyter Notebook on my Android smartphone! (Through the terminal and without using root access),1713,hhe1eb,https://i.redd.it/71tq4atqgn751.png,124,1593349549.0,M4D4R4G0D,0.96,/r/Python/comments/hhe1eb/i_was_able_to_install_and_use_jupyter_notebook_on/,Python,1112499,2
Using Python to find a prime number that looks like the python logo (or any other image) from far away [OC],1707,c8s5ym,https://i.redd.it/w4bawg6gz4831.png,90,1562180831.0,Gedanke,0.98,/r/Python/comments/c8s5ym/using_python_to_find_a_prime_number_that_looks/,Python,1112499,2
I just finished a 48 hour game jam using Python and Pygame! (Source in comments.),1683,auh5ig,https://i.redd.it/g81vu7azani21.gif,126,1551070411.0,DaFluffyPotato,0.98,/r/Python/comments/auh5ig/i_just_finished_a_48_hour_game_jam_using_python/,Python,1112499,2
"""Automate the Boring Stuff with Python"" online course is free to sign up for the next few days with code DEC2020FREE",1661,k4rxw0,https://www.reddit.com/r/Python/comments/k4rxw0/automate_the_boring_stuff_with_python_online/,83,1606850552.0,AlSweigart,0.98,/r/Python/comments/k4rxw0/automate_the_boring_stuff_with_python_online/,Python,1112499,2
"[RANT] Clients telling me ""I know python"" is a major red flag to me",1638,jm9dnh,https://www.reddit.com/r/Python/comments/jm9dnh/rant_clients_telling_me_i_know_python_is_a_major/,338,1604262469.0,anyfactor,0.95,/r/Python/comments/jm9dnh/rant_clients_telling_me_i_know_python_is_a_major/,Python,1112499,2
I made a raytracer in Python from scratch!,1634,gcra5c,https://i.redd.it/c40fzt4t5kw41.png,137,1588515247.0,jrmiranda,0.99,/r/Python/comments/gcra5c/i_made_a_raytracer_in_python_from_scratch/,Python,1112499,2
"""The rules of perf"" at Dropbox",1624,eip48b,https://i.redd.it/g7g5hf7dxm741.jpg,164,1577919048.0,stefantalpalaru,0.97,/r/Python/comments/eip48b/the_rules_of_perf_at_dropbox/,Python,1112499,2
The youtube-dl repository has been restored on GitHub with help from the Electronic Frontier Foundation,1584,jvbqzc,https://github.com/github/dmca/blob/b7a2f3602c43eb4761a75bc8a69242b5ce975563/2020/11/2020-11-16-RIAA-reversal.md,63,1605550353.0,DerpyChap,0.99,/r/Python/comments/jvbqzc/the_youtubedl_repository_has_been_restored_on/,Python,1112499,2
I made a program that allows you to download song cover arts from Spotify or Soundcloud and then embeds them to your MP3 files.,1577,ftktcn,https://i.redd.it/iu1yzg7d5eq41.gif,71,1585827407.0,sameera__madushan_,0.97,/r/Python/comments/ftktcn/i_made_a_program_that_allows_you_to_download_song/,Python,1112499,2
prettymaps: A small set of Python functions to draw pretty maps from OpenStreetMap data,1569,pbbjeo,https://github.com/marceloprates/prettymaps,69,1629899160.0,ASIC_SP,0.99,/r/Python/comments/pbbjeo/prettymaps_a_small_set_of_python_functions_to/,Python,1112499,2
[OC] Maze solving algorithm recursively attemps to solve the maze,1559,eme6k8,https://v.redd.it/y6sn2jskus941,123,1578596469.0,Enguzelharf,0.98,/r/Python/comments/eme6k8/oc_maze_solving_algorithm_recursively_attemps_to/,Python,1112499,2
"""Automate the Boring Stuff with Python"" online course is free to sign up for the next few days with code",1545,i1w03b,https://www.reddit.com/r/Python/comments/i1w03b/automate_the_boring_stuff_with_python_online/,87,1596303007.0,AlSweigart,0.97,/r/Python/comments/i1w03b/automate_the_boring_stuff_with_python_online/,Python,1112499,2
"Physics simulator with rotation and collision I made with Python. If you dropped your phone, and it just kept bouncing!",1520,cg1ipy,https://v.redd.it/8qy69vazxob31,66,1563729883.0,mbecks,0.97,/r/Python/comments/cg1ipy/physics_simulator_with_rotation_and_collision_i/,Python,1112499,2
"Spent Months Writing A Web Dev Course For A Platform, But It Got Canceled Midway. Publishing It Free For The Community.",1494,118ynyy,https://leanpub.com/c/flask-masterclass,93,1677072374.0,appinv,0.98,/r/Python/comments/118ynyy/spent_months_writing_a_web_dev_course_for_a/,Python,1112499,2
"Today I’m releasing PyBoy v1.5.0! A Game Boy emulator written in Python, focused on scripting, AI and learning",1497,vfsakl,https://www.reddit.com/r/Python/comments/vfsakl/today_im_releasing_pyboy_v150_a_game_boy_emulator/,33,1655634613.0,baekalfen,0.98,/r/Python/comments/vfsakl/today_im_releasing_pyboy_v150_a_game_boy_emulator/,Python,1112499,2
For those of you made uncomfortable by yesterdays simulation. No phones were harmed in the making of this simulation,1486,cghqy0,https://v.redd.it/em76zkj2pwb31,70,1563823660.0,mbecks,0.97,/r/Python/comments/cghqy0/for_those_of_you_made_uncomfortable_by_yesterdays/,Python,1112499,2
2D Raycasting along with Rendered view - Visualization was done using Pygame! People who love games would definitely love this! Link to the Github repository in the comments!,1485,grwueh,https://v.redd.it/gm4m2d4qse151,52,1590629583.0,anuj-99,0.98,/r/Python/comments/grwueh/2d_raycasting_along_with_rendered_view/,Python,1112499,2
Python is now the second most popular language in the world according to TIOBE. This is the highest position that Python reaches since 2001.,1474,nlavn7,https://www.tiobe.com/tiobe-index/,189,1622013581.0,ivaylos,0.96,/r/Python/comments/nlavn7/python_is_now_the_second_most_popular_language_in/,Python,1112499,2
I made a python script to download and save your favorite Facebook videos.,1456,fqdnjv,https://i.redd.it/suixxhhwgcp41.gif,104,1585371209.0,sameera__madushan_,0.95,/r/Python/comments/fqdnjv/i_made_a_python_script_to_download_and_save_your/,Python,1112499,2
My Python regex ebook with hundreds of examples and exercises is currently free,1450,hj0vp6,https://www.reddit.com/r/Python/comments/hj0vp6/my_python_regex_ebook_with_hundreds_of_examples/,111,1593567461.0,ASIC_SP,0.99,/r/Python/comments/hj0vp6/my_python_regex_ebook_with_hundreds_of_examples/,Python,1112499,2
"*Update* Thank you all for your suggestions on my previous post about Handwriting Synthesis Algorithm, after going through all the comments and ideas you all shared, I have made Handwriting Synthesis v2, please review and suggest any changes/add-ons.",1448,fr1x65,https://i.redd.it/c1vokq0jbkp41.png,68,1585466256.0,sanidhya69,0.98,/r/Python/comments/fr1x65/update_thank_you_all_for_your_suggestions_on_my/,Python,1112499,2
i made a python function that turn numbers into graphical format.,1423,hf31so,https://i.redd.it/bqsxep4kmv651.png,88,1593012648.0,jeel2331,0.92,/r/Python/comments/hf31so/i_made_a_python_function_that_turn_numbers_into/,Python,1112499,2
The Most Complete List of Legally Free Python Books (Updated 2021),1413,kdm6o7,https://www.pythonkitchen.com/legally-free-python-books-list/,73,1608040717.0,appinv,0.99,/r/Python/comments/kdm6o7/the_most_complete_list_of_legally_free_python/,Python,1112499,2
Finding the shortest path between two points using the A Star Algorithm! I find it to be one of the best self projects to learn and get into programming. Link to the Github repository in the comments!,1401,gqp5jn,https://i.redd.it/4frs3yuh01151.png,64,1590462653.0,anuj-99,0.97,/r/Python/comments/gqp5jn/finding_the_shortest_path_between_two_points/,Python,1112499,2
The second version of my simple game. It's still pretty pathetic. But now I have implemented a little object orientation (now my code has classes: P).,1379,hcb1zz,https://v.redd.it/1vcauplo7y551,77,1592608444.0,M4D4R4G0D,0.96,/r/Python/comments/hcb1zz/the_second_version_of_my_simple_game_its_still/,Python,1112499,2
Super Potato Bruh - A game written entirely in Python/Pygame.,1359,9h76as,https://v.redd.it/tspvwv5sa8n11,167,1537378105.0,DaFluffyPotato,0.98,/r/Python/comments/9h76as/super_potato_bruh_a_game_written_entirely_in/,Python,1112499,2
I made an automated machine learning bot that can detect diseases using images within seconds,1345,hm9pih,https://i.redd.it/35jinki699951.gif,102,1594049290.0,AnonDoser,0.96,/r/Python/comments/hm9pih/i_made_an_automated_machine_learning_bot_that_can/,Python,1112499,2
more than 100 scientific articles may be invalidated because scientists assumed that the output of glob.glob() is sorted,1337,dh2qwd,https://www.vice.com/en_us/article/zmjwda/a-code-glitch-may-have-caused-errors-in-more-than-100-published-studies,357,1570923208.0,stefantalpalaru,0.97,/r/Python/comments/dh2qwd/more_than_100_scientific_articles_may_be/,Python,1112499,2
Python 201 Book is Free for 48 hours,1332,57xaud,https://www.reddit.com/r/Python/comments/57xaud/python_201_book_is_free_for_48_hours/,294,1476710795.0,driscollis,0.97,/r/Python/comments/57xaud/python_201_book_is_free_for_48_hours/,Python,1112499,2
Generating a random maze using Prim's algorithm,1324,g0fz1e,https://v.redd.it/y9lpy5345ks41,57,1586771715.0,mutatedllama,0.98,/r/Python/comments/g0fz1e/generating_a_random_maze_using_prims_algorithm/,Python,1112499,2
Python Fractal Landscape,1323,7cffpd,https://i.redd.it/drnz4ukpsjxz.jpg,24,1510494115.0,Swipecat,0.94,/r/Python/comments/7cffpd/python_fractal_landscape/,Python,1112499,2
16 bytes of Python code compiles to 32 terabytes of bytecode,1315,llccey,https://codegolf.stackexchange.com/a/69415/4270,110,1613505988.0,azhenley,0.98,/r/Python/comments/llccey/16_bytes_of_python_code_compiles_to_32_terabytes/,Python,1112499,2
"I made a randomized binary tree (python, tkinter)",1299,g1conv,https://v.redd.it/f15osxcr9us41,53,1586894332.0,Ro0t-set,0.98,/r/Python/comments/g1conv/i_made_a_randomized_binary_tree_python_tkinter/,Python,1112499,2
The youtube-dl GitHub repo has received a DMCA takedown request from the RIAA,1297,jgvqa9,https://github.com/ytdl-org/youtube-dl,203,1603486951.0,DerpyChap,0.99,/r/Python/comments/jgvqa9/the_youtubedl_github_repo_has_received_a_dmca/,Python,1112499,2
Rolling Hills (Made with Python Processing),1298,d45ogl,https://gfycat.com/groundedthickkentrosaurus,34,1568470367.0,thebuffed,0.98,/r/Python/comments/d45ogl/rolling_hills_made_with_python_processing/,Python,1112499,2
"I would like to share my first game! I did it all with pygame. I'm still learning so it's not so cool, but I want to improve it in the future: P",1289,h9su9s,https://v.redd.it/q8l1s5c236551,104,1592268176.0,M4D4R4G0D,0.97,/r/Python/comments/h9su9s/i_would_like_to_share_my_first_game_i_did_it_all/,Python,1112499,2
Use python to find a prime number that looks like any image if glanced upon from far away. [OC],1265,ekjr42,https://i.redd.it/htrmof6091941.png,65,1578261821.0,Gedanke,0.97,/r/Python/comments/ekjr42/use_python_to_find_a_prime_number_that_looks_like/,Python,1112499,2
"Spotlightify (The Spotify overlay controller) Update - New Features added and Source Code Released! (Windows, macOS and Linux tested)",1238,gtnyll,https://v.redd.it/31qtwhcghz151,90,1590880099.0,Murpho19,0.99,/r/Python/comments/gtnyll/spotlightify_the_spotify_overlay_controller/,Python,1112499,2
I made a face recognition program in Python by using the pre-trained model to compute face embedding. Next based on these face embedding I am able to classify between all the faces in my data. It works fine but is really slow when executed in real-time. I have a low-end i3 laptop without GPU.,1228,j38z5c,https://i.redd.it/3itploxqnhq51.jpg,130,1601560413.0,Hussain_Mujtaba,0.93,/r/Python/comments/j38z5c/i_made_a_face_recognition_program_in_python_by/,Python,1112499,2
Here are my Python projects from 2018! (Mostly Game Dev),1217,ab97g3,https://v.redd.it/3av0rby4fn721,131,1546277548.0,DaFluffyPotato,0.97,/r/Python/comments/ab97g3/here_are_my_python_projects_from_2018_mostly_game/,Python,1112499,2
