title,score,id,url,num_comments,created,author,upvote_ratio,permalink,subreddit,subreddit_subscribers,depth
Ask me a question then edit your question to make me look like a dick,88068,fo6pki,https://www.reddit.com/r/CasualUK/comments/fo6pki/ask_me_a_question_then_edit_your_question_to_make/,2311,1585062764.0,jptoc,0.97,/r/CasualUK/comments/fo6pki/ask_me_a_question_then_edit_your_question_to_make/,CasualUK,1651723,2
An Egyptian woman is unimpressed by Stonehenge,83701,z2jxt7,https://i.redd.it/ddf503sbyn1a1.png,3390,1669193059.0,MellotronSymphony,0.88,/r/CasualUK/comments/z2jxt7/an_egyptian_woman_is_unimpressed_by_stonehenge/,CasualUK,1651723,2
As an American living in Britain this is both embarrassing and hilarious,72873,mkfha3,https://i.redd.it/9gdoj6aiabr61.jpg,3286,1617609660.0,Kingkunta87,0.89,/r/CasualUK/comments/mkfha3/as_an_american_living_in_britain_this_is_both/,CasualUK,1651723,2
This company has been getting boycotted over their name. I’m sorry but this is brilliant British Humour,57742,p607ax,https://i.redd.it/rwe1j37uxvh71.jpg,1911,1629191693.0,Kingkunta87,0.88,/r/CasualUK/comments/p607ax/this_company_has_been_getting_boycotted_over/,CasualUK,1651723,2
Efficient poster design in Bridgnorth pub,53155,f0oqfx,https://i.redd.it/jqd1lnw8rnf41.jpg,461,1581149336.0,Maff17,0.93,/r/CasualUK/comments/f0oqfx/efficient_poster_design_in_bridgnorth_pub/,CasualUK,1651723,2
Maybe it was worth the wait after all,49436,s1jwa8,https://i.redd.it/c7uhg4v8r3b81.jpg,471,1641925924.0,Stotallytob3r,0.95,/r/CasualUK/comments/s1jwa8/maybe_it_was_worth_the_wait_after_all/,CasualUK,1651723,2
Lewis Hamilton lifts the severed head of an opponent as a warning to all other drivers that dare to challenge him!,48867,j9m6wa,https://imgur.com/6fRF7xe.jpg,943,1602486318.0,26326312,0.91,/r/CasualUK/comments/j9m6wa/lewis_hamilton_lifts_the_severed_head_of_an/,CasualUK,1651723,2
"Ladies and gentlemen, I give you the worlds worst person",45772,ccnqgc,https://i.redd.it/lg8sqcn5p1a31.jpg,1758,1563012513.0,Jorarl,0.93,/r/CasualUK/comments/ccnqgc/ladies_and_gentlemen_i_give_you_the_worlds_worst/,CasualUK,1651723,2
London Tube Map as seen from above...,45110,f4nlo4,https://i.redd.it/cjlhi4srr8h41.jpg,693,1581839605.0,kiddsky,0.96,/r/CasualUK/comments/f4nlo4/london_tube_map_as_seen_from_above/,CasualUK,1651723,2
"As an American in the UK, I'm learning all sorts of new words! Today I discovered that ""queues"" can also be called ""wait rows!""",44058,ki4e5w,https://i.redd.it/qpypyv2teq661.jpg,1386,1608639928.0,RamsesThePigeon,0.9,/r/CasualUK/comments/ki4e5w/as_an_american_in_the_uk_im_learning_all_sorts_of/,CasualUK,1651723,2
That things first match will always be a treasured memory.,43068,j1gz3m,https://i.redd.it/fpyeu24ufxp51.png,1572,1601315583.0,Murderhands,0.94,/r/CasualUK/comments/j1gz3m/that_things_first_match_will_always_be_a/,CasualUK,1651723,2
A touching moment between a Scottish Piper and a traditional African drummer as they play together in Edinburgh. It was a beautiful display of humanity but unfortunately it sounded like a cat being kicked down a flight of wooden stairs.,42847,dfd7xq,https://i.redd.it/fymj6kohogr31.jpg,444,1570603310.0,whisssaat,0.95,/r/CasualUK/comments/dfd7xq/a_touching_moment_between_a_scottish_piper_and_a/,CasualUK,1651723,2
Well that was a complete waste of a morning. We came all the way to Liverpool because we heard today was the day and no bugger else had shown up.,41184,d6sui0,https://imgur.com/9IdZ3jV.jpg,276,1568974784.0,26326312,0.94,/r/CasualUK/comments/d6sui0/well_that_was_a_complete_waste_of_a_morning_we/,CasualUK,1651724,2
"When England lose a World Cup game, incidents of domestic violence increase by 38%. Let's not forget, it's just a game.",40572,z4o963,https://i.redd.it/oc22qq2je72a1.jpg,1328,1669410504.0,screenshotofdispair,0.91,/r/CasualUK/comments/z4o963/when_england_lose_a_world_cup_game_incidents_of/,CasualUK,1651724,2
"St Thomas church spire in Wells, Somerset, has just toppled",39608,svhgvz,https://v.redd.it/4875abf7bli81,1866,1645189427.0,MarthaFarcuss,0.96,/r/CasualUK/comments/svhgvz/st_thomas_church_spire_in_wells_somerset_has_just/,CasualUK,1651724,2
One of the benefits of speaking Welsh is you can walk faster than those who can’t.,39357,kyevbs,https://i.redd.it/n23mg3d3inb61.jpg,785,1610783929.0,welshie123,0.97,/r/CasualUK/comments/kyevbs/one_of_the_benefits_of_speaking_welsh_is_you_can/,CasualUK,1651724,2
"Genuinely thought this was an electric vehicle 😅 Imagine starting a new job with FedEx, it's your first day, and instead of van keys they give you the keys to a D lock and this thing 😂",39126,u3c0pg,https://v.redd.it/hg1nd5vr9gt81,2024,1649922709.0,Mr___Bizarre,0.78,/r/CasualUK/comments/u3c0pg/genuinely_thought_this_was_an_electric_vehicle/,CasualUK,1651724,2
One of the more creative female/male toilet signs I've seen.,38186,qe00y3,https://imgur.com/OjSjcqE.jpg,723,1634973325.0,26326312,0.91,/r/CasualUK/comments/qe00y3/one_of_the_more_creative_femalemale_toilet_signs/,CasualUK,1651724,2
Maybe someone should check in on Sheffield and make sure they’re ok.,37542,evtg3r,https://i.redd.it/rfzgefyoasd41.jpg,866,1580332607.0,Jorarl,0.97,/r/CasualUK/comments/evtg3r/maybe_someone_should_check_in_on_sheffield_and/,CasualUK,1651724,2
"BA Concordes gathering to sniff the back of a freshly built one before deciding if they let it into their group. If rejected, it has to go to Air France.",36599,z00e1v,https://i.redd.it/5nby76wax21a1.jpg,364,1668938476.0,kraven420,0.94,/r/CasualUK/comments/z00e1v/ba_concordes_gathering_to_sniff_the_back_of_a/,CasualUK,1651724,2
Cream tea on a busy train: am I living the high life or exhibiting poor passenger discipline ?,36303,xzinza,https://i.redd.it/g0zvumxrfrs91.jpg,2708,1665312588.0,cyclostome_monophyly,0.9,/r/CasualUK/comments/xzinza/cream_tea_on_a_busy_train_am_i_living_the_high/,CasualUK,1651724,2
"Note to self; Next time you buy some fertiliser pellets for the garden, don’t buy hydrogen peroxide (for my fish tank) in the same week. We all had a giggle in the end.",35074,108oula,https://i.redd.it/ggjlkh2lecba1.jpg,2287,1673393688.0,English_Joe,0.95,/r/CasualUK/comments/108oula/note_to_self_next_time_you_buy_some_fertiliser/,CasualUK,1651724,2
The Royal Mail is trialling the cutest electric van ever,32162,rfrwhf,https://i.redd.it/czzazke0yd581.jpg,844,1639434180.0,Stotallytob3r,0.95,/r/CasualUK/comments/rfrwhf/the_royal_mail_is_trialling_the_cutest_electric/,CasualUK,1651725,2
Who doesn’t love being married,32103,d7ocrn,https://i.redd.it/60xki53aa4o31.jpg,260,1569145706.0,kiddsky,0.95,/r/CasualUK/comments/d7ocrn/who_doesnt_love_being_married/,CasualUK,1651725,2
Enthusiastic Scottish distillery tour guide ;),31887,oh1vrh,https://v.redd.it/fz6q5y7nf8a71,726,1625856197.0,scouserdave,0.94,/r/CasualUK/comments/oh1vrh/enthusiastic_scottish_distillery_tour_guide/,CasualUK,1651725,2
With this sort of entertainment why wouldn’t you pay £90 a month,30609,cz89y6,https://i.redd.it/howc71n93fk31.jpg,333,1567533127.0,kiddsky,0.97,/r/CasualUK/comments/cz89y6/with_this_sort_of_entertainment_why_wouldnt_you/,CasualUK,1651725,2
My entry for the UK's dullest playground,30264,sp1ouu,https://i.redd.it/kyupvhctuyg81.jpg,718,1644481696.0,MarthaFarcuss,0.97,/r/CasualUK/comments/sp1ouu/my_entry_for_the_uks_dullest_playground/,CasualUK,1651725,2
City of Leicester starts turning bus-stops into “bee-stops”,30211,oezxhz,https://i.redd.it/hwr7b6popm971.jpg,920,1625593205.0,Stotallytob3r,0.96,/r/CasualUK/comments/oezxhz/city_of_leicester_starts_turning_busstops_into/,CasualUK,1651725,2
Welcome to B&Q,29306,ucwtkv,https://v.redd.it/52oge4ccj0w81,1104,1651039799.0,scouserdave,0.95,/r/CasualUK/comments/ucwtkv/welcome_to_bq/,CasualUK,1651725,2
Council artist at work,29291,gp1tom,https://v.redd.it/hhtcd9h3dh051,638,1590224754.0,scouserdave,0.96,/r/CasualUK/comments/gp1tom/council_artist_at_work/,CasualUK,1651725,2
This comment on someone’s breakfast,28983,yxp1a7,https://i.redd.it/ttntbrhsqj0a1.jpg,286,1668688213.0,welshie123,0.95,/r/CasualUK/comments/yxp1a7/this_comment_on_someones_breakfast/,CasualUK,1651725,2
I went for a confusing walk this morning...,28546,jqzeh9,https://v.redd.it/48pvdhb4e8y51,354,1604934994.0,RamsesThePigeon,0.91,/r/CasualUK/comments/jqzeh9/i_went_for_a_confusing_walk_this_morning/,CasualUK,1651725,2
This is not the greatest selfie in the world. It is just a.....,28396,iruduu,https://i.redd.it/2dhkh23jivm51.jpg,250,1599984736.0,Trilobite_Tom,0.87,/r/CasualUK/comments/iruduu/this_is_not_the_greatest_selfie_in_the_world_it/,CasualUK,1651725,2
I actually love this. We shouldn’t pretend that sex stops after a certain age and/or surgery.,27543,ugxpay,https://i.redd.it/htjhlvyn74x81.jpg,555,1651520105.0,screenshotofdispair,0.93,/r/CasualUK/comments/ugxpay/i_actually_love_this_we_shouldnt_pretend_that_sex/,CasualUK,1651725,2
There are 2 types of texts.,27444,hs7u9l,https://i.redd.it/t3p8rmzoe7b51.jpg,466,1594898541.0,welshie123,0.95,/r/CasualUK/comments/hs7u9l/there_are_2_types_of_texts/,CasualUK,1651725,2
Amazing. The Queen waves from the balcony of Buckingham Palace at the security queue for Manchester Airport!,27423,v38n36,https://imgur.com/AH4ubhC.jpg,351,1654175733.0,kraven420,0.9,/r/CasualUK/comments/v38n36/amazing_the_queen_waves_from_the_balcony_of/,CasualUK,1651724,2
And the winner is Jane,26684,mhowy4,https://v.redd.it/jtx8e70t5iq61,1347,1617256988.0,scouserdave,0.95,/r/CasualUK/comments/mhowy4/and_the_winner_is_jane/,CasualUK,1651724,2
Gotta love the Royal Mail.,26326,rmrwbw,https://i.redd.it/y760tjh6g9781.jpg,786,1640251465.0,Murderhands,0.96,/r/CasualUK/comments/rmrwbw/gotta_love_the_royal_mail/,CasualUK,1651724,2
I've been skipping (bin diving) for years as my main source of food. AMA !,26255,ynmi3w,https://i.redd.it/6t02qbpomcy91.png,3381,1667730395.0,Mr___Bizarre,0.86,/r/CasualUK/comments/ynmi3w/ive_been_skipping_bin_diving_for_years_as_my_main/,CasualUK,1651724,2
"My son tells me (an hour before bed) that he needs a cardboard model of his favourite book for school tomorrow. Think we can all agree I nailed it, especially Hedwig.",25450,11eigdi,https://www.reddit.com/gallery/11eigdi,854,1677614864.0,English_Joe,0.91,/r/CasualUK/comments/11eigdi/my_son_tells_me_an_hour_before_bed_that_he_needs/,CasualUK,1651724,2
Life sucks for longer,25218,es8xgp,https://i.redd.it/94qjdviheac41.jpg,209,1579680110.0,Maff17,0.97,/r/CasualUK/comments/es8xgp/life_sucks_for_longer/,CasualUK,1651724,2
English Heritage staff putting the clocks forward at Stonehenge for British Summertime,24862,fqg18j,https://i.imgur.com/4Rt5JFn.jpg,296,1585382966.0,jptoc,0.95,/r/CasualUK/comments/fqg18j/english_heritage_staff_putting_the_clocks_forward/,CasualUK,1651724,2
The Tesco buttons have arrived safely in America.,24605,f9ue43,https://i.redd.it/uz46kvs38aj41.jpg,672,1582728905.0,_brattyb_,0.95,/r/CasualUK/comments/f9ue43/the_tesco_buttons_have_arrived_safely_in_america/,CasualUK,1651724,2
This lad was catching some rays in Wollaton Park on Thursday.,24351,jysutm,https://imgur.com/6PtMi0Y.jpg,339,1606036635.0,26326312,0.97,/r/CasualUK/comments/jysutm/this_lad_was_catching_some_rays_in_wollaton_park/,CasualUK,1651724,2
"My dear mother has come out of retirement after 5 years to go stab people in the arm. She did 60 jabs yesterday! Anyway it dawned on me most of you guys probably haven't seen inside a mass vaccination centre. So, here you go...",23980,l14llq,https://imgur.com/1yiVwPn.jpg,630,1611129008.0,26326312,0.94,/r/CasualUK/comments/l14llq/my_dear_mother_has_come_out_of_retirement_after_5/,CasualUK,1651724,2
Curry house of the dead,23739,10gvvyc,https://i.redd.it/fk3zymqo07da1.jpg,517,1674218183.0,MellotronSymphony,0.96,/r/CasualUK/comments/10gvvyc/curry_house_of_the_dead/,CasualUK,1651724,2
"Goodbye UK, I’ll miss you.",23284,qrfdzr,https://www.reddit.com/r/CasualUK/comments/qrfdzr/goodbye_uk_ill_miss_you/,1266,1636614003.0,Kingkunta87,0.91,/r/CasualUK/comments/qrfdzr/goodbye_uk_ill_miss_you/,CasualUK,1651724,2
It’s my birthday. My family and friends seem to have forgotten. So an afternoon of hot tub. Whisky and pop punk. Fuck yeah. Cheers you glorious bunch of bastards.,23053,jb1c1w,https://i.redd.it/9mwoz6oai2t51.jpg,865,1602684493.0,Trilobite_Tom,0.91,/r/CasualUK/comments/jb1c1w/its_my_birthday_my_family_and_friends_seem_to/,CasualUK,1651724,2
"A couple got fined £60 after a woman with a Knitter tshirt walked in a bus lane, triggering the anpr camera and sending a fine to the couples door.",22907,qam2w9,https://i.redd.it/qh4zhhi5h7u71.jpg,636,1634561545.0,Currynrice9728,0.97,/r/CasualUK/comments/qam2w9/a_couple_got_fined_60_after_a_woman_with_a/,CasualUK,1651724,2
The Great UK Porridge scandal.,22893,g5x8ho,https://www.reddit.com/r/CasualUK/comments/g5x8ho/the_great_uk_porridge_scandal/,762,1587543172.0,Kingkunta87,0.93,/r/CasualUK/comments/g5x8ho/the_great_uk_porridge_scandal/,CasualUK,1651724,2
"I’m an American visiting, the lady at Tesco just gave me these. What are they for?",22634,ezvfdo,https://i.redd.it/s0x2ev2e6cf41.jpg,1459,1581009208.0,_brattyb_,0.97,/r/CasualUK/comments/ezvfdo/im_an_american_visiting_the_lady_at_tesco_just/,CasualUK,1651724,2
"I’m gaining more followers. By next Autumn, my goose militia will have grown in numbers. People will learn to fear us.",22507,n6t1um,https://v.redd.it/bjdxq6jmjnx61,498,1620373106.0,whisssaat,0.96,/r/CasualUK/comments/n6t1um/im_gaining_more_followers_by_next_autumn_my_goose/,CasualUK,1651724,2
"I feel this needs sharing, Matthew you are amazing!",22488,nrkjlr,https://i.redd.it/jkkdtkom43371.jpg,488,1622745457.0,Trilobite_Tom,0.96,/r/CasualUK/comments/nrkjlr/i_feel_this_needs_sharing_matthew_you_are_amazing/,CasualUK,1651724,2
It was unusually quiet after putting the kids to bed last night. Went to check and found 5 year old sat in bed filling out application for a nectar card,22479,ee3dxm,https://i.redd.it/gbz2pl46t5641.jpg,361,1577009432.0,cyclostome_monophyly,0.95,/r/CasualUK/comments/ee3dxm/it_was_unusually_quiet_after_putting_the_kids_to/,CasualUK,1651724,2
Beautiful.,22421,hgqi52,https://i.redd.it/zb8v7jye8f751.jpg,468,1593249893.0,Currynrice9728,0.96,/r/CasualUK/comments/hgqi52/beautiful/,CasualUK,1651724,2
