title,score,id,url,num_comments,created,author,upvote_ratio,permalink,subreddit,subreddit_subscribers,depth
"‘Saving For A Down Payment Has Never Been Worse,’ Says National Bank Of Canada",13889,lcg2qe,https://www.huffingtonpost.ca/entry/saving-down-payment_ca_601afd00c5b67cdd1a74fb7b,2020,1612446753.0,viva_la_vinyl,0.96,/r/canada/comments/lcg2qe/saving_for_a_down_payment_has_never_been_worse/,canada,1630671,2
The U.S. poses a serious threat of enticing Canada's skilled workers to move south,13874,ns4em1,https://financialpost.com/investing/the-u-s-poses-a-serious-threat-of-enticing-canadas-skilled-workers-to-move-south/,4010,1622811127.0,uselesspoliticalhack,0.91,/r/canada/comments/ns4em1/the_us_poses_a_serious_threat_of_enticing_canadas/,canada,1630671,2
"Quebec shutting down schools, bars, gyms tonight as COVID-19 cases soar",13812,rktl8y,https://montreal.ctvnews.ca/quebec-shutting-down-schools-bars-gyms-tonight-as-covid-19-cases-soar-1.5714268,2226,1640024426.0,cyclinginvancouver,0.9,/r/canada/comments/rktl8y/quebec_shutting_down_schools_bars_gyms_tonight_as/,canada,1630671,2
Canada to keep border restrictions with U.S. for long time: Trudeau,13555,g2mbm5,https://www.reuters.com/article/us-health-coronavirus-canada/canada-to-keep-border-restrictions-with-u-s-for-long-time-trudeau-idUSKBN21Y2KY,1480,1587067019.0,KissMyBBQ,0.95,/r/canada/comments/g2mbm5/canada_to_keep_border_restrictions_with_us_for/,canada,1630671,2
Andrew Scheer and the Conservatives lied to Canadians at least dozen times during the campaign,13525,dk2z0v,https://thinkpol.ca/2019/10/18/andrew-scheer-conservatives-lied-canadians-least-dozen-times-campaign/,1630,1571487255.0,CMikeHunt,0.82,/r/canada/comments/dk2z0v/andrew_scheer_and_the_conservatives_lied_to/,canada,1630671,2
"Inflated house prices are widening inequality, and inheritances will only further the gap",13359,ndlzkz,https://www.thestar.com/opinion/contributors/2021/05/16/inflated-house-prices-are-widening-inequality-and-inheritances-will-only-further-the-gap.html,2106,1621163136.0,viva_la_vinyl,0.94,/r/canada/comments/ndlzkz/inflated_house_prices_are_widening_inequality_and/,canada,1630671,2
Opinion: Canada risks becoming house-rich and everything else-poor,13302,mc2ef0,https://financialpost.com/opinion/opinion-canada-risks-becoming-house-rich-and-everything-else-poor,2494,1616581639.0,viva_la_vinyl,0.96,/r/canada/comments/mc2ef0/opinion_canada_risks_becoming_houserich_and/,canada,1630671,2
Taxing extreme wealth to offset the costs of the pandemic would be unquestionably fair,13236,mfmn74,https://www.thestar.com/opinion/contributors/2021/03/29/taxing-extreme-wealth-to-offset-the-costs-of-the-pandemic-would-be-unquestionably-fair.html,1272,1617014223.0,viva_la_vinyl,0.89,/r/canada/comments/mfmn74/taxing_extreme_wealth_to_offset_the_costs_of_the/,canada,1630671,2
"Supermarkets continue to increase profits on back of inflation, data shows",13205,zte4dh,https://www.thestar.com/news/canada/2022/12/23/supermarkets-continue-to-increase-profits-on-back-of-inflation-data-shows.html,976,1671798612.0,viva_la_vinyl,0.96,/r/canada/comments/zte4dh/supermarkets_continue_to_increase_profits_on_back/,canada,1630671,2
"Ryan Reynolds has hilarious response to petition for Vancouver street to be named after him - “Very kind but hard pass. If traffic sucks everyone will say, ‘Ryan Reynolds is a mess’ or ‘Ryan Reynolds is really backed up.’”",13052,k470i7,https://vancouversun.com/entertainment/celebrity/ryan-reynolds-has-hilarious-response-to-petition-for-vancouver-street-to-be-named-after-him,197,1606775478.0,cyclinginvancouver,0.96,/r/canada/comments/k470i7/ryan_reynolds_has_hilarious_response_to_petition/,canada,1630670,2
"China has released detained Canadians Kovrig, Spavor: PM",12930,puwdp3,https://www.ctvnews.ca/canada/huawei-cfo-meng-expected-to-reach-agreement-with-u-s-on-charges-against-her-reports-1.5598969,2492,1632531385.0,CMikeHunt,0.95,/r/canada/comments/puwdp3/china_has_released_detained_canadians_kovrig/,canada,1630670,2
The Canadian Association of Chiefs of Police is calling for the decriminalization of personal possession of illicit drugs,12811,ho6zmg,https://www.cacp.ca/news/canadas-police-leaders-recommend-adopting-a-public-health-led-diversionary-approach-to-illicit-subst.html,740,1594314771.0,cyclinginvancouver,0.96,/r/canada/comments/ho6zmg/the_canadian_association_of_chiefs_of_police_is/,canada,1630670,2
My friend works at Air Canada.. she just got this email...,12784,5qp6uk,https://imgur.com/gallery/wTflt,2038,1485629938.0,anislitim,0.89,/r/canada/comments/5qp6uk/my_friend_works_at_air_canada_she_just_got_this/,canada,1630670,2
COVID 'blank cheque': Report finds corporations spent billions on dividends and share buybacks while receiving government wage subsidies,12770,10xtoym,https://www.thestar.com/business/2023/02/09/the-covid-blank-cheque-report-shows-some-of-canadas-biggest-companies-spent-billions-on-dividends-and-share-buybacks-while-receiving-wage-subsidies.html,795,1675946147.0,morenewsat11,0.97,/r/canada/comments/10xtoym/covid_blank_cheque_report_finds_corporations/,canada,1630670,2
Remaining protesters say they will not leave until all COVID restrictions are lifted,12651,shvrwr,https://www.thestar.com/politics/2022/02/01/remaining-protesters-say-they-will-not-leave-until-all-covid-restrictions-are-lifted.html,4432,1643724397.0,viva_la_vinyl,0.9,/r/canada/comments/shvrwr/remaining_protesters_say_they_will_not_leave/,canada,1630670,2
"Nearly 60 per cent of Canadians find it difficult to feed their families, poll finds",12648,s99dta,https://www.ctvnews.ca/canada/nearly-60-per-cent-of-canadians-find-it-difficult-to-feed-their-families-poll-finds-1.5748898,1975,1642767113.0,viva_la_vinyl,0.95,/r/canada/comments/s99dta/nearly_60_per_cent_of_canadians_find_it_difficult/,canada,1630670,2
22% of Canadians say they’re ‘completely out of money’ as inflation bites: poll - National | Globalnews.ca,12610,10kx6v4,https://globalnews.ca/news/9432953/inflation-interest-rate-ipsos-poll-out-of-money/,2487,1674648595.0,LaconicStrike,0.96,/r/canada/comments/10kx6v4/22_of_canadians_say_theyre_completely_out_of/,canada,1630670,2
Federal government’s failure to tax the very rich is unconscionable,12584,s2zrgz,https://www.thestar.com/opinion/letters_to_the_editors/2022/01/13/federal-governments-failure-to-tax-the-very-rich-is-unconscionable.html,1739,1642081483.0,CoupleClothing,0.9,/r/canada/comments/s2zrgz/federal_governments_failure_to_tax_the_very_rich/,canada,1630670,2
'Cancer is not going to wait': Patients frustrated as surgeries postponed due to COVID-19 overload,12519,rxe7lc,https://ottawacitizen.com/news/local-news/cancer-is-not-going-to-wait-patients-frustrated-as-surgeries-postponed-due-to-covid-19-overload,1405,1641474448.0,morenewsat11,0.95,/r/canada/comments/rxe7lc/cancer_is_not_going_to_wait_patients_frustrated/,canada,1630670,2
Canadian Cities Have Seen Up To 90% of New Real Estate Supply Scooped By Investors - Better Dwelling,12387,tw19xx,https://betterdwelling.com/canadian-cities-have-seen-up-to-90-of-new-real-estate-supply-scooped-by-investors/,1805,1649076771.0,OverlyHonestCanadian,0.96,/r/canada/comments/tw19xx/canadian_cities_have_seen_up_to_90_of_new_real/,canada,1630670,2
"Majority of Canadians say abortion should be left as is, without legal restrictions: poll",12309,unyfuu,https://nationalpost.com/news/canada/majority-of-canadians-say-abortion-should-be-left-as-is-without-legal-restrictions-poll,1607,1652353202.0,morenewsat11,0.92,/r/canada/comments/unyfuu/majority_of_canadians_say_abortion_should_be_left/,canada,1630670,2
Sophie Grégoire Trudeau says she has recovered from COVID-19,12289,fqx1o9,https://www.cbc.ca/news/politics/sophie-trudeau-feeling-great-covid-19-1.5513731,902,1585444935.0,KissMyBBQ,0.93,/r/canada/comments/fqx1o9/sophie_grégoire_trudeau_says_she_has_recovered/,canada,1630670,2
Canada won't follow U.S. and declare national emergency over coronavirus: health minister,12111,ex5yld,https://www.cbc.ca/news/politics/champagne-coronavirus-airlift-china-1.5447130,1770,1580562832.0,viva_la_vinyl,0.93,/r/canada/comments/ex5yld/canada_wont_follow_us_and_declare_national/,canada,1630670,2
"Trudeau: Conservatives' unwillingness to prioritize climate change policy ""boggles my mind""",12059,w4nt9p,https://cultmtl.com/2022/07/justin-trudeau-conservatives-think-you-can-have-a-plan-for-the-economy-without-a-plan-for-the-environment-canada/,2465,1658427803.0,DonSalaam,0.83,/r/canada/comments/w4nt9p/trudeau_conservatives_unwillingness_to_prioritize/,canada,1630670,2
Young Canadians feeling significantly less confident in job prospects due to COVID-19,11972,m0ey8d,https://techbomb.ca/general/young-canadians-feeling-significantly-less-confident-in-job-prospects-due-to-covid-19/,1567,1615207587.0,NeptuneAgency,0.96,/r/canada/comments/m0ey8d/young_canadians_feeling_significantly_less/,canada,1630670,2
B.C. to decriminalize small amounts of ‘hard’ drugs – a North American first,11911,v1wg76,https://www.theglobeandmail.com/canada/article-decriminalize-drugs-british-columbia-canada/,1599,1654020769.0,cyclinginvancouver,0.93,/r/canada/comments/v1wg76/bc_to_decriminalize_small_amounts_of_hard_drugs_a/,canada,1630670,2
Canada Rejects Chinese Warning Against Granting Asylum to Hong Kong Protesters,11880,jc7qop,https://www.voanews.com/east-asia-pacific/canada-rejects-chinese-warning-against-granting-asylum-hong-kong-protesters,761,1602845728.0,Facerealityalready,0.97,/r/canada/comments/jc7qop/canada_rejects_chinese_warning_against_granting/,canada,1630670,2
"Scheer 'Irresponsible' For Wanting To Resume Parliament Amid COVID-19: Trudeau | The Green Party’s Elizabeth May says her ""blood is boiling"" because the Conservatives seem willing to risk the public’s health for in-person meetings.",11802,g4u87g,https://www.huffingtonpost.ca/entry/scheer-parliament-covid-trudeau_ca_5e9cefd0c5b635d25d6ec650,1418,1587394439.0,viva_la_vinyl,0.9,/r/canada/comments/g4u87g/scheer_irresponsible_for_wanting_to_resume/,canada,1630670,2
Meet the unvaccinated: This 33 year old mom is a real fucking idiot,11787,ov8riy,https://thebeaverton.com/2021/07/meet-the-unvaccinated-this-33-year-old-mom-is-a-real-fucking-idiot/,1501,1627743956.0,L0ngp1nk,0.85,/r/canada/comments/ov8riy/meet_the_unvaccinated_this_33_year_old_mom_is_a/,canada,1630670,2
Conservative Party announces this the best they could do,11697,ifqo9k,https://www.thebeaverton.com/2020/08/conservative-party-announces-this-the-best-they-could-do/,1708,1598281438.0,L0ngp1nk,0.87,/r/canada/comments/ifqo9k/conservative_party_announces_this_the_best_they/,canada,1630670,2
Florida couple charged in northern Ontario after failing to self-isolate,11665,hr4x1t,https://globalnews.ca/news/7174550/florida-couple-ontario-isolation-coronavirus/?utm_source=%40globalnews&utm_medium=Twitter&__twitter_impression=true,732,1594744944.0,ONE-OF-THREE,0.97,/r/canada/comments/hr4x1t/florida_couple_charged_in_northern_ontario_after/,canada,1630670,2
'Tears of joy': Alex Trebek says pancreatic cancer in 'near remission',11615,bufk7u,https://www.ctvnews.ca/entertainment/tears-of-joy-alex-trebek-says-pancreatic-cancer-in-near-remission-1.4441967?fbclid=IwAR2EtVJmEJO8cbBtRVRssEABQbT0bScw001rIqFJVW4j97LztLab0bjbqxA,324,1559141200.0,dasoberirishman,0.95,/r/canada/comments/bufk7u/tears_of_joy_alex_trebek_says_pancreatic_cancer/,canada,1630670,2
"'We're done with mandates': Freedom Convoy vows no violence as up to 2,000 vehicles head for Ottawa",11599,sdz7vm,https://nationalpost.com/news/canada/were-done-with-mandates-freedom-convoy-vows-no-violence-as-up-to-2000-vehicles-head-for-ottawa,4164,1643292522.0,uselesspoliticalhack,0.79,/r/canada/comments/sdz7vm/were_done_with_mandates_freedom_convoy_vows_no/,canada,1630670,2
"Canadian home prices have risen 70 percent or by $300,000 since Justin Trudeau took power in 2015",11595,r4b1g2,https://www.straight.com/news/canadian-home-prices-have-risen-70-percent-or-by-300000-since-justin-trudeau-took-power-in-2015,1965,1638124629.0,OverlyHonestCanadian,0.82,/r/canada/comments/r4b1g2/canadian_home_prices_have_risen_70_percent_or_by/,canada,1630670,2
Trudeau: “Every woman in Canada has a right to a safe and legal abortion”,11558,ovhokx,https://cultmtl.com/2021/07/justin-trudeau-every-woman-in-canada-has-a-right-to-a-safe-and-legal-abortion/,1877,1627775303.0,DonSalaam,0.89,/r/canada/comments/ovhokx/trudeau_every_woman_in_canada_has_a_right_to_a/,canada,1630670,2
61% of Canadians prefer a hybrid or remote work model. A ‘Work Anywhere’ Workplace is What Canadian Employees Actually Want Today,11512,oookc4,https://techbomb.ca/general/employment/61-of-canadians-prefer-a-hybrid-or-remote-work-model-a-work-anywhere-workplace-is-what-canadian-employees-actually-want-today/,1030,1626869311.0,NeptuneAgency,0.96,/r/canada/comments/oookc4/61_of_canadians_prefer_a_hybrid_or_remote_work/,canada,1630670,2
"Conservative support dips as Liberals appear on steady road to majority: poll (LPC 38%, CPC 26%, NDP 20%)",11434,oaviog,https://globalnews.ca/news/7991602/ipsos-poll-election-liberals-tories-june/,3503,1625053235.0,seakucumber,0.84,/r/canada/comments/oaviog/conservative_support_dips_as_liberals_appear_on/,canada,1630671,2
"Canada beats U.S., will play for Olympic women's soccer gold",11385,owbf44,https://www.cbc.ca/sports/olympics/summer/soccer/womens-soccer-canada-usa-recap-aug-2-1.6126694,687,1627898376.0,sirharryflashman,0.96,/r/canada/comments/owbf44/canada_beats_us_will_play_for_olympic_womens/,canada,1630671,2
"QAnon's 'Queen of Canada' Calls for Followers to 'Kill' People Vaccinating Children | QAnon influencer Romana Didulo told her 70,000 followers that ""duck-hunting season is open” and by ducks she means healthcare workers, politicians, and journalists.",11321,r228pt,https://www.vice.com/en/article/v7ddgm/qanons-queen-of-canada-calls-for-followers-to-kill-people-vaccinating-children,1622,1637862805.0,Austin63867,0.92,/r/canada/comments/r228pt/qanons_queen_of_canada_calls_for_followers_to/,canada,1630671,2
"Liberals would make it a criminal offence to block health-care buildings, threaten workers",11223,pnmi51,https://www.ctvnews.ca/politics/federal-election-2021/liberals-would-make-it-a-criminal-offence-to-block-health-care-buildings-threaten-workers-1.5583602,1006,1631561311.0,morenewsat11,0.92,/r/canada/comments/pnmi51/liberals_would_make_it_a_criminal_offence_to/,canada,1630671,2
Warning bells have rung for years over the risk of American money flowing into Canadian politics | The most alarming aspect of the truckers’ protests is the hole blown in our walls of protection against foreign influence in Canadian political life.,11198,sri9w9,https://www.thestar.com/opinion/contributors/2022/02/13/warning-bells-have-rung-for-years-over-the-risk-of-american-money-flowing-into-canadian-politics.html,1130,1644757705.0,viva_la_vinyl,0.85,/r/canada/comments/sri9w9/warning_bells_have_rung_for_years_over_the_risk/,canada,1630671,2
"Why you’ll help foot the bill for billions lost due to Ottawa protests — whatever your views | The so-called ‘working-class protest’ in Ottawa hurt the working class the most, and we’re all going to pick up the tab for the damage done, Armine Yalnizyan writes.",11127,szg433,https://www.thestar.com/business/opinion/2022/02/23/were-all-going-to-foot-the-bill-for-the-billions-lost-in-ottawa-regardless-of-our-views.html,2939,1645618597.0,viva_la_vinyl,0.77,/r/canada/comments/szg433/why_youll_help_foot_the_bill_for_billions_lost/,canada,1630671,2
Scheer didn't follow through on renouncing U.S. citizenship,11100,gleeqx,https://www.ctvnews.ca/politics/scheer-didn-t-follow-through-on-renouncing-u-s-citizenship-1.4941780,1370,1589717705.0,trackofalljades,0.93,/r/canada/comments/gleeqx/scheer_didnt_follow_through_on_renouncing_us/,canada,1630671,2
Huge win for Canadians as CRTC rejects Bell’s website blocking proposal,11010,9kroyb,https://openmedia.org/en/press/huge-win-canadians-crtc-rejects-bells-website-blocking-proposal,451,1538494748.0,jdtabish,0.96,/r/canada/comments/9kroyb/huge_win_for_canadians_as_crtc_rejects_bells/,canada,1630671,2
Canadians are angry about vaccine delays. It’s hurting Trudeau’s poll numbers: Ipsos,11001,lnfdvp,https://globalnews.ca/news/7648723/coronavirus-vaccine-delays-liberals-tories-polls-ipsos/,2102,1613739890.0,viva_la_vinyl,0.92,/r/canada/comments/lnfdvp/canadians_are_angry_about_vaccine_delays_its/,canada,1630671,2
Canada has planted only 8.5M of 2B trees promised by Trudeau so far,10902,rfi5q3,https://globalnews.ca/news/8446036/ottawa-2b-tree-planting-trudeau-update/,903,1639409115.0,uselesspoliticalhack,0.92,/r/canada/comments/rfi5q3/canada_has_planted_only_85m_of_2b_trees_promised/,canada,1630671,2
Pulling 'Baby It's Cold Outside' is puritanical and absurd: Opinion,10815,a3yw27,https://www.cbc.ca/news/opinion/baby-its-cold-outside-1.4936071,2167,1544180496.0,viva_la_vinyl,0.83,/r/canada/comments/a3yw27/pulling_baby_its_cold_outside_is_puritanical_and/,canada,1630671,2
63% of Canadian non-owners have ‘given up’ on ever buying a home: Ipsos,10719,uei02t,https://globalnews.ca/news/8794099/canada-real-estate-giving-up-owning-home/,1603,1651224201.0,morenewsat11,0.96,/r/canada/comments/uei02t/63_of_canadian_nonowners_have_given_up_on_ever/,canada,1630671,2
Employees who refuse to be vaccinated can be fired: lawyer,10678,q3xcar,https://toronto.ctvnews.ca/employees-who-refuse-to-be-vaccinated-can-be-fired-lawyer-1.5615552,2374,1633698260.0,dasoberirishman,0.88,/r/canada/comments/q3xcar/employees_who_refuse_to_be_vaccinated_can_be/,canada,1630671,2
Ontario Premier Doug Ford declares state of emergency in effort to end truck convoy blockade,10592,sq2lpq,https://toronto.ctvnews.ca/ontario-premier-doug-ford-declares-state-of-emergency-in-effort-to-end-truck-convoy-blockade-1.5777336,2930,1644594958.0,cyclinginvancouver,0.87,/r/canada/comments/sq2lpq/ontario_premier_doug_ford_declares_state_of/,canada,1630671,2
Multiple unions planning mass Ontario-wide walkout to protest Ford government: sources,10566,yoaoog,https://globalnews.ca/news/9256606/cupe-to-hold-news-conference-about-growing-fight-against-ontarios-bill-28/,967,1667789450.0,seakucumber,0.96,/r/canada/comments/yoaoog/multiple_unions_planning_mass_ontariowide_walkout/,canada,1630671,2
Conservative MP calls for nationwide three-digit suicide hotline | Calls to one national suicide prevention line have risen 200 per cent over last year,10510,jp3ozo,https://www.cbc.ca/news/politics/suicide-hotline-pandemic-covid-doherty-1.5790938,767,1604663067.0,viva_la_vinyl,0.97,/r/canada/comments/jp3ozo/conservative_mp_calls_for_nationwide_threedigit/,canada,1630671,2
Canada's Vaccine Rollout Is Ahead Of Schedule And More Doses Coming: PM,10411,kgtfnd,https://www.huffingtonpost.ca/entry/canada-vaccine-rollout-ahead-of-schedule-trudeau_ca_5fdd44abc5b6e5158fa7150f,908,1608468382.0,viva_la_vinyl,0.95,/r/canada/comments/kgtfnd/canadas_vaccine_rollout_is_ahead_of_schedule_and/,canada,1630671,2
Cannabis Impaired Driving has not Risen A Month After Legalization,10391,a81q7e,https://theseeker.ca/cannabis-impaired-driving-has-not-risen-a-month-after-legalization/35049/,714,1545335610.0,PM_Your_Green_Buds,0.93,/r/canada/comments/a81q7e/cannabis_impaired_driving_has_not_risen_a_month/,canada,1630671,2
Liberals announce election platform of things they could have easily done before now,10366,pfxqw1,https://thebeaverton.com/2021/09/liberals-announce-election-platform-of-things-they-could-have-easily-done-before-now/,598,1630514604.0,ONE-OF-THREE,0.92,/r/canada/comments/pfxqw1/liberals_announce_election_platform_of_things/,canada,1630671,2
PM on Trump’s racist tweets: “Only Quebec is allowed to do that in Canada”,10349,cdyhl4,https://www.thebeaverton.com/2019/07/pm-on-trumps-racist-tweets-only-quebec-is-allowed-to-do-that-in-canada/,1492,1563290632.0,pubwash,0.84,/r/canada/comments/cdyhl4/pm_on_trumps_racist_tweets_only_quebec_is_allowed/,canada,1630671,2
Stop flushing wipes down the toilet. They can clog sewers and pumps.,10321,fmyr2y,https://ottawa.ctvnews.ca/mobile/stop-flushing-wipes-down-the-toilet-city-official-1.4862712,378,1584877932.0,NeptuneAgency,0.96,/r/canada/comments/fmyr2y/stop_flushing_wipes_down_the_toilet_they_can_clog/,canada,1630671,2
The entitlement of Canadian politicians | Pam Palmater: Privileged politicians who took pandemic vacations need to lose more than their official roles as ministers or critics. It is time to take a stand.,10292,kt10jd,https://www.macleans.ca/opinion/the-entitlement-of-canadian-politicians/,575,1610106822.0,viva_la_vinyl,0.96,/r/canada/comments/kt10jd/the_entitlement_of_canadian_politicians_pam/,canada,1630671,2
"Publicly owned land should be used for affordable housing, not sold to private developers",10270,10uiyf6,https://theconversation.com/publicly-owned-land-should-be-used-for-affordable-housing-not-sold-to-private-developers-198654,575,1675620363.0,viva_la_vinyl,0.94,/r/canada/comments/10uiyf6/publicly_owned_land_should_be_used_for_affordable/,canada,1630671,2
