title,score,id,url,num_comments,created,author,upvote_ratio,permalink,subreddit,subreddit_subscribers,depth
"An accelerated view of the Sarychev volcano eruption in 2009, as seen from the International Space Station",1274,b7oepn,https://gfycat.com/ConcernedNervousIndochinesetiger,12,1554042988.0,SirT6,0.98,/r/sciences/comments/b7oepn/an_accelerated_view_of_the_sarychev_volcano/,sciences,166187,2
Cell division,1267,c0xha5,https://gfycat.com/mealyunfortunategerenuk,35,1560606580.0,SirT6,0.99,/r/sciences/comments/c0xha5/cell_division/,sciences,166187,2
This is Pluto,1239,gf5wfo,https://i.imgur.com/6hHX9sn.jpeg,37,1588855690.0,cosmemo,0.98,/r/sciences/comments/gf5wfo/this_is_pluto/,sciences,166187,2
Very high magnification view of cell division,1241,e5hbep,https://gfycat.com/exhaustedafraiddeviltasmanian,10,1575380760.0,SirT6,0.99,/r/sciences/comments/e5hbep/very_high_magnification_view_of_cell_division/,sciences,166187,2
How a star fish moves around,1238,c18ycj,https://i.imgur.com/UMhLWqK.gifv,50,1560684725.0,IJesusChrist,0.96,/r/sciences/comments/c18ycj/how_a_star_fish_moves_around/,sciences,166187,2
"Crabs, such as this Japanese spider crab (Macrocheira kaempferi), cannot grow in a linear fashion like most animals. Because they have a hard outer shell (the exoskeleton) that does not grow, they must shed their shells, a process called molting.",1239,g7cb4g,https://i.redd.it/951ygcettsu41.gif,42,1587748465.0,FillsYourNiche,0.96,/r/sciences/comments/g7cb4g/crabs_such_as_this_japanese_spider_crab/,sciences,166187,2
"A school of striped eel catfish. These fish tend to form a school as juveniles, up to hundreds of individuals to protect themselves from predators.",1235,erdfjd,https://gfycat.com/commondeadlyaurochs,23,1579528215.0,SirT6,0.98,/r/sciences/comments/erdfjd/a_school_of_striped_eel_catfish_these_fish_tend/,sciences,166187,2
"The smallest movie ever made, ""A Boy and His Atom"", was created using individual atoms and a scanning tunneling microscope (STM).",1235,bhmfkg,http://i.imgur.com/LjDu3D5.gifv,25,1556286243.0,FillsYourNiche,0.98,/r/sciences/comments/bhmfkg/the_smallest_movie_ever_made_a_boy_and_his_atom/,sciences,166187,2
Kentucky is employing ‘electrofishing’ boats to control its invasive Asian carp population.,1231,co1949,https://gfycat.com/mistywelloffbeaver,120,1565351198.0,SirT6,0.98,/r/sciences/comments/co1949/kentucky_is_employing_electrofishing_boats_to/,sciences,166187,2
The first image of the Earth from the Moon. Taken by NASA's Lunar Orbiter 1 in 1966.,1231,h9jdgj,https://i.redd.it/g77yxoemm3551.jpg,21,1592237751.0,SirT6,0.99,/r/sciences/comments/h9jdgj/the_first_image_of_the_earth_from_the_moon_taken/,sciences,166187,2
"Fifty years ago, 76% of twenty-six year olds in America lived with their spouse. Today, that share has plummeted to 24%. In fact, twenty-six year olds are now more likely to live with a parent than with a spouse.",1232,dcpndd,https://gfycat.com/chiefclosedblueandgoldmackaw,202,1570102713.0,SirT6,0.98,/r/sciences/comments/dcpndd/fifty_years_ago_76_of_twentysix_year_olds_in/,sciences,166187,2
Nature spoiled. Plankton-sized plastic at the base of the marine food chain. You can see easily how it can be mistaken for food,1226,d8zm7l,https://i.redd.it/em7cry66too31.gif,67,1569394212.0,PUTINKAAA,0.99,/r/sciences/comments/d8zm7l/nature_spoiled_planktonsized_plastic_at_the_base/,sciences,166187,2
Heart transplant: a bad heart going out and a new heart going in.,1229,cyb363,https://i.redd.it/hn3yfm9d00k31.jpg,46,1567350632.0,SirT6,0.98,/r/sciences/comments/cyb363/heart_transplant_a_bad_heart_going_out_and_a_new/,sciences,166187,2
The 8 planets & 2 dwarf planets in our solar system that have been fully mapped (except Pluto which is partially mapped). Objects to relative scale in size and rotation speed.,1226,dty1u1,https://gfycat.com/ashamedsmallibizanhound,46,1573316576.0,SirT6,0.99,/r/sciences/comments/dty1u1/the_8_planets_2_dwarf_planets_in_our_solar_system/,sciences,166187,2
"Ghost Pipe (Monotropa uniflora) is a non-photosynthetic plant. What you see is the whole above-ground plant body, it will never be green. It obtains energy from mycorrizhal fungi, who in turn get their energy from trees.",1210,eqho24,https://i.redd.it/4bsp0zvn1kb41.jpg,43,1579361217.0,IJesusChrist,0.99,/r/sciences/comments/eqho24/ghost_pipe_monotropa_uniflora_is_a/,sciences,166187,2
A melanoma cell in its death throes,1211,d6e6z4,https://gfycat.com/shortwealthybernesemountaindog,24,1568900372.0,SirT6,0.99,/r/sciences/comments/d6e6z4/a_melanoma_cell_in_its_death_throes/,sciences,166187,2
"The Netherlands has become the world’s second largest food exporter, while reducing water usage by 90% and nearly eradicating the use of pesticides.",1217,c92y5k,https://gfycat.com/amusedcreamyfoxhound,90,1562248991.0,SirT6,0.97,/r/sciences/comments/c92y5k/the_netherlands_has_become_the_worlds_second/,sciences,166187,2
"The world's smallest house - assembled inside a scanning electron microscope’s vacuum chamber, the house is just 20 micrometers long. It was built to test whether a robot could achieve nanometer accuracy in building.",1195,8lvvfv,https://i.redd.it/vef77v7f4vz01.png,105,1527193572.0,SirT6,0.98,/r/sciences/comments/8lvvfv/the_worlds_smallest_house_assembled_inside_a/,sciences,166187,2
"The Great Escape: a 232 gram octopus squeezes through a 1 inch hole. With a body made up mostly of soft tissue, an octopus can squeeze through any hole larger than its beak (the only “bone” in its body)",1187,bkxqnf,https://gfycat.com/UnselfishIllfatedHawk,31,1557063129.0,SirT6,0.98,/r/sciences/comments/bkxqnf/the_great_escape_a_232_gram_octopus_squeezes/,sciences,166187,2
"Congratulations to the 2019 #nobelprize winners in Physiology or Medicine which was assigned today to William G. Kaelin Jr., Sir Peter J. Ratcliffe and Gregg L. Semenza for their discoveries of how cells sense and adapt to oxygen availability",1184,del7c7,https://v.redd.it/8yruyur535r31,23,1570463005.0,pollisa_85,0.99,/r/sciences/comments/del7c7/congratulations_to_the_2019_nobelprize_winners_in/,sciences,166187,2
"It's fair to say planets orbit the Sun, but that's not 100% true. The Sun holds 99.8% of the Solar System's mass; Jupiter contains most of what's left and as a result plays tug of war with the Sun. Everything orbits a center of mass!",1175,gcr7nt,https://gfycat.com/firstfamiliarchameleon,31,1588514983.0,SirT6,0.98,/r/sciences/comments/gcr7nt/its_fair_to_say_planets_orbit_the_sun_but_thats/,sciences,166187,2
"Measles Cases in The United States, 1944-Present",1171,ctx1mo,https://i.imgur.com/xcv4ood.png,45,1566478523.0,SirT6,0.99,/r/sciences/comments/ctx1mo/measles_cases_in_the_united_states_1944present/,sciences,166187,2
"Gene therapy for spinal muscular atrophy showing promising results: 100% of the kids who got the highest dose a gene therapy were alive at 20 months. Nearly all could talk and feed themselves. And some, like little Evelyn Villarreal, could talk, walk and even do push-ups!",1159,au9fx8,https://gfycat.com/ValidSafeAzurevase,46,1551025224.0,SirT6,0.99,/r/sciences/comments/au9fx8/gene_therapy_for_spinal_muscular_atrophy_showing/,sciences,166187,2
Kin conflict in a colony of tree bumblebees. The queen catches worker #3 laying eggs and gives her a rather nasty telling off.,1164,bibg33,https://gfycat.com/GreenUnitedAcornweevil,30,1556459614.0,SirT6,0.99,/r/sciences/comments/bibg33/kin_conflict_in_a_colony_of_tree_bumblebees_the/,sciences,166187,2
"Visualizing human migration patterns over the past 125,000 years",1158,bzb5vu,https://gfycat.com/blandimmediatehomalocephale,46,1560251788.0,SirT6,0.97,/r/sciences/comments/bzb5vu/visualizing_human_migration_patterns_over_the/,sciences,166187,2
Live mitochondria seen at super-resolution for the first time as researchers develop technique to get around the “diffraction problem”.,1157,cq8eai,https://gfycat.com/pleasingsorrowfulhawk,40,1565782316.0,SirT6,0.99,/r/sciences/comments/cq8eai/live_mitochondria_seen_at_superresolution_for_the/,sciences,166187,2
Rotating Venus,1158,ei2k93,https://gfycat.com/somberliveacaciarat,11,1577797193.0,cosmicdatabase,0.98,/r/sciences/comments/ei2k93/rotating_venus/,sciences,166187,2
"This gif, created by Google product developer Clay Bavor, puts the 747 and SR-71 aircraft speeds into perspective compared to New Horizons spacecraft. 36,000 mph ~ 58,000 km/h was the speed reached at launch (Atlas V third stage cut off)",1151,fvi1zc,https://www.sciencealert.com/images/1405483165095695138.gif,17,1586109510.0,FillsYourNiche,0.98,/r/sciences/comments/fvi1zc/this_gif_created_by_google_product_developer_clay/,sciences,166187,2
Zooming in Milky Way,1153,eyp9k2,https://gfycat.com/granularfocusedamericanavocet,43,1580818973.0,cosmicdatabase,0.98,/r/sciences/comments/eyp9k2/zooming_in_milky_way/,sciences,166187,2
"A look at what is going on inside a drop of water! The giant spiral bacteria are causing mayhem, a large a single cell eukaryote ciliate is in an uproar, and dozens of smaller ciliates are dancing like no one is watching.",1154,ea6pu1,https://gfycat.com/bleaktautdiscus,26,1576256956.0,mtimetraveller,0.99,/r/sciences/comments/ea6pu1/a_look_at_what_is_going_on_inside_a_drop_of_water/,sciences,166187,2
"Time-lapse footage of deep sea scavengers gathering to enjoy a dead tuna carcass. Giant isopods, crabs, and deep-sea eels devour the carrion — leaving nothing but a skeleton on the ocean floor.",1150,dwqd8n,https://gfycat.com/spiffyspotlessgoldfish,52,1573822346.0,SirT6,0.98,/r/sciences/comments/dwqd8n/timelapse_footage_of_deep_sea_scavengers/,sciences,166187,2
This spiral may be the first evidence of the birth of a planet ever captured by humanity.,1148,gnva5w,https://gfycat.com/soggyexcellentduckling,19,1590061170.0,tismuma,0.97,/r/sciences/comments/gnva5w/this_spiral_may_be_the_first_evidence_of_the/,sciences,166187,2
Earth and Moon from Saturn,1145,exkopf,https://i.imgur.com/cJDD998.gifv,21,1580627041.0,illichian,0.99,/r/sciences/comments/exkopf/earth_and_moon_from_saturn/,sciences,166187,2
Killer whale using a fish as bait to hunt birds,1142,cx89uo,https://thumbs.gfycat.com/SomePettyCaecilian-size_restricted.gif,42,1567118917.0,IJesusChrist,0.98,/r/sciences/comments/cx89uo/killer_whale_using_a_fish_as_bait_to_hunt_birds/,sciences,166187,2
"Desert harvester ants leave no ant behind. When a colony member is caught in a spider web, multiple ants come to help, using their jaws to tear the web apart.",1143,c062d7,https://gfycat.com/finishedicyattwatersprairiechicken,23,1560433852.0,SirT6,0.99,/r/sciences/comments/c062d7/desert_harvester_ants_leave_no_ant_behind_when_a/,sciences,166187,2
"The chair of Harvard University’s chemistry department has been arrested on charges of lying to the U.S. about millions in Chinese funding he has received, in an escalation of U.S. efforts to counter what officials describe as Beijing’s aggressive recruitment at U.S. universities.",1130,ev996h,https://www.wsj.com/articles/harvards-chemistry-chair-charged-on-alleged-undisclosed-ties-to-china-11580228768,51,1580235747.0,SirT6,0.99,/r/sciences/comments/ev996h/the_chair_of_harvard_universitys_chemistry/,sciences,166187,2
"Mesospim captures ultra-detailed images using new open-source microscopy technology, here is a neurofilament stained chicken embryo",1122,d5fxow,https://gfycat.com/competentunawaregyrfalcon,26,1568721601.0,IJesusChrist,0.99,/r/sciences/comments/d5fxow/mesospim_captures_ultradetailed_images_using_new/,sciences,166187,2
Octopus eggs hatching,1120,cf6c1i,https://gfycat.com/uncommonblissfulchicken,21,1563535398.0,SirT6,0.99,/r/sciences/comments/cf6c1i/octopus_eggs_hatching/,sciences,166187,2
The force of moving electrons on a magnetic field,1117,hwfm2u,https://v.redd.it/tbsspfq4zlc51,23,1595510795.0,IJesusChrist,0.99,/r/sciences/comments/hwfm2u/the_force_of_moving_electrons_on_a_magnetic_field/,sciences,166187,2
"Oxycodone consumption, US vs. Europe.",1118,ekibqb,https://i.redd.it/gyeocaw1p0941.jpg,89,1578255063.0,SirT6,0.99,/r/sciences/comments/ekibqb/oxycodone_consumption_us_vs_europe/,sciences,166187,2
Wonderful demonstration of Newton’s principle of inertia.,1107,bjosga,https://gfycat.com/DisguisedFoolishLeveret,21,1556757837.0,SirT6,0.97,/r/sciences/comments/bjosga/wonderful_demonstration_of_newtons_principle_of/,sciences,166187,2
Apollo 10 Earthrise,1102,gdwogi,https://i.imgur.com/imWfwfR.png,11,1588681040.0,cosmemo,1.0,/r/sciences/comments/gdwogi/apollo_10_earthrise/,sciences,166187,2
"Eye Worms: The worms are transmitted to eyes by flies. The flies ingest the worm larvae, then land on an animal’s eyes, where the flies feed on tears and other secretions. During this process, the flies deposit the worm larvae into the eye, where they grow into adult worms.",1092,atx9v5,https://gfycat.com/FirstSpanishIrishdraughthorse,105,1550940119.0,SirT6,0.97,/r/sciences/comments/atx9v5/eye_worms_the_worms_are_transmitted_to_eyes_by/,sciences,166187,2
The moon passed between Nasa's Deep Space Climate Observatory and the Earth allowing this rare pic,1086,mfq6q7,https://i.redd.it/hr6v8iya4zp61.jpg,44,1617026444.0,AlbertDoublon12,0.97,/r/sciences/comments/mfq6q7/the_moon_passed_between_nasas_deep_space_climate/,sciences,166187,2
"An asteroid hit Earth’s atmosphere last June, sparking a fireball over South Africa",1084,bcccbk,https://gfycat.com/NastyBlondArctichare,18,1555067797.0,SirT6,0.98,/r/sciences/comments/bcccbk/an_asteroid_hit_earths_atmosphere_last_june/,sciences,166187,2
An adorable (and potentially deadly) cardiac thrombus,1079,c0j34w,https://gfycat.com/abandonedenormousasiansmallclawedotter,75,1560512368.0,SirT6,0.99,/r/sciences/comments/c0j34w/an_adorable_and_potentially_deadly_cardiac/,sciences,166187,2
"The Sun being eclipsed by Mars' moon Phobos, captured by the Curiosity Rover",1074,hf0wd9,https://gfycat.com/linedbarrenhogget,21,1593004845.0,SirT6,0.99,/r/sciences/comments/hf0wd9/the_sun_being_eclipsed_by_mars_moon_phobos/,sciences,166187,2
The Northern Lights as seen from the International Space Station,1080,cajs6k,https://gfycat.com/shimmeringlawfuldotterel,9,1562584842.0,SirT6,0.99,/r/sciences/comments/cajs6k/the_northern_lights_as_seen_from_the/,sciences,166187,2
"Despite its flaws, Niels Bohr’s atomic model made some important advances in our understanding of atomic structure and the diagrams from his 1923 lectures are stunningly detailed [x-post r/ScientificArt]",1079,f8kilm,https://i.redd.it/ngpjuz83csi41.jpg,10,1582512316.0,JesDOTse,0.99,/r/sciences/comments/f8kilm/despite_its_flaws_niels_bohrs_atomic_model_made/,sciences,166187,2
"Researchers have engineered a prosthetic system to let a man whose hand was amputated perform complex tasks, like picking grapes, grasping an egg or perceiving the tactile difference between “soft” and “hard”.",1078,chmmsz,https://gfycat.com/waryaromaticcoqui,14,1564055342.0,SirT6,0.99,/r/sciences/comments/chmmsz/researchers_have_engineered_a_prosthetic_system/,sciences,166187,2
"Eosinophils are drivers of Th2 diseases like asthma, atopic dermatitis and allergy. But give them a parasite and they’ll get the job done. One theory for why Th2 disease is on the rise is because we are exposed to less microorganisms (hygiene hypothesis).",1070,de56s4,https://gfycat.com/definitivebonyinvisiblerail,44,1570377958.0,SirT6,0.99,/r/sciences/comments/de56s4/eosinophils_are_drivers_of_th2_diseases_like/,sciences,166187,2
"Chameleons’ long, elastic tongues are one of the fastest muscles in the animal kingdom, extending more than twice their body length and packing 14,000 watts of power per kilo.",1067,gsyipr,https://i.imgur.com/k4mW9mM.gifv,10,1590777352.0,FillsYourNiche,0.97,/r/sciences/comments/gsyipr/chameleons_long_elastic_tongues_are_one_of_the/,sciences,166187,2
Nerd cookies: depicting the plasmodium parasite's lifecycle,1059,h0c9s0,https://i.redd.it/n4q8h2z6g3451.jpg,6,1591799784.0,SirT6,0.99,/r/sciences/comments/h0c9s0/nerd_cookies_depicting_the_plasmodium_parasites/,sciences,166187,2
Programmed cell death,1039,hc0m5z,https://i.redd.it/wlvo62e4s1k21.gif,24,1592573017.0,SirT6,0.99,/r/sciences/comments/hc0m5z/programmed_cell_death/,sciences,166187,2
This is atrial fibrillation. Fibrillating right atria and rapid ventricular response.,1043,gc6cu2,https://gfycat.com/immensereasonabledore,47,1588425658.0,SirT6,0.98,/r/sciences/comments/gc6cu2/this_is_atrial_fibrillation_fibrillating_right/,sciences,166187,2
Spider hauls a shell into a tree to use for shelter 🕷️,1044,ahxdun,https://gfycat.com/BothDimwittedLarva,78,1547989392.0,SirT6,0.97,/r/sciences/comments/ahxdun/spider_hauls_a_shell_into_a_tree_to_use_for/,sciences,166187,2
*Sandbox experiment* Sandbox modeling has been used extensively over the last decades to study the structural evolution to model shallow geological processes. A sandbox experiment model was designed to simulate how differences in rock strength and gravity between two blocks can influence the form,1028,nplidf,https://v.redd.it/hna64v8jyk271,22,1622521118.0,Constructorsfeed,0.99,/r/sciences/comments/nplidf/sandbox_experiment_sandbox_modeling_has_been_used/,sciences,166187,2
Science Summary for last month,1012,fn7s1q,https://i.imgur.com/Jw5uTNW.jpg,22,1584913099.0,prototyperspective,0.99,/r/sciences/comments/fn7s1q/science_summary_for_last_month/,sciences,166187,2
Boiling An Egg – With Chemistry!,1015,e6bw0g,https://gfycat.com/willinghiddenjaguar,48,1575519899.0,mtimetraveller,0.94,/r/sciences/comments/e6bw0g/boiling_an_egg_with_chemistry/,sciences,166187,2
MRI of the brain of an adult who had an entire cerebral hemisphere removed as a child due to severe epilepsy. Kids who undergo this procedure often retain surprisingly high levels of cognitive ability.,1017,e00lap,https://gfycat.com/madeupbruisedboutu,55,1574427255.0,SirT6,0.99,/r/sciences/comments/e00lap/mri_of_the_brain_of_an_adult_who_had_an_entire/,sciences,166187,2
"Two worlds, one Sun: taken at sunset, one from Earth and one from Mars",1008,b4jocl,https://gfycat.com/AnguishedAromaticBooby,25,1553350898.0,SirT6,0.99,/r/sciences/comments/b4jocl/two_worlds_one_sun_taken_at_sunset_one_from_earth/,sciences,166187,2
Relative sizes of the satellites and rock planets of our solar system,1007,ck8a5l,https://gfycat.com/uniformcoolasianelephant,21,1564578497.0,SirT6,0.98,/r/sciences/comments/ck8a5l/relative_sizes_of_the_satellites_and_rock_planets/,sciences,166187,2
First embryonic division of a nematode worm: the DNA (magenta) of the egg and sperm meet each other and initiate the start of a new life.,1003,cerfc0,https://gfycat.com/firmkindlyabalone,21,1563450381.0,SirT6,0.99,/r/sciences/comments/cerfc0/first_embryonic_division_of_a_nematode_worm_the/,sciences,166187,2
This gif just won the Nobel Prize,1004,jlym03,https://i.imgur.com/Y4yKL26.gifv,61,1604216420.0,pspencounter,0.99,/r/sciences/comments/jlym03/this_gif_just_won_the_nobel_prize/,sciences,166187,2
"Can Your AI Differentiate Cats from COVID-19? There is a recent interest in using AI to detect COVID-19 from Chest X-Ray images. However, recent work serve as a warning to practitioners by showing that these AIs are susceptible to making overconfident and wildly in accurate predictions.",996,ha2jy8,https://i.redd.it/iixl7fm6g9551.jpg,41,1592308570.0,SirT6,0.98,/r/sciences/comments/ha2jy8/can_your_ai_differentiate_cats_from_covid19_there/,sciences,166187,2
Platelets stop us bleeding to death. This movie shows how platelets are formed.,996,h8tuju,https://gfycat.com/flakyenergeticgadwall,15,1592141331.0,SirT6,0.99,/r/sciences/comments/h8tuju/platelets_stop_us_bleeding_to_death_this_movie/,sciences,166187,2
Scientist who helped develop new drug for ovarian cancer donates all profits to charity,998,e4pfvs,https://www.independent.co.uk/life-style/women/cancer-drug-ovarian-science-nicola-curtin-newcastle-university-charity-a9220506.html,17,1575241260.0,SirT6,0.98,/r/sciences/comments/e4pfvs/scientist_who_helped_develop_new_drug_for_ovarian/,sciences,166187,2
Io and its shadow on the Jupiter. Seen by Voayager-1 in 1979. Credit: NASA/JPL /Ian Regan,994,f88rde,https://i.redd.it/4ie2kaug1oi41.jpg,12,1582460328.0,cosmicdatabase,0.99,/r/sciences/comments/f88rde/io_and_its_shadow_on_the_jupiter_seen_by/,sciences,166187,2
"""PERMEABILITY OF SOIL"".",998,o9zfxa,https://v.redd.it/3hokua2vb4871,13,1624935008.0,Constructorsfeed,0.98,/r/sciences/comments/o9zfxa/permeability_of_soil/,sciences,166187,2
How To Make A Hot Ice!,993,e9m8se,https://gfycat.com/variablewatchfulguernseycow,28,1576148942.0,mtimetraveller,0.98,/r/sciences/comments/e9m8se/how_to_make_a_hot_ice/,sciences,166187,2
"The unicellular predator, Lacrymaria olor, programs a comprehensive search space and emergent hunting behavior through coupling surface based active cilia and cortex based contractile molecular systems together.",981,drzeiw,https://gfycat.com/impressivepiercingduck,24,1572961869.0,SirT6,0.99,/r/sciences/comments/drzeiw/the_unicellular_predator_lacrymaria_olor_programs/,sciences,166187,2
NASA astronaut Andrew Jay 'Drew' Fuestel after his return from 197 days in space,986,nbj03y,https://v.redd.it/b38q2507mwy61,31,1620919007.0,touchfeel,0.99,/r/sciences/comments/nbj03y/nasa_astronaut_andrew_jay_drew_fuestel_after_his/,sciences,166187,2
"Cancer cells are known to protect themselves using proteins that tell immune cells not to attack them. Stanford researchers have discovered a new “don’t eat me” signal, and blocking it may make cancer cells vulnerable to attack by the immune system.",975,cknr9s,http://med.stanford.edu/news/all-news/2019/07/new-dont-eat-me-signal-may-provide-basis-for-cancer-therapies.html?linkId=71369264,42,1564662690.0,SirT6,0.99,/r/sciences/comments/cknr9s/cancer_cells_are_known_to_protect_themselves/,sciences,166187,2
It takes the sun 200 million years to orbit the galaxy; dinosaurs existed when the solar system was on the other side,976,dtmtlx,https://gfycat.com/whitegorgeousjerboa,25,1573251402.0,IJesusChrist,0.99,/r/sciences/comments/dtmtlx/it_takes_the_sun_200_million_years_to_orbit_the/,sciences,166187,2
"Cells from a woolly mammoth that died more than 28,000 years ago from the Siberian permafrost have been observed to reactivate inside of mouse egg cells. The achievement shows that biological activity can be induced in the cells of long-dead creatures.",977,b1ejy1,https://gfycat.com/EllipticalDisastrousBanteng,62,1552654193.0,SirT6,0.99,/r/sciences/comments/b1ejy1/cells_from_a_woolly_mammoth_that_died_more_than/,sciences,166187,2
An animation showing how brain cells communicate.,972,11mpfaa,https://v.redd.it/rxqn70j34pma1,34,1678359888.0,Rifletree,0.98,/r/sciences/comments/11mpfaa/an_animation_showing_how_brain_cells_communicate/,sciences,166187,2
Visualizing intracranial vasculature.,965,ciht81,https://gfycat.com/torndimpledfunnelweaverspider,21,1564235943.0,SirT6,0.99,/r/sciences/comments/ciht81/visualizing_intracranial_vasculature/,sciences,166187,2
"The dead leaf butterfly is an exquisite example of mimicry, nailing the shape, color and even vein patterns of a dead leaf.",966,bip0zu,https://gfycat.com/SophisticatedHeartfeltImpala,19,1556541687.0,SirT6,0.98,/r/sciences/comments/bip0zu/the_dead_leaf_butterfly_is_an_exquisite_example/,sciences,166187,2
New ‘Pied Piper’ device granted ‘breakthrough’ designation by FDA for brain tumors. The device lures aggressive cancer cells from deep in the brain into its trap.,959,ao39p6,https://gfycat.com/GenuineWarmheartedBlackbird,74,1549542790.0,SirT6,0.99,/r/sciences/comments/ao39p6/new_pied_piper_device_granted_breakthrough/,sciences,166187,2
"A pregnant Christmas Island red crab on her way to spawn, stops along the way to feast on crab babies headed for the jungle. If a spawning crab migrates a month late (same tide a month later), she may pass last month’s larvae returning to the shoreline.",951,brniir,https://gfycat.com/ShamefulDelayedDrafthorse,47,1558524025.0,SirT6,0.98,/r/sciences/comments/brniir/a_pregnant_christmas_island_red_crab_on_her_way/,sciences,166187,2
"Fast new 3D printing method creates objects as big as an adult human, overcoming limitations caused by heat buildup from the exothermic polymerization process.",949,djm66c,https://gfycat.com/importantcrazygermanshepherd,76,1571398338.0,SirT6,0.99,/r/sciences/comments/djm66c/fast_new_3d_printing_method_creates_objects_as/,sciences,166187,2
"Giant Pacific octopus eggs hatching: Octopuses typically have a single reproductive period and then they die (semelparity). Once a clutch of fertilized eggs has been produced, the female protects and tends them until they hatch.",944,bnpdsv,https://gfycat.com/JampackedAnotherJumpingbean,36,1557670439.0,SirT6,0.99,/r/sciences/comments/bnpdsv/giant_pacific_octopus_eggs_hatching_octopuses/,sciences,166187,2
Stylonychia (microorganism) Creating A Water Vortex Using Its Cilia,943,eawbc3,https://gfycat.com/untidyvengefulgecko,19,1576396600.0,mtimetraveller,1.0,/r/sciences/comments/eawbc3/stylonychia_microorganism_creating_a_water_vortex/,sciences,166187,2
Stunning video of a live Keratinocyte and its organelles at super resolution,937,d2n61c,https://v.redd.it/wkv405m6jxl31,21,1568192438.0,pollisa_85,0.99,/r/sciences/comments/d2n61c/stunning_video_of_a_live_keratinocyte_and_its/,sciences,166187,2
Bird decides to do a spot of fishing.,936,awjbcf,https://gfycat.com/WellmadeBoilingAmericanratsnake,18,1551543665.0,SirT6,0.97,/r/sciences/comments/awjbcf/bird_decides_to_do_a_spot_of_fishing/,sciences,166187,2
Laryngoscopy - Vocal Cords in Action,931,bx1dbo,https://gfycat.com/WeirdAchingGroundhog,56,1559733232.0,SirT6,0.97,/r/sciences/comments/bx1dbo/laryngoscopy_vocal_cords_in_action/,sciences,166187,2
Sneak Attack: African red trapdoor spider surprises a passing cricket,928,aypkpy,https://gfycat.com/CandidAcademicFoxhound,104,1552047069.0,SirT6,0.98,/r/sciences/comments/aypkpy/sneak_attack_african_red_trapdoor_spider/,sciences,166187,2
