title,score,id,url,num_comments,created,author,upvote_ratio,permalink,subreddit,subreddit_subscribers,depth
My idea for how Duolingo could expand its Plus subscription,3291,ic85y0,https://i.redd.it/jqlnzvtbeth51.jpg,136,1597779878.0,Sledjoys,0.99,/r/duolingo/comments/ic85y0/my_idea_for_how_duolingo_could_expand_its_plus/,duolingo,208104,2
got bored and drew one of the characters from my lessons :D,2787,i6jzq7,https://i.redd.it/sx8p5ennizf51.png,63,1596982404.0,_kunakuna_,0.98,/r/duolingo/comments/i6jzq7/got_bored_and_drew_one_of_the_characters_from_my/,duolingo,208104,2
another fanart :D,2248,i8brkx,https://i.redd.it/qejvvadg0kg51.jpg,50,1597230405.0,_kunakuna_,0.99,/r/duolingo/comments/i8brkx/another_fanart_d/,duolingo,208104,2
"Confirmed: Tagalog, Zulu Xhosa, māori and Haitian Creole :))",2244,p89l7s,https://i.redd.it/ub78lyz2qji71.jpg,235,1629479652.0,ofnkrtffl,0.99,/r/duolingo/comments/p89l7s/confirmed_tagalog_zulu_xhosa_māori_and_haitian/,duolingo,208104,2
Today I had a dream that Duolingo started offering a survival course,2008,tq72hq,https://i.redd.it/tk2z8ls004q81.png,48,1648466642.0,Shneancy,0.98,/r/duolingo/comments/tq72hq/today_i_had_a_dream_that_duolingo_started/,duolingo,208104,2
A friendly reminder from Duo,1986,fkd4j4,https://i.redd.it/yferc7gtsan41.jpg,34,1584479259.0,tandem_felix,0.99,/r/duolingo/comments/fkd4j4/a_friendly_reminder_from_duo/,duolingo,208104,2
Newest language on Duolingo!,1842,dj5txl,https://i.redd.it/ljtyyhnrj3t31.jpg,129,1571316027.0,tandem_felix,0.99,/r/duolingo/comments/dj5txl/newest_language_on_duolingo/,duolingo,208104,2
"Spanish is universally known as an emotionless, monotone language so I was relieved when Duolingo got that right unlike other apps",1692,wu1uai,https://i.redd.it/h3d1jw1a13j91.png,105,1661094529.0,Prunestand,0.98,/r/duolingo/comments/wu1uai/spanish_is_universally_known_as_an_emotionless/,duolingo,208104,2
I need this bag so bad,1577,p6wr04,https://i.redd.it/et007atbq5i71.jpg,61,1629310242.0,Diet-Lopsided,1.0,/r/duolingo/comments/p6wr04/i_need_this_bag_so_bad/,duolingo,208104,2
this character has the cool aunt vibes,1456,ibchqu,https://i.redd.it/84t5h7oqujh51.jpg,30,1597664314.0,_kunakuna_,0.97,/r/duolingo/comments/ibchqu/this_character_has_the_cool_aunt_vibes/,duolingo,208104,2
Take it easy Dave,1325,w1mz8c,https://i.redd.it/7vmyer3wb8c91.jpg,85,1658107704.0,Prunestand,0.96,/r/duolingo/comments/w1mz8c/take_it_easy_dave/,duolingo,208104,2
Baking buff duo,1305,10w2suo,https://v.redd.it/1fefa8s6yrga1,47,1675779127.0,GuyWithoutAHat,0.98,/r/duolingo/comments/10w2suo/baking_buff_duo/,duolingo,208104,2
3D Printed Duo (knife for scale),1290,jt49wz,https://i.redd.it/0m7f7bytsvy51.jpg,52,1605218457.0,redfaction99,1.0,/r/duolingo/comments/jt49wz/3d_printed_duo_knife_for_scale/,duolingo,208104,2
Oh boiiiii,1235,p7kmak,https://i.redd.it/oe2lxcseyci71.jpg,166,1629397703.0,ofnkrtffl,0.99,/r/duolingo/comments/p7kmak/oh_boiiiii/,duolingo,208104,2
Continuation of my Duolingo adventure. It seems there is no limit to punctuation symbols.,1220,u9lrrt,https://i.redd.it/a78l1wxlm4v81.jpg,43,1650653434.0,MightyKin,0.99,/r/duolingo/comments/u9lrrt/continuation_of_my_duolingo_adventure_it_seems/,duolingo,208104,2
Dark mode for all Android users!,1181,iyx81v,https://i.redd.it/gnex9immk3p51.jpg,40,1600953984.0,tandem_felix,0.99,/r/duolingo/comments/iyx81v/dark_mode_for_all_android_users/,duolingo,208104,2
YOU GOTTA PAY FOR THEM NOW WTF???,1161,wmltjx,https://i.redd.it/gu5r8amifah91.jpg,147,1660312347.0,TheoMia,0.98,/r/duolingo/comments/wmltjx/you_gotta_pay_for_them_now_wtf/,duolingo,208104,2
Duo must be proud. City College of San Francisco accepts Duolingo record as proof of qualification in English!! That's so cool!,1115,g6r7fd,https://i.redd.it/0zj45phjulu41.png,24,1587663955.0,bishybishhh,0.98,/r/duolingo/comments/g6r7fd/duo_must_be_proud_city_college_of_san_francisco/,duolingo,208104,2
Happy British noises.,1069,u2k3zs,https://i.redd.it/s9hk51vwr8t81.jpg,69,1649831949.0,KingOfRubberyCustard,0.99,/r/duolingo/comments/u2k3zs/happy_british_noises/,duolingo,208104,2
Angry British noises.,1049,npt0ch,https://i.redd.it/vx5uhjfsfn271.png,68,1622551048.0,KingOfRubberyCustard,0.99,/r/duolingo/comments/npt0ch/angry_british_noises/,duolingo,208104,2
Today I've found out that you can give your sentence any intonation.,1039,u99eta,https://i.redd.it/6or23xuif1v81.jpg,45,1650614730.0,MightyKin,0.99,/r/duolingo/comments/u99eta/today_ive_found_out_that_you_can_give_your/,duolingo,208104,2
Someone drew the Duolingo owl on a house in my neighborhood.,1027,vek93f,https://i.imgur.com/fj2ckvt.jpg,49,1655484103.0,GuyWithoutAHat,0.99,/r/duolingo/comments/vek93f/someone_drew_the_duolingo_owl_on_a_house_in_my/,duolingo,208104,2
Latin is real now. I really like the flag ^^,1007,cpz5nz,https://i.redd.it/yzwmgb193ag31.png,105,1565729196.0,versain67,0.99,/r/duolingo/comments/cpz5nz/latin_is_real_now_i_really_like_the_flag/,duolingo,208104,2
Happy New Year!! Keep learning!,950,eidi2x,https://i.redd.it/2bc3kq9h93841.jpg,21,1577850288.0,tandem_felix,0.99,/r/duolingo/comments/eidi2x/happy_new_year_keep_learning/,duolingo,208104,2
Do you ever shock yourself with how much you've actually learned? I'm now at five-hundred-something-days and it's really working!,942,gksswi,https://i.redd.it/mic4ftnly3z41.jpg,95,1589626632.0,752649,0.99,/r/duolingo/comments/gksswi/do_you_ever_shock_yourself_with_how_much_youve/,duolingo,208104,2
I've submitted a thousand of these but this is the first reply I've ever had,938,dkhgy8,https://i.redd.it/6n0xie1e1ot31.jpg,29,1571564091.0,752649,0.99,/r/duolingo/comments/dkhgy8/ive_submitted_a_thousand_of_these_but_this_is_the/,duolingo,208104,2
Sometimes the side chick ain’t even a chick: it’s Duolingo,919,qwtjqj,https://i.redd.it/60xowgzcsd081.jpg,42,1637253055.0,Sledjoys,0.97,/r/duolingo/comments/qwtjqj/sometimes_the_side_chick_aint_even_a_chick_its/,duolingo,208104,2
This is the course I've been most excited for to come out of the incubator and it's almost here!,897,csu5h2,https://i.redd.it/yttiyofmnjh31.png,57,1566285933.0,IlluminEthan,0.99,/r/duolingo/comments/csu5h2/this_is_the_course_ive_been_most_excited_for_to/,duolingo,208104,2
Happy Halloween! Don't forget to do your daily lesson!,894,dpnshj,https://i.redd.it/6d65jtsqsvv31.jpg,36,1572529736.0,tandem_felix,0.99,/r/duolingo/comments/dpnshj/happy_halloween_dont_forget_to_do_your_daily/,duolingo,208104,2
Homemade Duolingo dolls!,885,jcpz6s,https://i.redd.it/vecd3grlilt51.jpg,26,1602914619.0,bishybishhh,0.98,/r/duolingo/comments/jcpz6s/homemade_duolingo_dolls/,duolingo,208104,2
I printed Duolingo's Japanese course!,881,uzuxdg,https://www.reddit.com/gallery/uzuxdg,97,1653767942.0,Shneancy,0.98,/r/duolingo/comments/uzuxdg/i_printed_duolingos_japanese_course/,duolingo,208104,2
Dealing with depression isn’t easy. I feel like a constant failure in life. Duolingo keeps me going! Thanks Duo. 100 days to go before I die of joy.,842,hapafd,https://i.redd.it/d7vad4bbgg551.jpg,105,1592392960.0,learningVocab,0.97,/r/duolingo/comments/hapafd/dealing_with_depression_isnt_easy_i_feel_like_a/,duolingo,208104,2
Okay but are we not talking abt how cute this is?,830,p6sfgf,https://i.redd.it/k95t6cl5o4i71.jpg,29,1629297405.0,Diet-Lopsided,0.98,/r/duolingo/comments/p6sfgf/okay_but_are_we_not_talking_abt_how_cute_this_is/,duolingo,208104,2
My response to a Plus ad,826,muwojs,https://i.redd.it/4prot4n1edu61.jpg,82,1618942607.0,Trad_Cat,0.97,/r/duolingo/comments/muwojs/my_response_to_a_plus_ad/,duolingo,208104,2
"Seriously, Duo, you miss me? I haven't missed a day in over a year and half!",812,ix1hsp,https://i.redd.it/urrttcr3hio51.jpg,45,1600698588.0,752649,0.99,/r/duolingo/comments/ix1hsp/seriously_duo_you_miss_me_i_havent_missed_a_day/,duolingo,208104,2
Latin is finally here!!,797,cw6xh1,https://i.redd.it/ma431i1ar0j31.png,99,1566923757.0,versain67,0.99,/r/duolingo/comments/cw6xh1/latin_is_finally_here/,duolingo,208104,2
Finnish is now in beta!,793,hek8mu,https://i.redd.it/8vsg0rfffp651.jpg,78,1592937472.0,Dubstros30,0.99,/r/duolingo/comments/hek8mu/finnish_is_now_in_beta/,duolingo,208104,2
8 LESSONS WTF,788,yl3zx1,https://i.redd.it/t4wtz0cevqx91.jpg,116,1667484973.0,TheoMia,0.96,/r/duolingo/comments/yl3zx1/8_lessons_wtf/,duolingo,208104,2
Stories are now available for all Android users!,793,ecy6wb,https://i.redd.it/4d7nijwu7n541.jpg,44,1576784336.0,tandem_felix,1.0,/r/duolingo/comments/ecy6wb/stories_are_now_available_for_all_android_users/,duolingo,208104,2
"To commemorate my 500th day of learning Spanish, I drew this!",787,11j05a7,https://www.reddit.com/gallery/11j05a7,51,1678031177.0,Sledjoys,0.98,/r/duolingo/comments/11j05a7/to_commemorate_my_500th_day_of_learning_spanish_i/,duolingo,208104,2
Can you make duolingo’s team hear this aloud that we want duolingo’s cartoon series?,789,mzumen,https://i.redd.it/md706jsearv61.jpg,86,1619546729.0,learningVocab,0.93,/r/duolingo/comments/mzumen/can_you_make_duolingos_team_hear_this_aloud_that/,duolingo,208104,2
Working on a 3D print - quick Duo render,789,hp5sih,https://i.redd.it/c14synrfg6a51.jpg,20,1594451377.0,redfaction99,1.0,/r/duolingo/comments/hp5sih/working_on_a_3d_print_quick_duo_render/,duolingo,208104,2
Scottish Gaelic for English speakers is now in the incubator!,764,celv0w,https://i.redd.it/fqgdozxyrya31.png,74,1563412991.0,IlluminEthan,0.99,/r/duolingo/comments/celv0w/scottish_gaelic_for_english_speakers_is_now_in/,duolingo,208104,2
I am taking Latin,756,na94x5,https://i.redd.it/g6tdjh6ceky61.jpg,33,1620770845.0,Trad_Cat,0.99,/r/duolingo/comments/na94x5/i_am_taking_latin/,duolingo,208104,2
You can now delete courses in the mobile app,749,hoizej,https://i.redd.it/agqk478fqy951.jpg,56,1594357676.0,Dubstros30,1.0,/r/duolingo/comments/hoizej/you_can_now_delete_courses_in_the_mobile_app/,duolingo,208104,2
