title,score,id,url,num_comments,created,author,upvote_ratio,permalink,subreddit,subreddit_subscribers,author_name
"Nothing particularly remarkable about this dusty sunset, except it's been captured by a robot working on Mars few hours ago",50692,9edf8x,https://i.redd.it/azr9btot58l11.jpg,779,1536504047.0,Mass1m01973,0.91,/r/space/comments/9edf8x/nothing_particularly_remarkable_about_this_dusty/,space,22943291,Mass1m01973
Perseverance Rover acquired this image,50596,p9c17h,https://i.redd.it/o87pc5ugqwi71.png,1223,1629637180.0,MistWeaver80,0.95,/r/space/comments/p9c17h/perseverance_rover_acquired_this_image/,space,22943291,MistWeaver80
I made a starless 4K wallpaper using over 200 hours of exposure on my favorite nebulae to showcase their dust and gas clouds,50578,cru0cn,https://i.redd.it/qx1kbu39i3h31.png,452,1566086408.0,Idontlikecock,0.94,/r/space/comments/cru0cn/i_made_a_starless_4k_wallpaper_using_over_200/,space,22943291,Idontlikecock
I spent nearly 6 months processing this 600 megapixel Milky Way Pano. This is one of my highest resolution images to date [OC],50566,qtdfrz,https://i.redd.it/05d3zkbfcgz71.jpg,654,1636848167.0,DanielJStein,0.93,/r/space/comments/qtdfrz/i_spent_nearly_6_months_processing_this_600/,space,22943291,DanielJStein
Hubble Space Telescope Captures a Star undergoing Supernova,50353,byjwwy,https://v.redd.it/lmtt14akvb331,1658,1560084814.0,kcgg123,0.96,/r/space/comments/byjwwy/hubble_space_telescope_captures_a_star_undergoing/,space,22943291,kcgg123
"Astronaut Anna Fisher kisses her daughter Kristin after training in Houston for a spacewalk in 1985. Photo/NASA She became the first mother in space on November 8, 1984.",50349,n8pkf5,https://i.redd.it/peza5uw2a6y61.jpg,582,1620600183.0,Aeromarine_eng,0.91,/r/space/comments/n8pkf5/astronaut_anna_fisher_kisses_her_daughter_kristin/,space,22943291,Aeromarine_eng
My sharpest moon image with over 100000 frames combined.,50267,10ckpdo,https://i.redd.it/wjj8g8pj99ca1.jpg,771,1673791552.0,Acuate187,0.92,/r/space/comments/10ckpdo/my_sharpest_moon_image_with_over_100000_frames/,space,22943291,Acuate187
Temperature of the Universe from Absolute Cold to Absolute Hot,50169,8o817m,https://i.redd.it/cc55dg4wxr111.png,1721,1528026536.0,berrysardar,0.91,/r/space/comments/8o817m/temperature_of_the_universe_from_absolute_cold_to/,space,22943291,berrysardar
"I spent over a year capturing this, the largest image ever taken of the complete andromeda galaxy",50043,z65fdn,https://i.redd.it/j1mptzkhsi2a1.jpg,767,1669566394.0,SPACESHUTTLEINMYANUS,0.95,/r/space/comments/z65fdn/i_spent_over_a_year_capturing_this_the_largest/,space,22943291,SPACESHUTTLEINMYANUS
"The Eye of God, over 100 hours of exposure on a dying star similar to our very own Sun [OC]",49412,pn40s8,https://i.redd.it/ze8udp9wt5n71.jpg,576,1631490732.0,Idontlikecock,0.95,/r/space/comments/pn40s8/the_eye_of_god_over_100_hours_of_exposure_on_a/,space,22943291,Idontlikecock
The United Kingdom From Space,49070,bfmt8m,https://i.redd.it/hxgolcrwwkt21.jpg,1656,1555835732.0,Stocky99,0.93,/r/space/comments/bfmt8m/the_united_kingdom_from_space/,space,22943291,Stocky99
2018 was easily my best year for photographing the Milky Way. This is an 8k compilation of my favorite images.,48801,aaqkid,https://i.redd.it/xeh6sxa03b721.jpg,406,1546128086.0,DanielJStein,0.91,/r/space/comments/aaqkid/2018_was_easily_my_best_year_for_photographing/,space,22943291,DanielJStein
Long exposure photograph I took of this morning's Minotaur IV rocket launch--the first Minotaur launch from Cape Canaveral.,48775,6w93n2,http://imgur.com/Bv6BUGu.jpg,414,1503792303.0,johnkphotos,0.93,/r/space/comments/6w93n2/long_exposure_photograph_i_took_of_this_mornings/,space,22943291,johnkphotos
I took this from my backyard!,48730,envw64,https://i.redd.it/55dg091bsfa41.jpg,782,1578873596.0,Pjacob77,0.94,/r/space/comments/envw64/i_took_this_from_my_backyard/,space,22943291,Pjacob77
The top photo was my first attempt ever at astrophotography 4 months ago. The bottom photo was last nights attempt,48733,ff4348,https://i.redd.it/u1xsfby7bcl41.jpg,478,1583625859.0,backyard_space,0.95,/r/space/comments/ff4348/the_top_photo_was_my_first_attempt_ever_at/,space,22943291,backyard_space
I took an 8k shot of the supermoon as it cut through the clouds. Try zooming in on the surface details. [OC],48327,b4pzbn,https://i.redd.it/m9t6hivjjyn21.jpg,1015,1553385649.0,ajamesmccarthy,0.91,/r/space/comments/b4pzbn/i_took_an_8k_shot_of_the_supermoon_as_it_cut/,space,22943291,ajamesmccarthy
"Fisheye photo I shot of the Atlas V / GOES-S launch from roughly 300ft away. My lens was destroyed, but the photo was worth it!",48327,857rga,https://i.imgur.com/3BKBrE9.jpg,484,1521331273.0,johnkphotos,0.91,/r/space/comments/857rga/fisheye_photo_i_shot_of_the_atlas_v_goess_launch/,space,22943291,johnkphotos
"I used my largest telescope to observe the moon/mars occultation on Wednesday night, and captured this detailed photo. If you zoom in you can see surface details on Mars next to the craters on the moon. It was spectacular and surreal to witness live.",48176,zi7upx,https://i.redd.it/1strr4irr55a1.jpg,812,1670716805.0,ajamesmccarthy,0.96,/r/space/comments/zi7upx/i_used_my_largest_telescope_to_observe_the/,space,22943291,ajamesmccarthy
"I took 100,000 pictures of the Sun one afternoon ... and after putting them all together, you can see the rotation of our star. [OC]",48022,dxuf43,https://gfycat.com/densecircularbushbaby,982,1574032724.0,TheVastReaches,0.96,/r/space/comments/dxuf43/i_took_100000_pictures_of_the_sun_one_afternoon/,space,22943291,TheVastReaches
"An astronaut in micro-g without access to handles or supports, is stuck floating",47340,b4tsen,https://v.redd.it/rxoemsp2t0o21,2015,1553413080.0,Mass1m01973,0.96,/r/space/comments/b4tsen/an_astronaut_in_microg_without_access_to_handles/,space,22943291,Mass1m01973
"A few weeks ago I shared with you my retro space art and everyone really enjoyed it, so I figured I'd share with you my Series 2 collection!",47293,awusju,https://i.redd.it/5wjq3ckc6xj21.png,495,1551625730.0,frankreddit5,0.9,/r/space/comments/awusju/a_few_weeks_ago_i_shared_with_you_my_retro_space/,space,22943291,frankreddit5
The small flash was a explosion caused by the comet Shoemaker-Levy 9 that collided with Jupiter. The explosion had the force of 5 billion atomic bombs and twice the size of Earth,47259,9ny9zf,https://v.redd.it/k6e9f4jpd1s11,1806,1539473156.0,Ghulam_Jewel,0.95,/r/space/comments/9ny9zf/the_small_flash_was_a_explosion_caused_by_the/,space,22943291,Ghulam_Jewel
Closeup photograph I shot of Falcon 9's Merlin 1D engines during its 50th flight last week.,47038,83qie5,https://i.imgur.com/z5wcWf9.jpg,405,1520810262.0,johnkphotos,0.9,/r/space/comments/83qie5/closeup_photograph_i_shot_of_falcon_9s_merlin_1d/,space,22943291,johnkphotos
"Enormous water worlds appear to be common throughout the Milky Way. The planets, which are up to 50% water by mass and 2-3 times the size of Earth, account for nearly one-third of known exoplanets.",46563,9ueqes,http://www.astronomy.com/news/2018/08/one-third-of-known-planets-may-be-enormous-ocean-worlds,2539,1541433686.0,clayt6,0.94,/r/space/comments/9ueqes/enormous_water_worlds_appear_to_be_common/,space,22943291,clayt6
I borrowed a big telescope in the desert to try and get the most detailed picture of a distant galaxy possible with amateur gear. Here is my result. [OC],46374,fj9w8l,https://i.redd.it/0r1ka79uxwm41.jpg,590,1584311452.0,TheVastReaches,0.96,/r/space/comments/fj9w8l/i_borrowed_a_big_telescope_in_the_desert_to_try/,space,22943291,TheVastReaches
Here is my first attempt at a high resolution moon. I user over 7000 images to create this!,46342,fzm0jw,https://i.redd.it/h4sijzgd2as41.jpg,712,1586649607.0,backyard_space,0.93,/r/space/comments/fzm0jw/here_is_my_first_attempt_at_a_high_resolution/,space,22943291,backyard_space
"40 years ago today, Viking 2 took this iconic image of frost on Mars",46341,bqfo7q,https://i.redd.it/zfup2vw8g5z21.jpg,788,1558263640.0,Mass1m01973,0.96,/r/space/comments/bqfo7q/40_years_ago_today_viking_2_took_this_iconic/,space,22943291,Mass1m01973
"It only takes about 3 hours to get from the east to west coast of New Zealand, but I still love to stop half way for the night and photograph the stars in Arthur's Pass",46323,covrjg,https://i.redd.it/h545r4bq3tf31.jpg,407,1565523761.0,EkantTakePhotos,0.95,/r/space/comments/covrjg/it_only_takes_about_3_hours_to_get_from_the_east/,space,22943291,EkantTakePhotos
SpaceX to Send Privately Crewed Dragon Spacecraft Beyond the Moon Next Year,46290,5wjkgh,http://www.spacex.com/news/2017/02/27/spacex-send-privately-crewed-dragon-spacecraft-beyond-moon-next-year,3163,1488231102.0,Pluto_and_Charon,0.9,/r/space/comments/5wjkgh/spacex_to_send_privately_crewed_dragon_spacecraft/,space,22943291,Pluto_and_Charon
"NASA Finds Ancient Organic Material, Mysterious Methane on Mars",46216,8pciwz,https://www.nasa.gov/press-release/nasa-finds-ancient-organic-material-mysterious-methane-on-mars,1643,1528394703.0,MaryADraper,0.92,/r/space/comments/8pciwz/nasa_finds_ancient_organic_material_mysterious/,space,22943291,MaryADraper
"This is what 13.5 minutes of exposure time looks like on a dark, moonless night in North Dakota.",46168,y5rrq3,https://i.redd.it/a75tk52ze8u91.jpg,571,1665954038.0,peeweekid,0.96,/r/space/comments/y5rrq3/this_is_what_135_minutes_of_exposure_time_looks/,space,22943291,peeweekid
I stitched together 12 images of the Milky Way to create my most detailed photograph of our galaxy I have ever created,46004,b1z2wd,https://i.redd.it/yws8cqc1lkm21.jpg,472,1552780818.0,DanielJStein,0.94,/r/space/comments/b1z2wd/i_stitched_together_12_images_of_the_milky_way_to/,space,22943291,DanielJStein
A picture I took of craters on the moon with a $150 camera,45961,8am8k4,https://i.redd.it/e864sr8frkq01.png,1089,1523145679.0,Idontlikecock,0.86,/r/space/comments/8am8k4/a_picture_i_took_of_craters_on_the_moon_with_a/,space,22943291,Idontlikecock
"One of the most incredible moments of my life happened almost exactly a year ago, when I witnessed this comet with my naked eyes. Here’s a photo I captured to try and do the moment justice. [OC]",45352,ow35no,https://i.redd.it/kobsamzq2ue71.jpg,464,1627861588.0,DanielJStein,0.95,/r/space/comments/ow35no/one_of_the_most_incredible_moments_of_my_life/,space,22943291,DanielJStein
I photographed the Milky Way over my house while my city was blacked-out from Hurricane Irma.,45262,721w3c,https://i.imgur.com/i9thApy.jpg,767,1506211543.0,marcuscotephoto,0.9,/r/space/comments/721w3c/i_photographed_the_milky_way_over_my_house_while/,space,22943291,marcuscotephoto
Successful SpaceX Crew-2 launch to the ISS.,45227,mwrsau,https://v.redd.it/dji3fob5bwu61,831,1619171680.0,CodingCoda,0.93,/r/space/comments/mwrsau/successful_spacex_crew2_launch_to_the_iss/,space,22943291,CodingCoda
This video of Sun’s Plasma rain larger than the earth captured by the Solar Dynamics Observatory Spacecraft over 9 hours.,45186,tj18sr,https://v.redd.it/3xq6dl5ddno81,1224,1647829420.0,Ghulam_Jewel,0.97,/r/space/comments/tj18sr/this_video_of_suns_plasma_rain_larger_than_the/,space,22943291,Ghulam_Jewel
My reflection selfie in a window on the International Space Station! More details in comments.,45109,1101fva,https://i.redd.it/06c0s9enbnha1.png,713,1676158970.0,astro_pettit,0.94,/r/space/comments/1101fva/my_reflection_selfie_in_a_window_on_the/,space,22943291,astro_pettit
I photographed Falcon Heavy passing through clouds that temporarily revealed more detail of its three 9-engine cores.,45065,7yajv5,http://i.imgur.com/W1lKTqs.jpg,588,1518912007.0,marcuscotephoto,0.89,/r/space/comments/7yajv5/i_photographed_falcon_heavy_passing_through/,space,22943291,marcuscotephoto
I captured the ISS crossing in front of yesterday's crescent moon during an uncommon daytime lunar transit.,44937,6qev0b,http://i.imgur.com/nlzhros.jpg,646,1501379077.0,marcuscotephoto,0.92,/r/space/comments/6qev0b/i_captured_the_iss_crossing_in_front_of/,space,22943291,marcuscotephoto
Boeing CEO says he’ll beat SpaceX to Mars; Elon Musk says ‘do it’.,44926,7i8v6x,https://www.geekwire.com/2017/boeing-ceo-dennis-muilenburg-says-hell-beat-spacex-mars-elon-musk-says/,1843,1512674165.0,AdamCannon,0.92,/r/space/comments/7i8v6x/boeing_ceo_says_hell_beat_spacex_to_mars_elon/,space,22943291,AdamCannon
"After nearly two years of astrophotography, finally have an image of the Andromeda Galaxy I’m proud of",44906,t2zv3k,https://i.redd.it/ymkb3n8fegk81.jpg,577,1646001639.0,MrJackDog,0.96,/r/space/comments/t2zv3k/after_nearly_two_years_of_astrophotography/,space,22943291,MrJackDog
I captured a high resolution photo of the true colors of the moon Wednesday evening. This is what you would see if your eyes were much more sensitive to color. [OC],44833,gyhrk3,https://i.redd.it/r1ao4kd09j351.jpg,1058,1591555214.0,ajamesmccarthy,0.82,/r/space/comments/gyhrk3/i_captured_a_high_resolution_photo_of_the_true/,space,22943291,ajamesmccarthy
"I took photos of the entire recent lunar eclipse. When I aligned them based on Earth's shadow, it helps visualize the shape of the Earth.",44737,yzqtas,https://i.redd.it/rk4os93o501a1.jpg,703,1668905003.0,ajamesmccarthy,0.94,/r/space/comments/yzqtas/i_took_photos_of_the_entire_recent_lunar_eclipse/,space,22943291,ajamesmccarthy
I Captured a Huge Eruption on the Sun Yesterday,44689,ufqlq1,https://i.redd.it/o7jwe3mh5sw81.gif,1075,1651374118.0,chucksastro,0.94,/r/space/comments/ufqlq1/i_captured_a_huge_eruption_on_the_sun_yesterday/,space,22943291,chucksastro
"Space Force leader suggests education secretary should be on the National Space Council. Early education about the value created by space technology should be a national priority, talented people find their passion very early in life, so more should be done to attract high achievers to the field.",44662,qsclyk,https://spacenews.com/space-force-leader-suggests-education-secretary-should-be-on-the-national-space-council/,1789,1636728103.0,MaryADraper,0.9,/r/space/comments/qsclyk/space_force_leader_suggests_education_secretary/,space,22943291,MaryADraper
NASA wants government to stop hitting reset button after Trump administration shifts target from Mars to Moon.,44232,7peb7w,http://www.ibtimes.co.uk/nasa-wants-government-stop-hitting-reset-button-after-trump-admin-shifts-target-mars-moon-1654510,2803,1515573424.0,AdamCannon,0.84,/r/space/comments/7peb7w/nasa_wants_government_to_stop_hitting_reset/,space,22943291,AdamCannon
"Most Milky Way images I see on here are taken with a wide angle lens. I took a different approach, and used a telephoto lens to get extreme details on our Galaxy and the foreground alike!",44122,g8pbk6,https://i.redd.it/cwvmafgh19v41.jpg,419,1587944797.0,DanielJStein,0.95,/r/space/comments/g8pbk6/most_milky_way_images_i_see_on_here_are_taken/,space,22943291,DanielJStein
"Earlier this week, I captured the International Space Station crossing the moon. Traveling at 17,500 miles per hour, the ISS transited the moon in under 0.7 seconds.",44083,65cp0w,http://i.imgur.com/eWDdXpM.jpg,942,1492178736.0,johnkphotos,0.91,/r/space/comments/65cp0w/earlier_this_week_i_captured_the_international/,space,22943291,johnkphotos
Space Debris orbiting Earth,44011,btewvn,https://i.imgur.com/Sm7eFiK.gifv,1696,1558914090.0,mossberg91,0.95,/r/space/comments/btewvn/space_debris_orbiting_earth/,space,22943291,mossberg91
I caught the brightest fireball I've ever seen in my timelapse!,43808,t2asek,https://v.redd.it/c62pkdvfn9k81,541,1645920053.0,peeweekid,0.95,/r/space/comments/t2asek/i_caught_the_brightest_fireball_ive_ever_seen_in/,space,22943291,peeweekid
"I left my camera running for 12 hours and 3,300 shots to capture an entire night of the Grand Tetons under starlight. [OC]",43792,qz0ryj,https://v.redd.it/iy4uggw0pz081,500,1637518389.0,peeweekid,0.95,/r/space/comments/qz0ryj/i_left_my_camera_running_for_12_hours_and_3300/,space,22943291,peeweekid
Mars is at its closest point to Earth right now. Here’s a picture I captured of it using a 14” telescope. On Wednesday I’ll be using the same telescope to capture it being occulted by the moon.,43609,zcp83l,https://i.redd.it/u1jljqzj904a1.jpg,412,1670195777.0,ajamesmccarthy,0.96,/r/space/comments/zcp83l/mars_is_at_its_closest_point_to_earth_right_now/,space,22943291,ajamesmccarthy
"Video captured of Jupiter, Io and Europa during Cassini's flyby.",43604,9tzhnh,https://media.giphy.com/media/BL4WUC94giJPZrO6Ta/giphy.gif,910,1541293525.0,mtimetraveller,0.91,/r/space/comments/9tzhnh/video_captured_of_jupiter_io_and_europa_during/,space,22943291,mtimetraveller
I downloaded data from NASA's solar observatory in space- this is my result after processing the data like it was my own image. [OC],43403,i6a9r1,https://i.redd.it/d69kfnbihvf51.jpg,552,1596933719.0,ajamesmccarthy,0.95,/r/space/comments/i6a9r1/i_downloaded_data_from_nasas_solar_observatory_in/,space,22943291,ajamesmccarthy
Got lucky the other night and was able to capture this hazy landscape of the Lunar Eclipse last weekend just before the clouds came in fast [OC],43382,uuz7gh,https://i.redd.it/6c15eys94x091.jpg,351,1653177608.0,DanielJStein,0.95,/r/space/comments/uuz7gh/got_lucky_the_other_night_and_was_able_to_capture/,space,22943291,DanielJStein
"The Strawberry Moon last night in Powhatan, Louisiana",43377,gy1wvz,https://i.redd.it/5ppvzui1pd351.jpg,538,1591488007.0,spiider_bro,0.95,/r/space/comments/gy1wvz/the_strawberry_moon_last_night_in_powhatan/,space,22943291,spiider_bro
2020 was a great year for capturing planets. These are all of the planets I captured ending with the Great Conjunction.,43373,l3omm2,https://v.redd.it/m5qlq7xjd6d61,563,1611448800.0,chucksastro,0.95,/r/space/comments/l3omm2/2020_was_a_great_year_for_capturing_planets_these/,space,22943291,chucksastro
