title,score,id,url,num_comments,created,author,upvote_ratio,permalink,subreddit,subreddit_subscribers,depth
Countries my dad doesn't recognise. Feel free to ask why,6782,x5jcin,https://i.redd.it/oc2qzhwgxul91.jpg,1270,1662285913.0,Hooperlooper16,0.94,/r/ShittyMapPorn/comments/x5jcin/countries_my_dad_doesnt_recognise_feel_free_to/,ShittyMapPorn,91824,2
Good survey,3219,yynvf1,https://i.redd.it/xgfrpo0wzr0a1.jpg,68,1668788159.0,WeldedLatimer,0.99,/r/ShittyMapPorn/comments/yynvf1/good_survey/,ShittyMapPorn,91824,2
Australian tries to draw the USA states from memory,3105,ymrueo,https://i.redd.it/3qjn0mbgx5y91.png,436,1667649262.0,meloon_man,0.97,/r/ShittyMapPorn/comments/ymrueo/australian_tries_to_draw_the_usa_states_from/,ShittyMapPorn,91824,2
"Map Of Earth But I Erased A Country, Bet You Can't Guess.",2839,p3bcv7,https://i.redd.it/tpk24l7qf0h71.png,240,1628810289.0,burgerking_foot,0.98,/r/ShittyMapPorn/comments/p3bcv7/map_of_earth_but_i_erased_a_country_bet_you_cant/,ShittyMapPorn,91824,2
places where I've thrown up (estimate),2776,vuedph,https://i.redd.it/p82u9frwcda91.jpg,104,1657296854.0,ABigOne77,0.98,/r/ShittyMapPorn/comments/vuedph/places_where_ive_thrown_up_estimate/,ShittyMapPorn,91824,2
Top two upvoted comments get a state. (Day 21: AriZona finally gets added! And Georgia looks a bit different...),2552,wvnsn6,https://i.redd.it/1jx8ac6yigj91.jpg,439,1661258445.0,Living_Murphys_Law,0.97,/r/ShittyMapPorn/comments/wvnsn6/top_two_upvoted_comments_get_a_state_day_21/,ShittyMapPorn,91824,2
Climate change is real confirmed,2481,zbfqxk,https://i.redd.it/l02dlpnv2q3a1.jpg,236,1670072464.0,endlesscosmichorror,0.97,/r/ShittyMapPorn/comments/zbfqxk/climate_change_is_real_confirmed/,ShittyMapPorn,91824,2
"Got deleted on MapPorn, so thought I'd post this here",2414,v8pc6h,https://i.redd.it/glyh1oghxeu71.jpg,66,1654804539.0,AA3081,0.98,/r/ShittyMapPorn/comments/v8pc6h/got_deleted_on_mapporn_so_thought_id_post_this/,ShittyMapPorn,91824,2
"The most voted country will gain half of each of their bordering countries' land. Day 1, Liechtenstein wins, taking half of Switzerland and Austria",2401,w82863,https://i.redd.it/ccv5mcwhisd91.png,356,1658787989.0,GarunixReborn,0.95,/r/ShittyMapPorn/comments/w82863/the_most_voted_country_will_gain_half_of_each_of/,ShittyMapPorn,91824,2
"The top two upvoted comments get a state. (Day 23: Rhode island, as an island, and Misery gets some Company.)",2383,wxcs9v,https://i.redd.it/rmtrag32ruj91.jpg,368,1661430079.0,Living_Murphys_Law,0.97,/r/ShittyMapPorn/comments/wxcs9v/the_top_two_upvoted_comments_get_a_state_day_23/,ShittyMapPorn,91824,2
"The top two upvoted comments get a state. (Day 28: The Carolinas are deemed unnecessary, and the Dacorners are finally filled in.)",2329,x1iwig,https://i.redd.it/xoeqvufsouk91.jpg,334,1661865406.0,Living_Murphys_Law,0.96,/r/ShittyMapPorn/comments/x1iwig/the_top_two_upvoted_comments_get_a_state_day_28/,ShittyMapPorn,91824,2
Most used Word in each State,2262,10jkcbk,https://i.redd.it/v0c6zoh9tvda1.png,46,1674500354.0,RyanH090,0.97,/r/ShittyMapPorn/comments/10jkcbk/most_used_word_in_each_state/,ShittyMapPorn,91824,2
"The top two upvoted comments get a state! (Day 24: The Islamic Empire of Al-Abama, and politicians learn to time travel in Washington, BC.)",2256,wy802x,https://i.redd.it/6w2sotbzx1k91.jpg,329,1661517143.0,Living_Murphys_Law,0.96,/r/ShittyMapPorn/comments/wy802x/the_top_two_upvoted_comments_get_a_state_day_24/,ShittyMapPorn,91824,2
"Top two upvoted comments get a state. (Day 5: The Mississippi River is owned by Missi...ssippi [who would've guessed!], and we have Central Dakota surrounded so they can't escape now)",2258,wgu31y,https://i.redd.it/bfgnm3zt0wf91.jpg,482,1659702066.0,Living_Murphys_Law,0.96,/r/ShittyMapPorn/comments/wgu31y/top_two_upvoted_comments_get_a_state_day_5_the/,ShittyMapPorn,91824,2
"The top two upvoted comments get a state. (Day 19: West Virginia grows its ever expanding empire, and Nebraska does some stuff on the internet.)",2207,wuti1j,https://i.redd.it/iwkcb4w6m9j91.jpg,352,1661174453.0,Living_Murphys_Law,0.96,/r/ShittyMapPorn/comments/wuti1j/the_top_two_upvoted_comments_get_a_state_day_19/,ShittyMapPorn,91824,2
"The most voted country will be eliminated and split between its neighbours. Day 15 - The Irish revolt, and Iceland collapses.",2178,wkeh4e,https://i.redd.it/l5wpa9no4rg91.png,206,1660078675.0,GarunixReborn,0.96,/r/ShittyMapPorn/comments/wkeh4e/the_most_voted_country_will_be_eliminated_and/,ShittyMapPorn,91824,2
The most voted country will be eliminated and split between its neighbours. Day 16 - Portugal gets swallowed up,2126,wl8v4e,https://i.redd.it/gyu8ttf3byg91.png,217,1660165693.0,GarunixReborn,0.96,/r/ShittyMapPorn/comments/wl8v4e/the_most_voted_country_will_be_eliminated_and/,ShittyMapPorn,91824,2
Top 12 US States to live in,2110,11gaebb,https://i.redd.it/47bqbl3hxela1.jpg,45,1677782737.0,69_sapnu,0.97,/r/ShittyMapPorn/comments/11gaebb/top_12_us_states_to_live_in/,ShittyMapPorn,91824,2
"The top two upvoted comments get a state. (Day 27: Lawn Guy Land takes over Long Island as the world's largest theme park, and southern Nevada was lost in a bet with China.)",2006,x0nizc,https://i.redd.it/vvswntu7cnk91.jpg,327,1661776175.0,Living_Murphys_Law,0.96,/r/ShittyMapPorn/comments/x0nizc/the_top_two_upvoted_comments_get_a_state_day_27/,ShittyMapPorn,91824,2
"""20 is the sweet spot""",1996,10g60dy,https://i.redd.it/uybymprji2da1.jpg,82,1674145649.0,RyanH090,0.98,/r/ShittyMapPorn/comments/10g60dy/20_is_the_sweet_spot/,ShittyMapPorn,91824,2
Fun fact of the day,1994,u5k2pz,https://i.redd.it/jnorwv9ca2u81.png,41,1650190088.0,Racingamer145,0.99,/r/ShittyMapPorn/comments/u5k2pz/fun_fact_of_the_day/,ShittyMapPorn,91824,2
"Is a man named ""Adolf Hitler"" in power in your country?",1977,10bgtpa,https://i.redd.it/eltpz2vmnzba1.png,54,1673675193.0,Mightgaming6,0.98,/r/ShittyMapPorn/comments/10bgtpa/is_a_man_named_adolf_hitler_in_power_in_your/,ShittyMapPorn,91824,2
"Europe, but the top-voted comment gets to add something everyday day 2: Czechoslovenia is added",1951,w4kcki,https://i.redd.it/3oxxd1pl2yc91.jpg,420,1658419328.0,ABigOne77,0.95,/r/ShittyMapPorn/comments/w4kcki/europe_but_the_topvoted_comment_gets_to_add/,ShittyMapPorn,91824,2
Countries that have eaten their Prime Minister,1933,usc7yb,https://i.redd.it/wg1pmt6me8091.jpg,124,1652878413.0,West_Sector_666,0.98,/r/ShittyMapPorn/comments/usc7yb/countries_that_have_eaten_their_prime_minister/,ShittyMapPorn,91824,2
"Europe, but the 2 top voted comments create a country everyday day 11: Northugal and New New Zealand join the battle",1929,wbzl70,https://i.redd.it/pxwrg9901qe91.jpg,336,1659193633.0,ABigOne77,0.95,/r/ShittyMapPorn/comments/wbzl70/europe_but_the_2_top_voted_comments_create_a/,ShittyMapPorn,91824,2
This Family Guy map just gave me cancer.,1926,pmy3vz,https://i.redd.it/q1fr0jee74n71.png,96,1631471041.0,HenriGL,0.98,/r/ShittyMapPorn/comments/pmy3vz/this_family_guy_map_just_gave_me_cancer/,ShittyMapPorn,91824,2
"The top two upvoted comments get a state. (Day 17: Fast Food officially takes over the middle of Outdiana, and Hawaiiaheeee.)",1918,wqo92c,https://i.redd.it/v1xm0m3mt9i91.jpg,322,1660740832.0,Living_Murphys_Law,0.97,/r/ShittyMapPorn/comments/wqo92c/the_top_two_upvoted_comments_get_a_state_day_17/,ShittyMapPorn,91824,2
What the FUCK is Azerbaijan?,1916,10st80l,https://i.redd.it/xfvugt17j2ga1.jpg,192,1675453410.0,Traditional-Rock9220,0.96,/r/ShittyMapPorn/comments/10st80l/what_the_fuck_is_azerbaijan/,ShittyMapPorn,91824,2
"The World but only with continents starting with ""A""",1891,x53kv0,https://i.redd.it/9octekphsql91.jpg,280,1662235812.0,Hooperlooper16,0.93,/r/ShittyMapPorn/comments/x53kv0/the_world_but_only_with_continents_starting_with_a/,ShittyMapPorn,91824,2
when a band goes on a world tour,1862,108m6y8,https://i.redd.it/lwalfk6fwbba1.jpg,88,1673387579.0,Maps_weird_WHAT,0.97,/r/ShittyMapPorn/comments/108m6y8/when_a_band_goes_on_a_world_tour/,ShittyMapPorn,91824,2
Map of all the countries in the world that have a unique initial (i.e: no other country name starts with their first letter in English),1836,z0yxcg,https://i.redd.it/32nktqt92b1a1.png,150,1669037066.0,NoNo_Cilantro,0.99,/r/ShittyMapPorn/comments/z0yxcg/map_of_all_the_countries_in_the_world_that_have_a/,ShittyMapPorn,91824,2
States with a coastline VS States without a coastline,1811,yg7l51,https://i.redd.it/b5feiwn56pw91.jpg,127,1667010523.0,FluffySheep2,0.94,/r/ShittyMapPorn/comments/yg7l51/states_with_a_coastline_vs_states_without_a/,ShittyMapPorn,91824,2
"Europe, but the top voted comment adds a country every day day 4: Sápmi is added",1800,w69gnp,https://i.redd.it/7doylromscd91.jpg,420,1658597594.0,ABigOne77,0.95,/r/ShittyMapPorn/comments/w69gnp/europe_but_the_top_voted_comment_adds_a_country/,ShittyMapPorn,91824,2
Persian cat,1736,115hncf,https://i.redd.it/wyu2wec7a0ja1.jpg,9,1676733716.0,SomebodyCalledHenryS,0.98,/r/ShittyMapPorn/comments/115hncf/persian_cat/,ShittyMapPorn,91824,2
Top two upvoted comments get a state! (Day 28: Halfalachia swaps with Fivessee to be more accurate.),1731,x2c9m8,https://i.redd.it/ll63ckt1l1l91.jpg,274,1661948638.0,Living_Murphys_Law,0.96,/r/ShittyMapPorn/comments/x2c9m8/top_two_upvoted_comments_get_a_state_day_28/,ShittyMapPorn,91824,2
"The top two upvoted comments get a state! (Day 25: Utah becomes the second state to endure the Bolsheviks, and Ken and Barbie get divorced in the most extreme way possible.)",1714,wz30jg,https://i.redd.it/xmx7kdjud9k91.jpg,305,1661607245.0,Living_Murphys_Law,0.96,/r/ShittyMapPorn/comments/wz30jg/the_top_two_upvoted_comments_get_a_state_day_25/,ShittyMapPorn,91824,2
"Europe, but the top voted country creates a country everyday day 5: an attempt was made to create Ohio",1703,w6yk9e,https://i.redd.it/3bfqbx49ejd91.jpg,277,1658677491.0,ABigOne77,0.94,/r/ShittyMapPorn/comments/w6yk9e/europe_but_the_top_voted_country_creates_a/,ShittyMapPorn,91824,2
US counties based off of how much I think they look like their state.,1695,xyzhj2,https://i.redd.it/9tc1f52ohms91.jpg,49,1665252680.0,ThePissGiver,0.98,/r/ShittyMapPorn/comments/xyzhj2/us_counties_based_off_of_how_much_i_think_they/,ShittyMapPorn,91824,2
"Top two upvoted comments get a state. (Day 30: Baltimore becomes king!... of Maryland, and Alaska is sponsored by Toyota. Let's go places.)",1683,x3yztj,https://i.redd.it/1k53oai0kfl91.jpg,235,1662117788.0,Living_Murphys_Law,0.97,/r/ShittyMapPorn/comments/x3yztj/top_two_upvoted_comments_get_a_state_day_30/,ShittyMapPorn,91824,2
"The top two upvoted comments get a state. (Day 26: The split personality of Minnesota divides the state apart, and Colorado is intentionally left blank.)",1656,wzjkmn,https://i.redd.it/eub1b5282dk91.jpg,293,1661651755.0,Living_Murphys_Law,0.97,/r/ShittyMapPorn/comments/wzjkmn/the_top_two_upvoted_comments_get_a_state_day_26/,ShittyMapPorn,91824,2
The top two upvoted comments get a state. (Day 15: Misery. *sigh*),1656,wq6uyn,https://i.redd.it/sh2mfw6bd5i91.jpg,290,1660686966.0,Living_Murphys_Law,0.96,/r/ShittyMapPorn/comments/wq6uyn/the_top_two_upvoted_comments_get_a_state_day_15/,ShittyMapPorn,91824,2
RULE BRITANNIA BRITANNIA RULES THE WAVES,1651,v3gwmt,https://i.redd.it/6g164jitf9391.jpg,174,1654198469.0,Nordumb,0.98,/r/ShittyMapPorn/comments/v3gwmt/rule_britannia_britannia_rules_the_waves/,ShittyMapPorn,91824,2
World according to Bhutan,1640,z81kw5,https://i.redd.it/6too7x4u3z2a1.png,79,1669745900.0,Maps_weird_WHAT,0.98,/r/ShittyMapPorn/comments/z81kw5/world_according_to_bhutan/,ShittyMapPorn,91824,2
"The top two upvoted comments get a state. (Day 6: The two Kansases [Kansi?] combine to form the Allkansan empire, and Ohio takes the rest of what Connecticut didn't.)",1597,whnr2r,https://i.redd.it/zv5gc867a3g91.jpg,371,1659790728.0,Living_Murphys_Law,0.96,/r/ShittyMapPorn/comments/whnr2r/the_top_two_upvoted_comments_get_a_state_day_6/,ShittyMapPorn,91824,2
Ohio,1595,x78y1u,https://i.redd.it/fwa0emkyb8m91.jpg,53,1662466179.0,thesupemeEDGElord666,0.98,/r/ShittyMapPorn/comments/x78y1u/ohio/,ShittyMapPorn,91824,2
Map of Europe but Italy really likes guns,1592,yutdnf,https://i.redd.it/y61p46otsvz91.jpg,46,1668416330.0,I_sellkids_organs,0.97,/r/ShittyMapPorn/comments/yutdnf/map_of_europe_but_italy_really_likes_guns/,ShittyMapPorn,91824,2
Us Michiganders know this one by heart.,1595,uw71zz,https://i.redd.it/myovyi4gs9191.jpg,68,1653331019.0,West_Sector_666,0.98,/r/ShittyMapPorn/comments/uw71zz/us_michiganders_know_this_one_by_heart/,ShittyMapPorn,91824,2
i divided germany again,1590,w3gbb2,https://i.redd.it/1xrvmpzdfoc91.jpg,148,1658302559.0,ABigOne77,0.95,/r/ShittyMapPorn/comments/w3gbb2/i_divided_germany_again/,ShittyMapPorn,91824,2
"Map Of Earth But A Continent Is Missing, There Is No Way You'll Figure This Out",1585,p8v43u,https://i.redd.it/atsd77i7tqi71.png,144,1629565450.0,burgerking_foot,0.96,/r/ShittyMapPorn/comments/p8v43u/map_of_earth_but_a_continent_is_missing_there_is/,ShittyMapPorn,91824,2
Map of US Counties that have Received Financial Aid from the Soviet Union,1571,ylpslg,https://i.redd.it/8g0fxcghdvx91.png,72,1667539518.0,Mightgaming6,0.98,/r/ShittyMapPorn/comments/ylpslg/map_of_us_counties_that_have_received_financial/,ShittyMapPorn,91824,2
Second most common race in each state,1566,zude4i,https://i.redd.it/g6sg2rds0x7a1.jpg,156,1671899900.0,1875ojofC,0.96,/r/ShittyMapPorn/comments/zude4i/second_most_common_race_in_each_state/,ShittyMapPorn,91824,2
Wait what,1549,yy2lkh,https://i.redd.it/u9o05jdj0l0a1.jpg,58,1668721607.0,saturnX77,0.99,/r/ShittyMapPorn/comments/yy2lkh/wait_what/,ShittyMapPorn,91824,2
"The top two upvoted comments get a state. (Day 11: The US rechecks the receipts on New Mexico and discovers its true origins, and Wyoming starts asking the big questions.)",1547,wlp0l5,https://i.redd.it/nr1fe1jojzg91.jpg,296,1660217060.0,Living_Murphys_Law,0.97,/r/ShittyMapPorn/comments/wlp0l5/the_top_two_upvoted_comments_get_a_state_day_11/,ShittyMapPorn,91824,2
I might get this one printed out.,1529,z6lixy,https://i.redd.it/zteopedikn2a1.jpg,35,1669606224.0,WeldedLatimer,0.99,/r/ShittyMapPorn/comments/z6lixy/i_might_get_this_one_printed_out/,ShittyMapPorn,91824,2
"Ah yes, the two most distinguishable colors: green and slightly darker green",1518,vhurk0,https://i.redd.it/z21nuae083791.jpg,68,1655866593.0,ijazat,0.99,/r/ShittyMapPorn/comments/vhurk0/ah_yes_the_two_most_distinguishable_colors_green/,ShittyMapPorn,91824,2
rule,1518,xqker6,https://i.redd.it/60ih0av8mmq91.png,194,1664389786.0,CredibleCactus,0.98,/r/ShittyMapPorn/comments/xqker6/rule/,ShittyMapPorn,91824,2
"The top two upvoted comments get a state. (Day 14: Swissconsin has its holes filled up, and a DMZ is formed over Disneyworld.)",1504,wod433,https://i.redd.it/rqr3wm7a2qh91.jpg,260,1660501610.0,Living_Murphys_Law,0.96,/r/ShittyMapPorn/comments/wod433/the_top_two_upvoted_comments_get_a_state_day_14/,ShittyMapPorn,91824,2
"Europe, but the 2 top voted comments add countries everyday day 12: Norway and Sweden get horny, and Leafland grows a stem",1499,wcr4p8,https://i.redd.it/czznwi308xe91.jpg,232,1659280733.0,ABigOne77,0.95,/r/ShittyMapPorn/comments/wcr4p8/europe_but_the_2_top_voted_comments_add_countries/,ShittyMapPorn,91824,2
true division of America,1492,vbh7j5,https://i.redd.it/qoc32cn69f591.jpg,73,1655140576.0,Nordumb,0.98,/r/ShittyMapPorn/comments/vbh7j5/true_division_of_america/,ShittyMapPorn,91824,2
Countries That Are South Sudan,1474,2h34x1,http://i.imgur.com/LKImbZv.jpg,19,1411350163.0,xcrissxcrossx,0.99,/r/ShittyMapPorn/comments/2h34x1/countries_that_are_south_sudan/,ShittyMapPorn,91824,2
The most voted country will gain half of each of their bordering countries' land.,1436,w77fx3,https://i.redd.it/uuy92i71bld91.png,502,1658700679.0,GarunixReborn,0.92,/r/ShittyMapPorn/comments/w77fx3/the_most_voted_country_will_gain_half_of_each_of/,ShittyMapPorn,91824,2
"The top two upvoted comments get a state. (Day 18: California splits in two, and Howdy, Arabia.)",1408,wrikrf,https://i.redd.it/bcbtl4nawgi91.jpg,292,1660826483.0,Living_Murphys_Law,0.96,/r/ShittyMapPorn/comments/wrikrf/the_top_two_upvoted_comments_get_a_state_day_18/,ShittyMapPorn,91824,2
"Europe, but the top voted comment creates a country everyday day 9: Croatia becomes L O N G",1368,wacbcm,https://i.redd.it/y130wgsuqbe91.jpg,229,1659020723.0,ABigOne77,0.95,/r/ShittyMapPorn/comments/wacbcm/europe_but_the_top_voted_comment_creates_a/,ShittyMapPorn,91824,2
"I present to you, the Paypal States!",1354,z72k7w,https://i.redd.it/ubwdz1km8q2a1.jpg,7,1669656568.0,UwUperson9987,0.99,/r/ShittyMapPorn/comments/z72k7w/i_present_to_you_the_paypal_states/,ShittyMapPorn,91824,2
"The most voted country will be eliminated and split between its neighbours. Day 15 - Byzantium repeats history without learning, collapsing after internal troubles",1350,wjk96i,https://i.redd.it/blg2jj6n1kg91.png,170,1659992905.0,GarunixReborn,0.95,/r/ShittyMapPorn/comments/wjk96i/the_most_voted_country_will_be_eliminated_and/,ShittyMapPorn,91824,2
Places I have threw up in,1353,p4c73t,https://i.redd.it/j5k2041eych71.png,40,1628961853.0,u_god_gud,0.99,/r/ShittyMapPorn/comments/p4c73t/places_i_have_threw_up_in/,ShittyMapPorn,91824,2
"Europe, but the 2 top voted comments add countries everyday day 13: the Basques and Catalonians finally get their own country, but they have to share it. Furthermore, some Swiss cantons leave Switzerland, creating Swiss Cheese",1350,wdjoz8,https://i.redd.it/fbubb1cca4f91.jpg,312,1659366269.0,ABigOne77,0.95,/r/ShittyMapPorn/comments/wdjoz8/europe_but_the_2_top_voted_comments_add_countries/,ShittyMapPorn,91824,2
Drew map of Europe from Memory as an Asian,1323,10tf5uc,https://i.redd.it/7oxj6cwjz5ga1.jpg,232,1675513233.0,69_sapnu,0.88,/r/ShittyMapPorn/comments/10tf5uc/drew_map_of_europe_from_memory_as_an_asian/,ShittyMapPorn,91824,2
South America,1317,z1tf9t,https://i.redd.it/1udx1av6oj1a1.jpg,60,1669123201.0,Puzzleheaded-Lab1028,0.98,/r/ShittyMapPorn/comments/z1tf9t/south_america/,ShittyMapPorn,91824,2
"Europe, but the top voted comment creates a country every day day 3: The Neverlands koloniseert Europe",1317,w5ezeo,https://i.redd.it/syfoia0ed5d91.jpg,279,1658507705.0,ABigOne77,0.96,/r/ShittyMapPorn/comments/w5ezeo/europe_but_the_top_voted_comment_creates_a/,ShittyMapPorn,91824,2
"The top two upvoted comments get a state. (Day 12: America decides to be an Oregon donor, and Illinois is renamed to annoy literally everyone.)",1282,wmj5er,https://i.redd.it/xl3flyuor9h91.jpg,293,1660304438.0,Living_Murphys_Law,0.98,/r/ShittyMapPorn/comments/wmj5er/the_top_two_upvoted_comments_get_a_state_day_12/,ShittyMapPorn,91824,2
"The top two upvoted comments get a state (Day 8: The U of Iowa Chess Team are leading the state, and Trans Mississippi.)",1254,wj7tp8,https://i.redd.it/mekl2mwjihg91.jpg,263,1659962273.0,Living_Murphys_Law,0.96,/r/ShittyMapPorn/comments/wj7tp8/the_top_two_upvoted_comments_get_a_state_day_8/,ShittyMapPorn,91824,2
Is your country Greenland?,1252,z2r8bp,https://i.redd.it/cp2i3zpjar1a1.jpg,13,1669215453.0,Maps_weird_WHAT,0.98,/r/ShittyMapPorn/comments/z2r8bp/is_your_country_greenland/,ShittyMapPorn,91824,2
Like that’ll ever happen,1252,ym0dys,https://i.redd.it/yv9h71hl1yx91.jpg,75,1667571799.0,CredibleCactus,0.98,/r/ShittyMapPorn/comments/ym0dys/like_thatll_ever_happen/,ShittyMapPorn,91824,2
Countries often omitted from maps,1235,11twpqr,https://i.redd.it/8cikuzcbfdoa1.jpg,31,1679072065.0,SomebodyCalledHenryS,0.99,/r/ShittyMapPorn/comments/11twpqr/countries_often_omitted_from_maps/,ShittyMapPorn,91824,2
Portugal is actually smaller than Spain,1229,yjo9l1,https://i.redd.it/7fh4mwp97fx91.jpg,33,1667343680.0,hiritomo,0.98,/r/ShittyMapPorn/comments/yjo9l1/portugal_is_actually_smaller_than_spain/,ShittyMapPorn,91824,2
I'ma just leave this here with no context,1224,tmv16a,https://i.redd.it/mtmazw7cndp81.jpg,93,1648147552.0,thesupemeEDGElord666,0.92,/r/ShittyMapPorn/comments/tmv16a/ima_just_leave_this_here_with_no_context/,ShittyMapPorn,91824,2
Duck!,1213,z0lqgs,https://i.redd.it/655tzmjyj71a1.jpg,24,1668994481.0,saturnX77,0.99,/r/ShittyMapPorn/comments/z0lqgs/duck/,ShittyMapPorn,91824,2
"Europe, but the top voted country creates a country everyday day 7: the seahorses get their own country with Seahorsia",1209,w8oe49,https://i.redd.it/5lqw2b0cxxd91.jpg,216,1658853404.0,ABigOne77,0.95,/r/ShittyMapPorn/comments/w8oe49/europe_but_the_top_voted_country_creates_a/,ShittyMapPorn,91824,2
coke,1202,yrjb56,https://i.redd.it/z5mzgkkzt6z91.jpg,35,1668096051.0,Wieg0rz,0.99,/r/ShittyMapPorn/comments/yrjb56/coke/,ShittyMapPorn,91824,2
Map of European Countries Who Have Had One of their Far-Right Politicians Pick Up a Femboy At an Anime Convention.,1185,yr1i99,https://i.redd.it/n7d2yya4h2z91.png,47,1668043298.0,Mightgaming6,0.98,/r/ShittyMapPorn/comments/yr1i99/map_of_european_countries_who_have_had_one_of/,ShittyMapPorn,91824,2
Map of europe but with islands only,1177,zinqvf,https://i.redd.it/jlfp1fqu095a1.png,58,1670755684.0,MajestroCZ,0.98,/r/ShittyMapPorn/comments/zinqvf/map_of_europe_but_with_islands_only/,ShittyMapPorn,91824,2
"The top two upvoted comments get a state. (Day 22: Dela has been found, thanks everyone!)",1178,wwi28b,https://i.redd.it/6gnzj7hklnj91.jpg,276,1661343478.0,Living_Murphys_Law,0.95,/r/ShittyMapPorn/comments/wwi28b/the_top_two_upvoted_comments_get_a_state_day_22/,ShittyMapPorn,91824,2
"The top two upvoted comments get a state. (Day 9: Oklahoma extends its panhandle to the Pacific, and Tennessee÷Twoxas=Fivessee)",1148,wk6fij,https://i.redd.it/2n1asdkcjpg91.jpg,287,1660059401.0,Living_Murphys_Law,0.97,/r/ShittyMapPorn/comments/wk6fij/the_top_two_upvoted_comments_get_a_state_day_9/,ShittyMapPorn,91824,2
Countries I’ve been to,1139,v5t4q6,https://i.redd.it/ypwvkclc1x391.jpg,137,1654484167.0,ThePissGiver,0.95,/r/ShittyMapPorn/comments/v5t4q6/countries_ive_been_to/,ShittyMapPorn,91824,2
Namibia👉👈Zimbabwe,1120,1127v3z,https://i.redd.it/07v8b2ewp7ia1.jpg,13,1676387895.0,SomebodyCalledHenryS,0.99,/r/ShittyMapPorn/comments/1127v3z/namibiazimbabwe/,ShittyMapPorn,91824,2
Ohio is finally defeated and turns into lake Erie 2,1105,x7sbcc,https://i.imgur.com/JWTd0Ga.jpg,38,1662515368.0,thesupemeEDGElord666,0.99,/r/ShittyMapPorn/comments/x7sbcc/ohio_is_finally_defeated_and_turns_into_lake_erie/,ShittyMapPorn,91824,2
"Europe, but the 2 top voted comments create a country everyday day 10: Romania doesn't want all of it's land taken, so they ally with Hungary to create the Hungry-Roman Empire",1091,wb73zw,https://i.redd.it/7cciqc9gvie91.jpg,242,1659107016.0,ABigOne77,0.94,/r/ShittyMapPorn/comments/wb73zw/europe_but_the_2_top_voted_comments_create_a/,ShittyMapPorn,91824,2
"Top two upvoted comments get a state. (Day 4: Communism takes over North Florea, and Washington's Western District of the District of Columbia.)",1091,wg1d4t,https://i.redd.it/4el2m9uf8pf91.jpg,325,1659619900.0,Living_Murphys_Law,0.95,/r/ShittyMapPorn/comments/wg1d4t/top_two_upvoted_comments_get_a_state_day_4/,ShittyMapPorn,91824,2
A map I made but I will not tell you what it represents and the person who finds out will not receive anything,1092,v6qxgv,https://i.redd.it/tt5l78ig26491.png,185,1654593540.0,ThePissGiver,0.96,/r/ShittyMapPorn/comments/v6qxgv/a_map_i_made_but_i_will_not_tell_you_what_it/,ShittyMapPorn,91824,2
Day 3 of changing Europe based on the top comment,1081,yw569b,https://i.redd.it/o3ltjyeuo50a1.png,324,1668536076.0,PixelSteel,0.92,/r/ShittyMapPorn/comments/yw569b/day_3_of_changing_europe_based_on_the_top_comment/,ShittyMapPorn,91824,2
Illinois is mental illness,1082,xn3bb8,https://i.redd.it/7xidreriavp91.jpg,6,1664051696.0,thesupemeEDGElord666,0.98,/r/ShittyMapPorn/comments/xn3bb8/illinois_is_mental_illness/,ShittyMapPorn,91824,2
turkey sandwich,1086,xwyuwd,https://i.redd.it/fxcx7c0tx4s91.jpg,24,1665040185.0,Mightgaming6,0.97,/r/ShittyMapPorn/comments/xwyuwd/turkey_sandwich/,ShittyMapPorn,91824,2
js had a nightmare,1058,v8hq5s,https://i.redd.it/8ayq7xsmsl491.jpg,152,1654783921.0,AA3081,0.93,/r/ShittyMapPorn/comments/v8hq5s/js_had_a_nightmare/,ShittyMapPorn,91824,2
A map of countries my friends could name,1055,10uhgmy,https://i.redd.it/evr9nq0gjega1.png,141,1675616789.0,UwUperson9987,0.92,/r/ShittyMapPorn/comments/10uhgmy/a_map_of_countries_my_friends_could_name/,ShittyMapPorn,91824,2
I feel bad for the ones in the soon category.,1036,zcb9w0,https://i.redd.it/l2w20vqwox3a1.jpg,78,1670164620.0,WeldedLatimer,0.95,/r/ShittyMapPorn/comments/zcb9w0/i_feel_bad_for_the_ones_in_the_soon_category/,ShittyMapPorn,91824,2
The 2 most voted countries will take half of their neighbours' land. Day 9 - Liechtenstein and Bosnia win.,1031,wensgi,https://i.redd.it/jv7y1k7gcdf91.png,173,1659475959.0,GarunixReborn,0.94,/r/ShittyMapPorn/comments/wensgi/the_2_most_voted_countries_will_take_half_of/,ShittyMapPorn,91824,2
An entire continent,1006,10wds68,https://i.redd.it/qm4u8mti4uga1.jpg,27,1675805474.0,SomebodyCalledHenryS,0.98,/r/ShittyMapPorn/comments/10wds68/an_entire_continent/,ShittyMapPorn,91824,2
America to an average Texan,996,10y6h95,https://i.redd.it/dbk522zdt9ha1.jpg,38,1675977435.0,I_sellkids_organs,0.99,/r/ShittyMapPorn/comments/10y6h95/america_to_an_average_texan/,ShittyMapPorn,91824,2
The only redeeming quality of this map is it kind of looks like a tardigrade,995,103628n,https://i.redd.it/im8kl9s743aa1.jpg,60,1672845391.0,endlesscosmichorror,0.97,/r/ShittyMapPorn/comments/103628n/the_only_redeeming_quality_of_this_map_is_it_kind/,ShittyMapPorn,91824,2
Countries in Europe,991,xda95t,https://i.redd.it/x9e6hbjj7nn91.jpg,45,1663082155.0,FluffySheep2,0.95,/r/ShittyMapPorn/comments/xda95t/countries_in_europe/,ShittyMapPorn,91824,2
"The top two upvoted comments get a state. (Day 10: Totally normal nothing changed Texas has joined the fun, and Mich comes again.)",978,wkuznh,https://i.redd.it/fjbrkzizcsg91.jpg,254,1660130921.0,Living_Murphys_Law,0.97,/r/ShittyMapPorn/comments/wkuznh/the_top_two_upvoted_comments_get_a_state_day_10/,ShittyMapPorn,91824,2
