title,score,id,url,num_comments,created,author,upvote_ratio,permalink,subreddit,subreddit_subscribers,depth
100 micron MRI scan of the human brain,934,bvxftq,https://gfycat.com/EmotionalExemplaryIbisbill,30,1559482677.0,SirT6,0.99,/r/sciences/comments/bvxftq/100_micron_mri_scan_of_the_human_brain/,sciences,166187,2
"A massive solar prominence, captured by NASA’s Solar Dynamics Observatory. These events can last for weeks or even months - and if they become unstable and break apart, the sun can spew magnetized plasma out into the surrounding environment in what is known as a coronal mass ejection.",920,bud5tl,https://gfycat.com/AngrySkeletalAstarte,26,1559127337.0,SirT6,0.99,/r/sciences/comments/bud5tl/a_massive_solar_prominence_captured_by_nasas/,sciences,166187,2
UK COVID-19 vaccine trial volunteer says she is 'doing fine' after anti-vax groups circulated online death rumours,912,g8sc6o,https://www.theguardian.com/world/2020/apr/26/uk-coronavirus-vaccine-trial-subject-doing-fine-online-death-rumours-elisa-granato,33,1587956418.0,SirT6,0.99,/r/sciences/comments/g8sc6o/uk_covid19_vaccine_trial_volunteer_says_she_is/,sciences,166187,2
"Japanese researchers develop ultrathin, highly elastic skin display. Breakthrough in healthcare?",904,dd3pim,https://i.redd.it/l3v0n5yn0hq31.gif,31,1570171565.0,PUTINKAAA,0.96,/r/sciences/comments/dd3pim/japanese_researchers_develop_ultrathin_highly/,sciences,166187,2
"Just 10 yrs ago, only 1 in 20 patients with advanced melanoma would survive for five years. Now, more than half of all patients survive for at least 5yrs when treated with immunotherapy.",894,dag8bc,https://www.bbc.com/news/amp/health-49853878?__twitter_impression=true,9,1569678667.0,SirT6,0.99,/r/sciences/comments/dag8bc/just_10_yrs_ago_only_1_in_20_patients_with/,sciences,166187,2
"This 2-millimeter creature is an Aeolosoma — a genus of annelid worm. You can find these darling organisms in fresh-water, often living on and consuming decaying material",898,dbp0o0,https://i.redd.it/k317u7khevp31.gif,19,1569909864.0,PUTINKAAA,0.99,/r/sciences/comments/dbp0o0/this_2millimeter_creature_is_an_aeolosoma_a_genus/,sciences,166187,2
The shot tho,894,f6uvg7,https://i.redd.it/jingz7zbn3i41.jpg,10,1582213426.0,wellendowedpenguin69,0.96,/r/sciences/comments/f6uvg7/the_shot_tho/,sciences,166187,2
"This is the first image ever taken of Earth from the surface of another planet. It was taken by the Mars Exploration Rover Spirit one hour before sunrise on the 63rd Martian day of its mission. (March 8, 2004)",890,b59ofu,https://i.redd.it/1jwvvqii69o21.jpg,20,1553514495.0,SirT6,0.99,/r/sciences/comments/b59ofu/this_is_the_first_image_ever_taken_of_earth_from/,sciences,166187,2
"NASA’s James Webb Space Telescope has imaged Jupiter. Credit: NASA, ESA, CSA, Jupiter ERS Team; image processing by Judy Schmidt.",887,wuyoyi,https://i.redd.it/lz9elrq2oaj91.png,22,1661186927.0,MistWeaver80,0.99,/r/sciences/comments/wuyoyi/nasas_james_webb_space_telescope_has_imaged/,sciences,166187,2
"NASA on going ‘back’ to the moon: “This time when we go to the moon, we’re going to stay. This isn’t about leaving flags and footprints ... but we’re going to go with sustainable, reusable architecture so we can go back to the moon over and over and over again.”",883,a6plow,https://www.smithsonianmag.com/smithsonian-institution/nasa-wont-go-back-moon-it-wants-go-beyond-180971033/,90,1544972408.0,SirT6,0.99,/r/sciences/comments/a6plow/nasa_on_going_back_to_the_moon_this_time_when_we/,sciences,166187,2
Night and day circles.,882,fgwkoi,https://gfycat.com/belovedancienteyra,15,1583930740.0,universal_native,0.99,/r/sciences/comments/fgwkoi/night_and_day_circles/,sciences,166187,2
"Soap bubbles float in an aquarium containing sulfur (VI) fluoride. SF₆ is five times heavier than air, so it squeezes all the air out of the aquarium and settles there. Since the bubbles filled with air are much lighter than the gas below them, they float on the surface.",883,11oiojz,https://v.redd.it/9afsnz0yp3na1,21,1678536749.0,Rifletree,0.98,/r/sciences/comments/11oiojz/soap_bubbles_float_in_an_aquarium_containing/,sciences,166187,2
Resolution of fingernail clubbing after treatment of lung cancer,876,szijdn,https://i.redd.it/um6ali9rclj81.jpg,17,1645625859.0,SirT6,0.99,/r/sciences/comments/szijdn/resolution_of_fingernail_clubbing_after_treatment/,sciences,166187,2
Discharge of water around 22 thousand liters per sec,873,nhz7bw,https://v.redd.it/ly48ov9nmi071,55,1621621202.0,touchfeel,0.98,/r/sciences/comments/nhz7bw/discharge_of_water_around_22_thousand_liters_per/,sciences,166187,2
The CDC and health agencies around the world are sounding the alarm: we are in the midst of a global pandemic of Lyme disease caused by ticks. This is one of the first global pandemics caused by climate change.,866,c57940,https://medium.com/l/ticks,98,1561462690.0,SirT6,0.97,/r/sciences/comments/c57940/the_cdc_and_health_agencies_around_the_world_are/,sciences,166187,2
"A metal foam that stops .50 caliber bullets as well as steel - at less than half the weight. These foams, in addition to being lightweight, are very effective at shielding X-rays, gamma rays and neutron radiation - and can handle fire and heat twice as well as the plain metals they are made of.",870,bxt9h8,https://gfycat.com/onlyshadowykingbird,27,1559905351.0,SirT6,0.98,/r/sciences/comments/bxt9h8/a_metal_foam_that_stops_50_caliber_bullets_as/,sciences,166187,2
"The Sanctuary of Madonna della Corona was built in 1625 into a vertical cliff face on Italy’s Mount Baldo. This church doesn’t actually hang on the cliff, but sits on a thin rock shelf.",861,cdgd8t,https://gfycat.com/shinywiltedharvestmouse,21,1563190663.0,SirT6,0.98,/r/sciences/comments/cdgd8t/the_sanctuary_of_madonna_della_corona_was_built/,sciences,166187,2
Arterial blood (bottom) is the oxygenated blood in the circulatory system and is bright red. Venous blood (top) is much darker.,860,aukthl,https://i.redd.it/ahst10yplpi21.jpg,53,1551098369.0,SirT6,0.99,/r/sciences/comments/aukthl/arterial_blood_bottom_is_the_oxygenated_blood_in/,sciences,166187,2
Researchers perform 3D time lapse imaging of the beating embryonic heart of a zebrafish. They are even able to capture cardiomyocytes undergoing mitosis.,855,dyjuvp,https://gfycat.com/nastyniftyamphibian,8,1574166968.0,SirT6,0.99,/r/sciences/comments/dyjuvp/researchers_perform_3d_time_lapse_imaging_of_the/,sciences,166187,2
The last billion years of Moon impacts.,856,b7b5ty,https://gfycat.com/VelvetyOpulentCub,34,1553951786.0,SirT6,0.99,/r/sciences/comments/b7b5ty/the_last_billion_years_of_moon_impacts/,sciences,166187,2
"The consistent underestimation of global solar capacity growth, illustrated",851,dxnhu7,https://i.redd.it/0ue92vrvg9z31.png,57,1574002819.0,IJesusChrist,0.98,/r/sciences/comments/dxnhu7/the_consistent_underestimation_of_global_solar/,sciences,166187,2
"A few days ago, SpaceX launched 60 Starlink Satellites that’ll beam high speed internet from space. An amateur astronomer in the Netherlands caught sight of them orbiting Earth after shortly after deployment, and captured the scene on video.",853,bv6ljd,https://gfycat.com/ShinyPrestigiousCony,38,1559303744.0,SirT6,0.99,/r/sciences/comments/bv6ljd/a_few_days_ago_spacex_launched_60_starlink/,sciences,166187,2
Friction welding is a solid-state welding process that generates heat through mechanical friction between workpieces in relative motion to one another. This process involves rubbing of the metal parts against each other to weld together.,849,11lrst9,https://v.redd.it/ezzwo90phhma1,38,1678267607.0,Rifletree,0.97,/r/sciences/comments/11lrst9/friction_welding_is_a_solidstate_welding_process/,sciences,166187,2
"Cancer death rates in the United States have dropped 29 percent from 1991 to 2017, and in the most recent update we see the the largest single-year decline in cancer mortality ever reported. Trend largely driven by breakthrough therapies for lung cancer and melanoma.",847,elu329,https://www.nytimes.com/2020/01/08/health/cancer-deaths-decline.html?smid=tw-nythealth&smtyp=cur,50,1578496970.0,SirT6,0.99,/r/sciences/comments/elu329/cancer_death_rates_in_the_united_states_have/,sciences,166187,2
This Is Blood Vessels Inside Sheep Heart Looks Like,848,e5ujn4,https://gfycat.com/groundedweeklychipmunk,17,1575437731.0,mtimetraveller,0.97,/r/sciences/comments/e5ujn4/this_is_blood_vessels_inside_sheep_heart_looks/,sciences,166187,2
Russian biologist has successfully used CRISPR to edit a deafness-causing gene in human eggs. The research has not led to the birth of gene-edited babies — yet.,830,dl0keu,https://www.the-scientist.com/news-opinion/deafness-gene-gjb2-edited-in-human-eggs-66600,37,1571664553.0,SirT6,0.98,/r/sciences/comments/dl0keu/russian_biologist_has_successfully_used_crispr_to/,sciences,166187,2
Long-awaited cystic fibrosis drug could turn deadly disease into a manageable condition: Patients who were unsure about whether they should bother attending college because they had always known they would die young are now being told they should think about planning for retirement.,829,dq32o8,https://www.washingtonpost.com/health/2019/10/31/long-awaited-cystic-fibrosis-drug-could-turn-deadly-disease-into-manageable-condition/#click=https://t.co/iyynsDkCRW,54,1572608540.0,SirT6,0.99,/r/sciences/comments/dq32o8/longawaited_cystic_fibrosis_drug_could_turn/,sciences,166187,2
"In 2011, Sonia Vallabh was handed a genetic report that contained a death sentence: she carried the gene for a prion disease, fatal familial insomnia. She quit her job, got a PhD and is now working with Ionis Pharma to develop a potential drug for her condition.",829,917346,https://www.technologyreview.com/s/611672/one-womans-race-to-defuse-the-genetic-time-bomb-in-her-genes/?utm_campaign=social_button&utm_source=twitter&utm_medium=social&utm_content=2018-07-23,95,1532352747.0,SirT6,0.98,/r/sciences/comments/917346/in_2011_sonia_vallabh_was_handed_a_genetic_report/,sciences,166187,2
Time-lapse videos of seeds sprouting,820,at56la,https://gfycat.com/WebbedImpeccableFruitfly,38,1550766979.0,SirT6,0.98,/r/sciences/comments/at56la/timelapse_videos_of_seeds_sprouting/,sciences,166187,2
Science Summary for last month,821,hchxmq,https://i.imgur.com/Px4HH51.jpg,11,1592638814.0,prototyperspective,0.98,/r/sciences/comments/hchxmq/science_summary_for_last_month/,sciences,166187,2
"Scientists have found evidence of microbial communities living in the oceanic crust hundreds of meters beneath the seafloor. Rock cores drilled from an undersea mountain in the Indian Ocean showed bacteria, fungi, and archaea live in cracks and fissures in the dense rock of the ocean’s lower crust.",820,fi1pad,https://eos.org/articles/microbes-discovered-hanging-out-in-the-oceans-crust,22,1584114540.0,FillsYourNiche,0.99,/r/sciences/comments/fi1pad/scientists_have_found_evidence_of_microbial/,sciences,166187,2
Neural plasticity in live rat hippocampal neurons,829,dj8175,https://v.redd.it/udx2rqf3e4t31,22,1571326363.0,pollisa_85,0.99,/r/sciences/comments/dj8175/neural_plasticity_in_live_rat_hippocampal_neurons/,sciences,166187,2
"A heart waiting to be transplanted… While 88% of patients who underwent heart transplant survived the first year after transplant surgery, the proportion of patients surviving for 5 years; Is 75%. The survival rate for 10 years after surgery is; Is 56%.",821,kjxaet,https://v.redd.it/210ny0w6eb761,22,1608893992.0,emir0723,0.99,/r/sciences/comments/kjxaet/a_heart_waiting_to_be_transplanted_while_88_of/,sciences,166187,2
"During the Great Depression, candy with a toy inside - usually a coin or lead trinket - was popular. However, they could be deadly when swallowed by small children. These photos helped convince Congress to write a law forbidding the sale of trinkets embedded in confections.",814,apfvsy,https://i.redd.it/hdmt26pdpxf21.png,57,1549888916.0,SirT6,0.98,/r/sciences/comments/apfvsy/during_the_great_depression_candy_with_a_toy/,sciences,166187,2
White blood cells engineered to drill holes in and destroy tumor cells (CAR-T) have emerged as a powerful clinical tool for managing blood cancers. Now a new genetically engineered immune cell is showing promise in animal models - CAR-M cells swallow tumor cells whole.,815,fns3if,https://www.fiercebiotech.com/research/abbvie-backed-carisma-s-car-m-tech-shrinks-tumors-mouse-models-ovarian-cancer,13,1584998013.0,SirT6,0.99,/r/sciences/comments/fns3if/white_blood_cells_engineered_to_drill_holes_in/,sciences,166187,2
"A man in eastern China recently visited a hospital with complaints of ""a crawling sensation"" in his right ear. Upon examination, the doctor found a spider had taken up residence and spun a web all across the ear canal.",808,bsfyik,https://gfycat.com/TeemingCoarseGoldfinch,61,1558698637.0,SirT6,0.96,/r/sciences/comments/bsfyik/a_man_in_eastern_china_recently_visited_a/,sciences,166187,2
"Science Summary for last month, September [OC]",807,dds7ty,https://i.imgur.com/WfBjJcl.jpg,25,1570304686.0,prototyperspective,0.99,/r/sciences/comments/dds7ty/science_summary_for_last_month_september_oc/,sciences,166187,2
"NASA's Parker Solar Probe just sent us this footage of Earth, Mercury, Jupiter, Saturn and Venus swimming in a sea of stars amidst the Milky Way",803,jktk2n,https://v.redd.it/xdcco47887w51,16,1604049762.0,pspencounter,0.99,/r/sciences/comments/jktk2n/nasas_parker_solar_probe_just_sent_us_this/,sciences,166187,2
"In U.S., Decline of Christianity Continues at Rapid Pace: 12% decline in American Christians from a decade ago; 84% of those born before 1945 are Christian vs 49% of millennials; 9% rise in atheism & agnosticism.",806,dp5ss7,https://www.pewforum.org/2019/10/17/in-u-s-decline-of-christianity-continues-at-rapid-pace/,154,1572437163.0,SirT6,0.97,/r/sciences/comments/dp5ss7/in_us_decline_of_christianity_continues_at_rapid/,sciences,166187,2
A gladiator spider hunting prey,800,bg0uuq,https://gfycat.com/SlightLastHippopotamus,12,1555931741.0,SirT6,0.95,/r/sciences/comments/bg0uuq/a_gladiator_spider_hunting_prey/,sciences,166187,2
"NASA releases ultra-high resolution ""Blue Marble"" image of Earth",791,mc4okj,https://i.redd.it/mpcc94fa1zo61.jpg,37,1616589586.0,AlbertDoublon12,0.91,/r/sciences/comments/mc4okj/nasa_releases_ultrahigh_resolution_blue_marble/,sciences,166187,2
NASA OSIRIS-REx spacecraft touchdown on asteroid Bennu’s surface,799,jl7drd,https://i.imgur.com/hxwrJim.gifv,31,1604099263.0,pspencounter,1.0,/r/sciences/comments/jl7drd/nasa_osirisrex_spacecraft_touchdown_on_asteroid/,sciences,166187,2
"In seahorses, the sperm-producers are also the ones that get pregnant. The female transfers her eggs to the male’s abdominal pouch. The male releases sperm to fertilize the eggs as they enter and incubates them until birth.",797,bgtirl,https://gfycat.com/DefinitivePeacefulFlatcoatretriever,37,1556105835.0,SirT6,0.98,/r/sciences/comments/bgtirl/in_seahorses_the_spermproducers_are_also_the_ones/,sciences,166187,2
Science Summary for June,789,hp9wz5,https://i.imgur.com/qjVfbCF.jpg,13,1594473842.0,prototyperspective,0.98,/r/sciences/comments/hp9wz5/science_summary_for_june/,sciences,166187,2
"How A Mosquito Finds And Pierces A Blood Vessel: The snout of a mosquito probing around for a blood vessel. When it finds and pierces a blood vessel, it drinks for ~4 min. It sucks so hard that the blood vessel starts to collapse.",786,bmxa49,https://gfycat.com/SafeTautClam,82,1557488882.0,SirT6,0.99,/r/sciences/comments/bmxa49/how_a_mosquito_finds_and_pierces_a_blood_vessel/,sciences,166187,2
"The ozone hole over Antarctica this year could be one of the smallest seen in three decades, say scientists. Observations of the gas's depletion high in the atmosphere demonstrate that it hasn't opened up in 2019 in the way it normally does.",786,d4zsca,https://www.bbc.co.uk/news/science-environment-49714987,14,1568635906.0,Wagamaga,0.99,/r/sciences/comments/d4zsca/the_ozone_hole_over_antarctica_this_year_could_be/,sciences,166187,2
"A simplified cellular pathway, protein-protein interaction wiring diagram.",782,c7idph,https://i.redd.it/3hsg22wpnj731.jpg,36,1561922496.0,SirT6,0.98,/r/sciences/comments/c7idph/a_simplified_cellular_pathway_proteinprotein/,sciences,166187,2
Glowing waves: the glowing is caused by a massive algae bloom of bioluminescent phytoplankton.,784,basnaq,https://gfycat.com/WatchfulMasculineGermanshepherd,23,1554723073.0,SirT6,0.98,/r/sciences/comments/basnaq/glowing_waves_the_glowing_is_caused_by_a_massive/,sciences,166187,2
"Acanthaspis petax, a type of assassin bug, stacks dead ant bodies on its back to confuse predators.",772,dg6bs1,https://i.redd.it/8q7weewmnsr31.jpg,22,1570749602.0,FillsYourNiche,0.99,/r/sciences/comments/dg6bs1/acanthaspis_petax_a_type_of_assassin_bug_stacks/,sciences,166187,2
Dividing cells,765,bff5ez,https://gfycat.com/RespectfulPlaintiveCusimanse,27,1555783536.0,SirT6,0.99,/r/sciences/comments/bff5ez/dividing_cells/,sciences,166187,2
"At least of 120 of Earth's largest and best telescopes have closed due to COVID-19, and astronomers are worried the lingering impact of the pandemic could set their field back years.",768,fwtztn,https://astronomy.com/news/2020/04/covid-19-forces-earths-largest-telescopes-to-close,29,1586297868.0,clayt6,0.98,/r/sciences/comments/fwtztn/at_least_of_120_of_earths_largest_and_best/,sciences,166187,2
Science Summary for last month,768,g006ud,https://i.imgur.com/aV4fS9m.jpg,16,1586710291.0,prototyperspective,0.99,/r/sciences/comments/g006ud/science_summary_for_last_month/,sciences,166187,2
Dr. Anthony Fauci says data from remdesivir coronavirus drug trial shows “clear cut positive effect in diminishing time to recover” - argues drug will now become standard of care for COVID-19 hospitalized patients.,764,gad8sn,https://www.cnbc.com/2020/04/29/dr-anthony-fauci-says-data-from-remdesivir-coronavirus-drug-trial-shows-quite-good-news.html,40,1588180026.0,SirT6,0.98,/r/sciences/comments/gad8sn/dr_anthony_fauci_says_data_from_remdesivir/,sciences,166187,2
"Dr. Jonas Salk volunteered himself and his entire family for a polio vaccine trial. He refused to patent the vaccine and never received financial compensation for his discovery. When asked who owned the vaccine he replied “Well, the people, I would say. There is no patent. Could you patent the sun?”",755,byjwj0,https://www.salk.edu/about/history-of-salk/jonas-salk/,33,1560084734.0,FillsYourNiche,0.98,/r/sciences/comments/byjwj0/dr_jonas_salk_volunteered_himself_and_his_entire/,sciences,166187,2
"The United States life expectancy has slightly declined in recent years, a reflection of increasingly common drug overdoses",759,e4h733,https://i.redd.it/xk4efuwss0241.jpg,31,1575205445.0,IJesusChrist,0.97,/r/sciences/comments/e4h733/the_united_states_life_expectancy_has_slightly/,sciences,166187,2
MRI footage of a world-class opera singer performing,762,ave9pi,https://gfycat.com/DigitalSpectacularFoxhound,24,1551279047.0,SirT6,0.98,/r/sciences/comments/ave9pi/mri_footage_of_a_worldclass_opera_singer/,sciences,166187,2
"Spider webs don’t rot easily because bacteria that would aid decomposition are unable to access the silk’s nitrogen, a nutrient the microbes need for growth and reproduction.",758,fym3hk,https://www.sciencenews.org/article/spider-webs-dont-rot-easily-scientists-may-have-figured-out-why,11,1586544829.0,FillsYourNiche,0.99,/r/sciences/comments/fym3hk/spider_webs_dont_rot_easily_because_bacteria_that/,sciences,166187,2
Puncture test from project to build better Army boots,756,fahndb,https://v.redd.it/gfoqlppisij41,15,1582832649.0,nist,0.93,/r/sciences/comments/fahndb/puncture_test_from_project_to_build_better_army/,sciences,166187,2
"ِAntarctic scientists have discovered an underground world of mollusks, sponges, and anemones deep in the Brunt Ice Shelf, the creatures have been living under an ice sheet measuring 490 feet (150 meters) thick for 50 years.",754,mf2pmz,https://www.reddit.com/gallery/mf2pmz,18,1616944474.0,AlbertDoublon12,0.99,/r/sciences/comments/mf2pmz/antarctic_scientists_have_discovered_an/,sciences,166187,2
NASA’s James Webb Space Telescope has captured the clearest view of this distant planet’s rings in more than 30 years.,750,xk6ovo,https://www.reddit.com/gallery/xk6ovo,23,1663771038.0,MistWeaver80,0.96,/r/sciences/comments/xk6ovo/nasas_james_webb_space_telescope_has_captured_the/,sciences,166187,2
"Covid-19 vaccine from Pfizer and BioNTech shows positive results: at day 28, all subjects who received 10 or 30 mg of the vaccine had SARS-CoV-2 neutralizing antibodies titers of 1.8-and 2.8-times, respectively, of a convalescent serum panel.",744,hj9yys,https://www.statnews.com/2020/07/01/covid-19-vaccine-from-pfizer-and-biontech-shows-positive-results,16,1593609433.0,SirT6,0.98,/r/sciences/comments/hj9yys/covid19_vaccine_from_pfizer_and_biontech_shows/,sciences,166187,2
*Pressure Associated with Dams & Reservoirs*,744,o7f5ca,https://v.redd.it/g6o3e3pnvb771,31,1624590450.0,Constructorsfeed,0.92,/r/sciences/comments/o7f5ca/pressure_associated_with_dams_reservoirs/,sciences,166187,2
Neurons immune surveillance system (microglia) hard at work,743,k1j3ox,https://v.redd.it/h24nxqnham161,15,1606410825.0,pollisa_85,0.99,/r/sciences/comments/k1j3ox/neurons_immune_surveillance_system_microglia_hard/,sciences,166187,2
This is basically how Neon lights work!,748,b6gub1,https://gfycat.com/generoustartaffenpinscher,32,1553766862.0,mtimetraveller,0.97,/r/sciences/comments/b6gub1/this_is_basically_how_neon_lights_work/,sciences,166187,2
"Nature adapting to urban environment: seagull enters store, peruses the chip aisle, makes off with a bag when it thinks no one is looking",739,btmmgs,https://gfycat.com/TemptingOfficialLarva,30,1558967421.0,SirT6,0.98,/r/sciences/comments/btmmgs/nature_adapting_to_urban_environment_seagull/,sciences,166187,2
Neutrophils hunt down and phagocyte pneumonia causing bacteria,734,fefbqn,https://v.redd.it/nu5akxtep2l41,12,1583509749.0,pollisa_85,0.99,/r/sciences/comments/fefbqn/neutrophils_hunt_down_and_phagocyte_pneumonia/,sciences,166187,2
"Gall aphids use their own bodily fluids to patch holes in their colony. If an invader pierces the gall, they lay down beads of a thick, milky fluid from their abdomens and don’t stop until they seal the breach. Some wring themselves dry until they are lifeless husks.",729,bekh98,https://gfycat.com/EverlastingJovialBlackbear,13,1555587357.0,SirT6,0.99,/r/sciences/comments/bekh98/gall_aphids_use_their_own_bodily_fluids_to_patch/,sciences,166187,2
"A paper argues that said masks don't work because if you cough through them on a petri dish, some viral RNA gets through. It has now been retracted because the authors didn't understand their own methodology and drew meaningless conclusions.",735,gv6gti,https://www.acpjournals.org/doi/10.7326/L20-0745,16,1591101103.0,SirT6,0.99,/r/sciences/comments/gv6gti/a_paper_argues_that_said_masks_dont_work_because/,sciences,166187,2
How 2 meters of DNA (6 billion nucleotides) fits inside the cell nucleus (5 μm wide). Each chromosome (colored) is confined to a discrete region. Active genetic regions (blue) are located towards the interior.,716,be71cc,https://gfycat.com/SpotlessOccasionalAmbushbug,13,1555503158.0,SirT6,0.98,/r/sciences/comments/be71cc/how_2_meters_of_dna_6_billion_nucleotides_fits/,sciences,166187,2
Sea snails emerge from sand to devour the body of a fish,716,avs0qi,https://gfycat.com/RealScholarlyCurassow,35,1551365995.0,SirT6,0.97,/r/sciences/comments/avs0qi/sea_snails_emerge_from_sand_to_devour_the_body_of/,sciences,166187,2
First helium ion microscope image of SARS-CoV-2. Credit: Bielefeld University/N. Frese,710,ld178o,https://i.redd.it/5uhjjaxmrlf61.jpg,24,1612506315.0,chromoscience,1.0,/r/sciences/comments/ld178o/first_helium_ion_microscope_image_of_sarscov2/,sciences,166187,2
Science Summary for last month,710,goguh0,https://i.imgur.com/2zDBbJq.jpg,21,1590143233.0,prototyperspective,0.99,/r/sciences/comments/goguh0/science_summary_for_last_month/,sciences,166187,2
Live cell response to COVID-19 infection imaged for the first time by Institut Pasteur in Paris,711,md1c4r,https://v.redd.it/9it3evgl37p61,25,1616687358.0,pollisa_85,0.99,/r/sciences/comments/md1c4r/live_cell_response_to_covid19_infection_imaged/,sciences,166187,2
"Immune cell that kills most cancers discovered by accident by British scientists; The cell expresses MR1, which in preclinical models, selectively targets cancerous cells, leaving healthy cells alone",712,eruw6x,https://www.nature.com/articles/s41590-019-0578-8.epdf?referrer_access_token=iPuQk-6FlRU7Qk7qbBLkhtRgN0jAjWel9jnR3ZoTv0NjOoBZR7tEtwlsa1xeSU1tSn9OqKp9tJ7vTk8p7vCmAQ8qq7tpdMDkkCOdHvdAnN49xW6X-XeBi6gqyGM3xYT8dkedMZCypj-TFzhNCGomCoo_SlMlW12mWlhHFh5MwQuk89wIDtA7gUz2dwarBLhzep_D90zyVJIGzDt-FQiu5uTncsH1R1bKVL-r8xi_7T-eedCdXvj2q3EtsYcpS8XhsgR6dNW6HAAui2viE977uTqIkwA2rhm7IUQNuMYml4prfpX6q33zV-FdChrDpCln&tracking_referrer=www.telegraph.co.uk,25,1579614372.0,IJesusChrist,0.99,/r/sciences/comments/eruw6x/immune_cell_that_kills_most_cancers_discovered_by/,sciences,166187,2
*Construction of foundation of longest & largest arch bridge in the world*,702,o8wpdi,https://v.redd.it/th3tcuqb3t771,20,1624799024.0,Constructorsfeed,0.94,/r/sciences/comments/o8wpdi/construction_of_foundation_of_longest_largest/,sciences,166187,2
New audio recordings show hospital kept vegetative patients on life support to boost the reported survival rates (allowing them to avoid scrutiny by federal regulators).,697,dhr2cu,https://www.propublica.org/article/audio-shows-hospital-kept-vegetative-patient-on-life-support-to-boost-survival-rates,15,1571062115.0,SirT6,0.99,/r/sciences/comments/dhr2cu/new_audio_recordings_show_hospital_kept/,sciences,166187,2
