title,score,id,url,num_comments,created,author,upvote_ratio,permalink,subreddit,subreddit_subscribers,depth
Tuscan Grand Prix circuit map with corner speeds,400,ipq8qp,https://i.redd.it/x7oubq5037m51.jpg,20,1599688947.0,JarrodIdeaGuru,0.99,/r/F1Technical/comments/ipq8qp/tuscan_grand_prix_circuit_map_with_corner_speeds/,F1Technical,221689,1
How Mercedes W13 is cooling the engine. Inlet under car. Thoughts?,399,tcst6m,https://i.redd.it/2xijbatn61n81.jpg,26,1647124965.0,Emergency_Leave_5761,0.96,/r/F1Technical/comments/tcst6m/how_mercedes_w13_is_cooling_the_engine_inlet/,F1Technical,221689,1
Cross-section of the 2013 Sauber C32 pedal assembly,396,legakt,https://i.redd.it/efj7590xrzf61.jpg,12,1612675903.0,SollarAce,1.0,/r/F1Technical/comments/legakt/crosssection_of_the_2013_sauber_c32_pedal_assembly/,F1Technical,221689,1
What are those spikes?,393,svp5w5,https://i.redd.it/4xwlpnrkzmi81.jpg,59,1645209706.0,FederalEngineer,0.99,/r/F1Technical/comments/svp5w5/what_are_those_spikes/,F1Technical,221689,1
"What would happen to Suzuka, if the chicane before the main straight was deleted ?",392,q3u1vs,https://i.redd.it/ztmctgig07s71.jpg,74,1633684231.0,TheRicardoRedish,0.96,/r/F1Technical/comments/q3u1vs/what_would_happen_to_suzuka_if_the_chicane_before/,F1Technical,221689,1
