title,score,id,url,num_comments,created,author,upvote_ratio,permalink,subreddit,subreddit_subscribers,depth
"10 years ago and our first family photo, it looked like we stole someones kid.",57431,a8ddgj,https://i.redd.it/zwkusd5dlo521.jpg,825,1545419925.0,Skissored,0.96,/r/blunderyears/comments/a8ddgj/10_years_ago_and_our_first_family_photo_it_looked/,blunderyears,851871,2
Hawaii wasn’t ready for my ice cold sister and I in 2003.,50291,cdi71b,https://i.imgur.com/9ABYNIY.jpg,919,1563201215.0,mrspetie,0.95,/r/blunderyears/comments/cdi71b/hawaii_wasnt_ready_for_my_ice_cold_sister_and_i/,blunderyears,851871,2
"It has been over half a year. Many of you have previously requested I repost these periodically. They seem to bring a smile to your face. Hope this makes your day a little better. I present, me as a kid",42151,c5orat,https://i.redd.it/cv2zoinnto631.jpg,380,1561549090.0,zwaymire,0.95,/r/blunderyears/comments/c5orat/it_has_been_over_half_a_year_many_of_you_have/,blunderyears,851871,2
"Many of you asked us to recreate our emo family photo, so we stole another kid.",31932,ek88ty,https://i.redd.it/feyk4jkx3w841.png,322,1578199652.0,Skissored,0.96,/r/blunderyears/comments/ek88ty/many_of_you_asked_us_to_recreate_our_emo_family/,blunderyears,851871,2
"My friends daughter found me in our junior high year book. And they laughed, and laughed..",28059,jr2ezi,https://i.redd.it/ym3u1d2t59y51.jpg,594,1604944272.0,dumbbelle,0.96,/r/blunderyears/comments/jr2ezi/my_friends_daughter_found_me_in_our_junior_high/,blunderyears,851871,2
"Not only did I take a mop to prom, I wore ICP face paint on school picture day in 2002",27134,7nuw62,https://i.redd.it/67qlv1md2v701.jpg,963,1514988967.0,thelemonx,0.91,/r/blunderyears/comments/7nuw62/not_only_did_i_take_a_mop_to_prom_i_wore_icp_face/,blunderyears,851871,2
"My mom calls this photo a family heirloom lol. 16 yrs ago, me (F 13) and my bf (M 13) at the Olive Garden",23049,kj7col,https://i.redd.it/26e7xy1vv1761.jpg,438,1608778813.0,dumbbelle,0.98,/r/blunderyears/comments/kj7col/my_mom_calls_this_photo_a_family_heirloom_lol_16/,blunderyears,851871,2
Titanic and iceberg - Halloween 1998,17758,gm95kf,https://i.imgur.com/gZJf0oF.jpg,253,1589832730.0,mrspetie,0.97,/r/blunderyears/comments/gm95kf/titanic_and_iceberg_halloween_1998/,blunderyears,851871,2
100% skateboarder,16956,c487ws,https://i.imgur.com/ABjJo4u.jpg,597,1561311186.0,I_play_high420,0.96,/r/blunderyears/comments/c487ws/100_skateboarder/,blunderyears,851871,2
I took a mop to the prom in 2004,15905,75qc21,https://i.redd.it/4o0irpgtc8rz.jpg,411,1507740436.0,thelemonx,0.97,/r/blunderyears/comments/75qc21/i_took_a_mop_to_the_prom_in_2004/,blunderyears,851871,2
"Every once in awhile, I just have to post these pictures of Bobby Hill and I, because they seem to bring people as much joy as they bring toward myself!",15607,9exvqh,https://i.redd.it/sylqhza6aml11.jpg,160,1536674986.0,zwaymire,0.96,/r/blunderyears/comments/9exvqh/every_once_in_awhile_i_just_have_to_post_these/,blunderyears,851871,2
98 vs 2020 I’m still 100% skateboarder,14047,j38r99,https://i.imgur.com/VGuWsGn.jpg,460,1601559627.0,I_play_high420,0.94,/r/blunderyears/comments/j38r99/98_vs_2020_im_still_100_skateboarder/,blunderyears,851871,2
