title,score,id,url,num_comments,created,author,upvote_ratio,permalink,subreddit,subreddit_subscribers,depth
"I know it’s not a lot, but this is my first day in 4 months not eating fast food at lunchtime!",30364,dber5u,https://i.redd.it/4t0kl71skrp31.jpg,623,1569863540.0,Nifteroni-and-Cheese,0.92,/r/MealPrepSunday/comments/dber5u/i_know_its_not_a_lot_but_this_is_my_first_day_in/,MealPrepSunday,2950654,2
My sister is coming home from heart surgery with a sodium restriction so I filled her freezer with homemade vegetarian comfort food,23587,awsnht,https://i.redd.it/xhdf5kolmvj21.jpg,433,1551606962.0,Thea_From_Juilliard,0.93,/r/MealPrepSunday/comments/awsnht/my_sister_is_coming_home_from_heart_surgery_with/,MealPrepSunday,2950654,2
I made some coffee bean cookies to go with my morning coffee!,19063,e58wwg,https://i.redd.it/31tthxtuhb241.jpg,259,1575334870.0,businessmoth,0.96,/r/MealPrepSunday/comments/e58wwg/i_made_some_coffee_bean_cookies_to_go_with_my/,MealPrepSunday,2950654,2
I did not make pasta salad.,17237,cd5nts,https://i.redd.it/bpwbf8ej0ba31.jpg,282,1563125327.0,shphunk,0.93,/r/MealPrepSunday/comments/cd5nts/i_did_not_make_pasta_salad/,MealPrepSunday,2950654,2
My cat likes to watch me meal prep.,14798,705mr2,https://i.redd.it/7qx2t1azaxlz.jpg,358,1505427493.0,sportyforty,0.93,/r/MealPrepSunday/comments/705mr2/my_cat_likes_to_watch_me_meal_prep/,MealPrepSunday,2950654,2
"Flight attendant meal prep for 17 days,coming home every 3 days to swap out.",14440,dcit08,https://i.redd.it/3owmg6dqt7q31.jpg,375,1570060262.0,LittleEwi,0.96,/r/MealPrepSunday/comments/dcit08/flight_attendant_meal_prep_for_17_dayscoming_home/,MealPrepSunday,2950654,2
10-meal freezer slow-cooker meal prep. Trying for the first time. Recipes & album in comments. Cat exploited for extra karma.,13093,742hvo,https://i.redd.it/g99r1t0jvnpz.jpg,245,1507056617.0,sportyforty,0.93,/r/MealPrepSunday/comments/742hvo/10meal_freezer_slowcooker_meal_prep_trying_for/,MealPrepSunday,2950654,2
$2 1k Calorie meal,12559,6nfyk9,https://i.redd.it/wd0c8o5her9z.jpg,949,1500125732.0,murder508,0.9,/r/MealPrepSunday/comments/6nfyk9/2_1k_calorie_meal/,MealPrepSunday,2950654,2
No need to complicate things,12342,m5mcy2,https://i.redd.it/hy12eifmg7n61.jpg,259,1615819910.0,mjomark,0.95,/r/MealPrepSunday/comments/m5mcy2/no_need_to_complicate_things/,MealPrepSunday,2950654,2
"I'm a high school senior with very limited time and I don't get off work until 11 5 nights a week, so I tried my hand at meal prepping breakfast, lunch, and dinner. Oatmeal apple bars, garden salad, sushi bowl, and chicken noodle soup for less than $20 :)",11797,j6bldn,https://i.redd.it/lyjdka1zyir51.jpg,352,1602012112.0,Tonks717817,0.95,/r/MealPrepSunday/comments/j6bldn/im_a_high_school_senior_with_very_limited_time/,MealPrepSunday,2950654,2
"Meal prep, you’re like, really pretty. Here’s the colorful fruit that went in this week’s supply of mason jar salads.",11641,8qn7qz,https://i.redd.it/mn6sbglgan311.jpg,290,1528841930.0,ThatDIYCouple,0.8,/r/MealPrepSunday/comments/8qn7qz/meal_prep_youre_like_really_pretty_heres_the/,MealPrepSunday,2950654,2
$1.75 Meal - I'm a thigh man .,11055,7swrmq,https://i.redd.it/vplmxpfhe8c01.jpg,529,1516893780.0,murder508,0.92,/r/MealPrepSunday/comments/7swrmq/175_meal_im_a_thigh_man/,MealPrepSunday,2950654,2
This week’s meal prep! Have lost 100 lbs eating like this. Details in comment.,10959,hhhxs0,https://i.redd.it/q55kuoipmo751.jpg,312,1593363662.0,ThatDIYCouple,0.97,/r/MealPrepSunday/comments/hhhxs0/this_weeks_meal_prep_have_lost_100_lbs_eating/,MealPrepSunday,2950654,2
"I officially have 5kg of Mac n’ Cheese made with Brie, Parmesan, and Cheddar! Now time to vacuum pack and freeze it for easy meals anytime!",10844,fk7y77,https://i.imgur.com/145sMMj.jpg,245,1584461727.0,Vulpixii,0.96,/r/MealPrepSunday/comments/fk7y77/i_officially_have_5kg_of_mac_n_cheese_made_with/,MealPrepSunday,2950654,2
"Meal Prep Inspiration - I meal prep with my 7 BFFs. It's epic, all this was $74 per family. Duuuuuude.....",10440,9jpta8,https://i.redd.it/znm6y6xb21p11.jpg,461,1538161609.0,feline1313,0.9,/r/MealPrepSunday/comments/9jpta8/meal_prep_inspiration_i_meal_prep_with_my_7_bffs/,MealPrepSunday,2950654,2
Meal prep for 8 families; $70 per family. Good times.,10334,b1x5sc,https://v.redd.it/cctcqcmbmjm21,276,1552769443.0,feline1313,0.97,/r/MealPrepSunday/comments/b1x5sc/meal_prep_for_8_families_70_per_family_good_times/,MealPrepSunday,2950654,2
In the break alone everyday with my meal preps like,10331,9kd9s9,https://i.redd.it/dwb3ngbw4ip11.jpg,239,1538368176.0,murder508,0.96,/r/MealPrepSunday/comments/9kd9s9/in_the_break_alone_everyday_with_my_meal_preps/,MealPrepSunday,2950654,2
DIY Just-Add-Hot-Water Instant Noodle Bowls: over a quart of chicken veggie ramen goodness per bowl at only 434 calories,10047,jmsjyl,https://i.redd.it/9uff2us09vw51.jpg,226,1604340009.0,Thea_From_Juilliard,0.98,/r/MealPrepSunday/comments/jmsjyl/diy_justaddhotwater_instant_noodle_bowls_over_a/,MealPrepSunday,2950654,2
Challenged myself to prep almost every week of 2021 and record it in my journal. No repeat meals! All recipes in the comments,9799,rr71tl,https://i.redd.it/x7lzwv106h881.jpg,295,1640780732.0,Thea_From_Juilliard,0.98,/r/MealPrepSunday/comments/rr71tl/challenged_myself_to_prep_almost_every_week_of/,MealPrepSunday,2950654,2
I'm a thigh guy,9417,9j2mgo,https://i.redd.it/8mg33n3c7lo11.jpg,156,1537969471.0,murder508,0.94,/r/MealPrepSunday/comments/9j2mgo/im_a_thigh_guy/,MealPrepSunday,2950654,2
Uncle Roger Approved Egg Fried Rice,9407,jccram,https://i.redd.it/njbwwv9keht51.jpg,175,1602864831.0,aspirefitnesswalnut,0.96,/r/MealPrepSunday/comments/jccram/uncle_roger_approved_egg_fried_rice/,MealPrepSunday,2950654,2
Just put together some lunchables for the week! Not pictured - little side cups of hummus for dipping.,9315,6qgx5u,https://i.redd.it/nca3jmiyupcz.jpg,253,1501414610.0,Cortadoo,0.93,/r/MealPrepSunday/comments/6qgx5u/just_put_together_some_lunchables_for_the_week/,MealPrepSunday,2950654,2
"Snack prep: frozen yogurt bark with berries, chocolate chips and coconut for 104 cals a piece",9217,bnoycp,https://i.redd.it/75ybhb5g8sx21.jpg,179,1557667757.0,Thea_From_Juilliard,0.97,/r/MealPrepSunday/comments/bnoycp/snack_prep_frozen_yogurt_bark_with_berries/,MealPrepSunday,2950654,2
Beef stew - $2.50 per serving,8718,7btscg,https://i.redd.it/9dmcwjjmrywz.jpg,248,1510239408.0,murder508,0.92,/r/MealPrepSunday/comments/7btscg/beef_stew_250_per_serving/,MealPrepSunday,2950654,2
I made some spinach puffs! What do you think?,8470,dgmbmv,https://i.redd.it/478unz8ymzr31.jpg,134,1570832824.0,businessmoth,0.97,/r/MealPrepSunday/comments/dgmbmv/i_made_some_spinach_puffs_what_do_you_think/,MealPrepSunday,2950654,2
Among Us Bento Boxes For the Week,8141,jtjhc3,https://i.redd.it/w4r22qiig1z51.jpg,78,1605286865.0,aspirefitnesswalnut,0.94,/r/MealPrepSunday/comments/jtjhc3/among_us_bento_boxes_for_the_week/,MealPrepSunday,2950654,2
"If you hate onions, may I suggest pumpkin spice cinnamon rolls for 144 calories each?",8004,dkjzkd,https://i.redd.it/iciwdsz2dpt31.jpg,214,1571580130.0,Thea_From_Juilliard,0.93,/r/MealPrepSunday/comments/dkjzkd/if_you_hate_onions_may_i_suggest_pumpkin_spice/,MealPrepSunday,2950654,2
"I made my ""adult lunchable"" keto-friendly!",7935,8rtnk9,https://i.redd.it/yxs0pyy5cm411.jpg,317,1529266241.0,Mitchell_Delgado,0.91,/r/MealPrepSunday/comments/8rtnk9/i_made_my_adult_lunchable_ketofriendly/,MealPrepSunday,2950654,2
This is my new favorite lunch prep- basically a grown-up Lunchable,7806,6s7obo,https://i.redd.it/m85fukgo3dez.jpg,301,1502131850.0,Mitchell_Delgado,0.92,/r/MealPrepSunday/comments/6s7obo/this_is_my_new_favorite_lunch_prep_basically_a/,MealPrepSunday,2950654,2
$1.80 Meal - Chicken thighs with roasted potatoes,7771,7z6tcp,https://i.redd.it/wp6cys60flh01.jpg,244,1519230584.0,murder508,0.93,/r/MealPrepSunday/comments/7z6tcp/180_meal_chicken_thighs_with_roasted_potatoes/,MealPrepSunday,2950654,2
$3 Sirloin steak bowl,7710,93qy63,https://i.redd.it/e5bo3hodmid11.jpg,160,1533143881.0,murder508,0.94,/r/MealPrepSunday/comments/93qy63/3_sirloin_steak_bowl/,MealPrepSunday,2950654,2
"Wife loves Panda Express but has Celiac Disease and can't eat anything there, so I made gluten free Fried Rice, Beijing Beef, and Mushroom Chicken",7422,cj25it,https://i.redd.it/k3kb7h4aa4d31.jpg,128,1564351548.0,shphunk,0.97,/r/MealPrepSunday/comments/cj25it/wife_loves_panda_express_but_has_celiac_disease/,MealPrepSunday,2950654,2
Baby due in 2 weeks. Prepped my ass off today!,7347,6tol88,https://i.redd.it/c26gx6m03rfz.jpg,220,1502737046.0,laskoriff,0.92,/r/MealPrepSunday/comments/6tol88/baby_due_in_2_weeks_prepped_my_ass_off_today/,MealPrepSunday,2950654,2
You know what else everybody likes ? Parfaits. - Donkey,7100,7pfb0u,https://i.redd.it/2doyz0x4j8901.jpg,170,1515587800.0,murder508,0.93,/r/MealPrepSunday/comments/7pfb0u/you_know_what_else_everybody_likes_parfaits_donkey/,MealPrepSunday,2950654,2
$10 Day - 2500 calories 190g protein,7014,6wcf4b,https://i.redd.it/ayfdrbyeiaiz.jpg,557,1503843873.0,murder508,0.93,/r/MealPrepSunday/comments/6wcf4b/10_day_2500_calories_190g_protein/,MealPrepSunday,2950654,2
Each week is better with Bento,6696,cdh4dc,https://i.redd.it/itljmk7hsga31.jpg,111,1563195341.0,Giraffe_Truther,0.98,/r/MealPrepSunday/comments/cdh4dc/each_week_is_better_with_bento/,MealPrepSunday,2950654,2
124 meals for $177 - about a month of meals with details in comments,6639,10q2l7i,https://i.redd.it/9n553dvxzffa1.jpg,424,1675180583.0,ArtisanGerard,0.97,/r/MealPrepSunday/comments/10q2l7i/124_meals_for_177_about_a_month_of_meals_with/,MealPrepSunday,2950654,2
Homemade Low-Cal Crunchwraps Supreme! Haven’t been this excited for workweek lunches in a bit (cross-section and ingredients pics in gallery),6317,iar6py,https://www.reddit.com/gallery/iar6py,131,1597579385.0,Thea_From_Juilliard,0.98,/r/MealPrepSunday/comments/iar6py/homemade_lowcal_crunchwraps_supreme_havent_been/,MealPrepSunday,2950654,2
“Italian Sub” lettuce wraps for a very satisfying 335 calories,6209,euo6do,https://i.redd.it/djogpljutbd41.jpg,117,1580133231.0,Thea_From_Juilliard,0.98,/r/MealPrepSunday/comments/euo6do/italian_sub_lettuce_wraps_for_a_very_satisfying/,MealPrepSunday,2950654,2
I’m having a baby on Tuesday! Meal prep to last at least 2 weeks.,6197,g4bsp0,https://i.redd.it/m4ls43vs9tt41.jpg,134,1587317997.0,laskoriff,0.96,/r/MealPrepSunday/comments/g4bsp0/im_having_a_baby_on_tuesday_meal_prep_to_last_at/,MealPrepSunday,2950654,2
High Protein Bento Box Meal Prep,6195,iumiky,https://i.redd.it/60lmp20afqn51.jpg,87,1600358945.0,aspirefitnesswalnut,0.98,/r/MealPrepSunday/comments/iumiky/high_protein_bento_box_meal_prep/,MealPrepSunday,2950654,2
Pilot and Flight Attendant Meal Prep!,6189,7y23ew,https://i.redd.it/4fuir4s68ng01.jpg,209,1518816660.0,LittleEwi,0.94,/r/MealPrepSunday/comments/7y23ew/pilot_and_flight_attendant_meal_prep/,MealPrepSunday,2950654,2
"Rainbow of baby food headed for the freezer! Beet, sweet potato, squash-carrot, pea-avocado, blueberry-yogurt, purple carrot",5849,eh7t4w,https://i.redd.it/zz69rr3dml741.jpg,162,1577636727.0,Thea_From_Juilliard,0.97,/r/MealPrepSunday/comments/eh7t4w/rainbow_of_baby_food_headed_for_the_freezer_beet/,MealPrepSunday,2950654,2
4 recipes in 4 hours. Set for the week!,5666,eknu1e,https://i.redd.it/p8ypw0sgr2941.jpg,123,1578280076.0,taliasara92,0.98,/r/MealPrepSunday/comments/eknu1e/4_recipes_in_4_hours_set_for_the_week/,MealPrepSunday,2950654,2
Bibimbap bowls for work lunches!,5519,czzwjl,https://i.redd.it/9k7b9gc3nrk31.jpg,134,1567685123.0,Giraffe_Truther,0.98,/r/MealPrepSunday/comments/czzwjl/bibimbap_bowls_for_work_lunches/,MealPrepSunday,2950654,2
"I know this sounds crazy, but hear me out: pasta-free onion “stuffed shells” casserole for 293 calories per cheesy serving",5495,dk4gan,https://i.redd.it/3poqd9zkcit31.jpg,226,1571495224.0,Thea_From_Juilliard,0.93,/r/MealPrepSunday/comments/dk4gan/i_know_this_sounds_crazy_but_hear_me_out/,MealPrepSunday,2950654,2
Teriyaki Chicken Onigiri For the Week,5457,k6nnlu,https://i.redd.it/5o0nkghi17361.jpg,96,1607097854.0,aspirefitnesswalnut,0.97,/r/MealPrepSunday/comments/k6nnlu/teriyaki_chicken_onigiri_for_the_week/,MealPrepSunday,2950654,2
"I'm going out of town for the week, but my wife will be well fed while I'm gone!",5342,6uwbaj,https://i.redd.it/onoo57ucvwgz.jpg,151,1503242915.0,Cortadoo,0.94,/r/MealPrepSunday/comments/6uwbaj/im_going_out_of_town_for_the_week_but_my_wife/,MealPrepSunday,2950654,2
"Breakfast ham, egg & cheese pretzel rolls!",5330,nyx9ku,https://www.reddit.com/gallery/nyx9ku,68,1623593818.0,Thea_From_Juilliard,0.98,/r/MealPrepSunday/comments/nyx9ku/breakfast_ham_egg_cheese_pretzel_rolls/,MealPrepSunday,2950654,2
A big batch of “all-the-crap-in-my-fridge” soup.,5246,fbzs7l,https://i.redd.it/jtydsvltb4k41.jpg,112,1583093361.0,MacBreeeezy,0.97,/r/MealPrepSunday/comments/fbzs7l/a_big_batch_of_allthecrapinmyfridge_soup/,MealPrepSunday,2950654,2
"Bacon, egg, cheese & broccoli-stuffed potato skins for breakfasts this week!",5228,kuf0x7,https://i.redd.it/two429w9iia61.jpg,82,1610287603.0,Thea_From_Juilliard,0.97,/r/MealPrepSunday/comments/kuf0x7/bacon_egg_cheese_broccolistuffed_potato_skins_for/,MealPrepSunday,2950654,2
Spicy Honey Garlic Chicken,5143,au0nsd,https://i.redd.it/ztajpy344ei21.jpg,89,1550959105.0,moremileage,0.95,/r/MealPrepSunday/comments/au0nsd/spicy_honey_garlic_chicken/,MealPrepSunday,2950655,2
Another year in the books —meal prepping breakfast and lunch (almost) every week! Details and recipes within,5132,zqpb4b,https://i.redd.it/uw4x4fo5p37a1.jpg,167,1671544890.0,Thea_From_Juilliard,0.97,/r/MealPrepSunday/comments/zqpb4b/another_year_in_the_books_meal_prepping_breakfast/,MealPrepSunday,2950655,2
134 meals for $189 - details in comments,5104,zkyhe5,https://www.reddit.com/gallery/zkyhe5,361,1670945438.0,ArtisanGerard,0.97,/r/MealPrepSunday/comments/zkyhe5/134_meals_for_189_details_in_comments/,MealPrepSunday,2950655,2
DIY Lunchables,5063,ejhvrr,https://i.redd.it/xd9ktpvbdl841.jpg,151,1578069525.0,moremileage,0.97,/r/MealPrepSunday/comments/ejhvrr/diy_lunchables/,MealPrepSunday,2950655,2
Healthier pumpkin spice whoopie pies for breakfast or snacks (91 calories each!),5016,d7t3yt,https://i.redd.it/wzhaybe5e6o31.jpg,66,1569171220.0,Thea_From_Juilliard,0.97,/r/MealPrepSunday/comments/d7t3yt/healthier_pumpkin_spice_whoopie_pies_for/,MealPrepSunday,2950655,2
"Lunch and dinner, I pack a week’s worth in mason jars every weekend. I’ve lost 90lbs and saved $1000s. Trick with the salad is to put the dressing on at work, and put all the juicy stuff at the bottom, then separate your greens with hardy cruciferous veggies like cabbage.",5004,8escp2,https://i.redd.it/yxr5rn1t11u01.jpg,242,1524650030.0,ThatDIYCouple,0.94,/r/MealPrepSunday/comments/8escp2/lunch_and_dinner_i_pack_a_weeks_worth_in_mason/,MealPrepSunday,2950655,2
Second attempt at making Steamed BBQ Pork Buns went well for my GF and I,5001,jt0ace,https://www.reddit.com/gallery/jt0ace,61,1605206380.0,Stepoo,0.98,/r/MealPrepSunday/comments/jt0ace/second_attempt_at_making_steamed_bbq_pork_buns/,MealPrepSunday,2950655,2
"I’m not counting calories. Right now, I’m just trying to get healthier food into my diet. 2021’s the year of change for the better :)",4947,kqflwa,https://i.redd.it/aepojz668d961.jpg,169,1609787823.0,AwkwardRainbow,0.98,/r/MealPrepSunday/comments/kqflwa/im_not_counting_calories_right_now_im_just_trying/,MealPrepSunday,2950655,2
Pasta-free chicken broccoli Alfredo stuffed onion “shells”,4952,nts7u4,https://i.redd.it/32rne24gvo371.jpg,89,1623004268.0,Thea_From_Juilliard,0.97,/r/MealPrepSunday/comments/nts7u4/pastafree_chicken_broccoli_alfredo_stuffed_onion/,MealPrepSunday,2950655,2
"Collard wraps were a success and great for preps since they don’t get soggy like tortillas. Chicken, bacon, avocado, cheese, mayo and veggies for 285 cals per wrap!",4946,bkx97p,https://i.redd.it/doqvxas21ew21.jpg,108,1557059937.0,Thea_From_Juilliard,0.98,/r/MealPrepSunday/comments/bkx97p/collard_wraps_were_a_success_and_great_for_preps/,MealPrepSunday,2950655,2
"8 hours of meal prep, done for the next two months!",4944,pa9cgx,https://i.redd.it/kqp4sjjte6j71.jpg,218,1629754330.0,ArtisanGerard,0.98,/r/MealPrepSunday/comments/pa9cgx/8_hours_of_meal_prep_done_for_the_next_two_months/,MealPrepSunday,2950655,2
Been prepping breakfast sandwiches to freeze and then heat at work or during ungodly hangovers.,4937,gaksc7,https://i.redd.it/aznnus1shuv41.jpg,140,1588204469.0,GarlicBreadBaby,0.98,/r/MealPrepSunday/comments/gaksc7/been_prepping_breakfast_sandwiches_to_freeze_and/,MealPrepSunday,2950655,2
Japanese Izakaya Style Meal Prep,4896,jjqti3,https://i.redd.it/vjc5gchb2vv51.jpg,84,1603901907.0,aspirefitnesswalnut,0.98,/r/MealPrepSunday/comments/jjqti3/japanese_izakaya_style_meal_prep/,MealPrepSunday,2950655,2
"Update: Three weeks in, still going strong. Big thank you to this community!",4865,dmj51k,https://i.redd.it/cqbv2xsiqiu31.png,88,1571935770.0,Nifteroni-and-Cheese,0.98,/r/MealPrepSunday/comments/dmj51k/update_three_weeks_in_still_going_strong_big/,MealPrepSunday,2950655,2
I heard we were sharing pasta salad :),4860,cche8u,https://i.imgur.com/N3lNcML.jpg,102,1562969340.0,Vulpixii,0.96,/r/MealPrepSunday/comments/cche8u/i_heard_we_were_sharing_pasta_salad/,MealPrepSunday,2950655,2
Japanese Beef Bowls For The Weekend,4835,l2qoah,https://i.redd.it/koi40kw1qwc61.jpg,84,1611331411.0,aspirefitnesswalnut,0.98,/r/MealPrepSunday/comments/l2qoah/japanese_beef_bowls_for_the_weekend/,MealPrepSunday,2950655,2
$1.80 Meal - Sweet and sour chicken,4800,7vq30x,https://i.redd.it/yk32btmiene01.jpg,131,1517947089.0,murder508,0.93,/r/MealPrepSunday/comments/7vq30x/180_meal_sweet_and_sour_chicken/,MealPrepSunday,2950655,2
"Working from home this week. Healthy nibbles next to my laptop! Humus, pepper, cucumber, cherry tomatoes, blueberries and cheese.",4728,ktqija,https://i.redd.it/c6rl7hae1ba61.jpg,112,1610197191.0,garden28,0.97,/r/MealPrepSunday/comments/ktqija/working_from_home_this_week_healthy_nibbles_next/,MealPrepSunday,2950655,2
"Made 10 low-cal “uncrustables” using low carb bread, PB2 and sugar free preserves. Store in freezer, thaws in lunchbox by breakfast time. Crusts will go into a breakfast casserole for next week!",4702,jrox2y,https://i.redd.it/zi15kx9r3gy51.jpg,142,1605028331.0,Thea_From_Juilliard,0.95,/r/MealPrepSunday/comments/jrox2y/made_10_lowcal_uncrustables_using_low_carb_bread/,MealPrepSunday,2950655,2
Homemade tomato soup with the cream sauce frozen to make it look pretty. Cheese sandwiches for toasting as a side.,4672,k77472,https://i.redd.it/1wldk6t6ad361.jpg,144,1607173418.0,garden28,0.97,/r/MealPrepSunday/comments/k77472/homemade_tomato_soup_with_the_cream_sauce_frozen/,MealPrepSunday,2950655,2
Christmas charkoots prep for board games day!,4667,a987fp,https://i.redd.it/6q34l3ng7a621.jpg,102,1545681605.0,elenuna,0.95,/r/MealPrepSunday/comments/a987fp/christmas_charkoots_prep_for_board_games_day/,MealPrepSunday,2950655,2
"The most American thing I’ve ever prepped: meatloaf muffins, green beans and mashed potato",4660,ecltcb,https://i.redd.it/sj68xn27rh541.jpg,180,1576718197.0,taliasara92,0.96,/r/MealPrepSunday/comments/ecltcb/the_most_american_thing_ive_ever_prepped_meatloaf/,MealPrepSunday,2950655,2
I swear there’s broccoli under the cheese,4650,hbg5c8,https://i.redd.it/po475vecno551.jpg,91,1592492179.0,MacBreeeezy,0.97,/r/MealPrepSunday/comments/hbg5c8/i_swear_theres_broccoli_under_the_cheese/,MealPrepSunday,2950655,2
115 meals for $131 - details in comments,4611,x2ff9l,https://www.reddit.com/gallery/x2ff9l,271,1661957037.0,ArtisanGerard,0.98,/r/MealPrepSunday/comments/x2ff9l/115_meals_for_131_details_in_comments/,MealPrepSunday,2950655,2
Japanese Beef Bowls w/ Miso Soup For Work This Week,4594,lhn1lg,https://i.redd.it/g8v6yqq4avg61.jpg,90,1613057349.0,aspirefitnesswalnut,0.98,/r/MealPrepSunday/comments/lhn1lg/japanese_beef_bowls_w_miso_soup_for_work_this_week/,MealPrepSunday,2950655,2
Kimbap Bento Box With Korean Side Dishes,4572,ixud0n,https://i.redd.it/x2k0tkbz2ro51.jpg,85,1600802770.0,aspirefitnesswalnut,0.98,/r/MealPrepSunday/comments/ixud0n/kimbap_bento_box_with_korean_side_dishes/,MealPrepSunday,2950654,2
Smoked Chicken Thighs for the Week,4507,ghyb1y,https://i.imgur.com/1CSkKRC.jpg,153,1589237102.0,Gibson1984,0.97,/r/MealPrepSunday/comments/ghyb1y/smoked_chicken_thighs_for_the_week/,MealPrepSunday,2950654,2
We had a massive snowstorm so I prepped a bunch of beef stew,4464,al2ed9,https://i.imgur.com/x4K8kTW.jpg,78,1548783278.0,Stepoo,0.97,/r/MealPrepSunday/comments/al2ed9/we_had_a_massive_snowstorm_so_i_prepped_a_bunch/,MealPrepSunday,2950654,2
Set it and ... forget it ! How I'm meal prepping today . 12 chicken thighs,4443,9va7fz,https://v.redd.it/wxhuclq654x11,207,1541685623.0,murder508,0.95,/r/MealPrepSunday/comments/9va7fz/set_it_and_forget_it_how_im_meal_prepping_today/,MealPrepSunday,2950654,2
Filipino Style Meal Prep - Chicken Adobo,4449,j824c5,https://i.redd.it/fllp70pai3s51.jpg,111,1602260742.0,aspirefitnesswalnut,0.98,/r/MealPrepSunday/comments/j824c5/filipino_style_meal_prep_chicken_adobo/,MealPrepSunday,2950654,2
"My friend is injured and out of work for a while, so I spent the weekend prepping some comfort food to surprise her with.",4424,gczpzn,https://i.redd.it/qpwfdci6nmw41.jpg,106,1588545279.0,GarlicBreadBaby,0.98,/r/MealPrepSunday/comments/gczpzn/my_friend_is_injured_and_out_of_work_for_a_while/,MealPrepSunday,2950654,2
Lazy curry buns,4408,l41tqe,https://i.redd.it/djipoixhxad61.jpg,77,1611503441.0,m0chila,0.96,/r/MealPrepSunday/comments/l41tqe/lazy_curry_buns/,MealPrepSunday,2950654,2
Who else takes the lazy way sometimes ?,4412,60njyr,https://i.reddituploads.com/fc26f4f909a443b096a0c47b078158d6?fit=max&h=1536&w=1536&s=a3e76634e09037fdc859663fea952b91,530,1490102757.0,murder508,0.9,/r/MealPrepSunday/comments/60njyr/who_else_takes_the_lazy_way_sometimes/,MealPrepSunday,2950654,2
"Chicken bowls for the rest of the week. Little bit of everything in there, all smoked on the pit :)",4389,cx0iwj,https://i.imgur.com/7cq3b7d.jpg,127,1567083245.0,Gibson1984,0.97,/r/MealPrepSunday/comments/cx0iwj/chicken_bowls_for_the_rest_of_the_week_little_bit/,MealPrepSunday,2950654,2
High Protein Dumplings For Next Week,4379,jp9gzo,https://i.redd.it/5wxu0e7eonx51.jpg,48,1604684171.0,aspirefitnesswalnut,0.99,/r/MealPrepSunday/comments/jp9gzo/high_protein_dumplings_for_next_week/,MealPrepSunday,2950654,2
So I know they’re not pretty/graceful in anyway but my pot stickers are done for the week! Going to leave them in the freezer until ready to eat. They are roughly 35 calories per sticker.,4374,c7twlc,https://i.redd.it/qnwmhukjmp731.jpg,168,1561994656.0,AwkwardRainbow,0.98,/r/MealPrepSunday/comments/c7twlc/so_i_know_theyre_not_prettygraceful_in_anyway_but/,MealPrepSunday,2950654,2
"Spinach Lasagna with cauliflower “noodles,” 276 calories for 1/4th the pan!",4363,hyuuly,https://i.redd.it/sr2s90b59fd51.jpg,73,1595865227.0,Thea_From_Juilliard,0.98,/r/MealPrepSunday/comments/hyuuly/spinach_lasagna_with_cauliflower_noodles_276/,MealPrepSunday,2950654,2
Made some personal bean dip cups,4348,7hz23a,https://i.redd.it/8negeob8vb201.jpg,121,1512577251.0,murder508,0.93,/r/MealPrepSunday/comments/7hz23a/made_some_personal_bean_dip_cups/,MealPrepSunday,2950654,2
Tried my hand at adult lunchables,4355,7x4f8v,https://i.redd.it/yyu391qvtuf01.jpg,172,1518472856.0,elenuna,0.96,/r/MealPrepSunday/comments/7x4f8v/tried_my_hand_at_adult_lunchables/,MealPrepSunday,2950654,2
Lazy all-day breakfast empanadas,4345,ebffdp,https://i.redd.it/k17ljwxo30541.jpg,63,1576504530.0,m0chila,0.98,/r/MealPrepSunday/comments/ebffdp/lazy_allday_breakfast_empanadas/,MealPrepSunday,2950654,2
107 meals for $198 - monthly meal prep details in comments,4290,rcm9nv,https://i.redd.it/91f9hp34vj481.jpg,204,1639070177.0,ArtisanGerard,0.98,/r/MealPrepSunday/comments/rcm9nv/107_meals_for_198_monthly_meal_prep_details_in/,MealPrepSunday,2950654,2
"Spent less than $20 on groceries this week, got some good stuff for online school!",4277,l0lnsc,https://i.redd.it/sczzy75k1bc61.jpg,182,1611068931.0,Tonks717817,0.98,/r/MealPrepSunday/comments/l0lnsc/spent_less_than_20_on_groceries_this_week_got/,MealPrepSunday,2950654,2
Not my proudest moment - but i was in a hurry,4271,xdzmcq,https://i.redd.it/o44iit579tn91.jpg,189,1663155354.0,mjomark,0.94,/r/MealPrepSunday/comments/xdzmcq/not_my_proudest_moment_but_i_was_in_a_hurry/,MealPrepSunday,2950654,2
89 meals for $134 - details in comments,4253,snmne9,https://www.reddit.com/gallery/snmne9,234,1644333479.0,ArtisanGerard,0.98,/r/MealPrepSunday/comments/snmne9/89_meals_for_134_details_in_comments/,MealPrepSunday,2950654,2
$2 Meal - I love grilled chicken thighs!,4242,8gih6i,https://i.redd.it/w5vkmeansgv01.jpg,193,1525276511.0,murder508,0.95,/r/MealPrepSunday/comments/8gih6i/2_meal_i_love_grilled_chicken_thighs/,MealPrepSunday,2950654,2
