title,score,id,url,num_comments,created,author,upvote_ratio,permalink,subreddit,subreddit_subscribers,depth
"The top two most upvoted comments get a state. (Day 15: The Incredibles hide out in northern Alaska, and Idaho joins part in the questioning of Montana.)",976,wowysh,https://i.redd.it/j5xkreca2vh91.jpg,223,1660562150.0,Living_Murphys_Law,0.96,/r/ShittyMapPorn/comments/wowysh/the_top_two_most_upvoted_comments_get_a_state_day/,ShittyMapPorn,91824,2
"Few people know, but every country’s borders are actually shaped after the country’s first letter. Here are four of the most uncanny examples.",966,zbl8au,https://i.redd.it/f8gdqnhicr3a1.jpg,29,1670087811.0,NoNo_Cilantro,0.99,/r/ShittyMapPorn/comments/zbl8au/few_people_know_but_every_countrys_borders_are/,ShittyMapPorn,91824,2
"The top two upvoted comments get a state. (Day 7: Classic video games in Texas, and Indiana is moving outwards.)",958,wikbtf,https://i.redd.it/zb02jlngnbg91.jpg,235,1659891289.0,Living_Murphys_Law,0.96,/r/ShittyMapPorn/comments/wikbtf/the_top_two_upvoted_comments_get_a_state_day_7/,ShittyMapPorn,91824,2
ok...,953,106y218,https://i.redd.it/zygxjlym4yaa1.jpg,133,1673220846.0,Maps_weird_WHAT,0.98,/r/ShittyMapPorn/comments/106y218/ok/,ShittyMapPorn,91824,2
Countries where I shit my pants,950,qjogbn,https://i.redd.it/inm3b75a4sw71.png,33,1635683155.0,u_god_gud,0.98,/r/ShittyMapPorn/comments/qjogbn/countries_where_i_shit_my_pants/,ShittyMapPorn,91824,2
What the-,941,qbnrfm,https://i.redd.it/jglhy65hrhu71.jpg,48,1634686082.0,HenriGL,0.99,/r/ShittyMapPorn/comments/qbnrfm/what_the/,ShittyMapPorn,91824,2
Map of the earth if the earth was a bear,939,37049v,http://i.imgur.com/CNh8iPQ.jpg,17,1432400014.0,xcrissxcrossx,0.96,/r/ShittyMapPorn/comments/37049v/map_of_the_earth_if_the_earth_was_a_bear/,ShittyMapPorn,91824,2
how to get from the UK to France,932,zqayv0,https://i.redd.it/echd19yj407a1.png,18,1671501644.0,Maps_weird_WHAT,0.98,/r/ShittyMapPorn/comments/zqayv0/how_to_get_from_the_uk_to_france/,ShittyMapPorn,91824,2
"Are you safe from the ""people"" of the isle of Sheppy.",942,vxoirv,https://i.redd.it/c8datyb308b91.jpg,20,1657667857.0,Ratman23445,0.98,/r/ShittyMapPorn/comments/vxoirv/are_you_safe_from_the_people_of_the_isle_of_sheppy/,ShittyMapPorn,91824,2
98% of Americans don't know about this Country,928,yk1vl6,https://i.redd.it/z2o905co6kx91.png,158,1667386015.0,meloon_man,0.97,/r/ShittyMapPorn/comments/yk1vl6/98_of_americans_dont_know_about_this_country/,ShittyMapPorn,91824,2
The most voted country will gain half of each of their bordering countries' land. Day 2 - San Marino wins taking half of Italy,922,w8vtxd,https://i.redd.it/vkvx78bgezd91.png,197,1658871305.0,GarunixReborn,0.92,/r/ShittyMapPorn/comments/w8vtxd/the_most_voted_country_will_gain_half_of_each_of/,ShittyMapPorn,91824,2
map of europe but but bu.. it was right here,918,zioaao,https://i.redd.it/geghtlg4595a1.png,18,1670757197.0,MajestroCZ,0.98,/r/ShittyMapPorn/comments/zioaao/map_of_europe_but_but_bu_it_was_right_here/,ShittyMapPorn,91824,2
"WWI, according to PragerU",922,u120gb,https://i.redd.it/i330gwlcqus81.png,66,1649661941.0,Shte_te_izpapkam,0.97,/r/ShittyMapPorn/comments/u120gb/wwi_according_to_prageru/,ShittyMapPorn,91824,2
Day 2 of changing the map of Europe based on the top comment,911,yv8iao,https://i.redd.it/hr61uonooyz91.png,280,1668451278.0,PixelSteel,0.92,/r/ShittyMapPorn/comments/yv8iao/day_2_of_changing_the_map_of_europe_based_on_the/,ShittyMapPorn,91824,2
"Map of Earth But 800,000,000 People Are Missing 😳",898,pc1irt,https://i.redd.it/pcg4mpz4ypj71.png,74,1629990861.0,burgerking_foot,0.95,/r/ShittyMapPorn/comments/pc1irt/map_of_earth_but_800000000_people_are_missing/,ShittyMapPorn,91824,2
Are you closer to Georgia or Georgia?,892,ufmpvd,https://i.redd.it/ey689bfq2rw81.jpg,45,1651361056.0,West_Sector_666,0.98,/r/ShittyMapPorn/comments/ufmpvd/are_you_closer_to_georgia_or_georgia/,ShittyMapPorn,91824,2
WTF map Simpsons,873,z4fzos,https://i.redd.it/n41szx17p52a1.jpg,31,1669389876.0,Puzzleheaded-Lab1028,0.99,/r/ShittyMapPorn/comments/z4fzos/wtf_map_simpsons/,ShittyMapPorn,91824,2
I've tracked all of the counties I've visited in the last 2 years!,880,p2ltd3,https://i.redd.it/qj0vqdbeksg71.jpg,37,1628715006.0,burgerking_foot,0.99,/r/ShittyMapPorn/comments/p2ltd3/ive_tracked_all_of_the_counties_ive_visited_in/,ShittyMapPorn,91824,2
"Europe, but the 2 top voted comments create countries everyday day 18: New New Zealand gets even newer, and the earlier separated Swiss cantons form the Holey Lands",869,wihu1r,https://i.redd.it/lf20wcs44bg91.jpg,144,1659884777.0,ABigOne77,0.93,/r/ShittyMapPorn/comments/wihu1r/europe_but_the_2_top_voted_comments_create/,ShittyMapPorn,91824,2
A map of the U.S but Florida likes pasta,845,yut5y2,https://i.redd.it/txdwss3cqvz91.jpg,13,1668415500.0,I_sellkids_organs,0.98,/r/ShittyMapPorn/comments/yut5y2/a_map_of_the_us_but_florida_likes_pasta/,ShittyMapPorn,91824,2
"Europe, but the top voted comment adds a country everyday day 8: Estonia can't into Nordics since it's part of the better Balkans now",845,w9htif,https://i.redd.it/q54xzbdwq4e91.jpg,188,1658935989.0,ABigOne77,0.95,/r/ShittyMapPorn/comments/w9htif/europe_but_the_top_voted_comment_adds_a_country/,ShittyMapPorn,91824,2
"As an American, Here Is How I See Australia",842,10mwedd,https://i.redd.it/nc1n1i9mbnea1.jpg,46,1674854388.0,Traditional-Rock9220,0.98,/r/ShittyMapPorn/comments/10mwedd/as_an_american_here_is_how_i_see_australia/,ShittyMapPorn,91824,2
"Drew this World Map from memory, guess where I'm from !",837,yxr055,https://i.redd.it/3bo84qqqoi0a1.png,126,1668693434.0,RyanH090,0.97,/r/ShittyMapPorn/comments/yxr055/drew_this_world_map_from_memory_guess_where_im/,ShittyMapPorn,91824,2
The key doesn’t even explain what the colors mean,836,zt7sy7,https://i.redd.it/cgyo7deqlf7a1.png,68,1671774798.0,ijazat,0.96,/r/ShittyMapPorn/comments/zt7sy7/the_key_doesnt_even_explain_what_the_colors_mean/,ShittyMapPorn,91824,2
reverse mercator,821,10ceqzr,https://i.redd.it/28q5nuobm7ca1.jpg,61,1673771605.0,Mightgaming6,0.99,/r/ShittyMapPorn/comments/10ceqzr/reverse_mercator/,ShittyMapPorn,91824,2
World map according to fish,809,z5ka8l,https://i.redd.it/n06tqfkajd2a1.jpg,17,1669502747.0,saturnX77,0.99,/r/ShittyMapPorn/comments/z5ka8l/world_map_according_to_fish/,ShittyMapPorn,91824,2
Shitty people map,807,uc80jc,https://i.redd.it/7kxyckzu6uv81.jpg,29,1650962916.0,Wieg0rz,0.98,/r/ShittyMapPorn/comments/uc80jc/shitty_people_map/,ShittyMapPorn,91824,2
What if it was all just a dream?,810,rpospm,https://i.redd.it/oo06c2f8j3881.jpg,76,1640615686.0,1875ojofC,0.98,/r/ShittyMapPorn/comments/rpospm/what_if_it_was_all_just_a_dream/,ShittyMapPorn,91824,2
AI generated map of Europe,807,v9sh42,https://i.redd.it/tm88ob414y491.png,34,1654933085.0,Racingamer145,0.99,/r/ShittyMapPorn/comments/v9sh42/ai_generated_map_of_europe/,ShittyMapPorn,91824,2
Nice——->Brest,801,y3h71o,https://i.redd.it/bwwoowrbkot91.jpg,18,1665713640.0,hiritomo,0.99,/r/ShittyMapPorn/comments/y3h71o/nicebrest/,ShittyMapPorn,91824,2
The most voted country will gain half of each of their bordering countries' land. Day 3 - Liechtenstein and Vatican City win.,793,w9ujp4,https://i.redd.it/0k0nhgk1c7e91.png,245,1658967320.0,GarunixReborn,0.92,/r/ShittyMapPorn/comments/w9ujp4/the_most_voted_country_will_gain_half_of_each_of/,ShittyMapPorn,91824,2
did you know that 98% of American people live in the red????,774,yfo9ch,https://i.redd.it/2marnpncblw91.png,91,1666963846.0,Maps_weird_WHAT,0.97,/r/ShittyMapPorn/comments/yfo9ch/did_you_know_that_98_of_american_people_live_in/,ShittyMapPorn,91824,2
Map of the world but I removed 4 islands,769,sm5puu,https://i.redd.it/yqhd54q2p9g81.png,131,1644177077.0,Ratman23445,0.94,/r/ShittyMapPorn/comments/sm5puu/map_of_the_world_but_i_removed_4_islands/,ShittyMapPorn,91824,2
"You ate turkey, I ate Türkiye, we are not the same.",764,z45bfe,https://i.redd.it/lxgwoo0wt22a1.jpg,13,1669355135.0,Mightgaming6,0.99,/r/ShittyMapPorn/comments/z45bfe/you_ate_turkey_i_ate_türkiye_we_are_not_the_same/,ShittyMapPorn,91824,2
T-Rex map,737,yncx9f,https://i.redd.it/znjzsbjtg8y91.jpg,3,1667697988.0,saturnX77,0.99,/r/ShittyMapPorn/comments/yncx9f/trex_map/,ShittyMapPorn,91824,2
"Ah yes, Crimea",740,u7d26k,https://i.redd.it/l4btmdgicju81.jpg,23,1650395794.0,Shte_te_izpapkam,0.99,/r/ShittyMapPorn/comments/u7d26k/ah_yes_crimea/,ShittyMapPorn,91824,2
"The longer you look at it, the worse it gets",735,11tg5tw,https://i.redd.it/y9cany1ni9oa1.png,59,1679024758.0,1875ojofC,0.98,/r/ShittyMapPorn/comments/11tg5tw/the_longer_you_look_at_it_the_worse_it_gets/,ShittyMapPorn,91824,2
Ideal borders of Europe,739,u1y2bt,https://i.redd.it/715bv7kne3t81.png,19,1649766955.0,Ratman23445,0.97,/r/ShittyMapPorn/comments/u1y2bt/ideal_borders_of_europe/,ShittyMapPorn,91824,2
