title,score,id,url,num_comments,created,author,upvote_ratio,permalink,subreddit,subreddit_subscribers,depth
Don’t just blame Trump for quitting the Paris deal — blame the Republican Party,1002,6eruux,https://www.vox.com/2017/6/1/15726726/trump-paris-climate-agreement-republicans,63,1496373088.0,bobbelcher,0.82,/r/uspolitics/comments/6eruux/dont_just_blame_trump_for_quitting_the_paris_deal/,uspolitics,28979,2
Study Finds More COVID-19 Cases Among Viewers Of Fox News Host Who Downplayed The Pandemic,339,gbimwa,https://www.wbez.org/amp/stories/study-viewers-of-a-fox-news-host-who-downplayed-the-pandemic-were-more-likely-to-get-covid-19/83dffd03-6013-47c8-b012-0b1cc5377e18?utm_campaign=Web-Share&utm_medium=referral&utm_source=twitter&__twitter_impression=true,15,1588341735.0,bobbelcher,0.97,/r/uspolitics/comments/gbimwa/study_finds_more_covid19_cases_among_viewers_of/,uspolitics,28979,2
"Speaker of the House Paul Ryan (R-WI): ""We got to a point that our Air Force pilots were going to museums to find spare parts over the last eight years"" under Barack Obama. | PANTS ON FIRE!",334,6akh13,http://www.politifact.com/wisconsin/statements/2017/may/11/paul-ryan/paul-ryans-pants-fire-claim-air-force-pilots-force/,34,1494513091.0,bobbelcher,0.86,/r/uspolitics/comments/6akh13/speaker_of_the_house_paul_ryan_rwi_we_got_to_a/,uspolitics,28979,2
Bernie Sanders: GOP health care plan gives wealthiest a $275 billion tax break | MOSTLY TRUE,309,5yhrza,http://www.politifact.com/truth-o-meter/statements/2017/mar/09/bernie-s/sanders-gop-health-care-plan-gives-wealthiest-275-/,31,1489093592.0,bobbelcher,0.83,/r/uspolitics/comments/5yhrza/bernie_sanders_gop_health_care_plan_gives/,uspolitics,28979,2
Trump's Approval Rating Tumbles To All-Time Low In Latest Gallup Poll,300,5tj8x6,http://www.politicususa.com/2017/02/11/trump-approval-rating-tumbles-all-time-latest-gallup-poll.html,43,1486868175.0,pheonix200,0.77,/r/uspolitics/comments/5tj8x6/trumps_approval_rating_tumbles_to_alltime_low_in/,uspolitics,28979,2
"Sean Spicer says Paul Manafort ""played a very limited role"" in the Trump presidential campaign. | FALSE",251,60xu76,http://www.politifact.com/truth-o-meter/statements/2017/mar/22/sean-spicer/sean-spicers-false-claim-paul-manafort-played-mino/,6,1490220735.0,bobbelcher,0.76,/r/uspolitics/comments/60xu76/sean_spicer_says_paul_manafort_played_a_very/,uspolitics,28979,2
Man dies in front of 11-year-old daughter at US border detention camp,236,cl7j4e,https://news.yahoo.com/man-dies-front-11-old-082637579.html,19,1564768614.0,HenryCorp,0.97,/r/uspolitics/comments/cl7j4e/man_dies_in_front_of_11yearold_daughter_at_us/,uspolitics,28979,2
'The Guy Won't Pay': Four Top Law Firms Declined WH Request To Defend Trump,231,6fmas1,http://politicaldig.com/the-guy-wont-pay-four-top-law-firms-declined-wh-request-to-defend-trump/,9,1496761175.0,pheonix200,0.86,/r/uspolitics/comments/6fmas1/the_guy_wont_pay_four_top_law_firms_declined_wh/,uspolitics,28979,2
Rudy Giuliani caught traveling after telling Fulton County DA he can't travel,227,wkx1n7,https://www.msn.com/en-us/travel/news/rudy-giuliani-caught-traveling-after-telling-fulton-county-da-he-can-t-travel/ar-AA10ubBs?ocid=msedgntp&cvid=0c7e22fbc4a84ae2abbb2ecb41c4e3fe,33,1660136956.0,northstardim,0.98,/r/uspolitics/comments/wkx1n7/rudy_giuliani_caught_traveling_after_telling/,uspolitics,28979,2
"If it were Biden rather than Trump who got the Coronavirus, Trump would now be talking nonstop about how Biden is too frail to be President",223,j4h0tm,https://www.reddit.com/r/uspolitics/comments/j4h0tm/if_it_were_biden_rather_than_trump_who_got_the/,29,1601739292.0,SamDemosthenes,0.98,/r/uspolitics/comments/j4h0tm/if_it_were_biden_rather_than_trump_who_got_the/,uspolitics,28979,2
Louis DeJoy Can Be Fired As Biden Now Has A Majority On Postal Service Board,220,yulc8z,https://www.politicususa.com/2022/05/13/louis-dejoy-postal-service-board.html,20,1668390061.0,realplayer16,0.98,/r/uspolitics/comments/yulc8z/louis_dejoy_can_be_fired_as_biden_now_has_a/,uspolitics,28979,2
"Please make this go viral. I am begging you. Police and National Guard patrolling neighborhood and shooting civilians on their own property. Make America see this, I beg you. [Minneapolis]",221,gtz5wo,https://streamable.com/u2jzoo,26,1590932250.0,CaptainSkull2030,0.96,/r/uspolitics/comments/gtz5wo/please_make_this_go_viral_i_am_begging_you_police/,uspolitics,28979,2
Trump Supporter Arrested For Requesting Absentee Ballot For Dead Mother,213,jt4af2,https://www.huffingtonpost.co.uk/entry/-trump-supporter-arrested-voter-fraud-pennsylvania_n_5f91e43ec5b61c185f4848de?ri18n=true,15,1605218517.0,tyw7,0.97,/r/uspolitics/comments/jt4af2/trump_supporter_arrested_for_requesting_absentee/,uspolitics,28979,2
Revealed: Four Supreme Court justices attended right-wing gala — risking the credibility of the court,203,ys9t87,https://www.msn.com/en-us/news/politics/revealed-four-supreme-court-justices-attended-right-wing-gala-risking-the-credibility-of-the-court/ar-AA13YJH1?ocid=msedgntp&cvid=f7687463c0064cce9f33e494ceeee636,107,1668171653.0,northstardim,0.96,/r/uspolitics/comments/ys9t87/revealed_four_supreme_court_justices_attended/,uspolitics,28979,2
Trump’s Kentucky Campaign Chair Pleads Guilty to Child Sex Trafficking,199,cpv83g,https://gritpost.com/trump-campaign-chair-trafficking/,39,1565712421.0,stankmanly,0.96,/r/uspolitics/comments/cpv83g/trumps_kentucky_campaign_chair_pleads_guilty_to/,uspolitics,28979,2
'We have the receipts': Analysis reveals $170 million in corporate gifts to GOP lawmakers who voted to overturn Biden win,195,kx63mp,https://www.rawstory.com/overturn-biden/,10,1610632669.0,KB_Sez,0.99,/r/uspolitics/comments/kx63mp/we_have_the_receipts_analysis_reveals_170_million/,uspolitics,28979,2
"Strikes erupt as US essential workers demand protection amid pandemic: American Apparel clothing plant, Truckers, Arby’s, Uber, and McDonalds.",195,gmp2fw,https://www.theguardian.com/world/2020/may/19/strikes-erupt-us-essential-workers-demand-better-protection-amid-pandemic,20,1589896718.0,Projectrage,0.99,/r/uspolitics/comments/gmp2fw/strikes_erupt_as_us_essential_workers_demand/,uspolitics,28979,2
"Trump, Who Made it Easier for Mentally Ill People To Buy Guns, Blames Mental Health Issues for Florida Shooting",189,7xqefs,https://www.motherjones.com/politics/2018/02/trump-who-made-it-easier-for-mentally-ill-people-to-buy-guns-blames-mental-health-issues-for-florida-shooting/,55,1518702008.0,bobbelcher,0.85,/r/uspolitics/comments/7xqefs/trump_who_made_it_easier_for_mentally_ill_people/,uspolitics,28979,2
"Fox News cuts away from Trump's Press Secretary, says it can't air ""false claims"" in good conscience",187,jr7xvw,https://www.newsweek.com/fox-news-cuts-away-trumps-press-secretary-says-it-cant-air-false-claims-good-conscience-1546155,33,1604960719.0,realplayer16,0.96,/r/uspolitics/comments/jr7xvw/fox_news_cuts_away_from_trumps_press_secretary/,uspolitics,28979,2
Republican Congresswoman Diane Black isn't Sure If Her $75 Million Fortune Qualifies as 'Rich',192,79gx0y,https://deepstatenation.com/this-republican-congresswoman-isnt-sure-if-her-75-million-fortune-qualifies-as-rich/,10,1509289188.0,HenryCorp,0.86,/r/uspolitics/comments/79gx0y/republican_congresswoman_diane_black_isnt_sure_if/,uspolitics,28979,2
"Robert Reich: ""Your reminder that Amy Coney Barrett was nominated by an impeached president who lost the popular vote by 3 million, and will be confirmed by GOP senators representing 11 million fewer Americans than their Democratic colleagues — after Obama's pick couldn't even get a vote.""",184,jecajv,https://twitter.com/RBReich/status/1316803657761845248,11,1603146030.0,shallah,0.97,/r/uspolitics/comments/jecajv/robert_reich_your_reminder_that_amy_coney_barrett/,uspolitics,28979,2
Biden mocks ‘socialist Republicans’ wanting funds they voted against,185,xypwrj,https://www.independent.co.uk/tv/us-news/joe-biden-socialist-republicans-funds-b2198208.html,29,1665226825.0,Pessimist2020,0.98,/r/uspolitics/comments/xypwrj/biden_mocks_socialist_republicans_wanting_funds/,uspolitics,28979,2
Black woman got 5 years for voting illegally. This white male judge got probation for rigging his election. In the same county.,184,8fz4g9,http://www.star-telegram.com/news/politics-government/election/article209641279.html,13,1525091882.0,HenryCorp,0.9,/r/uspolitics/comments/8fz4g9/black_woman_got_5_years_for_voting_illegally_this/,uspolitics,28979,2
"Sen. Ted Cruz, R-Texas: ""I have consistently opposed shutdowns."" | PANTS ON FIRE!",181,7sblww,http://www.politifact.com/truth-o-meter/statements/2018/jan/22/ted-cruz/ted-cruz-says-hes-opposed-shutdowns-he-hasnt-alway/,8,1516678538.0,bobbelcher,0.9,/r/uspolitics/comments/7sblww/sen_ted_cruz_rtexas_i_have_consistently_opposed/,uspolitics,28979,2
"Alex Jones Transferred Over $18 Million to Shell Companies to Hide Assets From Sandy Hook Victims, Court Filing Alleges",177,tzxpc7,https://www.msn.com/en-us/news/us/alex-jones-transferred-over-18-million-to-shell-companies-to-hide-assets-from-sandy-hook-victims-court-filing-alleges/ar-AAW1ap4,21,1649524480.0,northstardim,0.98,/r/uspolitics/comments/tzxpc7/alex_jones_transferred_over_18_million_to_shell/,uspolitics,28979,2
The biggest loser in the US midterms? Donald Trump,172,yqga5k,https://www.independent.co.uk/voices/midterm-elections-donald-trump-desantis-red-wave-b2221177.html,43,1667993462.0,Pessimist2020,0.95,/r/uspolitics/comments/yqga5k/the_biggest_loser_in_the_us_midterms_donald_trump/,uspolitics,28979,2
Lawyers Litigating for Trump Suddenly Remember Their Licenses Are on the Line If They Lie to a Judge,174,jsf4nv,https://lawandcrime.com/2020-election/lawyers-litigating-for-trump-suddenly-remember-their-licenses-are-on-the-line-if-they-lie-to-a-judge/,75,1605123793.0,bobbelcher,0.97,/r/uspolitics/comments/jsf4nv/lawyers_litigating_for_trump_suddenly_remember/,uspolitics,28979,2
"Alexandria Ocasio-Cortez calls on Cruz, Hawley to resign, or Senate to remove them",178,ksn2n5,https://www.newsweek.com/alexandria-ocasio-cortez-calls-cruz-hawley-resign-senate-remove-them-1559808,11,1610054396.0,DonaldWillKillUsAll,0.97,/r/uspolitics/comments/ksn2n5/alexandria_ocasiocortez_calls_on_cruz_hawley_to/,uspolitics,28979,2
We Crunched the Numbers: Police — Not Protesters — Are Overwhelmingly Responsible for Attacking Journalists,172,gwxlsh,https://theintercept.com/2020/06/04/journalists-attacked-police-george-floyd-protests/,3,1591330756.0,bobbelcher,0.99,/r/uspolitics/comments/gwxlsh/we_crunched_the_numbers_police_not_protesters_are/,uspolitics,28979,2
"Joe Biden takes all 5 votes in tiny township that is one of the first to announce results on Election Day - trump shut out in Dixville Notch, New Hampshire (pop 12), which gave him 4 votes in 2016.",175,jn7x1y,https://www.cnn.com/2020/11/02/politics/dixville-notch-2020-results/index.html,16,1604398786.0,Cinemaphreak,0.98,/r/uspolitics/comments/jn7x1y/joe_biden_takes_all_5_votes_in_tiny_township_that/,uspolitics,28979,2
Ex-FBI Officials Warn That Trump Could Easily Use New FBI Director To Thwart Russia Probe,171,6acebp,http://www.politicususa.com/2017/05/09/ex-fbi-officials-warn-trump-easily-fbi-director-thwart-russia-probe.html,16,1494418734.0,pheonix200,0.86,/r/uspolitics/comments/6acebp/exfbi_officials_warn_that_trump_could_easily_use/,uspolitics,28979,2
"Keith Ellison: ""About three-quarters of (Syrian refugees) are women and children. A full third of them are kids under 12 years old. | TRUE",175,5rrjr3,http://www.politifact.com/truth-o-meter/statements/2017/feb/02/keith-ellison/rep-keith-ellison-correct-demographic-overview-syr/,26,1486091773.0,bobbelcher,0.73,/r/uspolitics/comments/5rrjr3/keith_ellison_about_threequarters_of_syrian/,uspolitics,28979,2
Elizabeth Warren says the millions in bonuses Silicon Valley Bank executives took home last year should be recovered by regulators: 'We should claw all that back',167,11r42wq,https://www.msn.com/en-us/money/companies/elizabeth-warren-says-the-millions-in-bonuses-silicon-valley-bank-executives-took-home-last-year-should-be-recovered-by-regulators-we-should-claw-all-that-back/ar-AA18AohV?ocid=msedgntp&cvid=baaa7700d2104696a4d3650d224312d8&ei=43,13,1678794776.0,northstardim,0.99,/r/uspolitics/comments/11r42wq/elizabeth_warren_says_the_millions_in_bonuses/,uspolitics,28979,2
Trump officially loses Michigan as Republican announces certifying his election loss,169,jzr4rd,https://www.rawstory.com/2020/11/trump-officially-loses-michigan-as-republican-announces-certifying-his-election-loss/,29,1606167472.0,3ustice3,0.98,/r/uspolitics/comments/jzr4rd/trump_officially_loses_michigan_as_republican/,uspolitics,28979,2
"Trump fired U.S. Attorney preet Bharara, the suddenly ""Settled"" his Massive $235 Million Money-Laundering Case against a Russia Company for Only $6 million, 2.6% of the Amount Sought; the Defense Counsel was the Russian lawyer who met with Kushner, Manafort and Donald jr. Not a coincidence",166,6nqbnr,http://foreignpolicy.com/2017/07/12/doj-settled-massive-russian-fraud-case-involving-lawyer-who-met-with-trump-jr/,15,1500258377.0,Warren4Prez,0.88,/r/uspolitics/comments/6nqbnr/trump_fired_us_attorney_preet_bharara_the/,uspolitics,28979,2
‘QAnon Congresswoman’ Lauren Boebert faces calls to resign after tweeting information about Nancy Pelosi during Capitol riot,170,kvb08m,https://www.independent.co.uk/news/world/americas/us-election-2020/qanon-lauren-boebert-nancy-pelosi-capitol-riot-b1785663.html,20,1610396124.0,Pessimist2020,0.97,/r/uspolitics/comments/kvb08m/qanon_congresswoman_lauren_boebert_faces_calls_to/,uspolitics,28979,2
Texas Governor Abbott’s order closing ballot drop-off sites is voter suppression — plain and simple.,170,j527gr,https://www.houstonchronicle.com/opinion/editorials/article/Editorial-Call-Abbott-s-order-closing-mail-15617516.php,27,1601830511.0,SamDemosthenes,0.98,/r/uspolitics/comments/j527gr/texas_governor_abbotts_order_closing_ballot/,uspolitics,28979,2
"AOC: ""Pretty nauseating how easily Congress rubber stamped a $4 trillion dark slush fund for Wall St as “COVID relief,” yet somehow $600 for workers in pandemic is controversial. Up close it’s staggering how much resistance there is in Washington to actually helping people directly.""",167,i3zefc,https://twitter.com/AOC/status/1290789173444698112,17,1596604667.0,Projectrage,0.94,/r/uspolitics/comments/i3zefc/aoc_pretty_nauseating_how_easily_congress_rubber/,uspolitics,28979,2
Ousted Trump will return to a company deep in debt and under criminal investigation:,163,jqkhzj,https://www.rawstory.com/2020/11/ousted-trump-will-return-to-a-company-deep-in-debt-and-under-criminal-investigation-report/,18,1604872553.0,3ustice3,0.98,/r/uspolitics/comments/jqkhzj/ousted_trump_will_return_to_a_company_deep_in/,uspolitics,28979,2
Ted Cruz admitted to colleagues that all 'one hundred senators' knew Trump committed an impeachable defense: report,169,xy51y1,https://www.msn.com/en-us/news/politics/ted-cruz-admitted-to-colleagues-that-all-one-hundred-senators-knew-trump-committed-an-impeachable-defense-report/ar-AA12HHbr?ocid=msedgntp&c,24,1665163808.0,northstardim,0.99,/r/uspolitics/comments/xy51y1/ted_cruz_admitted_to_colleagues_that_all_one/,uspolitics,28979,2
The top U.S. military official makes loyalty clear: 'We do not take an oath to a king...',163,ju3hti,https://www.upworthy.com/joint-chiefs-chairman-mark-milley-reminds-military-of-oath-to-constitution#toggle-gdpr,24,1605367240.0,burtzev,0.99,/r/uspolitics/comments/ju3hti/the_top_us_military_official_makes_loyalty_clear/,uspolitics,28979,2
Demands for Trump Removal Grow as 'Fascist' Speech Condemned as Declaration of War Against US Public,164,gvar0q,https://www.commondreams.org/news/2020/06/02/demands-trump-removal-grow-fascist-speech-condemned-declaration-war-against-us,21,1591116125.0,CaptainSkull2030,0.97,/r/uspolitics/comments/gvar0q/demands_for_trump_removal_grow_as_fascist_speech/,uspolitics,28979,2
"50 years of tax cuts for the rich failed to trickle down, economics study says",163,lab3cb,https://www.cbsnews.com/news/tax-cuts-rich-50-years-no-trickle-down/,31,1612206214.0,jmaximus,0.99,/r/uspolitics/comments/lab3cb/50_years_of_tax_cuts_for_the_rich_failed_to/,uspolitics,28979,2
"Donald Trump Has At Least $1 Billion In Debt, More Than Twice The Amount He Suggested",162,jcdqh7,https://www.forbes.com/sites/danalexander/2020/10/16/donald-trump-has-at-least-1-billion-in-debt-more-than-twice-the-amount-he-suggested/#17482c8f4330,20,1602867895.0,bobbelcher,0.99,/r/uspolitics/comments/jcdqh7/donald_trump_has_at_least_1_billion_in_debt_more/,uspolitics,28979,2
"Susan Collins Engineered the USPS Disaster She's Now Protesting - As it turns out, Collins is actually one of the members of Congress most responsible for the Postal Service's devastation.",160,icm25i,https://washingtonmonthly.com/2020/08/18/susan-collins-engineered-the-usps-disaster-shes-now-protesting/,16,1597837406.0,cos,0.97,/r/uspolitics/comments/icm25i/susan_collins_engineered_the_usps_disaster_shes/,uspolitics,28979,2
Thank goodness Trump is too incompetent to properly organize a coup,160,jpbuvv,https://www.washingtonpost.com/opinions/2020/11/06/thank-goodness-trump-is-too-incompetent-properly-organize-coup/?utm_source=rss&utm_medium=referral&utm_campaign=wp_homepage,45,1604691646.0,navegar,0.95,/r/uspolitics/comments/jpbuvv/thank_goodness_trump_is_too_incompetent_to/,uspolitics,28979,2
"Rachel Maddow: ""There isn't a system"" for reuniting families separated under Trump’s zero tolerance border policy. | TRUE",160,8uu86s,http://www.politifact.com/punditfact/statements/2018/jun/29/rachel-maddow/rachel-maddow-right-there-was-no-plan-reuniting-fa/,55,1530287816.0,bobbelcher,0.82,/r/uspolitics/comments/8uu86s/rachel_maddow_there_isnt_a_system_for_reuniting/,uspolitics,28979,2
"Alexandria Ocasio-Cortez: ""What angers me about the GOP's attempts to turn the United States into a far-right Christian theocracy is how dishonest they are about it. At least be forthright about your desire to subvert and dismantle our democracy into a creepy theological order led by a mad king.""",162,s2024c,https://twitter.com/AOC/status/1129452432034029568,47,1641971187.0,Snoo_40410,0.95,/r/uspolitics/comments/s2024c/alexandria_ocasiocortez_what_angers_me_about_the/,uspolitics,28979,2
'Your Republican Party Everybody': GOP Senators Accused of Violating Oaths by Meeting With Trump Lawyers During Trial,160,lidhi4,https://www.commondreams.org/news/2021/02/11/your-republican-party-everybody-gop-senators-accused-violating-oaths-meeting-trump,15,1613144242.0,Facerealityalready,0.98,/r/uspolitics/comments/lidhi4/your_republican_party_everybody_gop_senators/,uspolitics,28979,2
"‘I just want to find 11,780 votes’: In extraordinary hour-long call, Trump pressures Georgia secretary of state to recalculate the vote in his favor",162,kpprsu,https://www.washingtonpost.com/politics/trump-raffensperger-call-georgia-vote/2021/01/03/d45acb92-4dc4-11eb-bda4-615aaefd0555_story.html?wpmk=1&wpisrc=al_post_exclusive__alert-politics--alert-national&utm_source=alert&utm_medium=email&utm_campaign=wp_news_alert_revere&location=alert&pwapi_token=eyJ0eXAiOiJKV1QiLCJhbGciOiJIUzI1NiJ9.eyJjb29raWVuYW1lIjoid3BfY3J0aWQiLCJpc3MiOiJDYXJ0YSIsImNvb2tpZXZhbHVlIjoiNTk3MjhiOTk5YmJjMGYxY2RjZTY3MDAwIiwidGFnIjoid3BfbmV3c19hbGVydF9yZXZlcmUiLCJ1cmwiOiJodHRwczovL3d3dy53YXNoaW5ndG9ucG9zdC5jb20vcG9saXRpY3MvdHJ1bXAtcmFmZmVuc3Blcmdlci1jYWxsLWdlb3JnaWEtdm90ZS8yMDIxLzAxLzAzL2Q0NWFjYjkyLTRkYzQtMTFlYi1iZGE0LTYxNWFhZWZkMDU1NV9zdG9yeS5odG1sP3dwbWs9MSZ3cGlzcmM9YWxfcG9zdF9leGNsdXNpdmVfX2FsZXJ0LXBvbGl0aWNzLS1hbGVydC1uYXRpb25hbCZ1dG1fc291cmNlPWFsZXJ0JnV0bV9tZWRpdW09ZW1haWwmdXRtX2NhbXBhaWduPXdwX25ld3NfYWxlcnRfcmV2ZXJlJmxvY2F0aW9uPWFsZXJ0In0.4MvC2bHjbBustusPsD9UKLrknM2eKt1MfCgKC_vYkNM,24,1609698304.0,bobbelcher,0.97,/r/uspolitics/comments/kpprsu/i_just_want_to_find_11780_votes_in_extraordinary/,uspolitics,28979,2
"‘No proof’ Proud Boys were stabbed by Black Lives Matter activists, DC police now say",157,jo6n1n,https://www.charlotteobserver.com/news/nation-world/national/article246960752.html,14,1604529507.0,spaceghoti,0.98,/r/uspolitics/comments/jo6n1n/no_proof_proud_boys_were_stabbed_by_black_lives/,uspolitics,28979,2
"Donald Trump dumped $400 million into his clubs in Aberdeen and Turnberry. Now, lawmakers in Edinburgh want to investigate him for money laundering.",155,jdj6cr,https://www.reddit.com/r/uspolitics/comments/jdj6cr/donald_trump_dumped_400_million_into_his_clubs_in/,16,1603038267.0,3ustice3,0.97,/r/uspolitics/comments/jdj6cr/donald_trump_dumped_400_million_into_his_clubs_in/,uspolitics,28979,2
"A Federal Judge Just Issued A Stay Against Donald Trump's ""Muslim Ban""",155,5qrfkh,http://www.motherjones.com/politics/2017/01/muslim-ban-federal-court,12,1485656113.0,bobbelcher,0.77,/r/uspolitics/comments/5qrfkh/a_federal_judge_just_issued_a_stay_against_donald/,uspolitics,28979,2
Biden event cancelled as 'armed' Trump supporters threaten campaign bus,159,jllqpq,https://www.independent.co.uk/news/world/americas/us-election-2020/us-election-biden-bus-trump-supporters-texas-event-cancelled-b1477876.html?utm_source=reddit.com,90,1604163157.0,Bobinct,0.95,/r/uspolitics/comments/jllqpq/biden_event_cancelled_as_armed_trump_supporters/,uspolitics,28979,2
"Mitch McConnell Confirms GOP Plans To Cut Medicare, Medicaid & Social Security",156,yolxbn,https://grassrootsdempolitics.com/index.php/2018/10/21/mitch-mcconnell-confirms-gop-plans-to-cut-medicare-medicaid-social-security/,45,1667825468.0,1000000students,0.97,/r/uspolitics/comments/yolxbn/mitch_mcconnell_confirms_gop_plans_to_cut/,uspolitics,28979,2
Ga. secretary of state says fellow Republicans are pressuring him to find ways to exclude legal ballots,159,jvi3go,https://www.washingtonpost.com/politics/brad-raffensperger-georgia-vote/2020/11/16/6b6cb2f4-283e-11eb-8fa2-06e7cbb145c0_story.html,8,1605570249.0,bobbelcher,0.99,/r/uspolitics/comments/jvi3go/ga_secretary_of_state_says_fellow_republicans_are/,uspolitics,28979,2
"What Fox News Doesn't Want You To Know: No, the Nazis were not left-wing socialists. The Nazis were conservative right-wing Christian Evangelical capitalist nationalists who hunted and killed socialists. This is common knowledge outside of America. (I'm the author. AMA)",156,i9i6q2,/r/AMA/comments/i9i58z/what_fox_news_doesnt_want_you_to_know_no_the/,18,1597393420.0,OliverMarkusMalloy,0.92,/r/uspolitics/comments/i9i6q2/what_fox_news_doesnt_want_you_to_know_no_the/,uspolitics,28979,2
Alabama's Roy Moore says whole communities in Midwest are under Sharia law | PANTS ON FIRE!,157,6uvwkc,http://www.politifact.com/truth-o-meter/statements/2017/aug/16/roy-moore/alabamas-roy-moore-says-whole-communities-midwest-/,59,1503238204.0,bobbelcher,0.87,/r/uspolitics/comments/6uvwkc/alabamas_roy_moore_says_whole_communities_in/,uspolitics,28979,2
Senator who voted for anti-trans ‘bathroom bill’ busted in hotel with underage boy,155,glmz1o,https://deadstate.org/senator-who-voted-to-protect-bathrooms-from-trans-people-caught-in-hotel-with-underage-boy/,26,1589748225.0,mulutavcocktail,0.98,/r/uspolitics/comments/glmz1o/senator_who_voted_for_antitrans_bathroom_bill/,uspolitics,28979,2
Pence says Trump never 'belittled' coronavirus threat. Here are 19 times he did.,156,ft8e40,https://americanindependent.com/mike-pence-donald-trump-coronavirus-threat-belittled-white-house-cnn-covid-19/,13,1585774335.0,bobbelcher,0.94,/r/uspolitics/comments/ft8e40/pence_says_trump_never_belittled_coronavirus/,uspolitics,28979,2
"Sen. Chris Murphy: ""The moment we all feared is likely upon us. An unstable President in way over his head, panicking, with all his experienced advisers having quit, and only the sycophantic amateurs remaining. Assassinating foreign leaders, announcing plans to bomb civilians. A nightmare.""",152,ekgyhu,https://twitter.com/ChrisMurphyCT/status/1213667832527015937,40,1578249359.0,Dems4Prez,0.96,/r/uspolitics/comments/ekgyhu/sen_chris_murphy_the_moment_we_all_feared_is/,uspolitics,28979,2
Joe Biden Has Taken The Lead In The Historically Red State Of Georgia,153,jp2j9o,https://www.buzzfeednews.com/article/emmanuelfelton/biden-lead-georgia-vote-count,14,1604656921.0,Cinemaphreak,0.99,/r/uspolitics/comments/jp2j9o/joe_biden_has_taken_the_lead_in_the_historically/,uspolitics,28979,2
"Don't be fooled by Russian trolls masquerading as American lefties. They're trying to convince you to vote third party or not vote at all. Their only goal is to get Trump elected by stopping you from voting for Biden. It's called ""demotivational propaganda.""",153,j2aijm,/r/AmericanFascism2020/comments/izhq4b/dont_be_fooled_by_russian_trolls_masquerading_as/,135,1601421215.0,OliverMarkusMalloy,0.92,/r/uspolitics/comments/j2aijm/dont_be_fooled_by_russian_trolls_masquerading_as/,uspolitics,28979,2
"President Donald Trump: ""For years, they have not been able to get tax cuts -- many, many years, since Reagan."" | PANTS ON FIRE!",152,7gngbe,http://www.politifact.com/truth-o-meter/statements/2017/nov/30/donald-trump/donald-trump-wrong-no-tax-cuts-passed-reagan/,6,1512058793.0,bobbelcher,0.86,/r/uspolitics/comments/7gngbe/president_donald_trump_for_years_they_have_not/,uspolitics,28979,2
"Ron Johnson ""must resign"": Wisconsin senator implicated in fake elector scheme",154,vi2wpd,https://www.msn.com/en-us/news/politics/ron-johnson-must-resign-wisconsin-senator-implicated-in-fake-elector-scheme/ar-AAYJpow?ocid=msedgdhp&pc=U531&cvid=5970e45246634df194d40e3b48d7e984,31,1655896976.0,northstardim,0.99,/r/uspolitics/comments/vi2wpd/ron_johnson_must_resign_wisconsin_senator/,uspolitics,28979,2
Trump’s attack on the Postal Service is now a national emergency,154,i93ysh,https://www.washingtonpost.com/opinions/2020/08/13/trumps-attack-postal-service-is-now-national-emergency/,20,1597338907.0,spaceghoti,0.94,/r/uspolitics/comments/i93ysh/trumps_attack_on_the_postal_service_is_now_a/,uspolitics,28979,2
