title,score,id,url,num_comments,created,author,upvote_ratio,permalink,subreddit,subreddit_subscribers,depth
MIT Develops Wearable Sensors Sewn into Clothes That Monitor Vital Signs,15473,gw218k,https://interestingengineering.com/mit-develops-wearable-sensors-sewn-into-clothes-that-monitor-vital-signs,396,1591216448.0,ChickenTeriyakiBoy1,0.94,/r/gadgets/comments/gw218k/mit_develops_wearable_sensors_sewn_into_clothes/,gadgets,21140247,2
NASA Curiosity Rover Starts Epic 'Summer Road Trip' Across Mars,15472,hn2a67,https://www.cnet.com/news/nasa-mars-curiosity-rover-starts-epic-summer-road-trip-across-red-planet/,335,1594153301.0,auscrisos,0.97,/r/gadgets/comments/hn2a67/nasa_curiosity_rover_starts_epic_summer_road_trip/,gadgets,21140247,2
"It’s getting too hot to play the Steam Deck or Switch outside, makers warn - Nintendo, Valve say not to use their products above 35° C (95° F).",15438,w4jlbr,https://arstechnica.com/gaming/2022/07/global-warming-is-boosting-the-risk-of-frying-your-portable-game-console/,1005,1658417471.0,speckz,0.95,/r/gadgets/comments/w4jlbr/its_getting_too_hot_to_play_the_steam_deck_or/,gadgets,21140247,2
Robot bees can now dive in and out of water using tiny combustible rockets,15386,7cgeg5,https://www.theverge.com/2017/10/25/16544996/robot-bees-harvard-fly-swim-water-rocket,1094,1510504922.0,Khaleeasi24,0.9,/r/gadgets/comments/7cgeg5/robot_bees_can_now_dive_in_and_out_of_water_using/,gadgets,21140247,2
"The fabled Razer Toaster finally becomes reality after six years of countless memes, 40,000 likes, one April Fools prank and 12 tattoos",15354,bjtayo,"https://www.tomsguide.com/us/razer-toaster-project-breadwinner,news-29981.html",557,1556792533.0,nopantsdolphin,0.95,/r/gadgets/comments/bjtayo/the_fabled_razer_toaster_finally_becomes_reality/,gadgets,21140247,2
Right-to-Repair Advocates Question John Deere’s New Promises - The tractor maker is accused of blocking farmers from fixing their own equipment. A new agreement offers concessions—but campaigners say it’s not enough.,15218,1095lle,https://www.wired.com/story/right-to-repair-advocates-question-john-deeres-new-promises/,318,1673446146.0,speckz,0.96,/r/gadgets/comments/1095lle/righttorepair_advocates_question_john_deeres_new/,gadgets,21140247,2
"Samsung recalls more than 660,000 washing machines after fire hazard reports.",15181,ztu039,https://www.cnn.com/2022/12/23/business/samsung-washing-machine-recall-fire-hazard/index.html,1032,1671833216.0,SUPRVLLAN,0.96,/r/gadgets/comments/ztu039/samsung_recalls_more_than_660000_washing_machines/,gadgets,21140247,2
"MacBook Pro with SD card slot, no Touch Bar coming in 2021",15168,l2r7j5,https://appleinsider.com/articles/21/01/22/macbook-pro-with-sd-card-slot-no-touch-bar-coming-in-2021,1628,1611332940.0,userndj,0.88,/r/gadgets/comments/l2r7j5/macbook_pro_with_sd_card_slot_no_touch_bar_coming/,gadgets,21140247,2
Forget AR glasses. Augmented reality is headed to your windshield,15127,jdnacw,https://www.digitaltrends.com/features/envisics-ar-windshield-technology/,820,1603051737.0,MicroSofty88,0.93,/r/gadgets/comments/jdnacw/forget_ar_glasses_augmented_reality_is_headed_to/,gadgets,21140247,2
"Researchers build flu detector that can diagnose at a breath, no doctor required",15122,5rnepv,http://www.digitaltrends.com/cool-tech/flu-breathalyzer/,533,1486049594.0,ZoneRangerMC,0.91,/r/gadgets/comments/5rnepv/researchers_build_flu_detector_that_can_diagnose/,gadgets,21140247,2
AirTag helps rescue dog swept away in California floodwaters,15084,10gxyre,https://appleinsider.com/articles/23/01/20/airtag-helps-rescue-dog-swept-away-in-california-floodwaters,360,1674224003.0,chrisdh79,0.94,/r/gadgets/comments/10gxyre/airtag_helps_rescue_dog_swept_away_in_california/,gadgets,21140247,2
"A group of students built a robotic hand for their 15-year-old classmate, who said the device changed his life, reports say",15051,10nnvyt,https://www.cbsnews.com/amp/news/sergio-peralta-robotic-hand-tennessee-hendersonville-high-school/,311,1674935693.0,thebelsnickle1991,0.94,/r/gadgets/comments/10nnvyt/a_group_of_students_built_a_robotic_hand_for/,gadgets,21140247,2
"iPhone lost in river for 10 months reunited with owner, and it still works",14989,vltvf4,https://www.digitaltrends.com/mobile/iphone-lost-in-river-for-10-months-reunited-with-owner/?utm_source=reddit&utm_medium=pe&utm_campaign=pd,520,1656331236.0,ChickenTeriyakiBoy1,0.91,/r/gadgets/comments/vltvf4/iphone_lost_in_river_for_10_months_reunited_with/,gadgets,21140247,2
The TactSuit haptic feedback vest provides physical feedback from gaming content,14965,kvr7xv,https://www.digitaltrends.com/gaming/ces-2021-haptic-feedback-vest-vr-virtual-reality-bhaptics/?utm_source=Reddit&utm_medium=Web&utm_campaign=PD,1020,1610456448.0,MicroSofty88,0.93,/r/gadgets/comments/kvr7xv/the_tactsuit_haptic_feedback_vest_provides/,gadgets,21140247,2
Ikea's first smart air purifier comes camouflaged as a side table,14920,oxp91h,https://gizmodo.com/ikeas-first-smart-air-purifier-comes-camouflaged-as-a-s-1847406840,466,1628070481.0,thebelsnickle1991,0.97,/r/gadgets/comments/oxp91h/ikeas_first_smart_air_purifier_comes_camouflaged/,gadgets,21140247,2
macOS Big Sur Update Bricking Some Older MacBook Pro Models,14918,jupvdz,https://www.macrumors.com/2020/11/15/macos-big-sur-update-bricking-some-macbook-pros/,1679,1605462241.0,wewewawa,0.94,/r/gadgets/comments/jupvdz/macos_big_sur_update_bricking_some_older_macbook/,gadgets,21140247,2
"Motorola Razr leaked specs are underwhelming for a $1,500 phone",14906,b0kscv,"https://www.tomsguide.com/us/motorola-razr-2019-specs-logo-price,news-29624.html",1236,1552475799.0,mspoonygp,0.92,/r/gadgets/comments/b0kscv/motorola_razr_leaked_specs_are_underwhelming_for/,gadgets,21140247,2
Apple Hit With Class Action Alleging It Tracks Users Despite Privacy Assurances,14827,yv040j,https://www.macrumors.com/2022/11/14/apple-class-action-user-tracking-allegations/,464,1668434156.0,chrisdh79,0.95,/r/gadgets/comments/yv040j/apple_hit_with_class_action_alleging_it_tracks/,gadgets,21140247,2
NASA Mars Perseverance Rover Uses Same PowerPC Chipset Found in 1998 G3 iMac,14813,lw0vsz,https://www.macrumors.com/2021/03/02/nasa-mars-perseverance-rover-imac-powerpc/,826,1614688174.0,chrisdh79,0.95,/r/gadgets/comments/lw0vsz/nasa_mars_perseverance_rover_uses_same_powerpc/,gadgets,21140247,2
"I 3D-Printed a Glock to See How Far Homemade Guns Have Come - Today’s 3D-printed ""ghost guns"" can look, feel, and shoot like factory-made weapons.",14813,pbywa9,https://www.vice.com/en/article/bvzak4/ghost-gun-glock-3d-printing,2575,1629982401.0,speckz,0.84,/r/gadgets/comments/pbywa9/i_3dprinted_a_glock_to_see_how_far_homemade_guns/,gadgets,21140247,2
USB 3.2 branding is a mess that will lead to confussion and scams,14711,avd12k,https://arstechnica.com/gadgets/2019/02/usb-3-2-is-going-to-make-the-current-usb-branding-even-worse/,1053,1551271031.0,nopantsdolphin,0.94,/r/gadgets/comments/avd12k/usb_32_branding_is_a_mess_that_will_lead_to/,gadgets,21140247,2
iPhone revenue drops $6 billion,14718,bj8sob,"https://www.tomsguide.com/us/apple-q2-2019-results,news-29968.html",3035,1556659103.0,mspoonygp,0.95,/r/gadgets/comments/bj8sob/iphone_revenue_drops_6_billion/,gadgets,21140247,2
Domestic abuser busted in the act of putting an AirTag on a car,14632,siwgk7,https://appleinsider.com/articles/22/02/02/connecticut-man-caught-placing-an-airtag-for-stalking,918,1643827758.0,chrisdh79,0.94,/r/gadgets/comments/siwgk7/domestic_abuser_busted_in_the_act_of_putting_an/,gadgets,21140247,2
Raspberry Pi 4 announced with up to 4GB of RAM and support for dual 4K 60Hz displays,14543,c4jlco,https://www.raspberrypi.org/products/raspberry-pi-4-model-b/,1177,1561360238.0,samtherat6,0.95,/r/gadgets/comments/c4jlco/raspberry_pi_4_announced_with_up_to_4gb_of_ram/,gadgets,21140247,2
"The Essential Phone now costs $499, $200 less than the original price",14513,784r5n,https://www.theverge.com/2017/10/22/16516828/essential-phone-price-cut-499-android,2750,1508725193.0,H4xolotl,0.88,/r/gadgets/comments/784r5n/the_essential_phone_now_costs_499_200_less_than/,gadgets,21140247,2
Anker partners with Nintendo on two new USB-C battery packs designed for the Switch,14514,8prpsn,https://www.theverge.com/circuitbreaker/2018/6/7/17437550/anker-nintendo-switch-battery-pack-usb-c-pd-fast-charge-partnership-powercore,450,1528536716.0,anonboxis,0.91,/r/gadgets/comments/8prpsn/anker_partners_with_nintendo_on_two_new_usbc/,gadgets,21140247,2
Huawei got people to write fake reviews for an unreleased phone,14510,7x95m0,https://www.theverge.com/2018/2/12/17005798/huawei-fake-reviews-best-buy-mate-10-pro-phone,773,1518526251.0,carrick1363,0.9,/r/gadgets/comments/7x95m0/huawei_got_people_to_write_fake_reviews_for_an/,gadgets,21140247,2
Apple glasses could adjust lenses to match user's prescription,14504,s1dr5p,https://appleinsider.com/articles/22/01/11/apple-glass-could-adjust-lenses-to-match-users-prescription,866,1641910228.0,chrisdh79,0.91,/r/gadgets/comments/s1dr5p/apple_glasses_could_adjust_lenses_to_match_users/,gadgets,21140247,2
Man credits Apple Watch Fall Detection for saving his life,14425,oavqmb,https://appleinsider.com/articles/21/06/30/mans-credits-apple-watch-fall-detection-for-saving-his-life,521,1625054100.0,chrisdh79,0.92,/r/gadgets/comments/oavqmb/man_credits_apple_watch_fall_detection_for_saving/,gadgets,21140247,2
The Marine Corps is testing a machine gun-wielding robot controlled with just a tablet and a joystick,14422,68euke,http://www.businessinsider.com/marines-corps-machine-gun-wielding-robot-controlled-by-tablet-2017-4,1492,1493548488.0,ZoneRangerMC,0.86,/r/gadgets/comments/68euke/the_marine_corps_is_testing_a_machine_gunwielding/,gadgets,21140247,2
"Oculus cuts Rift price for second time this year, now $399 with Touch",14398,6me06n,https://arstechnica.com/?post_type=post&p=1130407,2747,1499688178.0,Abscess2,0.89,/r/gadgets/comments/6me06n/oculus_cuts_rift_price_for_second_time_this_year/,gadgets,21140247,2
Workers at Nintendo’s third-party repair partner were reportedly overwhelmed with Joy-Con repairs,14381,ub9jd2,https://www.theverge.com/2022/4/24/23039777/workers-nintendo-third-party-repair-facility-were-reportedly-overwhelmed-with-joy-con-repairs,622,1650850120.0,GoMx808-0,0.96,/r/gadgets/comments/ub9jd2/workers_at_nintendos_thirdparty_repair_partner/,gadgets,21140247,2
Sony's new wearable AC unit combats heat hidden in your t-shirt,14345,cj9nuk,https://www.tomsguide.com/news/sonys-new-wearable-ac-unit-combats-heat-hidden-in-your-t-shirt,1195,1564397644.0,nopantsdolphin,0.95,/r/gadgets/comments/cj9nuk/sonys_new_wearable_ac_unit_combats_heat_hidden_in/,gadgets,21140247,2
This AI-Powered Machine Yells Compliments to Pups Passing By,14317,mf1y9l,https://gizmodo.com/neighborhood-hero-builds-ai-powered-device-that-automat-1846562170,331,1616942225.0,thebelsnickle1991,0.93,/r/gadgets/comments/mf1y9l/this_aipowered_machine_yells_compliments_to_pups/,gadgets,21140247,2
New drone claims Guinness World record with a top speed of 163 mph,14316,6ngd4j,https://www.theverge.com/2017/7/14/15967948/drone-racing-league-fastest-drone-racerx-guinness-world-record-163-mph,817,1500130968.0,ZoneRangerMC,0.89,/r/gadgets/comments/6ngd4j/new_drone_claims_guinness_world_record_with_a_top/,gadgets,21140247,2
"New MacBook Pros Have Battery Pull Tabs for Easier Do-it-Yourself Battery Replacements, Says iFixit",14302,qh3ik7,https://www.macrumors.com/2021/10/27/macbook-pro-battery-pull-tabs/,653,1635360203.0,UnKindClock,0.95,/r/gadgets/comments/qh3ik7/new_macbook_pros_have_battery_pull_tabs_for/,gadgets,21140247,2
"Amazon faces a privacy backlash for its Sidewalk feature, which turns Alexa devices into neighborhood WiFi networks that owners have to opt out of",14302,k33ptn,https://www.msn.com/en-in/money/technology/amazon-faces-a-privacy-backlash-for-its-sidewalk-feature-which-turns-alexa-devices-into-neighborhood-wifi-networks-that-owners-have-to-opt-out-of/ar-BB1boljH,822,1606627175.0,MicroSofty88,0.96,/r/gadgets/comments/k33ptn/amazon_faces_a_privacy_backlash_for_its_sidewalk/,gadgets,21140247,2
GPU shipments last quarter were the lowest they've been in over 10 years | The last time GPU shipments were this low we were in a massive recession.,14294,z8p819,https://www.pcgamer.com/gpu-shipments-last-quarter-were-the-lowest-theyve-been-in-over-10-years/,1580,1669808029.0,chrisdh79,0.94,/r/gadgets/comments/z8p819/gpu_shipments_last_quarter_were_the_lowest_theyve/,gadgets,21140247,2
Good news! Now you can buy a USB stick that destroys (almost) anything in its path,14223,51rp88,http://www.zdnet.com/article/now-you-can-buy-a-usb-stick-that-destroys-laptops/,1813,1473346598.0,moooooky,0.87,/r/gadgets/comments/51rp88/good_news_now_you_can_buy_a_usb_stick_that/,gadgets,21140247,2
"Magic Leap has reportedly sold only 6,000 headsets after raising $2.6 billion",14157,e741p9,https://www.tomsguide.com/news/dollar26-billion-later-magic-leap-looks-in-trouble,1141,1575664075.0,mspoonygp,0.94,/r/gadgets/comments/e741p9/magic_leap_has_reportedly_sold_only_6000_headsets/,gadgets,21140247,2
Apple kills MacBook 12 after four years,14141,cb1le5,https://www.cnet.com/news/apple-kills-12-inch-macbook/,2136,1562682561.0,nopantsdolphin,0.93,/r/gadgets/comments/cb1le5/apple_kills_macbook_12_after_four_years/,gadgets,21140247,2
‘I didn’t want it anywhere near me’: how the Apple AirTag became a gift to stalkers,14139,x75ekx,https://www.theguardian.com/technology/2022/sep/05/i-didnt-want-it-anywhere-near-me-how-the-apple-airtag-became-a-gift-to-stalkers,1563,1662454153.0,diacewrb,0.86,/r/gadgets/comments/x75ekx/i_didnt_want_it_anywhere_near_me_how_the_apple/,gadgets,21140247,2
"Robotised insects may search collapsed buildings for survivors | They can detect movement, body warmth and exhaled carbon dioxide",14142,tq6qsz,https://www.economist.com/science-and-technology/robotised-insects-may-search-collapsed-buildings-for-survivors/21808326,520,1648465306.0,chrisdh79,0.95,/r/gadgets/comments/tq6qsz/robotised_insects_may_search_collapsed_buildings/,gadgets,21140247,2
Real-life Iron Man breaks speed record with upgraded flying suit: 85mph,14137,dwpu8m,https://www.tomsguide.com/news/real-life-iron-man-breaks-speed-record-85-mph,477,1573819434.0,nopantsdolphin,0.94,/r/gadgets/comments/dwpu8m/reallife_iron_man_breaks_speed_record_with/,gadgets,21140247,2
"Tesla Model 3 announced: release set for 2017, price starts at $35,000",14096,4ctv0x,http://www.theverge.com/2016/3/31/11335272/tesla-model-3-announced-price-release-date-specs-preorder,2951,1459483982.0,english06,0.89,/r/gadgets/comments/4ctv0x/tesla_model_3_announced_release_set_for_2017/,gadgets,21140247,2
"Nissan Actively Discourages Battery Replacement on the Leaf, Upset Owner Claims",14091,jksu9z,https://www.autoevolution.com/news/nissan-actively-discourages-battery-replacement-on-the-leaf-upset-owner-claims-150788.html,1458,1604045747.0,wewewawa,0.96,/r/gadgets/comments/jksu9z/nissan_actively_discourages_battery_replacement/,gadgets,21140247,2
"Brazil court fines Apple, orders to sell iPhone with charger",14078,y3v7ud,https://www.reuters.com/legal/brazil-court-fines-apple-orders-sell-iphone-with-charger-2022-10-13/?taid=63487b293457710001b462bd,929,1665757128.0,Avieshek,0.96,/r/gadgets/comments/y3v7ud/brazil_court_fines_apple_orders_to_sell_iphone/,gadgets,21140247,2
Battery-Free Game Boy Runs Off of Solar and Kinetic Energy,14058,in3aco,https://interestingengineering.com/battery-free-game-boy-runs-forever-on-kinetic-energy,359,1599320651.0,MicroSofty88,0.94,/r/gadgets/comments/in3aco/batteryfree_game_boy_runs_off_of_solar_and/,gadgets,21140247,2
Apple’s battery replacement prices are going up by $20 to $50.,14061,101n6fm,https://www.theverge.com/2023/1/2/23535428/apple-iphone-ipad-mac-battery-service-replacement-price-increase,1207,1672692371.0,SUPRVLLAN,0.94,/r/gadgets/comments/101n6fm/apples_battery_replacement_prices_are_going_up_by/,gadgets,21140247,2
Facebook Is Paying Teens to Install a 'Research' App That Lets It Monitor Their Phones,14015,ala3ps,https://gizmodo.com/facebook-is-paying-teens-to-install-a-research-app-that-1832182370,914,1548831233.0,caliphornian,0.94,/r/gadgets/comments/ala3ps/facebook_is_paying_teens_to_install_a_research/,gadgets,21140247,2
"Valve’s Steam Deck makes a case against walled gardens | Rather than boxing you into its own store, Valve’s portable gaming system lets you install software from anywhere.",13998,vizpv7,https://www.fastcompany.com/90761990/steam-deck-install-apps-operating-systems,871,1655998566.0,chrisdh79,0.96,/r/gadgets/comments/vizpv7/valves_steam_deck_makes_a_case_against_walled/,gadgets,21140247,2
The 3G shutdown will affect everyday devices you probably own,13954,supo9w,https://www.eastbaytimes.com/2022/02/16/the-3g-shutdown-will-affect-everyday-devices-you-probably-own/,1539,1645106919.0,speckz,0.95,/r/gadgets/comments/supo9w/the_3g_shutdown_will_affect_everyday_devices_you/,gadgets,21140247,2
"Samsung may adopt graphene batteries for phones in 2020, promising full charge in under 30 minutes",13935,cprtyq,https://www.tomsguide.com/news/samsung-may-adopt-graphene-batteries-for-phones-in-2020,700,1565695902.0,mspoonygp,0.95,/r/gadgets/comments/cprtyq/samsung_may_adopt_graphene_batteries_for_phones/,gadgets,21140247,2
Sports Illustrated swimsuit model says she was tracked for hours with AirTag,13932,ryn1wk,https://appleinsider.com/articles/22/01/07/sports-illustrated-swimsuit-model-says-she-was-tracked-for-hours-with-airtag,1287,1641603162.0,chrisdh79,0.9,/r/gadgets/comments/ryn1wk/sports_illustrated_swimsuit_model_says_she_was/,gadgets,21140247,2
Samsung confirms it will reveal foldable Galaxy technology tomorrow,13910,9uo1f5,"https://www.tomsguide.com/us/foldable-galaxy-phone-ux,news-28464.html",1094,1541508778.0,thegeezuss,0.94,/r/gadgets/comments/9uo1f5/samsung_confirms_it_will_reveal_foldable_galaxy/,gadgets,21140247,2
Apple will soon be able to repair iPhone 12's rear glass without replacing the entire device,13872,llib0i,https://9to5mac.com/2021/02/16/apple-will-soon-be-able-to-repair-iphone-12s-rear-glass-without-replacing-the-entire-device/,1414,1613523630.0,UnKindClock,0.93,/r/gadgets/comments/llib0i/apple_will_soon_be_able_to_repair_iphone_12s_rear/,gadgets,21140247,2
Is Apple the only major brand not releasing a foldable phone in 2019? Probably,13766,aqytx4,"https://www.tomsguide.com/us/vivo-foldable-phone-rumors,news-29430.html",2198,1550251133.0,mspoonygp,0.89,/r/gadgets/comments/aqytx4/is_apple_the_only_major_brand_not_releasing_a/,gadgets,21140247,2
Apple will make a smaller iPhone in 2020 (report),13743,b8hq47,"https://www.tomsguide.com/us/apple-small-iphone-2020,news-29787.html",2155,1554202794.0,nopantsdolphin,0.88,/r/gadgets/comments/b8hq47/apple_will_make_a_smaller_iphone_in_2020_report/,gadgets,21140247,2
The U.S. military is using solar-powered balloons to spy on parts of the Midwest,13745,cln8me,https://www.digitaltrends.com/cool-tech/military-surveillance-balloon-spy-midwest/#utm_source=reddit&utm_medium=web,1098,1564863080.0,ChickenTeriyakiBoy1,0.93,/r/gadgets/comments/cln8me/the_us_military_is_using_solarpowered_balloons_to/,gadgets,21140247,2
Please Stop Buying the Foldable Phone From Pablo Escobar's Brother,13729,g36hnb,https://www.pcmag.com/news/please-stop-buying-the-foldable-phone-from-pablo-escobars-brother,826,1587144665.0,andyholla84,0.92,/r/gadgets/comments/g36hnb/please_stop_buying_the_foldable_phone_from_pablo/,gadgets,21140247,2
Apple Expected to Move 25% of All iPhone Production to India by 2025,13710,xkxw6r,https://www.macrumors.com/2022/09/22/apple-iphone-production-india-by-2025/,916,1663843422.0,chrisdh79,0.92,/r/gadgets/comments/xkxw6r/apple_expected_to_move_25_of_all_iphone/,gadgets,21140247,2
Sony's new Airpods rival: The noise-cancelling WF-1000XM3 with 6-hour battery life for $230,13655,c9flyt,https://www.theverge.com/2019/7/5/20682334/sony-wf-1000xm3-wireless-earbuds-hands-on-preview-features,1429,1562331141.0,nopantsdolphin,0.9,/r/gadgets/comments/c9flyt/sonys_new_airpods_rival_the_noisecancelling/,gadgets,21140247,2
The Army's New Night-Vision Goggles Look Like Technology Stolen From Aliens,13634,n4qykk,https://gizmodo.com/the-armys-new-night-vision-goggles-look-like-technology-1846799718?utm_source=reddit&utm_medium=pe&utm_campaign=pd,955,1620141699.0,MicroSofty88,0.92,/r/gadgets/comments/n4qykk/the_armys_new_nightvision_goggles_look_like/,gadgets,21140247,2
World’s first raspberry picking robot cracks the toughest nut: soft fruit,13628,v2eyz2,https://www.theguardian.com/business/2022/jun/01/uk-raspberry-picking-robot-soft-fruit,799,1654083664.0,diacewrb,0.96,/r/gadgets/comments/v2eyz2/worlds_first_raspberry_picking_robot_cracks_the/,gadgets,21140247,2
"Sony has now sold over 19 million PS5s | Only 2 million were sold last quarter, confirming Sony hasn't overcome its supply issues.",13621,umf43s,https://www.engadget.com/sony-has-now-sold-over-193-million-ps-5-s-074733741.html,1165,1652176725.0,chrisdh79,0.96,/r/gadgets/comments/umf43s/sony_has_now_sold_over_19_million_ps5s_only_2/,gadgets,21140247,2
New 2021 AirPods and AirPods Pro to be made in Vietnam,13623,hvrvqp,https://appleinsider.com/articles/20/07/22/new-2021-airpods-and-airpods-pro-to-be-made-in-vietnam,933,1595416224.0,gulabjamunyaar,0.93,/r/gadgets/comments/hvrvqp/new_2021_airpods_and_airpods_pro_to_be_made_in/,gadgets,21140247,2
"Samsung reveals US pricing for its very curved gaming monitors: $700, $800, $1,700",13602,h9hngx,https://www.engadget.com/samsung-odyssey-curved-gaming-monitors-us-prices-120014874.html?utm_campaign=homepage&utm_medium=internal&utm_source=dl,904,1592232062.0,andyholla84,0.94,/r/gadgets/comments/h9hngx/samsung_reveals_us_pricing_for_its_very_curved/,gadgets,21140247,2
"The World’s Thinnest Mechanical Watch Is No Thicker Than a Quarter and Costs $1,888,000 | No fitness tracking, no messages, and no access to smart assistants, but it does include a picture of a horse.",13577,vsrv2t,https://gizmodo.com/million-dollar-mechanical-watch-thinnest-ferrari-mille-1849146641,831,1657119200.0,chrisdh79,0.9,/r/gadgets/comments/vsrv2t/the_worlds_thinnest_mechanical_watch_is_no/,gadgets,21140247,2
Now even the FBI is warning about your smart TV security,13575,e4wyoi,https://techcrunch.com/2019/12/01/fbi-smart-tv-security/,1260,1575280762.0,mtimetraveller,0.96,/r/gadgets/comments/e4wyoi/now_even_the_fbi_is_warning_about_your_smart_tv/,gadgets,21140247,2
Apple announces Mac architecture transition from Intel to its own ARM chips,13572,hdxuls,https://9to5mac.com/2020/06/22/arm-mac-apple/,2347,1592850602.0,UnKindClock,0.92,/r/gadgets/comments/hdxuls/apple_announces_mac_architecture_transition_from/,gadgets,21140247,2
"'iPhone 12' will use magnets to simplify charging positioning, leak claims",13541,i46m5y,https://appleinsider.com/articles/20/08/05/leak-claims-iphone-12-will-use-magnets-to-simplify-charging-positioning,870,1596638774.0,chrisdh79,0.93,/r/gadgets/comments/i46m5y/iphone_12_will_use_magnets_to_simplify_charging/,gadgets,21140247,2
Apple is using proprietary software to lock MacBook Pros and iMac Pros from third-party repairs,13522,9ljpea,https://www.theverge.com/2018/10/4/17938820/apple-macbook-pro-imac-pro-third-party-repair-lock-out-software,1555,1538719149.0,H4xolotl,0.93,/r/gadgets/comments/9ljpea/apple_is_using_proprietary_software_to_lock/,gadgets,21140247,2
Atari ready to ship restyled version of classic game console,13522,guy5y8,https://www.digitaltrends.com/gaming/atari-ready-to-ship-restyled-version-of-classic-game-console/?itm_medium=topic&itm_source=21&itm_content=2x2&itm_term=2356592,639,1591062910.0,MicroSofty88,0.93,/r/gadgets/comments/guy5y8/atari_ready_to_ship_restyled_version_of_classic/,gadgets,21140247,2
"Tesla has received 375,000 preorders for the Model 3 - 'Biggest one-week launch of any product ever'",13436,4drof4,http://www.theverge.com/2016/4/7/11385146/tesla-model-3-preorders-375000-elon-musk,1856,1460044631.0,english06,0.86,/r/gadgets/comments/4drof4/tesla_has_received_375000_preorders_for_the_model/,gadgets,21140247,2
Bionic eye restores some vision for 88-year-old woman,13427,su3bzg,https://mashable.com/video/uk-first-bionic-eye-implant,309,1645037692.0,thebelsnickle1991,0.96,/r/gadgets/comments/su3bzg/bionic_eye_restores_some_vision_for_88yearold/,gadgets,21140247,2
AMD’s Ryzen 7000 CPUs will break the 5GHz barrier — and require a new motherboard,13420,uvx5jz,https://www.theverge.com/2022/5/23/23137217/amd-ryzen-7000-cpu-am5-motherboard-specs-details-5nm,989,1653301744.0,chrisdh79,0.95,/r/gadgets/comments/uvx5jz/amds_ryzen_7000_cpus_will_break_the_5ghz_barrier/,gadgets,21140247,2
MIT Team Shares New $500 Emergency Ventilator Design with the Public,13399,fsf0gi,https://interestingengineering.com/mit-team-shares-new-500-emergency-ventilator-design-with-the-public,465,1585668845.0,ChickenTeriyakiBoy1,0.96,/r/gadgets/comments/fsf0gi/mit_team_shares_new_500_emergency_ventilator/,gadgets,21140247,2
"Polymer cables could replace Thunderbolt & USB, deliver more than twice the speed",13386,m0emz0,https://appleinsider.com/articles/21/03/08/polymer-cables-could-replace-thunderbolt-with-105-gbps-data-transfers,602,1615206384.0,chrisdh79,0.95,/r/gadgets/comments/m0emz0/polymer_cables_could_replace_thunderbolt_usb/,gadgets,21140247,2
"Apple will start making AR Glasses as soon as the end of 2019, report",13359,ayq8wm,"https://www.tomsguide.com/us/apple-ar-glasses-release-date,news-29593.html",1371,1552051583.0,nopantsdolphin,0.9,/r/gadgets/comments/ayq8wm/apple_will_start_making_ar_glasses_as_soon_as_the/,gadgets,21140247,2
"USB Type-C finally shows up in power tools, thanks to DeWalt and Ryobi",13321,sgdn8l,https://www.xda-developers.com/usb-type-c-power-tools/,610,1643562555.0,speckz,0.96,/r/gadgets/comments/sgdn8l/usb_typec_finally_shows_up_in_power_tools_thanks/,gadgets,21140247,2
