title,score,id,url,num_comments,created,author,upvote_ratio,permalink,subreddit,subreddit_subscribers,depth
r/BIFL inspired me to buy a pair of Timberland Pro boots. The pair I bought was too small and their customer service offered to replace it with a bigger size for free. This is what came in the mail.,19412,81kkgh,https://i.redd.it/jhd5hlt93gj01.jpg,1129,1520037799.0,uncultured,0.91,/r/BuyItForLife/comments/81kkgh/rbifl_inspired_me_to_buy_a_pair_of_timberland_pro/,BuyItForLife,1449985,3
"When my grandfather passed away, I inherited his auto crawler. Still using it to change my oil after 80 years. (X-POST).",15266,70dh3p,https://i.redd.it/xxvw0q97p4mz.jpg,305,1505516906.0,testfire10,0.95,/r/BuyItForLife/comments/70dh3p/when_my_grandfather_passed_away_i_inherited_his/,BuyItForLife,1449985,3
A customer of mine came in for help with her voicemail…,14750,u3qa5p,https://i.redd.it/gy7r5lh8yjt81.jpg,376,1649967251.0,liveditlovedit,0.97,/r/BuyItForLife/comments/u3qa5p/a_customer_of_mine_came_in_for_help_with_her/,BuyItForLife,1449985,3
I'm working seasonally for UPS and someone left the best present ever on their porch!!!,13597,ef5ak4,https://i.imgur.com/K9ZBfLy.jpg,300,1577212961.0,lux514,0.97,/r/BuyItForLife/comments/ef5ak4/im_working_seasonally_for_ups_and_someone_left/,BuyItForLife,1449985,3
"A customer of mine finally decided to upgrade... Motorola Razr, purchased November 2006",10753,nrn1o8,https://i.redd.it/9spzrkay04371.jpg,535,1622751876.0,liveditlovedit,0.97,/r/BuyItForLife/comments/nrn1o8/a_customer_of_mine_finally_decided_to_upgrade/,BuyItForLife,1449985,3
"My mom and dad got matching North Face down jackets after their wedding 35 years ago. Still being worn today. Now that my dad won’t be wearing his anymore, it’s up to me to make sure it continues to get used.",10586,7wtbze,https://i.redd.it/qk4llezyplf01.jpg,269,1518362580.0,testfire10,0.93,/r/BuyItForLife/comments/7wtbze/my_mom_and_dad_got_matching_north_face_down/,BuyItForLife,1449985,3
This guy is creating videos about restoring BIFL products. No talking. No horrendous music. Just content.,10015,10uglco,https://www.youtube.com/watch?v=U2jNeObHnZY,418,1675614639.0,madredditscientist,0.94,/r/BuyItForLife/comments/10uglco/this_guy_is_creating_videos_about_restoring_bifl/,BuyItForLife,1449985,3
Recently restored this old girl. A 1990 something Weber Genesis 3000. Made in the USA.,9337,h0lolf,https://i.redd.it/0at8u230q5451.jpg,222,1591827397.0,applestofloranges,0.97,/r/BuyItForLife/comments/h0lolf/recently_restored_this_old_girl_a_1990_something/,BuyItForLife,1449985,3
Happy birthday to our refrigerator that turned 99 years old this month! She’s still going strong.,8663,vc3yn0,https://i.redd.it/ok1n841idl591.jpg,387,1655214672.0,LuLuWanda,0.95,/r/BuyItForLife/comments/vc3yn0/happy_birthday_to_our_refrigerator_that_turned_99/,BuyItForLife,1449985,3
Kids played the most with this 25-year-old toy despite all the gifts they got.,8124,5kahfu,http://imgur.com/zmznAw7,374,1482704718.0,vanderlinden,0.94,/r/BuyItForLife/comments/5kahfu/kids_played_the_most_with_this_25yearold_toy/,BuyItForLife,1449985,3
a pair of Levis from 1880 found after a mine shaft was discovered,6954,zy72hb,https://i.redd.it/aflkmco85w8a1.jpg,438,1672325139.0,Accomplished_Alarm_1,0.95,/r/BuyItForLife/comments/zy72hb/a_pair_of_levis_from_1880_found_after_a_mine/,BuyItForLife,1449985,3
Dyson have ended their third-party repair program; good luck getting your machine fixed now 😒,6660,110cwer,https://i.redd.it/ubgirh8y2sha1.jpg,669,1676198574.0,J3ttf,0.96,/r/BuyItForLife/comments/110cwer/dyson_have_ended_their_thirdparty_repair_program/,BuyItForLife,1449985,3
"Our son's nanny just received her master's degree, and we wanted to get her something special. My wife found this 1980's Coach briefcase, and I did a full restoration.",6613,unzxbf,https://imgur.com/a/6Pl4wdV/,223,1652358513.0,PatPetPitPotPut,0.96,/r/BuyItForLife/comments/unzxbf/our_sons_nanny_just_received_her_masters_degree/,BuyItForLife,1449985,3
I analyzed the most and least popular brands on r/BuyItForLife,6241,vxeudm,https://i.redd.it/7ssckxbgv5b91.png,697,1657642097.0,madredditscientist,0.94,/r/BuyItForLife/comments/vxeudm/i_analyzed_the_most_and_least_popular_brands_on/,BuyItForLife,1449985,3
I bought this palette knife over 30 years ago and have created countless paintings with it.,6115,n9967s,https://i.redd.it/3tqrdxotjby61.jpg,115,1620663730.0,Familiar_Big3322,0.96,/r/BuyItForLife/comments/n9967s/i_bought_this_palette_knife_over_30_years_ago_and/,BuyItForLife,1449985,3
My mom’s 1982 GE toaster. Same age as me. Used every day.,5836,y0dclb,https://i.redd.it/m52ddnio0zs91.jpg,159,1665404358.0,TummyPuppy,0.97,/r/BuyItForLife/comments/y0dclb/my_moms_1982_ge_toaster_same_age_as_me_used_every/,BuyItForLife,1449985,3
"27 years old, 299k miles, reliability I'd bet actual money on.",5403,aa30tj,https://i.imgur.com/HALQQWT.jpg,314,1545943477.0,sightlab,0.95,/r/BuyItForLife/comments/aa30tj/27_years_old_299k_miles_reliability_id_bet_actual/,BuyItForLife,1449985,3
"I am a leatherworker. I had a tradition of making the men in the family wallets. But they still use them 10 years later, so now I have to come up with something else.",5339,zsohny,https://www.reddit.com/gallery/zsohny,314,1671722396.0,Accomplished_Alarm_1,0.95,/r/BuyItForLife/comments/zsohny/i_am_a_leatherworker_i_had_a_tradition_of_making/,BuyItForLife,1449985,3
Just ~70k away from being a half million mile daily driver.,5122,m2tzpb,https://i.redd.it/mik5g3bkcfm61.jpg,166,1615479618.0,sightlab,0.98,/r/BuyItForLife/comments/m2tzpb/just_70k_away_from_being_a_half_million_mile/,BuyItForLife,1449985,3
L.L. Bean will not re-sole your boots (a paid service) unless you can prove you are the original owner!,4932,krt15y,https://www.reddit.com/r/BuyItForLife/comments/krt15y/ll_bean_will_not_resole_your_boots_a_paid_service/,442,1609955437.0,robinson217,0.94,/r/BuyItForLife/comments/krt15y/ll_bean_will_not_resole_your_boots_a_paid_service/,BuyItForLife,1449985,3
"I've been looking for an old beater .44 magnum cowboy gun to restore forever — Finally found the non-working Hawes Western Marshal, SAA clone, made in the 50s or 60s. Looked tired, didn't fire and was locked-up. Worked out a firing pin issue, stripped the bluing, and restored it. I'm a cowboy now.",4868,t7pw0y,https://i.redd.it/n7x7bf99mol81.jpg,234,1646536982.0,Familiar_Big3322,0.94,/r/BuyItForLife/comments/t7pw0y/ive_been_looking_for_an_old_beater_44_magnum/,BuyItForLife,1449985,3
I restored a neglected old wrench. It wasn't ready to retire.,4839,mj8y6c,https://i.redd.it/5vmsvbbjryq61.jpg,130,1617458066.0,Familiar_Big3322,0.97,/r/BuyItForLife/comments/mj8y6c/i_restored_a_neglected_old_wrench_it_wasnt_ready/,BuyItForLife,1449985,3
"This ЗИЛ Soviet fridge is over 50 years old, and is still actively used by our family without issues",4827,qjrvjh,https://i.redd.it/tqxgtbqz0tw71.jpg,255,1635694156.0,whyvitamins,0.96,/r/BuyItForLife/comments/qjrvjh/this_зил_soviet_fridge_is_over_50_years_old_and/,BuyItForLife,1449985,3
"This L.L. Bean commando sweater has been worn every winter since 1979 (my father handed it down to me in 1999). It's 100% wool, made in England and you can still find them for sale on eBay. Meanwhile, I bought a new ""Made in China"" version of this sweater from L.L. Bean: It didn't last me a year.",4805,dz5grh,https://i.imgur.com/HuJq0xW.jpg,307,1574271926.0,goodcheapandfast,0.97,/r/BuyItForLife/comments/dz5grh/this_ll_bean_commando_sweater_has_been_worn_every/,BuyItForLife,1449985,3
"Finished cleaning Grandad’s tools. Found his initials carved in a wrench after cleaning. He passed away before I was born. I never met him, but we have turned the same wrench.",4767,jxhff6,https://www.reddit.com/gallery/jxhff6,93,1605841989.0,LucasAugustus,0.97,/r/BuyItForLife/comments/jxhff6/finished_cleaning_grandads_tools_found_his/,BuyItForLife,1449985,3
This silverware set from 1858 that is still the primary set used by our family,4637,t1hl64,https://www.reddit.com/gallery/t1hl64,125,1645831327.0,whyvitamins,0.97,/r/BuyItForLife/comments/t1hl64/this_silverware_set_from_1858_that_is_still_the/,BuyItForLife,1449985,3
Thought you guys might like my coolers.,4603,hktbff,https://i.redd.it/bwo8cplu8q851.jpg,107,1593819069.0,applestofloranges,0.97,/r/BuyItForLife/comments/hktbff/thought_you_guys_might_like_my_coolers/,BuyItForLife,1449985,3
Thanks Grandad! Tools cleaned and oiled and tool boxes refinished. Ready for a few more generations.,4445,jpkcf8,https://www.reddit.com/gallery/jpkcf8,138,1604722632.0,LucasAugustus,0.98,/r/BuyItForLife/comments/jpkcf8/thanks_grandad_tools_cleaned_and_oiled_and_tool/,BuyItForLife,1449985,3
"Before and after restore: Vintage Ridgid adjustable wrench, $6 salvage company score.... Chemical rust remover, wire wheel, 80, 150, 220, 600, 1000, 2000 grit sandpaper, then buffing on a bench grinder, and paint.",4245,nphfez,https://i.redd.it/2x8gay2stj271.jpg,120,1622507374.0,Familiar_Big3322,0.97,/r/BuyItForLife/comments/nphfez/before_and_after_restore_vintage_ridgid/,BuyItForLife,1449985,3
I trained a ChatGPT-like bot on over 100k posts and comments from r/BuyItForLife. It's like having the collective wisdom of the BIFL community at your fingertips.,4221,11fgx4t,https://www.reddit.com/r/BuyItForLife/comments/11fgx4t/i_trained_a_chatgptlike_bot_on_over_100k_posts/,305,1677702386.0,madredditscientist,0.92,/r/BuyItForLife/comments/11fgx4t/i_trained_a_chatgptlike_bot_on_over_100k_posts/,BuyItForLife,1449985,3
"Started upgrading my kitchen with BIFL quality items. The Le Creuset is the single best thing I've ever used for cooking. I make everything in it now, and it does eggs better than any non-stick I've tried. The knife is a Shun Premier 8"".",4181,jwi6sx,https://i.redd.it/ajhrxqvor0061.jpg,512,1605714683.0,pawn_guy,0.96,/r/BuyItForLife/comments/jwi6sx/started_upgrading_my_kitchen_with_bifl_quality/,BuyItForLife,1449985,3
"An article on Barbour jackets - ""The queen, when she sent her jacket back to us, we said, 'We'd like to present you with a new one, ma'am.' And her secretary said, 'Well, the queen would be very pleased to accept your kind offer, but she'd like her old one back, please, reproofed!'""",4087,7osv9k,https://www.cbsnews.com/amp/news/coat-tales-a-tradition-of-barbour-outerwear/,191,1515354892.0,lux514,0.94,/r/BuyItForLife/comments/7osv9k/an_article_on_barbour_jackets_the_queen_when_she/,BuyItForLife,1449985,3
"We see many requests for backpacks here, so I analyzed the top 25 backpacks on Reddit (r/onebag)",3997,w8jaj9,https://i.redd.it/o1ky4tccvwd91.png,323,1658840661.0,madredditscientist,0.98,/r/BuyItForLife/comments/w8jaj9/we_see_many_requests_for_backpacks_here_so_i/,BuyItForLife,1449985,3
"I always tempting to delete FB , but found this guy on FB market place for $40 so I guess I'll keep using it.",3925,otny61,https://i.imgur.com/HcLeqgM.jpg,272,1627523102.0,damn_jexy,0.96,/r/BuyItForLife/comments/otny61/i_always_tempting_to_delete_fb_but_found_this_guy/,BuyItForLife,1449985,3
"One of these I bought used 15 years ago, the other I bought new 6 months ago. Take a guess which currently isn't working.",3921,k1hse5,https://i.imgur.com/o1FXZBM.jpg,429,1606406806.0,pawn_guy,0.96,/r/BuyItForLife/comments/k1hse5/one_of_these_i_bought_used_15_years_ago_the_other/,BuyItForLife,1449985,3
"When I came to USA and attended HS in 1994 I bought a mini Swingline stapler, now I am turning 40 soon and still using this in my work desk.",3911,j2t5t8,https://i.imgur.com/k98qTEi.jpg,89,1601494912.0,damn_jexy,0.97,/r/BuyItForLife/comments/j2t5t8/when_i_came_to_usa_and_attended_hs_in_1994_i/,BuyItForLife,1449985,3
I refurbished a Henry! These things are indestructible…,3889,yd28h7,https://i.redd.it/w9x18zlxqxv91.jpg,149,1666696522.0,J3ttf,0.98,/r/BuyItForLife/comments/yd28h7/i_refurbished_a_henry_these_things_are/,BuyItForLife,1449985,3
The chandelier at our cottage has this vintage light bulb from the early 1900s. It still works!,3885,vreus5,https://www.reddit.com/gallery/vreus5,224,1656961787.0,LuLuWanda,0.94,/r/BuyItForLife/comments/vreus5/the_chandelier_at_our_cottage_has_this_vintage/,BuyItForLife,1449985,3
"He’s getting older, but he still sucks like no other! (Numatic Henry, ~1987)",3776,10f4zhf,https://i.redd.it/ap0rqu91vtca1.jpg,134,1674040889.0,J3ttf,0.97,/r/BuyItForLife/comments/10f4zhf/hes_getting_older_but_he_still_sucks_like_no/,BuyItForLife,1449985,3
Timberland belt I’ve worn nearly every day since middle school (I’m 38 now),3735,pnglok,https://i.redd.it/0prhfyoq6an71.jpg,200,1631543425.0,TummyPuppy,0.98,/r/BuyItForLife/comments/pnglok/timberland_belt_ive_worn_nearly_every_day_since/,BuyItForLife,1449985,3
Lean Mean Fat Reducing Grilling Machine! Just realized I’ve had this since 1999.,3729,7ry6xy,https://i.imgur.com/BNi9JZV.jpg,239,1516547659.0,vanderlinden,0.92,/r/BuyItForLife/comments/7ry6xy/lean_mean_fat_reducing_grilling_machine_just/,BuyItForLife,1449985,3
"My wife purchased these Doc Martens in 1993 and hadn’t worn them in over 20 years. I restore Leather as a hobby, and it still blows me away what quality leather can come back from",3707,um4hbl,https://imgur.com/a/tcCT6L2/,142,1652139048.0,PatPetPitPotPut,0.97,/r/BuyItForLife/comments/um4hbl/my_wife_purchased_these_doc_martens_in_1993_and/,BuyItForLife,1449985,3
"When I got my first car at 17 , I bought a $40 jumper cable instead of cheap $20 jumper cable , I'm about to turn 40 and this same jumper cable have been with me through 5 different car and save my ass and people I know countless time.",3691,k4wog1,https://i.imgur.com/FmzSXE1.jpg,163,1606864461.0,damn_jexy,0.97,/r/BuyItForLife/comments/k4wog1/when_i_got_my_first_car_at_17_i_bought_a_40/,BuyItForLife,1449985,3
"[UPDATE] Timberland accidentally sent me 10 pairs of work boots. After seeing my post on Reddit, they let me keep them. I donated them all to help refugees in Toronto. (Police in pic because they helped me carry all the boots)",3505,8fh0yp,https://i.redd.it/1ux0a2m0aku01.jpg,92,1524882839.0,uncultured,0.93,/r/BuyItForLife/comments/8fh0yp/update_timberland_accidentally_sent_me_10_pairs/,BuyItForLife,1449985,3
"I took this to school every day from 1989 to 1996, (when it became uncool). Started taking it again from 2002 through college (when it became funny). Now I use it once or twice a month when I forget my modern lunch box at work. Aladdin brand, model unknown.",3487,59uxuw,http://imgur.com/wqTj5Ug,96,1477667609.0,robinson217,0.91,/r/BuyItForLife/comments/59uxuw/i_took_this_to_school_every_day_from_1989_to_1996/,BuyItForLife,1449985,3
My grandmother received this Aerolux bulb as a baby gift in 1948. It still lights up (and you can find similar bulbs on eBay for a reasonable price).,3478,eup498,https://i.redd.it/fwl5u7s87cd41.jpg,119,1580137759.0,goodcheapandfast,0.98,/r/BuyItForLife/comments/eup498/my_grandmother_received_this_aerolux_bulb_as_a/,BuyItForLife,1449985,3
