title,score,id,url,num_comments,created,author,upvote_ratio,permalink,subreddit,subreddit_subscribers,depth
"In Ukraine, Belarusians have created a separate battalion named after Kastus Kalinouski to defend Kyiv. According to them, more than 200 Belarusians have already joined the territorial defense of Ukraine, another 300 intend to go to Ukraine.",18724,ta9l6l,https://v.redd.it/2uj8dtxxgdm81,467,1646837872.0,PjeterPannos,0.98,/r/ukraine/comments/ta9l6l/in_ukraine_belarusians_have_created_a_separate/,ukraine,860311,2
"US Senator Murphy: If Saudi Arabia isn't willing to take the side of Ukraine and U.S. over Russia, why should we keep these Patriots in Saudi Arabia when Ukraine and our NATO allies need them? We should remove these Patriot batteries from Saudi Arabia and move them to Ukraine",18643,y3ff79,https://twitter.com/ChrisMurphyCT/status/1580654263587377153,846,1665708672.0,PanEuropeanism,0.97,/r/ukraine/comments/y3ff79/us_senator_murphy_if_saudi_arabia_isnt_willing_to/,ukraine,860311,2
“It’s bad. I think they are encircling us” 🫣😂,18477,11lxahc,https://v.redd.it/wy176m4bdkma1,540,1678284446.0,CorsicA123,0.95,/r/ukraine/comments/11lxahc/its_bad_i_think_they_are_encircling_us/,ukraine,860311,2
This is how Kherson residents hid Ukrainian flags during the Russian occupation of the city.,18455,ytwi6z,https://v.redd.it/7w4diaobroz91,356,1668331096.0,Zhana-Aul,0.96,/r/ukraine/comments/ytwi6z/this_is_how_kherson_residents_hid_ukrainian_flags/,ukraine,860311,2
The Unbeatable Faces of AZOVSTAL (before/now),18439,ulj2ab,https://www.reddit.com/gallery/ulj2ab,743,1652070041.0,ThaIgk,0.91,/r/ukraine/comments/ulj2ab/the_unbeatable_faces_of_azovstal_beforenow/,ukraine,860311,2
We will not fall.,18433,t5fhpr,https://i.redd.it/5urefc6il2l81.jpg,184,1646270367.0,GroundbreakingSet187,0.98,/r/ukraine/comments/t5fhpr/we_will_not_fall/,ukraine,860311,2
They have just seen each other for the first time since Feb 24th,18391,vw0ddl,https://i.redd.it/vofo9dfcwsa91.jpg,142,1657485067.0,ThaIgk,0.94,/r/ukraine/comments/vw0ddl/they_have_just_seen_each_other_for_the_first_time/,ukraine,860311,2
Russians after trying to storm Hostomel,18246,t6cxq1,https://v.redd.it/zl1q5fo8dbl81,1483,1646376583.0,WalkerBuldog,0.97,/r/ukraine/comments/t6cxq1/russians_after_trying_to_storm_hostomel/,ukraine,860311,2
"President Zelensky: “Kherson. In the morning, on Saturday, on the eve of Christmas, in the central part of the city. These are not military facilities. This is not a war according to the rules defined. It is terror, it is killing for the sake of intimidation and pleasure.”",18209,zu6v3r,https://www.instagram.com/p/Cmi-Yb8oTNt/?igshid=YmMyMTA2M2Y=,600,1671876158.0,TinyStrawberry23,0.96,/r/ukraine/comments/zu6v3r/president_zelensky_kherson_in_the_morning_on/,ukraine,860311,2
This is how three months of Russia's aggression against Ukraine looks like in less than 2 minutes.,18174,v7m7t3,https://v.redd.it/oxnajas5id491,647,1654683551.0,imkara92,0.95,/r/ukraine/comments/v7m7t3/this_is_how_three_months_of_russias_aggression/,ukraine,860311,2
Close-Up of the Kerch Collapse,18053,xyk3z9,https://i.redd.it/7o3khtt3mis91.jpg,1022,1665205798.0,pineapple_butt13,0.98,/r/ukraine/comments/xyk3z9/closeup_of_the_kerch_collapse/,ukraine,860311,2
Children in tears met their father. Ukrainian soldier who was fighting in Irpin.,17934,tvyl87,https://v.redd.it/0zp9qxddmhr81,349,1649067620.0,OwensKaren,0.96,/r/ukraine/comments/tvyl87/children_in_tears_met_their_father_ukrainian/,ukraine,860311,2
Marine Anton Gevak died heroically in a battle with a tank column of Russian occupiers near Mariupol. He was the commander of the 140th separate reconnaissance battalion of the Marines of the Ukrainian Armed Forces and devoted the last 9 years of life to the Ukrainian army.,17890,tetmvd,https://i.redd.it/2t38gfs4wkn81.jpg,250,1647363570.0,Eienkei,0.98,/r/ukraine/comments/tetmvd/marine_anton_gevak_died_heroically_in_a_battle/,ukraine,860311,2
Someone played the Ukrainian National anthem on their trumpet in Sumy during clashes.,17853,t1fbfm,https://v.redd.it/39fu7f1ut1k81,269,1645825237.0,Ignash3D,0.99,/r/ukraine/comments/t1fbfm/someone_played_the_ukrainian_national_anthem_on/,ukraine,860311,2
"Volunteer Maryana ""Kvitka"" (Flower) died fighting for Ukraine. She lived in Italy for 14 years and returned to defend her homeland.",17773,xoq9h0,https://suspilne.media/285346-povernulasa-z-italii-sob-zahisati-ukrainu-na-vijni-zaginula-prikarpatka-na-pozivnij-kvitka/,412,1664214234.0,Lady__Midnight,0.95,/r/ukraine/comments/xoq9h0/volunteer_maryana_kvitka_flower_died_fighting_for/,ukraine,860311,2
"Russian woman who was living in Germany illegally, harassing Ukrainian refugees. Making Tik Tok videos in support for Russia might face 10 years in jail.",17595,y76epf,https://i.redd.it/ux4mgyw5bku91.jpg,1100,1666097976.0,FarmSuch5021,0.95,/r/ukraine/comments/y76epf/russian_woman_who_was_living_in_germany_illegally/,ukraine,860311,2
"""If Russia stops fighting, the war ends. If Ukraine stops fighting, Ukraine ends."" –U.S. Secretary of State Antony Blinken to the UN Security Council",17567,xldme1,https://youtu.be/8Dxywym8NiI,317,1663881398.0,nOMnOMShanti,0.98,/r/ukraine/comments/xldme1/if_russia_stops_fighting_the_war_ends_if_ukraine/,ukraine,860311,2
Russian infantry vehicle asking people to stay calm and then this happens.,17524,t3nsxi,https://v.redd.it/tlkyzdpulmk81,1080,1646076890.0,WalkerBuldog,0.98,/r/ukraine/comments/t3nsxi/russian_infantry_vehicle_asking_people_to_stay/,ukraine,860311,2
Ukrainian soldier records what he thinks will be his final video as his unit is surrounded by Russian forces.,17510,yn3nip,https://v.redd.it/iyar6amqo6y91,627,1667676460.0,GnolRevilo,0.97,/r/ukraine/comments/yn3nip/ukrainian_soldier_records_what_he_thinks_will_be/,ukraine,860311,2
Prime Minister of Canada Justin Trudeaum Zelensky and Patron,17486,ul8l0n,https://i.redd.it/m76nm1oquay81.png,510,1652036394.0,WalkerBuldog,0.93,/r/ukraine/comments/ul8l0n/prime_minister_of_canada_justin_trudeaum_zelensky/,ukraine,860311,2
A white dove (a symbol of peace) sat on the hand of a priest who was helping to evacuate civilians. Good sign?,17407,t8o5f4,https://v.redd.it/1bzl6uwdgyl81,301,1646656112.0,valeron_b,0.95,/r/ukraine/comments/t8o5f4/a_white_dove_a_symbol_of_peace_sat_on_the_hand_of/,ukraine,860311,2
POV: You are a Russian VDV paratrooper that fell asleep on watch duty.,17401,ugpfj9,https://i.redd.it/68p62ca7c2x81.jpg,447,1651497417.0,RallyToTheColors,0.95,/r/ukraine/comments/ugpfj9/pov_you_are_a_russian_vdv_paratrooper_that_fell/,ukraine,860311,2
Ukrainian model Alina Baikova at the opening of New York Fashion Week,17303,10y545p,https://v.redd.it/93l7l81628ha1,137,1675974174.0,IgorVozMkUA,0.89,/r/ukraine/comments/10y545p/ukrainian_model_alina_baikova_at_the_opening_of/,ukraine,860311,2
Russian tank listening to the ground for Ukrainian troop movement,17233,vfwm7n,https://i.redd.it/hqtgna3l0l691.jpg,275,1655649595.0,TotalSpaceNut,0.96,/r/ukraine/comments/vfwm7n/russian_tank_listening_to_the_ground_for/,ukraine,860311,2
"Russia continues to burn. A tank farm in Bryansk; 🔥 military base in Bryansk; 🔥 meat processing plant in Bryansk; 🔥 ""Agropromkomplekt"" in Bryansk; 🔥 house in St. Petersburg; 🔥 air base in Ussuriysk; 🔥 police stations in Moscow, Irkutsk and Novosibirsk; 🔥 shopping center in the suburbs.",17164,uc4vnj,https://t.me/rf200_nooow/2896?single,1274,1650949289.0,Substantial-Ad-6808,0.93,/r/ukraine/comments/uc4vnj/russia_continues_to_burn_a_tank_farm_in_bryansk/,ukraine,860311,2
"In the Lviv Museum of Science, the most popular attraction is where you can reenact the sinking of the 186m Moskva again and again and again.",17065,10mp6r3,https://v.redd.it/kl38fghm4mea1,260,1674837229.0,TheGuvnor247,0.93,/r/ukraine/comments/10mp6r3/in_the_lviv_museum_of_science_the_most_popular/,ukraine,860311,2
The Foreign Ministry urged Reuters not to promote Russia's propaganda vocabulary,16913,v150fl,https://i.redd.it/0hiw0yshcn291.jpg,178,1653931009.0,ranaor,0.95,/r/ukraine/comments/v150fl/the_foreign_ministry_urged_reuters_not_to_promote/,ukraine,860311,2
The first vessel (since February 24th) loaded with the Ukrainian grain has left Odessa port,16886,wdaw6x,https://v.redd.it/fyb71c65x1f91,417,1659337682.0,ThaIgk,0.97,/r/ukraine/comments/wdaw6x/the_first_vessel_since_february_24th_loaded_with/,ukraine,860311,2
"The ""Freedom of Russia"" Legion in the Ukrainian Army have released their manifesto and call for all Russians to join them to fight against the Putin regime [Source, manifesto & translation in comments]",16875,u3dyl7,https://i.redd.it/9nhmolvixgt81.jpg,509,1649930808.0,MicrowaveBurns,0.97,/r/ukraine/comments/u3dyl7/the_freedom_of_russia_legion_in_the_ukrainian/,ukraine,860311,2
"Rest in peace, Julia.",16780,11pma04,https://i.redd.it/wjxgim89tcna1.png,192,1678646809.0,esberat,0.93,/r/ukraine/comments/11pma04/rest_in_peace_julia/,ukraine,860311,2
"Latvia, Lithuania, Estonia, Poland, the Czech Republic, Slovakia, Denmark, Belgium and the Netherlands no longer accept documents from Russians for tourist visas, the Association of Tour Operators of Russia reports.",16730,xd2oon,https://mobile.twitter.com/Flash_news_ua/status/1569614310003060736,601,1663060418.0,Practical_Quit_8873,0.96,/r/ukraine/comments/xd2oon/latvia_lithuania_estonia_poland_the_czech/,ukraine,860311,2
"One of the best sons of Ukraine died, Alexander Aleksandrovich Marchenko. Rescuing his subordinates, Kamenyar ordered them to retreat, and he and three soldiers accepted the battle. His last fight. Heroes do not die! April 3, 2022",16657,tvevz6,https://i.redd.it/4jbaxxz6ocr81.jpg,264,1649007602.0,305FUN,0.97,/r/ukraine/comments/tvevz6/one_of_the_best_sons_of_ukraine_died_alexander/,ukraine,860311,2
"Finns have knitted over 20,000 pairs of socks for Ukrainian soldiers!",16582,xya4uo,https://www.reddit.com/gallery/xya4uo,383,1665176477.0,PanEuropeanism,0.97,/r/ukraine/comments/xya4uo/finns_have_knitted_over_20000_pairs_of_socks_for/,ukraine,860311,2
During Live feed on Russian TV the stock exchange expert drank and cheered to the death of the Russian stock market and said that he would go to work as Santa Claus.,16520,t5qj3p,https://v.redd.it/p4z4j5zsw5l81,658,1646310581.0,Alone_Hedgehog7244,0.98,/r/ukraine/comments/t5qj3p/during_live_feed_on_russian_tv_the_stock_exchange/,ukraine,860311,2
Photos from the mall after the missile strike. “Let putin save his face”,16511,vm3kf9,https://www.reddit.com/gallery/vm3kf9,843,1656357742.0,JD017,0.96,/r/ukraine/comments/vm3kf9/photos_from_the_mall_after_the_missile_strike_let/,ukraine,860311,2
"In Warsaw, Poland, activists wake up Russian diplomats at 6 a.m. with the sounds of explosions and air raid sirens.",16475,11amz5g,https://mobile.twitter.com/Euan_MacDonald/status/1629031778403905536?ref_src=twsrc%5Egoogle%7Ctwcamp%5Eserp%7Ctwgr%5Etweet,310,1677229416.0,Practical_Quit_8873,0.96,/r/ukraine/comments/11amz5g/in_warsaw_poland_activists_wake_up_russian/,ukraine,860311,2
UA liberators wish everyone a good morning from Kupiansk,16468,xsu4pu,https://i.redd.it/qt4sam8qu6r91.jpg,149,1664627518.0,TinyStrawberry23,0.94,/r/ukraine/comments/xsu4pu/ua_liberators_wish_everyone_a_good_morning_from/,ukraine,860311,2
"Ukraine claims 5,300 Russian deaths so far! 146 tanks, 29 Jets and over 1,000 armoured fighting vehicles. Putin has severely underestimated the grit, patriotism, and bravery of this man. President Zelenskiy, fight on you hero.",16349,t3ipe4,https://i.redd.it/if4om7xpilk81.jpg,485,1646063619.0,abdulkxrim,0.99,/r/ukraine/comments/t3ipe4/ukraine_claims_5300_russian_deaths_so_far_146/,ukraine,860311,2
17% od Ukrainian army are women. Absolutely bad ass.,16286,t2qp2c,https://www.reddit.com/gallery/t2qp2c,595,1645976101.0,madwolli,0.98,/r/ukraine/comments/t2qp2c/17_od_ukrainian_army_are_women_absolutely_bad_ass/,ukraine,860311,2
Mark Hamill sent 500 drones to Ukraine in past month,16201,y9cn4u,https://thehill.com/blogs/in-the-know/3697568-mark-hamill-sent-500-drones-to-ukraine-in-past-month/,480,1666306483.0,TheRealMykola,0.97,/r/ukraine/comments/y9cn4u/mark_hamill_sent_500_drones_to_ukraine_in_past/,ukraine,860311,2
BREAKING: The European Parliament adopts a resolution declaring Russia a terrorist state!,16079,z2mmxi,https://twitter.com/guyverhofstadt/status/1595375911351746560,360,1669202666.0,IgorVozMkUA,0.96,/r/ukraine/comments/z2mmxi/breaking_the_european_parliament_adopts_a/,ukraine,860311,2
"Ukrainian flag raised in Vysokopillia, Kherson oblast",16062,x5k6ao,https://i.redd.it/pkq63i80ptl91.jpg,201,1662288972.0,Siderae,0.96,/r/ukraine/comments/x5k6ao/ukrainian_flag_raised_in_vysokopillia_kherson/,ukraine,860311,2
"Captured Russian conscript, birth year: 2004!",15984,uml6hv,https://v.redd.it/9lepht3q1oy81,1717,1652196101.0,onesole,0.93,/r/ukraine/comments/uml6hv/captured_russian_conscript_birth_year_2004/,ukraine,860311,2
"The Foreign Ministers of Finland, Estonia, Latvia, Lithuania, Norway, Iceland, and Sweden have arrived in Kyiv",15973,z6wskm,https://i.redd.it/uyv9tiyqkq2a1.jpg,509,1669642628.0,TheRealMykola,0.96,/r/ukraine/comments/z6wskm/the_foreign_ministers_of_finland_estonia_latvia/,ukraine,860311,2
"Russian President Putin: ""Regardless of which country declares a no-fly zone over Ukraine, we will consider it participation in the war. It doesn't matter if the said country is a member of any alliance"".",15933,t7a72w,https://i.redd.it/9nfud3hhokl81.jpg,2113,1646489294.0,KhanKavkaz,0.96,/r/ukraine/comments/t7a72w/russian_president_putin_regardless_of_which/,ukraine,860311,2
Pripyat Territorial Defence Forces have a Fallout-inspired badge,15917,uczeyi,https://i.redd.it/19m4mga4h1w81.jpg,273,1651051146.0,boskee,0.96,/r/ukraine/comments/uczeyi/pripyat_territorial_defence_forces_have_a/,ukraine,860311,2
"In Berdyansk, a mine was found near the bridge and houses - an ordinary Ukrainian man moved it to a forest with his bare hands.",15902,t2os5w,https://v.redd.it/56hfcebbtdk81,678,1645970323.0,vlFrozen,0.98,/r/ukraine/comments/t2os5w/in_berdyansk_a_mine_was_found_near_the_bridge_and/,ukraine,860311,2
"97-year-old from Volyn, Ukraine. The sign says ""I survived Hitler and the Germans. I was at the reconstruction of Donbas. I will survive Putin and his locusts. Glory to Ukraine.” 🇺🇦💛💙",15852,t3f3c1,https://i.redd.it/4d1nyr0xnkk81.jpg,126,1646053259.0,abdulkxrim,0.99,/r/ukraine/comments/t3f3c1/97yearold_from_volyn_ukraine_the_sign_says_i/,ukraine,860311,2
"Kyiv region's residents reported that the Russian occupiers had mined a beehive but bees saved the people. After opening the hive's lid, there was no explosion, because in six months the bees filled the igniters with honey and the pins did not pop out",15797,y206h5,https://i.redd.it/m8fs7f1mpct91.jpg,642,1665570143.0,merbaby11,0.97,/r/ukraine/comments/y206h5/kyiv_regions_residents_reported_that_the_russian/,ukraine,860311,2
A message from Ukraine's border guards to mobilised Russians,15743,xtjcdt,https://v.redd.it/w5mxq8s5rcr91,374,1664698976.0,Zhana-Aul,0.95,/r/ukraine/comments/xtjcdt/a_message_from_ukraines_border_guards_to/,ukraine,860311,2
"so much for Putin’s pivot to China. Chinese-sponsored media abruptly began to show Ukrainian civilian death and destruction today, ahead of Xi and Biden talk tomorrow",15645,tgm3u5,https://v.redd.it/i68uaraes0o81,980,1647556030.0,Artane_33,0.98,/r/ukraine/comments/tgm3u5/so_much_for_putins_pivot_to_china/,ukraine,860311,2
"In Russia, in the Rostov region, the Novoshakhtinsky oil refinery is on fire. Eyewitnesses reported that the plant caught fire because of a kamikaze drone.",15528,vi0h7j,https://v.redd.it/qfe86sq0y4791,784,1655887447.0,onesole,0.96,/r/ukraine/comments/vi0h7j/in_russia_in_the_rostov_region_the/,ukraine,860311,2
The flag of Russia was removed from the building of the Kherson regional state administration.,15432,ykxat3,https://i.redd.it/j6jm6hhcgpx91.jpg,336,1667467812.0,Zhana-Aul,0.97,/r/ukraine/comments/ykxat3/the_flag_of_russia_was_removed_from_the_building/,ukraine,860311,2
Kyiv today,15337,tp6hhp,https://v.redd.it/ir3yx7ys3tp81,334,1648334694.0,De-nis,0.97,/r/ukraine/comments/tp6hhp/kyiv_today/,ukraine,860311,2
4 HIMARS firing at once,15334,wf2u77,https://v.redd.it/x7y7000x4hf91,1028,1659521855.0,Siderae,0.95,/r/ukraine/comments/wf2u77/4_himars_firing_at_once/,ukraine,860311,2
Baltics Foreign ministers issue joint call on germany to provide tanks for Ukraine,15314,10ho2dr,https://i.redd.it/vjdhmqe1gdda1.jpg,1259,1674296066.0,brayduck,0.93,/r/ukraine/comments/10ho2dr/baltics_foreign_ministers_issue_joint_call_on/,ukraine,860311,2
"This is Sergey Volina, the commander of the 36th separate brigade of the Marine Corps in Mariupol. This man is a hero leading heroes - this man deserves to get the help he has asked for so they can liberate Mariupol.",15298,u6i4mu,https://i.redd.it/jtpeq4vjkbu81.jpg,174,1650301782.0,TheGuvnor247,0.95,/r/ukraine/comments/u6i4mu/this_is_sergey_volina_the_commander_of_the_36th/,ukraine,860311,2
"With 800,000 members, this subreddit is the largest Pro-Ukraine Platform on any social media network! Thank you all for your support!",15252,y1rjn8,https://www.reddit.com/r/ukraine/comments/y1rjn8/with_800000_members_this_subreddit_is_the_largest/,340,1665541356.0,TheRealMykola,0.95,/r/ukraine/comments/y1rjn8/with_800000_members_this_subreddit_is_the_largest/,ukraine,860311,2
Anonymous hackers now targeting Russian websites in retaliation for the Ukraine invasion.,15245,t0l7kb,https://i.redd.it/2ub8v5iahuj81.png,536,1645736254.0,Chasith,0.98,/r/ukraine/comments/t0l7kb/anonymous_hackers_now_targeting_russian_websites/,ukraine,860311,2
"Nastia 13, killed by a mortar attack while riding her bike home, after working as a volunteer organizing food and aid distribution. Lysychansk",15219,vkvhb1,https://i.redd.it/cqwg8xx2xv791.jpg,426,1656214063.0,TotalSpaceNut,0.96,/r/ukraine/comments/vkvhb1/nastia_13_killed_by_a_mortar_attack_while_riding/,ukraine,860311,2
"Protests against the occupation of Ukraine in Novosibirsk, Russia. ❤️",15173,t2lgvg,https://v.redd.it/6odfe1sxrck81,195,1645957779.0,-martinique-,0.99,/r/ukraine/comments/t2lgvg/protests_against_the_occupation_of_ukraine_in/,ukraine,860311,2
"Another interview with captured Russians. If this is real, it's big.",15156,t7cbkj,https://v.redd.it/0r0svft47ll81,1379,1646495639.0,Ignash3D,0.99,/r/ukraine/comments/t7cbkj/another_interview_with_captured_russians_if_this/,ukraine,860311,2
STALKER 2 devs show how the studio was impacted by the on-going war in Ukraine. Shown at the XBox games showcase,15148,vcaaml,https://v.redd.it/bu95e8g6sm591,394,1655231863.0,TotalSpaceNut,0.97,/r/ukraine/comments/vcaaml/stalker_2_devs_show_how_the_studio_was_impacted/,ukraine,860311,2
Montage of Russian crimes shown to the US Congress by President Zelenskyy,14969,tfianp,https://v.redd.it/u95wojdr4rn81,976,1647439139.0,boskee,0.98,/r/ukraine/comments/tfianp/montage_of_russian_crimes_shown_to_the_us/,ukraine,860311,2
International Legion liberated another Ukrainian village near Kyiv.,14972,tn0jhw,https://v.redd.it/99klx5uy0ep81,930,1648152138.0,madwolli,0.98,/r/ukraine/comments/tn0jhw/international_legion_liberated_another_ukrainian/,ukraine,860311,2
"Ukrainian lawyer, public figure and military man Masi Nayem, who was severely wounded in battle and lost one eye at the beginning of summer, became the face of the new advertising campaign of Indposhiv, a Ukrainian men's clothing brand.",14904,xw688p,https://i.redd.it/gjgko06mlyr91.jpg,280,1664963444.0,Lady__Midnight,0.97,/r/ukraine/comments/xw688p/ukrainian_lawyer_public_figure_and_military_man/,ukraine,860311,2
"A monument glorifying the Soviet Red Army in Litomerice, Czechia has been “vandalized”. Somebody has thrown red paint on it after modifying the pedestal, making it look like a washing machine.",14760,yd32j2,https://i.redd.it/5h81bypvyxv91.jpg,527,1666699203.0,gkanor,0.96,/r/ukraine/comments/yd32j2/a_monument_glorifying_the_soviet_red_army_in/,ukraine,860311,2
Bakhmut Holds! Bakhmut is Ukraine!,14738,zcrot6,https://i.redd.it/jaqp5lgx8z3a1.jpg,303,1670201487.0,RallyToTheColors,0.96,/r/ukraine/comments/zcrot6/bakhmut_holds_bakhmut_is_ukraine/,ukraine,860311,2
"Filming himself on a mobile phone, Ukrainian President Zelensky states that the Russian attack against the Zaporizhzhia Nuclear power plant might trigger a catastrophic disaster beyond Chernobyl.",14740,t682ek,https://v.redd.it/3w2j1d2a0al81,705,1646360088.0,GroundbreakingSet187,0.98,/r/ukraine/comments/t682ek/filming_himself_on_a_mobile_phone_ukrainian/,ukraine,860311,2
How Germany takes care of Ukrainian wounded. Soldiers POV. Thank you 🇺🇦🤝🇩🇪,14653,xfudor,https://v.redd.it/ugjgvveho8o91,582,1663342095.0,CorsicA123,0.96,/r/ukraine/comments/xfudor/how_germany_takes_care_of_ukrainian_wounded/,ukraine,860311,2
These here are Ukrainian refugees after cleaning up a park in Poland as a thank you for hosting them. They're organising these things all over Poland now,14547,u1r5pp,https://i.redd.it/fbskczehz0t81.png,313,1649740782.0,TotalSpaceNut,0.98,/r/ukraine/comments/u1r5pp/these_here_are_ukrainian_refugees_after_cleaning/,ukraine,860311,2
"Congratulations to the two volunteer soldiers, Lesya and Valeriy, who got married today near the frontline in Kyiv. Live long!",14541,t7y54k,https://v.redd.it/wze4zgqwfrl81,184,1646571181.0,PanEuropeanism,0.99,/r/ukraine/comments/t7y54k/congratulations_to_the_two_volunteer_soldiers/,ukraine,860311,2
"In the video, a young girl - a combat medic under fire from artillery, is in one of the hottest spots.",14471,vt0cze,https://v.redd.it/jrcbvwydh0a91,932,1657141007.0,valeron_b,0.92,/r/ukraine/comments/vt0cze/in_the_video_a_young_girl_a_combat_medic_under/,ukraine,860311,2
Ukrainian farmers know to put destroyed Russian equipment to a good use,14377,x8x97i,https://v.redd.it/y8ks3nw7pnm91,235,1662634241.0,ijnfrt,0.97,/r/ukraine/comments/x8x97i/ukrainian_farmers_know_to_put_destroyed_russian/,ukraine,860311,2
"Ukraine Translator for Ukrainian President Volodymyr Zelensky's address to the European Parliament becomes audibly emotional. ""Every square of today, no matter what it's called, is going to be called Freedom Square, in every city of our country. Nobody is gonna break us.""",14352,t46vo1,https://v.redd.it/1zcxriadnrk81,264,1646137839.0,abdulkxrim,0.99,/r/ukraine/comments/t46vo1/ukraine_translator_for_ukrainian_president/,ukraine,860311,2
Residents of Balaklia are greeting Ukrainian army,14329,x98njm,https://v.redd.it/oi9y2ckp4qm91,468,1662663695.0,ijnfrt,0.96,/r/ukraine/comments/x98njm/residents_of_balaklia_are_greeting_ukrainian_army/,ukraine,860311,2
"When the camp workers found out that a young girl from Ukraine is alone on her birthday in a refugee camp in Romania, they did this.",14227,t797zo,https://v.redd.it/azlzubmzekl81,270,1646486119.0,Sunnyflbunny,0.98,/r/ukraine/comments/t797zo/when_the_camp_workers_found_out_that_a_young_girl/,ukraine,860311,2
Mitch McConnell and Susan Collins make a surprise visit to Kyiv,14234,upigkq,https://i.redd.it/1uga1a3hcgz81.jpg,2260,1652538701.0,CapitalString,0.83,/r/ukraine/comments/upigkq/mitch_mcconnell_and_susan_collins_make_a_surprise/,ukraine,860311,2
Russian occupiers are stealing all the metal produced on AzovSteel from Mariupol,14216,v0w1kf,https://v.redd.it/rfdwhh7ewk291,684,1653901435.0,akvit,0.96,/r/ukraine/comments/v0w1kf/russian_occupiers_are_stealing_all_the_metal/,ukraine,860311,2
"WWII veteran, survivor of Leningrad Blockade, Yelena Osipova, arrested for peaceful protest against war in Saint Petersburg",14172,t5a3se,https://v.redd.it/n9sg7jfbb1l81,483,1646254890.0,Alone_Hedgehog7244,0.99,/r/ukraine/comments/t5a3se/wwii_veteran_survivor_of_leningrad_blockade/,ukraine,860311,2
"After long time with no connection to the outside world, people from the liberated territories of Ukraine have ability to call their family thanks to Starlink [subbed]",14020,tzoxfc,https://v.redd.it/8bf7pjm0sgs81,554,1649493100.0,akvit,0.95,/r/ukraine/comments/tzoxfc/after_long_time_with_no_connection_to_the_outside/,ukraine,860311,2
Candidate status for Ukraine approved by European Parliament,13992,viu1ml,https://i.redd.it/6ezwrz3roc791.jpg,511,1655981200.0,PanEuropeanism,0.97,/r/ukraine/comments/viu1ml/candidate_status_for_ukraine_approved_by_european/,ukraine,860311,2
