title,score,id,url,num_comments,created,author,upvote_ratio,permalink,subreddit,subreddit_subscribers,depth
"Meet 'Rambo', a pup guarding post with Ukranian soldiers.",114252,t1m70r,https://v.redd.it/xm3ta28fe3k81,1317,1645844267.0,lonely_fucker69,0.94,/r/interestingasfuck/comments/t1m70r/meet_rambo_a_pup_guarding_post_with_ukranian/,interestingasfuck,11275008,2
Saturation divers live at the bottom of the ocean for 28 days at a time in complete and utter darkness. They work in an incredibly hostile and alien environment and are rarely recognized for their courage.,113915,wldoe8,https://v.redd.it/5v5qacxddzg91,4371,1660178483.0,Slick0strich,0.93,/r/interestingasfuck/comments/wldoe8/saturation_divers_live_at_the_bottom_of_the_ocean/,interestingasfuck,11275008,2
"Absolute peak Russia. Asked whether it was planning to attack other countries, Lavrov said: ""We are not planning to attack other countries. We didn't attack Ukraine in the first place"".",113543,taxojr,https://v.redd.it/4eevmon1wjm81,6331,1646915580.0,lonely_fucker69,0.88,/r/interestingasfuck/comments/taxojr/absolute_peak_russia_asked_whether_it_was/,interestingasfuck,11275008,2
A clothing company makes custom shirts with magnetic buttons for a man with cerebral palsy,113365,jeb2az,https://gfycat.com/tiredvengefulhoneybee,1613,1603142325.0,HyperKing69,0.83,/r/interestingasfuck/comments/jeb2az/a_clothing_company_makes_custom_shirts_with/,interestingasfuck,11275008,2
"Swap your boring lawn grass with red creeping thyme, grows 3 inch tall max, requires no mowing, lovely lemony scent, can repel mosquitoes, grows all year long, better for local biodiversity.",113127,o4d2km,https://i.redd.it/gg6mdm8k2h671.jpg,3394,1624217350.0,GallowBoob,0.88,/r/interestingasfuck/comments/o4d2km/swap_your_boring_lawn_grass_with_red_creeping/,interestingasfuck,11275009,2
This forest noise amplifier is what my life has been missing,113013,lb4bfr,https://i.redd.it/v7rij955a4f61.jpg,1584,1612294620.0,GallowBoob,0.88,/r/interestingasfuck/comments/lb4bfr/this_forest_noise_amplifier_is_what_my_life_has/,interestingasfuck,11275009,2
How Bridges Were Constructed During The 14th century,112881,mbab34,https://gfycat.com/bouncydistantblobfish-bridge,1916,1616489307.0,NiceCasualRedditGuy,0.88,/r/interestingasfuck/comments/mbab34/how_bridges_were_constructed_during_the_14th/,interestingasfuck,11275009,2
"1,500-year-old Ceramic Maya Figurine with Removable Helmet, from El Perú-Waka', Petén, Guatemala",112840,n8g0bn,https://i.redd.it/i1fv10pv04y61.jpg,1765,1620572610.0,eskylabs,0.96,/r/interestingasfuck/comments/n8g0bn/1500yearold_ceramic_maya_figurine_with_removable/,interestingasfuck,11275009,2
"A solar tube, also called a sun tunnel, is a great way to get daylight into a dark space.",112395,lt6m4b,https://gfycat.com/horriblethoughtfulbeardedcollie,2536,1614370217.0,mtimetraveller,0.94,/r/interestingasfuck/comments/lt6m4b/a_solar_tube_also_called_a_sun_tunnel_is_a_great/,interestingasfuck,11275009,2
Robotic basketball hoop won't let you miss,112303,ghl8o6,https://i.imgur.com/db9be3W.gifv,1356,1589193772.0,aloofloofah,0.95,/r/interestingasfuck/comments/ghl8o6/robotic_basketball_hoop_wont_let_you_miss/,interestingasfuck,11275009,2
This dad made this game from cardboard for his daughter,112237,ig5h9p,https://i.imgur.com/2p152nN.gifv,1176,1598330506.0,sarveshak99,0.95,/r/interestingasfuck/comments/ig5h9p/this_dad_made_this_game_from_cardboard_for_his/,interestingasfuck,11275009,2
Sylvester Stallone still has the turtles from Rocky. They are 46 years old.,111956,p9ce8g,https://i.redd.it/slhcettpuwi71.jpg,1040,1629638598.0,gangbangkang,0.88,/r/interestingasfuck/comments/p9ce8g/sylvester_stallone_still_has_the_turtles_from/,interestingasfuck,11275009,2
The incredible photo captures the moment an orangutan reached out to help a conservationist who appeared to be stuck in a river. The picture was taken in a conservation forest area in Borneo as the man searched for snakes in the river to protect apes living in the area.,111785,kn7wge,https://i.redd.it/e405hm7pcd861.png,2229,1609353502.0,THECUTEKITTYCAT,0.96,/r/interestingasfuck/comments/kn7wge/the_incredible_photo_captures_the_moment_an/,interestingasfuck,11275009,2
Stream instantly turns to snow,111038,mss9rd,https://i.imgur.com/MeCD8Ie.gifv,881,1618671580.0,solateor,0.94,/r/interestingasfuck/comments/mss9rd/stream_instantly_turns_to_snow/,interestingasfuck,11275009,2
"Never before seen 9/11 photo, discovered in a photo book I received from a late relative. The photos have never been digitized nor seen by anyone other than her — until now.",110995,mxyatn,https://i.redd.it/eptk1e2e78v61.jpg,3645,1619315689.0,hanfanson,0.89,/r/interestingasfuck/comments/mxyatn/never_before_seen_911_photo_discovered_in_a_photo/,interestingasfuck,11275009,2
Pulling a post from the ground with a chain wrapped around a car wheel,109809,ipz90w,https://gfycat.com/deafeningimpeccableislandcanary,1761,1599725547.0,Thund3rbolt,0.96,/r/interestingasfuck/comments/ipz90w/pulling_a_post_from_the_ground_with_a_chain/,interestingasfuck,11275009,2
"Hi! Remember me? The white blood cell immunotherapy girl? Well, update: IT WORKED. Stage 4 to NO CANCER in 3 months! Zero evidence of disease at 3mo scan, and staying that way. Science is magic. (link to og post in comments)",109673,kkrerj,https://i.imgur.com/rqbdbvR.jpg,1636,1609021804.0,sarahjewel,0.89,/r/interestingasfuck/comments/kkrerj/hi_remember_me_the_white_blood_cell_immunotherapy/,interestingasfuck,11275009,2
Honda's new stabilization system can even keep a bike upright without a stand,109607,r2bpm8,https://gfycat.com/hilariousdecimalbilby,1592,1637890591.0,9999monkeys,0.95,/r/interestingasfuck/comments/r2bpm8/hondas_new_stabilization_system_can_even_keep_a/,interestingasfuck,11275009,2
How Hong Kong protestors deal with tear gas,109500,cj3epd,https://i.imgur.com/yFTGjhk.gifv,3229,1564357993.0,dickfromaccounting,0.96,/r/interestingasfuck/comments/cj3epd/how_hong_kong_protestors_deal_with_tear_gas/,interestingasfuck,11275009,2
Acropolis of Athens with snowfall from this year.,109030,lp6p8h,https://i.redd.it/mcwbd83zbwi61.jpg,881,1613941766.0,PC_Cuuhhrriiss,0.96,/r/interestingasfuck/comments/lp6p8h/acropolis_of_athens_with_snowfall_from_this_year/,interestingasfuck,11275009,2
Medieval armour vs. full weight medieval arrows,108860,ro0kqv,https://i.imgur.com/oFRShKO.gifv,2826,1640399675.0,aloofloofah,0.93,/r/interestingasfuck/comments/ro0kqv/medieval_armour_vs_full_weight_medieval_arrows/,interestingasfuck,11275009,2
A massive astroid/comet hits the surface of jupiter on the 13th of september,108675,pp1a4z,https://gfycat.com/oldfashionedblackhart,3444,1631747382.0,thunde-r,0.95,/r/interestingasfuck/comments/pp1a4z/a_massive_astroidcomet_hits_the_surface_of/,interestingasfuck,11275009,2
How Tequila is made,108484,ibxrwa,https://i.imgur.com/H0AsiZ6.gifv,2445,1597742880.0,__Dawn__Amber__,0.94,/r/interestingasfuck/comments/ibxrwa/how_tequila_is_made/,interestingasfuck,11275009,2
The moment Zelensky hears about the bombing of the Babyn Yar Holocaust memorial for the first time was caught on camera. This is his reaction,108451,t57r4t,https://v.redd.it/uhwsr36is0l81,2419,1646248565.0,sewn_of_a_gun,0.89,/r/interestingasfuck/comments/t57r4t/the_moment_zelensky_hears_about_the_bombing_of/,interestingasfuck,11275009,2
"A Silverback waiting to see the humans stepping aside for him, as he would expect from his troop",108449,nmh4u4,https://i.imgur.com/7fcYFCr.gifv,2869,1622148206.0,Ainsley-Sorsby,0.96,/r/interestingasfuck/comments/nmh4u4/a_silverback_waiting_to_see_the_humans_stepping/,interestingasfuck,11275009,2
The bubbles forming on the surface of a glass of sparkling wine are in perfect circular order,108329,n0lfm8,https://gfycat.com/whispereddeliciousalpineroadguidetigerbeetle,1312,1619634618.0,Thund3rbolt,0.95,/r/interestingasfuck/comments/n0lfm8/the_bubbles_forming_on_the_surface_of_a_glass_of/,interestingasfuck,11275009,2
Making Eye Contact with a Grey Whale,107825,mq2zmy,https://i.imgur.com/VdFYEWQ.gifv,1846,1618322888.0,eskylabs,0.96,/r/interestingasfuck/comments/mq2zmy/making_eye_contact_with_a_grey_whale/,interestingasfuck,11275009,2
"In 1945, a group of Soviet school children presented a US Ambassador with a carved US Seal as a gesture of friendship. It hung in his office for seven years before discovering it contained a listening device.",107548,mrz3fa,https://i.redd.it/0iq7azyh0it61.jpg,1943,1618562804.0,UnironicThatcherite,0.96,/r/interestingasfuck/comments/mrz3fa/in_1945_a_group_of_soviet_school_children/,interestingasfuck,11275009,2
"There is now a total of 11 people in space, the most since the shuttle era",107255,mxjsur,https://i.redd.it/9u4lvvcbg4v61.jpg,2426,1619270256.0,BlueTycho,0.95,/r/interestingasfuck/comments/mxjsur/there_is_now_a_total_of_11_people_in_space_the/,interestingasfuck,11275009,2
These 70s ‘conversation pits’ need to be brought back,107250,fwideq,https://i.redd.it/ab32fitukdr41.jpg,3077,1586256294.0,GallowBoob,0.88,/r/interestingasfuck/comments/fwideq/these_70s_conversation_pits_need_to_be_brought/,interestingasfuck,11275009,2
Shabani the Gorilla waves at his son and invites him to come and play,107238,jcvco0,https://i.imgur.com/LA4gl5W.gifv,1135,1602942273.0,Ainsley-Sorsby,0.96,/r/interestingasfuck/comments/jcvco0/shabani_the_gorilla_waves_at_his_son_and_invites/,interestingasfuck,11275009,2
A Cancer Cell Slashed Open By an Ion Beam.,107199,kdkc7k,https://i.redd.it/gdf8bu13ac561.jpg,1359,1608032967.0,gunslayerjj,0.96,/r/interestingasfuck/comments/kdkc7k/a_cancer_cell_slashed_open_by_an_ion_beam/,interestingasfuck,11275009,2
The Black-And-White Costume,106975,jz29gj,https://i.redd.it/opntesz8ku061.jpg,961,1606075078.0,j4ck132,0.92,/r/interestingasfuck/comments/jz29gj/the_blackandwhite_costume/,interestingasfuck,11275009,2
Surgeons practicing with origami,106404,kz2ze3,https://gfycat.com/fixedbigantarcticgiantpetrel,931,1610873416.0,9999monkeys,0.95,/r/interestingasfuck/comments/kz2ze3/surgeons_practicing_with_origami/,interestingasfuck,11275009,2
The difference between how a Shepherd approaches a situation compared to how a Mal approaches a situation.,106186,oeubti,https://i.imgur.com/0ehHg8e.gifv,3578,1625576016.0,__Dawn__Amber__,0.9,/r/interestingasfuck/comments/oeubti/the_difference_between_how_a_shepherd_approaches/,interestingasfuck,11275009,2
"This is neither a fox, dog or wolf. It is a Maned Wolf, and is the only species in its genus - Chrysocyon",106052,jht771,https://gfycat.com/tintedwarydamselfly,2350,1603631868.0,hate_mail,0.93,/r/interestingasfuck/comments/jht771/this_is_neither_a_fox_dog_or_wolf_it_is_a_maned/,interestingasfuck,11275009,2
These so-called wine windows were used by vintners in Italy to sell wine during plague pandemics in the 17th century. Now they are coming back to use due to coronavirus,105933,i6kdad,https://i.redd.it/d3qgvzelmzf51.jpg,700,1596983862.0,Lord-AG,0.89,/r/interestingasfuck/comments/i6kdad/these_socalled_wine_windows_were_used_by_vintners/,interestingasfuck,11275009,2
A solar eclipse happening mid-flight,105828,iflevp,https://i.redd.it/opqk4nqbzwi51.gif,737,1598259124.0,asdfpartyy,0.95,/r/interestingasfuck/comments/iflevp/a_solar_eclipse_happening_midflight/,interestingasfuck,11275009,2
"More than 100,000kg of plastic removed from the Great Pacific Garbage Patch (GPGP).",105816,w8duqo,https://v.redd.it/f8rcug5jdvd91,3091,1658822545.0,ashu71029,0.95,/r/interestingasfuck/comments/w8duqo/more_than_100000kg_of_plastic_removed_from_the/,interestingasfuck,11275009,2
Silverback Gorilla attempting to comfort a child that has fallen into his enclosure instead of displaying violent behaviour.,105762,q2hx5t,https://i.imgur.com/C9wKHXG.gifv,3183,1633517416.0,UnironicThatcherite,0.9,/r/interestingasfuck/comments/q2hx5t/silverback_gorilla_attempting_to_comfort_a_child/,interestingasfuck,11275009,2
"For the last two decades, during the spring floods, the water has been running out of this old mulberry tree in a village of Dinoša, Montenegro. It's likely due to high groundwater pressure coupled with a hollow section in the tree.",105508,jsbdxm,https://gfycat.com/timelyoddalligatorsnappingturtle,1571,1605112583.0,5_Frog_Margin,0.96,/r/interestingasfuck/comments/jsbdxm/for_the_last_two_decades_during_the_spring_floods/,interestingasfuck,11275009,2
Aeroflot 593 crashed in 1994 when the pilot let his children control the aircraft. This is the crash animation and audio log.,105443,wa4w02,https://v.redd.it/yixfa442z9e91,6128,1658999308.0,Slick0strich,0.93,/r/interestingasfuck/comments/wa4w02/aeroflot_593_crashed_in_1994_when_the_pilot_let/,interestingasfuck,11275009,2
"Orgone Accumulator, a device sold in the 1950s to allow a person sitting inside to attract orgone, a massless 'healing energy'. The FDA noted that one purchaser, a college professor, knew it was ""phony"" but found it ""helpful because his wife sat quietly in it for four hours every day.""",105328,isjktz,https://i.redd.it/a6vyl0j5t3n51.jpg,1647,1600085154.0,__Dawn__Amber__,0.94,/r/interestingasfuck/comments/isjktz/orgone_accumulator_a_device_sold_in_the_1950s_to/,interestingasfuck,11275009,2
Switzerland has mini jacuzzi boats,105275,lsbvmn,https://gfycat.com/paltryunlawfularawana,1510,1614274120.0,Unicornglitteryblood,0.92,/r/interestingasfuck/comments/lsbvmn/switzerland_has_mini_jacuzzi_boats/,interestingasfuck,11275009,2
"An agricultural engineer used this bear's night raids as a test to determine which type of honey was the best. In multiple, double-blind trials, ""Big boy"" always preferred the rare, expensive anzer honey; followed closely by chestnut, flower, and pine-wood honey.",104935,mxqs47,https://i.redd.it/o80w0t5486v61.jpg,1246,1619291713.0,__Dawn__Amber__,0.95,/r/interestingasfuck/comments/mxqs47/an_agricultural_engineer_used_this_bears_night/,interestingasfuck,11275009,2
"This Return it system in Sweden automatically sorts your plastics, glass and Misc containers for recycling and then pays you with a shopping coupon",104636,mqfy8q,https://gfycat.com/thoroughsmugamericanrobin,3483,1618362399.0,Thund3rbolt,0.94,/r/interestingasfuck/comments/mqfy8q/this_return_it_system_in_sweden_automatically/,interestingasfuck,11275009,2
Six Komodo dragons just hatched at the Bronx zoo. It’s the first time the species has successfully bred in the zoos 122 year history.,104624,rh9f23,https://v.redd.it/jbdw68dmur581,1532,1639602540.0,tandyman234,0.95,/r/interestingasfuck/comments/rh9f23/six_komodo_dragons_just_hatched_at_the_bronx_zoo/,interestingasfuck,11275009,2
This carwash installed water guns for the kids to play with while the cars are going through,104590,mat66c,https://gfycat.com/alarmedcomfortablechuckwalla,1111,1616434401.0,Thund3rbolt,0.93,/r/interestingasfuck/comments/mat66c/this_carwash_installed_water_guns_for_the_kids_to/,interestingasfuck,11275009,2
How different combinations of coastal defences and wave and tide conditions affect overtopping and flood risk,104521,qo6q8w,https://i.imgur.com/DuHM6zJ.gifv,768,1636224888.0,aloofloofah,0.95,/r/interestingasfuck/comments/qo6q8w/how_different_combinations_of_coastal_defences/,interestingasfuck,11275009,2
Brachistochrone curve. Fastest route for a ball.,104367,isoqn3,https://gfycat.com/DelayedBitesizedImperialeagle,1250,1600102107.0,mtimetraveller,0.93,/r/interestingasfuck/comments/isoqn3/brachistochrone_curve_fastest_route_for_a_ball/,interestingasfuck,11275009,2
A great example polarization effect,104086,ge7vyp,https://gfycat.com/zestydefiniteallensbigearedbat,1222,1588718435.0,Thund3rbolt,0.96,/r/interestingasfuck/comments/ge7vyp/a_great_example_polarization_effect/,interestingasfuck,11275009,2
"Saying goodbye to a species, the very last male Northern White Rhino. A powerful photo of 2018.",104063,aa94qc,https://i.redd.it/wop2z8w1vz621.jpg,2441,1545992207.0,GallowBoob,0.86,/r/interestingasfuck/comments/aa94qc/saying_goodbye_to_a_species_the_very_last_male/,interestingasfuck,11275009,2
"Langfoss waterfall, 600 meters of total drop (Akrafjord, Norway)",103884,mouagw,https://gfycat.com/ultimatenervousbluefintuna,1141,1618159714.0,WhenMachinesCry,0.96,/r/interestingasfuck/comments/mouagw/langfoss_waterfall_600_meters_of_total_drop/,interestingasfuck,11275009,2
Insane close range video of a tornado yesterday. Drone was lost,103728,n454fq,https://gfycat.com/scornfulfineballoonfish,1964,1620070437.0,solateor,0.96,/r/interestingasfuck/comments/n454fq/insane_close_range_video_of_a_tornado_yesterday/,interestingasfuck,11275009,2
Man lives for 82 years without ever seeing a woman,103648,vwxrxr,https://i.redd.it/sa8a5gtrgi841.jpg,4895,1657586078.0,haddock420,0.93,/r/interestingasfuck/comments/vwxrxr/man_lives_for_82_years_without_ever_seeing_a_woman/,interestingasfuck,11275009,2
When the wind hits the ceiling of this beach bar,103496,94t8wl,https://gfycat.com/BitesizedShamelessLcont,1103,1533487873.0,hate_mail,0.95,/r/interestingasfuck/comments/94t8wl/when_the_wind_hits_the_ceiling_of_this_beach_bar/,interestingasfuck,11275009,2
"Despite his dangerously sharp quills, Charlie the porcupine loves to be pet",103433,nkdvb4,https://i.imgur.com/l9cfLSa.gifv,1099,1621906430.0,solateor,0.95,/r/interestingasfuck/comments/nkdvb4/despite_his_dangerously_sharp_quills_charlie_the/,interestingasfuck,11275009,2
This steampunk 'watch' writes the time every minute & erases it before writing again,103031,l051ch,https://i.imgur.com/8LTgtMb.gifv,1127,1611007532.0,__Dawn__Amber__,0.9,/r/interestingasfuck/comments/l051ch/this_steampunk_watch_writes_the_time_every_minute/,interestingasfuck,11275009,2
"Lyuba is a month old Woolly Mammoth that died almost 42,000 years ago. She was found in Siberia with her skin and organs still intact and her mother’s milk still in her stomach. She is the most complete Mammoth ever discovered.",102872,mz4uft,https://i.redd.it/us2pw456dkv61.jpg,1513,1619462909.0,Fluid-Daydreamer,0.96,/r/interestingasfuck/comments/mz4uft/lyuba_is_a_month_old_woolly_mammoth_that_died/,interestingasfuck,11275009,2
