title,score,id,url,num_comments,created,author,upvote_ratio,permalink,subreddit,subreddit_subscribers,depth
"Here ya go guys, deleted pictures from the throwaway account",2211,o9a39j,https://www.reddit.com/gallery/o9a39j,684,1624843532.0,Ffcd23,0.88,/r/UFOs/comments/o9a39j/here_ya_go_guys_deleted_pictures_from_the/,UFOs,894644,2
Christopher Mellon 24 June - a DAY before the UAP report: “Non-human origin is presently the theory that best fits all the facts”,2177,o79lzp,https://i.redd.it/3srswghiz9771.jpg,558,1624567425.0,batazer,0.95,/r/UFOs/comments/o79lzp/christopher_mellon_24_june_a_day_before_the_uap/,UFOs,894644,2
"This footage is floating in the web. Help me stabilize and enhance it. Very good zoom, probably Nikon P900.",2156,ov5gv2,https://v.redd.it/n2ly1dsk9je71,474,1627730710.0,kinger90210,0.88,/r/UFOs/comments/ov5gv2/this_footage_is_floating_in_the_web_help_me/,UFOs,894644,2
RIP Michael Collins - Apollo 11 astronaut and believer in extraterrestrial life,2141,n0nj2e,https://i.redd.it/hbs5fhfw0zv61.jpg,84,1619640386.0,batazer,0.98,/r/UFOs/comments/n0nj2e/rip_michael_collins_apollo_11_astronaut_and/,UFOs,894644,2
An animation of my mother’s sighting in the 1970s. Upstate NY area,2107,o3r0qt,https://i.redd.it/fh51fjqppa671.jpg,291,1624140388.0,GrahamUhelski,0.95,/r/UFOs/comments/o3r0qt/an_animation_of_my_mothers_sighting_in_the_1970s/,UFOs,894644,2
750+ Pages of Internal NASA Emails on UFOs/UAP Just Released,2108,y85xfs,https://www.theblackvault.com/documentarchive/nasa-uap-ufo-related-internal-communications,323,1666193816.0,blackvault,0.98,/r/UFOs/comments/y85xfs/750_pages_of_internal_nasa_emails_on_ufosuap_just/,UFOs,894644,2
"Luis Elizondo would be willing to testify before Congress: ""I will tell Congress and American people what I know""",2106,o2jk6c,https://i.redd.it/mchl6e5f6z571.png,266,1624002016.0,AlienDisclosureGroup,0.97,/r/UFOs/comments/o2jk6c/luis_elizondo_would_be_willing_to_testify_before/,UFOs,894644,2
Testimonies of Astronauts. How long can the public ignore these Witnesses? Submission Comment will include 5+ other Testimonies.,2095,px873y,https://v.redd.it/vxgbazboc9q71,434,1632841075.0,kinger90210,0.96,/r/UFOs/comments/px873y/testimonies_of_astronauts_how_long_can_the_public/,UFOs,894644,2
Pentagon Press Secretary Asked About Next Week's Hearing and AOIMSG,2092,umwa72,https://v.redd.it/p9vmpv3ejqy81,498,1652226611.0,TreeLover4twenty,0.97,/r/UFOs/comments/umwa72/pentagon_press_secretary_asked_about_next_weeks/,UFOs,894644,2
Compilation of UFOs in NASA archives!,2087,p1fkj9,https://v.redd.it/o4ij5tf8sfg71,279,1628560271.0,Flimsy-Union1524,0.96,/r/UFOs/comments/p1fkj9/compilation_of_ufos_in_nasa_archives/,UFOs,894644,2
"New Lima, Brazil. 31st May 2020. Video + 5 pictures of rapidly form changing Plasma Looking Object. Witness Statement and additional pics in comments",2078,piggwp,https://v.redd.it/mfcnhcg0rpl71,505,1630860150.0,kinger90210,0.88,/r/UFOs/comments/piggwp/new_lima_brazil_31st_may_2020_video_5_pictures_of/,UFOs,894644,2
If Chris Mellon is saying this - pay attention!: “Govt could be concealing physical proof of ET life”,2074,na3obp,https://i.redd.it/8tdx6qdm9jy61.jpg,490,1620757154.0,batazer,0.93,/r/UFOs/comments/na3obp/if_chris_mellon_is_saying_this_pay_attention_govt/,UFOs,894644,2
UAP Capable of 90 Degree Turns,2066,11hm2cq,https://v.redd.it/q960yh1fomla1,273,1677894744.0,TreeLover4twenty,0.96,/r/UFOs/comments/11hm2cq/uap_capable_of_90_degree_turns/,UFOs,894644,2
Drone footage of a UFO in Gorges du Verdon (Canyon). UFO phase shifts thru solid rock. September 2014,2070,quftuy,https://v.redd.it/v5hgpeefbrz71,356,1636981001.0,kinger90210,0.86,/r/UFOs/comments/quftuy/drone_footage_of_a_ufo_in_gorges_du_verdon_canyon/,UFOs,894644,2
Cloaked UFOs seen using Polarized sunglasses,2057,xzm9i3,https://v.redd.it/np2sxkewcss91,327,1665323720.0,littlespacemochi,0.87,/r/UFOs/comments/xzm9i3/cloaked_ufos_seen_using_polarized_sunglasses/,UFOs,894644,2
„Imagine everything you’ve been told about what we are is not entirely accurate.“ Coincidence he says similar things as the NASA Chief Bill Nelson?,2038,qf1iuy,https://v.redd.it/dr73annetgv71,1247,1635110483.0,kinger90210,0.94,/r/UFOs/comments/qf1iuy/imagine_everything_youve_been_told_about_what_we/,UFOs,894644,2
To anyone who is outside the US and wants to see the CBS 60 minutes broadcast on UFOs tonight. A streaming link:,2035,ndu60t,https://ustvgo.tv/,288,1621188670.0,Remseey2907,0.97,/r/UFOs/comments/ndu60t/to_anyone_who_is_outside_the_us_and_wants_to_see/,UFOs,894644,2
u/Expensive_Ad1774 recorded three glowing orbs a couple blocks from the US capitol last week.,1989,zjkq6a,https://v.redd.it/7t2xhqznud5a1,414,1670814144.0,AlbaneseGummies327,0.94,/r/UFOs/comments/zjkq6a/uexpensive_ad1774_recorded_three_glowing_orbs_a/,UFOs,894644,2
"CIA with a new official statement about Remote Viewing. October 27, 2021. Coincidence after new Lue Elizondo remote viewing background informations?",1990,qhtpca,https://www.reddit.com/gallery/qhtpca,808,1635446766.0,kinger90210,0.91,/r/UFOs/comments/qhtpca/cia_with_a_new_official_statement_about_remote/,UFOs,894644,2
"Circular UFO spotted by amateur astronomer Ruben Ariza during livestream over the city of Armenia in Quindío, Colombia on May 8th 2022",1980,unc7py,https://v.redd.it/u6f9n8cp4vy81,477,1652282290.0,UFOLOGY_SHORTS,0.9,/r/UFOs/comments/unc7py/circular_ufo_spotted_by_amateur_astronomer_ruben/,UFOs,894644,2
"Incredible footage of a UFO. Metallic Sphere is couple times faster as a Blue Angels Jet. Huntington Beach, California. Friday 1st October 2021",1968,q17qsl,https://v.redd.it/harifokocgr71,385,1633361465.0,kinger90210,0.91,/r/UFOs/comments/q17qsl/incredible_footage_of_a_ufo_metallic_sphere_is/,UFOs,894644,2
"“Ship radar picked up UAP seconds later, 60 miles away. A third F/A-18 then caught it on an infrared camera: it looked like a giant white Tic Tac”",1957,nigag5,https://i.redd.it/s2mbju50nn071.jpg,246,1621681779.0,batazer,0.96,/r/UFOs/comments/nigag5/ship_radar_picked_up_uap_seconds_later_60_miles/,UFOs,894644,2
Roswell 1947,1958,zb01bx,https://i.redd.it/psiykjzmrl3a1.jpg,420,1670020257.0,MartianMaterial,0.93,/r/UFOs/comments/zb01bx/roswell_1947/,UFOs,894644,2
15.03.20 UFO during thunderstorm captured in Barcelona,1950,xo0qpw,https://v.redd.it/grhuyowiw2q91,515,1664144023.0,littlespacemochi,0.79,/r/UFOs/comments/xo0qpw/150320_ufo_during_thunderstorm_captured_in/,UFOs,894644,2
Former senator Harry Reid just gave a big L to people who question Lue Elizondo's credibility.,1950,mzft1f,https://i.redd.it/wn4ef1ph1nv61.jpg,317,1619495309.0,swiggybaby,0.98,/r/UFOs/comments/mzft1f/former_senator_harry_reid_just_gave_a_big_l_to/,UFOs,894644,2
"Treviso Air Force Base, Italy 🇮🇹 | June 18th 1979 at 11.30am Posting this because it’s the first colour representation of this famous black and white photograph. More information in comments",1951,vwllnk,https://i.redd.it/fm9w8uju40b91.jpg,324,1657554602.0,kinger90210,0.96,/r/UFOs/comments/vwllnk/treviso_air_force_base_italy_june_18th_1979_at/,UFOs,894644,2
Admiral Bobby Ray Inman to go on Record about UAP with Project Unity Soon (Podcast),1947,tes2je,https://i.redd.it/cu2bhj4wjkn81.jpg,449,1647359445.0,TreeLover4twenty,0.96,/r/UFOs/comments/tes2je/admiral_bobby_ray_inman_to_go_on_record_about_uap/,UFOs,894644,2
James Fox reveals a claim about the Varginha UFO incident,1946,11iiynd,https://v.redd.it/ws3hxc3kktla1,641,1677977995.0,littlespacemochi,0.91,/r/UFOs/comments/11iiynd/james_fox_reveals_a_claim_about_the_varginha_ufo/,UFOs,894644,2
"UFO captured by Brigadier General, James McDivitt, USAF Retired, who was the commander on the Gemini IV mission. June 1965. Article by theblackvault",1937,pxdc4q,https://i.redd.it/q92bkrt9laq71.jpg,445,1632855855.0,kinger90210,0.92,/r/UFOs/comments/pxdc4q/ufo_captured_by_brigadier_general_james_mcdivitt/,UFOs,894644,2
"Military Footage: Mexican-Airforce. March, 5th, 2004. Filmed by multiple Pilots using infrared equipment. Only 3 of these Objects showed up on Radar.",1920,pooxy3,https://v.redd.it/2txew4xbsnn71,406,1631708120.0,kinger90210,0.93,/r/UFOs/comments/pooxy3/military_footage_mexicanairforce_march_5th_2004/,UFOs,894644,2
"One of the best UFO photos ever - taken on a farm near McMinnville, Oregon in 1950. Majority of experts who studied photo claims it's legit however identity of the object remains unknown",1909,11i7ylb,https://i.redd.it/i7twjbykcrla1.jpg,253,1677951825.0,SirGorti,0.91,/r/UFOs/comments/11i7ylb/one_of_the_best_ufo_photos_ever_taken_on_a_farm/,UFOs,894644,2
Pentagon UAP Task Force Report Status: Not Yet Released,1909,o28x34,https://www.reddit.com/r/UFOs/comments/o28x34/pentagon_uap_task_force_report_status_not_yet/,1124,1623966762.0,ZolotoGold,0.98,/r/UFOs/comments/o28x34/pentagon_uap_task_force_report_status_not_yet/,UFOs,894644,2
This is a real photo from Roswell in 1947 of the US military trying to convince everybody a UFO is a weather balloon. They think we’re idiots.,1887,zef4pj,https://i.redd.it/hteq3awibd4a1.jpg,365,1670353830.0,MartianMaterial,0.87,/r/UFOs/comments/zef4pj/this_is_a_real_photo_from_roswell_in_1947_of_the/,UFOs,894644,2
UFOs Speed Away Lightening Fast. Gulf Breeze Indecent showing instantaneous acceleration.,1882,w21e3p,https://v.redd.it/dhr5hp75ccc91,347,1658156210.0,JBeanoBeano,0.96,/r/UFOs/comments/w21e3p/ufos_speed_away_lightening_fast_gulf_breeze/,UFOs,894644,2
"UFOs over Lima, Peru",1865,j0b4bf,https://v.redd.it/zo7e1sjacjp51,347,1601144942.0,Roacchie,0.96,/r/UFOs/comments/j0b4bf/ufos_over_lima_peru/,UFOs,894644,2
This is the recreation of the famous ' NOT MAN MADE' craft that was seen by Hacker SOLO ( Gary McKinnon ) when he hacked & accessed NASA Computers.,1854,sviesj,https://i.redd.it/4bxgiehaili81.gif,339,1645192193.0,GaryMckinnonOfficial,0.87,/r/UFOs/comments/sviesj/this_is_the_recreation_of_the_famous_not_man_made/,UFOs,894644,2
You guys in the US need to be making more noise,1838,op3wng,https://www.reddit.com/r/UFOs/comments/op3wng/you_guys_in_the_us_need_to_be_making_more_noise/,547,1626917761.0,charliebrookersright,0.93,/r/UFOs/comments/op3wng/you_guys_in_the_us_need_to_be_making_more_noise/,UFOs,894644,2
Jeremy Corbell strikes again claiming that US got fully intact craft and machines that they are trying to reverse engineer - technology made by 'non-human intelligence',1839,11dcex7,https://i.redd.it/2b4f0wjekqka1.png,946,1677506126.0,SirGorti,0.79,/r/UFOs/comments/11dcex7/jeremy_corbell_strikes_again_claiming_that_us_got/,UFOs,894644,2
Sighting in Australia Today,1832,rmbv8q,https://i.redd.it/2ccpqee525781.png,249,1640198855.0,SandOk9259,0.97,/r/UFOs/comments/rmbv8q/sighting_in_australia_today/,UFOs,894646,2
Drone Captures Triangle UFO in 4K,1822,q935au,https://v.redd.it/xc60esii5qt71,241,1634351826.0,BuzzDownBaby,0.9,/r/UFOs/comments/q935au/drone_captures_triangle_ufo_in_4k/,UFOs,894646,2
Cigar Shaped UFO Zoom In + Stabilization,1822,pb3kzw,https://v.redd.it/9qp5s7wihfj71,330,1629864294.0,BuzzDownBaby,0.94,/r/UFOs/comments/pb3kzw/cigar_shaped_ufo_zoom_in_stabilization/,UFOs,894646,2
"Tennessee Congressman alleges ""huge"" UFO cover-up in U.S. government",1824,10din8e,https://www.newsweek.com/tennessee-congressman-ufo-coverup-government-tim-burchett-1774007,367,1673885898.0,LigmaBalls-420,0.95,/r/UFOs/comments/10din8e/tennessee_congressman_alleges_huge_ufo_coverup_in/,UFOs,894646,2
Billings Montana Falling Object Video,1826,114chcb,https://v.redd.it/7yriqh6agqia1,363,1676614691.0,Rev19rb,0.95,/r/UFOs/comments/114chcb/billings_montana_falling_object_video/,UFOs,894646,2
Richard Dolan claims that details of the classified version of the UAPTF report were leaked to him.,1807,oalidx,https://i.redd.it/bt9zg93ita871.jpg,791,1625013361.0,swiggybaby,0.94,/r/UFOs/comments/oalidx/richard_dolan_claims_that_details_of_the/,UFOs,894646,2
"Well, the report could be ready Tuesday 8th June - exactly one week from today, according to Washington Post",1802,nptavc,https://i.redd.it/77l1pbunin271.jpg,418,1622552013.0,batazer,0.97,/r/UFOs/comments/nptavc/well_the_report_could_be_ready_tuesday_8th_june/,UFOs,894646,2
"Donna Hare, who was a NASA launch photographic specialist, said that in building 8 of Johnson Space Centre, there was a lab set aside specially for 'airbrushing out' UFOs from high-res sat imagery - ( Washington D.C. May 9, 2001 )",1798,xli6a9,https://v.redd.it/pycscqtp4ip91,286,1663892675.0,user678990655,0.96,/r/UFOs/comments/xli6a9/donna_hare_who_was_a_nasa_launch_photographic/,UFOs,894646,2
"CLARIFICATION: that video about ""15.03.20 UFO during thunderstorm captured in Barcelona"" is a fake video by CG artist ALIEN PLANET",1781,xod4vf,https://i.redd.it/z1vv21dwv5q91.jpg,167,1664180111.0,ufoofinterest,0.97,/r/UFOs/comments/xod4vf/clarification_that_video_about_150320_ufo_during/,UFOs,894646,2
New Pilot Reports of UFO Sightings | Gadi Schwartz on the Today show,1782,y9umb8,https://v.redd.it/74szpou716v91,262,1666361147.0,quantumcryogenics,0.97,/r/UFOs/comments/y9umb8/new_pilot_reports_of_ufo_sightings_gadi_schwartz/,UFOs,894646,2
I made new discoveries regarding the STS100-708A-48 anomaly,1780,u8eo39,https://www.reddit.com/r/UFOs/comments/u8eo39/i_made_new_discoveries_regarding_the_sts100708a48/,150,1650513357.0,UFOLOGY_SHORTS,0.96,/r/UFOs/comments/u8eo39/i_made_new_discoveries_regarding_the_sts100708a48/,UFOs,894646,2
I found more evidence confirming that the recent Tic Tac footage is a CGI hoax made by the Blake Cousins (Thirdphaseofmoon),1753,t977vf,https://www.reddit.com/r/UFOs/comments/t977vf/i_found_more_evidence_confirming_that_the_recent/,321,1646709472.0,UFOLOGY_SHORTS,0.93,/r/UFOs/comments/t977vf/i_found_more_evidence_confirming_that_the_recent/,UFOs,894646,2
"Another triangle UFO filmed with night vision , source YT back to 12 years .",1749,q4f38p,https://v.redd.it/nhy4m2mj2ds71,339,1633758117.0,NAWFAL93,0.94,/r/UFOs/comments/q4f38p/another_triangle_ufo_filmed_with_night_vision/,UFOs,894646,2
Guys...this dude makes a full UFO magazine bi-monthly and is a one man team. He has 57 followers and frankly it should be read by this entire sub.,1735,j2u27m,https://issuu.com/shadowsofyourmind/docs/soym_issue_8,84,1601497813.0,chicompj,0.99,/r/UFOs/comments/j2u27m/guysthis_dude_makes_a_full_ufo_magazine_bimonthly/,UFOs,894646,2
UFO sighting in India,1709,mkj4w0,https://v.redd.it/6v3b2yleicr61,354,1617624450.0,swiggybaby,0.95,/r/UFOs/comments/mkj4w0/ufo_sighting_in_india/,UFOs,894646,2
Obama's former pilot Andy Danzinger describes UFO encounter he had in 1989,1697,wiru4g,https://v.redd.it/z98tx0ng9dg91,325,1659910840.0,AlbaneseGummies327,0.97,/r/UFOs/comments/wiru4g/obamas_former_pilot_andy_danzinger_describes_ufo/,UFOs,894646,2
We are not alone. Washington needs to release the un redacted files. Let the people decide. - Tim Burchett on Twitter,1692,11ef5k6,https://twitter.com/timburchett/status/1630609398723756050,469,1677607034.0,shogun2909,0.9,/r/UFOs/comments/11ef5k6/we_are_not_alone_washington_needs_to_release_the/,UFOs,894646,2
Bold claims made by steven greer in his new movie : the cosmic hoax,1678,oe5b44,https://v.redd.it/0336cv87od971,850,1625484026.0,Ffcd23,0.88,/r/UFOs/comments/oe5b44/bold_claims_made_by_steven_greer_in_his_new_movie/,UFOs,894646,2
American Airlines 2292 Audio UFO Encounter on 21 February 2021.,1679,lptgcb,https://v.redd.it/51kqp8nu72j61,312,1614013064.0,RealVaultteam6,0.99,/r/UFOs/comments/lptgcb/american_airlines_2292_audio_ufo_encounter_on_21/,UFOs,894646,2
"Frankston Flinders Road, Hastings, Victoria, Australia. 7.29am May 28th 2018. Witness: Yuan Khailee Pution. More informations in comments",1665,pjo1mc,https://v.redd.it/e077074wb3m71,251,1631024565.0,kinger90210,0.93,/r/UFOs/comments/pjo1mc/frankston_flinders_road_hastings_victoria/,UFOs,894646,2
"Luis Elizondo on CNN a few hours ago: “The UAPs aren’t ours, it probably isn’t our enemies. We must be prepared to digest that it’s something else”",1662,nsrctl,https://twitter.com/the_real_klaatu/status/1401008461048123393?s=21,383,1622882798.0,batazer,0.97,/r/UFOs/comments/nsrctl/luis_elizondo_on_cnn_a_few_hours_ago_the_uaps/,UFOs,894646,2
The Classified UAP Report is OFFICIALLY confirmed as 17 pages - Here's the FULL story,1652,olh7fx,https://www.theblackvault.com/documentarchive/length-confirmed-of-classified-uap-report-by-office-of-the-director-of-national-intelligence-odni/,358,1626443323.0,blackvault,0.93,/r/UFOs/comments/olh7fx/the_classified_uap_report_is_officially_confirmed/,UFOs,894646,2
Time to clench those buttholes,1651,k6lodd,https://i.redd.it/oz6uakadi6361.jpg,263,1607091417.0,ididnotsee1,0.97,/r/UFOs/comments/k6lodd/time_to_clench_those_buttholes/,UFOs,894646,2
USA Has Secret Evidence Of UFOs breaking Sound Barrier without Sonic Boom!,1642,marzq3,https://i.redd.it/kznq0vosylo61.png,395,1616431354.0,RealVaultteam6,0.97,/r/UFOs/comments/marzq3/usa_has_secret_evidence_of_ufos_breaking_sound/,UFOs,894646,2
"Triangular UFO formation over Las Vegas, Nevada on April 30th 2022 at 4:45 AM. Credit : Jason Suraci",1614,ugot6m,https://v.redd.it/8k6qf1g252x81,209,1651495447.0,UFOLOGY_SHORTS,0.94,/r/UFOs/comments/ugot6m/triangular_ufo_formation_over_las_vegas_nevada_on/,UFOs,894646,2
"u/witwar101: THIS flew over my building! Very fast, no sound, and smooth movement. Southern Ontario.",1613,xtqmvr,https://v.redd.it/gwchgcrs9br91,263,1664722108.0,AlbaneseGummies327,0.93,/r/UFOs/comments/xtqmvr/uwitwar101_this_flew_over_my_building_very_fast/,UFOs,894646,2
