title,score,id,url,num_comments,created,author,upvote_ratio,permalink,subreddit,subreddit_subscribers,depth
Kids who succeed academically deserve scholarships more than kids who are good at sports.,59107,hrpkpp,https://www.reddit.com/r/unpopularopinion/comments/hrpkpp/kids_who_succeed_academically_deserve/,2766,1594826707.0,Branden_the_Dj,0.74,/r/unpopularopinion/comments/hrpkpp/kids_who_succeed_academically_deserve/,unpopularopinion,3441788,2
A lot of the television shows using fully adult actors in a high school setting could easily change their plot to revolve around a college setting instead of the weird fixation television has on displaying the sex lives of high schoolers,51315,is05qo,https://www.reddit.com/r/unpopularopinion/comments/is05qo/a_lot_of_the_television_shows_using_fully_adult/,1366,1600010644.0,iyxnoluwa,0.91,/r/unpopularopinion/comments/is05qo/a_lot_of_the_television_shows_using_fully_adult/,unpopularopinion,3441788,2
I'm all for being kinky but certain 'kinks' are just a mental illness masquerading as being sexually adventurous,45962,b0p30m,https://www.reddit.com/r/unpopularopinion/comments/b0p30m/im_all_for_being_kinky_but_certain_kinks_are_just/,3672,1552500071.0,Hulawan,0.84,/r/unpopularopinion/comments/b0p30m/im_all_for_being_kinky_but_certain_kinks_are_just/,unpopularopinion,3441788,2
In a lot of children's shows like Peppa Pig the fathers are consistently portrayed as bumbling idiots and the mothers as awesome heroines saving the day and it sends a very wrong message to little kids,44467,aycewu,https://www.reddit.com/r/unpopularopinion/comments/aycewu/in_a_lot_of_childrens_shows_like_peppa_pig_the/,4123,1551963923.0,Hulawan,0.84,/r/unpopularopinion/comments/aycewu/in_a_lot_of_childrens_shows_like_peppa_pig_the/,unpopularopinion,3441788,2
People who are really intense sports fans are in the same caliber of “nerd” as people really into comic books or superheroes,41753,j21is2,https://www.reddit.com/r/unpopularopinion/comments/j21is2/people_who_are_really_intense_sports_fans_are_in/,1353,1601393641.0,iyxnoluwa,0.88,/r/unpopularopinion/comments/j21is2/people_who_are_really_intense_sports_fans_are_in/,unpopularopinion,3441788,2
I miss when songs had sexual innuendos rather than just outright saying what they're doing,40777,jw3mka,https://www.reddit.com/r/unpopularopinion/comments/jw3mka/i_miss_when_songs_had_sexual_innuendos_rather/,4140,1605653699.0,revyxx,0.8,/r/unpopularopinion/comments/jw3mka/i_miss_when_songs_had_sexual_innuendos_rather/,unpopularopinion,3441788,2
People who advocate for weed and its medicinal benefits don’t actually care about the medicinal part. The majority just want to get stoned without getting judged for it.,39757,i9sa5k,https://www.reddit.com/r/unpopularopinion/comments/i9sa5k/people_who_advocate_for_weed_and_its_medicinal/,4477,1597432505.0,vivachilewn,0.68,/r/unpopularopinion/comments/i9sa5k/people_who_advocate_for_weed_and_its_medicinal/,unpopularopinion,3441788,2
"Being afraid of law enforcement, even if you don't commit any illegal activities and don't have a record, is completely normal. They have the ability to totally fuck your life up.",39104,jv9td0,https://www.reddit.com/r/unpopularopinion/comments/jv9td0/being_afraid_of_law_enforcement_even_if_you_dont/,2411,1605544357.0,HorseFacedDipShit,0.82,/r/unpopularopinion/comments/jv9td0/being_afraid_of_law_enforcement_even_if_you_dont/,unpopularopinion,3441788,2
"If your kids are running around like crazy in public and they fall over, don’t get mad at me for laughing",39007,i7tljm,https://www.reddit.com/r/unpopularopinion/comments/i7tljm/if_your_kids_are_running_around_like_crazy_in/,1078,1597159103.0,Optimal-Good-3082,0.87,/r/unpopularopinion/comments/i7tljm/if_your_kids_are_running_around_like_crazy_in/,unpopularopinion,3441788,2
"Americans vastly underestimate the number of actors who take steroids for roles, and youtube fitness culture is lying through its teeth",33603,j3d63q,https://www.reddit.com/r/unpopularopinion/comments/j3d63q/americans_vastly_underestimate_the_number_of/,2885,1601573503.0,HorseFacedDipShit,0.87,/r/unpopularopinion/comments/j3d63q/americans_vastly_underestimate_the_number_of/,unpopularopinion,3441788,2
Every company should automatically give everyone a day off for their birthday,33054,ptva87,https://www.reddit.com/r/unpopularopinion/comments/ptva87/every_company_should_automatically_give_everyone/,2179,1632403720.0,Branden_the_Dj,0.8,/r/unpopularopinion/comments/ptva87/every_company_should_automatically_give_everyone/,unpopularopinion,3441788,2
Unless a hoodie can replace my coat...there is literally no reason they should be like $60+,31884,kxf5gw,https://www.reddit.com/r/unpopularopinion/comments/kxf5gw/unless_a_hoodie_can_replace_my_coatthere_is/,2356,1610659454.0,revyxx,0.85,/r/unpopularopinion/comments/kxf5gw/unless_a_hoodie_can_replace_my_coatthere_is/,unpopularopinion,3441788,2
Being able to say “I didn’t respond/didn’t answer your call because I just didn’t feel like it” should be normalized and people shouldn’t take it personally.,31431,hunko3,https://www.reddit.com/r/unpopularopinion/comments/hunko3/being_able_to_say_i_didnt_responddidnt_answer/,960,1595260009.0,vivachilewn,0.88,/r/unpopularopinion/comments/hunko3/being_able_to_say_i_didnt_responddidnt_answer/,unpopularopinion,3441788,2
It’s incredibly fun to argue with strangers on the internet,30072,k21tsc,https://www.reddit.com/r/unpopularopinion/comments/k21tsc/its_incredibly_fun_to_argue_with_strangers_on_the/,1973,1606486489.0,Optimal-Good-3082,0.8,/r/unpopularopinion/comments/k21tsc/its_incredibly_fun_to_argue_with_strangers_on_the/,unpopularopinion,3441788,2
