title,score,id,url,num_comments,created,author,upvote_ratio,permalink,subreddit,subreddit_subscribers,depth
Rocket I made for local art show to help promote our local turners club. Build log in comments.,345,dkbl1a,https://i.redd.it/8ak7tvdx1lt31.jpg,36,1571527952.0,chaotictinkering,0.99,/r/turning/comments/dkbl1a/rocket_i_made_for_local_art_show_to_help_promote/,turning,104595,2
Riding the bevel with a razor sharp fingernail bowl gouge,343,npunjo,https://v.redd.it/cvhnwuk6un271,16,1622555904.0,Trevocb,0.99,/r/turning/comments/npunjo/riding_the_bevel_with_a_razor_sharp_fingernail/,turning,104595,2
Progress on Mesquite Hollow Form,349,ze99co,https://v.redd.it/kb24g7zh5c4a1,16,1670339701.0,BrogueEncore,0.99,/r/turning/comments/ze99co/progress_on_mesquite_hollow_form/,turning,104595,2
"We did 10 wooden trophies with my friend Carlos on the lathe. Commissioned by Hip Opsession festival in Nantes, France. Basswood/Wenge. Woodturning & chip carving. 26cm diameter.",345,srlofr,https://v.redd.it/u06ktxa0hmh81,10,1644767634.0,WoodBernCarvings,0.99,/r/turning/comments/srlofr/we_did_10_wooden_trophies_with_my_friend_carlos/,turning,104595,2
Maple burl bowl fresh off the lathe today,344,bd5t4o,https://i.redd.it/n1nj0xbbw9s21.jpg,11,1555266508.0,zst2589,0.99,/r/turning/comments/bd5t4o/maple_burl_bowl_fresh_off_the_lathe_today/,turning,104595,2
Hanging succulent planters I make. Cedar 6” tall.,343,bb2atl,https://i.redd.it/qrswduhvb5r21.jpg,22,1554775362.0,entoaggie,0.99,/r/turning/comments/bb2atl/hanging_succulent_planters_i_make_cedar_6_tall/,turning,104595,2
"A video of the Amish Beyblade was requested, so “Letteth it rip.”",347,k3eigi,https://v.redd.it/pgwu6os138261,13,1606674770.0,jthyroid,0.99,/r/turning/comments/k3eigi/a_video_of_the_amish_beyblade_was_requested_so/,turning,104595,2
First show this weekend,340,dbcam6,https://i.redd.it/cuda6m9xnqp31.jpg,55,1569853425.0,TeamBenny14,0.99,/r/turning/comments/dbcam6/first_show_this_weekend/,turning,104595,2
"I’m so stoked about this one. Shape, Colors, the way the lid fits. I’m really happy with my progress, I definitely feel like I’m improving.",344,10zct88,https://v.redd.it/4dq95q288jha1,23,1676091937.0,mikeytwocakes,0.99,/r/turning/comments/10zct88/im_so_stoked_about_this_one_shape_colors_the_way/,turning,104595,2
When people know you like woodturning and start bringing you free wood 8-D,342,f0amiq,https://i.redd.it/r84ne53k9if41.jpg,15,1581082876.0,Massis87,0.99,/r/turning/comments/f0amiq/when_people_know_you_like_woodturning_and_start/,turning,104595,2
I call this Volcanic Norfolk Pine. The tree was killed by the lava flow last here in Hawaii I was able to get a bunch of it afterwards.,342,cq4elc,https://i.redd.it/9wu2kkul8cg31.jpg,16,1565755211.0,MrKoaKine,0.99,/r/turning/comments/cq4elc/i_call_this_volcanic_norfolk_pine_the_tree_was/,turning,104595,2
"A test run of a design I've seen before, more to it than I'd first thought",345,wpzmf3,https://www.reddit.com/gallery/wpzmf3,39,1660669460.0,lowrrado,0.99,/r/turning/comments/wpzmf3/a_test_run_of_a_design_ive_seen_before_more_to_it/,turning,104595,2
Lamp in Walnut and Spalted Cottonwood. 31” by 10”,338,kdmm7c,https://www.reddit.com/gallery/kdmm7c,38,1608042271.0,GardnersGrendel,1.0,/r/turning/comments/kdmm7c/lamp_in_walnut_and_spalted_cottonwood_31_by_10/,turning,104595,2
"Since school has been closed, I’ve been without access to the lathe. I was given permission to take it home for the Summer. I built a base for it and placed it on two saw horses. Very sturdy. Turned a pen quickly. In a happy place.",338,gpaxg0,https://i.redd.it/zztqkkwrfk051.jpg,20,1590261967.0,The_Nerdy_Teacher,0.99,/r/turning/comments/gpaxg0/since_school_has_been_closed_ive_been_without/,turning,104595,2
5 unique beer tap pulls for my local pub.,340,aiggp6,https://i.redd.it/s9msvadb2vb21.jpg,21,1548113357.0,whiskeyvacation,0.99,/r/turning/comments/aiggp6/5_unique_beer_tap_pulls_for_my_local_pub/,turning,104595,2
my biggest plate to date is finally on the lathe. wish me luck!,335,xcga1o,https://i.redd.it/tb9jimal8gn91.jpg,81,1662997753.0,Ben716,0.99,/r/turning/comments/xcga1o/my_biggest_plate_to_date_is_finally_on_the_lathe/,turning,104595,2
My friends and family just don’t understand why “a couple pieces of wood” has me this excited...,334,lbsm0e,https://i.redd.it/7xr5dto7qaf61.jpg,21,1612372658.0,MetalandWoodworks,0.99,/r/turning/comments/lbsm0e/my_friends_and_family_just_dont_understand_why_a/,turning,104595,2
"""Depths"" One of my three entries into a gallery art show.",339,7d8357,https://i.redd.it/bi6lg3ad18yz.jpg,38,1510787511.0,CrimsonKeel,0.99,/r/turning/comments/7d8357/depths_one_of_my_three_entries_into_a_gallery_art/,turning,104595,2
County Fairs Are Definitely a Ego Boost,337,wvrvvb,https://i.redd.it/0n4667unfhj91.jpg,21,1661268843.0,Live-Delivery-7183,0.99,/r/turning/comments/wvrvvb/county_fairs_are_definitely_a_ego_boost/,turning,104595,2
"Fancy new kaleidoscope I made with figured black locust hardwood, crushed opal inlay and handblown glass floating in oil",337,v8iapi,https://v.redd.it/7myisstcxl491,27,1654785579.0,leiferslook,0.99,/r/turning/comments/v8iapi/fancy_new_kaleidoscope_i_made_with_figured_black/,turning,104595,2
Not sure if it’s a bowl or what. Woke up this morning with this idea in my head and had to make it before the day came to an end.,330,f5iu01,https://i.redd.it/ei2s21s5vkh41.jpg,54,1581986037.0,xington,0.99,/r/turning/comments/f5iu01/not_sure_if_its_a_bowl_or_what_woke_up_this/,turning,104595,2
"Soooooo, this happened. More big leaf maple burl than I can possibly handle.",336,exg2bt,https://i.redd.it/fmr7axcrtee41.jpg,17,1580605371.0,chatski,0.99,/r/turning/comments/exg2bt/soooooo_this_happened_more_big_leaf_maple_burl/,turning,104595,2
Backflow incense burner I made.,331,lq4d5g,https://v.redd.it/531ykyedf4j61,26,1614039783.0,Morgoroth37,0.99,/r/turning/comments/lq4d5g/backflow_incense_burner_i_made/,turning,104595,2
Usually I only post my work but one of my buddies is a photographer and I thought people here would appreciate the middle of turning photo,334,10kks53,https://i.redd.it/fq5ed199i4ea1.jpg,18,1674605616.0,MetalandWoodworks,0.98,/r/turning/comments/10kks53/usually_i_only_post_my_work_but_one_of_my_buddies/,turning,104595,2
"Tried my hand at making a wand, for my daughter. Ebony and resin. It was a fun project, my wife and I want one now!",332,m0g9f3,https://www.reddit.com/gallery/m0g9f3,28,1615212023.0,deacon76,0.99,/r/turning/comments/m0g9f3/tried_my_hand_at_making_a_wand_for_my_daughter/,turning,104595,2
10 inch tall segmented vase made of ash with bubinga and walnut accents,327,lo6c1n,https://www.reddit.com/gallery/lo6c1n,28,1613824777.0,mwalker1533,0.99,/r/turning/comments/lo6c1n/10_inch_tall_segmented_vase_made_of_ash_with/,turning,104595,2
Big honking makeshift lathe table base completed!,333,fzhx8u,https://i.redd.it/m6vkc7b7z8s41.jpg,23,1586636442.0,Negative1fkstogive,0.99,/r/turning/comments/fzhx8u/big_honking_makeshift_lathe_table_base_completed/,turning,104595,2
I finally have a little spot of my own.,328,eh9tjb,https://i.redd.it/o3o5u8txdm741.jpg,22,1577645969.0,White_v,0.99,/r/turning/comments/eh9tjb/i_finally_have_a_little_spot_of_my_own/,turning,104595,2
The Devil's Bowling Ball,331,ahaxah,https://imgur.com/7FeEAlR,23,1547821503.0,Mysecretpassphrase,0.99,/r/turning/comments/ahaxah/the_devils_bowling_ball/,turning,104595,2
My lathe in its new home. Climate controlled instead of unheated and uncooled shop. I can finally work year round! Now to move the rest of my equipment.,332,ao65k2,https://i.redd.it/yfs30rcbl6f21.jpg,21,1549560604.0,Jkwparrott,0.99,/r/turning/comments/ao65k2/my_lathe_in_its_new_home_climate_controlled/,turning,104595,2
"Finished this Walnut bowl last week for my mom's (August) birthday. A little late, but it sure had some beautiful patterns in the grain!",327,ezaji1,https://i.redd.it/9d5rof4wa4f41.jpg,15,1580913813.0,capnwessles,0.98,/r/turning/comments/ezaji1/finished_this_walnut_bowl_last_week_for_my_moms/,turning,104595,2
A cane I made for my cousin,323,ayq9sl,https://i.redd.it/ra0molh3dwk21.jpg,15,1552051748.0,Jkwparrott,0.98,/r/turning/comments/ayq9sl/a_cane_i_made_for_my_cousin/,turning,104595,2
Made another ring today....something different,326,8w54bp,https://i.redd.it/jl2kovlzzz711.jpg,28,1530739184.0,CardMechanic,0.98,/r/turning/comments/8w54bp/made_another_ring_todaysomething_different/,turning,104595,2
"This beautiful brute had been sitting in a shed in Copenhagen for years. She's now mine, along with 25 chisels etc. Exciting.",321,f9q97d,https://i.redd.it/nyl1ucfvb8j41.jpg,25,1582706037.0,Ben716,0.99,/r/turning/comments/f9q97d/this_beautiful_brute_had_been_sitting_in_a_shed/,turning,104595,2
"I won’t be able to spin these, but the customer who buys them is in for a TREAT",323,be8wqn,https://i.redd.it/q7sr132hbus21.jpg,30,1555513747.0,Glock19mos,0.98,/r/turning/comments/be8wqn/i_wont_be_able_to_spin_these_but_the_customer_who/,turning,104595,2
Wanted to try a dough bowl on the lathe...,326,10djeof,https://i.redd.it/9yjh32gxpfca1.jpg,18,1673887679.0,CarolinaGrainCo,0.99,/r/turning/comments/10djeof/wanted_to_try_a_dough_bowl_on_the_lathe/,turning,104595,2
The results of my first time (actually 3 days) of learning to turn wood!,328,fdyj8a,https://i.redd.it/h8u5s7531wk41.jpg,19,1583428741.0,micro_cosm,0.99,/r/turning/comments/fdyj8a/the_results_of_my_first_time_actually_3_days_of/,turning,104595,2
Sphere blanks made for a customer.,325,cagn1c,https://i.redd.it/8gl373c9f0931.jpg,34,1562561230.0,Glock19mos,0.99,/r/turning/comments/cagn1c/sphere_blanks_made_for_a_customer/,turning,104595,2
"Yours almost spoke, mine is just sad.",324,apjhrj,https://i.redd.it/hdb1frqgjzf21.jpg,11,1549910954.0,terrible01,0.98,/r/turning/comments/apjhrj/yours_almost_spoke_mine_is_just_sad/,turning,104595,2
Black walnut bowl I just finished. Fought the urge to use resin in the voids.,323,gc42yv,https://i.redd.it/3zuq46intbw41.jpg,25,1588414281.0,Adk318,1.0,/r/turning/comments/gc42yv/black_walnut_bowl_i_just_finished_fought_the_urge/,turning,104595,2
"Quarantine day 7, A Christmas tree turned from a Christmas tree",327,fnay2f,https://i.redd.it/wssx5b7tlbo41.jpg,17,1584924904.0,Alkynesofchemistry,0.97,/r/turning/comments/fnay2f/quarantine_day_7_a_christmas_tree_turned_from_a/,turning,104595,2
"Don't have the resources to make a river table, so I turned a river fountain pen.",317,etfiga,https://i.redd.it/tzhbr9dw5sc41.jpg,17,1579895225.0,lochneffmonster,0.98,/r/turning/comments/etfiga/dont_have_the_resources_to_make_a_river_table_so/,turning,104595,2
I was feeling anxious all day. Was up at 2am and worked the rest of the day. Getting to work on this for 90 minutes calmed me right down. Turning has been great for my mental health.,315,f20ce6,https://i.redd.it/brvgai0817g41.jpg,22,1581382722.0,The_Nerdy_Teacher,0.99,/r/turning/comments/f20ce6/i_was_feeling_anxious_all_day_was_up_at_2am_and/,turning,104595,2
Bowl turned from a stockpile of figured Black Walnut I’ve had for years. The grain patterns on this are so beautiful. It looks almost holographic.,319,a8tlbq,https://v.redd.it/maa39pxf30621,19,1545559295.0,Woodyoubelieve,0.99,/r/turning/comments/a8tlbq/bowl_turned_from_a_stockpile_of_figured_black/,turning,104595,2
"Most places I get appreciation for the burn, but here I know that y’all will also appreciate this gorgeous wood",313,xk6bg7,https://www.reddit.com/gallery/xk6bg7,45,1663770148.0,psilocelebi,0.99,/r/turning/comments/xk6bg7/most_places_i_get_appreciation_for_the_burn_but/,turning,104595,2
My carving process of a wood turned bowl by my friend Charlywoodbcn. Main piece is basswood with a purple heart insertion 46cm diameter.,317,pq1kj2,https://v.redd.it/xcjayj6bt2o71,22,1631890041.0,WoodBernCarvings,0.98,/r/turning/comments/pq1kj2/my_carving_process_of_a_wood_turned_bowl_by_my/,turning,104595,2
Spalted black sassafras bowl.,315,c19x3z,https://v.redd.it/or6q50hi0q431,22,1560691919.0,Robin_Banks101,1.0,/r/turning/comments/c19x3z/spalted_black_sassafras_bowl/,turning,104595,2
Rosewood bowl with Mahogany and Ebony lid,317,fk83m4,https://i.redd.it/sz6h68m7e9n41.jpg,22,1584462244.0,Alkynesofchemistry,0.99,/r/turning/comments/fk83m4/rosewood_bowl_with_mahogany_and_ebony_lid/,turning,104595,2
Bowl #20 after six weeks of turning. Turned out pretty well. Apple from a tree in the yard.,318,e6z1tb,https://i.redd.it/aykb2z1mq0341.jpg,19,1575640489.0,ReallyFineWhine,0.99,/r/turning/comments/e6z1tb/bowl_20_after_six_weeks_of_turning_turned_out/,turning,104595,2
You guys liked my last stupid idea bowl - so here's the next one.,313,7gpih4,https://i.redd.it/3t744ftrd6101.jpg,21,1512075182.0,CP_Creations,0.99,/r/turning/comments/7gpih4/you_guys_liked_my_last_stupid_idea_bowl_so_heres/,turning,104595,2
"Big honking makeshift lathe for a table base. This counts as turning, right?",311,fxc2ic,https://v.redd.it/c7jbo4iq1nr41,34,1586371133.0,Negative1fkstogive,0.99,/r/turning/comments/fxc2ic/big_honking_makeshift_lathe_for_a_table_base_this/,turning,104595,2
My First Captive Ring Goblet,321,b2jo5c,https://i.redd.it/gqvdixim5wm21.jpg,23,1552920958.0,JCarr86,0.99,/r/turning/comments/b2jo5c/my_first_captive_ring_goblet/,turning,104595,2
Cocobolo and Cottonwood,312,b17na8,https://i.redd.it/76nf01l486m21.jpg,26,1552606966.0,GardnersGrendel,0.99,/r/turning/comments/b17na8/cocobolo_and_cottonwood/,turning,104595,2
I showed my 9yr old son turning today on the mini lathe. He made a chess piece. Very proud father.,314,amx6dv,https://i.redd.it/8g5liphguge21.jpg,24,1549248761.0,azidstar,0.96,/r/turning/comments/amx6dv/i_showed_my_9yr_old_son_turning_today_on_the_mini/,turning,104595,2
Here is a small maple burl vessel I turned this week,313,iucf1a,https://i.redd.it/nrs7fb94zmn51.jpg,27,1600317208.0,wooden-spoon_12,0.99,/r/turning/comments/iucf1a/here_is_a_small_maple_burl_vessel_i_turned_this/,turning,104595,2
My shop is messy... These pens aren’t.,312,ex9a6r,https://i.redd.it/8o8ywc7gice41.jpg,18,1580577357.0,ScrazerHD,0.98,/r/turning/comments/ex9a6r/my_shop_is_messy_these_pens_arent/,turning,104595,2
Cast a pine cone and made it into a beer bottle opener,311,ediwjc,https://i.redd.it/q442aym9xv541.jpg,23,1576889736.0,CardMechanic,0.99,/r/turning/comments/ediwjc/cast_a_pine_cone_and_made_it_into_a_beer_bottle/,turning,104595,2
Red Burl Bowl looking pretty in the light,314,nuxf41,https://i.redd.it/ckyt0crebz371.png,34,1623130729.0,StringFood,0.99,/r/turning/comments/nuxf41/red_burl_bowl_looking_pretty_in_the_light/,turning,104595,2
2nd checkered bowl. Learned a lot to make alignment more precise.,308,9tfin1,https://v.redd.it/erkbzitkgtv11,12,1541120913.0,WoodmanXI,0.99,/r/turning/comments/9tfin1/2nd_checkered_bowl_learned_a_lot_to_make/,turning,104595,2
The math is done. Now time to make a segmented Captain America bowl.,315,9pugnn,https://i.redd.it/iv4c1ejimct11.jpg,24,1540044854.0,WoodmanXI,0.97,/r/turning/comments/9pugnn/the_math_is_done_now_time_to_make_a_segmented/,turning,104595,2
Took a mental health day. Best day on the lathe yet. Beech crotch and apple wood from my yard.,311,gm1ymr,https://i.redd.it/c34obbiy4jz41.jpg,26,1589810374.0,Ben716,0.99,/r/turning/comments/gm1ymr/took_a_mental_health_day_best_day_on_the_lathe/,turning,104595,2
Pawns done for a chess set!,312,d946py,https://i.redd.it/hymots6p4ro31.jpg,20,1569422308.0,conster13,0.99,/r/turning/comments/d946py/pawns_done_for_a_chess_set/,turning,104595,2
"Purpleheart, Patagonian Rosewood, Spalted Tamarind and Spectra-ply",314,af289t,https://i.redd.it/5adwu8lb4w921.jpg,13,1547254644.0,ba-na-na-way,0.98,/r/turning/comments/af289t/purpleheart_patagonian_rosewood_spalted_tamarind/,turning,104595,2
I see many bowls in my future. Working on blanks today.,309,11u1i3n,https://i.redd.it/46xvf9699eoa1.jpg,28,1679082138.0,mikeytwocakes,1.0,/r/turning/comments/11u1i3n/i_see_many_bowls_in_my_future_working_on_blanks/,turning,104595,2
"Yes, that is wood. (Maple burl platter)",308,atjkb8,https://imgur.com/td089ur,10,1550852889.0,Mysecretpassphrase,0.98,/r/turning/comments/atjkb8/yes_that_is_wood_maple_burl_platter/,turning,104595,2
Turned a set of mini trees out of maple and sapele.,306,akqrf0,https://i.redd.it/8rvdksupp7d21.jpg,20,1548702450.0,CIWorkshop,1.0,/r/turning/comments/akqrf0/turned_a_set_of_mini_trees_out_of_maple_and_sapele/,turning,104595,2
"Wife wanted a pencil holder, so I found this in the firewood pile.",306,ixbjh4,https://i.redd.it/s1y22yb31lo51.jpg,7,1600729490.0,xington,0.99,/r/turning/comments/ixbjh4/wife_wanted_a_pencil_holder_so_i_found_this_in/,turning,104595,2
Cherry mug turned on a spring pole lathe,309,i022x0,https://i.redd.it/fcbtc9sl8td51.jpg,20,1596034555.0,SylvaSpoon,0.99,/r/turning/comments/i022x0/cherry_mug_turned_on_a_spring_pole_lathe/,turning,104595,2
"Found this natural snake in the grain, so I did the logical thing and burned a skull into it.",305,nz5ql8,https://www.reddit.com/gallery/nz5ql8,23,1623617664.0,psilocelebi,0.98,/r/turning/comments/nz5ql8/found_this_natural_snake_in_the_grain_so_i_did/,turning,104595,2
"The Cherry Sunburst Bowl! I made this by sanding strips of cherry into thin ""diamond"" shapes before casting them in epoxy resin dyed with my own blend of mica pigments. What do you think?",307,10p2u2m,https://youtu.be/Cl_bO8c4TAY,24,1675086778.0,FormanWoodworking,0.98,/r/turning/comments/10p2u2m/the_cherry_sunburst_bowl_i_made_this_by_sanding/,turning,104595,2
"One of those commissions you don't look forward to, a urn for a clients parent.",303,v62fi2,https://v.redd.it/pyht6wosvz391,46,1654518631.0,Live-Delivery-7183,0.99,/r/turning/comments/v62fi2/one_of_those_commissions_you_dont_look_forward_to/,turning,104595,2
"So I've built this LEGO woodshop based on an article from Fine Woodworking Magazine and I thought you would like to see it. It's on LEGO Ideas right now, so it has a chance of becoming a real set if enough people support it.",310,q5xqnt,https://ideas.lego.com/projects/f13da25c-2795-4976-9dfe-72f3bd61b4c3,38,1633964437.0,cambuimg,0.98,/r/turning/comments/q5xqnt/so_ive_built_this_lego_woodshop_based_on_an/,turning,104595,2
I think I'm done making Ornaments for this season,305,e7i9gw,https://i.redd.it/lbjkpxlwd9341.jpg,16,1575745195.0,NECESolarGuy,0.99,/r/turning/comments/e7i9gw/i_think_im_done_making_ornaments_for_this_season/,turning,104595,2
"15 Minute Bowl, Before and After",305,95dwiv,https://i.redd.it/t94sbyk5mpe11.jpg,22,1533664434.0,JCarr86,0.98,/r/turning/comments/95dwiv/15_minute_bowl_before_and_after/,turning,104595,2
Nested set of Black locust burl bowls. Finished with walnut oil and beeswax.,305,lalfpb,https://www.reddit.com/gallery/lalfpb,13,1612233652.0,Trevocb,0.99,/r/turning/comments/lalfpb/nested_set_of_black_locust_burl_bowls_finished/,turning,104595,2
"segmented salad bowl. made of ash, buginga and walnut. measures 12 inches in diameter",305,ozvfgw,https://www.reddit.com/gallery/ozvfgw,30,1628350441.0,mwalker1533,1.0,/r/turning/comments/ozvfgw/segmented_salad_bowl_made_of_ash_buginga_and/,turning,104595,2
"I saw somebody make a top, and I decided to take it a bit further. I present to you, the Amish Beyblade.",303,k2y0pl,https://i.redd.it/u69ksy5ld2261.jpg,19,1606605550.0,jthyroid,0.99,/r/turning/comments/k2y0pl/i_saw_somebody_make_a_top_and_i_decided_to_take/,turning,104595,2
"Salad bowl for my wife - birch and padauk, 13” x 5”. Took a while, but built a lot of jigs along the way that should help in the future.",308,jv9v8q,https://i.redd.it/zcuuyjunqmz51.jpg,37,1605544523.0,deacon76,1.0,/r/turning/comments/jv9v8q/salad_bowl_for_my_wife_birch_and_padauk_13_x_5/,turning,104595,2
Starship Enterprise in resin.,303,cmf4sc,https://i.redd.it/jbbpydwefoe31.jpg,18,1565031089.0,Nigiri28,0.97,/r/turning/comments/cmf4sc/starship_enterprise_in_resin/,turning,104595,2
World’s worst soup bowl...,305,gzddpt,https://i.redd.it/d26uhkoiis351.jpg,27,1591667293.0,emblemssal,0.99,/r/turning/comments/gzddpt/worlds_worst_soup_bowl/,turning,104595,2
Tiny pots,305,flf3f9,https://i.redd.it/7x0a43mfbon41.jpg,15,1584642930.0,conster13,0.99,/r/turning/comments/flf3f9/tiny_pots/,turning,104595,2
Pole lathe turned mug and creamer jug,302,bj43gr,https://i.redd.it/dtdf3wpdyev21.jpg,45,1556635282.0,SylvaSpoon,0.99,/r/turning/comments/bj43gr/pole_lathe_turned_mug_and_creamer_jug/,turning,104595,2
