title,score,id,url,num_comments,created,author,upvote_ratio,permalink,subreddit,subreddit_subscribers,depth
All video recordings for STAT 451: Intro to Machine Learning,395,kcmu3v,https://www.reddit.com/r/learnmachinelearning/comments/kcmu3v/all_video_recordings_for_stat_451_intro_to/,28,1607906728.0,seraschka,0.99,/r/learnmachinelearning/comments/kcmu3v/all_video_recordings_for_stat_451_intro_to/,learnmachinelearning,287562,2
AI will generate a full function React app,394,huovw6,https://youtu.be/RyiWFbSdk78,38,1595264239.0,cmillionaire9,0.9,/r/learnmachinelearning/comments/huovw6/ai_will_generate_a_full_function_react_app/,learnmachinelearning,287562,2
AI model that generates galaxies based on Hubble images,389,uyuf7h,https://i.redd.it/lo1flsw67m191.gif,13,1653643642.0,AdelSexy,0.98,/r/learnmachinelearning/comments/uyuf7h/ai_model_that_generates_galaxies_based_on_hubble/,learnmachinelearning,287562,2
Stanford University Probabilities and Statistics refresher,387,mc1r95,https://stanford.edu/~shervine/teaching/cs-229/refresher-probabilities-statistics,8,1616579078.0,datapablo,0.99,/r/learnmachinelearning/comments/mc1r95/stanford_university_probabilities_and_statistics/,learnmachinelearning,287562,2
New YouTube channel with a focus on Machine Learning,385,spwj8j,https://i.redd.it/6z4zuvuqm6h81.png,14,1644576064.0,python_engineer,0.95,/r/learnmachinelearning/comments/spwj8j/new_youtube_channel_with_a_focus_on_machine/,learnmachinelearning,287562,2
From 53% to 95% acc - Real vs Fake Faces Classification | Fine-tuning EfficientNet (Github in comment),386,s0rawv,https://i.redd.it/5z6nwyv5pwa81.png,32,1641840551.0,oFlamingo,0.98,/r/learnmachinelearning/comments/s0rawv/from_53_to_95_acc_real_vs_fake_faces/,learnmachinelearning,287562,2
My course where I teach how to make an augmented reality piano is over. It contains some basic machine learning elements but it is mostly image processing and procedural sound generation. I think it still fits here for beginner enthusiasts. [Code and Lectures linked in the comments],382,m3c8yg,https://v.redd.it/uf3if8ebqjm61,18,1615532756.0,gniziemazity,0.99,/r/learnmachinelearning/comments/m3c8yg/my_course_where_i_teach_how_to_make_an_augmented/,learnmachinelearning,287562,2
"This AI can cartoonize any picture or video you feed it! Tune in the video in caption at 3:08 to see more awesome examples using it, they passed in on The Avengers movie and the results are impressive!",378,i6i0bm,https://www.youtube.com/watch?v=GZVsONq3qtg,24,1596973492.0,OnlyProggingForFun,0.84,/r/learnmachinelearning/comments/i6i0bm/this_ai_can_cartoonize_any_picture_or_video_you/,learnmachinelearning,287562,2
MLOps Lifecycle,381,vnyogv,https://www.reddit.com/gallery/vnyogv,9,1656560713.0,instituteprograms,0.97,/r/learnmachinelearning/comments/vnyogv/mlops_lifecycle/,learnmachinelearning,287562,2
Deep RL Agent Learning to play Snake,381,f7x1y6,https://v.redd.it/i4f4435uwii41,23,1582398302.0,jack-of-some,0.99,/r/learnmachinelearning/comments/f7x1y6/deep_rl_agent_learning_to_play_snake/,learnmachinelearning,287562,2
Machine learning YouTube lectures for STAT 451: Intro to ML by Sebastian Raschka,382,ip562a,https://www.reddit.com/r/learnmachinelearning/comments/ip562a/machine_learning_youtube_lectures_for_stat_451/,24,1599609512.0,seraschka,0.99,/r/learnmachinelearning/comments/ip562a/machine_learning_youtube_lectures_for_stat_451/,learnmachinelearning,287562,2
CNN- A Quick Revision,379,vc7cdb,https://i.redd.it/0ljiuza45m591.jpg,5,1655223960.0,eforebrahim,0.99,/r/learnmachinelearning/comments/vc7cdb/cnn_a_quick_revision/,learnmachinelearning,287562,2
[X-Post] IAMA Senior Data Scientist at Disney and I’m setting up free Q&A Zoom sessions to help people who are looking to enter/transition into data science,375,j5jeog,https://www.reddit.com/r/learnmachinelearning/comments/j5jeog/xpost_iama_senior_data_scientist_at_disney_and_im/,28,1601904578.0,madzthakz,0.97,/r/learnmachinelearning/comments/j5jeog/xpost_iama_senior_data_scientist_at_disney_and_im/,learnmachinelearning,287562,2
Transfer Learning is one of the most power techniques for neural networks,375,xd9ijr,https://i.redd.it/4p3j8qej1nn91.png,17,1663080443.0,roycoding,0.96,/r/learnmachinelearning/comments/xd9ijr/transfer_learning_is_one_of_the_most_power/,learnmachinelearning,287562,2
Data Science Interview Question asked by Apple,373,mwqgut,https://i.redd.it/igc0n2r7svu61.png,60,1619165579.0,3DataGuys,0.91,/r/learnmachinelearning/comments/mwqgut/data_science_interview_question_asked_by_apple/,learnmachinelearning,287562,2
Beginner-friendly GANs repo in PyTorch!,374,irzbeb,https://i.redd.it/gr5gu80pexm51.gif,30,1600007717.0,gordicaleksa,0.99,/r/learnmachinelearning/comments/irzbeb/beginnerfriendly_gans_repo_in_pytorch/,learnmachinelearning,287562,2
Unbeaten PyGAD (Genetic Algorithm) Plays Flapping Bird,368,midara,https://v.redd.it/q3bkrif2zoq61,28,1617339490.0,ahmed26gad,0.75,/r/learnmachinelearning/comments/midara/unbeaten_pygad_genetic_algorithm_plays_flapping/,learnmachinelearning,287562,2
"Hi! I just expanded the Data Science Cheatsheet to five pages, which adds material on Time Series, Statistics, and A/B Testing [Cross-post from r/DataScience]",368,o4n62s,https://www.reddit.com/r/learnmachinelearning/comments/o4n62s/hi_i_just_expanded_the_data_science_cheatsheet_to/,16,1624250289.0,WirelessSushi,0.99,/r/learnmachinelearning/comments/o4n62s/hi_i_just_expanded_the_data_science_cheatsheet_to/,learnmachinelearning,287562,2
We're building a platform to efficiently learn machine learning,369,n397hw,https://www.reddit.com/r/learnmachinelearning/comments/n397hw/were_building_a_platform_to_efficiently_learn/,34,1619970681.0,Ok-Craft-9908,0.98,/r/learnmachinelearning/comments/n397hw/were_building_a_platform_to_efficiently_learn/,learnmachinelearning,287562,2
Deep learning tool,366,ytzkrc,https://i.redd.it/vtvhvk9ljpz91.jpg,33,1668340585.0,st1275857,0.92,/r/learnmachinelearning/comments/ytzkrc/deep_learning_tool/,learnmachinelearning,287562,2
"We live in beautiful times where you can learn Machine Learning and become an expert, for free. Here are many resources in a complete guide for everyone even with no tech background at all. Save it for your Holiday break! (ping me if it misses anything great)",360,r6gj7v,https://github.com/louisfb01/start-machine-learning,20,1638370444.0,OnlyProggingForFun,0.96,/r/learnmachinelearning/comments/r6gj7v/we_live_in_beautiful_times_where_you_can_learn/,learnmachinelearning,287562,2
A little tip for aspiring Data Scientists and ML- Engineers,361,njzx9w,https://www.reddit.com/r/learnmachinelearning/comments/njzx9w/a_little_tip_for_aspiring_data_scientists_and_ml/,20,1621868388.0,Philo167,0.9,/r/learnmachinelearning/comments/njzx9w/a_little_tip_for_aspiring_data_scientists_and_ml/,learnmachinelearning,287562,2
Physics-Informed Neural Networks,364,1124q10,https://v.redd.it/grjijnsli5ia1,70,1676379318.0,TheInsaneApp,0.91,/r/learnmachinelearning/comments/1124q10/physicsinformed_neural_networks/,learnmachinelearning,287562,2
Using NeuroEvolution - AI mastering Flappy Bird,364,g5u61t,https://v.redd.it/p2gpz4qqkau41,18,1587527625.0,oFlamingo,0.97,/r/learnmachinelearning/comments/g5u61t/using_neuroevolution_ai_mastering_flappy_bird/,learnmachinelearning,287562,2
"Top 38 Python Libraries for Data Science, Data Visualization, and Machine Learning.",356,jms4zt,https://www.kdnuggets.com/2020/11/top-python-libraries-data-science-data-visualization-machine-learning.html,5,1604338820.0,ItisAhmad,0.97,/r/learnmachinelearning/comments/jms4zt/top_38_python_libraries_for_data_science_data/,learnmachinelearning,287562,2
Role of Mathematics in Machine Learning,356,xi8jg7,https://i.redd.it/tdhcj5jdpso91.png,20,1663584537.0,instituteprograms,0.84,/r/learnmachinelearning/comments/xi8jg7/role_of_mathematics_in_machine_learning/,learnmachinelearning,287562,2
Microsoft launches a drag-and-drop machine learning tool (Article by Frederic Lardinois: https://techcrunch.com/2019/05/02/microsoft-launches-a-drag-and-drop-machine-learning-tool-and-hosted-jupyter-notebooks/),352,blj0i6,https://i.redd.it/bmwsa52y8ow21.jpg,25,1557183669.0,ai-lover,0.97,/r/learnmachinelearning/comments/blj0i6/microsoft_launches_a_draganddrop_machine_learning/,learnmachinelearning,287562,2
A direct comparison of kNN for different values of k,351,pxw0hs,https://v.redd.it/tqqwjyi78gq71,11,1632924113.0,Va_Linor,0.98,/r/learnmachinelearning/comments/pxw0hs/a_direct_comparison_of_knn_for_different_values/,learnmachinelearning,287562,2
Learning Machine Learning Efficiently,345,ik4fvd,https://www.youtube.com/watch?v=r2X9Se6ayGQ&feature=share,24,1598901187.0,research_pie,0.98,/r/learnmachinelearning/comments/ik4fvd/learning_machine_learning_efficiently/,learnmachinelearning,287562,2
"Andrew Ng Interview with Father Of Deep Learning , Geoffrey Hinton |Andrew Ng and Geoffrey Hinton",349,efhsaw,https://www.youtube.com/watch?v=089U2maCg0Q&feature=youtu.be&app=desktop,8,1577288136.0,RickDeveloper,0.97,/r/learnmachinelearning/comments/efhsaw/andrew_ng_interview_with_father_of_deep_learning/,learnmachinelearning,287562,2
Virtually seeking timeline using opencv and mediapipe [code below],346,nljdry,https://v.redd.it/l7ea91tvdh171,13,1622041980.0,Pawan315,0.98,/r/learnmachinelearning/comments/nljdry/virtually_seeking_timeline_using_opencv_and/,learnmachinelearning,287562,2
What regularization does to a machine learning model,346,w7yrog,https://i.redd.it/k72b1a9vmrd91.png,20,1658779467.0,roycoding,0.97,/r/learnmachinelearning/comments/w7yrog/what_regularization_does_to_a_machine_learning/,learnmachinelearning,287562,2
PyTorch is THE most popular deep learning framework in the research community. Here is how to learn it.,345,in3vrl,https://youtu.be/2n_uoGOPoVk,44,1599322708.0,gordicaleksa,0.93,/r/learnmachinelearning/comments/in3vrl/pytorch_is_the_most_popular_deep_learning/,learnmachinelearning,287562,2
How neural network recognise a dog.,340,z1qo1f,https://i.redd.it/v8ohqeepyi1a1.jpg,60,1669114635.0,st1275857,0.7,/r/learnmachinelearning/comments/z1qo1f/how_neural_network_recognise_a_dog/,learnmachinelearning,287562,2
Second version of my GPT-3 powered resume writer - now does bullet points and doesn't use pronouns!,349,oboywl,https://gfycat.com/bitteroffbeatitalianbrownbear,29,1625155571.0,Camjw1123,0.96,/r/learnmachinelearning/comments/oboywl/second_version_of_my_gpt3_powered_resume_writer/,learnmachinelearning,287562,2
This AI can Colorize your Black & White Photos with Full Photorealistic Renders! (DeOldify),348,jqacm3,https://youtu.be/1EP_Lq04h4M,16,1604835448.0,OnlyProggingForFun,0.95,/r/learnmachinelearning/comments/jqacm3/this_ai_can_colorize_your_black_white_photos_with/,learnmachinelearning,287562,2
Self-Supervised Learning of 3D Human Pose using Multi-view Geometry,341,grh2z9,https://v.redd.it/n3ipa4d69a151,6,1590574552.0,TheInsaneApp,0.99,/r/learnmachinelearning/comments/grh2z9/selfsupervised_learning_of_3d_human_pose_using/,learnmachinelearning,287562,2
A Game Of Pong Programmed Inside Of An RNN,339,tdrjx9,https://v.redd.it/c5nq04wdtan81,5,1647241796.0,vadhavaniyafaijan,0.99,/r/learnmachinelearning/comments/tdrjx9/a_game_of_pong_programmed_inside_of_an_rnn/,learnmachinelearning,287562,2
Hair styling just got easier with AI,339,nth2q0,https://youtu.be/_BVzWAUcKzc,14,1622968074.0,Independent-Square32,0.98,/r/learnmachinelearning/comments/nth2q0/hair_styling_just_got_easier_with_ai/,learnmachinelearning,287562,2
Hating Tensorflow doesn't make you cool,337,iu985e,https://www.reddit.com/r/learnmachinelearning/comments/iu985e/hating_tensorflow_doesnt_make_you_cool/,115,1600305157.0,ItisAhmad,0.93,/r/learnmachinelearning/comments/iu985e/hating_tensorflow_doesnt_make_you_cool/,learnmachinelearning,287562,2
Free live hands-on python lecture about using generative neural networks to create art - for redditors,339,h8ykiq,https://i.redd.it/ng10b5ul1x451.jpg,16,1592158026.0,pinter69,0.98,/r/learnmachinelearning/comments/h8ykiq/free_live_handson_python_lecture_about_using/,learnmachinelearning,287562,2
Why 100 Days of ML Code Challenge is great,335,eh7qef,https://www.reddit.com/r/learnmachinelearning/comments/eh7qef/why_100_days_of_ml_code_challenge_is_great/,27,1577636365.0,hithesh111,0.98,/r/learnmachinelearning/comments/eh7qef/why_100_days_of_ml_code_challenge_is_great/,learnmachinelearning,287562,2
"Live zoom lecture about High-Resolution Networks, SOTA Pose Estimation Network by paper's author Dr. Jingdong Wang",337,ia29mv,https://i.redd.it/vx6w0bdgw3h51.jpg,11,1597471233.0,pinter69,0.98,/r/learnmachinelearning/comments/ia29mv/live_zoom_lecture_about_highresolution_networks/,learnmachinelearning,287562,2
AI solves Sudoku,340,h0jyj0,https://youtu.be/PDdYxQhhCus,30,1591822381.0,cmillionaire9,0.89,/r/learnmachinelearning/comments/h0jyj0/ai_solves_sudoku/,learnmachinelearning,287562,2
A new brain-inspired intelligent system drives a car using only 19 control neurons!,331,jc8pyk,https://youtu.be/wAa358pNDkQ,25,1602850521.0,OnlyProggingForFun,0.98,/r/learnmachinelearning/comments/jc8pyk/a_new_braininspired_intelligent_system_drives_a/,learnmachinelearning,287562,2
Brief Overview: Which Machine Learning Algorithm should I use?,327,r5l17z,https://i.redd.it/9rzlckceup281.png,22,1638270711.0,Philo167,0.91,/r/learnmachinelearning/comments/r5l17z/brief_overview_which_machine_learning_algorithm/,learnmachinelearning,287562,2
Putting visual recognition in context - Link to free zoom lecture by the authors in comments,332,nzhxoc,https://i.redd.it/pguciw27x6571.png,30,1623658667.0,pinter69,0.97,/r/learnmachinelearning/comments/nzhxoc/putting_visual_recognition_in_context_link_to/,learnmachinelearning,287562,2
Markov Chain: Understanding Higher-order Transition Matrix,324,jwh8c4,https://youtu.be/Zo3ieESzr4E,12,1605711479.0,nerdy_wits,0.99,/r/learnmachinelearning/comments/jwh8c4/markov_chain_understanding_higherorder_transition/,learnmachinelearning,287562,2
Important of Linear Regression,334,gozj4h,https://www.reddit.com/r/learnmachinelearning/comments/gozj4h/important_of_linear_regression/,78,1590211929.0,rtthatbrownguy,0.96,/r/learnmachinelearning/comments/gozj4h/important_of_linear_regression/,learnmachinelearning,287562,2
50 Kaggle Notebooks to learn Data Visualization (link in comment),328,uy3ku3,https://i.redd.it/7ny7o8sofs191.jpg,7,1653556765.0,eforebrahim,0.97,/r/learnmachinelearning/comments/uy3ku3/50_kaggle_notebooks_to_learn_data_visualization/,learnmachinelearning,287562,2
