title,score,id,url,num_comments,created,author,upvote_ratio,permalink,subreddit,subreddit_subscribers,depth
SpaceX on Instagram: Crew Dragon parachute Test,3406,8u331z,https://www.instagram.com/p/BkgAmoGF490/?utm_source=ig_share_sheet&igshid=17lnbjbo3gy82,394,1530042667.0,failion_V2,0.96,/r/spacex/comments/8u331z/spacex_on_instagram_crew_dragon_parachute_test/,spacex,1828412,2
TiGridFin,3395,80bdvg,https://i.redd.it/dx3imatsjii01.jpg,352,1519631724.0,TomCross,0.96,/r/spacex/comments/80bdvg/tigridfin/,spacex,1828412,2
"Elon Musk: It was foolish of us not to start 3 engines & immediately shut down 1, as 2 are needed to land",3384,lcoyz5,https://twitter.com/elonmusk/status/1357422126161145856?s=21,593,1612469851.0,RoyalPatriot,0.98,/r/spacex/comments/lcoyz5/elon_musk_it_was_foolish_of_us_not_to_start_3/,spacex,1828412,2
Falcon 9’s second stage put on an incredible display in the post-sunset California sky as it soared toward orbit with SAOCOM 1A.,3381,9mb677,https://i.redd.it/85y6jpxglvq11.jpg,227,1538967014.0,johnkphotos,0.96,/r/spacex/comments/9mb677/falcon_9s_second_stage_put_on_an_incredible/,spacex,1828412,2
SpaceX are hiring an Offshore Operations Engineer to “design and build an operational offshore rocket launch facility”,3368,ha6mht,https://boards.greenhouse.io/spacex/jobs/4764403002?gh_jid=4764403002,374,1592322777.0,rustybeancake,0.98,/r/spacex/comments/ha6mht/spacex_are_hiring_an_offshore_operations_engineer/,spacex,1828412,2
StarLink V1 L6 soars across crystal blue sky,3373,g6lbnz,https://i.redd.it/bo071xuy3ku41.jpg,74,1587642980.0,spiel2001,0.98,/r/spacex/comments/g6lbnz/starlink_v1_l6_soars_across_crystal_blue_sky/,spacex,1828412,2
Axiom-1 launch photobombed,3357,tz6tj1,https://i.redd.it/n53thzokvbs81.jpg,80,1649433689.0,stevenmadow,0.98,/r/spacex/comments/tz6tj1/axiom1_launch_photobombed/,spacex,1828412,2
"One of the last sunsets I got to spend with SN11. Godspeed, Starship.",3353,mgngc8,https://i.redd.it/osvpblazr7q61.jpg,62,1617131273.0,adambernnyc,0.99,/r/spacex/comments/mgngc8/one_of_the_last_sunsets_i_got_to_spend_with_sn11/,spacex,1828412,2
Turksat 5A launching into orbit! [OC],3354,kstcfg,https://i.redd.it/py4civozu0a61.jpg,40,1610073970.0,mdcainjr,0.98,/r/spacex/comments/kstcfg/turksat_5a_launching_into_orbit_oc/,spacex,1828412,2
"Falcon 9 going the distance, Falcon 9 going for speed. Cargo Dragon version 2 is headed to the International Space Station!",3338,k7zqzz,https://i.redd.it/ioddplib7m361.jpg,86,1607281410.0,johnpisaniphotos,0.98,/r/spacex/comments/k7zqzz/falcon_9_going_the_distance_falcon_9_going_for/,spacex,1828412,2
Elon Musk on Instagram: Fast play of today's rocket landing on SpaceX droneship OCISLY,3337,4ldw1h,https://www.instagram.com/p/BF7sxM9QES7/?taken-by=elonmusk&hl=en,271,1464399775.0,Zucal,0.93,/r/spacex/comments/4ldw1h/elon_musk_on_instagram_fast_play_of_todays_rocket/,spacex,1828412,2
Streak shot of SpaceX launching Inspiration4 into orbit! [OC],3306,pp41lo,https://i.redd.it/8uz23bt0vrn71.jpg,83,1631757481.0,mdcainjr,0.97,/r/spacex/comments/pp41lo/streak_shot_of_spacex_launching_inspiration4_into/,spacex,1828412,2
SpaceX has secured $885.5M in FCC rural broadband subsidies,3302,k8lt3i,https://docs.fcc.gov/public/attachments/DOC-368588A1.pdf,421,1607364350.0,675longtail,0.97,/r/spacex/comments/k8lt3i/spacex_has_secured_8855m_in_fcc_rural_broadband/,spacex,1828412,2
Starship stack light up for the presentation,3302,spmsnu,https://i.redd.it/1vmnhr78z3h81.jpg,128,1644543697.0,ElongatedMuskrat,0.97,/r/spacex/comments/spmsnu/starship_stack_light_up_for_the_presentation/,spacex,1828412,2
Elon Musk: Ocean spaceport Deimos is under construction for launch next year,3276,noivcj,https://twitter.com/elonmusk/status/1399088815705399305?s=21,553,1622403859.0,Tommy099431,0.96,/r/spacex/comments/noivcj/elon_musk_ocean_spaceport_deimos_is_under/,spacex,1828412,2
SpaceX on Twitter: SpaceX has been selected to develop a lunar optimized Starship to transport crew between lunar orbit and the surface of the Moon as part of @NASA ’s Artemis program!,3264,gazruw,https://twitter.com/SpaceX/status/1255907211533901825,670,1588266630.0,OccupyMarsNow,0.96,/r/spacex/comments/gazruw/spacex_on_twitter_spacex_has_been_selected_to/,spacex,1828412,2
Liftoff of CRS-22 viewed from Kirk Point Park in Titusville,3250,nrjmmr,https://i.redd.it/pve3654va3371.jpg,33,1622743101.0,Space_Coast_Steve,0.99,/r/spacex/comments/nrjmmr/liftoff_of_crs22_viewed_from_kirk_point_park_in/,spacex,1828412,2
"The 1,400 mile drive was worth it - Everyday Astronaut",3243,7vrsna,https://i.redd.it/781476tcjoe01.jpg,104,1517960831.0,everydayastronaut,0.98,/r/spacex/comments/7vrsna/the_1400_mile_drive_was_worth_it_everyday/,spacex,1828412,2
The current status of SpaceX's Starship & Superheavy prototypes. 21st March 2021 https://t.co/0RpzqVlzWb,3233,m9rs2s,https://i.redd.it/p6elj4tu7co61.jpg,213,1616313335.0,brendan290803,0.98,/r/spacex/comments/m9rs2s/the_current_status_of_spacexs_starship_superheavy/,spacex,1828412,2
A VIP media event at the base of Falcon Heavy shows you the scale this beast! | Teslarati,3213,7vig7t,https://i.redd.it/pq77omcrwge01.jpg,208,1517868488.0,TomCross,0.98,/r/spacex/comments/7vig7t/a_vip_media_event_at_the_base_of_falcon_heavy/,spacex,1828412,2
"Elon Musk on Twitter: Most Starship spaceports will probably need to be ~20 miles / 30km offshore for acceptable noise levels, especially for frequent daily flights, as would occur for point to point flights on Earth",3197,dryslh,https://twitter.com/elonmusk/status/1191496935250616321?s=19,827,1572958750.0,shaldag_x,0.97,/r/spacex/comments/dryslh/elon_musk_on_twitter_most_starship_spaceports/,spacex,1828412,2
"A deep rundown on the Raptor engine. Explaining the full flow staged combustion cycle, comparing it to other engines, and why methane fuel was chosen.",3166,bsy6rp,https://everydayastronaut.com/raptor-engine/,227,1558811067.0,everydayastronaut,0.97,/r/spacex/comments/bsy6rp/a_deep_rundown_on_the_raptor_engine_explaining/,spacex,1828412,2
I took long exposures of the Falcon 9 launch and landing!,3162,3xs43x,http://imgur.com/a/ot3Ex,100,1450749557.0,johnkphotos,0.9,/r/spacex/comments/3xs43x/i_took_long_exposures_of_the_falcon_9_launch_and/,spacex,1828412,2
Sometimes you just gotta sit back and enjoy it (SXM-8),3155,nteuzq,https://i.redd.it/u90afo734l371.jpg,53,1622958747.0,mdcainjr,0.99,/r/spacex/comments/nteuzq/sometimes_you_just_gotta_sit_back_and_enjoy_it/,spacex,1828412,2
FAA inspector unable to reach Starbase in time for launch today. Postponed to no earlier than tomorrow.,3160,mfs8bg,https://twitter.com/elonmusk/status/1376558233624666120?s=19,236,1617032237.0,skpl,0.96,/r/spacex/comments/mfs8bg/faa_inspector_unable_to_reach_starbase_in_time/,spacex,1828412,2
Instagram - SES-10 Landing video,3157,63isey,https://www.instagram.com/p/BSfJDjMFzwR/,495,1491358705.0,beardboy90,0.99,/r/spacex/comments/63isey/instagram_ses10_landing_video/,spacex,1828412,2
Falcon 9 and Dragon in the hangar at Launch Complex 39A ahead of launching Inspiration4 (Credit: SpaceX,3132,pm7h5k,https://i.redd.it/wst8paaamvm71.jpg,172,1631367058.0,ReKt1971,0.99,/r/spacex/comments/pm7h5k/falcon_9_and_dragon_in_the_hangar_at_launch/,spacex,1828412,2
BocaChicaGal: Happy to let y’all know that I have been asked to evacuate for Starship SN10 launch attempt tomorrow. It looks like it will be a beautiful day for a launch. I can’t wait to see SN10 nail the landing!🔥🚀🔥 @NASASpaceflight,3127,lwadi0,https://twitter.com/bocachicagal/status/1366831841509056512?s=21,143,1614713321.0,RoyalPatriot,0.98,/r/spacex/comments/lwadi0/bocachicagal_happy_to_let_yall_know_that_i_have/,spacex,1828412,2
Elon Musk on Twitter: Sending this tweet through space via Starlink satellite,3127,dldn8v,https://twitter.com/elonmusk/status/1186523464712146944,344,1571724277.0,OccupyMarsNow,0.98,/r/spacex/comments/dldn8v/elon_musk_on_twitter_sending_this_tweet_through/,spacex,1828412,2
"Falcon 9 launches Telstar 18 VANTAGE at 12:45 A.M. this morning, tracing an incredible reflection in the water north of Cape Canaveral. — johnkrausphotos.com",3100,9ejuvm,https://i.redd.it/l97r5529fcl11.jpg,59,1536555667.0,johnkphotos,0.97,/r/spacex/comments/9ejuvm/falcon_9_launches_telstar_18_vantage_at_1245_am/,spacex,1828412,2
"While we wait for TESS, anyone wanna have lunch?",3097,8d0yrn,https://i.redd.it/a3cxfc8hwjs01.jpg,123,1524006687.0,TMahlman,0.95,/r/spacex/comments/8d0yrn/while_we_wait_for_tess_anyone_wanna_have_lunch/,spacex,1828412,2
Future Mars explorer desperately tries to see the rocket that will pave the way,3096,9xm1sm,https://i.redd.it/2d4s6hga0py11.jpg,81,1542374014.0,learntimelapse,0.94,/r/spacex/comments/9xm1sm/future_mars_explorer_desperately_tries_to_see_the/,spacex,1828412,2
"Elon Musk on Twitter: ""Oh yeah, forgot to mention [Iridium-5 fairing] actually landed fine, just not on Mr Steven""",3057,88wjbp,https://twitter.com/elonmusk/status/980647734888681472,264,1522640403.0,zlsa,0.96,/r/spacex/comments/88wjbp/elon_musk_on_twitter_oh_yeah_forgot_to_mention/,spacex,1828412,2
"SpaceX on track to launch first NASA astronauts in May, COO Gwynne Shotwell says",3046,fgk5ii,https://www.cnbc.com/2020/03/10/spacex-aiming-for-may-astronaut-launch-will-reuse-crew-dragon.html,276,1583871016.0,ReKt1971,0.99,/r/spacex/comments/fgk5ii/spacex_on_track_to_launch_first_nasa_astronauts/,spacex,1828412,2
Fighter jet formation flight with Inspiration4 team over Falcon 9 and Dragon at LC-39A,3038,po4mby,https://i.redd.it/8tyf0yo9ihn71.jpg,162,1631632049.0,johnkphotos,0.97,/r/spacex/comments/po4mby/fighter_jet_formation_flight_with_inspiration4/,spacex,1828412,2
"I set a camera 1,000 feet away from SpaceX's first reused rocket and it captured this beautiful shot",3036,62ltrn,http://i.imgur.com/InTf1LQ.jpg,73,1490973776.0,everydayastronaut,0.99,/r/spacex/comments/62ltrn/i_set_a_camera_1000_feet_away_from_spacexs_first/,spacex,1828412,2
"SpaceX raised $850 million last week at $419.99 a share, jumping valuation to about $74 billion",3013,llhyr5,https://www.cnbc.com/2021/02/16/elon-musks-spacex-raised-850-million-at-419point99-a-share.html,472,1613522519.0,rory096,0.97,/r/spacex/comments/llhyr5/spacex_raised_850_million_last_week_at_41999_a/,spacex,1828412,2
"From Cocoa Beach, this morning’s launch was magical",3008,h8ce4k,https://i.redd.it/8daqircdwp451.jpg,33,1592071478.0,Space_Coast_Steve,0.99,/r/spacex/comments/h8ce4k/from_cocoa_beach_this_mornings_launch_was_magical/,spacex,1828412,2
Iridium-1 Landing,2988,5oric0,https://www.flickr.com/photos/spacex/31579784413/,261,1484767981.0,beardboy90,1.0,/r/spacex/comments/5oric0/iridium1_landing/,spacex,1828412,2
Falcon 9 putting on a fiery show as it climbs from SLC-40 with Dragon — CRS-16.,2977,a3qafo,https://i.redd.it/v9wbjyqh3p221.jpg,72,1544118564.0,johnkphotos,0.97,/r/spacex/comments/a3qafo/falcon_9_putting_on_a_fiery_show_as_it_climbs/,spacex,1828412,2
Elon on Twitter: Starhopper just lifted off & hit tether limits!,2979,ba0wqy,https://twitter.com/elonmusk/status/1114390314565787648?s=21,386,1554526391.0,rustybeancake,0.96,/r/spacex/comments/ba0wqy/elon_on_twitter_starhopper_just_lifted_off_hit/,spacex,1828412,2
"My photos of the Falcon Heavy launching and landing, seen from the NASA Causeway at Kennedy Space Center (Album will update as remotes become available).",2946,7vqoly,https://imgur.com/a/ScEnW,131,1517951749.0,jardeon,0.98,/r/spacex/comments/7vqoly/my_photos_of_the_falcon_heavy_launching_and/,spacex,1828412,2
SpaceX gives employees Friday off as the company celebrates a historic week,2937,i5iky0,https://www.cnbc.com/2020/08/07/elon-musk-gives-spacex-employees-a-day-off-after-historic-week.html,285,1596823025.0,thesheetztweetz,0.97,/r/spacex/comments/i5iky0/spacex_gives_employees_friday_off_as_the_company/,spacex,1828412,2
A twice-flown Falcon 9 rocket takes to the sky for the third time tonight with SpaceX's heaviest payload to date. (Marcus Cote/ Space Coast Times),2942,bsgvfm,https://i.redd.it/kdx44ffwt5031.jpg,113,1558704149.0,marcuscotephoto,0.99,/r/spacex/comments/bsgvfm/a_twiceflown_falcon_9_rocket_takes_to_the_sky_for/,spacex,1828412,2
Falcon 9 streaks into the starry nighttime Space Coast sky with Telstar 19V — johnkrausphotos.com,2920,90vt2c,https://i.redd.it/gr5hpdp2xfb11.jpg,54,1532239564.0,johnkphotos,0.95,/r/spacex/comments/90vt2c/falcon_9_streaks_into_the_starry_nighttime_space/,spacex,1828412,2
Falcon 9 lights up the sky above the Space Coast for the first time in 2019. (Photo: Marcus Cote/ Space Coast Times),2915,atbmsf,https://i.redd.it/r8j1xdgp11i21.jpg,76,1550800932.0,marcuscotephoto,0.98,/r/spacex/comments/atbmsf/falcon_9_lights_up_the_sky_above_the_space_coast/,spacex,1828412,2
"Beautiful, cloudy launch of Falcon 9 and Dragon with CRS-22.",2905,nsxn6j,https://i.redd.it/kvan3wjapg371.jpg,27,1622905343.0,johnkphotos,0.99,/r/spacex/comments/nsxn6j/beautiful_cloudy_launch_of_falcon_9_and_dragon/,spacex,1828412,2
SpaceX on Twitter: Falcon 9 first stage has landed at LZ-1,2904,5uyjuz,https://twitter.com/SpaceX/status/833327256239878145,367,1487516018.0,TheVehicleDestroyer,1.0,/r/spacex/comments/5uyjuz/spacex_on_twitter_falcon_9_first_stage_has_landed/,spacex,1828412,2
"Elon Musk on Twitter: Turns out MCT can go well beyond Mars, so will need a new name…",2874,534ylb,https://twitter.com/elonmusk/status/776939304140414976,883,1474071777.0,aguyfromnewzealand,0.92,/r/spacex/comments/534ylb/elon_musk_on_twitter_turns_out_mct_can_go_well/,spacex,1828412,2
Elon on Twitter: BFR will be able to launch in „All-weather. ~300km/h high altitude winds. ~60km/h ground winds. It’s a beast.“,2870,8wv1ut,https://twitter.com/elonmusk/status/1015648140341403648?s=21,473,1530986551.0,failion_V2,0.96,/r/spacex/comments/8wv1ut/elon_on_twitter_bfr_will_be_able_to_launch_in/,spacex,1828412,2
"Musk: ""It would need to refill to return, but it could get to Jupiter with low payload""",2872,73shkg,https://twitter.com/elonmusk/status/914734726493102082,388,1506947734.0,Balance-,0.94,/r/spacex/comments/73shkg/musk_it_would_need_to_refill_to_return_but_it/,spacex,1828412,2
Elon Musk: Success on [SN10] landing probability is ~60% this time,2870,ljt8pz,https://twitter.com/elonmusk/status/1360774866023112704,387,1613324892.0,CProphet,0.98,/r/spacex/comments/ljt8pz/elon_musk_success_on_sn10_landing_probability_is/,spacex,1828412,2
SpaceX on Twitter: Successful deployment of all 10 @IridiumComm NEXT satellites to low-Earth orbit confirmed.,2863,88b6oq,https://twitter.com/SpaceX/status/979742157580849152,207,1522423862.0,TheVehicleDestroyer,0.96,/r/spacex/comments/88b6oq/spacex_on_twitter_successful_deployment_of_all_10/,spacex,1828412,2
Elon Musk: SpaceX is starting a program to take CO2 out of atmosphere & turn it into rocket fuel. Please join if interested.,2860,rg579o,https://twitter.com/elonmusk/status/1470519292651352070,609,1639479977.0,CProphet,0.93,/r/spacex/comments/rg579o/elon_musk_spacex_is_starting_a_program_to_take/,spacex,1828412,2
"SpaceX raising over $500 million, double what Elon Musk's company planned to bring in",2853,ffxd3p,https://www.cnbc.com/2020/03/09/spacex-raising-500-million-in-new-funding-for-elon-musks-company.html,292,1583771548.0,ethan829,0.98,/r/spacex/comments/ffxd3p/spacex_raising_over_500_million_double_what_elon/,spacex,1828412,2
Falcon 9 laser beam (Starlink v1.0 L-25),2843,n4x8b8,https://i.redd.it/8lib8gdcx5x61.jpg,61,1620159797.0,Space_Coast_Steve,0.97,/r/spacex/comments/n4x8b8/falcon_9_laser_beam_starlink_v10_l25/,spacex,1828412,2
Washington Post: Boeing faced only ‘limited’ safety review from NASA while SpaceX got a full examination,2840,dy9gdv,https://www.washingtonpost.com/technology/2019/11/18/boeing-faced-only-limited-safety-review-nasa-while-spacex-got-full-examination/,429,1574110987.0,rustybeancake,0.98,/r/spacex/comments/dy9gdv/washington_post_boeing_faced_only_limited_safety/,spacex,1828412,2
Sunrise —> Day —> Launch: Seamless time lapse and real-time video of today’s liftoff of Falcon 9 and 60 Starlink satellites,2840,l1akw5,https://v.redd.it/pf0lwyui2ic61,63,1611154069.0,johnkphotos,0.98,/r/spacex/comments/l1akw5/sunrise_day_launch_seamless_time_lapse_and/,spacex,1828412,2
"This is by far and away my favorite remote camera image to date! Safe travels, Starman.",2844,7vrxyg,https://i.redd.it/8adtfjh3noe01.jpg,86,1517962171.0,TMahlman,0.99,/r/spacex/comments/7vrxyg/this_is_by_far_and_away_my_favorite_remote_camera/,spacex,1828412,2
CREW-3 taking to the skies! [OC],2835,qrap3z,https://i.redd.it/2j6rj5f8ovy71.jpg,57,1636597884.0,mdcainjr,0.98,/r/spacex/comments/qrap3z/crew3_taking_to_the_skies_oc/,spacex,1828412,2
STARLINK 14 streaks away through the clouds,2812,jlhlcy,https://i.redd.it/7ksx1yojcfw51.jpg,46,1604147606.0,CCBRChris,0.98,/r/spacex/comments/jlhlcy/starlink_14_streaks_away_through_the_clouds/,spacex,1828412,2
When a Train and Rocket Meet,2794,elbccj,https://i.redd.it/zl3nauravc941.jpg,39,1578402523.0,stevenmadow,0.99,/r/spacex/comments/elbccj/when_a_train_and_rocket_meet/,spacex,1828412,2
Announcing the first commercial astronaut mission to orbit Earth aboard Dragon,2792,laerqd,https://www.spacex.com/updates/inspiration-4-mission/index.html,286,1612215112.0,AnimatorOnFire,0.98,/r/spacex/comments/laerqd/announcing_the_first_commercial_astronaut_mission/,spacex,1828412,2
Onlookers on a jam-packed Cocoa Beach Pier enjoy a beautiful dual landing of Falcon Heavy's side boosters.,2784,bc9e3u,https://i.redd.it/siv8y6arcrr21.jpg,104,1555042542.0,Space_Coast_Steve,0.99,/r/spacex/comments/bc9e3u/onlookers_on_a_jampacked_cocoa_beach_pier_enjoy_a/,spacex,1828412,2
SN3 Fails during cryogenic testing,2775,fu3ugm,https://v.redd.it/vun1xdck0kq41,578,1585898378.0,Humble_Giveaway,0.98,/r/spacex/comments/fu3ugm/sn3_fails_during_cryogenic_testing/,spacex,1828412,2
"SpaceX will no longer develop Starship/Super Heavy at Port of LA, instead moving operations fully to Texas",2753,agpbkk,https://www.latimes.com/business/la-fi-spacex-port-of-la-20190116-story.html,433,1547670131.0,thesheetztweetz,0.93,/r/spacex/comments/agpbkk/spacex_will_no_longer_develop_starshipsuper_heavy/,spacex,1828412,2
Elon Musk on Twitter: SpaceX propulsion just achieved first firing of the Raptor interplanetary transport engine,2749,54j56i,https://twitter.com/elonmusk/status/780275236922994688/photo/1,557,1474867116.0,aguyfromnewzealand,0.99,/r/spacex/comments/54j56i/elon_musk_on_twitter_spacex_propulsion_just/,spacex,1828412,2
One of the most beautiful launches I’ve ever seen. Falcon 9 launches the COSMO-SkyMed Second Generation FM2 mission at sunset.,2737,shxc6z,https://i.redd.it/moibo74en8f81.jpg,68,1643728559.0,johnkphotos,0.98,/r/spacex/comments/shxc6z/one_of_the_most_beautiful_launches_ive_ever_seen/,spacex,1828412,2
The current status of SpaceX's Starship & Superheavy prototypes. 9th January 2021 The blue overlays show changes compared to this time last week.,2732,kto5v2,https://i.redd.it/i5kybjrg4aa61.jpg,183,1610186105.0,brendan290803,0.99,/r/spacex/comments/kto5v2/the_current_status_of_spacexs_starship_superheavy/,spacex,1828412,2
"Elon Musk on Twitter: “First Starship orbital flight will be with Raptor 2 engines, as they are much more capable & reliable. 230 ton or ~500k lb thrust at sea level. We’ll have 39 flightworthy engines built by next month, then another month to integrate, so hopefully May for orbital flight test.”",2727,tjjqq7,https://twitter.com/elonmusk/status/1505987581464367104?s=21,442,1647890665.0,rustybeancake,0.94,/r/spacex/comments/tjjqq7/elon_musk_on_twitter_first_starship_orbital/,spacex,1828412,2
Gorgeously faded morning sky behind Falcon 9 with KoreaSat5A | Teslarati,2710,79no48,https://i.redd.it/88187lhsxyuz.jpg,83,1509369785.0,TomCross,0.94,/r/spacex/comments/79no48/gorgeously_faded_morning_sky_behind_falcon_9_with/,spacex,1828412,2
"SpaceX's flightworthy boosters as of Apr 30, 2021",2711,n1qbuw,https://i.redd.it/rwgstgen5aw61.png,258,1619775255.0,rykllan,0.99,/r/spacex/comments/n1qbuw/spacexs_flightworthy_boosters_as_of_apr_30_2021/,spacex,1828412,2
I photographed today’s launch of Falcon 9 and BulgiariaSat-1 from a Robinson R44 helicopter over Cape Canaveral!,2704,6j3esl,http://i.imgur.com/Px98nSd.jpg,111,1498245554.0,johnkphotos,0.99,/r/spacex/comments/6j3esl/i_photographed_todays_launch_of_falcon_9_and/,spacex,1828412,2
SpaceX plans to start offering Starlink broadband services in 2020,2703,dlo9lt,https://spacenews.com/spacex-plans-to-start-offering-starlink-broadband-services-in-2020/,576,1571777533.0,jclishman,0.99,/r/spacex/comments/dlo9lt/spacex_plans_to_start_offering_starlink_broadband/,spacex,1828412,2
Falcon 9 Block 5 rolling out to the launch pad,2704,8gtt5k,https://www.instagram.com/p/BiVG1svA9Yd/?taken-by=elonmusk,255,1525381751.0,TMahlman,0.95,/r/spacex/comments/8gtt5k/falcon_9_block_5_rolling_out_to_the_launch_pad/,spacex,1828412,2
GPS-III SV05 next-gen GPS successfully deployed in orbit!,2696,o21ufk,https://i.redd.it/8rljwl0wvu571.jpg,108,1623948769.0,mdcainjr,0.97,/r/spacex/comments/o21ufk/gpsiii_sv05_nextgen_gps_successfully_deployed_in/,spacex,1828412,2
"B1058.6 and B1051.9, for the first time ever there are two boosters vertical in Port Canaveral",2698,m6rld7,https://i.redd.it/yh36zfnfhin61.jpg,166,1615953360.0,Kyle_M_Photo,0.99,/r/spacex/comments/m6rld7/b10586_and_b10519_for_the_first_time_ever_there/,spacex,1828412,2
"Elon Musk - Our biggest priorities with Starship: 1. Orbital launch tower that can stack, 2. Enough Raptors for orbit booster, 3. Improve ship & booster mass",2690,lfb79j,https://twitter.com/elonmusk/status/1358594029101879298,354,1612788908.0,CProphet,0.96,/r/spacex/comments/lfb79j/elon_musk_our_biggest_priorities_with_starship_1/,spacex,1828412,2
Falcon 9 lifting off with Turksat 5A,2688,kt6oc0,https://i.redd.it/7pvui3ab45a61.jpg,29,1610125559.0,Kyle_M_Photo,0.99,/r/spacex/comments/kt6oc0/falcon_9_lifting_off_with_turksat_5a/,spacex,1828412,2
SpaceX confirms it is now targeting no earlier than Monday (Feb. 1) for its Starship SN9 launch attempt,2687,l7vvhm,https://twitter.com/thesheetztweetz/status/1355180981859311624?s=21,221,1611935411.0,ragner11,0.98,/r/spacex/comments/l7vvhm/spacex_confirms_it_is_now_targeting_no_earlier/,spacex,1828412,2
CREW-4 heading towards the ISS!,2677,ucz6kt,https://i.redd.it/kmeuv951e1w81.jpg,80,1651050080.0,mdcainjr,0.98,/r/spacex/comments/ucz6kt/crew4_heading_towards_the_iss/,spacex,1828412,2
"After Inspiration4, SpaceX sees high demand for free-flyer missions : The company will consider building vehicles dedicated to this purpose",2678,prvf72,https://arstechnica.com/science/2021/09/after-inspiration4-spacex-sees-high-demand-for-free-flyer-missions/,614,1632146209.0,skpl,0.97,/r/spacex/comments/prvf72/after_inspiration4_spacex_sees_high_demand_for/,spacex,1828412,2
Falcon Heavy Animation,2672,7vgr5m,https://www.youtube.com/watch?v=Tk338VXcb24,443,1517855089.0,ethan829,0.96,/r/spacex/comments/7vgr5m/falcon_heavy_animation/,spacex,1828412,2
53 more Starlink sats make their way to LEO,2673,ug9az9,https://i.redd.it/id0rpzu3ixw81.jpg,76,1651438868.0,mdcainjr,0.97,/r/spacex/comments/ug9az9/53_more_starlink_sats_make_their_way_to_leo/,spacex,1828412,2
Last pic of Starman in Roadster on its journey to Mars orbit and then the Asteroid Belt,2671,7vzu4q,https://www.instagram.com/p/Be6VZEzgAEk/,469,1518040890.0,jclishman,0.98,/r/spacex/comments/7vzu4q/last_pic_of_starman_in_roadster_on_its_journey_to/,spacex,1828412,2
Mission Starlink 4-5 lifting off pad 39a [OC],2664,rxrc6q,https://i.redd.it/dpn106oqc5a81.jpg,163,1641509470.0,mdcainjr,0.98,/r/spacex/comments/rxrc6q/mission_starlink_45_lifting_off_pad_39a_oc/,spacex,1828412,2
Mesmerizing slowmo footage captured during CRS23 🎥,2659,pehtlt,https://v.redd.it/b9ehtnpnchk71,70,1630329198.0,learntimelapse,0.99,/r/spacex/comments/pehtlt/mesmerizing_slowmo_footage_captured_during_crs23/,spacex,1828412,2
Close-Up of Falcon Heavy Titanium Grid Fin,2651,7zoqt6,https://i.redd.it/dzbyy6jebzh01.jpg,333,1519399051.0,adambernnyc,0.98,/r/spacex/comments/7zoqt6/closeup_of_falcon_heavy_titanium_grid_fin/,spacex,1828412,2
"@elonmusk: ""Seems likely that we’ll be able to reuse fairings that soft-landed in the ocean. May not need net at all. Would still love to see the catch happen though ⚾️ 👍""",2653,a58m9y,https://twitter.com/elonmusk/status/1072534901919006720,342,1544547687.0,ketivab,0.97,/r/spacex/comments/a58m9y/elonmusk_seems_likely_that_well_be_able_to_reuse/,spacex,1828412,2
A conversation with Jim Bridenstine inside SpaceX HQ Mission Control about the Commercial Crew Program,2649,dghslj,https://youtu.be/TU_vOt3wSDg,294,1570812205.0,everydayastronaut,0.97,/r/spacex/comments/dghslj/a_conversation_with_jim_bridenstine_inside_spacex/,spacex,1828412,2
Elon Musk: Using [Star]ship itself as structure for new giant telescope that’s >10X Hubble resolution. Was talking to Saul Perlmutter (who’s awesome) & he suggested wanting to do that.,2642,ofqm8o,https://twitter.com/elonmusk/status/1412846722561105921,657,1625687442.0,CProphet,0.94,/r/spacex/comments/ofqm8o/elon_musk_using_starship_itself_as_structure_for/,spacex,1828412,2
"Falcon fairing halves missed the net, but touched down softly in the water. Mr Steven is picking them up. Plan is to dry them out & launch again. Nothing wrong with a little swim.",2641,a2sg85,https://twitter.com/elonmusk/status/1069679948103847939,415,1543867907.0,FoxhoundBat,0.96,/r/spacex/comments/a2sg85/falcon_fairing_halves_missed_the_net_but_touched/,spacex,1828412,2
15-image composite photo at one-second intervals showcasing Falcon 9 B1058 landing during Transporter-3 mission today,2633,s34xqn,https://i.redd.it/v7r8d2rmrhb81.jpg,53,1642095569.0,johnkphotos,0.98,/r/spacex/comments/s34xqn/15image_composite_photo_at_onesecond_intervals/,spacex,1828412,2
B1049 on its 9th mission for Starlink-25,2626,n5eh26,https://i.redd.it/wvdtw1pxmax61.jpg,58,1620216826.0,mdcainjr,0.99,/r/spacex/comments/n5eh26/b1049_on_its_9th_mission_for_starlink25/,spacex,1828412,2
