title,score,id,url,num_comments,created,author,upvote_ratio,permalink,subreddit,subreddit_subscribers,depth
"Lets upvote this image so it's the first result on Google when people search for ""How does gay sex work?""",33039,65vm8j,https://i.redd.it/d7xfzg1pa4sy.gif,574,1492436646.0,SecretIllegalAccount,0.76,/r/gaybros/comments/65vm8j/lets_upvote_this_image_so_its_the_first_result_on/,gaybros,377070,2
upstairs gay neighbour,25535,7qzx0f,https://i.imgur.com/JiWvKpL.jpg,337,1516181999.0,bass-,0.91,/r/gaybros/comments/7qzx0f/upstairs_gay_neighbour/,gaybros,377070,2
Eyes wide open 👀,22763,8gaz6u,https://i.redd.it/qq68x2jolav01.jpg,467,1525201528.0,albannonymous,0.85,/r/gaybros/comments/8gaz6u/eyes_wide_open/,gaybros,377070,2
well shit,21952,b73aqy,https://i.redd.it/7hlga747r4p21.jpg,198,1553896709.0,jooordanstevens,0.95,/r/gaybros/comments/b73aqy/well_shit/,gaybros,377070,2
I know LGBT news has been depressing of late... but Lil Nas X just made out with a guy during his BET awards performance.,21949,o9ic78,https://i.redd.it/zz4ch7szrz771.jpg,1460,1624879675.0,isuhkzwane,0.72,/r/gaybros/comments/o9ic78/i_know_lgbt_news_has_been_depressing_of_late_but/,gaybros,377070,2
The husband of Luxembourg's gay Prime Minister joined the other NATO leaders' wives and girlfriend for a photo op,21648,6dewcv,http://i.imgur.com/mOyYLls.jpg,1060,1495774500.0,bass-,0.89,/r/gaybros/comments/6dewcv/the_husband_of_luxembourgs_gay_prime_minister/,gaybros,377070,2
I...I don’t know,12467,7wibij,https://i.redd.it/1shu2mcagaf01.jpg,256,1518226143.0,CbusLawyer,0.84,/r/gaybros/comments/7wibij/ii_dont_know/,gaybros,377070,2
"Ian McKellen, great actor... great human being",10597,7tjx5e,https://i.redd.it/2qlm9w8bznc01.png,171,1517141416.0,anoelr1963,0.92,/r/gaybros/comments/7tjx5e/ian_mckellen_great_actor_great_human_being/,gaybros,377070,2
”it's just a phase”,10567,6i7zd9,https://pbs.twimg.com/media/DCqlFDrVoAAsQfM.jpg,195,1497893864.0,bass-,0.81,/r/gaybros/comments/6i7zd9/its_just_a_phase/,gaybros,377070,2
George Takei isn't having any of this shit,9611,uiadvc,https://i.redd.it/qx4ycjt8jhx81.jpg,509,1651681397.0,PeasKhichra,0.91,/r/gaybros/comments/uiadvc/george_takei_isnt_having_any_of_this_shit/,gaybros,377070,2
"A salute to Lil Nas X. “Old Town Road”, a song by a gay man is now the longest running No. 1 song ever (17 weeks).",9308,cjftm7,https://i.redd.it/cw9i4v48kad31.jpg,421,1564427364.0,new_beginningss,0.92,/r/gaybros/comments/cjftm7/a_salute_to_lil_nas_x_old_town_road_a_song_by_a/,gaybros,377070,2
It's okay guys one day you will be ready,9167,bw93au,https://imgur.com/7IcX7xj,187,1559557490.0,miguelcabezas,0.92,/r/gaybros/comments/bw93au/its_okay_guys_one_day_you_will_be_ready/,gaybros,377070,2
😄😄,8655,j7enoc,https://i.redd.it/udakkf9tyvr51.jpg,99,1602169441.0,flower-defianter,0.97,/r/gaybros/comments/j7enoc/_/,gaybros,377070,2
"21 years ago today, Mathew Shepard, when 21, was brutally attacked just for being gay. He died as a result of his injuries on October 12th, 1998. 18 hours after the attack he was found with his face caked in blood except where his tears had left track marks. Be safe and be vigilant.",7994,decp8x,https://i.redd.it/uniy1i3ov0r31.jpg,271,1570412011.0,Gaymbers,0.96,/r/gaybros/comments/decp8x/21_years_ago_today_mathew_shepard_when_21_was/,gaybros,377070,2
And they were roommates,7435,i57kum,https://v.redd.it/yyfml7bfgif51,277,1596775704.0,Bluewy_Atenean,0.96,/r/gaybros/comments/i57kum/and_they_were_roommates/,gaybros,377070,2
GET IT fellow gaybro,7377,bbb0c0,https://i.imgur.com/1phrMtV.jpg,57,1554832220.0,oknatethegreat,0.95,/r/gaybros/comments/bbb0c0/get_it_fellow_gaybro/,gaybros,377070,2
gay culture,7227,9o44vv,https://i.redd.it/y9khd2kri6s11.jpg,80,1539535102.0,jooordanstevens,0.96,/r/gaybros/comments/9o44vv/gay_culture/,gaybros,377070,2
When you're gay but single af,6909,d7xeoc,https://i.redd.it/g5khenuez7o31.jpg,151,1569190484.0,hazily,0.92,/r/gaybros/comments/d7xeoc/when_youre_gay_but_single_af/,gaybros,377070,2
😄😄😄,6911,j8i13i,https://i.redd.it/w0rfapz3s8s51.jpg,123,1602324578.0,flower-defianter,0.98,/r/gaybros/comments/j8i13i/_/,gaybros,377070,2
"More often than not, the gay community does look a bit like this (artist: @stormzebastille)",6865,hj759j,https://i.redd.it/vf6tsgqnu7851.jpg,480,1593596447.0,hazily,0.92,/r/gaybros/comments/hj759j/more_often_than_not_the_gay_community_does_look_a/,gaybros,377070,2
"merry christmas, gay bros! hope you all have the christmas you deserve ❤️",6788,a9gwt2,https://i.redd.it/l6rneufpsg621.jpg,176,1545761389.0,jooordanstevens,0.94,/r/gaybros/comments/a9gwt2/merry_christmas_gay_bros_hope_you_all_have_the/,gaybros,377070,2
Meanwhile Gays at the Olympic’s. 🌈🧶,6722,owgy4x,https://i.redd.it/zcenbutirye71.jpg,179,1627918370.0,imat_ture,0.94,/r/gaybros/comments/owgy4x/meanwhile_gays_at_the_olympics/,gaybros,377070,2
Oh Ok,6681,3z3fpl,http://imgur.com/Xx3mbGq,119,1451704666.0,miguelcabezas,0.88,/r/gaybros/comments/3z3fpl/oh_ok/,gaybros,377070,2
Why is this so true?,6209,8ia626,https://i.redd.it/yx498riprww01.jpg,122,1525905756.0,CbusLawyer,0.95,/r/gaybros/comments/8ia626/why_is_this_so_true/,gaybros,377070,2
"Gay lawmaker destroys Republican in powerful speech: ""I'm not afraid of you anymore""",6166,u5r4w4,https://v.redd.it/cm7375sbd4u81,273,1650214506.0,PeasKhichra,0.95,/r/gaybros/comments/u5r4w4/gay_lawmaker_destroys_republican_in_powerful/,gaybros,377070,2
India right now...,5978,9e5lrq,https://imgur.com/Kbf8Kuw,74,1536425398.0,anoelr1963,0.93,/r/gaybros/comments/9e5lrq/india_right_now/,gaybros,377070,2
Dad's note to gay son that hasn't came out yet...,5940,7oqtwq,https://i.redd.it/iqux0lheal801.jpg,211,1515335372.0,anoelr1963,0.91,/r/gaybros/comments/7oqtwq/dads_note_to_gay_son_that_hasnt_came_out_yet/,gaybros,377070,2
I felt bad for one of our gaybro 😞,5727,qpejn9,https://v.redd.it/kphy46adrdy71,433,1636381016.0,Bluewy_Atenean,0.95,/r/gaybros/comments/qpejn9/i_felt_bad_for_one_of_our_gaybro/,gaybros,377070,2
"If I had a dollar for every time a historian explained away an obvious gay relationship by saying ""It was a different time""",5681,98jqwx,https://i.redd.it/yjf3nalzg1h11.jpg,238,1534679837.0,SecretIllegalAccount,0.91,/r/gaybros/comments/98jqwx/if_i_had_a_dollar_for_every_time_a_historian/,gaybros,377070,2
Doug Jones sweared into office by Mike Pence next to his openly gay son.,5651,7o2dbv,https://i.redd.it/cbiv3dn9kz701.jpg,256,1515064881.0,anoelr1963,0.9,/r/gaybros/comments/7o2dbv/doug_jones_sweared_into_office_by_mike_pence_next/,gaybros,377070,2
"Well, if this isn’t something most of us can relate to...",5607,89tt6d,https://i.redd.it/2a3mxffmoyp01.jpg,104,1522877997.0,MajorasMasc4Masc,0.93,/r/gaybros/comments/89tt6d/well_if_this_isnt_something_most_of_us_can_relate/,gaybros,377070,2
"We eat the same things, girl.",5553,d736jp,https://i.redd.it/n94ueqb97un31.jpg,107,1569023616.0,PaulRob517,0.97,/r/gaybros/comments/d736jp/we_eat_the_same_things_girl/,gaybros,377070,2
Second Christmas Together,5521,kknkvu,https://i.redd.it/7la7n102vk761.jpg,62,1609008575.0,pakman1991,0.96,/r/gaybros/comments/kknkvu/second_christmas_together/,gaybros,377070,2
"No, but actually",5431,7oh8tc,https://i.redd.it/kqp92k39rd801.jpg,154,1515215213.0,CbusLawyer,0.9,/r/gaybros/comments/7oh8tc/no_but_actually/,gaybros,377070,2
hahaha same,5338,ba4fv1,https://i.redd.it/nvpvuu8kenq21.jpg,54,1554558339.0,jooordanstevens,0.97,/r/gaybros/comments/ba4fv1/hahaha_same/,gaybros,377070,2
Who's here as gym couples?,5332,imi10b,https://i.redd.it/75m1fxydg5l51.jpg,158,1599233377.0,bett3r,0.95,/r/gaybros/comments/imi10b/whos_here_as_gym_couples/,gaybros,377070,2
Swedish singer Darin came out as gay during Pride weekend in Stockholm. Glad Pride to the all the Swedish bros. 🏳️‍🌈🇸🇪,5286,i30brx,https://i.redd.it/l7sbjn6bfte51.jpg,165,1596472645.0,gatogatinhomiau,0.98,/r/gaybros/comments/i30brx/swedish_singer_darin_came_out_as_gay_during_pride/,gaybros,377070,2
Congrats to actor Kal Penn on coming out!,5268,qjq1oz,https://i.redd.it/btnpx24qksw71.jpg,312,1635688685.0,IndyMLVC,0.96,/r/gaybros/comments/qjq1oz/congrats_to_actor_kal_penn_on_coming_out/,gaybros,377070,2
2 year anniversary with my hubby,5208,haegqd,https://i.redd.it/uofmd4k4nc551.jpg,97,1592346834.0,patituz,0.95,/r/gaybros/comments/haegqd/2_year_anniversary_with_my_hubby/,gaybros,377070,2
What being Gay and Fat fells like!,5184,8qhrea,https://i.imgur.com/24Y3aA8.jpg,402,1528797999.0,bass-,0.88,/r/gaybros/comments/8qhrea/what_being_gay_and_fat_fells_like/,gaybros,377070,2
"Today I learned about the Rainbow Railroad. A NGO based in Canada that helps gay men to escape from countries where they lives are in danger. Founded in 2006, it has helped more than 800 people from 38 different countries.",5178,lscbmv,https://i.redd.it/1zbnshfnvnj61.jpg,135,1614275268.0,ed8907,0.98,/r/gaybros/comments/lscbmv/today_i_learned_about_the_rainbow_railroad_a_ngo/,gaybros,377070,2
First date things,5166,8qt1ht,https://i.redd.it/osjya1578s311.jpg,127,1528901698.0,albannonymous,0.92,/r/gaybros/comments/8qt1ht/first_date_things/,gaybros,377070,2
Happy Fathers’ Day!,5140,c0py5m,https://i.redd.it/azctf371be431.jpg,157,1560550063.0,wonderpeejay,0.96,/r/gaybros/comments/c0py5m/happy_fathers_day/,gaybros,377070,2
Because we exist!,5144,be0kio,https://i.redd.it/khynghrbkps21.jpg,365,1555456192.0,KingOfCranes,0.9,/r/gaybros/comments/be0kio/because_we_exist/,gaybros,377070,2
Cute Family,5050,60f3gt,https://pbs.twimg.com/media/C7VB-0OVwAQi16F.jpg,210,1489993415.0,bass-,0.78,/r/gaybros/comments/60f3gt/cute_family/,gaybros,377070,2
Only one name was added to Toronto’s AIDS memorial in 2019. Up to seven plaques were required in some years to list all the Bros who were being claimed by the epidemic. One name.,5031,eifs05,https://i.redd.it/9zs2mjueg4841.jpg,140,1577864725.0,vmcla,0.98,/r/gaybros/comments/eifs05/only_one_name_was_added_to_torontos_aids_memorial/,gaybros,377070,2
Happy Daddy’s Day,5019,o485fl,https://i.redd.it/07r43olzvf671.jpg,128,1624203032.0,wonderpeejay,0.97,/r/gaybros/comments/o485fl/happy_daddys_day/,gaybros,377070,2
"Florida high school class president was told by his school that they would cut his microphone if he said “gay” in his grad speech, so he replaced gay with “having curly hair.”",4969,uxhxed,https://v.redd.it/8i240h3tnm191,122,1653486930.0,PeasKhichra,0.99,/r/gaybros/comments/uxhxed/florida_high_school_class_president_was_told_by/,gaybros,377070,2
Hugh Nini & Neal Treadwell ( Loving: A Photographic History of Men in Love 1850-1950),4923,l44bax,https://i.redd.it/stwuw7wgkbd61.jpg,45,1611511137.0,pedreirolingerie,0.98,/r/gaybros/comments/l44bax/hugh_nini_neal_treadwell_loving_a_photographic/,gaybros,377070,2
Lil Nas is a Power Top Now. 😜,4923,p2zm7h,https://i.redd.it/w095pcpagxg71.jpg,164,1628774160.0,imat_ture,0.97,/r/gaybros/comments/p2zm7h/lil_nas_is_a_power_top_now/,gaybros,377070,2
i’m crying 🤣,4906,f30gkp,https://i.redd.it/qvody6kvwkg41.jpg,106,1581550757.0,jooordanstevens,0.95,/r/gaybros/comments/f30gkp/im_crying/,gaybros,377070,2
Better late than never,4866,dmy00s,https://i.redd.it/8x89ysr83pu31.png,96,1572012674.0,KingOfCranes,0.98,/r/gaybros/comments/dmy00s/better_late_than_never/,gaybros,377070,2
Coming full circle,4833,bnbvk4,https://i.redd.it/f5wi9l5pzkx21.jpg,100,1557580112.0,KingOfCranes,0.97,/r/gaybros/comments/bnbvk4/coming_full_circle/,gaybros,377070,2
lmao i am crying,4796,bi80ff,https://i.redd.it/jlwpmsjgxxu21.jpg,178,1556429155.0,jooordanstevens,0.95,/r/gaybros/comments/bi80ff/lmao_i_am_crying/,gaybros,377070,2
Not a gaybro...but still a bro,4788,9g21y0,https://i.redd.it/bwqq3k311em11.jpg,136,1537023236.0,anoelr1963,0.92,/r/gaybros/comments/9g21y0/not_a_gaybrobut_still_a_bro/,gaybros,377070,2
"wow, how i miss that! stop it soon, pandemic!",4771,kvfrfd,https://i.redd.it/wqysv2xgmsa61.gif,114,1610410085.0,pedreirolingerie,0.96,/r/gaybros/comments/kvfrfd/wow_how_i_miss_that_stop_it_soon_pandemic/,gaybros,377070,2
And there is no free pizza,4766,b438iz,https://i.redd.it/8lrky7ps8nn21.jpg,287,1553248941.0,KingOfCranes,0.96,/r/gaybros/comments/b438iz/and_there_is_no_free_pizza/,gaybros,377070,2
I got married to my best friend last Friday and I am still over the moon,4714,ner3d5,https://i.redd.it/c4vbqg98rqz61.jpg,97,1621283670.0,starstufft,0.95,/r/gaybros/comments/ner3d5/i_got_married_to_my_best_friend_last_friday_and_i/,gaybros,377070,2
The Plight of Tall Bottoms..,4663,oz7gpj,https://i.redd.it/nw02ax38xqf71.jpg,195,1628259256.0,imat_ture,0.98,/r/gaybros/comments/oz7gpj/the_plight_of_tall_bottoms/,gaybros,377070,2
Just because situation in Poland is looking bleak this doesn't mean we're going into hiding again,4624,m47l9o,https://i.redd.it/g5icl6585tm61.jpg,94,1615646573.0,FenusToBe,0.98,/r/gaybros/comments/m47l9o/just_because_situation_in_poland_is_looking_bleak/,gaybros,377070,2
Pretty much,4584,ee6t5t,https://i.redd.it/7dm0vbl2p7641.jpg,189,1577032261.0,IndyMLVC,0.97,/r/gaybros/comments/ee6t5t/pretty_much/,gaybros,377070,2
Tbh I think Shrek is pretty cute,4560,hzft49,https://i.redd.it/43c2d0ep0md51.jpg,116,1595947136.0,Gaymbers,0.98,/r/gaybros/comments/hzft49/tbh_i_think_shrek_is_pretty_cute/,gaybros,377070,2
Sprite made a campaign in the Southern Cone (Argentina and Chile) to make gay couples more visible. This is one of the images of this campaign. It was painted on a small truck transporting products so that everyone sees it around Santiago de Chile and Buenos Aires.,4551,dv8kx1,https://i.redd.it/v4rb36dwn8y31.jpg,85,1573557189.0,ed8907,0.97,/r/gaybros/comments/dv8kx1/sprite_made_a_campaign_in_the_southern_cone/,gaybros,377070,2
Doug Jones defeats roy moore in alabama senate race,4541,7jggyw,https://apnews.com/e2f3c87b2f6b4c05b5e8f8cab38dd48c/Jones-wins-in-stunning-Alabama-upset,152,1513136138.0,nightpanda893,0.86,/r/gaybros/comments/7jggyw/doug_jones_defeats_roy_moore_in_alabama_senate/,gaybros,377070,2
He said yes ❤️,4515,ciru4p,https://i.redd.it/82opqsq97zc31.jpg,130,1564289831.0,theaviator10,0.94,/r/gaybros/comments/ciru4p/he_said_yes/,gaybros,377070,2
Sailors. The beginning of a beautiful friendship.,4495,sigc0t,https://i.redd.it/2ci0qrh5tcf81.jpg,73,1643778924.0,alanboston,0.97,/r/gaybros/comments/sigc0t/sailors_the_beginning_of_a_beautiful_friendship/,gaybros,377070,2
I'm in my mid 20s and this is how I feel...,4461,oaw7bs,https://v.redd.it/oosg7fxlbe871,265,1625055777.0,isuhkzwane,0.95,/r/gaybros/comments/oaw7bs/im_in_my_mid_20s_and_this_is_how_i_feel/,gaybros,377070,2
no problem 😛🤣,4460,ahpwuy,https://i.redd.it/c5f0vldmwfb21.jpg,110,1547929836.0,jooordanstevens,0.94,/r/gaybros/comments/ahpwuy/no_problem/,gaybros,377070,2
I feel at peace when i look at this drawing..i donno why..😊,4443,isio5f,https://i.redd.it/mqns6dblg3n51.jpg,89,1600080929.0,flower-defianter,0.97,/r/gaybros/comments/isio5f/i_feel_at_peace_when_i_look_at_this_drawingi/,gaybros,377070,2
Tom and Ian,4435,tw3x8h,https://i.redd.it/gse8hppjzir81.jpg,96,1649083897.0,alanboston,0.96,/r/gaybros/comments/tw3x8h/tom_and_ian/,gaybros,377070,2
True😂😂😂,4423,7mmsog,https://i.redd.it/2hsbr5h1dn601.jpg,103,1514470318.0,anoelr1963,0.89,/r/gaybros/comments/7mmsog/true/,gaybros,377070,2
Just completed 365 days of being open! It's been a rocky 1st year but we made it!! I love seeing him this happy!,4417,jwjuvi,https://www.reddit.com/gallery/jwjuvi,134,1605719884.0,ema1989,0.96,/r/gaybros/comments/jwjuvi/just_completed_365_days_of_being_open_its_been_a/,gaybros,377070,2
LMAOOO,4383,f6lt7l,https://i.redd.it/e0u1nxsrmzh41.jpg,63,1582164810.0,jooordanstevens,0.98,/r/gaybros/comments/f6lt7l/lmaooo/,gaybros,377070,2
"Yesterday the city of Wrocław, Poland had its biggest pride parade yet, over 10k people took part",4357,q0onp2,https://v.redd.it/hnddb4zacar71,57,1633288758.0,FenusToBe,0.97,/r/gaybros/comments/q0onp2/yesterday_the_city_of_wrocław_poland_had_its/,gaybros,377070,2
When you're determined to make it in one trip from the car,4304,6vaakh,https://i.redd.it/i8d2qr73h9hz.jpg,62,1503400593.0,tempestzephyr,0.86,/r/gaybros/comments/6vaakh/when_youre_determined_to_make_it_in_one_trip_from/,gaybros,377070,2
Wholesome af,4294,oo9w00,https://i.redd.it/i0i1vb70cfc71.jpg,42,1626811400.0,starstufft,0.98,/r/gaybros/comments/oo9w00/wholesome_af/,gaybros,377070,2
Optimus Pride!,4285,6f9y83,https://pbs.twimg.com/media/DBfaLCsWAAAmKGQ.jpg,32,1496612040.0,bass-,0.88,/r/gaybros/comments/6f9y83/optimus_pride/,gaybros,377070,2
Hope and denial are strange bedfellows,4253,d2qvfc,https://i.redd.it/qnl0fbqb4zl31.jpg,70,1568211482.0,KingOfCranes,0.98,/r/gaybros/comments/d2qvfc/hope_and_denial_are_strange_bedfellows/,gaybros,377070,2
Freddie Mercury and partner Jim Hutton mid 80's.,4259,b1zwv9,https://imgur.com/d7zLHgP,121,1552785985.0,anoelr1963,0.96,/r/gaybros/comments/b1zwv9/freddie_mercury_and_partner_jim_hutton_mid_80s/,gaybros,377070,2
Gay President! 🏳️‍🌈🇸🇲,4248,twtnkq,https://i.redd.it/aup2c15edpr81.jpg,121,1649161201.0,PeasKhichra,0.97,/r/gaybros/comments/twtnkq/gay_president/,gaybros,377070,2
"Yes, of course",4220,c33wnu,https://i.imgur.com/NfUtkvG.jpg,83,1561078265.0,MajorasMasc4Masc,0.99,/r/gaybros/comments/c33wnu/yes_of_course/,gaybros,377070,2
"""...you'll see""",4211,87hcn4,https://i.redd.it/twmkenluw7o01.jpg,67,1522146731.0,anoelr1963,0.93,/r/gaybros/comments/87hcn4/youll_see/,gaybros,377070,2
Gay Jeans,4197,ezb827,https://i.redd.it/abblomhjj4f41.jpg,132,1580916722.0,KingOfCranes,0.97,/r/gaybros/comments/ezb827/gay_jeans/,gaybros,377070,2
Cereal Queens...apologizes if this is a repost I didn’t see it posted yet,4193,ibi943,https://i.redd.it/1whcu6fcilh51.jpg,89,1597684354.0,pakman1991,0.98,/r/gaybros/comments/ibi943/cereal_queensapologizes_if_this_is_a_repost_i/,gaybros,377070,2
"Last Year I Was 90kg, sad, an alcoholic and barely functioned. Today I'm 67kg, ""kind sober & fully dressed"" and it wouldn't be without the support of on & off line people. If I can do it, literally anybody can.",4163,k28hsf,https://i.redd.it/l3vuos3k9u161.jpg,204,1606507323.0,Ellen_Degenerates86,0.97,/r/gaybros/comments/k28hsf/last_year_i_was_90kg_sad_an_alcoholic_and_barely/,gaybros,377070,2
Bonus points for bachelorette parties,4155,b82bve,https://i.redd.it/414kxcowlnp21.jpg,141,1554124996.0,KingOfCranes,0.97,/r/gaybros/comments/b82bve/bonus_points_for_bachelorette_parties/,gaybros,377070,2
"The headstone of Leonard Matlovich (1943-1988). It reads ''When I was in the military they gave me a medal for killing two men, and a discharge for loving one.'' [repost]",4132,7me19z,http://1.bp.blogspot.com/-x_afnGctt0U/TnSLGOGMDTI/AAAAAAAADmg/yCEHgdi4EqI/s1600/Matlovich+tombstone.jpg,79,1514366461.0,anoelr1963,0.93,/r/gaybros/comments/7me19z/the_headstone_of_leonard_matlovich_19431988_it/,gaybros,377070,2
"Don't dream it, be it",4071,cjs5xe,https://i.redd.it/4a6qn8q26gd31.jpg,139,1564495249.0,KingOfCranes,0.97,/r/gaybros/comments/cjs5xe/dont_dream_it_be_it/,gaybros,377070,2
We just purchased our first home! So thankful for this life we’ve created together.,4065,m00weu,https://www.reddit.com/gallery/m00weu,85,1615154797.0,patituz,0.97,/r/gaybros/comments/m00weu/we_just_purchased_our_first_home_so_thankful_for/,gaybros,377070,2
Oh my.,4055,dqm2tr,https://i.redd.it/i8gsoqyfpaw31.png,69,1572710229.0,Gaymbers,0.97,/r/gaybros/comments/dqm2tr/oh_my/,gaybros,377070,2
Drag angels from heaven😇😇,4043,it60q7,https://i.redd.it/butmiab3fan51.jpg,81,1600165173.0,flower-defianter,0.98,/r/gaybros/comments/it60q7/drag_angels_from_heaven/,gaybros,377070,2
How to handle unexpected onion rings and the wrong currency...,4037,af7f8h,https://imgur.com/evcEovF,87,1547300062.0,anoelr1963,0.97,/r/gaybros/comments/af7f8h/how_to_handle_unexpected_onion_rings_and_the/,gaybros,377070,2
Betty White dead at 99 18 days before her 100th birthday :(,3992,rt1laq,https://i.redd.it/0au9v20llx881.jpg,128,1640979701.0,OkieTwink,0.96,/r/gaybros/comments/rt1laq/betty_white_dead_at_99_18_days_before_her_100th/,gaybros,377070,2
Three year anniversary with my Hubby.,3940,o1f58k,https://i.redd.it/w2vqwa9fxo571.jpg,49,1623876635.0,patituz,0.98,/r/gaybros/comments/o1f58k/three_year_anniversary_with_my_hubby/,gaybros,377070,2
Chameleon years,3902,e7vo1i,https://i.redd.it/63xfmwrlqf341.png,90,1575822279.0,KingOfCranes,0.98,/r/gaybros/comments/e7vo1i/chameleon_years/,gaybros,377070,2
Pro-LGBT bilboards are popping in conservative parts of Poland after the election,3886,hv68j7,https://i.redd.it/rb9qgshor4c51.jpg,126,1595333396.0,FenusToBe,0.97,/r/gaybros/comments/hv68j7/prolgbt_bilboards_are_popping_in_conservative/,gaybros,377070,2
"How do you do, fellow gays?",3888,btm6oh,https://i.redd.it/a6zny2htdr031.jpg,182,1558965006.0,KingOfCranes,0.94,/r/gaybros/comments/btm6oh/how_do_you_do_fellow_gays/,gaybros,377070,2
Loneliness builds character,3856,enbcmr,https://i.redd.it/y60u0bcj37a41.png,97,1578768424.0,KingOfCranes,0.98,/r/gaybros/comments/enbcmr/loneliness_builds_character/,gaybros,377070,2
If at first you don't succeed...,3859,7ws6eg,https://i.redd.it/rqeya2jdckf01.jpg,169,1518345908.0,KingOfCranes,0.92,/r/gaybros/comments/7ws6eg/if_at_first_you_dont_succeed/,gaybros,377070,2
Dynamic Tension,3836,c8of4b,https://i.redd.it/v4mry6t4h3831.png,163,1562162355.0,KingOfCranes,0.96,/r/gaybros/comments/c8of4b/dynamic_tension/,gaybros,377070,2
This was great to read with my morning coffee,3836,d02rzg,https://i.redd.it/h39bdgre8rk31.jpg,63,1567699530.0,dj1041,0.97,/r/gaybros/comments/d02rzg/this_was_great_to_read_with_my_morning_coffee/,gaybros,377070,2
We can chill,3832,ej7cfx,https://i.redd.it/n4oz609zmg841.jpg,206,1578012216.0,patituz,0.98,/r/gaybros/comments/ej7cfx/we_can_chill/,gaybros,377070,2
Gay marriage you say? These pics are from a wedding in 1957. Photos were found in a Philadelphia photog studio; either not picked up or not returned to the customer for their “risqué” nature.,3828,dbbjpr,https://i.redd.it/py8qu0pngqp31.jpg,122,1569850045.0,vmcla,0.98,/r/gaybros/comments/dbbjpr/gay_marriage_you_say_these_pics_are_from_a/,gaybros,377070,2
For when people say they’re sick of seeing gay stuff everywhere. Suck it up.,3813,d57cb2,https://i.redd.it/l7ytbi3itx731.png,277,1568670933.0,tempestzephyr,0.97,/r/gaybros/comments/d57cb2/for_when_people_say_theyre_sick_of_seeing_gay/,gaybros,377070,2
oh wow,3821,9x7yx7,https://i.redd.it/ri3g1wp2dfy11.jpg,97,1542257252.0,jooordanstevens,0.96,/r/gaybros/comments/9x7yx7/oh_wow/,gaybros,377070,2
"Gotta Keep Them on Their Toes, Bros!",3810,igx9q1,https://i.redd.it/cvf1w1w83cj51.jpg,67,1598442085.0,CheddarCurtainExile,0.98,/r/gaybros/comments/igx9q1/gotta_keep_them_on_their_toes_bros/,gaybros,377070,2
i screamed,3790,bu6l4m,https://i.redd.it/6xu31vvb41131.jpg,108,1559082876.0,jooordanstevens,0.96,/r/gaybros/comments/bu6l4m/i_screamed/,gaybros,377070,2
We finally did it! My boyfriend & I finally opened our little coffee house to the local community! We've worked long and hard for this and I'm so proud of us and our team!!,3769,e2javu,https://i.redd.it/tfqa1qxrj9141.jpg,91,1574875454.0,ema1989,0.98,/r/gaybros/comments/e2javu/we_finally_did_it_my_boyfriend_i_finally_opened/,gaybros,377070,2
"We had to postpone our original ceremony and do a small backyard wedding instead, but I wouldn’t change a thing. 7/11/2020",3764,hqh5as,https://i.redd.it/s73z8n9g6na51.jpg,92,1594653632.0,theaviator10,0.97,/r/gaybros/comments/hqh5as/we_had_to_postpone_our_original_ceremony_and_do_a/,gaybros,377070,2
Where’s the lie,3751,9mm20z,https://i.redd.it/4eh9b6xw53r11.jpg,249,1539058610.0,CbusLawyer,0.94,/r/gaybros/comments/9mm20z/wheres_the_lie/,gaybros,377070,2
Hubby and me,3749,zvwcqy,https://i.redd.it/78soyld2ic8a1.jpg,101,1672087315.0,Bukakkonaut,0.95,/r/gaybros/comments/zvwcqy/hubby_and_me/,gaybros,377070,2
Big companies when June is coming,3744,ng7fa5,https://i.redd.it/mmg6nqhd83071.jpg,104,1621434720.0,bett3r,0.97,/r/gaybros/comments/ng7fa5/big_companies_when_june_is_coming/,gaybros,377070,2
How things change,3747,cx75s7,https://i.redd.it/7ozt2bzhggj31.jpg,96,1567113835.0,PaulRob517,0.97,/r/gaybros/comments/cx75s7/how_things_change/,gaybros,377070,2
Cute😍😜,3744,irz0z8,https://i.redd.it/lf2i3xdobxm51.jpg,50,1600006636.0,flower-defianter,0.98,/r/gaybros/comments/irz0z8/cute/,gaybros,377070,2
The Golden Girls were so ahead of their time.,3734,rlmr3y,https://i.redd.it/22er0frdby681.jpg,89,1640116664.0,OkieTwink,0.98,/r/gaybros/comments/rlmr3y/the_golden_girls_were_so_ahead_of_their_time/,gaybros,377070,2
When you're a little TOO into wrestling,3729,9fjr00,https://i.redd.it/x2qwmfs8e1m11.gif,142,1536857980.0,KingOfCranes,0.96,/r/gaybros/comments/9fjr00/when_youre_a_little_too_into_wrestling/,gaybros,377070,2
the Denver Zoo explains the courtship rituals of their same-sex birds to the non-believers,3712,gpjjs6,https://i.redd.it/x8rjnbwqke741.png,102,1590295213.0,CheddarCurtainExile,0.99,/r/gaybros/comments/gpjjs6/the_denver_zoo_explains_the_courtship_rituals_of/,gaybros,377070,2
Wrong number?,3693,cmuctk,https://i.redd.it/10sorai5gve31.jpg,62,1565116085.0,new_beginningss,0.97,/r/gaybros/comments/cmuctk/wrong_number/,gaybros,377070,2
These bots aren't even trying anymore...,3656,5yp8eu,http://i.imgur.com/74zalnT.jpg,76,1489185007.0,nightpanda893,0.92,/r/gaybros/comments/5yp8eu/these_bots_arent_even_trying_anymore/,gaybros,377070,2
"Time to use that hashtag, boys.",3648,j3mbf2,https://i.redd.it/aip38tj2dlq51.jpg,148,1601605214.0,gatogatinhomiau,0.98,/r/gaybros/comments/j3mbf2/time_to_use_that_hashtag_boys/,gaybros,377070,2
FINISH HIM!,3642,6hkqwt,https://i.imgur.com/tAYTL6z.png,156,1497593233.0,bass-,0.89,/r/gaybros/comments/6hkqwt/finish_him/,gaybros,377070,2
"There is a place for you here, and you are loved.",3638,artiu7,https://i.redd.it/6vb58v3he9h21.jpg,264,1550466180.0,oknatethegreat,0.95,/r/gaybros/comments/artiu7/there_is_a_place_for_you_here_and_you_are_loved/,gaybros,377070,2
