title,score,id,url,num_comments,created,author,upvote_ratio,permalink,subreddit,subreddit_subscribers,depth
"Amazon Ring patents describe a dystopian future where networks of cameras identify 'suspicious' people by recognizing their faces, retinas, skin texture, gait, voice, and even odor",19147,rh9cy7,https://www.businessinsider.com/amazon-ring-patents-describe-cameras-recognizing-skin-texture-odor-2021-12,1186,1639602383.0,speckz,0.94,/r/gadgets/comments/rh9cy7/amazon_ring_patents_describe_a_dystopian_future/,gadgets,21140247,2
Apple reportedly testing new iPhones with three rear cameras and a USB-C port,19062,alr6o2,https://www.theverge.com/2019/1/30/18204220/apple-new-iphone-testing-camera-three-rear-usb-c-port,2976,1548952043.0,drdessertlover,0.86,/r/gadgets/comments/alr6o2/apple_reportedly_testing_new_iphones_with_three/,gadgets,21140247,2
"After tens of thousands of pre-orders, 3D audio headphones startup Ossic disappears",18988,8kyw6o,https://techcrunch.com/2018/05/20/after-tens-of-thousands-of-pre-orders-high-end-3d-headphones-startup-ossic-disappears/,2094,1526885711.0,Philo1927,0.93,/r/gadgets/comments/8kyw6o/after_tens_of_thousands_of_preorders_3d_audio/,gadgets,21140247,2
The $139 Nokia 2.2 phone brings back the removable battery,18982,ce4du7,https://arstechnica.com/gadgets/2019/07/one-of-the-cheapest-nokia-phones-comes-to-the-us-the-139-nokia-2-2/,1395,1563317464.0,Philo1927,0.95,/r/gadgets/comments/ce4du7/the_139_nokia_22_phone_brings_back_the_removable/,gadgets,21140247,2
Apple Glasses Patent Suggests Any Surface Could Become a Virtual Touch Interface,18951,hva6lq,https://www.macrumors.com/2020/07/21/apple-glasses-touch-surface/,735,1595347886.0,chrisdh79,0.92,/r/gadgets/comments/hva6lq/apple_glasses_patent_suggests_any_surface_could/,gadgets,21140247,2
"Valve discontinues the Steam Link, the best wireless HDMI gadget ever made",18915,9ynlow,https://www.theverge.com/circuitbreaker/2018/11/19/18103672/valve-discontinues-steam-link-streaming-set-top-box,1944,1542679840.0,i_love_anachronisms,0.91,/r/gadgets/comments/9ynlow/valve_discontinues_the_steam_link_the_best/,gadgets,21140247,2
"Comcast website bug leaks Xfinity router data, like Wi-Fi name and password",18818,8l57ls,https://www.zdnet.com/article/comcast-bug-leaks-xfinity-home-addresses-wireless-passwords/#ftag=RSSbaffb68,1018,1526944665.0,moooooky,0.94,/r/gadgets/comments/8l57ls/comcast_website_bug_leaks_xfinity_router_data/,gadgets,21140247,2
"100 Million Alexa devices have been sold - Yes, Amazon finally gave a number",18804,acwfsp,https://www.theverge.com/2019/1/4/18168565/amazon-alexa-devices-how-many-sold-number-100-million-dave-limp,1882,1546711296.0,mspoonygp,0.91,/r/gadgets/comments/acwfsp/100_million_alexa_devices_have_been_sold_yes/,gadgets,21140247,2
FBI Calls Apple's Enhanced iCloud Encryption 'Deeply Concerning' as Privacy Groups Hail It As a Victory for Users,18761,zfy25m,https://www.macrumors.com/2022/12/08/fbi-privacy-groups-icloud-encryption/,986,1670503992.0,Avieshek,0.95,/r/gadgets/comments/zfy25m/fbi_calls_apples_enhanced_icloud_encryption/,gadgets,21140247,2
Apple and Hyundai hope to reach Apple Car deal by March,18756,kufsuc,https://9to5mac.com/2021/01/10/apple-car-hyundai-production-deal/,1233,1610290663.0,UnKindClock,0.89,/r/gadgets/comments/kufsuc/apple_and_hyundai_hope_to_reach_apple_car_deal_by/,gadgets,21140247,2
"This adapter makes the Nintendo 64 look good on modern TVs, upscaling and cleaning the S-video output into HDMI",18761,cn7olc,https://www.theverge.com/circuitbreaker/2019/8/7/20758227/eon-super-64-review-n64-hdmi-adapter,799,1565193788.0,nopantsdolphin,0.92,/r/gadgets/comments/cn7olc/this_adapter_makes_the_nintendo_64_look_good_on/,gadgets,21140247,2
AT&T will put a fake 5G logo on its 4G LTE phones,18710,a8cmgp,https://www.theverge.com/2018/12/21/18151764/att-5g-evolution-logo-rollout-fake-network,924,1545415582.0,Abscess2,0.95,/r/gadgets/comments/a8cmgp/att_will_put_a_fake_5g_logo_on_its_4g_lte_phones/,gadgets,21140247,2
Automated Drywall Robot Works Faster Than Humans in Construction,18644,k1l5sm,https://interestingengineering.com/automated-drywall-robot-works-faster-than-humans-in-construction,1575,1606417204.0,MicroSofty88,0.91,/r/gadgets/comments/k1l5sm/automated_drywall_robot_works_faster_than_humans/,gadgets,21140247,2
You May Not Get a New Charger with Your iPhone This Year,18637,hi2yzz,https://interestingengineering.com/you-may-not-get-a-new-charger-with-your-iphone-this-year,2653,1593447862.0,ChickenTeriyakiBoy1,0.88,/r/gadgets/comments/hi2yzz/you_may_not_get_a_new_charger_with_your_iphone/,gadgets,21140247,2
Google will pay Arizona $85 million over illegally tracking Android users | Engadget,18505,xx5ve2,https://www.engadget.com/google-arizona-user-tracking-suit-85-million-191649436.html,667,1665064486.0,MCA2142,0.96,/r/gadgets/comments/xx5ve2/google_will_pay_arizona_85_million_over_illegally/,gadgets,21140247,2
"Locked Out of ‘God Mode,’ Runners Are Hacking Their Treadmills - NordicTrack customers were watching Netflix using a simple trick—until the company blocked their access.",18496,qy8r8y,https://www.wired.co.uk/article/nordictrack-ifit-treadmill-privilege-mode,1717,1637424726.0,speckz,0.94,/r/gadgets/comments/qy8r8y/locked_out_of_god_mode_runners_are_hacking_their/,gadgets,21140247,2
"Nokia wants to take over the US with low cost Android Pie phones that have headphone jacks, launching the Nokia 3.1 A for AT&T and the Nokia 3.1 C for Cricket for less than $160",18442,bxty33,https://www.theverge.com/2019/6/7/18654332/nokia-3-1-a-c-att-cricket-launch-prepaid-price-specs-features-release-date-interview,1686,1559909956.0,nopantsdolphin,0.93,/r/gadgets/comments/bxty33/nokia_wants_to_take_over_the_us_with_low_cost/,gadgets,21140247,2
Samsung patents phone display that projects holograms like In Star Wars,18443,a6z4p4,"https://www.tomsguide.com/us/samsung-holographic-display-phones,news-28866.html",943,1545047174.0,thegeezuss,0.91,/r/gadgets/comments/a6z4p4/samsung_patents_phone_display_that_projects/,gadgets,21140247,2
New Material Allows Lithium-Ion Batteries to Maintain Full Capacity for 5 Years,18402,mlw97z,https://au.pcmag.com/batteries-power/85992/new-material-allows-lithium-ion-batteries-to-maintain-full-capacity-for-5-years,685,1617778109.0,karatekid430,0.96,/r/gadgets/comments/mlw97z/new_material_allows_lithiumion_batteries_to/,gadgets,21140247,2
"Improved Galaxy Fold feels more durable but comes with 19 pieces of AT&T bloatware for $2,000",18236,d8lgua,https://www.tomsguide.com/news/new-galaxy-fold-hands-on-5-things-i-like-and-3-things-i-hate,1414,1569322280.0,mspoonygp,0.92,/r/gadgets/comments/d8lgua/improved_galaxy_fold_feels_more_durable_but_comes/,gadgets,21140247,2
"Put macOS on the iPad, you cowards",18159,mwxn54,https://www.theverge.com/2021/4/22/22396449/apple-ipad-pro-macbook-air-macos-2021,1437,1619191229.0,karatekid430,0.88,/r/gadgets/comments/mwxn54/put_macos_on_the_ipad_you_cowards/,gadgets,21140247,2
Mars Helicopter Survives Malfunction During Sixth Flight,18095,nnl3oq,https://www.digitaltrends.com/news/mars-helicopter-survives-malfunction-scare-during-sixth-flight/?utm_source=reddit&utm_medium=pe&utm_campaign=pd,485,1622286050.0,MicroSofty88,0.97,/r/gadgets/comments/nnl3oq/mars_helicopter_survives_malfunction_during_sixth/,gadgets,21140247,2
Leaked image appears to show iPhone 15 Pro with USB-C port and titanium design,18017,116cqrg,https://9to5mac.com/2023/02/16/iphone-15-pro-usb-c-titanium/,2153,1676818038.0,thebelsnickle1991,0.91,/r/gadgets/comments/116cqrg/leaked_image_appears_to_show_iphone_15_pro_with/,gadgets,21140247,2
Apple announces the new $399 second generation iPhone SE,17946,g1tmgl,https://www.theverge.com/2020/4/15/21221918/iphone-se-announcement-apple-price-specs-release-date-features,2623,1586963039.0,gulabjamunyaar,0.88,/r/gadgets/comments/g1tmgl/apple_announces_the_new_399_second_generation/,gadgets,21140247,2
"Samsung Galaxy Fold sells out within minutes in Korea, with some people paying more than $4,000 on resale market",17929,d5voks,https://www.tomsguide.com/news/samsung-galaxy-fold-sold-out-some-people-paying-dollar4000-for-one,1360,1568801970.0,nopantsdolphin,0.93,/r/gadgets/comments/d5voks/samsung_galaxy_fold_sells_out_within_minutes_in/,gadgets,21140247,2
BMW Backed Impeller Thrusted Electric Wingsuit Can Fly at 185 MPH,17903,jqfkot,https://interestingengineering.com/bmw-backed-impeller-thrusted-electric-wingsuit-can-fly-at-185-mph,676,1604856465.0,ChickenTeriyakiBoy1,0.95,/r/gadgets/comments/jqfkot/bmw_backed_impeller_thrusted_electric_wingsuit/,gadgets,21140247,2
Asus made a crypto-mining motherboard that supports up to 20 GPUs,17847,8n9rf3,https://www.theverge.com/2018/5/30/17408610/asus-crypto-mining-motherboard-gpus,2050,1527696166.0,instantreporter,0.86,/r/gadgets/comments/8n9rf3/asus_made_a_cryptomining_motherboard_that/,gadgets,21140247,2
Exaeris AcquaTap can create 3.5 to 5 gallons of fresh drinking water per day out of thin air,17832,kt32mv,https://www.digitaltrends.com/news/exaeris-acquatap-world-water-crisis-ces-2021/?utm_source=Reddit&utm_medium=Web&utm_campaign=PD,1170,1610114764.0,MicroSofty88,0.75,/r/gadgets/comments/kt32mv/exaeris_acquatap_can_create_35_to_5_gallons_of/,gadgets,21140247,2
Florida airline worker arrested after AirTag reveals he stole thousands of dollars worth of luggage,17825,wpq0ua,https://9to5mac.com/2022/08/15/airtag-checked-bags-thief/,755,1660643100.0,chrisdh79,0.97,/r/gadgets/comments/wpq0ua/florida_airline_worker_arrested_after_airtag/,gadgets,21140247,2
New Spring-Loaded Screw Turns Drywall Into Sound-Absorbing Panels,17805,ojtksu,https://gizmodo.com/new-spring-loaded-screw-turns-drywall-into-sound-absorb-1847280616,837,1626225186.0,chrisdh79,0.95,/r/gadgets/comments/ojtksu/new_springloaded_screw_turns_drywall_into/,gadgets,21140247,2
PS5 Shortage Has Reportedly Led Sony to Make More PS4s Than Initially Planned,17606,s2336z,https://www.ign.com/articles/ps5-shortage-has-reportedly-led-sony-to-make-more-ps4s-than-initially-planned,2025,1641982937.0,Darren-B80,0.94,/r/gadgets/comments/s2336z/ps5_shortage_has_reportedly_led_sony_to_make_more/,gadgets,21140247,2
Samsung announces breakthrough display technology to kill the notch and make screens truly bezel-free,17575,9qf9vr,"https://www.tomsguide.com/us/galaxy-s10-sensor-integrated-technology,news-28353.html",1790,1540224784.0,thegeezuss,0.92,/r/gadgets/comments/9qf9vr/samsung_announces_breakthrough_display_technology/,gadgets,21140247,2
"Cheaper hearing aids hit stores today, available over the counter for first time | They often cost thousands and by prescription only. Now they're as low as $199 at Walmart.",17522,y749nh,https://arstechnica.com/science/2022/10/cheaper-hearing-aids-hit-stores-today-available-over-the-counter-for-first-time/,847,1666091945.0,chrisdh79,0.96,/r/gadgets/comments/y749nh/cheaper_hearing_aids_hit_stores_today_available/,gadgets,21140247,2
"Rare Nintendo Play Station console sells for $360,000 at auction",17484,ffekul,https://www.theverge.com/2020/3/8/21170206/rare-nintendo-play-station-console-auction-sony,611,1583683658.0,Philo1927,0.94,/r/gadgets/comments/ffekul/rare_nintendo_play_station_console_sells_for/,gadgets,21140247,2
Coronavirus puts global smartphone shipments in biggest decline ever,17483,fm2v3k,https://9to5mac.com/2020/03/20/biggest-smartphone-decline-ever/amp/?__twitter_impression=true,882,1584738718.0,UnKindClock,0.94,/r/gadgets/comments/fm2v3k/coronavirus_puts_global_smartphone_shipments_in/,gadgets,21140247,2
Microsoft wins $480M military contract to outfit soldiers with HoloLens,17399,a1ggua,https://techcrunch.com/2018/11/28/microsoft-wins-480m-military-contract-to-outfit-soldiers-with-hololens-ar-tech/,1245,1543490089.0,thegeezuss,0.94,/r/gadgets/comments/a1ggua/microsoft_wins_480m_military_contract_to_outfit/,gadgets,21140247,2
"No, you can’t get a 16TB SSD for a hundred bucks | Even if the listing says “shipped by Amazon,” you’re still getting scammed.",17382,10e9mef,https://www.theverge.com/2023/1/16/23557569/amazon-scam-review-merging-16tb-external-ssds,1071,1673953538.0,chrisdh79,0.95,/r/gadgets/comments/10e9mef/no_you_cant_get_a_16tb_ssd_for_a_hundred_bucks/,gadgets,21140247,2
The USB-C iPhone becomes a reality thanks to a robotics engineer,17333,q6pfor,https://www.engadget.com/the-usb-c-i-phone-becomes-a-reality-thanks-to-a-robotics-engineer-113556672.html,1273,1634054532.0,thebelsnickle1991,0.94,/r/gadgets/comments/q6pfor/the_usbc_iphone_becomes_a_reality_thanks_to_a/,gadgets,21140247,2
Apple hikes battery replacements — including up to 40% increase for iPhones,17218,11h2hfd,https://www.cultofmac.com/807873/apple-charges-more-iphone-ipad-macbook-battery-replacement/,1941,1677854633.0,thebelsnickle1991,0.94,/r/gadgets/comments/11h2hfd/apple_hikes_battery_replacements_including_up_to/,gadgets,21140247,2
An engineer modded an iPhone to have both a USB-C port and a Lightning port,17168,115lt75,https://www.digitaltrends.com/mobile/apple-iphone-usb-c-lightning-dual-port-mod/?utm_source=reddit&utm_medium=pe&utm_campaign=pd,849,1676745008.0,MicroSofty88,0.9,/r/gadgets/comments/115lt75/an_engineer_modded_an_iphone_to_have_both_a_usbc/,gadgets,21140247,2
The Light Phone 2 adds messaging and more to the ultra-minimalist cellphone,17092,819d95,https://www.theverge.com/circuitbreaker/2018/3/1/17066494/light-phone-2-ultra-minimalist-cellphone-indiegogo-crowdfunding,1871,1519943141.0,GriffonsChainsaw,0.85,/r/gadgets/comments/819d95/the_light_phone_2_adds_messaging_and_more_to_the/,gadgets,21140247,2
Chicago has implemented a trash-eating river robot,16980,bmyi06,https://www.digitaltrends.com/cool-tech/harness-crowds-to-solve-world-challenges/?utm_source=r,514,1557496029.0,ChickenTeriyakiBoy1,0.95,/r/gadgets/comments/bmyi06/chicago_has_implemented_a_trasheating_river_robot/,gadgets,21140247,2
Man Uses Brain-Controlled Robot Arms to Eat a Twinkie,16803,kpujjt,https://www.digitaltrends.com/news/brain-controlled-robot-arms-twinkie/?utm_source=Reddit&utm_medium=Web&utm_campaign=PD,619,1609712612.0,MicroSofty88,0.95,/r/gadgets/comments/kpujjt/man_uses_braincontrolled_robot_arms_to_eat_a/,gadgets,21140247,2
"A jet suit makes a record-breaking ascent to 3,100 feet in just three minutes | This could be the difference between life and death for many critical cases.",16685,usfwqk,https://interestingengineering.com/video/jet-suit-record-ascent,982,1652888798.0,chrisdh79,0.94,/r/gadgets/comments/usfwqk/a_jet_suit_makes_a_recordbreaking_ascent_to_3100/,gadgets,21140247,2
"Microsoft has laid off entire teams behind Virtual, Mixed Reality, and HoloLens",16649,10j84y7,https://www.windowscentral.com/microsoft/microsoft-has-laid-off-entire-teams-behind-virtual-mixed-reality-and-hololens,1168,1674464612.0,diacewrb,0.96,/r/gadgets/comments/10j84y7/microsoft_has_laid_off_entire_teams_behind/,gadgets,21140247,2
Sony’s new PS5 model weighs less because it has a smaller heatsink,16646,pdtwkd,https://www.theverge.com/2021/8/29/22646963/sony-new-ps5-model-lighter-smaller-heatsink-teardown,1833,1630238065.0,Snoop8ball,0.94,/r/gadgets/comments/pdtwkd/sonys_new_ps5_model_weighs_less_because_it_has_a/,gadgets,21140247,2
"New York’s governor signs watered-down right-to-repair bill - Last-minute concessions weakened the rules, which will only apply to new consumer products sold after July 1st.",16575,zz2psw,https://www.engadget.com/new-york-right-to-repair-law-kathy-hochul-184654713.html,809,1672412843.0,speckz,0.95,/r/gadgets/comments/zz2psw/new_yorks_governor_signs_watereddown/,gadgets,21140247,2
"McDonald's Created a Grease-Proof Gaming Chair - The chair comes equipped with a french fry holster, dedicated dip holders, a burger “heat zone,” and grease proof leather.",16557,yprnkg,https://gizmodo.com/mcdonalds-gaming-fast-food-mccrispy-chicken-1849757237,992,1667925847.0,speckz,0.79,/r/gadgets/comments/yprnkg/mcdonalds_created_a_greaseproof_gaming_chair_the/,gadgets,21140247,2
"Mars helicopter Ingenuity hits 23rd flight, can't be stopped",16539,tpm347,https://www.digitaltrends.com/news/ingenuity-helicopter-flight-23/?utm_source=reddit&utm_medium=pe&utm_campaign=pd,545,1648394433.0,MicroSofty88,0.94,/r/gadgets/comments/tpm347/mars_helicopter_ingenuity_hits_23rd_flight_cant/,gadgets,21140247,2
"Human augmentation with robotic body parts is at hand, say scientists",16530,11i0x15,https://www.theguardian.com/science/2023/mar/02/human-augmentation-with-robotic-body-parts-is-at-hand-say-scientists,1283,1677941324.0,diacewrb,0.93,/r/gadgets/comments/11i0x15/human_augmentation_with_robotic_body_parts_is_at/,gadgets,21140247,2
Apple headphones snatched off from at least 21 wearers' heads in New York,16488,11d64cf,https://www.thenationalnews.com/world/us-news/2023/02/26/apple-headphones-snatched-off-wearers-heads-in-new-york/?outputType=amp,2577,1677484219.0,thebelsnickle1991,0.88,/r/gadgets/comments/11d64cf/apple_headphones_snatched_off_from_at_least_21/,gadgets,21140247,2
iPhone overtakes Android to claim majority of US smartphone market,16474,x5nam9,https://www.engadget.com/iphone-overtakes-android-us-market-share-223251196.html,5024,1662298949.0,thebelsnickle1991,0.82,/r/gadgets/comments/x5nam9/iphone_overtakes_android_to_claim_majority_of_us/,gadgets,21140247,2
"Alexa is now multilingual, capable of simultaneously listening to English and Spanish, Indian English and Hindi, and Canadia English and French",16457,dha2n0,https://www.theverge.com/2019/10/11/20910086/amazon-alexa-spanish-multilingual-mode,912,1570970418.0,nopantsdolphin,0.89,/r/gadgets/comments/dha2n0/alexa_is_now_multilingual_capable_of/,gadgets,21140247,2
Elon Musk Says Neuralink Is Like a Fitbit in Your Skull,16454,iiussn,https://www.digitaltrends.com/news/neuralink-progress-update-2020/?itm_medium=topic&itm_source=5&itm_content=1x4&itm_term=2356592,3130,1598716687.0,MicroSofty88,0.82,/r/gadgets/comments/iiussn/elon_musk_says_neuralink_is_like_a_fitbit_in_your/,gadgets,21140247,2
Lifetime Nintendo Switch sales surpass PlayStation 4 in the U.S.,16363,uos7fj,https://venturebeat.com/2022/05/13/lifetime-nintendo-switch-sales-surpass-playstation-4-in-the-u-s/,972,1652449821.0,PressTurn,0.94,/r/gadgets/comments/uos7fj/lifetime_nintendo_switch_sales_surpass/,gadgets,21140247,2
PlayStation 5 shortages expected to continue throughout 2022 and maybe beyond,16338,sk3apr,https://www.gamegrin.com/news/playstation-5-shortages-expected-to-continue-throughout-2022-and-maybe-beyond/,2564,1643946281.0,thebelsnickle1991,0.93,/r/gadgets/comments/sk3apr/playstation_5_shortages_expected_to_continue/,gadgets,21140247,2
Shower Power Speaker is completely powered by the flow of water,16330,jpw78o,https://www.digitaltrends.com/news/shower-power-speaker-powered-by-your-shower/?utm_source=Reddit&utm_medium=Web&utm_campaign=PD,492,1604776247.0,MicroSofty88,0.88,/r/gadgets/comments/jpw78o/shower_power_speaker_is_completely_powered_by_the/,gadgets,21140247,2
Akira-Like Electric Superbike Concept Provides Glimpse Into the Future,16269,irfa3s,https://interestingengineering.com/akira-like-electric-superbike-concept-provides-glimpse-into-the-future,672,1599926804.0,MicroSofty88,0.86,/r/gadgets/comments/irfa3s/akiralike_electric_superbike_concept_provides/,gadgets,21140247,2
Apple working on how to securely present electronic ID wirelessly,16193,j7dq3w,https://appleinsider.com/articles/20/10/08/apple-working-on-how-to-securely-present-electronic-id-wirelessly,784,1602166253.0,chrisdh79,0.93,/r/gadgets/comments/j7dq3w/apple_working_on_how_to_securely_present/,gadgets,21140247,2
Cracking news: improved smartphone glass twice as likely to survive drops | Technology,16188,9050df,https://www.theguardian.com/technology/2018/jul/19/cracking-news-smartphone-gorilla-glass-twice-survive-drops-smash-iphone-samsung,1231,1531999550.0,Abscess2,0.91,/r/gadgets/comments/9050df/cracking_news_improved_smartphone_glass_twice_as/,gadgets,21140247,2
"Engineer who made USB-C iPhone now makes AirPods Pro repair possible | Pilonnel noticed that millions watch his videos, but very few actually attempt them. He wants to help people by making replacement parts available.",16121,10wy0oj,https://interestingengineering.com/innovation/airpods-pro-repair-possible,409,1675866343.0,chrisdh79,0.96,/r/gadgets/comments/10wy0oj/engineer_who_made_usbc_iphone_now_makes_airpods/,gadgets,21140247,2
GPU demand declines as prices continue to drop,16111,v42gbd,https://www.digitaltrends.com/computing/gpu-demand-declined-in-q1-2022/?utm_source=reddit&utm_medium=pe&utm_campaign=pd,1273,1654271725.0,ChickenTeriyakiBoy1,0.96,/r/gadgets/comments/v42gbd/gpu_demand_declines_as_prices_continue_to_drop/,gadgets,21140247,2
"Tiny, Wireless, Injectable Chips Use Ultrasound to Monitor Body Processes",16087,neetb8,https://www.engineering.columbia.edu/press-releases/shepard-injectable-chips-monitor-body-processes,1969,1621254201.0,GalileoGurdjieff,0.87,/r/gadgets/comments/neetb8/tiny_wireless_injectable_chips_use_ultrasound_to/,gadgets,21140247,2
Brazil says Apple can’t keep selling iPhones that don’t come with a charger,16014,x7hbbj,https://www.theverge.com/2022/9/6/23339069/brazil-blocks-iphone-sales-without-charger-box,800,1662487366.0,thebelsnickle1991,0.96,/r/gadgets/comments/x7hbbj/brazil_says_apple_cant_keep_selling_iphones_that/,gadgets,21140247,2
"Sony vows to ramp up PS5 production to levels 'never achieved before' | Sony will also increase its investments in live services, PC and mobile.",15965,uy7i1n,https://www.engadget.com/sony-ramp-up-ps5-production-113543289.html,1767,1653571266.0,chrisdh79,0.92,/r/gadgets/comments/uy7i1n/sony_vows_to_ramp_up_ps5_production_to_levels/,gadgets,21140247,2
A Roomba recorded a woman on the toilet. How did screenshots end up on Facebook?,15949,zq3yfx,https://www.technologyreview.com/2022/12/19/1065306/roomba-irobot-robot-vacuums-artificial-intelligence-training-data-privacy/,1107,1671484926.0,speckz,0.89,/r/gadgets/comments/zq3yfx/a_roomba_recorded_a_woman_on_the_toilet_how_did/,gadgets,21140247,2
Elton John wants you to use noise-cancelling headphones at his concerts so you are isolated from the crowd and can remix the live audio using an app. But isn't the communal experience the whole damn point of concerts?,15941,ayeqcc,"https://www.tomsguide.com/us/peex-rx-concert-headphones-elton-john,news-29589.html",1113,1551977488.0,nopantsdolphin,0.85,/r/gadgets/comments/ayeqcc/elton_john_wants_you_to_use_noisecancelling/,gadgets,21140247,2
Galaxy Fold fiasco is worst possible start for foldable phones,15934,bemqbf,"https://www.tomsguide.com/us/galaxy-fold-problems-bad-for-foldable-phones,news-29895.html",2052,1555600492.0,krichbutler,0.89,/r/gadgets/comments/bemqbf/galaxy_fold_fiasco_is_worst_possible_start_for/,gadgets,21140247,2
"Nintendo Switch Lite: a smaller, cheaper Switch built for handheld play",15924,cbg0os,https://www.theverge.com/circuitbreaker/2019/7/10/20687801/nintendo-switch-lite-price-release-date-size-battery-life-motion-control-games,2024,1562761185.0,anonboxis,0.92,/r/gadgets/comments/cbg0os/nintendo_switch_lite_a_smaller_cheaper_switch/,gadgets,21140247,2
"Apple mixed reality headset to have two 8K displays, cost $3000 – The Information",15914,lcgttn,https://9to5mac.com/2021/02/04/apple-mixed-reality-headset/,1394,1612449059.0,userndj,0.91,/r/gadgets/comments/lcgttn/apple_mixed_reality_headset_to_have_two_8k/,gadgets,21140247,2
Mandatory USB-C phone port edges closer after EU deal | A major blow to Apple’s Lightning port,15869,v6rpby,https://www.theverge.com/2022/6/7/23156361/european-union-usb-c-wired-charging-iphone-lightning-ewaste,1513,1654596716.0,chrisdh79,0.94,/r/gadgets/comments/v6rpby/mandatory_usbc_phone_port_edges_closer_after_eu/,gadgets,21140247,2
"The Army is eyeing a personal hoverboard that can reach 10,000 feet",15853,6en916,http://www.businessinsider.com/the-army-is-eyeing-personal-hoverboard-that-can-reach-10000-feet-2017-5,1589,1496328903.0,ZoneRangerMC,0.88,/r/gadgets/comments/6en916/the_army_is_eyeing_a_personal_hoverboard_that_can/,gadgets,21140247,2
Ultra-high-density hard drives made with graphene store ten times more data,15839,nssk2s,https://www.cam.ac.uk/research/news/ultra-high-density-hard-drives-made-with-graphene-store-ten-times-more-data,770,1622887805.0,GalileoGurdjieff,0.96,/r/gadgets/comments/nssk2s/ultrahighdensity_hard_drives_made_with_graphene/,gadgets,21140247,2
These blinds can generate solar power,15775,6ev02k,https://techcrunch.com/2017/05/31/solargaps-power-blinds/?ncid=rss,640,1496416629.0,ZoneRangerMC,0.87,/r/gadgets/comments/6ev02k/these_blinds_can_generate_solar_power/,gadgets,21140247,2
Galaxy S20 Ultra camera is randomly breaking and Samsung calls it 'cosmetic damage',15752,ga7ljp,https://www.digitaltrends.com/mobile/samsung-galaxy-s20-ultra-camera-glass-breaking-issue/,1578,1588159074.0,mspoonygp,0.95,/r/gadgets/comments/ga7ljp/galaxy_s20_ultra_camera_is_randomly_breaking_and/,gadgets,21140247,2
iPhone 15 to require certified accessories for full access to USB-C,15746,11e3m7p,https://appleinsider.com/articles/23/02/28/iphone-15-to-require-certified-accessories-for-full-access-to-usb-c,2463,1677583225.0,chrisdh79,0.93,/r/gadgets/comments/11e3m7p/iphone_15_to_require_certified_accessories_for/,gadgets,21140247,2
"Samsung Galaxy S8 won't get Android 10 update despite being a 2017 flagship, allegedly leaked roadmap shows",15652,d6e76x,https://www.tomsguide.com/news/samsung-galaxy-phones-android-10-list,2312,1568900405.0,nopantsdolphin,0.95,/r/gadgets/comments/d6e76x/samsung_galaxy_s8_wont_get_android_10_update/,gadgets,21140247,2
Larger-than-30TB hard drives are coming much sooner than expected,15634,uyxoqp,https://www.msn.com/en-us/news/technology/larger-than-30tb-hard-drives-are-coming-much-sooner-than-expected/ar-AAXM1Pj?rc=1&ocid=winp1taskbar&cvid=ba268f149d4646dcec37e2ab31fe6915,1149,1653656373.0,chrisdh79,0.96,/r/gadgets/comments/uyxoqp/largerthan30tb_hard_drives_are_coming_much_sooner/,gadgets,21140247,2
