title,score,id,url,num_comments,created,author,upvote_ratio,permalink,subreddit,subreddit_subscribers,depth
Crew Dragon has cleared the tower.,35601,gtkm8y,https://i.imgur.com/XU74ft4.jpg,574,1590868552.0,jardeon,0.93,/r/spacex/comments/gtkm8y/crew_dragon_has_cleared_the_tower/,spacex,1828412,2
Falcon 9 launches the secretive Zuma payload and lands its first stage back at Cape Canaveral in this three-photo long exposure composite photograph — @johnkrausphotos,33155,7ouxot,https://i.redd.it/8jkukgakvq801.jpg,773,1515374066.0,johnkphotos,0.93,/r/spacex/comments/7ouxot/falcon_9_launches_the_secretive_zuma_payload_and/,spacex,1828412,2
"I made a lucky guess for when it would happen and captured F9 going through the supersonic regime, leaving these beautiful iridescent vapor rings in its path.",25537,910273,https://i.redd.it/hzuhm8zvnjb11.jpg,244,1532285814.0,TMahlman,0.94,/r/spacex/comments/910273/i_made_a_lucky_guess_for_when_it_would_happen_and/,spacex,1828412,2
"We are the SpaceX software team, ask us anything!",23789,gxb7j1,https://www.reddit.com/r/spacex/comments/gxb7j1/we_are_the_spacex_software_team_ask_us_anything/,7248,1591385198.0,spacexfsw,0.88,/r/spacex/comments/gxb7j1/we_are_the_spacex_software_team_ask_us_anything/,spacex,1828412,2
SpaceX Interplanetary Transport System,19588,54rrnb,https://www.youtube.com/watch?v=0qo78R_yYFA,2781,1474997951.0,retiringonmars,0.92,/r/spacex/comments/54rrnb/spacex_interplanetary_transport_system/,spacex,1828412,2
"Elon Musk on Twitter: ...a fully expendable Falcon Heavy, which far exceeds the performance of a Delta IV Heavy, is $150M, compared to over $400M for Delta IV Heavy.",19229,7x1rrk,https://twitter.com/elonmusk/status/963076231921938432,1289,1518451873.0,Zucal,0.89,/r/spacex/comments/7x1rrk/elon_musk_on_twitter_a_fully_expendable_falcon/,spacex,1828412,2
The first stage has landed successfully on OCISLY!,17929,4dycyv,https://twitter.com/spacex/status/718542066041532416,1222,1460148824.0,Zucal,0.9,/r/spacex/comments/4dycyv/the_first_stage_has_landed_successfully_on_ocisly/,spacex,1828412,2
14-shot composite image of SN8 12.5km test flight I made from 5 miles away,17465,kb5wzt,https://i.redd.it/tpben8lh3l461.jpg,402,1607703863.0,TMahlman,0.97,/r/spacex/comments/kb5wzt/14shot_composite_image_of_sn8_125km_test_flight_i/,spacex,1828412,2
"[Elon Musk] Fuel header tank pressure was low during landing burn, causing touchdown velocity to be high & RUD, but we got all the data we needed! Congrats SpaceX team hell yeah!!",17012,ka34n6,https://twitter.com/elonmusk/status/1336809767574982658?s=19,1680,1607555715.0,ModeHopper,0.88,/r/spacex/comments/ka34n6/elon_musk_fuel_header_tank_pressure_was_low/,spacex,1828412,2
"Dragons are usually the ones breathing fire, but here...Falcon 9 stole the show.",15614,89qhg0,https://i.redd.it/dtsxav7itwp01.gif,253,1522855931.0,TMahlman,0.94,/r/spacex/comments/89qhg0/dragons_are_usually_the_ones_breathing_fire_but/,spacex,1828412,2
FCC authorizes SpaceX to provide broadband services via satellite constellation,14920,885aij,https://apps.fcc.gov/edocs_public/attachmatch/DOC-349998A1.pdf,793,1522360391.0,thesheetztweetz,0.95,/r/spacex/comments/885aij/fcc_authorizes_spacex_to_provide_broadband/,spacex,1828412,2
"SpaceX on Twitter: ""The Falcon 9 first stage landing is confirmed.""",14046,3xs21y,https://twitter.com/SpaceX/status/679114269485436928,1377,1450748605.0,retiringonmars,0.92,/r/spacex/comments/3xs21y/spacex_on_twitter_the_falcon_9_first_stage/,spacex,1828412,2
"Elon Musk on Twitter: ""Today’s Falcon launch carries 2 SpaceX test satellites for global broadband. If successful, Starlink constellation will serve least served.""",13944,7z5esc,https://twitter.com/elonmusk/status/966298034978959361,867,1519218614.0,ethan829,0.91,/r/spacex/comments/7z5esc/elon_musk_on_twitter_todays_falcon_launch_carries/,spacex,1828412,2
"ABORT! Through a tiny hole in the clouds, I managed to catch the abort and subsequent explosion! RIP B1046.",13819,eqy4jz,https://i.redd.it/4f8q5y5oerb41.jpg,431,1579450142.0,Space_Coast_Steve,0.95,/r/spacex/comments/eqy4jz/abort_through_a_tiny_hole_in_the_clouds_i_managed/,spacex,1828412,2
The moon rises between Starship SN9 and Starship SN10 yesterday evening.,13701,l8ocav,https://i.redd.it/ftvtv9piqhe61.jpg,290,1612021684.0,johnkphotos,0.97,/r/spacex/comments/l8ocav/the_moon_rises_between_starship_sn9_and_starship/,spacex,1828412,2
Stacked progression image of today’s successful launch and explosive landing of Starship SN9!,13329,lba40u,https://i.redd.it/ctfpencei5f61.jpg,608,1612309496.0,johnkphotos,0.97,/r/spacex/comments/lba40u/stacked_progression_image_of_todays_successful/,spacex,1828412,2
Starlink fairing deploy sequence,12617,gzwnaz,https://v.redd.it/13jwyqxtcy351,368,1591738040.0,ReKt1971,0.97,/r/spacex/comments/gzwnaz/starlink_fairing_deploy_sequence/,spacex,1828412,2
Falcon Heavy is going vertical for the first time at pad 39A at the Kennedy Space Center.,12012,7mmxv4,https://twitter.com/SpaceflightNow/status/946389869378588672,1256,1514472005.0,ketivab,0.93,/r/spacex/comments/7mmxv4/falcon_heavy_is_going_vertical_for_the_first_time/,spacex,1828412,2
Falcon Heavy Future,11958,7vqje4,https://www.reddit.com/r/spacex/comments/7vqje4/falcon_heavy_future/,547,1517950676.0,CProphet,0.89,/r/spacex/comments/7vqje4/falcon_heavy_future/,spacex,1828412,2
"Elon Musk on Twitter: ""Falcon 9 flight 50 launches tonight, carrying Hispasat for Spain. At 6 metric tons and almost the size of a city bus, it will be the largest geostationary satellite we’ve ever flown.""",11430,828qwz,https://twitter.com/elonmusk/status/970747812311740416,370,1520279494.0,ethan829,0.93,/r/spacex/comments/828qwz/elon_musk_on_twitter_falcon_9_flight_50_launches/,spacex,1828412,2
With more than 5 million pounds of thrust at liftoff—equal to approximately eighteen 747 aircraft at full power—Falcon Heavy will be the most powerful operational rocket in the world by a factor of two.,10730,7nreao,https://www.instagram.com/p/BdeEU2glMJT/?taken-by=spacex,653,1514945074.0,TMahlman,0.93,/r/spacex/comments/7nreao/with_more_than_5_million_pounds_of_thrust_at/,spacex,1828412,2
Falcon sunrise this morning.,10367,j63qby,https://i.redd.it/q5a85ybxrgr51.jpg,208,1601985522.0,johnkphotos,0.97,/r/spacex/comments/j63qby/falcon_sunrise_this_morning/,spacex,1828412,2
"SpaceX on Twitter: ""The Falcon 9 first stage has landed on the droneship""",10182,4i3t13,https://twitter.com/SpaceX/status/728456793735585793,999,1462512641.0,Zucal,0.93,/r/spacex/comments/4i3t13/spacex_on_twitter_the_falcon_9_first_stage_has/,spacex,1828412,2
Falcon 9 streaks to orbit with 60 more Starlink satellites.,10128,el519l,https://i.redd.it/zu9bzxj6t9941.jpg,200,1578365402.0,johnkphotos,0.97,/r/spacex/comments/el519l/falcon_9_streaks_to_orbit_with_60_more_starlink/,spacex,1828412,2
Falcon Heavy soars above Kennedy Space Center this afternoon as it begins its first flight with a commercial payload onboard. (Marcus Cote/ Space Coast Times),9648,bc6d9y,https://i.redd.it/i270dx80tpr21.jpg,381,1555023262.0,marcuscotephoto,0.96,/r/spacex/comments/bc6d9y/falcon_heavy_soars_above_kennedy_space_center/,spacex,1828412,2
"Falcon Heavy taking flight, remote camera photo from inside LC-39A.",9500,7vwyjp,https://i.imgur.com/l5U6apv.jpg,115,1518018369.0,jardeon,0.96,/r/spacex/comments/7vwyjp/falcon_heavy_taking_flight_remote_camera_photo/,spacex,1828412,2
Spectacular streak and illuminated exhaust plume of Falcon 9 as seen from the VAB roof.,9136,8us5uy,https://i.imgur.com/XZy3PSB.jpg,176,1530269054.0,marcuscotephoto,0.95,/r/spacex/comments/8us5uy/spectacular_streak_and_illuminated_exhaust_plume/,spacex,1828412,2
"Elon Musk on Twitter: “We’re going to try to catch the Super Heavy Booster with the launch tower arm, using the grid fins to take the load”",8845,kn61d1,https://twitter.com/elonmusk/status/1344327757916868608?s=21,1433,1609347862.0,AnimatorOnFire,0.9,/r/spacex/comments/kn61d1/elon_musk_on_twitter_were_going_to_try_to_catch/,spacex,1828412,2
Falcon 9 B1051 returns to Port Canaveral after its record-breaking tenth flight,8487,naxv7e,https://i.redd.it/lheh45odwqy61.jpg,316,1620849555.0,johnkphotos,0.97,/r/spacex/comments/naxv7e/falcon_9_b1051_returns_to_port_canaveral_after/,spacex,1828412,2
"Elon: This rocket was meant to test very high retrothrust landing in water so it didn’t hurt the droneship, but amazingly it has survived. We will try to tow it back to shore.",8344,7ueeiu,https://twitter.com/elonmusk/status/958847818583584768,1240,1517442147.0,Craig_VG,0.92,/r/spacex/comments/7ueeiu/elon_this_rocket_was_meant_to_test_very_high/,spacex,1828412,2
Falcon 9’s Merlin 1D engines propel it and TESS from SLC-40 — johnkrausphotos.com,8330,8del9r,https://i.redd.it/iaidk08m9vs01.jpg,186,1524144172.0,johnkphotos,0.94,/r/spacex/comments/8del9r/falcon_9s_merlin_1d_engines_propel_it_and_tess/,spacex,1828412,2
Beautiful middle-of-the-night launch of Falcon 9 and SES-12 — @johnkrausphotos,8317,8oeq2w,https://i.redd.it/9d4hsdor1x111.jpg,99,1528088391.0,johnkphotos,0.95,/r/spacex/comments/8oeq2w/beautiful_middleofthenight_launch_of_falcon_9_and/,spacex,1828412,2
"Falcon Heavy flame detail from 1300ft away. It's a 42.4MP 81.6MB uncompressed RAW image, let's count bolts | Ryan Chylinski for SpaceFlight Insider",8254,7vypqa,https://i.redd.it/q744askfdue01.jpg,372,1518032043.0,learntimelapse,0.97,/r/spacex/comments/7vypqa/falcon_heavy_flame_detail_from_1300ft_away_its_a/,spacex,1828412,2
"SpaceX on Twitter: ""Falcon 9 first stage has landed""",8064,4ld0cq,https://twitter.com/SpaceX/status/736313075385540608,554,1464385707.0,Zucal,0.92,/r/spacex/comments/4ld0cq/spacex_on_twitter_falcon_9_first_stage_has_landed/,spacex,1828412,2
SpaceX on Twitter: Falcon 9 first stage has landed on Of Course I Still Love You — world’s first reflight of an orbital class rocket.,7890,62hcv0,https://twitter.com/SpaceX/status/847578231808991232,930,1490913418.0,johnkphotos,1.0,/r/spacex/comments/62hcv0/spacex_on_twitter_falcon_9_first_stage_has_landed/,spacex,1828412,2
"Guys... are you ready!? #FalconHeavy LAUNCH DATE! February 6th, with a backup on the 7th. Launch time is 13:30-16:30 EST (18:30-21:30 UTC) #ItsHappening",7861,7t6sf1,https://twitter.com/ChrisG_NSF/status/956964986353528832,477,1516993388.0,michaelza199,0.93,/r/spacex/comments/7t6sf1/guys_are_you_ready_falconheavy_launch_date/,spacex,1828412,2
"On February 28, SpaceX completed a demonstration of their ability to recover the crew and capsule after a nominal water splashdown.",7492,8483lf,https://www.flickr.com/photos/nasakennedy/40750271222/in/dateposted/,349,1520978408.0,ethan829,0.95,/r/spacex/comments/8483lf/on_february_28_spacex_completed_a_demonstration/,spacex,1828412,2
"We are the SpaceX software team, ask us anything!",7338,ncj4vz,https://www.reddit.com/r/spacex/comments/ncj4vz/we_are_the_spacex_software_team_ask_us_anything/,2583,1621026693.0,spacexfsw,0.88,/r/spacex/comments/ncj4vz/we_are_the_spacex_software_team_ask_us_anything/,spacex,1828412,2
Elon on Twitter: Starship landing nominal!,6963,n5sy4t,https://twitter.com/elonmusk/status/1390073153347592192?s=21,992,1620255135.0,ElongatedMuskrat,0.92,/r/spacex/comments/n5sy4t/elon_on_twitter_starship_landing_nominal/,spacex,1828412,2
"Elon Musk on Twitter: ""SpaceX will try to bring rocket upper stage back from orbital velocity using a giant party balloon""",6751,8cj1qo,https://twitter.com/elonmusk/status/985655249745592320,862,1523833522.0,ethan829,0.94,/r/spacex/comments/8cj1qo/elon_musk_on_twitter_spacex_will_try_to_bring/,spacex,1828412,2
"A brand new Falcon 9 roars to life on SLC-40, as clean as she'll ever be",6591,hja7td,https://i.redd.it/b48fto3rz8851.jpg,152,1593610294.0,adambernnyc,0.98,/r/spacex/comments/hja7td/a_brand_new_falcon_9_roars_to_life_on_slc40_as/,spacex,1828412,2
I put a camera ~850ft from SpaceX's last brand-new Block IV Falcon 9 and it captured this awesome lunch picture.,6557,8eeul4,https://i.redd.it/pfp8e7ewwpt01.jpg,190,1524516753.0,TMahlman,0.95,/r/spacex/comments/8eeul4/i_put_a_camera_850ft_from_spacexs_last_brandnew/,spacex,1828412,2
"Elon Musk on Twitter - Very proud of the SpaceX team! Can’t believe it’s been fifty Falcon 9 launches already. Just ten years ago, we couldn’t even reach orbit with little Falcon 1.",6550,82j6bv,https://twitter.com/elonmusk/status/970914681069039617,253,1520374912.0,RootDeliver,0.95,/r/spacex/comments/82j6bv/elon_musk_on_twitter_very_proud_of_the_spacex/,spacex,1828412,2
"Elon Musk on Twitter - ""First 60 @SpaceX Starlink satellites loaded into Falcon fairing. Tight fit.""",6539,bnjrnf,https://twitter.com/elonmusk/status/1127388838362378241,1191,1557625438.0,jclishman,0.96,/r/spacex/comments/bnjrnf/elon_musk_on_twitter_first_60_spacex_starlink/,spacex,1828412,2
Falcon 9 first stage lands at Landing Zone 1 to complete this booster’s fourth flight (Credit: SpaceX),6511,ik1fh4,https://v.redd.it/gwriuk059dk51,251,1598891984.0,ReKt1971,0.99,/r/spacex/comments/ik1fh4/falcon_9_first_stage_lands_at_landing_zone_1_to/,spacex,1828412,2
Starlink through the fog in the first of a new generation of satellites,6498,qt0wkx,https://i.redd.it/uqrpie2h3dz71.jpg,138,1636808823.0,stevenmadow,0.95,/r/spacex/comments/qt0wkx/starlink_through_the_fog_in_the_first_of_a_new/,spacex,1828412,2
Crew Dragon beaming up to orbit! [OC],6492,juxe3l,https://i.redd.it/y0rj8en63iz51.jpg,127,1605488287.0,mdcainjr,0.97,/r/spacex/comments/juxe3l/crew_dragon_beaming_up_to_orbit_oc/,spacex,1828412,2
Starship | SN10 | High-Altitude Flight Test,6454,lx8kgf,https://www.youtube.com/watch?v=ODY6JWzS8WU&t,621,1614818249.0,CProphet,0.97,/r/spacex/comments/lx8kgf/starship_sn10_highaltitude_flight_test/,spacex,1828412,2
9 Merlin 1D+ engines doing what they do best,6361,hj00ch,https://i.redd.it/g12t39th65851.jpg,199,1593564094.0,mdcainjr,0.97,/r/spacex/comments/hj00ch/9_merlin_1d_engines_doing_what_they_do_best/,spacex,1828412,2
"Starlink v1.0 Launches 1, 2, & 3",6148,hd9h3j,https://gfycat.com/somepalatableiberiannase,399,1592755904.0,TheVehicleDestroyer,0.97,/r/spacex/comments/hd9h3j/starlink_v10_launches_1_2_3/,spacex,1828412,2
"Elon Musk, says he is ""highly confident"" that SpaceX will land humans on Mars ""about 6 years from now."" ""If we get lucky, maybe 4 years ... we want to send an uncrewed vehicle there in 2 years.""",6138,k4tk3l,https://twitter.com/thesheetztweetz/status/1333871203782680577?s=21,979,1606855121.0,ragner11,0.91,/r/spacex/comments/k4tk3l/elon_musk_says_he_is_highly_confident_that_spacex/,spacex,1828412,2
[Elon Musk] They are aiming too low. Only rockets that are fully & rapidly reusable will be competitive. Everything else will seem like a cloth biplane in the age of jets.,6112,mbd1zl,https://twitter.com/elonmusk/status/1374163576747884544?s=21,1166,1616500577.0,tonybinky20,0.92,/r/spacex/comments/mbd1zl/elon_musk_they_are_aiming_too_low_only_rockets/,spacex,1828412,2
Falcon 9 breaks the sound barrier on its way to space with the sixth batch of 60 Starlink satellites.,6081,fkoug0,https://i.redd.it/9pkpmakqefn41.jpg,128,1584535058.0,johnkphotos,0.97,/r/spacex/comments/fkoug0/falcon_9_breaks_the_sound_barrier_on_its_way_to/,spacex,1828412,2
SpaceX wins a $130 million contract from the Air Force to launch AFSPC-52 on Falcon Heavy,6064,8svs3k,https://www.defense.gov/News/Contracts/Contract-View/Article/1557205/,453,1529616929.0,rory096,0.95,/r/spacex/comments/8svs3k/spacex_wins_a_130_million_contract_from_the_air/,spacex,1828412,2
Aiming for first flight of Falcon Heavy on Feb 6 from Apollo launchpad 39A at Cape Kennedy. Easy viewing from the public causeway.,6003,7tfni2,https://twitter.com/elonmusk/status/957361443023695872,346,1517087765.0,Craig_VG,0.93,/r/spacex/comments/7tfni2/aiming_for_first_flight_of_falcon_heavy_on_feb_6/,spacex,1828412,2
"SpaceX on Twitter - ""SpaceX has signed the world’s first private passenger to fly around the Moon aboard our BFR launch vehicle—an important step toward enabling access for everyday people who dream of traveling to space. Find out who’s flying and why on Monday, September 17.""",5914,9fnfdz,https://twitter.com/SpaceX/status/1040397262248005632,1377,1536885038.0,jclishman,0.94,/r/spacex/comments/9fnfdz/spacex_on_twitter_spacex_has_signed_the_worlds/,spacex,1828412,2
"NSF bocachicagal: ""The two sections have been put together. Still working on the final fit.""",5842,adybyu,https://i.redd.it/61trjei0a9921.jpg,756,1546978011.0,ketivab,0.96,/r/spacex/comments/adybyu/nsf_bocachicagal_the_two_sections_have_been_put/,spacex,1828412,2
Liftoff of today’s Starlink mission!,5725,ic2pmw,https://i.redd.it/qzfw7vwq0sh51.jpg,102,1597763185.0,johnkphotos,0.98,/r/spacex/comments/ic2pmw/liftoff_of_todays_starlink_mission/,spacex,1828412,2
Bezos' Blue Origin loses lawsuit against NASA over SpaceX lunar lander contract,5686,qmm2d5,https://www.cnbc.com/2021/11/04/bezos-blue-origin-loses-lawsuit-against-nasa-over-spacex-lunar-lander.html,463,1636036864.0,BeginningResearch,0.97,/r/spacex/comments/qmm2d5/bezos_blue_origin_loses_lawsuit_against_nasa_over/,spacex,1828412,2
The entirety of Starship SN9's test flight visualized in a single image from 5.9 miles away on South Padre Island!,5604,lirayf,https://i.redd.it/hvkupdboo5h61.jpg,110,1613183867.0,TMahlman,0.98,/r/spacex/comments/lirayf/the_entirety_of_starship_sn9s_test_flight/,spacex,1828412,2
"Building on the legacy of those who came before, Crew-2 is heading to the Space Station!",5581,mws6xa,https://i.redd.it/y2gwkvwcgwu61.jpg,96,1619173418.0,Space_Coast_Steve,0.98,/r/spacex/comments/mws6xa/building_on_the_legacy_of_those_who_came_before/,spacex,1828412,2
Bob & Doug aboard Endeavor shortly after liftoff!,5503,gud9ik,https://i.redd.it/l6ybs7qhz7251.jpg,221,1590982904.0,mdcainjr,0.99,/r/spacex/comments/gud9ik/bob_doug_aboard_endeavor_shortly_after_liftoff/,spacex,1828412,2
Falcon 9 soars by the sun on its way to space with the third GPS III satellite,5498,hjzg60,https://i.redd.it/v4fyeftetg851.jpg,71,1593704926.0,johnkphotos,0.98,/r/spacex/comments/hjzg60/falcon_9_soars_by_the_sun_on_its_way_to_space/,spacex,1828412,2
A shot I’ve coveted for years: Milky Way panorama and Falcon 9 launch of 60 Starlink satellites this morning!,5492,n8dk9t,https://i.redd.it/9q38weklc3y61.jpg,121,1620564444.0,johnkphotos,0.98,/r/spacex/comments/n8dk9t/a_shot_ive_coveted_for_years_milky_way_panorama/,spacex,1828412,2
"Elon Musk at Air Force Space Pitch Day claims Starship will cost ""around $2 million per flight"" with about $900K being propellant.",5305,dsfnmh,https://spacenews.com/elon-musk-space-pitch-day/,954,1573043524.0,Dragon029,0.97,/r/spacex/comments/dsfnmh/elon_musk_at_air_force_space_pitch_day_claims/,spacex,1828412,2
Falcon Heavy. STP-2. 27 Merlins. I’m speechless. What an incredible spectacle.,5285,c5g2l0,https://i.redd.it/h3wnogddqk631.jpg,142,1561499559.0,johnkphotos,0.97,/r/spacex/comments/c5g2l0/falcon_heavy_stp2_27_merlins_im_speechless_what/,spacex,1828412,2
SpaceX Falcon 9 through the Moon! [OC],5262,lc9jtk,https://i.redd.it/auujne6snef61.jpg,115,1612420269.0,mdcainjr,0.98,/r/spacex/comments/lc9jtk/spacex_falcon_9_through_the_moon_oc/,spacex,1828412,2
[OC] Falcon Heavy vs Various Rockets (requested),5238,7o8ogz,https://gfycat.com/TediousUnderstatedGreatwhiteshark,356,1515125555.0,theblackshell,0.97,/r/spacex/comments/7o8ogz/oc_falcon_heavy_vs_various_rockets_requested/,spacex,1828412,2
Falcon 9 riding a pillar of fire,5206,hv8zt0,https://i.redd.it/qca5xubx58c51.jpg,74,1595344156.0,Space_Coast_Steve,0.98,/r/spacex/comments/hv8zt0/falcon_9_riding_a_pillar_of_fire/,spacex,1828412,2
NASA have released the Crew 1 poster for the next SpaceX commercial transport to the ISS,5187,hxbqdq,https://i.redd.it/b9q49z7gwvc51.jpg,217,1595630926.0,launchpins,0.98,/r/spacex/comments/hxbqdq/nasa_have_released_the_crew_1_poster_for_the_next/,spacex,1828412,2
Powerful ride into space for the Inspiration 4 crew members!,5191,ppfqk6,https://i.redd.it/rboz1tzuxvn71.jpg,163,1631806793.0,stevenmadow,0.97,/r/spacex/comments/ppfqk6/powerful_ride_into_space_for_the_inspiration_4/,spacex,1828412,2
"Falcon lands, crowds cheer, SpaceX launches their final mission of the year.",5176,kg8l47,https://i.redd.it/ljzwfbqol5661.jpg,140,1608387971.0,johnkphotos,0.98,/r/spacex/comments/kg8l47/falcon_lands_crowds_cheer_spacex_launches_their/,spacex,1828412,2
Falcon 9’s second stage heads to orbit with another 60 Starlink satellites Wednesday evening.,5181,n14an7,https://i.redd.it/cnw0zk7964w61.jpg,104,1619702722.0,johnkphotos,0.98,/r/spacex/comments/n14an7/falcon_9s_second_stage_heads_to_orbit_with/,spacex,1828412,2
Transporter-1 taking off! [OC],5167,l41b5v,https://i.redd.it/p7fz5tfisad61.jpg,110,1611501785.0,mdcainjr,0.98,/r/spacex/comments/l41b5v/transporter1_taking_off_oc/,spacex,1828412,2
SpaceX main body tool for the BFR interplanetary spaceship,5149,8avzhh,https://www.instagram.com/p/BhVk3y3A0yB/,696,1523249943.0,jclishman,0.95,/r/spacex/comments/8avzhh/spacex_main_body_tool_for_the_bfr_interplanetary/,spacex,1828412,2
"SpaceX Launch Control has a new sign, reflecting their recent successful landings.",5103,4eylpa,http://i.imgur.com/Op6kNXX.jpg,147,1460751442.0,jardeon,0.94,/r/spacex/comments/4eylpa/spacex_launch_control_has_a_new_sign_reflecting/,spacex,1828412,2
"SpaceX newest launcher after the recent outcomes on the Starship test campaign announced, render leaked!",5088,mhrvuy,https://i.redd.it/up171picajq61.png,219,1617270679.0,ElongatedMuskrat,0.93,/r/spacex/comments/mhrvuy/spacex_newest_launcher_after_the_recent_outcomes/,spacex,1828412,2
Ships passing in the night,5073,gwg8i0,https://i.redd.it/nofxwq2xwv251.jpg,77,1591272604.0,stevenmadow,0.98,/r/spacex/comments/gwg8i0/ships_passing_in_the_night/,spacex,1828412,2
"Elon on SN11 failure: ""Ascent phase, transition to horizontal & control during free fall were good. A (relatively) small CH4 leak led to fire on engine 2 & fried part of avionics, causing hard start attempting landing burn in CH4 turbopump. This is getting fixed 6 ways to Sunday.""",5043,mkhthl,https://twitter.com/elonmusk/status/1379022709737275393,785,1617619772.0,ethan829,0.95,/r/spacex/comments/mkhthl/elon_on_sn11_failure_ascent_phase_transition_to/,spacex,1828412,2
Another batch of Starlink satellites beam to orbit from Cape Canaveral atop a SpaceX Falcon 9 rocket this evening — one day before the tenth anniversary of Falcon 9’s first flight. Also: My 100th launch photographed to date!,5014,gw7u5x,https://i.redd.it/ca03kem3vs251.jpg,173,1591235675.0,johnkphotos,0.98,/r/spacex/comments/gw7u5x/another_batch_of_starlink_satellites_beam_to/,spacex,1828412,2
"Falcon goes up, Falcon comes down",4992,ijphhq,https://i.redd.it/xewkap2tx8k51.jpg,154,1598839776.0,Space_Coast_Steve,0.98,/r/spacex/comments/ijphhq/falcon_goes_up_falcon_comes_down/,spacex,1828412,2
"I've logged about 50,000 miles on a mission to photograph every major spacex starship prototype to fly thus far, made a collage of the full-scale ones I took from the same location / angle SN8 to 15🚀",4967,o5wvuc,https://i.redd.it/8r8xsdo1pv671.jpg,120,1624394819.0,TMahlman,0.98,/r/spacex/comments/o5wvuc/ive_logged_about_50000_miles_on_a_mission_to/,spacex,1828412,2
Everyday Astronaut: A conversation with Elon Musk about Starship,4969,dbtv0a,https://www.youtube.com/watch?v=cIQ36Kt7UVg,565,1569938698.0,Dragon029,0.96,/r/spacex/comments/dbtv0a/everyday_astronaut_a_conversation_with_elon_musk/,spacex,1828412,2
"SpaceX says early Starlink tests show ""super low latency"" and 100 megabits per second download speeds",4933,ilts8x,https://www.cnbc.com/2020/09/03/spacex-starlink-satellite-internet-network-early-tests-show-fast-speeds.html,848,1599141133.0,thesheetztweetz,0.95,/r/spacex/comments/ilts8x/spacex_says_early_starlink_tests_show_super_low/,spacex,1828412,2
NASA Awards SpaceX Contract to Launch Initial Elements of Lunar Outpost,4897,lgecum,https://www.nasa.gov/press-release/nasa-awards-contract-to-launch-initial-elements-for-lunar-outpost/,641,1612907196.0,675longtail,0.97,/r/spacex/comments/lgecum/nasa_awards_spacex_contract_to_launch_initial/,spacex,1828412,2
Official SpaceX release: SpaceX to Send Privately Crewed Dragon Spacecraft Beyond the Moon Next Year,4895,5wjklw,http://www.spacex.com/news/2017/02/27/spacex-send-privately-crewed-dragon-spacecraft-beyond-moon-next-year,1911,1488231142.0,johnkphotos,0.99,/r/spacex/comments/5wjklw/official_spacex_release_spacex_to_send_privately/,spacex,1828412,2
Remote camera view: Falcon 9 launches the fifth Starlink mission,4886,f5r3ne,https://i.redd.it/s7o7r16dfoh41.jpg,88,1582029147.0,johnkphotos,0.98,/r/spacex/comments/f5r3ne/remote_camera_view_falcon_9_launches_the_fifth/,spacex,1828412,2
"Elon Musk on Twitter: ""Will do a Reddit AMA on Mars in the next week or tw""",4853,55bdj4,https://twitter.com/elonmusk/status/782043081021399040,683,1475288752.0,aguyfromnewzealand,0.97,/r/spacex/comments/55bdj4/elon_musk_on_twitter_will_do_a_reddit_ama_on_mars/,spacex,1828412,2
"A closeup, long exposure look at Falcon 9’s boostback burn and second stage burn, and the resulting plume interaction between the two stages. Incredible.",4837,feqmi5,https://i.redd.it/5p3plok4q6l41.jpg,127,1583558236.0,johnkphotos,0.98,/r/spacex/comments/feqmi5/a_closeup_long_exposure_look_at_falcon_9s/,spacex,1828412,2
WOW! Here’s a view from inside LC-39A as Falcon Heavy’s 27 first stage Merlin 1D engines propelled the massive rocket and the Arabsat-6A satellite to space yesterday evening.,4825,bceib5,https://i.redd.it/hvb7quvlkur21.jpg,108,1555081025.0,johnkphotos,0.97,/r/spacex/comments/bceib5/wow_heres_a_view_from_inside_lc39a_as_falcon/,spacex,1828412,2
Reddit AMA this Weekend!,4824,75uc0h,https://twitter.com/elonmusk/status/918314470048382977,325,1507778291.0,venku122,0.92,/r/spacex/comments/75uc0h/reddit_ama_this_weekend/,spacex,1828412,2
