title,score,id,url,num_comments,created,author,upvote_ratio,permalink,subreddit,subreddit_subscribers,depth
Proud Boys memo reveals meticulous planning for 'street-level violence',135,xi873u,https://www.theguardian.com/world/2022/sep/19/proud-boys-document-jan-6-violence,58,1663583446.0,Pessimist2020,0.99,/r/uspolitics/comments/xi873u/proud_boys_memo_reveals_meticulous_planning_for/,uspolitics,28979,2
BREAKING: FBI Official Who Investigated Trump Russia Collusion Arrested for Colluding With Russia,134,10mucww,https://trendingpoliticsnews.com/breaking-fbi-official-who-investigated-trump-russia-collusion-arrested-for-colluding-with-russia/,31,1674849427.0,SimilarPlate,0.96,/r/uspolitics/comments/10mucww/breaking_fbi_official_who_investigated_trump/,uspolitics,28979,2
Elon Musk deletes tweet with unfounded theory about Pelosi attack,134,yhsfkw,https://www.reuters.com/world/us/elon-musk-deletes-tweet-with-unfounded-theory-about-pelosi-attack-2022-10-30/,40,1667169650.0,Pessimist2020,0.97,/r/uspolitics/comments/yhsfkw/elon_musk_deletes_tweet_with_unfounded_theory/,uspolitics,28979,2
‘You’re marked for assassination’: Woman charged for threatening voicemails to Trump Mar-a-Lago judge,133,xdyxi4,https://www.independent.co.uk/news/world/americas/us-politics/donald-trump-aileen-cannon-judge-threats-b2166405.html,38,1663153236.0,Pessimist2020,0.96,/r/uspolitics/comments/xdyxi4/youre_marked_for_assassination_woman_charged_for/,uspolitics,28979,2
"Twitter CFO says Trump's ban is permanent, even if he runs for office again",130,q168n5,https://abc7news.com/trump-twitter-ban-when-did-get-banned-from-is-donald-back-on-how-many-followers-does-have/10327473/,24,1633356789.0,NORDLAN,0.98,/r/uspolitics/comments/q168n5/twitter_cfo_says_trumps_ban_is_permanent_even_if/,uspolitics,28979,2
Calls for Alex Jones' Arrest Grow Louder After His $500K Donation to January 6 Rally Resurfaces,133,nyuxaz,https://www.msn.com/en-us/news/us/calls-for-alex-jones-arrest-grow-louder-after-his-500k-donation-to-january-6-rally-resurfaces/ar-AAKZ5pF?ocid=msedgdhp&pc=U531,9,1623586108.0,northstardim,0.97,/r/uspolitics/comments/nyuxaz/calls_for_alex_jones_arrest_grow_louder_after_his/,uspolitics,28979,2
Steve Bannon under investigation by New York District Attorney for border wall fraud scheme. The former Trump strategist dodged federal charges thanks to a presidential pardon,133,lbzlfh,https://www.independent.co.uk/news/world/americas/us-politics/steve-bannon-investigation-border-wall-b1797275.html,6,1612389694.0,Facerealityalready,1.0,/r/uspolitics/comments/lbzlfh/steve_bannon_under_investigation_by_new_york/,uspolitics,28979,2
The Trial of Donald Trump Must Tell the Full Story of the Capitol Insurrection,132,kyl6sy,https://www.newyorker.com/news/our-columnists/the-trial-of-donald-trump-must-tell-the-full-story-of-the-capitol-insurrection?utm_social-type=owned&utm_brand=tny&utm_source=facebook&mbid=social_facebook&utm_medium=social&fbclid=IwAR205s7oPAcIbA726mssraJ1_XkEnROgc7jty9YcxTE18RHIgbpWpYqd8RU,4,1610812040.0,bobbelcher,0.97,/r/uspolitics/comments/kyl6sy/the_trial_of_donald_trump_must_tell_the_full/,uspolitics,28979,2
"Trump's Lawyer Files To Withdraw - ""client has used the lawyers services to perpetuate a crime""",133,ku60sx,https://www.reddit.com/r/uspolitics/comments/ku60sx/trumps_lawyer_files_to_withdraw_client_has_used/,12,1610247932.0,OverByTheEdge,1.0,/r/uspolitics/comments/ku60sx/trumps_lawyer_files_to_withdraw_client_has_used/,uspolitics,28979,2
West Virginia lawmaker Derrick Evans posts — then deletes — video of himself storming Capitol,132,ksnqlx,https://v.redd.it/zajy422lny961,19,1610056272.0,DonaldWillKillUsAll,0.99,/r/uspolitics/comments/ksnqlx/west_virginia_lawmaker_derrick_evans_posts_then/,uspolitics,28979,2
Trump's 'law and order' is starting to look like martial law,136,hus7g1,https://www.cnn.com/2020/07/20/politics/what-matters-portland-protests-federal-agents/index.html,35,1595274285.0,FnordFinder,0.96,/r/uspolitics/comments/hus7g1/trumps_law_and_order_is_starting_to_look_like/,uspolitics,28979,2
We Now Know Who Society’s Essential Workers Are. And They’re Among The Lowest Paid.,135,fr8m1i,https://www.huffingtonpost.ca/entry/essential-workers-lowest-paid_n_5e7bc7f7c5b6256a7a23e6f5,11,1585499519.0,Dems4Prez,0.97,/r/uspolitics/comments/fr8m1i/we_now_know_who_societys_essential_workers_are/,uspolitics,28979,2
Third GOP Senator caught selling equity before the market crash — this time up to $25 million worth,130,flox5e,https://www.rawstory.com/2020/03/third-gop-senator-caught-dumping-stock-before-the-market-crash-this-time-up-to-25-million-worth/,14,1584679420.0,bobbelcher,0.95,/r/uspolitics/comments/flox5e/third_gop_senator_caught_selling_equity_before/,uspolitics,28979,2
Video Of Trump From 1992 Surfaces; Shows Trump Is Exactly The Guy Comey Describes.,132,6gs68q,http://newcenturytimes.com/2017/06/11/video-of-trump-from-1992-surfaces-shows-trump-is-exactly-the-guy-comey-describes/,14,1497273732.0,pheonix200,0.85,/r/uspolitics/comments/6gs68q/video_of_trump_from_1992_surfaces_shows_trump_is/,uspolitics,28979,2
Don't stop at Trump. All candidates for office should disclose their tax returns,130,zrzj5n,https://www.theguardian.com/commentisfree/2022/dec/21/politicians-candidates-tax-returns-mandatory-congress-stocks,11,1671653741.0,Pessimist2020,0.99,/r/uspolitics/comments/zrzj5n/dont_stop_at_trump_all_candidates_for_office/,uspolitics,28979,2
Trump Brought Nazis Into the GOP. DeSantis Won’t Expel Them. White nationalism is not just a Trump problem.,131,z762v0,https://nymag.com/intelligencer/2022/11/donald-trump-nick-fuentes-ye-white-nationalist-nazi-anti-semite-ron-desantis.html,32,1669664277.0,spaceghoti,0.96,/r/uspolitics/comments/z762v0/trump_brought_nazis_into_the_gop_desantis_wont/,uspolitics,28979,2
"A US Federal Appeals Panel Rules That Donald Trump's Attorney General, William Barr, Who Headed The US Justice Dept., Wrongly Withheld Russia Probe Memo",132,wsljww,https://apnews.com/article/russia-ukraine-donald-trump-william-barr-obstruction-of-justice-992952614b7619681df0e1109548a27f,8,1660934582.0,Motor-Ad-8858,0.98,/r/uspolitics/comments/wsljww/a_us_federal_appeals_panel_rules_that_donald/,uspolitics,28979,2
Another GOP voter caught casting a ballot for a dead relative,131,p6mmiy,https://www.msnbc.com/rachel-maddow-show/another-gop-voter-caught-casting-ballot-dead-relative-n1276965,22,1629273029.0,tyw7,0.96,/r/uspolitics/comments/p6mmiy/another_gop_voter_caught_casting_a_ballot_for_a/,uspolitics,28979,2
Pennsylvania Accuses Texas And Trump Of Sedition In SCOTUS Response,131,kb42ms,https://www.politicususa.com/2020/12/10/pennsylvania-accuses-texas-and-trump-of-sedition-in-scotus-election-lawsuit-response.html,13,1607697906.0,speakhyroglyphically,0.99,/r/uspolitics/comments/kb42ms/pennsylvania_accuses_texas_and_trump_of_sedition/,uspolitics,28979,2
QAnon Is Supposed to Be All About Protecting Kids. Its Primary Enabler Appears to Have Hosted Child Porn Domains.,133,jkh2y4,https://www.motherjones.com/politics/2020/10/jim-watkins-child-pornography-domains/?utm_source=feedburner&utm_medium=feed&utm_campaign=Feed%3A+motherjones%2Fmain+%28MotherJones.com+Main+Article+Feed%29,11,1604000463.0,bobbelcher,1.0,/r/uspolitics/comments/jkh2y4/qanon_is_supposed_to_be_all_about_protecting_kids/,uspolitics,28979,2
Trump Is Losing Old People to Biden in Battleground States,134,j65j5b,https://reason.com/2020/10/06/trump-is-losing-old-people-to-biden-in-battleground-states/,12,1601992795.0,Bobinct,0.98,/r/uspolitics/comments/j65j5b/trump_is_losing_old_people_to_biden_in/,uspolitics,28979,2
"A decade after screaming about nonexistent ""death panels,"" Fox News is downplaying the deaths of 200,000 Americans",127,iybwrd,https://www.mediamatters.org/coronavirus-covid-19/decade-after-screaming-about-nonexistent-death-panels-fox-news-downplaying,2,1600873718.0,bobbelcher,0.97,/r/uspolitics/comments/iybwrd/a_decade_after_screaming_about_nonexistent_death/,uspolitics,28979,2
"Tough Guy Ted Cruz Delivers Conservate Asswhuppin’ By Threatening To Have His Buddy Beat Up An Aging Actor: As befits a sitting senator, member of the bar, and alleged adult.",129,ha68ve,https://abovethelaw.com/2020/06/tough-guy-ted-cruz-delivers-conservate-asswhuppin-by-threatening-to-have-his-buddy-beat-up-an-aging-actor/,14,1592321557.0,shallah,0.94,/r/uspolitics/comments/ha68ve/tough_guy_ted_cruz_delivers_conservate_asswhuppin/,uspolitics,28979,2
"President Donald Trump: ""There aren't too many people outside protesting"" his speech at the Phoenix Convention Center. | FALSE",135,6vlnle,http://www.politifact.com/truth-o-meter/statements/2017/aug/23/donald-trump/trumps-false-claim-there-werent-too-many-peop/,44,1503519067.0,bobbelcher,0.82,/r/uspolitics/comments/6vlnle/president_donald_trump_there_arent_too_many/,uspolitics,28979,2
Letter reveals Ted Cruz demanded Biden lift sanctions on Russian ammunition manufacturers,129,uz77ze,https://www.msn.com/en-us/news/politics/letter-reveals-ted-cruz-demanded-biden-lift-sanctions-on-russian-ammunition-manufacturers/ar-AAXNju8?ocid=msedgdhp&pc=U531&cvid=e392e6b456c34f45a5429c05c4a60a60,30,1653683776.0,northstardim,0.99,/r/uspolitics/comments/uz77ze/letter_reveals_ted_cruz_demanded_biden_lift/,uspolitics,28979,2
Never Forget That Trump Purged the Pentagon Leadership Between the Election and January 6 | And that the new leadership he installed seized direct control over deploying the National Guard that day. And that deployment was delayed for hours.,127,rb8ibd,https://www.esquire.com/news-politics/politics/a38439573/january-6-national-guard-delayed-trump-pentagon-officials/,8,1638908498.0,NORDLAN,0.97,/r/uspolitics/comments/rb8ibd/never_forget_that_trump_purged_the_pentagon/,uspolitics,28979,2
QAnon congresswoman faces calls for arrest after live-tweeting Nancy Pelosi's location to rioters,132,kv5bp5,https://www.rawstory.com/lauren-boebert-twitter/,13,1610380427.0,spaceghoti,0.98,/r/uspolitics/comments/kv5bp5/qanon_congresswoman_faces_calls_for_arrest_after/,uspolitics,28979,2
"Trump accused of ""criminal extortion"" after asking Georgia official to ""find"" votes | After Trump's call with Brad Raffensperger is leaked, a new question: How many other such calls has he made?",130,kq6e0a,https://www.salon.com/2021/01/04/trump-accused-of-criminal-extortion-after-asking-georgia-official-to-find-votes_partner/,13,1609757339.0,DonaldWillKillUsAll,0.99,/r/uspolitics/comments/kq6e0a/trump_accused_of_criminal_extortion_after_asking/,uspolitics,28979,2
Biden not getting intelligence reports because Trump officials won't recognize him as president-elect,134,jrvru5,https://www.nbcnews.com/politics/national-security/biden-not-getting-intelligence-reports-because-trump-officials-won-t-n1247294,21,1605049211.0,tyw7,0.96,/r/uspolitics/comments/jrvru5/biden_not_getting_intelligence_reports_because/,uspolitics,28979,2
"Pfizer COVID-19 vaccine was ""never part"" of Trump's Operation Warp Speed, says research head",127,jrldhs,https://www.newsweek.com/pfizer-covid-vaccine-operation-warp-speed-trump-pence-1546024,16,1605016710.0,HenryCorp,0.99,/r/uspolitics/comments/jrldhs/pfizer_covid19_vaccine_was_never_part_of_trumps/,uspolitics,28979,2
Schwarzenegger: California Republicans 'off the rails' with 'fake' ballot boxes,128,jc4khf,https://www.politico.com/states/california/story/2020/10/15/schwarzenegger-california-republicans-off-the-rails-with-fake-ballot-boxes-9424470,18,1602828561.0,bobbelcher,0.99,/r/uspolitics/comments/jc4khf/schwarzenegger_california_republicans_off_the/,uspolitics,28979,2
Karen Pence criticized for joining debate stage without mask despite rules mandating use in venue,130,j7d9e1,https://www.newsweek.com/karen-pence-criticized-joining-debate-stage-without-mask-despite-rules-mandating-use-venue-1537315,32,1602164595.0,CamelsandHippos,0.98,/r/uspolitics/comments/j7d9e1/karen_pence_criticized_for_joining_debate_stage/,uspolitics,28979,2
Federal Agents Shoot Portland Reporter With Projectile Hours After Judge Issues Restraining Order to Protect Journalists,129,hx6lfd,https://lawandcrime.com/high-profile/federal-agents-shoot-portland-reporter-hours-after-judge-issues-restraining-order-to-protect-journalists-during-protests/,41,1595613531.0,bobbelcher,0.99,/r/uspolitics/comments/hx6lfd/federal_agents_shoot_portland_reporter_with/,uspolitics,28979,2
Bill Barr asked Italian officials to discredit Russia probe — they responded with evidence linking Trump to crimes,128,10mknlc,https://www.msn.com/en-us/news/politics/bill-barr-asked-italian-officials-to-discredit-russia-probe-they-responded-with-evidence-linking-trump-to-crimes/ar-AA16Mafg?ocid=msedgdhp&pc=U531&cvid=ed512e4901e94cc3bcc8ee28994ac605,21,1674825647.0,northstardim,0.98,/r/uspolitics/comments/10mknlc/bill_barr_asked_italian_officials_to_discredit/,uspolitics,28979,2
"Herschel Walker, running for U.S. Senate in Georgia, still gets tax break on $3 million Texas residence. Under Texas law, homeowners can claim a homestead exemption only on their primary residence. The Republican Senate candidate registered to vote in Georgia last year.",128,z3mrw7,https://www.texastribune.org/2022/11/23/herschel-walker-texas-tax-break/,20,1669303660.0,1000000students,0.96,/r/uspolitics/comments/z3mrw7/herschel_walker_running_for_us_senate_in_georgia/,uspolitics,28979,2
"Trump charged Secret Service 'exorbitant' hotel rates, records show",125,y6ftr0,https://www.washingtonpost.com/nation/2022/10/17/trump-secret-service-hotel-rates-records/,12,1666024694.0,Pessimist2020,0.97,/r/uspolitics/comments/y6ftr0/trump_charged_secret_service_exorbitant_hotel/,uspolitics,28979,2
Judge dismisses Trump's 'immunity' claim in Jan. 6 lawsuits,132,weknqy,https://www.nbcnews.com/politics/donald-trump/judge-dismisses-trumps-immunity-claim-jan-6-lawsuits-rcna41171,18,1659468455.0,Pessimist2020,0.97,/r/uspolitics/comments/weknqy/judge_dismisses_trumps_immunity_claim_in_jan_6/,uspolitics,28979,2
GOP senator says roads and bridges are ‘a woman’s problem’ because women ‘do the shopping’,129,o9hl7c,https://www.independent.co.uk/news/world/americas/us-politics/bill-cassidy-bridges-women-infrastructure-b1873655.html,46,1624876392.0,Pessimist2020,0.96,/r/uspolitics/comments/o9hl7c/gop_senator_says_roads_and_bridges_are_a_womans/,uspolitics,28979,2
U.S. voting rights activist Stacey Abrams nominated for Nobel Peace Prize,126,mvlr97,https://www.reuters.com/article/us-nobel-prize-peace-usa-idUSKBN2A12HY,11,1619028886.0,wiscowall,0.94,/r/uspolitics/comments/mvlr97/us_voting_rights_activist_stacey_abrams_nominated/,uspolitics,28979,2
Trump’s pardons included health care execs behind massive frauds,127,l2wxr9,https://www.pbs.org/newshour/health/trumps-pardons-included-health-care-execs-behind-massive-frauds,14,1611349265.0,bobbelcher,0.99,/r/uspolitics/comments/l2wxr9/trumps_pardons_included_health_care_execs_behind/,uspolitics,28979,2
This Republican Party Is Not Worth Saving No one should ever get a second chance to destroy the Constitution.,128,iq46xa,https://www.theatlantic.com/ideas/archive/2020/09/i-used-think-gop-should-be-saved/616189/?utm_source=feedburner&utm_medium=feed&utm_campaign=Feed%3A+TheAtlantic+%28The+Atlantic+-+Master+Feed%29,149,1599747623.0,navegar,0.97,/r/uspolitics/comments/iq46xa/this_republican_party_is_not_worth_saving_no_one/,uspolitics,28979,2
Trump Team Fails to Cite Mail-in Election Fraud Cases in Court,128,idh8fy,https://theintercept.com/2020/08/20/trump-election-fraud-pennsylvania-court/,3,1597952339.0,bobbelcher,0.99,/r/uspolitics/comments/idh8fy/trump_team_fails_to_cite_mailin_election_fraud/,uspolitics,28979,2
Beto O’Rourke Mobilized So Many Democratic Voters That They Swept Even Local Judges Out of Office,127,9vlb1w,https://www.motherjones.com/crime-justice/2018/11/texas-harris-country-judges-bail-beto-orourke-juvenile-justice/,0,1541777009.0,bobbelcher,0.95,/r/uspolitics/comments/9vlb1w/beto_orourke_mobilized_so_many_democratic_voters/,uspolitics,28979,2
Trump used to tweet a lot about the evils of mishandling classified information,132,6bf346,https://www.vox.com/policy-and-politics/2017/5/15/15642512/trump-tweet-security-bad,2,1494904847.0,bobbelcher,0.83,/r/uspolitics/comments/6bf346/trump_used_to_tweet_a_lot_about_the_evils_of/,uspolitics,28979,2
"I.R.S. Routinely Audited Obama and Biden, Raising Questions Over Delays for Trump",130,zsgd56,https://www.nytimes.com/2022/12/21/us/politics/trump-irs-taxes.html?unlocked_article_code=UFtJASmTUZvr88woLk6kr_BDqHtSQA73k7mubIqgFHViN-PN9AzLy5qjXRC57HFxTK-aLgJEkQyAogvWvliY2qQhfsOtn6BP2_mPxKNnw_ldZm9ZpOPEABBQNkNenqRHqkJKTzHO-0vlox_dnGcnq-vTn1qCTOZydayepqYRDxtZA0fz2GHJGSrjIWaP81RiQSs6NQgKd77JH-eAC9osv2kCOU7P8_KMLgRtNsp6APNcews5oqKfsEVXu1HWAducQRDGqYuIc4Dk_LflyQkLGb4ahZFRxkGLmACBe8W586iaFJ_3gvctNsuFoUvceW7DgA_U6xWifPb9Y85XTw&smid=share-url,23,1671696015.0,bobbelcher,0.99,/r/uspolitics/comments/zsgd56/irs_routinely_audited_obama_and_biden_raising/,uspolitics,28979,2
"Donald Trump dialled Fox hosts into Oval Office meetings, report says",126,s0i0kw,https://www.independent.co.uk/news/world/americas/us-politics/trump-fox-news-hosts-white-house-b1989772.html,29,1641814372.0,Pessimist2020,0.97,/r/uspolitics/comments/s0i0kw/donald_trump_dialled_fox_hosts_into_oval_office/,uspolitics,28979,2
"People are turning in family members, ex-romantic partners they recognize in Capitol riot footage",128,l5sbki,https://www.nbcnews.com/news/us-news/people-are-turning-family-members-ex-romantic-partners-they-recognize-n1254597,10,1611708618.0,Pessimist2020,0.99,/r/uspolitics/comments/l5sbki/people_are_turning_in_family_members_exromantic/,uspolitics,28979,2
Florida may have “manipulated” COVID death data to make it more favorable ahead of election: report,129,kgmj1i,https://www.salon.com/2020/12/16/desantis-faces-renewed-scrutiny-following-discovery-of-mysterious-gap-in-floridas-covid-death-tally/,7,1608434304.0,stankmanly,0.99,/r/uspolitics/comments/kgmj1i/florida_may_have_manipulated_covid_death_data_to/,uspolitics,28979,2
Trump Reveals Plan to ‘Fire Fauci’ After Election,130,jmhxtj,https://www.thedailybeast.com/trump-reveals-plan-to-fire-fauci-after-election,19,1604295451.0,realplayer16,0.98,/r/uspolitics/comments/jmhxtj/trump_reveals_plan_to_fire_fauci_after_election/,uspolitics,28979,2
Bernie Sanders is Officially the 2020 Democratic Frontrunner,128,f2qst9,https://www.vice.com/en_us/article/y3mb5w/bernie-sanders-is-officially-the-2020-democratic-frontrunner,17,1581512133.0,HenryCorp,0.96,/r/uspolitics/comments/f2qst9/bernie_sanders_is_officially_the_2020_democratic/,uspolitics,28979,2
NY Times Drops Massive Tucker Carlson Investigation Declaring Program ‘Most Racist Show In The History Of Cable News’,126,ufmy66,https://www.msn.com/en-us/news/us/ny-times-drops-massive-tucker-carlson-investigation-declaring-program-most-racist-show-in-the-history-of-cable-news/ar-AAWMRev?ocid=msedgntp&cvid=50cc8942d970471084bc963ec54c6e7d,15,1651361780.0,northstardim,0.97,/r/uspolitics/comments/ufmy66/ny_times_drops_massive_tucker_carlson/,uspolitics,28979,2
"McDonald's, other CEOs have confided to Investors that a $15 minimum wage won't hurt business",127,mkhf1u,https://www.newsweek.com/mcdonalds-other-ceos-tell-investors-15-minimum-wage-wont-hurt-business-1580978,12,1617618093.0,realplayer16,0.99,/r/uspolitics/comments/mkhf1u/mcdonalds_other_ceos_have_confided_to_investors/,uspolitics,28979,2
"Ocasio-Cortez raises $1 million for Texas relief, plans trip to Houston",127,lnitl2,https://thehill.com/homenews/house/539550-ocasio-cortez-raises-1-million-for-texas-relief-plans-trip-to-houston,16,1613749273.0,Pessimist2020,0.99,/r/uspolitics/comments/lnitl2/ocasiocortez_raises_1_million_for_texas_relief/,uspolitics,28979,2
Republican Bill Cassidy says Trump wanted to ‘intimidate’ lawmakers as he defends vote to impeach,127,ljpzuc,https://www.independent.co.uk/news/world/americas/us-politics/trump-bill-cassidy-impeachment-b1802123.html,8,1613315204.0,Pessimist2020,0.99,/r/uspolitics/comments/ljpzuc/republican_bill_cassidy_says_trump_wanted_to/,uspolitics,28979,2
"Fifty Years of Tax Cuts for Rich Didn’t Trickle Down, Study Says",129,kehq8r,https://www.bloomberg.com/news/articles/2020-12-16/fifty-years-of-tax-cuts-for-rich-didn-t-trickle-down-study-says,20,1608152062.0,stankmanly,0.99,/r/uspolitics/comments/kehq8r/fifty_years_of_tax_cuts_for_rich_didnt_trickle/,uspolitics,28979,2
David Perdue sold his home to a finance industry official whose organization was lobbying the Senate,129,kcfaw1,https://www.salon.com/2020/12/13/david-perdue-sold-his-home-to-a-finance-industry-official-whose-organization-was-lobbying-the-senate_partner/,9,1607882743.0,Pessimist2020,1.0,/r/uspolitics/comments/kcfaw1/david_perdue_sold_his_home_to_a_finance_industry/,uspolitics,28979,2
‘What the hell is Lindsey Graham doing?’ CNN analyst shocked by GOP senator’s election meddling,126,jvxczr,https://www.rawstory.com/2020/11/what-the-hell-is-lindsey-graham-doing-cnn-analyst-shocked-by-gop-senators-election-meddling/,22,1605634684.0,OliverMarkusMalloy,0.97,/r/uspolitics/comments/jvxczr/what_the_hell_is_lindsey_graham_doing_cnn_analyst/,uspolitics,28979,2
Trump files emergency request with Supreme Court to stop release of his tax returns,124,jazq2a,https://www.cbsnews.com/amp/news/trump-supreme-court-tax-returns-emergency-request/,45,1602678509.0,Bobinct,0.97,/r/uspolitics/comments/jazq2a/trump_files_emergency_request_with_supreme_court/,uspolitics,28979,2
"The Pentagon has ordered Stars and Stripes to shut down: Trump wants to pull funding from Stars and Stripes, a newspaper for American troops that began in the Civil War and has been serving our soldiers.",127,imh6t7,https://www.usatoday.com/story/opinion/2020/09/04/trump-and-stars-and-stripes-attacking-american-icon-column/5706859002/,56,1599230591.0,cos,0.98,/r/uspolitics/comments/imh6t7/the_pentagon_has_ordered_stars_and_stripes_to/,uspolitics,28979,2
"President Donald Trump: ""The murder rate in our country is the highest it’s been in 47 years."" | FALSE",128,5su84r,http://www.politifact.com/truth-o-meter/statements/2017/feb/08/donald-trump/donald-trump-wrong-murder-rate-highest-47-years/,20,1486576319.0,bobbelcher,0.81,/r/uspolitics/comments/5su84r/president_donald_trump_the_murder_rate_in_our/,uspolitics,28979,2
Ron DeSantis (R-FL) Caught On Tape wanting Republicans to Cut Social Security and Medicare,122,11mafma,https://politicsvideochannel.com/ron-desantis-r-fl-caught-on-tape-wanting-republicans-to-cut-social-security-and-medicare/,24,1678314812.0,1000000students,0.98,/r/uspolitics/comments/11mafma/ron_desantis_rfl_caught_on_tape_wanting/,uspolitics,28979,2
Jon Stewart Calls Out Fox News For Refusing To Have Him On To Discuss Republican US Senators Who Voted Down Bill That Would Have Expanded Health Care For Veterans Affected By Cancer Causing Toxins,128,wb3cdq,https://www.yahoo.com/entertainment/jon-stewart-calls-out-fox-news-for-refusing-to-have-him-on-to-discuss-veterans-healthcare-055303489.html,18,1659097170.0,Motor-Ad-8858,0.96,/r/uspolitics/comments/wb3cdq/jon_stewart_calls_out_fox_news_for_refusing_to/,uspolitics,28979,2
"Robert Reich: ""The NRA buys off Congress. No action on guns. The oil industry buys off Congress. No action on climate. Insurance companies buy off Congress. No action on health care. Pharma buys off Congress. No action on drug prices. Money in politics is the root of our dysfunction.""",126,vt00y1,https://www.reddit.com/r/uspolitics/comments/vt00y1/robert_reich_the_nra_buys_off_congress_no_action/,21,1657140153.0,Snoo_40410,0.98,/r/uspolitics/comments/vt00y1/robert_reich_the_nra_buys_off_congress_no_action/,uspolitics,28979,2
Ghislaine Maxwell trial updates:: Accuser sobs while recounting Epstein abuse and says she met Trump at 14,125,r75k0q,https://www.independent.co.uk/news/world/americas/crime/ghislaine-maxwell-trial-epstein-victim-testimony-b1968194.html,12,1638444938.0,Pessimist2020,0.99,/r/uspolitics/comments/r75k0q/ghislaine_maxwell_trial_updates_accuser_sobs/,uspolitics,28979,2
"FBI Begins Arresting People Accused of Assaulting Journalists at Capitol on January 6 | ""It's about damn time,"" said one journalist.",126,od988j,https://www.commondreams.org/news/2021/07/03/fbi-begins-arresting-people-accused-assaulting-journalists-capitol-january-6,11,1625356631.0,theladynora,0.99,/r/uspolitics/comments/od988j/fbi_begins_arresting_people_accused_of_assaulting/,uspolitics,28979,2
Coward of the week: GOP leader McConnell will vote to acquit Trump,126,lj8b6i,https://apnews.com/article/capitol-siege-donald-trump-impeachments-trump-impeachment-mitch-mcconnell-0a14d2e41e376331580b98a992f7d856?&,12,1613247529.0,burtzev,0.97,/r/uspolitics/comments/lj8b6i/coward_of_the_week_gop_leader_mcconnell_will_vote/,uspolitics,28979,2
Georgia Republican Voters Consider Boycott Of Special Senate Election In Support Of Trump,125,k0fnci,https://www.ibtimes.com/georgia-republican-voters-consider-boycott-special-senate-election-support-trump-3088584,30,1606258005.0,Bobinct,0.96,/r/uspolitics/comments/k0fnci/georgia_republican_voters_consider_boycott_of/,uspolitics,28979,2
Senator Dumped Up to $1.6 Million of Stock After Reassuring Public About Coronavirus Preparedness,122,flilpa,https://www.propublica.org/article/senator-dumped-up-to-1-6-million-of-stock-after-reassuring-public-about-coronavirus-preparedness?utm_source=pardot&utm_medium=email&utm_campaign=majorinvestigations,22,1584654636.0,bobbelcher,0.99,/r/uspolitics/comments/flilpa/senator_dumped_up_to_16_million_of_stock_after/,uspolitics,28979,2
Trump to Puerto Rico: Your hurricane isn’t a “real catastrophe” like Katrina,125,741rn3,https://www.vox.com/2017/10/3/16411488/trump-remarks-puerto-rico,13,1507050183.0,bobbelcher,0.81,/r/uspolitics/comments/741rn3/trump_to_puerto_rico_your_hurricane_isnt_a_real/,uspolitics,28979,2
