title,score,id,url,num_comments,created,author,upvote_ratio,permalink,subreddit,subreddit_subscribers,depth
Turning mini Christmas Trees,1126,abk51j,https://v.redd.it/ukqxjf4rnt721,41,1546365015.0,aidjay,0.99,/r/turning/comments/abk51j/turning_mini_christmas_trees/,turning,104595,2
"Dude makes me super nervous with his speed and no face shield, but hey...he's ""The Maestro""",1066,z2gtyt,https://v.redd.it/fy3n3app2n1a1,77,1669182553.0,djcamera,0.99,/r/turning/comments/z2gtyt/dude_makes_me_super_nervous_with_his_speed_and_no/,turning,104595,2
I thought someone else on here would appreciate this trick for prepping blanks!,1065,knhw6h,https://v.redd.it/ha32b3mizf861,42,1609385444.0,rellim88,0.99,/r/turning/comments/knhw6h/i_thought_someone_else_on_here_would_appreciate/,turning,104595,2
I bought this face shield after reading about another redditor getting a face full of wood and stitches. Face shield arrived today and on the first turn with it I get a split and wood flys into my visor. I wanted to thanks everyone for the warning! I am safe and unharmed!,875,gw18x3,https://i.redd.it/22o393yn2r251.jpg,67,1591214015.0,rellim88,1.0,/r/turning/comments/gw18x3/i_bought_this_face_shield_after_reading_about/,turning,104595,2
"My piece ""Eroded"" won best in show",863,e297b9,https://i.imgur.com/FjYO4mM.jpg,35,1574821931.0,CrimsonKeel,0.99,/r/turning/comments/e297b9/my_piece_eroded_won_best_in_show/,turning,104595,2
This spiraling is insane.,783,aotg1t,https://gfycat.com/WeirdHollowBobwhite,10,1549727420.0,aidjay,0.98,/r/turning/comments/aotg1t/this_spiraling_is_insane/,turning,104595,2
My latest,710,b50co5,https://i.redd.it/zmf61u1ab4o21.jpg,48,1553455699.0,Nigiri28,0.99,/r/turning/comments/b50co5/my_latest/,turning,104595,2
"Found this glass dome at a yardsale, had to turn a base for it!",679,11enmgs,https://i.redd.it/2lnhxan4l0la1.jpg,39,1677627114.0,CarolinaGrainCo,1.0,/r/turning/comments/11enmgs/found_this_glass_dome_at_a_yardsale_had_to_turn_a/,turning,104595,2
Tried out a new to me technique - chalk paint inside a big leaf maple bowl,641,aljxm2,https://i.redd.it/wgnx6vqxqnd21.jpg,35,1548896524.0,CIWorkshop,0.99,/r/turning/comments/aljxm2/tried_out_a_new_to_me_technique_chalk_paint/,turning,104595,2
Spiral maple wand,631,hbj6w7,https://i.redd.it/l0eh71jffp551.jpg,25,1592501633.0,conster13,0.99,/r/turning/comments/hbj6w7/spiral_maple_wand/,turning,104595,2
"Captain America shield I made this weekend. Padauk, Maple and Walnut.",630,9q9ive,https://v.redd.it/fmxszz6kcnt11,30,1540174966.0,WoodmanXI,0.98,/r/turning/comments/9q9ive/captain_america_shield_i_made_this_weekend_padauk/,turning,104595,2
The latest work from my teacher and mentor,627,z7zngh,https://www.reddit.com/gallery/z7zngh,27,1669741572.0,qwilter2662,1.0,/r/turning/comments/z7zngh/the_latest_work_from_my_teacher_and_mentor/,turning,104595,2
"Guess I’ll post this in here too. I’m a blank maker, shoot me some questions",611,b1hnt1,https://i.redd.it/10c6p4kzhbm21.jpg,149,1552670858.0,Glock19mos,0.99,/r/turning/comments/b1hnt1/guess_ill_post_this_in_here_too_im_a_blank_maker/,turning,104595,2
Was pleasantly surprised with this experiment using acrylic paint,619,yrxrep,https://v.redd.it/1c3uo9gp68z91,31,1668130458.0,brando444,0.98,/r/turning/comments/yrxrep/was_pleasantly_surprised_with_this_experiment/,turning,104595,2
"Hi, I'm new on this sub! This is a Making Of video of a recent collaboration with my friend Charlywoodbcn and myself. He did the turning and I did the chip carving. European Basswood Bowl.",614,lxnr01,https://v.redd.it/4gdte18791l61,46,1614873455.0,WoodBernCarvings,0.99,/r/turning/comments/lxnr01/hi_im_new_on_this_sub_this_is_a_making_of_video/,turning,104595,2
"I know you guys mainly post wood turning, but I work as a toolmaker and I was pretty proud of this :)",581,aydpwh,https://i.redd.it/uvubf8sc5pk21.jpg,40,1551972061.0,ericpol3,0.98,/r/turning/comments/aydpwh/i_know_you_guys_mainly_post_wood_turning_but_i/,turning,104595,2
"Just started my first craft fair with my sister! I couldn’t make too many pens with two months notice and school, but I’m sure it will still be fun!",566,duc8be,https://i.redd.it/cfzeselzevx31.png,17,1573396811.0,ScrazerHD,0.98,/r/turning/comments/duc8be/just_started_my_first_craft_fair_with_my_sister_i/,turning,104595,2
3rd attempt at chess pieces.,557,arltyy,https://i.redd.it/8741z3ebj5h21.jpg,26,1550419382.0,whiskeyvacation,0.99,/r/turning/comments/arltyy/3rd_attempt_at_chess_pieces/,turning,104595,2
Spalted wood wasnt the best idea for this bowl but a little more hand sanding and I'm calling this one done.,550,1126n1u,https://www.reddit.com/gallery/1126n1u,45,1676384813.0,lowrrado,1.0,/r/turning/comments/1126n1u/spalted_wood_wasnt_the_best_idea_for_this_bowl/,turning,104595,2
Over the weekend I tried a slightly larger project with last year's Christmas tree,545,azr5pv,https://i.redd.it/eohu59zxfgl21.jpg,31,1552294836.0,azidstar,0.99,/r/turning/comments/azr5pv/over_the_weekend_i_tried_a_slightly_larger/,turning,104595,2
"Star Wars, resin and wood.",541,ax2txn,https://i.redd.it/xjshm3b431k21.jpg,28,1551673104.0,Nigiri28,0.99,/r/turning/comments/ax2txn/star_wars_resin_and_wood/,turning,104595,2
This gag gift was a real pain in the butt to make,539,euqf9a,https://v.redd.it/nlhh3k27ocd41,75,1580143490.0,VernestWatkins,0.98,/r/turning/comments/euqf9a/this_gag_gift_was_a_real_pain_in_the_butt_to_make/,turning,104595,2
Lidded Box in Ebony and Cocobolo,541,l48pjy,https://www.reddit.com/gallery/l48pjy,26,1611525530.0,GardnersGrendel,1.0,/r/turning/comments/l48pjy/lidded_box_in_ebony_and_cocobolo/,turning,104595,2
"8” walnut square dish. Long time listener, first time caller.",524,gl21zf,https://i.redd.it/k80zod0qv6z41.jpg,21,1589661992.0,emblemssal,1.0,/r/turning/comments/gl21zf/8_walnut_square_dish_long_time_listener_first/,turning,104595,2
"lattice bowl. bubinga, birdseye maple and wenge. 11.5 inch diameter",525,k7sxsa,https://www.reddit.com/gallery/k7sxsa,29,1607257725.0,mwalker1533,1.0,/r/turning/comments/k7sxsa/lattice_bowl_bubinga_birdseye_maple_and_wenge_115/,turning,104595,2
I Made Waterproof Root Vase,518,jfwsfk,https://v.redd.it/5d22l342dmu51,20,1603360822.0,Dmisak,0.97,/r/turning/comments/jfwsfk/i_made_waterproof_root_vase/,turning,104595,2
"The maple burl bug - turned/carved no joinery on maple, solid/single/continuous piece of wood",515,anede9,https://i.redd.it/xiayarbmare21.jpg,34,1549375344.0,Mysecretpassphrase,0.99,/r/turning/comments/anede9/the_maple_burl_bug_turnedcarved_no_joinery_on/,turning,104595,2
Reminder to use your face shield folks...,514,eb8fu2,https://i.redd.it/1ztq3xnakw441.jpg,41,1576461636.0,Mathias_Greyjoy,0.99,/r/turning/comments/eb8fu2/reminder_to_use_your_face_shield_folks/,turning,104595,2
"Score! Got this for free today from someone who ""just wanted it gone"".",509,ftd66s,https://i.redd.it/d801zfep4bq41.jpg,27,1585790914.0,djcamera,0.99,/r/turning/comments/ftd66s/score_got_this_for_free_today_from_someone_who/,turning,104595,2
First time turning a knot! A few more to go...,507,kbqybe,https://www.reddit.com/gallery/kbqybe,48,1607787110.0,Morgoroth37,0.99,/r/turning/comments/kbqybe/first_time_turning_a_knot_a_few_more_to_go/,turning,104595,2
"Snowman ready to start turning on his own! Made by one of the members of my turning group who's not on Reddit, but I thought it was too good not to share.",506,esuxy3,https://i.redd.it/8mk1j9lvujc41.jpg,25,1579794771.0,TeamBenny14,1.0,/r/turning/comments/esuxy3/snowman_ready_to_start_turning_on_his_own_made_by/,turning,104595,2
Wife told me wooden trees are ‘in’ this year. I said “how far?”,498,k481z6,https://i.redd.it/7lpa5j92og261.jpg,48,1606778562.0,entoaggie,0.99,/r/turning/comments/k481z6/wife_told_me_wooden_trees_are_in_this_year_i_said/,turning,104595,2
Another friend of mine turns even bigger wooden vessels.,500,elyr08,https://i.redd.it/jg6v6wlubm941.jpg,55,1578517001.0,darkasfck,0.99,/r/turning/comments/elyr08/another_friend_of_mine_turns_even_bigger_wooden/,turning,104595,2
Got lucky with this redheart wood!,501,bye8pg,https://i.redd.it/d0hm0j2318331.jpg,24,1560038265.0,conster13,0.99,/r/turning/comments/bye8pg/got_lucky_with_this_redheart_wood/,turning,104595,2
On numerous requests to show all figures in detail:,502,zi2v22,https://www.reddit.com/gallery/zi2v22,29,1670704726.0,IgorStechkevych,1.0,/r/turning/comments/zi2v22/on_numerous_requests_to_show_all_figures_in_detail/,turning,104595,2
I’m getting ready for my first show in an official gallery,487,j2f4y0,https://i.redd.it/9lrxqc2vm7q51.jpg,19,1601439009.0,wooden-spoon_12,0.99,/r/turning/comments/j2f4y0/im_getting_ready_for_my_first_show_in_an_official/,turning,104595,2
Ebony with gold and gunmetal chrome,478,b3gmcd,https://i.redd.it/xo3o4nemxbn21.jpg,25,1553111921.0,conster13,0.99,/r/turning/comments/b3gmcd/ebony_with_gold_and_gunmetal_chrome/,turning,104595,2
The way the wood and acrylic meet. An amazing piece of art,469,cjzy26,https://v.redd.it/v5n60eadugd31,17,1564529050.0,ericpol3,0.98,/r/turning/comments/cjzy26/the_way_the_wood_and_acrylic_meet_an_amazing/,turning,104595,2
I think I’m gonna need a bigger lathe!,470,9zg96r,https://i.redd.it/u81t5inj7xz11.jpg,41,1542909150.0,Bobb-R,0.99,/r/turning/comments/9zg96r/i_think_im_gonna_need_a_bigger_lathe/,turning,104595,2
"Because some of you asked for it: That´s how XL hollowing looks at a similar piece. And yes - its from one log, no segmented something.",469,eliyqh,https://i.redd.it/xk2a80l2nf941.jpg,48,1578436196.0,darkasfck,0.99,/r/turning/comments/eliyqh/because_some_of_you_asked_for_it_thats_how_xl/,turning,104595,2
Lost my dad last week. Made this for him. 13” tall x 7” white pine with black walnut cap. Hollow. He was 85. These were his favorite woods.,468,ndndhy,https://i.redd.it/2b06zx2c8hz61.jpg,24,1621168356.0,NECESolarGuy,0.99,/r/turning/comments/ndndhy/lost_my_dad_last_week_made_this_for_him_13_tall_x/,turning,104595,2
I turned some walnut shot glasses || I painted them with acrylic paint and protected them with beeswax and propolis paste.,459,krmy55,https://www.reddit.com/gallery/krmy55,34,1609936100.0,copiandwood,0.99,/r/turning/comments/krmy55/i_turned_some_walnut_shot_glasses_i_painted_them/,turning,104595,2
Got sick of my wife’s rings sitting on the counter waiting to get swept into the sink. Pretty happy for 5 minutes work and piece of scrap oak,460,fez4ax,https://i.redd.it/e1g2c7ommal41.jpg,20,1583605483.0,quackertracker,1.0,/r/turning/comments/fez4ax/got_sick_of_my_wifes_rings_sitting_on_the_counter/,turning,104595,2
TIE fighter art glass ball.,461,bn4zmu,https://gfycat.com/DentalFarawayGermanspitz,15,1557528705.0,ericpol3,0.98,/r/turning/comments/bn4zmu/tie_fighter_art_glass_ball/,turning,104595,2
"So I've built this LEGO woodshop based on an article from Fine Woodworking Magazine and I thought you would like to see it. It's on LEGO Ideas right now, so it has a chance of becoming a real set if enough people support it.",451,of47li,https://ideas.lego.com/projects/f13da25c-2795-4976-9dfe-72f3bd61b4c3,70,1625605799.0,cambuimg,0.98,/r/turning/comments/of47li/so_ive_built_this_lego_woodshop_based_on_an/,turning,104595,2
NLD - new lathe day!,450,f3wkf8,https://i.redd.it/1ccatisapxg41.jpg,28,1581705600.0,ReallyFineWhine,0.99,/r/turning/comments/f3wkf8/nld_new_lathe_day/,turning,104595,2
I made drinking cups for kids. They are made out of cherry wood UV printed and protected with food safe epoxy,442,ksenrc,https://www.reddit.com/gallery/ksenrc,25,1610030813.0,copiandwood,0.99,/r/turning/comments/ksenrc/i_made_drinking_cups_for_kids_they_are_made_out/,turning,104595,2
Shot glasses out of wild tambran this time. And with a different liquor. Just trying to get a whiskey sponsorship,443,f2ek2t,https://i.redd.it/a22nrq3gvcg41.jpg,25,1581453421.0,VernestWatkins,0.97,/r/turning/comments/f2ek2t/shot_glasses_out_of_wild_tambran_this_time_and/,turning,104595,2
Maple Burl and Resin orb. About 2.5” diameter.,446,aflar6,https://i.redd.it/w0oleumm38a21.jpg,27,1547399493.0,Nigiri28,0.99,/r/turning/comments/aflar6/maple_burl_and_resin_orb_about_25_diameter/,turning,104595,2
I knew this board was going to be special but WOW,440,rwxuva,https://www.reddit.com/gallery/rwxuva,40,1641419838.0,lowrrado,1.0,/r/turning/comments/rwxuva/i_knew_this_board_was_going_to_be_special_but_wow/,turning,104595,2
"Ahh. Black walnut, we meet again.",432,b6bg0x,https://i.redd.it/ruwnkxy4xqo21.jpg,9,1553729213.0,terrible01,0.99,/r/turning/comments/b6bg0x/ahh_black_walnut_we_meet_again/,turning,104595,2
"Moon flyby rocket. A nightlight for my son’s 3rd birthday! Walnut, oak, brass",431,iejcex,https://www.reddit.com/gallery/iejcex,22,1598106328.0,dafigzz,0.99,/r/turning/comments/iejcex/moon_flyby_rocket_a_nightlight_for_my_sons_3rd/,turning,104595,2
"The Jade Brick Bowl! I cast these oak ""bricks"" in green resin and turned them down to a bowl. What do you think?",425,y0dqa5,https://youtu.be/ZjkzmmsYOs0,42,1665405444.0,FormanWoodworking,0.98,/r/turning/comments/y0dqa5/the_jade_brick_bowl_i_cast_these_oak_bricks_in/,turning,104595,2
20” Cottonwood platter before applying finish,429,gr3lqq,https://i.redd.it/8ilhtmy9t5151.jpg,16,1590520762.0,emblemssal,0.98,/r/turning/comments/gr3lqq/20_cottonwood_platter_before_applying_finish/,turning,104595,2
"My dream space is finally set up, complete with views!",420,gha0gy,https://i.redd.it/uwub0tns90y41.jpg,40,1589146126.0,micro_cosm,0.99,/r/turning/comments/gha0gy/my_dream_space_is_finally_set_up_complete_with/,turning,104595,2
"Got a bunch of walnut, and decided to add a tiny bit of colour. I love how these turned out!",424,xy3kmu,https://www.reddit.com/gallery/xy3kmu,25,1665160186.0,brando444,1.0,/r/turning/comments/xy3kmu/got_a_bunch_of_walnut_and_decided_to_add_a_tiny/,turning,104595,2
Chess🇺🇦,418,zf8t9b,https://i.redd.it/ehftj0bk6k4a1.jpg,17,1670436912.0,IgorStechkevych,0.98,/r/turning/comments/zf8t9b/chess/,turning,104595,2
"Curly cherry platter still wet from walnut oil. Thanks dad, it was a joy to turn the wood you left me as a way to remember you.",423,c1eogw,https://v.redd.it/9y9fflv65s431,16,1560717715.0,terrible01,0.99,/r/turning/comments/c1eogw/curly_cherry_platter_still_wet_from_walnut_oil/,turning,104595,2
Just a cutoff that I couldn’t let go to waste.,414,bk2akl,https://v.redd.it/gnyuxpoi5wv21,44,1556843633.0,Woodyoubelieve,0.98,/r/turning/comments/bk2akl/just_a_cutoff_that_i_couldnt_let_go_to_waste/,turning,104595,2
I made plywood bowl,417,hm6o06,https://v.redd.it/a3jhf02dc8951,25,1594038230.0,Dmisak,0.97,/r/turning/comments/hm6o06/i_made_plywood_bowl/,turning,104595,2
A few weeks’ worth of stress relief,413,bkn4qr,https://i.redd.it/fncslio758w21.jpg,19,1556988724.0,conster13,0.99,/r/turning/comments/bkn4qr/a_few_weeks_worth_of_stress_relief/,turning,104595,2
Work in progress. A burl landing site for one of my little rockets. Thoughts?,413,d7jprs,https://i.redd.it/1lp0n3qoq1o31.jpg,38,1569114899.0,chaotictinkering,0.99,/r/turning/comments/d7jprs/work_in_progress_a_burl_landing_site_for_one_of/,turning,104595,2
"Day #1 of self quarantine, it’s going to be a long 2 weeks",412,fm2dyx,https://i.redd.it/gkqeq4xc3wn41.jpg,62,1584737049.0,White_v,0.95,/r/turning/comments/fm2dyx/day_1_of_self_quarantine_its_going_to_be_a_long_2/,turning,104595,2
Spindle terminology,411,a4vmie,https://i.redd.it/ok244ev3cg321.jpg,22,1544448273.0,Mysecretpassphrase,0.98,/r/turning/comments/a4vmie/spindle_terminology/,turning,104595,2
I tried lidded boxes yesterday. Super happy with the result.,404,10ltghl,https://v.redd.it/zt2ezifxyfea1,31,1674744462.0,mikeytwocakes,0.99,/r/turning/comments/10ltghl/i_tried_lidded_boxes_yesterday_super_happy_with/,turning,104595,2
Team walnut. Ready to do battle.,396,an0vri,https://i.redd.it/nemos0fzgje21.jpg,24,1549280551.0,whiskeyvacation,0.99,/r/turning/comments/an0vri/team_walnut_ready_to_do_battle/,turning,104595,2
"10 inch segmented bowl. purpleheart, wenge and birch",396,my9mhz,https://www.reddit.com/gallery/my9mhz,23,1619361635.0,mwalker1533,1.0,/r/turning/comments/my9mhz/10_inch_segmented_bowl_purpleheart_wenge_and_birch/,turning,104595,2
Fresh walnut bowl about to come off the lathe,401,e4ixyr,https://v.redd.it/ndpx4ynzk1241,20,1575214944.0,BrogueEncore,0.98,/r/turning/comments/e4ixyr/fresh_walnut_bowl_about_to_come_off_the_lathe/,turning,104595,2
Finished the highvoltage woodburnig vase of death,394,b73tyk,https://v.redd.it/nuby95xjy4p21,21,1553899643.0,j-lehman,0.98,/r/turning/comments/b73tyk/finished_the_highvoltage_woodburnig_vase_of_death/,turning,104595,2
My dad showed me today these that my great-great-great grandfather turned with a manual lathe,391,bfpts4,https://i.redd.it/0hq3geu7wmt21.jpg,18,1555859714.0,azidstar,1.0,/r/turning/comments/bfpts4/my_dad_showed_me_today_these_that_my/,turning,104595,2
"Happy with this mistake! Maple & Redheart. I was planning the typical swirl but glued the third segmented ring in the wrong direction, so I just went with it.",394,9o3q6h,https://i.redd.it/qoe5iva4a6s11.jpg,22,1539532194.0,Bobb-R,0.99,/r/turning/comments/9o3q6h/happy_with_this_mistake_maple_redheart_i_was/,turning,104595,2
Super-thin Maple,391,er3w3e,https://i.redd.it/9g2drmedftb41.jpg,18,1579474697.0,leiferslook,0.99,/r/turning/comments/er3w3e/superthin_maple/,turning,104595,2
This elf is all done in Santa’ Workshop. Everyone gift is coming off the lathe this year,390,e8t480,https://i.redd.it/30kwf94a5u341.jpg,36,1575996522.0,quackertracker,0.99,/r/turning/comments/e8t480/this_elf_is_all_done_in_santa_workshop_everyone/,turning,104595,2
Big Leaf Maple,387,asoyny,https://i.redd.it/xg4hoe2rhqh21.jpg,16,1550673103.0,chatski,0.99,/r/turning/comments/asoyny/big_leaf_maple/,turning,104595,2
Just an exercise to get used to deep hollowing.,386,el9r9t,https://i.redd.it/pdqkw6ogzb941.jpg,25,1578392357.0,darkasfck,0.98,/r/turning/comments/el9r9t/just_an_exercise_to_get_used_to_deep_hollowing/,turning,104595,2
I made an office glass with a piece of root and the purple resin,383,k0pvh5,https://v.redd.it/22ujux5k6d161,21,1606300580.0,Dmisak,0.98,/r/turning/comments/k0pvh5/i_made_an_office_glass_with_a_piece_of_root_and/,turning,104595,2
First attempt at a segmented bowl. Wish me luck.,383,ab6nm5,https://i.redd.it/wobxco20wl721.jpg,39,1546258883.0,Robin_Banks101,0.99,/r/turning/comments/ab6nm5/first_attempt_at_a_segmented_bowl_wish_me_luck/,turning,104595,2
I made a needlessly difficult bowl.,376,79xbgd,https://i.redd.it/tj7i87l1a7vz.jpg,30,1509470821.0,CP_Creations,0.98,/r/turning/comments/79xbgd/i_made_a_needlessly_difficult_bowl/,turning,104595,2
Turned sink and faucet for a kid play kitchen,381,kn3wtb,https://www.reddit.com/gallery/kn3wtb,21,1609341061.0,dafigzz,1.0,/r/turning/comments/kn3wtb/turned_sink_and_faucet_for_a_kid_play_kitchen/,turning,104595,2
I think that I'm set for walnut for a while...,382,kyn67q,https://www.reddit.com/gallery/kyn67q,16,1610818244.0,ReallyFineWhine,0.98,/r/turning/comments/kyn67q/i_think_that_im_set_for_walnut_for_a_while/,turning,104595,2
Call this piece “The Galaxy”,371,hav3b0,https://i.redd.it/btxxs2403i551.jpg,26,1592412770.0,Cakeisalie77,0.98,/r/turning/comments/hav3b0/call_this_piece_the_galaxy/,turning,104595,2
"13,157 pieces in this bowl turned by my mentor and teacher.",376,zje807,https://www.reddit.com/gallery/zje807,21,1670800817.0,qwilter2662,1.0,/r/turning/comments/zje807/13157_pieces_in_this_bowl_turned_by_my_mentor_and/,turning,104595,2
Update: My bowls are in the gallery!,379,jr6ioj,https://i.redd.it/tfzce50u5ay51.jpg,9,1604956390.0,wooden-spoon_12,1.0,/r/turning/comments/jr6ioj/update_my_bowls_are_in_the_gallery/,turning,104595,2
Candles. Design inspired by my lack of creativity Oak,374,e4396o,https://i.redd.it/k85ceticzv141.jpg,15,1575147123.0,ba-na-na-way,0.99,/r/turning/comments/e4396o/candles_design_inspired_by_my_lack_of_creativity/,turning,104595,2
The Urn I made for my grandfather that died last week.,373,hesvyo,https://i.redd.it/q55nwli0wr651.jpg,31,1592967265.0,mak3rdad,0.99,/r/turning/comments/hesvyo/the_urn_i_made_for_my_grandfather_that_died_last/,turning,104595,2
Resin cast playing card,372,aczkt2,https://i.redd.it/53b8msqcuo821.jpg,36,1546730491.0,CardMechanic,0.99,/r/turning/comments/aczkt2/resin_cast_playing_card/,turning,104595,2
Wow! This burl was exciting and nervewracking to turn. Red Coolah burl platter,368,l0au0w,https://i.redd.it/6vc2hysjh7c61.png,16,1611025925.0,StringFood,0.99,/r/turning/comments/l0au0w/wow_this_burl_was_exciting_and_nervewracking_to/,turning,104595,2
"When you have a 200 year old yarn spinning wheel but only have one bobbin, who you gonna call? Wood turner! I made 6 reproductions.",373,ep9deq,https://i.redd.it/jzql0gohn0b41.jpg,34,1579126224.0,Negative1fkstogive,0.99,/r/turning/comments/ep9deq/when_you_have_a_200_year_old_yarn_spinning_wheel/,turning,104595,2
Ash bowl. This is my 4th bowl i’ve turned. It’s not perfect but it’s my best bowl so far,367,emb55q,https://i.redd.it/7cr97lwaur941.jpg,13,1578583710.0,n1jonesy,0.99,/r/turning/comments/emb55q/ash_bowl_this_is_my_4th_bowl_ive_turned_its_not/,turning,104595,2
Anyone else ever turn a bowl into a lampshade?,370,b9bxqy,https://i.redd.it/qikim2oao8q21.jpg,31,1554380010.0,zst2589,0.99,/r/turning/comments/b9bxqy/anyone_else_ever_turn_a_bowl_into_a_lampshade/,turning,104595,2
Learning fractal pyrography,365,b5bt0w,https://i.redd.it/9j7dexw66ao21.jpg,28,1553526441.0,j-lehman,0.98,/r/turning/comments/b5bt0w/learning_fractal_pyrography/,turning,104595,2
"There's literally nothing special about it, but it's my first bowl. Walnut and Danish oil.",369,f7xbj3,https://i.redd.it/cko5xqe3zii41.jpg,23,1582399376.0,djcamera,1.0,/r/turning/comments/f7xbj3/theres_literally_nothing_special_about_it_but_its/,turning,104595,2
It’s carved now! 11” x 5.5” Cherry. Used Saburrtooth bits and Waterlox finish. My favorite of the ones I’ve done so far.,372,nyispn,https://www.reddit.com/gallery/nyispn,21,1623538153.0,gilbylawless,0.99,/r/turning/comments/nyispn/its_carved_now_11_x_55_cherry_used_saburrtooth/,turning,104595,2
Really enjoyed turning this simple little baby rattle,365,b89lhg,https://i.redd.it/w7w0qajp2qp21.jpg,26,1554154827.0,Mathias_Greyjoy,0.99,/r/turning/comments/b89lhg/really_enjoyed_turning_this_simple_little_baby/,turning,104595,2
So I found out that filming your turning at 24fps looks pretty trippy..,364,s11oqn,https://v.redd.it/g9p01pccyya81,13,1641867848.0,brando444,0.99,/r/turning/comments/s11oqn/so_i_found_out_that_filming_your_turning_at_24fps/,turning,104595,2
Hobbies collide: I got my first lathe; my wife started her first flower garden. Maple and Zinnia,362,hs91et,https://i.redd.it/plfq6qlcu7b51.jpg,12,1594903807.0,dafigzz,1.0,/r/turning/comments/hs91et/hobbies_collide_i_got_my_first_lathe_my_wife/,turning,104595,2
Made a cookie jar.,362,axsvez,https://i.redd.it/4vp7fztmgek21.jpg,18,1551834987.0,MrKoaKine,0.98,/r/turning/comments/axsvez/made_a_cookie_jar/,turning,104595,2
"First airbrush work other than practice boards. I wanted more yellow at the top, but I am pleased with the outcome",358,g9z9vg,https://i.redd.it/ho4m424bjnv41.jpg,21,1588120239.0,j-lehman,0.99,/r/turning/comments/g9z9vg/first_airbrush_work_other_than_practice_boards_i/,turning,104595,2
Decent haul of free black walnut and elm.,362,buu7kr,https://i.redd.it/3acxhyu35d131.jpg,10,1559228466.0,capnwessles,0.99,/r/turning/comments/buu7kr/decent_haul_of_free_black_walnut_and_elm/,turning,104595,2
Turned some Detroit Agate,355,ddrwsx,https://i.redd.it/xdsymrkhwrq31.jpg,38,1570303324.0,CardMechanic,0.99,/r/turning/comments/ddrwsx/turned_some_detroit_agate/,turning,104595,2
Show tomorrow.,352,9xrbu6,https://i.redd.it/lngyb5rb0sy11.jpg,45,1542410341.0,gilbylawless,0.98,/r/turning/comments/9xrbu6/show_tomorrow/,turning,104595,2
New lathe setup 😍,358,9w6388,https://i.redd.it/xhsew3h0vqx11.jpg,45,1541960599.0,Glock19mos,0.99,/r/turning/comments/9w6388/new_lathe_setup/,turning,104595,2
The downside of turning resin: you look like a snowman every 10 seconds,353,ktwcda,https://i.imgur.com/lvgiG2a.jpg,35,1610216825.0,Massis87,0.98,/r/turning/comments/ktwcda/the_downside_of_turning_resin_you_look_like_a/,turning,104595,2
"Lost my sweet little girl, Cherry, a couple months ago after almost a full year of battling health issues. Just finished her urn, and I'm really happy with it. Pulled an ash log from my firewood pile.",353,ik4qb1,https://i.redd.it/bp93d6n83ek51.jpg,11,1598902070.0,capnwessles,0.98,/r/turning/comments/ik4qb1/lost_my_sweet_little_girl_cherry_a_couple_months/,turning,104595,2
First lidded pot attempt. Live edge oak.,355,gmtffn,https://i.redd.it/3sqlolzherz41.jpg,17,1589910438.0,lochneffmonster,0.99,/r/turning/comments/gmtffn/first_lidded_pot_attempt_live_edge_oak/,turning,104595,2
I think I sold 60 of these trees in the past 3 weeks.,353,k8nvq2,https://i.redd.it/c2yrujnvjt361.jpg,62,1607370383.0,gilbylawless,0.99,/r/turning/comments/k8nvq2/i_think_i_sold_60_of_these_trees_in_the_past_3/,turning,104595,2
"As requested, the finished result of the ocean bowl.",351,e6qe39,https://i.redd.it/rl3zdw70pw241.jpg,18,1575591522.0,Adk318,0.98,/r/turning/comments/e6qe39/as_requested_the_finished_result_of_the_ocean_bowl/,turning,104595,2
My first attempt at a inside out Christmas ornament. Made from oak,354,e1481c,https://v.redd.it/dlo0g1y13p041,17,1574627764.0,n1jonesy,0.99,/r/turning/comments/e1481c/my_first_attempt_at_a_inside_out_christmas/,turning,104595,2
1st bowl. I am proud of it.,354,gu9yoy,https://i.redd.it/mt8hu7h3w6251.jpg,31,1590969657.0,mak3rdad,0.99,/r/turning/comments/gu9yoy/1st_bowl_i_am_proud_of_it/,turning,104595,2
Marblewood bowl turned out sexy.,349,i6xfih,https://i.redd.it/z7c8uubyh3g51.jpg,16,1597030452.0,Cakeisalie77,1.0,/r/turning/comments/i6xfih/marblewood_bowl_turned_out_sexy/,turning,104595,2
