title,score,id,url,num_comments,created,author,upvote_ratio,permalink,subreddit,subreddit_subscribers,depth
"Chinese elementary school facial recognition system in action: The technology is being implemented more broadly across China, monitoring attendance, classroom participation, and - perhaps cynically - normalizing students to the concept of a surveillance state.",1776,c21197,https://gfycat.com/hugegaseousgallinule,135,1560856876.0,SirT6,0.98,/r/sciences/comments/c21197/chinese_elementary_school_facial_recognition/,sciences,166187,2
Chemotaxis: Bacteria attracted by a sugar crystal,1752,db95x7,https://i.redd.it/wnx17nsldpp31.gif,43,1569836923.0,PUTINKAAA,0.99,/r/sciences/comments/db95x7/chemotaxis_bacteria_attracted_by_a_sugar_crystal/,sciences,166187,2
"A carnivorous sea slug: Melibe viridis is a hermaphroditic nudibranch with a large, net-like mouth that it spreads out to snag its prey Hungry Hungry Hippo style.",1757,d3o85v,https://gfycat.com/illfatedwavyduiker,51,1568376192.0,SirT6,0.99,/r/sciences/comments/d3o85v/a_carnivorous_sea_slug_melibe_viridis_is_a/,sciences,166187,2
Soyuz docks to the ISS,1747,ez9hnh,https://gfycat.com/acclaimedvelvetyfrillneckedlizard,79,1580908998.0,cosmicdatabase,0.99,/r/sciences/comments/ez9hnh/soyuz_docks_to_the_iss/,sciences,166187,2
"Researchers have 3D printed a heart using a patient’s own cells. It could be used to patch diseased hearts - and possibly, for full transplants. The heart is the first to be printed with all blood vessels, ventricles and chambers, using an ink made from the patient’s own biological materials.",1739,bdsocp,https://gfycat.com/EuphoricAnotherBorer,73,1555413221.0,SirT6,0.98,/r/sciences/comments/bdsocp/researchers_have_3d_printed_a_heart_using_a/,sciences,166187,2
"Zoom-in on the Orion Nebula, starting with ground-based observations and finishing with Hubble images.",1731,dfwhsv,https://gfycat.com/elegantcreamyfeline,26,1570706112.0,SirT6,0.99,/r/sciences/comments/dfwhsv/zoomin_on_the_orion_nebula_starting_with/,sciences,166187,2
Jupiter this week,1727,f7s475,https://i.imgur.com/vWUVk8y.jpg,30,1582375656.0,illichian,0.99,/r/sciences/comments/f7s475/jupiter_this_week/,sciences,166187,2
The gorgonorhynchus is a member of the proboscis worm species. It shoots out a white appendage to capture food.,1714,cjqpji,https://gfycat.com/slowtotalcrane,116,1564487830.0,SirT6,0.97,/r/sciences/comments/cjqpji/the_gorgonorhynchus_is_a_member_of_the_proboscis/,sciences,166187,2
"Crown shyness is a phenomenon observed in some tree species, in which the crowns of fully stocked trees do not touch each other, forming a canopy with channel-like gaps. We aren’t quite sure why it happens.",1718,by872n,https://gfycat.com/ordinarysanekoalabear,92,1560002054.0,SirT6,0.98,/r/sciences/comments/by872n/crown_shyness_is_a_phenomenon_observed_in_some/,sciences,166187,2
Gasses Near A Tesla Coil,1713,eby4wc,https://v.redd.it/c1u0lnqn18541,43,1576600658.0,stelios_malamas,0.99,/r/sciences/comments/eby4wc/gasses_near_a_tesla_coil/,sciences,166187,2
Researchers have captured the first-ever videos of chemical synthesis at atomic resolution. Using single-molecule atomic-resolution real-time electron microscopic imaging they visualize the structures and dynamics of prenucleation clusters for metal-organic framework syntheses.,1700,cw3ez6,https://www-u--tokyo-ac-jp.cdn.ampproject.org/ii/w1200/s/www.u-tokyo.ac.jp/content/400121944.gif,47,1566907109.0,SirT6,0.99,/r/sciences/comments/cw3ez6/researchers_have_captured_the_firstever_videos_of/,sciences,166187,2
The first direct observation of gravitational waves was detected emanating from the inspiral and merger of two black holes. The event emitted 3.6 septillion yottawatts of power (3.6×10⁴⁶ watts) and reached Earth as a ripple in spacetime.,1673,ch7aej,https://gfycat.com/cookedpointedconch,95,1563969774.0,SirT6,0.98,/r/sciences/comments/ch7aej/the_first_direct_observation_of_gravitational/,sciences,166187,2
The NASA mathematician Katherine Johnson died today at the age of 101.She calculated accurate trajectories for many missions my hand,1668,f9dtfo,https://i.redd.it/bh36f2nev3j41.jpg,21,1582651990.0,wellendowedpenguin69,0.98,/r/sciences/comments/f9dtfo/the_nasa_mathematician_katherine_johnson_died/,sciences,166187,2
"A close-up of the Sun's dynamic surface, seen in x-ray by the Hinode spacecraft.",1672,eccqnw,https://gfycat.com/misguideddistincthochstettersfrog,38,1576676356.0,SirT6,0.99,/r/sciences/comments/eccqnw/a_closeup_of_the_suns_dynamic_surface_seen_in/,sciences,166187,2
Amoeba trying very hard to engulf a yeast cell that is a little too big,1668,bowpel,https://gfycat.com/EntireGrotesqueDamselfly,69,1557919363.0,SirT6,0.99,/r/sciences/comments/bowpel/amoeba_trying_very_hard_to_engulf_a_yeast_cell/,sciences,166187,2
"Last year 920,000 children died of pneumonia, mostly in countries without access to expensive medical care. Now an Indian doctor has fashioned and artificial respirator out of shampoo bottles. It has been routinely deployed in his hospital, and infant pneumonia deaths have dropped by 75%.",1639,9dov8e,https://www.economist.com/science-and-technology/2018/09/08/how-a-shampoo-bottle-is-saving-young-lives,125,1536279729.0,SirT6,0.97,/r/sciences/comments/9dov8e/last_year_920000_children_died_of_pneumonia/,sciences,166187,2
MRI scan of a person moving their eyes back and forth.,1632,klrdts,https://gfycat.com/thoroughimperfectcentipede,50,1609165236.0,SirT6,0.99,/r/sciences/comments/klrdts/mri_scan_of_a_person_moving_their_eyes_back_and/,sciences,166187,2
What your skull looks like before adult teeth grow in,1629,dzjofp,https://i.redd.it/6sgmn8bjp1041.jpg,75,1574344706.0,SirT6,0.97,/r/sciences/comments/dzjofp/what_your_skull_looks_like_before_adult_teeth/,sciences,166187,2
"The Google healthcare AI was shown a picture of a cat, it was “100% positive” it was guacamole: More and more researchers are urging caution around the use of AI in healthcare, arguing we don’t fully understand the nuances of these algorithms. And that can be dangerous.",1627,c2ft1d,https://www.statnews.com/2019/06/19/what-if-ai-in-health-care-is-next-asbestos/,193,1560943209.0,SirT6,0.91,/r/sciences/comments/c2ft1d/the_google_healthcare_ai_was_shown_a_picture_of_a/,sciences,166187,2
"Dropping a magnet through a copper tube. As the magnet falls it induces a current in the copper pipe. That current creates a magnetic field that opposes the changing field of the falling magnet, resulting in the magnet being repelled (falling more slowly). This is Lenz’s law.",1610,c6jmjq,https://gfycat.com/brilliantsnarlingafricanaugurbuzzard,61,1561725053.0,SirT6,0.98,/r/sciences/comments/c6jmjq/dropping_a_magnet_through_a_copper_tube_as_the/,sciences,166187,2
The International Space Station passing in front of the moon at 7.67 Km/s,1603,dv99yk,https://gfycat.com/heartfeltfortunatebaiji,29,1573561516.0,SirT6,0.99,/r/sciences/comments/dv99yk/the_international_space_station_passing_in_front/,sciences,166187,2
"AI machine vision assists during a colonoscopy: not just helping to pick up flat, sessile, missed lesions, but also to real-time classify whether the lesion is likely to be malignant or benign.",1597,dpmb5h,https://gfycat.com/thatsardonicattwatersprairiechicken,56,1572522158.0,SirT6,0.98,/r/sciences/comments/dpmb5h/ai_machine_vision_assists_during_a_colonoscopy/,sciences,166187,2
"The boy’s brain tumor was growing so fast that he had trouble putting words together. Then he started taking an experimental drug targeting a mutation in the tumor. Within months, the tumor had all but disappeared. 11 out of 11 other patients have also responded in early trials.",1585,bpboq1,https://www.bloomberg.com/amp/news/articles/2019-05-15/roche-s-gene-targeting-drug-shows-promise-in-child-brain-tumors?__twitter_impression=true,83,1558008182.0,SirT6,0.99,/r/sciences/comments/bpboq1/the_boys_brain_tumor_was_growing_so_fast_that_he/,sciences,166187,2
Cancer patient goes into spontaneous remission after COVID-19 infection,1584,kqyl4q,https://i.redd.it/nkhb0ff8oi961.png,64,1609853789.0,SirT6,0.97,/r/sciences/comments/kqyl4q/cancer_patient_goes_into_spontaneous_remission/,sciences,166187,2
Octopus goes into stealth mode,1571,cja0z0,https://gfycat.com/newnervousammonite,36,1564399987.0,SirT6,0.98,/r/sciences/comments/cja0z0/octopus_goes_into_stealth_mode/,sciences,166187,2
"A storm-producing island, cutey named Hector the Convector seems to give birth to storm clouds (link in comments)",1562,ee4y3l,https://v.redd.it/p9zo1lgqt6641,35,1577021784.0,IJesusChrist,0.99,/r/sciences/comments/ee4y3l/a_stormproducing_island_cutey_named_hector_the/,sciences,166187,2
"The pearlfish has a special relationship with sea cucumbers. The pearlfish will live in the sea cucumber's anus, backing into the hole tail-first so its head can stick out, avoiding predators and having easier access to food.",1559,dlgptm,https://gfycat.com/definiteviciousfattaileddunnart,125,1571744611.0,SirT6,0.98,/r/sciences/comments/dlgptm/the_pearlfish_has_a_special_relationship_with_sea/,sciences,166187,2
"Mixing the right amount of table salt, yellow prussiate of potash, liquid soap, boiling water and treating this solution with paper forms a Chemical Christmas Tree",1557,eek1p8,https://gfycat.com/lonelyadolescentafricanrockpython,41,1577104285.0,mtimetraveller,0.93,/r/sciences/comments/eek1p8/mixing_the_right_amount_of_table_salt_yellow/,sciences,166187,2
"As migrating cells move, they leave long tubular strands, called retraction fibers, behind them. These fibers are studded with vesicles containing factors that promote cells to “follow the trail”. The process is called migracytosis and has implications in development and diseases like cancer.",1548,d5wjsb,https://gfycat.com/discreteonlyeyelashpitviper,36,1568807120.0,SirT6,0.99,/r/sciences/comments/d5wjsb/as_migrating_cells_move_they_leave_long_tubular/,sciences,166187,2
The Daily Mail is at it again. We need better scientific journalism if we want people to better understand science.,1539,e6nzcl,https://i.redd.it/7iq9k71quv241.png,42,1575581390.0,SirT6,0.98,/r/sciences/comments/e6nzcl/the_daily_mail_is_at_it_again_we_need_better/,sciences,166187,2
"Most geckos do not possess eyelids; they feature a clear scale that covers the eye. Because they can’t blink, they lick their eyes to keep them clean and moist, with the tongue acting like a windshield wiper.",1535,cxwp4v,https://gfycat.com/spryharmoniousaustrianpinscher,25,1567264649.0,SirT6,0.99,/r/sciences/comments/cxwp4v/most_geckos_do_not_possess_eyelids_they_feature_a/,sciences,166187,2
Two Freshwater Tardigrades Can Be Seen Feeding On Another Tardigrade In 10x Magnification,1518,efqn4k,https://gfycat.com/anchoredfelinechupacabra,66,1577333740.0,mtimetraveller,0.99,/r/sciences/comments/efqn4k/two_freshwater_tardigrades_can_be_seen_feeding_on/,sciences,166187,2
"Jupiter's moon, Io, casts a shadow on the gas giant",1513,d7swlq,https://i.redd.it/m1b8v17gb6o31.png,30,1569170327.0,IJesusChrist,0.98,/r/sciences/comments/d7swlq/jupiters_moon_io_casts_a_shadow_on_the_gas_giant/,sciences,166187,2
"Dynamic history of infectious diseases before and after vaccines, 1955 to present.",1493,d85d07,https://gfycat.com/identicalhonoredleafhopper,36,1569238992.0,SirT6,0.99,/r/sciences/comments/d85d07/dynamic_history_of_infectious_diseases_before_and/,sciences,166187,2
Imaging firing neurons in the brain of a live mouse,1494,dy2m9i,https://gfycat.com/lividuntimelyadmiralbutterfly,36,1574080493.0,SirT6,0.99,/r/sciences/comments/dy2m9i/imaging_firing_neurons_in_the_brain_of_a_live/,sciences,166187,2
"Measles raging in Europe because of anti-vaccine movement. Now 41,000 cases of measles in Europe and 40 deaths due to lack of vaccination.",1485,9q907b,https://www.nbcnews.com/news/amp/ncna922146?__twitter_impression=true,411,1540170591.0,SirT6,0.97,/r/sciences/comments/9q907b/measles_raging_in_europe_because_of_antivaccine/,sciences,166187,2
"No, this isn't Mars. This is Indonesia at 1pm. Their rainforests are still burning and it's giving the sky a whole new color.",1468,d8mxx0,https://gfycat.com/darlinglightheartedbullmastiff,27,1569330437.0,IJesusChrist,0.98,/r/sciences/comments/d8mxx0/no_this_isnt_mars_this_is_indonesia_at_1pm_their/,sciences,166187,2
Woman discovers that her headaches have been caused by a spider living in her ear.,1465,ba437a,https://gfycat.com/GaseousExaltedCollardlizard,182,1554555814.0,SirT6,0.96,/r/sciences/comments/ba437a/woman_discovers_that_her_headaches_have_been/,sciences,166187,2
A microscopic water bear appears to be temporarily stuck to a bubble as a result of surface tension.,1451,bywl3c,https://gfycat.com/brokenfearlessdorado,65,1560165306.0,SirT6,0.98,/r/sciences/comments/bywl3c/a_microscopic_water_bear_appears_to_be/,sciences,166187,2
"Those who were most opposed to genetically modified foods believed they were the most knowledgeable about this issue, yet scored the lowest on actual tests of scientific knowledge.",1453,ci2hh7,https://www.nytimes.com/2019/07/22/upshot/health-facts-importance-persuasion.html?smtyp=cur&smid=tw-nythealth,256,1564145551.0,SirT6,0.98,/r/sciences/comments/ci2hh7/those_who_were_most_opposed_to_genetically/,sciences,166187,2
The birth of 10 billion suns being born over 2 billion years: a simulation created by researchers in Germany and the United States,1439,e0zuvk,https://gfycat.com/happygoluckynarrowhorsemouse,20,1574609383.0,SirT6,0.98,/r/sciences/comments/e0zuvk/the_birth_of_10_billion_suns_being_born_over_2/,sciences,166187,2
A small drop of venoms from a Russell’s viper turns blood to jelly in seconds.,1425,cgbz4a,https://gfycat.com/talkativewetconey,60,1563794650.0,SirT6,0.97,/r/sciences/comments/cgbz4a/a_small_drop_of_venoms_from_a_russells_viper/,sciences,166187,2
"When a liquid touches a mass significantly hotter than the liquid's boiling point, an insulating vapor layer keeps that liquid from boiling rapidly, creating a 'repulsive force' that make the drops hover. This is what happens when the hot mass is sand.",1418,ca6tpp,https://gfycat.com/medicalpaledragonfly,48,1562506122.0,SirT6,0.98,/r/sciences/comments/ca6tpp/when_a_liquid_touches_a_mass_significantly_hotter/,sciences,166187,2
"Time lapse imagery of Chennai's disappearing reservoirs. That's roughly 3 billion cubic feet of water gone in less than a year. Government mismanagement, climate change combined to make a real threat to the over 4.5 million residents.",1419,c4lw7b,https://gfycat.com/defensivecarelesshydatidtapeworm,42,1561374957.0,SirT6,0.98,/r/sciences/comments/c4lw7b/time_lapse_imagery_of_chennais_disappearing/,sciences,166187,2
The most populous cities in the world (1500 - 2018),1419,b456kg,https://gfycat.com/CelebratedBeautifulDolphin,97,1553261937.0,SirT6,0.98,/r/sciences/comments/b456kg/the_most_populous_cities_in_the_world_1500_2018/,sciences,166187,2
"This ultraviolet Hubble movie shows the ring of aurora on Jupiter and the silhouette and shadow of its moon Europa. You can also see the magnetic footprint of Io, just ahead of the aurora.",1411,egb1mq,https://gfycat.com/improbablesmallamericanwirehair,30,1577452553.0,SirT6,0.99,/r/sciences/comments/egb1mq/this_ultraviolet_hubble_movie_shows_the_ring_of/,sciences,166187,2
"The night side of Pluto, its thin atmosphere illuminated by the Sun from 4.9 billion kilometers away. Captured by the departing New Horizons spacecraft after its closest approach 19 minutes earlier.",1406,dlxtfq,https://i.redd.it/etou90rqy9u31.jpg,24,1571829587.0,SirT6,0.99,/r/sciences/comments/dlxtfq/the_night_side_of_pluto_its_thin_atmosphere/,sciences,166187,2
NASA’s Juno spacecraft spotted a ‘dolphin’ in the clouds of Jupiter during its flyby last year,1404,dgfc2e,https://gfycat.com/simpleharmlessamericanpainthorse,32,1570801250.0,SirT6,0.98,/r/sciences/comments/dgfc2e/nasas_juno_spacecraft_spotted_a_dolphin_in_the/,sciences,166187,2
Removing plaque from a blocked carotid artery,1404,b5ozo9,https://gfycat.com/DeliriousHairyDamselfly,166,1553602690.0,SirT6,0.99,/r/sciences/comments/b5ozo9/removing_plaque_from_a_blocked_carotid_artery/,sciences,166187,2
Visual proof that the exterior angles of the side of a polygon always add up to 360 degrees,1405,boahon,https://gfycat.com/TatteredLikelyIlsamochadegu,20,1557787607.0,SirT6,0.98,/r/sciences/comments/boahon/visual_proof_that_the_exterior_angles_of_the_side/,sciences,166187,2
"A computer simulation of protein synthesis by a ribosome, sped up from the estimated real time ~4x",1391,egtgg7,https://gfycat.com/exaltedfrayedhuia,43,1577554187.0,IJesusChrist,0.99,/r/sciences/comments/egtgg7/a_computer_simulation_of_protein_synthesis_by_a/,sciences,166187,2
"The frog fish is a deceptively vicious hunter that strikes in 1/6,000th of a second. There are multiple species of frog fish - each different shapes and colors - but all have an enormously distensible stomach, which allows an individual frog fish to fully swallow prey as large as itself.",1387,cc9qpu,https://gfycat.com/flusteredwatchfulbasenji,58,1562931533.0,SirT6,0.99,/r/sciences/comments/cc9qpu/the_frog_fish_is_a_deceptively_vicious_hunter/,sciences,166187,2
Human stem cells differentiating into neurons,1380,fpewu4,https://v.redd.it/79xufrlxq1p41,24,1585241420.0,pollisa_85,0.98,/r/sciences/comments/fpewu4/human_stem_cells_differentiating_into_neurons/,sciences,166187,2
CT scan of a patient who had swallowed 63 packets of cocaine. The packets were successfully evacuated using laxatives.,1385,bzq60t,https://i.redd.it/4ocj1v77xw331.jpg,50,1560339765.0,SirT6,0.99,/r/sciences/comments/bzq60t/ct_scan_of_a_patient_who_had_swallowed_63_packets/,sciences,166187,2
2.5 hours of Jupiter rotation along with two Galilean moons. Images captured from the driveway.,1375,czjjgp,https://gfycat.com/pleasinganchoredelectriceel,34,1567596374.0,SirT6,0.99,/r/sciences/comments/czjjgp/25_hours_of_jupiter_rotation_along_with_two/,sciences,166187,2
"The razor clam can burrow rapidly into sand. It can dig up to 2 feet into the sand despite having no hands or claws. It turn solid sand into a quicksand-like substance in order to dig deeper, a process called “fluidizing”.",1372,bo28wr,https://gfycat.com/EllipticalKnobbyGroundbeetle,100,1557746789.0,SirT6,0.98,/r/sciences/comments/bo28wr/the_razor_clam_can_burrow_rapidly_into_sand_it/,sciences,166187,2
Merino sheep are normally shorn annually. One such sheep - named Shrek - avoided being caught and shorn for six years letting his coat grow to an impressive length.,1364,gdc7ad,https://i.redd.it/usr0ygu48rw41.jpg,37,1588601109.0,SirT6,0.96,/r/sciences/comments/gdc7ad/merino_sheep_are_normally_shorn_annually_one_such/,sciences,166187,2
Jane Goodall and team release a rehabilitated chimp back into the wild.,1362,bkl0mw,https://gfycat.com/EdibleInnocentKite,35,1556975671.0,SirT6,0.98,/r/sciences/comments/bkl0mw/jane_goodall_and_team_release_a_rehabilitated/,sciences,166187,2
"Researchers found a grain of silicon carbide, dug out of the Murchison meteorite, that is seven billion years old. This presolar grain was belched into the universe by a dying star during the final stage of its life. It eventually hitched a ride to Earth on an asteroid that produced the meteorite.",1361,hfm6h7,https://i.redd.it/a4mvcc2i52751.png,22,1593092049.0,SirT6,0.99,/r/sciences/comments/hfm6h7/researchers_found_a_grain_of_silicon_carbide_dug/,sciences,166187,2
A liver fluke - a type of flatworm parasite - peeking through the duodenal papilla of a 40 year old patient.,1363,dteuqg,https://gfycat.com/blacktenderlamb,121,1573216648.0,SirT6,0.96,/r/sciences/comments/dteuqg/a_liver_fluke_a_type_of_flatworm_parasite_peeking/,sciences,166187,2
"Inspired by diving bell spiders and rafts of fire ants, researchers have created a metallic structure that is so water repellent, it refuses to sink, no matter if it is forced into water or damaged. May lead to unsinkable ships & wearable flotation devices.",1358,dvqym2,https://gfycat.com/jauntyscarcedouglasfirbarkbeetle,28,1573647582.0,SirT6,0.93,/r/sciences/comments/dvqym2/inspired_by_diving_bell_spiders_and_rafts_of_fire/,sciences,166187,2
"A star death in the galaxy Centaurus A,13.4 million light years away from us. What you watch here, what happened 1 month after the star's death with the supernova which is extinguished&a light echo's spread around in a ring. If there's life around,no more.",1342,fdwvrn,https://gfycat.com/palatableuntriedimpala,47,1583422325.0,spacepix,0.98,/r/sciences/comments/fdwvrn/a_star_death_in_the_galaxy_centaurus_a134_million/,sciences,166187,2
How Poisonous Is A Black Widow,1340,e89zoy,https://gfycat.com/deliriousdistortedheterodontosaurus,62,1575898320.0,mtimetraveller,0.94,/r/sciences/comments/e89zoy/how_poisonous_is_a_black_widow/,sciences,166187,2
NASA releases first image of Perseverance Rover being lowered down onto the surface of Mars yesterday,1335,lnowa6,https://i.imgur.com/FNZZQjK.png,23,1613764505.0,avitechwriter,0.99,/r/sciences/comments/lnowa6/nasa_releases_first_image_of_perseverance_rover/,sciences,166187,2
This is Mars,1330,gehdlh,https://i.imgur.com/cmfl8EO.png,33,1588760398.0,cosmemo,0.99,/r/sciences/comments/gehdlh/this_is_mars/,sciences,166187,2
Aluminum powder in organic solvent is mesmerizing,1329,d44ikn,https://i.imgur.com/s4g9iv6.gifv,19,1568463922.0,SirT6,0.99,/r/sciences/comments/d44ikn/aluminum_powder_in_organic_solvent_is_mesmerizing/,sciences,166187,2
"For the first time ever, a drone successfully delivered an organ for transplant",1326,bjar6v,https://gfycat.com/SpiritedAdolescentKitten,90,1556669653.0,SirT6,0.98,/r/sciences/comments/bjar6v/for_the_first_time_ever_a_drone_successfully/,sciences,166187,2
Blowing the candles,1330,epm8ou,https://v.redd.it/s1rpkly1b6b41,54,1579194743.0,stelios_malamas,0.98,/r/sciences/comments/epm8ou/blowing_the_candles/,sciences,166187,2
"Researchers have created the most detailed map of the mouse brain to date, capturing the projections and connections of over 1,000 neurons (and counting).",1328,d0ffbd,https://gfycat.com/limitedorganicleopardseal,37,1567769550.0,SirT6,0.99,/r/sciences/comments/d0ffbd/researchers_have_created_the_most_detailed_map_of/,sciences,166187,2
A male seahorse giving birth,1324,c1mkxj,https://gfycat.com/untidyvariablealaskajingle,73,1560772190.0,SirT6,0.98,/r/sciences/comments/c1mkxj/a_male_seahorse_giving_birth/,sciences,166187,2
"Wood ants spray formic acid from their abdomens as a defense. The acid gives off a pungent odor, but does't hurt unless it gets into an open wound, which is most often caused by the ants biting with their powerful jaws. The acid fumes also irritate the nose and mouth causing coughing and choking.",1310,ds7ztw,https://gfycat.com/wholefaircat-shittyreactiongifs-naturegifs,34,1572998744.0,FillsYourNiche,0.99,/r/sciences/comments/ds7ztw/wood_ants_spray_formic_acid_from_their_abdomens/,sciences,166187,2
Northern Lights. [xpost from r/cosmicporn],1310,f7b9a8,https://gfycat.com/nastyaggressivebeagle,20,1582292562.0,spacepix,0.99,/r/sciences/comments/f7b9a8/northern_lights_xpost_from_rcosmicporn/,sciences,166187,2
"3D imaging of neurons from intact brain tissue. Green is to the amygdala, and purple is from the amygdala.",1313,c92vio,https://gfycat.com/scratchykeycottontail,33,1562248568.0,SirT6,0.99,/r/sciences/comments/c92vio/3d_imaging_of_neurons_from_intact_brain_tissue/,sciences,166187,2
"A bacterial flagellum is driven by a rotary engine made up of protein, and is powered by the flow of protons across the bacterial cell membrane. It rotates at ~1,000 rpm, but the rotor alone can rotate at up to 17,000 rpm.",1307,11ib3cc,https://v.redd.it/xnmh5glzzrla1,50,1677958980.0,Rifletree,0.99,/r/sciences/comments/11ib3cc/a_bacterial_flagellum_is_driven_by_a_rotary/,sciences,166187,2
"A primitive, but effective contrast agent: Ink injection into the yolk sac artery of a 72 hour-old chick embryo to visualize the beating heart and the vasculature.",1301,cdvnsh,https://gfycat.com/yellowishearlyindianjackal,64,1563275733.0,SirT6,0.99,/r/sciences/comments/cdvnsh/a_primitive_but_effective_contrast_agent_ink/,sciences,166187,2
Scientists found 1 billion-year-old fossil cells so well preserved they could see structures inside. The fossils were likely marine bacteria from rivers or ocean water near the Rodinia supercontinent.,1304,c64hq9,https://i.redd.it/yp226lz4zv631.png,30,1561635689.0,SirT6,0.99,/r/sciences/comments/c64hq9/scientists_found_1_billionyearold_fossil_cells_so/,sciences,166187,2
"Golden algae colonies grow as unbranched or branched chains (as seen here), and the individual cells are surrounded by vase-shaped receptacles called loricae.",1289,efbvln,https://gfycat.com/cloudyhonestblobfish,15,1577247592.0,mtimetraveller,0.99,/r/sciences/comments/efbvln/golden_algae_colonies_grow_as_unbranched_or/,sciences,166187,2
Drops of water coated in a powder that reacts to laser light creates a tiny engine pulling 150 times its weight,1289,dz049g,https://gfycat.com/verifiablezealousindianelephant,63,1574244744.0,PUTINKAAA,0.99,/r/sciences/comments/dz049g/drops_of_water_coated_in_a_powder_that_reacts_to/,sciences,166187,2
The farthest view of Earth seen by human eyes,1283,ffbebn,https://i.imgur.com/dD2aCv2.jpg,35,1583667340.0,illichian,0.99,/r/sciences/comments/ffbebn/the_farthest_view_of_earth_seen_by_human_eyes/,sciences,166187,2
Science Summary for last month [OC],1280,d4jbhx,https://i.imgur.com/BYtIR8K.jpg,25,1568547291.0,prototyperspective,0.99,/r/sciences/comments/d4jbhx/science_summary_for_last_month_oc/,sciences,166187,2
"Just a flesh wound: Zombify a dead fish by adding salt. When a creature dies its neurons don't stop working right away. Sodium chloride (salt) is enough to trigger the still-working neurons to fire, signaling the muscles to contract (until they use up their energy stores).",1275,ax6kwa,https://gfycat.com/SimilarWholeAnnelida,102,1551702418.0,SirT6,0.97,/r/sciences/comments/ax6kwa/just_a_flesh_wound_zombify_a_dead_fish_by_adding/,sciences,166187,2
