title,score,id,url,num_comments,created,author,upvote_ratio,permalink,subreddit,subreddit_subscribers,depth
Animated comparison between Verstappen and Charles Qualy Lap (AutoSport),6650,vv0vng,https://v.redd.it/nexa81uvfja91,205,1657370497.0,alfred_27,0.98,/r/F1Technical/comments/vv0vng/animated_comparison_between_verstappen_and/,F1Technical,221689,1
2022 regs inspired me to add ground effect to my RC car.,4982,sqtwhc,https://v.redd.it/n5iknqta7fh81,128,1644679605.0,engineeringafterhour,0.99,/r/F1Technical/comments/sqtwhc/2022_regs_inspired_me_to_add_ground_effect_to_my/,F1Technical,221689,1
Autosport did this comparison.... extreme interpretations!,3661,tdvydc,https://i.redd.it/l95ewv1racn81.jpg,128,1647259524.0,thewarmnutter,0.99,/r/F1Technical/comments/tdvydc/autosport_did_this_comparison_extreme/,F1Technical,221689,1
Ferrari F1-75 dash layout: What the drivers see during a qualifying lap,3536,tr6xy7,https://i.redd.it/imepj2o0mcq81.jpg,100,1648571712.0,DrivenByData_,0.99,/r/F1Technical/comments/tr6xy7/ferrari_f175_dash_layout_what_the_drivers_see/,F1Technical,221689,1
Porpoising continues to haunt teams on Day 2 of pre-season testing,3022,tbt3vb,https://v.redd.it/269ptsix0sm81,215,1647014083.0,matemr,0.99,/r/F1Technical/comments/tbt3vb/porpoising_continues_to_haunt_teams_on_day_2_of/,F1Technical,221689,1
The severity of Ferrari’s porpoising issue in Bahrain,2571,tb5wzo,https://v.redd.it/k74i1et1tlm81,193,1646938793.0,matemr,0.99,/r/F1Technical/comments/tb5wzo/the_severity_of_ferraris_porpoising_issue_in/,F1Technical,221689,1
Under Ferrari 👀👀👀👀,2223,u9kdcb,https://www.reddit.com/gallery/u9kdcb,106,1650649561.0,Emergency_Leave_5761,0.98,/r/F1Technical/comments/u9kdcb/under_ferrari/,F1Technical,221689,1
I put DRS on my RC car,2160,10aujr2,https://v.redd.it/mjc63wulbtba1,66,1673616506.0,engineeringafterhour,0.97,/r/F1Technical/comments/10aujr2/i_put_drs_on_my_rc_car/,F1Technical,221689,1
These curves 😍. What do you think Ferrari are trying to achieve with the deep side pods?,2158,supaf2,https://i.redd.it/ni7ft3vweei81.jpg,176,1645105888.0,Kamasutra08,0.98,/r/F1Technical/comments/supaf2/these_curves_what_do_you_think_ferrari_are_trying/,F1Technical,221689,1
Mercedes front wing flex,2056,tayf3s,https://v.redd.it/y0ky8p8f3km81,111,1646918112.0,Rouxs05,0.98,/r/F1Technical/comments/tayf3s/mercedes_front_wing_flex/,F1Technical,221689,1
Mercedes trimmed their rear Wing,1882,tmac3f,https://i.redd.it/wzi5pffg3cp81.jpg,99,1648128803.0,FederalEngineer,0.97,/r/F1Technical/comments/tmac3f/mercedes_trimmed_their_rear_wing/,F1Technical,221689,1
A curious F1 tech detail - The Anti-Ackermann steering,1793,v0ypaa,https://www.reddit.com/r/F1Technical/comments/v0ypaa/a_curious_f1_tech_detail_the_antiackermann/,71,1653912230.0,F1DataAnalysis,0.99,/r/F1Technical/comments/v0ypaa/a_curious_f1_tech_detail_the_antiackermann/,F1Technical,221689,1
Merc vs Ferrari,1790,sw6l6j,https://i.redd.it/l8i8p9xxiri81.jpg,107,1645264633.0,thewarmnutter,0.99,/r/F1Technical/comments/sw6l6j/merc_vs_ferrari/,F1Technical,221689,1
The Halo did his job again.,1787,pmuze2,https://i.redd.it/c7y6onkbe3n71.jpg,146,1631461225.0,RudieBatsbak,0.98,/r/F1Technical/comments/pmuze2/the_halo_did_his_job_again/,F1Technical,221689,1
you can see how low are the others compared to W13,1787,tkcza7,https://i.redd.it/rj9zb4m610p81.png,144,1647982734.0,FederalEngineer,0.95,/r/F1Technical/comments/tkcza7/you_can_see_how_low_are_the_others_compared_to_w13/,F1Technical,221689,1
Lewis changed his launch procedure in the past few races to give himself a significant advantage off the line. Does anyone know what he's engaging at the back of his steering wheel here prior to launch?,1764,re1l5j,https://v.redd.it/voj48ijihx481,212,1639235049.0,DisjointedHuntsville,0.92,/r/F1Technical/comments/re1l5j/lewis_changed_his_launch_procedure_in_the_past/,F1Technical,221689,1
Slightly bendy Mercedes frontwing.,1721,tci4ej,https://v.redd.it/gigskpe1wym81,79,1647097190.0,RudieBatsbak,0.97,/r/F1Technical/comments/tci4ej/slightly_bendy_mercedes_frontwing/,F1Technical,221689,1
Mercedes programmed a secret good bye message into Valtteri;s steering wheel that was triggered by his slow down lap procedure,1618,rettzi,https://streamable.com/5i991v,62,1639330458.0,Noname_Maddox,0.99,/r/F1Technical/comments/rettzi/mercedes_programmed_a_secret_good_bye_message/,F1Technical,221689,1
The New W13,1595,svdy3b,https://i.redd.it/eqijxoyp9ki81.png,146,1645176790.0,ITAHawkmoon98,0.98,/r/F1Technical/comments/svdy3b/the_new_w13/,F1Technical,221689,1
Which programming language is used on the onboard computer? Something written in C or some super fail proof astronomical mission code?,1555,tgwxyo,https://i.redd.it/988quq75w3o81.jpg,199,1647593596.0,pombocorreio,0.98,/r/F1Technical/comments/tgwxyo/which_programming_language_is_used_on_the_onboard/,F1Technical,221689,1
Everyone going the Redbull way? Thoughts?,1532,voegnw,https://i.redd.it/a4ffixcs8u891.jpg,106,1656611588.0,Emergency_Leave_5761,0.99,/r/F1Technical/comments/voegnw/everyone_going_the_redbull_way_thoughts/,F1Technical,221689,1
Dk if this is a low effort post or something but that's just 2kmph off of the fastest apex speed through Pouhon. That's 2020 levels of grip. Seems like these cars are gonna get properly absurd with the speed ofevelopment,1496,wz7nk1,https://v.redd.it/479ydo4fdak91,79,1661619282.0,sebvettelstan,0.97,/r/F1Technical/comments/wz7nk1/dk_if_this_is_a_low_effort_post_or_something_but/,F1Technical,221689,1
What can it be if not pump?,1475,tjbpag,https://i.redd.it/zq8th8epmqo81.png,236,1647868883.0,FederalEngineer,0.98,/r/F1Technical/comments/tjbpag/what_can_it_be_if_not_pump/,F1Technical,221689,1
The New F1-75,1356,suoicw,https://i.redd.it/9fhnum6x7ei81.png,68,1645103553.0,ITAHawkmoon98,0.99,/r/F1Technical/comments/suoicw/the_new_f175/,F1Technical,221689,1
Ferrari’s SF-23 formula one car,1339,1122rtv,https://www.reddit.com/gallery/1122rtv,57,1676372744.0,Sundae_227,0.99,/r/F1Technical/comments/1122rtv/ferraris_sf23_formula_one_car/,F1Technical,221689,1
Best mini-section times recorded for each team across the three days of Pre-Season testing 2022,1323,teppx3,https://www.reddit.com/gallery/teppx3,165,1647352999.0,DrivenByData_,0.98,/r/F1Technical/comments/teppx3/best_minisection_times_recorded_for_each_team/,F1Technical,221689,1
Bahrain GP Race - Speed Trap,1267,tit7k3,https://i.redd.it/38gwq6cwelo81.png,177,1647805766.0,Sm0g3R,0.99,/r/F1Technical/comments/tit7k3/bahrain_gp_race_speed_trap/,F1Technical,221689,1
What are your thoughts on planning to ban tyre warming blankets in f1?,1264,rgvn67,https://i.redd.it/ziuh6q2kio581.jpg,260,1639562160.0,karolis_7,0.97,/r/F1Technical/comments/rgvn67/what_are_your_thoughts_on_planning_to_ban_tyre/,F1Technical,221689,1
"RIP Sir Frank Williams 1942-2021, founder and former team principal of the Williams Formula 1 team",1262,r46083,https://www.reddit.com/r/F1Technical/comments/r46083/rip_sir_frank_williams_19422021_founder_and/,15,1638111257.0,Noname_Maddox,0.98,/r/F1Technical/comments/r46083/rip_sir_frank_williams_19422021_founder_and/,F1Technical,221689,1
New AT03,1199,ss88kk,https://www.reddit.com/gallery/ss88kk,66,1644837190.0,ITAHawkmoon98,0.99,/r/F1Technical/comments/ss88kk/new_at03/,F1Technical,221689,1
Explanation of DAS mechanism by Sky Sports F1,1188,o42286,https://v.redd.it/rnu99shz5e671,48,1624182219.0,Animesh_Mishra,0.99,/r/F1Technical/comments/o42286/explanation_of_das_mechanism_by_sky_sports_f1/,F1Technical,221689,1
Analysis of Launch RPM for Drivers and Teams in the 2021 Formula 1 World Championship,1169,rz530u,https://www.reddit.com/gallery/rz530u,90,1641663131.0,DrivenByData_,0.99,/r/F1Technical/comments/rz530u/analysis_of_launch_rpm_for_drivers_and_teams_in/,F1Technical,221689,1
McLaren's floor is seen to have a hole in it,1170,118czzj,https://www.reddit.com/gallery/118czzj,53,1677007492.0,vick5516,0.97,/r/F1Technical/comments/118czzj/mclarens_floor_is_seen_to_have_a_hole_in_it/,F1Technical,221689,1
.The rear end of the cars from the Barcelona test.,1163,t1u7nj,https://i.redd.it/ns9q78t7o5k81.jpg,52,1645871774.0,RIFASOM,0.99,/r/F1Technical/comments/t1u7nj/the_rear_end_of_the_cars_from_the_barcelona_test/,F1Technical,221689,1
24k Gold seat covering for Lance Stroll which helps cooling. is this for every driver?,1140,11trt54,https://i.redd.it/3z90bdtgjcoa1.jpg,209,1679061358.0,Zendaya-Papaya,0.95,/r/F1Technical/comments/11trt54/24k_gold_seat_covering_for_lance_stroll_which/,F1Technical,221689,1
Mercedes new 2023 W14 formula 1 car,1134,112u82t,https://www.reddit.com/gallery/112u82t,86,1676453929.0,Sundae_227,0.98,/r/F1Technical/comments/112u82t/mercedes_new_2023_w14_formula_1_car/,F1Technical,221689,1
AMR22 Front Wing Outwash Vortices as Seen in Heat Haze,1135,t10iu2,https://i.redd.it/8k9gx3n3eyj81.gif,15,1645783640.0,EdgeOfExceptional,0.99,/r/F1Technical/comments/t10iu2/amr22_front_wing_outwash_vortices_as_seen_in_heat/,F1Technical,221689,1
Mclaren 2022 steering wheel,1116,sdwzqw,https://i.redd.it/0laaqjqt18e81.png,64,1643285500.0,S1eet,0.98,/r/F1Technical/comments/sdwzqw/mclaren_2022_steering_wheel/,F1Technical,221689,1
Upshift RPM Analysis for Drivers and Teams in the 2021 Formula 1 World Championship [Details below],1109,s0fw3r,https://www.reddit.com/gallery/s0fw3r,64,1641806113.0,DrivenByData_,0.99,/r/F1Technical/comments/s0fw3r/upshift_rpm_analysis_for_drivers_and_teams_in_the/,F1Technical,221689,1
Webber through the swimming pool section on the way to a pole. How does the suspension not get damaged after taking that kind of abuse through a race distance?,1105,zu5du2,https://v.redd.it/yipt7rhx1t7a1,65,1671869873.0,sebvettelstan,0.96,/r/F1Technical/comments/zu5du2/webber_through_the_swimming_pool_section_on_the/,F1Technical,221689,1
Going from just the picture how would these designs effect the car?,1089,sq7tgy,https://i.redd.it/kzzcjabmc9h81.png,120,1644608742.0,alfred_27,0.97,/r/F1Technical/comments/sq7tgy/going_from_just_the_picture_how_would_these/,F1Technical,221689,1
HAAS VS ASTON MARTIN - THE STRUGGLE OF CONCEPTS IN FORMULA 1,1066,spqc34,https://i.redd.it/9zjxeiqss4h81.jpg,130,1644553663.0,PeterL1nch,0.98,/r/F1Technical/comments/spqc34/haas_vs_aston_martin_the_struggle_of_concepts_in/,F1Technical,221689,1
"Comparison of 2022 F1 cars on track: AMR22, C42 & FW44",1065,staojv,https://i.redd.it/348jtcx3q1i81.jpg,66,1644952265.0,sissipaska,0.99,/r/F1Technical/comments/staojv/comparison_of_2022_f1_cars_on_track_amr22_c42_fw44/,F1Technical,221689,1
A522 Model in the windtunnel,1044,108be5p,https://i.redd.it/8gpgksl1r9ba1.jpg,42,1673361558.0,Thelegendkenobi,0.99,/r/F1Technical/comments/108be5p/a522_model_in_the_windtunnel/,F1Technical,221689,1
The most dominant f1 car in history?,1043,sauch7,https://www.reddit.com/gallery/sauch7,123,1642946647.0,RIFASOM,0.95,/r/F1Technical/comments/sauch7/the_most_dominant_f1_car_in_history/,F1Technical,221689,1
Cooling vents under the Detached Sharkfin (Credit to Craig Scarborough),1019,sxqv4t,https://i.redd.it/3eaz4vnk36j81.png,48,1645441103.0,ITAHawkmoon98,0.99,/r/F1Technical/comments/sxqv4t/cooling_vents_under_the_detached_sharkfin_credit/,F1Technical,221689,1
Close up of Alpine‘s steering wheel from Ocon‘s IG story,1013,rlfsrp,https://i.redd.it/gq8cpoajow681.jpg,49,1640096874.0,Thelegendkenobi,0.99,/r/F1Technical/comments/rlfsrp/close_up_of_alpines_steering_wheel_from_ocons_ig/,F1Technical,221689,1
"While the mercs have gone with most tight packaging to an extent where there sidepods are extremely small, aston have left so much gap, why is it like that with the same engine",997,tavllb,https://i.redd.it/bdinlnm97jm81.jpg,75,1646907246.0,ani_budihal,0.99,/r/F1Technical/comments/tavllb/while_the_mercs_have_gone_with_most_tight/,F1Technical,221689,1
The Fast and Furious Pit Stop Showdown. Distribution of PitStop Times by Team visualized,1000,tk0wbc,https://i.redd.it/4ziqa9oc8xo81.png,78,1647948820.0,jaffa133,0.98,/r/F1Technical/comments/tk0wbc/the_fast_and_furious_pit_stop_showdown/,F1Technical,221689,1
3D Printed Working Hybrid Era F1 Gearbox,969,zq1ger,https://v.redd.it/tnfnzvtsqw6a1,32,1671479098.0,indeterminatedesign,0.99,/r/F1Technical/comments/zq1ger/3d_printed_working_hybrid_era_f1_gearbox/,F1Technical,221689,1
"Hi! I've been teaching Formula 1 Data Analysis over the past months, and next Tuesday I'll be hosting a webinar ""Intro to Formula 1 Data Analysis in Python"". It's free, so if you want to join, the link is in this post!",933,xnm5vz,https://www.reddit.com/r/F1Technical/comments/xnm5vz/hi_ive_been_teaching_formula_1_data_analysis_over/,182,1664109235.0,Nothing0,0.98,/r/F1Technical/comments/xnm5vz/hi_ive_been_teaching_formula_1_data_analysis_over/,F1Technical,221689,1
The Mercedes Engine saga is possibly related to the FIA rulings on cooling air in the plenum,926,qufg63,https://www.reddit.com/r/F1Technical/comments/qufg63/the_mercedes_engine_saga_is_possibly_related_to/,174,1636979721.0,DisjointedHuntsville,0.96,/r/F1Technical/comments/qufg63/the_mercedes_engine_saga_is_possibly_related_to/,F1Technical,221689,1
Canadian GP Qualification Q3 - Fastest driver in each of 25 mini sectors,931,vfog5k,https://i.redd.it/tctdh6vdoi691.png,43,1655617878.0,TracingInsights,0.99,/r/F1Technical/comments/vfog5k/canadian_gp_qualification_q3_fastest_driver_in/,F1Technical,221689,1
T-Tray stays/dampers of different teams,915,11gxzv2,https://www.reddit.com/gallery/11gxzv2,46,1677841702.0,beerusuuuuh,0.99,/r/F1Technical/comments/11gxzv2/ttray_staysdampers_of_different_teams/,F1Technical,221689,1
Pat Symonds killing it with a chemistry lesson about F1 fuels right now. I’m loving his presence in the commentary booth!,904,11bhgsb,https://i.redd.it/6echab2pncka1.jpg,40,1677319385.0,pombocorreio,0.98,/r/F1Technical/comments/11bhgsb/pat_symonds_killing_it_with_a_chemistry_lesson/,F1Technical,221689,1
Formula1 is alive and well. BahrainGP driver positions across sessions visualized.,911,tktlk7,https://i.redd.it/wv913ackr4p81.png,42,1648041053.0,jaffa133,0.97,/r/F1Technical/comments/tktlk7/formula1_is_alive_and_well_bahraingp_driver/,F1Technical,221689,1
George Russell showed of his helmet for Monza. Including the helmet camera.,913,plib5d,https://i.redd.it/4jjq7g4xjnm71.jpg,56,1631269397.0,RudieBatsbak,0.99,/r/F1Technical/comments/plib5d/george_russell_showed_of_his_helmet_for_monza/,F1Technical,221689,1
About the Blown diffusers of the 2011 season. They were so important to the downforce of the car. Why did the laptimes not get much slower when the regulations got stricter in 2012 and 2013? I understand there was some workarounds but the actual concept was outlawed right?,895,yktry7,https://v.redd.it/po1mj27keox91,59,1667455092.0,sebvettelstan,0.99,/r/F1Technical/comments/yktry7/about_the_blown_diffusers_of_the_2011_season_they/,F1Technical,221689,1
[TracingInsights] Every drivers' fastest lap of the race compared for Spanish GP,893,uxctms,https://i.redd.it/w5k3z4a22l191.png,47,1653467508.0,TracingInsights,0.99,/r/F1Technical/comments/uxctms/tracinginsights_every_drivers_fastest_lap_of_the/,F1Technical,221689,1
Newly added runoff in Spa Circuit and a VERY interesting sausage kerb.,880,ta0g91,https://i.redd.it/fhf5ck6tlam81.jpg,101,1646803174.0,mmd_aaron,0.98,/r/F1Technical/comments/ta0g91/newly_added_runoff_in_spa_circuit_and_a_very/,F1Technical,221689,1
Details of Haas VF22 underfloor revealead in Mick's Saudi Arabia crash | Source: Racefans.net / XPB Images,878,tqc5tx,https://www.racefans.net/2022/03/28/schumachers-33g-jeddah-crash-leaves-haas-with-repair-bill-of-up-to-1-million/,40,1648482159.0,sissipaska,0.99,/r/F1Technical/comments/tqc5tx/details_of_haas_vf22_underfloor_revealead_in/,F1Technical,221689,1
The miracle of F1 safety technology. Remarkable animation courtesy of Canal+ SportReporter. The outcome was not perfect but it wasn't too bad.,873,loo4pz,https://streamable.com/qlz92n,56,1613878834.0,bhargvagiri,0.99,/r/F1Technical/comments/loo4pz/the_miracle_of_f1_safety_technology_remarkable/,F1Technical,221689,1
"Note how the Williams FW-44 is a beautiful car that ""reminds"" the 1992 FW-14/B model, but evolved into the 2022 version.",873,stcohf,https://i.redd.it/cc0v4f8c52i81.jpg,42,1644957391.0,PeterL1nch,0.96,/r/F1Technical/comments/stcohf/note_how_the_williams_fw44_is_a_beautiful_car/,F1Technical,221689,1
Race Trace Plot for the 2023 Bahrain GP [OC],865,11nm65i,https://i.redd.it/kc6pjyb99wma1.png,55,1678446428.0,EdgeOfExceptional,0.98,/r/F1Technical/comments/11nm65i/race_trace_plot_for_the_2023_bahrain_gp_oc/,F1Technical,221689,1
Post-Season testing: The front wing of Alpines mule car,848,rge3ym,https://i.redd.it/844hw452zj581.png,49,1639507238.0,DaevChoons,0.99,/r/F1Technical/comments/rge3ym/postseason_testing_the_front_wing_of_alpines_mule/,F1Technical,221689,1
"Haven't seen this being brought up but Alfa Romeo had changed their coke bottle side pod design to a less undercut and seemingly less radical design in Imola and continue to run it in Miami. Top is new, bottom is old. Thoughts?",847,ukl7g7,https://i.redd.it/6ui20ac814y81.jpg,38,1651953879.0,Madhav_Taneja,0.99,/r/F1Technical/comments/ukl7g7/havent_seen_this_being_brought_up_but_alfa_romeo/,F1Technical,221689,1
Micheal Schumacher in Monza (2004 I believe). What were the driving characteristics of these cars and how do they compare to the present day cars with much higher downforce?,840,10ykptw,https://v.redd.it/jf6luxtmnbha1,138,1676017726.0,sebvettelstan,0.97,/r/F1Technical/comments/10ykptw/micheal_schumacher_in_monza_2004_i_believe_what/,F1Technical,221689,1
Pirelli Preview - Singapore 2022 @ Marina Bay,839,xoql18,https://i.redd.it/c6b5wiwwr8q91.jpg,50,1664214954.0,autobanh_me,0.99,/r/F1Technical/comments/xoql18/pirelli_preview_singapore_2022_marina_bay/,F1Technical,221689,1
What's the purpose of the second exhaust joining the main one ? Credit to f1sutton for the pic,833,tgk7p1,https://i.redd.it/5d0ev6d7d0o81.jpg,83,1647550908.0,Master_Reaction_703,0.99,/r/F1Technical/comments/tgk7p1/whats_the_purpose_of_the_second_exhaust_joining/,F1Technical,221689,1
I ran CFD on the 2021 Williams car. Link to the full results and images in the comments.,831,mwat7k,https://i.redd.it/cgsa6cmslru61.png,74,1619114781.0,Spacehead3,0.99,/r/F1Technical/comments/mwat7k/i_ran_cfd_on_the_2021_williams_car_link_to_the/,F1Technical,221689,1
Why did the 80s cars have such a long back? Makes it look like a boat,825,sjsf4n,https://i.redd.it/8vzg4mtx9of81.jpg,131,1643917741.0,DaManTheOne,0.98,/r/F1Technical/comments/sjsf4n/why_did_the_80s_cars_have_such_a_long_back_makes/,F1Technical,221689,1
Distribution of Upshift RPM for each team throughout 2022 Pre-Season Testing in Bahrain,822,tfmac9,https://i.redd.it/88ovqbdqxrn81.png,56,1647448872.0,DrivenByData_,0.99,/r/F1Technical/comments/tfmac9/distribution_of_upshift_rpm_for_each_team/,F1Technical,221689,1
Multiple Motorsports car length comparison,807,iw4iky,https://i.redd.it/k0n72z58d7o51.png,45,1600564112.0,16CLeclerc,0.99,/r/F1Technical/comments/iw4iky/multiple_motorsports_car_length_comparison/,F1Technical,221689,1
Are the new F1 cars running negative ackerman steering geometry ?,809,t61ylz,https://i.redd.it/28r3w5j4j8l81.jpg,57,1646342211.0,TheRicardoRedish,0.98,/r/F1Technical/comments/t61ylz/are_the_new_f1_cars_running_negative_ackerman/,F1Technical,221689,1
What is the advantage (or potential advantage) of these little individual protrusions?,808,115p4bp,https://i.redd.it/30e7oyrh80ja1.jpg,59,1676751325.0,bamiel,0.97,/r/F1Technical/comments/115p4bp/what_is_the_advantage_or_potential_advantage_of/,F1Technical,221689,1
A close-up shot of the incredibly complex Williams FW15C active suspension system,812,ln61y9,https://i.redd.it/43c7bzsvxci61.jpg,35,1613706996.0,SollarAce,1.0,/r/F1Technical/comments/ln61y9/a_closeup_shot_of_the_incredibly_complex_williams/,F1Technical,221689,1
Can someone explain how the DRS is going to work on the 2022 rear wing?,808,r1ctb1,https://i.redd.it/mhltkia9fl181.jpg,78,1637781364.0,Kamasutra08,0.98,/r/F1Technical/comments/r1ctb1/can_someone_explain_how_the_drs_is_going_to_work/,F1Technical,221689,1
"What are these crocodile teeth shaped fins at the cockpit called, and their purpose?",801,wx0i6j,https://i.redd.it/57759p3sfrj91.jpg,59,1661389951.0,beerusuuuuh,0.97,/r/F1Technical/comments/wx0i6j/what_are_these_crocodile_teeth_shaped_fins_at_the/,F1Technical,221689,1
Alpine flexible rearwing.,803,nd2ayw,https://v.redd.it/3gaxp86c6bz61,95,1621095043.0,RudieBatsbak,0.98,/r/F1Technical/comments/nd2ayw/alpine_flexible_rearwing/,F1Technical,221689,1
Structures inside sidepods of the williams,783,su3nvk,https://www.reddit.com/gallery/su3nvk,53,1645038512.0,FederalEngineer,0.99,/r/F1Technical/comments/su3nvk/structures_inside_sidepods_of_the_williams/,F1Technical,221689,1
I created a tutorial on how to create these plots in Python. Maybe a nice way to start the off-season for those interested! Check comments for link.,779,rh2745,https://i.redd.it/r0hk58hbaq581.png,33,1639583689.0,Nothing0,0.99,/r/F1Technical/comments/rh2745/i_created_a_tutorial_on_how_to_create_these_plots/,F1Technical,221689,1
The FIA is mandating teams place 12 10mm dots on their rear wings to track deformation from the onboard cameras,773,ns56nh,https://i.redd.it/0fkc5tdq39371.jpg,36,1622813452.0,DP_CFD,1.0,/r/F1Technical/comments/ns56nh/the_fia_is_mandating_teams_place_12_10mm_dots_on/,F1Technical,221689,1
Differences between the old and new Mercedes front wing end plate. It appears they have gone for a more aggressive approach in general.,762,uk4o9o,https://www.reddit.com/gallery/uk4o9o,62,1651894645.0,Madhav_Taneja,0.99,/r/F1Technical/comments/uk4o9o/differences_between_the_old_and_new_mercedes/,F1Technical,221689,1
"If purple means hydraulic, why is the plenum duct purple?",765,x16hi2,https://i.redd.it/7jdswelxbrk91.jpg,48,1661824502.0,beerusuuuuh,0.96,/r/F1Technical/comments/x16hi2/if_purple_means_hydraulic_why_is_the_plenum_duct/,F1Technical,221689,1
"Throwback to 1976: Ligier F1 introduce a larger and bulkier airbox to intentionally block air from the rear wing, and also improve the centre of gravity. Although the design philosophy was scrapped after a few races, I still find this cool to discuss.",763,105cit2,https://i.redd.it/rlm0g9ysjkaa1.jpg,44,1673056452.0,Madhav_Taneja,0.99,/r/F1Technical/comments/105cit2/throwback_to_1976_ligier_f1_introduce_a_larger/,F1Technical,221689,1
Some images of the MCL60's very aggressive sidepods,755,111en5t,https://www.reddit.com/gallery/111en5t,34,1676309081.0,vick5516,0.98,/r/F1Technical/comments/111en5t/some_images_of_the_mcl60s_very_aggressive_sidepods/,F1Technical,221689,1
Close up shot of the 2022 model car.( via noble Jon on Instagram),756,rzqf8g,https://www.reddit.com/gallery/rzqf8g,27,1641730417.0,ani_budihal,0.99,/r/F1Technical/comments/rzqf8g/close_up_shot_of_the_2022_model_car_via_noble_jon/,F1Technical,221689,1
Interesting end plate.,732,sxp46x,https://i.redd.it/zrut373fj5j81.jpg,59,1645434290.0,Rouxs05,0.99,/r/F1Technical/comments/sxp46x/interesting_end_plate/,F1Technical,221689,1
2021 F1 Season: Pit stops from round 1 to round 7,726,o6al5x,https://www.reddit.com/gallery/o6al5x,72,1624446368.0,f1bythenumbers,0.99,/r/F1Technical/comments/o6al5x/2021_f1_season_pit_stops_from_round_1_to_round_7/,F1Technical,221689,1
Ferrari uncovered,726,iso2f5,https://i.redd.it/4r6cu8by15n51.jpg,62,1600100223.0,Noname_Maddox,0.99,/r/F1Technical/comments/iso2f5/ferrari_uncovered/,F1Technical,221689,1
Ayrton Senna through the swimming pool section in 1990. What was the purpose of changing the track in that area?,723,11hqvca,https://v.redd.it/vsnje0kctnla1,34,1677908318.0,sebvettelstan,0.98,/r/F1Technical/comments/11hqvca/ayrton_senna_through_the_swimming_pool_section_in/,F1Technical,221689,1
"Attempting to answer ""What/where do I study to become an F1 Aerodynamicist?"" using LinkedIn statistics (N=97)",710,rmd46h,https://www.reddit.com/r/F1Technical/comments/rmd46h/attempting_to_answer_whatwhere_do_i_study_to/,76,1640202374.0,DP_CFD,0.98,/r/F1Technical/comments/rmd46h/attempting_to_answer_whatwhere_do_i_study_to/,F1Technical,221689,1
Tyre Deg Analysis - The Hards became faster than the Mediums only after 34 laps!,703,yjcn6h,https://i.redd.it/7e92ann25dx91.png,42,1667318735.0,F1DataAnalysis,0.97,/r/F1Technical/comments/yjcn6h/tyre_deg_analysis_the_hards_became_faster_than/,F1Technical,221689,1
Distribution of Top Speeds on DRS-laps for each team in Free Practice 2 at the 2022 Saudi Arabian Grand Prix,697,tokl01,https://i.redd.it/w0nhzgtx0pp81.png,60,1648285312.0,DrivenByData_,0.99,/r/F1Technical/comments/tokl01/distribution_of_top_speeds_on_drslaps_for_each/,F1Technical,221689,1
The real sidepods used by Mercedes during Silverstone filming for the W14,702,1134r7r,https://i.redd.it/xd06y0mnrfia1.jpg,73,1676485341.0,Master_Reaction_703,0.98,/r/F1Technical/comments/1134r7r/the_real_sidepods_used_by_mercedes_during/,F1Technical,221689,1
What is this measurement tool on Albon's head used for exactly?,695,s59t8j,https://i.redd.it/9wpapd15a1c81.jpg,35,1642331807.0,Fatamos,0.99,/r/F1Technical/comments/s59t8j/what_is_this_measurement_tool_on_albons_head_used/,F1Technical,221689,1
Austrian GP Qualification Q1-Q3 - Fastest driver in each of 25 mini sectors,693,vufzs3,https://i.redd.it/66sup1xgpda91.png,58,1657301141.0,TracingInsights,0.99,/r/F1Technical/comments/vufzs3/austrian_gp_qualification_q1q3_fastest_driver_in/,F1Technical,221689,1
Why are there ferrari logos on the Redbull Pitwall screens?,686,tpeh89,https://i.redd.it/1786bss8jvp81.jpg,67,1648364102.0,Zendaya-Papaya,0.94,/r/F1Technical/comments/tpeh89/why_are_there_ferrari_logos_on_the_redbull/,F1Technical,221689,1
"Found this, perhaps Merc found some more clever aero?",689,tadyba,https://i.redd.it/nl73axjggem81.jpg,40,1646849801.0,Chasedi9_9923,0.88,/r/F1Technical/comments/tadyba/found_this_perhaps_merc_found_some_more_clever/,F1Technical,221689,1
