title,score,id,url,num_comments,created,author,upvote_ratio,permalink,subreddit,subreddit_subscribers,depth
Started learning today and tried classifying my face using my facial recognition AI...,3524,e32pnx,https://i.redd.it/cx8vq9q98h141.jpg,147,1574968552.0,deztructicus,0.98,/r/learnmachinelearning/comments/e32pnx/started_learning_today_and_tried_classifying_my/,learnmachinelearning,287562,2
Machine Learning + Augmented Reality Project App Link and Github Code given in the comment,3276,ida21c,https://v.redd.it/g8fwo7f7q5i51,89,1597929246.0,TheInsaneApp,0.98,/r/learnmachinelearning/comments/ida21c/machine_learning_augmented_reality_project_app/,learnmachinelearning,287562,2
Solve your Rubik Cube using this AI+AR Powered App,3031,mgclfo,https://v.redd.it/ibclnhol35q61,45,1617098965.0,TheInsaneApp,0.96,/r/learnmachinelearning/comments/mgclfo/solve_your_rubik_cube_using_this_aiar_powered_app/,learnmachinelearning,287562,2
I am trying to make a game that learns how to play itself using reinforcement learning . Here is my first results . I am going to tweak the reward function and put more emphasis on smoothness .,2604,fz2lf4,https://v.redd.it/0o6clapp66s41,152,1586602663.0,Little_french_kev,0.99,/r/learnmachinelearning/comments/fz2lf4/i_am_trying_to_make_a_game_that_learns_how_to/,learnmachinelearning,287562,2
Machine Learning Pipelines,2561,mrhlyy,https://v.redd.it/6n4o74950dt61,96,1618502120.0,TheInsaneApp,0.98,/r/learnmachinelearning/comments/mrhlyy/machine_learning_pipelines/,learnmachinelearning,287562,2
A simple and easy-to-remember example for false positives and false negatives.,2541,mn1i08,https://i.redd.it/2ucd8yqqk0s61.jpg,53,1617915878.0,TheCodingBug,0.98,/r/learnmachinelearning/comments/mn1i08/a_simple_and_easytoremember_example_for_false/,learnmachinelearning,287562,2
Example of Multi-Agent Reinforcement Algorithms,2299,kmbpph,https://v.redd.it/crekjv7bp3861,39,1609236713.0,TheInsaneApp,0.99,/r/learnmachinelearning/comments/kmbpph/example_of_multiagent_reinforcement_algorithms/,learnmachinelearning,287562,2
Data cleaning is so must,1820,qpolnw,https://i.redd.it/7evreh7u3gy71.jpg,49,1636409417.0,harsh5161,0.99,/r/learnmachinelearning/comments/qpolnw/data_cleaning_is_so_must/,learnmachinelearning,287562,2
50 Free Machine Learning and Data Science Ebooks by DataScienceCentral/ Link is given in the comment section,1736,gzk4wz,https://i.redd.it/pfgocrtbyu351.jpg,103,1591696821.0,TheInsaneApp,0.99,/r/learnmachinelearning/comments/gzk4wz/50_free_machine_learning_and_data_science_ebooks/,learnmachinelearning,287562,2
I created opencv object tracker which can write in air,1700,gjkped,https://v.redd.it/e3gpkl78wpy41,117,1589456377.0,Pawan315,0.99,/r/learnmachinelearning/comments/gjkped/i_created_opencv_object_tracker_which_can_write/,learnmachinelearning,287562,2
After a week of training trying various parameters I finally managed to get an AI to learn how to play a game with an Xbox controller . I documented my journey here : https://youtu.be/zJdZ-RQ0Fks . That was pretty fun . I will try to do more of this type of stuff in the future .😁😁😁😁,1552,g3pedv,https://v.redd.it/kufymsw6ilt41,49,1587224062.0,Little_french_kev,0.99,/r/learnmachinelearning/comments/g3pedv/after_a_week_of_training_trying_various/,learnmachinelearning,287562,2
"Identical Twins no longer fool Visual AI! - (BTW: I'm the black dude from 2 weeks ago whose AI kept classifying as Obama lol 😅). I gotta say, I'm pretty happy with this progress! ^__^",1556,eb0p4v,https://i.redd.it/zmdqnliwlt441.jpg,90,1576426278.0,deztructicus,0.97,/r/learnmachinelearning/comments/eb0p4v/identical_twins_no_longer_fool_visual_ai_btw_im/,learnmachinelearning,287562,2
"Difference in Image Classification, Semantic Segmentation, Object Detection, and Instance Segmentation",1520,kt0hov,https://i.redd.it/apse69opd3a61.jpg,23,1610104550.0,TheCodingBug,0.98,/r/learnmachinelearning/comments/kt0hov/difference_in_image_classification_semantic/,learnmachinelearning,287562,2
I printed a second Xbox arm controller and decided to have an air hockey AI battle . I used unity to make the game and unity ml-agent to handle all the reinforcement learning thing . It is sim to real which I am quite happy to have achieved even if there is so much that could be improved .,1514,hda70m,https://v.redd.it/kr30k98bma651,77,1592758450.0,Little_french_kev,0.99,/r/learnmachinelearning/comments/hda70m/i_printed_a_second_xbox_arm_controller_and/,learnmachinelearning,287562,2
Still a work in progress but I trained an agent in Unity (ML-agent package) to drive an RC car through gates . I am planning to get it to control a real RC car . I have been told many times that I should not go thought the actual controller but I like making these little robots too much!,1501,pygbye,https://v.redd.it/2zqxkiyz0mq71,52,1632994598.0,Little_french_kev,0.99,/r/learnmachinelearning/comments/pygbye/still_a_work_in_progress_but_i_trained_an_agent/,learnmachinelearning,287562,2
This AI Reveals How much time politicians stare at their phone at work,1472,oi0i0r,https://i.redd.it/fae2zvz2kja71.jpg,55,1625990850.0,vadhavaniyafaijan,0.97,/r/learnmachinelearning/comments/oi0i0r/this_ai_reveals_how_much_time_politicians_stare/,learnmachinelearning,287562,2
Types of Machine Learning Papers,1411,n2ful7,https://i.redd.it/kzhj4qzkmhw61.jpg,37,1619865604.0,vadhavaniyafaijan,0.99,/r/learnmachinelearning/comments/n2ful7/types_of_machine_learning_papers/,learnmachinelearning,287562,2
Built a Real-time Sudoku Solver! Basic Image Processing + a little Deep Learning. It's quite intriguing how simple pieces of codes can do magical stuff! Check the thread for the GitHub repo and references!,1408,hu1rvq,https://v.redd.it/af8g5evivtb51,58,1595170625.0,jumper_oj,0.98,/r/learnmachinelearning/comments/hu1rvq/built_a_realtime_sudoku_solver_basic_image/,learnmachinelearning,287562,2
This is a project to create artificial painting. The first steps look good. I use tensorflow and Python.,1367,ih4gmd,https://i.redd.it/j1t2n9854ej51.jpg,31,1598466731.0,gbbb1982,0.99,/r/learnmachinelearning/comments/ih4gmd/this_is_a_project_to_create_artificial_painting/,learnmachinelearning,287562,2
Neural Networks Cheat Sheet,1338,es5fr0,https://i.redd.it/x5tbb33fr8c41.png,74,1579660250.0,The-AI-Guy,0.92,/r/learnmachinelearning/comments/es5fr0/neural_networks_cheat_sheet/,learnmachinelearning,287562,2
Looks like my Python Environment after 1 year of coding,1324,ioafgt,https://i.redd.it/ux234arc3rl51.jpg,93,1599495451.0,3DataGuys,0.99,/r/learnmachinelearning/comments/ioafgt/looks_like_my_python_environment_after_1_year_of/,learnmachinelearning,287562,2
Do one push up every time you blame the data,1303,qwr2jo,https://i.redd.it/4ea2ja7t7d081.jpg,8,1637246143.0,harsh5161,0.98,/r/learnmachinelearning/comments/qwr2jo/do_one_push_up_every_time_you_blame_the_data/,learnmachinelearning,287562,2
"ML Meme War- This is one of my favourite Machine Learning Memes, what´s yours?",1292,cqb7b8,https://i.redd.it/nc5ua4x8lfg31.png,42,1565796388.0,conradws,0.98,/r/learnmachinelearning/comments/cqb7b8/ml_meme_war_this_is_one_of_my_favourite_machine/,learnmachinelearning,287562,2
Immerse yourself with code,1284,gls05o,https://v.redd.it/lywpecqvffz41,57,1589765730.0,wstcpyt1988,0.96,/r/learnmachinelearning/comments/gls05o/immerse_yourself_with_code/,learnmachinelearning,287562,2
What do you use?,1274,gvmedk,https://i.redd.it/4jf66c8z9m251.jpg,61,1591155927.0,rtthatbrownguy,0.97,/r/learnmachinelearning/comments/gvmedk/what_do_you_use/,learnmachinelearning,287562,2
Real Time Recognition of Handwritten Math Functions and Predicting their Graphs using Machine Learning,1265,pjmo84,https://v.redd.it/fhlzn5tcc1m71,28,1631019896.0,vadhavaniyafaijan,0.98,/r/learnmachinelearning/comments/pjmo84/real_time_recognition_of_handwritten_math/,learnmachinelearning,287562,2
"Me trying ML for the first time, what could possibly go wrong?",1226,r1ky72,https://v.redd.it/c9msqigndn181,24,1637805041.0,harsh5161,0.96,/r/learnmachinelearning/comments/r1ky72/me_trying_ml_for_the_first_time_what_could/,learnmachinelearning,287562,2
I made an Infographic to summarise K-means clustering in simple english. Let me know what you think!,1225,kipra3,https://i.redd.it/g16w49p2hw661.png,57,1608714209.0,spiyer991,1.0,/r/learnmachinelearning/comments/kipra3/i_made_an_infographic_to_summarise_kmeans/,learnmachinelearning,287562,2
Machine learning experiment,1214,hp9627,https://v.redd.it/ooul9pho18a51,59,1594470437.0,OmrieBE,0.98,/r/learnmachinelearning/comments/hp9627/machine_learning_experiment/,learnmachinelearning,287562,2
Reality! What's your thought about this?,1193,q79bh0,https://i.redd.it/kp5axvp0k5t71.jpg,62,1634125328.0,vadhavaniyafaijan,0.98,/r/learnmachinelearning/comments/q79bh0/reality_whats_your_thought_about_this/,learnmachinelearning,287562,2
"Happy 2021 Everyone , Stay Healthy & Happy",1186,knubje,https://v.redd.it/vzrjwkb5sj861,19,1609436247.0,paypaytr,0.98,/r/learnmachinelearning/comments/knubje/happy_2021_everyone_stay_healthy_happy/,learnmachinelearning,287562,2
Trying to keep my Jump Rope and AI Skills on point! Made this application using OpenPose. Link to the Medium tutorial and the GitHub Repo in the thread.,1175,j05rte,https://v.redd.it/jh5n48ghrhp51,29,1601125855.0,jumper_oj,0.99,/r/learnmachinelearning/comments/j05rte/trying_to_keep_my_jump_rope_and_ai_skills_on/,learnmachinelearning,287562,2
Deep Learning Activation Functions using Dance Moves,1168,lvehmi,https://i.redd.it/sylrjb6e8gk61.jpg,19,1614618549.0,TheInsaneApp,0.96,/r/learnmachinelearning/comments/lvehmi/deep_learning_activation_functions_using_dance/,learnmachinelearning,287562,2
Real Life MARIO ... my 4hrs of work,1129,ibrpgs,https://v.redd.it/du0tz01s0oh51,48,1597714830.0,Pawan315,0.98,/r/learnmachinelearning/comments/ibrpgs/real_life_mario_my_4hrs_of_work/,learnmachinelearning,287562,2
All Stanford AI courses (100% free!),1132,f3z8ug,https://twitter.com/rickwierenga/status/1228432865878253572,53,1581716251.0,RickDeveloper,0.99,/r/learnmachinelearning/comments/f3z8ug/all_stanford_ai_courses_100_free/,learnmachinelearning,287562,2
I wrote an O'Reilly book on TensorFlow.js,1107,lwbi0z,https://www.reddit.com/gallery/lwbi0z,88,1614716395.0,GantMan,0.98,/r/learnmachinelearning/comments/lwbi0z/i_wrote_an_oreilly_book_on_tensorflowjs/,learnmachinelearning,287562,2
🔥 Machine Learning + JavaScript + TensorFlow = Superpower / Full Video Link in Comments (Via TensorFlow),1088,k59z78,https://v.redd.it/tvjmkn288s261,20,1606918563.0,TheInsaneApp,0.98,/r/learnmachinelearning/comments/k59z78/machine_learning_javascript_tensorflow_superpower/,learnmachinelearning,287562,2
Red light green light using python,1079,qe2dy4,https://v.redd.it/o3tyqfcag6v71,27,1634985084.0,Pawan315,0.98,/r/learnmachinelearning/comments/qe2dy4/red_light_green_light_using_python/,learnmachinelearning,287562,2
The Goddam Truth...,1077,e0cws2,https://i.imgur.com/9DbfqEz.jpg,58,1574482767.0,conradws,0.98,/r/learnmachinelearning/comments/e0cws2/the_goddam_truth/,learnmachinelearning,287562,2
Not every problem needs Deep Learning. But how to be sure when to use traditional machine learning algorithms and when to switch to the deep learning side?,1059,l0nxvg,https://i.redd.it/q0jzfru6lbc61.png,36,1611075612.0,TheCodingBug,0.99,/r/learnmachinelearning/comments/l0nxvg/not_every_problem_needs_deep_learning_but_how_to/,learnmachinelearning,287562,2
How is one supposed to keep up with that?,1052,qsbco1,https://i.redd.it/5plk6k1446z71.jpg,66,1636724289.0,Ottzel3,0.98,/r/learnmachinelearning/comments/qsbco1/how_is_one_supposed_to_keep_up_with_that/,learnmachinelearning,287562,2
Types of Machine Learning Papers,1053,o7uha6,https://i.redd.it/5xsi6j26pg771.jpg,47,1624648694.0,TheInsaneApp,0.97,/r/learnmachinelearning/comments/o7uha6/types_of_machine_learning_papers/,learnmachinelearning,287562,2
iperdance github in description which can transfer motion from video to single image,1030,kj6e6y,https://v.redd.it/vknxnv4sk1761,25,1608775142.0,Pawan315,0.99,/r/learnmachinelearning/comments/kj6e6y/iperdance_github_in_description_which_can/,learnmachinelearning,287562,2
"Demo of the Convolutional Network Face Detector built at NEC Labs in 2003 by Rita Osadchy, Matt Miller and Yann LeCun / Credits: Yann LeCun YouTube Channel",1023,kuwk8b,https://v.redd.it/v5x6tyzl7na61,26,1610344587.0,TheInsaneApp,0.99,/r/learnmachinelearning/comments/kuwk8b/demo_of_the_convolutional_network_face_detector/,learnmachinelearning,287562,2
"Should have read *binary* classifier, but ok...",1020,qhkyxu,https://i.redd.it/ovxlpeeyf6w71.jpg,19,1635420796.0,larsupilami73,0.98,/r/learnmachinelearning/comments/qhkyxu/should_have_read_binary_classifier_but_ok/,learnmachinelearning,287562,2
Second ML experiment feeding abstract art,1013,hcp47m,https://v.redd.it/ijxeahb9d3651,29,1592670441.0,OmrieBE,0.99,/r/learnmachinelearning/comments/hcp47m/second_ml_experiment_feeding_abstract_art/,learnmachinelearning,287562,2
Different types of distances used in ML,993,v13zuw,https://i.redd.it/xihpg7k34n291.jpg,33,1653928177.0,eforebrahim,0.97,/r/learnmachinelearning/comments/v13zuw/different_types_of_distances_used_in_ml/,learnmachinelearning,287562,2
Get personalised roadmaps for learning ML,991,ot9df4,https://v.redd.it/l2a020lbbyd71,47,1627477084.0,Ok-Craft-9908,0.99,/r/learnmachinelearning/comments/ot9df4/get_personalised_roadmaps_for_learning_ml/,learnmachinelearning,287562,2
Image Classification with Pytorch,980,gpmei2,https://v.redd.it/03fxw48cfo051,28,1590310301.0,wstcpyt1988,0.98,/r/learnmachinelearning/comments/gpmei2/image_classification_with_pytorch/,learnmachinelearning,287562,2
An Interesting Map Of Computer Science - What's Missing?,976,ifnrvi,https://i.redd.it/9hlz8wi0zxi51.png,63,1598271095.0,TheInsaneApp,0.96,/r/learnmachinelearning/comments/ifnrvi/an_interesting_map_of_computer_science_whats/,learnmachinelearning,287562,2
Curve fitting method,960,yzlnr7,https://i.redd.it/zlnxx071h01a1.jpg,10,1668890749.0,st1275857,0.97,/r/learnmachinelearning/comments/yzlnr7/curve_fitting_method/,learnmachinelearning,287562,2
How to look smart in ML meeting pretending to make any sense,955,rfilee,https://i.redd.it/hk9s2fjwyb581.png,29,1639410306.0,AdelSexy,0.97,/r/learnmachinelearning/comments/rfilee/how_to_look_smart_in_ml_meeting_pretending_to/,learnmachinelearning,287562,2
I found a paper on neural style transfer and I think this is a great paper to implement for a beginner like me ... link in the comments if anybody else wants to give it a shot,950,llstam,https://i.redd.it/hamulbt111i61.png,89,1613562798.0,wilhelmberghammer,0.99,/r/learnmachinelearning/comments/llstam/i_found_a_paper_on_neural_style_transfer_and_i/,learnmachinelearning,287562,2
Andrew Ng’s Machine Learning course is relaunching in Python in June 2022,939,uhbm08,https://www.deeplearning.ai/program/machine-learning-specialization/,76,1651567203.0,leej11,0.99,/r/learnmachinelearning/comments/uhbm08/andrew_ngs_machine_learning_course_is_relaunching/,learnmachinelearning,287562,2
Real life contra using python,939,s59w80,https://v.redd.it/3xjshmbja1c81,33,1642332135.0,Pawan315,0.98,/r/learnmachinelearning/comments/s59w80/real_life_contra_using_python/,learnmachinelearning,287562,2
Variance And Bias Cheatsheet,933,fbmeud,https://i.redd.it/yijts052oyj41.jpg,33,1583024862.0,wstcpyt1988,0.96,/r/learnmachinelearning/comments/fbmeud/variance_and_bias_cheatsheet/,learnmachinelearning,287562,2
4 Data Science Algorithms Explained in Infographics,918,o519ji,https://i.imgur.com/PrOjsKK.jpg,22,1624298450.0,spiyer991,0.98,/r/learnmachinelearning/comments/o519ji/4_data_science_algorithms_explained_in/,learnmachinelearning,287562,2
Playing tekken using python (code in comments),916,skcr5q,https://v.redd.it/i7dy4nnactf81,20,1643979692.0,Pawan315,0.96,/r/learnmachinelearning/comments/skcr5q/playing_tekken_using_python_code_in_comments/,learnmachinelearning,287562,2
Linear Regression | Visualizing Squared Errors,907,xyk2si,https://v.redd.it/owtd5n1tlis91,29,1665205688.0,RacerRex9727,0.99,/r/learnmachinelearning/comments/xyk2si/linear_regression_visualizing_squared_errors/,learnmachinelearning,287562,2
Painted from image by learned neural networks,910,m22261,https://i.redd.it/pt6v74qjd8m61.jpg,42,1615395190.0,gbbb1982,0.98,/r/learnmachinelearning/comments/m22261/painted_from_image_by_learned_neural_networks/,learnmachinelearning,287562,2
"Using StyleGANs to recreate faces in historical paintings 🖼 You can clearly observe the depth of clarity, accuracy and precision in the outputs on the right. Truly amazing! More like these can be found on Nathan Shipley’s IG Account: https://lnkd.in/d3BYmUM",885,kyh92z,https://i.redd.it/nidzpsgzhob61.jpg,22,1610795995.0,Mskhan_1,0.98,/r/learnmachinelearning/comments/kyh92z/using_stylegans_to_recreate_faces_in_historical/,learnmachinelearning,287562,2
Playing mario using python.,868,qn6mti,https://v.redd.it/yrpozkmpnqx71,42,1636101393.0,Pawan315,0.98,/r/learnmachinelearning/comments/qn6mti/playing_mario_using_python/,learnmachinelearning,287562,2
AI That Can Potentially Solve Bandwidth Problems for Video Calls (NVIDIA Maxine),858,jd2qpt,https://youtu.be/XuiGKsJ0sR0,41,1602967274.0,cloud_weather,0.98,/r/learnmachinelearning/comments/jd2qpt/ai_that_can_potentially_solve_bandwidth_problems/,learnmachinelearning,287562,2
"A pretty cool visualization of the Data Science and AI landscape! 🔭 Almost all of these different fields stem from the core Programming branch which I personally believe is a necessity not only for CS students but for everyone, regardless of their field of choice.",844,l1hx6e,https://i.redd.it/x9y0wb5ysjc61.jpg,60,1611174998.0,Mskhan_1,0.89,/r/learnmachinelearning/comments/l1hx6e/a_pretty_cool_visualization_of_the_data_science/,learnmachinelearning,287562,2
AI basketball analysis web App and API,837,gf6zl8,https://i.redd.it/ddymeguslcx41.gif,43,1588859739.0,chonyyy,1.0,/r/learnmachinelearning/comments/gf6zl8/ai_basketball_analysis_web_app_and_api/,learnmachinelearning,287562,2
Deep Reinforcement Learning Neural Network,803,q9dvfp,https://v.redd.it/6tx0ee81bkt71,14,1634397023.0,vadhavaniyafaijan,0.97,/r/learnmachinelearning/comments/q9dvfp/deep_reinforcement_learning_neural_network/,learnmachinelearning,287562,2
"Convolution Neural Networks Visualization using Unity 3D, C# and Python",770,q1s5w1,https://v.redd.it/7wb7z6c3vkr71,20,1633422662.0,vadhavaniyafaijan,0.99,/r/learnmachinelearning/comments/q1s5w1/convolution_neural_networks_visualization_using/,learnmachinelearning,287562,2
Support Vector Machines: All you need to know!,769,he8yjz,https://v.redd.it/o7fnbh6lll651,40,1592891226.0,wstcpyt1988,0.96,/r/learnmachinelearning/comments/he8yjz/support_vector_machines_all_you_need_to_know/,learnmachinelearning,287562,2
I Used Deep Learning To Detect Naruto (Anime Series) Hand Signs [I Made This],766,fowydr,https://youtu.be/mCcla6k3lXA,46,1585166098.0,oFlamingo,0.96,/r/learnmachinelearning/comments/fowydr/i_used_deep_learning_to_detect_naruto_anime/,learnmachinelearning,287562,2
[Update] Shooting pose analysis and basketball shot detection [GitHub repo in comment],762,gte2zu,https://i.redd.it/zah2ip9cjw151.gif,43,1590844384.0,chonyyy,0.99,/r/learnmachinelearning/comments/gte2zu/update_shooting_pose_analysis_and_basketball_shot/,learnmachinelearning,287562,2
Removing NAs from data be like,754,qqh6pv,https://i.redd.it/poqvkkliuny71.jpg,37,1636503137.0,harsh5161,0.97,/r/learnmachinelearning/comments/qqh6pv/removing_nas_from_data_be_like/,learnmachinelearning,287562,2
Classification of Machine Learning Tools,754,gqwtyu,https://i.redd.it/quxbdgm704151.png,44,1590498870.0,TheInsaneApp,0.93,/r/learnmachinelearning/comments/gqwtyu/classification_of_machine_learning_tools/,learnmachinelearning,287562,2
"Started learning ML 14 months ago, now I'm using GPT-3 to automate CVs!",749,oa7x3p,https://gfycat.com/ambitioushauntingagama,53,1624972025.0,Camjw1123,0.97,/r/learnmachinelearning/comments/oa7x3p/started_learning_ml_14_months_ago_now_im_using/,learnmachinelearning,287562,2
Basic Anatomy of Matplotlib,748,v4r7wn,https://i.redd.it/y7wezafqhm391.png,33,1654356536.0,Otherwise_Lab_4638,0.97,/r/learnmachinelearning/comments/v4r7wn/basic_anatomy_of_matplotlib/,learnmachinelearning,287562,2
Activation Functions Cheat Sheet,746,eoaq5c,https://i.redd.it/3ou01m7q6ma41.png,34,1578951107.0,The-AI-Guy,0.98,/r/learnmachinelearning/comments/eoaq5c/activation_functions_cheat_sheet/,learnmachinelearning,287562,2
A few weeks ago I made a little robot playing a game . This time I wanted it to play from visual input only like a human player would . Because the game is so simple I only used basic image classification . It sort of working but still needs a lot of improvement .,740,gp2s5q,https://v.redd.it/qf2u400tsh051,45,1590230330.0,Little_french_kev,0.99,/r/learnmachinelearning/comments/gp2s5q/a_few_weeks_ago_i_made_a_little_robot_playing_a/,learnmachinelearning,287562,2
Data visualisation in Python,726,f6ffod,https://i.redd.it/ep7p20b5hxh41.png,37,1582138712.0,RickDeveloper,0.97,/r/learnmachinelearning/comments/f6ffod/data_visualisation_in_python/,learnmachinelearning,287562,2
"AI play T rex game based on screenshot, using reinforcement learning.(sorry for not using screenshot as my Macbook pro cannot handle the intense computation)",723,f238ey,https://i.redd.it/wqv2ge6d48g41.gif,43,1581396039.0,zhangzhuyan,0.98,/r/learnmachinelearning/comments/f238ey/ai_play_t_rex_game_based_on_screenshot_using/,learnmachinelearning,287562,2
I visualised K-means clustering using 3Blue1Brown's animation library (manim),713,hipfih,https://i.redd.it/6zlk0zo2f2851.gif,20,1593530717.0,guyi567,0.99,/r/learnmachinelearning/comments/hipfih/i_visualised_kmeans_clustering_using_3blue1browns/,learnmachinelearning,287562,2
Hi r/learnmachinelearning! I built a visual clustering algo that organizes a random sets of images into visually similar groups. What cool things could I use this for?,704,gcqphx,https://i.redd.it/vn1ori4xyjw41.png,86,1588513008.0,_conquistador,0.99,/r/learnmachinelearning/comments/gcqphx/hi_rlearnmachinelearning_i_built_a_visual/,learnmachinelearning,287562,2
gradient descent visualisation in linear regression.,699,enleb8,https://i.redd.it/iq5wif6ycba41.gif,37,1578820334.0,zhangzhuyan,0.99,/r/learnmachinelearning/comments/enleb8/gradient_descent_visualisation_in_linear/,learnmachinelearning,287562,2
Hi r/learnmachinelearning! I built a Jupyter notebook add-in that autogenerates data science Python code from simple natural language. What do you think?,698,p6c61u,https://i.redd.it/x1pw2i53dzh71.gif,23,1629233268.0,_conquistador,0.98,/r/learnmachinelearning/comments/p6c61u/hi_rlearnmachinelearning_i_built_a_jupyter/,learnmachinelearning,287562,2
Data Science Interview Question from Facebook,699,i5gn0s,https://i.redd.it/47kq2kraulf51.png,44,1596816684.0,3DataGuys,0.97,/r/learnmachinelearning/comments/i5gn0s/data_science_interview_question_from_facebook/,learnmachinelearning,287562,2
"Take a look at this machine learning cheat sheet for the top machine learning algorithms, their advantages and disadvantages, and key use-cases.",692,urkba6,https://i.redd.it/59aiqy4du0091.jpg,35,1652786916.0,joanna58,0.97,/r/learnmachinelearning/comments/urkba6/take_a_look_at_this_machine_learning_cheat_sheet/,learnmachinelearning,287562,2
Is PCA the best way to reduce dimensionality?,687,r42ner,https://i.redd.it/g91iakhbrb281.jpg,55,1638100193.0,harsh5161,0.98,/r/learnmachinelearning/comments/r42ner/is_pca_the_best_way_to_reduce_dimensionality/,learnmachinelearning,287562,2
I created speed measuring project which with just webcam can measure speed even in low lights and fast motion...,689,gn6j4h,https://v.redd.it/dhcvihyrbvz41,62,1589958005.0,Pawan315,0.96,/r/learnmachinelearning/comments/gn6j4h/i_created_speed_measuring_project_which_with_just/,learnmachinelearning,287562,2
LSTM Visualized,676,smindi,https://v.redd.it/afzlbpt2ncg81,32,1644212978.0,vadhavaniyafaijan,0.98,/r/learnmachinelearning/comments/smindi/lstm_visualized/,learnmachinelearning,287562,2
Do Statisticians like programming?,680,qrq990,https://i.redd.it/lm21o8b140z71.jpg,70,1636651621.0,harsh5161,0.95,/r/learnmachinelearning/comments/qrq990/do_statisticians_like_programming/,learnmachinelearning,287562,2
[Project]YOLOR Object Detection for Rapid Website Code Generation,669,ptxr75,https://v.redd.it/odrpz1eou9p71,27,1632411096.0,NickFortez06,0.98,/r/learnmachinelearning/comments/ptxr75/projectyolor_object_detection_for_rapid_website/,learnmachinelearning,287562,2
We Built IntelliBrush - An AI Labeller Using Neural Networks and CV,665,qij16b,https://v.redd.it/nck5u6omlfw71,19,1635531693.0,xusty,0.99,/r/learnmachinelearning/comments/qij16b/we_built_intellibrush_an_ai_labeller_using_neural/,learnmachinelearning,287562,2
Data Visualization Cheat Sheet by Dr. Andrew Abela,658,va2omm,https://i.redd.it/f4j4wz7s41591.jpg,10,1654969605.0,eforebrahim,0.99,/r/learnmachinelearning/comments/va2omm/data_visualization_cheat_sheet_by_dr_andrew_abela/,learnmachinelearning,287562,2
k-Means clustering: Visually explained,649,qq2lh6,https://v.redd.it/ky9xtjl6cky71,37,1636460839.0,Va_Linor,1.0,/r/learnmachinelearning/comments/qq2lh6/kmeans_clustering_visually_explained/,learnmachinelearning,287562,2
Mathematics for Machine Learning,649,whi3rt,https://i.redd.it/luvfhrqql1g91.png,68,1659769687.0,instituteprograms,0.93,/r/learnmachinelearning/comments/whi3rt/mathematics_for_machine_learning/,learnmachinelearning,287562,2
Statistics vs Geography,637,qkf0ku,https://i.redd.it/qc1eqp9ktzw71.jpg,29,1635776403.0,harsh5161,0.94,/r/learnmachinelearning/comments/qkf0ku/statistics_vs_geography/,learnmachinelearning,287562,2
I trained a Falcon 9 Rocket with PPO/SAC/D4PG,637,hhetqm,https://i.redd.it/hocqi47dqn751.gif,28,1593352794.0,paypaytr,0.98,/r/learnmachinelearning/comments/hhetqm/i_trained_a_falcon_9_rocket_with_pposacd4pg/,learnmachinelearning,287562,2
