title,score,id,url,num_comments,created,author,upvote_ratio,permalink,subreddit,subreddit_subscribers,depth
One thing I think made Donna stand out from other new era companions was that she was empathetic rather than sympathetic towards others suffering. Her reactions to Pompeii and the Ood really made it feel like parts of her were dying alongside those around her.,3308,z7gdcr,https://i.redd.it/ojpq641tbu2a1.jpg,167,1669688045.0,Jackmac32,0.99,/r/doctorwho/comments/z7gdcr/one_thing_i_think_made_donna_stand_out_from_other/,doctorwho,504481,2
Who doesn't love a bit of Rory?,3306,at9ig0,https://i.redd.it/qiaoh50b10i21.jpg,133,1550788640.0,TheMasterMelon-,0.98,/r/doctorwho/comments/at9ig0/who_doesnt_love_a_bit_of_rory/,doctorwho,504481,2
Give him a mate.....,3271,b3rce3,https://i.redd.it/8veygey8ihn21.jpg,191,1553179415.0,Lowcrbnaman,0.97,/r/doctorwho/comments/b3rce3/give_him_a_mate/,doctorwho,504481,2
peter capaldi is such an underrated doctor!,3239,vkeied,https://v.redd.it/zpt2us29lr791,209,1656161796.0,bewarethechameleon,0.95,/r/doctorwho/comments/vkeied/peter_capaldi_is_such_an_underrated_doctor/,doctorwho,504481,2
Don’t think this has ever felt more relevant,3237,knat6z,https://i.redd.it/8c222vcw2e861.jpg,93,1609362309.0,Jackmac32,0.99,/r/doctorwho/comments/knat6z/dont_think_this_has_ever_felt_more_relevant/,doctorwho,504481,2
My Granny died 2 days ago suddenly in her sleep. She was the main carer for my Grandpa who is 97. She was 86 so we all thought he’d go first. He has outlived all his younger siblings and almost all of his friends and now his wife of 68 years. I can’t stop thinking about this line,3229,bywbqs,https://i.redd.it/yaju5lr7di331.jpg,42,1560163376.0,SparkyMcKenzie,0.98,/r/doctorwho/comments/bywbqs/my_granny_died_2_days_ago_suddenly_in_her_sleep/,doctorwho,504481,2
Find someone who looks at you the same way The Master looks at himself!,3223,83xmj8,https://i.redd.it/xiz6epastdl01.jpg,93,1520882095.0,TheHip141991,0.94,/r/doctorwho/comments/83xmj8/find_someone_who_looks_at_you_the_same_way_the/,doctorwho,504481,2
A Dalek’s Perspective,3215,ilzbk7,https://i.redd.it/1ls4jps09zk51.jpg,134,1599158260.0,ananizapta,0.98,/r/doctorwho/comments/ilzbk7/a_daleks_perspective/,doctorwho,504481,2
I can’t help but smile every time I see this...,3203,bh8pcw,https://i.redd.it/5o5gmvg1yeu21.jpg,74,1556199319.0,R4wly1997,0.98,/r/doctorwho/comments/bh8pcw/i_cant_help_but_smile_every_time_i_see_this/,doctorwho,504481,2
I see a lot of people complaining about the potential damage to cannon and continuity and I felt like we all need reminding of one of the Doctor’s most important lessons,3205,ev208y,https://i.redd.it/td1qiaybvgd41.jpg,776,1580194265.0,SparkyMcKenzie,0.9,/r/doctorwho/comments/ev208y/i_see_a_lot_of_people_complaining_about_the/,doctorwho,504481,2
"I'm still sad about the guy with the stutter who tries to call to Donna at the end of ""Forest of the Dead""",3154,xow0ua,https://i.imgur.com/09qlGDN.jpg,130,1664226707.0,schlitt88,0.98,/r/doctorwho/comments/xow0ua/im_still_sad_about_the_guy_with_the_stutter_who/,doctorwho,504481,2
Dark Side VS Light,3145,lc3zoj,https://i.redd.it/1wbnx0yj5df61.jpg,229,1612402043.0,bartarton,0.95,/r/doctorwho/comments/lc3zoj/dark_side_vs_light/,doctorwho,504481,2
One of my favorite 12th Doctor quotes,3128,5j226v,https://i.reddituploads.com/62bef30b62d746a08502d979bef051de?fit=max&h=1536&w=1536&s=63e29f3b0a7f370fe5624183a2ca1b11,42,1482091585.0,JakeM917,0.93,/r/doctorwho/comments/5j226v/one_of_my_favorite_12th_doctor_quotes/,doctorwho,504481,2
