title,score,id,url,num_comments,created,author,upvote_ratio,permalink,subreddit,subreddit_subscribers,depth
"This really resonated with me: I find it odd when people take such pride in telling me ""I would never have guess you were gay!"" like covert homoing is innately better than being camp, a ""good"" gay thing? You just some how double insulted me, Steve from IT.",3634,mlegsp,https://i.redd.it/fzs9k3y9afr61.jpg,226,1617723533.0,Ellen_Degenerates86,0.97,/r/gaybros/comments/mlegsp/this_really_resonated_with_me_i_find_it_odd_when/,gaybros,377070,2
had This Conversation More than Once,3623,drj6io,https://i.redd.it/0s2ega5ruow31.png,211,1572881518.0,KingOfCranes,0.96,/r/gaybros/comments/drj6io/had_this_conversation_more_than_once/,gaybros,377070,2
Someone needed to say it,3618,9bb2uh,https://i.redd.it/128djojfc2j11.jpg,294,1535561911.0,CbusLawyer,0.95,/r/gaybros/comments/9bb2uh/someone_needed_to_say_it/,gaybros,377070,2
Damn straight...,3610,egc14o,https://i.redd.it/md7ma61pz5741.jpg,65,1577458291.0,IndyMLVC,0.98,/r/gaybros/comments/egc14o/damn_straight/,gaybros,377070,2
How has serving (in the U.S. Army) impacted you?,3600,gf4e08,https://i.redd.it/g1w3fw1syax41.jpg,104,1588848959.0,CheddarCurtainExile,0.97,/r/gaybros/comments/gf4e08/how_has_serving_in_the_us_army_impacted_you/,gaybros,377070,2
Is this even legal? 😳,3563,tptxha,https://i.redd.it/ejlxa4q8xzp81.jpg,180,1648417234.0,bett3r,0.95,/r/gaybros/comments/tptxha/is_this_even_legal/,gaybros,377070,2
He might need a full body search,3524,rrgzs3,https://v.redd.it/ciwx5wpodj881,210,1640807617.0,bett3r,0.97,/r/gaybros/comments/rrgzs3/he_might_need_a_full_body_search/,gaybros,377070,2
JFK and his best friend Lem Billings who was gay. These pictures are so wholesome.,3518,jyojpk,https://www.reddit.com/gallery/jyojpk,130,1606015092.0,dj1041,0.99,/r/gaybros/comments/jyojpk/jfk_and_his_best_friend_lem_billings_who_was_gay/,gaybros,377070,2
At the Nurses Strike in Australia,3516,stva6c,https://i.redd.it/lxvvyfxc07i81.jpg,59,1645016266.0,PeasKhichra,0.98,/r/gaybros/comments/stva6c/at_the_nurses_strike_in_australia/,gaybros,377070,2
Some of you requested a new picture of my husband and me,3508,10d82ef,https://i.redd.it/vqh4fex8deca1.jpg,103,1673853301.0,Bukakkonaut,0.96,/r/gaybros/comments/10d82ef/some_of_you_requested_a_new_picture_of_my_husband/,gaybros,377070,2
Gay dads adopt 6 siblings to stop them being separated,3501,hezius,https://i.redd.it/bhuhxzbf2r651.jpg,95,1592998867.0,CheddarCurtainExile,0.99,/r/gaybros/comments/hezius/gay_dads_adopt_6_siblings_to_stop_them_being/,gaybros,377070,2
