title,score,id,url,num_comments,created,author,upvote_ratio,permalink,subreddit,subreddit_subscribers,depth
Greatest Raptor of all time. Upvote so this shows up before Kawhi Leonard when you search up “greatest raptor of all time”,19945,cceiqr,https://i.imgur.com/X9pVyWh.jpg,541,1562955466.0,brownjesus__,0.82,/r/torontoraptors/comments/cceiqr/greatest_raptor_of_all_time_upvote_so_this_shows/,torontoraptors,380953,2
NBA Champion. Upvote so this is the first image that shows up when you search “NBA Champion”.,14409,c0nmph,https://i.imgur.com/ijTnVzF.jpg,118,1560537470.0,brownjesus__,0.85,/r/torontoraptors/comments/c0nmph/nba_champion_upvote_so_this_is_the_first_image/,torontoraptors,380953,2
Predictions Tournament,13819,qc4xbs,https://reddit.com/r/torontoraptors/predictions?tournament=tnmt-e747c5bd-c3ba-4be6-9841-d208430ae463,123,1647228597.0,absolutkaos,0.9,/r/torontoraptors/comments/qc4xbs/predictions_tournament/,torontoraptors,380953,2
Golden State took out a full page in the Toronto Star to post this. Very classy move.,11177,c1odxd,https://i.redd.it/35la0s16jx431.png,305,1560782831.0,zevHS,0.95,/r/torontoraptors/comments/c1odxd/golden_state_took_out_a_full_page_in_the_toronto/,torontoraptors,380953,2
You've been visited by the green ranger. Upvote this to unlock Danny Green's full power.,9833,brdimt,https://i.redd.it/mv10irz4rlz21.jpg,96,1558461021.0,Kizz3r,0.88,/r/torontoraptors/comments/brdimt/youve_been_visited_by_the_green_ranger_upvote/,torontoraptors,380953,2
<--- the amount of 3's Danny will get the rest of the finals,8591,bxbmpd,https://i.imgur.com/FpWIV3a.jpg,122,1559789973.0,mansmurf,0.86,/r/torontoraptors/comments/bxbmpd/the_amount_of_3s_danny_will_get_the_rest_of_the/,torontoraptors,380953,2
KAWHI FINALS MVP UPVOTE PARTY,7499,c0fktw,https://www.reddit.com/r/torontoraptors/comments/c0fktw/kawhi_finals_mvp_upvote_party/,514,1560484975.0,Ps4player3,0.94,/r/torontoraptors/comments/c0fktw/kawhi_finals_mvp_upvote_party/,torontoraptors,380953,2
🔥JEREMY LIN GAME 3 HIGHLIGHTS HYPE REEL🔥,7116,bxlahd,https://v.redd.it/yv23dgpkls231,255,1559851437.0,atomicbolt,0.96,/r/torontoraptors/comments/bxlahd/jeremy_lin_game_3_highlights_hype_reel/,torontoraptors,380953,2
4-2 W4 | Toronto Raptors Heading to the NBA Finals | May 25th 2019,6697,bt37c5,https://www.reddit.com/r/torontoraptors/comments/bt37c5/42_w4_toronto_raptors_heading_to_the_nba_finals/,2102,1558840336.0,LinuxF4n,0.89,/r/torontoraptors/comments/bt37c5/42_w4_toronto_raptors_heading_to_the_nba_finals/,torontoraptors,380953,2
FRED VANVLEET CAREER HIGH 54 POINTS: THE NEW RAPTORS FRANCHISE RECORD UPVOTE PARTY!,6687,lbd1ps,https://i.redd.it/j0uwnihx86f61.jpg,153,1612318466.0,TeamZiggler,0.94,/r/torontoraptors/comments/lbd1ps/fred_vanvleet_career_high_54_points_the_new/,torontoraptors,380953,2
Upvote picture of young Lowry for maximum luck tonight 🙏🏻,5780,iphmzf,https://i.redd.it/wa373fax05m51.jpg,103,1599664027.0,RaptorzGod,0.95,/r/torontoraptors/comments/iphmzf/upvote_picture_of_young_lowry_for_maximum_luck/,torontoraptors,380953,2
"You have been my favorite basketball player ever since the day you were drafted. No one has ever embraced this team, the city of Toronto, and the country of Canada like you. You will forever be the greatest Toronto Raptor of all-time. Thank you for everything.",5520,8zvez3,https://i.redd.it/5euro2gyhpa11.jpg,235,1531919866.0,BenJCarlos,0.94,/r/torontoraptors/comments/8zvez3/you_have_been_my_favorite_basketball_player_ever/,torontoraptors,380953,2
MIP,5509,c4zxc8,https://i.redd.it/x4s40bjhne631.jpg,101,1561425947.0,Kinglokner16,0.94,/r/torontoraptors/comments/c4zxc8/mip/,torontoraptors,380953,2
End this shit tonight please!!!! POSITIVE VIBES ONLY 🏆,5002,c046js,https://i.redd.it/7nfczwfuq3431.jpg,183,1560422204.0,TydalOG,0.95,/r/torontoraptors/comments/c046js/end_this_shit_tonight_please_positive_vibes_only/,torontoraptors,380953,2
When you remember that you chose Paul George over Siakam and Lowry,4816,ifc6ba,https://i.redd.it/wknj18vypti51.jpg,435,1598219620.0,jack_hojo,0.97,/r/torontoraptors/comments/ifc6ba/when_you_remember_that_you_chose_paul_george_over/,torontoraptors,380953,2
Kawhi's decision summed up,4735,c8uush,https://i.redd.it/k025fnzl36831.jpg,405,1562194103.0,Jesus_Hates_Memes,0.96,/r/torontoraptors/comments/c8uush/kawhis_decision_summed_up/,torontoraptors,380953,2
For real,4622,c8hbbq,https://i.redd.it/zxqpmpifgz731.jpg,166,1562113672.0,newyearnewuser19,0.95,/r/torontoraptors/comments/c8hbbq/for_real/,torontoraptors,380953,2
Body Cam footage was just released of the shoving match between the Alameda Co. sheriff and Masai Ujiri,4579,icdx0t,https://youtu.be/wd4e9qX-ZZs,525,1597799165.0,catch22milo,0.97,/r/torontoraptors/comments/icdx0t/body_cam_footage_was_just_released_of_the_shoving/,torontoraptors,380953,2
Officially Official,4565,iem4ku,https://i.redd.it/a6idxesd5li51.jpg,188,1598115842.0,GucciToilet23,0.97,/r/torontoraptors/comments/iem4ku/officially_official/,torontoraptors,380953,2
🔥🔥 SCOTTIE BARNES FIRST CAREER HIGH DOUBLE DOUBLE 25PTS AND 13REBS UPVOTE PARTY 🔥🔥,4524,qdvas6,https://i.redd.it/s5qn3h04v3v71.jpg,241,1634953655.0,bomankleinn01,0.94,/r/torontoraptors/comments/qdvas6/scottie_barnes_first_career_high_double_double/,torontoraptors,380953,2
GARY TRENT BEATS THE WIZARDS AT THE BUZZER,4480,ml02a4,https://v.redd.it/ebe52xarfgr61,239,1617671964.0,LordOfBathurst,0.96,/r/torontoraptors/comments/ml02a4/gary_trent_beats_the_wizards_at_the_buzzer/,torontoraptors,380953,2
Damn straight!,4367,c136u3,https://i.redd.it/oqwek5zxnl431.jpg,171,1560639152.0,zevHS,0.96,/r/torontoraptors/comments/c136u3/damn_straight/,torontoraptors,380953,2
Thank you Serge and Marc for everything ❤️,4353,ir5n4h,https://i.redd.it/hlrezall3nm51.jpg,267,1599882850.0,_janson,0.97,/r/torontoraptors/comments/ir5n4h/thank_you_serge_and_marc_for_everything/,torontoraptors,380953,2
Thought you guys might like this,4293,bsbzgv,https://i.imgur.com/BxviGsO.jpg,133,1558667804.0,suzukigun4life,0.96,/r/torontoraptors/comments/bsbzgv/thought_you_guys_might_like_this/,torontoraptors,380953,2
GREATEST COMEBACK IN RAPTORS HISTORY UPVOTE PARTY,4259,eebsds,https://www.reddit.com/r/torontoraptors/comments/eebsds/greatest_comeback_in_raptors_history_upvote_party/,179,1577055849.0,h3yn0w75,0.94,/r/torontoraptors/comments/eebsds/greatest_comeback_in_raptors_history_upvote_party/,torontoraptors,380953,2
Lethbridge Lakers,4251,mm12t2,https://i.redd.it/7ds8c69swnr61.jpg,396,1617798969.0,mikeydale007,0.97,/r/torontoraptors/comments/mm12t2/lethbridge_lakers/,torontoraptors,380953,2
OFFICIAL PASCAL SIAKAM NEW CAREER-HIGH 52PTS UPVOTE PARTY,4102,zsa50d,https://i.redd.it/dorvqarm1d7a1.jpg,163,1671677851.0,LordOfBathurst,0.93,/r/torontoraptors/comments/zsa50d/official_pascal_siakam_new_careerhigh_52pts/,torontoraptors,380953,2
Marc Gasol Appreciation Thread,4022,j2rey1,https://i.redd.it/24wqmldmsbq51.jpg,185,1601489373.0,RaptorzGod,0.97,/r/torontoraptors/comments/j2rey1/marc_gasol_appreciation_thread/,torontoraptors,380953,2
36 POINT NEW CAREER HIGH STEADY FREDDY VANVLEET UPVOTE PARTY,3929,i34o4q,https://i.redd.it/ul3613spiue51.jpg,78,1596485896.0,TeamZiggler,0.96,/r/torontoraptors/comments/i34o4q/36_point_new_career_high_steady_freddy_vanvleet/,torontoraptors,380953,2
This.,3855,c27skz,https://i.redd.it/zseuohdgi6531.jpg,224,1560891553.0,iliketoytules,0.97,/r/torontoraptors/comments/c27skz/this/,torontoraptors,380953,2
UPVOTE PARTY FOR THE BEST PLAYER TO EVER WEAR #23!!!!!,3819,bsbuj8,https://i.redd.it/ok30mwzjr2031.jpg,161,1558666944.0,Kenji_Of_East,0.81,/r/torontoraptors/comments/bsbuj8/upvote_party_for_the_best_player_to_ever_wear_23/,torontoraptors,380953,2
1-0 W1 | Toronto Raptors 118 vs Golden State Warriors 109 F | May 30th 2019,3765,bv2mqp,https://www.reddit.com/r/torontoraptors/comments/bv2mqp/10_w1_toronto_raptors_118_vs_golden_state/,1585,1559273828.0,LinuxF4n,0.9,/r/torontoraptors/comments/bv2mqp/10_w1_toronto_raptors_118_vs_golden_state/,torontoraptors,380953,2
"BASKETBALL GOAT. UPVOTE THIS SO OUR GOD SHOWS UP WHEN YOU GOOGLE ""BASKETBALL GOAT""",3741,67dirp,http://i.imgur.com/nH9m8ws.jpg,73,1493084213.0,blazingminer14,0.61,/r/torontoraptors/comments/67dirp/basketball_goat_upvote_this_so_our_god_shows_up/,torontoraptors,380953,2
Thank you for a Great Season!!!,3692,ueaqth,https://i.redd.it/30kcjo11hdw81.jpg,105,1651196366.0,NoPlan4789,0.96,/r/torontoraptors/comments/ueaqth/thank_you_for_a_great_season/,torontoraptors,380953,2
Toronto Sports over the last 29 years,3575,xzpqhr,https://i.redd.it/mpw1ba704ts91.jpg,243,1665332834.0,Kinglokner16,0.94,/r/torontoraptors/comments/xzpqhr/toronto_sports_over_the_last_29_years/,torontoraptors,380953,2
FRED VANVLEET ALL-STAR UPVOTE PARTY!!!,3510,sjz0fv,https://i.redd.it/0vf7efckhpf81.png,84,1643934128.0,6iannis,0.96,/r/torontoraptors/comments/sjz0fv/fred_vanvleet_allstar_upvote_party/,torontoraptors,380953,2
Norman Powell on the wrong side of the Jump Ball lol,3422,mfcnmk,https://v.redd.it/a86vebqxrup61,94,1616973874.0,LordOfBathurst,0.98,/r/torontoraptors/comments/mfcnmk/norman_powell_on_the_wrong_side_of_the_jump_ball/,torontoraptors,380953,2
FRED VANVLEET FIRST TRIPLE-DOUBLE UPVOTE PARTY!!!,3387,rypau8,https://i.redd.it/wkiucq8gmda81.jpg,134,1641609749.0,LordOfBathurst,0.94,/r/torontoraptors/comments/rypau8/fred_vanvleet_first_tripledouble_upvote_party/,torontoraptors,380953,2
Never forget this man. The Toronto Raptors could never have gotten here without him.,3327,c0flep,https://i.imgur.com/Tv7Eai9.png,82,1560485078.0,twistedlogicx,0.98,/r/torontoraptors/comments/c0flep/never_forget_this_man_the_toronto_raptors_could/,torontoraptors,380953,2
Bro TIL Drake wasn’t the 1st.,3306,c2o6uv,https://i.redd.it/hnaw5qqpae531.jpg,186,1560985810.0,MekeniMan,0.97,/r/torontoraptors/comments/c2o6uv/bro_til_drake_wasnt_the_1st/,torontoraptors,380953,2
LOL Jamal liked this tweet 🇨🇦,3268,iu5ll9,https://i.redd.it/uyk8stzxykn51.jpg,78,1600292917.0,mhamgal,0.98,/r/torontoraptors/comments/iu5ll9/lol_jamal_liked_this_tweet/,torontoraptors,380953,2
OG ANUNOBY CAREER HIGH 36pts UPVOTE PARTY🧣🧣,3262,qkti4y,https://i.redd.it/4eizst8f83x71.jpg,100,1635817722.0,buffalo-blonde,0.96,/r/torontoraptors/comments/qkti4y/og_anunoby_career_high_36pts_upvote_party/,torontoraptors,380953,2
Jeremy Lin professional response to Kenyon Martin insulting him years ago,3254,cjmn0b,https://i.redd.it/e7hya05ybdd31.png,192,1564460896.0,Rey123x,0.98,/r/torontoraptors/comments/cjmn0b/jeremy_lin_professional_response_to_kenyon_martin/,torontoraptors,380953,2
We are 5-0 when I post this photo of a pooping doggo before the game! 1 upvote = 1 Kawhi poster,3238,bw3i91,https://i.redd.it/rr7qzkimx0231.jpg,125,1559516467.0,mantistobogganmMD,0.86,/r/torontoraptors/comments/bw3i91/we_are_50_when_i_post_this_photo_of_a_pooping/,torontoraptors,380953,2
"[EID] Kawhi Leonard has officially signed A sponsorship deal with Cargo Jet Airways, based out of Hamilton Ontario. This is the same company who gave Drake his signature Boeing 767 Airplane.",3199,c3f9ot,https://twitter.com/ESPNEID/status/1142144909144743938,368,1561145632.0,twistedlogicx,0.97,/r/torontoraptors/comments/c3f9ot/eid_kawhi_leonard_has_officially_signed_a/,torontoraptors,380953,2
Just leaving this here. Masai ....,3178,ifvm9c,https://i.redd.it/8mhszegc20j51.jpg,161,1598296424.0,h3yn0w75,0.98,/r/torontoraptors/comments/ifvm9c/just_leaving_this_here_masai/,torontoraptors,380953,2
Jonas Valanciunas Appreciation Thread,3175,ao74l6,https://www.reddit.com/r/torontoraptors/comments/ao74l6/jonas_valanciunas_appreciation_thread/,489,1549565875.0,_janson,0.94,/r/torontoraptors/comments/ao74l6/jonas_valanciunas_appreciation_thread/,torontoraptors,380953,2
Dalano Banton's first bucket as a Raptor!,3115,qcgd10,https://v.redd.it/o2fmuj01jpu71,95,1634780117.0,LordOfBathurst,0.97,/r/torontoraptors/comments/qcgd10/dalano_bantons_first_bucket_as_a_raptor/,torontoraptors,380953,2
Nav Bhatia on Kawhi’s jersey being retired? “No! Not at all. No! [The championship] was not just because of him. It was because of VanVleet... of Gasol... of Lowry playing his heart out. It was a lot of people. Not just because of Kawhi. People are giving him more credit than they should. ”,3076,civyi5,https://www.sportsnet.ca/basketball/nba/raptors-superfan-nav-bhatia-sounds-off-kawhis-decision-join-clippers/,465,1564321390.0,nanobot001,0.94,/r/torontoraptors/comments/civyi5/nav_bhatia_on_kawhis_jersey_being_retired_no_not/,torontoraptors,380953,2
This man better get a ring,3081,c0fr9c,https://i.redd.it/r53bqbit09431.jpg,97,1560486103.0,Tipex,0.98,/r/torontoraptors/comments/c0fr9c/this_man_better_get_a_ring/,torontoraptors,380953,2
Upvote party for siakam to get back on track. #SpicyP,3064,iqajr3,https://i.redd.it/f0kicgtzhdm51.jpg,52,1599766622.0,Daman3608,0.98,/r/torontoraptors/comments/iqajr3/upvote_party_for_siakam_to_get_back_on_track/,torontoraptors,380953,2
OFFICIAL GARY TRENT JR. NEW CAREER-HIGH 31PTS UPVOTE PARTY,3046,mhlj8j,https://i.redd.it/vdh3yeah0hq61.jpg,155,1617243762.0,LordOfBathurst,0.97,/r/torontoraptors/comments/mhlj8j/official_gary_trent_jr_new_careerhigh_31pts/,torontoraptors,380953,2
2021-22 /r/torontoraptors PLAYOFF PREDICTION TOURNAMENT,3031,u3rn21,https://reddit.com/r/torontoraptors/predictions?tournament=tnmt-7f8d3ebd-d28f-410a-9012-5603e4c26dbc,13,1651037942.0,absolutkaos,1.0,/r/torontoraptors/comments/u3rn21/202122_rtorontoraptors_playoff_prediction/,torontoraptors,380953,2
"You have been visited by Kawhi “Mj” Leonard, Jodie “steph curry” Meeks and Patrick “2 time nba champion” Mccaw one upvote equals one made 3, defensive stop, and championship for the raptors",3029,brs1on,https://i.redd.it/yke8riq5zsz21.jpg,24,1558548434.0,Ps4player3,0.95,/r/torontoraptors/comments/brs1on/you_have_been_visited_by_kawhi_mj_leonard_jodie/,torontoraptors,380953,2
TD II CAREER HIGH 31 PT UPVOTE PARTY,3026,exwfbj,https://i.redd.it/jk4w09cx5le41.jpg,111,1580682111.0,LordOfBathurst,0.97,/r/torontoraptors/comments/exwfbj/td_ii_career_high_31_pt_upvote_party/,torontoraptors,380953,2
JV and Demar tonight 😩❤️,3004,kj8fjc,https://www.reddit.com/gallery/kj8fjc,101,1608782973.0,mhamgal,0.99,/r/torontoraptors/comments/kj8fjc/jv_and_demar_tonight/,torontoraptors,380953,2
14 GAME WIN STREAK UPVOTE PARTY 🎉🥳🏀,2981,f12c2i,https://www.reddit.com/r/torontoraptors/comments/f12c2i/14_game_win_streak_upvote_party/,168,1581216360.0,Parmg100,0.95,/r/torontoraptors/comments/f12c2i/14_game_win_streak_upvote_party/,torontoraptors,380953,2
Time to focus on the Raptors!,2940,xz8639,https://i.redd.it/q9tlkazueos91.png,135,1665275964.0,managerjohngibbons,0.97,/r/torontoraptors/comments/xz8639/time_to_focus_on_the_raptors/,torontoraptors,380953,2
Congrats Kyle Lowry. You deserved this ring,2927,c0fmiu,https://i.redd.it/dt3enxpcy8431.jpg,84,1560485280.0,Tipex,1.0,/r/torontoraptors/comments/c0fmiu/congrats_kyle_lowry_you_deserved_this_ring/,torontoraptors,380953,2
"Shaq on Kawhi’s Free Agency: “He’s the King of Toronto, he’s the Emperor of Canada. I would stay”",2914,c2wdcz,https://streamable.com/vppde,326,1561039254.0,h3yn0w75,0.97,/r/torontoraptors/comments/c2wdcz/shaq_on_kawhis_free_agency_hes_the_king_of/,torontoraptors,380953,2
Happy Early Thanksgiving from Kyle,2892,j6w2v7,https://i.redd.it/m0cd3smprpr51.jpg,53,1602094412.0,GucciToilet23,0.98,/r/torontoraptors/comments/j6w2v7/happy_early_thanksgiving_from_kyle/,torontoraptors,380953,2
KD bought a $3.7 million dollar property in Toronto,2888,vqwpr0,https://i.redd.it/zvv4thxk3i991.jpg,92,1656900403.0,UjiriWatcher,0.97,/r/torontoraptors/comments/vqwpr0/kd_bought_a_37_million_dollar_property_in_toronto/,torontoraptors,380953,2
It's exam week but watching the game and making this meme is more important,2885,a5qq1z,https://i.redd.it/4ijli1axhz321.jpg,103,1544680249.0,_janson,0.95,/r/torontoraptors/comments/a5qq1z/its_exam_week_but_watching_the_game_and_making/,torontoraptors,380953,2
Matty Ice Career High Upvote Party,2872,i7hc5q,https://i.redd.it/c07gs05ip9g51.jpg,84,1597105630.0,jack_hojo,0.96,/r/torontoraptors/comments/i7hc5q/matty_ice_career_high_upvote_party/,torontoraptors,380953,2
UPVOTE PARTY FOR THE GREEN RANGER!!!,2828,bv2p0p,https://i.redd.it/r7iz1j7cxg131.jpg,65,1559274233.0,Kenji_Of_East,0.98,/r/torontoraptors/comments/bv2p0p/upvote_party_for_the_green_ranger/,torontoraptors,380953,2
Bad Ass Pic of FvV sr. and KD. He ain't scared homie.,2815,c5qjql,https://i.redd.it/czzccebtop631.jpg,194,1561559626.0,_friendlyfoe_,0.97,/r/torontoraptors/comments/c5qjql/bad_ass_pic_of_fvv_sr_and_kd_he_aint_scared_homie/,torontoraptors,380953,2
"[Wojnarowski] Toronto Raptors forward O.G. Anunoby has agreed to a four-year, $72 million extension, including a player-option for the 2024-2025 season, @KlutchSports Head of Basketball Omar Wilkes tells ESPN.",2802,khs9k3,https://twitter.com/wojespn/status/1341153643056214021,283,1608590942.0,mkgandkembafan,0.97,/r/torontoraptors/comments/khs9k3/wojnarowski_toronto_raptors_forward_og_anunoby/,torontoraptors,380953,2
[Nav Bhatia] Thank you to all the @Bucks fans who came up to me and apologized for words someone tweeted even though you didnt have to. I know we are in a heated series but i want everyone to know regardless of what one person has said. Milwaukee and its fans are incredible!,2780,bsl2pf,https://twitter.com/superfan_nav/status/1131983177336197120?s=09,163,1558725889.0,edwara19,0.97,/r/torontoraptors/comments/bsl2pf/nav_bhatia_thank_you_to_all_the_bucks_fans_who/,torontoraptors,380953,2
Siakam 32 point upvote party!!!,2741,ks5nqq,https://i.redd.it/3lnyiahr8u961.jpg,120,1609993839.0,meanbygodgene,0.96,/r/torontoraptors/comments/ks5nqq/siakam_32_point_upvote_party/,torontoraptors,380953,2
Patrick Beverly calls for iso defense against Pascal,2677,suz42u,https://v.redd.it/mvcwlcbdigi81,143,1645131382.0,catch22milo,0.98,/r/torontoraptors/comments/suz42u/patrick_beverly_calls_for_iso_defense_against/,torontoraptors,380953,2
"Filthy! Raptors, please bring these back for the 25th anniversary.",2631,ce3hj9,https://i.redd.it/flofzif8jqa31.jpg,115,1563313193.0,Agentchaos50,0.97,/r/torontoraptors/comments/ce3hj9/filthy_raptors_please_bring_these_back_for_the/,torontoraptors,380953,2
"I'm not crying, you are. Thanks Serge",2614,jypn10,https://i.redd.it/7hce4qeszp061.jpg,183,1606019761.0,cw158,0.98,/r/torontoraptors/comments/jypn10/im_not_crying_you_are_thanks_serge/,torontoraptors,380953,2
Kawhi rumours,2603,blv8pj,https://i.redd.it/saz6eqjffuw21.jpg,52,1557258467.0,h3yn0w75,0.97,/r/torontoraptors/comments/blv8pj/kawhi_rumours/,torontoraptors,380953,2
Your 2020 All Star Coach!,2595,ewz8hx,https://i.redd.it/ovz9juw328e41.jpg,100,1580523431.0,cw158,0.96,/r/torontoraptors/comments/ewz8hx/your_2020_all_star_coach/,torontoraptors,380953,2
[OC] “Keep demanding justice” - Masai Ujiri,2586,ij2lz5,https://i.redd.it/5l072cy311k51.jpg,53,1598743964.0,limeback,0.95,/r/torontoraptors/comments/ij2lz5/oc_keep_demanding_justice_masai_ujiri/,torontoraptors,380953,2
Me watching this game,2581,ioivfg,https://i.redd.it/0cwrpgokbtl51.jpg,55,1599522333.0,managerjohngibbons,0.97,/r/torontoraptors/comments/ioivfg/me_watching_this_game/,torontoraptors,380953,2
UPVOTE IT INTO EXISTENCE.,2577,o5b1r3,https://i.redd.it/cpzz8vz1zp671.png,55,1624325627.0,BenJCarlos,0.98,/r/torontoraptors/comments/o5b1r3/upvote_it_into_existence/,torontoraptors,380953,2
That must’ve been tough for him yesterday 😂😂😂,2584,ex7kv5,https://i.redd.it/yseon0u5ybe41.jpg,195,1580570530.0,TydalOG,0.97,/r/torontoraptors/comments/ex7kv5/that_mustve_been_tough_for_him_yesterday/,torontoraptors,380953,2
[OC] Happy Canada Day!,2579,c7rt38,https://i.redd.it/lag49ox7oo731.jpg,48,1561983121.0,limeback,0.98,/r/torontoraptors/comments/c7rt38/oc_happy_canada_day/,torontoraptors,380953,2
[DeMarre Carroll] I think Toronto would of won this series easy with game 7 at home...Toronto fans usually spots you 5-10 points with their energy....💯💯💯,2571,iricvi,https://twitter.com/demarrecarroll1/status/1304628175885021184?s=21,151,1599936806.0,nanobot001,0.97,/r/torontoraptors/comments/iricvi/demarre_carroll_i_think_toronto_would_of_won_this/,torontoraptors,380953,2
Love them so much ❤️🖤,2573,j4l9fb,https://i.imgur.com/K2Y3KAf.jpg,53,1601753687.0,brownjesus__,0.98,/r/torontoraptors/comments/j4l9fb/love_them_so_much/,torontoraptors,380953,2
Nothing but love for him. Always gonna support him❤️,2542,mg1ze8,https://i.redd.it/sst7sawts1q61.jpg,91,1617058904.0,therealfunguy1,0.99,/r/torontoraptors/comments/mg1ze8/nothing_but_love_for_him_always_gonna_support_him/,torontoraptors,380953,2
Leaked footage of the Knicks front office on their way to meet with Masai,2520,eza1i3,https://gfycat.com/nauticalacademicblackmamba,80,1580911587.0,ImOffside,0.98,/r/torontoraptors/comments/eza1i3/leaked_footage_of_the_knicks_front_office_on/,torontoraptors,380953,2
Gary Trent Jr.'s has achieved the franchise-record +54!!!,2523,miybbh,https://i.redd.it/sp5gyyfj0vq61.jpg,122,1617412599.0,LordOfBathurst,0.98,/r/torontoraptors/comments/miybbh/gary_trent_jrs_has_achieved_the_franchiserecord_54/,torontoraptors,380953,2
Upvote Fred VanVleet Jr. for his contributions to this years playoff run!,2507,ce6t8q,https://i.redd.it/5u294r2tyra31.jpg,42,1563330536.0,RaptorzGod,0.98,/r/torontoraptors/comments/ce6t8q/upvote_fred_vanvleet_jr_for_his_contributions_to/,torontoraptors,380953,2
#Free Beal,2478,lby70s,https://i.redd.it/o267tffeubf61.jpg,83,1612386173.0,bomankleinn01,0.98,/r/torontoraptors/comments/lby70s/free_beal/,torontoraptors,380953,2
(Richard Chen) The Kings of the North return home,2474,c1mch3,https://imgur.com/fPu3oX7,33,1560770492.0,Pi_R_Squared,0.97,/r/torontoraptors/comments/c1mch3/richard_chen_the_kings_of_the_north_return_home/,torontoraptors,380953,2
DeMar DeRozan appreciation thread. He got us,2475,8ztndz,https://www.reddit.com/r/torontoraptors/comments/8ztndz/demar_derozan_appreciation_thread_he_got_us/,329,1531902589.0,_janson,0.97,/r/torontoraptors/comments/8ztndz/demar_derozan_appreciation_thread_he_got_us/,torontoraptors,380953,2
We are officially no longer defending champions,2473,j9i7we,https://www.reddit.com/gallery/j9i7we,198,1602468088.0,therealfunguy1,0.96,/r/torontoraptors/comments/j9i7we/we_are_officially_no_longer_defending_champions/,torontoraptors,380953,2
Lowry got his jersey retired at Villanova tonight,2460,fa4gck,https://i.redd.it/abhv0cbfgdj41.jpg,65,1582768024.0,mhamgal,0.99,/r/torontoraptors/comments/fa4gck/lowry_got_his_jersey_retired_at_villanova_tonight/,torontoraptors,380953,2
Raps in 5,2460,ik6l35,https://i.redd.it/sj4a1b0gkek51.jpg,66,1598907856.0,VanVleet-goes-for-22,0.97,/r/torontoraptors/comments/ik6l35/raps_in_5/,torontoraptors,380953,2
WE DIDN'T TRADE ANYONE UPVOTE PARTY,2459,ezy2ym,https://www.reddit.com/r/torontoraptors/comments/ezy2ym/we_didnt_trade_anyone_upvote_party/,174,1581019475.0,mikeydale007,0.96,/r/torontoraptors/comments/ezy2ym/we_didnt_trade_anyone_upvote_party/,torontoraptors,380953,2
This makes me so sad 😢💔,2456,j7mfv6,https://i.imgur.com/AvkfErT.jpg,230,1602194218.0,brownjesus__,0.97,/r/torontoraptors/comments/j7mfv6/this_makes_me_so_sad/,torontoraptors,380953,2
This picture looks absolutely surreal,2459,aq2jk1,https://i.redd.it/05jf70hph9g21.jpg,147,1550031443.0,Tipex,0.96,/r/torontoraptors/comments/aq2jk1/this_picture_looks_absolutely_surreal/,torontoraptors,380953,2
SPICY P EXTENSION UPVOTE PARTY,2436,dk7hho,https://i.imgur.com/35U0Wp2.jpg,44,1571508946.0,brownjesus__,0.98,/r/torontoraptors/comments/dk7hho/spicy_p_extension_upvote_party/,torontoraptors,380953,2
A story told by a Bucks fan's Youtube channel,2420,cfr9hz,https://i.redd.it/ewgdnxlu2jb31.png,146,1563658817.0,_janson,0.97,/r/torontoraptors/comments/cfr9hz/a_story_told_by_a_bucks_fans_youtube_channel/,torontoraptors,380953,2
Remember those who died for our championship,2417,cai7js,https://i.imgur.com/Jxd8tbb.jpg,65,1562572861.0,Kizz3r,0.99,/r/torontoraptors/comments/cai7js/remember_those_who_died_for_our_championship/,torontoraptors,380953,2
May i remind you that this epic shot took us to where we are right now.,2410,bu6py1,https://v.redd.it/imqzdx0461131,78,1559083589.0,MekeniMan,0.98,/r/torontoraptors/comments/bu6py1/may_i_remind_you_that_this_epic_shot_took_us_to/,torontoraptors,380953,2
Chris Boucher’s last 5 games 👀,2405,kz8guk,https://i.redd.it/88uscadewwb61.jpg,127,1610897698.0,h3yn0w75,0.98,/r/torontoraptors/comments/kz8guk/chris_bouchers_last_5_games/,torontoraptors,380953,2
We are 4-0 when I post this pooping doggo before the game. 1 upvote = 1 Curry turnover,2382,bv16qz,https://i.redd.it/246og6i26g131.jpg,35,1559265064.0,mantistobogganmMD,0.96,/r/torontoraptors/comments/bv16qz/we_are_40_when_i_post_this_pooping_doggo_before/,torontoraptors,380953,2
Raptors are 1-0 when we score more then the other team,2359,kqap1j,https://www.reddit.com/r/torontoraptors/comments/kqap1j/raptors_are_10_when_we_score_more_then_the_other/,111,1609773523.0,KyleAce98,0.96,/r/torontoraptors/comments/kqap1j/raptors_are_10_when_we_score_more_then_the_other/,torontoraptors,380953,2
"2 years ago, today Kawhi Leonard hit The Shot",2351,nal8qj,https://www.reddit.com/gallery/nal8qj,124,1620814421.0,therealfunguy1,0.99,/r/torontoraptors/comments/nal8qj/2_years_ago_today_kawhi_leonard_hit_the_shot/,torontoraptors,380953,2
Kawhi watching the Raptors beat the Lakers,2347,i256wf,https://i.redd.it/h4259f78aie51.jpg,61,1596337759.0,h3yn0w75,0.99,/r/torontoraptors/comments/i256wf/kawhi_watching_the_raptors_beat_the_lakers/,torontoraptors,380953,2
Dalano Banton 27 PTS CAREER HIGH UPVOTE PARTY,2330,yvkgdx,https://i.redd.it/9s6cvwhk110a1.jpg,83,1668479833.0,LordOfBathurst,0.96,/r/torontoraptors/comments/yvkgdx/dalano_banton_27_pts_career_high_upvote_party/,torontoraptors,380953,2
