title,score,id,url,num_comments,created,author,upvote_ratio,permalink,subreddit,subreddit_subscribers,depth
In Black Adam (2022) Black Adam (The Rock) is hit with a metal rod but doesn't flinch. This would mean that even scissors wouldn't stand a chance.,32411,wowis8,https://i.redd.it/fco4u7c6xuh91.jpg,189,1660560668.0,pale_guy_,0.91,/r/shittymoviedetails/comments/wowis8/in_black_adam_2022_black_adam_the_rock_is_hit/,shittymoviedetails,954480,3
"In the Fast & Furious movies, Vin (Vehicle Identification Number) Diesel doesn't drink beer because he only runs on diesel.",32267,mneuta,https://i.redd.it/1j7rvcrvr4s61.jpg,246,1617966605.0,pale_guy_,0.94,/r/shittymoviedetails/comments/mneuta/in_the_fast_furious_movies_vin_vehicle/,shittymoviedetails,954480,3
"In Breaking Bad season 2, episode 11 “Mandala” (2009), it is revealed that Jesse Pinkman has the ability to levitate. Yet, that super power is never addressed again in the series, even though he could’ve easily used it to escape the Nazis. This is a plot hole.",32059,wu2ldb,https://i.redd.it/sd515l4773j91.jpg,209,1661096497.0,Sidiousfancasting,0.93,/r/shittymoviedetails/comments/wu2ldb/in_breaking_bad_season_2_episode_11_mandala_2009/,shittymoviedetails,954480,3
"Disney didn't get permission to use the Punisher logo on Sid's shirt in Toy Story (1995). To avoid getting sued, they bought the rights to Marvel comics.",31691,l9aoqm,https://i.redd.it/a84x5sctmne61.jpg,148,1612093058.0,pale_guy_,0.96,/r/shittymoviedetails/comments/l9aoqm/disney_didnt_get_permission_to_use_the_punisher/,shittymoviedetails,954480,3
In A Quiet Place (2018) the kids are able to stay quiet for more than 5 seconds at a time. This is because they are not my neighbors' children.,31640,t3wddx,https://i.redd.it/xjyu3zdijok81.jpg,128,1646100200.0,PapaJaundice,0.97,/r/shittymoviedetails/comments/t3wddx/in_a_quiet_place_2018_the_kids_are_able_to_stay/,shittymoviedetails,954480,3
"In Dunc (2021), Timothćc Chalamct, who plays Paul Atrcidcs, is only twclvc ycars youngcr than actrcss Rcbccca Fcrguson, who plays his onscrccn mothcr, Lady Jcssica.",31527,uykm30,https://i.imgur.com/eNjIFCI.jpg,448,1653608002.0,Gniphe,0.94,/r/shittymoviedetails/comments/uykm30/in_dunc_2021_timothćc_chalamct_who_plays_paul/,shittymoviedetails,954480,3
Hanks for all the laughs!,31459,bo2y1x,https://i.redd.it/pe7ezq4f4zx21.jpg,105,1557751148.0,SleepyGary5,0.96,/r/shittymoviedetails/comments/bo2y1x/hanks_for_all_the_laughs/,shittymoviedetails,954480,3
"In The Hunger Games (2012), Peeta disguises himself as a rock and no one notices him. He was taught this trick by his cousin, a famous wrestler called Dwayne.",31094,ltwq90,https://i.redd.it/4xl50zguy2k61.jpg,285,1614458090.0,Tokyono,0.93,/r/shittymoviedetails/comments/ltwq90/in_the_hunger_games_2012_peeta_disguises_himself/,shittymoviedetails,954480,3
"In Joker (2019) we see Joker wearing red and lifting his arms to take flight. But he couldn't fly because, despite the actor's name, he is not a real Phoenix.",31047,lpkbib,https://i.redd.it/3i3hc3cn40j61.jpg,108,1613987729.0,pale_guy_,0.91,/r/shittymoviedetails/comments/lpkbib/in_joker_2019_we_see_joker_wearing_red_and/,shittymoviedetails,954480,3
In Coco (2017) the VFX artists spent upwards of 2000 manhours working on these few seconds alone. But I didn't see shit because I was crying hysterically.,30942,y5kfpw,https://i.redd.it/hj2ck3zxx6u91.gif,379,1665936142.0,KennKennyKenKen,0.93,/r/shittymoviedetails/comments/y5kfpw/in_coco_2017_the_vfx_artists_spent_upwards_of/,shittymoviedetails,954480,3
In Batman Vs Superman (2016) Henry Cavill makes this stupid face. God he looks stupid.,30834,mvikzb,https://i.redd.it/nvow8fqmsju61.jpg,298,1619020155.0,KennKennyKenKen,0.94,/r/shittymoviedetails/comments/mvikzb/in_batman_vs_superman_2016_henry_cavill_makes/,shittymoviedetails,954480,3
"Cocaine Bear comes out this Friday, so get ready for the most outrageously mediocre experience of your life.",30792,119e7lr,https://i.redd.it/v022kffynuja1.jpg,1086,1677101548.0,theDart,0.87,/r/shittymoviedetails/comments/119e7lr/cocaine_bear_comes_out_this_friday_so_get_ready/,shittymoviedetails,954480,3
"In Spider (hyphen) Man: Far From Home (2019), Jake Gyllenhal can be seen in the background of several scenes. He wasn’t meant to be there and later admitted he just enjoys stalking Tom Holland",30699,ld4sgk,https://i.redd.it/ezhsqj3t3nf61.jpg,165,1612522513.0,KermitTheFraud92,0.95,/r/shittymoviedetails/comments/ld4sgk/in_spider_hyphen_man_far_from_home_2019_jake/,shittymoviedetails,954480,3
"In a show of immense dedication to his craft, Lincoln Osiris wore whiteface for 11 years to portray Tony Stark in the Marvel Cinematic Universe (2008-2019)",30611,u7ntri,https://i.redd.it/vo01uvw9ylu81.jpg,188,1650427448.0,AdvocateSaint,0.95,/r/shittymoviedetails/comments/u7ntri/in_a_show_of_immense_dedication_to_his_craft/,shittymoviedetails,954480,3
"In John Wick (2014) Gold coins are used as underworld currency. This is because anytime a post about Keanu Reeves gets gold, Reddit donates 1 gold coin to the underworld.",30548,jhqtvn,https://i.redd.it/ai0ay86yo7v51.jpg,61,1603619184.0,Iamnotbroke,0.91,/r/shittymoviedetails/comments/jhqtvn/in_john_wick_2014_gold_coins_are_used_as/,shittymoviedetails,954480,3
"In Aquaman (2018), Willem Dafoe was cast as a good guy for once, making him dafriend of Aquaman.",30540,kmguro,https://i.redd.it/6z52xgx2e5861.jpg,222,1609257109.0,pale_guy_,0.95,/r/shittymoviedetails/comments/kmguro/in_aquaman_2018_willem_dafoe_was_cast_as_a_good/,shittymoviedetails,954480,3
In Justice League (2017) Superman is seen carrying an entire building. This shows that even physics has given up on this movie at this point.,30466,reo399,https://i.redd.it/wils60fbv3581.jpg,797,1639312206.0,pale_guy_,0.94,/r/shittymoviedetails/comments/reo399/in_justice_league_2017_superman_is_seen_carrying/,shittymoviedetails,954480,3
"In Spider-Man 2 (2002), Dr. Otto Octavius was an ordinary man who had four mechanical arms fused into his spine. This apparently explains how he can shrug off multiple punches to the face from a guy who can stop a train with his bare hands.",30082,xv9k9h,https://i.redd.it/a7cew58a2rr91.jpg,793,1664872404.0,AdvocateSaint,0.95,/r/shittymoviedetails/comments/xv9k9h/in_spiderman_2_2002_dr_otto_octavius_was_an/,shittymoviedetails,954480,3
"In The Dark Knight (2008), billionaire Bruce Wayne was so busy beating up poor criminals that he was not suspicious when his ex was replaced with an imposter.",30057,ottyr6,https://i.redd.it/84c6urd3c4e71.jpg,523,1627549952.0,pale_guy_,0.95,/r/shittymoviedetails/comments/ottyr6/in_the_dark_knight_2008_billionaire_bruce_wayne/,shittymoviedetails,954480,3
"In Temple of Doom (1984), Indiana Jones acquires the Indiana Stones, to sell and pay off his Indiana loans, or else lose the house he Indiana owns",29949,u3ebl1,https://i.redd.it/2ip3vkhv1ht81.jpg,167,1649932173.0,AdvocateSaint,0.92,/r/shittymoviedetails/comments/u3ebl1/in_temple_of_doom_1984_indiana_jones_acquires_the/,shittymoviedetails,954480,3
"In The Lion King (2019), if you look closely you can notice the dust cloud spell out ""SEX"" in the sky.",29780,cyqb47,https://i.redd.it/7x18yx2p67k31.png,224,1567437575.0,RayInRed,0.94,/r/shittymoviedetails/comments/cyqb47/in_the_lion_king_2019_if_you_look_closely_you_can/,shittymoviedetails,954480,3
In Spider-Man (2002) Mary Jane asks Spider-Man who he is. This is because actress Kirsten Dunst wasn't aware she auditioned for a role in a Spider-Man movie.,29715,k935qi,https://i.redd.it/76axbuy4gy361.jpg,167,1607429662.0,pale_guy_,0.92,/r/shittymoviedetails/comments/k935qi/in_spiderman_2002_mary_jane_asks_spiderman_who_he/,shittymoviedetails,954480,3
"In Jeremiah Johnson (1975), Robert Redord's character gently moves his head up and down. This is a subtle nod",29472,boonm7,https://i.redd.it/94nnuep3t8y21.gif,204,1557868417.0,Jonhinchliffe10,0.96,/r/shittymoviedetails/comments/boonm7/in_jeremiah_johnson_1975_robert_redords_character/,shittymoviedetails,954480,3
"In Avengers: Infinity War (2018), Thanos can be seen using an Android since Apple prohibits villains from using iPhones.",29386,feupj6,https://i.redd.it/p3e1qftay8l41.jpg,133,1583585356.0,skyfall91404,0.95,/r/shittymoviedetails/comments/feupj6/in_avengers_infinity_war_2018_thanos_can_be_seen/,shittymoviedetails,954480,3
"In Spider-Man; Far From Home (2018) Peter Parker yells the phrase “what the fuck”. This has nothing to do with Sony or Disney, but is in fact my reaction to the Amazon rainforest fires that have been destroying the world’s most ecologically important areas for the last three weeks.",29358,ctv73c,https://i.redd.it/agpi3ja63zh31.jpg,220,1566467692.0,Rickmundo,0.9,/r/shittymoviedetails/comments/ctv73c/in_spiderman_far_from_home_2018_peter_parker/,shittymoviedetails,954480,3
"In the Little Mermaid (1991), Ariel meets an African mermaid from the Ivory Coast. This is because mermaids are fictional and can be black.",29209,c9awwm,https://i.imgur.com/lwMo8k1.png,1313,1562295432.0,PeterPorky,0.92,/r/shittymoviedetails/comments/c9awwm/in_the_little_mermaid_1991_ariel_meets_an_african/,shittymoviedetails,954480,3
"Martin Scorsese named his movie The IrishMAN to trick superhero fans of BatMAN, SuperMAN or SpiderMAN to watch real cinema.",29205,ju0qis,https://i.redd.it/wxzcsa1q07z51.png,599,1605354199.0,pale_guy_,0.87,/r/shittymoviedetails/comments/ju0qis/martin_scorsese_named_his_movie_the_irishman_to/,shittymoviedetails,954480,3
"Titanic (1997) has a continuity error. A man sings, ""As I walk through the valley of the shadow of death,"" the opening line from Coolio's Gangsta's Paradise. The Titanic sunk in 1912 so there is no way he could've ever heard this song, as it was released in 1995.",29177,113cm8f,https://v.redd.it/k81cfo23yfia1,418,1676505737.0,-Wayward_Son-,0.94,/r/shittymoviedetails/comments/113cm8f/titanic_1997_has_a_continuity_error_a_man_sings/,shittymoviedetails,954480,3
"In Kingsman: The Golden Circle (2017), the character Elton John is played by Elton John. Taron Egerton (who plays Elton John in real life) was unavailable for the role, as he was already in the film as Eggsy.",29069,btnpqs,https://i.redd.it/68fuqmq91s031.jpg,177,1558973028.0,WorkThatFunction,0.95,/r/shittymoviedetails/comments/btnpqs/in_kingsman_the_golden_circle_2017_the_character/,shittymoviedetails,954480,3
In ‘The Manalorian we see frog lady cross the galaxy protecting her eggs with her life. This is a reference to the lengths which most women will go to protect their eggs from the average Star Wars fan.,28991,qyx44z,https://i.redd.it/oml3jz4sty081.jpg,196,1637508056.0,Iamnotbroke,0.95,/r/shittymoviedetails/comments/qyx44z/in_the_manalorian_we_see_frog_lady_cross_the/,shittymoviedetails,954480,3
"In the Raimi Spider-Man movies, the suit originally didn't have any lenses but Tobey Maguire would keep threatening the stuntman behind the scenes telling him he would put dirt in his eye so they settled with protective lenses for the stuntman's safety.",28825,s2ztg4,https://i.redd.it/sfhlbgr9mgb81.png,163,1642081644.0,pale_guy_,0.95,/r/shittymoviedetails/comments/s2ztg4/in_the_raimi_spiderman_movies_the_suit_originally/,shittymoviedetails,954480,3
"In Avengers: Infinity War (2018) Steve Rogers says, “We don’t trade lives, Vision.” Steve then proceeds to have the entire Wakadan army killed in an attempt to protect Vision. This is reference to the fact that Steve Rogers is from the 1920s and wouldn’t have considered Africans as people.",28817,un97sz,https://i.redd.it/2qx86kxnguy81.jpg,660,1652273757.0,-Wayward_Son-,0.94,/r/shittymoviedetails/comments/un97sz/in_avengers_infinity_war_2018_steve_rogers_says/,shittymoviedetails,954480,3
"In Breaking Bad, the protagonist Walter White used to be Walter Grey until he fought the Balrog and was reborn.",28795,i8zm23,https://i.redd.it/lkfvyr1xqrg51.jpg,129,1597324136.0,RayInRed,0.9,/r/shittymoviedetails/comments/i8zm23/in_breaking_bad_the_protagonist_walter_white_used/,shittymoviedetails,954480,3
"In Knives Out (2019), a bunch of knives are hanging out. This is why the movie is called Knives Out.",28578,malt3m,https://i.redd.it/2sloob0fjko61.png,215,1616414333.0,Tokyono,0.95,/r/shittymoviedetails/comments/malt3m/in_knives_out_2019_a_bunch_of_knives_are_hanging/,shittymoviedetails,954480,3
"In Terminator 2: Judgement Day (1991), the molten steel special effect was achieved with vats of milk lit from below with orange lights. The T-1000's dramatic death sequence was largely unscripted; Robert Patrick was not told about the milk, and was lactose intolerant. His reaction here is 100% real",28381,u2uwxl,https://i.redd.it/pgksp8maubt81.gif,253,1649869082.0,AdvocateSaint,0.95,/r/shittymoviedetails/comments/u2uwxl/in_terminator_2_judgement_day_1991_the_molten/,shittymoviedetails,954480,3
"In the Marvel Cinematic Universe, many characters changed their hairstyles.",28198,nqk62g,https://i.redd.it/w7djvzx4eu271.jpg,372,1622635242.0,pale_guy_,0.96,/r/shittymoviedetails/comments/nqk62g/in_the_marvel_cinematic_universe_many_characters/,shittymoviedetails,954480,3
It took roughly 12 years for Robert Pattinson to finally become a bat after being cast as a vampire in Twilight.,28158,ji7efi,https://i.imgur.com/6wYsNoE.jpg,123,1603682940.0,RayInRed,0.95,/r/shittymoviedetails/comments/ji7efi/it_took_roughly_12_years_for_robert_pattinson_to/,shittymoviedetails,954480,3
In Need for Speed (2014) Aaron Paul can be seen stopping his car many times in the movie which means that his breaking isn't bad.,28049,wy9xbd,https://i.redd.it/0l5ho142d2k91.jpg,140,1661522306.0,pale_guy_,0.94,/r/shittymoviedetails/comments/wy9xbd/in_need_for_speed_2014_aaron_paul_can_be_seen/,shittymoviedetails,954480,3
In Knives Out (2019) the whole movie is just a black screen for 3 hours with the faint sound of my neighbors talking in the distance. This is a reference to how my house hasn't had power for 49 hours and I'm starting to lose my grip on reality.,27736,i8ix12,https://i.redd.it/17aew0xt4mg51.jpg,266,1597256075.0,PapaJaundice,0.93,/r/shittymoviedetails/comments/i8ix12/in_knives_out_2019_the_whole_movie_is_just_a/,shittymoviedetails,954480,3
"In Dark Phoenix (2019), Jean Grey can be seen wearing grey, a reference to the fact that she is Jean Grey.",27660,j4c3l3,https://i.redd.it/0c1wfzvo8uq51.jpg,408,1601712706.0,Likestuff12,0.93,/r/shittymoviedetails/comments/j4c3l3/in_dark_phoenix_2019_jean_grey_can_be_seen/,shittymoviedetails,954480,3
Stranger Things actor Finn Wolfhard actually appeared in Pulp Fiction (1994).,27658,mqyty3,https://i.redd.it/lzx3pim447t61.jpg,176,1618430785.0,pale_guy_,0.94,/r/shittymoviedetails/comments/mqyty3/stranger_things_actor_finn_wolfhard_actually/,shittymoviedetails,954480,3
"There are many logic leaps in the MCU. However in the latest episode of She-Hulk: Attorney at Law (2022), we are meant to believe the main character Jen (pictured) has trouble finding matches on tinder. Get tf out",27578,x90pbd,https://i.redd.it/90waktf01nm91.jpg,495,1662644099.0,KennKennyKenKen,0.9,/r/shittymoviedetails/comments/x90pbd/there_are_many_logic_leaps_in_the_mcu_however_in/,shittymoviedetails,954480,3
"When with Tony, the shirt Peter wears in Spider-man: Homecoming (2017) is the same as the one Pepper wears in Iron Man 3 (2013), a subtle nod to the fact that the shirt belongs to Tony and that he regularly sleeps with both of them.",27339,cp8j2a,https://i.redd.it/tbvjk6k1pyf31.jpg,288,1565591247.0,123batman456,0.97,/r/shittymoviedetails/comments/cp8j2a/when_with_tony_the_shirt_peter_wears_in_spiderman/,shittymoviedetails,954480,3
"In Toy Story 4, Bonnie names her toy “Forky”, even though he is clearly a spork. This shows that she is not very intelligent, later demonstrated when she cares more for a fucking utensil than a badass cowboy voiced by Tom Hanks. Andy trusted her! And this bitch treated my childhood hero like shit.",27328,gbkxoq,https://i.redd.it/cp35i7tjg6w41.jpg,393,1588349338.0,StuartRomano114,0.95,/r/shittymoviedetails/comments/gbkxoq/in_toy_story_4_bonnie_names_her_toy_forky_even/,shittymoviedetails,954480,3
"In Spider-Man: Homecoming (2017), actors Tom Holland and Ned (full name Netherlands) are not actually Dutch.",27237,tk0a1r,https://i.redd.it/oe6xf31d1xo81.jpg,139,1647946514.0,pale_guy_,0.94,/r/shittymoviedetails/comments/tk0a1r/in_spiderman_homecoming_2017_actors_tom_holland/,shittymoviedetails,954480,3
