title,score,id,url,num_comments,created,author,upvote_ratio,permalink,subreddit,subreddit_subscribers,depth
UPDATE: 30 pounds of bananas,49656,1185njd,https://i.redd.it/n4cxhl2zmlja1.jpg,710,1676992257.0,bethany_katherine,0.93,/r/Frugal/comments/1185njd/update_30_pounds_of_bananas/,Frugal,2834149,2
"Oh hey! It only took 20 years, but my student loans are at zero as of today",48101,gx5vo7,https://i.redd.it/srjx3279t3351.png,1050,1591368235.0,AmNotLost,0.93,/r/Frugal/comments/gx5vo7/oh_hey_it_only_took_20_years_but_my_student_loans/,Frugal,2834149,2
"The FCC just announced its plan to slash net neutrality rules, allowing ISPs to block apps, slow websites, and charge fees to control what you see & do online. Please call your congressperson! If enough of us speak up, we can stop this.",20381,7eprzq,https://www.battleforthenet.com/#bftn-action-form,1,1511343707.0,claire0,0.89,/r/Frugal/comments/7eprzq/the_fcc_just_announced_its_plan_to_slash_net/,Frugal,2834149,2
"147 Days Ago, I proudly posted my account balance, having saved just over $2000 in 4 months after starting at $12 in my account, working at $11/hr in Chicago by making a budget plan compiled from tips found around r/frugal. Today, I’ve saved an additional $1000 by tweaking those tips just a bit.",16482,8ma79z,https://i.redd.it/aug2oyh6e7011.jpg,813,1527341921.0,Atlas_Black,0.89,/r/Frugal/comments/8ma79z/147_days_ago_i_proudly_posted_my_account_balance/,Frugal,2834149,2
"Whenever I get a dish sponge that is past its lifetime for washing dishes, I always cut it in half and then retire those sponges for household cleaning around the bathroom and other dirty areas. Cutting in half make sure that they never get used for dishes again.",13508,9rm95v,https://imgur.com/JZDp5Ci,371,1540571339.0,IAmAPhysicsGuy,0.93,/r/Frugal/comments/9rm95v/whenever_i_get_a_dish_sponge_that_is_past_its/,Frugal,2834149,2
Some cheap Rit dye made my old backpack look new again.,11756,k7kwzo,https://i.redd.it/h066vv5o7h361.jpg,251,1607220994.0,dogmetal,0.96,/r/Frugal/comments/k7kwzo/some_cheap_rit_dye_made_my_old_backpack_look_new/,Frugal,2834149,2
"Bought 30 pounds of bananas for super cheap, what should I make?",11307,117fk50,https://i.redd.it/n34bkdeyafja1.jpg,2962,1676915574.0,bethany_katherine,0.91,/r/Frugal/comments/117fk50/bought_30_pounds_of_bananas_for_super_cheap_what/,Frugal,2834149,2
‘I see no way out’: Living paycheck to paycheck is disturbingly common,11262,aav117,http://www.philly.com/jobs/labor/i-see-no-way-out-living-paycheck-paycheck-is-disturbingly-common-20181228.html,1716,1546167469.0,Maxcactus,0.95,/r/Frugal/comments/aav117/i_see_no_way_out_living_paycheck_to_paycheck_is/,Frugal,2834149,2
Scholastic is offering free online courses so your kids can keep learning while schools are closed,11033,fj7tke,https://www.cnn.com/2020/03/15/us/scholastic-coronavirus-students-trnd/index.html,111,1584303685.0,WarpSeven,0.97,/r/Frugal/comments/fj7tke/scholastic_is_offering_free_online_courses_so/,Frugal,2834149,2
National Park Service to waive entrance fees at open parks to aid social distancing,10662,fkw8no,https://www.cnn.com/2020/03/18/politics/national-parks-service-coronavirus/index.html,278,1584562302.0,WarpSeven,0.97,/r/Frugal/comments/fkw8no/national_park_service_to_waive_entrance_fees_at/,Frugal,2834149,2
"A little cleaning and a $30 leather repair kit, and it's almost as good as new!",10624,ji3hvq,https://imgur.com/v5PQpb4,139,1603667955.0,IAmAPhysicsGuy,0.97,/r/Frugal/comments/ji3hvq/a_little_cleaning_and_a_30_leather_repair_kit_and/,Frugal,2834149,2
"In an effort to make my iced tea obsession less expensive and also in trying to be less wasteful, I took the labels off of a pack of Snapple bottles and I've been using them to make my own iced tea for a while. It's seriously has cut my drink cost down by like 90%",9205,gtq9qw,https://i.redd.it/jprurl5d80251.jpg,359,1590889036.0,paigeelizabeth3660,0.96,/r/Frugal/comments/gtq9qw/in_an_effort_to_make_my_iced_tea_obsession_less/,Frugal,2834148,2
Actual cost of McDonald's items,9158,5kw820,http://m.imgur.com/3oWuRHw?r,1086,1483007943.0,Maxcactus,0.85,/r/Frugal/comments/5kw820/actual_cost_of_mcdonalds_items/,Frugal,2834148,2
You are allowed to refill squeeze tubes of jam with regular jam. The government can't stop you.,8135,t8ct5r,https://imgur.com/AeZkTTq,360,1646613478.0,Ajreil,0.92,/r/Frugal/comments/t8ct5r/you_are_allowed_to_refill_squeeze_tubes_of_jam/,Frugal,2834148,2
ALWAYS check the per unit pricing. This is the most blatant example I have ever come across,8085,d86n6p,https://i.redd.it/8xkiaglzjco31.jpg,329,1569245830.0,thenewyorkgod,0.96,/r/Frugal/comments/d86n6p/always_check_the_per_unit_pricing_this_is_the/,Frugal,2834148,2
/r/frugal supports a free and open internet.,8029,6mttvw,https://www.reddit.com/r/Frugal/comments/6mttvw/rfrugal_supports_a_free_and_open_internet/,5,1499865125.0,claire0,0.91,/r/Frugal/comments/6mttvw/rfrugal_supports_a_free_and_open_internet/,Frugal,2834148,2
"2 yrs ago, I was #23 of r/all for a post I made here about how I had used tips from r/povertyfinance & this subreddit to save $3000 in 3 months, & be debt free while working min. wage in Chicago. Yesterday, after 2 more years of saving, my fiancé & I finalized the purchase of a new house in Texas.",7771,idggy0,https://i.redd.it/9cft7e43g7i51.jpg,334,1597949986.0,Atlas_Black,0.95,/r/Frugal/comments/idggy0/2_yrs_ago_i_was_23_of_rall_for_a_post_i_made_here/,Frugal,2834148,2
Save clothes from the trash with a $10 fabric shaver. Sweater went from fuzzy and pilled to like new in a matter of minutes.,6895,gc1ggo,https://i.redd.it/3h1fftunkaw41.jpg,256,1588399148.0,paigeelizabeth3660,0.97,/r/Frugal/comments/gc1ggo/save_clothes_from_the_trash_with_a_10_fabric/,Frugal,2834149,2
Tourists in Hawaii are driving U-Hauls because rental cars are so expensive,6783,n4ke31,https://www.washingtonpost.com/travel/2021/05/03/hawaii-uhaul-car-rental-shortage/,392,1620121525.0,Maxcactus,0.98,/r/Frugal/comments/n4ke31/tourists_in_hawaii_are_driving_uhauls_because/,Frugal,2834149,2
"Unclaimed property office -- legit money I didn't know I was owed! Search your state's database, I found this in Michigan",6694,lfn5ir,https://i.redd.it/a553j11ttbg61.jpg,437,1612821824.0,AmNotLost,0.97,/r/Frugal/comments/lfn5ir/unclaimed_property_office_legit_money_i_didnt/,Frugal,2834149,2
"Easy, cheap, and inflation proof at $2.21 a portion",6405,t3sd6z,https://i.redd.it/a8cvxleelnk81.jpg,631,1646088732.0,GeorgiaDevil,0.86,/r/Frugal/comments/t3sd6z/easy_cheap_and_inflation_proof_at_221_a_portion/,Frugal,2834149,2
Every pair of jeans that start to wear out become jorts in this household.,6319,ndqylp,https://i.redd.it/ooz1qato5iz61.jpg,268,1621179573.0,dogmetal,0.96,/r/Frugal/comments/ndqylp/every_pair_of_jeans_that_start_to_wear_out_become/,Frugal,2834149,2
"Today on why I like my bread machine, I made 6 hoagie rolls for $0.09 each instead of buying them at the bakery for $1-3 each! (Yes, I should have made them longer and less potato like, but this was the first attempt).",5738,ojrflo,https://i.redd.it/wf7mqta6b2b71.jpg,270,1626217890.0,RelayFX,0.96,/r/Frugal/comments/ojrflo/today_on_why_i_like_my_bread_machine_i_made_6/,Frugal,2834148,2
Spam mac and cheese lunch for the week- $1.80 per portion,5338,zjbl1y,https://i.redd.it/yfeuirzcwd5a1.jpg,451,1670796687.0,GeorgiaDevil,0.9,/r/Frugal/comments/zjbl1y/spam_mac_and_cheese_lunch_for_the_week_180_per/,Frugal,2834148,2
"The best gift advice I've ever received is to buy an expensive version of something that's normally cheap. A $20 shirt is just a shirt, but a $20 pen is a pretty solid pen.",5321,ralgvv,https://www.reddit.com/r/Frugal/comments/ralgvv/the_best_gift_advice_ive_ever_received_is_to_buy/,478,1638835076.0,Ajreil,0.95,/r/Frugal/comments/ralgvv/the_best_gift_advice_ive_ever_received_is_to_buy/,Frugal,2834148,2
"Every year my dad make 150$-300$ by picking up cans on the side of the road when he walks, and we arnt even in a state that has can deposit.",5157,934l4t,https://www.reddit.com/r/Frugal/comments/934l4t/every_year_my_dad_make_150300_by_picking_up_cans/,407,1532961411.0,Not_so_ghetto,0.9,/r/Frugal/comments/934l4t/every_year_my_dad_make_150300_by_picking_up_cans/,Frugal,2834148,2
"Rather than spending around $3.50 for 6 garbage store bought bagels or $1+ per bagel for authentic New York bagels, I made bagels for the first time. It only cost me $0.688 for all 8 or $0.086 per bagel!",4942,u34nwl,https://www.reddit.com/gallery/u34nwl,323,1649896132.0,RelayFX,0.94,/r/Frugal/comments/u34nwl/rather_than_spending_around_350_for_6_garbage/,Frugal,2834149,2
I've come a long way from that newly divorcee who couldn't get a secured credit card without a co-signer,4920,egpkfu,https://i.redd.it/mpxq0j20wc741.png,259,1577530974.0,AmNotLost,0.95,/r/Frugal/comments/egpkfu/ive_come_a_long_way_from_that_newly_divorcee_who/,Frugal,2834149,2
8 years and $36k in credit card debt finally paid off!,4892,7x1nbq,https://www.reddit.com/r/Frugal/comments/7x1nbq/8_years_and_36k_in_credit_card_debt_finally_paid/,269,1518450872.0,thenewyorkgod,0.94,/r/Frugal/comments/7x1nbq/8_years_and_36k_in_credit_card_debt_finally_paid/,Frugal,2834149,2
LPT: a bidet is cheaper than buying toilet paper(after a few months) specially a great thing to have when during inevitable toilet paper shortages that will happen.,4590,fhno6j,https://www.reddit.com/r/Frugal/comments/fhno6j/lpt_a_bidet_is_cheaper_than_buying_toilet/,284,1584047368.0,Not_so_ghetto,0.94,/r/Frugal/comments/fhno6j/lpt_a_bidet_is_cheaper_than_buying_toilet/,Frugal,2834149,2
