title,score,id,url,num_comments,created,author,upvote_ratio,permalink,subreddit,subreddit_subscribers,depth
NHS employees preparing to go on strike after rejecting five per cent pay increase,5505,xp8pqy,https://www.dailyrecord.co.uk/news/scottish-news/nhs-employees-preparing-go-strike-28078891,591,1664260013.0,Visual-Wonder-3017,0.97,/r/unitedkingdom/comments/xp8pqy/nhs_employees_preparing_to_go_on_strike_after/,unitedkingdom,1404691,2
Squatters invade £25m London mansion of Russian oligarch in protest over war in Ukraine,5486,tdu2du,https://www.lbc.co.uk/news/squatters-invade-london-mansion-russian-oligarch-belgravia/,457,1647252365.0,Cheapo-Git,0.97,/r/unitedkingdom/comments/tdu2du/squatters_invade_25m_london_mansion_of_russian/,unitedkingdom,1404691,2
NHS staff abused by people seeking second Covid jab early for holiday,5470,ohem8k,https://www.theguardian.com/society/2021/jul/10/nhs-staff-abused-by-people-seeking-second-covid-jab-early-for-holiday?CMP=Share_AndroidApp_Other,935,1625904026.0,BlackMixen,0.95,/r/unitedkingdom/comments/ohem8k/nhs_staff_abused_by_people_seeking_second_covid/,unitedkingdom,1404691,2
BREAKING Met Police sued in High Court for 'not properly investigating' Boris Johnson over Partygate,5472,vnhgby,https://www.mirror.co.uk/news/politics/breaking-met-police-sued-high-27358794,182,1656513850.0,ainbheartach,0.97,/r/unitedkingdom/comments/vnhgby/breaking_met_police_sued_in_high_court_for_not/,unitedkingdom,1404691,2
Far-right parties and conspiracy theorists ‘roundly rejected’ at polls,5467,uk6szi,https://www.independent.co.uk/news/uk/politics/far-right-parties-local-election-results-for-britain-b2073353.html,790,1651903115.0,masterblaster0,0.92,/r/unitedkingdom/comments/uk6szi/farright_parties_and_conspiracy_theorists_roundly/,unitedkingdom,1404691,2
J.K. Rowling tops ‘Person of the Year’ award poll — and it’s quickly closed,5423,rrdnfl,https://wegotthiscovered.com/movies/j-k-rowling-tops-person-of-the-year-award-poll-and-its-quickly-closed/,1490,1640799290.0,casualphilosopher1,0.89,/r/unitedkingdom/comments/rrdnfl/jk_rowling_tops_person_of_the_year_award_poll_and/,unitedkingdom,1404691,2
"Britain could reach 40C by mid-July, forecast computer models predict for first time",5421,vuvsvr,https://news.sky.com/story/britain-could-reach-40c-by-mid-july-forecast-computer-models-predict-for-first-time-12648278,1256,1657349421.0,esprit-de-lescalier,0.95,/r/unitedkingdom/comments/vuvsvr/britain_could_reach_40c_by_midjuly_forecast/,unitedkingdom,1404691,2
Carriegate: No 10 admits pressuring The Times to drop Carrie Johnson story,5419,vgk0h9,https://www.independent.co.uk/news/uk/politics/boris-johnson-carriegate-times-story-b2105025.html,463,1655726984.0,ainbheartach,0.97,/r/unitedkingdom/comments/vgk0h9/carriegate_no_10_admits_pressuring_the_times_to/,unitedkingdom,1404691,2
Tony Blair tells Starmer to drop ‘woke’ politics and focus on economy,5398,uoms5i,https://www.theguardian.com/politics/2022/may/13/tony-blair-tells-keir-starmer-to-drop-woke-politics-and-focus-on-economy-labour,2290,1652429110.0,ClassicFlavour,0.91,/r/unitedkingdom/comments/uoms5i/tony_blair_tells_starmer_to_drop_woke_politics/,unitedkingdom,1404691,2
UK fuel shortage: Long petrol station queues as drivers defy appeals not to panic buy,5394,pv2990,https://www.mirror.co.uk/money/breaking-uk-fuel-shortage-desperate-25061303,1700,1632556137.0,Mighty_L_LORT,0.95,/r/unitedkingdom/comments/pv2990/uk_fuel_shortage_long_petrol_station_queues_as/,unitedkingdom,1404691,2
Martin Lewis warns of ‘civil unrest’ amid worsening cost-of-living crisis,5391,u13o35,https://www.independent.co.uk/business/martin-lewis-civil-unrest-costofliving-crisis-b2054843.html?utm_content=Echobox&utm_medium=Social&utm_campaign=Main&utm_source=Twitter#Echobox=1649586720,943,1649669195.0,Mobalise_Anarchise,0.96,/r/unitedkingdom/comments/u13o35/martin_lewis_warns_of_civil_unrest_amid_worsening/,unitedkingdom,1404691,2
"Retirees 'disgusted' by £4.25 state pension increase amid 'never ending' price rises As the cost of living crisis continues, pensioners have told The Mirror that the state pension increase simply isn’t enough. Retired teacher Sue called the minimal rise “insulting to pensioners”",5379,u1t7ui,https://www.mirror.co.uk/money/retirees-disgusted-425-state-pension-26688003,1423,1649748041.0,Visual-Wonder-3017,0.95,/r/unitedkingdom/comments/u1t7ui/retirees_disgusted_by_425_state_pension_increase/,unitedkingdom,1404691,2
Anti-Cancel Culture Conference Featuring Nigel Farage Has Been Cancelled,5359,ra1e8k,https://www.unilad.co.uk/news/anti-cancel-culture-conference-featuring-nigel-farage-has-been-cancelled/,724,1638775049.0,CJBill,0.95,/r/unitedkingdom/comments/ra1e8k/anticancel_culture_conference_featuring_nigel/,unitedkingdom,1404691,2
Time Magazine unveils its commemorative cover of the late Queen Elizabeth II.,5353,x9muqg,https://i.redd.it/5dfcsxyoqrm91.jpg,211,1662701162.0,TheRealMykola,0.93,/r/unitedkingdom/comments/x9muqg/time_magazine_unveils_its_commemorative_cover_of/,unitedkingdom,1404691,2
Landlords will have to ‘take the hit' and accept lower restaurant rents,5344,l6u6sn,https://www.thecaterer.com/news/christie-co-restaurant-landlords-coronavirus,664,1611832308.0,UnstatesmanlikeChi,0.98,/r/unitedkingdom/comments/l6u6sn/landlords_will_have_to_take_the_hit_and_accept/,unitedkingdom,1404691,2
Tory MP calling for delay to UK climate action has banked £150k from oil firm,5272,qiy2eh,https://www.opendemocracy.net/en/opendemocracyuk/tory-mp-calling-for-delay-to-uk-climate-action-has-banked-150k-from-oil-firm/,306,1635586711.0,apple_kicks,0.97,/r/unitedkingdom/comments/qiy2eh/tory_mp_calling_for_delay_to_uk_climate_action/,unitedkingdom,1404691,2
Family evicted from temporary housing in London for not attending viewing 180 miles away in Stoke-on-Trent,5276,oufl8e,https://inews.co.uk/news/family-evicted-temporary-housing-london-viewing-stoke-on-trent-1122958,608,1627627989.0,twistedLucidity,0.97,/r/unitedkingdom/comments/oufl8e/family_evicted_from_temporary_housing_in_london/,unitedkingdom,1404691,2
Tory police minister slaps down chief's plea for cops to spare shoplifters stealing to eat | Police Minister Kit Malthouse said poverty 'doesn't cause crime' as he rejected plea for cops to show 'discretion' in the cost-of-living crisis,5264,usyaty,https://www.mirror.co.uk/news/politics/tory-police-minister-slaps-down-27005128,989,1652946709.0,qpl23,0.95,/r/unitedkingdom/comments/usyaty/tory_police_minister_slaps_down_chiefs_plea_for/,unitedkingdom,1404691,2
Boris Johnson 'spent £840 a roll on wallpaper' as SNP accuse PM of living like French king. The Prime Minister must come clean about the costs of the Downing Street flat refurbishment and over who paid the bills said the SNP.,5263,mzn39z,https://www.dailyrecord.co.uk/news/politics/boris-johnson-spent-840-roll-23990166,602,1619525634.0,bottish,0.96,/r/unitedkingdom/comments/mzn39z/boris_johnson_spent_840_a_roll_on_wallpaper_as/,unitedkingdom,1404691,2
"Tory MP Suella Braverman says ‘too many rely on benefits’, yet claimed £159,000 in expenses last year. Let’s unpick that",5239,vyfnu7,https://www.stylist.co.uk/news/politics/suella-braverman-benefits-expenses/682484,838,1657750892.0,BestButtons,0.97,/r/unitedkingdom/comments/vyfnu7/tory_mp_suella_braverman_says_too_many_rely_on/,unitedkingdom,1404691,2
Rishi Sunak set to become prime minister,5224,ycapos,https://www.bbc.co.uk/news/live/uk-politics-63327087?ns_mchannel=social&ns_source=twitter&ns_campaign=bbc_live&ns_linkname=63568c6240fad4042da790a2%26Rishi%20Sunak%20set%20to%20become%20prime%20minister%262022-10-24T13%3A00%3A18.414Z&ns_fee=0&pinned_post_locator=urn:asset:d1d548da-839e-479d-85ec-a32d93aa3ebb&pinned_post_asset_id=63568c6240fad4042da790a2&pinned_post_type=share,1660,1666616618.0,Alert-One-Two,0.92,/r/unitedkingdom/comments/ycapos/rishi_sunak_set_to_become_prime_minister/,unitedkingdom,1404691,2
Firefighters vote to strike over pay,5170,10p6qp1,https://www.bbc.co.uk/news/uk-64457843,948,1675095315.0,topotaul,0.97,/r/unitedkingdom/comments/10p6qp1/firefighters_vote_to_strike_over_pay/,unitedkingdom,1404691,2
UK petrol and diesel retailers accused of not passing on falling oil prices to drivers,5173,104n5vr,https://www.theguardian.com/money/2023/jan/06/uk-petrol-and-diesel-retailers-accused-of-not-passing-on-falling-oil-prices-to-drivers,550,1672987193.0,masterblaster0,0.97,/r/unitedkingdom/comments/104n5vr/uk_petrol_and_diesel_retailers_accused_of_not/,unitedkingdom,1404691,2
Rishi Sunak backtracks on pledge to fine patients £10 for missed GP appointments,5171,yflzrp,https://news.sky.com/story/rishi-sunak-backtracks-on-pledge-to-fine-patients-16310-for-missed-gp-appointments-12732266,963,1666957618.0,topotaul,0.96,/r/unitedkingdom/comments/yflzrp/rishi_sunak_backtracks_on_pledge_to_fine_patients/,unitedkingdom,1404691,2
"For Britain's vaccination success, we must thank our universal healthcare system After months of government misjudgments on Covid, the NHS has come to the rescue and given us a new sense of pride",5161,l0gb3z,https://www.theguardian.com/commentisfree/2021/jan/19/britain-vaccination-universal-healthcare-covid-nhs?CMP=Share_AndroidApp_Other,403,1611047861.0,Duanedoberman,0.94,/r/unitedkingdom/comments/l0gb3z/for_britains_vaccination_success_we_must_thank/,unitedkingdom,1404691,2
"Four-day week could alleviate cost of living crisis, thinktank claims",5137,xi3upt,https://www.theguardian.com/business/2022/sep/19/four-day-week-could-alleviate-cost-of-living-crisis-thinktank-claims,689,1663568352.0,printial,0.95,/r/unitedkingdom/comments/xi3upt/fourday_week_could_alleviate_cost_of_living/,unitedkingdom,1404691,2
Buckingham Palace to investigate claims that Meghan bullied Prince Andrew into having sex with teenage girls,5119,lxhztf,https://newsthump.com/2021/03/04/buckingham-palace-to-investigate-claims-that-meghan-bullied-prince-andrew-into-having-sex-with-teenage-girls/,452,1614855586.0,Currency_Cat,0.94,/r/unitedkingdom/comments/lxhztf/buckingham_palace_to_investigate_claims_that/,unitedkingdom,1404691,2
Animal Rebellion activists free 18 beagle puppies from testing facility,5104,zqlo0j,https://www.standard.co.uk/news/uk/animal-rebellion-activists-beagle-puppies-free-mbr-acres-testing-facility-b1048377.html,1201,1671534450.0,insomnimax_99,0.93,/r/unitedkingdom/comments/zqlo0j/animal_rebellion_activists_free_18_beagle_puppies/,unitedkingdom,1404691,2
Sterling collapses as investors fly into dollars,5069,xob2ha,https://www.msn.com/en-gb/money/other/sterling-collapses-as-investors-fly-into-dollars/ar-AA12d8Es,1128,1664172911.0,Mighty_L_LORT,0.96,/r/unitedkingdom/comments/xob2ha/sterling_collapses_as_investors_fly_into_dollars/,unitedkingdom,1404691,2
"Ghislaine Maxwell: Pilot says Prince Andrew, Bill Clinton and Trump flew on Epstein’s ‘Lolita Express’",5037,r5thop,https://www.independent.co.uk/news/world/americas/ghislaine-maxwell-pilot-epstein-trump-b1967112.html,733,1638295979.0,printial,0.97,/r/unitedkingdom/comments/r5thop/ghislaine_maxwell_pilot_says_prince_andrew_bill/,unitedkingdom,1404691,2
Emma Raducanu: British tennis star makes history and wins US Open,5028,pmgk26,http://news.sky.com/story/emma-raducanu-british-tennis-star-makes-history-and-wins-us-open-12405558,749,1631398332.0,Mistermiyagi93,0.95,/r/unitedkingdom/comments/pmgk26/emma_raducanu_british_tennis_star_makes_history/,unitedkingdom,1404691,2
Keir Starmer sacks shadow transport minister who backed rail strikes,5029,w9j1zy,https://www.bbc.co.uk/news/uk-politics-62325842,1793,1658938910.0,mathen,0.9,/r/unitedkingdom/comments/w9j1zy/keir_starmer_sacks_shadow_transport_minister_who/,unitedkingdom,1404691,2
Cartoon for @LondonEconomic [oc],4969,wt5bst,https://i.redd.it/y338jlr3yui91.png,193,1660996609.0,ferji,0.97,/r/unitedkingdom/comments/wt5bst/cartoon_for_londoneconomic_oc/,unitedkingdom,1404691,2
"With Trump gone, Britain is now the world’s leading international embarrassment",4951,pu07dx,https://www.independent.co.uk/voices/boris-johnson-global-britain-kermit-b1925727.html,889,1632418041.0,ainbheartach,0.86,/r/unitedkingdom/comments/pu07dx/with_trump_gone_britain_is_now_the_worlds_leading/,unitedkingdom,1404691,2
Healthcare jaws drop as Sajid Javid calls NHS ‘a defunct Blockbuster video rental store in the age of Netflix’,4930,v6vsg1,https://www.cityam.com/healthcare-jaws-drop-as-sajid-javid-calls-nhs-a-defunct-blockbuster-video-rental-store-in-the-age-of-netflix/,787,1654609084.0,KilgoreDude,0.96,/r/unitedkingdom/comments/v6vsg1/healthcare_jaws_drop_as_sajid_javid_calls_nhs_a/,unitedkingdom,1404691,2
"Don’t clap for us – we are not ‘heroes’ – we just need fair pay, safe staffing and PPE, say nurses",4905,ktarus,https://nursingnotes.co.uk/news/dont-clap-for-us-we-are-not-heroes-we-just-need-fair-pay-safe-staffing-and-ppe-say-nurses/,362,1610137051.0,Yogurt789,0.97,/r/unitedkingdom/comments/ktarus/dont_clap_for_us_we_are_not_heroes_we_just_need/,unitedkingdom,1404691,2
Boris Johnson seen without mask on crowded train - hours after hospital apology,4884,qyrsfl,https://www.mirror.co.uk/news/politics/boris-johnson-caught-without-mask-25508029,446,1637488379.0,GreyFoxNinjaFan,0.95,/r/unitedkingdom/comments/qyrsfl/boris_johnson_seen_without_mask_on_crowded_train/,unitedkingdom,1404691,2
Nadine Dorries hits BBC with £2bn funding cut as she freezes annual licence fee charge until 2024,4873,s56fd2,https://www.dailymail.co.uk/news/article-10406491/Nadine-Dorries-hits-BBC-2bn-funding-cut-freezes-annual-licence-fee-charge-2024.html,2105,1642317781.0,CJBill,0.95,/r/unitedkingdom/comments/s56fd2/nadine_dorries_hits_bbc_with_2bn_funding_cut_as/,unitedkingdom,1404691,2
Jeremy Corbyn shares an image of all the foodbanks in UK and it is bleak,4849,v57jp2,https://www.thelondoneconomic.com/news/jeremy-corbyn-shares-an-image-of-all-the-foodbanks-in-uk-and-it-is-bleak-325098/,969,1654410659.0,casualphilosopher1,0.92,/r/unitedkingdom/comments/v57jp2/jeremy_corbyn_shares_an_image_of_all_the/,unitedkingdom,1404691,2
Housing: Mission Impossible,4796,70miqa,https://i.imgur.com/OsqtrNB.jpg,789,1505639566.0,grepnork,0.99,/r/unitedkingdom/comments/70miqa/housing_mission_impossible/,unitedkingdom,1404691,2
‘There was no way to predict this’ explains man to nation full of people who predicted this,4789,l6bpa0,https://newsthump.com/2021/01/27/there-was-no-way-to-predict-this-explains-man-to-nation-full-of-people-who-predicted-this/,353,1611773618.0,Currency_Cat,0.97,/r/unitedkingdom/comments/l6bpa0/there_was_no_way_to_predict_this_explains_man_to/,unitedkingdom,1404691,2
Buy-to-let crisis to trigger property fire sale as landlords suffer losses,4792,zo1thd,https://www.telegraph.co.uk/property/uk/buy-to-let-crisis-trigger-property-fire-sale-landlords-suffer/,1059,1671265702.0,Caprylate,0.95,/r/unitedkingdom/comments/zo1thd/buytolet_crisis_to_trigger_property_fire_sale_as/,unitedkingdom,1404691,2
"The Queen could afford Prince Andrew’s settlement by making her own packed lunch and ditching Netflix, insists Kirstie Allsopp",4768,svhs06,https://newsthump.com/2022/02/16/the-queen-could-afford-prince-andrews-settlement-by-making-her-own-packed-lunch-and-ditching-netflix-insists-kirstie-allsopp/?fbclid=IwAR1FE_qx48kPeThM82QZvtPgiF_l3Hips6zU8uvHYGQgxZ5aS3dvqAb7Ds4,84,1645190337.0,tubaintothewildfern,0.97,/r/unitedkingdom/comments/svhs06/the_queen_could_afford_prince_andrews_settlement/,unitedkingdom,1404691,2
Nurses’ pay in England to fall 7% in a decade even after government offer,4763,or62at,https://www.theguardian.com/society/2021/jul/25/nurses-pay-in-england-to-fall-7-in-a-decade-even-after-government-offer?CMP=Share_AndroidApp_Other,618,1627192478.0,BlackMixen,0.97,/r/unitedkingdom/comments/or62at/nurses_pay_in_england_to_fall_7_in_a_decade_even/,unitedkingdom,1404691,2
"UK government plans 80% cuts to ‘world-leading’ anti-corruption work - Government accused of ‘turning its back on the world’, as leaks suggest cuts to anti-corruption, human rights and media freedom efforts",4764,m64qna,https://www.opendemocracy.net/en/opendemocracyuk/uk-government-plans-80-cuts-to-world-leading-anti-corruption-work/,413,1615885293.0,chowieuk,0.97,/r/unitedkingdom/comments/m64qna/uk_government_plans_80_cuts_to_worldleading/,unitedkingdom,1404691,2
As we all go out and vote today lets remind ourselves of the utterly shameful acts of the BBC during this election campaign,4761,e9lx0r,https://www.reddit.com/r/unitedkingdom/comments/e9lx0r/as_we_all_go_out_and_vote_today_lets_remind/,369,1576146346.0,KamikazeChief,0.94,/r/unitedkingdom/comments/e9lx0r/as_we_all_go_out_and_vote_today_lets_remind/,unitedkingdom,1404691,2
"Health Secretary won’t hold pay talks with nurses despite their offer to pause strike, cabinet minister says",4742,zimacy,https://www.independent.co.uk/news/uk/politics/steve-barclay-nurse-cleverly-strike-nhs-b2243025.html,412,1670751570.0,wb0verdrive,0.97,/r/unitedkingdom/comments/zimacy/health_secretary_wont_hold_pay_talks_with_nurses/,unitedkingdom,1404691,2
Treating the NHS like a charity rather than a severely underfunded public health service is the beginning of a slippery slope.,4731,g34gg0,https://www.vice.com/en_uk/article/pkenq9/nhs-raise-money-virgin-taxes,379,1587138264.0,grepnork,0.98,/r/unitedkingdom/comments/g34gg0/treating_the_nhs_like_a_charity_rather_than_a/,unitedkingdom,1404691,2
Nursing union the Royal College of Nursing announces first strike in its 106-year history,4712,yql38i,https://news.sky.com/story/nursing-union-the-royal-college-of-nursing-announces-first-strike-in-its-106-year-history-12742357,501,1668005481.0,topotaul,0.98,/r/unitedkingdom/comments/yql38i/nursing_union_the_royal_college_of_nursing/,unitedkingdom,1404691,2
Boris became PM with 92k votes. Boaty McBoatface got 124k and was overruled for being a bloody stupid idea....,4704,chyu87,https://www.reddit.com/r/unitedkingdom/comments/chyu87/boris_became_pm_with_92k_votes_boaty_mcboatface/,409,1564119168.0,esprit-de-lescalier,0.97,/r/unitedkingdom/comments/chyu87/boris_became_pm_with_92k_votes_boaty_mcboatface/,unitedkingdom,1404691,2
"Anti-vaxxer club boss, 56, dies of Covid after mocking people for getting 'experimental' vaccine and warning of 'big pharma' conspiracy in hundreds of Facebook messages",4693,oz7m75,https://www.dailymail.co.uk/news/article-9867589/Anti-vaxxer-club-boss-56-dies-Covid-mocking-people-getting-experimental-vaccine.html,772,1628259738.0,qpl23,0.93,/r/unitedkingdom/comments/oz7m75/antivaxxer_club_boss_56_dies_of_covid_after/,unitedkingdom,1404690,2
Boris Johnson news: PM’s approval rating drops to all-time low,4684,rdv0su,https://www.independent.co.uk/news/uk/politics/boris-johnson-news-live-party-update-b1973459.html,595,1639209907.0,HandOfThePing,0.97,/r/unitedkingdom/comments/rdv0su/boris_johnson_news_pms_approval_rating_drops_to/,unitedkingdom,1404690,2
"""Tories appropriate patriotism as row about flags easier than explaining NHS pay rise""",4679,mdjyd1,https://www.mirror.co.uk/news/uk-news/tories-appropriate-patriotism-row-flags-23798814,886,1616747063.0,Disillusioned_Pleb01,0.93,/r/unitedkingdom/comments/mdjyd1/tories_appropriate_patriotism_as_row_about_flags/,unitedkingdom,1404690,2
"Brexit, week 3",4662,kyxm8t,https://i.redd.it/k3bzgby33tb61.jpg,338,1610851531.0,TheSuspiciousKoala,0.96,/r/unitedkingdom/comments/kyxm8t/brexit_week_3/,unitedkingdom,1404690,2
Boris Johnson skips Cobra meeting as decision over Christmas restrictions goes unmade,4658,rki3j5,https://www.mirror.co.uk/news/politics/boris-johnson-skips-cobra-meeting-25739780,762,1639987352.0,chrisjd,0.96,/r/unitedkingdom/comments/rki3j5/boris_johnson_skips_cobra_meeting_as_decision/,unitedkingdom,1404690,2
Buckingham Palace 'should be open all year to pay for its upkeep',4657,w6q3zt,https://news.sky.com/story/buckingham-palace-should-be-open-all-year-to-pay-for-its-upkeep-12658005,851,1658648406.0,Cheapo-Git,0.94,/r/unitedkingdom/comments/w6q3zt/buckingham_palace_should_be_open_all_year_to_pay/,unitedkingdom,1404690,2
BP reports profits of £7bn as oil prices surge because of Ukraine war | BP,4645,we4d2d,https://www.theguardian.com/business/2022/aug/02/bp-profits-oil-prices-ukraine-war-energy-prices-cost-of-living-crisis,600,1659422031.0,CJBill,0.97,/r/unitedkingdom/comments/we4d2d/bp_reports_profits_of_7bn_as_oil_prices_surge/,unitedkingdom,1404690,2
'They're leaving in droves': UK faces bus driver shortage as HGV industry offers better pay,4641,qeonwd,https://news.sky.com/story/theyre-leaving-in-droves-uk-faces-bus-driver-shortage-as-hgv-industry-offers-better-pay-12442971,752,1635067086.0,chowieuk,0.97,/r/unitedkingdom/comments/qeonwd/theyre_leaving_in_droves_uk_faces_bus_driver/,unitedkingdom,1404690,2
Rishi Sunak asks homeless man in shelter if he ‘works in business’ before serving him a hot meal,4631,zu9834,https://www.independent.co.uk/tv/news/rishi-sunak-homeless-business-shelter-b2251063.html,536,1671886248.0,BestButtons,0.96,/r/unitedkingdom/comments/zu9834/rishi_sunak_asks_homeless_man_in_shelter_if_he/,unitedkingdom,1404690,2
"While the Tories dawdle over Russian gas, we have a £28bn plan to make energy cheap – and green: Insulating homes and investing in wind and solar are the only solutions to the energy crisis. But Johnson is busy pandering to climate deniers",4619,tcbs5u,https://www.theguardian.com/commentisfree/2022/mar/12/tories-russian-energy-cheap-green-insulating-homes-wind-solar-boris-johnson?CMP=fb_cif,507,1647072881.0,Mobalise_Anarchise,0.93,/r/unitedkingdom/comments/tcbs5u/while_the_tories_dawdle_over_russian_gas_we_have/,unitedkingdom,1404690,2
Cancer hell of Grenfell heroes: Up to a dozen firefighters who battled tower block inferno that killed 72 are now ill with several with rare terminal tumours caused by inhaling pollutants - amid fears more are yet to be diagnosed,4612,10aocrd,https://www.dailymail.co.uk/news/article-11629989/Up-dozen-Grenfell-Tower-firefighters-ill-cancer-caused-inhaling-pollutants.html,413,1673594635.0,Caprylate,0.96,/r/unitedkingdom/comments/10aocrd/cancer_hell_of_grenfell_heroes_up_to_a_dozen/,unitedkingdom,1404690,2
"Jeremy Corbyn will never stand for Labour again, say senior figures",4598,yur4qe,https://www.theguardian.com/politics/2022/nov/14/jeremy-corbyn-will-never-stand-for-labour-again-say-senior-figures?utm_source=facebook&utm_medium=news_tab,2407,1668407776.0,lighthouse77,0.92,/r/unitedkingdom/comments/yur4qe/jeremy_corbyn_will_never_stand_for_labour_again/,unitedkingdom,1404690,2
"House price rises outstrip salaries in huge swathes of country, keeping millions off the property ladder",4589,q53j0h,https://www.independent.co.uk/news/uk/politics/house-prices-lucy-powell-labour-b1934906.html,866,1633851782.0,HandOfThePing,0.98,/r/unitedkingdom/comments/q53j0h/house_price_rises_outstrip_salaries_in_huge/,unitedkingdom,1404690,2
Mel B calls James Corden as one of the ‘biggest d***heads in showbiz’,4583,zbfaed,https://www.independent.co.uk/arts-entertainment/tv/news/james-corden-mel-b-this-morning-b2237477.html,392,1670070932.0,ClassicFlavour,0.96,/r/unitedkingdom/comments/zbfaed/mel_b_calls_james_corden_as_one_of_the_biggest/,unitedkingdom,1404690,2
Conservative MP arrested over rape and sexual assault allegations spanning seven-year period,4574,urqp3r,https://news.sky.com/story/conservative-mp-arrested-over-rape-and-sexual-assault-allegations-spanning-seven-year-period-12615430,615,1652806046.0,Beanybunny,0.97,/r/unitedkingdom/comments/urqp3r/conservative_mp_arrested_over_rape_and_sexual/,unitedkingdom,1404690,2
"Boris Johnson had birthday bash during lockdown, ITV News understands | ITV News",4567,sbsja4,https://www.itv.com/news/2022-01-24/boris-johnson-had-birthday-bash-during-lockdown-itv-news-understands,540,1643048130.0,Disillusioned_Pleb01,0.97,/r/unitedkingdom/comments/sbsja4/boris_johnson_had_birthday_bash_during_lockdown/,unitedkingdom,1404690,2
Crisis for landlords as one in 12 tenants pays reduced rent | Buy-to-let investors suffer as cost-of-living crisis hammers renters' finances,4566,xetp45,https://www.telegraph.co.uk/property/buy-to-let/crisis-landlords-one-12-tenants-pays-reduced-rent/,1157,1663239211.0,BestButtons,0.92,/r/unitedkingdom/comments/xetp45/crisis_for_landlords_as_one_in_12_tenants_pays/,unitedkingdom,1404690,2
Greta Thunberg says claims that UK is a climate leader are 'a lie' as UNICEF report finds one billion children at 'high risk' from climate impacts,4554,p7xnxw,https://news.sky.com/story/greta-thunberg-says-claims-that-uk-is-a-climate-leader-are-a-lie-as-unicef-report-finds-1-billion-children-at-high-risk-from-climate-impacts-12385672,817,1629446246.0,esprit-de-lescalier,0.87,/r/unitedkingdom/comments/p7xnxw/greta_thunberg_says_claims_that_uk_is_a_climate/,unitedkingdom,1404690,2
"Title of “Andrew, the pizza-loving sex offender” finally passes to the next generation of high-profile deviant",4538,zz71v6,https://newsthump.com/2022/12/30/title-of-andrew-the-pizza-loving-sex-offender-finally-passes-to-the-next-generation-of-high-profile-deviant/,99,1672423385.0,CJBill,0.94,/r/unitedkingdom/comments/zz71v6/title_of_andrew_the_pizzaloving_sex_offender/,unitedkingdom,1404690,2
Just Stop Oil blockade M25 and declare it a ‘site of civil resistance’,4543,w3hrgw,https://www.standard.co.uk/news/uk/just-stop-oil-protest-m25-wisley-chertsey-surrey-london-b1013487.html,1554,1658308236.0,insomnimax_99,0.93,/r/unitedkingdom/comments/w3hrgw/just_stop_oil_blockade_m25_and_declare_it_a_site/,unitedkingdom,1404690,2
Sainsbury's asks shoppers and staff to keep wearing masks,4514,sd3ktx,https://www.bbc.co.uk/news/business-60137428,1362,1643195465.0,esprit-de-lescalier,0.93,/r/unitedkingdom/comments/sd3ktx/sainsburys_asks_shoppers_and_staff_to_keep/,unitedkingdom,1404690,2
