title,score,id,url,num_comments,created,author,upvote_ratio,permalink,subreddit,subreddit_subscribers,depth
"Queen Elizabeth II has died aged 96, Buckingham Palace announces",72351,x96jm9,https://news.sky.com/story/queen-elizabeth-ii-has-died-aged-96-buckingham-palace-announces-12692823,8588,1662658295.0,topotaul,0.79,/r/unitedkingdom/comments/x96jm9/queen_elizabeth_ii_has_died_aged_96_buckingham/,unitedkingdom,1404690,2
Teenager was fined for reporting stalker to police 5 times before he killed her,47731,mb9qg3,https://www.mirror.co.uk/news/uk-news/teenager-fined-reporting-stalker-police-23775721,2193,1616486685.0,chrisjd,0.95,/r/unitedkingdom/comments/mb9qg3/teenager_was_fined_for_reporting_stalker_to/,unitedkingdom,1404690,2
"A scene from ""V for Vendetta""? Nope, a silent vigil in London for a woman allegedly murdered by a serving police officer in 2021",35482,m4krxp,https://i.redd.it/qkscdf1gdwm61.jpg,2417,1615685671.0,KamikazeChief,0.88,/r/unitedkingdom/comments/m4krxp/a_scene_from_v_for_vendetta_nope_a_silent_vigil/,unitedkingdom,1404690,2
COVID-19: Boris Johnson announces new national lockdown for England,33883,kqgkwi,http://news.sky.com/story/covid-19-boris-johnson-announces-new-national-lockdown-for-england-12179371,8604,1609790579.0,topotaul,0.92,/r/unitedkingdom/comments/kqgkwi/covid19_boris_johnson_announces_new_national/,unitedkingdom,1404690,2
"The terrifying truth: Britain’s a hothouse, but one day 40C will seem cool - This extreme heat is just the beginning. We should be scared, and channel this emotion into action",27927,w1rqb6,https://www.theguardian.com/commentisfree/2022/jul/18/britain-hothouse-extreme-weather?CMP=fb_cif,4603,1658123380.0,Mobalise_Anarchise,0.86,/r/unitedkingdom/comments/w1rqb6/the_terrifying_truth_britains_a_hothouse_but_one/,unitedkingdom,1404690,2
"Boris Johnson has agreed to resign, but wants to stay on as PM until new Tory leader elected by autumn",26501,vtdfi7,https://www.theguardian.com/politics/live/2022/jul/07/boris-johnson-latest-resignations-today-conservatives-uk-politics-live?page=with:block-62c694908f088ba9fc80dfbe#block-62c694908f088ba9fc80dfbe,4943,1657181493.0,ainbheartach,0.94,/r/unitedkingdom/comments/vtdfi7/boris_johnson_has_agreed_to_resign_but_wants_to/,unitedkingdom,1404690,2
Queen under medical supervision as doctors are concerned for her health,20741,x8y5jy,https://news.sky.com/story/queen-under-medical-supervision-as-doctors-are-concerned-for-her-health-12692805,6528,1662636981.0,topotaul,0.88,/r/unitedkingdom/comments/x8y5jy/queen_under_medical_supervision_as_doctors_are/,unitedkingdom,1404690,2
Pound falls again following reports that Liz Truss has got out of bed,19980,xyneoa,https://newsthump.com/2022/10/06/pound-falls-again-following-reports-that-liz-truss-has-got-out-of-bed/,423,1665217682.0,Superbuddhapunk,0.95,/r/unitedkingdom/comments/xyneoa/pound_falls_again_following_reports_that_liz/,unitedkingdom,1404690,2
France accuses UK of ‘lack of humanity’ after 150 Ukraine refugees turned away at Calais - French minister writes strongly-worded letter to Priti Patel saying UK’s response ‘completely unsuitable’,19960,t7vc7w,https://www.independent.co.uk/news/uk/home-news/ukraine-refugees-france-uk-b2029536.html,1588,1646559274.0,Mobalise_Anarchise,0.92,/r/unitedkingdom/comments/t7vc7w/france_accuses_uk_of_lack_of_humanity_after_150/,unitedkingdom,1404690,2
Shell reports record profit of $39.9bn,19936,10rjsb9,http://www.bbc.co.uk/news/uk-64489147,1918,1675322251.0,Codydoc4,0.95,/r/unitedkingdom/comments/10rjsb9/shell_reports_record_profit_of_399bn/,unitedkingdom,1404690,2
Captain Sir Tom Moore dies at 100 after testing positive for Covid,19883,laz6mr,https://www.theguardian.com/uk-news/2021/feb/02/captain-sir-tom-moore-dies-at-100-after-testing-positive-for-covid?CMP=Share_AndroidApp_Other,2045,1612282136.0,Alex09464367,0.93,/r/unitedkingdom/comments/laz6mr/captain_sir_tom_moore_dies_at_100_after_testing/,unitedkingdom,1404690,2
From a recent Simpsons Episode,19786,p9g6gj,https://i.redd.it/er5o2c1bxxi71.jpg,527,1629651585.0,KamikazeChief,0.93,/r/unitedkingdom/comments/p9g6gj/from_a_recent_simpsons_episode/,unitedkingdom,1404690,2
Italy crush England’s dreams after winning Euro 2020 on penalties,19660,oidhjv,https://www.theguardian.com/football/2021/jul/11/italy-crush-england-dreams-after-winning-euro-2020-on-penalties?CMP=Share_AndroidApp_Other,2900,1626040587.0,BlackMixen,0.87,/r/unitedkingdom/comments/oidhjv/italy_crush_englands_dreams_after_winning_euro/,unitedkingdom,1404690,2
People started breaking Covid rules when they saw those with privilege ignore them,19354,kova7m,https://www.theguardian.com/commentisfree/2021/jan/02/follow-covid-restrictions-break-rules-compliance,919,1609582894.0,bintasaurus,0.95,/r/unitedkingdom/comments/kova7m/people_started_breaking_covid_rules_when_they_saw/,unitedkingdom,1404690,2
ENOUGH IS ENOUGH - The British public are going to run out of money.,18599,sggy2r,https://www.reddit.com/r/unitedkingdom/comments/sggy2r/enough_is_enough_the_british_public_are_going_to/,3492,1643571490.0,Richyro0,0.91,/r/unitedkingdom/comments/sggy2r/enough_is_enough_the_british_public_are_going_to/,unitedkingdom,1404690,2
Single mum survives on just one meal a day and has to use candles to light her house,17598,u5hunc,https://www.lincolnshirelive.co.uk/news/uk-world-news/single-mum-survives-just-one-6946419?fbclid=IwAR2jLVlswplSjU1vA8un5RHS-coF5M0KAJ_J2wlE61WKMm25mjnrXHCoYvE#l22ynkgfuahso1r7msj,3811,1650180192.0,lighthouse77,0.88,/r/unitedkingdom/comments/u5hunc/single_mum_survives_on_just_one_meal_a_day_and/,unitedkingdom,1404690,2
"Legal age someone can buy cigarettes should rise by a year every year, review recommends",17334,v8bypf,https://news.sky.com/story/legal-age-someone-can-buy-cigarettes-should-rise-by-a-year-every-year-review-recommends-12630498,2667,1654762626.0,topotaul,0.88,/r/unitedkingdom/comments/v8bypf/legal_age_someone_can_buy_cigarettes_should_rise/,unitedkingdom,1404690,2
"Chickens died of thirst and dead birds left to rot at suppliers to Tesco, Sainsbury, Lidl and KFC",15800,ov3bph,https://www.independent.co.uk/news/uk/home-news/chicken-tesco-sainsbury-sainsbury-kfc-lidl-aldi-welfare-b1893070.html,2363,1627718818.0,GarlicCornflakes,0.95,/r/unitedkingdom/comments/ov3bph/chickens_died_of_thirst_and_dead_birds_left_to/,unitedkingdom,1404690,2
"Brexit has Made Britain a More Expensive and Poorer Country, Say Voters",15214,10t7id6,https://www.bylinesupplement.com/p/brexit-has-made-britain-a-more-expensive,1315,1675493813.0,esprit-de-lescalier,0.94,/r/unitedkingdom/comments/10t7id6/brexit_has_made_britain_a_more_expensive_and/,unitedkingdom,1404690,2
Liz Truss will become UK's next prime minister after beating Rishi Sunak in race to succeed Boris Johnson,14720,x6e2dr,https://news.sky.com/story/liz-truss-will-become-uks-next-prime-minister-after-beating-rishi-sunak-in-race-to-succeed-boris-johnson-12686742,3522,1662377966.0,topotaul,0.91,/r/unitedkingdom/comments/x6e2dr/liz_truss_will_become_uks_next_prime_minister/,unitedkingdom,1404690,2
Landlords evicting hundreds during lockdown with government’s new ‘eviction ban’ loopholes,14562,lk8esf,https://www.independent.co.uk/news/uk/politics/eviction-ban-lockdown-extended-loopholes-landlords-b1802188.html,1754,1613373858.0,UnstatesmanlikeChi,0.95,/r/unitedkingdom/comments/lk8esf/landlords_evicting_hundreds_during_lockdown_with/,unitedkingdom,1404690,2
Brexiters left stunned after several EU countries demonstrate easy control of their own borders,13591,khfxls,https://newsthump.com/2020/12/21/brexiters-left-stunned-after-several-eu-countries-demonstrate-easy-control-of-their-own-borders/,973,1608551501.0,bilefreebill,0.93,/r/unitedkingdom/comments/khfxls/brexiters_left_stunned_after_several_eu_countries/,unitedkingdom,1404690,2
Abortion deleted from UK Government-organised international human rights statement,13019,w53o8e,https://humanists.uk/2022/07/19/abortion-deleted-from-uk-government-organised-international-human-rights-statement/,1322,1658472452.0,apple_kicks,0.94,/r/unitedkingdom/comments/w53o8e/abortion_deleted_from_uk_governmentorganised/,unitedkingdom,1404690,2
Call for wealth tax as UK billionaire numbers up by 20% since pandemic | The super-rich,12919,zpls8l,http://www.theguardian.com/news/2022/dec/19/call-for-wealth-tax-as-uk-billionaire-numbers-up-by-20-since-pandemic?CMP=fb_gu&utm_medium=Social&utm_source=Facebook#Echobox=1671434573,987,1671437280.0,Codydoc4,0.95,/r/unitedkingdom/comments/zpls8l/call_for_wealth_tax_as_uk_billionaire_numbers_up/,unitedkingdom,1404690,2
Half of Britons won't be celebrating Platinum Jubilee and think Royal Family is out of touch,12110,v3cxs3,https://inews.co.uk/news/politics/platinum-jubilee-queen-half-britons-wont-celebrate-royal-family-out-of-touch-poll-1665587,1345,1654187706.0,casualphilosopher1,0.9,/r/unitedkingdom/comments/v3cxs3/half_of_britons_wont_be_celebrating_platinum/,unitedkingdom,1404690,2
"Judge me on my record, insists man seemingly unaware his record is awful",11901,103rzue,https://newsthump.com/2023/01/04/judge-me-on-my-record-insists-man-seemingly-unaware-his-record-is-awful/,463,1672900777.0,Superbuddhapunk,0.95,/r/unitedkingdom/comments/103rzue/judge_me_on_my_record_insists_man_seemingly/,unitedkingdom,1404690,2
‘It’s ridiculous’: shock as some UK grocery prices rise by more than 20%,11797,uui3vq,https://www.theguardian.com/business/2022/may/21/uk-grocery-prices-rise-which,1929,1653118008.0,printial,0.96,/r/unitedkingdom/comments/uui3vq/its_ridiculous_shock_as_some_uk_grocery_prices/,unitedkingdom,1404690,2
Bill Bailey has put himself forward for the UK's Eurovision 2022 entry,11689,nj5wxl,https://www.nme.com/news/tv/bill-bailey-has-put-himself-forward-for-the-uks-eurovision-2022-entry-2946487,788,1621769393.0,sincerityisscxry,0.96,/r/unitedkingdom/comments/nj5wxl/bill_bailey_has_put_himself_forward_for_the_uks/,unitedkingdom,1404690,2
"People have right to protest against monarchy this week, police say",11427,xd0gvd,https://www.standard.co.uk/news/uk/london-people-scotland-oxford-king-b1025188.html,1614,1663052019.0,insomnimax_99,0.95,/r/unitedkingdom/comments/xd0gvd/people_have_right_to_protest_against_monarchy/,unitedkingdom,1404690,2
Prince Andrew asked to prove his inability to sweat by Virginia Giuffre’s lawyers,11318,rsp3gv,https://www.thetimes.co.uk/article/prince-andrew-asked-to-prove-his-inability-to-sweat-by-virginia-giuffres-lawyers-zgktnq6rl,888,1640938457.0,ainbheartach,0.97,/r/unitedkingdom/comments/rsp3gv/prince_andrew_asked_to_prove_his_inability_to/,unitedkingdom,1404690,2
Supreme Court rules Scottish Parliament can not hold an independence referendum without Westminster's approval,11265,z2l5o1,https://www.theguardian.com/politics/live/2022/nov/23/scottish-independence-referendum-supreme-court-scotland-pmqs-sunak-starmer-uk-politics-live-latest-news?page=with:block-637deea38f08edd1a151fe46#block-637deea38f08edd1a151fe46,3170,1669197583.0,Sir_Bantersaurus,0.93,/r/unitedkingdom/comments/z2l5o1/supreme_court_rules_scottish_parliament_can_not/,unitedkingdom,1404690,2
The Conservative Party is ‘Institutionally Corrupt’ Say Voters,11225,10n7xjk,https://www.bylinesupplement.com/p/the-conservative-party-is-institutionally,667,1674886228.0,esprit-de-lescalier,0.93,/r/unitedkingdom/comments/10n7xjk/the_conservative_party_is_institutionally_corrupt/,unitedkingdom,1404690,2
UK and EU announce post-Brexit trade deal - BBC News,11157,kjgm4r,https://www.bbc.co.uk/news/live/uk-politics-55433447,2100,1608821388.0,Mistermiyagi93,0.95,/r/unitedkingdom/comments/kjgm4r/uk_and_eu_announce_postbrexit_trade_deal_bbc_news/,unitedkingdom,1404690,2
London's New Year's Eve celebration pays tribute to Ukraine. Featuring Ukraine’s winning Eurovision Song Contest artist Kalush Orchestra.,11075,100djzg,https://v.redd.it/rqcc1k14ld9a1,813,1672554307.0,TheRealMykola,0.9,/r/unitedkingdom/comments/100djzg/londons_new_years_eve_celebration_pays_tribute_to/,unitedkingdom,1404690,2
Labour demands Boris Johnson quit immediately over 'national security risk' | It follows Boris Johnson’s admission he met a former Russian spy without either officials or his security team present,10776,vvmzsw,https://www.mirror.co.uk/news/politics/labour-demands-boris-johnson-quit-27440450,373,1657441474.0,qpl23,0.96,/r/unitedkingdom/comments/vvmzsw/labour_demands_boris_johnson_quit_immediately/,unitedkingdom,1404690,2
Cartoon for @LondonEconomic [oc],10470,xrwa4k,https://i.redd.it/7fl0xqmylyq91.png,137,1664527799.0,ferji,0.96,/r/unitedkingdom/comments/xrwa4k/cartoon_for_londoneconomic_oc/,unitedkingdom,1404690,2
Tampon tax abolished from today - The ‘tampon tax’ has been abolished - with a zero rate of VAT applying to women’s sanitary products coming into effect today,10378,koa2v4,https://www.gov.uk/government/news/tampon-tax-abolished-from-today,749,1609501782.0,TheSuspiciousKoala,0.95,/r/unitedkingdom/comments/koa2v4/tampon_tax_abolished_from_today_the_tampon_tax/,unitedkingdom,1404690,2
Boris Johnson apologises after admitting he attended Downing Street garden party in lockdown,10374,s24qkn,http://news.sky.com/story/boris-johnson-apologises-after-admitting-he-attended-downing-street-garden-party-12514197,1270,1641989091.0,Mistermiyagi93,0.94,/r/unitedkingdom/comments/s24qkn/boris_johnson_apologises_after_admitting_he/,unitedkingdom,1404690,2
"The Tories, in a stroke of political genius, have punished people so much, they now vote Tory",10237,n7j0bn,https://www.independent.co.uk/voices/hartlepool-labour-starmer-tories-brexit-austerity-b1843720.html,2615,1620455017.0,sensiblecentrist20,0.87,/r/unitedkingdom/comments/n7j0bn/the_tories_in_a_stroke_of_political_genius_have/,unitedkingdom,1404690,2
Independent Scotland would rejoin European Union - Sturgeon,10041,y5a4r8,https://www.bbc.co.uk/news/uk-scotland-scotland-politics-63260224,1845,1665903748.0,SwimmerGlass4257,0.92,/r/unitedkingdom/comments/y5a4r8/independent_scotland_would_rejoin_european_union/,unitedkingdom,1404690,2
Sign at Camden polling station earlier today.,9966,uiuysr,https://i.redd.it/oua9r29y2nx81.jpg,402,1651748598.0,KamikazeChief,0.96,/r/unitedkingdom/comments/uiuysr/sign_at_camden_polling_station_earlier_today/,unitedkingdom,1404690,2
Russian state TV presenter says Moscow should have bombed UK during Queen's funeral,9864,xjdj5y,https://uk.news.yahoo.com/russian-tv-bombed-uk-queen-funeral-114704857.html,1539,1663691641.0,Yogurt789,0.94,/r/unitedkingdom/comments/xjdj5y/russian_state_tv_presenter_says_moscow_should/,unitedkingdom,1404690,2
"The government has facilitated frauds and tax dodges running into tens of billions of pounds 'The UK economy is in dire straits. It has the highest level of reported government fraud, the highest level of taxation for 70 years, and the biggest decline in living standards since WW2'",9864,u0co1r,https://leftfootforward.org/2022/04/the-government-has-facilitated-frauds-and-tax-dodges-running-into-tens-of-billions-of-pounds/,1078,1649576001.0,Mobalise_Anarchise,0.96,/r/unitedkingdom/comments/u0co1r/the_government_has_facilitated_frauds_and_tax/,unitedkingdom,1404689,2
Voters believe 'nothing in Britain works anymore' as they give Labour huge poll lead,9811,zuszqf,https://www.mirror.co.uk/news/politics/voters-believe-nothing-britain-works-28794437,846,1671952393.0,casualphilosopher1,0.95,/r/unitedkingdom/comments/zuszqf/voters_believe_nothing_in_britain_works_anymore/,unitedkingdom,1404689,2
Keir Starmer leads calls for immediate general election,9766,y9l5fh,https://www.bbc.co.uk/news/uk-politics-63328852,708,1666330991.0,Alert-One-Two,0.96,/r/unitedkingdom/comments/y9l5fh/keir_starmer_leads_calls_for_immediate_general/,unitedkingdom,1404689,2
England players deserve better than their own fans booing them for taking a knee,9442,nr82hg,https://inews.co.uk/sport/football/england-fans-boo-taking-the-knee-players-deserve-better-1032896,2870,1622707347.0,tipodecinta,0.81,/r/unitedkingdom/comments/nr82hg/england_players_deserve_better_than_their_own/,unitedkingdom,1404689,2
"Boris Johnson confirms Rwanda migrant plans, saying those arriving by illegal routes will face ‘swift’ removal",9383,u3dwry,https://www.independent.co.uk/news/uk/politics/boris-johnson-uk-rwanda-migrants-plan-b2057913.html,3074,1649930614.0,ainbheartach,0.93,/r/unitedkingdom/comments/u3dwry/boris_johnson_confirms_rwanda_migrant_plans/,unitedkingdom,1404689,2
Four-day week trial confirms working less increases wellbeing and productivity,9314,zay0g0,https://theconversation.com/four-day-week-trial-confirms-working-less-increases-wellbeing-and-productivity-195660?utm_source=twitter&utm_medium=bylinetwitterbutton,667,1670015960.0,Overthrow_Capitalism,0.98,/r/unitedkingdom/comments/zay0g0/fourday_week_trial_confirms_working_less/,unitedkingdom,1404689,2
Nurses are ‘too important to be allowed to strike’ insists man who also believes they’re not important enough to be paid properly,8959,znayfu,https://newsthump.com/2022/12/15/nurses-are-too-important-to-be-allowed-to-strike-insists-man-who-also-believes-theyre-not-important-enough-to-be-paid-properly/,339,1671183939.0,marketrent,0.96,/r/unitedkingdom/comments/znayfu/nurses_are_too_important_to_be_allowed_to_strike/,unitedkingdom,1404689,2
England charged after 'laser' incident,8941,og4ugo,https://www.bbc.co.uk/sport/football/57763001,1380,1625741861.0,echoesreach,0.96,/r/unitedkingdom/comments/og4ugo/england_charged_after_laser_incident/,unitedkingdom,1404689,2
Viral video of Boris Johnson ‘lying to parliament’ approaches 10 million views,8866,mqm0xd,https://www.independent.co.uk/climate-change/news/boris-johnson-lies-viral-video-b1830732.html?fbclid=IwAR0_GTmVxUNcEBoh6w0ZF59g_baacgsRdPAnSTrwynI9DFETI13pSeW-eik,502,1618387598.0,chrisjd,0.96,/r/unitedkingdom/comments/mqm0xd/viral_video_of_boris_johnson_lying_to_parliament/,unitedkingdom,1404689,2
Over 70k people fined for lockdown parties - but cops won't probe No10 Xmas bash,8712,rcf8xx,https://www.mirror.co.uk/news/politics/over-70k-brits-fined-illegal-25651159,611,1639047154.0,tipodecinta,0.97,/r/unitedkingdom/comments/rcf8xx/over_70k_people_fined_for_lockdown_parties_but/,unitedkingdom,1404689,2
Euro 2022: Lionesses win final with extra-time victory over Germany,8675,wcvi6i,https://news.sky.com/story/euro-2022-lionesses-win-final-with-extra-time-victory-over-germany-12662936,1018,1659292413.0,Mistermiyagi93,0.91,/r/unitedkingdom/comments/wcvi6i/euro_2022_lionesses_win_final_with_extratime/,unitedkingdom,1404689,2
Boris Johnson booed as he arrives at St Paul’s for platinum jubilee event,8621,v3x1p4,https://www.theguardian.com/politics/2022/jun/03/boris-johnson-booed-st-pauls-platinum-jubilee-queen,610,1654254732.0,KilgoreDude,0.96,/r/unitedkingdom/comments/v3x1p4/boris_johnson_booed_as_he_arrives_at_st_pauls_for/,unitedkingdom,1404689,2
"Retired BBC director, 76, found with 832 child abuse images gasps in shock as he avoids jail",8615,slslzt,https://www.dailymail.co.uk/news/article-10402929/Retired-BBC-director-76-832-child-abuse-images-gasps-shock-avoids-jail.html,873,1644138963.0,MoneyEqual,0.96,/r/unitedkingdom/comments/slslzt/retired_bbc_director_76_found_with_832_child/,unitedkingdom,1404689,2
"Shamima Begum: IS bride should not be allowed to return to the UK to fight citizenship decision, court rules",8547,lsuh6f,http://news.sky.com/story/shamima-begum-is-bride-should-not-be-allowed-to-return-to-the-uk-to-fight-citizenship-decision-court-rules-12229270,1870,1614333336.0,topotaul,0.95,/r/unitedkingdom/comments/lsuh6f/shamima_begum_is_bride_should_not_be_allowed_to/,unitedkingdom,1404689,2
"COVID-19: Almost all coronavirus rules - including face masks and home-working - to be ditched on 19 July, PM says",8508,oeah2y,https://news.sky.com/story/covid-19-almost-all-coronavirus-rules-including-face-masks-and-home-working-to-be-ditched-on-19-july-pm-says-12349419,3096,1625501230.0,Beanybunny,0.93,/r/unitedkingdom/comments/oeah2y/covid19_almost_all_coronavirus_rules_including/,unitedkingdom,1404689,2
Scotland to freeze rent and rail fares as cost of living worsens,8491,x7bh2i,https://news.sky.com/story/scotland-to-freeze-rent-and-rail-fares-as-cost-of-living-worsens-12691305,1106,1662473079.0,topotaul,0.96,/r/unitedkingdom/comments/x7bh2i/scotland_to_freeze_rent_and_rail_fares_as_cost_of/,unitedkingdom,1404689,2
"UK is only major economy to put up taxes during cost-of-living crisis, research finds",8474,tg4v48,https://www.independent.co.uk/news/uk/politics/national-insurance-sunak-mcfadden-ifs-b2037508.html,842,1647503341.0,Mobalise_Anarchise,0.96,/r/unitedkingdom/comments/tg4v48/uk_is_only_major_economy_to_put_up_taxes_during/,unitedkingdom,1404689,2
BBC edits out boos from replay of Johnson’s arrival at Jubilee event – not the first time they’ve covered for him,8451,v5aioo,https://skwawkbox.org/2022/06/04/video-bbc-edits-out-boos-from-replay-of-johnsons-arrival-at-jubilee-event-not-the-first-time-theyve-covered-for-him/,491,1654424622.0,qpl23,0.94,/r/unitedkingdom/comments/v5aioo/bbc_edits_out_boos_from_replay_of_johnsons/,unitedkingdom,1404689,2
Sunak says it was a mistake to ‘empower scientists’ during Covid pandemic,8330,wx8d1u,https://www.theguardian.com/politics/2022/aug/24/sunak-says-it-was-a-mistake-to-empower-scientists-during-covid-pandemic,1638,1661415229.0,RassimoFlom,0.93,/r/unitedkingdom/comments/wx8d1u/sunak_says_it_was_a_mistake_to_empower_scientists/,unitedkingdom,1404689,2
Boris Johnson waters down ethics code and blocks watchdog's powers to investigate him,8204,uyxsbp,https://www.mirror.co.uk/news/politics/boris-johnson-waters-down-ethics-27083430,776,1653656675.0,qpl23,0.97,/r/unitedkingdom/comments/uyxsbp/boris_johnson_waters_down_ethics_code_and_blocks/,unitedkingdom,1404689,2
UK watchdog bans vegan TV ad for showing violence towards animals,7953,v7ksji,https://www.theguardian.com/lifeandstyle/2022/jun/08/watchdog-bans-vegan-friendly-uk-tv-ad-violence-towards-animals,1993,1654677812.0,ClassicFlavour,0.95,/r/unitedkingdom/comments/v7ksji/uk_watchdog_bans_vegan_tv_ad_for_showing_violence/,unitedkingdom,1404689,2
"Nurses must drop pay demands to ‘send clear message to Putin’, cabinet minister says",7944,zc6f6x,https://www.independent.co.uk/news/uk/politics/nurses-strikes-inflation-zahawi-putin-b2238518.html,1057,1670150043.0,wb0verdrive,0.94,/r/unitedkingdom/comments/zc6f6x/nurses_must_drop_pay_demands_to_send_clear/,unitedkingdom,1404689,2
EXCLUSIVE: Michael Gove plans to scrap rules that force developers to build affordable homes,7931,ufuqtg,https://www.mirror.co.uk/news/politics/michael-gove-plans-scrap-rules-26841507#l2mzb99xenyp0rcc4x,1148,1651390622.0,lighthouse77,0.96,/r/unitedkingdom/comments/ufuqtg/exclusive_michael_gove_plans_to_scrap_rules_that/,unitedkingdom,1404689,2
Heavily tattooed mum banned from child's nativity over appearance is told to watch 'through the class window',7865,zsjr4n,https://www.lbc.co.uk/news/heavily-tatooed-mum-banned-from-childs-nativity-over-appearance-is-told-to-watch/,2902,1671707897.0,insomnimax_99,0.92,/r/unitedkingdom/comments/zsjr4n/heavily_tattooed_mum_banned_from_childs_nativity/,unitedkingdom,1404689,2
British Prime Minister now has more fixed penalty notices than general election wins,7834,10hple0,https://newsthump.com/2023/01/20/british-prime-minister-now-has-more-fixed-penalty-notices-than-general-election-wins/,407,1674302149.0,marketrent,0.95,/r/unitedkingdom/comments/10hple0/british_prime_minister_now_has_more_fixed_penalty/,unitedkingdom,1404689,2
Sainsbury’s becomes first supermarket to rename chicken kiev to kyiv,7827,t6kfc4,https://www.independent.co.uk/life-style/food-and-drink/sainsburys-chicken-kiev-kyiv-russia-ukraine-b2028661.html,877,1646404866.0,ClassicFlavour,0.94,/r/unitedkingdom/comments/t6kfc4/sainsburys_becomes_first_supermarket_to_rename/,unitedkingdom,1404689,2
"Calls for Notting Hill Carnival to be scrapped after death, stabbings and sex assaults",7739,x26ptf,https://www.mylondon.news/news/west-london-news/notting-hill-carnival-must-now-24893532,1727,1661929016.0,lighthouse77,0.92,/r/unitedkingdom/comments/x26ptf/calls_for_notting_hill_carnival_to_be_scrapped/,unitedkingdom,1404689,2
Chancellor reverses 'almost all' tax cuts of mini-budget and says energy bills support scheme will be scaled back,7642,y678cl,https://news.sky.com/story/chancellor-reverses-almost-all-tax-cuts-of-mini-budget-and-says-energy-bills-support-scheme-will-be-scaled-back-12722880,1244,1666001762.0,topotaul,0.96,/r/unitedkingdom/comments/y678cl/chancellor_reverses_almost_all_tax_cuts_of/,unitedkingdom,1404689,2
Led by donkeys - Met Police Downing St Christmas Party - “Who exactly does the Metropolitan police work for Ma’am?Our citizens or Boris Johnson?”,7608,rhmygp,https://youtu.be/9Y18CrgFdh4,560,1639645892.0,RassimoFlom,0.96,/r/unitedkingdom/comments/rhmygp/led_by_donkeys_met_police_downing_st_christmas/,unitedkingdom,1404689,2
"Archie Battersbee, 12, dies after life support is turned off",7583,whnomq,https://news.sky.com/story/archie-battersbee-12-dies-after-life-support-is-turned-off-12633585,2438,1659790512.0,insomnimax_99,0.89,/r/unitedkingdom/comments/whnomq/archie_battersbee_12_dies_after_life_support_is/,unitedkingdom,1404689,2
Sunak vows to crack down on university degrees that do not improve 'earning potential',7566,wi81x5,https://news.sky.com/story/sunak-vows-to-crack-down-on-university-degrees-that-do-not-improve-earning-potential-12667369,2023,1659850299.0,insomnimax_99,0.92,/r/unitedkingdom/comments/wi81x5/sunak_vows_to_crack_down_on_university_degrees/,unitedkingdom,1404689,2
So why does the press hate Meghan more than Andrew?,7558,m5etfq,https://www.theneweuropean.co.uk/brexit-news/contrasting-coverage-of-meghan-and-prince-andrew-7813644,1391,1615791212.0,casualphilosopher1,0.92,/r/unitedkingdom/comments/m5etfq/so_why_does_the_press_hate_meghan_more_than_andrew/,unitedkingdom,1404689,2
