title,score,id,url,num_comments,created,author,upvote_ratio,permalink,subreddit,subreddit_subscribers,depth
"Fuck Reddit. Fuck /u/spez. If this post gets over 9000 upvotes, this will become a Battletoads themed subreddit.",53157,3h14s9,https://www.reddit.com/r/circlejerk/comments/3h14s9/fuck_reddit_fuck_uspez_if_this_post_gets_over/,512,1439590461.0,Boobies_Are_Awesome,0.89,/r/circlejerk/comments/3h14s9/fuck_reddit_fuck_uspez_if_this_post_gets_over/,circlejerk,469720,2
<- # of people jerking off today,50115,5u1eec,https://www.reddit.com/r/circlejerk/comments/5u1eec/of_people_jerking_off_today/,386,1487091924.0,GodOfAtheism,0.84,/r/circlejerk/comments/5u1eec/of_people_jerking_off_today/,circlejerk,469720,2
Upvotes. If you upvote this post it will literally appear at the top of reddit.,43287,4bwqfi,http://i.imgur.com/jKQfS87.jpg,462,1458917132.0,preggit,0.78,/r/circlejerk/comments/4bwqfi/upvotes_if_you_upvote_this_post_it_will_literally/,circlejerk,469720,2
Youtube is giving people meaningless internet points for moderating videos. Upvote this to show them that giving meaningless internet points to moderators is bad... or something. Yeah.,28870,53ymcp,https://www.reddit.com/r/circlejerk/comments/53ymcp/youtube_is_giving_people_meaningless_internet/,312,1474546192.0,GodOfAtheism,0.87,/r/circlejerk/comments/53ymcp/youtube_is_giving_people_meaningless_internet/,circlejerk,469720,2
"/u/spez here. I am editing this submission to tell every redditor that I fucked their mom. Yep, every single one of them; fucked her right in the pussy and butthole. Mad? I dare you to say something, you little bitch. I will edit your comments and get you thrown in prison. Step up, pussies.",28317,5elax4,https://www.reddit.com/r/circlejerk/comments/5elax4/uspez_here_i_am_editing_this_submission_to_tell/,633,1479953733.0,Boobies_Are_Awesome,0.78,/r/circlejerk/comments/5elax4/uspez_here_i_am_editing_this_submission_to_tell/,circlejerk,469720,2
If this gets 1658 upmeatballs /r/circlejerk will adopt glorious Swedish culture.,24530,4eruof,http://i.imgur.com/X4Mgrzm.jpg,292,1460650116.0,Ghostise,0.82,/r/circlejerk/comments/4eruof/if_this_gets_1658_upmeatballs_rcirclejerk_will/,circlejerk,469720,2
<--- Number of people jerking off on Valentines Day,24107,45p49m,https://www.reddit.com/r/circlejerk/comments/45p49m/number_of_people_jerking_off_on_valentines_day/,275,1455433315.0,GodOfAtheism,0.89,/r/circlejerk/comments/45p49m/number_of_people_jerking_off_on_valentines_day/,circlejerk,469720,2
if this post gets 2000 upfieris the mods will make this a guy fieri subreddit,22180,3zhmqy,http://i.imgur.com/pPZVVot.png,309,1451954985.0,Ghostise,0.81,/r/circlejerk/comments/3zhmqy/if_this_post_gets_2000_upfieris_the_mods_will/,circlejerk,469720,2
"Hey /r/Circlejerk, it's time to cut the shit and get serious for once. This user has been shitting up reddit for too long and this is a petition to globally ban them from reddit. Give an upvote (to the left) to sign it.",15227,4i6b7z,https://www.reddit.com/u/me,409,1462557970.0,Ghostise,0.88,/r/circlejerk/comments/4i6b7z/hey_rcirclejerk_its_time_to_cut_the_shit_and_get/,circlejerk,469720,2
WARNING: DO NOT CLICK. UNDER NO CIRCUMSTANCES SHOULD YOU CLICK ON THIS POST!!! [NSFL] [DON'T DO IT],15155,3nuhu3,http://i.imgur.com/0VXGKke.jpg,187,1444229486.0,dhamster,0.81,/r/circlejerk/comments/3nuhu3/warning_do_not_click_under_no_circumstances/,circlejerk,469720,2
"Circlejerk may or may not become a bird-themed subreddit if this submission receives 2,500 Upjackdaws.",14736,2c76c7,http://i.imgur.com/RGQdf67.jpg,267,1406770519.0,dhamster,0.87,/r/circlejerk/comments/2c76c7/circlejerk_may_or_may_not_become_a_birdthemed/,circlejerk,469720,2
Steeple [NSFW] [NSFL],12175,39sjzj,http://imgur.com/JjisrXx,120,1434276311.0,JimLazerbeam,0.91,/r/circlejerk/comments/39sjzj/steeple_nsfw_nsfl/,circlejerk,469720,2
"McDonald's now serving ""French fries"" in show of support for France.",12150,3sryhk,https://www.reddit.com/r/circlejerk/comments/3sryhk/mcdonalds_now_serving_french_fries_in_show_of/,299,1447505573.0,EdwardBola,0.88,/r/circlejerk/comments/3sryhk/mcdonalds_now_serving_french_fries_in_show_of/,circlejerk,469720,2
108 year old Hillary Clinton dies 6 days after conceding her second Presidential loss,10440,5cq80u,https://www.reddit.com/r/circlejerk/comments/5cq80u/108_year_old_hillary_clinton_dies_6_days_after/,141,1479048608.0,jaimmster,0.79,/r/circlejerk/comments/5cq80u/108_year_old_hillary_clinton_dies_6_days_after/,circlejerk,469720,2
"Dear god, you won't believe what Hillary Clinton has done this time! [NSFL] [DON'T CLICK]",10276,4ggbh1,http://i.imgur.com/sESwKWB.png,116,1461630572.0,JimLazerbeam,0.77,/r/circlejerk/comments/4ggbh1/dear_god_you_wont_believe_what_hillary_clinton/,circlejerk,469720,2
"It's been two months since the slaying of our friend Harambe, the creator of /r/circlejerk. This post will reach 2,000 UpSads in his honor.",10047,4v1a5n,http://i.imgur.com/m8LKO9g.jpg,171,1469719836.0,GodOfAtheism,0.88,/r/circlejerk/comments/4v1a5n/its_been_two_months_since_the_slaying_of_our/,circlejerk,469720,2
Some of you are alright. Don't go to 2018 tomorrow.,9993,7nbu3m,https://i.redd.it/nk422w2agc701.jpg,77,1514763592.0,Boobies_Are_Awesome,0.9,/r/circlejerk/comments/7nbu3m/some_of_you_are_alright_dont_go_to_2018_tomorrow/,circlejerk,469720,2
"TIL about Perpetual Reddit, common in the modern ages, it was a website that was kept constantly reposting in a karma pot and rarely emptied, just constantly replenished with whatever shitpost they could throw in it.",9943,7z647b,https://www.reddit.com/r/circlejerk/comments/7z647b/til_about_perpetual_reddit_common_in_the_modern/,122,1519225124.0,machib77,0.92,/r/circlejerk/comments/7z647b/til_about_perpetual_reddit_common_in_the_modern/,circlejerk,469720,2
Announcing Fat Steeple Hate!,9541,39duph,https://www.reddit.com/r/circlejerk/comments/39duph/announcing_fat_steeple_hate/,272,1433989307.0,OBLIVIATER,0.81,/r/circlejerk/comments/39duph/announcing_fat_steeple_hate/,circlejerk,469720,2
"Hillary Clinton: ""im a grill btw ;)""",9392,4eandi,https://www.reddit.com/r/circlejerk/comments/4eandi/hillary_clinton_im_a_grill_btw/,427,1460380699.0,Changefunding,0.86,/r/circlejerk/comments/4eandi/hillary_clinton_im_a_grill_btw/,circlejerk,469720,2
"If this post gets 2000 upvotes, /r/circlejerk will become a subreddit dedicated to posting stolen nude photos of the reddit admins",9112,2fg17i,https://www.reddit.com/r/circlejerk/comments/2fg17i/if_this_post_gets_2000_upvotes_rcirclejerk_will/,179,1409829746.0,BarbatisCollum,0.86,/r/circlejerk/comments/2fg17i/if_this_post_gets_2000_upvotes_rcirclejerk_will/,circlejerk,469720,2
My girlfriend's Neil DeGrasse Tyson costume she made,8822,2kgreb,http://i.imgur.com/xixE1GN.jpg,256,1414419479.0,dhamster,0.84,/r/circlejerk/comments/2kgreb/my_girlfriends_neil_degrasse_tyson_costume_she/,circlejerk,469720,2
helo,8800,diqv1e,https://i.imgur.com/QGKojl6.png,115,1571239614.0,GodOfAtheism,0.99,/r/circlejerk/comments/diqv1e/helo/,circlejerk,469720,2
Wouldn't it be a shame if THIS made it to r/all?,8612,5i8cug,http://idolosol.com/images/this-2.jpg,103,1481686935.0,APKID716,0.89,/r/circlejerk/comments/5i8cug/wouldnt_it_be_a_shame_if_this_made_it_to_rall/,circlejerk,469720,2
"The '2016 Karma Boom' is upsetting the karma economy in /r/circlejerk. If this post gets 5,000 upvotes, we will begin rationing posts.",8473,4trfr7,https://www.reddit.com/r/circlejerk/comments/4trfr7/the_2016_karma_boom_is_upsetting_the_karma/,158,1469025567.0,BarbatisCollum,0.88,/r/circlejerk/comments/4trfr7/the_2016_karma_boom_is_upsetting_the_karma/,circlejerk,469720,2
If this gets to the front page there will be an erotic fanfiction of Paul Blart and James Franco on the front page.,8453,372upx,https://www.reddit.com/r/circlejerk/comments/372upx/if_this_gets_to_the_front_page_there_will_be_an/,157,1432462108.0,GodOfAtheism,0.89,/r/circlejerk/comments/372upx/if_this_gets_to_the_front_page_there_will_be_an/,circlejerk,469720,2
LPT: You can double your karma by submitting the same thing twice,8332,3n0xdw,http://static.dnaindia.com/sites/default/files/2015/08/01/361285-john-cena-2.jpg,172,1443651486.0,290077,0.86,/r/circlejerk/comments/3n0xdw/lpt_you_can_double_your_karma_by_submitting_the/,circlejerk,469720,2
"Why isn't there a ""tip jar"" on r/circlejerk? I would gladly pay users I like $10 or $20 for a shitpost I love, if I knew it went straight to them",7951,4hu7vi,https://www.reddit.com/r/circlejerk/comments/4hu7vi/why_isnt_there_a_tip_jar_on_rcirclejerk_i_would/,260,1462364628.0,machib77,0.89,/r/circlejerk/comments/4hu7vi/why_isnt_there_a_tip_jar_on_rcirclejerk_i_would/,circlejerk,469720,2
[F] Ever wonder what your barrister looks like naked?,7698,4o74np,https://i.redd.it/9s2s1lpn9g3x.png,81,1465994800.0,welsh_dragon_roar,0.78,/r/circlejerk/comments/4o74np/f_ever_wonder_what_your_barrister_looks_like_naked/,circlejerk,469720,2
'It's my job to kill them' - Hillary Clinton leaves 420 children in burning vehicle,7032,52pz8g,https://www.reddit.com/r/circlejerk/comments/52pz8g/its_my_job_to_kill_them_hillary_clinton_leaves/,137,1473852157.0,jaimmster,0.87,/r/circlejerk/comments/52pz8g/its_my_job_to_kill_them_hillary_clinton_leaves/,circlejerk,469720,2
"just fucked this girl, so hot. It was my GF. I HAVE A GIRLFRIEND",6938,3q2md6,http://i.imgur.com/CqVsbV5.png,113,1445719417.0,EskimoHarry,0.77,/r/circlejerk/comments/3q2md6/just_fucked_this_girl_so_hot_it_was_my_gf_i_have/,circlejerk,469720,2
'I no longer masturbate because I'm horny. I do it to relieve pneumonia or to prevent myself from dying' - Hillary Clinton,6791,531ffz,https://www.reddit.com/r/circlejerk/comments/531ffz/i_no_longer_masturbate_because_im_horny_i_do_it/,132,1474025409.0,jaimmster,0.82,/r/circlejerk/comments/531ffz/i_no_longer_masturbate_because_im_horny_i_do_it/,circlejerk,469720,2
me irl,6770,78ob6e,https://i.redd.it/ya66hm1xsztz.png,182,1508944408.0,GallowBoob,0.78,/r/circlejerk/comments/78ob6e/me_irl/,circlejerk,469720,2
Wouldn't it be a shame if this picture of THE DONALD made it to r/all,6583,5hup8m,http://i3.kym-cdn.com/photos/images/original/001/109/620/5c6.jpg,112,1481517669.0,APKID716,0.85,/r/circlejerk/comments/5hup8m/wouldnt_it_be_a_shame_if_this_picture_of_the/,circlejerk,469720,2
GOOGLE FIBER GOOGLE FIBER GOOGLE FIBER GOOGLE FIBER GOOGLE FIBER GOOGLE FIBER GOOGLE FIBER GOOGLE FIBER GOOGLE FIBER GOOGLE FIBER GOOGLE FIBER GOOGLE FIBER GOOGLE FIBER GOOGLE FIBER GOOGLE FIBER GOOGLE FIBER GOOGLE FIBER GOOGLE FIBER GOOGLE FIBER GOOGLE FIBER GOOGLE FIBER GOOGLE FIBER GOOGLE FIBER,6531,40mjqc,http://i.imgur.com/0ULGfDG.jpg,270,1452607550.0,dhamster,0.84,/r/circlejerk/comments/40mjqc/google_fiber_google_fiber_google_fiber_google/,circlejerk,469720,2
"""RIP My inbox"" - Hillary Clinton",6390,4j5yt9,https://www.reddit.com/r/circlejerk/comments/4j5yt9/rip_my_inbox_hillary_clinton/,180,1463140518.0,jaimmster,0.92,/r/circlejerk/comments/4j5yt9/rip_my_inbox_hillary_clinton/,circlejerk,469720,2
[NSFL] DONT CLICK [NSFL],6343,525z4b,https://www.reddit.com/r/circlejerk/comments/525z4b/nsfl_dont_click_nsfl/,78,1473552787.0,GarethPW,0.76,/r/circlejerk/comments/525z4b/nsfl_dont_click_nsfl/,circlejerk,469720,2
卐AT&T卐AT&T卐AT&T卐AT&T卐AT&T卐AT&T卐AT&T卐AT&T卐AT&T卐AT&T卐AT&T卐AT&T卐AT&T卐AT&T卐AT&T卐AT&T卐AT&T卐AT&T卐AT&T卐AT&T卐AT&T卐AT&T卐AT&T卐AT&T卐AT&T卐AT&T卐AT&T卐AT&T卐AT&T卐AT&T卐AT&T卐AT&T卐AT&T卐AT&T卐AT&T卐AT&T卐AT&T卐AT&T卐AT&T卐AT&T卐AT&T卐AT&T卐AT&T卐AT&T卐AT&T卐AT&T卐AT&T卐AT&T卐AT&T卐AT&T卐AT&T卐AT&T卐AT&T卐AT&T卐AT&T卐AT&T卐,6335,59bvn9,https://www.reddit.com/r/circlejerk/comments/59bvn9/卐att卐att卐att卐att卐att卐att卐att卐att卐att卐att卐att卐att卐a/,131,1477411896.0,GarethPW,0.79,/r/circlejerk/comments/59bvn9/卐att卐att卐att卐att卐att卐att卐att卐att卐att卐att卐att卐att卐a/,circlejerk,469720,2
"If this post receives 5000 upvotes, /r/circlejerk will become a subreddit dedicated to discussion of conspiracy theories and memes",6274,33hexh,https://www.reddit.com/r/circlejerk/comments/33hexh/if_this_post_receives_5000_upvotes_rcirclejerk/,161,1429716313.0,BarbatisCollum,0.93,/r/circlejerk/comments/33hexh/if_this_post_receives_5000_upvotes_rcirclejerk/,circlejerk,469720,2
"Hillary Clinton: ""If this gets 2,383 updoots, /r/circlejerk will become a /r/HillaryClinton""",6213,4dczuc,https://www.reddit.com/r/circlejerk/comments/4dczuc/hillary_clinton_if_this_gets_2383_updoots/,103,1459802117.0,Changefunding,0.82,/r/circlejerk/comments/4dczuc/hillary_clinton_if_this_gets_2383_updoots/,circlejerk,469720,2
A message from your friends at [Brand],6168,gunql0,https://i.imgur.com/HiGeioW.png,126,1591029067.0,GodOfAtheism,1.0,/r/circlejerk/comments/gunql0/a_message_from_your_friends_at_brand/,circlejerk,469720,2
Amazing Bernie Sanders cosplay.,6027,3jz98q,http://imgur.com/EU6QBOO,82,1441638525.0,EdwardBola,0.82,/r/circlejerk/comments/3jz98q/amazing_bernie_sanders_cosplay/,circlejerk,469720,2
"I (69m) hired a Private investigator($50/hour) and found that my wife (19f) is cheating on me with black guys(3, 30m). Should I pack my bags (2, 10kg), take the dog (5f, don't deserve) and get an uber($15) to the hotel ($80/night) or donate all my money($420) to Bernie(77m)?",5904,b4r5ju,https://i.redd.it/vshaq2hm5zn21.jpg,156,1553393071.0,upvoteifurgey,0.97,/r/circlejerk/comments/b4r5ju/i_69m_hired_a_private_investigator50hour_and/,circlejerk,469720,2
<------- number of Reddit cops having sex with prostitutes,5748,66ophq,https://www.reddit.com/r/circlejerk/comments/66ophq/number_of_reddit_cops_having_sex_with_prostitutes/,78,1492775572.0,welsh_dragon_roar,0.9,/r/circlejerk/comments/66ophq/number_of_reddit_cops_having_sex_with_prostitutes/,circlejerk,469720,2
"Justin Trudeau: ""To those lacking karma, r/circlejerk will welcome you, regardless of your content. Diversity is our strength #WelcomeToCirclejerk""",5595,5qthtz,http://www.dailymail.co.uk/tvshowbiz/article-4168098/Justin-Timberlake-dons-designer-suit-Variety-brunch.html,105,1485691755.0,machib77,0.88,/r/circlejerk/comments/5qthtz/justin_trudeau_to_those_lacking_karma_rcirclejerk/,circlejerk,469720,2
#ChangeMyView,5595,82ja9i,https://i.redd.it/2vv8l8f608k01.jpg,189,1520375756.0,GallowBoob,0.89,/r/circlejerk/comments/82ja9i/changemyview/,circlejerk,469720,2
Oh no! Alton Brown is about to give Guy Fieri lettuce without any ranch dressing on it! Shoot a fieri arrow at him or lose your cooking license forever!,5579,3zie6t,http://i.imgur.com/hirIEc6.jpg,60,1451966291.0,dhamster,0.82,/r/circlejerk/comments/3zie6t/oh_no_alton_brown_is_about_to_give_guy_fieri/,circlejerk,469720,2
BERNIE,5549,36jy95,http://imgur.com/ijLwJpE,57,1432076386.0,LlamaKing01,0.74,/r/circlejerk/comments/36jy95/bernie/,circlejerk,469720,2
"What was your biggest ""I need to eat some Szechuan Sauce"" moment?",5227,6473v9,https://www.reddit.com/r/circlejerk/comments/6473v9/what_was_your_biggest_i_need_to_eat_some_szechuan/,133,1491659470.0,jaimmster,0.87,/r/circlejerk/comments/6473v9/what_was_your_biggest_i_need_to_eat_some_szechuan/,circlejerk,469720,2
<- # of people jerking off on Valentine's Day,5201,7xgl6h,https://www.reddit.com/r/circlejerk/comments/7xgl6h/of_people_jerking_off_on_valentines_day/,68,1518596108.0,GodOfAtheism,0.96,/r/circlejerk/comments/7xgl6h/of_people_jerking_off_on_valentines_day/,circlejerk,469720,2
You know what to do,5195,719shu,https://i.imgur.com/HnBJcTA.jpg,69,1505897580.0,GodOfAtheism,0.97,/r/circlejerk/comments/719shu/you_know_what_to_do/,circlejerk,469720,2
Oh for fuck’s sake I can’t top this bullshit,5176,c1onss,https://i.redd.it/nehj6zcbnx431.jpg,151,1560784226.0,heinz_inthecity,0.97,/r/circlejerk/comments/c1onss/oh_for_fucks_sake_i_cant_top_this_bullshit/,circlejerk,469720,2
"""C"" - Fat Steeples everywhere",5143,39m6ds,http://i.imgur.com/E3uUew2.jpg,17,1434134236.0,Admiral_Egg,0.76,/r/circlejerk/comments/39m6ds/c_fat_steeples_everywhere/,circlejerk,469720,2
SANDERS,5103,36jy81,http://imgur.com/bxTo5XT,40,1432076373.0,LlamaKing01,0.74,/r/circlejerk/comments/36jy81/sanders/,circlejerk,469720,2
"NO ONE RECOGNIZES MY OBSCURE AND/OR SHITTY HALLOWEEN COSTUME, KARMA PLEASE",5077,5a5s3h,https://www.reddit.com/r/circlejerk/comments/5a5s3h/no_one_recognizes_my_obscure_andor_shitty/,114,1477830255.0,preggit,0.91,/r/circlejerk/comments/5a5s3h/no_one_recognizes_my_obscure_andor_shitty/,circlejerk,469720,2
"Hillary Clinton's vault is opened, there are enough speeches to release a new lie every day for the next century",5011,4h4bjx,https://www.reddit.com/r/circlejerk/comments/4h4bjx/hillary_clintons_vault_is_opened_there_are_enough/,63,1462020479.0,jaimmster,0.89,/r/circlejerk/comments/4h4bjx/hillary_clintons_vault_is_opened_there_are_enough/,circlejerk,469720,2
"""K"" - Fat Steeples everywhere",4982,39m6dm,http://i.imgur.com/wUq7Ols.jpg,14,1434134234.0,Admiral_Egg,0.76,/r/circlejerk/comments/39m6dm/k_fat_steeples_everywhere/,circlejerk,469720,2
North Korean founder Kim-Il Sung had a baseball sized tumor on the back of his head. This is one of the pictures not censored by the mods of /r/news. (NSFL),4958,4ooqpf,https://i.redd.it/n5gtn6g8724x.png,91,1466260623.0,jaimmster,0.82,/r/circlejerk/comments/4ooqpf/north_korean_founder_kimil_sung_had_a_baseball/,circlejerk,469720,2
If this post gets 10k+ upvotes I will delete u/GallowBoob,4944,88r84v,https://www.reddit.com/r/u_GallowBoob/comments/88r6w2/if_this_post_gets_10k_upvotes_i_will_delete/,93,1522593581.0,GallowBoob,0.74,/r/circlejerk/comments/88r84v/if_this_post_gets_10k_upvotes_i_will_delete/,circlejerk,469720,2
OH NO! /R/NEWS MODS HAVE CENSORED LE NICE MAY MAY MAN! UPCENSOR IF YOU LIKE FREEDOM OF SPEECH!,4926,4ntls2,http://i.imgur.com/JjNjYZJ.gif,101,1465784992.0,OBLIVIATER,0.88,/r/circlejerk/comments/4ntls2/oh_no_rnews_mods_have_censored_le_nice_may_may/,circlejerk,469720,2
Only 90's kids will upvote this,4864,4tqkav,https://www.reddit.com/r/circlejerk/comments/4tqkav/only_90s_kids_will_upvote_this/,187,1469011502.0,GodOfAtheism,0.82,/r/circlejerk/comments/4tqkav/only_90s_kids_will_upvote_this/,circlejerk,469720,2
For every upvote I won't shitpost for a day.,4787,61s3km,https://www.reddit.com/r/circlejerk/comments/61s3km/for_every_upvote_i_wont_shitpost_for_a_day/,120,1490620959.0,Ghostise,0.89,/r/circlejerk/comments/61s3km/for_every_upvote_i_wont_shitpost_for_a_day/,circlejerk,469720,2
"TIL that Jesus once saw a crowd throwing stones at a woman accused of adultery. He stopped and looked at the woman and said ""NTA"". Then he looked at the crowd and said ""YTA""",4756,d0n4m6,https://www.reddit.com/r/circlejerk/comments/d0n4m6/til_that_jesus_once_saw_a_crowd_throwing_stones/,98,1567806363.0,upvoteifurgey,1.0,/r/circlejerk/comments/d0n4m6/til_that_jesus_once_saw_a_crowd_throwing_stones/,circlejerk,469720,2
"Woke up at 1am walked 300000 miles to take this picture, i am nearly crying i'm so proud",4720,a32ik0,https://i.redd.it/fjxphmh7la221.jpg,92,1543942881.0,EskimoHarry,0.98,/r/circlejerk/comments/a32ik0/woke_up_at_1am_walked_300000_miles_to_take_this/,circlejerk,469720,2
"""F"" - Fat Steeples everywhere",4680,39m6e2,http://i.imgur.com/BSCg6KA.jpg,74,1434134239.0,Admiral_Egg,0.76,/r/circlejerk/comments/39m6e2/f_fat_steeples_everywhere/,circlejerk,469720,2
LPT: You can double your karma by submitting the same thing twice,4658,3n0xf0,http://static.dnaindia.com/sites/default/files/2015/08/01/361285-john-cena-2.jpg,45,1443651502.0,290077,0.85,/r/circlejerk/comments/3n0xf0/lpt_you_can_double_your_karma_by_submitting_the/,circlejerk,469720,2
"My Uncle George is tri-bi (bisexual, biracial & bipolar) & falsely convicted of raping 200 altar boys because he disobeyed PETA & vaccinated them. The High Court said if I get 20K karma on this post, they’ll free him! You know what to do, Reddit!",4658,awtfm6,https://i.redd.it/3umpd2ys9wj21.jpg,99,1551614766.0,heinz_inthecity,0.94,/r/circlejerk/comments/awtfm6/my_uncle_george_is_tribi_bisexual_biracial/,circlejerk,469720,2
"""U"" - Fat Steeples everywhere",4644,39m6dv,http://i.imgur.com/eSxX5xk.jpg,11,1434134238.0,Admiral_Egg,0.76,/r/circlejerk/comments/39m6dv/u_fat_steeples_everywhere/,circlejerk,469720,2
"My autistic brother [420,F] has never said a word in his life until yesterday, when he finally stuttered ""orange man bad"". Literally overcome with emotion right now",4521,a89oew,https://i.imgur.com/z77o2wz.jpg,79,1545396679.0,jaimmster,0.97,/r/circlejerk/comments/a89oew/my_autistic_brother_420f_has_never_said_a_word_in/,circlejerk,469720,2
"OFFICIAL REDDIT POLL: There's a secret cabal on this site that is out to steal your hard-earned karma? Click the top arrow on the left 3 times for yes, once for no.",4248,2vu4qb,https://www.reddit.com/r/circlejerk/comments/2vu4qb/official_reddit_poll_theres_a_secret_cabal_on/,115,1423882298.0,Boobies_Are_Awesome,0.89,/r/circlejerk/comments/2vu4qb/official_reddit_poll_theres_a_secret_cabal_on/,circlejerk,469720,2
this gif,4081,3b0fv9,http://i.imgur.com/jJym2ea.gifv,120,1435189242.0,preggit,0.95,/r/circlejerk/comments/3b0fv9/this_gif/,circlejerk,469720,2
