title,score,id,url,num_comments,created,author,upvote_ratio,permalink,subreddit,subreddit_subscribers,depth
"""The Germans did not mocked people like that."" CNN correspondents accompany Ukrainian military in the Mykolaiv region. Forced evacuated old men say that today's actions of ruZZians is worse than fascism.",27327,tko9ia,https://v.redd.it/acm7r66v13p81,1490,1648019368.0,Regrup,0.9,/r/ukraine/comments/tko9ia/the_germans_did_not_mocked_people_like_that_cnn/,ukraine,860311,2
They did everything they could and more. Great respect to these defenders!,27232,urv6t4,https://i.redd.it/wv8bwl9qf3091.jpg,540,1652818298.0,305FUN,0.92,/r/ukraine/comments/urv6t4/they_did_everything_they_could_and_more_great/,ukraine,860311,2
"A resident of Kherson: “We have no heating, no electricity, no water, no mobile or internet connection, but NO RUSSIANS! I am extremely happy because now we are free.”",27102,yw4o1k,https://v.redd.it/0nffuvvjl50a1,325,1668534996.0,merbaby11,0.97,/r/ukraine/comments/yw4o1k/a_resident_of_kherson_we_have_no_heating_no/,ukraine,860311,2
The German DHL delivery service provided 6 cars to the Ukrainian military. Defenders simply called and asked for transport.,27065,tpq9z9,https://v.redd.it/k2cu6rx02zp81,692,1648406758.0,Did-ko,0.94,/r/ukraine/comments/tpq9z9/the_german_dhl_delivery_service_provided_6_cars/,ukraine,860311,2
President Zelensky is on the cover of Time Magazine!,26813,udsa1c,https://i.redd.it/mns7v5ab39w81.jpg,729,1651143328.0,TinyStrawberry23,0.9,/r/ukraine/comments/udsa1c/president_zelensky_is_on_the_cover_of_time/,ukraine,860311,2
All 59 gas stations of Azerbaijan State Oil Company (SOCAR) in Ukraine will provide state vehicles with free fuel 24/7. Humanitarian aid and medicines worth 5 million euros were sent to Ukraine from Azerbaijan. Zelensky said that Azerbaijan promised to provide free oil assistance.,26606,t238v6,https://i.redd.it/26tajn26x7k81.jpg,657,1645899010.0,KhanKavkaz,0.98,/r/ukraine/comments/t238v6/all_59_gas_stations_of_azerbaijan_state_oil/,ukraine,860311,2
Your face when you persuaded Macron stop bothering Putin with the phone calls.,26543,vdpyvf,https://i.redd.it/bd6nuuotf0691.jpg,1095,1655397053.0,ThaIgk,0.91,/r/ukraine/comments/vdpyvf/your_face_when_you_persuaded_macron_stop/,ukraine,860311,2
"21+! This is Mariupol. All Russians should see it, as all Germans should have seen such in 1945",26304,tpf1q0,https://v.redd.it/c3gzt2w1rvp81,2338,1648366766.0,Regrup,0.94,/r/ukraine/comments/tpf1q0/21_this_is_mariupol_all_russians_should_see_it_as/,ukraine,860311,2
Our hero. The guy who repelled the Russians' attack while he was in a trench,25924,115migc,https://www.reddit.com/gallery/115migc,1100,1676746920.0,IgorVozMkUA,0.9,/r/ukraine/comments/115migc/our_hero_the_guy_who_repelled_the_russians_attack/,ukraine,860311,2
Russian tourist cries as she flees Crimea after yesterday’s Ukrainian missile strike on a Russian airbase in Sevastopol. “I don't want to leave Crimea. It's so cool here and it’s like being at home. *sobs*” Time for Russians to realize they started a war,25736,wktcbt,https://twitter.com/visegrad24/status/1557301388509585408?t=tGXrT-4GRuzvyFYArjzsWg&s=19,1175,1660125163.0,51patsfan,0.91,/r/ukraine/comments/wktcbt/russian_tourist_cries_as_she_flees_crimea_after/,ukraine,860311,2
Wagner recruitment website has been hacked. Message reads: IT-Army of Ukraine reporting. We have all your personal data. Welcome to Ukraine. We are waiting for you.,25722,xilcs0,https://i.redd.it/nqnrdim75vo91.jpg,666,1663614067.0,CorsicA123,0.94,/r/ukraine/comments/xilcs0/wagner_recruitment_website_has_been_hacked/,ukraine,860311,2
Welcome to the United States of Ukraine*,25496,tmzm5d,https://v.redd.it/knz00txnydp81,2030,1648151365.0,madwolli,0.92,/r/ukraine/comments/tmzm5d/welcome_to_the_united_states_of_ukraine/,ukraine,860311,2
A Ukrainian soldier meets his parents in a liberated village near Chernihiv. They spent one month under russian occupation.,25479,ttz7j2,https://v.redd.it/wbibseyqxyq81,619,1648841187.0,Stas9t,0.95,/r/ukraine/comments/ttz7j2/a_ukrainian_soldier_meets_his_parents_in_a/,ukraine,860311,2
President Zelensky and government officials recreate iconic outdoor video from late February 2022 to mark 100 days of war,25258,v3vduo,https://v.redd.it/s4e44i5xhd391,500,1654247647.0,TinyStrawberry23,0.92,/r/ukraine/comments/v3vduo/president_zelensky_and_government_officials/,ukraine,860311,2
"Ukrainian air defenses took down a Russian Su-35 this morning, in the vicinity of Izyum in Kharkiv oblast. A $45,000,000 - $60,000,000 loss.",25061,tv8i36,https://www.reddit.com/gallery/tv8i36,1807,1648990106.0,RallyToTheColors,0.96,/r/ukraine/comments/tv8i36/ukrainian_air_defenses_took_down_a_russian_su35/,ukraine,860311,2
"President Zelensky: ""This is a gift from 14-year-old Henriikka from Finland. She began to knit warm wool socks, sell them, and donate the earned funds to support Ukraine. At her request, one of these pairs reached me! Each such story inspires and gives strength to move on.""",25041,zq512m,https://www.instagram.com/p/CmXYPZgsjLP/?igshid=YmMyMTA2M2Y=,261,1671487398.0,TinyStrawberry23,0.93,/r/ukraine/comments/zq512m/president_zelensky_this_is_a_gift_from_14yearold/,ukraine,860311,2
"The moment we feared has come, the traitors of Europe have come out.",24718,tjj5id,https://i.redd.it/daenkhusaso81.png,1808,1647889116.0,PjeterPannos,0.91,/r/ukraine/comments/tjj5id/the_moment_we_feared_has_come_the_traitors_of/,ukraine,860311,2
Oops,24548,xbmv7k,https://i.redd.it/glf7nh1fa9n91.jpg,367,1662913629.0,boskee,0.89,/r/ukraine/comments/xbmv7k/oops/,ukraine,860311,2
"Never forget, Vitalii Skakun, who sacrificed himself to destroy a bridge in Henichesk to slow Russian advances. He will forever be my inspiration",24477,zv9n82,https://i.redd.it/e6mdye9w768a1.jpg,309,1672011253.0,SovietPikachu2,0.92,/r/ukraine/comments/zv9n82/never_forget_vitalii_skakun_who_sacrificed/,ukraine,860311,2
"Former Russian troops who agreed to fight for Ukraine created the ""Legion of Free Russia"". They will go through training, take an oath and transfer under command of the Ukrainian army.",24334,ts1dul,https://www.reddit.com/gallery/ts1dul,802,1648627197.0,WalkerBuldog,0.95,/r/ukraine/comments/ts1dul/former_russian_troops_who_agreed_to_fight_for/,ukraine,860311,2
"Oleksandr Shapoval, soloist of National Opera ballet, Honored Artist of Ukraine, died in combat near Mayorsk, Donetsk region. He went to the frontlines as a volunteer and served as a grenade launcher. RIP, Hero.",24283,xcpxm0,https://i.redd.it/vrqkupnn5in91.jpg,304,1663021018.0,Stas9t,0.96,/r/ukraine/comments/xcpxm0/oleksandr_shapoval_soloist_of_national_opera/,ukraine,860311,2
Russia is on fire again. A big fire broke out in the center of Perm.,23777,ul0rwu,https://v.redd.it/0bfrebjdy8y81,960,1652013362.0,vlFrozen,0.96,/r/ukraine/comments/ul0rwu/russia_is_on_fire_again_a_big_fire_broke_out_in/,ukraine,860311,2
"Brazenly and on camera, the Russians kidnap orphans from the occupied territories of Ukraine and say that it is ""for their good."" The Russian terrorists commit more war crimes by kidnapping Ukrainian children and scattering them across 13 regions of Russia. Reminiscent of Hitler's Germany.",23519,xgfsm1,https://v.redd.it/78p2otvcedo91,829,1663399216.0,mossadnik,0.93,/r/ukraine/comments/xgfsm1/brazenly_and_on_camera_the_russians_kidnap/,ukraine,860311,2
Russian soldier stole a phone from a 10-year-old Ivanka at the block post. Ukrainian soldiers found it when he was captured and gave it back to the owner.,23396,u68l0c,https://www.reddit.com/gallery/u68l0c,361,1650272213.0,ranaor,0.92,/r/ukraine/comments/u68l0c/russian_soldier_stole_a_phone_from_a_10yearold/,ukraine,860311,2
"The Junior World Champion in Biathlon, Anna Krivonos, has paused her sports career in order to join the Ukrainian Army and shoot at other targets instead.",23376,tpipbo,https://i.redd.it/9n1k1wl24xp81.png,595,1648383242.0,PjeterPannos,0.96,/r/ukraine/comments/tpipbo/the_junior_world_champion_in_biathlon_anna/,ukraine,860311,2
Latvia has decided to demolish the largest soviet monument.,23186,wxhakg,https://v.redd.it/k9ggb1p1pvj91,810,1661441511.0,esberat,0.93,/r/ukraine/comments/wxhakg/latvia_has_decided_to_demolish_the_largest_soviet/,ukraine,860311,2
"Never forget Ukrainian hero Vitaly Skakun who sacrificed his life to blow up the henichesky bridge for his nation as Russian soldiers were advancing. Skakun radioed his unit and told them he would do it manually, saying goodbye. 🇺🇦💙💛",22990,t3gp0o,https://i.redd.it/jd6lwuz32lk81.jpg,314,1646058045.0,abdulkxrim,0.98,/r/ukraine/comments/t3gp0o/never_forget_ukrainian_hero_vitaly_skakun_who/,ukraine,860311,2
A historic night at Versailles. After five hours of heated discussions EU leaders said yes to Ukrainian eurointegration. The process started. - Lithuanian President Nausėda,22885,tbgwn7,https://twitter.com/GitanasNauseda/status/1502103582337871874?s=20&t=LiZ5xMiRB8kb_j6FvY9-zA,832,1646969749.0,TheRealMykola,0.96,/r/ukraine/comments/tbgwn7/a_historic_night_at_versailles_after_five_hours/,ukraine,860311,2
The true brother nations in one photo,22790,uvb1sk,https://i.redd.it/r3ct6d3551191.jpg,699,1653226325.0,onesole,0.92,/r/ukraine/comments/uvb1sk/the_true_brother_nations_in_one_photo/,ukraine,860311,2
"His name was Vitaly Skakun. He was 25. To stop RU fascists, he blew up a bridge at the cost of his life. Today he was carried to grave in his hometown - and people stood on their knees.",22743,t58k05,https://www.reddit.com/gallery/t58k05,377,1646250716.0,Over9000Holland,0.98,/r/ukraine/comments/t58k05/his_name_was_vitaly_skakun_he_was_25_to_stop_ru/,ukraine,860311,2
"Antiwar protests continue in Moscow, despite arrests. Thank you, brothers and sisters! ❤️",22624,t2oq8v,https://v.redd.it/8b2rx9fqsdk81,220,1645970144.0,-martinique-,0.99,/r/ukraine/comments/t2oq8v/antiwar_protests_continue_in_moscow_despite/,ukraine,860311,2
"Oleg and Nikita, father and son, both killed in Bakhmut. The father covered his son with his body, but the artillery shell exploded near their heads.",22483,11mrqfh,https://i.redd.it/4bstuiyvppma1.jpg,578,1678367242.0,GnolRevilo,0.95,/r/ukraine/comments/11mrqfh/oleg_and_nikita_father_and_son_both_killed_in/,ukraine,860311,2
Congratulations to the russian federation for losing their 5000th vehicle in Ukraine today!r,22487,wcs2b7,https://v.redd.it/egdqeu0eexe91,476,1659283249.0,christianandrewborys,0.95,/r/ukraine/comments/wcs2b7/congratulations_to_the_russian_federation_for/,ukraine,860311,2
Germany HAS DECIDED TO SEND LEOPARD 2 TANKS (Article in German),22273,10kb6fk,https://www.spiegel.de/politik/deutschland/krieg-in-der-ukraine-deutschland-schickt-leopard-panzer-a-e2dde871-88d0-4cf5-8aae-482d58fd850f,151,1674582143.0,pineapple_butt13,0.94,/r/ukraine/comments/10kb6fk/germany_has_decided_to_send_leopard_2_tanks/,ukraine,860311,2
"The breathtaking bravery of Russian citizens who know they’ll be arrested, and worse, for protesting the war and do it anyway.",22237,t0n7ym,https://i.redd.it/9w1gdjiuwuj81.jpg,264,1645741487.0,Chasith,0.98,/r/ukraine/comments/t0n7ym/the_breathtaking_bravery_of_russian_citizens_who/,ukraine,860311,2
"Mykhailo Dianov, defender of Azovstal, has undergone a successful arm surgery in the United States",22066,zlmom3,https://i.redd.it/c7dno7a52u5a1.jpg,479,1671010457.0,brayduck,0.94,/r/ukraine/comments/zlmom3/mykhailo_dianov_defender_of_azovstal_has/,ukraine,860311,2
Footage of a Ukrainian TB2 Bayraktar drone engaging and destroying a Russian Buk-M2 SAM system,22035,tax49d,https://v.redd.it/ydx40tdxpjm81,1239,1646913523.0,Sondioc2152,0.97,/r/ukraine/comments/tax49d/footage_of_a_ukrainian_tb2_bayraktar_drone/,ukraine,860311,2
"8 years ago today, ruzzian terrorists shot down Malaysia Airlines Flight 17. Killing 80 children, 20 families, 298 people total.",21795,w11ntc,https://v.redd.it/0vgwsqqwx2c91,634,1658042480.0,Size14Shoes,0.93,/r/ukraine/comments/w11ntc/8_years_ago_today_ruzzian_terrorists_shot_down/,ukraine,860311,2
Thank you USA! Ukrainian artillery mastered American howitzers a now performing faster fire rate.,21659,uzn4e7,https://v.redd.it/axc3pynkv7291,1152,1653743707.0,onesole,0.94,/r/ukraine/comments/uzn4e7/thank_you_usa_ukrainian_artillery_mastered/,ukraine,860311,2
Love is... watch how russian ships burn.,21430,tnj2uf,https://i.imgur.com/UiOtrfu.jpg,244,1648204796.0,Did-ko,0.96,/r/ukraine/comments/tnj2uf/love_is_watch_how_russian_ships_burn/,ukraine,860311,2
The American M270 multiple launch rocket system can destroy military targets at a distance of up to 120 kilometers. And it is already in service in Ukraine.,21398,uewvnn,https://v.redd.it/ty2s77edkjw81,1135,1651270149.0,imkara92,0.93,/r/ukraine/comments/uewvnn/the_american_m270_multiple_launch_rocket_system/,ukraine,860311,2
"Ukraine counterattack, over 800 square kilometers liberated in the last 5 days",21321,x9x0ri,https://v.redd.it/ohk3bj2dxvm91,844,1662733835.0,onesole,0.96,/r/ukraine/comments/x9x0ri/ukraine_counterattack_over_800_square_kilometers/,ukraine,860311,2
Toddler sees dad come home from the war to bring supplies.,21018,t5u9iy,https://v.redd.it/k9h652afu6l81,515,1646321809.0,-martinique-,0.97,/r/ukraine/comments/t5u9iy/toddler_sees_dad_come_home_from_the_war_to_bring/,ukraine,860311,2
"BREAKING: Ukrainian presidential advisor Aleksey Arestovich reported that Ukraine’s defense forces destroyed the Russian command post in the Kherson region, in which there were about 50 military officers.",20958,u9ujxo,https://twitter.com/joncoopertweets/status/1517681600925941762?s=20&t=u2MJ4SHmhtluwLZ-kc-UaQ,781,1650678914.0,51patsfan,0.97,/r/ukraine/comments/u9ujxo/breaking_ukrainian_presidential_advisor_aleksey/,ukraine,860311,2
"Yesterday, a Russian missile killed Oksana Leontieva in Kyiv. Oksana was on her way to work at the Okhmatdyt hospital. She was an oncologist, a specialist in bone marrow transplantation. She was saving children. Russia is a terrorist state.",20931,y13y64,https://www.reddit.com/gallery/y13y64,491,1665478462.0,HarakenQQ,0.96,/r/ukraine/comments/y13y64/yesterday_a_russian_missile_killed_oksana/,ukraine,860311,2
We've completed our Saint Javelin mural in Kyiv!,20915,uxgm2i,https://i.redd.it/4is0a538bm191.jpg,251,1653482859.0,christianandrewborys,0.96,/r/ukraine/comments/uxgm2i/weve_completed_our_saint_javelin_mural_in_kyiv/,ukraine,860311,2
"Khrystyna a Ukrainian biathlete changed her sports rifle. ""I have no fear of the enemy. I shoot skillfully, so the invaders will not have a chance""",20868,unrmhe,https://i.redd.it/rmzochxmryy81.jpg,651,1652326033.0,TotalSpaceNut,0.94,/r/ukraine/comments/unrmhe/khrystyna_a_ukrainian_biathlete_changed_her/,ukraine,860311,2
Slava Ukraini! ✊️🇺🇦🇺🇦,20734,v07dsd,https://i.redd.it/xzifxyq4td291.jpg,257,1653815525.0,Substantial-Ad-6808,0.9,/r/ukraine/comments/v07dsd/slava_ukraini/,ukraine,860311,2
BREAKING Russian High Command has issued a general retreat to all surviving Russian forces at the Western bank of the Dnipro River.,20542,yqm2kz,https://twitter.com/Tendar/status/1590363323627110401,1238,1668007650.0,RunTheBull13,0.97,/r/ukraine/comments/yqm2kz/breaking_russian_high_command_has_issued_a/,ukraine,860311,2
"President Zelenskyy: Today we have significant news for our state, for our defense. The United States has prepared a new support package for Ukraine worth $33 billion. In particular, more than 20 billion can be allocated for defense. More than $8 billion is planned for economic support.",20340,ue5lr6,https://v.redd.it/gy33ebgw6cw81,1065,1651180871.0,Local_Fox_2000,0.95,/r/ukraine/comments/ue5lr6/president_zelenskyy_today_we_have_significant/,ukraine,860311,2
President Zelensky: “Now the whole world knows for sure: Ukraine is a country of courage. Ukraine is a country of heroes. Happy National Flag Day of Ukraine! 🇺🇦🇺🇦🇺🇦”,20069,wv5v7s,https://v.redd.it/zkrbt7er2cj91,253,1661203971.0,TinyStrawberry23,0.94,/r/ukraine/comments/wv5v7s/president_zelensky_now_the_whole_world_knows_for/,ukraine,860311,2
"Ukrainian women who were raped by Russians and left to Poland cannot have abortions there. Under Polish law, abortion is allowed in case of rape, but there is no criminal case yet Psychologists in Poland are convincing her that a new life is wonderful. They destroys lives of both",19955,u2jksf,https://twitter.com/avalaina/status/1514115426560716801,1217,1649829731.0,rishcast,0.91,/r/ukraine/comments/u2jksf/ukrainian_women_who_were_raped_by_russians_and/,ukraine,860311,2
Irpin is liberated by Ukrainian Forces! - Mayor,19919,tq9pz8,https://v.redd.it/d1r0i4wxp4q81,329,1648475342.0,Overall_Memory6689,0.96,/r/ukraine/comments/tq9pz8/irpin_is_liberated_by_ukrainian_forces_mayor/,ukraine,860311,2
Restoration of destroyed buildings and facilities in Kyiv region proves how fast Ukraine works to get back on track 🇺🇦,19902,y5f26r,https://v.redd.it/v34zmmfqp5u91,626,1665921492.0,TinyStrawberry23,0.96,/r/ukraine/comments/y5f26r/restoration_of_destroyed_buildings_and_facilities/,ukraine,860311,2
Russians waiting in massive queues after McDonald's announced closure of all 850 restaurants in Russia,19807,t9r4ow,https://v.redd.it/qex8vws878m81,1804,1646774212.0,Sondioc2152,0.96,/r/ukraine/comments/t9r4ow/russians_waiting_in_massive_queues_after/,ukraine,860311,2
"Igor Volobuev, former vice president of Gazprom Bank in Russia, has joined the Freedom of Russia Legion to fight for the defence of Ukraine & to topple Putin's regime.",19787,va0fgy,https://v.redd.it/bmr1q6mok0591,379,1654962922.0,MicrowaveBurns,0.96,/r/ukraine/comments/va0fgy/igor_volobuev_former_vice_president_of_gazprom/,ukraine,860311,2
"Today, president of Ukraine Volodymyr Zelenskyy met prime minister of Finland Sanna Marin.",19765,uy5v4a,https://i.redd.it/p72r9h367t191.jpg,945,1653566000.0,onesole,0.96,/r/ukraine/comments/uy5v4a/today_president_of_ukraine_volodymyr_zelenskyy/,ukraine,860311,2
Breaking: two generals dead and one critical condition after Ukrainian forces destroyed the command center in Kherson.,19619,ua51f1,https://t.me/c/1233777422/26889,823,1650719151.0,onesole,0.96,/r/ukraine/comments/ua51f1/breaking_two_generals_dead_and_one_critical/,ukraine,860311,2
Iryna and Olga were dentists who provided free dental care to soldiers and former prisoners of war. They were killed in last night's missile attack on the Dnipro apartment building.,19598,10csrnx,https://i.redd.it/6f3rpp91e9ca1.png,288,1673811616.0,TinyStrawberry23,0.95,/r/ukraine/comments/10csrnx/iryna_and_olga_were_dentists_who_provided_free/,ukraine,860311,2
"We, Ukrainians, are not one people with russians",19597,xevs5p,https://v.redd.it/y9u29kado0o91,518,1663245508.0,ThaIgk,0.95,/r/ukraine/comments/xevs5p/we_ukrainians_are_not_one_people_with_russians/,ukraine,860311,2
Adam Kinzinger: There is a video where two Ukrainian soldiers are killed after being clearly confused about who was holding a gun on them. Russians are wearing Ukrainian uniforms for the attack. This is a war crime.,19580,109bumt,https://twitter.com/adamkinzinger/status/1613232775552962561?s=46&t=uealaOL8k21d4tIbxmwzaQ,162,1673461507.0,TheRealMykola,0.94,/r/ukraine/comments/109bumt/adam_kinzinger_there_is_a_video_where_two/,ukraine,860311,2
"Refrigerated Trains filled with Russia's dead Abandoned during Russian Retreats from Ukrainian regions. As Russia Celebrates its May 9th Victory day, its Soldiers remain forgotten on Foreign soil to which Ukraine will now deal with them with More respect and care than those given to Ukrainians by RU",19528,ulsd9i,https://v.redd.it/4si1hcs6mgy81,396,1652106126.0,ThewizardBlundermore,0.96,/r/ukraine/comments/ulsd9i/refrigerated_trains_filled_with_russias_dead/,ukraine,860311,2
Occupants surrendering. Brought a BMP-1 with them for cash reward.,19386,xwfnf5,https://v.redd.it/2f71bngkn0s91,1552,1664988332.0,CorsicA123,0.97,/r/ukraine/comments/xwfnf5/occupants_surrendering_brought_a_bmp1_with_them/,ukraine,860311,2
"In the Russian city of Tver northwest of Moscow, the main building of the 2nd Central Research Institute of the Russian Ministry of Defence caught fire, it focuses on the development of anti-aircraft and air & space defence weapons, navigation devices etc. The roof has since collapsed.",19362,u8nu5f,https://v.redd.it/8xqfzi41xvu81,963,1650548198.0,TheGuvnor247,0.97,/r/ukraine/comments/u8nu5f/in_the_russian_city_of_tver_northwest_of_moscow/,ukraine,860311,2
"Anonymous reports they hacked the Central Bank of Russia. Will be published in the next 48 hours with more than 35,000 files of the bank, including those with secret contracts.",19318,tlngth,https://twitter.com/nexta_tv/status/1506784229811757059?s=20&t=VbfyM0_2c8Jb-ks59KATYg,856,1648080667.0,TheRealMykola,0.97,/r/ukraine/comments/tlngth/anonymous_reports_they_hacked_the_central_bank_of/,ukraine,860311,2
To remember. Faces of those killed yesterday by the vile terrorist attack in Vinnytsia.,19316,vzyx0t,https://i.redd.it/xevofos9psb91.jpg,378,1657918463.0,migoodenuf,0.96,/r/ukraine/comments/vzyx0t/to_remember_faces_of_those_killed_yesterday_by/,ukraine,860311,2
"Zelensky: “Our military managed to replenish its arsenal... Enemy tanks, armored vehicles, ammo will now work for our defense. What could be more humiliating for the invaders? We’ll beat the enemy with its own weapons.”",19267,tank60,https://twitter.com/ChristopherJM/status/1501577368049176584?s=20&t=TZmUARIFJ7xOTYbnRXeLqg,662,1646877171.0,TheRealMykola,0.98,/r/ukraine/comments/tank60/zelensky_our_military_managed_to_replenish_its/,ukraine,860311,2
"An orc: Our main goal has been completed at A+, we got on only 3 x 300 (wounded)... boom",19262,uempck,https://v.redd.it/fvvlpx9c6hw81,1808,1651241211.0,ThaIgk,0.9,/r/ukraine/comments/uempck/an_orc_our_main_goal_has_been_completed_at_a_we/,ukraine,860311,2
Honor to the troops who gave their lives on snake island “Go fuck yourself”,19204,t0qe1a,https://v.redd.it/i3pd56kimvj81,560,1645750256.0,X2Gaming,0.99,/r/ukraine/comments/t0qe1a/honor_to_the_troops_who_gave_their_lives_on_snake/,ukraine,860311,2
"Poland has announced that it will stop issuing visas to Russian citizens. The Polish Ministry of Foreign Affairs also announced that it is joining Finland, Estonia, Latvia and Denmark in the effort to launch an EU-wide ban on issuing tourist visas for Russians.",19099,wo4wn7,https://twitter.com/visegrad24/status/1558778000954490880?t=R_wXVTEc3vdpTnhL4qQ1OA&s=19,568,1660478984.0,51patsfan,0.96,/r/ukraine/comments/wo4wn7/poland_has_announced_that_it_will_stop_issuing/,ukraine,860311,2
Exactly,19100,y0m6iv,https://i.redd.it/tx48orlru0t91.jpg,435,1665426582.0,FarmSuch5021,0.97,/r/ukraine/comments/y0m6iv/exactly/,ukraine,860311,2
The European Parliament has approved Ukraine's application to join the European Union. A special admission procedure has been launched. Voting will take place at 16:30,19053,t477vc,https://i.redd.it/u4chjo2wqrk81.png,1363,1646139025.0,Zhana-Aul,0.98,/r/ukraine/comments/t477vc/the_european_parliament_has_approved_ukraines/,ukraine,860311,2
Direct missile attack at a shopping mall in Krymenchuk. The video published by Zelensky,19050,vlwn9s,https://v.redd.it/johjceyva6891,725,1656339732.0,ThaIgk,0.96,/r/ukraine/comments/vlwn9s/direct_missile_attack_at_a_shopping_mall_in/,ukraine,860311,2
People were just crying after the liberation from the occupiers in Sviatohirsk,18948,xi3mpl,https://i.redd.it/5hpaosaj5ro91.jpg,415,1663567588.0,TotalSpaceNut,0.92,/r/ukraine/comments/xi3mpl/people_were_just_crying_after_the_liberation_from/,ukraine,860311,2
Poll: Majority of Americans say U.S. should back Ukraine until Russia withdraws,18909,wx05oo,https://www.axios.com/2022/08/24/american-support-ukraine-poll,850,1661389017.0,D-R-AZ,0.93,/r/ukraine/comments/wx05oo/poll_majority_of_americans_say_us_should_back/,ukraine,860311,2
"Ukrainian grandpas ""welcoming"" russian soldiers, i must admit everyone in this country has massive balls!",18863,t2thgl,https://v.redd.it/58eiutomxek81,677,1645983884.0,madwolli,0.98,/r/ukraine/comments/t2thgl/ukrainian_grandpas_welcoming_russian_soldiers_i/,ukraine,860311,2
"Parents of this 11 year old boy sent him alone from Ukraine to Slovakia due to the war. He had a phone number on his relatives written on his hand by pen, he made it safely. Eurolanche forces and volunteers came to his aide.",18823,t86j3z,https://v.redd.it/yzk6cc4cgtl81,823,1646595553.0,Sunnyflbunny,0.97,/r/ukraine/comments/t86j3z/parents_of_this_11_year_old_boy_sent_him_alone/,ukraine,860311,2
"R.I.P. Belarusian soldier in the Armed Forces of Ukraine Aliaksej Skoblia ""Tur"" died today near Kyiv. Tur was the group's deputy commander when his squad was ambushed. He perished, covering the retreat of his brothers.",18813,tdiiey,https://i.redd.it/co4v50rsa8n81.jpg,268,1647211106.0,PjeterPannos,0.97,/r/ukraine/comments/tdiiey/rip_belarusian_soldier_in_the_armed_forces_of/,ukraine,860311,2
A bakery in Kyiv,18751,z3el0o,https://i.redd.it/wlorj7i3iw1a1.jpg,168,1669278528.0,irishrugby2015,0.96,/r/ukraine/comments/z3el0o/a_bakery_in_kyiv/,ukraine,860311,2
Almost a year since Lukashenko said these famous words,18734,115amn9,https://v.redd.it/p2zrmgh88yia1,572,1676708856.0,SovietPikachu2,0.94,/r/ukraine/comments/115amn9/almost_a_year_since_lukashenko_said_these_famous/,ukraine,860311,2
"In Kharkiv, a large group of Russian soldiers surrendered. “We did not want to go to war against Ukraine, we were demoralized, but the command said that if we retreated, we could be shot for not following the order”",18729,t2n25n,https://v.redd.it/lukbxebebdk81,807,1645964312.0,Dredd005,0.99,/r/ukraine/comments/t2n25n/in_kharkiv_a_large_group_of_russian_soldiers/,ukraine,860311,2
