title,score,id,url,num_comments,created,author,upvote_ratio,permalink,subreddit,subreddit_subscribers,depth
"Dear Nintendo, I don’t hate motion controls, but I always want the option to not use them.",20992,9x23ck,https://www.reddit.com/r/NintendoSwitch/comments/9x23ck/dear_nintendo_i_dont_hate_motion_controls_but_i/,1334,1542216163.0,Dacvak,0.91,/r/NintendoSwitch/comments/9x23ck/dear_nintendo_i_dont_hate_motion_controls_but_i/,NintendoSwitch,4498701,2
Pokémon Company will now start to permanently ban players who disconnect from online matches in Sword and Shield.,20935,fxq84l,https://www.pokemon-support.com/news/s/article/000002193,1225,1586428861.0,Frocharocha,0.9,/r/NintendoSwitch/comments/fxq84l/pokémon_company_will_now_start_to_permanently_ban/,NintendoSwitch,4498701,2
A little Stardew Valley Multiplayer fanart (OC),20769,ahojjf,https://i.imgur.com/2KEWjXX.jpg,270,1547921690.0,Throwy_away_1,0.94,/r/NintendoSwitch/comments/ahojjf/a_little_stardew_valley_multiplayer_fanart_oc/,NintendoSwitch,4498701,2
Scott Pilgrim vs. The World: The Game Complete Edition Trailer,20762,iqacgg,https://www.youtube.com/watch?v=wUU_wRjdi2I,993,1599766029.0,Ganrokh,0.92,/r/NintendoSwitch/comments/iqacgg/scott_pilgrim_vs_the_world_the_game_complete/,NintendoSwitch,4498701,2
BOTW sequel was initially planned as a DLC but the ideas were too many and they wanted to add bigger changes.,20749,c27sgu,https://kotaku.com/breath-of-the-wild-is-getting-a-sequel-because-the-team-1835624233,1230,1560891535.0,TheFearlessWarrior,0.96,/r/NintendoSwitch/comments/c27sgu/botw_sequel_was_initially_planned_as_a_dlc_but/,NintendoSwitch,4498701,2
The Legend of Zelda: Tears of the Kingdom – Official Trailer #2,20683,10xddig,https://www.youtube.com/watch?v=fYZuiFDQwQw,3318,1675896307.0,Turbostrider27,0.93,/r/NintendoSwitch/comments/10xddig/the_legend_of_zelda_tears_of_the_kingdom_official/,NintendoSwitch,4498701,2
Thank you from Nintendo for making Super Mario Odyssey the fastest selling Mario title ever.,20679,7abcsn,https://twitter.com/NintendoAmerica/status/926071430294507522,1376,1509627957.0,Porkpants81,0.88,/r/NintendoSwitch/comments/7abcsn/thank_you_from_nintendo_for_making_super_mario/,NintendoSwitch,4498701,2
A little Breath of the Wild fanart. (OC),20518,9829zr,https://i.imgur.com/qCNzw6F.jpg,324,1534512660.0,Throwy_away_1,0.91,/r/NintendoSwitch/comments/9829zr/a_little_breath_of_the_wild_fanart_oc/,NintendoSwitch,4498701,2
All profiles on a single switch system will share the same island In Animal Crossing New Horizons,20237,c0xiik,https://www.ign.com/articles/2019/06/12/nintendo-confirms-new-details-about-multiplayer-in-animal-crossing-new-horizons-e3-2019,1415,1560606802.0,TheFearlessWarrior,0.95,/r/NintendoSwitch/comments/c0xiik/all_profiles_on_a_single_switch_system_will_share/,NintendoSwitch,4498701,2
Modders are already adding cut Pokémon in Sword and Shield with surprising ease,20156,dy1g6f,https://www.twitter.com/SciresM/status/1196342543425781760?ref_src=twsrc%5Etfw%7Ctwcamp%5Etweetembed%7Ctwterm%5E1196342543425781760&ref_url=https%3A%2F%2Fs9e.github.io%2Fiframe%2F2%2Ftwitter.min.html%231196342543425781760,2083,1574072789.0,TheFearlessWarrior,0.77,/r/NintendoSwitch/comments/dy1g6f/modders_are_already_adding_cut_pokémon_in_sword/,NintendoSwitch,4498701,2
"Aonuma to IGN: New Zelda will be “a little bit darker” than Majora’s Mask, and is not connected to it.",19937,bzl0fu,https://m.ign.com/articles/2019/06/11/zelda-breath-of-the-wild-sequel-is-not-related-to-majoras-mask?sf103907097=1,1274,1560303123.0,Frocharocha,0.96,/r/NintendoSwitch/comments/bzl0fu/aonuma_to_ign_new_zelda_will_be_a_little_bit/,NintendoSwitch,4498701,2
Nintendo’s profits soar by 500% thanks to massive success of Switch console.,19921,8f43vh,https://www.geekwire.com/2018/nintendos-profits-soar-500-thanks-massive-success-switch-console/,877,1524760978.0,AdamCannon,0.94,/r/NintendoSwitch/comments/8f43vh/nintendos_profits_soar_by_500_thanks_to_massive/,NintendoSwitch,4498701,2
Stealth has “multiple sources” that say Windwaker HD and Twilight Princess HD will be coming to the Switch.,19764,b8xink,https://twitter.com/stealth40k/status/1113415908289122304?s=21,1888,1554295704.0,Porkpants81,0.85,/r/NintendoSwitch/comments/b8xink/stealth_has_multiple_sources_that_say_windwaker/,NintendoSwitch,4498701,2
Super Mario 3D All Stars (Digital) is no longer available on the Nintendo eShop,19748,mhpr0j,https://www.nintendo.com/games/detail/switch/s/super-mario-3d-all-stars-switch/,2786,1617260615.0,K-LAWN,0.94,/r/NintendoSwitch/comments/mhpr0j/super_mario_3d_all_stars_digital_is_no_longer/,NintendoSwitch,4498701,2
Stardew Valley has sold over 10 million copies across platforms it’s on,19621,esx61y,https://twitter.com/concernedape/status/1220407295667920896?s=21,619,1579804115.0,Amiibofan101,0.94,/r/NintendoSwitch/comments/esx61y/stardew_valley_has_sold_over_10_million_copies/,NintendoSwitch,4498701,2
Nintendo Switch Joy-Con Class Action Lawsuit Claims Joy-Cons are 'Defective',19578,daj2ux,https://www.ign.com/articles/2019/09/27/nintendo-switch-joy-con-drift-leads-to-class-action-lawsuit,1915,1569692005.0,Frocharocha,0.95,/r/NintendoSwitch/comments/daj2ux/nintendo_switch_joycon_class_action_lawsuit/,NintendoSwitch,4498701,2
Pokémon Sword&Shield releasing November 15 worldwide,19261,bx2hc5,https://twitter.com/Nibellion/status/1136260494979981312,1488,1559740840.0,Frocharocha,0.94,/r/NintendoSwitch/comments/bx2hc5/pokémon_swordshield_releasing_november_15/,NintendoSwitch,4498701,2
Kirby and the Forgotten Land - Announcement Trailer - Nintendo Switch,18845,pu60fn,https://www.youtube.com/watch?v=H3LAkr0ANgw,1215,1632435164.0,MarvelsGrantMan136,0.95,/r/NintendoSwitch/comments/pu60fn/kirby_and_the_forgotten_land_announcement_trailer/,NintendoSwitch,4498701,2
"Zelda: Breat The Wild is currently the second best game of the decade according to Metacritic, losing the title only to Super Mario Galaxy 2",18759,e6zggk,https://www.metacritic.com/feature/best-videogames-of-the-decade-2010s,1964,1575642586.0,Frocharocha,0.86,/r/NintendoSwitch/comments/e6zggk/zelda_breat_the_wild_is_currently_the_second_best/,NintendoSwitch,4498701,2
[Official] Nintendo Direct planned for 13th February at 2PM PT / 5PM ET,18711,aptlji,https://www.nintendo.com/nintendo-direct/02-13-2019/,3076,1549979973.0,callmeahri,0.92,/r/NintendoSwitch/comments/aptlji/official_nintendo_direct_planned_for_13th/,NintendoSwitch,4498701,2
GameStop Cancels Midnight Release Events For Animal Crossing And Doom,18625,fk8fbw,https://kotaku.com/gamestop-cancels-midnight-release-events-for-animal-cro-1842379133?utm_medium=Socialflow&utm_source=Kotaku_Twitter&utm_campaign=Socialflow_Kotaku_Twitter,985,1584463379.0,Frocharocha,0.97,/r/NintendoSwitch/comments/fk8fbw/gamestop_cancels_midnight_release_events_for/,NintendoSwitch,4498701,2
Nintendo resets Nintendo Switch Online free trials for people who already used them,18570,ga8y4l,https://twitter.com/NintendoEurope/status/1255436701868138496,841,1588165045.0,Frocharocha,0.97,/r/NintendoSwitch/comments/ga8y4l/nintendo_resets_nintendo_switch_online_free/,NintendoSwitch,4498701,2
Banjo Ka-HONK,18546,dapdk1,https://i.redd.it/j5btbc741gp31.jpg,181,1569723751.0,N00DLEB0Y,0.95,/r/NintendoSwitch/comments/dapdk1/banjo_kahonk/,NintendoSwitch,4498701,2
Pokemon Violet is now the lowest rated main Pokemon game on Metacritic,18480,ze5qk3,https://www.metacritic.com/game/switch/pokemon-violet,2515,1670330510.0,Turbostrider27,0.9,/r/NintendoSwitch/comments/ze5qk3/pokemon_violet_is_now_the_lowest_rated_main/,NintendoSwitch,4498701,2
Animated a tribute to Luigi's Mansion 3,18181,e7cbml,https://v.redd.it/sm5ksjh1e6341,137,1575710499.0,a3headedcat,0.96,/r/NintendoSwitch/comments/e7cbml/animated_a_tribute_to_luigis_mansion_3/,NintendoSwitch,4498701,2
Made some Retro Game trays,18153,gtwrm0,https://i.redd.it/xwmbcen8v2251.jpg,165,1590920939.0,nilsk89,0.97,/r/NintendoSwitch/comments/gtwrm0/made_some_retro_game_trays/,NintendoSwitch,4498701,2
Breath of the Wild fan pulls 100% no-damage run after months of trying,18107,lca1ox,https://www.polygon.com/2021/2/3/22264390/botw-breath-of-the-wild-zelda-nintendo-switch-speedrun-100-percent-damageless-joedun,463,1612422283.0,Ganrokh,0.97,/r/NintendoSwitch/comments/lca1ox/breath_of_the_wild_fan_pulls_100_nodamage_run/,NintendoSwitch,4498701,2
"A Pokémon Presents has been announced for tomorrow, February 26th",18050,ls62cp,https://twitter.com/Pokemon_cojp/status/1364923236820090883,1633,1614258069.0,harushiga,0.93,/r/NintendoSwitch/comments/ls62cp/a_pokémon_presents_has_been_announced_for/,NintendoSwitch,4498701,2
"Paid DLC is coming to #MarioKart 8 Deluxe with 48 remastered courses from across the Mario Kart series! The first wave of the Mario Kart 8 Deluxe – Booster Course Pass, containing eight courses, arrives on 18/03.",18035,soq2gg,https://twitter.com/NintendoEurope/status/1491542090953674754,2628,1644446337.0,Turbostrider27,0.92,/r/NintendoSwitch/comments/soq2gg/paid_dlc_is_coming_to_mariokart_8_deluxe_with_48/,NintendoSwitch,4498701,2
"Super Mario Party update coming today, adds online and new modes",17981,mzizsb,https://topics.nintendo.co.jp/article/39ce2e59-b887-4ea3-a0fe-2fbe3b4c60ab?utm_source=twitter&utm_medium=social&utm_content=20210427&utm_campaign=topics,1465,1619508625.0,Amiibofan101,0.94,/r/NintendoSwitch/comments/mzizsb/super_mario_party_update_coming_today_adds_online/,NintendoSwitch,4498701,2
Pokemon Scarlet and Violet announced. Coming later this year.,17968,t2p59l,https://www.youtube.com/watch?v=BedVUFpZSF4,2184,1645971431.0,Turbostrider27,0.9,/r/NintendoSwitch/comments/t2p59l/pokemon_scarlet_and_violet_announced_coming_later/,NintendoSwitch,4498701,2
"Official Artwork for Gigantamax Pikachu, Buterfree, Charizard and Eevee",17717,dip5ti,https://s3.gifyu.com/images/49536743a254a6e45.jpg,1133,1571231673.0,Frocharocha,0.92,/r/NintendoSwitch/comments/dip5ti/official_artwork_for_gigantamax_pikachu_buterfree/,NintendoSwitch,4498701,2
"Like many, I didn't dig the Kirby demo... until I played it for 7 hours in a car with a 6 year old!",17652,861ti6,https://imgur.com/kA11znC,493,1521636724.0,Warlach,0.89,/r/NintendoSwitch/comments/861ti6/like_many_i_didnt_dig_the_kirby_demo_until_i/,NintendoSwitch,4498701,2
Unreal Engine 5 will support the Nintendo Switch.,17643,gk2jac,https://www.eurogamer.net/articles/digitalfoundry-2020-this-is-next-gen-unreal-engine-running-on-playstation-5,910,1589517456.0,TheFearlessWarrior,0.95,/r/NintendoSwitch/comments/gk2jac/unreal_engine_5_will_support_the_nintendo_switch/,NintendoSwitch,4498701,2
A little Final Fantasy VII fanart (OC),17609,ba65s0,https://i.imgur.com/0HHfQgr.jpg,185,1554568704.0,Throwy_away_1,0.94,/r/NintendoSwitch/comments/ba65s0/a_little_final_fantasy_vii_fanart_oc/,NintendoSwitch,4498701,2
"Nintendo: In light of recent world events, we have made the decision to delay Advance Wars 1+2: Re-Boot Camp",17568,ta8g74,https://twitter.com/NintendoAmerica/status/1501559021848965120,1943,1646834585.0,Turbostrider27,0.91,/r/NintendoSwitch/comments/ta8g74/nintendo_in_light_of_recent_world_events_we_have/,NintendoSwitch,4498701,2
Unknown K.K. - Album Art (OC),17553,g3h6du,https://i.redd.it/pciisl5v2it41.jpg,195,1587182474.0,N00DLEB0Y,0.96,/r/NintendoSwitch/comments/g3h6du/unknown_kk_album_art_oc/,NintendoSwitch,4498701,2
My 4 year old daughter proud of her first place in Mario Kart as princess Daisy (steering assistance is awesome!),17434,6pkm2a,https://imgur.com/CPL2TDo,605,1501030364.0,tjbassoon,0.8,/r/NintendoSwitch/comments/6pkm2a/my_4_year_old_daughter_proud_of_her_first_place/,NintendoSwitch,4498701,2
"Activision Blizzard Sued Over ‘Frat Boy’ Culture, Harassment - Bloomberg Law",17412,ope8no,https://news.bloomberglaw.com/daily-labor-report/activision-blizzard-sued-by-california-over-frat-boy-culture,1213,1626961912.0,schuey_08,0.93,/r/NintendoSwitch/comments/ope8no/activision_blizzard_sued_over_frat_boy_culture/,NintendoSwitch,4498701,2
New Pokémon Snap arrives on April 30!,17378,kx595z,https://www.youtube.com/watch?v=Mq8Kn6mhUxA,1334,1610629502.0,harushiga,0.93,/r/NintendoSwitch/comments/kx595z/new_pokémon_snap_arrives_on_april_30/,NintendoSwitch,4498701,2
"Nintendo and Microsoft team up to promote cross-play, while Sony remains silent.",17326,8st5i1,https://www.theverge.com/2018/6/21/17488530/nintendo-switch-microsoft-xbox-minecraft-cross-play-marketing-sony,1396,1529597552.0,AdamCannon,0.94,/r/NintendoSwitch/comments/8st5i1/nintendo_and_microsoft_team_up_to_promote/,NintendoSwitch,4498701,2
"E3 2021 will take place June 12-15th this year as a free, “reimagined, all-virtual” event",17158,mlb5o7,https://www.theverge.com/2021/4/6/22368617/e3-2021-virtual-event-digital-microsoft-nintendo,810,1617714210.0,dorkmax_executives,0.95,/r/NintendoSwitch/comments/mlb5o7/e3_2021_will_take_place_june_1215th_this_year_as/,NintendoSwitch,4498701,2
"New Horizons, starting with the free April update landing on your island 4/23! Check out new seasonal events like Nature Day",17095,g5esf1,https://twitter.com/animalcrossing/status/1252582860361531393,1116,1587474070.0,Frocharocha,0.94,/r/NintendoSwitch/comments/g5esf1/new_horizons_starting_with_the_free_april_update/,NintendoSwitch,4498701,2
"Half of all Nintendo Switch owners bought Zelda: Breath of the Wild, Mario Kart 8, and Super Mario Odyssey.",17086,a5yogn,https://www.ign.com/articles/2018/12/13/half-of-all-nintendo-switch-owners-bought-zelda-breath-of-the-wild-mario-kart-8-and-super-mario-odyssey,1625,1544741485.0,AdamCannon,0.95,/r/NintendoSwitch/comments/a5yogn/half_of_all_nintendo_switch_owners_bought_zelda/,NintendoSwitch,4498701,2
User recreated Pokémon Gold and Silver in Animal Crossing.,17004,g14ra0,https://twitter.com/hinopika/status/1250020869352484866,575,1586867865.0,Frocharocha,0.95,/r/NintendoSwitch/comments/g14ra0/user_recreated_pokémon_gold_and_silver_in_animal/,NintendoSwitch,4498701,2
Use the code “P1KAADVANCE” to get Pikachu with Ash’s cap in Pokémon Sword & Shield,16990,j3s6zf,https://twitter.com/playpokemon/status/1311975327791566848?s=21,403,1601634900.0,maanwel,0.95,/r/NintendoSwitch/comments/j3s6zf/use_the_code_p1kaadvance_to_get_pikachu_with_ashs/,NintendoSwitch,4498701,2
